timestamp	program_hash	spirv_size	word_count	fitness	status	description
2026-03-14T07:36:45.726505	cf3e2d35	0	0	0.0000	CRASH	gen=826 glyphs=3
2026-03-14T07:36:45.726702	099964a4	0	0	0.0000	CRASH	gen=826 glyphs=4
2026-03-14T07:36:45.726986	099964a4	0	0	0.0000	CRASH	gen=827 glyphs=4
2026-03-14T07:36:45.727180	099964a4	0	0	0.0000	CRASH	gen=827 glyphs=4
2026-03-14T07:36:45.727375	099964a4	0	0	0.0000	CRASH	gen=827 glyphs=4
2026-03-14T07:36:45.727569	099964a4	0	0	0.0000	CRASH	gen=827 glyphs=4
2026-03-14T07:36:45.727761	cf93b656	0	0	0.0000	CRASH	gen=827 glyphs=3
2026-03-14T07:36:45.727957	099964a4	0	0	0.0000	CRASH	gen=827 glyphs=4
2026-03-14T07:36:45.728150	3390fd3a	0	0	0.0000	CRASH	gen=827 glyphs=4
2026-03-14T07:36:45.728343	8da1f8d8	0	0	0.0000	CRASH	gen=827 glyphs=4
2026-03-14T07:36:45.728543	7ede4765	0	0	0.0000	CRASH	gen=827 glyphs=2
2026-03-14T07:36:45.728734	099964a4	0	0	0.0000	CRASH	gen=827 glyphs=4
2026-03-14T07:36:45.729021	099964a4	0	0	0.0000	CRASH	gen=828 glyphs=4
2026-03-14T07:36:45.729215	099964a4	0	0	0.0000	CRASH	gen=828 glyphs=4
2026-03-14T07:36:45.729409	099964a4	0	0	0.0000	CRASH	gen=828 glyphs=4
2026-03-14T07:36:45.729605	099964a4	0	0	0.0000	CRASH	gen=828 glyphs=4
2026-03-14T07:36:45.729799	81aca74b	0	0	0.0000	CRASH	gen=828 glyphs=3
2026-03-14T07:36:45.729993	099964a4	0	0	0.0000	CRASH	gen=828 glyphs=4
2026-03-14T07:36:45.730193	53091e61	0	0	0.0000	CRASH	gen=828 glyphs=2
2026-03-14T07:36:45.730385	099964a4	0	0	0.0000	CRASH	gen=828 glyphs=4
2026-03-14T07:36:45.730579	3a734398	0	0	0.0000	CRASH	gen=828 glyphs=4
2026-03-14T07:36:45.730775	cf93b656	0	0	0.0000	CRASH	gen=828 glyphs=3
2026-03-14T07:36:45.731048	099964a4	0	0	0.0000	CRASH	gen=829 glyphs=4
2026-03-14T07:36:45.731248	099964a4	0	0	0.0000	CRASH	gen=829 glyphs=4
2026-03-14T07:36:45.731441	31fe51b8	0	0	0.0000	CRASH	gen=829 glyphs=4
2026-03-14T07:36:45.731637	7ede4765	0	0	0.0000	CRASH	gen=829 glyphs=2
2026-03-14T07:36:45.731829	1e957477	0	0	0.0000	CRASH	gen=829 glyphs=4
2026-03-14T07:36:45.732021	099964a4	0	0	0.0000	CRASH	gen=829 glyphs=4
2026-03-14T07:36:45.732218	099964a4	0	0	0.0000	CRASH	gen=829 glyphs=4
2026-03-14T07:36:45.732410	8062d9d2	0	0	0.0000	CRASH	gen=829 glyphs=4
2026-03-14T07:36:45.732612	bc631370	0	0	0.0000	CRASH	gen=829 glyphs=4
2026-03-14T07:36:45.732807	80cef82b	0	0	0.0000	CRASH	gen=829 glyphs=4
2026-03-14T07:36:45.733079	099964a4	0	0	0.0000	CRASH	gen=830 glyphs=4
2026-03-14T07:36:45.733277	099964a4	0	0	0.0000	CRASH	gen=830 glyphs=4
2026-03-14T07:36:45.733467	099964a4	0	0	0.0000	CRASH	gen=830 glyphs=4
2026-03-14T07:36:45.733659	9be1d6d2	0	0	0.0000	CRASH	gen=830 glyphs=3
2026-03-14T07:36:45.733850	099964a4	0	0	0.0000	CRASH	gen=830 glyphs=4
2026-03-14T07:36:45.734039	ff30496a	0	0	0.0000	CRASH	gen=830 glyphs=3
2026-03-14T07:36:45.734230	751593a2	0	0	0.0000	CRASH	gen=830 glyphs=3
2026-03-14T07:36:45.734425	7ede4765	0	0	0.0000	CRASH	gen=830 glyphs=2
2026-03-14T07:36:45.734623	41eebd9c	0	0	0.0000	CRASH	gen=830 glyphs=4
2026-03-14T07:36:45.734818	099964a4	0	0	0.0000	CRASH	gen=830 glyphs=4
2026-03-14T07:36:45.735095	099964a4	0	0	0.0000	CRASH	gen=831 glyphs=4
2026-03-14T07:36:45.735288	099964a4	0	0	0.0000	CRASH	gen=831 glyphs=4
2026-03-14T07:36:45.735487	c08d5140	0	0	0.0000	CRASH	gen=831 glyphs=4
2026-03-14T07:36:45.735684	099964a4	0	0	0.0000	CRASH	gen=831 glyphs=4
2026-03-14T07:36:45.735877	099964a4	0	0	0.0000	CRASH	gen=831 glyphs=4
2026-03-14T07:36:45.736069	3ca14993	0	0	0.0000	CRASH	gen=831 glyphs=4
2026-03-14T07:36:45.736261	099964a4	0	0	0.0000	CRASH	gen=831 glyphs=4
2026-03-14T07:36:45.736459	8da1f8d8	0	0	0.0000	CRASH	gen=831 glyphs=4
2026-03-14T07:36:45.736657	8715279a	0	0	0.0000	CRASH	gen=831 glyphs=4
2026-03-14T07:36:45.736853	099964a4	0	0	0.0000	CRASH	gen=831 glyphs=4
2026-03-14T07:36:45.737122	099964a4	0	0	0.0000	CRASH	gen=832 glyphs=4
2026-03-14T07:36:45.737313	099964a4	0	0	0.0000	CRASH	gen=832 glyphs=4
2026-03-14T07:36:45.737510	8da1f8d8	0	0	0.0000	CRASH	gen=832 glyphs=4
2026-03-14T07:36:45.737709	ff30496a	0	0	0.0000	CRASH	gen=832 glyphs=3
2026-03-14T07:36:45.737901	099964a4	0	0	0.0000	CRASH	gen=832 glyphs=4
2026-03-14T07:36:45.738091	dffcc1c3	0	0	0.0000	CRASH	gen=832 glyphs=2
2026-03-14T07:36:45.738286	e787208a	0	0	0.0000	CRASH	gen=832 glyphs=3
2026-03-14T07:36:45.738481	3a734398	0	0	0.0000	CRASH	gen=832 glyphs=4
2026-03-14T07:36:45.738682	099964a4	0	0	0.0000	CRASH	gen=832 glyphs=4
2026-03-14T07:36:45.738873	099964a4	0	0	0.0000	CRASH	gen=832 glyphs=4
2026-03-14T07:36:45.739138	099964a4	0	0	0.0000	CRASH	gen=833 glyphs=4
2026-03-14T07:36:45.739332	099964a4	0	0	0.0000	CRASH	gen=833 glyphs=4
2026-03-14T07:36:45.739532	ff30496a	0	0	0.0000	CRASH	gen=833 glyphs=3
2026-03-14T07:36:45.739729	dcb1fb50	0	0	0.0000	CRASH	gen=833 glyphs=4
2026-03-14T07:36:45.739922	80cef82b	0	0	0.0000	CRASH	gen=833 glyphs=4
2026-03-14T07:36:45.740116	099964a4	0	0	0.0000	CRASH	gen=833 glyphs=4
2026-03-14T07:36:45.740309	8da1f8d8	0	0	0.0000	CRASH	gen=833 glyphs=4
2026-03-14T07:36:45.740503	099964a4	0	0	0.0000	CRASH	gen=833 glyphs=4
2026-03-14T07:36:45.740707	099964a4	0	0	0.0000	CRASH	gen=833 glyphs=4
2026-03-14T07:36:45.740897	099964a4	0	0	0.0000	CRASH	gen=833 glyphs=4
2026-03-14T07:36:45.741167	099964a4	0	0	0.0000	CRASH	gen=834 glyphs=4
2026-03-14T07:36:45.741362	099964a4	0	0	0.0000	CRASH	gen=834 glyphs=4
2026-03-14T07:36:45.741560	099964a4	0	0	0.0000	CRASH	gen=834 glyphs=4
2026-03-14T07:36:45.741758	099964a4	0	0	0.0000	CRASH	gen=834 glyphs=4
2026-03-14T07:36:45.741954	099964a4	0	0	0.0000	CRASH	gen=834 glyphs=4
2026-03-14T07:36:45.742145	b8f7d62e	0	0	0.0000	CRASH	gen=834 glyphs=5
2026-03-14T07:36:45.742340	6ec45214	0	0	0.0000	CRASH	gen=834 glyphs=4
2026-03-14T07:36:45.742537	099964a4	0	0	0.0000	CRASH	gen=834 glyphs=4
2026-03-14T07:36:45.742729	dcb1fb50	0	0	0.0000	CRASH	gen=834 glyphs=4
2026-03-14T07:36:45.742927	099964a4	0	0	0.0000	CRASH	gen=834 glyphs=4
2026-03-14T07:36:45.743205	099964a4	0	0	0.0000	CRASH	gen=835 glyphs=4
2026-03-14T07:36:45.743399	099964a4	0	0	0.0000	CRASH	gen=835 glyphs=4
2026-03-14T07:36:45.743596	099964a4	0	0	0.0000	CRASH	gen=835 glyphs=4
2026-03-14T07:36:45.743787	8d6ddc97	0	0	0.0000	CRASH	gen=835 glyphs=3
2026-03-14T07:36:45.743985	099964a4	0	0	0.0000	CRASH	gen=835 glyphs=4
2026-03-14T07:36:45.744175	58bd4182	0	0	0.0000	CRASH	gen=835 glyphs=4
2026-03-14T07:36:45.744372	099964a4	0	0	0.0000	CRASH	gen=835 glyphs=4
2026-03-14T07:36:45.744569	80cef82b	0	0	0.0000	CRASH	gen=835 glyphs=4
2026-03-14T07:36:45.744766	099964a4	0	0	0.0000	CRASH	gen=835 glyphs=4
2026-03-14T07:36:45.744963	099964a4	0	0	0.0000	CRASH	gen=835 glyphs=4
2026-03-14T07:36:45.745249	099964a4	0	0	0.0000	CRASH	gen=836 glyphs=4
2026-03-14T07:36:45.745445	099964a4	0	0	0.0000	CRASH	gen=836 glyphs=4
2026-03-14T07:36:45.745642	ff30496a	0	0	0.0000	CRASH	gen=836 glyphs=3
2026-03-14T07:36:45.745835	621d6850	0	0	0.0000	CRASH	gen=836 glyphs=4
2026-03-14T07:36:45.746034	a401dc3f	0	0	0.0000	CRASH	gen=836 glyphs=3
2026-03-14T07:36:45.746228	099964a4	0	0	0.0000	CRASH	gen=836 glyphs=4
2026-03-14T07:36:45.746420	1c65cfe8	0	0	0.0000	CRASH	gen=836 glyphs=4
2026-03-14T07:36:45.746618	099964a4	0	0	0.0000	CRASH	gen=836 glyphs=4
2026-03-14T07:36:45.746814	099964a4	0	0	0.0000	CRASH	gen=836 glyphs=4
2026-03-14T07:36:45.747010	099964a4	0	0	0.0000	CRASH	gen=836 glyphs=4
2026-03-14T07:36:45.747293	099964a4	0	0	0.0000	CRASH	gen=837 glyphs=4
2026-03-14T07:36:45.747490	099964a4	0	0	0.0000	CRASH	gen=837 glyphs=4
2026-03-14T07:36:45.747687	099964a4	0	0	0.0000	CRASH	gen=837 glyphs=4
2026-03-14T07:36:45.747884	b643b070	0	0	0.0000	CRASH	gen=837 glyphs=4
2026-03-14T07:36:45.748078	201516f4	0	0	0.0000	CRASH	gen=837 glyphs=4
2026-03-14T07:36:45.748281	7d9357d2	0	0	0.0000	CRASH	gen=837 glyphs=4
2026-03-14T07:36:45.748475	099964a4	0	0	0.0000	CRASH	gen=837 glyphs=4
2026-03-14T07:36:45.748673	099964a4	0	0	0.0000	CRASH	gen=837 glyphs=4
2026-03-14T07:36:45.748864	e9b4be0b	0	0	0.0000	CRASH	gen=837 glyphs=3
2026-03-14T07:36:45.749053	0a0ad1ba	0	0	0.0000	CRASH	gen=837 glyphs=3
2026-03-14T07:36:45.749332	099964a4	0	0	0.0000	CRASH	gen=838 glyphs=4
2026-03-14T07:36:45.749531	099964a4	0	0	0.0000	CRASH	gen=838 glyphs=4
2026-03-14T07:36:45.749725	cf93b656	0	0	0.0000	CRASH	gen=838 glyphs=3
2026-03-14T07:36:45.749920	099964a4	0	0	0.0000	CRASH	gen=838 glyphs=4
2026-03-14T07:36:45.750114	099964a4	0	0	0.0000	CRASH	gen=838 glyphs=4
2026-03-14T07:36:45.750307	8da1f8d8	0	0	0.0000	CRASH	gen=838 glyphs=4
2026-03-14T07:36:45.750504	099964a4	0	0	0.0000	CRASH	gen=838 glyphs=4
2026-03-14T07:36:45.750700	1bcf4dfc	0	0	0.0000	CRASH	gen=838 glyphs=4
2026-03-14T07:36:45.750895	099964a4	0	0	0.0000	CRASH	gen=838 glyphs=4
2026-03-14T07:36:45.751088	7ede4765	0	0	0.0000	CRASH	gen=838 glyphs=2
2026-03-14T07:36:45.751359	099964a4	0	0	0.0000	CRASH	gen=839 glyphs=4
2026-03-14T07:36:45.751559	099964a4	0	0	0.0000	CRASH	gen=839 glyphs=4
2026-03-14T07:36:45.751752	099964a4	0	0	0.0000	CRASH	gen=839 glyphs=4
2026-03-14T07:36:45.751943	ff30496a	0	0	0.0000	CRASH	gen=839 glyphs=3
2026-03-14T07:36:45.752135	3ca14993	0	0	0.0000	CRASH	gen=839 glyphs=4
2026-03-14T07:36:45.752327	099964a4	0	0	0.0000	CRASH	gen=839 glyphs=4
2026-03-14T07:36:45.752526	099964a4	0	0	0.0000	CRASH	gen=839 glyphs=4
2026-03-14T07:36:45.752717	8a770538	0	0	0.0000	CRASH	gen=839 glyphs=3
2026-03-14T07:36:45.752914	099964a4	0	0	0.0000	CRASH	gen=839 glyphs=4
2026-03-14T07:36:45.753108	099964a4	0	0	0.0000	CRASH	gen=839 glyphs=4
2026-03-14T07:36:45.753380	099964a4	0	0	0.0000	CRASH	gen=840 glyphs=4
2026-03-14T07:36:45.753585	099964a4	0	0	0.0000	CRASH	gen=840 glyphs=4
2026-03-14T07:36:45.753778	135a3ef5	0	0	0.0000	CRASH	gen=840 glyphs=4
2026-03-14T07:36:45.753973	099964a4	0	0	0.0000	CRASH	gen=840 glyphs=4
2026-03-14T07:36:45.754163	099964a4	0	0	0.0000	CRASH	gen=840 glyphs=4
2026-03-14T07:36:45.754356	099964a4	0	0	0.0000	CRASH	gen=840 glyphs=4
2026-03-14T07:36:45.754568	32db9189	0	0	0.0000	CRASH	gen=840 glyphs=5
2026-03-14T07:36:45.754768	7ede4765	0	0	0.0000	CRASH	gen=840 glyphs=2
2026-03-14T07:36:45.754960	099964a4	0	0	0.0000	CRASH	gen=840 glyphs=4
2026-03-14T07:36:45.755153	80cef82b	0	0	0.0000	CRASH	gen=840 glyphs=4
2026-03-14T07:36:45.755443	099964a4	0	0	0.0000	CRASH	gen=841 glyphs=4
2026-03-14T07:36:45.755640	099964a4	0	0	0.0000	CRASH	gen=841 glyphs=4
2026-03-14T07:36:45.755836	099964a4	0	0	0.0000	CRASH	gen=841 glyphs=4
2026-03-14T07:36:45.756025	5993dda1	0	0	0.0000	CRASH	gen=841 glyphs=4
2026-03-14T07:36:45.756217	dcb1fb50	0	0	0.0000	CRASH	gen=841 glyphs=4
2026-03-14T07:36:45.756409	099964a4	0	0	0.0000	CRASH	gen=841 glyphs=4
2026-03-14T07:36:45.756601	80cef82b	0	0	0.0000	CRASH	gen=841 glyphs=4
2026-03-14T07:36:45.756801	8da1f8d8	0	0	0.0000	CRASH	gen=841 glyphs=4
2026-03-14T07:36:45.756994	ff30496a	0	0	0.0000	CRASH	gen=841 glyphs=3
2026-03-14T07:36:45.757184	80cef82b	0	0	0.0000	CRASH	gen=841 glyphs=4
2026-03-14T07:36:45.757457	099964a4	0	0	0.0000	CRASH	gen=842 glyphs=4
2026-03-14T07:36:45.757653	099964a4	0	0	0.0000	CRASH	gen=842 glyphs=4
2026-03-14T07:36:45.757845	8da1f8d8	0	0	0.0000	CRASH	gen=842 glyphs=4
2026-03-14T07:36:45.758040	e0911907	0	0	0.0000	CRASH	gen=842 glyphs=5
2026-03-14T07:36:45.758234	099964a4	0	0	0.0000	CRASH	gen=842 glyphs=4
2026-03-14T07:36:45.758427	54f3bfed	0	0	0.0000	CRASH	gen=842 glyphs=3
2026-03-14T07:36:45.758624	099964a4	0	0	0.0000	CRASH	gen=842 glyphs=4
2026-03-14T07:36:45.758814	ff30496a	0	0	0.0000	CRASH	gen=842 glyphs=3
2026-03-14T07:36:45.759011	099964a4	0	0	0.0000	CRASH	gen=842 glyphs=4
2026-03-14T07:36:45.759200	099964a4	0	0	0.0000	CRASH	gen=842 glyphs=4
2026-03-14T07:36:45.759486	099964a4	0	0	0.0000	CRASH	gen=843 glyphs=4
2026-03-14T07:36:45.759685	099964a4	0	0	0.0000	CRASH	gen=843 glyphs=4
2026-03-14T07:36:45.759877	45e1164b	0	0	0.0000	CRASH	gen=843 glyphs=4
2026-03-14T07:36:45.760079	540bda06	0	0	0.0000	CRASH	gen=843 glyphs=4
2026-03-14T07:36:45.760271	5015cc9b	0	0	0.0000	CRASH	gen=843 glyphs=4
2026-03-14T07:36:45.760464	7ede4765	0	0	0.0000	CRASH	gen=843 glyphs=2
2026-03-14T07:36:45.760657	5c3217d3	0	0	0.0000	CRASH	gen=843 glyphs=4
2026-03-14T07:36:45.760848	9d990997	0	0	0.0000	CRASH	gen=843 glyphs=4
2026-03-14T07:36:45.761048	dae0a753	0	0	0.0000	CRASH	gen=843 glyphs=4
2026-03-14T07:36:45.761242	4386a90d	0	0	0.0000	CRASH	gen=843 glyphs=4
2026-03-14T07:36:45.761526	099964a4	0	0	0.0000	CRASH	gen=844 glyphs=4
2026-03-14T07:36:45.761720	099964a4	0	0	0.0000	CRASH	gen=844 glyphs=4
2026-03-14T07:36:45.761912	0082693f	0	0	0.0000	CRASH	gen=844 glyphs=5
2026-03-14T07:36:45.762108	099964a4	0	0	0.0000	CRASH	gen=844 glyphs=4
2026-03-14T07:36:45.762298	cf93b656	0	0	0.0000	CRASH	gen=844 glyphs=3
2026-03-14T07:36:45.762496	bd1bf961	0	0	0.0000	CRASH	gen=844 glyphs=3
2026-03-14T07:36:45.762690	3ca14993	0	0	0.0000	CRASH	gen=844 glyphs=4
2026-03-14T07:36:45.762884	8da1f8d8	0	0	0.0000	CRASH	gen=844 glyphs=4
2026-03-14T07:36:45.763076	099964a4	0	0	0.0000	CRASH	gen=844 glyphs=4
2026-03-14T07:36:45.763263	69add68b	0	0	0.0000	CRASH	gen=844 glyphs=4
2026-03-14T07:36:45.763545	099964a4	0	0	0.0000	CRASH	gen=845 glyphs=4
2026-03-14T07:36:45.763739	099964a4	0	0	0.0000	CRASH	gen=845 glyphs=4
2026-03-14T07:36:45.763933	099964a4	0	0	0.0000	CRASH	gen=845 glyphs=4
2026-03-14T07:36:45.764126	099964a4	0	0	0.0000	CRASH	gen=845 glyphs=4
2026-03-14T07:36:45.764317	099964a4	0	0	0.0000	CRASH	gen=845 glyphs=4
2026-03-14T07:36:45.764514	099964a4	0	0	0.0000	CRASH	gen=845 glyphs=4
2026-03-14T07:36:45.764709	099964a4	0	0	0.0000	CRASH	gen=845 glyphs=4
2026-03-14T07:36:45.764901	099964a4	0	0	0.0000	CRASH	gen=845 glyphs=4
2026-03-14T07:36:45.765094	099964a4	0	0	0.0000	CRASH	gen=845 glyphs=4
2026-03-14T07:36:45.765290	099964a4	0	0	0.0000	CRASH	gen=845 glyphs=4
2026-03-14T07:36:45.765584	099964a4	0	0	0.0000	CRASH	gen=846 glyphs=4
2026-03-14T07:36:45.765783	099964a4	0	0	0.0000	CRASH	gen=846 glyphs=4
2026-03-14T07:36:45.765978	a73fb45c	0	0	0.0000	CRASH	gen=846 glyphs=2
2026-03-14T07:36:45.766174	d937055d	0	0	0.0000	CRASH	gen=846 glyphs=2
2026-03-14T07:36:45.766367	099964a4	0	0	0.0000	CRASH	gen=846 glyphs=4
2026-03-14T07:36:45.766561	3ca14993	0	0	0.0000	CRASH	gen=846 glyphs=4
2026-03-14T07:36:45.766758	099964a4	0	0	0.0000	CRASH	gen=846 glyphs=4
2026-03-14T07:36:45.766949	b7234f39	0	0	0.0000	CRASH	gen=846 glyphs=4
2026-03-14T07:36:45.767145	de602181	0	0	0.0000	CRASH	gen=846 glyphs=4
2026-03-14T07:36:45.767337	ff30496a	0	0	0.0000	CRASH	gen=846 glyphs=3
2026-03-14T07:36:45.767630	099964a4	0	0	0.0000	CRASH	gen=847 glyphs=4
2026-03-14T07:36:45.767829	099964a4	0	0	0.0000	CRASH	gen=847 glyphs=4
2026-03-14T07:36:45.768022	d4108cb6	0	0	0.0000	CRASH	gen=847 glyphs=5
2026-03-14T07:36:45.768217	ca0ed757	0	0	0.0000	CRASH	gen=847 glyphs=2
2026-03-14T07:36:45.768409	099964a4	0	0	0.0000	CRASH	gen=847 glyphs=4
2026-03-14T07:36:45.768603	099964a4	0	0	0.0000	CRASH	gen=847 glyphs=4
2026-03-14T07:36:45.768801	c8578dfb	0	0	0.0000	CRASH	gen=847 glyphs=4
2026-03-14T07:36:45.768996	099964a4	0	0	0.0000	CRASH	gen=847 glyphs=4
2026-03-14T07:36:45.769192	7ede4765	0	0	0.0000	CRASH	gen=847 glyphs=2
2026-03-14T07:36:45.769387	c33422bd	0	0	0.0000	CRASH	gen=847 glyphs=3
2026-03-14T07:36:45.769668	099964a4	0	0	0.0000	CRASH	gen=848 glyphs=4
2026-03-14T07:36:45.769870	099964a4	0	0	0.0000	CRASH	gen=848 glyphs=4
2026-03-14T07:36:45.770063	3a86d05d	0	0	0.0000	CRASH	gen=848 glyphs=2
2026-03-14T07:36:45.770254	099964a4	0	0	0.0000	CRASH	gen=848 glyphs=4
2026-03-14T07:36:45.770449	099964a4	0	0	0.0000	CRASH	gen=848 glyphs=4
2026-03-14T07:36:45.770643	4af6ac4a	0	0	0.0000	CRASH	gen=848 glyphs=2
2026-03-14T07:36:45.770836	099964a4	0	0	0.0000	CRASH	gen=848 glyphs=4
2026-03-14T07:36:45.771029	7d5690f0	0	0	0.0000	CRASH	gen=848 glyphs=3
2026-03-14T07:36:45.771220	d83132bd	0	0	0.0000	CRASH	gen=848 glyphs=1
2026-03-14T07:36:45.771409	099964a4	0	0	0.0000	CRASH	gen=848 glyphs=4
2026-03-14T07:36:45.771684	099964a4	0	0	0.0000	CRASH	gen=849 glyphs=4
2026-03-14T07:36:45.771880	099964a4	0	0	0.0000	CRASH	gen=849 glyphs=4
2026-03-14T07:36:45.772076	099964a4	0	0	0.0000	CRASH	gen=849 glyphs=4
2026-03-14T07:36:45.772266	80cef82b	0	0	0.0000	CRASH	gen=849 glyphs=4
2026-03-14T07:36:45.772460	099964a4	0	0	0.0000	CRASH	gen=849 glyphs=4
2026-03-14T07:36:45.772655	3ca14993	0	0	0.0000	CRASH	gen=849 glyphs=4
2026-03-14T07:36:45.772847	aaa8986a	0	0	0.0000	CRASH	gen=849 glyphs=4
2026-03-14T07:36:45.773042	099964a4	0	0	0.0000	CRASH	gen=849 glyphs=4
2026-03-14T07:36:45.773235	099964a4	0	0	0.0000	CRASH	gen=849 glyphs=4
2026-03-14T07:36:45.773428	8da1f8d8	0	0	0.0000	CRASH	gen=849 glyphs=4
2026-03-14T07:36:45.773711	099964a4	0	0	0.0000	CRASH	gen=850 glyphs=4
2026-03-14T07:36:45.773905	099964a4	0	0	0.0000	CRASH	gen=850 glyphs=4
2026-03-14T07:36:45.774100	099964a4	0	0	0.0000	CRASH	gen=850 glyphs=4
2026-03-14T07:36:45.774292	6905fffc	0	0	0.0000	CRASH	gen=850 glyphs=4
2026-03-14T07:36:45.774484	099964a4	0	0	0.0000	CRASH	gen=850 glyphs=4
2026-03-14T07:36:45.774678	ff30496a	0	0	0.0000	CRASH	gen=850 glyphs=3
2026-03-14T07:36:45.774869	17f1eac8	0	0	0.0000	CRASH	gen=850 glyphs=4
2026-03-14T07:36:45.775061	dcb1fb50	0	0	0.0000	CRASH	gen=850 glyphs=4
2026-03-14T07:36:45.775256	3a734398	0	0	0.0000	CRASH	gen=850 glyphs=4
2026-03-14T07:36:45.775447	099964a4	0	0	0.0000	CRASH	gen=850 glyphs=4
2026-03-14T07:36:45.775726	099964a4	0	0	0.0000	CRASH	gen=851 glyphs=4
2026-03-14T07:36:45.775921	099964a4	0	0	0.0000	CRASH	gen=851 glyphs=4
2026-03-14T07:36:45.776118	099964a4	0	0	0.0000	CRASH	gen=851 glyphs=4
2026-03-14T07:36:45.776314	099964a4	0	0	0.0000	CRASH	gen=851 glyphs=4
2026-03-14T07:36:45.776508	099964a4	0	0	0.0000	CRASH	gen=851 glyphs=4
2026-03-14T07:36:45.776704	099964a4	0	0	0.0000	CRASH	gen=851 glyphs=4
2026-03-14T07:36:45.776898	099964a4	0	0	0.0000	CRASH	gen=851 glyphs=4
2026-03-14T07:36:45.777092	ff30496a	0	0	0.0000	CRASH	gen=851 glyphs=3
2026-03-14T07:36:45.777291	768c2986	0	0	0.0000	CRASH	gen=851 glyphs=2
2026-03-14T07:36:45.777481	099964a4	0	0	0.0000	CRASH	gen=851 glyphs=4
2026-03-14T07:36:45.777771	099964a4	0	0	0.0000	CRASH	gen=852 glyphs=4
2026-03-14T07:36:45.777968	099964a4	0	0	0.0000	CRASH	gen=852 glyphs=4
2026-03-14T07:36:45.778161	ff30496a	0	0	0.0000	CRASH	gen=852 glyphs=3
2026-03-14T07:36:45.778357	2c1c2777	0	0	0.0000	CRASH	gen=852 glyphs=3
2026-03-14T07:36:45.778554	a9d68c57	0	0	0.0000	CRASH	gen=852 glyphs=4
2026-03-14T07:36:45.778750	73849a2f	0	0	0.0000	CRASH	gen=852 glyphs=4
2026-03-14T07:36:45.778944	099964a4	0	0	0.0000	CRASH	gen=852 glyphs=4
2026-03-14T07:36:45.779136	099964a4	0	0	0.0000	CRASH	gen=852 glyphs=4
2026-03-14T07:36:45.779327	863c4277	0	0	0.0000	CRASH	gen=852 glyphs=4
2026-03-14T07:36:45.779521	dcb1fb50	0	0	0.0000	CRASH	gen=852 glyphs=4
2026-03-14T07:36:45.779794	099964a4	0	0	0.0000	CRASH	gen=853 glyphs=4
2026-03-14T07:36:45.779987	099964a4	0	0	0.0000	CRASH	gen=853 glyphs=4
2026-03-14T07:36:45.780183	099964a4	0	0	0.0000	CRASH	gen=853 glyphs=4
2026-03-14T07:36:45.780376	099964a4	0	0	0.0000	CRASH	gen=853 glyphs=4
2026-03-14T07:36:45.780575	099964a4	0	0	0.0000	CRASH	gen=853 glyphs=4
2026-03-14T07:36:45.780767	099964a4	0	0	0.0000	CRASH	gen=853 glyphs=4
2026-03-14T07:36:45.780959	099964a4	0	0	0.0000	CRASH	gen=853 glyphs=4
2026-03-14T07:36:45.781153	53f61971	0	0	0.0000	CRASH	gen=853 glyphs=3
2026-03-14T07:36:45.781349	7ede4765	0	0	0.0000	CRASH	gen=853 glyphs=2
2026-03-14T07:36:45.781548	099964a4	0	0	0.0000	CRASH	gen=853 glyphs=4
2026-03-14T07:36:45.781815	099964a4	0	0	0.0000	CRASH	gen=854 glyphs=4
2026-03-14T07:36:45.782012	099964a4	0	0	0.0000	CRASH	gen=854 glyphs=4
2026-03-14T07:36:45.782207	27f76448	0	0	0.0000	CRASH	gen=854 glyphs=2
2026-03-14T07:36:45.782401	099964a4	0	0	0.0000	CRASH	gen=854 glyphs=4
2026-03-14T07:36:45.782602	099964a4	0	0	0.0000	CRASH	gen=854 glyphs=4
2026-03-14T07:36:45.782797	92e5d1b9	0	0	0.0000	CRASH	gen=854 glyphs=3
2026-03-14T07:36:45.782991	099964a4	0	0	0.0000	CRASH	gen=854 glyphs=4
2026-03-14T07:36:45.783181	164d43ae	0	0	0.0000	CRASH	gen=854 glyphs=3
2026-03-14T07:36:45.783375	099964a4	0	0	0.0000	CRASH	gen=854 glyphs=4
2026-03-14T07:36:45.783569	3a734398	0	0	0.0000	CRASH	gen=854 glyphs=4
2026-03-14T07:36:45.783848	099964a4	0	0	0.0000	CRASH	gen=855 glyphs=4
2026-03-14T07:36:45.784044	099964a4	0	0	0.0000	CRASH	gen=855 glyphs=4
2026-03-14T07:36:45.784239	357d804f	0	0	0.0000	CRASH	gen=855 glyphs=4
2026-03-14T07:36:45.784434	099964a4	0	0	0.0000	CRASH	gen=855 glyphs=4
2026-03-14T07:36:45.784631	7d1ca9cb	0	0	0.0000	CRASH	gen=855 glyphs=4
2026-03-14T07:36:45.784827	099964a4	0	0	0.0000	CRASH	gen=855 glyphs=4
2026-03-14T07:36:45.785019	43c61a16	0	0	0.0000	CRASH	gen=855 glyphs=4
2026-03-14T07:36:45.785213	dcb1fb50	0	0	0.0000	CRASH	gen=855 glyphs=4
2026-03-14T07:36:45.785409	83c2dabd	0	0	0.0000	CRASH	gen=855 glyphs=4
2026-03-14T07:36:45.785604	7ede4765	0	0	0.0000	CRASH	gen=855 glyphs=2
2026-03-14T07:36:45.785879	099964a4	0	0	0.0000	CRASH	gen=856 glyphs=4
2026-03-14T07:36:45.786071	099964a4	0	0	0.0000	CRASH	gen=856 glyphs=4
2026-03-14T07:36:45.786263	099964a4	0	0	0.0000	CRASH	gen=856 glyphs=4
2026-03-14T07:36:45.786454	dcb1fb50	0	0	0.0000	CRASH	gen=856 glyphs=4
2026-03-14T07:36:45.786648	a78db5f9	0	0	0.0000	CRASH	gen=856 glyphs=4
2026-03-14T07:36:45.786844	7ede4765	0	0	0.0000	CRASH	gen=856 glyphs=2
2026-03-14T07:36:45.787035	ff30496a	0	0	0.0000	CRASH	gen=856 glyphs=3
2026-03-14T07:36:45.787227	ee8f5da8	0	0	0.0000	CRASH	gen=856 glyphs=3
2026-03-14T07:36:45.787423	3ca14993	0	0	0.0000	CRASH	gen=856 glyphs=4
2026-03-14T07:36:45.787624	8da1f8d8	0	0	0.0000	CRASH	gen=856 glyphs=4
2026-03-14T07:36:45.787891	099964a4	0	0	0.0000	CRASH	gen=857 glyphs=4
2026-03-14T07:36:45.788083	099964a4	0	0	0.0000	CRASH	gen=857 glyphs=4
2026-03-14T07:36:45.788278	099964a4	0	0	0.0000	CRASH	gen=857 glyphs=4
2026-03-14T07:36:45.788471	099964a4	0	0	0.0000	CRASH	gen=857 glyphs=4
2026-03-14T07:36:45.788668	099964a4	0	0	0.0000	CRASH	gen=857 glyphs=4
2026-03-14T07:36:45.788861	40b2a4f4	0	0	0.0000	CRASH	gen=857 glyphs=4
2026-03-14T07:36:45.789062	099964a4	0	0	0.0000	CRASH	gen=857 glyphs=4
2026-03-14T07:36:45.789256	099964a4	0	0	0.0000	CRASH	gen=857 glyphs=4
2026-03-14T07:36:45.789456	5cb552ec	0	0	0.0000	CRASH	gen=857 glyphs=4
2026-03-14T07:36:45.789651	099964a4	0	0	0.0000	CRASH	gen=857 glyphs=4
2026-03-14T07:36:45.789924	099964a4	0	0	0.0000	CRASH	gen=858 glyphs=4
