timestamp	program_hash	spirv_size	word_count	fitness	status	description
2026-03-14T07:36:45.599507	099964a4	0	0	0.0000	CRASH	gen=764 glyphs=4
2026-03-14T07:36:45.599703	099964a4	0	0	0.0000	CRASH	gen=764 glyphs=4
2026-03-14T07:36:45.599894	099964a4	0	0	0.0000	CRASH	gen=764 glyphs=4
2026-03-14T07:36:45.600084	099964a4	0	0	0.0000	CRASH	gen=764 glyphs=4
2026-03-14T07:36:45.600279	3a734398	0	0	0.0000	CRASH	gen=764 glyphs=4
2026-03-14T07:36:45.600472	099964a4	0	0	0.0000	CRASH	gen=764 glyphs=4
2026-03-14T07:36:45.600664	099964a4	0	0	0.0000	CRASH	gen=764 glyphs=4
2026-03-14T07:36:45.600855	facb5b72	0	0	0.0000	CRASH	gen=764 glyphs=4
2026-03-14T07:36:45.601137	099964a4	0	0	0.0000	CRASH	gen=765 glyphs=4
2026-03-14T07:36:45.601334	099964a4	0	0	0.0000	CRASH	gen=765 glyphs=4
2026-03-14T07:36:45.601528	099964a4	0	0	0.0000	CRASH	gen=765 glyphs=4
2026-03-14T07:36:45.601716	3a734398	0	0	0.0000	CRASH	gen=765 glyphs=4
2026-03-14T07:36:45.601916	3ca14993	0	0	0.0000	CRASH	gen=765 glyphs=4
2026-03-14T07:36:45.602105	7ede4765	0	0	0.0000	CRASH	gen=765 glyphs=2
2026-03-14T07:36:45.602294	1fb49a32	0	0	0.0000	CRASH	gen=765 glyphs=4
2026-03-14T07:36:45.602488	3a734398	0	0	0.0000	CRASH	gen=765 glyphs=4
2026-03-14T07:36:45.602682	099964a4	0	0	0.0000	CRASH	gen=765 glyphs=4
2026-03-14T07:36:45.602878	099964a4	0	0	0.0000	CRASH	gen=765 glyphs=4
2026-03-14T07:36:45.603168	099964a4	0	0	0.0000	CRASH	gen=766 glyphs=4
2026-03-14T07:36:45.603368	099964a4	0	0	0.0000	CRASH	gen=766 glyphs=4
2026-03-14T07:36:45.603568	1e767b77	0	0	0.0000	CRASH	gen=766 glyphs=4
2026-03-14T07:36:45.603763	099964a4	0	0	0.0000	CRASH	gen=766 glyphs=4
2026-03-14T07:36:45.603956	099964a4	0	0	0.0000	CRASH	gen=766 glyphs=4
2026-03-14T07:36:45.604150	cf93b656	0	0	0.0000	CRASH	gen=766 glyphs=3
2026-03-14T07:36:45.604341	3ca14993	0	0	0.0000	CRASH	gen=766 glyphs=4
2026-03-14T07:36:45.604540	099964a4	0	0	0.0000	CRASH	gen=766 glyphs=4
2026-03-14T07:36:45.604734	099964a4	0	0	0.0000	CRASH	gen=766 glyphs=4
2026-03-14T07:36:45.604926	099964a4	0	0	0.0000	CRASH	gen=766 glyphs=4
2026-03-14T07:36:45.605196	099964a4	0	0	0.0000	CRASH	gen=767 glyphs=4
2026-03-14T07:36:45.605391	099964a4	0	0	0.0000	CRASH	gen=767 glyphs=4
2026-03-14T07:36:45.605590	1975dc7e	0	0	0.0000	CRASH	gen=767 glyphs=2
2026-03-14T07:36:45.605783	099964a4	0	0	0.0000	CRASH	gen=767 glyphs=4
2026-03-14T07:36:45.605973	099964a4	0	0	0.0000	CRASH	gen=767 glyphs=4
2026-03-14T07:36:45.606165	099964a4	0	0	0.0000	CRASH	gen=767 glyphs=4
2026-03-14T07:36:45.606356	099964a4	0	0	0.0000	CRASH	gen=767 glyphs=4
2026-03-14T07:36:45.606551	3a734398	0	0	0.0000	CRASH	gen=767 glyphs=4
2026-03-14T07:36:45.606748	099964a4	0	0	0.0000	CRASH	gen=767 glyphs=4
2026-03-14T07:36:45.606940	099964a4	0	0	0.0000	CRASH	gen=767 glyphs=4
2026-03-14T07:36:45.607202	099964a4	0	0	0.0000	CRASH	gen=768 glyphs=4
2026-03-14T07:36:45.607393	099964a4	0	0	0.0000	CRASH	gen=768 glyphs=4
2026-03-14T07:36:45.607588	1673bd3f	0	0	0.0000	CRASH	gen=768 glyphs=4
2026-03-14T07:36:45.607786	dc8f9bb3	0	0	0.0000	CRASH	gen=768 glyphs=4
2026-03-14T07:36:45.607977	dcb1fb50	0	0	0.0000	CRASH	gen=768 glyphs=4
2026-03-14T07:36:45.608169	099964a4	0	0	0.0000	CRASH	gen=768 glyphs=4
2026-03-14T07:36:45.608356	099964a4	0	0	0.0000	CRASH	gen=768 glyphs=4
2026-03-14T07:36:45.608548	099964a4	0	0	0.0000	CRASH	gen=768 glyphs=4
2026-03-14T07:36:45.608745	dcb1fb50	0	0	0.0000	CRASH	gen=768 glyphs=4
2026-03-14T07:36:45.608938	099964a4	0	0	0.0000	CRASH	gen=768 glyphs=4
2026-03-14T07:36:45.609220	099964a4	0	0	0.0000	CRASH	gen=769 glyphs=4
2026-03-14T07:36:45.609414	099964a4	0	0	0.0000	CRASH	gen=769 glyphs=4
2026-03-14T07:36:45.609611	099964a4	0	0	0.0000	CRASH	gen=769 glyphs=4
2026-03-14T07:36:45.609806	099964a4	0	0	0.0000	CRASH	gen=769 glyphs=4
2026-03-14T07:36:45.609997	8da1f8d8	0	0	0.0000	CRASH	gen=769 glyphs=4
2026-03-14T07:36:45.610192	eec4ecfb	0	0	0.0000	CRASH	gen=769 glyphs=4
2026-03-14T07:36:45.610387	eb8791a8	0	0	0.0000	CRASH	gen=769 glyphs=4
2026-03-14T07:36:45.610581	5f488e94	0	0	0.0000	CRASH	gen=769 glyphs=4
2026-03-14T07:36:45.610776	95e60396	0	0	0.0000	CRASH	gen=769 glyphs=4
2026-03-14T07:36:45.610974	099964a4	0	0	0.0000	CRASH	gen=769 glyphs=4
2026-03-14T07:36:45.611242	099964a4	0	0	0.0000	CRASH	gen=770 glyphs=4
2026-03-14T07:36:45.611439	099964a4	0	0	0.0000	CRASH	gen=770 glyphs=4
2026-03-14T07:36:45.611635	099964a4	0	0	0.0000	CRASH	gen=770 glyphs=4
2026-03-14T07:36:45.611829	3b20ede8	0	0	0.0000	CRASH	gen=770 glyphs=4
2026-03-14T07:36:45.612023	dcb1fb50	0	0	0.0000	CRASH	gen=770 glyphs=4
2026-03-14T07:36:45.612215	3ca14993	0	0	0.0000	CRASH	gen=770 glyphs=4
2026-03-14T07:36:45.612408	ff30496a	0	0	0.0000	CRASH	gen=770 glyphs=3
2026-03-14T07:36:45.612599	099964a4	0	0	0.0000	CRASH	gen=770 glyphs=4
2026-03-14T07:36:45.612792	1158df01	0	0	0.0000	CRASH	gen=770 glyphs=4
2026-03-14T07:36:45.612992	f577c336	0	0	0.0000	CRASH	gen=770 glyphs=3
2026-03-14T07:36:45.613276	099964a4	0	0	0.0000	CRASH	gen=771 glyphs=4
2026-03-14T07:36:45.613472	099964a4	0	0	0.0000	CRASH	gen=771 glyphs=4
2026-03-14T07:36:45.613666	099964a4	0	0	0.0000	CRASH	gen=771 glyphs=4
2026-03-14T07:36:45.613859	099964a4	0	0	0.0000	CRASH	gen=771 glyphs=4
2026-03-14T07:36:45.614055	cf93b656	0	0	0.0000	CRASH	gen=771 glyphs=3
2026-03-14T07:36:45.614246	099964a4	0	0	0.0000	CRASH	gen=771 glyphs=4
2026-03-14T07:36:45.614436	099964a4	0	0	0.0000	CRASH	gen=771 glyphs=4
2026-03-14T07:36:45.614630	0b9c64b0	0	0	0.0000	CRASH	gen=771 glyphs=2
2026-03-14T07:36:45.614823	099964a4	0	0	0.0000	CRASH	gen=771 glyphs=4
2026-03-14T07:36:45.615016	099964a4	0	0	0.0000	CRASH	gen=771 glyphs=4
2026-03-14T07:36:45.615290	099964a4	0	0	0.0000	CRASH	gen=772 glyphs=4
2026-03-14T07:36:45.615482	099964a4	0	0	0.0000	CRASH	gen=772 glyphs=4
2026-03-14T07:36:45.615676	099964a4	0	0	0.0000	CRASH	gen=772 glyphs=4
2026-03-14T07:36:45.615868	099964a4	0	0	0.0000	CRASH	gen=772 glyphs=4
2026-03-14T07:36:45.616063	8da1f8d8	0	0	0.0000	CRASH	gen=772 glyphs=4
2026-03-14T07:36:45.616258	099964a4	0	0	0.0000	CRASH	gen=772 glyphs=4
2026-03-14T07:36:45.616449	eb3d1bc8	0	0	0.0000	CRASH	gen=772 glyphs=4
2026-03-14T07:36:45.616646	25854b16	0	0	0.0000	CRASH	gen=772 glyphs=3
2026-03-14T07:36:45.616837	df518cf8	0	0	0.0000	CRASH	gen=772 glyphs=4
2026-03-14T07:36:45.617028	b8ae2a35	0	0	0.0000	CRASH	gen=772 glyphs=3
2026-03-14T07:36:45.617294	099964a4	0	0	0.0000	CRASH	gen=773 glyphs=4
2026-03-14T07:36:45.617484	099964a4	0	0	0.0000	CRASH	gen=773 glyphs=4
2026-03-14T07:36:45.617677	2a783ff2	0	0	0.0000	CRASH	gen=773 glyphs=4
2026-03-14T07:36:45.617870	099964a4	0	0	0.0000	CRASH	gen=773 glyphs=4
2026-03-14T07:36:45.618064	099964a4	0	0	0.0000	CRASH	gen=773 glyphs=4
2026-03-14T07:36:45.618261	099964a4	0	0	0.0000	CRASH	gen=773 glyphs=4
2026-03-14T07:36:45.618454	2b0e8305	0	0	0.0000	CRASH	gen=773 glyphs=4
2026-03-14T07:36:45.618649	3ca14993	0	0	0.0000	CRASH	gen=773 glyphs=4
2026-03-14T07:36:45.618843	099964a4	0	0	0.0000	CRASH	gen=773 glyphs=4
2026-03-14T07:36:45.619036	099964a4	0	0	0.0000	CRASH	gen=773 glyphs=4
2026-03-14T07:36:45.619318	099964a4	0	0	0.0000	CRASH	gen=774 glyphs=4
2026-03-14T07:36:45.619515	099964a4	0	0	0.0000	CRASH	gen=774 glyphs=4
2026-03-14T07:36:45.619713	dcb1fb50	0	0	0.0000	CRASH	gen=774 glyphs=4
2026-03-14T07:36:45.619907	099964a4	0	0	0.0000	CRASH	gen=774 glyphs=4
2026-03-14T07:36:45.620099	ff30496a	0	0	0.0000	CRASH	gen=774 glyphs=3
2026-03-14T07:36:45.620296	908953de	0	0	0.0000	CRASH	gen=774 glyphs=1
2026-03-14T07:36:45.620485	099964a4	0	0	0.0000	CRASH	gen=774 glyphs=4
2026-03-14T07:36:45.620679	099964a4	0	0	0.0000	CRASH	gen=774 glyphs=4
2026-03-14T07:36:45.620871	099964a4	0	0	0.0000	CRASH	gen=774 glyphs=4
2026-03-14T07:36:45.621061	099964a4	0	0	0.0000	CRASH	gen=774 glyphs=4
2026-03-14T07:36:45.621339	099964a4	0	0	0.0000	CRASH	gen=775 glyphs=4
2026-03-14T07:36:45.621533	099964a4	0	0	0.0000	CRASH	gen=775 glyphs=4
2026-03-14T07:36:45.621726	099964a4	0	0	0.0000	CRASH	gen=775 glyphs=4
2026-03-14T07:36:45.621917	099964a4	0	0	0.0000	CRASH	gen=775 glyphs=4
2026-03-14T07:36:45.622109	099964a4	0	0	0.0000	CRASH	gen=775 glyphs=4
2026-03-14T07:36:45.622298	099964a4	0	0	0.0000	CRASH	gen=775 glyphs=4
2026-03-14T07:36:45.622495	91b9912c	0	0	0.0000	CRASH	gen=775 glyphs=3
2026-03-14T07:36:45.622689	099964a4	0	0	0.0000	CRASH	gen=775 glyphs=4
2026-03-14T07:36:45.622880	3a734398	0	0	0.0000	CRASH	gen=775 glyphs=4
2026-03-14T07:36:45.623073	a6e06259	0	0	0.0000	CRASH	gen=775 glyphs=2
2026-03-14T07:36:45.623349	099964a4	0	0	0.0000	CRASH	gen=776 glyphs=4
2026-03-14T07:36:45.623551	099964a4	0	0	0.0000	CRASH	gen=776 glyphs=4
2026-03-14T07:36:45.623746	099964a4	0	0	0.0000	CRASH	gen=776 glyphs=4
2026-03-14T07:36:45.623940	80cef82b	0	0	0.0000	CRASH	gen=776 glyphs=4
2026-03-14T07:36:45.624136	099964a4	0	0	0.0000	CRASH	gen=776 glyphs=4
2026-03-14T07:36:45.624328	a087b5ec	0	0	0.0000	CRASH	gen=776 glyphs=3
2026-03-14T07:36:45.624526	deb7243d	0	0	0.0000	CRASH	gen=776 glyphs=3
2026-03-14T07:36:45.624723	099964a4	0	0	0.0000	CRASH	gen=776 glyphs=4
2026-03-14T07:36:45.624916	cf93b656	0	0	0.0000	CRASH	gen=776 glyphs=3
2026-03-14T07:36:45.625107	099964a4	0	0	0.0000	CRASH	gen=776 glyphs=4
2026-03-14T07:36:45.625376	099964a4	0	0	0.0000	CRASH	gen=777 glyphs=4
2026-03-14T07:36:45.625577	099964a4	0	0	0.0000	CRASH	gen=777 glyphs=4
2026-03-14T07:36:45.625771	099964a4	0	0	0.0000	CRASH	gen=777 glyphs=4
2026-03-14T07:36:45.625965	099964a4	0	0	0.0000	CRASH	gen=777 glyphs=4
2026-03-14T07:36:45.626157	099964a4	0	0	0.0000	CRASH	gen=777 glyphs=4
2026-03-14T07:36:45.626346	099964a4	0	0	0.0000	CRASH	gen=777 glyphs=4
2026-03-14T07:36:45.626542	099964a4	0	0	0.0000	CRASH	gen=777 glyphs=4
2026-03-14T07:36:45.626739	8da1f8d8	0	0	0.0000	CRASH	gen=777 glyphs=4
2026-03-14T07:36:45.626934	cf93b656	0	0	0.0000	CRASH	gen=777 glyphs=3
2026-03-14T07:36:45.627126	099964a4	0	0	0.0000	CRASH	gen=777 glyphs=4
2026-03-14T07:36:45.627411	099964a4	0	0	0.0000	CRASH	gen=778 glyphs=4
2026-03-14T07:36:45.627608	099964a4	0	0	0.0000	CRASH	gen=778 glyphs=4
2026-03-14T07:36:45.627808	099964a4	0	0	0.0000	CRASH	gen=778 glyphs=4
2026-03-14T07:36:45.628000	099964a4	0	0	0.0000	CRASH	gen=778 glyphs=4
2026-03-14T07:36:45.628192	3a734398	0	0	0.0000	CRASH	gen=778 glyphs=4
2026-03-14T07:36:45.628382	099964a4	0	0	0.0000	CRASH	gen=778 glyphs=4
2026-03-14T07:36:45.628575	2693d950	0	0	0.0000	CRASH	gen=778 glyphs=2
2026-03-14T07:36:45.628770	3d800ba1	0	0	0.0000	CRASH	gen=778 glyphs=3
2026-03-14T07:36:45.628966	d5c2bcd4	0	0	0.0000	CRASH	gen=778 glyphs=4
2026-03-14T07:36:45.629160	61874967	0	0	0.0000	CRASH	gen=778 glyphs=4
2026-03-14T07:36:45.629428	099964a4	0	0	0.0000	CRASH	gen=779 glyphs=4
2026-03-14T07:36:45.629625	099964a4	0	0	0.0000	CRASH	gen=779 glyphs=4
2026-03-14T07:36:45.629824	0d55116b	0	0	0.0000	CRASH	gen=779 glyphs=3
2026-03-14T07:36:45.630016	ab591316	0	0	0.0000	CRASH	gen=779 glyphs=4
2026-03-14T07:36:45.630210	099964a4	0	0	0.0000	CRASH	gen=779 glyphs=4
2026-03-14T07:36:45.630402	099964a4	0	0	0.0000	CRASH	gen=779 glyphs=4
2026-03-14T07:36:45.630596	099964a4	0	0	0.0000	CRASH	gen=779 glyphs=4
2026-03-14T07:36:45.630787	099964a4	0	0	0.0000	CRASH	gen=779 glyphs=4
2026-03-14T07:36:45.630984	80cef82b	0	0	0.0000	CRASH	gen=779 glyphs=4
2026-03-14T07:36:45.631175	01dae979	0	0	0.0000	CRASH	gen=779 glyphs=3
2026-03-14T07:36:45.631441	099964a4	0	0	0.0000	CRASH	gen=780 glyphs=4
2026-03-14T07:36:45.631638	099964a4	0	0	0.0000	CRASH	gen=780 glyphs=4
2026-03-14T07:36:45.631830	099964a4	0	0	0.0000	CRASH	gen=780 glyphs=4
2026-03-14T07:36:45.632027	099964a4	0	0	0.0000	CRASH	gen=780 glyphs=4
2026-03-14T07:36:45.632219	eda65625	0	0	0.0000	CRASH	gen=780 glyphs=3
2026-03-14T07:36:45.632413	afbd03f0	0	0	0.0000	CRASH	gen=780 glyphs=3
2026-03-14T07:36:45.632608	3ca14993	0	0	0.0000	CRASH	gen=780 glyphs=4
2026-03-14T07:36:45.632801	7fe15ec9	0	0	0.0000	CRASH	gen=780 glyphs=4
2026-03-14T07:36:45.633000	099964a4	0	0	0.0000	CRASH	gen=780 glyphs=4
2026-03-14T07:36:45.633195	0ddfdb1d	0	0	0.0000	CRASH	gen=780 glyphs=3
2026-03-14T07:36:45.633487	099964a4	0	0	0.0000	CRASH	gen=781 glyphs=4
2026-03-14T07:36:45.633686	099964a4	0	0	0.0000	CRASH	gen=781 glyphs=4
2026-03-14T07:36:45.633881	cf93b656	0	0	0.0000	CRASH	gen=781 glyphs=3
2026-03-14T07:36:45.634079	32ac3730	0	0	0.0000	CRASH	gen=781 glyphs=4
2026-03-14T07:36:45.634275	099964a4	0	0	0.0000	CRASH	gen=781 glyphs=4
2026-03-14T07:36:45.634468	099964a4	0	0	0.0000	CRASH	gen=781 glyphs=4
2026-03-14T07:36:45.634665	099964a4	0	0	0.0000	CRASH	gen=781 glyphs=4
2026-03-14T07:36:45.634860	099964a4	0	0	0.0000	CRASH	gen=781 glyphs=4
2026-03-14T07:36:45.635058	80cef82b	0	0	0.0000	CRASH	gen=781 glyphs=4
2026-03-14T07:36:45.635253	099964a4	0	0	0.0000	CRASH	gen=781 glyphs=4
2026-03-14T07:36:45.635528	099964a4	0	0	0.0000	CRASH	gen=782 glyphs=4
2026-03-14T07:36:45.635720	099964a4	0	0	0.0000	CRASH	gen=782 glyphs=4
2026-03-14T07:36:45.635911	099964a4	0	0	0.0000	CRASH	gen=782 glyphs=4
2026-03-14T07:36:45.636103	80cef82b	0	0	0.0000	CRASH	gen=782 glyphs=4
2026-03-14T07:36:45.636300	099964a4	0	0	0.0000	CRASH	gen=782 glyphs=4
2026-03-14T07:36:45.636491	99db9e12	0	0	0.0000	CRASH	gen=782 glyphs=4
2026-03-14T07:36:45.636687	8da1f8d8	0	0	0.0000	CRASH	gen=782 glyphs=4
2026-03-14T07:36:45.636880	a183b021	0	0	0.0000	CRASH	gen=782 glyphs=4
2026-03-14T07:36:45.637072	099964a4	0	0	0.0000	CRASH	gen=782 glyphs=4
2026-03-14T07:36:45.637266	cf93b656	0	0	0.0000	CRASH	gen=782 glyphs=3
2026-03-14T07:36:45.637538	099964a4	0	0	0.0000	CRASH	gen=783 glyphs=4
2026-03-14T07:36:45.637734	099964a4	0	0	0.0000	CRASH	gen=783 glyphs=4
2026-03-14T07:36:45.637931	8da1f8d8	0	0	0.0000	CRASH	gen=783 glyphs=4
2026-03-14T07:36:45.638126	7e377fc1	0	0	0.0000	CRASH	gen=783 glyphs=4
2026-03-14T07:36:45.638324	dcb1fb50	0	0	0.0000	CRASH	gen=783 glyphs=4
2026-03-14T07:36:45.638521	6c84cc18	0	0	0.0000	CRASH	gen=783 glyphs=4
2026-03-14T07:36:45.638717	099964a4	0	0	0.0000	CRASH	gen=783 glyphs=4
2026-03-14T07:36:45.638910	8e012b22	0	0	0.0000	CRASH	gen=783 glyphs=4
2026-03-14T07:36:45.639107	ccb6f4c4	0	0	0.0000	CRASH	gen=783 glyphs=4
2026-03-14T07:36:45.639308	7dffb459	0	0	0.0000	CRASH	gen=783 glyphs=4
2026-03-14T07:36:45.639588	099964a4	0	0	0.0000	CRASH	gen=784 glyphs=4
2026-03-14T07:36:45.639785	099964a4	0	0	0.0000	CRASH	gen=784 glyphs=4
2026-03-14T07:36:45.639979	099964a4	0	0	0.0000	CRASH	gen=784 glyphs=4
2026-03-14T07:36:45.640173	099964a4	0	0	0.0000	CRASH	gen=784 glyphs=4
2026-03-14T07:36:45.640369	099964a4	0	0	0.0000	CRASH	gen=784 glyphs=4
2026-03-14T07:36:45.640564	099964a4	0	0	0.0000	CRASH	gen=784 glyphs=4
2026-03-14T07:36:45.640757	80cef82b	0	0	0.0000	CRASH	gen=784 glyphs=4
2026-03-14T07:36:45.640951	110535d3	0	0	0.0000	CRASH	gen=784 glyphs=4
2026-03-14T07:36:45.641147	8da1f8d8	0	0	0.0000	CRASH	gen=784 glyphs=4
2026-03-14T07:36:45.641341	099964a4	0	0	0.0000	CRASH	gen=784 glyphs=4
2026-03-14T07:36:45.641625	099964a4	0	0	0.0000	CRASH	gen=785 glyphs=4
2026-03-14T07:36:45.641821	099964a4	0	0	0.0000	CRASH	gen=785 glyphs=4
2026-03-14T07:36:45.642017	099964a4	0	0	0.0000	CRASH	gen=785 glyphs=4
2026-03-14T07:36:45.642211	099964a4	0	0	0.0000	CRASH	gen=785 glyphs=4
2026-03-14T07:36:45.642405	099964a4	0	0	0.0000	CRASH	gen=785 glyphs=4
2026-03-14T07:36:45.642604	3ca14993	0	0	0.0000	CRASH	gen=785 glyphs=4
2026-03-14T07:36:45.642799	12572659	0	0	0.0000	CRASH	gen=785 glyphs=3
2026-03-14T07:36:45.642996	ff30496a	0	0	0.0000	CRASH	gen=785 glyphs=3
2026-03-14T07:36:45.643193	af2542b5	0	0	0.0000	CRASH	gen=785 glyphs=3
2026-03-14T07:36:45.643386	66c5d476	0	0	0.0000	CRASH	gen=785 glyphs=1
2026-03-14T07:36:45.643665	099964a4	0	0	0.0000	CRASH	gen=786 glyphs=4
2026-03-14T07:36:45.643859	099964a4	0	0	0.0000	CRASH	gen=786 glyphs=4
2026-03-14T07:36:45.644054	ff30496a	0	0	0.0000	CRASH	gen=786 glyphs=3
2026-03-14T07:36:45.644247	099964a4	0	0	0.0000	CRASH	gen=786 glyphs=4
2026-03-14T07:36:45.644439	099964a4	0	0	0.0000	CRASH	gen=786 glyphs=4
2026-03-14T07:36:45.644638	099964a4	0	0	0.0000	CRASH	gen=786 glyphs=4
2026-03-14T07:36:45.644830	099964a4	0	0	0.0000	CRASH	gen=786 glyphs=4
2026-03-14T07:36:45.645023	70944f51	0	0	0.0000	CRASH	gen=786 glyphs=4
2026-03-14T07:36:45.645220	099964a4	0	0	0.0000	CRASH	gen=786 glyphs=4
2026-03-14T07:36:45.645415	099964a4	0	0	0.0000	CRASH	gen=786 glyphs=4
2026-03-14T07:36:45.645694	099964a4	0	0	0.0000	CRASH	gen=787 glyphs=4
2026-03-14T07:36:45.645891	099964a4	0	0	0.0000	CRASH	gen=787 glyphs=4
2026-03-14T07:36:45.646087	7a3093ec	0	0	0.0000	CRASH	gen=787 glyphs=1
2026-03-14T07:36:45.646281	099964a4	0	0	0.0000	CRASH	gen=787 glyphs=4
2026-03-14T07:36:45.646474	099964a4	0	0	0.0000	CRASH	gen=787 glyphs=4
2026-03-14T07:36:45.646673	35e15999	0	0	0.0000	CRASH	gen=787 glyphs=2
2026-03-14T07:36:45.646870	099964a4	0	0	0.0000	CRASH	gen=787 glyphs=4
2026-03-14T07:36:45.647065	7ede4765	0	0	0.0000	CRASH	gen=787 glyphs=2
2026-03-14T07:36:45.647262	2aaa9efc	0	0	0.0000	CRASH	gen=787 glyphs=4
2026-03-14T07:36:45.647457	80fc640d	0	0	0.0000	CRASH	gen=787 glyphs=3
2026-03-14T07:36:45.647738	099964a4	0	0	0.0000	CRASH	gen=788 glyphs=4
2026-03-14T07:36:45.647933	099964a4	0	0	0.0000	CRASH	gen=788 glyphs=4
2026-03-14T07:36:45.648127	d7edd62c	0	0	0.0000	CRASH	gen=788 glyphs=4
2026-03-14T07:36:45.648321	099964a4	0	0	0.0000	CRASH	gen=788 glyphs=4
2026-03-14T07:36:45.648513	099964a4	0	0	0.0000	CRASH	gen=788 glyphs=4
2026-03-14T07:36:45.648705	099964a4	0	0	0.0000	CRASH	gen=788 glyphs=4
2026-03-14T07:36:45.648900	3a734398	0	0	0.0000	CRASH	gen=788 glyphs=4
2026-03-14T07:36:45.649094	80cef82b	0	0	0.0000	CRASH	gen=788 glyphs=4
2026-03-14T07:36:45.649287	099964a4	0	0	0.0000	CRASH	gen=788 glyphs=4
2026-03-14T07:36:45.649476	099964a4	0	0	0.0000	CRASH	gen=788 glyphs=4
2026-03-14T07:36:45.649756	099964a4	0	0	0.0000	CRASH	gen=789 glyphs=4
2026-03-14T07:36:45.649955	099964a4	0	0	0.0000	CRASH	gen=789 glyphs=4
2026-03-14T07:36:45.650148	099964a4	0	0	0.0000	CRASH	gen=789 glyphs=4
2026-03-14T07:36:45.650339	dcb1fb50	0	0	0.0000	CRASH	gen=789 glyphs=4
2026-03-14T07:36:45.650535	099964a4	0	0	0.0000	CRASH	gen=789 glyphs=4
2026-03-14T07:36:45.650728	099964a4	0	0	0.0000	CRASH	gen=789 glyphs=4
2026-03-14T07:36:45.650921	099964a4	0	0	0.0000	CRASH	gen=789 glyphs=4
2026-03-14T07:36:45.651114	099964a4	0	0	0.0000	CRASH	gen=789 glyphs=4
2026-03-14T07:36:45.651308	3c70422b	0	0	0.0000	CRASH	gen=789 glyphs=4
2026-03-14T07:36:45.651503	099964a4	0	0	0.0000	CRASH	gen=789 glyphs=4
2026-03-14T07:36:45.651781	099964a4	0	0	0.0000	CRASH	gen=790 glyphs=4
2026-03-14T07:36:45.651979	099964a4	0	0	0.0000	CRASH	gen=790 glyphs=4
2026-03-14T07:36:45.652177	099964a4	0	0	0.0000	CRASH	gen=790 glyphs=4
2026-03-14T07:36:45.652373	099964a4	0	0	0.0000	CRASH	gen=790 glyphs=4
2026-03-14T07:36:45.652571	099964a4	0	0	0.0000	CRASH	gen=790 glyphs=4
2026-03-14T07:36:45.652765	dcb1fb50	0	0	0.0000	CRASH	gen=790 glyphs=4
2026-03-14T07:36:45.652961	099964a4	0	0	0.0000	CRASH	gen=790 glyphs=4
2026-03-14T07:36:45.653160	c9945d89	0	0	0.0000	CRASH	gen=790 glyphs=4
2026-03-14T07:36:45.653357	099964a4	0	0	0.0000	CRASH	gen=790 glyphs=4
2026-03-14T07:36:45.653553	3a734398	0	0	0.0000	CRASH	gen=790 glyphs=4
2026-03-14T07:36:45.653834	099964a4	0	0	0.0000	CRASH	gen=791 glyphs=4
2026-03-14T07:36:45.654028	099964a4	0	0	0.0000	CRASH	gen=791 glyphs=4
2026-03-14T07:36:45.654226	5d4b362e	0	0	0.0000	CRASH	gen=791 glyphs=4
2026-03-14T07:36:45.654421	099964a4	0	0	0.0000	CRASH	gen=791 glyphs=4
2026-03-14T07:36:45.654617	099964a4	0	0	0.0000	CRASH	gen=791 glyphs=4
2026-03-14T07:36:45.654808	ff30496a	0	0	0.0000	CRASH	gen=791 glyphs=3
2026-03-14T07:36:45.655000	3a734398	0	0	0.0000	CRASH	gen=791 glyphs=4
2026-03-14T07:36:45.655194	756713f9	0	0	0.0000	CRASH	gen=791 glyphs=2
2026-03-14T07:36:45.655389	e171e946	0	0	0.0000	CRASH	gen=791 glyphs=4
2026-03-14T07:36:45.655584	099964a4	0	0	0.0000	CRASH	gen=791 glyphs=4
2026-03-14T07:36:45.655860	099964a4	0	0	0.0000	CRASH	gen=792 glyphs=4
2026-03-14T07:36:45.656057	099964a4	0	0	0.0000	CRASH	gen=792 glyphs=4
2026-03-14T07:36:45.656257	30a5fbbf	0	0	0.0000	CRASH	gen=792 glyphs=4
2026-03-14T07:36:45.656452	099964a4	0	0	0.0000	CRASH	gen=792 glyphs=4
2026-03-14T07:36:45.656649	099964a4	0	0	0.0000	CRASH	gen=792 glyphs=4
2026-03-14T07:36:45.656840	f04c79b1	0	0	0.0000	CRASH	gen=792 glyphs=4
2026-03-14T07:36:45.657034	bd0a3e7e	0	0	0.0000	CRASH	gen=792 glyphs=4
2026-03-14T07:36:45.657229	364d12ea	0	0	0.0000	CRASH	gen=792 glyphs=4
2026-03-14T07:36:45.657428	62918113	0	0	0.0000	CRASH	gen=792 glyphs=3
2026-03-14T07:36:45.657623	099964a4	0	0	0.0000	CRASH	gen=792 glyphs=4
2026-03-14T07:36:45.657891	099964a4	0	0	0.0000	CRASH	gen=793 glyphs=4
2026-03-14T07:36:45.658085	099964a4	0	0	0.0000	CRASH	gen=793 glyphs=4
2026-03-14T07:36:45.658278	9ca39885	0	0	0.0000	CRASH	gen=793 glyphs=3
2026-03-14T07:36:45.658474	a0c845fb	0	0	0.0000	CRASH	gen=793 glyphs=4
2026-03-14T07:36:45.658669	099964a4	0	0	0.0000	CRASH	gen=793 glyphs=4
2026-03-14T07:36:45.658861	5218b1ff	0	0	0.0000	CRASH	gen=793 glyphs=3
2026-03-14T07:36:45.659054	3ca14993	0	0	0.0000	CRASH	gen=793 glyphs=4
2026-03-14T07:36:45.659246	099964a4	0	0	0.0000	CRASH	gen=793 glyphs=4
2026-03-14T07:36:45.659445	099964a4	0	0	0.0000	CRASH	gen=793 glyphs=4
2026-03-14T07:36:45.659640	099964a4	0	0	0.0000	CRASH	gen=793 glyphs=4
2026-03-14T07:36:45.659926	099964a4	0	0	0.0000	CRASH	gen=794 glyphs=4
2026-03-14T07:36:45.660122	099964a4	0	0	0.0000	CRASH	gen=794 glyphs=4
2026-03-14T07:36:45.660314	2659dd30	0	0	0.0000	CRASH	gen=794 glyphs=4
2026-03-14T07:36:45.660512	470f8426	0	0	0.0000	CRASH	gen=794 glyphs=4
2026-03-14T07:36:45.660710	099964a4	0	0	0.0000	CRASH	gen=794 glyphs=4
2026-03-14T07:36:45.660903	099964a4	0	0	0.0000	CRASH	gen=794 glyphs=4
2026-03-14T07:36:45.661095	099964a4	0	0	0.0000	CRASH	gen=794 glyphs=4
2026-03-14T07:36:45.661287	8da1f8d8	0	0	0.0000	CRASH	gen=794 glyphs=4
2026-03-14T07:36:45.661481	80cef82b	0	0	0.0000	CRASH	gen=794 glyphs=4
2026-03-14T07:36:45.661687	099964a4	0	0	0.0000	CRASH	gen=794 glyphs=4
2026-03-14T07:36:45.661961	099964a4	0	0	0.0000	CRASH	gen=795 glyphs=4
2026-03-14T07:36:45.662154	099964a4	0	0	0.0000	CRASH	gen=795 glyphs=4
2026-03-14T07:36:45.662346	d476cae5	0	0	0.0000	CRASH	gen=795 glyphs=4
2026-03-14T07:36:45.662542	80cef82b	0	0	0.0000	CRASH	gen=795 glyphs=4
2026-03-14T07:36:45.662741	7ede4765	0	0	0.0000	CRASH	gen=795 glyphs=2
