timestamp	program_hash	spirv_size	word_count	fitness	status	description
2026-03-14T00:21:42.545414	09c11fc5	116	29	1.0000	DISCARD	gen=271 glyphs=4
2026-03-14T00:21:42.812753	0941d5e3	120	30	1.0000	DISCARD	gen=315 glyphs=4
2026-03-14T00:21:45.319220	5a06ca32	120	30	1.0000	DISCARD	gen=271 glyphs=4
2026-03-14T00:21:45.592927	9cf378b3	116	29	1.0000	DISCARD	gen=315 glyphs=4
2026-03-14T00:21:48.070388	fdb5d108	120	30	1.0000	DISCARD	gen=271 glyphs=4
2026-03-14T00:21:48.348237	a78f9454	120	30	1.0000	DISCARD	gen=315 glyphs=4
2026-03-14T00:21:50.864886	fdb5d108	120	30	1.0000	DISCARD	gen=271 glyphs=4
2026-03-14T00:21:51.141537	8aef8872	116	29	1.0000	DISCARD	gen=315 glyphs=4
2026-03-14T00:21:53.646303	a7e2e9dc	116	29	1.0000	DISCARD	gen=271 glyphs=4
2026-03-14T00:21:53.925342	cd6f1aab	116	29	1.0000	DISCARD	gen=315 glyphs=4
2026-03-14T00:21:56.378221	37f4017b	116	29	1.0000	DISCARD	gen=272 glyphs=4
2026-03-14T00:21:56.648746	8aef8872	116	29	1.0000	DISCARD	gen=315 glyphs=4
2026-03-14T00:21:59.081884	bfdf7cad	120	30	1.0000	DISCARD	gen=272 glyphs=4
2026-03-14T00:21:59.354752	19355583	120	30	1.0000	DISCARD	gen=316 glyphs=4
2026-03-14T00:22:01.813421	5a06ca32	120	30	1.0000	DISCARD	gen=272 glyphs=4
2026-03-14T00:22:02.080223	8aef8872	116	29	1.0000	DISCARD	gen=316 glyphs=4
2026-03-14T00:22:04.561217	37f4017b	116	29	1.0000	DISCARD	gen=272 glyphs=4
2026-03-14T00:22:04.833743	875e0f8a	116	29	1.0000	DISCARD	gen=316 glyphs=4
2026-03-14T00:22:07.298338	37f4017b	116	29	1.0000	DISCARD	gen=272 glyphs=4
2026-03-14T00:22:07.573397	339c3250	120	30	1.0000	DISCARD	gen=316 glyphs=4
2026-03-14T00:22:10.029719	55d6c151	120	30	1.0000	DISCARD	gen=272 glyphs=4
2026-03-14T00:22:10.300196	d7c8681b	120	30	1.0000	DISCARD	gen=316 glyphs=4
2026-03-14T00:22:12.768777	37f4017b	116	29	1.0000	DISCARD	gen=272 glyphs=4
2026-03-14T00:22:13.043044	0eaedb57	116	29	1.0000	DISCARD	gen=316 glyphs=4
2026-03-14T00:22:15.503064	5a06ca32	120	30	1.0000	DISCARD	gen=272 glyphs=4
2026-03-14T00:22:15.776956	ae44ace5	116	29	1.0000	DISCARD	gen=316 glyphs=4
2026-03-14T00:22:18.250782	331a49f9	120	30	1.0000	DISCARD	gen=272 glyphs=4
2026-03-14T00:22:18.524303	1641920d	116	29	1.0000	DISCARD	gen=316 glyphs=4
2026-03-14T00:22:20.957271	5a06ca32	120	30	1.0000	DISCARD	gen=272 glyphs=4
2026-03-14T00:22:21.225816	875e0f8a	116	29	1.0000	DISCARD	gen=316 glyphs=4
2026-03-14T00:22:23.784892	37f4017b	116	29	1.0000	DISCARD	gen=273 glyphs=4
2026-03-14T00:22:24.061744	8aef8872	116	29	1.0000	DISCARD	gen=316 glyphs=4
2026-03-14T00:22:26.512825	bfdf7cad	120	30	1.0000	DISCARD	gen=273 glyphs=4
2026-03-14T00:22:26.792548	19355583	120	30	1.0000	DISCARD	gen=317 glyphs=4
2026-03-14T00:22:29.248775	37f4017b	116	29	1.0000	DISCARD	gen=273 glyphs=4
2026-03-14T00:22:29.507015	8aef8872	116	29	1.0000	DISCARD	gen=317 glyphs=4
2026-03-14T00:22:31.977540	88622161	120	30	1.0000	DISCARD	gen=273 glyphs=4
2026-03-14T00:22:32.244618	85f567ae	116	29	1.0000	DISCARD	gen=317 glyphs=4
2026-03-14T00:22:34.714721	6d3b73ff	120	30	1.0000	DISCARD	gen=273 glyphs=4
2026-03-14T00:22:34.994823	cc02404c	124	31	0.9500	DISCARD	gen=317 glyphs=4
2026-03-14T00:22:37.441648	37f4017b	116	29	1.0000	DISCARD	gen=273 glyphs=4
2026-03-14T00:22:37.719869	58565a38	116	29	1.0000	DISCARD	gen=317 glyphs=4
2026-03-14T00:22:40.173966	37f4017b	116	29	1.0000	DISCARD	gen=273 glyphs=4
2026-03-14T00:22:40.446153	819b31b0	116	29	1.0000	DISCARD	gen=317 glyphs=4
2026-03-14T00:22:42.907344	3c91a07b	120	30	1.0000	DISCARD	gen=273 glyphs=4
2026-03-14T00:22:43.186413	d7c8681b	120	30	1.0000	DISCARD	gen=317 glyphs=4
2026-03-14T00:22:45.635267	7af6c379	116	29	1.0000	DISCARD	gen=273 glyphs=4
2026-03-14T00:22:45.917445	0eaedb57	116	29	1.0000	DISCARD	gen=317 glyphs=4
2026-03-14T00:22:48.374575	5a06ca32	120	30	1.0000	DISCARD	gen=273 glyphs=4
2026-03-14T00:22:48.634815	a78f9454	120	30	1.0000	DISCARD	gen=317 glyphs=4
2026-03-14T00:22:51.093628	37f4017b	116	29	1.0000	DISCARD	gen=274 glyphs=4
2026-03-14T00:22:51.374805	7a3adabc	116	29	1.0000	DISCARD	gen=317 glyphs=4
2026-03-14T00:22:53.820630	bfdf7cad	120	30	1.0000	DISCARD	gen=274 glyphs=4
2026-03-14T00:22:54.092274	19355583	120	30	1.0000	DISCARD	gen=318 glyphs=4
2026-03-14T00:22:56.651797	ffe8c96b	116	29	0.9500	DISCARD	gen=274 glyphs=4
2026-03-14T00:22:56.923826	8aef8872	116	29	1.0000	DISCARD	gen=318 glyphs=4
2026-03-14T00:22:59.407627	37f4017b	116	29	1.0000	DISCARD	gen=274 glyphs=4
2026-03-14T00:22:59.683515	d7c8681b	120	30	1.0000	DISCARD	gen=318 glyphs=4
2026-03-14T00:23:02.143324	12b38c2d	116	29	1.0000	DISCARD	gen=274 glyphs=4
2026-03-14T00:23:02.414193	8aef8872	116	29	1.0000	DISCARD	gen=318 glyphs=4
2026-03-14T00:23:04.884973	5a06ca32	120	30	1.0000	DISCARD	gen=274 glyphs=4
2026-03-14T00:23:05.158919	67cb81be	120	30	1.0000	DISCARD	gen=318 glyphs=4
2026-03-14T00:23:07.645405	ea357cda	120	30	1.0000	DISCARD	gen=274 glyphs=4
2026-03-14T00:23:07.915923	8aef8872	116	29	1.0000	DISCARD	gen=318 glyphs=4
2026-03-14T00:23:10.400499	fdb5d108	120	30	1.0000	DISCARD	gen=274 glyphs=4
2026-03-14T00:23:10.681592	9e34ede0	116	29	1.0000	DISCARD	gen=318 glyphs=4
2026-03-14T00:23:13.157175	37f4017b	116	29	1.0000	DISCARD	gen=274 glyphs=4
2026-03-14T00:23:13.438882	19355583	120	30	1.0000	DISCARD	gen=318 glyphs=4
2026-03-14T00:23:15.890225	8f3150fe	116	29	1.0000	DISCARD	gen=274 glyphs=4
2026-03-14T00:23:16.167373	663d679f	116	29	0.9500	DISCARD	gen=318 glyphs=4
2026-03-14T00:23:18.612065	37f4017b	116	29	1.0000	DISCARD	gen=275 glyphs=4
2026-03-14T00:23:18.892546	050862ad	120	30	1.0000	DISCARD	gen=318 glyphs=4
2026-03-14T00:23:21.334286	bfdf7cad	120	30	1.0000	DISCARD	gen=275 glyphs=4
2026-03-14T00:23:21.610446	19355583	120	30	1.0000	DISCARD	gen=319 glyphs=4
2026-03-14T00:23:24.085153	f28ac866	116	29	1.0000	DISCARD	gen=275 glyphs=4
2026-03-14T00:23:24.360214	8aef8872	116	29	1.0000	DISCARD	gen=319 glyphs=4
2026-03-14T00:23:26.847318	5a06ca32	120	30	1.0000	DISCARD	gen=275 glyphs=4
2026-03-14T00:23:27.137274	50dc991d	116	29	1.0000	DISCARD	gen=319 glyphs=4
2026-03-14T00:23:29.607996	d3b6fcfa	120	30	1.0000	DISCARD	gen=275 glyphs=4
2026-03-14T00:23:29.885913	4fd33b24	116	29	1.0000	DISCARD	gen=319 glyphs=4
2026-03-14T00:23:32.335777	a67471c9	120	30	1.0000	DISCARD	gen=275 glyphs=4
2026-03-14T00:23:32.617806	19355583	120	30	1.0000	DISCARD	gen=319 glyphs=4
2026-03-14T00:23:35.062059	37f4017b	116	29	1.0000	DISCARD	gen=275 glyphs=4
2026-03-14T00:23:35.344914	b57e7176	120	30	1.0000	DISCARD	gen=319 glyphs=4
2026-03-14T00:23:37.821165	a93c4fdd	116	29	1.0000	DISCARD	gen=275 glyphs=4
2026-03-14T00:23:38.085328	b7aed8e9	116	29	1.0000	DISCARD	gen=319 glyphs=4
2026-03-14T00:23:40.567078	8c861a18	116	29	1.0000	DISCARD	gen=275 glyphs=4
2026-03-14T00:23:40.852430	0eaedb57	116	29	1.0000	DISCARD	gen=319 glyphs=4
2026-03-14T00:23:43.323537	5b9807ac	120	30	1.0000	DISCARD	gen=275 glyphs=4
2026-03-14T00:23:43.597111	2d982fc6	120	30	1.0000	DISCARD	gen=319 glyphs=4
2026-03-14T00:23:46.060851	37f4017b	116	29	1.0000	DISCARD	gen=276 glyphs=4
2026-03-14T00:23:46.335028	67cb81be	120	30	1.0000	DISCARD	gen=319 glyphs=4
2026-03-14T00:23:48.822604	bfdf7cad	120	30	1.0000	DISCARD	gen=276 glyphs=4
2026-03-14T00:23:49.095208	19355583	120	30	1.0000	DISCARD	gen=320 glyphs=4
2026-03-14T00:23:51.560410	4c9b0dd4	120	30	1.0000	DISCARD	gen=276 glyphs=4
2026-03-14T00:23:51.843245	8aef8872	116	29	1.0000	DISCARD	gen=320 glyphs=4
2026-03-14T00:23:54.301095	5a06ca32	120	30	1.0000	DISCARD	gen=276 glyphs=4
2026-03-14T00:23:54.573279	a1b62a6a	120	30	1.0000	DISCARD	gen=320 glyphs=4
2026-03-14T00:23:57.067784	37f4017b	116	29	1.0000	DISCARD	gen=276 glyphs=4
2026-03-14T00:23:57.340144	0eaedb57	116	29	1.0000	DISCARD	gen=320 glyphs=4
2026-03-14T00:23:59.901785	d8ad0f94	120	30	1.0000	DISCARD	gen=276 glyphs=4
2026-03-14T00:24:00.176169	0eaedb57	116	29	1.0000	DISCARD	gen=320 glyphs=4
2026-03-14T00:24:02.661047	fdb5d108	120	30	1.0000	DISCARD	gen=276 glyphs=4
2026-03-14T00:24:02.933496	a78f9454	120	30	1.0000	DISCARD	gen=320 glyphs=4
2026-03-14T00:24:05.400324	55d6c151	120	30	1.0000	DISCARD	gen=276 glyphs=4
2026-03-14T00:24:05.676629	0eaedb57	116	29	1.0000	DISCARD	gen=320 glyphs=4
2026-03-14T00:24:08.177567	d11c1062	120	30	1.0000	DISCARD	gen=276 glyphs=4
2026-03-14T00:24:08.450284	e8c7f6cf	120	30	1.0000	DISCARD	gen=320 glyphs=4
2026-03-14T00:24:10.935607	5a06ca32	120	30	1.0000	DISCARD	gen=276 glyphs=4
2026-03-14T00:24:11.230291	67cb81be	120	30	1.0000	DISCARD	gen=320 glyphs=4
2026-03-14T00:24:13.708257	37f4017b	116	29	1.0000	DISCARD	gen=277 glyphs=4
2026-03-14T00:24:13.995392	19355583	120	30	1.0000	DISCARD	gen=320 glyphs=4
2026-03-14T00:24:16.476167	bfdf7cad	120	30	1.0000	DISCARD	gen=277 glyphs=4
2026-03-14T00:24:16.753745	19355583	120	30	1.0000	DISCARD	gen=321 glyphs=4
2026-03-14T00:24:19.214894	fdb5d108	120	30	1.0000	DISCARD	gen=277 glyphs=4
2026-03-14T00:24:19.494657	8aef8872	116	29	1.0000	DISCARD	gen=321 glyphs=4
2026-03-14T00:24:21.966736	37f4017b	116	29	1.0000	DISCARD	gen=277 glyphs=4
2026-03-14T00:24:22.243432	5dd83ab7	116	29	1.0000	DISCARD	gen=321 glyphs=4
2026-03-14T00:24:24.717606	bfdf7cad	120	30	1.0000	DISCARD	gen=277 glyphs=4
2026-03-14T00:24:24.982360	875e0f8a	116	29	1.0000	DISCARD	gen=321 glyphs=4
2026-03-14T00:24:27.450854	ad7dd0c2	120	30	0.9500	DISCARD	gen=277 glyphs=4
2026-03-14T00:24:27.727800	e2cd28ea	120	30	1.0000	DISCARD	gen=321 glyphs=4
2026-03-14T00:24:30.261007	4c9b0dd4	120	30	1.0000	DISCARD	gen=277 glyphs=4
2026-03-14T00:24:30.544712	b7aed8e9	116	29	1.0000	DISCARD	gen=321 glyphs=4
2026-03-14T00:24:33.034655	5a06ca32	120	30	1.0000	DISCARD	gen=277 glyphs=4
2026-03-14T00:24:33.315280	0eaedb57	116	29	1.0000	DISCARD	gen=321 glyphs=4
2026-03-14T00:24:35.779683	5a06ca32	120	30	1.0000	DISCARD	gen=277 glyphs=4
2026-03-14T00:24:36.053253	95a92cea	116	29	1.0000	DISCARD	gen=321 glyphs=4
2026-03-14T00:24:38.522527	1d34459a	116	29	1.0000	DISCARD	gen=277 glyphs=4
2026-03-14T00:24:38.805732	050862ad	120	30	1.0000	DISCARD	gen=321 glyphs=4
2026-03-14T00:24:41.273311	37f4017b	116	29	1.0000	DISCARD	gen=278 glyphs=4
2026-03-14T00:24:41.538949	0eaedb57	116	29	1.0000	DISCARD	gen=321 glyphs=4
2026-03-14T00:24:44.010176	bfdf7cad	120	30	1.0000	DISCARD	gen=278 glyphs=4
2026-03-14T00:24:44.274593	19355583	120	30	1.0000	DISCARD	gen=322 glyphs=4
2026-03-14T00:24:46.738084	71e2ba66	116	29	1.0000	DISCARD	gen=278 glyphs=4
2026-03-14T00:24:47.013060	8aef8872	116	29	1.0000	DISCARD	gen=322 glyphs=4
2026-03-14T00:24:49.475284	5a06ca32	120	30	1.0000	DISCARD	gen=278 glyphs=4
2026-03-14T00:24:49.733172	e2cd28ea	120	30	1.0000	DISCARD	gen=322 glyphs=4
2026-03-14T00:24:52.217429	fdb5d108	120	30	1.0000	DISCARD	gen=278 glyphs=4
2026-03-14T00:24:52.490376	e8c7f6cf	120	30	1.0000	DISCARD	gen=322 glyphs=4
2026-03-14T00:24:54.969226	5a06ca32	120	30	1.0000	DISCARD	gen=278 glyphs=4
2026-03-14T00:24:55.241506	1e5f0e21	116	29	1.0000	DISCARD	gen=322 glyphs=4
2026-03-14T00:24:57.750242	5a06ca32	120	30	1.0000	DISCARD	gen=278 glyphs=4
2026-03-14T00:24:58.021957	fde121d8	116	29	1.0000	DISCARD	gen=322 glyphs=4
2026-03-14T00:25:00.483940	37f4017b	116	29	1.0000	DISCARD	gen=278 glyphs=4
2026-03-14T00:25:00.760329	0eaedb57	116	29	1.0000	DISCARD	gen=322 glyphs=4
2026-03-14T00:25:03.341216	5a06ca32	120	30	1.0000	DISCARD	gen=278 glyphs=4
2026-03-14T00:25:03.634251	19355583	120	30	1.0000	DISCARD	gen=322 glyphs=4
2026-03-14T00:25:06.092380	5a06ca32	120	30	1.0000	DISCARD	gen=278 glyphs=4
2026-03-14T00:25:06.373493	d7c8681b	120	30	1.0000	DISCARD	gen=322 glyphs=4
2026-03-14T00:25:08.852206	37f4017b	116	29	1.0000	DISCARD	gen=279 glyphs=4
2026-03-14T00:25:09.131226	67cb81be	120	30	1.0000	DISCARD	gen=322 glyphs=4
2026-03-14T00:25:11.584049	bfdf7cad	120	30	1.0000	DISCARD	gen=279 glyphs=4
2026-03-14T00:25:11.850650	19355583	120	30	1.0000	DISCARD	gen=323 glyphs=4
2026-03-14T00:25:14.298119	1502125f	116	29	1.0000	DISCARD	gen=279 glyphs=4
2026-03-14T00:25:14.591428	8aef8872	116	29	1.0000	DISCARD	gen=323 glyphs=4
2026-03-14T00:25:17.043883	5a06ca32	120	30	1.0000	DISCARD	gen=279 glyphs=4
2026-03-14T00:25:17.332816	e571a2ae	120	30	1.0000	DISCARD	gen=323 glyphs=4
2026-03-14T00:25:19.800465	5a06ca32	120	30	1.0000	DISCARD	gen=279 glyphs=4
2026-03-14T00:25:20.074889	8aef8872	116	29	1.0000	DISCARD	gen=323 glyphs=4
2026-03-14T00:25:22.543138	53f85763	116	29	1.0000	DISCARD	gen=279 glyphs=4
2026-03-14T00:25:22.823099	8aef8872	116	29	1.0000	DISCARD	gen=323 glyphs=4
2026-03-14T00:25:25.287664	55d6c151	120	30	1.0000	DISCARD	gen=279 glyphs=4
2026-03-14T00:25:25.581630	8aef8872	116	29	1.0000	DISCARD	gen=323 glyphs=4
2026-03-14T00:25:28.043738	7ca87b42	116	29	1.0000	DISCARD	gen=279 glyphs=4
2026-03-14T00:25:28.307653	875e0f8a	116	29	1.0000	DISCARD	gen=323 glyphs=4
2026-03-14T00:25:30.775772	a215ae88	116	29	1.0000	DISCARD	gen=279 glyphs=4
2026-03-14T00:25:31.047553	8aef8872	116	29	1.0000	DISCARD	gen=323 glyphs=4
2026-03-14T00:25:33.590727	7b9b9014	116	29	0.9500	DISCARD	gen=279 glyphs=4
2026-03-14T00:25:33.856902	e2cd28ea	120	30	1.0000	DISCARD	gen=323 glyphs=4
2026-03-14T00:25:36.364055	37f4017b	116	29	1.0000	DISCARD	gen=280 glyphs=4
2026-03-14T00:25:36.626936	8aef8872	116	29	1.0000	DISCARD	gen=323 glyphs=4
2026-03-14T00:25:39.095200	bfdf7cad	120	30	1.0000	DISCARD	gen=280 glyphs=4
2026-03-14T00:25:39.371793	19355583	120	30	1.0000	DISCARD	gen=324 glyphs=4
2026-03-14T00:25:41.813774	2701cb73	116	29	1.0000	DISCARD	gen=280 glyphs=4
2026-03-14T00:25:42.091576	8aef8872	116	29	1.0000	DISCARD	gen=324 glyphs=4
2026-03-14T00:25:44.549278	f875596c	120	30	1.0000	DISCARD	gen=280 glyphs=4
2026-03-14T00:25:44.837433	8f8a80eb	124	31	0.9500	DISCARD	gen=324 glyphs=4
2026-03-14T00:25:47.319536	af9f2347	120	30	1.0000	DISCARD	gen=280 glyphs=4
2026-03-14T00:25:47.593145	19355583	120	30	1.0000	DISCARD	gen=324 glyphs=4
2026-03-14T00:25:50.040089	fdb5d108	120	30	1.0000	DISCARD	gen=280 glyphs=4
2026-03-14T00:25:50.306438	b57e7176	120	30	1.0000	DISCARD	gen=324 glyphs=4
2026-03-14T00:25:52.758266	37f4017b	116	29	1.0000	DISCARD	gen=280 glyphs=4
2026-03-14T00:25:53.030678	8aef8872	116	29	1.0000	DISCARD	gen=324 glyphs=4
2026-03-14T00:25:55.512481	71e2ba66	116	29	1.0000	DISCARD	gen=280 glyphs=4
2026-03-14T00:25:55.780407	0cbf272f	116	29	1.0000	DISCARD	gen=324 glyphs=4
2026-03-14T00:25:58.223175	55d6c151	120	30	1.0000	DISCARD	gen=280 glyphs=4
2026-03-14T00:25:58.498324	301dd759	120	30	1.0000	DISCARD	gen=324 glyphs=4
2026-03-14T00:26:00.951044	5a06ca32	120	30	1.0000	DISCARD	gen=280 glyphs=4
2026-03-14T00:26:01.245139	8aef8872	116	29	1.0000	DISCARD	gen=324 glyphs=4
2026-03-14T00:26:03.716974	37f4017b	116	29	1.0000	DISCARD	gen=281 glyphs=4
2026-03-14T00:26:03.991212	d02f3b84	124	31	0.9500	DISCARD	gen=324 glyphs=4
2026-03-14T00:26:06.563346	bfdf7cad	120	30	1.0000	DISCARD	gen=281 glyphs=4
2026-03-14T00:26:06.844949	19355583	120	30	1.0000	DISCARD	gen=325 glyphs=4
2026-03-14T00:26:09.299092	12b38c2d	116	29	1.0000	DISCARD	gen=281 glyphs=4
2026-03-14T00:26:09.574417	8aef8872	116	29	1.0000	DISCARD	gen=325 glyphs=4
2026-03-14T00:26:12.034980	71e2ba66	116	29	1.0000	DISCARD	gen=281 glyphs=4
2026-03-14T00:26:12.304021	67cb81be	120	30	1.0000	DISCARD	gen=325 glyphs=4
2026-03-14T00:26:14.742324	63a47af8	120	30	1.0000	DISCARD	gen=281 glyphs=4
2026-03-14T00:26:15.023614	050862ad	120	30	1.0000	DISCARD	gen=325 glyphs=4
2026-03-14T00:26:17.463872	5a06ca32	120	30	1.0000	DISCARD	gen=281 glyphs=4
2026-03-14T00:26:17.740397	b7aed8e9	116	29	1.0000	DISCARD	gen=325 glyphs=4
2026-03-14T00:26:20.184018	55d6c151	120	30	1.0000	DISCARD	gen=281 glyphs=4
2026-03-14T00:26:20.458815	0eaedb57	116	29	1.0000	DISCARD	gen=325 glyphs=4
2026-03-14T00:26:22.939826	7ca87b42	116	29	1.0000	DISCARD	gen=281 glyphs=4
2026-03-14T00:26:23.221943	56af9c9f	120	30	1.0000	DISCARD	gen=325 glyphs=4
2026-03-14T00:26:25.706921	1d34459a	116	29	1.0000	DISCARD	gen=281 glyphs=4
2026-03-14T00:26:25.978700	8aef8872	116	29	1.0000	DISCARD	gen=325 glyphs=4
2026-03-14T00:26:28.422396	55d6c151	120	30	1.0000	DISCARD	gen=281 glyphs=4
2026-03-14T00:26:28.704109	b57e7176	120	30	1.0000	DISCARD	gen=325 glyphs=4
2026-03-14T00:26:31.163134	37f4017b	116	29	1.0000	DISCARD	gen=282 glyphs=4
2026-03-14T00:26:31.438098	eca7ab6c	116	29	1.0000	DISCARD	gen=325 glyphs=4
2026-03-14T00:26:33.868073	bfdf7cad	120	30	1.0000	DISCARD	gen=282 glyphs=4
2026-03-14T00:26:34.127486	19355583	120	30	1.0000	DISCARD	gen=326 glyphs=4
2026-03-14T00:26:36.589821	5b9807ac	120	30	1.0000	DISCARD	gen=282 glyphs=4
2026-03-14T00:26:36.881678	8aef8872	116	29	1.0000	DISCARD	gen=326 glyphs=4
2026-03-14T00:26:39.378405	1d34459a	116	29	1.0000	DISCARD	gen=282 glyphs=4
2026-03-14T00:26:39.649247	0eaedb57	116	29	1.0000	DISCARD	gen=326 glyphs=4
2026-03-14T00:26:42.121907	bfdf7cad	120	30	1.0000	DISCARD	gen=282 glyphs=4
2026-03-14T00:26:42.395438	15d96668	124	31	0.9500	DISCARD	gen=326 glyphs=4
2026-03-14T00:26:44.850244	37f4017b	116	29	1.0000	DISCARD	gen=282 glyphs=4
2026-03-14T00:26:45.131783	1e5f0e21	116	29	1.0000	DISCARD	gen=326 glyphs=4
2026-03-14T00:26:47.580460	4c9b0dd4	120	30	1.0000	DISCARD	gen=282 glyphs=4
2026-03-14T00:26:47.848465	15053dcf	116	29	1.0000	DISCARD	gen=326 glyphs=4
2026-03-14T00:26:50.298357	37f4017b	116	29	1.0000	DISCARD	gen=282 glyphs=4
2026-03-14T00:26:50.575341	e8c7f6cf	120	30	1.0000	DISCARD	gen=326 glyphs=4
2026-03-14T00:26:53.055208	031b8481	120	30	1.0000	DISCARD	gen=282 glyphs=4
2026-03-14T00:26:53.321815	f43933fa	120	30	1.0000	DISCARD	gen=326 glyphs=4
2026-03-14T00:26:55.805748	2f1ad2d0	120	30	1.0000	DISCARD	gen=282 glyphs=4
2026-03-14T00:26:56.093563	19355583	120	30	1.0000	DISCARD	gen=326 glyphs=4
2026-03-14T00:26:58.537276	37f4017b	116	29	1.0000	DISCARD	gen=283 glyphs=4
2026-03-14T00:26:58.813336	d2cca5a3	120	30	0.9500	DISCARD	gen=326 glyphs=4
2026-03-14T00:27:01.273009	bfdf7cad	120	30	1.0000	DISCARD	gen=283 glyphs=4
2026-03-14T00:27:01.545492	19355583	120	30	1.0000	DISCARD	gen=327 glyphs=4
2026-03-14T00:27:04.021550	fdb5d108	120	30	1.0000	DISCARD	gen=283 glyphs=4
2026-03-14T00:27:04.296352	8aef8872	116	29	1.0000	DISCARD	gen=327 glyphs=4
2026-03-14T00:27:06.747099	cb4d3de0	116	29	1.0000	DISCARD	gen=283 glyphs=4
2026-03-14T00:27:07.028693	9d1880ca	116	29	1.0000	DISCARD	gen=327 glyphs=4
2026-03-14T00:27:09.581182	e874d93d	116	29	1.0000	DISCARD	gen=283 glyphs=4
2026-03-14T00:27:09.863999	8aef8872	116	29	1.0000	DISCARD	gen=327 glyphs=4
2026-03-14T00:27:12.338351	5a06ca32	120	30	1.0000	DISCARD	gen=283 glyphs=4
2026-03-14T00:27:12.607408	5a61a59b	116	29	1.0000	DISCARD	gen=327 glyphs=4
2026-03-14T00:27:15.078833	4c9b0dd4	120	30	1.0000	DISCARD	gen=283 glyphs=4
2026-03-14T00:27:15.347544	354762af	116	29	0.9500	DISCARD	gen=327 glyphs=4
2026-03-14T00:27:17.828910	da76ccdb	116	29	1.0000	DISCARD	gen=283 glyphs=4
2026-03-14T00:27:18.126568	9e34ede0	116	29	1.0000	DISCARD	gen=327 glyphs=4
2026-03-14T00:27:20.588446	a1a8f621	116	29	1.0000	DISCARD	gen=283 glyphs=4
2026-03-14T00:27:20.859345	ae44ace5	116	29	1.0000	DISCARD	gen=327 glyphs=4
2026-03-14T00:27:23.365075	5a06ca32	120	30	1.0000	DISCARD	gen=283 glyphs=4
2026-03-14T00:27:23.647995	19355583	120	30	1.0000	DISCARD	gen=327 glyphs=4
2026-03-14T00:27:26.136234	37f4017b	116	29	1.0000	DISCARD	gen=284 glyphs=4
2026-03-14T00:27:26.406445	eca7ab6c	116	29	1.0000	DISCARD	gen=327 glyphs=4
2026-03-14T00:27:28.894850	bfdf7cad	120	30	1.0000	DISCARD	gen=284 glyphs=4
2026-03-14T00:27:29.168825	19355583	120	30	1.0000	DISCARD	gen=328 glyphs=4
2026-03-14T00:27:31.625007	357fd409	124	31	0.9500	DISCARD	gen=284 glyphs=4
2026-03-14T00:27:31.886881	8aef8872	116	29	1.0000	DISCARD	gen=328 glyphs=4
2026-03-14T00:27:34.357661	37f4017b	116	29	1.0000	DISCARD	gen=284 glyphs=4
2026-03-14T00:27:34.634445	d7c8681b	120	30	1.0000	DISCARD	gen=328 glyphs=4
2026-03-14T00:27:37.103664	5a06ca32	120	30	1.0000	DISCARD	gen=284 glyphs=4
2026-03-14T00:27:37.377057	6bba0a8c	116	29	0.9500	DISCARD	gen=328 glyphs=4
2026-03-14T00:27:39.841453	bfdf7cad	120	30	1.0000	DISCARD	gen=284 glyphs=4
2026-03-14T00:27:40.114826	8aef8872	116	29	1.0000	DISCARD	gen=328 glyphs=4
2026-03-14T00:27:42.676358	1d34459a	116	29	1.0000	DISCARD	gen=284 glyphs=4
2026-03-14T00:27:42.950898	8aad38f8	116	29	1.0000	DISCARD	gen=328 glyphs=4
2026-03-14T00:27:45.432052	37f4017b	116	29	1.0000	DISCARD	gen=284 glyphs=4
2026-03-14T00:27:45.707396	0eaedb57	116	29	1.0000	DISCARD	gen=328 glyphs=4
2026-03-14T00:27:48.146223	675f2996	116	29	1.0000	DISCARD	gen=284 glyphs=4
2026-03-14T00:27:48.415848	185b1925	116	29	1.0000	DISCARD	gen=328 glyphs=4
2026-03-14T00:27:50.904896	4c9b0dd4	120	30	1.0000	DISCARD	gen=284 glyphs=4
2026-03-14T00:27:51.183839	45fef3cf	116	29	1.0000	DISCARD	gen=328 glyphs=4
2026-03-14T00:27:53.659803	37f4017b	116	29	1.0000	DISCARD	gen=285 glyphs=4
2026-03-14T00:27:53.951044	b7aed8e9	116	29	1.0000	DISCARD	gen=328 glyphs=4
2026-03-14T00:27:56.455372	bfdf7cad	120	30	1.0000	DISCARD	gen=285 glyphs=4
2026-03-14T00:27:56.719541	19355583	120	30	1.0000	DISCARD	gen=329 glyphs=4
2026-03-14T00:27:59.210367	37f4017b	116	29	1.0000	DISCARD	gen=285 glyphs=4
2026-03-14T00:27:59.485115	8aef8872	116	29	1.0000	DISCARD	gen=329 glyphs=4
2026-03-14T00:28:01.940942	bdf65429	116	29	1.0000	DISCARD	gen=285 glyphs=4
2026-03-14T00:28:02.209564	19355583	120	30	1.0000	DISCARD	gen=329 glyphs=4
2026-03-14T00:28:04.709064	5a06ca32	120	30	1.0000	DISCARD	gen=285 glyphs=4
2026-03-14T00:28:04.986966	050862ad	120	30	1.0000	DISCARD	gen=329 glyphs=4
2026-03-14T00:28:07.450626	5a06ca32	120	30	1.0000	DISCARD	gen=285 glyphs=4
2026-03-14T00:28:07.713761	8aef8872	116	29	1.0000	DISCARD	gen=329 glyphs=4
2026-03-14T00:28:10.206560	7ca87b42	116	29	1.0000	DISCARD	gen=285 glyphs=4
2026-03-14T00:28:10.479058	e8c7f6cf	120	30	1.0000	DISCARD	gen=329 glyphs=4
2026-03-14T00:28:13.024115	673f5837	116	29	1.0000	DISCARD	gen=285 glyphs=4
2026-03-14T00:28:13.290265	19355583	120	30	1.0000	DISCARD	gen=329 glyphs=4
2026-03-14T00:28:15.781596	5a06ca32	120	30	1.0000	DISCARD	gen=285 glyphs=4
2026-03-14T00:28:16.046546	8aef8872	116	29	1.0000	DISCARD	gen=329 glyphs=4
2026-03-14T00:28:18.512425	1ca0b657	120	30	1.0000	DISCARD	gen=285 glyphs=4
2026-03-14T00:28:18.785595	8aef8872	116	29	1.0000	DISCARD	gen=329 glyphs=4
2026-03-14T00:28:21.256771	37f4017b	116	29	1.0000	DISCARD	gen=286 glyphs=4
2026-03-14T00:28:21.527023	b7aed8e9	116	29	1.0000	DISCARD	gen=329 glyphs=4
