timestamp	program_hash	spirv_size	word_count	fitness	status	description
2026-03-14T02:55:02.251232	bfdf7cad	120	30	1.0000	DISCARD	gen=607 glyphs=4
2026-03-14T02:55:02.522958	b57e7176	120	30	1.0000	DISCARD	gen=651 glyphs=4
2026-03-14T02:55:04.948069	55d6c151	120	30	1.0000	DISCARD	gen=607 glyphs=4
2026-03-14T02:55:05.217225	ae44ace5	116	29	1.0000	DISCARD	gen=651 glyphs=4
2026-03-14T02:55:07.720743	6f16e608	120	30	1.0000	DISCARD	gen=607 glyphs=4
2026-03-14T02:55:08.002131	b7aed8e9	116	29	1.0000	DISCARD	gen=651 glyphs=4
2026-03-14T02:55:10.470414	c4976f0e	120	30	1.0000	DISCARD	gen=607 glyphs=4
2026-03-14T02:55:10.742930	0eaedb57	116	29	1.0000	DISCARD	gen=651 glyphs=4
2026-03-14T02:55:13.170987	2701cb73	116	29	1.0000	DISCARD	gen=607 glyphs=4
2026-03-14T02:55:13.449067	b57e7176	120	30	1.0000	DISCARD	gen=651 glyphs=4
2026-03-14T02:55:15.876780	5b9807ac	120	30	1.0000	DISCARD	gen=607 glyphs=4
2026-03-14T02:55:16.144488	1e5f0e21	116	29	1.0000	DISCARD	gen=651 glyphs=4
2026-03-14T02:55:18.588591	5a06ca32	120	30	1.0000	DISCARD	gen=607 glyphs=4
2026-03-14T02:55:18.859539	8aef8872	116	29	1.0000	DISCARD	gen=651 glyphs=4
2026-03-14T02:55:21.288293	37f4017b	116	29	1.0000	DISCARD	gen=608 glyphs=4
2026-03-14T02:55:21.563530	050862ad	120	30	1.0000	DISCARD	gen=651 glyphs=4
2026-03-14T02:55:23.977627	bfdf7cad	120	30	1.0000	DISCARD	gen=608 glyphs=4
2026-03-14T02:55:24.249824	19355583	120	30	1.0000	DISCARD	gen=652 glyphs=4
2026-03-14T02:55:26.669639	37f4017b	116	29	1.0000	DISCARD	gen=608 glyphs=4
2026-03-14T02:55:26.928397	8aef8872	116	29	1.0000	DISCARD	gen=652 glyphs=4
2026-03-14T02:55:29.355478	12b38c2d	116	29	1.0000	DISCARD	gen=608 glyphs=4
2026-03-14T02:55:29.618313	0eaedb57	116	29	1.0000	DISCARD	gen=652 glyphs=4
2026-03-14T02:55:32.041171	37f4017b	116	29	1.0000	DISCARD	gen=608 glyphs=4
2026-03-14T02:55:32.310621	d7c8681b	120	30	1.0000	DISCARD	gen=652 glyphs=4
2026-03-14T02:55:34.739006	0ed731a4	116	29	1.0000	DISCARD	gen=608 glyphs=4
2026-03-14T02:55:35.001066	b010a718	120	30	1.0000	DISCARD	gen=652 glyphs=4
2026-03-14T02:55:37.428827	5b9807ac	120	30	1.0000	DISCARD	gen=608 glyphs=4
2026-03-14T02:55:37.696899	a314eac8	116	29	1.0000	DISCARD	gen=652 glyphs=4
2026-03-14T02:55:40.227492	fdb5d108	120	30	1.0000	DISCARD	gen=608 glyphs=4
2026-03-14T02:55:40.503603	19355583	120	30	1.0000	DISCARD	gen=652 glyphs=4
2026-03-14T02:55:42.908084	55d6c151	120	30	1.0000	DISCARD	gen=608 glyphs=4
2026-03-14T02:55:43.198917	e2cd28ea	120	30	1.0000	DISCARD	gen=652 glyphs=4
2026-03-14T02:55:45.655455	1d34459a	116	29	1.0000	DISCARD	gen=608 glyphs=4
2026-03-14T02:55:45.931622	3528e27c	116	29	1.0000	DISCARD	gen=652 glyphs=4
2026-03-14T02:55:48.363638	37f4017b	116	29	1.0000	DISCARD	gen=609 glyphs=4
2026-03-14T02:55:48.626264	593a480f	116	29	1.0000	DISCARD	gen=652 glyphs=4
2026-03-14T02:55:51.051969	bfdf7cad	120	30	1.0000	DISCARD	gen=609 glyphs=4
2026-03-14T02:55:51.330087	19355583	120	30	1.0000	DISCARD	gen=653 glyphs=4
2026-03-14T02:55:53.750906	4c9b0dd4	120	30	1.0000	DISCARD	gen=609 glyphs=4
2026-03-14T02:55:54.024319	8aef8872	116	29	1.0000	DISCARD	gen=653 glyphs=4
2026-03-14T02:55:56.481606	2701cb73	116	29	1.0000	DISCARD	gen=609 glyphs=4
2026-03-14T02:55:56.748400	ae44ace5	116	29	1.0000	DISCARD	gen=653 glyphs=4
2026-03-14T02:55:59.166857	9e390ecc	116	29	1.0000	DISCARD	gen=609 glyphs=4
2026-03-14T02:55:59.442508	19355583	120	30	1.0000	DISCARD	gen=653 glyphs=4
2026-03-14T02:56:01.847654	04bf18fe	120	30	1.0000	DISCARD	gen=609 glyphs=4
2026-03-14T02:56:02.114439	0eaedb57	116	29	1.0000	DISCARD	gen=653 glyphs=4
2026-03-14T02:56:04.547419	5a06ca32	120	30	1.0000	DISCARD	gen=609 glyphs=4
2026-03-14T02:56:04.827825	6c8a602a	116	29	1.0000	DISCARD	gen=653 glyphs=4
2026-03-14T02:56:07.282431	5b9807ac	120	30	1.0000	DISCARD	gen=609 glyphs=4
2026-03-14T02:56:07.553740	875e0f8a	116	29	1.0000	DISCARD	gen=653 glyphs=4
2026-03-14T02:56:10.027077	5b9807ac	120	30	1.0000	DISCARD	gen=609 glyphs=4
2026-03-14T02:56:10.290379	d7c8681b	120	30	1.0000	DISCARD	gen=653 glyphs=4
2026-03-14T02:56:12.777127	2701cb73	116	29	1.0000	DISCARD	gen=609 glyphs=4
2026-03-14T02:56:13.047443	67cb81be	120	30	1.0000	DISCARD	gen=653 glyphs=4
2026-03-14T02:56:15.468498	37f4017b	116	29	1.0000	DISCARD	gen=610 glyphs=4
2026-03-14T02:56:15.743998	66265f11	116	29	1.0000	DISCARD	gen=653 glyphs=4
2026-03-14T02:56:18.216948	bfdf7cad	120	30	1.0000	DISCARD	gen=610 glyphs=4
2026-03-14T02:56:18.487758	19355583	120	30	1.0000	DISCARD	gen=654 glyphs=4
2026-03-14T02:56:20.919761	55d6c151	120	30	1.0000	DISCARD	gen=610 glyphs=4
2026-03-14T02:56:21.189505	8aef8872	116	29	1.0000	DISCARD	gen=654 glyphs=4
2026-03-14T02:56:23.614419	37f4017b	116	29	1.0000	DISCARD	gen=610 glyphs=4
2026-03-14T02:56:23.885745	ae44ace5	116	29	1.0000	DISCARD	gen=654 glyphs=4
2026-03-14T02:56:26.299915	12b38c2d	116	29	1.0000	DISCARD	gen=610 glyphs=4
2026-03-14T02:56:26.568888	9e34ede0	116	29	1.0000	DISCARD	gen=654 glyphs=4
2026-03-14T02:56:29.016683	37f4017b	116	29	1.0000	DISCARD	gen=610 glyphs=4
2026-03-14T02:56:29.276839	050862ad	120	30	1.0000	DISCARD	gen=654 glyphs=4
2026-03-14T02:56:31.686885	7ca87b42	116	29	1.0000	DISCARD	gen=610 glyphs=4
2026-03-14T02:56:31.975262	1e5f0e21	116	29	1.0000	DISCARD	gen=654 glyphs=4
2026-03-14T02:56:34.399005	5b9807ac	120	30	1.0000	DISCARD	gen=610 glyphs=4
2026-03-14T02:56:34.665931	1ef1f4eb	116	29	1.0000	DISCARD	gen=654 glyphs=4
2026-03-14T02:56:37.096575	37f4017b	116	29	1.0000	DISCARD	gen=610 glyphs=4
2026-03-14T02:56:37.377082	b57e7176	120	30	1.0000	DISCARD	gen=654 glyphs=4
2026-03-14T02:56:39.820126	d05e7a24	116	29	1.0000	DISCARD	gen=610 glyphs=4
2026-03-14T02:56:40.099123	050862ad	120	30	1.0000	DISCARD	gen=654 glyphs=4
2026-03-14T02:56:42.618940	37f4017b	116	29	1.0000	DISCARD	gen=611 glyphs=4
2026-03-14T02:56:42.886407	38d50de9	116	29	1.0000	DISCARD	gen=654 glyphs=4
2026-03-14T02:56:45.293765	bfdf7cad	120	30	1.0000	DISCARD	gen=611 glyphs=4
2026-03-14T02:56:45.567955	19355583	120	30	1.0000	DISCARD	gen=655 glyphs=4
2026-03-14T02:56:47.964466	55d6c151	120	30	1.0000	DISCARD	gen=611 glyphs=4
2026-03-14T02:56:48.229085	8aef8872	116	29	1.0000	DISCARD	gen=655 glyphs=4
2026-03-14T02:56:50.655934	2701cb73	116	29	1.0000	DISCARD	gen=611 glyphs=4
2026-03-14T02:56:50.934578	1e5f0e21	116	29	1.0000	DISCARD	gen=655 glyphs=4
2026-03-14T02:56:53.359145	37f4017b	116	29	1.0000	DISCARD	gen=611 glyphs=4
2026-03-14T02:56:53.632075	1e5f0e21	116	29	1.0000	DISCARD	gen=655 glyphs=4
2026-03-14T02:56:56.077660	5a06ca32	120	30	1.0000	DISCARD	gen=611 glyphs=4
2026-03-14T02:56:56.344446	6e4a9711	116	29	1.0000	DISCARD	gen=655 glyphs=4
2026-03-14T02:56:58.763879	d11c1062	120	30	1.0000	DISCARD	gen=611 glyphs=4
2026-03-14T02:56:59.028442	e62a593e	120	30	1.0000	DISCARD	gen=655 glyphs=4
2026-03-14T02:57:01.465192	bfdf7cad	120	30	1.0000	DISCARD	gen=611 glyphs=4
2026-03-14T02:57:01.737814	1e5f0e21	116	29	1.0000	DISCARD	gen=655 glyphs=4
2026-03-14T02:57:04.172311	5a06ca32	120	30	1.0000	DISCARD	gen=611 glyphs=4
2026-03-14T02:57:04.441489	0eaedb57	116	29	1.0000	DISCARD	gen=655 glyphs=4
2026-03-14T02:57:06.864559	2701cb73	116	29	1.0000	DISCARD	gen=611 glyphs=4
2026-03-14T02:57:07.138241	19355583	120	30	1.0000	DISCARD	gen=655 glyphs=4
2026-03-14T02:57:09.607419	37f4017b	116	29	1.0000	DISCARD	gen=612 glyphs=4
2026-03-14T02:57:09.877885	ae44ace5	116	29	1.0000	DISCARD	gen=655 glyphs=4
2026-03-14T02:57:12.296477	bfdf7cad	120	30	1.0000	DISCARD	gen=612 glyphs=4
2026-03-14T02:57:12.566042	19355583	120	30	1.0000	DISCARD	gen=656 glyphs=4
2026-03-14T02:57:15.092530	0f557161	116	29	1.0000	DISCARD	gen=612 glyphs=4
2026-03-14T02:57:15.378409	8aef8872	116	29	1.0000	DISCARD	gen=656 glyphs=4
2026-03-14T02:57:17.823901	4b1902e3	120	30	1.0000	DISCARD	gen=612 glyphs=4
2026-03-14T02:57:18.094659	e2cd28ea	120	30	1.0000	DISCARD	gen=656 glyphs=4
2026-03-14T02:57:20.563166	fdb5d108	120	30	1.0000	DISCARD	gen=612 glyphs=4
2026-03-14T02:57:20.835889	875e0f8a	116	29	1.0000	DISCARD	gen=656 glyphs=4
2026-03-14T02:57:23.251418	f2935ab8	116	29	0.9500	DISCARD	gen=612 glyphs=4
2026-03-14T02:57:23.642006	7045599d	116	29	1.0000	DISCARD	gen=656 glyphs=4
2026-03-14T02:57:26.054877	5a06ca32	120	30	1.0000	DISCARD	gen=612 glyphs=4
2026-03-14T02:57:26.323036	d7c8681b	120	30	1.0000	DISCARD	gen=656 glyphs=4
2026-03-14T02:57:28.745460	fdb5d108	120	30	1.0000	DISCARD	gen=612 glyphs=4
2026-03-14T02:57:29.009974	2401c5b1	116	29	1.0000	DISCARD	gen=656 glyphs=4
2026-03-14T02:57:31.473091	5a06ca32	120	30	1.0000	DISCARD	gen=612 glyphs=4
2026-03-14T02:57:31.742599	050862ad	120	30	1.0000	DISCARD	gen=656 glyphs=4
2026-03-14T02:57:34.172327	2a3de6bc	116	29	0.9500	DISCARD	gen=612 glyphs=4
2026-03-14T02:57:34.445990	a78f9454	120	30	1.0000	DISCARD	gen=656 glyphs=4
2026-03-14T02:57:36.870756	37f4017b	116	29	1.0000	DISCARD	gen=613 glyphs=4
2026-03-14T02:57:37.133653	050862ad	120	30	1.0000	DISCARD	gen=656 glyphs=4
2026-03-14T02:57:39.569373	bfdf7cad	120	30	1.0000	DISCARD	gen=613 glyphs=4
2026-03-14T02:57:39.840140	19355583	120	30	1.0000	DISCARD	gen=657 glyphs=4
2026-03-14T02:57:42.291555	0ce0ca99	116	29	1.0000	DISCARD	gen=613 glyphs=4
2026-03-14T02:57:42.582780	8aef8872	116	29	1.0000	DISCARD	gen=657 glyphs=4
2026-03-14T02:57:45.014099	12b38c2d	116	29	1.0000	DISCARD	gen=613 glyphs=4
2026-03-14T02:57:45.355195	875e0f8a	116	29	1.0000	DISCARD	gen=657 glyphs=4
2026-03-14T02:57:47.856794	a00d1423	116	29	1.0000	DISCARD	gen=613 glyphs=4
2026-03-14T02:57:48.133689	7327d02b	116	29	1.0000	DISCARD	gen=657 glyphs=4
2026-03-14T02:57:50.569194	1d34459a	116	29	1.0000	DISCARD	gen=613 glyphs=4
2026-03-14T02:57:50.830648	0be00c0f	116	29	1.0000	DISCARD	gen=657 glyphs=4
2026-03-14T02:57:53.256829	35a6ad09	116	29	1.0000	DISCARD	gen=613 glyphs=4
2026-03-14T02:57:53.528078	8aef8872	116	29	1.0000	DISCARD	gen=657 glyphs=4
2026-03-14T02:57:55.965492	fdb5d108	120	30	1.0000	DISCARD	gen=613 glyphs=4
2026-03-14T02:57:56.244358	6d461f1c	116	29	0.9500	DISCARD	gen=657 glyphs=4
2026-03-14T02:57:58.681245	2701cb73	116	29	1.0000	DISCARD	gen=613 glyphs=4
2026-03-14T02:57:58.946479	e8c7f6cf	120	30	1.0000	DISCARD	gen=657 glyphs=4
2026-03-14T02:58:01.384357	7b16a5dc	120	30	0.9500	DISCARD	gen=613 glyphs=4
2026-03-14T02:58:01.650755	875e0f8a	116	29	1.0000	DISCARD	gen=657 glyphs=4
2026-03-14T02:58:04.095459	37f4017b	116	29	1.0000	DISCARD	gen=614 glyphs=4
2026-03-14T02:58:04.368651	050862ad	120	30	1.0000	DISCARD	gen=657 glyphs=4
2026-03-14T02:58:06.795928	bfdf7cad	120	30	1.0000	DISCARD	gen=614 glyphs=4
2026-03-14T02:58:07.067901	19355583	120	30	1.0000	DISCARD	gen=658 glyphs=4
2026-03-14T02:58:09.824191	37f4017b	116	29	1.0000	DISCARD	gen=614 glyphs=4
2026-03-14T02:58:10.096568	8aef8872	116	29	1.0000	DISCARD	gen=658 glyphs=4
2026-03-14T02:58:12.515506	2701cb73	116	29	1.0000	DISCARD	gen=614 glyphs=4
2026-03-14T02:58:12.785644	19355583	120	30	1.0000	DISCARD	gen=658 glyphs=4
2026-03-14T02:58:15.214231	37f4017b	116	29	1.0000	DISCARD	gen=614 glyphs=4
2026-03-14T02:58:15.473703	b7aed8e9	116	29	1.0000	DISCARD	gen=658 glyphs=4
2026-03-14T02:58:17.959189	5a06ca32	120	30	1.0000	DISCARD	gen=614 glyphs=4
2026-03-14T02:58:18.233575	875e0f8a	116	29	1.0000	DISCARD	gen=658 glyphs=4
2026-03-14T02:58:20.672503	5a06ca32	120	30	1.0000	DISCARD	gen=614 glyphs=4
2026-03-14T02:58:20.956618	a78f9454	120	30	1.0000	DISCARD	gen=658 glyphs=4
2026-03-14T02:58:23.364249	37f4017b	116	29	1.0000	DISCARD	gen=614 glyphs=4
2026-03-14T02:58:23.635069	d7c8681b	120	30	1.0000	DISCARD	gen=658 glyphs=4
2026-03-14T02:58:26.059333	55d6c151	120	30	1.0000	DISCARD	gen=614 glyphs=4
2026-03-14T02:58:26.331708	8aef8872	116	29	1.0000	DISCARD	gen=658 glyphs=4
2026-03-14T02:58:28.753461	55d6c151	120	30	1.0000	DISCARD	gen=614 glyphs=4
2026-03-14T02:58:29.021598	4fe29a4c	116	29	1.0000	DISCARD	gen=658 glyphs=4
2026-03-14T02:58:31.436944	37f4017b	116	29	1.0000	DISCARD	gen=615 glyphs=4
2026-03-14T02:58:31.695078	8520c191	116	29	1.0000	DISCARD	gen=658 glyphs=4
2026-03-14T02:58:34.112049	bfdf7cad	120	30	1.0000	DISCARD	gen=615 glyphs=4
2026-03-14T02:58:34.384473	19355583	120	30	1.0000	DISCARD	gen=659 glyphs=4
2026-03-14T02:58:36.813203	e4d082eb	120	30	1.0000	DISCARD	gen=615 glyphs=4
2026-03-14T02:58:37.084043	8aef8872	116	29	1.0000	DISCARD	gen=659 glyphs=4
2026-03-14T02:58:39.494824	5ad38d75	120	30	1.0000	DISCARD	gen=615 glyphs=4
2026-03-14T02:58:39.767267	67cb81be	120	30	1.0000	DISCARD	gen=659 glyphs=4
2026-03-14T02:58:42.188357	5b9807ac	120	30	1.0000	DISCARD	gen=615 glyphs=4
2026-03-14T02:58:42.457755	0eaedb57	116	29	1.0000	DISCARD	gen=659 glyphs=4
2026-03-14T02:58:44.877112	7ca87b42	116	29	1.0000	DISCARD	gen=615 glyphs=4
2026-03-14T02:58:45.152157	b7aed8e9	116	29	1.0000	DISCARD	gen=659 glyphs=4
2026-03-14T02:58:47.602652	1d34459a	116	29	1.0000	DISCARD	gen=615 glyphs=4
2026-03-14T02:58:47.871352	8aef8872	116	29	1.0000	DISCARD	gen=659 glyphs=4
2026-03-14T02:58:50.394691	12b38c2d	116	29	1.0000	DISCARD	gen=615 glyphs=4
2026-03-14T02:58:50.670510	8aef8872	116	29	1.0000	DISCARD	gen=659 glyphs=4
2026-03-14T02:58:53.270338	2701cb73	116	29	1.0000	DISCARD	gen=615 glyphs=4
2026-03-14T02:58:53.532790	f21781e2	116	29	1.0000	DISCARD	gen=659 glyphs=4
2026-03-14T02:58:55.978112	1d34459a	116	29	1.0000	DISCARD	gen=615 glyphs=4
2026-03-14T02:58:56.246428	8aef8872	116	29	1.0000	DISCARD	gen=659 glyphs=4
2026-03-14T02:58:58.663651	37f4017b	116	29	1.0000	DISCARD	gen=616 glyphs=4
2026-03-14T02:58:58.934861	e8c7f6cf	120	30	1.0000	DISCARD	gen=659 glyphs=4
2026-03-14T02:59:01.376236	bfdf7cad	120	30	1.0000	DISCARD	gen=616 glyphs=4
2026-03-14T02:59:01.643473	19355583	120	30	1.0000	DISCARD	gen=660 glyphs=4
2026-03-14T02:59:04.081642	241f547e	120	30	1.0000	DISCARD	gen=616 glyphs=4
2026-03-14T02:59:04.352554	8aef8872	116	29	1.0000	DISCARD	gen=660 glyphs=4
2026-03-14T02:59:06.782979	1d34459a	116	29	1.0000	DISCARD	gen=616 glyphs=4
2026-03-14T02:59:07.041322	8aef8872	116	29	1.0000	DISCARD	gen=660 glyphs=4
2026-03-14T02:59:09.452565	5a06ca32	120	30	1.0000	DISCARD	gen=616 glyphs=4
2026-03-14T02:59:09.727340	7d79a0cc	120	30	1.0000	DISCARD	gen=660 glyphs=4
2026-03-14T02:59:12.184170	37630203	116	29	1.0000	DISCARD	gen=616 glyphs=4
2026-03-14T02:59:12.459862	050862ad	120	30	1.0000	DISCARD	gen=660 glyphs=4
2026-03-14T02:59:14.886501	4c9b0dd4	120	30	1.0000	DISCARD	gen=616 glyphs=4
2026-03-14T02:59:15.156305	e8c7f6cf	120	30	1.0000	DISCARD	gen=660 glyphs=4
2026-03-14T02:59:17.570103	ba581600	120	30	1.0000	DISCARD	gen=616 glyphs=4
2026-03-14T02:59:17.829432	e2b93b25	116	29	1.0000	DISCARD	gen=660 glyphs=4
2026-03-14T02:59:20.254253	5a06ca32	120	30	1.0000	DISCARD	gen=616 glyphs=4
2026-03-14T02:59:20.516735	b7aed8e9	116	29	1.0000	DISCARD	gen=660 glyphs=4
2026-03-14T02:59:23.065926	516de701	116	29	1.0000	DISCARD	gen=616 glyphs=4
2026-03-14T02:59:23.328370	875e0f8a	116	29	1.0000	DISCARD	gen=660 glyphs=4
2026-03-14T02:59:25.876756	37f4017b	116	29	1.0000	DISCARD	gen=617 glyphs=4
2026-03-14T02:59:26.152812	8aef8872	116	29	1.0000	DISCARD	gen=660 glyphs=4
2026-03-14T02:59:28.603617	bfdf7cad	120	30	1.0000	DISCARD	gen=617 glyphs=4
2026-03-14T02:59:28.860989	19355583	120	30	1.0000	DISCARD	gen=661 glyphs=4
2026-03-14T02:59:31.294576	936d00d4	120	30	1.0000	DISCARD	gen=617 glyphs=4
2026-03-14T02:59:31.569902	8aef8872	116	29	1.0000	DISCARD	gen=661 glyphs=4
2026-03-14T02:59:34.002841	1d34459a	116	29	1.0000	DISCARD	gen=617 glyphs=4
2026-03-14T02:59:34.280611	19355583	120	30	1.0000	DISCARD	gen=661 glyphs=4
2026-03-14T02:59:36.929176	12b38c2d	116	29	1.0000	DISCARD	gen=617 glyphs=4
2026-03-14T02:59:37.187336	8aef8872	116	29	1.0000	DISCARD	gen=661 glyphs=4
2026-03-14T02:59:39.624801	37f4017b	116	29	1.0000	DISCARD	gen=617 glyphs=4
2026-03-14T02:59:39.899160	9e34ede0	116	29	1.0000	DISCARD	gen=661 glyphs=4
2026-03-14T02:59:42.319924	5a06ca32	120	30	1.0000	DISCARD	gen=617 glyphs=4
2026-03-14T02:59:42.590947	0eaedb57	116	29	1.0000	DISCARD	gen=661 glyphs=4
2026-03-14T02:59:45.155780	37f4017b	116	29	1.0000	DISCARD	gen=617 glyphs=4
2026-03-14T02:59:45.426737	e2cd28ea	120	30	1.0000	DISCARD	gen=661 glyphs=4
2026-03-14T02:59:47.850097	4c9b0dd4	120	30	1.0000	DISCARD	gen=617 glyphs=4
2026-03-14T02:59:48.120639	0940ed46	116	29	1.0000	DISCARD	gen=661 glyphs=4
2026-03-14T02:59:50.550457	5a06ca32	120	30	1.0000	DISCARD	gen=617 glyphs=4
2026-03-14T02:59:50.814982	8aef8872	116	29	1.0000	DISCARD	gen=661 glyphs=4
2026-03-14T02:59:53.332119	37f4017b	116	29	1.0000	DISCARD	gen=618 glyphs=4
2026-03-14T02:59:53.612127	a78f9454	120	30	1.0000	DISCARD	gen=661 glyphs=4
2026-03-14T02:59:56.036245	bfdf7cad	120	30	1.0000	DISCARD	gen=618 glyphs=4
2026-03-14T02:59:56.327325	19355583	120	30	1.0000	DISCARD	gen=662 glyphs=4
2026-03-14T02:59:58.752941	37f4017b	116	29	1.0000	DISCARD	gen=618 glyphs=4
2026-03-14T02:59:59.023001	8aef8872	116	29	1.0000	DISCARD	gen=662 glyphs=4
2026-03-14T03:00:01.459193	fdb5d108	120	30	1.0000	DISCARD	gen=618 glyphs=4
2026-03-14T03:00:01.716887	8aef8872	116	29	1.0000	DISCARD	gen=662 glyphs=4
2026-03-14T03:00:04.157429	df5bd439	116	29	0.9500	DISCARD	gen=618 glyphs=4
2026-03-14T03:00:04.430267	50dc991d	116	29	1.0000	DISCARD	gen=662 glyphs=4
2026-03-14T03:00:06.861203	afc71b8c	120	30	1.0000	DISCARD	gen=618 glyphs=4
2026-03-14T03:00:07.128094	0eaedb57	116	29	1.0000	DISCARD	gen=662 glyphs=4
2026-03-14T03:00:09.594655	f76fc0ba	116	29	1.0000	DISCARD	gen=618 glyphs=4
2026-03-14T03:00:09.862328	19355583	120	30	1.0000	DISCARD	gen=662 glyphs=4
2026-03-14T03:00:12.301793	37f4017b	116	29	1.0000	DISCARD	gen=618 glyphs=4
2026-03-14T03:00:12.576336	875e0f8a	116	29	1.0000	DISCARD	gen=662 glyphs=4
2026-03-14T03:00:14.991386	5ac55389	116	29	1.0000	DISCARD	gen=618 glyphs=4
2026-03-14T03:00:15.263280	67cb81be	120	30	1.0000	DISCARD	gen=662 glyphs=4
2026-03-14T03:00:17.723698	5a06ca32	120	30	1.0000	DISCARD	gen=618 glyphs=4
2026-03-14T03:00:18.000977	33f92377	116	29	0.9500	DISCARD	gen=662 glyphs=4
2026-03-14T03:00:20.429458	37f4017b	116	29	1.0000	DISCARD	gen=619 glyphs=4
2026-03-14T03:00:20.715253	e8c7f6cf	120	30	1.0000	DISCARD	gen=662 glyphs=4
2026-03-14T03:00:23.181867	bfdf7cad	120	30	1.0000	DISCARD	gen=619 glyphs=4
2026-03-14T03:00:23.447608	19355583	120	30	1.0000	DISCARD	gen=663 glyphs=4
2026-03-14T03:00:25.896744	37f4017b	116	29	1.0000	DISCARD	gen=619 glyphs=4
2026-03-14T03:00:26.169570	8aef8872	116	29	1.0000	DISCARD	gen=663 glyphs=4
2026-03-14T03:00:28.594290	71e2ba66	116	29	1.0000	DISCARD	gen=619 glyphs=4
2026-03-14T03:00:28.861708	8aef8872	116	29	1.0000	DISCARD	gen=663 glyphs=4
2026-03-14T03:00:31.375799	fdb5d108	120	30	1.0000	DISCARD	gen=619 glyphs=4
2026-03-14T03:00:31.744728	e2cd28ea	120	30	1.0000	DISCARD	gen=663 glyphs=4
2026-03-14T03:00:35.381174	fcb34c5c	116	29	1.0000	DISCARD	gen=619 glyphs=4
2026-03-14T03:00:35.654660	0eaedb57	116	29	1.0000	DISCARD	gen=663 glyphs=4
2026-03-14T03:00:38.112488	55d6c151	120	30	1.0000	DISCARD	gen=619 glyphs=4
2026-03-14T03:00:38.382189	8aef8872	116	29	1.0000	DISCARD	gen=663 glyphs=4
2026-03-14T03:00:40.822692	5bfa2712	116	29	1.0000	DISCARD	gen=619 glyphs=4
2026-03-14T03:00:41.103781	1e5f0e21	116	29	1.0000	DISCARD	gen=663 glyphs=4
2026-03-14T03:00:43.562212	37f4017b	116	29	1.0000	DISCARD	gen=619 glyphs=4
2026-03-14T03:00:43.828828	91e91bd0	116	29	1.0000	DISCARD	gen=663 glyphs=4
2026-03-14T03:00:46.266938	37f4017b	116	29	1.0000	DISCARD	gen=619 glyphs=4
2026-03-14T03:00:46.543970	20ffbd41	120	30	1.0000	DISCARD	gen=663 glyphs=4
2026-03-14T03:00:49.162733	37f4017b	116	29	1.0000	DISCARD	gen=620 glyphs=4
2026-03-14T03:00:49.428017	aa2d94ca	116	29	1.0000	DISCARD	gen=663 glyphs=4
2026-03-14T03:00:51.865403	bfdf7cad	120	30	1.0000	DISCARD	gen=620 glyphs=4
2026-03-14T03:00:52.130206	19355583	120	30	1.0000	DISCARD	gen=664 glyphs=4
2026-03-14T03:00:54.572963	3460ece6	120	30	1.0000	DISCARD	gen=620 glyphs=4
2026-03-14T03:00:54.844118	8aef8872	116	29	1.0000	DISCARD	gen=664 glyphs=4
2026-03-14T03:00:57.334020	37f4017b	116	29	1.0000	DISCARD	gen=620 glyphs=4
2026-03-14T03:00:57.611957	50dc991d	116	29	1.0000	DISCARD	gen=664 glyphs=4
2026-03-14T03:01:00.064667	fdb5d108	120	30	1.0000	DISCARD	gen=620 glyphs=4
2026-03-14T03:01:00.336693	e2cd28ea	120	30	1.0000	DISCARD	gen=664 glyphs=4
2026-03-14T03:01:02.800275	e7648075	116	29	1.0000	DISCARD	gen=620 glyphs=4
2026-03-14T03:01:03.065846	50dc991d	116	29	1.0000	DISCARD	gen=664 glyphs=4
2026-03-14T03:01:05.501898	1a29c392	120	30	1.0000	DISCARD	gen=620 glyphs=4
2026-03-14T03:01:05.779495	0eaedb57	116	29	1.0000	DISCARD	gen=664 glyphs=4
2026-03-14T03:01:08.218169	f44b6bdd	116	29	1.0000	DISCARD	gen=620 glyphs=4
2026-03-14T03:01:08.493434	875e0f8a	116	29	1.0000	DISCARD	gen=664 glyphs=4
2026-03-14T03:01:10.933102	bfdf7cad	120	30	1.0000	DISCARD	gen=620 glyphs=4
2026-03-14T03:01:11.211434	0e1b8fed	120	30	1.0000	DISCARD	gen=664 glyphs=4
2026-03-14T03:01:13.622054	4c9b0dd4	120	30	1.0000	DISCARD	gen=620 glyphs=4
2026-03-14T03:01:13.911551	0eaedb57	116	29	1.0000	DISCARD	gen=664 glyphs=4
2026-03-14T03:01:16.310921	37f4017b	116	29	1.0000	DISCARD	gen=621 glyphs=4
2026-03-14T03:01:16.586648	b57e7176	120	30	1.0000	DISCARD	gen=664 glyphs=4
2026-03-14T03:01:18.993091	bfdf7cad	120	30	1.0000	DISCARD	gen=621 glyphs=4
2026-03-14T03:01:19.265113	19355583	120	30	1.0000	DISCARD	gen=665 glyphs=4
2026-03-14T03:01:21.691282	5a06ca32	120	30	1.0000	DISCARD	gen=621 glyphs=4
2026-03-14T03:01:21.955738	8aef8872	116	29	1.0000	DISCARD	gen=665 glyphs=4
2026-03-14T03:01:24.397916	5b9807ac	120	30	1.0000	DISCARD	gen=621 glyphs=4
2026-03-14T03:01:24.666834	e8c7f6cf	120	30	1.0000	DISCARD	gen=665 glyphs=4
2026-03-14T03:01:27.083176	1d34459a	116	29	1.0000	DISCARD	gen=621 glyphs=4
2026-03-14T03:01:27.360919	050862ad	120	30	1.0000	DISCARD	gen=665 glyphs=4
2026-03-14T03:01:29.909776	37f4017b	116	29	1.0000	DISCARD	gen=621 glyphs=4
2026-03-14T03:01:30.164416	e2cd28ea	120	30	1.0000	DISCARD	gen=665 glyphs=4
2026-03-14T03:01:32.551931	d11c1062	120	30	1.0000	DISCARD	gen=621 glyphs=4
2026-03-14T03:01:32.818936	b57e7176	120	30	1.0000	DISCARD	gen=665 glyphs=4
2026-03-14T03:01:35.261295	d11c1062	120	30	1.0000	DISCARD	gen=621 glyphs=4
2026-03-14T03:01:35.525960	050862ad	120	30	1.0000	DISCARD	gen=665 glyphs=4
2026-03-14T03:01:37.950079	06f80c02	116	29	1.0000	DISCARD	gen=621 glyphs=4
2026-03-14T03:01:38.217297	0eaedb57	116	29	1.0000	DISCARD	gen=665 glyphs=4
