timestamp	program_hash	spirv_size	word_count	fitness	status	description
2026-03-14T01:48:27.877803	30362ea5	120	30	1.0000	DISCARD	gen=461 glyphs=4
2026-03-14T01:48:28.156028	6d31c8b1	120	30	1.0000	DISCARD	gen=505 glyphs=4
2026-03-14T01:48:30.791820	55d6c151	120	30	1.0000	DISCARD	gen=461 glyphs=4
2026-03-14T01:48:31.057891	8aef8872	116	29	1.0000	DISCARD	gen=505 glyphs=4
2026-03-14T01:48:33.484391	d3844b0f	116	29	1.0000	DISCARD	gen=461 glyphs=4
2026-03-14T01:48:33.760527	a84b2b7e	116	29	1.0000	DISCARD	gen=505 glyphs=4
2026-03-14T01:48:36.205161	5a06ca32	120	30	1.0000	DISCARD	gen=461 glyphs=4
2026-03-14T01:48:36.478344	8aef8872	116	29	1.0000	DISCARD	gen=505 glyphs=4
2026-03-14T01:48:38.899784	2701cb73	116	29	1.0000	DISCARD	gen=461 glyphs=4
2026-03-14T01:48:39.152769	eca7ab6c	116	29	1.0000	DISCARD	gen=505 glyphs=4
2026-03-14T01:48:41.630614	37f4017b	116	29	1.0000	DISCARD	gen=461 glyphs=4
2026-03-14T01:48:41.898947	e8c7f6cf	120	30	1.0000	DISCARD	gen=505 glyphs=4
2026-03-14T01:48:44.348830	37f4017b	116	29	1.0000	DISCARD	gen=461 glyphs=4
2026-03-14T01:48:44.613601	1e5f0e21	116	29	1.0000	DISCARD	gen=505 glyphs=4
2026-03-14T01:48:47.047416	37f4017b	116	29	1.0000	DISCARD	gen=462 glyphs=4
2026-03-14T01:48:47.307279	0eaedb57	116	29	1.0000	DISCARD	gen=505 glyphs=4
2026-03-14T01:48:49.770530	bfdf7cad	120	30	1.0000	DISCARD	gen=462 glyphs=4
2026-03-14T01:48:50.049097	19355583	120	30	1.0000	DISCARD	gen=506 glyphs=4
2026-03-14T01:48:52.542966	1d34459a	116	29	1.0000	DISCARD	gen=462 glyphs=4
2026-03-14T01:48:52.825764	8aef8872	116	29	1.0000	DISCARD	gen=506 glyphs=4
2026-03-14T01:48:55.287326	5a06ca32	120	30	1.0000	DISCARD	gen=462 glyphs=4
2026-03-14T01:48:55.560033	8aef8872	116	29	1.0000	DISCARD	gen=506 glyphs=4
2026-03-14T01:48:57.987884	55d6c151	120	30	1.0000	DISCARD	gen=462 glyphs=4
2026-03-14T01:48:58.264264	f2de9fe3	120	30	1.0000	DISCARD	gen=506 glyphs=4
2026-03-14T01:49:00.689210	b62e73fe	116	29	1.0000	DISCARD	gen=462 glyphs=4
2026-03-14T01:49:00.977022	67cb81be	120	30	1.0000	DISCARD	gen=506 glyphs=4
2026-03-14T01:49:03.498427	2d2077d2	120	30	1.0000	DISCARD	gen=462 glyphs=4
2026-03-14T01:49:03.777098	a6f89504	120	30	1.0000	DISCARD	gen=506 glyphs=4
2026-03-14T01:49:06.265941	4c9b0dd4	120	30	1.0000	DISCARD	gen=462 glyphs=4
2026-03-14T01:49:06.526818	50dc991d	116	29	1.0000	DISCARD	gen=506 glyphs=4
2026-03-14T01:49:08.990416	71e2ba66	116	29	1.0000	DISCARD	gen=462 glyphs=4
2026-03-14T01:49:09.278017	b57e7176	120	30	1.0000	DISCARD	gen=506 glyphs=4
2026-03-14T01:49:11.736599	d11c1062	120	30	1.0000	DISCARD	gen=462 glyphs=4
2026-03-14T01:49:12.001109	2203d11d	116	29	1.0000	DISCARD	gen=506 glyphs=4
2026-03-14T01:49:14.483127	37f4017b	116	29	1.0000	DISCARD	gen=463 glyphs=4
2026-03-14T01:49:14.763473	875e0f8a	116	29	1.0000	DISCARD	gen=506 glyphs=4
2026-03-14T01:49:17.269331	bfdf7cad	120	30	1.0000	DISCARD	gen=463 glyphs=4
2026-03-14T01:49:17.554646	19355583	120	30	1.0000	DISCARD	gen=507 glyphs=4
2026-03-14T01:49:19.992699	37f4017b	116	29	1.0000	DISCARD	gen=463 glyphs=4
2026-03-14T01:49:20.263055	8aef8872	116	29	1.0000	DISCARD	gen=507 glyphs=4
2026-03-14T01:49:22.731201	12b38c2d	116	29	1.0000	DISCARD	gen=463 glyphs=4
2026-03-14T01:49:23.017328	96379cfa	116	29	1.0000	DISCARD	gen=507 glyphs=4
2026-03-14T01:49:25.449146	55d6c151	120	30	1.0000	DISCARD	gen=463 glyphs=4
2026-03-14T01:49:25.717320	e8c7f6cf	120	30	1.0000	DISCARD	gen=507 glyphs=4
2026-03-14T01:49:28.154819	d7fe3150	116	29	1.0000	DISCARD	gen=463 glyphs=4
2026-03-14T01:49:28.431281	50dc991d	116	29	1.0000	DISCARD	gen=507 glyphs=4
2026-03-14T01:49:30.869450	facce5d7	120	30	1.0000	DISCARD	gen=463 glyphs=4
2026-03-14T01:49:31.136697	c9f8ec96	116	29	1.0000	DISCARD	gen=507 glyphs=4
2026-03-14T01:49:33.567886	37f4017b	116	29	1.0000	DISCARD	gen=463 glyphs=4
2026-03-14T01:49:33.835090	0eaedb57	116	29	1.0000	DISCARD	gen=507 glyphs=4
2026-03-14T01:49:36.331686	7ca87b42	116	29	1.0000	DISCARD	gen=463 glyphs=4
2026-03-14T01:49:36.607799	0eaedb57	116	29	1.0000	DISCARD	gen=507 glyphs=4
2026-03-14T01:49:39.145391	71e2ba66	116	29	1.0000	DISCARD	gen=463 glyphs=4
2026-03-14T01:49:39.416506	8aef8872	116	29	1.0000	DISCARD	gen=507 glyphs=4
2026-03-14T01:49:41.855887	37f4017b	116	29	1.0000	DISCARD	gen=464 glyphs=4
2026-03-14T01:49:42.120356	88cb4be2	116	29	1.0000	DISCARD	gen=507 glyphs=4
2026-03-14T01:49:44.579373	bfdf7cad	120	30	1.0000	DISCARD	gen=464 glyphs=4
2026-03-14T01:49:44.850151	19355583	120	30	1.0000	DISCARD	gen=508 glyphs=4
2026-03-14T01:49:47.287359	bfdf7cad	120	30	1.0000	DISCARD	gen=464 glyphs=4
2026-03-14T01:49:47.556717	8aef8872	116	29	1.0000	DISCARD	gen=508 glyphs=4
2026-03-14T01:49:50.062895	55042626	116	29	1.0000	DISCARD	gen=464 glyphs=4
2026-03-14T01:49:50.350026	d7c8681b	120	30	1.0000	DISCARD	gen=508 glyphs=4
2026-03-14T01:49:52.825356	f1892e17	120	30	1.0000	DISCARD	gen=464 glyphs=4
2026-03-14T01:49:53.113230	cb36a79d	116	29	1.0000	DISCARD	gen=508 glyphs=4
2026-03-14T01:49:55.644390	fdb5d108	120	30	1.0000	DISCARD	gen=464 glyphs=4
2026-03-14T01:49:55.900969	ae44ace5	116	29	1.0000	DISCARD	gen=508 glyphs=4
2026-03-14T01:49:58.352978	2701cb73	116	29	1.0000	DISCARD	gen=464 glyphs=4
2026-03-14T01:49:58.618230	050862ad	120	30	1.0000	DISCARD	gen=508 glyphs=4
2026-03-14T01:50:01.025080	e51615a0	120	30	1.0000	DISCARD	gen=464 glyphs=4
2026-03-14T01:50:01.283330	d6726b53	116	29	1.0000	DISCARD	gen=508 glyphs=4
2026-03-14T01:50:03.727851	fdb5d108	120	30	1.0000	DISCARD	gen=464 glyphs=4
2026-03-14T01:50:03.998582	19355583	120	30	1.0000	DISCARD	gen=508 glyphs=4
2026-03-14T01:50:06.408567	d3603069	116	29	1.0000	DISCARD	gen=464 glyphs=4
2026-03-14T01:50:06.680165	a78f9454	120	30	1.0000	DISCARD	gen=508 glyphs=4
2026-03-14T01:50:09.104822	37f4017b	116	29	1.0000	DISCARD	gen=465 glyphs=4
2026-03-14T01:50:09.375379	ad89d0ac	120	30	1.0000	DISCARD	gen=508 glyphs=4
2026-03-14T01:50:11.774795	bfdf7cad	120	30	1.0000	DISCARD	gen=465 glyphs=4
2026-03-14T01:50:12.045548	19355583	120	30	1.0000	DISCARD	gen=509 glyphs=4
2026-03-14T01:50:14.484461	37f4017b	116	29	1.0000	DISCARD	gen=465 glyphs=4
2026-03-14T01:50:14.744979	8aef8872	116	29	1.0000	DISCARD	gen=509 glyphs=4
2026-03-14T01:50:17.179112	5b9807ac	120	30	1.0000	DISCARD	gen=465 glyphs=4
2026-03-14T01:50:17.453956	eca7ab6c	116	29	1.0000	DISCARD	gen=509 glyphs=4
2026-03-14T01:50:19.883190	2701cb73	116	29	1.0000	DISCARD	gen=465 glyphs=4
2026-03-14T01:50:20.145938	19355583	120	30	1.0000	DISCARD	gen=509 glyphs=4
2026-03-14T01:50:22.562646	5a06ca32	120	30	1.0000	DISCARD	gen=465 glyphs=4
2026-03-14T01:50:22.842653	8aef8872	116	29	1.0000	DISCARD	gen=509 glyphs=4
2026-03-14T01:50:25.263879	5c6b7879	120	30	1.0000	DISCARD	gen=465 glyphs=4
2026-03-14T01:50:25.527904	1e5f0e21	116	29	1.0000	DISCARD	gen=509 glyphs=4
2026-03-14T01:50:28.053082	891c3702	116	29	1.0000	DISCARD	gen=465 glyphs=4
2026-03-14T01:50:28.311598	810a349f	116	29	1.0000	DISCARD	gen=509 glyphs=4
2026-03-14T01:50:30.732465	0df57852	116	29	1.0000	DISCARD	gen=465 glyphs=4
2026-03-14T01:50:30.996791	050862ad	120	30	1.0000	DISCARD	gen=509 glyphs=4
2026-03-14T01:50:33.442822	cd7be3fd	120	30	1.0000	DISCARD	gen=465 glyphs=4
2026-03-14T01:50:33.719559	67cb81be	120	30	1.0000	DISCARD	gen=509 glyphs=4
2026-03-14T01:50:36.117015	37f4017b	116	29	1.0000	DISCARD	gen=466 glyphs=4
2026-03-14T01:50:36.397922	ae44ace5	116	29	1.0000	DISCARD	gen=509 glyphs=4
2026-03-14T01:50:38.819220	bfdf7cad	120	30	1.0000	DISCARD	gen=466 glyphs=4
2026-03-14T01:50:39.091835	19355583	120	30	1.0000	DISCARD	gen=510 glyphs=4
2026-03-14T01:50:41.481287	55d6c151	120	30	1.0000	DISCARD	gen=466 glyphs=4
2026-03-14T01:50:41.752800	8aef8872	116	29	1.0000	DISCARD	gen=510 glyphs=4
2026-03-14T01:50:44.184207	5a06ca32	120	30	1.0000	DISCARD	gen=466 glyphs=4
2026-03-14T01:50:44.443237	fb0b3b33	116	29	1.0000	DISCARD	gen=510 glyphs=4
2026-03-14T01:50:46.885361	5b9807ac	120	30	1.0000	DISCARD	gen=466 glyphs=4
2026-03-14T01:50:47.149924	ca8b1bac	120	30	1.0000	DISCARD	gen=510 glyphs=4
2026-03-14T01:50:49.579544	5a06ca32	120	30	1.0000	DISCARD	gen=466 glyphs=4
2026-03-14T01:50:49.837430	e2cd28ea	120	30	1.0000	DISCARD	gen=510 glyphs=4
2026-03-14T01:50:52.277820	5b9807ac	120	30	1.0000	DISCARD	gen=466 glyphs=4
2026-03-14T01:50:52.545279	a7835e2a	120	30	1.0000	DISCARD	gen=510 glyphs=4
2026-03-14T01:50:54.942782	4c9b0dd4	120	30	1.0000	DISCARD	gen=466 glyphs=4
2026-03-14T01:50:55.216068	8aef8872	116	29	1.0000	DISCARD	gen=510 glyphs=4
2026-03-14T01:50:57.697596	37f4017b	116	29	1.0000	DISCARD	gen=466 glyphs=4
2026-03-14T01:50:57.959616	d7c8681b	120	30	1.0000	DISCARD	gen=510 glyphs=4
2026-03-14T01:51:00.455345	4c9b0dd4	120	30	1.0000	DISCARD	gen=466 glyphs=4
2026-03-14T01:51:00.715995	71f2ec4c	116	29	1.0000	DISCARD	gen=510 glyphs=4
2026-03-14T01:51:03.150946	37f4017b	116	29	1.0000	DISCARD	gen=467 glyphs=4
2026-03-14T01:51:03.423015	1fc0a667	116	29	1.0000	DISCARD	gen=510 glyphs=4
2026-03-14T01:51:05.855367	bfdf7cad	120	30	1.0000	DISCARD	gen=467 glyphs=4
2026-03-14T01:51:06.123463	19355583	120	30	1.0000	DISCARD	gen=511 glyphs=4
2026-03-14T01:51:08.555253	fd1f69db	116	29	1.0000	DISCARD	gen=467 glyphs=4
2026-03-14T01:51:08.829023	8aef8872	116	29	1.0000	DISCARD	gen=511 glyphs=4
2026-03-14T01:51:11.236662	37f4017b	116	29	1.0000	DISCARD	gen=467 glyphs=4
2026-03-14T01:51:11.514340	0eaedb57	116	29	1.0000	DISCARD	gen=511 glyphs=4
2026-03-14T01:51:13.945505	1a328f9a	116	29	1.0000	DISCARD	gen=467 glyphs=4
2026-03-14T01:51:14.214815	e8c7f6cf	120	30	1.0000	DISCARD	gen=511 glyphs=4
2026-03-14T01:51:16.646397	71e2ba66	116	29	1.0000	DISCARD	gen=467 glyphs=4
2026-03-14T01:51:16.930784	37ed44db	120	30	1.0000	DISCARD	gen=511 glyphs=4
2026-03-14T01:51:19.353647	7ca87b42	116	29	1.0000	DISCARD	gen=467 glyphs=4
2026-03-14T01:51:19.617307	19355583	120	30	1.0000	DISCARD	gen=511 glyphs=4
2026-03-14T01:51:22.062129	bfdf7cad	120	30	1.0000	DISCARD	gen=467 glyphs=4
2026-03-14T01:51:22.323729	76a9964f	116	29	1.0000	DISCARD	gen=511 glyphs=4
2026-03-14T01:51:24.757811	7775c40e	116	29	0.9500	DISCARD	gen=467 glyphs=4
2026-03-14T01:51:25.022369	fa567c40	116	29	1.0000	DISCARD	gen=511 glyphs=4
2026-03-14T01:51:27.449326	1d34459a	116	29	1.0000	DISCARD	gen=467 glyphs=4
2026-03-14T01:51:27.729194	bd61ef46	116	29	0.9500	DISCARD	gen=511 glyphs=4
2026-03-14T01:51:30.244442	37f4017b	116	29	1.0000	DISCARD	gen=468 glyphs=4
2026-03-14T01:51:30.519368	cdc444c9	116	29	1.0000	DISCARD	gen=511 glyphs=4
2026-03-14T01:51:32.934362	bfdf7cad	120	30	1.0000	DISCARD	gen=468 glyphs=4
2026-03-14T01:51:33.217023	19355583	120	30	1.0000	DISCARD	gen=512 glyphs=4
2026-03-14T01:51:35.639766	7ca87b42	116	29	1.0000	DISCARD	gen=468 glyphs=4
2026-03-14T01:51:35.913506	8aef8872	116	29	1.0000	DISCARD	gen=512 glyphs=4
2026-03-14T01:51:38.317527	bfdf7cad	120	30	1.0000	DISCARD	gen=468 glyphs=4
2026-03-14T01:51:38.585050	0eaedb57	116	29	1.0000	DISCARD	gen=512 glyphs=4
2026-03-14T01:51:40.989538	5a06ca32	120	30	1.0000	DISCARD	gen=468 glyphs=4
2026-03-14T01:51:41.257721	0eaedb57	116	29	1.0000	DISCARD	gen=512 glyphs=4
2026-03-14T01:51:43.703976	55d6c151	120	30	1.0000	DISCARD	gen=468 glyphs=4
2026-03-14T01:51:43.972720	67cb81be	120	30	1.0000	DISCARD	gen=512 glyphs=4
2026-03-14T01:51:46.373004	3e449c12	116	29	1.0000	DISCARD	gen=468 glyphs=4
2026-03-14T01:51:46.649622	6cbe7cf6	116	29	1.0000	DISCARD	gen=512 glyphs=4
2026-03-14T01:51:49.089263	fdb5d108	120	30	1.0000	DISCARD	gen=468 glyphs=4
2026-03-14T01:51:49.353716	050862ad	120	30	1.0000	DISCARD	gen=512 glyphs=4
2026-03-14T01:51:51.759566	55d6c151	120	30	1.0000	DISCARD	gen=468 glyphs=4
2026-03-14T01:51:52.027506	d7c8681b	120	30	1.0000	DISCARD	gen=512 glyphs=4
2026-03-14T01:51:54.438276	948b28e2	120	30	1.0000	DISCARD	gen=468 glyphs=4
2026-03-14T01:51:54.711865	e87330c1	120	30	0.9500	DISCARD	gen=512 glyphs=4
2026-03-14T01:51:57.152175	37f4017b	116	29	1.0000	DISCARD	gen=469 glyphs=4
2026-03-14T01:51:57.434840	0eaedb57	116	29	1.0000	DISCARD	gen=512 glyphs=4
2026-03-14T01:51:59.874394	bfdf7cad	120	30	1.0000	DISCARD	gen=469 glyphs=4
2026-03-14T01:52:00.139650	19355583	120	30	1.0000	DISCARD	gen=513 glyphs=4
2026-03-14T01:52:02.640859	71e2ba66	116	29	1.0000	DISCARD	gen=469 glyphs=4
2026-03-14T01:52:02.911374	8aef8872	116	29	1.0000	DISCARD	gen=513 glyphs=4
2026-03-14T01:52:05.335100	5a06ca32	120	30	1.0000	DISCARD	gen=469 glyphs=4
2026-03-14T01:52:05.601735	8aef8872	116	29	1.0000	DISCARD	gen=513 glyphs=4
2026-03-14T01:52:08.000113	5a06ca32	120	30	1.0000	DISCARD	gen=469 glyphs=4
2026-03-14T01:52:08.264669	8aef8872	116	29	1.0000	DISCARD	gen=513 glyphs=4
2026-03-14T01:52:10.702455	d11c1062	120	30	1.0000	DISCARD	gen=469 glyphs=4
2026-03-14T01:52:10.960814	8aef8872	116	29	1.0000	DISCARD	gen=513 glyphs=4
2026-03-14T01:52:13.399382	62469db6	120	30	1.0000	DISCARD	gen=469 glyphs=4
2026-03-14T01:52:13.666513	875e0f8a	116	29	1.0000	DISCARD	gen=513 glyphs=4
2026-03-14T01:52:16.079783	82b932ef	120	30	1.0000	DISCARD	gen=469 glyphs=4
2026-03-14T01:52:16.337576	d7c8681b	120	30	1.0000	DISCARD	gen=513 glyphs=4
2026-03-14T01:52:18.778133	fdb5d108	120	30	1.0000	DISCARD	gen=469 glyphs=4
2026-03-14T01:52:19.048984	d21ae290	116	29	1.0000	DISCARD	gen=513 glyphs=4
2026-03-14T01:52:21.496093	37f4017b	116	29	1.0000	DISCARD	gen=469 glyphs=4
2026-03-14T01:52:21.762969	050862ad	120	30	1.0000	DISCARD	gen=513 glyphs=4
2026-03-14T01:52:24.198915	37f4017b	116	29	1.0000	DISCARD	gen=470 glyphs=4
2026-03-14T01:52:24.464842	ae44ace5	116	29	1.0000	DISCARD	gen=513 glyphs=4
2026-03-14T01:52:26.871012	bfdf7cad	120	30	1.0000	DISCARD	gen=470 glyphs=4
2026-03-14T01:52:27.151602	19355583	120	30	1.0000	DISCARD	gen=514 glyphs=4
2026-03-14T01:52:29.589020	55d6c151	120	30	1.0000	DISCARD	gen=470 glyphs=4
2026-03-14T01:52:29.851548	8aef8872	116	29	1.0000	DISCARD	gen=514 glyphs=4
2026-03-14T01:52:32.276174	4c9b0dd4	120	30	1.0000	DISCARD	gen=470 glyphs=4
2026-03-14T01:52:32.558375	f9af8fc1	116	29	1.0000	DISCARD	gen=514 glyphs=4
2026-03-14T01:52:35.002141	9edc2da0	116	29	1.0000	DISCARD	gen=470 glyphs=4
2026-03-14T01:52:35.268578	050862ad	120	30	1.0000	DISCARD	gen=514 glyphs=4
2026-03-14T01:52:37.676648	704367c7	116	29	1.0000	DISCARD	gen=470 glyphs=4
2026-03-14T01:52:37.957625	b7aed8e9	116	29	1.0000	DISCARD	gen=514 glyphs=4
2026-03-14T01:52:40.371407	37f4017b	116	29	1.0000	DISCARD	gen=470 glyphs=4
2026-03-14T01:52:40.660052	8aef8872	116	29	1.0000	DISCARD	gen=514 glyphs=4
2026-03-14T01:52:43.080217	7a9c5e15	120	30	0.9500	DISCARD	gen=470 glyphs=4
2026-03-14T01:52:43.360337	875e0f8a	116	29	1.0000	DISCARD	gen=514 glyphs=4
2026-03-14T01:52:45.778614	37f4017b	116	29	1.0000	DISCARD	gen=470 glyphs=4
2026-03-14T01:52:46.044072	8aef8872	116	29	1.0000	DISCARD	gen=514 glyphs=4
2026-03-14T01:52:48.493564	28496d11	116	29	1.0000	DISCARD	gen=470 glyphs=4
2026-03-14T01:52:48.751947	c2b2d677	120	30	1.0000	DISCARD	gen=514 glyphs=4
2026-03-14T01:52:51.182475	37f4017b	116	29	1.0000	DISCARD	gen=471 glyphs=4
2026-03-14T01:52:51.446742	19355583	120	30	1.0000	DISCARD	gen=514 glyphs=4
2026-03-14T01:52:53.867663	bfdf7cad	120	30	1.0000	DISCARD	gen=471 glyphs=4
2026-03-14T01:52:54.137288	19355583	120	30	1.0000	DISCARD	gen=515 glyphs=4
2026-03-14T01:52:56.580857	140ffc4b	124	31	0.9500	DISCARD	gen=471 glyphs=4
2026-03-14T01:52:56.860770	8aef8872	116	29	1.0000	DISCARD	gen=515 glyphs=4
2026-03-14T01:52:59.273795	40dcd163	116	29	1.0000	DISCARD	gen=471 glyphs=4
2026-03-14T01:52:59.531588	67cb81be	120	30	1.0000	DISCARD	gen=515 glyphs=4
2026-03-14T01:53:01.979634	9ac2b55e	116	29	1.0000	DISCARD	gen=471 glyphs=4
2026-03-14T01:53:02.238013	602875d5	116	29	1.0000	DISCARD	gen=515 glyphs=4
2026-03-14T01:53:04.650214	37f4017b	116	29	1.0000	DISCARD	gen=471 glyphs=4
2026-03-14T01:53:04.923817	d7c8681b	120	30	1.0000	DISCARD	gen=515 glyphs=4
2026-03-14T01:53:07.408913	37f4017b	116	29	1.0000	DISCARD	gen=471 glyphs=4
2026-03-14T01:53:07.677270	8aef8872	116	29	1.0000	DISCARD	gen=515 glyphs=4
2026-03-14T01:53:10.092083	5a06ca32	120	30	1.0000	DISCARD	gen=471 glyphs=4
2026-03-14T01:53:10.360951	8bed451e	120	30	1.0000	DISCARD	gen=515 glyphs=4
2026-03-14T01:53:12.807402	55d6c151	120	30	1.0000	DISCARD	gen=471 glyphs=4
2026-03-14T01:53:13.083794	27094bd4	116	29	0.9500	DISCARD	gen=515 glyphs=4
2026-03-14T01:53:15.504601	871864e7	120	30	1.0000	DISCARD	gen=471 glyphs=4
2026-03-14T01:53:15.773141	6c96205c	116	29	1.0000	DISCARD	gen=515 glyphs=4
2026-03-14T01:53:18.170265	37f4017b	116	29	1.0000	DISCARD	gen=472 glyphs=4
2026-03-14T01:53:18.432754	0d1d1d58	116	29	0.9500	DISCARD	gen=515 glyphs=4
2026-03-14T01:53:20.851894	bfdf7cad	120	30	1.0000	DISCARD	gen=472 glyphs=4
2026-03-14T01:53:21.127827	19355583	120	30	1.0000	DISCARD	gen=516 glyphs=4
2026-03-14T01:53:23.542204	2701cb73	116	29	1.0000	DISCARD	gen=472 glyphs=4
2026-03-14T01:53:23.806933	8aef8872	116	29	1.0000	DISCARD	gen=516 glyphs=4
2026-03-14T01:53:26.227058	5b9807ac	120	30	1.0000	DISCARD	gen=472 glyphs=4
2026-03-14T01:53:26.494507	ae44ace5	116	29	1.0000	DISCARD	gen=516 glyphs=4
2026-03-14T01:53:28.917846	4c9b0dd4	120	30	1.0000	DISCARD	gen=472 glyphs=4
2026-03-14T01:53:29.196586	13962bad	116	29	1.0000	DISCARD	gen=516 glyphs=4
2026-03-14T01:53:31.648013	37f4017b	116	29	1.0000	DISCARD	gen=472 glyphs=4
2026-03-14T01:53:31.909651	0dbb6c31	116	29	0.9500	DISCARD	gen=516 glyphs=4
2026-03-14T01:53:34.385865	55d6c151	120	30	1.0000	DISCARD	gen=472 glyphs=4
2026-03-14T01:53:34.652206	74183b44	116	29	1.0000	DISCARD	gen=516 glyphs=4
2026-03-14T01:53:37.130417	e5394ea9	116	29	0.9500	DISCARD	gen=472 glyphs=4
2026-03-14T01:53:37.398497	8aef8872	116	29	1.0000	DISCARD	gen=516 glyphs=4
2026-03-14T01:53:39.830157	55d6c151	120	30	1.0000	DISCARD	gen=472 glyphs=4
2026-03-14T01:53:40.096159	0eaedb57	116	29	1.0000	DISCARD	gen=516 glyphs=4
2026-03-14T01:53:42.500032	bbff3f23	116	29	1.0000	DISCARD	gen=472 glyphs=4
2026-03-14T01:53:42.761495	8d0b79e6	116	29	1.0000	DISCARD	gen=516 glyphs=4
2026-03-14T01:53:45.168235	37f4017b	116	29	1.0000	DISCARD	gen=473 glyphs=4
2026-03-14T01:53:45.442954	8aef8872	116	29	1.0000	DISCARD	gen=516 glyphs=4
2026-03-14T01:53:47.917104	bfdf7cad	120	30	1.0000	DISCARD	gen=473 glyphs=4
2026-03-14T01:53:48.179936	19355583	120	30	1.0000	DISCARD	gen=517 glyphs=4
2026-03-14T01:53:50.589076	55d6c151	120	30	1.0000	DISCARD	gen=473 glyphs=4
2026-03-14T01:53:50.864317	8aef8872	116	29	1.0000	DISCARD	gen=517 glyphs=4
2026-03-14T01:53:53.314084	55d6c151	120	30	1.0000	DISCARD	gen=473 glyphs=4
2026-03-14T01:53:53.582143	e4ab7656	120	30	1.0000	DISCARD	gen=517 glyphs=4
2026-03-14T01:53:55.980954	d9ec40f1	116	29	1.0000	DISCARD	gen=473 glyphs=4
2026-03-14T01:53:56.251745	eca7ab6c	116	29	1.0000	DISCARD	gen=517 glyphs=4
2026-03-14T01:53:58.668865	5a06ca32	120	30	1.0000	DISCARD	gen=473 glyphs=4
2026-03-14T01:53:58.940057	d9fa0918	116	29	1.0000	DISCARD	gen=517 glyphs=4
2026-03-14T01:54:01.344761	572d9737	116	29	1.0000	DISCARD	gen=473 glyphs=4
2026-03-14T01:54:01.612977	050862ad	120	30	1.0000	DISCARD	gen=517 glyphs=4
2026-03-14T01:54:04.043438	fdb5d108	120	30	1.0000	DISCARD	gen=473 glyphs=4
2026-03-14T01:54:04.312977	9e34ede0	116	29	1.0000	DISCARD	gen=517 glyphs=4
2026-03-14T01:54:06.733539	291294e3	120	30	1.0000	DISCARD	gen=473 glyphs=4
2026-03-14T01:54:07.003949	8aef8872	116	29	1.0000	DISCARD	gen=517 glyphs=4
2026-03-14T01:54:09.527967	8ad088c9	116	29	1.0000	DISCARD	gen=473 glyphs=4
2026-03-14T01:54:09.793824	0eaedb57	116	29	1.0000	DISCARD	gen=517 glyphs=4
2026-03-14T01:54:12.244558	37f4017b	116	29	1.0000	DISCARD	gen=474 glyphs=4
2026-03-14T01:54:12.520698	8aef8872	116	29	1.0000	DISCARD	gen=517 glyphs=4
2026-03-14T01:54:14.914611	bfdf7cad	120	30	1.0000	DISCARD	gen=474 glyphs=4
2026-03-14T01:54:15.189891	19355583	120	30	1.0000	DISCARD	gen=518 glyphs=4
2026-03-14T01:54:17.629639	7ca87b42	116	29	1.0000	DISCARD	gen=474 glyphs=4
2026-03-14T01:54:17.896544	8aef8872	116	29	1.0000	DISCARD	gen=518 glyphs=4
2026-03-14T01:54:20.349211	ba694ea0	120	30	1.0000	DISCARD	gen=474 glyphs=4
2026-03-14T01:54:20.616748	eca7ab6c	116	29	1.0000	DISCARD	gen=518 glyphs=4
2026-03-14T01:54:23.041713	60c2757e	116	29	1.0000	DISCARD	gen=474 glyphs=4
2026-03-14T01:54:23.319080	050862ad	120	30	1.0000	DISCARD	gen=518 glyphs=4
2026-03-14T01:54:25.733818	957fc12b	116	29	1.0000	DISCARD	gen=474 glyphs=4
2026-03-14T01:54:26.003240	9e34ede0	116	29	1.0000	DISCARD	gen=518 glyphs=4
2026-03-14T01:54:28.407046	d11c1062	120	30	1.0000	DISCARD	gen=474 glyphs=4
2026-03-14T01:54:28.677909	00fc3a47	116	29	1.0000	DISCARD	gen=518 glyphs=4
2026-03-14T01:54:31.091910	9bcfb927	116	29	1.0000	DISCARD	gen=474 glyphs=4
2026-03-14T01:54:31.365276	a78f9454	120	30	1.0000	DISCARD	gen=518 glyphs=4
2026-03-14T01:54:33.776861	7705b4ab	116	29	0.9500	DISCARD	gen=474 glyphs=4
2026-03-14T01:54:34.051021	341ea87c	116	29	1.0000	DISCARD	gen=518 glyphs=4
2026-03-14T01:54:36.485756	982d6359	120	30	1.0000	DISCARD	gen=474 glyphs=4
2026-03-14T01:54:36.741457	8aef8872	116	29	1.0000	DISCARD	gen=518 glyphs=4
2026-03-14T01:54:39.176873	37f4017b	116	29	1.0000	DISCARD	gen=475 glyphs=4
2026-03-14T01:54:39.446544	0eaedb57	116	29	1.0000	DISCARD	gen=518 glyphs=4
2026-03-14T01:54:41.938825	bfdf7cad	120	30	1.0000	DISCARD	gen=475 glyphs=4
2026-03-14T01:54:42.205424	19355583	120	30	1.0000	DISCARD	gen=519 glyphs=4
2026-03-14T01:54:44.614639	6f44e6b6	120	30	1.0000	DISCARD	gen=475 glyphs=4
2026-03-14T01:54:44.892327	8aef8872	116	29	1.0000	DISCARD	gen=519 glyphs=4
2026-03-14T01:54:47.294182	37f4017b	116	29	1.0000	DISCARD	gen=475 glyphs=4
2026-03-14T01:54:47.562437	0eaedb57	116	29	1.0000	DISCARD	gen=519 glyphs=4
2026-03-14T01:54:49.975917	66e56e41	116	29	1.0000	DISCARD	gen=475 glyphs=4
2026-03-14T01:54:50.248423	b57e7176	120	30	1.0000	DISCARD	gen=519 glyphs=4
2026-03-14T01:54:52.670058	37f4017b	116	29	1.0000	DISCARD	gen=475 glyphs=4
2026-03-14T01:54:52.951429	67fbba97	120	30	1.0000	DISCARD	gen=519 glyphs=4
2026-03-14T01:54:55.356649	37f4017b	116	29	1.0000	DISCARD	gen=475 glyphs=4
2026-03-14T01:54:55.618537	8aef8872	116	29	1.0000	DISCARD	gen=519 glyphs=4
2026-03-14T01:54:58.008559	54e4a3e9	116	29	1.0000	DISCARD	gen=475 glyphs=4
2026-03-14T01:54:58.270471	faf60f00	120	30	1.0000	DISCARD	gen=519 glyphs=4
2026-03-14T01:55:00.684592	4fb31553	116	29	1.0000	DISCARD	gen=475 glyphs=4
2026-03-14T01:55:00.953134	bbc1434f	116	29	1.0000	DISCARD	gen=519 glyphs=4
