timestamp	program_hash	spirv_size	word_count	fitness	status	description
2026-03-14T02:14:56.780113	bfdf7cad	120	30	1.0000	DISCARD	gen=519 glyphs=4
2026-03-14T02:14:57.050876	272d0a23	116	29	1.0000	DISCARD	gen=563 glyphs=4
2026-03-14T02:14:59.527597	55d6c151	120	30	1.0000	DISCARD	gen=519 glyphs=4
2026-03-14T02:14:59.800037	875e0f8a	116	29	1.0000	DISCARD	gen=563 glyphs=4
2026-03-14T02:15:02.279954	fdb5d108	120	30	1.0000	DISCARD	gen=519 glyphs=4
2026-03-14T02:15:02.547922	e2cd28ea	120	30	1.0000	DISCARD	gen=563 glyphs=4
2026-03-14T02:15:05.037458	37f4017b	116	29	1.0000	DISCARD	gen=520 glyphs=4
2026-03-14T02:15:05.305781	72f62fd3	120	30	1.0000	DISCARD	gen=563 glyphs=4
2026-03-14T02:15:07.804334	bfdf7cad	120	30	1.0000	DISCARD	gen=520 glyphs=4
2026-03-14T02:15:08.073322	19355583	120	30	1.0000	DISCARD	gen=564 glyphs=4
2026-03-14T02:15:10.558658	5a06ca32	120	30	1.0000	DISCARD	gen=520 glyphs=4
2026-03-14T02:15:10.835264	8aef8872	116	29	1.0000	DISCARD	gen=564 glyphs=4
2026-03-14T02:15:13.343365	f6e6f491	120	30	1.0000	DISCARD	gen=520 glyphs=4
2026-03-14T02:15:13.605364	33cc5590	116	29	1.0000	DISCARD	gen=564 glyphs=4
2026-03-14T02:15:16.111650	55d6c151	120	30	1.0000	DISCARD	gen=520 glyphs=4
2026-03-14T02:15:16.380947	050862ad	120	30	1.0000	DISCARD	gen=564 glyphs=4
2026-03-14T02:15:18.862690	2701cb73	116	29	1.0000	DISCARD	gen=520 glyphs=4
2026-03-14T02:15:19.138443	050862ad	120	30	1.0000	DISCARD	gen=564 glyphs=4
2026-03-14T02:15:21.647200	29c06cae	116	29	0.9500	DISCARD	gen=520 glyphs=4
2026-03-14T02:15:21.959731	19355583	120	30	1.0000	DISCARD	gen=564 glyphs=4
2026-03-14T02:15:24.442488	8b09f1d3	120	30	1.0000	DISCARD	gen=520 glyphs=4
2026-03-14T02:15:24.724915	9ea779ad	116	29	1.0000	DISCARD	gen=564 glyphs=4
2026-03-14T02:15:27.188736	32dec8ff	116	29	1.0000	DISCARD	gen=520 glyphs=4
2026-03-14T02:15:27.454075	a98647b6	116	29	1.0000	DISCARD	gen=564 glyphs=4
2026-03-14T02:15:29.944979	55d6c151	120	30	1.0000	DISCARD	gen=520 glyphs=4
2026-03-14T02:15:30.224158	ca96e487	116	29	1.0000	DISCARD	gen=564 glyphs=4
2026-03-14T02:15:32.714056	37f4017b	116	29	1.0000	DISCARD	gen=521 glyphs=4
2026-03-14T02:15:32.990136	67cb81be	120	30	1.0000	DISCARD	gen=564 glyphs=4
2026-03-14T02:15:35.475758	bfdf7cad	120	30	1.0000	DISCARD	gen=521 glyphs=4
2026-03-14T02:15:35.747045	19355583	120	30	1.0000	DISCARD	gen=565 glyphs=4
2026-03-14T02:15:38.223348	37f4017b	116	29	1.0000	DISCARD	gen=521 glyphs=4
2026-03-14T02:15:38.492842	8aef8872	116	29	1.0000	DISCARD	gen=565 glyphs=4
2026-03-14T02:15:40.967148	1d34459a	116	29	1.0000	DISCARD	gen=521 glyphs=4
2026-03-14T02:15:41.237241	e2cd28ea	120	30	1.0000	DISCARD	gen=565 glyphs=4
2026-03-14T02:15:43.726013	58524e12	120	30	1.0000	DISCARD	gen=521 glyphs=4
2026-03-14T02:15:43.998889	19355583	120	30	1.0000	DISCARD	gen=565 glyphs=4
2026-03-14T02:15:46.472554	37f4017b	116	29	1.0000	DISCARD	gen=521 glyphs=4
2026-03-14T02:15:46.750048	eca7ab6c	116	29	1.0000	DISCARD	gen=565 glyphs=4
2026-03-14T02:15:49.207467	5a06ca32	120	30	1.0000	DISCARD	gen=521 glyphs=4
2026-03-14T02:15:49.476345	050862ad	120	30	1.0000	DISCARD	gen=565 glyphs=4
2026-03-14T02:15:51.937231	5a06ca32	120	30	1.0000	DISCARD	gen=521 glyphs=4
2026-03-14T02:15:52.212934	b57e7176	120	30	1.0000	DISCARD	gen=565 glyphs=4
2026-03-14T02:15:54.848804	bfdf7cad	120	30	1.0000	DISCARD	gen=521 glyphs=4
2026-03-14T02:15:55.114652	3308bac7	116	29	1.0000	DISCARD	gen=565 glyphs=4
2026-03-14T02:15:57.588707	bfdf7cad	120	30	1.0000	DISCARD	gen=521 glyphs=4
2026-03-14T02:15:57.870369	c6e7df86	116	29	1.0000	DISCARD	gen=565 glyphs=4
2026-03-14T02:16:00.364734	37f4017b	116	29	1.0000	DISCARD	gen=522 glyphs=4
2026-03-14T02:16:00.637233	9e34ede0	116	29	1.0000	DISCARD	gen=565 glyphs=4
2026-03-14T02:16:03.134750	bfdf7cad	120	30	1.0000	DISCARD	gen=522 glyphs=4
2026-03-14T02:16:03.404790	19355583	120	30	1.0000	DISCARD	gen=566 glyphs=4
2026-03-14T02:16:05.881566	691c56e1	120	30	1.0000	DISCARD	gen=522 glyphs=4
2026-03-14T02:16:06.170403	8aef8872	116	29	1.0000	DISCARD	gen=566 glyphs=4
2026-03-14T02:16:08.628544	11e4d8b9	120	30	1.0000	DISCARD	gen=522 glyphs=4
2026-03-14T02:16:08.905704	050862ad	120	30	1.0000	DISCARD	gen=566 glyphs=4
2026-03-14T02:16:11.373777	dca08a98	116	29	0.9500	DISCARD	gen=522 glyphs=4
2026-03-14T02:16:11.649186	e495af07	120	30	1.0000	DISCARD	gen=566 glyphs=4
2026-03-14T02:16:14.107787	b52349bb	116	29	1.0000	DISCARD	gen=522 glyphs=4
2026-03-14T02:16:14.381400	9e34ede0	116	29	1.0000	DISCARD	gen=566 glyphs=4
2026-03-14T02:16:16.850727	cd57524b	120	30	0.9500	DISCARD	gen=522 glyphs=4
2026-03-14T02:16:17.121078	67cb81be	120	30	1.0000	DISCARD	gen=566 glyphs=4
2026-03-14T02:16:19.589939	bfdf7cad	120	30	1.0000	DISCARD	gen=522 glyphs=4
2026-03-14T02:16:19.870372	d46faded	116	29	1.0000	DISCARD	gen=566 glyphs=4
2026-03-14T02:16:22.342265	5a06ca32	120	30	1.0000	DISCARD	gen=522 glyphs=4
2026-03-14T02:16:22.627647	36144c31	120	30	1.0000	DISCARD	gen=566 glyphs=4
2026-03-14T02:16:25.129981	37f4017b	116	29	1.0000	DISCARD	gen=522 glyphs=4
2026-03-14T02:16:25.408058	e2cd28ea	120	30	1.0000	DISCARD	gen=566 glyphs=4
2026-03-14T02:16:27.902314	37f4017b	116	29	1.0000	DISCARD	gen=523 glyphs=4
2026-03-14T02:16:28.166762	8aef8872	116	29	1.0000	DISCARD	gen=566 glyphs=4
2026-03-14T02:16:30.627112	bfdf7cad	120	30	1.0000	DISCARD	gen=523 glyphs=4
2026-03-14T02:16:30.903568	19355583	120	30	1.0000	DISCARD	gen=567 glyphs=4
2026-03-14T02:16:33.374186	55d6c151	120	30	1.0000	DISCARD	gen=523 glyphs=4
2026-03-14T02:16:33.655076	8aef8872	116	29	1.0000	DISCARD	gen=567 glyphs=4
2026-03-14T02:16:36.147890	37f4017b	116	29	1.0000	DISCARD	gen=523 glyphs=4
2026-03-14T02:16:36.425407	2aa33884	116	29	1.0000	DISCARD	gen=567 glyphs=4
2026-03-14T02:16:38.892215	2701cb73	116	29	1.0000	DISCARD	gen=523 glyphs=4
2026-03-14T02:16:39.177070	8aef8872	116	29	1.0000	DISCARD	gen=567 glyphs=4
2026-03-14T02:16:41.643405	5b9807ac	120	30	1.0000	DISCARD	gen=523 glyphs=4
2026-03-14T02:16:41.916137	fa6556d4	116	29	1.0000	DISCARD	gen=567 glyphs=4
2026-03-14T02:16:44.400867	78e16bea	120	30	1.0000	DISCARD	gen=523 glyphs=4
2026-03-14T02:16:44.663060	67cb81be	120	30	1.0000	DISCARD	gen=567 glyphs=4
2026-03-14T02:16:47.130829	ec256af7	116	29	1.0000	DISCARD	gen=523 glyphs=4
2026-03-14T02:16:47.412883	875e0f8a	116	29	1.0000	DISCARD	gen=567 glyphs=4
2026-03-14T02:16:49.857998	12b38c2d	116	29	1.0000	DISCARD	gen=523 glyphs=4
2026-03-14T02:16:50.131489	e8c7f6cf	120	30	1.0000	DISCARD	gen=567 glyphs=4
2026-03-14T02:16:52.585186	37f4017b	116	29	1.0000	DISCARD	gen=523 glyphs=4
2026-03-14T02:16:52.865908	35470c16	120	30	1.0000	DISCARD	gen=567 glyphs=4
2026-03-14T02:16:55.347910	37f4017b	116	29	1.0000	DISCARD	gen=524 glyphs=4
2026-03-14T02:16:55.615424	0b3118b2	116	29	1.0000	DISCARD	gen=567 glyphs=4
2026-03-14T02:16:58.204615	bfdf7cad	120	30	1.0000	DISCARD	gen=524 glyphs=4
2026-03-14T02:16:58.475036	19355583	120	30	1.0000	DISCARD	gen=568 glyphs=4
2026-03-14T02:17:00.935273	2701cb73	116	29	1.0000	DISCARD	gen=524 glyphs=4
2026-03-14T02:17:01.209769	8aef8872	116	29	1.0000	DISCARD	gen=568 glyphs=4
2026-03-14T02:17:03.679591	37f4017b	116	29	1.0000	DISCARD	gen=524 glyphs=4
2026-03-14T02:17:03.955152	19355583	120	30	1.0000	DISCARD	gen=568 glyphs=4
2026-03-14T02:17:06.442548	fdb5d108	120	30	1.0000	DISCARD	gen=524 glyphs=4
2026-03-14T02:17:06.711624	7e39edcb	120	30	1.0000	DISCARD	gen=568 glyphs=4
2026-03-14T02:17:09.167267	3c29488e	116	29	1.0000	DISCARD	gen=524 glyphs=4
2026-03-14T02:17:09.439557	19355583	120	30	1.0000	DISCARD	gen=568 glyphs=4
2026-03-14T02:17:11.937524	fdb5d108	120	30	1.0000	DISCARD	gen=524 glyphs=4
2026-03-14T02:17:12.212023	0eaedb57	116	29	1.0000	DISCARD	gen=568 glyphs=4
2026-03-14T02:17:14.688041	52149b1e	116	29	1.0000	DISCARD	gen=524 glyphs=4
2026-03-14T02:17:14.963326	19355583	120	30	1.0000	DISCARD	gen=568 glyphs=4
2026-03-14T02:17:17.420146	2701cb73	116	29	1.0000	DISCARD	gen=524 glyphs=4
2026-03-14T02:17:17.699433	50dc991d	116	29	1.0000	DISCARD	gen=568 glyphs=4
2026-03-14T02:17:20.171340	5a06ca32	120	30	1.0000	DISCARD	gen=524 glyphs=4
2026-03-14T02:17:20.439949	f3798204	116	29	1.0000	DISCARD	gen=568 glyphs=4
2026-03-14T02:17:22.903417	37f4017b	116	29	1.0000	DISCARD	gen=525 glyphs=4
2026-03-14T02:17:23.183431	50dc991d	116	29	1.0000	DISCARD	gen=568 glyphs=4
2026-03-14T02:17:25.668226	bfdf7cad	120	30	1.0000	DISCARD	gen=525 glyphs=4
2026-03-14T02:17:25.942781	19355583	120	30	1.0000	DISCARD	gen=569 glyphs=4
2026-03-14T02:17:28.444491	37f4017b	116	29	1.0000	DISCARD	gen=525 glyphs=4
2026-03-14T02:17:28.721640	8aef8872	116	29	1.0000	DISCARD	gen=569 glyphs=4
2026-03-14T02:17:31.278980	7bc2e8fb	120	30	1.0000	DISCARD	gen=525 glyphs=4
2026-03-14T02:17:31.558278	219109cd	116	29	1.0000	DISCARD	gen=569 glyphs=4
2026-03-14T02:17:34.028538	37f4017b	116	29	1.0000	DISCARD	gen=525 glyphs=4
2026-03-14T02:17:34.299084	ae44ace5	116	29	1.0000	DISCARD	gen=569 glyphs=4
2026-03-14T02:17:36.773968	37f4017b	116	29	1.0000	DISCARD	gen=525 glyphs=4
2026-03-14T02:17:37.055615	0eaedb57	116	29	1.0000	DISCARD	gen=569 glyphs=4
2026-03-14T02:17:39.526911	55d6c151	120	30	1.0000	DISCARD	gen=525 glyphs=4
2026-03-14T02:17:39.801751	0eaedb57	116	29	1.0000	DISCARD	gen=569 glyphs=4
2026-03-14T02:17:42.278233	5a06ca32	120	30	1.0000	DISCARD	gen=525 glyphs=4
2026-03-14T02:17:42.552633	8aef8872	116	29	1.0000	DISCARD	gen=569 glyphs=4
2026-03-14T02:17:45.024774	82563e75	116	29	1.0000	DISCARD	gen=525 glyphs=4
2026-03-14T02:17:45.293810	050862ad	120	30	1.0000	DISCARD	gen=569 glyphs=4
2026-03-14T02:17:47.768090	8e6471a8	120	30	1.0000	DISCARD	gen=525 glyphs=4
2026-03-14T02:17:48.043041	b7aed8e9	116	29	1.0000	DISCARD	gen=569 glyphs=4
2026-03-14T02:17:50.528307	37f4017b	116	29	1.0000	DISCARD	gen=526 glyphs=4
2026-03-14T02:17:50.800847	8aef8872	116	29	1.0000	DISCARD	gen=569 glyphs=4
2026-03-14T02:17:53.273688	bfdf7cad	120	30	1.0000	DISCARD	gen=526 glyphs=4
2026-03-14T02:17:53.546223	19355583	120	30	1.0000	DISCARD	gen=570 glyphs=4
2026-03-14T02:17:56.032709	5a06ca32	120	30	1.0000	DISCARD	gen=526 glyphs=4
2026-03-14T02:17:56.310932	8aef8872	116	29	1.0000	DISCARD	gen=570 glyphs=4
2026-03-14T02:17:58.785788	9b762729	116	29	1.0000	DISCARD	gen=526 glyphs=4
2026-03-14T02:17:59.077357	9e34ede0	116	29	1.0000	DISCARD	gen=570 glyphs=4
2026-03-14T02:18:01.694232	1d34459a	116	29	1.0000	DISCARD	gen=526 glyphs=4
2026-03-14T02:18:01.960609	3872cbee	120	30	1.0000	DISCARD	gen=570 glyphs=4
2026-03-14T02:18:04.452961	ab08222e	116	29	1.0000	DISCARD	gen=526 glyphs=4
2026-03-14T02:18:04.735640	875e0f8a	116	29	1.0000	DISCARD	gen=570 glyphs=4
2026-03-14T02:18:07.214975	37f4017b	116	29	1.0000	DISCARD	gen=526 glyphs=4
2026-03-14T02:18:07.482811	b57e7176	120	30	1.0000	DISCARD	gen=570 glyphs=4
2026-03-14T02:18:09.966917	5a06ca32	120	30	1.0000	DISCARD	gen=526 glyphs=4
2026-03-14T02:18:10.238928	0eaedb57	116	29	1.0000	DISCARD	gen=570 glyphs=4
2026-03-14T02:18:12.714395	55d6c151	120	30	1.0000	DISCARD	gen=526 glyphs=4
2026-03-14T02:18:12.988619	67cb81be	120	30	1.0000	DISCARD	gen=570 glyphs=4
2026-03-14T02:18:15.473090	fdb5d108	120	30	1.0000	DISCARD	gen=526 glyphs=4
2026-03-14T02:18:15.733253	9b6c929c	116	29	1.0000	DISCARD	gen=570 glyphs=4
2026-03-14T02:18:18.200356	37f4017b	116	29	1.0000	DISCARD	gen=527 glyphs=4
2026-03-14T02:18:18.478101	19355583	120	30	1.0000	DISCARD	gen=570 glyphs=4
2026-03-14T02:18:20.933639	bfdf7cad	120	30	1.0000	DISCARD	gen=527 glyphs=4
2026-03-14T02:18:21.204097	19355583	120	30	1.0000	DISCARD	gen=571 glyphs=4
2026-03-14T02:18:23.701503	37f4017b	116	29	1.0000	DISCARD	gen=527 glyphs=4
2026-03-14T02:18:23.960656	8aef8872	116	29	1.0000	DISCARD	gen=571 glyphs=4
2026-03-14T02:18:26.456101	5a06ca32	120	30	1.0000	DISCARD	gen=527 glyphs=4
2026-03-14T02:18:26.727907	050862ad	120	30	1.0000	DISCARD	gen=571 glyphs=4
2026-03-14T02:18:29.236485	5a06ca32	120	30	1.0000	DISCARD	gen=527 glyphs=4
2026-03-14T02:18:29.509178	2a9ba416	116	29	0.9500	DISCARD	gen=571 glyphs=4
2026-03-14T02:18:31.991510	5a06ca32	120	30	1.0000	DISCARD	gen=527 glyphs=4
2026-03-14T02:18:32.323505	050862ad	120	30	1.0000	DISCARD	gen=571 glyphs=4
2026-03-14T02:18:34.846372	5a06ca32	120	30	1.0000	DISCARD	gen=527 glyphs=4
2026-03-14T02:18:35.130450	8aef8872	116	29	1.0000	DISCARD	gen=571 glyphs=4
2026-03-14T02:18:37.589176	e3dc3f98	116	29	1.0000	DISCARD	gen=527 glyphs=4
2026-03-14T02:18:37.859945	875e0f8a	116	29	1.0000	DISCARD	gen=571 glyphs=4
2026-03-14T02:18:40.341427	55d6c151	120	30	1.0000	DISCARD	gen=527 glyphs=4
2026-03-14T02:18:40.610420	473129e4	116	29	1.0000	DISCARD	gen=571 glyphs=4
2026-03-14T02:18:43.076723	bfdf7cad	120	30	1.0000	DISCARD	gen=527 glyphs=4
2026-03-14T02:18:43.368483	d7c8681b	120	30	1.0000	DISCARD	gen=571 glyphs=4
2026-03-14T02:18:45.826647	37f4017b	116	29	1.0000	DISCARD	gen=528 glyphs=4
2026-03-14T02:18:46.099726	b57e7176	120	30	1.0000	DISCARD	gen=571 glyphs=4
2026-03-14T02:18:48.537279	bfdf7cad	120	30	1.0000	DISCARD	gen=528 glyphs=4
2026-03-14T02:18:48.808787	19355583	120	30	1.0000	DISCARD	gen=572 glyphs=4
2026-03-14T02:18:51.337496	6e843fb4	120	30	1.0000	DISCARD	gen=528 glyphs=4
2026-03-14T02:18:51.619847	8aef8872	116	29	1.0000	DISCARD	gen=572 glyphs=4
2026-03-14T02:18:54.068501	5a06ca32	120	30	1.0000	DISCARD	gen=528 glyphs=4
2026-03-14T02:18:54.365905	875e0f8a	116	29	1.0000	DISCARD	gen=572 glyphs=4
2026-03-14T02:18:56.855195	55d6c151	120	30	1.0000	DISCARD	gen=528 glyphs=4
2026-03-14T02:18:57.133146	b7aed8e9	116	29	1.0000	DISCARD	gen=572 glyphs=4
2026-03-14T02:18:59.598143	5b9807ac	120	30	1.0000	DISCARD	gen=528 glyphs=4
2026-03-14T02:18:59.871641	b57e7176	120	30	1.0000	DISCARD	gen=572 glyphs=4
2026-03-14T02:19:02.322032	37f4017b	116	29	1.0000	DISCARD	gen=528 glyphs=4
2026-03-14T02:19:02.588890	eca7ab6c	116	29	1.0000	DISCARD	gen=572 glyphs=4
2026-03-14T02:19:05.157427	5a06ca32	120	30	1.0000	DISCARD	gen=528 glyphs=4
2026-03-14T02:19:05.444889	b7aed8e9	116	29	1.0000	DISCARD	gen=572 glyphs=4
2026-03-14T02:19:07.912859	bbc6c994	116	29	1.0000	DISCARD	gen=528 glyphs=4
2026-03-14T02:19:08.187637	8ccbf332	116	29	1.0000	DISCARD	gen=572 glyphs=4
2026-03-14T02:19:10.641804	55d6c151	120	30	1.0000	DISCARD	gen=528 glyphs=4
2026-03-14T02:19:10.915821	e2cd28ea	120	30	1.0000	DISCARD	gen=572 glyphs=4
2026-03-14T02:19:13.349465	37f4017b	116	29	1.0000	DISCARD	gen=529 glyphs=4
2026-03-14T02:19:13.617280	8aef8872	116	29	1.0000	DISCARD	gen=572 glyphs=4
2026-03-14T02:19:16.075164	bfdf7cad	120	30	1.0000	DISCARD	gen=529 glyphs=4
2026-03-14T02:19:16.356371	19355583	120	30	1.0000	DISCARD	gen=573 glyphs=4
2026-03-14T02:19:18.787919	5a06ca32	120	30	1.0000	DISCARD	gen=529 glyphs=4
2026-03-14T02:19:19.082131	8aef8872	116	29	1.0000	DISCARD	gen=573 glyphs=4
2026-03-14T02:19:21.547060	5a06ca32	120	30	1.0000	DISCARD	gen=529 glyphs=4
2026-03-14T02:19:21.818345	b1188d87	116	29	1.0000	DISCARD	gen=573 glyphs=4
2026-03-14T02:19:24.310928	fdb5d108	120	30	1.0000	DISCARD	gen=529 glyphs=4
2026-03-14T02:19:24.589209	a78f9454	120	30	1.0000	DISCARD	gen=573 glyphs=4
2026-03-14T02:19:27.048703	5a06ca32	120	30	1.0000	DISCARD	gen=529 glyphs=4
2026-03-14T02:19:27.311776	875e0f8a	116	29	1.0000	DISCARD	gen=573 glyphs=4
2026-03-14T02:19:29.766189	484206f1	116	29	1.0000	DISCARD	gen=529 glyphs=4
2026-03-14T02:19:30.037806	50dc991d	116	29	1.0000	DISCARD	gen=573 glyphs=4
2026-03-14T02:19:32.499822	2701cb73	116	29	1.0000	DISCARD	gen=529 glyphs=4
2026-03-14T02:19:32.781182	96be13e0	116	29	1.0000	DISCARD	gen=573 glyphs=4
2026-03-14T02:19:35.238988	ab43d23b	120	30	1.0000	DISCARD	gen=529 glyphs=4
2026-03-14T02:19:35.508932	e8c7f6cf	120	30	1.0000	DISCARD	gen=573 glyphs=4
2026-03-14T02:19:38.081073	10177bc5	120	30	1.0000	DISCARD	gen=529 glyphs=4
2026-03-14T02:19:38.348493	3461f9a2	116	29	1.0000	DISCARD	gen=573 glyphs=4
2026-03-14T02:19:40.833061	37f4017b	116	29	1.0000	DISCARD	gen=530 glyphs=4
2026-03-14T02:19:41.108663	ec52e27d	116	29	1.0000	DISCARD	gen=573 glyphs=4
2026-03-14T02:19:43.554255	bfdf7cad	120	30	1.0000	DISCARD	gen=530 glyphs=4
2026-03-14T02:19:43.821426	19355583	120	30	1.0000	DISCARD	gen=574 glyphs=4
2026-03-14T02:19:46.306931	37f4017b	116	29	1.0000	DISCARD	gen=530 glyphs=4
2026-03-14T02:19:46.592081	8aef8872	116	29	1.0000	DISCARD	gen=574 glyphs=4
2026-03-14T02:19:49.060869	37f4017b	116	29	1.0000	DISCARD	gen=530 glyphs=4
2026-03-14T02:19:49.338523	daec69bc	116	29	1.0000	DISCARD	gen=574 glyphs=4
2026-03-14T02:19:51.810061	dcc952b2	120	30	1.0000	DISCARD	gen=530 glyphs=4
2026-03-14T02:19:52.079725	50dc991d	116	29	1.0000	DISCARD	gen=574 glyphs=4
2026-03-14T02:19:54.555325	cdd9b54a	120	30	1.0000	DISCARD	gen=530 glyphs=4
2026-03-14T02:19:54.823645	050862ad	120	30	1.0000	DISCARD	gen=574 glyphs=4
2026-03-14T02:19:57.300045	55d6c151	120	30	1.0000	DISCARD	gen=530 glyphs=4
2026-03-14T02:19:57.589381	875e0f8a	116	29	1.0000	DISCARD	gen=574 glyphs=4
2026-03-14T02:20:00.048924	b95e0029	116	29	1.0000	DISCARD	gen=530 glyphs=4
2026-03-14T02:20:00.318201	875e0f8a	116	29	1.0000	DISCARD	gen=574 glyphs=4
2026-03-14T02:20:02.802320	a20e47d1	116	29	1.0000	DISCARD	gen=530 glyphs=4
2026-03-14T02:20:03.080669	ed7d9616	116	29	1.0000	DISCARD	gen=574 glyphs=4
2026-03-14T02:20:05.535097	55d6c151	120	30	1.0000	DISCARD	gen=530 glyphs=4
2026-03-14T02:20:05.813403	eca7ab6c	116	29	1.0000	DISCARD	gen=574 glyphs=4
2026-03-14T02:20:08.381868	37f4017b	116	29	1.0000	DISCARD	gen=531 glyphs=4
2026-03-14T02:20:08.674918	e2cd28ea	120	30	1.0000	DISCARD	gen=574 glyphs=4
2026-03-14T02:20:11.170156	bfdf7cad	120	30	1.0000	DISCARD	gen=531 glyphs=4
2026-03-14T02:20:11.446700	19355583	120	30	1.0000	DISCARD	gen=575 glyphs=4
2026-03-14T02:20:13.899397	37f4017b	116	29	1.0000	DISCARD	gen=531 glyphs=4
2026-03-14T02:20:14.166036	8aef8872	116	29	1.0000	DISCARD	gen=575 glyphs=4
2026-03-14T02:20:16.673826	71e2ba66	116	29	1.0000	DISCARD	gen=531 glyphs=4
2026-03-14T02:20:16.953637	a1e74e48	116	29	1.0000	DISCARD	gen=575 glyphs=4
2026-03-14T02:20:19.449545	4c9b0dd4	120	30	1.0000	DISCARD	gen=531 glyphs=4
2026-03-14T02:20:19.716604	928b6548	120	30	1.0000	DISCARD	gen=575 glyphs=4
2026-03-14T02:20:22.225745	55d6c151	120	30	1.0000	DISCARD	gen=531 glyphs=4
2026-03-14T02:20:22.500181	12ef3e37	116	29	1.0000	DISCARD	gen=575 glyphs=4
2026-03-14T02:20:24.982744	bfdf7cad	120	30	1.0000	DISCARD	gen=531 glyphs=4
2026-03-14T02:20:25.246766	adcb9277	120	30	1.0000	DISCARD	gen=575 glyphs=4
2026-03-14T02:20:27.720950	fdb5d108	120	30	1.0000	DISCARD	gen=531 glyphs=4
2026-03-14T02:20:27.990594	ae44ace5	116	29	1.0000	DISCARD	gen=575 glyphs=4
2026-03-14T02:20:30.442755	37f4017b	116	29	1.0000	DISCARD	gen=531 glyphs=4
2026-03-14T02:20:30.712234	050862ad	120	30	1.0000	DISCARD	gen=575 glyphs=4
2026-03-14T02:20:33.207868	7ca87b42	116	29	1.0000	DISCARD	gen=531 glyphs=4
2026-03-14T02:20:33.491431	a78f9454	120	30	1.0000	DISCARD	gen=575 glyphs=4
2026-03-14T02:20:35.929181	37f4017b	116	29	1.0000	DISCARD	gen=532 glyphs=4
2026-03-14T02:20:36.211835	1be3cbc7	120	30	1.0000	DISCARD	gen=575 glyphs=4
2026-03-14T02:20:38.657322	bfdf7cad	120	30	1.0000	DISCARD	gen=532 glyphs=4
2026-03-14T02:20:38.921384	19355583	120	30	1.0000	DISCARD	gen=576 glyphs=4
2026-03-14T02:20:41.506910	71e2ba66	116	29	1.0000	DISCARD	gen=532 glyphs=4
2026-03-14T02:20:41.791185	8aef8872	116	29	1.0000	DISCARD	gen=576 glyphs=4
2026-03-14T02:20:44.269013	2701cb73	116	29	1.0000	DISCARD	gen=532 glyphs=4
2026-03-14T02:20:44.548327	e8c7f6cf	120	30	1.0000	DISCARD	gen=576 glyphs=4
2026-03-14T02:20:47.052802	ee8a7498	120	30	0.9500	DISCARD	gen=532 glyphs=4
2026-03-14T02:20:47.322712	0eaedb57	116	29	1.0000	DISCARD	gen=576 glyphs=4
2026-03-14T02:20:49.787679	35f55a59	116	29	1.0000	DISCARD	gen=532 glyphs=4
2026-03-14T02:20:50.059980	1e5f0e21	116	29	1.0000	DISCARD	gen=576 glyphs=4
2026-03-14T02:20:52.539055	5b9807ac	120	30	1.0000	DISCARD	gen=532 glyphs=4
2026-03-14T02:20:52.825161	50dc991d	116	29	1.0000	DISCARD	gen=576 glyphs=4
2026-03-14T02:20:55.316833	37f4017b	116	29	1.0000	DISCARD	gen=532 glyphs=4
2026-03-14T02:20:55.587818	8f15fa83	116	29	0.9500	DISCARD	gen=576 glyphs=4
2026-03-14T02:20:58.047387	37f4017b	116	29	1.0000	DISCARD	gen=532 glyphs=4
2026-03-14T02:20:58.326481	2b9c1302	116	29	0.9500	DISCARD	gen=576 glyphs=4
2026-03-14T02:21:00.796337	55d6c151	120	30	1.0000	DISCARD	gen=532 glyphs=4
2026-03-14T02:21:01.078462	0eaedb57	116	29	1.0000	DISCARD	gen=576 glyphs=4
2026-03-14T02:21:03.562500	37f4017b	116	29	1.0000	DISCARD	gen=533 glyphs=4
2026-03-14T02:21:03.839302	99369661	116	29	0.9500	DISCARD	gen=576 glyphs=4
2026-03-14T02:21:06.324163	bfdf7cad	120	30	1.0000	DISCARD	gen=533 glyphs=4
2026-03-14T02:21:06.586762	19355583	120	30	1.0000	DISCARD	gen=577 glyphs=4
2026-03-14T02:21:09.101202	1d34459a	116	29	1.0000	DISCARD	gen=533 glyphs=4
2026-03-14T02:21:09.371641	8aef8872	116	29	1.0000	DISCARD	gen=577 glyphs=4
2026-03-14T02:21:11.976799	5a06ca32	120	30	1.0000	DISCARD	gen=533 glyphs=4
2026-03-14T02:21:12.249189	d7c8681b	120	30	1.0000	DISCARD	gen=577 glyphs=4
2026-03-14T02:21:14.729848	2701cb73	116	29	1.0000	DISCARD	gen=533 glyphs=4
2026-03-14T02:21:15.006949	afba214b	116	29	1.0000	DISCARD	gen=577 glyphs=4
2026-03-14T02:21:17.458492	37f4017b	116	29	1.0000	DISCARD	gen=533 glyphs=4
2026-03-14T02:21:17.729526	0eaedb57	116	29	1.0000	DISCARD	gen=577 glyphs=4
2026-03-14T02:21:20.201335	37f4017b	116	29	1.0000	DISCARD	gen=533 glyphs=4
2026-03-14T02:21:20.472753	d7c8681b	120	30	1.0000	DISCARD	gen=577 glyphs=4
2026-03-14T02:21:22.914480	d48d100f	120	30	1.0000	DISCARD	gen=533 glyphs=4
2026-03-14T02:21:23.193853	0eaedb57	116	29	1.0000	DISCARD	gen=577 glyphs=4
2026-03-14T02:21:25.644404	7ca87b42	116	29	1.0000	DISCARD	gen=533 glyphs=4
2026-03-14T02:21:25.917348	9e34ede0	116	29	1.0000	DISCARD	gen=577 glyphs=4
2026-03-14T02:21:28.382328	5a06ca32	120	30	1.0000	DISCARD	gen=533 glyphs=4
2026-03-14T02:21:28.657512	0eaedb57	116	29	1.0000	DISCARD	gen=577 glyphs=4
2026-03-14T02:21:31.113885	37f4017b	116	29	1.0000	DISCARD	gen=534 glyphs=4
2026-03-14T02:21:31.389162	eca7ab6c	116	29	1.0000	DISCARD	gen=577 glyphs=4
2026-03-14T02:21:33.899287	bfdf7cad	120	30	1.0000	DISCARD	gen=534 glyphs=4
2026-03-14T02:21:34.185104	19355583	120	30	1.0000	DISCARD	gen=578 glyphs=4
2026-03-14T02:21:36.650689	37f4017b	116	29	1.0000	DISCARD	gen=534 glyphs=4
2026-03-14T02:21:36.937852	8aef8872	116	29	1.0000	DISCARD	gen=578 glyphs=4
