timestamp	program_hash	spirv_size	word_count	fitness	status	description
2026-03-13T23:20:59.957775	bfdf7cad	120	30	1.0000	DISCARD	gen=140 glyphs=4
2026-03-13T23:21:00.239490	19355583	120	30	1.0000	DISCARD	gen=184 glyphs=4
2026-03-13T23:21:02.735510	fdb5d108	120	30	1.0000	DISCARD	gen=140 glyphs=4
2026-03-13T23:21:03.010010	8aef8872	116	29	1.0000	DISCARD	gen=184 glyphs=4
2026-03-13T23:21:05.491473	37f4017b	116	29	1.0000	DISCARD	gen=140 glyphs=4
2026-03-13T23:21:05.767442	750598b4	116	29	1.0000	DISCARD	gen=184 glyphs=4
2026-03-13T23:21:08.270415	5a06ca32	120	30	1.0000	DISCARD	gen=140 glyphs=4
2026-03-13T23:21:08.559150	875e0f8a	116	29	1.0000	DISCARD	gen=184 glyphs=4
2026-03-13T23:21:11.051882	37f4017b	116	29	1.0000	DISCARD	gen=140 glyphs=4
2026-03-13T23:21:11.323365	19355583	120	30	1.0000	DISCARD	gen=184 glyphs=4
2026-03-13T23:21:13.811656	37f4017b	116	29	1.0000	DISCARD	gen=140 glyphs=4
2026-03-13T23:21:14.083015	050862ad	120	30	1.0000	DISCARD	gen=184 glyphs=4
2026-03-13T23:21:16.586183	37f4017b	116	29	1.0000	DISCARD	gen=140 glyphs=4
2026-03-13T23:21:16.854473	ae44ace5	116	29	1.0000	DISCARD	gen=184 glyphs=4
2026-03-13T23:21:19.341958	bfdf7cad	120	30	1.0000	DISCARD	gen=140 glyphs=4
2026-03-13T23:21:19.633237	1e5f0e21	116	29	1.0000	DISCARD	gen=184 glyphs=4
2026-03-13T23:21:22.100226	37f4017b	116	29	1.0000	DISCARD	gen=140 glyphs=4
2026-03-13T23:21:22.376116	d7c8681b	120	30	1.0000	DISCARD	gen=184 glyphs=4
2026-03-13T23:21:24.891848	37f4017b	116	29	1.0000	DISCARD	gen=141 glyphs=4
2026-03-13T23:21:25.176568	cc386f40	116	29	1.0000	DISCARD	gen=184 glyphs=4
2026-03-13T23:21:27.678370	bfdf7cad	120	30	1.0000	DISCARD	gen=141 glyphs=4
2026-03-13T23:21:27.983676	19355583	120	30	1.0000	DISCARD	gen=185 glyphs=4
2026-03-13T23:21:30.511091	c0d316e4	120	30	1.0000	DISCARD	gen=141 glyphs=4
2026-03-13T23:21:30.791305	8aef8872	116	29	1.0000	DISCARD	gen=185 glyphs=4
2026-03-13T23:21:33.252506	2b6f3232	116	29	1.0000	DISCARD	gen=141 glyphs=4
2026-03-13T23:21:33.528122	39eac80d	116	29	1.0000	DISCARD	gen=185 glyphs=4
2026-03-13T23:21:36.026299	5a06ca32	120	30	1.0000	DISCARD	gen=141 glyphs=4
2026-03-13T23:21:36.301299	e2cd28ea	120	30	1.0000	DISCARD	gen=185 glyphs=4
2026-03-13T23:21:38.788176	2701cb73	116	29	1.0000	DISCARD	gen=141 glyphs=4
2026-03-13T23:21:39.066900	b7aed8e9	116	29	1.0000	DISCARD	gen=185 glyphs=4
2026-03-13T23:21:41.532186	55d6c151	120	30	1.0000	DISCARD	gen=141 glyphs=4
2026-03-13T23:21:41.818554	0eaedb57	116	29	1.0000	DISCARD	gen=185 glyphs=4
2026-03-13T23:21:48.423463	37f4017b	116	29	1.0000	DISCARD	gen=141 glyphs=4
2026-03-13T23:21:48.715645	19355583	120	30	1.0000	DISCARD	gen=185 glyphs=4
2026-03-13T23:21:51.178308	4c9b0dd4	120	30	1.0000	DISCARD	gen=141 glyphs=4
2026-03-13T23:21:51.465052	19355583	120	30	1.0000	DISCARD	gen=185 glyphs=4
2026-03-13T23:21:54.053087	37f4017b	116	29	1.0000	DISCARD	gen=141 glyphs=4
2026-03-13T23:21:54.344255	eca7ab6c	116	29	1.0000	DISCARD	gen=185 glyphs=4
2026-03-13T23:21:56.810526	37f4017b	116	29	1.0000	DISCARD	gen=142 glyphs=4
2026-03-13T23:21:57.081796	6e6a37e1	116	29	1.0000	DISCARD	gen=185 glyphs=4
2026-03-13T23:21:59.578425	bfdf7cad	120	30	1.0000	DISCARD	gen=142 glyphs=4
2026-03-13T23:21:59.891798	19355583	120	30	1.0000	DISCARD	gen=186 glyphs=4
2026-03-13T23:22:02.389380	37f4017b	116	29	1.0000	DISCARD	gen=142 glyphs=4
2026-03-13T23:22:02.652151	8aef8872	116	29	1.0000	DISCARD	gen=186 glyphs=4
2026-03-13T23:22:05.142730	37f4017b	116	29	1.0000	DISCARD	gen=142 glyphs=4
2026-03-13T23:22:05.413606	eca7ab6c	116	29	1.0000	DISCARD	gen=186 glyphs=4
2026-03-13T23:22:07.989515	37f4017b	116	29	1.0000	DISCARD	gen=142 glyphs=4
2026-03-13T23:22:08.267662	050862ad	120	30	1.0000	DISCARD	gen=186 glyphs=4
2026-03-13T23:22:10.847025	37f4017b	116	29	1.0000	DISCARD	gen=142 glyphs=4
2026-03-13T23:22:11.124293	19355583	120	30	1.0000	DISCARD	gen=186 glyphs=4
2026-03-13T23:22:13.681968	12b38c2d	116	29	1.0000	DISCARD	gen=142 glyphs=4
2026-03-13T23:22:13.955334	050862ad	120	30	1.0000	DISCARD	gen=186 glyphs=4
2026-03-13T23:22:16.468284	8a95104a	116	29	1.0000	DISCARD	gen=142 glyphs=4
2026-03-13T23:22:16.752505	050862ad	120	30	1.0000	DISCARD	gen=186 glyphs=4
2026-03-13T23:22:19.250970	37f4017b	116	29	1.0000	DISCARD	gen=142 glyphs=4
2026-03-13T23:22:19.520207	e8c7f6cf	120	30	1.0000	DISCARD	gen=186 glyphs=4
2026-03-13T23:22:21.970789	fdb5d108	120	30	1.0000	DISCARD	gen=142 glyphs=4
2026-03-13T23:22:22.423379	0eaedb57	116	29	1.0000	DISCARD	gen=186 glyphs=4
2026-03-13T23:22:24.957565	37f4017b	116	29	1.0000	DISCARD	gen=143 glyphs=4
2026-03-13T23:22:25.232166	67cb81be	120	30	1.0000	DISCARD	gen=186 glyphs=4
2026-03-13T23:22:27.767159	bfdf7cad	120	30	1.0000	DISCARD	gen=143 glyphs=4
2026-03-13T23:22:28.050550	19355583	120	30	1.0000	DISCARD	gen=187 glyphs=4
2026-03-13T23:22:30.517811	37f4017b	116	29	1.0000	DISCARD	gen=143 glyphs=4
2026-03-13T23:22:30.791333	8aef8872	116	29	1.0000	DISCARD	gen=187 glyphs=4
2026-03-13T23:22:33.316042	9eb33358	120	30	1.0000	DISCARD	gen=143 glyphs=4
2026-03-13T23:22:33.600371	9e34ede0	116	29	1.0000	DISCARD	gen=187 glyphs=4
2026-03-13T23:22:36.329189	0c47ec6e	116	29	0.9500	DISCARD	gen=143 glyphs=4
2026-03-13T23:22:36.602820	d7c8681b	120	30	1.0000	DISCARD	gen=187 glyphs=4
2026-03-13T23:22:39.155831	5a06ca32	120	30	1.0000	DISCARD	gen=143 glyphs=4
2026-03-13T23:22:39.436218	e2cd28ea	120	30	1.0000	DISCARD	gen=187 glyphs=4
2026-03-13T23:22:41.991060	2701cb73	116	29	1.0000	DISCARD	gen=143 glyphs=4
2026-03-13T23:22:42.268206	2e8351bc	120	30	1.0000	DISCARD	gen=187 glyphs=4
2026-03-13T23:22:44.899816	bfdf7cad	120	30	1.0000	DISCARD	gen=143 glyphs=4
2026-03-13T23:22:45.175332	8aef8872	116	29	1.0000	DISCARD	gen=187 glyphs=4
2026-03-13T23:22:47.714267	5b9807ac	120	30	1.0000	DISCARD	gen=143 glyphs=4
2026-03-13T23:22:47.985149	67cb81be	120	30	1.0000	DISCARD	gen=187 glyphs=4
2026-03-13T23:22:50.430350	5a06ca32	120	30	1.0000	DISCARD	gen=143 glyphs=4
2026-03-13T23:22:50.721663	0eaedb57	116	29	1.0000	DISCARD	gen=187 glyphs=4
2026-03-13T23:22:53.207086	37f4017b	116	29	1.0000	DISCARD	gen=144 glyphs=4
2026-03-13T23:22:53.610172	50dc991d	116	29	1.0000	DISCARD	gen=187 glyphs=4
2026-03-13T23:22:56.119841	bfdf7cad	120	30	1.0000	DISCARD	gen=144 glyphs=4
2026-03-13T23:22:56.392709	19355583	120	30	1.0000	DISCARD	gen=188 glyphs=4
2026-03-13T23:22:58.936988	4e183445	116	29	1.0000	DISCARD	gen=144 glyphs=4
2026-03-13T23:22:59.209229	8aef8872	116	29	1.0000	DISCARD	gen=188 glyphs=4
2026-03-13T23:23:01.763864	dd177e18	120	30	1.0000	DISCARD	gen=144 glyphs=4
2026-03-13T23:23:02.096557	050862ad	120	30	1.0000	DISCARD	gen=188 glyphs=4
2026-03-13T23:23:05.416467	71e2ba66	116	29	1.0000	DISCARD	gen=144 glyphs=4
2026-03-13T23:23:05.785609	8aef8872	116	29	1.0000	DISCARD	gen=188 glyphs=4
2026-03-13T23:23:09.009263	55d6c151	120	30	1.0000	DISCARD	gen=144 glyphs=4
2026-03-13T23:23:09.298678	4a7edbde	120	30	1.0000	DISCARD	gen=188 glyphs=4
2026-03-13T23:23:11.824018	5a06ca32	120	30	1.0000	DISCARD	gen=144 glyphs=4
2026-03-13T23:23:12.102785	539a636d	116	29	0.9500	DISCARD	gen=188 glyphs=4
2026-03-13T23:23:14.896119	4c9b0dd4	120	30	1.0000	DISCARD	gen=144 glyphs=4
2026-03-13T23:23:15.303475	60b4ebbc	116	29	1.0000	DISCARD	gen=188 glyphs=4
2026-03-13T23:23:18.307496	bfdf7cad	120	30	1.0000	DISCARD	gen=144 glyphs=4
2026-03-13T23:23:18.676149	517f300c	116	29	1.0000	DISCARD	gen=188 glyphs=4
2026-03-13T23:23:21.590620	d11c1062	120	30	1.0000	DISCARD	gen=144 glyphs=4
2026-03-13T23:23:21.873403	8aef8872	116	29	1.0000	DISCARD	gen=188 glyphs=4
2026-03-13T23:23:24.358172	37f4017b	116	29	1.0000	DISCARD	gen=145 glyphs=4
2026-03-13T23:23:24.619837	275e0716	120	30	1.0000	DISCARD	gen=188 glyphs=4
2026-03-13T23:23:27.086216	bfdf7cad	120	30	1.0000	DISCARD	gen=145 glyphs=4
2026-03-13T23:23:27.371231	19355583	120	30	1.0000	DISCARD	gen=189 glyphs=4
2026-03-13T23:23:29.852089	c88433d5	120	30	1.0000	DISCARD	gen=145 glyphs=4
2026-03-13T23:23:30.123490	8aef8872	116	29	1.0000	DISCARD	gen=189 glyphs=4
2026-03-13T23:23:32.601452	5a06ca32	120	30	1.0000	DISCARD	gen=145 glyphs=4
2026-03-13T23:23:32.876144	1e16f768	116	29	1.0000	DISCARD	gen=189 glyphs=4
2026-03-13T23:23:35.340742	44090ef4	116	29	1.0000	DISCARD	gen=145 glyphs=4
2026-03-13T23:23:35.612671	55937a71	116	29	1.0000	DISCARD	gen=189 glyphs=4
2026-03-13T23:23:38.083426	f12a7602	116	29	0.9500	DISCARD	gen=145 glyphs=4
2026-03-13T23:23:38.354280	19355583	120	30	1.0000	DISCARD	gen=189 glyphs=4
2026-03-13T23:23:40.823295	5a06ca32	120	30	1.0000	DISCARD	gen=145 glyphs=4
2026-03-13T23:23:41.103245	b57e7176	120	30	1.0000	DISCARD	gen=189 glyphs=4
2026-03-13T23:23:43.568239	9e99c104	116	29	1.0000	DISCARD	gen=145 glyphs=4
2026-03-13T23:23:43.845922	19355583	120	30	1.0000	DISCARD	gen=189 glyphs=4
2026-03-13T23:23:46.303881	a9b15b18	116	29	1.0000	DISCARD	gen=145 glyphs=4
2026-03-13T23:23:46.578204	875e0f8a	116	29	1.0000	DISCARD	gen=189 glyphs=4
2026-03-13T23:23:49.066375	37f4017b	116	29	1.0000	DISCARD	gen=145 glyphs=4
2026-03-13T23:23:49.342422	e2cd28ea	120	30	1.0000	DISCARD	gen=189 glyphs=4
2026-03-13T23:23:51.812488	37f4017b	116	29	1.0000	DISCARD	gen=146 glyphs=4
2026-03-13T23:23:52.090586	b7aed8e9	116	29	1.0000	DISCARD	gen=189 glyphs=4
2026-03-13T23:23:54.554608	bfdf7cad	120	30	1.0000	DISCARD	gen=146 glyphs=4
2026-03-13T23:23:54.825348	19355583	120	30	1.0000	DISCARD	gen=190 glyphs=4
2026-03-13T23:23:57.330927	1d34459a	116	29	1.0000	DISCARD	gen=146 glyphs=4
2026-03-13T23:23:57.612943	8aef8872	116	29	1.0000	DISCARD	gen=190 glyphs=4
2026-03-13T23:24:00.060981	37f4017b	116	29	1.0000	DISCARD	gen=146 glyphs=4
2026-03-13T23:24:00.339128	e8c7f6cf	120	30	1.0000	DISCARD	gen=190 glyphs=4
2026-03-13T23:24:03.023178	55d6c151	120	30	1.0000	DISCARD	gen=146 glyphs=4
2026-03-13T23:24:03.296014	050862ad	120	30	1.0000	DISCARD	gen=190 glyphs=4
2026-03-13T23:24:05.770736	5a06ca32	120	30	1.0000	DISCARD	gen=146 glyphs=4
2026-03-13T23:24:06.038683	921fd827	120	30	1.0000	DISCARD	gen=190 glyphs=4
2026-03-13T23:24:08.605407	5a06ca32	120	30	1.0000	DISCARD	gen=146 glyphs=4
2026-03-13T23:24:08.876225	b57e7176	120	30	1.0000	DISCARD	gen=190 glyphs=4
2026-03-13T23:24:11.362293	5a06ca32	120	30	1.0000	DISCARD	gen=146 glyphs=4
2026-03-13T23:24:11.639593	56dd2667	120	30	1.0000	DISCARD	gen=190 glyphs=4
2026-03-13T23:24:14.087449	96e6744f	116	29	0.9500	DISCARD	gen=146 glyphs=4
2026-03-13T23:24:14.354424	e2cd28ea	120	30	1.0000	DISCARD	gen=190 glyphs=4
2026-03-13T23:24:16.821620	5b9807ac	120	30	1.0000	DISCARD	gen=146 glyphs=4
2026-03-13T23:24:17.095537	9e34ede0	116	29	1.0000	DISCARD	gen=190 glyphs=4
2026-03-13T23:24:19.578434	37f4017b	116	29	1.0000	DISCARD	gen=147 glyphs=4
2026-03-13T23:24:19.853788	1e5f0e21	116	29	1.0000	DISCARD	gen=190 glyphs=4
2026-03-13T23:24:22.338932	bfdf7cad	120	30	1.0000	DISCARD	gen=147 glyphs=4
2026-03-13T23:24:22.622574	19355583	120	30	1.0000	DISCARD	gen=191 glyphs=4
2026-03-13T23:24:25.101498	f4222a9e	116	29	1.0000	DISCARD	gen=147 glyphs=4
2026-03-13T23:24:25.390524	8aef8872	116	29	1.0000	DISCARD	gen=191 glyphs=4
2026-03-13T23:24:27.858619	55d6c151	120	30	1.0000	DISCARD	gen=147 glyphs=4
2026-03-13T23:24:28.132881	57384aba	116	29	1.0000	DISCARD	gen=191 glyphs=4
2026-03-13T23:24:30.600332	5a06ca32	120	30	1.0000	DISCARD	gen=147 glyphs=4
2026-03-13T23:24:30.872398	c134f420	120	30	1.0000	DISCARD	gen=191 glyphs=4
2026-03-13T23:24:33.365441	7ca87b42	116	29	1.0000	DISCARD	gen=147 glyphs=4
2026-03-13T23:24:33.632780	8aef8872	116	29	1.0000	DISCARD	gen=191 glyphs=4
2026-03-13T23:24:36.249564	55d6c151	120	30	1.0000	DISCARD	gen=147 glyphs=4
2026-03-13T23:24:36.535978	94de8f5c	116	29	0.9500	DISCARD	gen=191 glyphs=4
2026-03-13T23:24:39.156220	71e2ba66	116	29	1.0000	DISCARD	gen=147 glyphs=4
2026-03-13T23:24:39.448819	d7c8681b	120	30	1.0000	DISCARD	gen=191 glyphs=4
2026-03-13T23:24:42.032211	452eae27	116	29	1.0000	DISCARD	gen=147 glyphs=4
2026-03-13T23:24:42.320386	c238c700	116	29	1.0000	DISCARD	gen=191 glyphs=4
2026-03-13T23:24:44.926334	37f4017b	116	29	1.0000	DISCARD	gen=147 glyphs=4
2026-03-13T23:24:45.222560	eca7ab6c	116	29	1.0000	DISCARD	gen=191 glyphs=4
2026-03-13T23:24:47.805209	37f4017b	116	29	1.0000	DISCARD	gen=148 glyphs=4
2026-03-13T23:24:48.089990	4c98cad9	116	29	1.0000	DISCARD	gen=191 glyphs=4
2026-03-13T23:24:50.666431	bfdf7cad	120	30	1.0000	DISCARD	gen=148 glyphs=4
2026-03-13T23:24:50.957263	19355583	120	30	1.0000	DISCARD	gen=192 glyphs=4
2026-03-13T23:24:53.577268	5a06ca32	120	30	1.0000	DISCARD	gen=148 glyphs=4
2026-03-13T23:24:53.859361	8aef8872	116	29	1.0000	DISCARD	gen=192 glyphs=4
2026-03-13T23:24:56.459196	e3742a66	116	29	1.0000	DISCARD	gen=148 glyphs=4
2026-03-13T23:24:56.760105	b9e24e7d	116	29	1.0000	DISCARD	gen=192 glyphs=4
2026-03-13T23:24:59.340092	55d6c151	120	30	1.0000	DISCARD	gen=148 glyphs=4
2026-03-13T23:24:59.625442	c91830e2	116	29	1.0000	DISCARD	gen=192 glyphs=4
2026-03-13T23:25:02.194078	d11c1062	120	30	1.0000	DISCARD	gen=148 glyphs=4
2026-03-13T23:25:02.459920	b57e7176	120	30	1.0000	DISCARD	gen=192 glyphs=4
2026-03-13T23:25:04.895539	1d34459a	116	29	1.0000	DISCARD	gen=148 glyphs=4
2026-03-13T23:25:05.168005	eca7ab6c	116	29	1.0000	DISCARD	gen=192 glyphs=4
2026-03-13T23:25:07.599348	5a06ca32	120	30	1.0000	DISCARD	gen=148 glyphs=4
2026-03-13T23:25:07.879010	8aef8872	116	29	1.0000	DISCARD	gen=192 glyphs=4
2026-03-13T23:25:10.453097	37f4017b	116	29	1.0000	DISCARD	gen=148 glyphs=4
2026-03-13T23:25:10.754006	0eaedb57	116	29	1.0000	DISCARD	gen=192 glyphs=4
2026-03-13T23:25:13.255189	8182166e	116	29	1.0000	DISCARD	gen=148 glyphs=4
2026-03-13T23:25:13.529343	0eaedb57	116	29	1.0000	DISCARD	gen=192 glyphs=4
2026-03-13T23:25:16.015674	37f4017b	116	29	1.0000	DISCARD	gen=149 glyphs=4
2026-03-13T23:25:16.288767	19355583	120	30	1.0000	DISCARD	gen=192 glyphs=4
2026-03-13T23:25:18.796106	bfdf7cad	120	30	1.0000	DISCARD	gen=149 glyphs=4
2026-03-13T23:25:19.055762	19355583	120	30	1.0000	DISCARD	gen=193 glyphs=4
2026-03-13T23:25:21.505650	2701cb73	116	29	1.0000	DISCARD	gen=149 glyphs=4
2026-03-13T23:25:21.767574	8aef8872	116	29	1.0000	DISCARD	gen=193 glyphs=4
2026-03-13T23:25:24.249098	257f8143	120	30	1.0000	DISCARD	gen=149 glyphs=4
2026-03-13T23:25:24.518584	b57e7176	120	30	1.0000	DISCARD	gen=193 glyphs=4
2026-03-13T23:25:26.980792	55d6c151	120	30	1.0000	DISCARD	gen=149 glyphs=4
2026-03-13T23:25:27.265376	98aa7410	120	30	0.9500	DISCARD	gen=193 glyphs=4
2026-03-13T23:25:29.716396	5a06ca32	120	30	1.0000	DISCARD	gen=149 glyphs=4
2026-03-13T23:25:29.980503	ae44ace5	116	29	1.0000	DISCARD	gen=193 glyphs=4
2026-03-13T23:25:32.431388	7ca87b42	116	29	1.0000	DISCARD	gen=149 glyphs=4
2026-03-13T23:25:32.706822	8aef8872	116	29	1.0000	DISCARD	gen=193 glyphs=4
2026-03-13T23:25:35.180934	55d6c151	120	30	1.0000	DISCARD	gen=149 glyphs=4
2026-03-13T23:25:35.464648	b57e7176	120	30	1.0000	DISCARD	gen=193 glyphs=4
2026-03-13T23:25:37.894654	37f4017b	116	29	1.0000	DISCARD	gen=149 glyphs=4
2026-03-13T23:25:38.165396	8aef8872	116	29	1.0000	DISCARD	gen=193 glyphs=4
2026-03-13T23:25:40.587346	3188632f	120	30	1.0000	DISCARD	gen=149 glyphs=4
2026-03-13T23:25:40.854424	5f72f49f	120	30	1.0000	DISCARD	gen=193 glyphs=4
2026-03-13T23:25:43.448609	37f4017b	116	29	1.0000	DISCARD	gen=150 glyphs=4
2026-03-13T23:25:43.730972	0eaedb57	116	29	1.0000	DISCARD	gen=193 glyphs=4
2026-03-13T23:25:46.205366	bfdf7cad	120	30	1.0000	DISCARD	gen=150 glyphs=4
2026-03-13T23:25:46.482594	19355583	120	30	1.0000	DISCARD	gen=194 glyphs=4
2026-03-13T23:25:48.939884	37f4017b	116	29	1.0000	DISCARD	gen=150 glyphs=4
2026-03-13T23:25:49.212156	8aef8872	116	29	1.0000	DISCARD	gen=194 glyphs=4
2026-03-13T23:25:51.647780	f0c9f326	120	30	1.0000	DISCARD	gen=150 glyphs=4
2026-03-13T23:25:51.915807	a78f9454	120	30	1.0000	DISCARD	gen=194 glyphs=4
2026-03-13T23:25:54.360081	d11c1062	120	30	1.0000	DISCARD	gen=150 glyphs=4
2026-03-13T23:25:54.631367	8aef8872	116	29	1.0000	DISCARD	gen=194 glyphs=4
2026-03-13T23:25:57.060601	55d6c151	120	30	1.0000	DISCARD	gen=150 glyphs=4
2026-03-13T23:25:57.341061	e8c7f6cf	120	30	1.0000	DISCARD	gen=194 glyphs=4
2026-03-13T23:25:59.831897	5a06ca32	120	30	1.0000	DISCARD	gen=150 glyphs=4
2026-03-13T23:26:00.109119	ae44ace5	116	29	1.0000	DISCARD	gen=194 glyphs=4
2026-03-13T23:26:02.556306	5b9807ac	120	30	1.0000	DISCARD	gen=150 glyphs=4
2026-03-13T23:26:02.833330	a78f9454	120	30	1.0000	DISCARD	gen=194 glyphs=4
2026-03-13T23:26:05.298571	d11c1062	120	30	1.0000	DISCARD	gen=150 glyphs=4
2026-03-13T23:26:05.578310	8aef8872	116	29	1.0000	DISCARD	gen=194 glyphs=4
2026-03-13T23:26:08.049351	fdb5d108	120	30	1.0000	DISCARD	gen=150 glyphs=4
2026-03-13T23:26:08.338902	8aef8872	116	29	1.0000	DISCARD	gen=194 glyphs=4
2026-03-13T23:26:10.780636	37f4017b	116	29	1.0000	DISCARD	gen=151 glyphs=4
2026-03-13T23:26:11.048255	918b2649	116	29	1.0000	DISCARD	gen=194 glyphs=4
2026-03-13T23:26:13.515238	bfdf7cad	120	30	1.0000	DISCARD	gen=151 glyphs=4
2026-03-13T23:26:13.807332	19355583	120	30	1.0000	DISCARD	gen=195 glyphs=4
2026-03-13T23:26:16.308248	5a06ca32	120	30	1.0000	DISCARD	gen=151 glyphs=4
2026-03-13T23:26:16.571359	8aef8872	116	29	1.0000	DISCARD	gen=195 glyphs=4
2026-03-13T23:26:19.038610	37f4017b	116	29	1.0000	DISCARD	gen=151 glyphs=4
2026-03-13T23:26:19.330915	8aef8872	116	29	1.0000	DISCARD	gen=195 glyphs=4
2026-03-13T23:26:21.771094	5a06ca32	120	30	1.0000	DISCARD	gen=151 glyphs=4
2026-03-13T23:26:22.047291	19355583	120	30	1.0000	DISCARD	gen=195 glyphs=4
2026-03-13T23:26:24.519776	740dce2a	116	29	1.0000	DISCARD	gen=151 glyphs=4
2026-03-13T23:26:24.787952	0eaedb57	116	29	1.0000	DISCARD	gen=195 glyphs=4
2026-03-13T23:26:27.243971	d11c1062	120	30	1.0000	DISCARD	gen=151 glyphs=4
2026-03-13T23:26:27.503950	875e0f8a	116	29	1.0000	DISCARD	gen=195 glyphs=4
2026-03-13T23:26:29.941806	55d6c151	120	30	1.0000	DISCARD	gen=151 glyphs=4
2026-03-13T23:26:30.217326	3a47f031	120	30	1.0000	DISCARD	gen=195 glyphs=4
2026-03-13T23:26:32.670355	37f4017b	116	29	1.0000	DISCARD	gen=151 glyphs=4
2026-03-13T23:26:32.936710	1701380a	116	29	1.0000	DISCARD	gen=195 glyphs=4
2026-03-13T23:26:35.418601	37f4017b	116	29	1.0000	DISCARD	gen=151 glyphs=4
2026-03-13T23:26:35.695741	50dc991d	116	29	1.0000	DISCARD	gen=195 glyphs=4
2026-03-13T23:26:38.164790	37f4017b	116	29	1.0000	DISCARD	gen=152 glyphs=4
2026-03-13T23:26:38.443326	875e0f8a	116	29	1.0000	DISCARD	gen=195 glyphs=4
2026-03-13T23:26:40.896796	bfdf7cad	120	30	1.0000	DISCARD	gen=152 glyphs=4
2026-03-13T23:26:41.167342	19355583	120	30	1.0000	DISCARD	gen=196 glyphs=4
2026-03-13T23:26:43.628129	05bf049c	116	29	1.0000	DISCARD	gen=152 glyphs=4
2026-03-13T23:26:43.906053	8aef8872	116	29	1.0000	DISCARD	gen=196 glyphs=4
2026-03-13T23:26:46.623450	37f4017b	116	29	1.0000	DISCARD	gen=152 glyphs=4
2026-03-13T23:26:46.905655	19355583	120	30	1.0000	DISCARD	gen=196 glyphs=4
2026-03-13T23:26:49.452847	4fc6fc3b	120	30	0.9500	DISCARD	gen=152 glyphs=4
2026-03-13T23:26:49.738429	b57e7176	120	30	1.0000	DISCARD	gen=196 glyphs=4
2026-03-13T23:26:52.259501	5a06ca32	120	30	1.0000	DISCARD	gen=152 glyphs=4
2026-03-13T23:26:52.563553	dea4a875	116	29	1.0000	DISCARD	gen=196 glyphs=4
2026-03-13T23:26:55.689799	55d6c151	120	30	1.0000	DISCARD	gen=152 glyphs=4
2026-03-13T23:26:55.982941	66cfb809	120	30	1.0000	DISCARD	gen=196 glyphs=4
2026-03-13T23:26:59.111534	5a06ca32	120	30	1.0000	DISCARD	gen=152 glyphs=4
2026-03-13T23:26:59.470496	68a01bde	116	29	1.0000	DISCARD	gen=196 glyphs=4
2026-03-13T23:27:02.100278	88a40a57	116	29	1.0000	DISCARD	gen=152 glyphs=4
2026-03-13T23:27:02.366736	8aef8872	116	29	1.0000	DISCARD	gen=196 glyphs=4
2026-03-13T23:27:04.810437	197bb799	116	29	1.0000	DISCARD	gen=152 glyphs=4
2026-03-13T23:27:05.070492	19355583	120	30	1.0000	DISCARD	gen=196 glyphs=4
2026-03-13T23:27:07.536827	37f4017b	116	29	1.0000	DISCARD	gen=153 glyphs=4
2026-03-13T23:27:07.809382	50460861	116	29	0.9500	DISCARD	gen=196 glyphs=4
2026-03-13T23:27:10.297543	bfdf7cad	120	30	1.0000	DISCARD	gen=153 glyphs=4
2026-03-13T23:27:10.567638	19355583	120	30	1.0000	DISCARD	gen=197 glyphs=4
2026-03-13T23:27:13.016961	5a06ca32	120	30	1.0000	DISCARD	gen=153 glyphs=4
2026-03-13T23:27:13.298926	8aef8872	116	29	1.0000	DISCARD	gen=197 glyphs=4
2026-03-13T23:27:15.755019	55d6c151	120	30	1.0000	DISCARD	gen=153 glyphs=4
2026-03-13T23:27:16.029895	ae44ace5	116	29	1.0000	DISCARD	gen=197 glyphs=4
2026-03-13T23:27:18.555742	bfdf7cad	120	30	1.0000	DISCARD	gen=153 glyphs=4
2026-03-13T23:27:18.830594	a78f9454	120	30	1.0000	DISCARD	gen=197 glyphs=4
2026-03-13T23:27:21.351445	37f4017b	116	29	1.0000	DISCARD	gen=153 glyphs=4
2026-03-13T23:27:21.628225	863375dc	116	29	1.0000	DISCARD	gen=197 glyphs=4
2026-03-13T23:27:24.078784	5a06ca32	120	30	1.0000	DISCARD	gen=153 glyphs=4
2026-03-13T23:27:24.353421	50dc991d	116	29	1.0000	DISCARD	gen=197 glyphs=4
2026-03-13T23:27:26.809143	37f4017b	116	29	1.0000	DISCARD	gen=153 glyphs=4
2026-03-13T23:27:27.067597	d7c8681b	120	30	1.0000	DISCARD	gen=197 glyphs=4
2026-03-13T23:27:29.548117	37f4017b	116	29	1.0000	DISCARD	gen=153 glyphs=4
2026-03-13T23:27:29.822384	fd74cfee	116	29	1.0000	DISCARD	gen=197 glyphs=4
2026-03-13T23:27:32.291117	97da8930	120	30	1.0000	DISCARD	gen=153 glyphs=4
2026-03-13T23:27:32.563667	0eaedb57	116	29	1.0000	DISCARD	gen=197 glyphs=4
2026-03-13T23:27:35.170536	37f4017b	116	29	1.0000	DISCARD	gen=154 glyphs=4
2026-03-13T23:27:35.444915	19355583	120	30	1.0000	DISCARD	gen=197 glyphs=4
2026-03-13T23:27:37.993963	bfdf7cad	120	30	1.0000	DISCARD	gen=154 glyphs=4
2026-03-13T23:27:38.269665	19355583	120	30	1.0000	DISCARD	gen=198 glyphs=4
2026-03-13T23:27:40.795077	71e2ba66	116	29	1.0000	DISCARD	gen=154 glyphs=4
2026-03-13T23:27:41.081177	8aef8872	116	29	1.0000	DISCARD	gen=198 glyphs=4
2026-03-13T23:27:43.778743	37f4017b	116	29	1.0000	DISCARD	gen=154 glyphs=4
2026-03-13T23:27:44.151694	a78f9454	120	30	1.0000	DISCARD	gen=198 glyphs=4
2026-03-13T23:27:46.962968	7ca87b42	116	29	1.0000	DISCARD	gen=154 glyphs=4
2026-03-13T23:27:47.275279	050862ad	120	30	1.0000	DISCARD	gen=198 glyphs=4
2026-03-13T23:27:50.621646	addf3d4e	116	29	1.0000	DISCARD	gen=154 glyphs=4
2026-03-13T23:27:50.906480	8aef8872	116	29	1.0000	DISCARD	gen=198 glyphs=4
2026-03-13T23:27:53.401321	e877dc7c	116	29	1.0000	DISCARD	gen=154 glyphs=4
2026-03-13T23:27:53.680196	875e0f8a	116	29	1.0000	DISCARD	gen=198 glyphs=4
