timestamp	program_hash	spirv_size	word_count	fitness	status	description
2026-03-14T02:41:43.235196	bfdf7cad	120	30	1.0000	DISCARD	gen=578 glyphs=4
2026-03-14T02:41:43.515591	19355583	120	30	1.0000	DISCARD	gen=622 glyphs=4
2026-03-14T02:41:45.945606	3927ee77	116	29	1.0000	DISCARD	gen=578 glyphs=4
2026-03-14T02:41:46.222857	8aef8872	116	29	1.0000	DISCARD	gen=622 glyphs=4
2026-03-14T02:41:48.627490	fdb5d108	120	30	1.0000	DISCARD	gen=578 glyphs=4
2026-03-14T02:41:48.897234	1e5f0e21	116	29	1.0000	DISCARD	gen=622 glyphs=4
2026-03-14T02:41:51.403843	5a06ca32	120	30	1.0000	DISCARD	gen=578 glyphs=4
2026-03-14T02:41:51.667478	19355583	120	30	1.0000	DISCARD	gen=622 glyphs=4
2026-03-14T02:41:54.157900	fdb5d108	120	30	1.0000	DISCARD	gen=578 glyphs=4
2026-03-14T02:41:54.423750	8aef8872	116	29	1.0000	DISCARD	gen=622 glyphs=4
2026-03-14T02:41:56.870123	55d6c151	120	30	1.0000	DISCARD	gen=578 glyphs=4
2026-03-14T02:41:57.142227	b1526b8c	120	30	1.0000	DISCARD	gen=622 glyphs=4
2026-03-14T02:41:59.589937	f14c6830	116	29	1.0000	DISCARD	gen=578 glyphs=4
2026-03-14T02:41:59.851060	3c830e80	116	29	1.0000	DISCARD	gen=622 glyphs=4
2026-03-14T02:42:02.283866	7ca87b42	116	29	1.0000	DISCARD	gen=578 glyphs=4
2026-03-14T02:42:02.559325	19355583	120	30	1.0000	DISCARD	gen=622 glyphs=4
2026-03-14T02:42:04.988962	5b9807ac	120	30	1.0000	DISCARD	gen=578 glyphs=4
2026-03-14T02:42:05.268252	1e5f0e21	116	29	1.0000	DISCARD	gen=622 glyphs=4
2026-03-14T02:42:07.721232	37f4017b	116	29	1.0000	DISCARD	gen=579 glyphs=4
2026-03-14T02:42:07.980355	0eaedb57	116	29	1.0000	DISCARD	gen=622 glyphs=4
2026-03-14T02:42:10.446741	bfdf7cad	120	30	1.0000	DISCARD	gen=579 glyphs=4
2026-03-14T02:42:10.711657	19355583	120	30	1.0000	DISCARD	gen=623 glyphs=4
2026-03-14T02:42:13.154663	37f4017b	116	29	1.0000	DISCARD	gen=579 glyphs=4
2026-03-14T02:42:13.426780	8aef8872	116	29	1.0000	DISCARD	gen=623 glyphs=4
2026-03-14T02:42:15.855651	12b38c2d	116	29	1.0000	DISCARD	gen=579 glyphs=4
2026-03-14T02:42:16.129360	050862ad	120	30	1.0000	DISCARD	gen=623 glyphs=4
2026-03-14T02:42:18.570358	12b38c2d	116	29	1.0000	DISCARD	gen=579 glyphs=4
2026-03-14T02:42:18.838921	8aef8872	116	29	1.0000	DISCARD	gen=623 glyphs=4
2026-03-14T02:42:21.316653	bb3f9cc7	116	29	1.0000	DISCARD	gen=579 glyphs=4
2026-03-14T02:42:21.580956	50dc991d	116	29	1.0000	DISCARD	gen=623 glyphs=4
2026-03-14T02:42:24.121008	5a06ca32	120	30	1.0000	DISCARD	gen=579 glyphs=4
2026-03-14T02:42:24.413996	d7c8681b	120	30	1.0000	DISCARD	gen=623 glyphs=4
2026-03-14T02:42:26.854330	e41908da	116	29	0.9500	DISCARD	gen=579 glyphs=4
2026-03-14T02:42:27.128386	fddd6685	120	30	1.0000	DISCARD	gen=623 glyphs=4
2026-03-14T02:42:29.617060	55d6c151	120	30	1.0000	DISCARD	gen=579 glyphs=4
2026-03-14T02:42:29.886369	8aef8872	116	29	1.0000	DISCARD	gen=623 glyphs=4
2026-03-14T02:42:32.345052	55d6c151	120	30	1.0000	DISCARD	gen=579 glyphs=4
2026-03-14T02:42:32.626285	0802adf0	116	29	1.0000	DISCARD	gen=623 glyphs=4
2026-03-14T02:42:35.085746	37f4017b	116	29	1.0000	DISCARD	gen=580 glyphs=4
2026-03-14T02:42:35.358524	9e34ede0	116	29	1.0000	DISCARD	gen=623 glyphs=4
2026-03-14T02:42:37.832234	bfdf7cad	120	30	1.0000	DISCARD	gen=580 glyphs=4
2026-03-14T02:42:38.112485	19355583	120	30	1.0000	DISCARD	gen=624 glyphs=4
2026-03-14T02:42:40.562446	5a06ca32	120	30	1.0000	DISCARD	gen=580 glyphs=4
2026-03-14T02:42:40.834750	8aef8872	116	29	1.0000	DISCARD	gen=624 glyphs=4
2026-03-14T02:42:43.281025	5a06ca32	120	30	1.0000	DISCARD	gen=580 glyphs=4
2026-03-14T02:42:43.556006	19355583	120	30	1.0000	DISCARD	gen=624 glyphs=4
2026-03-14T02:42:46.002153	11931dcb	116	29	1.0000	DISCARD	gen=580 glyphs=4
2026-03-14T02:42:46.280975	19355583	120	30	1.0000	DISCARD	gen=624 glyphs=4
2026-03-14T02:42:48.720179	71e2ba66	116	29	1.0000	DISCARD	gen=580 glyphs=4
2026-03-14T02:42:49.002232	050862ad	120	30	1.0000	DISCARD	gen=624 glyphs=4
2026-03-14T02:42:51.423720	5a06ca32	120	30	1.0000	DISCARD	gen=580 glyphs=4
2026-03-14T02:42:51.694041	1e5f0e21	116	29	1.0000	DISCARD	gen=624 glyphs=4
2026-03-14T02:42:54.150459	f343c276	120	30	1.0000	DISCARD	gen=580 glyphs=4
2026-03-14T02:42:54.416155	19355583	120	30	1.0000	DISCARD	gen=624 glyphs=4
2026-03-14T02:42:56.982985	5b9807ac	120	30	1.0000	DISCARD	gen=580 glyphs=4
2026-03-14T02:42:57.250719	67cb81be	120	30	1.0000	DISCARD	gen=624 glyphs=4
2026-03-14T02:42:59.694419	71e2ba66	116	29	1.0000	DISCARD	gen=580 glyphs=4
2026-03-14T02:42:59.956906	875e0f8a	116	29	1.0000	DISCARD	gen=624 glyphs=4
2026-03-14T02:43:02.410117	37f4017b	116	29	1.0000	DISCARD	gen=581 glyphs=4
2026-03-14T02:43:02.687761	0eaedb57	116	29	1.0000	DISCARD	gen=624 glyphs=4
2026-03-14T02:43:05.168233	bfdf7cad	120	30	1.0000	DISCARD	gen=581 glyphs=4
2026-03-14T02:43:05.437979	19355583	120	30	1.0000	DISCARD	gen=625 glyphs=4
2026-03-14T02:43:07.875942	fdb5d108	120	30	1.0000	DISCARD	gen=581 glyphs=4
2026-03-14T02:43:08.143220	8aef8872	116	29	1.0000	DISCARD	gen=625 glyphs=4
2026-03-14T02:43:10.563955	12b38c2d	116	29	1.0000	DISCARD	gen=581 glyphs=4
2026-03-14T02:43:10.829662	0eaedb57	116	29	1.0000	DISCARD	gen=625 glyphs=4
2026-03-14T02:43:13.290411	1d34459a	116	29	1.0000	DISCARD	gen=581 glyphs=4
2026-03-14T02:43:13.562471	b57e7176	120	30	1.0000	DISCARD	gen=625 glyphs=4
2026-03-14T02:43:16.004149	5a06ca32	120	30	1.0000	DISCARD	gen=581 glyphs=4
2026-03-14T02:43:16.268323	0ccd5cad	120	30	1.0000	DISCARD	gen=625 glyphs=4
2026-03-14T02:43:18.713995	5a06ca32	120	30	1.0000	DISCARD	gen=581 glyphs=4
2026-03-14T02:43:18.984462	0c03d04a	116	29	1.0000	DISCARD	gen=625 glyphs=4
2026-03-14T02:43:21.437569	fdb5d108	120	30	1.0000	DISCARD	gen=581 glyphs=4
2026-03-14T02:43:21.705755	b8de28a2	116	29	1.0000	DISCARD	gen=625 glyphs=4
2026-03-14T02:43:24.120932	37f4017b	116	29	1.0000	DISCARD	gen=581 glyphs=4
2026-03-14T02:43:24.394681	1e5f0e21	116	29	1.0000	DISCARD	gen=625 glyphs=4
2026-03-14T02:43:26.882976	37f4017b	116	29	1.0000	DISCARD	gen=581 glyphs=4
2026-03-14T02:43:27.151237	b7aed8e9	116	29	1.0000	DISCARD	gen=625 glyphs=4
2026-03-14T02:43:29.616923	37f4017b	116	29	1.0000	DISCARD	gen=582 glyphs=4
2026-03-14T02:43:29.888065	09644a48	116	29	1.0000	DISCARD	gen=625 glyphs=4
2026-03-14T02:43:32.300579	bfdf7cad	120	30	1.0000	DISCARD	gen=582 glyphs=4
2026-03-14T02:43:32.572511	19355583	120	30	1.0000	DISCARD	gen=626 glyphs=4
2026-03-14T02:43:35.005640	71e2ba66	116	29	1.0000	DISCARD	gen=582 glyphs=4
2026-03-14T02:43:35.291147	8aef8872	116	29	1.0000	DISCARD	gen=626 glyphs=4
2026-03-14T02:43:37.705226	55d6c151	120	30	1.0000	DISCARD	gen=582 glyphs=4
2026-03-14T02:43:37.983168	d7c8681b	120	30	1.0000	DISCARD	gen=626 glyphs=4
2026-03-14T02:43:40.418554	5a06ca32	120	30	1.0000	DISCARD	gen=582 glyphs=4
2026-03-14T02:43:40.693973	19355583	120	30	1.0000	DISCARD	gen=626 glyphs=4
2026-03-14T02:43:43.126022	1d34459a	116	29	1.0000	DISCARD	gen=582 glyphs=4
2026-03-14T02:43:43.402988	2fbe6df4	116	29	1.0000	DISCARD	gen=626 glyphs=4
2026-03-14T02:43:45.836157	ae57ceb6	116	29	1.0000	DISCARD	gen=582 glyphs=4
2026-03-14T02:43:46.102914	e6c064b2	116	29	1.0000	DISCARD	gen=626 glyphs=4
2026-03-14T02:43:48.540375	bfdf7cad	120	30	1.0000	DISCARD	gen=582 glyphs=4
2026-03-14T02:43:48.802949	19355583	120	30	1.0000	DISCARD	gen=626 glyphs=4
2026-03-14T02:43:51.223111	fdb5d108	120	30	1.0000	DISCARD	gen=582 glyphs=4
2026-03-14T02:43:51.502917	aef0bea5	116	29	1.0000	DISCARD	gen=626 glyphs=4
2026-03-14T02:43:53.901935	fdb5d108	120	30	1.0000	DISCARD	gen=582 glyphs=4
2026-03-14T02:43:54.174196	8aef8872	116	29	1.0000	DISCARD	gen=626 glyphs=4
2026-03-14T02:43:56.591539	37f4017b	116	29	1.0000	DISCARD	gen=583 glyphs=4
2026-03-14T02:43:56.854795	050862ad	120	30	1.0000	DISCARD	gen=626 glyphs=4
2026-03-14T02:43:59.349672	bfdf7cad	120	30	1.0000	DISCARD	gen=583 glyphs=4
2026-03-14T02:43:59.620914	19355583	120	30	1.0000	DISCARD	gen=627 glyphs=4
2026-03-14T02:44:02.076339	e2dead5b	120	30	1.0000	DISCARD	gen=583 glyphs=4
2026-03-14T02:44:02.350430	8aef8872	116	29	1.0000	DISCARD	gen=627 glyphs=4
2026-03-14T02:44:04.765279	0d64563f	116	29	1.0000	DISCARD	gen=583 glyphs=4
2026-03-14T02:44:05.032393	382711ae	120	30	1.0000	DISCARD	gen=627 glyphs=4
2026-03-14T02:44:07.468445	f06fc7a6	116	29	1.0000	DISCARD	gen=583 glyphs=4
2026-03-14T02:44:07.741139	1e5f0e21	116	29	1.0000	DISCARD	gen=627 glyphs=4
2026-03-14T02:44:10.167891	29745f3d	116	29	1.0000	DISCARD	gen=583 glyphs=4
2026-03-14T02:44:10.442437	d7c8681b	120	30	1.0000	DISCARD	gen=627 glyphs=4
2026-03-14T02:44:12.872200	37f4017b	116	29	1.0000	DISCARD	gen=583 glyphs=4
2026-03-14T02:44:13.148294	e8c7f6cf	120	30	1.0000	DISCARD	gen=627 glyphs=4
2026-03-14T02:44:15.569145	4c9b0dd4	120	30	1.0000	DISCARD	gen=583 glyphs=4
2026-03-14T02:44:15.824713	19355583	120	30	1.0000	DISCARD	gen=627 glyphs=4
2026-03-14T02:44:18.231211	c28e80f9	116	29	1.0000	DISCARD	gen=583 glyphs=4
2026-03-14T02:44:18.502629	b14c111c	116	29	1.0000	DISCARD	gen=627 glyphs=4
2026-03-14T02:44:20.957860	5a06ca32	120	30	1.0000	DISCARD	gen=583 glyphs=4
2026-03-14T02:44:21.229987	4f19cfd2	120	30	1.0000	DISCARD	gen=627 glyphs=4
2026-03-14T02:44:23.650909	37f4017b	116	29	1.0000	DISCARD	gen=584 glyphs=4
2026-03-14T02:44:23.915258	c2d24d51	120	30	1.0000	DISCARD	gen=627 glyphs=4
2026-03-14T02:44:26.379004	bfdf7cad	120	30	1.0000	DISCARD	gen=584 glyphs=4
2026-03-14T02:44:26.648246	19355583	120	30	1.0000	DISCARD	gen=628 glyphs=4
2026-03-14T02:44:29.087911	5a06ca32	120	30	1.0000	DISCARD	gen=584 glyphs=4
2026-03-14T02:44:29.359404	8aef8872	116	29	1.0000	DISCARD	gen=628 glyphs=4
2026-03-14T02:44:31.884178	12b38c2d	116	29	1.0000	DISCARD	gen=584 glyphs=4
2026-03-14T02:44:32.156323	8aef8872	116	29	1.0000	DISCARD	gen=628 glyphs=4
2026-03-14T02:44:34.601782	12b38c2d	116	29	1.0000	DISCARD	gen=584 glyphs=4
2026-03-14T02:44:34.872616	19355583	120	30	1.0000	DISCARD	gen=628 glyphs=4
2026-03-14T02:44:37.287554	7e20c0ef	116	29	1.0000	DISCARD	gen=584 glyphs=4
2026-03-14T02:44:37.560773	875e0f8a	116	29	1.0000	DISCARD	gen=628 glyphs=4
2026-03-14T02:44:39.999989	15d7c473	120	30	1.0000	DISCARD	gen=584 glyphs=4
2026-03-14T02:44:40.267895	b7aed8e9	116	29	1.0000	DISCARD	gen=628 glyphs=4
2026-03-14T02:44:42.709646	7ca87b42	116	29	1.0000	DISCARD	gen=584 glyphs=4
2026-03-14T02:44:42.981459	7048a71a	116	29	1.0000	DISCARD	gen=628 glyphs=4
2026-03-14T02:44:45.444480	37f4017b	116	29	1.0000	DISCARD	gen=584 glyphs=4
2026-03-14T02:44:45.703103	50dc991d	116	29	1.0000	DISCARD	gen=628 glyphs=4
2026-03-14T02:44:48.422863	fdb5d108	120	30	1.0000	DISCARD	gen=584 glyphs=4
2026-03-14T02:44:48.695980	b57e7176	120	30	1.0000	DISCARD	gen=628 glyphs=4
2026-03-14T02:44:51.140339	37f4017b	116	29	1.0000	DISCARD	gen=585 glyphs=4
2026-03-14T02:44:51.408504	ba8a85c8	120	30	1.0000	DISCARD	gen=628 glyphs=4
2026-03-14T02:44:53.825945	bfdf7cad	120	30	1.0000	DISCARD	gen=585 glyphs=4
2026-03-14T02:44:54.092694	19355583	120	30	1.0000	DISCARD	gen=629 glyphs=4
2026-03-14T02:44:56.490664	12b38c2d	116	29	1.0000	DISCARD	gen=585 glyphs=4
2026-03-14T02:44:56.774022	8aef8872	116	29	1.0000	DISCARD	gen=629 glyphs=4
2026-03-14T02:44:59.228468	37f4017b	116	29	1.0000	DISCARD	gen=585 glyphs=4
2026-03-14T02:44:59.499348	33912573	116	29	1.0000	DISCARD	gen=629 glyphs=4
2026-03-14T02:45:01.975142	d95311b0	116	29	1.0000	DISCARD	gen=585 glyphs=4
2026-03-14T02:45:02.258513	19355583	120	30	1.0000	DISCARD	gen=629 glyphs=4
2026-03-14T02:45:04.741604	31beb43f	116	29	1.0000	DISCARD	gen=585 glyphs=4
2026-03-14T02:45:05.002160	8aef8872	116	29	1.0000	DISCARD	gen=629 glyphs=4
2026-03-14T02:45:07.457048	41e5f09e	124	31	0.9500	DISCARD	gen=585 glyphs=4
2026-03-14T02:45:07.721815	d862320d	116	29	1.0000	DISCARD	gen=629 glyphs=4
2026-03-14T02:45:10.173551	2701cb73	116	29	1.0000	DISCARD	gen=585 glyphs=4
2026-03-14T02:45:10.440281	160906da	116	29	1.0000	DISCARD	gen=629 glyphs=4
2026-03-14T02:45:12.893258	1d34459a	116	29	1.0000	DISCARD	gen=585 glyphs=4
2026-03-14T02:45:13.162793	8aef8872	116	29	1.0000	DISCARD	gen=629 glyphs=4
2026-03-14T02:45:15.879912	5a06ca32	120	30	1.0000	DISCARD	gen=585 glyphs=4
2026-03-14T02:45:16.145839	eca7ab6c	116	29	1.0000	DISCARD	gen=629 glyphs=4
2026-03-14T02:45:18.572323	37f4017b	116	29	1.0000	DISCARD	gen=586 glyphs=4
2026-03-14T02:45:18.849964	a78f9454	120	30	1.0000	DISCARD	gen=629 glyphs=4
2026-03-14T02:45:21.287162	bfdf7cad	120	30	1.0000	DISCARD	gen=586 glyphs=4
2026-03-14T02:45:21.562038	19355583	120	30	1.0000	DISCARD	gen=630 glyphs=4
2026-03-14T02:45:24.003082	bfdf7cad	120	30	1.0000	DISCARD	gen=586 glyphs=4
2026-03-14T02:45:24.271736	8aef8872	116	29	1.0000	DISCARD	gen=630 glyphs=4
2026-03-14T02:45:26.735580	12b38c2d	116	29	1.0000	DISCARD	gen=586 glyphs=4
2026-03-14T02:45:27.004014	473f2810	120	30	1.0000	DISCARD	gen=630 glyphs=4
2026-03-14T02:45:29.414147	2a58163d	116	29	1.0000	DISCARD	gen=586 glyphs=4
2026-03-14T02:45:29.682160	75bf5506	120	30	1.0000	DISCARD	gen=630 glyphs=4
2026-03-14T02:45:32.140704	71e2ba66	116	29	1.0000	DISCARD	gen=586 glyphs=4
2026-03-14T02:45:32.417297	e8c7f6cf	120	30	1.0000	DISCARD	gen=630 glyphs=4
2026-03-14T02:45:34.922457	71e2ba66	116	29	1.0000	DISCARD	gen=586 glyphs=4
2026-03-14T02:45:35.207554	00711e9d	120	30	1.0000	DISCARD	gen=630 glyphs=4
2026-03-14T02:45:37.891475	1d34459a	116	29	1.0000	DISCARD	gen=586 glyphs=4
2026-03-14T02:45:38.273613	0eaedb57	116	29	1.0000	DISCARD	gen=630 glyphs=4
2026-03-14T02:45:40.750592	37f4017b	116	29	1.0000	DISCARD	gen=586 glyphs=4
2026-03-14T02:45:41.030969	3529494b	120	30	1.0000	DISCARD	gen=630 glyphs=4
2026-03-14T02:45:43.467267	fdb5d108	120	30	1.0000	DISCARD	gen=586 glyphs=4
2026-03-14T02:45:43.744047	eca7ab6c	116	29	1.0000	DISCARD	gen=630 glyphs=4
2026-03-14T02:45:46.155386	37f4017b	116	29	1.0000	DISCARD	gen=587 glyphs=4
2026-03-14T02:45:46.425513	c45b74b6	120	30	1.0000	DISCARD	gen=630 glyphs=4
2026-03-14T02:45:48.848736	bfdf7cad	120	30	1.0000	DISCARD	gen=587 glyphs=4
2026-03-14T02:45:49.130024	19355583	120	30	1.0000	DISCARD	gen=631 glyphs=4
2026-03-14T02:45:51.583893	5a06ca32	120	30	1.0000	DISCARD	gen=587 glyphs=4
2026-03-14T02:45:51.846319	8aef8872	116	29	1.0000	DISCARD	gen=631 glyphs=4
2026-03-14T02:45:54.283003	b4b3938b	120	30	1.0000	DISCARD	gen=587 glyphs=4
2026-03-14T02:45:54.552300	e2cd28ea	120	30	1.0000	DISCARD	gen=631 glyphs=4
2026-03-14T02:45:57.012923	b0e721a2	116	29	1.0000	DISCARD	gen=587 glyphs=4
2026-03-14T02:45:57.274726	fb17aba7	116	29	0.9500	DISCARD	gen=631 glyphs=4
2026-03-14T02:45:59.741263	5a06ca32	120	30	1.0000	DISCARD	gen=587 glyphs=4
2026-03-14T02:46:00.005420	dbdbb03d	120	30	1.0000	DISCARD	gen=631 glyphs=4
2026-03-14T02:46:02.454074	5a06ca32	120	30	1.0000	DISCARD	gen=587 glyphs=4
2026-03-14T02:46:02.717202	0eaedb57	116	29	1.0000	DISCARD	gen=631 glyphs=4
2026-03-14T02:46:05.147010	5a06ca32	120	30	1.0000	DISCARD	gen=587 glyphs=4
2026-03-14T02:46:05.417907	ef22aac8	116	29	0.9500	DISCARD	gen=631 glyphs=4
2026-03-14T02:46:07.964026	37f4017b	116	29	1.0000	DISCARD	gen=587 glyphs=4
2026-03-14T02:46:08.235167	8aef8872	116	29	1.0000	DISCARD	gen=631 glyphs=4
2026-03-14T02:46:10.853464	5a06ca32	120	30	1.0000	DISCARD	gen=587 glyphs=4
2026-03-14T02:46:11.122218	1e5f0e21	116	29	1.0000	DISCARD	gen=631 glyphs=4
2026-03-14T02:46:13.548243	37f4017b	116	29	1.0000	DISCARD	gen=588 glyphs=4
2026-03-14T02:46:13.819572	8aef8872	116	29	1.0000	DISCARD	gen=631 glyphs=4
2026-03-14T02:46:16.241267	bfdf7cad	120	30	1.0000	DISCARD	gen=588 glyphs=4
2026-03-14T02:46:16.504371	19355583	120	30	1.0000	DISCARD	gen=632 glyphs=4
2026-03-14T02:46:18.940774	08be2bcf	116	29	1.0000	DISCARD	gen=588 glyphs=4
2026-03-14T02:46:19.211463	8aef8872	116	29	1.0000	DISCARD	gen=632 glyphs=4
2026-03-14T02:46:21.629042	fdb5d108	120	30	1.0000	DISCARD	gen=588 glyphs=4
2026-03-14T02:46:21.898491	b2f0bf3b	116	29	1.0000	DISCARD	gen=632 glyphs=4
2026-03-14T02:46:24.323106	37f4017b	116	29	1.0000	DISCARD	gen=588 glyphs=4
2026-03-14T02:46:24.590892	eca7ab6c	116	29	1.0000	DISCARD	gen=632 glyphs=4
2026-03-14T02:46:27.008384	a6c6bcd4	120	30	0.9500	DISCARD	gen=588 glyphs=4
2026-03-14T02:46:27.269051	ae8bf571	120	30	1.0000	DISCARD	gen=632 glyphs=4
2026-03-14T02:46:29.700358	08590a3c	124	31	0.9500	DISCARD	gen=588 glyphs=4
2026-03-14T02:46:29.965537	0eaedb57	116	29	1.0000	DISCARD	gen=632 glyphs=4
2026-03-14T02:46:32.424118	1d34459a	116	29	1.0000	DISCARD	gen=588 glyphs=4
2026-03-14T02:46:32.709046	050862ad	120	30	1.0000	DISCARD	gen=632 glyphs=4
2026-03-14T02:46:35.252991	71e2ba66	116	29	1.0000	DISCARD	gen=588 glyphs=4
2026-03-14T02:46:35.531628	19355583	120	30	1.0000	DISCARD	gen=632 glyphs=4
2026-03-14T02:46:38.084209	5a06ca32	120	30	1.0000	DISCARD	gen=588 glyphs=4
2026-03-14T02:46:38.385267	023c6a2f	120	30	1.0000	DISCARD	gen=632 glyphs=4
2026-03-14T02:46:40.840508	37f4017b	116	29	1.0000	DISCARD	gen=589 glyphs=4
2026-03-14T02:46:41.115194	8aef8872	116	29	1.0000	DISCARD	gen=632 glyphs=4
2026-03-14T02:46:43.612470	bfdf7cad	120	30	1.0000	DISCARD	gen=589 glyphs=4
2026-03-14T02:46:43.888367	19355583	120	30	1.0000	DISCARD	gen=633 glyphs=4
2026-03-14T02:46:46.350689	3713e88f	116	29	1.0000	DISCARD	gen=589 glyphs=4
2026-03-14T02:46:46.638863	8aef8872	116	29	1.0000	DISCARD	gen=633 glyphs=4
2026-03-14T02:46:49.155201	5a06ca32	120	30	1.0000	DISCARD	gen=589 glyphs=4
2026-03-14T02:46:49.487597	19355583	120	30	1.0000	DISCARD	gen=633 glyphs=4
2026-03-14T02:46:52.102846	85020068	116	29	0.9500	DISCARD	gen=589 glyphs=4
2026-03-14T02:46:52.390628	19355583	120	30	1.0000	DISCARD	gen=633 glyphs=4
2026-03-14T02:46:54.824360	271c263f	120	30	1.0000	DISCARD	gen=589 glyphs=4
2026-03-14T02:46:55.089432	8aef8872	116	29	1.0000	DISCARD	gen=633 glyphs=4
2026-03-14T02:46:57.508801	5a06ca32	120	30	1.0000	DISCARD	gen=589 glyphs=4
2026-03-14T02:46:57.785014	8ba6a459	120	30	1.0000	DISCARD	gen=633 glyphs=4
2026-03-14T02:47:00.235105	a345778b	116	29	0.9500	DISCARD	gen=589 glyphs=4
2026-03-14T02:47:00.499804	050862ad	120	30	1.0000	DISCARD	gen=633 glyphs=4
2026-03-14T02:47:02.922775	37f4017b	116	29	1.0000	DISCARD	gen=589 glyphs=4
2026-03-14T02:47:03.200285	76275440	120	30	1.0000	DISCARD	gen=633 glyphs=4
2026-03-14T02:47:05.655467	fdb5d108	120	30	1.0000	DISCARD	gen=589 glyphs=4
2026-03-14T02:47:05.931487	494ba4d3	116	29	0.9500	DISCARD	gen=633 glyphs=4
2026-03-14T02:47:08.356683	37f4017b	116	29	1.0000	DISCARD	gen=590 glyphs=4
2026-03-14T02:47:08.633622	8aef8872	116	29	1.0000	DISCARD	gen=633 glyphs=4
2026-03-14T02:47:11.105164	bfdf7cad	120	30	1.0000	DISCARD	gen=590 glyphs=4
2026-03-14T02:47:11.375832	19355583	120	30	1.0000	DISCARD	gen=634 glyphs=4
2026-03-14T02:47:13.839806	55d6c151	120	30	1.0000	DISCARD	gen=590 glyphs=4
2026-03-14T02:47:14.111523	8aef8872	116	29	1.0000	DISCARD	gen=634 glyphs=4
2026-03-14T02:47:16.535990	4da32b23	116	29	1.0000	DISCARD	gen=590 glyphs=4
2026-03-14T02:47:16.810010	67cb81be	120	30	1.0000	DISCARD	gen=634 glyphs=4
2026-03-14T02:47:19.261247	a10146de	116	29	1.0000	DISCARD	gen=590 glyphs=4
2026-03-14T02:47:19.541923	a78f9454	120	30	1.0000	DISCARD	gen=634 glyphs=4
2026-03-14T02:47:21.962956	5b9807ac	120	30	1.0000	DISCARD	gen=590 glyphs=4
2026-03-14T02:47:22.230314	7a4a9559	120	30	1.0000	DISCARD	gen=634 glyphs=4
2026-03-14T02:47:24.667972	82d14d71	116	29	1.0000	DISCARD	gen=590 glyphs=4
2026-03-14T02:47:24.928104	19355583	120	30	1.0000	DISCARD	gen=634 glyphs=4
2026-03-14T02:47:27.377988	5a06ca32	120	30	1.0000	DISCARD	gen=590 glyphs=4
2026-03-14T02:47:27.657916	8aef8872	116	29	1.0000	DISCARD	gen=634 glyphs=4
2026-03-14T02:47:30.085121	5a06ca32	120	30	1.0000	DISCARD	gen=590 glyphs=4
2026-03-14T02:47:30.351973	7b18b00d	120	30	1.0000	DISCARD	gen=634 glyphs=4
2026-03-14T02:47:32.772821	55d6c151	120	30	1.0000	DISCARD	gen=590 glyphs=4
2026-03-14T02:47:33.039834	dfd937c1	120	30	1.0000	DISCARD	gen=634 glyphs=4
2026-03-14T02:47:35.480472	37f4017b	116	29	1.0000	DISCARD	gen=591 glyphs=4
2026-03-14T02:47:35.748456	ef003ac3	120	30	1.0000	DISCARD	gen=634 glyphs=4
2026-03-14T02:47:38.176373	bfdf7cad	120	30	1.0000	DISCARD	gen=591 glyphs=4
2026-03-14T02:47:38.452350	19355583	120	30	1.0000	DISCARD	gen=635 glyphs=4
2026-03-14T02:47:40.875205	fdb5d108	120	30	1.0000	DISCARD	gen=591 glyphs=4
2026-03-14T02:47:41.149820	8aef8872	116	29	1.0000	DISCARD	gen=635 glyphs=4
2026-03-14T02:47:44.006765	5a06ca32	120	30	1.0000	DISCARD	gen=591 glyphs=4
2026-03-14T02:47:44.265795	b54372c2	116	29	1.0000	DISCARD	gen=635 glyphs=4
2026-03-14T02:47:46.707728	55d6c151	120	30	1.0000	DISCARD	gen=591 glyphs=4
2026-03-14T02:47:46.969686	19355583	120	30	1.0000	DISCARD	gen=635 glyphs=4
2026-03-14T02:47:49.430304	a84f6e9f	124	31	0.9500	DISCARD	gen=591 glyphs=4
2026-03-14T02:47:49.692574	19355583	120	30	1.0000	DISCARD	gen=635 glyphs=4
2026-03-14T02:47:52.135533	c4912100	120	30	1.0000	DISCARD	gen=591 glyphs=4
2026-03-14T02:47:52.414398	0eaedb57	116	29	1.0000	DISCARD	gen=635 glyphs=4
2026-03-14T02:47:54.834244	4c9b0dd4	120	30	1.0000	DISCARD	gen=591 glyphs=4
2026-03-14T02:47:55.110328	050862ad	120	30	1.0000	DISCARD	gen=635 glyphs=4
2026-03-14T02:47:57.520321	1337ae0c	120	30	1.0000	DISCARD	gen=591 glyphs=4
2026-03-14T02:47:57.786961	19355583	120	30	1.0000	DISCARD	gen=635 glyphs=4
2026-03-14T02:48:00.244342	37f4017b	116	29	1.0000	DISCARD	gen=591 glyphs=4
2026-03-14T02:48:00.515986	050862ad	120	30	1.0000	DISCARD	gen=635 glyphs=4
2026-03-14T02:48:02.975445	37f4017b	116	29	1.0000	DISCARD	gen=592 glyphs=4
2026-03-14T02:48:03.236428	1e5f0e21	116	29	1.0000	DISCARD	gen=635 glyphs=4
2026-03-14T02:48:05.673731	bfdf7cad	120	30	1.0000	DISCARD	gen=592 glyphs=4
2026-03-14T02:48:06.059578	19355583	120	30	1.0000	DISCARD	gen=636 glyphs=4
2026-03-14T02:48:08.634336	37f4017b	116	29	1.0000	DISCARD	gen=592 glyphs=4
2026-03-14T02:48:08.911003	8aef8872	116	29	1.0000	DISCARD	gen=636 glyphs=4
2026-03-14T02:48:11.372439	d7f42221	116	29	1.0000	DISCARD	gen=592 glyphs=4
2026-03-14T02:48:11.644641	50dc991d	116	29	1.0000	DISCARD	gen=636 glyphs=4
2026-03-14T02:48:14.176384	1d17430a	116	29	1.0000	DISCARD	gen=592 glyphs=4
2026-03-14T02:48:14.448205	0eaedb57	116	29	1.0000	DISCARD	gen=636 glyphs=4
2026-03-14T02:48:16.885772	fdb5d108	120	30	1.0000	DISCARD	gen=592 glyphs=4
2026-03-14T02:48:17.153341	ae44ace5	116	29	1.0000	DISCARD	gen=636 glyphs=4
2026-03-14T02:48:19.613472	8aee0adc	116	29	1.0000	DISCARD	gen=592 glyphs=4
2026-03-14T02:48:19.878435	19355583	120	30	1.0000	DISCARD	gen=636 glyphs=4
