timestamp	program_hash	spirv_size	word_count	fitness	status	description
2026-03-14T00:35:04.588933	5b9807ac	120	30	1.0000	DISCARD	gen=300 glyphs=4
2026-03-14T00:35:04.881693	19355583	120	30	1.0000	DISCARD	gen=344 glyphs=4
2026-03-14T00:35:07.397492	d11c1062	120	30	1.0000	DISCARD	gen=300 glyphs=4
2026-03-14T00:35:07.667861	ae44ace5	116	29	1.0000	DISCARD	gen=344 glyphs=4
2026-03-14T00:35:10.142850	10a1d166	120	30	0.9500	DISCARD	gen=300 glyphs=4
2026-03-14T00:35:10.419089	a78f9454	120	30	1.0000	DISCARD	gen=344 glyphs=4
2026-03-14T00:35:12.909555	37f4017b	116	29	1.0000	DISCARD	gen=301 glyphs=4
2026-03-14T00:35:13.182918	d7c8681b	120	30	1.0000	DISCARD	gen=344 glyphs=4
2026-03-14T00:35:15.675552	bfdf7cad	120	30	1.0000	DISCARD	gen=301 glyphs=4
2026-03-14T00:35:15.950255	19355583	120	30	1.0000	DISCARD	gen=345 glyphs=4
2026-03-14T00:35:18.396219	37f4017b	116	29	1.0000	DISCARD	gen=301 glyphs=4
2026-03-14T00:35:18.664949	8aef8872	116	29	1.0000	DISCARD	gen=345 glyphs=4
2026-03-14T00:35:21.138952	37f4017b	116	29	1.0000	DISCARD	gen=301 glyphs=4
2026-03-14T00:35:21.417451	e2cd28ea	120	30	1.0000	DISCARD	gen=345 glyphs=4
2026-03-14T00:35:23.844952	d61abde6	116	29	0.9500	DISCARD	gen=301 glyphs=4
2026-03-14T00:35:24.108779	2f30bbe4	120	30	0.9500	DISCARD	gen=345 glyphs=4
2026-03-14T00:35:26.571568	55d6c151	120	30	1.0000	DISCARD	gen=301 glyphs=4
2026-03-14T00:35:26.843263	e2cd28ea	120	30	1.0000	DISCARD	gen=345 glyphs=4
2026-03-14T00:35:29.293796	2701cb73	116	29	1.0000	DISCARD	gen=301 glyphs=4
2026-03-14T00:35:29.563365	8aef8872	116	29	1.0000	DISCARD	gen=345 glyphs=4
2026-03-14T00:35:32.048225	8ff021e5	120	30	1.0000	DISCARD	gen=301 glyphs=4
2026-03-14T00:35:32.315606	050862ad	120	30	1.0000	DISCARD	gen=345 glyphs=4
2026-03-14T00:35:34.741748	12b38c2d	116	29	1.0000	DISCARD	gen=301 glyphs=4
2026-03-14T00:35:35.022541	050862ad	120	30	1.0000	DISCARD	gen=345 glyphs=4
2026-03-14T00:35:37.476788	6da8648b	120	30	1.0000	DISCARD	gen=301 glyphs=4
2026-03-14T00:35:37.740950	19355583	120	30	1.0000	DISCARD	gen=345 glyphs=4
2026-03-14T00:35:40.296551	37f4017b	116	29	1.0000	DISCARD	gen=302 glyphs=4
2026-03-14T00:35:40.568939	19355583	120	30	1.0000	DISCARD	gen=345 glyphs=4
2026-03-14T00:35:43.032948	bfdf7cad	120	30	1.0000	DISCARD	gen=302 glyphs=4
2026-03-14T00:35:43.304691	19355583	120	30	1.0000	DISCARD	gen=346 glyphs=4
2026-03-14T00:35:45.803721	fdb5d108	120	30	1.0000	DISCARD	gen=302 glyphs=4
2026-03-14T00:35:46.066635	8aef8872	116	29	1.0000	DISCARD	gen=346 glyphs=4
2026-03-14T00:35:48.518587	f34b9968	116	29	1.0000	DISCARD	gen=302 glyphs=4
2026-03-14T00:35:48.793434	ae44ace5	116	29	1.0000	DISCARD	gen=346 glyphs=4
2026-03-14T00:35:51.258292	bbfbd484	116	29	1.0000	DISCARD	gen=302 glyphs=4
2026-03-14T00:35:51.522194	933dcbfc	116	29	0.9500	DISCARD	gen=346 glyphs=4
2026-03-14T00:35:53.971541	ff7ff18e	116	29	1.0000	DISCARD	gen=302 glyphs=4
2026-03-14T00:35:54.241751	9e34ede0	116	29	1.0000	DISCARD	gen=346 glyphs=4
2026-03-14T00:35:56.698165	6879807e	120	30	1.0000	DISCARD	gen=302 glyphs=4
2026-03-14T00:35:56.969359	67cb81be	120	30	1.0000	DISCARD	gen=346 glyphs=4
2026-03-14T00:35:59.407152	12b38c2d	116	29	1.0000	DISCARD	gen=302 glyphs=4
2026-03-14T00:35:59.681650	1e5f0e21	116	29	1.0000	DISCARD	gen=346 glyphs=4
2026-03-14T00:36:02.131087	247ec07a	116	29	1.0000	DISCARD	gen=302 glyphs=4
2026-03-14T00:36:02.409385	d7c8681b	120	30	1.0000	DISCARD	gen=346 glyphs=4
2026-03-14T00:36:04.848168	37f4017b	116	29	1.0000	DISCARD	gen=302 glyphs=4
2026-03-14T00:36:05.113206	97f0d98a	116	29	1.0000	DISCARD	gen=346 glyphs=4
2026-03-14T00:36:07.571062	37f4017b	116	29	1.0000	DISCARD	gen=303 glyphs=4
2026-03-14T00:36:07.846808	cd05e4cb	116	29	1.0000	DISCARD	gen=346 glyphs=4
2026-03-14T00:36:10.354474	bfdf7cad	120	30	1.0000	DISCARD	gen=303 glyphs=4
2026-03-14T00:36:10.645485	19355583	120	30	1.0000	DISCARD	gen=347 glyphs=4
2026-03-14T00:36:13.106842	5b9807ac	120	30	1.0000	DISCARD	gen=303 glyphs=4
2026-03-14T00:36:13.375202	8aef8872	116	29	1.0000	DISCARD	gen=347 glyphs=4
2026-03-14T00:36:15.810142	d11c1062	120	30	1.0000	DISCARD	gen=303 glyphs=4
2026-03-14T00:36:16.083870	0eaedb57	116	29	1.0000	DISCARD	gen=347 glyphs=4
2026-03-14T00:36:18.551182	1d34459a	116	29	1.0000	DISCARD	gen=303 glyphs=4
2026-03-14T00:36:18.826653	19355583	120	30	1.0000	DISCARD	gen=347 glyphs=4
2026-03-14T00:36:21.269727	d11c1062	120	30	1.0000	DISCARD	gen=303 glyphs=4
2026-03-14T00:36:21.541918	0eaedb57	116	29	1.0000	DISCARD	gen=347 glyphs=4
2026-03-14T00:36:24.022195	479e7bba	116	29	1.0000	DISCARD	gen=303 glyphs=4
2026-03-14T00:36:24.296039	19355583	120	30	1.0000	DISCARD	gen=347 glyphs=4
2026-03-14T00:36:26.756769	55d6c151	120	30	1.0000	DISCARD	gen=303 glyphs=4
2026-03-14T00:36:27.028344	eca7ab6c	116	29	1.0000	DISCARD	gen=347 glyphs=4
2026-03-14T00:36:29.486178	5a06ca32	120	30	1.0000	DISCARD	gen=303 glyphs=4
2026-03-14T00:36:29.745786	1e5f0e21	116	29	1.0000	DISCARD	gen=347 glyphs=4
2026-03-14T00:36:32.237488	5b9807ac	120	30	1.0000	DISCARD	gen=303 glyphs=4
2026-03-14T00:36:32.505165	efde608e	120	30	1.0000	DISCARD	gen=347 glyphs=4
2026-03-14T00:36:34.936754	37f4017b	116	29	1.0000	DISCARD	gen=304 glyphs=4
2026-03-14T00:36:35.207272	8a2ee13e	116	29	1.0000	DISCARD	gen=347 glyphs=4
2026-03-14T00:36:37.660083	bfdf7cad	120	30	1.0000	DISCARD	gen=304 glyphs=4
2026-03-14T00:36:37.929489	19355583	120	30	1.0000	DISCARD	gen=348 glyphs=4
2026-03-14T00:36:40.391457	5a06ca32	120	30	1.0000	DISCARD	gen=304 glyphs=4
2026-03-14T00:36:40.664551	8aef8872	116	29	1.0000	DISCARD	gen=348 glyphs=4
2026-03-14T00:36:43.181285	d11c1062	120	30	1.0000	DISCARD	gen=304 glyphs=4
2026-03-14T00:36:43.463732	0eaedb57	116	29	1.0000	DISCARD	gen=348 glyphs=4
2026-03-14T00:36:45.903153	7ca87b42	116	29	1.0000	DISCARD	gen=304 glyphs=4
2026-03-14T00:36:46.183739	a78f9454	120	30	1.0000	DISCARD	gen=348 glyphs=4
2026-03-14T00:36:48.606175	2701cb73	116	29	1.0000	DISCARD	gen=304 glyphs=4
2026-03-14T00:36:48.904302	e2cd28ea	120	30	1.0000	DISCARD	gen=348 glyphs=4
2026-03-14T00:36:51.359321	5a06ca32	120	30	1.0000	DISCARD	gen=304 glyphs=4
2026-03-14T00:36:51.621790	9e34ede0	116	29	1.0000	DISCARD	gen=348 glyphs=4
2026-03-14T00:36:54.094348	5a06ca32	120	30	1.0000	DISCARD	gen=304 glyphs=4
2026-03-14T00:36:54.380868	8aef8872	116	29	1.0000	DISCARD	gen=348 glyphs=4
2026-03-14T00:36:56.828968	7ca87b42	116	29	1.0000	DISCARD	gen=304 glyphs=4
2026-03-14T00:36:57.107699	050862ad	120	30	1.0000	DISCARD	gen=348 glyphs=4
2026-03-14T00:36:59.583857	1d34459a	116	29	1.0000	DISCARD	gen=304 glyphs=4
2026-03-14T00:36:59.858759	875e0f8a	116	29	1.0000	DISCARD	gen=348 glyphs=4
2026-03-14T00:37:02.347122	37f4017b	116	29	1.0000	DISCARD	gen=305 glyphs=4
2026-03-14T00:37:02.635427	dd9a2ccb	116	29	0.9500	DISCARD	gen=348 glyphs=4
2026-03-14T00:37:05.128166	bfdf7cad	120	30	1.0000	DISCARD	gen=305 glyphs=4
2026-03-14T00:37:05.411424	19355583	120	30	1.0000	DISCARD	gen=349 glyphs=4
2026-03-14T00:37:07.918346	5b9807ac	120	30	1.0000	DISCARD	gen=305 glyphs=4
2026-03-14T00:37:08.199144	8aef8872	116	29	1.0000	DISCARD	gen=349 glyphs=4
2026-03-14T00:37:10.657934	2701cb73	116	29	1.0000	DISCARD	gen=305 glyphs=4
2026-03-14T00:37:10.934073	50dc991d	116	29	1.0000	DISCARD	gen=349 glyphs=4
2026-03-14T00:37:13.412197	37f4017b	116	29	1.0000	DISCARD	gen=305 glyphs=4
2026-03-14T00:37:13.713329	b57e7176	120	30	1.0000	DISCARD	gen=349 glyphs=4
2026-03-14T00:37:16.229123	12b38c2d	116	29	1.0000	DISCARD	gen=305 glyphs=4
2026-03-14T00:37:16.497929	eca7ab6c	116	29	1.0000	DISCARD	gen=349 glyphs=4
2026-03-14T00:37:18.938795	2701cb73	116	29	1.0000	DISCARD	gen=305 glyphs=4
2026-03-14T00:37:19.206553	1e5f0e21	116	29	1.0000	DISCARD	gen=349 glyphs=4
2026-03-14T00:37:21.650674	5a06ca32	120	30	1.0000	DISCARD	gen=305 glyphs=4
2026-03-14T00:37:21.941683	9e34ede0	116	29	1.0000	DISCARD	gen=349 glyphs=4
2026-03-14T00:37:24.432040	37f4017b	116	29	1.0000	DISCARD	gen=305 glyphs=4
2026-03-14T00:37:24.703887	0eaedb57	116	29	1.0000	DISCARD	gen=349 glyphs=4
2026-03-14T00:37:27.162538	71e2ba66	116	29	1.0000	DISCARD	gen=305 glyphs=4
2026-03-14T00:37:27.457603	b57e7176	120	30	1.0000	DISCARD	gen=349 glyphs=4
2026-03-14T00:37:29.887729	37f4017b	116	29	1.0000	DISCARD	gen=306 glyphs=4
2026-03-14T00:37:30.157504	7ebd32c9	120	30	1.0000	DISCARD	gen=349 glyphs=4
2026-03-14T00:37:32.619654	bfdf7cad	120	30	1.0000	DISCARD	gen=306 glyphs=4
2026-03-14T00:37:32.885883	19355583	120	30	1.0000	DISCARD	gen=350 glyphs=4
2026-03-14T00:37:35.331950	7ca87b42	116	29	1.0000	DISCARD	gen=306 glyphs=4
2026-03-14T00:37:35.602523	8aef8872	116	29	1.0000	DISCARD	gen=350 glyphs=4
2026-03-14T00:37:38.034582	37f4017b	116	29	1.0000	DISCARD	gen=306 glyphs=4
2026-03-14T00:37:38.312220	f150ed83	116	29	1.0000	DISCARD	gen=350 glyphs=4
2026-03-14T00:37:40.730411	8c272983	120	30	1.0000	DISCARD	gen=306 glyphs=4
2026-03-14T00:37:41.007428	050862ad	120	30	1.0000	DISCARD	gen=350 glyphs=4
2026-03-14T00:37:43.463050	37f4017b	116	29	1.0000	DISCARD	gen=306 glyphs=4
2026-03-14T00:37:43.726482	0eaedb57	116	29	1.0000	DISCARD	gen=350 glyphs=4
2026-03-14T00:37:46.232049	55d6c151	120	30	1.0000	DISCARD	gen=306 glyphs=4
2026-03-14T00:37:46.518826	db530ea0	116	29	0.9500	DISCARD	gen=350 glyphs=4
2026-03-14T00:37:48.971666	bfdf7cad	120	30	1.0000	DISCARD	gen=306 glyphs=4
2026-03-14T00:37:49.240070	ee48dc26	120	30	1.0000	DISCARD	gen=350 glyphs=4
2026-03-14T00:37:51.653028	5a06ca32	120	30	1.0000	DISCARD	gen=306 glyphs=4
2026-03-14T00:37:51.918169	f9a8c831	116	29	1.0000	DISCARD	gen=350 glyphs=4
2026-03-14T00:37:54.341928	37f4017b	116	29	1.0000	DISCARD	gen=306 glyphs=4
2026-03-14T00:37:54.613039	b57e7176	120	30	1.0000	DISCARD	gen=350 glyphs=4
2026-03-14T00:37:57.043554	37f4017b	116	29	1.0000	DISCARD	gen=307 glyphs=4
2026-03-14T00:37:57.311869	b7aed8e9	116	29	1.0000	DISCARD	gen=350 glyphs=4
2026-03-14T00:37:59.732679	bfdf7cad	120	30	1.0000	DISCARD	gen=307 glyphs=4
2026-03-14T00:38:00.002322	19355583	120	30	1.0000	DISCARD	gen=351 glyphs=4
2026-03-14T00:38:02.452206	d11c1062	120	30	1.0000	DISCARD	gen=307 glyphs=4
2026-03-14T00:38:02.719905	8aef8872	116	29	1.0000	DISCARD	gen=351 glyphs=4
2026-03-14T00:38:05.121965	da5c3401	116	29	1.0000	DISCARD	gen=307 glyphs=4
2026-03-14T00:38:05.399026	1e5f0e21	116	29	1.0000	DISCARD	gen=351 glyphs=4
2026-03-14T00:38:07.821887	2701cb73	116	29	1.0000	DISCARD	gen=307 glyphs=4
2026-03-14T00:38:08.087146	8aef8872	116	29	1.0000	DISCARD	gen=351 glyphs=4
2026-03-14T00:38:10.591650	d11c1062	120	30	1.0000	DISCARD	gen=307 glyphs=4
2026-03-14T00:38:10.854583	9e34ede0	116	29	1.0000	DISCARD	gen=351 glyphs=4
2026-03-14T00:38:13.313694	5a06ca32	120	30	1.0000	DISCARD	gen=307 glyphs=4
2026-03-14T00:38:13.579690	e8c7f6cf	120	30	1.0000	DISCARD	gen=351 glyphs=4
2026-03-14T00:38:16.003187	4c9b0dd4	120	30	1.0000	DISCARD	gen=307 glyphs=4
2026-03-14T00:38:16.280494	fcbadc4b	124	31	0.9500	DISCARD	gen=351 glyphs=4
2026-03-14T00:38:18.770986	bfdf7cad	120	30	1.0000	DISCARD	gen=307 glyphs=4
2026-03-14T00:38:19.054697	ae44ace5	116	29	1.0000	DISCARD	gen=351 glyphs=4
2026-03-14T00:38:21.499987	37f4017b	116	29	1.0000	DISCARD	gen=307 glyphs=4
2026-03-14T00:38:21.764668	19355583	120	30	1.0000	DISCARD	gen=351 glyphs=4
2026-03-14T00:38:24.198734	37f4017b	116	29	1.0000	DISCARD	gen=308 glyphs=4
2026-03-14T00:38:24.460124	1e5f0e21	116	29	1.0000	DISCARD	gen=351 glyphs=4
2026-03-14T00:38:26.898912	bfdf7cad	120	30	1.0000	DISCARD	gen=308 glyphs=4
2026-03-14T00:38:27.164600	19355583	120	30	1.0000	DISCARD	gen=352 glyphs=4
2026-03-14T00:38:29.553962	65c95260	116	29	1.0000	DISCARD	gen=308 glyphs=4
2026-03-14T00:38:29.821400	8aef8872	116	29	1.0000	DISCARD	gen=352 glyphs=4
2026-03-14T00:38:32.246417	2701cb73	116	29	1.0000	DISCARD	gen=308 glyphs=4
2026-03-14T00:38:32.514596	8aef8872	116	29	1.0000	DISCARD	gen=352 glyphs=4
2026-03-14T00:38:34.954699	2701cb73	116	29	1.0000	DISCARD	gen=308 glyphs=4
2026-03-14T00:38:35.223686	64af1c6a	116	29	1.0000	DISCARD	gen=352 glyphs=4
2026-03-14T00:38:37.641371	37f4017b	116	29	1.0000	DISCARD	gen=308 glyphs=4
2026-03-14T00:38:37.907813	67cb81be	120	30	1.0000	DISCARD	gen=352 glyphs=4
2026-03-14T00:38:40.350080	d0647de4	120	30	1.0000	DISCARD	gen=308 glyphs=4
2026-03-14T00:38:40.621898	50dc991d	116	29	1.0000	DISCARD	gen=352 glyphs=4
2026-03-14T00:38:43.043664	6edaecba	120	30	1.0000	DISCARD	gen=308 glyphs=4
2026-03-14T00:38:43.329571	9be05216	116	29	0.9500	DISCARD	gen=352 glyphs=4
2026-03-14T00:38:45.780272	5a06ca32	120	30	1.0000	DISCARD	gen=308 glyphs=4
2026-03-14T00:38:46.050171	1e5f0e21	116	29	1.0000	DISCARD	gen=352 glyphs=4
2026-03-14T00:38:48.473763	5b9807ac	120	30	1.0000	DISCARD	gen=308 glyphs=4
2026-03-14T00:38:48.750272	ae44ace5	116	29	1.0000	DISCARD	gen=352 glyphs=4
2026-03-14T00:38:51.286473	37f4017b	116	29	1.0000	DISCARD	gen=309 glyphs=4
2026-03-14T00:38:51.559407	ae44ace5	116	29	1.0000	DISCARD	gen=352 glyphs=4
2026-03-14T00:38:53.993338	bfdf7cad	120	30	1.0000	DISCARD	gen=309 glyphs=4
2026-03-14T00:38:54.268546	19355583	120	30	1.0000	DISCARD	gen=353 glyphs=4
2026-03-14T00:38:56.708070	d11c1062	120	30	1.0000	DISCARD	gen=309 glyphs=4
2026-03-14T00:38:56.976675	8aef8872	116	29	1.0000	DISCARD	gen=353 glyphs=4
2026-03-14T00:38:59.402388	55d6c151	120	30	1.0000	DISCARD	gen=309 glyphs=4
2026-03-14T00:38:59.669443	050862ad	120	30	1.0000	DISCARD	gen=353 glyphs=4
2026-03-14T00:39:02.098949	9449e6bf	120	30	1.0000	DISCARD	gen=309 glyphs=4
2026-03-14T00:39:02.367109	37ba13e8	116	29	1.0000	DISCARD	gen=353 glyphs=4
2026-03-14T00:39:04.809245	a67493c3	120	30	1.0000	DISCARD	gen=309 glyphs=4
2026-03-14T00:39:05.071632	b7aed8e9	116	29	1.0000	DISCARD	gen=353 glyphs=4
2026-03-14T00:39:07.516428	37f4017b	116	29	1.0000	DISCARD	gen=309 glyphs=4
2026-03-14T00:39:07.781846	de8187cf	116	29	1.0000	DISCARD	gen=353 glyphs=4
2026-03-14T00:39:10.213474	37f4017b	116	29	1.0000	DISCARD	gen=309 glyphs=4
2026-03-14T00:39:10.485272	ae44ace5	116	29	1.0000	DISCARD	gen=353 glyphs=4
2026-03-14T00:39:12.958795	37f4017b	116	29	1.0000	DISCARD	gen=309 glyphs=4
2026-03-14T00:39:13.226190	a78f9454	120	30	1.0000	DISCARD	gen=353 glyphs=4
2026-03-14T00:39:15.686577	d3eb9491	120	30	1.0000	DISCARD	gen=309 glyphs=4
2026-03-14T00:39:15.947438	8aef8872	116	29	1.0000	DISCARD	gen=353 glyphs=4
2026-03-14T00:39:18.399713	37f4017b	116	29	1.0000	DISCARD	gen=310 glyphs=4
2026-03-14T00:39:18.669843	5b1fdef0	116	29	0.9500	DISCARD	gen=353 glyphs=4
2026-03-14T00:39:21.135754	bfdf7cad	120	30	1.0000	DISCARD	gen=310 glyphs=4
2026-03-14T00:39:21.423992	19355583	120	30	1.0000	DISCARD	gen=354 glyphs=4
2026-03-14T00:39:23.862570	5a06ca32	120	30	1.0000	DISCARD	gen=310 glyphs=4
2026-03-14T00:39:24.141039	8aef8872	116	29	1.0000	DISCARD	gen=354 glyphs=4
2026-03-14T00:39:26.583021	37f4017b	116	29	1.0000	DISCARD	gen=310 glyphs=4
2026-03-14T00:39:26.855100	19355583	120	30	1.0000	DISCARD	gen=354 glyphs=4
2026-03-14T00:39:29.292632	6194cea2	120	30	1.0000	DISCARD	gen=310 glyphs=4
2026-03-14T00:39:29.575215	50dc991d	116	29	1.0000	DISCARD	gen=354 glyphs=4
2026-03-14T00:39:32.006023	5a06ca32	120	30	1.0000	DISCARD	gen=310 glyphs=4
2026-03-14T00:39:32.290042	b57e7176	120	30	1.0000	DISCARD	gen=354 glyphs=4
2026-03-14T00:39:34.767690	fdb5d108	120	30	1.0000	DISCARD	gen=310 glyphs=4
2026-03-14T00:39:35.037439	0eaedb57	116	29	1.0000	DISCARD	gen=354 glyphs=4
2026-03-14T00:39:37.459581	5a06ca32	120	30	1.0000	DISCARD	gen=310 glyphs=4
2026-03-14T00:39:37.716909	875e0f8a	116	29	1.0000	DISCARD	gen=354 glyphs=4
2026-03-14T00:39:40.154191	4e38ba8c	116	29	1.0000	DISCARD	gen=310 glyphs=4
2026-03-14T00:39:40.417061	0eaedb57	116	29	1.0000	DISCARD	gen=354 glyphs=4
2026-03-14T00:39:42.836617	55d6c151	120	30	1.0000	DISCARD	gen=310 glyphs=4
2026-03-14T00:39:43.105496	e30939bb	120	30	1.0000	DISCARD	gen=354 glyphs=4
2026-03-14T00:39:45.531272	37f4017b	116	29	1.0000	DISCARD	gen=311 glyphs=4
2026-03-14T00:39:45.793296	0eaedb57	116	29	1.0000	DISCARD	gen=354 glyphs=4
2026-03-14T00:39:48.217316	bfdf7cad	120	30	1.0000	DISCARD	gen=311 glyphs=4
2026-03-14T00:39:48.484123	19355583	120	30	1.0000	DISCARD	gen=355 glyphs=4
2026-03-14T00:39:50.899894	37f4017b	116	29	1.0000	DISCARD	gen=311 glyphs=4
2026-03-14T00:39:51.170200	8aef8872	116	29	1.0000	DISCARD	gen=355 glyphs=4
2026-03-14T00:39:53.703154	93e6576b	116	29	1.0000	DISCARD	gen=311 glyphs=4
2026-03-14T00:39:53.979293	8882eb5f	116	29	1.0000	DISCARD	gen=355 glyphs=4
2026-03-14T00:39:56.397968	37f4017b	116	29	1.0000	DISCARD	gen=311 glyphs=4
2026-03-14T00:39:56.665922	0eaedb57	116	29	1.0000	DISCARD	gen=355 glyphs=4
2026-03-14T00:39:59.117039	be7c60f4	116	29	1.0000	DISCARD	gen=311 glyphs=4
2026-03-14T00:39:59.389627	9e34ede0	116	29	1.0000	DISCARD	gen=355 glyphs=4
2026-03-14T00:40:01.801659	4c9b0dd4	120	30	1.0000	DISCARD	gen=311 glyphs=4
2026-03-14T00:40:02.074259	19355583	120	30	1.0000	DISCARD	gen=355 glyphs=4
2026-03-14T00:40:04.497438	bfdf7cad	120	30	1.0000	DISCARD	gen=311 glyphs=4
2026-03-14T00:40:04.768785	76872a03	116	29	1.0000	DISCARD	gen=355 glyphs=4
2026-03-14T00:40:07.202651	3a623e8b	120	30	1.0000	DISCARD	gen=311 glyphs=4
2026-03-14T00:40:07.474960	19355583	120	30	1.0000	DISCARD	gen=355 glyphs=4
2026-03-14T00:40:09.896817	55d6c151	120	30	1.0000	DISCARD	gen=311 glyphs=4
2026-03-14T00:40:10.162268	b7aed8e9	116	29	1.0000	DISCARD	gen=355 glyphs=4
2026-03-14T00:40:12.588421	37f4017b	116	29	1.0000	DISCARD	gen=312 glyphs=4
2026-03-14T00:40:12.870976	19355583	120	30	1.0000	DISCARD	gen=355 glyphs=4
2026-03-14T00:40:15.306670	bfdf7cad	120	30	1.0000	DISCARD	gen=312 glyphs=4
2026-03-14T00:40:15.582403	19355583	120	30	1.0000	DISCARD	gen=356 glyphs=4
2026-03-14T00:40:17.982053	521dd855	116	29	1.0000	DISCARD	gen=312 glyphs=4
2026-03-14T00:40:18.251850	8aef8872	116	29	1.0000	DISCARD	gen=356 glyphs=4
2026-03-14T00:40:20.671000	4db1d1ba	116	29	1.0000	DISCARD	gen=312 glyphs=4
2026-03-14T00:40:20.949392	875e0f8a	116	29	1.0000	DISCARD	gen=356 glyphs=4
2026-03-14T00:40:23.352667	c299540b	120	30	1.0000	DISCARD	gen=312 glyphs=4
2026-03-14T00:40:23.638666	0eaedb57	116	29	1.0000	DISCARD	gen=356 glyphs=4
2026-03-14T00:40:26.119378	a1259364	120	30	1.0000	DISCARD	gen=312 glyphs=4
2026-03-14T00:40:26.401150	9e34ede0	116	29	1.0000	DISCARD	gen=356 glyphs=4
2026-03-14T00:40:28.827858	37f4017b	116	29	1.0000	DISCARD	gen=312 glyphs=4
2026-03-14T00:40:29.095110	67cb81be	120	30	1.0000	DISCARD	gen=356 glyphs=4
2026-03-14T00:40:31.538597	4c9b0dd4	120	30	1.0000	DISCARD	gen=312 glyphs=4
2026-03-14T00:40:31.803223	ae44ace5	116	29	1.0000	DISCARD	gen=356 glyphs=4
2026-03-14T00:40:34.287845	1d34459a	116	29	1.0000	DISCARD	gen=312 glyphs=4
2026-03-14T00:40:34.557455	33d7c03c	120	30	1.0000	DISCARD	gen=356 glyphs=4
2026-03-14T00:40:36.999663	29573ced	116	29	1.0000	DISCARD	gen=312 glyphs=4
2026-03-14T00:40:37.274703	67cb81be	120	30	1.0000	DISCARD	gen=356 glyphs=4
2026-03-14T00:40:39.705318	37f4017b	116	29	1.0000	DISCARD	gen=313 glyphs=4
2026-03-14T00:40:39.979012	9e34ede0	116	29	1.0000	DISCARD	gen=356 glyphs=4
2026-03-14T00:40:42.383194	bfdf7cad	120	30	1.0000	DISCARD	gen=313 glyphs=4
2026-03-14T00:40:42.649949	19355583	120	30	1.0000	DISCARD	gen=357 glyphs=4
2026-03-14T00:40:45.094601	321c87b3	116	29	1.0000	DISCARD	gen=313 glyphs=4
2026-03-14T00:40:45.364139	8aef8872	116	29	1.0000	DISCARD	gen=357 glyphs=4
2026-03-14T00:40:47.795965	d11c1062	120	30	1.0000	DISCARD	gen=313 glyphs=4
2026-03-14T00:40:48.074660	0eaedb57	116	29	1.0000	DISCARD	gen=357 glyphs=4
2026-03-14T00:40:50.498562	fdb5d108	120	30	1.0000	DISCARD	gen=313 glyphs=4
2026-03-14T00:40:50.780092	1e5f0e21	116	29	1.0000	DISCARD	gen=357 glyphs=4
2026-03-14T00:40:53.209777	b28717d2	116	29	1.0000	DISCARD	gen=313 glyphs=4
2026-03-14T00:40:53.474777	e2cd28ea	120	30	1.0000	DISCARD	gen=357 glyphs=4
2026-03-14T00:40:55.919382	37f4017b	116	29	1.0000	DISCARD	gen=313 glyphs=4
2026-03-14T00:40:56.194135	e4e810d0	116	29	1.0000	DISCARD	gen=357 glyphs=4
2026-03-14T00:40:58.714666	37f4017b	116	29	1.0000	DISCARD	gen=313 glyphs=4
2026-03-14T00:40:58.984973	7591e3ea	116	29	0.9500	DISCARD	gen=357 glyphs=4
2026-03-14T00:41:01.422093	37f4017b	116	29	1.0000	DISCARD	gen=313 glyphs=4
2026-03-14T00:41:01.698071	a78f9454	120	30	1.0000	DISCARD	gen=357 glyphs=4
2026-03-14T00:41:04.118138	5b9807ac	120	30	1.0000	DISCARD	gen=313 glyphs=4
2026-03-14T00:41:04.377703	d7c8681b	120	30	1.0000	DISCARD	gen=357 glyphs=4
2026-03-14T00:41:06.834234	37f4017b	116	29	1.0000	DISCARD	gen=314 glyphs=4
2026-03-14T00:41:07.115583	3483a180	116	29	0.9500	DISCARD	gen=357 glyphs=4
2026-03-14T00:41:09.536820	bfdf7cad	120	30	1.0000	DISCARD	gen=314 glyphs=4
2026-03-14T00:41:09.813639	19355583	120	30	1.0000	DISCARD	gen=358 glyphs=4
2026-03-14T00:41:12.245017	7ca87b42	116	29	1.0000	DISCARD	gen=314 glyphs=4
2026-03-14T00:41:12.516303	8aef8872	116	29	1.0000	DISCARD	gen=358 glyphs=4
2026-03-14T00:41:14.951005	c9e4a462	116	29	0.9500	DISCARD	gen=314 glyphs=4
2026-03-14T00:41:15.218815	3d1e011c	116	29	1.0000	DISCARD	gen=358 glyphs=4
2026-03-14T00:41:17.639667	5a06ca32	120	30	1.0000	DISCARD	gen=314 glyphs=4
2026-03-14T00:41:17.915873	19355583	120	30	1.0000	DISCARD	gen=358 glyphs=4
2026-03-14T00:41:20.347940	55d6c151	120	30	1.0000	DISCARD	gen=314 glyphs=4
2026-03-14T00:41:20.616170	2ec27277	116	29	1.0000	DISCARD	gen=358 glyphs=4
2026-03-14T00:41:23.057304	2a9e56d2	116	29	1.0000	DISCARD	gen=314 glyphs=4
2026-03-14T00:41:23.326691	875e0f8a	116	29	1.0000	DISCARD	gen=358 glyphs=4
2026-03-14T00:41:25.801040	d11c1062	120	30	1.0000	DISCARD	gen=314 glyphs=4
2026-03-14T00:41:26.069300	e2cd28ea	120	30	1.0000	DISCARD	gen=358 glyphs=4
2026-03-14T00:41:28.523765	5a06ca32	120	30	1.0000	DISCARD	gen=314 glyphs=4
2026-03-14T00:41:28.830410	719e4f38	120	30	1.0000	DISCARD	gen=358 glyphs=4
2026-03-14T00:41:31.294933	37f4017b	116	29	1.0000	DISCARD	gen=314 glyphs=4
2026-03-14T00:41:31.567036	b7aed8e9	116	29	1.0000	DISCARD	gen=358 glyphs=4
2026-03-14T00:41:34.000109	37f4017b	116	29	1.0000	DISCARD	gen=315 glyphs=4
2026-03-14T00:41:34.264340	ae44ace5	116	29	1.0000	DISCARD	gen=358 glyphs=4
2026-03-14T00:41:36.711909	bfdf7cad	120	30	1.0000	DISCARD	gen=315 glyphs=4
2026-03-14T00:41:36.980081	19355583	120	30	1.0000	DISCARD	gen=359 glyphs=4
2026-03-14T00:41:39.385972	5b9807ac	120	30	1.0000	DISCARD	gen=315 glyphs=4
2026-03-14T00:41:39.656914	8aef8872	116	29	1.0000	DISCARD	gen=359 glyphs=4
