timestamp	program_hash	spirv_size	word_count	fitness	status	description
2026-03-13T23:06:51.175069	ae44ace5	116	29	1.0000	DISCARD	gen=154 glyphs=4
2026-03-13T23:06:51.723966	2701cb73	116	29	1.0000	DISCARD	gen=110 glyphs=4
2026-03-13T23:06:53.864057	67cb81be	120	30	1.0000	DISCARD	gen=154 glyphs=4
2026-03-13T23:06:54.396936	37f4017b	116	29	1.0000	DISCARD	gen=111 glyphs=4
2026-03-13T23:06:56.583626	19355583	120	30	1.0000	DISCARD	gen=155 glyphs=4
2026-03-13T23:06:57.124762	bfdf7cad	120	30	1.0000	DISCARD	gen=111 glyphs=4
2026-03-13T23:06:59.269778	8aef8872	116	29	1.0000	DISCARD	gen=155 glyphs=4
2026-03-13T23:06:59.803779	5a06ca32	120	30	1.0000	DISCARD	gen=111 glyphs=4
2026-03-13T23:07:01.974247	0eaedb57	116	29	1.0000	DISCARD	gen=155 glyphs=4
2026-03-13T23:07:02.505663	1aa2c6f4	120	30	1.0000	DISCARD	gen=111 glyphs=4
2026-03-13T23:07:04.664506	19355583	120	30	1.0000	DISCARD	gen=155 glyphs=4
2026-03-13T23:07:05.193669	7ca87b42	116	29	1.0000	DISCARD	gen=111 glyphs=4
2026-03-13T23:07:07.334713	20db7fe9	116	29	1.0000	DISCARD	gen=155 glyphs=4
2026-03-13T23:07:07.897241	6d011919	116	29	1.0000	DISCARD	gen=111 glyphs=4
2026-03-13T23:07:10.288070	19355583	120	30	1.0000	DISCARD	gen=155 glyphs=4
2026-03-13T23:07:10.828844	37f4017b	116	29	1.0000	DISCARD	gen=111 glyphs=4
2026-03-13T23:07:12.995522	eca7ab6c	116	29	1.0000	DISCARD	gen=155 glyphs=4
2026-03-13T23:07:13.521842	37f4017b	116	29	1.0000	DISCARD	gen=111 glyphs=4
2026-03-13T23:07:15.671984	6d2c5b82	120	30	1.0000	DISCARD	gen=155 glyphs=4
2026-03-13T23:07:16.208957	5a06ca32	120	30	1.0000	DISCARD	gen=111 glyphs=4
2026-03-13T23:07:18.355441	d487669b	116	29	0.9500	DISCARD	gen=155 glyphs=4
2026-03-13T23:07:18.895971	55d6c151	120	30	1.0000	DISCARD	gen=111 glyphs=4
2026-03-13T23:07:21.063446	19355583	120	30	1.0000	DISCARD	gen=155 glyphs=4
2026-03-13T23:07:21.590191	37f4017b	116	29	1.0000	DISCARD	gen=112 glyphs=4
2026-03-13T23:07:23.907437	19355583	120	30	1.0000	DISCARD	gen=156 glyphs=4
2026-03-13T23:07:24.448198	bfdf7cad	120	30	1.0000	DISCARD	gen=112 glyphs=4
2026-03-13T23:07:26.577933	8aef8872	116	29	1.0000	DISCARD	gen=156 glyphs=4
2026-03-13T23:07:27.119927	37f4017b	116	29	1.0000	DISCARD	gen=112 glyphs=4
2026-03-13T23:07:29.276038	50dc991d	116	29	1.0000	DISCARD	gen=156 glyphs=4
2026-03-13T23:07:29.802785	4c9b0dd4	120	30	1.0000	DISCARD	gen=112 glyphs=4
2026-03-13T23:07:31.972272	875e0f8a	116	29	1.0000	DISCARD	gen=156 glyphs=4
2026-03-13T23:07:32.513835	55d6c151	120	30	1.0000	DISCARD	gen=112 glyphs=4
2026-03-13T23:07:34.665025	050862ad	120	30	1.0000	DISCARD	gen=156 glyphs=4
2026-03-13T23:07:35.200028	4c9b0dd4	120	30	1.0000	DISCARD	gen=112 glyphs=4
2026-03-13T23:07:37.387393	875e0f8a	116	29	1.0000	DISCARD	gen=156 glyphs=4
2026-03-13T23:07:37.930905	5a06ca32	120	30	1.0000	DISCARD	gen=112 glyphs=4
2026-03-13T23:07:40.077314	0eaedb57	116	29	1.0000	DISCARD	gen=156 glyphs=4
2026-03-13T23:07:40.613097	1d34459a	116	29	1.0000	DISCARD	gen=112 glyphs=4
2026-03-13T23:07:43.057289	67cb81be	120	30	1.0000	DISCARD	gen=156 glyphs=4
2026-03-13T23:07:43.589069	488acd88	120	30	1.0000	DISCARD	gen=112 glyphs=4
2026-03-13T23:07:45.730019	875e0f8a	116	29	1.0000	DISCARD	gen=156 glyphs=4
2026-03-13T23:07:46.286450	fa830eb0	124	31	0.9500	DISCARD	gen=112 glyphs=4
2026-03-13T23:07:48.457756	875e0f8a	116	29	1.0000	DISCARD	gen=156 glyphs=4
2026-03-13T23:07:48.987575	37f4017b	116	29	1.0000	DISCARD	gen=113 glyphs=4
2026-03-13T23:07:51.147811	19355583	120	30	1.0000	DISCARD	gen=157 glyphs=4
2026-03-13T23:07:51.711402	bfdf7cad	120	30	1.0000	DISCARD	gen=113 glyphs=4
2026-03-13T23:07:53.852943	8aef8872	116	29	1.0000	DISCARD	gen=157 glyphs=4
2026-03-13T23:07:54.407782	156999e1	116	29	1.0000	DISCARD	gen=113 glyphs=4
2026-03-13T23:07:56.541964	d154a69e	116	29	1.0000	DISCARD	gen=157 glyphs=4
2026-03-13T23:07:57.078999	5a06ca32	120	30	1.0000	DISCARD	gen=113 glyphs=4
2026-03-13T23:07:59.201053	050862ad	120	30	1.0000	DISCARD	gen=157 glyphs=4
2026-03-13T23:07:59.736187	229be732	120	30	1.0000	DISCARD	gen=113 glyphs=4
2026-03-13T23:08:01.857816	0eaedb57	116	29	1.0000	DISCARD	gen=157 glyphs=4
2026-03-13T23:08:02.392984	feb8437a	116	29	1.0000	DISCARD	gen=113 glyphs=4
2026-03-13T23:08:04.543951	1e5f0e21	116	29	1.0000	DISCARD	gen=157 glyphs=4
2026-03-13T23:08:05.064102	2701cb73	116	29	1.0000	DISCARD	gen=113 glyphs=4
2026-03-13T23:08:07.217569	1e5f0e21	116	29	1.0000	DISCARD	gen=157 glyphs=4
2026-03-13T23:08:07.748179	d11c1062	120	30	1.0000	DISCARD	gen=113 glyphs=4
2026-03-13T23:08:09.878608	b57e7176	120	30	1.0000	DISCARD	gen=157 glyphs=4
2026-03-13T23:08:10.420265	12b38c2d	116	29	1.0000	DISCARD	gen=113 glyphs=4
2026-03-13T23:08:12.543692	a78f9454	120	30	1.0000	DISCARD	gen=157 glyphs=4
2026-03-13T23:08:13.146650	5a06ca32	120	30	1.0000	DISCARD	gen=113 glyphs=4
2026-03-13T23:08:15.300071	e8c7f6cf	120	30	1.0000	DISCARD	gen=157 glyphs=4
2026-03-13T23:08:15.830785	37f4017b	116	29	1.0000	DISCARD	gen=114 glyphs=4
2026-03-13T23:08:17.970062	19355583	120	30	1.0000	DISCARD	gen=158 glyphs=4
2026-03-13T23:08:18.519052	bfdf7cad	120	30	1.0000	DISCARD	gen=114 glyphs=4
2026-03-13T23:08:20.656072	8aef8872	116	29	1.0000	DISCARD	gen=158 glyphs=4
2026-03-13T23:08:21.190777	37f4017b	116	29	1.0000	DISCARD	gen=114 glyphs=4
2026-03-13T23:08:23.316932	7213da0a	116	29	1.0000	DISCARD	gen=158 glyphs=4
2026-03-13T23:08:23.843801	37f4017b	116	29	1.0000	DISCARD	gen=114 glyphs=4
2026-03-13T23:08:25.981430	b7aed8e9	116	29	1.0000	DISCARD	gen=158 glyphs=4
2026-03-13T23:08:26.516723	71e2ba66	116	29	1.0000	DISCARD	gen=114 glyphs=4
2026-03-13T23:08:28.643792	65c6986d	116	29	1.0000	DISCARD	gen=158 glyphs=4
2026-03-13T23:08:29.176187	34712a27	120	30	1.0000	DISCARD	gen=114 glyphs=4
2026-03-13T23:08:31.304979	3c398f94	120	30	1.0000	DISCARD	gen=158 glyphs=4
2026-03-13T23:08:31.820006	37f4017b	116	29	1.0000	DISCARD	gen=114 glyphs=4
2026-03-13T23:08:33.955399	3708c18b	116	29	1.0000	DISCARD	gen=158 glyphs=4
2026-03-13T23:08:34.496587	55d6c151	120	30	1.0000	DISCARD	gen=114 glyphs=4
2026-03-13T23:08:36.629198	50dc991d	116	29	1.0000	DISCARD	gen=158 glyphs=4
2026-03-13T23:08:37.147390	5a06ca32	120	30	1.0000	DISCARD	gen=114 glyphs=4
2026-03-13T23:08:39.272567	0eaedb57	116	29	1.0000	DISCARD	gen=158 glyphs=4
2026-03-13T23:08:39.827488	0b457516	116	29	1.0000	DISCARD	gen=114 glyphs=4
2026-03-13T23:08:41.948665	875e0f8a	116	29	1.0000	DISCARD	gen=158 glyphs=4
2026-03-13T23:08:42.482496	37f4017b	116	29	1.0000	DISCARD	gen=115 glyphs=4
2026-03-13T23:08:44.630706	19355583	120	30	1.0000	DISCARD	gen=159 glyphs=4
2026-03-13T23:08:45.242772	bfdf7cad	120	30	1.0000	DISCARD	gen=115 glyphs=4
2026-03-13T23:08:47.427050	8aef8872	116	29	1.0000	DISCARD	gen=159 glyphs=4
2026-03-13T23:08:47.964424	12b38c2d	116	29	1.0000	DISCARD	gen=115 glyphs=4
2026-03-13T23:08:50.081178	eca7ab6c	116	29	1.0000	DISCARD	gen=159 glyphs=4
2026-03-13T23:08:50.621549	5a06ca32	120	30	1.0000	DISCARD	gen=115 glyphs=4
2026-03-13T23:08:52.756145	1e5f0e21	116	29	1.0000	DISCARD	gen=159 glyphs=4
2026-03-13T23:08:53.289851	2d3379ef	120	30	1.0000	DISCARD	gen=115 glyphs=4
2026-03-13T23:08:55.426009	0eaedb57	116	29	1.0000	DISCARD	gen=159 glyphs=4
2026-03-13T23:08:55.961304	37f4017b	116	29	1.0000	DISCARD	gen=115 glyphs=4
2026-03-13T23:08:58.076643	875e0f8a	116	29	1.0000	DISCARD	gen=159 glyphs=4
2026-03-13T23:08:58.608270	5a06ca32	120	30	1.0000	DISCARD	gen=115 glyphs=4
2026-03-13T23:09:00.741017	8aef8872	116	29	1.0000	DISCARD	gen=159 glyphs=4
2026-03-13T23:09:01.268458	fdb5d108	120	30	1.0000	DISCARD	gen=115 glyphs=4
2026-03-13T23:09:03.417716	8aef8872	116	29	1.0000	DISCARD	gen=159 glyphs=4
2026-03-13T23:09:03.944639	55d6c151	120	30	1.0000	DISCARD	gen=115 glyphs=4
2026-03-13T23:09:06.078823	8aef8872	116	29	1.0000	DISCARD	gen=159 glyphs=4
2026-03-13T23:09:06.615305	e6c87316	116	29	1.0000	DISCARD	gen=115 glyphs=4
2026-03-13T23:09:08.771874	b7aed8e9	116	29	1.0000	DISCARD	gen=159 glyphs=4
2026-03-13T23:09:09.318261	37f4017b	116	29	1.0000	DISCARD	gen=116 glyphs=4
2026-03-13T23:09:11.484928	19355583	120	30	1.0000	DISCARD	gen=160 glyphs=4
2026-03-13T23:09:12.026821	bfdf7cad	120	30	1.0000	DISCARD	gen=116 glyphs=4
2026-03-13T23:09:14.124547	8aef8872	116	29	1.0000	DISCARD	gen=160 glyphs=4
2026-03-13T23:09:14.654744	931bf3fa	120	30	1.0000	DISCARD	gen=116 glyphs=4
2026-03-13T23:09:16.797842	0eaedb57	116	29	1.0000	DISCARD	gen=160 glyphs=4
2026-03-13T23:09:17.334689	37f4017b	116	29	1.0000	DISCARD	gen=116 glyphs=4
2026-03-13T23:09:19.517050	19355583	120	30	1.0000	DISCARD	gen=160 glyphs=4
2026-03-13T23:09:20.046818	37f4017b	116	29	1.0000	DISCARD	gen=116 glyphs=4
2026-03-13T23:09:22.190364	0eaedb57	116	29	1.0000	DISCARD	gen=160 glyphs=4
2026-03-13T23:09:22.716974	831e59ff	116	29	1.0000	DISCARD	gen=116 glyphs=4
2026-03-13T23:09:24.869163	ba632387	116	29	1.0000	DISCARD	gen=160 glyphs=4
2026-03-13T23:09:25.394094	37f4017b	116	29	1.0000	DISCARD	gen=116 glyphs=4
2026-03-13T23:09:27.546209	19355583	120	30	1.0000	DISCARD	gen=160 glyphs=4
2026-03-13T23:09:28.083675	fdb5d108	120	30	1.0000	DISCARD	gen=116 glyphs=4
2026-03-13T23:09:30.260988	b57e7176	120	30	1.0000	DISCARD	gen=160 glyphs=4
2026-03-13T23:09:30.801259	37f4017b	116	29	1.0000	DISCARD	gen=116 glyphs=4
2026-03-13T23:09:32.937463	0eaedb57	116	29	1.0000	DISCARD	gen=160 glyphs=4
2026-03-13T23:09:33.454424	7ca87b42	116	29	1.0000	DISCARD	gen=116 glyphs=4
2026-03-13T23:09:35.610210	b7aed8e9	116	29	1.0000	DISCARD	gen=160 glyphs=4
2026-03-13T23:09:36.129204	37f4017b	116	29	1.0000	DISCARD	gen=117 glyphs=4
2026-03-13T23:09:38.283228	19355583	120	30	1.0000	DISCARD	gen=161 glyphs=4
2026-03-13T23:09:38.814967	bfdf7cad	120	30	1.0000	DISCARD	gen=117 glyphs=4
2026-03-13T23:09:40.972309	8aef8872	116	29	1.0000	DISCARD	gen=161 glyphs=4
2026-03-13T23:09:41.520144	bfdf7cad	120	30	1.0000	DISCARD	gen=117 glyphs=4
2026-03-13T23:09:43.650839	ce4242cf	116	29	1.0000	DISCARD	gen=161 glyphs=4
2026-03-13T23:09:44.179126	37f4017b	116	29	1.0000	DISCARD	gen=117 glyphs=4
2026-03-13T23:09:46.339093	c6c7a238	116	29	1.0000	DISCARD	gen=161 glyphs=4
2026-03-13T23:09:46.872103	6cd86854	116	29	1.0000	DISCARD	gen=117 glyphs=4
2026-03-13T23:09:49.039931	050862ad	120	30	1.0000	DISCARD	gen=161 glyphs=4
2026-03-13T23:09:49.576595	37f4017b	116	29	1.0000	DISCARD	gen=117 glyphs=4
2026-03-13T23:09:51.727052	846d7335	116	29	1.0000	DISCARD	gen=161 glyphs=4
2026-03-13T23:09:52.257579	71e2ba66	116	29	1.0000	DISCARD	gen=117 glyphs=4
2026-03-13T23:09:54.423995	e8c7f6cf	120	30	1.0000	DISCARD	gen=161 glyphs=4
2026-03-13T23:09:54.963379	37f4017b	116	29	1.0000	DISCARD	gen=117 glyphs=4
2026-03-13T23:09:57.084438	50993ad7	116	29	0.9500	DISCARD	gen=161 glyphs=4
2026-03-13T23:09:57.623667	d56688a8	116	29	1.0000	DISCARD	gen=117 glyphs=4
2026-03-13T23:09:59.794981	8aef8872	116	29	1.0000	DISCARD	gen=161 glyphs=4
2026-03-13T23:10:00.345041	2701cb73	116	29	1.0000	DISCARD	gen=117 glyphs=4
2026-03-13T23:10:02.512480	67cb81be	120	30	1.0000	DISCARD	gen=161 glyphs=4
2026-03-13T23:10:03.066611	37f4017b	116	29	1.0000	DISCARD	gen=118 glyphs=4
2026-03-13T23:10:05.204411	19355583	120	30	1.0000	DISCARD	gen=162 glyphs=4
2026-03-13T23:10:05.740047	bfdf7cad	120	30	1.0000	DISCARD	gen=118 glyphs=4
2026-03-13T23:10:07.896681	8aef8872	116	29	1.0000	DISCARD	gen=162 glyphs=4
2026-03-13T23:10:08.447156	8d6b1f8d	120	30	1.0000	DISCARD	gen=118 glyphs=4
2026-03-13T23:10:10.627633	48e9a4cc	116	29	1.0000	DISCARD	gen=162 glyphs=4
2026-03-13T23:10:11.167670	43fa3d1c	116	29	1.0000	DISCARD	gen=118 glyphs=4
2026-03-13T23:10:13.386199	5956f644	120	30	1.0000	DISCARD	gen=162 glyphs=4
2026-03-13T23:10:13.929100	585cd723	120	30	1.0000	DISCARD	gen=118 glyphs=4
2026-03-13T23:10:16.079207	d7c8681b	120	30	1.0000	DISCARD	gen=162 glyphs=4
2026-03-13T23:10:16.808052	5a06ca32	120	30	1.0000	DISCARD	gen=118 glyphs=4
2026-03-13T23:10:19.741731	1dd9839a	116	29	1.0000	DISCARD	gen=162 glyphs=4
2026-03-13T23:10:20.570377	5a06ca32	120	30	1.0000	DISCARD	gen=118 glyphs=4
2026-03-13T23:10:23.980870	388fb6ef	116	29	1.0000	DISCARD	gen=162 glyphs=4
2026-03-13T23:10:24.574806	bb0ee388	116	29	1.0000	DISCARD	gen=118 glyphs=4
2026-03-13T23:10:26.783079	e19ebbe4	116	29	1.0000	DISCARD	gen=162 glyphs=4
2026-03-13T23:10:27.321689	5a06ca32	120	30	1.0000	DISCARD	gen=118 glyphs=4
2026-03-13T23:10:29.512939	9e34ede0	116	29	1.0000	DISCARD	gen=162 glyphs=4
2026-03-13T23:10:30.077023	55d6c151	120	30	1.0000	DISCARD	gen=118 glyphs=4
2026-03-13T23:10:32.607741	e2cd28ea	120	30	1.0000	DISCARD	gen=162 glyphs=4
2026-03-13T23:10:33.168449	37f4017b	116	29	1.0000	DISCARD	gen=119 glyphs=4
2026-03-13T23:10:35.341340	19355583	120	30	1.0000	DISCARD	gen=163 glyphs=4
2026-03-13T23:10:35.878217	bfdf7cad	120	30	1.0000	DISCARD	gen=119 glyphs=4
2026-03-13T23:10:38.068464	8aef8872	116	29	1.0000	DISCARD	gen=163 glyphs=4
2026-03-13T23:10:38.621062	7ca87b42	116	29	1.0000	DISCARD	gen=119 glyphs=4
2026-03-13T23:10:41.027901	50dc991d	116	29	1.0000	DISCARD	gen=163 glyphs=4
2026-03-13T23:10:41.669795	904193b1	116	29	0.9500	DISCARD	gen=119 glyphs=4
2026-03-13T23:10:43.903588	050862ad	120	30	1.0000	DISCARD	gen=163 glyphs=4
2026-03-13T23:10:44.448824	2701cb73	116	29	1.0000	DISCARD	gen=119 glyphs=4
2026-03-13T23:10:46.624046	eace1a2e	116	29	1.0000	DISCARD	gen=163 glyphs=4
2026-03-13T23:10:47.166675	5b9807ac	120	30	1.0000	DISCARD	gen=119 glyphs=4
2026-03-13T23:10:49.360780	5966befd	116	29	0.9500	DISCARD	gen=163 glyphs=4
2026-03-13T23:10:49.912508	76626c32	116	29	1.0000	DISCARD	gen=119 glyphs=4
2026-03-13T23:10:52.151299	875e0f8a	116	29	1.0000	DISCARD	gen=163 glyphs=4
2026-03-13T23:10:52.932689	82ba44f5	120	30	1.0000	DISCARD	gen=119 glyphs=4
2026-03-13T23:10:55.609372	19355583	120	30	1.0000	DISCARD	gen=163 glyphs=4
2026-03-13T23:10:56.183120	fdb5d108	120	30	1.0000	DISCARD	gen=119 glyphs=4
2026-03-13T23:10:59.021660	19355583	120	30	1.0000	DISCARD	gen=163 glyphs=4
2026-03-13T23:10:59.649080	91f54846	116	29	1.0000	DISCARD	gen=119 glyphs=4
2026-03-13T23:11:01.855049	b7aed8e9	116	29	1.0000	DISCARD	gen=163 glyphs=4
2026-03-13T23:11:02.397470	37f4017b	116	29	1.0000	DISCARD	gen=120 glyphs=4
2026-03-13T23:11:04.571232	19355583	120	30	1.0000	DISCARD	gen=164 glyphs=4
2026-03-13T23:11:05.109103	bfdf7cad	120	30	1.0000	DISCARD	gen=120 glyphs=4
2026-03-13T23:11:07.262410	8aef8872	116	29	1.0000	DISCARD	gen=164 glyphs=4
2026-03-13T23:11:07.814500	37f4017b	116	29	1.0000	DISCARD	gen=120 glyphs=4
2026-03-13T23:11:10.095010	8aef8872	116	29	1.0000	DISCARD	gen=164 glyphs=4
2026-03-13T23:11:10.642615	fdb5d108	120	30	1.0000	DISCARD	gen=120 glyphs=4
2026-03-13T23:11:12.808007	4ef8ff4a	116	29	1.0000	DISCARD	gen=164 glyphs=4
2026-03-13T23:11:13.346330	027ca4d8	120	30	1.0000	DISCARD	gen=120 glyphs=4
2026-03-13T23:11:15.495076	0eaedb57	116	29	1.0000	DISCARD	gen=164 glyphs=4
2026-03-13T23:11:16.034422	a3c22c6a	116	29	1.0000	DISCARD	gen=120 glyphs=4
2026-03-13T23:11:18.330756	b9714e61	120	30	0.9500	DISCARD	gen=164 glyphs=4
2026-03-13T23:11:18.876644	37f4017b	116	29	1.0000	DISCARD	gen=120 glyphs=4
2026-03-13T23:11:21.038473	ae44ace5	116	29	1.0000	DISCARD	gen=164 glyphs=4
2026-03-13T23:11:21.602585	12b38c2d	116	29	1.0000	DISCARD	gen=120 glyphs=4
2026-03-13T23:11:23.754782	cac4b3c3	116	29	1.0000	DISCARD	gen=164 glyphs=4
2026-03-13T23:11:24.303192	37f4017b	116	29	1.0000	DISCARD	gen=120 glyphs=4
2026-03-13T23:11:26.543226	1e5f0e21	116	29	1.0000	DISCARD	gen=164 glyphs=4
2026-03-13T23:11:27.083644	f9bf8e94	116	29	1.0000	DISCARD	gen=120 glyphs=4
2026-03-13T23:11:29.261136	e2cd28ea	120	30	1.0000	DISCARD	gen=164 glyphs=4
2026-03-13T23:11:29.798230	37f4017b	116	29	1.0000	DISCARD	gen=121 glyphs=4
2026-03-13T23:11:31.966675	19355583	120	30	1.0000	DISCARD	gen=165 glyphs=4
2026-03-13T23:11:32.495277	bfdf7cad	120	30	1.0000	DISCARD	gen=121 glyphs=4
2026-03-13T23:11:34.658264	8aef8872	116	29	1.0000	DISCARD	gen=165 glyphs=4
2026-03-13T23:11:35.191733	57f7d773	120	30	1.0000	DISCARD	gen=121 glyphs=4
2026-03-13T23:11:37.357642	e7456a08	116	29	0.9500	DISCARD	gen=165 glyphs=4
2026-03-13T23:11:37.898787	d11c1062	120	30	1.0000	DISCARD	gen=121 glyphs=4
2026-03-13T23:11:40.052985	8aef8872	116	29	1.0000	DISCARD	gen=165 glyphs=4
2026-03-13T23:11:40.592344	ded6faf2	116	29	1.0000	DISCARD	gen=121 glyphs=4
2026-03-13T23:11:42.780283	ae44ace5	116	29	1.0000	DISCARD	gen=165 glyphs=4
2026-03-13T23:11:43.329166	fdb5d108	120	30	1.0000	DISCARD	gen=121 glyphs=4
2026-03-13T23:11:45.478745	ae44ace5	116	29	1.0000	DISCARD	gen=165 glyphs=4
2026-03-13T23:11:46.014972	6234eaec	116	29	1.0000	DISCARD	gen=121 glyphs=4
2026-03-13T23:11:48.239556	8aef8872	116	29	1.0000	DISCARD	gen=165 glyphs=4
2026-03-13T23:11:48.770062	37f4017b	116	29	1.0000	DISCARD	gen=121 glyphs=4
2026-03-13T23:11:50.952523	19355583	120	30	1.0000	DISCARD	gen=165 glyphs=4
2026-03-13T23:11:51.497112	55d6c151	120	30	1.0000	DISCARD	gen=121 glyphs=4
2026-03-13T23:11:53.656958	eca7ab6c	116	29	1.0000	DISCARD	gen=165 glyphs=4
2026-03-13T23:11:54.196957	d2b40ff7	116	29	1.0000	DISCARD	gen=121 glyphs=4
2026-03-13T23:11:56.356995	19355583	120	30	1.0000	DISCARD	gen=165 glyphs=4
2026-03-13T23:11:56.966219	37f4017b	116	29	1.0000	DISCARD	gen=122 glyphs=4
2026-03-13T23:11:59.379028	19355583	120	30	1.0000	DISCARD	gen=166 glyphs=4
2026-03-13T23:11:59.939853	bfdf7cad	120	30	1.0000	DISCARD	gen=122 glyphs=4
2026-03-13T23:12:02.388173	8aef8872	116	29	1.0000	DISCARD	gen=166 glyphs=4
2026-03-13T23:12:02.948668	fdb5d108	120	30	1.0000	DISCARD	gen=122 glyphs=4
2026-03-13T23:12:05.109683	fd643f35	116	29	1.0000	DISCARD	gen=166 glyphs=4
2026-03-13T23:12:05.645218	9aa85e5a	120	30	1.0000	DISCARD	gen=122 glyphs=4
2026-03-13T23:12:07.832839	0eaedb57	116	29	1.0000	DISCARD	gen=166 glyphs=4
2026-03-13T23:12:08.374117	bfdf7cad	120	30	1.0000	DISCARD	gen=122 glyphs=4
2026-03-13T23:12:10.517398	8aef8872	116	29	1.0000	DISCARD	gen=166 glyphs=4
2026-03-13T23:12:11.055890	4c9b0dd4	120	30	1.0000	DISCARD	gen=122 glyphs=4
2026-03-13T23:12:13.217718	42361dfb	116	29	1.0000	DISCARD	gen=166 glyphs=4
2026-03-13T23:12:13.758785	19753da4	116	29	1.0000	DISCARD	gen=122 glyphs=4
2026-03-13T23:12:15.940638	19355583	120	30	1.0000	DISCARD	gen=166 glyphs=4
2026-03-13T23:12:16.482575	37f4017b	116	29	1.0000	DISCARD	gen=122 glyphs=4
2026-03-13T23:12:18.661078	213ccf42	116	29	1.0000	DISCARD	gen=166 glyphs=4
2026-03-13T23:12:19.203620	cbff9cb7	116	29	1.0000	DISCARD	gen=122 glyphs=4
2026-03-13T23:12:21.381887	ae35c382	116	29	1.0000	DISCARD	gen=166 glyphs=4
2026-03-13T23:12:21.914667	bfdf7cad	120	30	1.0000	DISCARD	gen=122 glyphs=4
2026-03-13T23:12:24.078572	0eaedb57	116	29	1.0000	DISCARD	gen=166 glyphs=4
2026-03-13T23:12:24.607837	37f4017b	116	29	1.0000	DISCARD	gen=123 glyphs=4
2026-03-13T23:12:26.954789	19355583	120	30	1.0000	DISCARD	gen=167 glyphs=4
2026-03-13T23:12:27.486300	bfdf7cad	120	30	1.0000	DISCARD	gen=123 glyphs=4
2026-03-13T23:12:29.729597	8aef8872	116	29	1.0000	DISCARD	gen=167 glyphs=4
2026-03-13T23:12:30.268406	37f4017b	116	29	1.0000	DISCARD	gen=123 glyphs=4
2026-03-13T23:12:32.413009	8aef8872	116	29	1.0000	DISCARD	gen=167 glyphs=4
2026-03-13T23:12:32.959280	fdb5d108	120	30	1.0000	DISCARD	gen=123 glyphs=4
2026-03-13T23:12:35.144128	8aef8872	116	29	1.0000	DISCARD	gen=167 glyphs=4
2026-03-13T23:12:35.680170	5a06ca32	120	30	1.0000	DISCARD	gen=123 glyphs=4
2026-03-13T23:12:37.854165	050862ad	120	30	1.0000	DISCARD	gen=167 glyphs=4
2026-03-13T23:12:38.404189	fdb5d108	120	30	1.0000	DISCARD	gen=123 glyphs=4
2026-03-13T23:12:40.574820	050862ad	120	30	1.0000	DISCARD	gen=167 glyphs=4
2026-03-13T23:12:41.109432	4c9b0dd4	120	30	1.0000	DISCARD	gen=123 glyphs=4
2026-03-13T23:12:43.279940	fce6376d	116	29	1.0000	DISCARD	gen=167 glyphs=4
2026-03-13T23:12:43.847760	5bc214cc	120	30	1.0000	DISCARD	gen=123 glyphs=4
2026-03-13T23:12:46.028097	8aef8872	116	29	1.0000	DISCARD	gen=167 glyphs=4
2026-03-13T23:12:46.556229	5a06ca32	120	30	1.0000	DISCARD	gen=123 glyphs=4
2026-03-13T23:12:48.718586	19355583	120	30	1.0000	DISCARD	gen=167 glyphs=4
2026-03-13T23:12:49.277053	4aa2c976	120	30	1.0000	DISCARD	gen=123 glyphs=4
2026-03-13T23:12:51.431129	0339fa2e	116	29	0.9500	DISCARD	gen=167 glyphs=4
2026-03-13T23:12:51.962429	37f4017b	116	29	1.0000	DISCARD	gen=124 glyphs=4
2026-03-13T23:12:54.114049	19355583	120	30	1.0000	DISCARD	gen=168 glyphs=4
2026-03-13T23:12:54.666173	bfdf7cad	120	30	1.0000	DISCARD	gen=124 glyphs=4
2026-03-13T23:12:56.828308	8aef8872	116	29	1.0000	DISCARD	gen=168 glyphs=4
2026-03-13T23:12:57.382076	bfdf7cad	120	30	1.0000	DISCARD	gen=124 glyphs=4
2026-03-13T23:12:59.592506	19355583	120	30	1.0000	DISCARD	gen=168 glyphs=4
2026-03-13T23:13:00.135069	12b38c2d	116	29	1.0000	DISCARD	gen=124 glyphs=4
2026-03-13T23:13:02.301035	8aef8872	116	29	1.0000	DISCARD	gen=168 glyphs=4
2026-03-13T23:13:02.840363	59057e96	120	30	1.0000	DISCARD	gen=124 glyphs=4
2026-03-13T23:13:05.029248	b7aed8e9	116	29	1.0000	DISCARD	gen=168 glyphs=4
2026-03-13T23:13:05.569825	5eca1e08	116	29	1.0000	DISCARD	gen=124 glyphs=4
2026-03-13T23:13:07.716969	73daaf67	116	29	1.0000	DISCARD	gen=168 glyphs=4
2026-03-13T23:13:08.247429	a80a7215	116	29	1.0000	DISCARD	gen=124 glyphs=4
2026-03-13T23:13:10.412623	9e34ede0	116	29	1.0000	DISCARD	gen=168 glyphs=4
2026-03-13T23:13:10.951798	71e2ba66	116	29	1.0000	DISCARD	gen=124 glyphs=4
2026-03-13T23:13:13.103626	875e0f8a	116	29	1.0000	DISCARD	gen=168 glyphs=4
2026-03-13T23:13:13.662510	5b9807ac	120	30	1.0000	DISCARD	gen=124 glyphs=4
2026-03-13T23:13:15.816125	8aef8872	116	29	1.0000	DISCARD	gen=168 glyphs=4
2026-03-13T23:13:16.344445	d18a8f80	120	30	1.0000	DISCARD	gen=124 glyphs=4
2026-03-13T23:13:18.477866	e3babd7c	124	31	0.9500	DISCARD	gen=168 glyphs=4
2026-03-13T23:13:19.032267	37f4017b	116	29	1.0000	DISCARD	gen=125 glyphs=4
2026-03-13T23:13:21.173544	19355583	120	30	1.0000	DISCARD	gen=169 glyphs=4
2026-03-13T23:13:21.704343	bfdf7cad	120	30	1.0000	DISCARD	gen=125 glyphs=4
2026-03-13T23:13:23.874811	8aef8872	116	29	1.0000	DISCARD	gen=169 glyphs=4
2026-03-13T23:13:24.411899	55d6c151	120	30	1.0000	DISCARD	gen=125 glyphs=4
2026-03-13T23:13:26.562219	a1774f4a	116	29	1.0000	DISCARD	gen=169 glyphs=4
2026-03-13T23:13:27.090035	d472bc3b	116	29	1.0000	DISCARD	gen=125 glyphs=4
2026-03-13T23:13:29.234009	67cb81be	120	30	1.0000	DISCARD	gen=169 glyphs=4
2026-03-13T23:13:29.781002	199bac4a	116	29	1.0000	DISCARD	gen=125 glyphs=4
