timestamp	program_hash	spirv_size	word_count	fitness	status	description
2026-03-14T00:55:01.310305	5a06ca32	120	30	1.0000	DISCARD	gen=344 glyphs=4
2026-03-14T00:55:01.590290	875e0f8a	116	29	1.0000	DISCARD	gen=388 glyphs=4
2026-03-14T00:55:04.069661	5b9807ac	120	30	1.0000	DISCARD	gen=344 glyphs=4
2026-03-14T00:55:04.347967	50dc991d	116	29	1.0000	DISCARD	gen=388 glyphs=4
2026-03-14T00:55:06.857637	5a06ca32	120	30	1.0000	DISCARD	gen=344 glyphs=4
2026-03-14T00:55:07.130466	19355583	120	30	1.0000	DISCARD	gen=388 glyphs=4
2026-03-14T00:55:09.630623	37f4017b	116	29	1.0000	DISCARD	gen=344 glyphs=4
2026-03-14T00:55:09.903903	2a4f7179	116	29	1.0000	DISCARD	gen=388 glyphs=4
2026-03-14T00:55:12.350420	12b38c2d	116	29	1.0000	DISCARD	gen=344 glyphs=4
2026-03-14T00:55:12.638201	ae3356b5	120	30	1.0000	DISCARD	gen=388 glyphs=4
2026-03-14T00:55:15.123764	37f4017b	116	29	1.0000	DISCARD	gen=345 glyphs=4
2026-03-14T00:55:15.407019	062a4ad3	120	30	1.0000	DISCARD	gen=388 glyphs=4
2026-03-14T00:55:17.971934	bfdf7cad	120	30	1.0000	DISCARD	gen=345 glyphs=4
2026-03-14T00:55:18.251796	19355583	120	30	1.0000	DISCARD	gen=389 glyphs=4
2026-03-14T00:55:20.738364	55d6c151	120	30	1.0000	DISCARD	gen=345 glyphs=4
2026-03-14T00:55:21.010346	8aef8872	116	29	1.0000	DISCARD	gen=389 glyphs=4
2026-03-14T00:55:23.494018	2ad97a85	120	30	1.0000	DISCARD	gen=345 glyphs=4
2026-03-14T00:55:23.774308	a78f9454	120	30	1.0000	DISCARD	gen=389 glyphs=4
2026-03-14T00:55:26.249514	71e2ba66	116	29	1.0000	DISCARD	gen=345 glyphs=4
2026-03-14T00:55:26.523767	0eaedb57	116	29	1.0000	DISCARD	gen=389 glyphs=4
2026-03-14T00:55:28.986783	f4a230f8	120	30	1.0000	DISCARD	gen=345 glyphs=4
2026-03-14T00:55:29.255924	ebaef6b6	116	29	1.0000	DISCARD	gen=389 glyphs=4
2026-03-14T00:55:31.765170	352d2c3c	116	29	1.0000	DISCARD	gen=345 glyphs=4
2026-03-14T00:55:32.036891	a78f9454	120	30	1.0000	DISCARD	gen=389 glyphs=4
2026-03-14T00:55:34.507155	55d6c151	120	30	1.0000	DISCARD	gen=345 glyphs=4
2026-03-14T00:55:34.781333	8b925fd9	116	29	1.0000	DISCARD	gen=389 glyphs=4
2026-03-14T00:55:37.290571	91f39c23	116	29	1.0000	DISCARD	gen=345 glyphs=4
2026-03-14T00:55:37.569881	ee4250dd	116	29	0.9500	DISCARD	gen=389 glyphs=4
2026-03-14T00:55:40.056160	25808faf	116	29	0.9500	DISCARD	gen=345 glyphs=4
2026-03-14T00:55:40.320093	50dc991d	116	29	1.0000	DISCARD	gen=389 glyphs=4
2026-03-14T00:55:42.776941	37f4017b	116	29	1.0000	DISCARD	gen=346 glyphs=4
2026-03-14T00:55:43.049702	8aef8872	116	29	1.0000	DISCARD	gen=389 glyphs=4
2026-03-14T00:55:45.523246	bfdf7cad	120	30	1.0000	DISCARD	gen=346 glyphs=4
2026-03-14T00:55:45.805569	19355583	120	30	1.0000	DISCARD	gen=390 glyphs=4
2026-03-14T00:55:48.343469	55d6c151	120	30	1.0000	DISCARD	gen=346 glyphs=4
2026-03-14T00:55:48.618269	8aef8872	116	29	1.0000	DISCARD	gen=390 glyphs=4
2026-03-14T00:55:51.117092	5a492c71	120	30	1.0000	DISCARD	gen=346 glyphs=4
2026-03-14T00:55:51.394478	9ee6739e	116	29	1.0000	DISCARD	gen=390 glyphs=4
2026-03-14T00:55:53.862274	12b38c2d	116	29	1.0000	DISCARD	gen=346 glyphs=4
2026-03-14T00:55:54.136876	f354e47c	116	29	0.9500	DISCARD	gen=390 glyphs=4
2026-03-14T00:55:56.598134	37f4017b	116	29	1.0000	DISCARD	gen=346 glyphs=4
2026-03-14T00:55:56.876979	0eaedb57	116	29	1.0000	DISCARD	gen=390 glyphs=4
2026-03-14T00:55:59.363720	37f4017b	116	29	1.0000	DISCARD	gen=346 glyphs=4
2026-03-14T00:55:59.639935	9e34ede0	116	29	1.0000	DISCARD	gen=390 glyphs=4
2026-03-14T00:56:02.114151	37f4017b	116	29	1.0000	DISCARD	gen=346 glyphs=4
2026-03-14T00:56:02.385058	0eaedb57	116	29	1.0000	DISCARD	gen=390 glyphs=4
2026-03-14T00:56:04.836009	4c9b0dd4	120	30	1.0000	DISCARD	gen=346 glyphs=4
2026-03-14T00:56:05.116955	0f5ddec7	116	29	1.0000	DISCARD	gen=390 glyphs=4
2026-03-14T00:56:07.579536	d11c1062	120	30	1.0000	DISCARD	gen=346 glyphs=4
2026-03-14T00:56:07.851125	19355583	120	30	1.0000	DISCARD	gen=390 glyphs=4
2026-03-14T00:56:10.331788	37f4017b	116	29	1.0000	DISCARD	gen=347 glyphs=4
2026-03-14T00:56:10.616409	9e34ede0	116	29	1.0000	DISCARD	gen=390 glyphs=4
2026-03-14T00:56:13.076108	bfdf7cad	120	30	1.0000	DISCARD	gen=347 glyphs=4
2026-03-14T00:56:13.349810	19355583	120	30	1.0000	DISCARD	gen=391 glyphs=4
2026-03-14T00:56:15.823956	d024aab0	116	29	1.0000	DISCARD	gen=347 glyphs=4
2026-03-14T00:56:16.110988	8aef8872	116	29	1.0000	DISCARD	gen=391 glyphs=4
2026-03-14T00:56:18.575414	55d6c151	120	30	1.0000	DISCARD	gen=347 glyphs=4
2026-03-14T00:56:18.841000	19355583	120	30	1.0000	DISCARD	gen=391 glyphs=4
2026-03-14T00:56:21.406854	5b9807ac	120	30	1.0000	DISCARD	gen=347 glyphs=4
2026-03-14T00:56:21.675691	50dc991d	116	29	1.0000	DISCARD	gen=391 glyphs=4
2026-03-14T00:56:24.143272	4c9b0dd4	120	30	1.0000	DISCARD	gen=347 glyphs=4
2026-03-14T00:56:24.421333	06116e64	116	29	1.0000	DISCARD	gen=391 glyphs=4
2026-03-14T00:56:26.919458	37f4017b	116	29	1.0000	DISCARD	gen=347 glyphs=4
2026-03-14T00:56:27.199031	e2cd28ea	120	30	1.0000	DISCARD	gen=391 glyphs=4
2026-03-14T00:56:29.668800	55d6c151	120	30	1.0000	DISCARD	gen=347 glyphs=4
2026-03-14T00:56:29.936083	a78f9454	120	30	1.0000	DISCARD	gen=391 glyphs=4
2026-03-14T00:56:32.385351	55d6c151	120	30	1.0000	DISCARD	gen=347 glyphs=4
2026-03-14T00:56:32.652946	abd4de2c	116	29	1.0000	DISCARD	gen=391 glyphs=4
2026-03-14T00:56:35.149877	d78e68d3	120	30	0.9500	DISCARD	gen=347 glyphs=4
2026-03-14T00:56:35.425337	050862ad	120	30	1.0000	DISCARD	gen=391 glyphs=4
2026-03-14T00:56:37.879454	37f4017b	116	29	1.0000	DISCARD	gen=348 glyphs=4
2026-03-14T00:56:38.157525	19355583	120	30	1.0000	DISCARD	gen=391 glyphs=4
2026-03-14T00:56:40.631103	bfdf7cad	120	30	1.0000	DISCARD	gen=348 glyphs=4
2026-03-14T00:56:40.902030	19355583	120	30	1.0000	DISCARD	gen=392 glyphs=4
2026-03-14T00:56:43.391254	37f4017b	116	29	1.0000	DISCARD	gen=348 glyphs=4
2026-03-14T00:56:43.651862	8aef8872	116	29	1.0000	DISCARD	gen=392 glyphs=4
2026-03-14T00:56:46.167972	37f4017b	116	29	1.0000	DISCARD	gen=348 glyphs=4
2026-03-14T00:56:46.443151	a78f9454	120	30	1.0000	DISCARD	gen=392 glyphs=4
2026-03-14T00:56:48.957579	71e2ba66	116	29	1.0000	DISCARD	gen=348 glyphs=4
2026-03-14T00:56:49.227810	eca7ab6c	116	29	1.0000	DISCARD	gen=392 glyphs=4
2026-03-14T00:56:51.723336	37f4017b	116	29	1.0000	DISCARD	gen=348 glyphs=4
2026-03-14T00:56:52.005377	19355583	120	30	1.0000	DISCARD	gen=392 glyphs=4
2026-03-14T00:56:54.515045	37f4017b	116	29	1.0000	DISCARD	gen=348 glyphs=4
2026-03-14T00:56:54.783159	e8c7f6cf	120	30	1.0000	DISCARD	gen=392 glyphs=4
2026-03-14T00:56:57.258162	d7f2d6d7	120	30	1.0000	DISCARD	gen=348 glyphs=4
2026-03-14T00:56:57.528171	d7c8681b	120	30	1.0000	DISCARD	gen=392 glyphs=4
2026-03-14T00:56:59.984144	4c9b0dd4	120	30	1.0000	DISCARD	gen=348 glyphs=4
2026-03-14T00:57:00.268139	19355583	120	30	1.0000	DISCARD	gen=392 glyphs=4
2026-03-14T00:57:02.724709	4e60f8d0	116	29	1.0000	DISCARD	gen=348 glyphs=4
2026-03-14T00:57:03.000374	8aef8872	116	29	1.0000	DISCARD	gen=392 glyphs=4
2026-03-14T00:57:05.466784	37f4017b	116	29	1.0000	DISCARD	gen=349 glyphs=4
2026-03-14T00:57:05.731614	19355583	120	30	1.0000	DISCARD	gen=392 glyphs=4
2026-03-14T00:57:08.245424	bfdf7cad	120	30	1.0000	DISCARD	gen=349 glyphs=4
2026-03-14T00:57:08.514576	19355583	120	30	1.0000	DISCARD	gen=393 glyphs=4
2026-03-14T00:57:11.015375	4c9b0dd4	120	30	1.0000	DISCARD	gen=349 glyphs=4
2026-03-14T00:57:11.295554	8aef8872	116	29	1.0000	DISCARD	gen=393 glyphs=4
2026-03-14T00:57:13.778152	7a88d486	120	30	0.9500	DISCARD	gen=349 glyphs=4
2026-03-14T00:57:14.055983	0eaedb57	116	29	1.0000	DISCARD	gen=393 glyphs=4
2026-03-14T00:57:16.555889	37f4017b	116	29	1.0000	DISCARD	gen=349 glyphs=4
2026-03-14T00:57:16.821885	b57e7176	120	30	1.0000	DISCARD	gen=393 glyphs=4
2026-03-14T00:57:19.312026	fdb5d108	120	30	1.0000	DISCARD	gen=349 glyphs=4
2026-03-14T00:57:19.578012	050862ad	120	30	1.0000	DISCARD	gen=393 glyphs=4
2026-03-14T00:57:22.096960	37f4017b	116	29	1.0000	DISCARD	gen=349 glyphs=4
2026-03-14T00:57:22.376288	8aef8872	116	29	1.0000	DISCARD	gen=393 glyphs=4
2026-03-14T00:57:24.903999	5a06ca32	120	30	1.0000	DISCARD	gen=349 glyphs=4
2026-03-14T00:57:25.195299	0eaedb57	116	29	1.0000	DISCARD	gen=393 glyphs=4
2026-03-14T00:57:27.674523	5a06ca32	120	30	1.0000	DISCARD	gen=349 glyphs=4
2026-03-14T00:57:27.949711	8aef8872	116	29	1.0000	DISCARD	gen=393 glyphs=4
2026-03-14T00:57:30.467610	5a06ca32	120	30	1.0000	DISCARD	gen=349 glyphs=4
2026-03-14T00:57:30.736667	19355583	120	30	1.0000	DISCARD	gen=393 glyphs=4
2026-03-14T00:57:33.194666	37f4017b	116	29	1.0000	DISCARD	gen=350 glyphs=4
2026-03-14T00:57:33.472466	0eaedb57	116	29	1.0000	DISCARD	gen=393 glyphs=4
2026-03-14T00:57:35.936139	bfdf7cad	120	30	1.0000	DISCARD	gen=350 glyphs=4
2026-03-14T00:57:36.208942	19355583	120	30	1.0000	DISCARD	gen=394 glyphs=4
2026-03-14T00:57:38.657342	12b38c2d	116	29	1.0000	DISCARD	gen=350 glyphs=4
2026-03-14T00:57:38.931868	8aef8872	116	29	1.0000	DISCARD	gen=394 glyphs=4
2026-03-14T00:57:41.372679	1d34459a	116	29	1.0000	DISCARD	gen=350 glyphs=4
2026-03-14T00:57:41.644372	8aef8872	116	29	1.0000	DISCARD	gen=394 glyphs=4
2026-03-14T00:57:44.128794	1d34459a	116	29	1.0000	DISCARD	gen=350 glyphs=4
2026-03-14T00:57:44.395874	19355583	120	30	1.0000	DISCARD	gen=394 glyphs=4
2026-03-14T00:57:46.847234	4c9b0dd4	120	30	1.0000	DISCARD	gen=350 glyphs=4
2026-03-14T00:57:47.140394	ae44ace5	116	29	1.0000	DISCARD	gen=394 glyphs=4
2026-03-14T00:57:49.581068	5a06ca32	120	30	1.0000	DISCARD	gen=350 glyphs=4
2026-03-14T00:57:49.858070	b7aed8e9	116	29	1.0000	DISCARD	gen=394 glyphs=4
2026-03-14T00:57:52.293337	1d34459a	116	29	1.0000	DISCARD	gen=350 glyphs=4
2026-03-14T00:57:52.575156	9e34ede0	116	29	1.0000	DISCARD	gen=394 glyphs=4
2026-03-14T00:57:55.084140	37f4017b	116	29	1.0000	DISCARD	gen=350 glyphs=4
2026-03-14T00:57:55.353571	8aef8872	116	29	1.0000	DISCARD	gen=394 glyphs=4
2026-03-14T00:57:57.856353	37f4017b	116	29	1.0000	DISCARD	gen=350 glyphs=4
2026-03-14T00:57:58.125625	875e0f8a	116	29	1.0000	DISCARD	gen=394 glyphs=4
2026-03-14T00:58:00.585330	37f4017b	116	29	1.0000	DISCARD	gen=351 glyphs=4
2026-03-14T00:58:00.875232	ae44ace5	116	29	1.0000	DISCARD	gen=394 glyphs=4
2026-03-14T00:58:03.337686	bfdf7cad	120	30	1.0000	DISCARD	gen=351 glyphs=4
2026-03-14T00:58:03.600260	19355583	120	30	1.0000	DISCARD	gen=395 glyphs=4
2026-03-14T00:58:06.077510	fdb5d108	120	30	1.0000	DISCARD	gen=351 glyphs=4
2026-03-14T00:58:06.352768	8aef8872	116	29	1.0000	DISCARD	gen=395 glyphs=4
2026-03-14T00:58:08.824488	37f4017b	116	29	1.0000	DISCARD	gen=351 glyphs=4
2026-03-14T00:58:09.101232	bde646d8	120	30	0.9500	DISCARD	gen=395 glyphs=4
2026-03-14T00:58:11.585059	1bde5600	116	29	1.0000	DISCARD	gen=351 glyphs=4
2026-03-14T00:58:11.864512	8aef8872	116	29	1.0000	DISCARD	gen=395 glyphs=4
2026-03-14T00:58:14.327632	37f4017b	116	29	1.0000	DISCARD	gen=351 glyphs=4
2026-03-14T00:58:14.594287	5655159a	120	30	1.0000	DISCARD	gen=395 glyphs=4
2026-03-14T00:58:17.061942	37f4017b	116	29	1.0000	DISCARD	gen=351 glyphs=4
2026-03-14T00:58:17.333821	0eaedb57	116	29	1.0000	DISCARD	gen=395 glyphs=4
2026-03-14T00:58:19.808860	37f4017b	116	29	1.0000	DISCARD	gen=351 glyphs=4
2026-03-14T00:58:20.077562	b7aed8e9	116	29	1.0000	DISCARD	gen=395 glyphs=4
2026-03-14T00:58:22.533191	fdb5d108	120	30	1.0000	DISCARD	gen=351 glyphs=4
2026-03-14T00:58:22.791969	226e4a35	116	29	1.0000	DISCARD	gen=395 glyphs=4
2026-03-14T00:58:25.275976	5a06ca32	120	30	1.0000	DISCARD	gen=351 glyphs=4
2026-03-14T00:58:25.554927	19355583	120	30	1.0000	DISCARD	gen=395 glyphs=4
2026-03-14T00:58:28.082166	37f4017b	116	29	1.0000	DISCARD	gen=352 glyphs=4
2026-03-14T00:58:28.363642	e8c7f6cf	120	30	1.0000	DISCARD	gen=395 glyphs=4
2026-03-14T00:58:30.820161	bfdf7cad	120	30	1.0000	DISCARD	gen=352 glyphs=4
2026-03-14T00:58:31.101086	19355583	120	30	1.0000	DISCARD	gen=396 glyphs=4
2026-03-14T00:58:33.556632	55d6c151	120	30	1.0000	DISCARD	gen=352 glyphs=4
2026-03-14T00:58:33.825071	8aef8872	116	29	1.0000	DISCARD	gen=396 glyphs=4
2026-03-14T00:58:36.255053	55d6c151	120	30	1.0000	DISCARD	gen=352 glyphs=4
2026-03-14T00:58:36.530692	ae44ace5	116	29	1.0000	DISCARD	gen=396 glyphs=4
2026-03-14T00:58:38.975563	596e0076	120	30	1.0000	DISCARD	gen=352 glyphs=4
2026-03-14T00:58:39.243926	0eaedb57	116	29	1.0000	DISCARD	gen=396 glyphs=4
2026-03-14T00:58:41.734099	71e2ba66	116	29	1.0000	DISCARD	gen=352 glyphs=4
2026-03-14T00:58:42.009298	d7c8681b	120	30	1.0000	DISCARD	gen=396 glyphs=4
2026-03-14T00:58:44.478204	4c9b0dd4	120	30	1.0000	DISCARD	gen=352 glyphs=4
2026-03-14T00:58:44.751858	b57e7176	120	30	1.0000	DISCARD	gen=396 glyphs=4
2026-03-14T00:58:47.219759	55d6c151	120	30	1.0000	DISCARD	gen=352 glyphs=4
2026-03-14T00:58:47.499874	050862ad	120	30	1.0000	DISCARD	gen=396 glyphs=4
2026-03-14T00:58:49.952439	4c9b0dd4	120	30	1.0000	DISCARD	gen=352 glyphs=4
2026-03-14T00:58:50.216751	df6fbf1a	120	30	1.0000	DISCARD	gen=396 glyphs=4
2026-03-14T00:58:52.709080	4c9b0dd4	120	30	1.0000	DISCARD	gen=352 glyphs=4
2026-03-14T00:58:52.994978	19355583	120	30	1.0000	DISCARD	gen=396 glyphs=4
2026-03-14T00:58:55.445792	37f4017b	116	29	1.0000	DISCARD	gen=353 glyphs=4
2026-03-14T00:58:55.719488	ae44ace5	116	29	1.0000	DISCARD	gen=396 glyphs=4
2026-03-14T00:58:58.169252	bfdf7cad	120	30	1.0000	DISCARD	gen=353 glyphs=4
2026-03-14T00:58:58.468665	19355583	120	30	1.0000	DISCARD	gen=397 glyphs=4
2026-03-14T00:59:01.016949	55d6c151	120	30	1.0000	DISCARD	gen=353 glyphs=4
2026-03-14T00:59:01.287476	8aef8872	116	29	1.0000	DISCARD	gen=397 glyphs=4
2026-03-14T00:59:03.711183	42ca0977	116	29	0.9500	DISCARD	gen=353 glyphs=4
2026-03-14T00:59:03.983418	8aef8872	116	29	1.0000	DISCARD	gen=397 glyphs=4
2026-03-14T00:59:06.454072	bfdf7cad	120	30	1.0000	DISCARD	gen=353 glyphs=4
2026-03-14T00:59:06.723920	e8c7f6cf	120	30	1.0000	DISCARD	gen=397 glyphs=4
2026-03-14T00:59:09.176324	1d34459a	116	29	1.0000	DISCARD	gen=353 glyphs=4
2026-03-14T00:59:09.454752	19355583	120	30	1.0000	DISCARD	gen=397 glyphs=4
2026-03-14T00:59:11.884409	02253f2a	116	29	1.0000	DISCARD	gen=353 glyphs=4
2026-03-14T00:59:12.158926	e8c7f6cf	120	30	1.0000	DISCARD	gen=397 glyphs=4
2026-03-14T00:59:14.635780	5a06ca32	120	30	1.0000	DISCARD	gen=353 glyphs=4
2026-03-14T00:59:14.895774	eca7ab6c	116	29	1.0000	DISCARD	gen=397 glyphs=4
2026-03-14T00:59:17.371458	61c72526	120	30	1.0000	DISCARD	gen=353 glyphs=4
2026-03-14T00:59:17.641598	f1653a4d	120	30	1.0000	DISCARD	gen=397 glyphs=4
2026-03-14T00:59:20.114548	55d6c151	120	30	1.0000	DISCARD	gen=353 glyphs=4
2026-03-14T00:59:20.408192	8aef8872	116	29	1.0000	DISCARD	gen=397 glyphs=4
2026-03-14T00:59:22.876208	37f4017b	116	29	1.0000	DISCARD	gen=354 glyphs=4
2026-03-14T00:59:23.152714	19355583	120	30	1.0000	DISCARD	gen=397 glyphs=4
2026-03-14T00:59:25.612094	bfdf7cad	120	30	1.0000	DISCARD	gen=354 glyphs=4
2026-03-14T00:59:25.895423	19355583	120	30	1.0000	DISCARD	gen=398 glyphs=4
2026-03-14T00:59:28.359099	ebea7b8b	120	30	1.0000	DISCARD	gen=354 glyphs=4
2026-03-14T00:59:28.624811	8aef8872	116	29	1.0000	DISCARD	gen=398 glyphs=4
2026-03-14T00:59:31.096113	7ca87b42	116	29	1.0000	DISCARD	gen=354 glyphs=4
2026-03-14T00:59:31.379602	a78f9454	120	30	1.0000	DISCARD	gen=398 glyphs=4
2026-03-14T00:59:33.860986	12b38c2d	116	29	1.0000	DISCARD	gen=354 glyphs=4
2026-03-14T00:59:34.135618	1e5f0e21	116	29	1.0000	DISCARD	gen=398 glyphs=4
2026-03-14T00:59:36.592910	37f4017b	116	29	1.0000	DISCARD	gen=354 glyphs=4
2026-03-14T00:59:36.871359	b7aed8e9	116	29	1.0000	DISCARD	gen=398 glyphs=4
2026-03-14T00:59:39.319359	37f4017b	116	29	1.0000	DISCARD	gen=354 glyphs=4
2026-03-14T00:59:39.586949	8aef8872	116	29	1.0000	DISCARD	gen=398 glyphs=4
2026-03-14T00:59:42.040859	37f4017b	116	29	1.0000	DISCARD	gen=354 glyphs=4
2026-03-14T00:59:42.298839	1e5f0e21	116	29	1.0000	DISCARD	gen=398 glyphs=4
2026-03-14T00:59:44.773565	bb5b82c0	120	30	1.0000	DISCARD	gen=354 glyphs=4
2026-03-14T00:59:45.036429	ef1955b2	120	30	1.0000	DISCARD	gen=398 glyphs=4
2026-03-14T00:59:47.496014	04277a74	120	30	1.0000	DISCARD	gen=354 glyphs=4
2026-03-14T00:59:47.761376	a78f9454	120	30	1.0000	DISCARD	gen=398 glyphs=4
2026-03-14T00:59:50.223617	37f4017b	116	29	1.0000	DISCARD	gen=355 glyphs=4
2026-03-14T00:59:50.495828	d7c8681b	120	30	1.0000	DISCARD	gen=398 glyphs=4
2026-03-14T00:59:52.977210	bfdf7cad	120	30	1.0000	DISCARD	gen=355 glyphs=4
2026-03-14T00:59:53.261820	19355583	120	30	1.0000	DISCARD	gen=399 glyphs=4
2026-03-14T00:59:55.721387	bfdf7cad	120	30	1.0000	DISCARD	gen=355 glyphs=4
2026-03-14T00:59:55.995416	8aef8872	116	29	1.0000	DISCARD	gen=399 glyphs=4
2026-03-14T00:59:58.464969	71e2ba66	116	29	1.0000	DISCARD	gen=355 glyphs=4
2026-03-14T00:59:58.740155	801f74ba	116	29	1.0000	DISCARD	gen=399 glyphs=4
2026-03-14T01:00:01.227187	3252b67f	116	29	1.0000	DISCARD	gen=355 glyphs=4
2026-03-14T01:00:01.495008	1e5f0e21	116	29	1.0000	DISCARD	gen=399 glyphs=4
2026-03-14T01:00:04.061826	f1ce6b09	116	29	1.0000	DISCARD	gen=355 glyphs=4
2026-03-14T01:00:04.360499	ea580e5c	116	29	0.9500	DISCARD	gen=399 glyphs=4
2026-03-14T01:00:06.859883	7ca87b42	116	29	1.0000	DISCARD	gen=355 glyphs=4
2026-03-14T01:00:07.139063	0b250a9f	116	29	1.0000	DISCARD	gen=399 glyphs=4
2026-03-14T01:00:09.597655	5b9807ac	120	30	1.0000	DISCARD	gen=355 glyphs=4
2026-03-14T01:00:09.867357	62a7861f	116	29	1.0000	DISCARD	gen=399 glyphs=4
2026-03-14T01:00:12.357286	e93ae99a	120	30	1.0000	DISCARD	gen=355 glyphs=4
2026-03-14T01:00:12.631972	98092618	116	29	0.9500	DISCARD	gen=399 glyphs=4
2026-03-14T01:00:15.077031	71e2ba66	116	29	1.0000	DISCARD	gen=355 glyphs=4
2026-03-14T01:00:15.354609	770e55a4	120	30	1.0000	DISCARD	gen=399 glyphs=4
2026-03-14T01:00:17.836848	37f4017b	116	29	1.0000	DISCARD	gen=356 glyphs=4
2026-03-14T01:00:18.109861	9e34ede0	116	29	1.0000	DISCARD	gen=399 glyphs=4
2026-03-14T01:00:20.565862	bfdf7cad	120	30	1.0000	DISCARD	gen=356 glyphs=4
2026-03-14T01:00:20.840106	19355583	120	30	1.0000	DISCARD	gen=400 glyphs=4
2026-03-14T01:00:23.344233	4c9b0dd4	120	30	1.0000	DISCARD	gen=356 glyphs=4
2026-03-14T01:00:23.613428	8aef8872	116	29	1.0000	DISCARD	gen=400 glyphs=4
2026-03-14T01:00:26.088985	b3528d7b	116	29	1.0000	DISCARD	gen=356 glyphs=4
2026-03-14T01:00:26.367781	32decef0	116	29	1.0000	DISCARD	gen=400 glyphs=4
2026-03-14T01:00:28.876043	91a7dd52	116	29	1.0000	DISCARD	gen=356 glyphs=4
2026-03-14T01:00:29.160047	0eaedb57	116	29	1.0000	DISCARD	gen=400 glyphs=4
2026-03-14T01:00:31.618561	5d54737e	116	29	1.0000	DISCARD	gen=356 glyphs=4
2026-03-14T01:00:31.881855	0eaedb57	116	29	1.0000	DISCARD	gen=400 glyphs=4
2026-03-14T01:00:34.359071	71e2ba66	116	29	1.0000	DISCARD	gen=356 glyphs=4
2026-03-14T01:00:34.641292	a4bb6989	116	29	1.0000	DISCARD	gen=400 glyphs=4
2026-03-14T01:00:37.172441	5a06ca32	120	30	1.0000	DISCARD	gen=356 glyphs=4
2026-03-14T01:00:37.447168	e8c7f6cf	120	30	1.0000	DISCARD	gen=400 glyphs=4
2026-03-14T01:00:39.951685	da56c2f3	120	30	1.0000	DISCARD	gen=356 glyphs=4
2026-03-14T01:00:40.224023	67cb81be	120	30	1.0000	DISCARD	gen=400 glyphs=4
2026-03-14T01:00:42.708326	55d6c151	120	30	1.0000	DISCARD	gen=356 glyphs=4
2026-03-14T01:00:42.972756	00ebbe9c	116	29	0.9500	DISCARD	gen=400 glyphs=4
2026-03-14T01:00:45.445747	37f4017b	116	29	1.0000	DISCARD	gen=357 glyphs=4
2026-03-14T01:00:45.723308	8aef8872	116	29	1.0000	DISCARD	gen=400 glyphs=4
2026-03-14T01:00:48.196995	bfdf7cad	120	30	1.0000	DISCARD	gen=357 glyphs=4
2026-03-14T01:00:48.467209	19355583	120	30	1.0000	DISCARD	gen=401 glyphs=4
2026-03-14T01:00:50.960597	37f4017b	116	29	1.0000	DISCARD	gen=357 glyphs=4
2026-03-14T01:00:51.224840	8aef8872	116	29	1.0000	DISCARD	gen=401 glyphs=4
2026-03-14T01:00:53.699159	37f4017b	116	29	1.0000	DISCARD	gen=357 glyphs=4
2026-03-14T01:00:53.967258	19355583	120	30	1.0000	DISCARD	gen=401 glyphs=4
2026-03-14T01:00:56.435308	5a06ca32	120	30	1.0000	DISCARD	gen=357 glyphs=4
2026-03-14T01:00:56.709299	eb1b0a5d	116	29	1.0000	DISCARD	gen=401 glyphs=4
2026-03-14T01:00:59.210893	55d6c151	120	30	1.0000	DISCARD	gen=357 glyphs=4
2026-03-14T01:00:59.480485	b9347620	116	29	1.0000	DISCARD	gen=401 glyphs=4
2026-03-14T01:01:01.935436	2bcae75c	120	30	1.0000	DISCARD	gen=357 glyphs=4
2026-03-14T01:01:02.220253	0eaedb57	116	29	1.0000	DISCARD	gen=401 glyphs=4
2026-03-14T01:01:04.672211	37f4017b	116	29	1.0000	DISCARD	gen=357 glyphs=4
2026-03-14T01:01:04.958453	19355583	120	30	1.0000	DISCARD	gen=401 glyphs=4
2026-03-14T01:01:07.543310	4c9b0dd4	120	30	1.0000	DISCARD	gen=357 glyphs=4
2026-03-14T01:01:07.829983	50dc991d	116	29	1.0000	DISCARD	gen=401 glyphs=4
2026-03-14T01:01:10.310894	5a06ca32	120	30	1.0000	DISCARD	gen=357 glyphs=4
2026-03-14T01:01:10.580876	050862ad	120	30	1.0000	DISCARD	gen=401 glyphs=4
2026-03-14T01:01:13.074341	37f4017b	116	29	1.0000	DISCARD	gen=358 glyphs=4
2026-03-14T01:01:13.363632	050862ad	120	30	1.0000	DISCARD	gen=401 glyphs=4
2026-03-14T01:01:15.839258	bfdf7cad	120	30	1.0000	DISCARD	gen=358 glyphs=4
2026-03-14T01:01:16.109034	19355583	120	30	1.0000	DISCARD	gen=402 glyphs=4
2026-03-14T01:01:18.546941	fdb5d108	120	30	1.0000	DISCARD	gen=358 glyphs=4
2026-03-14T01:01:18.821542	8aef8872	116	29	1.0000	DISCARD	gen=402 glyphs=4
2026-03-14T01:01:21.286049	ae89cb15	116	29	1.0000	DISCARD	gen=358 glyphs=4
2026-03-14T01:01:21.561361	50dc991d	116	29	1.0000	DISCARD	gen=402 glyphs=4
2026-03-14T01:01:24.017286	2701cb73	116	29	1.0000	DISCARD	gen=358 glyphs=4
2026-03-14T01:01:24.289972	2e8a8faf	116	29	1.0000	DISCARD	gen=402 glyphs=4
2026-03-14T01:01:26.749896	237c480d	116	29	1.0000	DISCARD	gen=358 glyphs=4
2026-03-14T01:01:27.030009	999555b4	116	29	1.0000	DISCARD	gen=402 glyphs=4
2026-03-14T01:01:29.512609	55d6c151	120	30	1.0000	DISCARD	gen=358 glyphs=4
2026-03-14T01:01:29.785245	8aef8872	116	29	1.0000	DISCARD	gen=402 glyphs=4
2026-03-14T01:01:32.269246	5a06ca32	120	30	1.0000	DISCARD	gen=358 glyphs=4
2026-03-14T01:01:32.536268	e2cd28ea	120	30	1.0000	DISCARD	gen=402 glyphs=4
2026-03-14T01:01:35.043040	37f4017b	116	29	1.0000	DISCARD	gen=358 glyphs=4
2026-03-14T01:01:35.314085	9e34ede0	116	29	1.0000	DISCARD	gen=402 glyphs=4
2026-03-14T01:01:37.774441	91c736ab	120	30	1.0000	DISCARD	gen=358 glyphs=4
2026-03-14T01:01:38.076216	9e1c18a3	116	29	1.0000	DISCARD	gen=402 glyphs=4
2026-03-14T01:01:40.583372	37f4017b	116	29	1.0000	DISCARD	gen=359 glyphs=4
2026-03-14T01:01:40.863854	b7aed8e9	116	29	1.0000	DISCARD	gen=402 glyphs=4
