timestamp	program_hash	spirv_size	word_count	fitness	status	description
2026-03-13T22:53:28.453402	050862ad	120	30	1.0000	DISCARD	gen=125 glyphs=4
2026-03-13T22:53:28.994960	37f4017b	116	29	1.0000	DISCARD	gen=81 glyphs=4
2026-03-13T22:53:31.179712	512b3553	116	29	1.0000	DISCARD	gen=125 glyphs=4
2026-03-13T22:53:31.731751	bc2faea7	120	30	1.0000	DISCARD	gen=81 glyphs=4
2026-03-13T22:53:33.943719	b1f9a084	120	30	1.0000	DISCARD	gen=125 glyphs=4
2026-03-13T22:53:34.500265	7ca87b42	116	29	1.0000	DISCARD	gen=81 glyphs=4
2026-03-13T22:53:36.713037	a78f9454	120	30	1.0000	DISCARD	gen=125 glyphs=4
2026-03-13T22:53:37.277127	5a06ca32	120	30	1.0000	DISCARD	gen=81 glyphs=4
2026-03-13T22:53:39.488976	0eaedb57	116	29	1.0000	DISCARD	gen=125 glyphs=4
2026-03-13T22:53:40.032813	37f4017b	116	29	1.0000	DISCARD	gen=82 glyphs=4
2026-03-13T22:53:42.248423	19355583	120	30	1.0000	DISCARD	gen=126 glyphs=4
2026-03-13T22:53:42.801787	bfdf7cad	120	30	1.0000	DISCARD	gen=82 glyphs=4
2026-03-13T22:53:44.999101	8aef8872	116	29	1.0000	DISCARD	gen=126 glyphs=4
2026-03-13T22:53:45.550501	12b38c2d	116	29	1.0000	DISCARD	gen=82 glyphs=4
2026-03-13T22:53:47.746306	d7c8681b	120	30	1.0000	DISCARD	gen=126 glyphs=4
2026-03-13T22:53:48.292770	d11c1062	120	30	1.0000	DISCARD	gen=82 glyphs=4
2026-03-13T22:53:50.499331	0eaedb57	116	29	1.0000	DISCARD	gen=126 glyphs=4
2026-03-13T22:53:51.047890	37f4017b	116	29	1.0000	DISCARD	gen=82 glyphs=4
2026-03-13T22:53:53.235795	e2cd28ea	120	30	1.0000	DISCARD	gen=126 glyphs=4
2026-03-13T22:53:53.775457	7d37a5c1	116	29	1.0000	DISCARD	gen=82 glyphs=4
2026-03-13T22:53:56.073706	050862ad	120	30	1.0000	DISCARD	gen=126 glyphs=4
2026-03-13T22:53:56.615174	96e1aeba	116	29	1.0000	DISCARD	gen=82 glyphs=4
2026-03-13T22:53:58.764118	9e34ede0	116	29	1.0000	DISCARD	gen=126 glyphs=4
2026-03-13T22:53:59.304314	5b9807ac	120	30	1.0000	DISCARD	gen=82 glyphs=4
2026-03-13T22:54:01.466150	9e34ede0	116	29	1.0000	DISCARD	gen=126 glyphs=4
2026-03-13T22:54:02.015128	b62bec31	120	30	1.0000	DISCARD	gen=82 glyphs=4
2026-03-13T22:54:04.143768	ae44ace5	116	29	1.0000	DISCARD	gen=126 glyphs=4
2026-03-13T22:54:04.687625	5a06ca32	120	30	1.0000	DISCARD	gen=82 glyphs=4
2026-03-13T22:54:06.831664	fd43df20	120	30	1.0000	DISCARD	gen=126 glyphs=4
2026-03-13T22:54:07.358150	37f4017b	116	29	1.0000	DISCARD	gen=83 glyphs=4
2026-03-13T22:54:09.549927	19355583	120	30	1.0000	DISCARD	gen=127 glyphs=4
2026-03-13T22:54:10.084836	bfdf7cad	120	30	1.0000	DISCARD	gen=83 glyphs=4
2026-03-13T22:54:12.216044	8aef8872	116	29	1.0000	DISCARD	gen=127 glyphs=4
2026-03-13T22:54:12.757009	5a06ca32	120	30	1.0000	DISCARD	gen=83 glyphs=4
2026-03-13T22:54:14.919337	8c222c39	116	29	1.0000	DISCARD	gen=127 glyphs=4
2026-03-13T22:54:15.467752	37f4017b	116	29	1.0000	DISCARD	gen=83 glyphs=4
2026-03-13T22:54:17.626744	e2cd28ea	120	30	1.0000	DISCARD	gen=127 glyphs=4
2026-03-13T22:54:18.162341	22eff912	116	29	1.0000	DISCARD	gen=83 glyphs=4
2026-03-13T22:54:20.295964	1e5f0e21	116	29	1.0000	DISCARD	gen=127 glyphs=4
2026-03-13T22:54:20.832421	7f125c93	116	29	1.0000	DISCARD	gen=83 glyphs=4
2026-03-13T22:54:22.980961	050862ad	120	30	1.0000	DISCARD	gen=127 glyphs=4
2026-03-13T22:54:23.513434	fdb5d108	120	30	1.0000	DISCARD	gen=83 glyphs=4
2026-03-13T22:54:25.650444	b57e7176	120	30	1.0000	DISCARD	gen=127 glyphs=4
2026-03-13T22:54:26.199294	12b38c2d	116	29	1.0000	DISCARD	gen=83 glyphs=4
2026-03-13T22:54:28.473447	e8c7f6cf	120	30	1.0000	DISCARD	gen=127 glyphs=4
2026-03-13T22:54:29.021379	37f4017b	116	29	1.0000	DISCARD	gen=83 glyphs=4
2026-03-13T22:54:31.163265	8aef8872	116	29	1.0000	DISCARD	gen=127 glyphs=4
2026-03-13T22:54:31.702891	37f4017b	116	29	1.0000	DISCARD	gen=83 glyphs=4
2026-03-13T22:54:33.852144	a78f9454	120	30	1.0000	DISCARD	gen=127 glyphs=4
2026-03-13T22:54:34.386097	37f4017b	116	29	1.0000	DISCARD	gen=84 glyphs=4
2026-03-13T22:54:36.563375	19355583	120	30	1.0000	DISCARD	gen=128 glyphs=4
2026-03-13T22:54:37.107505	bfdf7cad	120	30	1.0000	DISCARD	gen=84 glyphs=4
2026-03-13T22:54:39.242947	8aef8872	116	29	1.0000	DISCARD	gen=128 glyphs=4
2026-03-13T22:54:39.773754	bfdf7cad	120	30	1.0000	DISCARD	gen=84 glyphs=4
2026-03-13T22:54:41.919358	e8c7f6cf	120	30	1.0000	DISCARD	gen=128 glyphs=4
2026-03-13T22:54:42.460858	37f4017b	116	29	1.0000	DISCARD	gen=84 glyphs=4
2026-03-13T22:54:44.606407	d7c8681b	120	30	1.0000	DISCARD	gen=128 glyphs=4
2026-03-13T22:54:45.136238	5b9807ac	120	30	1.0000	DISCARD	gen=84 glyphs=4
2026-03-13T22:54:47.291462	ae44ace5	116	29	1.0000	DISCARD	gen=128 glyphs=4
2026-03-13T22:54:47.827627	37f4017b	116	29	1.0000	DISCARD	gen=84 glyphs=4
2026-03-13T22:54:50.011983	5fe5846c	116	29	1.0000	DISCARD	gen=128 glyphs=4
2026-03-13T22:54:50.537124	2701cb73	116	29	1.0000	DISCARD	gen=84 glyphs=4
2026-03-13T22:54:52.685158	6ec7c1db	116	29	1.0000	DISCARD	gen=128 glyphs=4
2026-03-13T22:54:53.226603	5a06ca32	120	30	1.0000	DISCARD	gen=84 glyphs=4
2026-03-13T22:54:55.354376	0eaedb57	116	29	1.0000	DISCARD	gen=128 glyphs=4
2026-03-13T22:54:55.889461	7ca87b42	116	29	1.0000	DISCARD	gen=84 glyphs=4
2026-03-13T22:54:58.023390	5367b227	120	30	1.0000	DISCARD	gen=128 glyphs=4
2026-03-13T22:54:58.583728	37f4017b	116	29	1.0000	DISCARD	gen=84 glyphs=4
2026-03-13T22:55:00.771355	42b7d22a	120	30	1.0000	DISCARD	gen=128 glyphs=4
2026-03-13T22:55:01.319165	37f4017b	116	29	1.0000	DISCARD	gen=85 glyphs=4
2026-03-13T22:55:03.508964	19355583	120	30	1.0000	DISCARD	gen=129 glyphs=4
2026-03-13T22:55:04.044312	bfdf7cad	120	30	1.0000	DISCARD	gen=85 glyphs=4
2026-03-13T22:55:06.211096	8aef8872	116	29	1.0000	DISCARD	gen=129 glyphs=4
2026-03-13T22:55:06.769957	37f4017b	116	29	1.0000	DISCARD	gen=85 glyphs=4
2026-03-13T22:55:08.925259	e2cd28ea	120	30	1.0000	DISCARD	gen=129 glyphs=4
2026-03-13T22:55:09.470138	55d6c151	120	30	1.0000	DISCARD	gen=85 glyphs=4
2026-03-13T22:55:11.644825	8aef8872	116	29	1.0000	DISCARD	gen=129 glyphs=4
2026-03-13T22:55:12.185307	2701cb73	116	29	1.0000	DISCARD	gen=85 glyphs=4
2026-03-13T22:55:14.344490	7714bc1c	120	30	1.0000	DISCARD	gen=129 glyphs=4
2026-03-13T22:55:14.882184	ec1aaabe	120	30	0.9500	DISCARD	gen=85 glyphs=4
2026-03-13T22:55:17.023976	19355583	120	30	1.0000	DISCARD	gen=129 glyphs=4
2026-03-13T22:55:17.577690	189d237e	116	29	1.0000	DISCARD	gen=85 glyphs=4
2026-03-13T22:55:19.768919	8aef8872	116	29	1.0000	DISCARD	gen=129 glyphs=4
2026-03-13T22:55:20.323152	37f4017b	116	29	1.0000	DISCARD	gen=85 glyphs=4
2026-03-13T22:55:22.476295	0eaedb57	116	29	1.0000	DISCARD	gen=129 glyphs=4
2026-03-13T22:55:23.026525	55d6c151	120	30	1.0000	DISCARD	gen=85 glyphs=4
2026-03-13T22:55:25.196677	b7aed8e9	116	29	1.0000	DISCARD	gen=129 glyphs=4
2026-03-13T22:55:25.735038	bfdf7cad	120	30	1.0000	DISCARD	gen=85 glyphs=4
2026-03-13T22:55:27.883304	e8c7f6cf	120	30	1.0000	DISCARD	gen=129 glyphs=4
2026-03-13T22:55:28.415978	37f4017b	116	29	1.0000	DISCARD	gen=86 glyphs=4
2026-03-13T22:55:30.655248	19355583	120	30	1.0000	DISCARD	gen=130 glyphs=4
2026-03-13T22:55:31.225779	bfdf7cad	120	30	1.0000	DISCARD	gen=86 glyphs=4
2026-03-13T22:55:33.401116	8aef8872	116	29	1.0000	DISCARD	gen=130 glyphs=4
2026-03-13T22:55:33.931911	5b9807ac	120	30	1.0000	DISCARD	gen=86 glyphs=4
2026-03-13T22:55:36.125935	19355583	120	30	1.0000	DISCARD	gen=130 glyphs=4
2026-03-13T22:55:36.653476	7ca87b42	116	29	1.0000	DISCARD	gen=86 glyphs=4
2026-03-13T22:55:38.830196	050862ad	120	30	1.0000	DISCARD	gen=130 glyphs=4
2026-03-13T22:55:39.374885	2f4b19cc	120	30	0.9500	DISCARD	gen=86 glyphs=4
2026-03-13T22:55:41.557018	8aef8872	116	29	1.0000	DISCARD	gen=130 glyphs=4
2026-03-13T22:55:42.111064	37f4017b	116	29	1.0000	DISCARD	gen=86 glyphs=4
2026-03-13T22:55:44.285013	67cb81be	120	30	1.0000	DISCARD	gen=130 glyphs=4
2026-03-13T22:55:44.829289	37f4017b	116	29	1.0000	DISCARD	gen=86 glyphs=4
2026-03-13T22:55:47.026763	b57e7176	120	30	1.0000	DISCARD	gen=130 glyphs=4
2026-03-13T22:55:47.568058	88dcf2c1	120	30	1.0000	DISCARD	gen=86 glyphs=4
2026-03-13T22:55:49.717695	ae44ace5	116	29	1.0000	DISCARD	gen=130 glyphs=4
2026-03-13T22:55:50.263903	71e2ba66	116	29	1.0000	DISCARD	gen=86 glyphs=4
2026-03-13T22:55:52.437697	a78f9454	120	30	1.0000	DISCARD	gen=130 glyphs=4
2026-03-13T22:55:52.971404	55d6c151	120	30	1.0000	DISCARD	gen=86 glyphs=4
2026-03-13T22:55:55.141182	d36bfd35	116	29	1.0000	DISCARD	gen=130 glyphs=4
2026-03-13T22:55:55.677987	37f4017b	116	29	1.0000	DISCARD	gen=87 glyphs=4
2026-03-13T22:55:57.852210	19355583	120	30	1.0000	DISCARD	gen=131 glyphs=4
2026-03-13T22:55:58.401622	bfdf7cad	120	30	1.0000	DISCARD	gen=87 glyphs=4
2026-03-13T22:56:00.547349	8aef8872	116	29	1.0000	DISCARD	gen=131 glyphs=4
2026-03-13T22:56:01.099044	37f4017b	116	29	1.0000	DISCARD	gen=87 glyphs=4
2026-03-13T22:56:03.359176	19355583	120	30	1.0000	DISCARD	gen=131 glyphs=4
2026-03-13T22:56:03.935089	5b9807ac	120	30	1.0000	DISCARD	gen=87 glyphs=4
2026-03-13T22:56:06.089991	f07adb24	116	29	1.0000	DISCARD	gen=131 glyphs=4
2026-03-13T22:56:06.636026	f01e9b01	120	30	1.0000	DISCARD	gen=87 glyphs=4
2026-03-13T22:56:08.778713	e92cc473	116	29	1.0000	DISCARD	gen=131 glyphs=4
2026-03-13T22:56:09.305937	5a06ca32	120	30	1.0000	DISCARD	gen=87 glyphs=4
2026-03-13T22:56:11.456864	875e0f8a	116	29	1.0000	DISCARD	gen=131 glyphs=4
2026-03-13T22:56:11.994383	718f2d82	116	29	1.0000	DISCARD	gen=87 glyphs=4
2026-03-13T22:56:14.163306	0eaedb57	116	29	1.0000	DISCARD	gen=131 glyphs=4
2026-03-13T22:56:14.727237	55d6c151	120	30	1.0000	DISCARD	gen=87 glyphs=4
2026-03-13T22:56:16.898850	875e0f8a	116	29	1.0000	DISCARD	gen=131 glyphs=4
2026-03-13T22:56:17.437128	e25148a2	116	29	1.0000	DISCARD	gen=87 glyphs=4
2026-03-13T22:56:19.593365	050862ad	120	30	1.0000	DISCARD	gen=131 glyphs=4
2026-03-13T22:56:20.138349	37f4017b	116	29	1.0000	DISCARD	gen=87 glyphs=4
2026-03-13T22:56:22.297231	c814cd53	116	29	1.0000	DISCARD	gen=131 glyphs=4
2026-03-13T22:56:22.833171	37f4017b	116	29	1.0000	DISCARD	gen=88 glyphs=4
2026-03-13T22:56:24.981490	19355583	120	30	1.0000	DISCARD	gen=132 glyphs=4
2026-03-13T22:56:25.528984	bfdf7cad	120	30	1.0000	DISCARD	gen=88 glyphs=4
2026-03-13T22:56:27.686803	8aef8872	116	29	1.0000	DISCARD	gen=132 glyphs=4
2026-03-13T22:56:28.235045	4c9b0dd4	120	30	1.0000	DISCARD	gen=88 glyphs=4
2026-03-13T22:56:30.370457	a78f9454	120	30	1.0000	DISCARD	gen=132 glyphs=4
2026-03-13T22:56:30.914220	37f4017b	116	29	1.0000	DISCARD	gen=88 glyphs=4
2026-03-13T22:56:33.078780	8aef8872	116	29	1.0000	DISCARD	gen=132 glyphs=4
2026-03-13T22:56:33.626926	d1972dc3	120	30	1.0000	DISCARD	gen=88 glyphs=4
2026-03-13T22:56:35.876344	b57e7176	120	30	1.0000	DISCARD	gen=132 glyphs=4
2026-03-13T22:56:36.423348	2701cb73	116	29	1.0000	DISCARD	gen=88 glyphs=4
2026-03-13T22:56:38.592194	b7aed8e9	116	29	1.0000	DISCARD	gen=132 glyphs=4
2026-03-13T22:56:39.127806	37f4017b	116	29	1.0000	DISCARD	gen=88 glyphs=4
2026-03-13T22:56:41.312079	9fe760b0	120	30	1.0000	DISCARD	gen=132 glyphs=4
2026-03-13T22:56:41.853660	5a06ca32	120	30	1.0000	DISCARD	gen=88 glyphs=4
2026-03-13T22:56:44.003646	bc26dbf4	116	29	1.0000	DISCARD	gen=132 glyphs=4
2026-03-13T22:56:44.539962	783d25f8	116	29	1.0000	DISCARD	gen=88 glyphs=4
2026-03-13T22:56:46.691662	525a2a84	120	30	1.0000	DISCARD	gen=132 glyphs=4
2026-03-13T22:56:47.238566	5a06ca32	120	30	1.0000	DISCARD	gen=88 glyphs=4
2026-03-13T22:56:49.376531	050862ad	120	30	1.0000	DISCARD	gen=132 glyphs=4
2026-03-13T22:56:49.915631	37f4017b	116	29	1.0000	DISCARD	gen=89 glyphs=4
2026-03-13T22:56:52.053096	19355583	120	30	1.0000	DISCARD	gen=133 glyphs=4
2026-03-13T22:56:52.579316	bfdf7cad	120	30	1.0000	DISCARD	gen=89 glyphs=4
2026-03-13T22:56:54.749600	8aef8872	116	29	1.0000	DISCARD	gen=133 glyphs=4
2026-03-13T22:56:55.295139	5a06ca32	120	30	1.0000	DISCARD	gen=89 glyphs=4
2026-03-13T22:56:57.460414	f6f0293a	116	29	1.0000	DISCARD	gen=133 glyphs=4
2026-03-13T22:56:58.023898	55d6c151	120	30	1.0000	DISCARD	gen=89 glyphs=4
2026-03-13T22:57:00.157368	8aef8872	116	29	1.0000	DISCARD	gen=133 glyphs=4
2026-03-13T22:57:00.710417	022de575	116	29	1.0000	DISCARD	gen=89 glyphs=4
2026-03-13T22:57:02.877042	3c7547b6	120	30	1.0000	DISCARD	gen=133 glyphs=4
2026-03-13T22:57:03.413087	12b38c2d	116	29	1.0000	DISCARD	gen=89 glyphs=4
2026-03-13T22:57:05.561569	b57e7176	120	30	1.0000	DISCARD	gen=133 glyphs=4
2026-03-13T22:57:06.137320	34573e12	120	30	1.0000	DISCARD	gen=89 glyphs=4
2026-03-13T22:57:08.315083	050862ad	120	30	1.0000	DISCARD	gen=133 glyphs=4
2026-03-13T22:57:08.871805	d11c1062	120	30	1.0000	DISCARD	gen=89 glyphs=4
2026-03-13T22:57:10.995146	50dc991d	116	29	1.0000	DISCARD	gen=133 glyphs=4
2026-03-13T22:57:11.531899	fdb5d108	120	30	1.0000	DISCARD	gen=89 glyphs=4
2026-03-13T22:57:13.681931	a78f9454	120	30	1.0000	DISCARD	gen=133 glyphs=4
2026-03-13T22:57:14.208415	37f4017b	116	29	1.0000	DISCARD	gen=89 glyphs=4
2026-03-13T22:57:16.358445	309c16a0	116	29	1.0000	DISCARD	gen=133 glyphs=4
2026-03-13T22:57:16.899284	37f4017b	116	29	1.0000	DISCARD	gen=90 glyphs=4
2026-03-13T22:57:19.029824	19355583	120	30	1.0000	DISCARD	gen=134 glyphs=4
2026-03-13T22:57:19.586952	bfdf7cad	120	30	1.0000	DISCARD	gen=90 glyphs=4
2026-03-13T22:57:21.750077	8aef8872	116	29	1.0000	DISCARD	gen=134 glyphs=4
2026-03-13T22:57:22.276319	55d6c151	120	30	1.0000	DISCARD	gen=90 glyphs=4
2026-03-13T22:57:24.440383	0d765163	120	30	1.0000	DISCARD	gen=134 glyphs=4
2026-03-13T22:57:24.982934	37f4017b	116	29	1.0000	DISCARD	gen=90 glyphs=4
2026-03-13T22:57:27.129353	8aef8872	116	29	1.0000	DISCARD	gen=134 glyphs=4
2026-03-13T22:57:27.662829	ad58e1a3	116	29	1.0000	DISCARD	gen=90 glyphs=4
2026-03-13T22:57:29.808050	b7aed8e9	116	29	1.0000	DISCARD	gen=134 glyphs=4
2026-03-13T22:57:30.350852	4325af14	116	29	0.9500	DISCARD	gen=90 glyphs=4
2026-03-13T22:57:32.502702	b57e7176	120	30	1.0000	DISCARD	gen=134 glyphs=4
2026-03-13T22:57:33.031162	4c9b0dd4	120	30	1.0000	DISCARD	gen=90 glyphs=4
2026-03-13T22:57:35.181928	050862ad	120	30	1.0000	DISCARD	gen=134 glyphs=4
2026-03-13T22:57:35.715294	20fc5c3a	116	29	1.0000	DISCARD	gen=90 glyphs=4
2026-03-13T22:57:37.913048	8aef8872	116	29	1.0000	DISCARD	gen=134 glyphs=4
2026-03-13T22:57:38.463350	f96d30bb	120	30	1.0000	DISCARD	gen=90 glyphs=4
2026-03-13T22:57:40.606534	8aef8872	116	29	1.0000	DISCARD	gen=134 glyphs=4
2026-03-13T22:57:41.141367	37f4017b	116	29	1.0000	DISCARD	gen=90 glyphs=4
2026-03-13T22:57:43.288624	67cb81be	120	30	1.0000	DISCARD	gen=134 glyphs=4
2026-03-13T22:57:43.832702	37f4017b	116	29	1.0000	DISCARD	gen=91 glyphs=4
2026-03-13T22:57:45.977961	19355583	120	30	1.0000	DISCARD	gen=135 glyphs=4
2026-03-13T22:57:46.508446	bfdf7cad	120	30	1.0000	DISCARD	gen=91 glyphs=4
2026-03-13T22:57:48.657316	8aef8872	116	29	1.0000	DISCARD	gen=135 glyphs=4
2026-03-13T22:57:49.204739	d11c1062	120	30	1.0000	DISCARD	gen=91 glyphs=4
2026-03-13T22:57:51.366021	9e34ede0	116	29	1.0000	DISCARD	gen=135 glyphs=4
2026-03-13T22:57:51.892081	fdb5d108	120	30	1.0000	DISCARD	gen=91 glyphs=4
2026-03-13T22:57:54.062268	1eddcb3e	116	29	1.0000	DISCARD	gen=135 glyphs=4
2026-03-13T22:57:54.601301	37f4017b	116	29	1.0000	DISCARD	gen=91 glyphs=4
2026-03-13T22:57:56.731220	ec040848	120	30	1.0000	DISCARD	gen=135 glyphs=4
2026-03-13T22:57:57.268314	5b9807ac	120	30	1.0000	DISCARD	gen=91 glyphs=4
2026-03-13T22:57:59.427833	3888940b	120	30	1.0000	DISCARD	gen=135 glyphs=4
2026-03-13T22:57:59.955549	5a06ca32	120	30	1.0000	DISCARD	gen=91 glyphs=4
2026-03-13T22:58:02.121758	8aef8872	116	29	1.0000	DISCARD	gen=135 glyphs=4
2026-03-13T22:58:02.656786	5a06ca32	120	30	1.0000	DISCARD	gen=91 glyphs=4
2026-03-13T22:58:04.813351	bc492b2d	116	29	1.0000	DISCARD	gen=135 glyphs=4
2026-03-13T22:58:05.348326	5a06ca32	120	30	1.0000	DISCARD	gen=91 glyphs=4
2026-03-13T22:58:07.488961	7b1af61c	116	29	1.0000	DISCARD	gen=135 glyphs=4
2026-03-13T22:58:08.024801	c26e6f64	116	29	1.0000	DISCARD	gen=91 glyphs=4
2026-03-13T22:58:10.181721	1e5f0e21	116	29	1.0000	DISCARD	gen=135 glyphs=4
2026-03-13T22:58:10.719605	37f4017b	116	29	1.0000	DISCARD	gen=92 glyphs=4
2026-03-13T22:58:12.879834	19355583	120	30	1.0000	DISCARD	gen=136 glyphs=4
2026-03-13T22:58:13.428609	bfdf7cad	120	30	1.0000	DISCARD	gen=92 glyphs=4
2026-03-13T22:58:15.582885	8aef8872	116	29	1.0000	DISCARD	gen=136 glyphs=4
2026-03-13T22:58:16.128854	fdb5d108	120	30	1.0000	DISCARD	gen=92 glyphs=4
2026-03-13T22:58:18.283976	0eaedb57	116	29	1.0000	DISCARD	gen=136 glyphs=4
2026-03-13T22:58:18.807555	fdb5d108	120	30	1.0000	DISCARD	gen=92 glyphs=4
2026-03-13T22:58:20.956050	3371f7cf	116	29	1.0000	DISCARD	gen=136 glyphs=4
2026-03-13T22:58:21.486399	fdb5d108	120	30	1.0000	DISCARD	gen=92 glyphs=4
2026-03-13T22:58:23.653095	0eaedb57	116	29	1.0000	DISCARD	gen=136 glyphs=4
2026-03-13T22:58:24.186347	55d6c151	120	30	1.0000	DISCARD	gen=92 glyphs=4
2026-03-13T22:58:26.331098	5feee4d2	120	30	1.0000	DISCARD	gen=136 glyphs=4
2026-03-13T22:58:26.854972	fdb5d108	120	30	1.0000	DISCARD	gen=92 glyphs=4
2026-03-13T22:58:28.987255	9e34ede0	116	29	1.0000	DISCARD	gen=136 glyphs=4
2026-03-13T22:58:29.518905	bfdf7cad	120	30	1.0000	DISCARD	gen=92 glyphs=4
2026-03-13T22:58:31.682375	cf4332f6	116	29	1.0000	DISCARD	gen=136 glyphs=4
2026-03-13T22:58:32.215923	37f4017b	116	29	1.0000	DISCARD	gen=92 glyphs=4
2026-03-13T22:58:34.404853	67cb81be	120	30	1.0000	DISCARD	gen=136 glyphs=4
2026-03-13T22:58:34.926438	5a06ca32	120	30	1.0000	DISCARD	gen=92 glyphs=4
2026-03-13T22:58:37.079401	50dc991d	116	29	1.0000	DISCARD	gen=136 glyphs=4
2026-03-13T22:58:37.622199	37f4017b	116	29	1.0000	DISCARD	gen=93 glyphs=4
2026-03-13T22:58:39.747806	19355583	120	30	1.0000	DISCARD	gen=137 glyphs=4
2026-03-13T22:58:40.286539	bfdf7cad	120	30	1.0000	DISCARD	gen=93 glyphs=4
2026-03-13T22:58:42.541688	8aef8872	116	29	1.0000	DISCARD	gen=137 glyphs=4
2026-03-13T22:58:43.071790	fdb5d108	120	30	1.0000	DISCARD	gen=93 glyphs=4
2026-03-13T22:58:45.231166	a92304c6	116	29	1.0000	DISCARD	gen=137 glyphs=4
2026-03-13T22:58:45.776961	5a06ca32	120	30	1.0000	DISCARD	gen=93 glyphs=4
2026-03-13T22:58:47.922590	d7c8681b	120	30	1.0000	DISCARD	gen=137 glyphs=4
2026-03-13T22:58:48.478892	37f4017b	116	29	1.0000	DISCARD	gen=93 glyphs=4
2026-03-13T22:58:50.631239	eca7ab6c	116	29	1.0000	DISCARD	gen=137 glyphs=4
2026-03-13T22:58:51.177801	fdb5d108	120	30	1.0000	DISCARD	gen=93 glyphs=4
2026-03-13T22:58:53.326863	050862ad	120	30	1.0000	DISCARD	gen=137 glyphs=4
2026-03-13T22:58:53.858888	37f4017b	116	29	1.0000	DISCARD	gen=93 glyphs=4
2026-03-13T22:58:56.018350	0eaedb57	116	29	1.0000	DISCARD	gen=137 glyphs=4
2026-03-13T22:58:56.567188	55d6c151	120	30	1.0000	DISCARD	gen=93 glyphs=4
2026-03-13T22:58:58.714656	8aef8872	116	29	1.0000	DISCARD	gen=137 glyphs=4
2026-03-13T22:58:59.244422	37f4017b	116	29	1.0000	DISCARD	gen=93 glyphs=4
2026-03-13T22:59:01.383886	a78f9454	120	30	1.0000	DISCARD	gen=137 glyphs=4
2026-03-13T22:59:01.936652	bfdf7cad	120	30	1.0000	DISCARD	gen=93 glyphs=4
2026-03-13T22:59:04.114306	e85f008d	116	29	1.0000	DISCARD	gen=137 glyphs=4
2026-03-13T22:59:04.638436	37f4017b	116	29	1.0000	DISCARD	gen=94 glyphs=4
2026-03-13T22:59:06.799667	19355583	120	30	1.0000	DISCARD	gen=138 glyphs=4
2026-03-13T22:59:07.338503	bfdf7cad	120	30	1.0000	DISCARD	gen=94 glyphs=4
2026-03-13T22:59:09.480401	8aef8872	116	29	1.0000	DISCARD	gen=138 glyphs=4
2026-03-13T22:59:10.014697	37f4017b	116	29	1.0000	DISCARD	gen=94 glyphs=4
2026-03-13T22:59:12.197388	a75686cf	120	30	1.0000	DISCARD	gen=138 glyphs=4
2026-03-13T22:59:12.789147	29127ee8	120	30	1.0000	DISCARD	gen=94 glyphs=4
2026-03-13T22:59:14.985825	050862ad	120	30	1.0000	DISCARD	gen=138 glyphs=4
2026-03-13T22:59:15.533876	1d34459a	116	29	1.0000	DISCARD	gen=94 glyphs=4
2026-03-13T22:59:17.696020	b7aed8e9	116	29	1.0000	DISCARD	gen=138 glyphs=4
2026-03-13T22:59:18.235570	55d6c151	120	30	1.0000	DISCARD	gen=94 glyphs=4
2026-03-13T22:59:20.364876	19355583	120	30	1.0000	DISCARD	gen=138 glyphs=4
2026-03-13T22:59:20.899638	37f4017b	116	29	1.0000	DISCARD	gen=94 glyphs=4
2026-03-13T22:59:23.055504	c138feb8	116	29	1.0000	DISCARD	gen=138 glyphs=4
2026-03-13T22:59:23.583310	3107b347	120	30	1.0000	DISCARD	gen=94 glyphs=4
2026-03-13T22:59:25.722201	26a2ff06	116	29	1.0000	DISCARD	gen=138 glyphs=4
2026-03-13T22:59:26.255932	2701cb73	116	29	1.0000	DISCARD	gen=94 glyphs=4
2026-03-13T22:59:28.414869	b7aed8e9	116	29	1.0000	DISCARD	gen=138 glyphs=4
2026-03-13T22:59:28.949289	5a06ca32	120	30	1.0000	DISCARD	gen=94 glyphs=4
2026-03-13T22:59:31.089279	1e5f0e21	116	29	1.0000	DISCARD	gen=138 glyphs=4
2026-03-13T22:59:31.615279	37f4017b	116	29	1.0000	DISCARD	gen=95 glyphs=4
2026-03-13T22:59:33.772300	19355583	120	30	1.0000	DISCARD	gen=139 glyphs=4
2026-03-13T22:59:34.312702	bfdf7cad	120	30	1.0000	DISCARD	gen=95 glyphs=4
2026-03-13T22:59:36.504146	8aef8872	116	29	1.0000	DISCARD	gen=139 glyphs=4
2026-03-13T22:59:37.038376	bfdf7cad	120	30	1.0000	DISCARD	gen=95 glyphs=4
2026-03-13T22:59:39.191285	8aef8872	116	29	1.0000	DISCARD	gen=139 glyphs=4
2026-03-13T22:59:39.725343	ef203770	116	29	1.0000	DISCARD	gen=95 glyphs=4
2026-03-13T22:59:41.902488	050862ad	120	30	1.0000	DISCARD	gen=139 glyphs=4
2026-03-13T22:59:42.432990	1d34459a	116	29	1.0000	DISCARD	gen=95 glyphs=4
2026-03-13T22:59:44.633394	19355583	120	30	1.0000	DISCARD	gen=139 glyphs=4
2026-03-13T22:59:45.185589	5a06ca32	120	30	1.0000	DISCARD	gen=95 glyphs=4
2026-03-13T22:59:47.334956	19355583	120	30	1.0000	DISCARD	gen=139 glyphs=4
2026-03-13T22:59:47.868446	37f4017b	116	29	1.0000	DISCARD	gen=95 glyphs=4
2026-03-13T22:59:50.027632	9e34ede0	116	29	1.0000	DISCARD	gen=139 glyphs=4
2026-03-13T22:59:50.562098	26da1d8c	116	29	1.0000	DISCARD	gen=95 glyphs=4
2026-03-13T22:59:52.706402	e8c7f6cf	120	30	1.0000	DISCARD	gen=139 glyphs=4
2026-03-13T22:59:53.232012	2701cb73	116	29	1.0000	DISCARD	gen=95 glyphs=4
2026-03-13T22:59:55.386217	b7aed8e9	116	29	1.0000	DISCARD	gen=139 glyphs=4
2026-03-13T22:59:55.915162	55d6c151	120	30	1.0000	DISCARD	gen=95 glyphs=4
2026-03-13T22:59:58.087312	eca7ab6c	116	29	1.0000	DISCARD	gen=139 glyphs=4
2026-03-13T22:59:58.620397	37f4017b	116	29	1.0000	DISCARD	gen=96 glyphs=4
2026-03-13T23:00:00.759044	19355583	120	30	1.0000	DISCARD	gen=140 glyphs=4
2026-03-13T23:00:01.307193	bfdf7cad	120	30	1.0000	DISCARD	gen=96 glyphs=4
2026-03-13T23:00:03.475286	8aef8872	116	29	1.0000	DISCARD	gen=140 glyphs=4
2026-03-13T23:00:04.008947	7ca87b42	116	29	1.0000	DISCARD	gen=96 glyphs=4
