timestamp	program_hash	spirv_size	word_count	fitness	status	description
2026-03-14T07:36:45.917174	70b3d4bd	0	0	0.0000	CRASH	gen=920 glyphs=4
2026-03-14T07:36:45.917366	3ca14993	0	0	0.0000	CRASH	gen=920 glyphs=4
2026-03-14T07:36:45.917563	099964a4	0	0	0.0000	CRASH	gen=920 glyphs=4
2026-03-14T07:36:45.917837	099964a4	0	0	0.0000	CRASH	gen=921 glyphs=4
2026-03-14T07:36:45.918031	099964a4	0	0	0.0000	CRASH	gen=921 glyphs=4
2026-03-14T07:36:45.918221	099964a4	0	0	0.0000	CRASH	gen=921 glyphs=4
2026-03-14T07:36:45.918411	099964a4	0	0	0.0000	CRASH	gen=921 glyphs=4
2026-03-14T07:36:45.918607	099964a4	0	0	0.0000	CRASH	gen=921 glyphs=4
2026-03-14T07:36:45.918798	099964a4	0	0	0.0000	CRASH	gen=921 glyphs=4
2026-03-14T07:36:45.918989	099964a4	0	0	0.0000	CRASH	gen=921 glyphs=4
2026-03-14T07:36:45.919178	099964a4	0	0	0.0000	CRASH	gen=921 glyphs=4
2026-03-14T07:36:45.919369	ff30496a	0	0	0.0000	CRASH	gen=921 glyphs=3
2026-03-14T07:36:45.919571	7ede4765	0	0	0.0000	CRASH	gen=921 glyphs=2
2026-03-14T07:36:45.919854	099964a4	0	0	0.0000	CRASH	gen=922 glyphs=4
2026-03-14T07:36:45.920049	099964a4	0	0	0.0000	CRASH	gen=922 glyphs=4
2026-03-14T07:36:45.920244	099964a4	0	0	0.0000	CRASH	gen=922 glyphs=4
2026-03-14T07:36:45.920436	3a734398	0	0	0.0000	CRASH	gen=922 glyphs=4
2026-03-14T07:36:45.920637	09af1c49	0	0	0.0000	CRASH	gen=922 glyphs=4
2026-03-14T07:36:45.920829	42bdd6db	0	0	0.0000	CRASH	gen=922 glyphs=3
2026-03-14T07:36:45.921024	099964a4	0	0	0.0000	CRASH	gen=922 glyphs=4
2026-03-14T07:36:45.921219	5c990d65	0	0	0.0000	CRASH	gen=922 glyphs=3
2026-03-14T07:36:45.921415	d31fad74	0	0	0.0000	CRASH	gen=922 glyphs=4
2026-03-14T07:36:45.921617	099964a4	0	0	0.0000	CRASH	gen=922 glyphs=4
2026-03-14T07:36:45.921892	099964a4	0	0	0.0000	CRASH	gen=923 glyphs=4
2026-03-14T07:36:45.922086	099964a4	0	0	0.0000	CRASH	gen=923 glyphs=4
2026-03-14T07:36:45.922281	099964a4	0	0	0.0000	CRASH	gen=923 glyphs=4
2026-03-14T07:36:45.922473	037b6c07	0	0	0.0000	CRASH	gen=923 glyphs=3
2026-03-14T07:36:45.922675	099964a4	0	0	0.0000	CRASH	gen=923 glyphs=4
2026-03-14T07:36:45.922871	099964a4	0	0	0.0000	CRASH	gen=923 glyphs=4
2026-03-14T07:36:45.923064	f6e442ca	0	0	0.0000	CRASH	gen=923 glyphs=2
2026-03-14T07:36:45.923257	3a734398	0	0	0.0000	CRASH	gen=923 glyphs=4
2026-03-14T07:36:45.923454	9e1038e6	0	0	0.0000	CRASH	gen=923 glyphs=4
2026-03-14T07:36:45.923652	80cef82b	0	0	0.0000	CRASH	gen=923 glyphs=4
2026-03-14T07:36:45.923926	099964a4	0	0	0.0000	CRASH	gen=924 glyphs=4
2026-03-14T07:36:45.924121	099964a4	0	0	0.0000	CRASH	gen=924 glyphs=4
2026-03-14T07:36:45.924318	b780c867	0	0	0.0000	CRASH	gen=924 glyphs=4
2026-03-14T07:36:45.924513	80cef82b	0	0	0.0000	CRASH	gen=924 glyphs=4
2026-03-14T07:36:45.924712	099964a4	0	0	0.0000	CRASH	gen=924 glyphs=4
2026-03-14T07:36:45.924910	099964a4	0	0	0.0000	CRASH	gen=924 glyphs=4
2026-03-14T07:36:45.925102	099964a4	0	0	0.0000	CRASH	gen=924 glyphs=4
2026-03-14T07:36:45.925295	099964a4	0	0	0.0000	CRASH	gen=924 glyphs=4
2026-03-14T07:36:45.925490	099964a4	0	0	0.0000	CRASH	gen=924 glyphs=4
2026-03-14T07:36:45.925687	099964a4	0	0	0.0000	CRASH	gen=924 glyphs=4
2026-03-14T07:36:45.925959	099964a4	0	0	0.0000	CRASH	gen=925 glyphs=4
2026-03-14T07:36:45.926157	099964a4	0	0	0.0000	CRASH	gen=925 glyphs=4
2026-03-14T07:36:45.926349	099964a4	0	0	0.0000	CRASH	gen=925 glyphs=4
2026-03-14T07:36:45.926545	80cef82b	0	0	0.0000	CRASH	gen=925 glyphs=4
2026-03-14T07:36:45.926740	09ef51f5	0	0	0.0000	CRASH	gen=925 glyphs=3
2026-03-14T07:36:45.926940	099964a4	0	0	0.0000	CRASH	gen=925 glyphs=4
2026-03-14T07:36:45.927132	099964a4	0	0	0.0000	CRASH	gen=925 glyphs=4
2026-03-14T07:36:45.927324	3ca14993	0	0	0.0000	CRASH	gen=925 glyphs=4
2026-03-14T07:36:45.927522	80cef82b	0	0	0.0000	CRASH	gen=925 glyphs=4
2026-03-14T07:36:45.927717	dcb1fb50	0	0	0.0000	CRASH	gen=925 glyphs=4
2026-03-14T07:36:45.927998	099964a4	0	0	0.0000	CRASH	gen=926 glyphs=4
2026-03-14T07:36:45.928203	099964a4	0	0	0.0000	CRASH	gen=926 glyphs=4
2026-03-14T07:36:45.928399	80cef82b	0	0	0.0000	CRASH	gen=926 glyphs=4
2026-03-14T07:36:45.928599	e7ce622e	0	0	0.0000	CRASH	gen=926 glyphs=4
2026-03-14T07:36:45.928795	099964a4	0	0	0.0000	CRASH	gen=926 glyphs=4
2026-03-14T07:36:45.928992	dcb1fb50	0	0	0.0000	CRASH	gen=926 glyphs=4
2026-03-14T07:36:45.929188	099964a4	0	0	0.0000	CRASH	gen=926 glyphs=4
2026-03-14T07:36:45.929381	98796cd4	0	0	0.0000	CRASH	gen=926 glyphs=3
2026-03-14T07:36:45.929585	3ca14993	0	0	0.0000	CRASH	gen=926 glyphs=4
2026-03-14T07:36:45.929782	ed40e3fa	0	0	0.0000	CRASH	gen=926 glyphs=4
2026-03-14T07:36:45.930065	099964a4	0	0	0.0000	CRASH	gen=927 glyphs=4
2026-03-14T07:36:45.930261	099964a4	0	0	0.0000	CRASH	gen=927 glyphs=4
2026-03-14T07:36:45.930457	099964a4	0	0	0.0000	CRASH	gen=927 glyphs=4
2026-03-14T07:36:45.930654	099964a4	0	0	0.0000	CRASH	gen=927 glyphs=4
2026-03-14T07:36:45.930846	d64ac78e	0	0	0.0000	CRASH	gen=927 glyphs=2
2026-03-14T07:36:45.931039	099964a4	0	0	0.0000	CRASH	gen=927 glyphs=4
2026-03-14T07:36:45.931235	099964a4	0	0	0.0000	CRASH	gen=927 glyphs=4
2026-03-14T07:36:45.931426	80cef82b	0	0	0.0000	CRASH	gen=927 glyphs=4
2026-03-14T07:36:45.931625	099964a4	0	0	0.0000	CRASH	gen=927 glyphs=4
2026-03-14T07:36:45.931821	099964a4	0	0	0.0000	CRASH	gen=927 glyphs=4
2026-03-14T07:36:45.932094	099964a4	0	0	0.0000	CRASH	gen=928 glyphs=4
2026-03-14T07:36:45.932295	099964a4	0	0	0.0000	CRASH	gen=928 glyphs=4
2026-03-14T07:36:45.932496	4e50a35e	0	0	0.0000	CRASH	gen=928 glyphs=3
2026-03-14T07:36:45.932698	e262f8d6	0	0	0.0000	CRASH	gen=928 glyphs=5
2026-03-14T07:36:45.932896	cf93b656	0	0	0.0000	CRASH	gen=928 glyphs=3
2026-03-14T07:36:45.933092	099964a4	0	0	0.0000	CRASH	gen=928 glyphs=4
2026-03-14T07:36:45.933292	3ca14993	0	0	0.0000	CRASH	gen=928 glyphs=4
2026-03-14T07:36:45.933489	099964a4	0	0	0.0000	CRASH	gen=928 glyphs=4
2026-03-14T07:36:45.933690	099964a4	0	0	0.0000	CRASH	gen=928 glyphs=4
2026-03-14T07:36:45.933887	082d9e19	0	0	0.0000	CRASH	gen=928 glyphs=4
2026-03-14T07:36:45.934170	099964a4	0	0	0.0000	CRASH	gen=929 glyphs=4
2026-03-14T07:36:45.934370	099964a4	0	0	0.0000	CRASH	gen=929 glyphs=4
2026-03-14T07:36:45.934572	099964a4	0	0	0.0000	CRASH	gen=929 glyphs=4
2026-03-14T07:36:45.934765	099964a4	0	0	0.0000	CRASH	gen=929 glyphs=4
2026-03-14T07:36:45.934961	099964a4	0	0	0.0000	CRASH	gen=929 glyphs=4
2026-03-14T07:36:45.935154	ff30496a	0	0	0.0000	CRASH	gen=929 glyphs=3
2026-03-14T07:36:45.935353	099964a4	0	0	0.0000	CRASH	gen=929 glyphs=4
2026-03-14T07:36:45.935548	3ca14993	0	0	0.0000	CRASH	gen=929 glyphs=4
2026-03-14T07:36:45.935743	5497d3a9	0	0	0.0000	CRASH	gen=929 glyphs=5
2026-03-14T07:36:45.935937	099964a4	0	0	0.0000	CRASH	gen=929 glyphs=4
2026-03-14T07:36:45.936213	099964a4	0	0	0.0000	CRASH	gen=930 glyphs=4
2026-03-14T07:36:45.936413	099964a4	0	0	0.0000	CRASH	gen=930 glyphs=4
2026-03-14T07:36:45.936612	099964a4	0	0	0.0000	CRASH	gen=930 glyphs=4
2026-03-14T07:36:45.936804	099964a4	0	0	0.0000	CRASH	gen=930 glyphs=4
2026-03-14T07:36:45.936999	055767ba	0	0	0.0000	CRASH	gen=930 glyphs=4
2026-03-14T07:36:45.937193	3a734398	0	0	0.0000	CRASH	gen=930 glyphs=4
2026-03-14T07:36:45.937391	443d8e6b	0	0	0.0000	CRASH	gen=930 glyphs=4
2026-03-14T07:36:45.937591	099964a4	0	0	0.0000	CRASH	gen=930 glyphs=4
2026-03-14T07:36:45.937788	c707a252	0	0	0.0000	CRASH	gen=930 glyphs=3
2026-03-14T07:36:45.937982	cf93b656	0	0	0.0000	CRASH	gen=930 glyphs=3
2026-03-14T07:36:45.938263	099964a4	0	0	0.0000	CRASH	gen=931 glyphs=4
2026-03-14T07:36:45.938464	099964a4	0	0	0.0000	CRASH	gen=931 glyphs=4
2026-03-14T07:36:45.938662	dcb1fb50	0	0	0.0000	CRASH	gen=931 glyphs=4
2026-03-14T07:36:45.938859	01230976	0	0	0.0000	CRASH	gen=931 glyphs=5
2026-03-14T07:36:45.939055	099964a4	0	0	0.0000	CRASH	gen=931 glyphs=4
2026-03-14T07:36:45.939249	21491600	0	0	0.0000	CRASH	gen=931 glyphs=4
2026-03-14T07:36:45.939441	099964a4	0	0	0.0000	CRASH	gen=931 glyphs=4
2026-03-14T07:36:45.939637	5e23de66	0	0	0.0000	CRASH	gen=931 glyphs=4
2026-03-14T07:36:45.939834	099964a4	0	0	0.0000	CRASH	gen=931 glyphs=4
2026-03-14T07:36:45.940025	099964a4	0	0	0.0000	CRASH	gen=931 glyphs=4
2026-03-14T07:36:45.940296	099964a4	0	0	0.0000	CRASH	gen=932 glyphs=4
2026-03-14T07:36:45.940492	099964a4	0	0	0.0000	CRASH	gen=932 glyphs=4
2026-03-14T07:36:45.940697	099964a4	0	0	0.0000	CRASH	gen=932 glyphs=4
2026-03-14T07:36:45.940892	21fc88b4	0	0	0.0000	CRASH	gen=932 glyphs=4
2026-03-14T07:36:45.941088	099964a4	0	0	0.0000	CRASH	gen=932 glyphs=4
2026-03-14T07:36:45.941282	80cef82b	0	0	0.0000	CRASH	gen=932 glyphs=4
2026-03-14T07:36:45.941475	099964a4	0	0	0.0000	CRASH	gen=932 glyphs=4
2026-03-14T07:36:45.941673	099964a4	0	0	0.0000	CRASH	gen=932 glyphs=4
2026-03-14T07:36:45.941866	099964a4	0	0	0.0000	CRASH	gen=932 glyphs=4
2026-03-14T07:36:45.942054	099964a4	0	0	0.0000	CRASH	gen=932 glyphs=4
2026-03-14T07:36:45.942322	099964a4	0	0	0.0000	CRASH	gen=933 glyphs=4
2026-03-14T07:36:45.942514	099964a4	0	0	0.0000	CRASH	gen=933 glyphs=4
2026-03-14T07:36:45.942717	099964a4	0	0	0.0000	CRASH	gen=933 glyphs=4
2026-03-14T07:36:45.942907	099964a4	0	0	0.0000	CRASH	gen=933 glyphs=4
2026-03-14T07:36:45.943099	d7ec5934	0	0	0.0000	CRASH	gen=933 glyphs=4
2026-03-14T07:36:45.943291	099964a4	0	0	0.0000	CRASH	gen=933 glyphs=4
2026-03-14T07:36:45.943483	099964a4	0	0	0.0000	CRASH	gen=933 glyphs=4
2026-03-14T07:36:45.943681	cf93b656	0	0	0.0000	CRASH	gen=933 glyphs=3
2026-03-14T07:36:45.943876	099964a4	0	0	0.0000	CRASH	gen=933 glyphs=4
2026-03-14T07:36:45.944069	a51db0d2	0	0	0.0000	CRASH	gen=933 glyphs=3
2026-03-14T07:36:45.944346	099964a4	0	0	0.0000	CRASH	gen=934 glyphs=4
2026-03-14T07:36:45.944544	099964a4	0	0	0.0000	CRASH	gen=934 glyphs=4
2026-03-14T07:36:45.944737	27aa020f	0	0	0.0000	CRASH	gen=934 glyphs=3
2026-03-14T07:36:45.944933	099964a4	0	0	0.0000	CRASH	gen=934 glyphs=4
2026-03-14T07:36:45.945124	099964a4	0	0	0.0000	CRASH	gen=934 glyphs=4
2026-03-14T07:36:45.945316	73ecd0f2	0	0	0.0000	CRASH	gen=934 glyphs=4
2026-03-14T07:36:45.945509	f4cced17	0	0	0.0000	CRASH	gen=934 glyphs=4
2026-03-14T07:36:45.945707	099964a4	0	0	0.0000	CRASH	gen=934 glyphs=4
2026-03-14T07:36:45.945905	099964a4	0	0	0.0000	CRASH	gen=934 glyphs=4
2026-03-14T07:36:45.946095	099964a4	0	0	0.0000	CRASH	gen=934 glyphs=4
2026-03-14T07:36:45.946359	099964a4	0	0	0.0000	CRASH	gen=935 glyphs=4
2026-03-14T07:36:45.946564	099964a4	0	0	0.0000	CRASH	gen=935 glyphs=4
2026-03-14T07:36:45.946759	577e71b5	0	0	0.0000	CRASH	gen=935 glyphs=4
2026-03-14T07:36:45.946958	099964a4	0	0	0.0000	CRASH	gen=935 glyphs=4
2026-03-14T07:36:45.947154	099964a4	0	0	0.0000	CRASH	gen=935 glyphs=4
2026-03-14T07:36:45.947344	0e73b472	0	0	0.0000	CRASH	gen=935 glyphs=4
2026-03-14T07:36:45.947540	9e3034bb	0	0	0.0000	CRASH	gen=935 glyphs=3
2026-03-14T07:36:45.947735	099964a4	0	0	0.0000	CRASH	gen=935 glyphs=4
2026-03-14T07:36:45.947929	3a734398	0	0	0.0000	CRASH	gen=935 glyphs=4
2026-03-14T07:36:45.948125	099964a4	0	0	0.0000	CRASH	gen=935 glyphs=4
2026-03-14T07:36:45.948403	099964a4	0	0	0.0000	CRASH	gen=936 glyphs=4
2026-03-14T07:36:45.948601	099964a4	0	0	0.0000	CRASH	gen=936 glyphs=4
2026-03-14T07:36:45.948796	099964a4	0	0	0.0000	CRASH	gen=936 glyphs=4
2026-03-14T07:36:45.948990	099964a4	0	0	0.0000	CRASH	gen=936 glyphs=4
2026-03-14T07:36:45.949187	3ca14993	0	0	0.0000	CRASH	gen=936 glyphs=4
2026-03-14T07:36:45.949381	099964a4	0	0	0.0000	CRASH	gen=936 glyphs=4
2026-03-14T07:36:45.949576	bbc0549b	0	0	0.0000	CRASH	gen=936 glyphs=3
2026-03-14T07:36:45.949770	957a7534	0	0	0.0000	CRASH	gen=936 glyphs=3
2026-03-14T07:36:45.949963	099964a4	0	0	0.0000	CRASH	gen=936 glyphs=4
2026-03-14T07:36:45.950158	099964a4	0	0	0.0000	CRASH	gen=936 glyphs=4
2026-03-14T07:36:45.950428	099964a4	0	0	0.0000	CRASH	gen=937 glyphs=4
2026-03-14T07:36:45.950623	099964a4	0	0	0.0000	CRASH	gen=937 glyphs=4
2026-03-14T07:36:45.950816	dcb1fb50	0	0	0.0000	CRASH	gen=937 glyphs=4
2026-03-14T07:36:45.951011	fb6a1df9	0	0	0.0000	CRASH	gen=937 glyphs=4
2026-03-14T07:36:45.951208	099964a4	0	0	0.0000	CRASH	gen=937 glyphs=4
2026-03-14T07:36:45.951400	dcb1fb50	0	0	0.0000	CRASH	gen=937 glyphs=4
2026-03-14T07:36:45.951596	099964a4	0	0	0.0000	CRASH	gen=937 glyphs=4
2026-03-14T07:36:45.951791	099964a4	0	0	0.0000	CRASH	gen=937 glyphs=4
2026-03-14T07:36:45.951986	099964a4	0	0	0.0000	CRASH	gen=937 glyphs=4
2026-03-14T07:36:45.952176	099964a4	0	0	0.0000	CRASH	gen=937 glyphs=4
2026-03-14T07:36:45.952451	099964a4	0	0	0.0000	CRASH	gen=938 glyphs=4
2026-03-14T07:36:45.952648	099964a4	0	0	0.0000	CRASH	gen=938 glyphs=4
2026-03-14T07:36:45.952841	f5fe5c1d	0	0	0.0000	CRASH	gen=938 glyphs=4
2026-03-14T07:36:45.953036	dcb1fb50	0	0	0.0000	CRASH	gen=938 glyphs=4
2026-03-14T07:36:45.953231	cac70705	0	0	0.0000	CRASH	gen=938 glyphs=4
2026-03-14T07:36:45.953430	3a734398	0	0	0.0000	CRASH	gen=938 glyphs=4
2026-03-14T07:36:45.953626	cf93b656	0	0	0.0000	CRASH	gen=938 glyphs=3
2026-03-14T07:36:45.953819	099964a4	0	0	0.0000	CRASH	gen=938 glyphs=4
2026-03-14T07:36:45.954018	099964a4	0	0	0.0000	CRASH	gen=938 glyphs=4
2026-03-14T07:36:45.954215	099964a4	0	0	0.0000	CRASH	gen=938 glyphs=4
2026-03-14T07:36:45.954485	099964a4	0	0	0.0000	CRASH	gen=939 glyphs=4
2026-03-14T07:36:45.954681	099964a4	0	0	0.0000	CRASH	gen=939 glyphs=4
2026-03-14T07:36:45.954875	7ede4765	0	0	0.0000	CRASH	gen=939 glyphs=2
2026-03-14T07:36:45.955065	98ca4405	0	0	0.0000	CRASH	gen=939 glyphs=3
2026-03-14T07:36:45.955260	099964a4	0	0	0.0000	CRASH	gen=939 glyphs=4
2026-03-14T07:36:45.955455	7ede4765	0	0	0.0000	CRASH	gen=939 glyphs=2
2026-03-14T07:36:45.955649	099964a4	0	0	0.0000	CRASH	gen=939 glyphs=4
2026-03-14T07:36:45.955839	099964a4	0	0	0.0000	CRASH	gen=939 glyphs=4
2026-03-14T07:36:45.956036	099964a4	0	0	0.0000	CRASH	gen=939 glyphs=4
2026-03-14T07:36:45.956230	dcb1fb50	0	0	0.0000	CRASH	gen=939 glyphs=4
2026-03-14T07:36:45.956507	099964a4	0	0	0.0000	CRASH	gen=940 glyphs=4
2026-03-14T07:36:45.956705	099964a4	0	0	0.0000	CRASH	gen=940 glyphs=4
2026-03-14T07:36:45.956899	de8b53cb	0	0	0.0000	CRASH	gen=940 glyphs=4
2026-03-14T07:36:45.957096	099964a4	0	0	0.0000	CRASH	gen=940 glyphs=4
2026-03-14T07:36:45.957288	099964a4	0	0	0.0000	CRASH	gen=940 glyphs=4
2026-03-14T07:36:45.957481	099964a4	0	0	0.0000	CRASH	gen=940 glyphs=4
2026-03-14T07:36:45.957678	099964a4	0	0	0.0000	CRASH	gen=940 glyphs=4
2026-03-14T07:36:45.957872	099964a4	0	0	0.0000	CRASH	gen=940 glyphs=4
2026-03-14T07:36:45.958066	099964a4	0	0	0.0000	CRASH	gen=940 glyphs=4
2026-03-14T07:36:45.958258	099964a4	0	0	0.0000	CRASH	gen=940 glyphs=4
2026-03-14T07:36:45.958555	099964a4	0	0	0.0000	CRASH	gen=941 glyphs=4
2026-03-14T07:36:45.958752	099964a4	0	0	0.0000	CRASH	gen=941 glyphs=4
2026-03-14T07:36:45.958947	2382f246	0	0	0.0000	CRASH	gen=941 glyphs=4
2026-03-14T07:36:45.959142	8e7a3cbe	0	0	0.0000	CRASH	gen=941 glyphs=4
2026-03-14T07:36:45.959341	099964a4	0	0	0.0000	CRASH	gen=941 glyphs=4
2026-03-14T07:36:45.959557	58a91386	0	0	0.0000	CRASH	gen=941 glyphs=4
2026-03-14T07:36:45.959769	80cef82b	0	0	0.0000	CRASH	gen=941 glyphs=4
2026-03-14T07:36:45.959963	f342b28a	0	0	0.0000	CRASH	gen=941 glyphs=4
2026-03-14T07:36:45.960167	9b390d7c	0	0	0.0000	CRASH	gen=941 glyphs=3
2026-03-14T07:36:45.960361	099964a4	0	0	0.0000	CRASH	gen=941 glyphs=4
2026-03-14T07:36:45.960650	099964a4	0	0	0.0000	CRASH	gen=942 glyphs=4
2026-03-14T07:36:45.960847	099964a4	0	0	0.0000	CRASH	gen=942 glyphs=4
2026-03-14T07:36:45.961040	099964a4	0	0	0.0000	CRASH	gen=942 glyphs=4
2026-03-14T07:36:45.961231	099964a4	0	0	0.0000	CRASH	gen=942 glyphs=4
2026-03-14T07:36:45.961422	7ede4765	0	0	0.0000	CRASH	gen=942 glyphs=2
2026-03-14T07:36:45.961615	0ed83243	0	0	0.0000	CRASH	gen=942 glyphs=4
2026-03-14T07:36:45.961814	d71fa2d4	0	0	0.0000	CRASH	gen=942 glyphs=3
2026-03-14T07:36:45.962006	099964a4	0	0	0.0000	CRASH	gen=942 glyphs=4
2026-03-14T07:36:45.962200	fbbccc72	0	0	0.0000	CRASH	gen=942 glyphs=5
2026-03-14T07:36:45.962394	099964a4	0	0	0.0000	CRASH	gen=942 glyphs=4
2026-03-14T07:36:45.962668	099964a4	0	0	0.0000	CRASH	gen=943 glyphs=4
2026-03-14T07:36:45.962866	099964a4	0	0	0.0000	CRASH	gen=943 glyphs=4
2026-03-14T07:36:45.963061	9982be7b	0	0	0.0000	CRASH	gen=943 glyphs=3
2026-03-14T07:36:45.963254	7ede4765	0	0	0.0000	CRASH	gen=943 glyphs=2
2026-03-14T07:36:45.963446	cf93b656	0	0	0.0000	CRASH	gen=943 glyphs=3
2026-03-14T07:36:45.963640	dcb1fb50	0	0	0.0000	CRASH	gen=943 glyphs=4
2026-03-14T07:36:45.963834	60c0abf5	0	0	0.0000	CRASH	gen=943 glyphs=2
2026-03-14T07:36:45.964030	8e937f99	0	0	0.0000	CRASH	gen=943 glyphs=4
2026-03-14T07:36:45.964226	099964a4	0	0	0.0000	CRASH	gen=943 glyphs=4
2026-03-14T07:36:45.964418	099964a4	0	0	0.0000	CRASH	gen=943 glyphs=4
2026-03-14T07:36:45.964690	099964a4	0	0	0.0000	CRASH	gen=944 glyphs=4
2026-03-14T07:36:45.964883	099964a4	0	0	0.0000	CRASH	gen=944 glyphs=4
2026-03-14T07:36:45.965077	099964a4	0	0	0.0000	CRASH	gen=944 glyphs=4
2026-03-14T07:36:45.965268	25e996fa	0	0	0.0000	CRASH	gen=944 glyphs=4
2026-03-14T07:36:45.965458	1ca05222	0	0	0.0000	CRASH	gen=944 glyphs=4
2026-03-14T07:36:45.965651	cf93b656	0	0	0.0000	CRASH	gen=944 glyphs=3
2026-03-14T07:36:45.965840	099964a4	0	0	0.0000	CRASH	gen=944 glyphs=4
2026-03-14T07:36:45.966034	2dab65b3	0	0	0.0000	CRASH	gen=944 glyphs=4
2026-03-14T07:36:45.966225	dcb1fb50	0	0	0.0000	CRASH	gen=944 glyphs=4
2026-03-14T07:36:45.966415	66efbc64	0	0	0.0000	CRASH	gen=944 glyphs=3
2026-03-14T07:36:45.966686	099964a4	0	0	0.0000	CRASH	gen=945 glyphs=4
2026-03-14T07:36:45.966881	099964a4	0	0	0.0000	CRASH	gen=945 glyphs=4
2026-03-14T07:36:45.967080	b7808c70	0	0	0.0000	CRASH	gen=945 glyphs=1
2026-03-14T07:36:45.967272	099964a4	0	0	0.0000	CRASH	gen=945 glyphs=4
2026-03-14T07:36:45.967466	3de7cb0c	0	0	0.0000	CRASH	gen=945 glyphs=3
2026-03-14T07:36:45.967663	099964a4	0	0	0.0000	CRASH	gen=945 glyphs=4
2026-03-14T07:36:45.967858	d20d38a6	0	0	0.0000	CRASH	gen=945 glyphs=3
2026-03-14T07:36:45.968052	099964a4	0	0	0.0000	CRASH	gen=945 glyphs=4
2026-03-14T07:36:45.968250	099964a4	0	0	0.0000	CRASH	gen=945 glyphs=4
2026-03-14T07:36:45.968440	3418e19e	0	0	0.0000	CRASH	gen=945 glyphs=4
2026-03-14T07:36:45.968720	099964a4	0	0	0.0000	CRASH	gen=946 glyphs=4
2026-03-14T07:36:45.968914	099964a4	0	0	0.0000	CRASH	gen=946 glyphs=4
2026-03-14T07:36:45.969109	099964a4	0	0	0.0000	CRASH	gen=946 glyphs=4
2026-03-14T07:36:45.969307	099964a4	0	0	0.0000	CRASH	gen=946 glyphs=4
2026-03-14T07:36:45.969499	099964a4	0	0	0.0000	CRASH	gen=946 glyphs=4
2026-03-14T07:36:45.969694	099964a4	0	0	0.0000	CRASH	gen=946 glyphs=4
2026-03-14T07:36:45.969886	cf93b656	0	0	0.0000	CRASH	gen=946 glyphs=3
2026-03-14T07:36:45.970079	cf180e57	0	0	0.0000	CRASH	gen=946 glyphs=4
2026-03-14T07:36:45.970281	8da1f8d8	0	0	0.0000	CRASH	gen=946 glyphs=4
2026-03-14T07:36:45.970478	868ec4ed	0	0	0.0000	CRASH	gen=946 glyphs=4
2026-03-14T07:36:45.970767	099964a4	0	0	0.0000	CRASH	gen=947 glyphs=4
2026-03-14T07:36:45.970964	099964a4	0	0	0.0000	CRASH	gen=947 glyphs=4
2026-03-14T07:36:45.971157	cf93b656	0	0	0.0000	CRASH	gen=947 glyphs=3
2026-03-14T07:36:45.971352	099964a4	0	0	0.0000	CRASH	gen=947 glyphs=4
2026-03-14T07:36:45.971547	099964a4	0	0	0.0000	CRASH	gen=947 glyphs=4
2026-03-14T07:36:45.971740	3ca14993	0	0	0.0000	CRASH	gen=947 glyphs=4
2026-03-14T07:36:45.971934	099964a4	0	0	0.0000	CRASH	gen=947 glyphs=4
2026-03-14T07:36:45.972128	41c3dcb0	0	0	0.0000	CRASH	gen=947 glyphs=4
2026-03-14T07:36:45.972324	099964a4	0	0	0.0000	CRASH	gen=947 glyphs=4
2026-03-14T07:36:45.972521	832f18b4	0	0	0.0000	CRASH	gen=947 glyphs=4
2026-03-14T07:36:45.972799	099964a4	0	0	0.0000	CRASH	gen=948 glyphs=4
2026-03-14T07:36:45.972993	099964a4	0	0	0.0000	CRASH	gen=948 glyphs=4
2026-03-14T07:36:45.973190	ff30496a	0	0	0.0000	CRASH	gen=948 glyphs=3
2026-03-14T07:36:45.973384	ff30496a	0	0	0.0000	CRASH	gen=948 glyphs=3
2026-03-14T07:36:45.973586	099964a4	0	0	0.0000	CRASH	gen=948 glyphs=4
2026-03-14T07:36:45.973777	099964a4	0	0	0.0000	CRASH	gen=948 glyphs=4
2026-03-14T07:36:45.973970	099964a4	0	0	0.0000	CRASH	gen=948 glyphs=4
2026-03-14T07:36:45.974161	099964a4	0	0	0.0000	CRASH	gen=948 glyphs=4
2026-03-14T07:36:45.974353	aabea1dc	0	0	0.0000	CRASH	gen=948 glyphs=4
2026-03-14T07:36:45.974555	ff30496a	0	0	0.0000	CRASH	gen=948 glyphs=3
2026-03-14T07:36:45.974831	099964a4	0	0	0.0000	CRASH	gen=949 glyphs=4
2026-03-14T07:36:45.975025	099964a4	0	0	0.0000	CRASH	gen=949 glyphs=4
2026-03-14T07:36:45.975219	099964a4	0	0	0.0000	CRASH	gen=949 glyphs=4
2026-03-14T07:36:45.975412	099964a4	0	0	0.0000	CRASH	gen=949 glyphs=4
2026-03-14T07:36:45.975611	3a734398	0	0	0.0000	CRASH	gen=949 glyphs=4
2026-03-14T07:36:45.975803	099964a4	0	0	0.0000	CRASH	gen=949 glyphs=4
2026-03-14T07:36:45.975995	099964a4	0	0	0.0000	CRASH	gen=949 glyphs=4
2026-03-14T07:36:45.976185	099964a4	0	0	0.0000	CRASH	gen=949 glyphs=4
2026-03-14T07:36:45.976377	099964a4	0	0	0.0000	CRASH	gen=949 glyphs=4
2026-03-14T07:36:45.976573	3ca14993	0	0	0.0000	CRASH	gen=949 glyphs=4
2026-03-14T07:36:45.976854	099964a4	0	0	0.0000	CRASH	gen=950 glyphs=4
2026-03-14T07:36:45.977046	099964a4	0	0	0.0000	CRASH	gen=950 glyphs=4
2026-03-14T07:36:45.977238	cf93b656	0	0	0.0000	CRASH	gen=950 glyphs=3
2026-03-14T07:36:45.977428	099964a4	0	0	0.0000	CRASH	gen=950 glyphs=4
2026-03-14T07:36:45.977621	099964a4	0	0	0.0000	CRASH	gen=950 glyphs=4
2026-03-14T07:36:45.977814	3ca14993	0	0	0.0000	CRASH	gen=950 glyphs=4
2026-03-14T07:36:45.978006	099964a4	0	0	0.0000	CRASH	gen=950 glyphs=4
2026-03-14T07:36:45.978198	099964a4	0	0	0.0000	CRASH	gen=950 glyphs=4
2026-03-14T07:36:45.978391	21676c7e	0	0	0.0000	CRASH	gen=950 glyphs=4
2026-03-14T07:36:45.978589	078d3d8b	0	0	0.0000	CRASH	gen=950 glyphs=4
2026-03-14T07:36:45.978879	099964a4	0	0	0.0000	CRASH	gen=951 glyphs=4
2026-03-14T07:36:45.979074	099964a4	0	0	0.0000	CRASH	gen=951 glyphs=4
2026-03-14T07:36:45.979269	8c8051c0	0	0	0.0000	CRASH	gen=951 glyphs=4
2026-03-14T07:36:45.979464	7d12e0b9	0	0	0.0000	CRASH	gen=951 glyphs=3
2026-03-14T07:36:45.979661	1d1bf1db	0	0	0.0000	CRASH	gen=951 glyphs=4
2026-03-14T07:36:45.979862	099964a4	0	0	0.0000	CRASH	gen=951 glyphs=4
2026-03-14T07:36:45.980055	099964a4	0	0	0.0000	CRASH	gen=951 glyphs=4
2026-03-14T07:36:45.980250	88296224	0	0	0.0000	CRASH	gen=951 glyphs=4
2026-03-14T07:36:45.980448	faebec4a	0	0	0.0000	CRASH	gen=951 glyphs=5
2026-03-14T07:36:45.980644	1046641d	0	0	0.0000	CRASH	gen=951 glyphs=3
