timestamp	program_hash	spirv_size	word_count	fitness	status	description
2026-03-14T07:36:44.247903	099964a4	0	0	0.0000	CRASH	gen=106 glyphs=4
2026-03-14T07:36:44.248180	099964a4	0	0	0.0000	CRASH	gen=107 glyphs=4
2026-03-14T07:36:44.248375	099964a4	0	0	0.0000	CRASH	gen=107 glyphs=4
2026-03-14T07:36:44.248572	dcb1fb50	0	0	0.0000	CRASH	gen=107 glyphs=4
2026-03-14T07:36:44.248770	3b917475	0	0	0.0000	CRASH	gen=107 glyphs=3
2026-03-14T07:36:44.248964	8da1f8d8	0	0	0.0000	CRASH	gen=107 glyphs=4
2026-03-14T07:36:44.249158	cf93b656	0	0	0.0000	CRASH	gen=107 glyphs=3
2026-03-14T07:36:44.249351	099964a4	0	0	0.0000	CRASH	gen=107 glyphs=4
2026-03-14T07:36:44.249545	099964a4	0	0	0.0000	CRASH	gen=107 glyphs=4
2026-03-14T07:36:44.249743	cf93b656	0	0	0.0000	CRASH	gen=107 glyphs=3
2026-03-14T07:36:44.249937	4115e5b3	0	0	0.0000	CRASH	gen=107 glyphs=3
2026-03-14T07:36:44.250212	099964a4	0	0	0.0000	CRASH	gen=108 glyphs=4
2026-03-14T07:36:44.250405	099964a4	0	0	0.0000	CRASH	gen=108 glyphs=4
2026-03-14T07:36:44.250597	099964a4	0	0	0.0000	CRASH	gen=108 glyphs=4
2026-03-14T07:36:44.250792	0a4bc7df	0	0	0.0000	CRASH	gen=108 glyphs=5
2026-03-14T07:36:44.250986	185f8012	0	0	0.0000	CRASH	gen=108 glyphs=3
2026-03-14T07:36:44.251177	f23d219c	0	0	0.0000	CRASH	gen=108 glyphs=4
2026-03-14T07:36:44.251369	099964a4	0	0	0.0000	CRASH	gen=108 glyphs=4
2026-03-14T07:36:44.251565	099964a4	0	0	0.0000	CRASH	gen=108 glyphs=4
2026-03-14T07:36:44.251759	ec921970	0	0	0.0000	CRASH	gen=108 glyphs=4
2026-03-14T07:36:44.251955	099964a4	0	0	0.0000	CRASH	gen=108 glyphs=4
2026-03-14T07:36:44.252220	099964a4	0	0	0.0000	CRASH	gen=109 glyphs=4
2026-03-14T07:36:44.252414	099964a4	0	0	0.0000	CRASH	gen=109 glyphs=4
2026-03-14T07:36:44.252609	aeb09dd5	0	0	0.0000	CRASH	gen=109 glyphs=4
2026-03-14T07:36:44.252803	e1083f50	0	0	0.0000	CRASH	gen=109 glyphs=4
2026-03-14T07:36:44.253005	099964a4	0	0	0.0000	CRASH	gen=109 glyphs=4
2026-03-14T07:36:44.253197	099964a4	0	0	0.0000	CRASH	gen=109 glyphs=4
2026-03-14T07:36:44.253390	099964a4	0	0	0.0000	CRASH	gen=109 glyphs=4
2026-03-14T07:36:44.253587	099964a4	0	0	0.0000	CRASH	gen=109 glyphs=4
2026-03-14T07:36:44.253779	dcb1fb50	0	0	0.0000	CRASH	gen=109 glyphs=4
2026-03-14T07:36:44.253990	099964a4	0	0	0.0000	CRASH	gen=109 glyphs=4
2026-03-14T07:36:44.254261	099964a4	0	0	0.0000	CRASH	gen=110 glyphs=4
2026-03-14T07:36:44.254455	099964a4	0	0	0.0000	CRASH	gen=110 glyphs=4
2026-03-14T07:36:44.254650	099964a4	0	0	0.0000	CRASH	gen=110 glyphs=4
2026-03-14T07:36:44.254840	dcb1fb50	0	0	0.0000	CRASH	gen=110 glyphs=4
2026-03-14T07:36:44.255034	96fd3baf	0	0	0.0000	CRASH	gen=110 glyphs=3
2026-03-14T07:36:44.255224	099964a4	0	0	0.0000	CRASH	gen=110 glyphs=4
2026-03-14T07:36:44.255412	099964a4	0	0	0.0000	CRASH	gen=110 glyphs=4
2026-03-14T07:36:44.255602	3a734398	0	0	0.0000	CRASH	gen=110 glyphs=4
2026-03-14T07:36:44.255792	099964a4	0	0	0.0000	CRASH	gen=110 glyphs=4
2026-03-14T07:36:44.255980	099964a4	0	0	0.0000	CRASH	gen=110 glyphs=4
2026-03-14T07:36:44.256264	099964a4	0	0	0.0000	CRASH	gen=111 glyphs=4
2026-03-14T07:36:44.256461	099964a4	0	0	0.0000	CRASH	gen=111 glyphs=4
2026-03-14T07:36:44.256660	82110dc7	0	0	0.0000	CRASH	gen=111 glyphs=3
2026-03-14T07:36:44.256854	c510e588	0	0	0.0000	CRASH	gen=111 glyphs=3
2026-03-14T07:36:44.257046	099964a4	0	0	0.0000	CRASH	gen=111 glyphs=4
2026-03-14T07:36:44.257241	ff30496a	0	0	0.0000	CRASH	gen=111 glyphs=3
2026-03-14T07:36:44.257432	099964a4	0	0	0.0000	CRASH	gen=111 glyphs=4
2026-03-14T07:36:44.257625	aa67a08a	0	0	0.0000	CRASH	gen=111 glyphs=4
2026-03-14T07:36:44.257820	099964a4	0	0	0.0000	CRASH	gen=111 glyphs=4
2026-03-14T07:36:44.258011	099964a4	0	0	0.0000	CRASH	gen=111 glyphs=4
2026-03-14T07:36:44.258278	099964a4	0	0	0.0000	CRASH	gen=112 glyphs=4
2026-03-14T07:36:44.258472	099964a4	0	0	0.0000	CRASH	gen=112 glyphs=4
2026-03-14T07:36:44.258673	099964a4	0	0	0.0000	CRASH	gen=112 glyphs=4
2026-03-14T07:36:44.258861	099964a4	0	0	0.0000	CRASH	gen=112 glyphs=4
2026-03-14T07:36:44.259051	99909f8a	0	0	0.0000	CRASH	gen=112 glyphs=3
2026-03-14T07:36:44.259241	099964a4	0	0	0.0000	CRASH	gen=112 glyphs=4
2026-03-14T07:36:44.259434	322c4d44	0	0	0.0000	CRASH	gen=112 glyphs=4
2026-03-14T07:36:44.259626	099964a4	0	0	0.0000	CRASH	gen=112 glyphs=4
2026-03-14T07:36:44.259815	099964a4	0	0	0.0000	CRASH	gen=112 glyphs=4
2026-03-14T07:36:44.260005	099964a4	0	0	0.0000	CRASH	gen=112 glyphs=4
2026-03-14T07:36:44.260283	099964a4	0	0	0.0000	CRASH	gen=113 glyphs=4
2026-03-14T07:36:44.260481	099964a4	0	0	0.0000	CRASH	gen=113 glyphs=4
2026-03-14T07:36:44.260676	f70ecb10	0	0	0.0000	CRASH	gen=113 glyphs=2
2026-03-14T07:36:44.260868	3ca14993	0	0	0.0000	CRASH	gen=113 glyphs=4
2026-03-14T07:36:44.261062	dcb1fb50	0	0	0.0000	CRASH	gen=113 glyphs=4
2026-03-14T07:36:44.261255	dcb1fb50	0	0	0.0000	CRASH	gen=113 glyphs=4
2026-03-14T07:36:44.261447	ae33bc09	0	0	0.0000	CRASH	gen=113 glyphs=4
2026-03-14T07:36:44.261644	3a734398	0	0	0.0000	CRASH	gen=113 glyphs=4
2026-03-14T07:36:44.261839	1c331533	0	0	0.0000	CRASH	gen=113 glyphs=5
2026-03-14T07:36:44.262034	78b0a819	0	0	0.0000	CRASH	gen=113 glyphs=4
2026-03-14T07:36:44.262311	099964a4	0	0	0.0000	CRASH	gen=114 glyphs=4
2026-03-14T07:36:44.262504	099964a4	0	0	0.0000	CRASH	gen=114 glyphs=4
2026-03-14T07:36:44.262699	099964a4	0	0	0.0000	CRASH	gen=114 glyphs=4
2026-03-14T07:36:44.262888	3ca14993	0	0	0.0000	CRASH	gen=114 glyphs=4
2026-03-14T07:36:44.263082	099964a4	0	0	0.0000	CRASH	gen=114 glyphs=4
2026-03-14T07:36:44.263272	aa0f5363	0	0	0.0000	CRASH	gen=114 glyphs=4
2026-03-14T07:36:44.263467	8da1f8d8	0	0	0.0000	CRASH	gen=114 glyphs=4
2026-03-14T07:36:44.263677	3ebf3663	0	0	0.0000	CRASH	gen=114 glyphs=4
2026-03-14T07:36:44.263869	7ede4765	0	0	0.0000	CRASH	gen=114 glyphs=2
2026-03-14T07:36:44.264058	099964a4	0	0	0.0000	CRASH	gen=114 glyphs=4
2026-03-14T07:36:44.264335	099964a4	0	0	0.0000	CRASH	gen=115 glyphs=4
2026-03-14T07:36:44.264536	099964a4	0	0	0.0000	CRASH	gen=115 glyphs=4
2026-03-14T07:36:44.264737	099964a4	0	0	0.0000	CRASH	gen=115 glyphs=4
2026-03-14T07:36:44.264930	099964a4	0	0	0.0000	CRASH	gen=115 glyphs=4
2026-03-14T07:36:44.265122	3d820e84	0	0	0.0000	CRASH	gen=115 glyphs=4
2026-03-14T07:36:44.265315	099964a4	0	0	0.0000	CRASH	gen=115 glyphs=4
2026-03-14T07:36:44.265508	099964a4	0	0	0.0000	CRASH	gen=115 glyphs=4
2026-03-14T07:36:44.265702	099964a4	0	0	0.0000	CRASH	gen=115 glyphs=4
2026-03-14T07:36:44.265901	8da1f8d8	0	0	0.0000	CRASH	gen=115 glyphs=4
2026-03-14T07:36:44.266095	e3d5129c	0	0	0.0000	CRASH	gen=115 glyphs=2
2026-03-14T07:36:44.266365	099964a4	0	0	0.0000	CRASH	gen=116 glyphs=4
2026-03-14T07:36:44.266565	099964a4	0	0	0.0000	CRASH	gen=116 glyphs=4
2026-03-14T07:36:44.266761	80cef82b	0	0	0.0000	CRASH	gen=116 glyphs=4
2026-03-14T07:36:44.266954	8da1f8d8	0	0	0.0000	CRASH	gen=116 glyphs=4
2026-03-14T07:36:44.267150	099964a4	0	0	0.0000	CRASH	gen=116 glyphs=4
2026-03-14T07:36:44.267342	29b5730d	0	0	0.0000	CRASH	gen=116 glyphs=4
2026-03-14T07:36:44.267540	80cef82b	0	0	0.0000	CRASH	gen=116 glyphs=4
2026-03-14T07:36:44.267734	099964a4	0	0	0.0000	CRASH	gen=116 glyphs=4
2026-03-14T07:36:44.267932	dcb1fb50	0	0	0.0000	CRASH	gen=116 glyphs=4
2026-03-14T07:36:44.268128	ff30496a	0	0	0.0000	CRASH	gen=116 glyphs=3
2026-03-14T07:36:44.268403	099964a4	0	0	0.0000	CRASH	gen=117 glyphs=4
2026-03-14T07:36:44.268600	099964a4	0	0	0.0000	CRASH	gen=117 glyphs=4
2026-03-14T07:36:44.268795	8da1f8d8	0	0	0.0000	CRASH	gen=117 glyphs=4
2026-03-14T07:36:44.268994	ff30496a	0	0	0.0000	CRASH	gen=117 glyphs=3
2026-03-14T07:36:44.269189	cf93b656	0	0	0.0000	CRASH	gen=117 glyphs=3
2026-03-14T07:36:44.269381	cf93b656	0	0	0.0000	CRASH	gen=117 glyphs=3
2026-03-14T07:36:44.269579	099964a4	0	0	0.0000	CRASH	gen=117 glyphs=4
2026-03-14T07:36:44.269772	29ff09a9	0	0	0.0000	CRASH	gen=117 glyphs=2
2026-03-14T07:36:44.269965	ff30496a	0	0	0.0000	CRASH	gen=117 glyphs=3
2026-03-14T07:36:44.270165	099964a4	0	0	0.0000	CRASH	gen=117 glyphs=4
2026-03-14T07:36:44.270439	099964a4	0	0	0.0000	CRASH	gen=118 glyphs=4
2026-03-14T07:36:44.270635	099964a4	0	0	0.0000	CRASH	gen=118 glyphs=4
2026-03-14T07:36:44.270829	3fffa773	0	0	0.0000	CRASH	gen=118 glyphs=4
2026-03-14T07:36:44.271022	c47727a2	0	0	0.0000	CRASH	gen=118 glyphs=4
2026-03-14T07:36:44.271222	cf93b656	0	0	0.0000	CRASH	gen=118 glyphs=3
2026-03-14T07:36:44.271414	3ca14993	0	0	0.0000	CRASH	gen=118 glyphs=4
2026-03-14T07:36:44.271611	099964a4	0	0	0.0000	CRASH	gen=118 glyphs=4
2026-03-14T07:36:44.271801	4593026b	0	0	0.0000	CRASH	gen=118 glyphs=4
2026-03-14T07:36:44.271994	0c347c32	0	0	0.0000	CRASH	gen=118 glyphs=4
2026-03-14T07:36:44.272189	cee3796d	0	0	0.0000	CRASH	gen=118 glyphs=4
2026-03-14T07:36:44.272449	099964a4	0	0	0.0000	CRASH	gen=119 glyphs=4
2026-03-14T07:36:44.272644	099964a4	0	0	0.0000	CRASH	gen=119 glyphs=4
2026-03-14T07:36:44.272838	7ede4765	0	0	0.0000	CRASH	gen=119 glyphs=2
2026-03-14T07:36:44.273029	8da1f8d8	0	0	0.0000	CRASH	gen=119 glyphs=4
2026-03-14T07:36:44.273225	536e6e9c	0	0	0.0000	CRASH	gen=119 glyphs=4
2026-03-14T07:36:44.273420	cf93b656	0	0	0.0000	CRASH	gen=119 glyphs=3
2026-03-14T07:36:44.273615	ff30496a	0	0	0.0000	CRASH	gen=119 glyphs=3
2026-03-14T07:36:44.273806	099964a4	0	0	0.0000	CRASH	gen=119 glyphs=4
2026-03-14T07:36:44.273998	099964a4	0	0	0.0000	CRASH	gen=119 glyphs=4
2026-03-14T07:36:44.274187	3ca14993	0	0	0.0000	CRASH	gen=119 glyphs=4
2026-03-14T07:36:44.274463	099964a4	0	0	0.0000	CRASH	gen=120 glyphs=4
2026-03-14T07:36:44.274660	099964a4	0	0	0.0000	CRASH	gen=120 glyphs=4
2026-03-14T07:36:44.274854	099964a4	0	0	0.0000	CRASH	gen=120 glyphs=4
2026-03-14T07:36:44.275047	099964a4	0	0	0.0000	CRASH	gen=120 glyphs=4
2026-03-14T07:36:44.275242	099964a4	0	0	0.0000	CRASH	gen=120 glyphs=4
2026-03-14T07:36:44.275440	099964a4	0	0	0.0000	CRASH	gen=120 glyphs=4
2026-03-14T07:36:44.275640	099964a4	0	0	0.0000	CRASH	gen=120 glyphs=4
2026-03-14T07:36:44.275832	e818f7ec	0	0	0.0000	CRASH	gen=120 glyphs=4
2026-03-14T07:36:44.276026	099964a4	0	0	0.0000	CRASH	gen=120 glyphs=4
2026-03-14T07:36:44.276219	9781296b	0	0	0.0000	CRASH	gen=120 glyphs=4
2026-03-14T07:36:44.276500	099964a4	0	0	0.0000	CRASH	gen=121 glyphs=4
2026-03-14T07:36:44.276697	099964a4	0	0	0.0000	CRASH	gen=121 glyphs=4
2026-03-14T07:36:44.276893	7ede4765	0	0	0.0000	CRASH	gen=121 glyphs=2
2026-03-14T07:36:44.277084	dcb1fb50	0	0	0.0000	CRASH	gen=121 glyphs=4
2026-03-14T07:36:44.277280	2a1c5c49	0	0	0.0000	CRASH	gen=121 glyphs=4
2026-03-14T07:36:44.277472	3ca14993	0	0	0.0000	CRASH	gen=121 glyphs=4
2026-03-14T07:36:44.277674	099964a4	0	0	0.0000	CRASH	gen=121 glyphs=4
2026-03-14T07:36:44.277866	099964a4	0	0	0.0000	CRASH	gen=121 glyphs=4
2026-03-14T07:36:44.278059	3a734398	0	0	0.0000	CRASH	gen=121 glyphs=4
2026-03-14T07:36:44.278251	b89c8928	0	0	0.0000	CRASH	gen=121 glyphs=4
2026-03-14T07:36:44.278525	099964a4	0	0	0.0000	CRASH	gen=122 glyphs=4
2026-03-14T07:36:44.278725	099964a4	0	0	0.0000	CRASH	gen=122 glyphs=4
2026-03-14T07:36:44.278919	099964a4	0	0	0.0000	CRASH	gen=122 glyphs=4
2026-03-14T07:36:44.279111	96402636	0	0	0.0000	CRASH	gen=122 glyphs=4
2026-03-14T07:36:44.279304	099964a4	0	0	0.0000	CRASH	gen=122 glyphs=4
2026-03-14T07:36:44.279494	099964a4	0	0	0.0000	CRASH	gen=122 glyphs=4
2026-03-14T07:36:44.279692	3ca14993	0	0	0.0000	CRASH	gen=122 glyphs=4
2026-03-14T07:36:44.279887	3606db0f	0	0	0.0000	CRASH	gen=122 glyphs=5
2026-03-14T07:36:44.280086	dcb1fb50	0	0	0.0000	CRASH	gen=122 glyphs=4
2026-03-14T07:36:44.280282	0b2df3f2	0	0	0.0000	CRASH	gen=122 glyphs=4
2026-03-14T07:36:44.280565	099964a4	0	0	0.0000	CRASH	gen=123 glyphs=4
2026-03-14T07:36:44.280767	099964a4	0	0	0.0000	CRASH	gen=123 glyphs=4
2026-03-14T07:36:44.280961	099964a4	0	0	0.0000	CRASH	gen=123 glyphs=4
2026-03-14T07:36:44.281156	f83c5c6e	0	0	0.0000	CRASH	gen=123 glyphs=3
2026-03-14T07:36:44.281350	80cef82b	0	0	0.0000	CRASH	gen=123 glyphs=4
2026-03-14T07:36:44.281545	099964a4	0	0	0.0000	CRASH	gen=123 glyphs=4
2026-03-14T07:36:44.281740	099964a4	0	0	0.0000	CRASH	gen=123 glyphs=4
2026-03-14T07:36:44.281935	80cef82b	0	0	0.0000	CRASH	gen=123 glyphs=4
2026-03-14T07:36:44.282129	099964a4	0	0	0.0000	CRASH	gen=123 glyphs=4
2026-03-14T07:36:44.282324	099964a4	0	0	0.0000	CRASH	gen=123 glyphs=4
2026-03-14T07:36:44.282604	099964a4	0	0	0.0000	CRASH	gen=124 glyphs=4
2026-03-14T07:36:44.282800	099964a4	0	0	0.0000	CRASH	gen=124 glyphs=4
2026-03-14T07:36:44.282999	e2ff899a	0	0	0.0000	CRASH	gen=124 glyphs=4
2026-03-14T07:36:44.283195	0e317eca	0	0	0.0000	CRASH	gen=124 glyphs=3
2026-03-14T07:36:44.283389	099964a4	0	0	0.0000	CRASH	gen=124 glyphs=4
2026-03-14T07:36:44.283583	099964a4	0	0	0.0000	CRASH	gen=124 glyphs=4
2026-03-14T07:36:44.283778	099964a4	0	0	0.0000	CRASH	gen=124 glyphs=4
2026-03-14T07:36:44.283977	099964a4	0	0	0.0000	CRASH	gen=124 glyphs=4
2026-03-14T07:36:44.284174	ff30496a	0	0	0.0000	CRASH	gen=124 glyphs=3
2026-03-14T07:36:44.284369	9e299a85	0	0	0.0000	CRASH	gen=124 glyphs=4
2026-03-14T07:36:44.284658	099964a4	0	0	0.0000	CRASH	gen=125 glyphs=4
2026-03-14T07:36:44.284853	099964a4	0	0	0.0000	CRASH	gen=125 glyphs=4
2026-03-14T07:36:44.285046	cc48bfe9	0	0	0.0000	CRASH	gen=125 glyphs=4
2026-03-14T07:36:44.285244	456e03ef	0	0	0.0000	CRASH	gen=125 glyphs=4
2026-03-14T07:36:44.285438	099964a4	0	0	0.0000	CRASH	gen=125 glyphs=4
2026-03-14T07:36:44.285632	60cd1061	0	0	0.0000	CRASH	gen=125 glyphs=3
2026-03-14T07:36:44.285826	8d0f57cc	0	0	0.0000	CRASH	gen=125 glyphs=5
2026-03-14T07:36:44.286022	c45d1e89	0	0	0.0000	CRASH	gen=125 glyphs=5
2026-03-14T07:36:44.286221	099964a4	0	0	0.0000	CRASH	gen=125 glyphs=4
2026-03-14T07:36:44.286413	32cf4cc9	0	0	0.0000	CRASH	gen=125 glyphs=3
2026-03-14T07:36:44.286687	099964a4	0	0	0.0000	CRASH	gen=126 glyphs=4
2026-03-14T07:36:44.286882	099964a4	0	0	0.0000	CRASH	gen=126 glyphs=4
2026-03-14T07:36:44.287077	8da1f8d8	0	0	0.0000	CRASH	gen=126 glyphs=4
2026-03-14T07:36:44.287277	099964a4	0	0	0.0000	CRASH	gen=126 glyphs=4
2026-03-14T07:36:44.287474	dcb1fb50	0	0	0.0000	CRASH	gen=126 glyphs=4
2026-03-14T07:36:44.287672	099964a4	0	0	0.0000	CRASH	gen=126 glyphs=4
2026-03-14T07:36:44.287867	099964a4	0	0	0.0000	CRASH	gen=126 glyphs=4
2026-03-14T07:36:44.288061	099964a4	0	0	0.0000	CRASH	gen=126 glyphs=4
2026-03-14T07:36:44.288257	099964a4	0	0	0.0000	CRASH	gen=126 glyphs=4
2026-03-14T07:36:44.288449	099964a4	0	0	0.0000	CRASH	gen=126 glyphs=4
2026-03-14T07:36:44.288729	099964a4	0	0	0.0000	CRASH	gen=127 glyphs=4
2026-03-14T07:36:44.288939	099964a4	0	0	0.0000	CRASH	gen=127 glyphs=4
2026-03-14T07:36:44.289132	491cf6df	0	0	0.0000	CRASH	gen=127 glyphs=4
2026-03-14T07:36:44.289330	cf93b656	0	0	0.0000	CRASH	gen=127 glyphs=3
2026-03-14T07:36:44.289527	099964a4	0	0	0.0000	CRASH	gen=127 glyphs=4
2026-03-14T07:36:44.289720	29218611	0	0	0.0000	CRASH	gen=127 glyphs=4
2026-03-14T07:36:44.289916	ff30496a	0	0	0.0000	CRASH	gen=127 glyphs=3
2026-03-14T07:36:44.290109	0c031a33	0	0	0.0000	CRASH	gen=127 glyphs=4
2026-03-14T07:36:44.290302	099964a4	0	0	0.0000	CRASH	gen=127 glyphs=4
2026-03-14T07:36:44.290506	099964a4	0	0	0.0000	CRASH	gen=127 glyphs=4
2026-03-14T07:36:44.290776	099964a4	0	0	0.0000	CRASH	gen=128 glyphs=4
2026-03-14T07:36:44.290971	099964a4	0	0	0.0000	CRASH	gen=128 glyphs=4
2026-03-14T07:36:44.291164	099964a4	0	0	0.0000	CRASH	gen=128 glyphs=4
2026-03-14T07:36:44.291357	099964a4	0	0	0.0000	CRASH	gen=128 glyphs=4
2026-03-14T07:36:44.291557	099964a4	0	0	0.0000	CRASH	gen=128 glyphs=4
2026-03-14T07:36:44.291751	099964a4	0	0	0.0000	CRASH	gen=128 glyphs=4
2026-03-14T07:36:44.291943	099964a4	0	0	0.0000	CRASH	gen=128 glyphs=4
2026-03-14T07:36:44.292136	067e5930	0	0	0.0000	CRASH	gen=128 glyphs=3
2026-03-14T07:36:44.292331	cf93b656	0	0	0.0000	CRASH	gen=128 glyphs=3
2026-03-14T07:36:44.292529	8da1f8d8	0	0	0.0000	CRASH	gen=128 glyphs=4
2026-03-14T07:36:44.292810	099964a4	0	0	0.0000	CRASH	gen=129 glyphs=4
2026-03-14T07:36:44.293005	099964a4	0	0	0.0000	CRASH	gen=129 glyphs=4
2026-03-14T07:36:44.293198	658126d9	0	0	0.0000	CRASH	gen=129 glyphs=3
2026-03-14T07:36:44.293388	099964a4	0	0	0.0000	CRASH	gen=129 glyphs=4
2026-03-14T07:36:44.293583	099964a4	0	0	0.0000	CRASH	gen=129 glyphs=4
2026-03-14T07:36:44.293778	099964a4	0	0	0.0000	CRASH	gen=129 glyphs=4
2026-03-14T07:36:44.293970	21053643	0	0	0.0000	CRASH	gen=129 glyphs=4
2026-03-14T07:36:44.294167	0fa9e758	0	0	0.0000	CRASH	gen=129 glyphs=4
2026-03-14T07:36:44.294363	099964a4	0	0	0.0000	CRASH	gen=129 glyphs=4
2026-03-14T07:36:44.294558	099964a4	0	0	0.0000	CRASH	gen=129 glyphs=4
2026-03-14T07:36:44.294846	099964a4	0	0	0.0000	CRASH	gen=130 glyphs=4
2026-03-14T07:36:44.295040	099964a4	0	0	0.0000	CRASH	gen=130 glyphs=4
2026-03-14T07:36:44.295246	099964a4	0	0	0.0000	CRASH	gen=130 glyphs=4
2026-03-14T07:36:44.295438	e2f57a2a	0	0	0.0000	CRASH	gen=130 glyphs=3
2026-03-14T07:36:44.295634	97b9e44a	0	0	0.0000	CRASH	gen=130 glyphs=4
2026-03-14T07:36:44.295832	c4f6e1fd	0	0	0.0000	CRASH	gen=130 glyphs=4
2026-03-14T07:36:44.296025	cf93b656	0	0	0.0000	CRASH	gen=130 glyphs=3
2026-03-14T07:36:44.296216	099964a4	0	0	0.0000	CRASH	gen=130 glyphs=4
2026-03-14T07:36:44.296411	c559993c	0	0	0.0000	CRASH	gen=130 glyphs=4
2026-03-14T07:36:44.296608	ff30496a	0	0	0.0000	CRASH	gen=130 glyphs=3
2026-03-14T07:36:44.296893	099964a4	0	0	0.0000	CRASH	gen=131 glyphs=4
2026-03-14T07:36:44.297087	099964a4	0	0	0.0000	CRASH	gen=131 glyphs=4
2026-03-14T07:36:44.297277	099964a4	0	0	0.0000	CRASH	gen=131 glyphs=4
2026-03-14T07:36:44.297467	3f687bd9	0	0	0.0000	CRASH	gen=131 glyphs=3
2026-03-14T07:36:44.297664	290b42df	0	0	0.0000	CRASH	gen=131 glyphs=4
2026-03-14T07:36:44.297861	099964a4	0	0	0.0000	CRASH	gen=131 glyphs=4
2026-03-14T07:36:44.298054	9fe2b01d	0	0	0.0000	CRASH	gen=131 glyphs=2
2026-03-14T07:36:44.298245	2a06ccd5	0	0	0.0000	CRASH	gen=131 glyphs=4
2026-03-14T07:36:44.298439	dcb1fb50	0	0	0.0000	CRASH	gen=131 glyphs=4
2026-03-14T07:36:44.298637	7d2a6532	0	0	0.0000	CRASH	gen=131 glyphs=4
2026-03-14T07:36:44.298914	099964a4	0	0	0.0000	CRASH	gen=132 glyphs=4
2026-03-14T07:36:44.299109	099964a4	0	0	0.0000	CRASH	gen=132 glyphs=4
2026-03-14T07:36:44.299300	099964a4	0	0	0.0000	CRASH	gen=132 glyphs=4
2026-03-14T07:36:44.299495	099964a4	0	0	0.0000	CRASH	gen=132 glyphs=4
2026-03-14T07:36:44.299688	ff30496a	0	0	0.0000	CRASH	gen=132 glyphs=3
2026-03-14T07:36:44.299880	099964a4	0	0	0.0000	CRASH	gen=132 glyphs=4
2026-03-14T07:36:44.300078	099964a4	0	0	0.0000	CRASH	gen=132 glyphs=4
2026-03-14T07:36:44.300269	099964a4	0	0	0.0000	CRASH	gen=132 glyphs=4
2026-03-14T07:36:44.300466	7ede4765	0	0	0.0000	CRASH	gen=132 glyphs=2
2026-03-14T07:36:44.300663	8b265a5a	0	0	0.0000	CRASH	gen=132 glyphs=5
2026-03-14T07:36:44.300945	099964a4	0	0	0.0000	CRASH	gen=133 glyphs=4
2026-03-14T07:36:44.301147	099964a4	0	0	0.0000	CRASH	gen=133 glyphs=4
2026-03-14T07:36:44.301344	7ede4765	0	0	0.0000	CRASH	gen=133 glyphs=2
2026-03-14T07:36:44.301538	dcb1fb50	0	0	0.0000	CRASH	gen=133 glyphs=4
2026-03-14T07:36:44.301734	099964a4	0	0	0.0000	CRASH	gen=133 glyphs=4
2026-03-14T07:36:44.301927	099964a4	0	0	0.0000	CRASH	gen=133 glyphs=4
2026-03-14T07:36:44.302126	099964a4	0	0	0.0000	CRASH	gen=133 glyphs=4
2026-03-14T07:36:44.302319	6bc2a13c	0	0	0.0000	CRASH	gen=133 glyphs=4
2026-03-14T07:36:44.302515	80cef82b	0	0	0.0000	CRASH	gen=133 glyphs=4
2026-03-14T07:36:44.302712	099964a4	0	0	0.0000	CRASH	gen=133 glyphs=4
2026-03-14T07:36:44.302988	099964a4	0	0	0.0000	CRASH	gen=134 glyphs=4
2026-03-14T07:36:44.303188	099964a4	0	0	0.0000	CRASH	gen=134 glyphs=4
2026-03-14T07:36:44.303383	a10cbed6	0	0	0.0000	CRASH	gen=134 glyphs=4
2026-03-14T07:36:44.303582	099964a4	0	0	0.0000	CRASH	gen=134 glyphs=4
2026-03-14T07:36:44.303775	099964a4	0	0	0.0000	CRASH	gen=134 glyphs=4
2026-03-14T07:36:44.303969	9f3b3b5b	0	0	0.0000	CRASH	gen=134 glyphs=4
2026-03-14T07:36:44.304162	099964a4	0	0	0.0000	CRASH	gen=134 glyphs=4
2026-03-14T07:36:44.304359	099964a4	0	0	0.0000	CRASH	gen=134 glyphs=4
2026-03-14T07:36:44.304556	099964a4	0	0	0.0000	CRASH	gen=134 glyphs=4
2026-03-14T07:36:44.304749	099964a4	0	0	0.0000	CRASH	gen=134 glyphs=4
2026-03-14T07:36:44.305023	099964a4	0	0	0.0000	CRASH	gen=135 glyphs=4
2026-03-14T07:36:44.305217	099964a4	0	0	0.0000	CRASH	gen=135 glyphs=4
2026-03-14T07:36:44.305414	80cef82b	0	0	0.0000	CRASH	gen=135 glyphs=4
2026-03-14T07:36:44.305610	aea2899a	0	0	0.0000	CRASH	gen=135 glyphs=4
2026-03-14T07:36:44.305807	099964a4	0	0	0.0000	CRASH	gen=135 glyphs=4
2026-03-14T07:36:44.306001	dcb1fb50	0	0	0.0000	CRASH	gen=135 glyphs=4
2026-03-14T07:36:44.306197	9a756abd	0	0	0.0000	CRASH	gen=135 glyphs=4
2026-03-14T07:36:44.306394	099964a4	0	0	0.0000	CRASH	gen=135 glyphs=4
2026-03-14T07:36:44.306591	099964a4	0	0	0.0000	CRASH	gen=135 glyphs=4
2026-03-14T07:36:44.306785	17fa31db	0	0	0.0000	CRASH	gen=135 glyphs=4
2026-03-14T07:36:44.307070	099964a4	0	0	0.0000	CRASH	gen=136 glyphs=4
2026-03-14T07:36:44.307264	099964a4	0	0	0.0000	CRASH	gen=136 glyphs=4
2026-03-14T07:36:44.307464	3a734398	0	0	0.0000	CRASH	gen=136 glyphs=4
2026-03-14T07:36:44.307661	099964a4	0	0	0.0000	CRASH	gen=136 glyphs=4
2026-03-14T07:36:44.307853	099964a4	0	0	0.0000	CRASH	gen=136 glyphs=4
2026-03-14T07:36:44.308044	099964a4	0	0	0.0000	CRASH	gen=136 glyphs=4
2026-03-14T07:36:44.308236	099964a4	0	0	0.0000	CRASH	gen=136 glyphs=4
2026-03-14T07:36:44.308429	099964a4	0	0	0.0000	CRASH	gen=136 glyphs=4
2026-03-14T07:36:44.308630	991f15d9	0	0	0.0000	CRASH	gen=136 glyphs=3
2026-03-14T07:36:44.308823	e4f16df0	0	0	0.0000	CRASH	gen=136 glyphs=2
2026-03-14T07:36:44.309088	099964a4	0	0	0.0000	CRASH	gen=137 glyphs=4
2026-03-14T07:36:44.309287	099964a4	0	0	0.0000	CRASH	gen=137 glyphs=4
2026-03-14T07:36:44.309482	099964a4	0	0	0.0000	CRASH	gen=137 glyphs=4
2026-03-14T07:36:44.309681	ced16c8e	0	0	0.0000	CRASH	gen=137 glyphs=3
2026-03-14T07:36:44.309876	dcb1fb50	0	0	0.0000	CRASH	gen=137 glyphs=4
2026-03-14T07:36:44.310070	cf93b656	0	0	0.0000	CRASH	gen=137 glyphs=3
2026-03-14T07:36:44.310263	099964a4	0	0	0.0000	CRASH	gen=137 glyphs=4
2026-03-14T07:36:44.310455	099964a4	0	0	0.0000	CRASH	gen=137 glyphs=4
2026-03-14T07:36:44.310653	099964a4	0	0	0.0000	CRASH	gen=137 glyphs=4
2026-03-14T07:36:44.310843	8da1f8d8	0	0	0.0000	CRASH	gen=137 glyphs=4
2026-03-14T07:36:44.311110	099964a4	0	0	0.0000	CRASH	gen=138 glyphs=4
2026-03-14T07:36:44.311308	099964a4	0	0	0.0000	CRASH	gen=138 glyphs=4
