timestamp	program_hash	spirv_size	word_count	fitness	status	description
2026-03-14T03:08:15.340706	51a48b6a	116	29	1.0000	DISCARD	gen=636 glyphs=4
2026-03-14T03:08:15.592610	e8c7f6cf	120	30	1.0000	DISCARD	gen=680 glyphs=4
2026-03-14T03:08:17.986581	5b9807ac	120	30	1.0000	DISCARD	gen=636 glyphs=4
2026-03-14T03:08:18.253254	0e9bffbc	116	29	1.0000	DISCARD	gen=680 glyphs=4
2026-03-14T03:08:20.656548	98dcd7f1	116	29	1.0000	DISCARD	gen=636 glyphs=4
2026-03-14T03:08:20.928655	45ac0cc8	116	29	1.0000	DISCARD	gen=680 glyphs=4
2026-03-14T03:08:23.374800	5a06ca32	120	30	1.0000	DISCARD	gen=636 glyphs=4
2026-03-14T03:08:23.643027	8d011090	116	29	0.9500	DISCARD	gen=680 glyphs=4
2026-03-14T03:08:26.053239	fdb5d108	120	30	1.0000	DISCARD	gen=636 glyphs=4
2026-03-14T03:08:26.308783	050862ad	120	30	1.0000	DISCARD	gen=680 glyphs=4
2026-03-14T03:08:28.725923	37f4017b	116	29	1.0000	DISCARD	gen=637 glyphs=4
2026-03-14T03:08:28.995846	a78f9454	120	30	1.0000	DISCARD	gen=680 glyphs=4
2026-03-14T03:08:31.386967	bfdf7cad	120	30	1.0000	DISCARD	gen=637 glyphs=4
2026-03-14T03:08:31.659179	19355583	120	30	1.0000	DISCARD	gen=681 glyphs=4
2026-03-14T03:08:34.066295	01c258a5	120	30	1.0000	DISCARD	gen=637 glyphs=4
2026-03-14T03:08:34.347729	8aef8872	116	29	1.0000	DISCARD	gen=681 glyphs=4
2026-03-14T03:08:36.764819	37f4017b	116	29	1.0000	DISCARD	gen=637 glyphs=4
2026-03-14T03:08:37.034915	50dc991d	116	29	1.0000	DISCARD	gen=681 glyphs=4
2026-03-14T03:08:39.443572	2701cb73	116	29	1.0000	DISCARD	gen=637 glyphs=4
2026-03-14T03:08:39.710657	8aef8872	116	29	1.0000	DISCARD	gen=681 glyphs=4
2026-03-14T03:08:42.104721	5a06ca32	120	30	1.0000	DISCARD	gen=637 glyphs=4
2026-03-14T03:08:42.381319	d7c8681b	120	30	1.0000	DISCARD	gen=681 glyphs=4
2026-03-14T03:08:44.794319	7f0ae828	120	30	1.0000	DISCARD	gen=637 glyphs=4
2026-03-14T03:08:45.060409	39e85a36	116	29	1.0000	DISCARD	gen=681 glyphs=4
2026-03-14T03:08:47.484184	49fefe1b	116	29	0.9500	DISCARD	gen=637 glyphs=4
2026-03-14T03:08:47.741092	515d519a	116	29	1.0000	DISCARD	gen=681 glyphs=4
2026-03-14T03:08:50.145151	37f4017b	116	29	1.0000	DISCARD	gen=637 glyphs=4
2026-03-14T03:08:50.415089	8eb7d449	116	29	1.0000	DISCARD	gen=681 glyphs=4
2026-03-14T03:08:52.844806	71e2ba66	116	29	1.0000	DISCARD	gen=637 glyphs=4
2026-03-14T03:08:53.118484	050862ad	120	30	1.0000	DISCARD	gen=681 glyphs=4
2026-03-14T03:08:55.600846	37f4017b	116	29	1.0000	DISCARD	gen=638 glyphs=4
2026-03-14T03:08:55.867014	eca7ab6c	116	29	1.0000	DISCARD	gen=681 glyphs=4
2026-03-14T03:08:58.291523	bfdf7cad	120	30	1.0000	DISCARD	gen=638 glyphs=4
2026-03-14T03:08:58.548515	19355583	120	30	1.0000	DISCARD	gen=682 glyphs=4
2026-03-14T03:09:00.946016	8769617c	120	30	1.0000	DISCARD	gen=638 glyphs=4
2026-03-14T03:09:01.220587	8aef8872	116	29	1.0000	DISCARD	gen=682 glyphs=4
2026-03-14T03:09:03.611563	802722ee	120	30	1.0000	DISCARD	gen=638 glyphs=4
2026-03-14T03:09:03.896825	571efa4d	120	30	1.0000	DISCARD	gen=682 glyphs=4
2026-03-14T03:09:06.282361	967fcea8	116	29	1.0000	DISCARD	gen=638 glyphs=4
2026-03-14T03:09:06.541110	ae44ace5	116	29	1.0000	DISCARD	gen=682 glyphs=4
2026-03-14T03:09:08.959275	679b0814	116	29	1.0000	DISCARD	gen=638 glyphs=4
2026-03-14T03:09:09.230019	050862ad	120	30	1.0000	DISCARD	gen=682 glyphs=4
2026-03-14T03:09:11.657855	4c9b0dd4	120	30	1.0000	DISCARD	gen=638 glyphs=4
2026-03-14T03:09:11.936074	d7c8681b	120	30	1.0000	DISCARD	gen=682 glyphs=4
2026-03-14T03:09:14.350031	fdb5d108	120	30	1.0000	DISCARD	gen=638 glyphs=4
2026-03-14T03:09:14.616975	50dc991d	116	29	1.0000	DISCARD	gen=682 glyphs=4
2026-03-14T03:09:17.028961	a77456bf	120	30	1.0000	DISCARD	gen=638 glyphs=4
2026-03-14T03:09:17.301928	eca7ab6c	116	29	1.0000	DISCARD	gen=682 glyphs=4
2026-03-14T03:09:19.734490	12b38c2d	116	29	1.0000	DISCARD	gen=638 glyphs=4
2026-03-14T03:09:19.993113	8aef8872	116	29	1.0000	DISCARD	gen=682 glyphs=4
2026-03-14T03:09:22.396349	37f4017b	116	29	1.0000	DISCARD	gen=639 glyphs=4
2026-03-14T03:09:22.657577	050862ad	120	30	1.0000	DISCARD	gen=682 glyphs=4
2026-03-14T03:09:25.150476	bfdf7cad	120	30	1.0000	DISCARD	gen=639 glyphs=4
2026-03-14T03:09:25.441427	19355583	120	30	1.0000	DISCARD	gen=683 glyphs=4
2026-03-14T03:09:27.871874	37f4017b	116	29	1.0000	DISCARD	gen=639 glyphs=4
2026-03-14T03:09:28.136881	8aef8872	116	29	1.0000	DISCARD	gen=683 glyphs=4
2026-03-14T03:09:30.514446	4181f422	120	30	1.0000	DISCARD	gen=639 glyphs=4
2026-03-14T03:09:30.779774	9e34ede0	116	29	1.0000	DISCARD	gen=683 glyphs=4
2026-03-14T03:09:33.191336	5a06ca32	120	30	1.0000	DISCARD	gen=639 glyphs=4
2026-03-14T03:09:33.457616	875e0f8a	116	29	1.0000	DISCARD	gen=683 glyphs=4
2026-03-14T03:09:35.871147	fdb5d108	120	30	1.0000	DISCARD	gen=639 glyphs=4
2026-03-14T03:09:36.144416	ae44ace5	116	29	1.0000	DISCARD	gen=683 glyphs=4
2026-03-14T03:09:38.545087	5a06ca32	120	30	1.0000	DISCARD	gen=639 glyphs=4
2026-03-14T03:09:38.821981	50dc991d	116	29	1.0000	DISCARD	gen=683 glyphs=4
2026-03-14T03:09:41.228700	37f4017b	116	29	1.0000	DISCARD	gen=639 glyphs=4
2026-03-14T03:09:41.487107	0eaedb57	116	29	1.0000	DISCARD	gen=683 glyphs=4
2026-03-14T03:09:43.905313	bfdf7cad	120	30	1.0000	DISCARD	gen=639 glyphs=4
2026-03-14T03:09:44.179738	eca7ab6c	116	29	1.0000	DISCARD	gen=683 glyphs=4
2026-03-14T03:09:46.595054	f6e07c82	120	30	1.0000	DISCARD	gen=639 glyphs=4
2026-03-14T03:09:46.869235	66013a00	120	30	1.0000	DISCARD	gen=683 glyphs=4
2026-03-14T03:09:49.273236	37f4017b	116	29	1.0000	DISCARD	gen=640 glyphs=4
2026-03-14T03:09:49.538585	d7c8681b	120	30	1.0000	DISCARD	gen=683 glyphs=4
2026-03-14T03:09:51.942535	bfdf7cad	120	30	1.0000	DISCARD	gen=640 glyphs=4
2026-03-14T03:09:52.218813	19355583	120	30	1.0000	DISCARD	gen=684 glyphs=4
2026-03-14T03:09:54.611097	37f4017b	116	29	1.0000	DISCARD	gen=640 glyphs=4
2026-03-14T03:09:54.889732	8aef8872	116	29	1.0000	DISCARD	gen=684 glyphs=4
2026-03-14T03:09:57.373923	0cd2265a	120	30	1.0000	DISCARD	gen=640 glyphs=4
2026-03-14T03:09:57.640088	8028b229	116	29	1.0000	DISCARD	gen=684 glyphs=4
2026-03-14T03:10:00.102607	37f4017b	116	29	1.0000	DISCARD	gen=640 glyphs=4
2026-03-14T03:10:00.368892	37afcf8a	116	29	0.9500	DISCARD	gen=684 glyphs=4
2026-03-14T03:10:02.819058	5a06ca32	120	30	1.0000	DISCARD	gen=640 glyphs=4
2026-03-14T03:10:03.084819	8aef8872	116	29	1.0000	DISCARD	gen=684 glyphs=4
2026-03-14T03:10:05.504734	d11c1062	120	30	1.0000	DISCARD	gen=640 glyphs=4
2026-03-14T03:10:05.784145	050862ad	120	30	1.0000	DISCARD	gen=684 glyphs=4
2026-03-14T03:10:08.197944	2701cb73	116	29	1.0000	DISCARD	gen=640 glyphs=4
2026-03-14T03:10:08.464860	80d3aa12	116	29	1.0000	DISCARD	gen=684 glyphs=4
2026-03-14T03:10:10.913074	ee88950d	120	30	1.0000	DISCARD	gen=640 glyphs=4
2026-03-14T03:10:11.177444	1e5f0e21	116	29	1.0000	DISCARD	gen=684 glyphs=4
2026-03-14T03:10:13.609475	6c5ef447	120	30	1.0000	DISCARD	gen=640 glyphs=4
2026-03-14T03:10:13.889949	0eaedb57	116	29	1.0000	DISCARD	gen=684 glyphs=4
2026-03-14T03:10:16.332591	37f4017b	116	29	1.0000	DISCARD	gen=641 glyphs=4
2026-03-14T03:10:16.602074	0eaedb57	116	29	1.0000	DISCARD	gen=684 glyphs=4
2026-03-14T03:10:19.034883	bfdf7cad	120	30	1.0000	DISCARD	gen=641 glyphs=4
2026-03-14T03:10:19.296210	19355583	120	30	1.0000	DISCARD	gen=685 glyphs=4
2026-03-14T03:10:21.727565	f04d7fe8	116	29	0.9500	DISCARD	gen=641 glyphs=4
2026-03-14T03:10:21.994832	8aef8872	116	29	1.0000	DISCARD	gen=685 glyphs=4
2026-03-14T03:10:24.487437	30977c98	120	30	1.0000	DISCARD	gen=641 glyphs=4
2026-03-14T03:10:24.754839	19355583	120	30	1.0000	DISCARD	gen=685 glyphs=4
2026-03-14T03:10:27.207169	756613c3	116	29	1.0000	DISCARD	gen=641 glyphs=4
2026-03-14T03:10:27.466926	b7aed8e9	116	29	1.0000	DISCARD	gen=685 glyphs=4
2026-03-14T03:10:29.981583	4c9b0dd4	120	30	1.0000	DISCARD	gen=641 glyphs=4
2026-03-14T03:10:30.248956	eca7ab6c	116	29	1.0000	DISCARD	gen=685 glyphs=4
2026-03-14T03:10:32.700219	bef54f84	116	29	1.0000	DISCARD	gen=641 glyphs=4
2026-03-14T03:10:32.956339	b57e7176	120	30	1.0000	DISCARD	gen=685 glyphs=4
2026-03-14T03:10:35.397221	d11c1062	120	30	1.0000	DISCARD	gen=641 glyphs=4
2026-03-14T03:10:35.666053	e1d9136f	120	30	1.0000	DISCARD	gen=685 glyphs=4
2026-03-14T03:10:38.105424	5a06ca32	120	30	1.0000	DISCARD	gen=641 glyphs=4
2026-03-14T03:10:38.365635	a78f9454	120	30	1.0000	DISCARD	gen=685 glyphs=4
2026-03-14T03:10:40.810931	55d6c151	120	30	1.0000	DISCARD	gen=641 glyphs=4
2026-03-14T03:10:41.070510	885ae2af	116	29	1.0000	DISCARD	gen=685 glyphs=4
2026-03-14T03:10:43.498109	37f4017b	116	29	1.0000	DISCARD	gen=642 glyphs=4
2026-03-14T03:10:43.774959	2bb5229c	120	30	1.0000	DISCARD	gen=685 glyphs=4
2026-03-14T03:10:46.236446	bfdf7cad	120	30	1.0000	DISCARD	gen=642 glyphs=4
2026-03-14T03:10:46.509564	19355583	120	30	1.0000	DISCARD	gen=686 glyphs=4
2026-03-14T03:10:48.967330	8960b871	116	29	1.0000	DISCARD	gen=642 glyphs=4
2026-03-14T03:10:49.243111	8aef8872	116	29	1.0000	DISCARD	gen=686 glyphs=4
2026-03-14T03:10:51.670412	1fed5665	116	29	0.9500	DISCARD	gen=642 glyphs=4
2026-03-14T03:10:51.948622	0eaedb57	116	29	1.0000	DISCARD	gen=686 glyphs=4
2026-03-14T03:10:54.406240	fdb5d108	120	30	1.0000	DISCARD	gen=642 glyphs=4
2026-03-14T03:10:54.668728	0eaedb57	116	29	1.0000	DISCARD	gen=686 glyphs=4
2026-03-14T03:10:57.113505	5a06ca32	120	30	1.0000	DISCARD	gen=642 glyphs=4
2026-03-14T03:10:57.382616	e2cd28ea	120	30	1.0000	DISCARD	gen=686 glyphs=4
2026-03-14T03:10:59.879764	f949dcd7	120	30	1.0000	DISCARD	gen=642 glyphs=4
2026-03-14T03:11:00.150594	8aef8872	116	29	1.0000	DISCARD	gen=686 glyphs=4
2026-03-14T03:11:02.607314	5a06ca32	120	30	1.0000	DISCARD	gen=642 glyphs=4
2026-03-14T03:11:02.891323	0eaedb57	116	29	1.0000	DISCARD	gen=686 glyphs=4
2026-03-14T03:11:05.339005	37f4017b	116	29	1.0000	DISCARD	gen=642 glyphs=4
2026-03-14T03:11:05.612271	19355583	120	30	1.0000	DISCARD	gen=686 glyphs=4
2026-03-14T03:11:08.030151	37f4017b	116	29	1.0000	DISCARD	gen=642 glyphs=4
2026-03-14T03:11:08.303017	8aef8872	116	29	1.0000	DISCARD	gen=686 glyphs=4
2026-03-14T03:11:10.739629	37f4017b	116	29	1.0000	DISCARD	gen=643 glyphs=4
2026-03-14T03:11:11.008085	a78f9454	120	30	1.0000	DISCARD	gen=686 glyphs=4
2026-03-14T03:11:13.430432	bfdf7cad	120	30	1.0000	DISCARD	gen=643 glyphs=4
2026-03-14T03:11:13.697225	19355583	120	30	1.0000	DISCARD	gen=687 glyphs=4
2026-03-14T03:11:16.118730	d11c1062	120	30	1.0000	DISCARD	gen=643 glyphs=4
2026-03-14T03:11:16.401165	8aef8872	116	29	1.0000	DISCARD	gen=687 glyphs=4
2026-03-14T03:11:18.841037	72e8a39c	116	29	1.0000	DISCARD	gen=643 glyphs=4
2026-03-14T03:11:19.130423	050862ad	120	30	1.0000	DISCARD	gen=687 glyphs=4
2026-03-14T03:11:21.586703	4f7ea420	116	29	1.0000	DISCARD	gen=643 glyphs=4
2026-03-14T03:11:21.869986	0b1fd8ae	116	29	1.0000	DISCARD	gen=687 glyphs=4
2026-03-14T03:11:24.311273	4c9b0dd4	120	30	1.0000	DISCARD	gen=643 glyphs=4
2026-03-14T03:11:24.585626	1e5f0e21	116	29	1.0000	DISCARD	gen=687 glyphs=4
2026-03-14T03:11:27.026266	be8eb3a0	116	29	1.0000	DISCARD	gen=643 glyphs=4
2026-03-14T03:11:27.301604	1e5f0e21	116	29	1.0000	DISCARD	gen=687 glyphs=4
2026-03-14T03:11:29.715083	37f4017b	116	29	1.0000	DISCARD	gen=643 glyphs=4
2026-03-14T03:11:30.003616	468659de	116	29	1.0000	DISCARD	gen=687 glyphs=4
2026-03-14T03:11:32.445010	5a06ca32	120	30	1.0000	DISCARD	gen=643 glyphs=4
2026-03-14T03:11:32.717342	57a36d49	120	30	1.0000	DISCARD	gen=687 glyphs=4
2026-03-14T03:11:35.178153	55d6c151	120	30	1.0000	DISCARD	gen=643 glyphs=4
2026-03-14T03:11:35.439083	67cb81be	120	30	1.0000	DISCARD	gen=687 glyphs=4
2026-03-14T03:11:37.886186	37f4017b	116	29	1.0000	DISCARD	gen=644 glyphs=4
2026-03-14T03:11:38.158984	50dc991d	116	29	1.0000	DISCARD	gen=687 glyphs=4
2026-03-14T03:11:40.594117	bfdf7cad	120	30	1.0000	DISCARD	gen=644 glyphs=4
2026-03-14T03:11:40.859783	19355583	120	30	1.0000	DISCARD	gen=688 glyphs=4
2026-03-14T03:11:43.309712	8a8277aa	116	29	1.0000	DISCARD	gen=644 glyphs=4
2026-03-14T03:11:43.581458	8aef8872	116	29	1.0000	DISCARD	gen=688 glyphs=4
2026-03-14T03:11:46.040195	7ca87b42	116	29	1.0000	DISCARD	gen=644 glyphs=4
2026-03-14T03:11:46.311097	0eaedb57	116	29	1.0000	DISCARD	gen=688 glyphs=4
2026-03-14T03:11:48.741364	fdb5d108	120	30	1.0000	DISCARD	gen=644 glyphs=4
2026-03-14T03:11:49.014337	e8e128ca	116	29	1.0000	DISCARD	gen=688 glyphs=4
2026-03-14T03:11:51.444258	32911def	120	30	1.0000	DISCARD	gen=644 glyphs=4
2026-03-14T03:11:51.720462	8aef8872	116	29	1.0000	DISCARD	gen=688 glyphs=4
2026-03-14T03:11:54.199681	71e2ba66	116	29	1.0000	DISCARD	gen=644 glyphs=4
2026-03-14T03:11:54.469963	e2cd28ea	120	30	1.0000	DISCARD	gen=688 glyphs=4
2026-03-14T03:11:56.922574	f7692a14	116	29	1.0000	DISCARD	gen=644 glyphs=4
2026-03-14T03:11:57.185138	a78f9454	120	30	1.0000	DISCARD	gen=688 glyphs=4
2026-03-14T03:11:59.616376	5a06ca32	120	30	1.0000	DISCARD	gen=644 glyphs=4
2026-03-14T03:11:59.886406	8aef8872	116	29	1.0000	DISCARD	gen=688 glyphs=4
2026-03-14T03:12:02.335997	5a06ca32	120	30	1.0000	DISCARD	gen=644 glyphs=4
2026-03-14T03:12:02.603068	f044f2da	116	29	1.0000	DISCARD	gen=688 glyphs=4
2026-03-14T03:12:05.205980	37f4017b	116	29	1.0000	DISCARD	gen=645 glyphs=4
2026-03-14T03:12:05.475446	771da498	116	29	1.0000	DISCARD	gen=688 glyphs=4
2026-03-14T03:12:07.908817	bfdf7cad	120	30	1.0000	DISCARD	gen=645 glyphs=4
2026-03-14T03:12:08.188773	19355583	120	30	1.0000	DISCARD	gen=689 glyphs=4
2026-03-14T03:12:10.645806	2701cb73	116	29	1.0000	DISCARD	gen=645 glyphs=4
2026-03-14T03:12:10.913310	8aef8872	116	29	1.0000	DISCARD	gen=689 glyphs=4
2026-03-14T03:12:13.345314	37f4017b	116	29	1.0000	DISCARD	gen=645 glyphs=4
2026-03-14T03:12:13.616136	8f180079	120	30	1.0000	DISCARD	gen=689 glyphs=4
2026-03-14T03:12:16.021861	37f4017b	116	29	1.0000	DISCARD	gen=645 glyphs=4
2026-03-14T03:12:16.292281	0eaedb57	116	29	1.0000	DISCARD	gen=689 glyphs=4
2026-03-14T03:12:18.768625	37f4017b	116	29	1.0000	DISCARD	gen=645 glyphs=4
2026-03-14T03:12:19.047001	9e34ede0	116	29	1.0000	DISCARD	gen=689 glyphs=4
2026-03-14T03:12:21.488335	55d6c151	120	30	1.0000	DISCARD	gen=645 glyphs=4
2026-03-14T03:12:21.756082	71e3155c	120	30	1.0000	DISCARD	gen=689 glyphs=4
2026-03-14T03:12:24.165485	55d6c151	120	30	1.0000	DISCARD	gen=645 glyphs=4
2026-03-14T03:12:24.435221	319fd716	120	30	1.0000	DISCARD	gen=689 glyphs=4
2026-03-14T03:12:26.892112	de5f9117	120	30	1.0000	DISCARD	gen=645 glyphs=4
2026-03-14T03:12:27.158281	5aa26dde	116	29	1.0000	DISCARD	gen=689 glyphs=4
2026-03-14T03:12:29.640537	55d6c151	120	30	1.0000	DISCARD	gen=645 glyphs=4
2026-03-14T03:12:29.909568	1e5f0e21	116	29	1.0000	DISCARD	gen=689 glyphs=4
2026-03-14T03:12:32.354820	37f4017b	116	29	1.0000	DISCARD	gen=646 glyphs=4
2026-03-14T03:12:32.625250	0eaedb57	116	29	1.0000	DISCARD	gen=689 glyphs=4
2026-03-14T03:12:35.205844	bfdf7cad	120	30	1.0000	DISCARD	gen=646 glyphs=4
2026-03-14T03:12:35.472939	19355583	120	30	1.0000	DISCARD	gen=690 glyphs=4
2026-03-14T03:12:37.903813	c19066bf	116	29	1.0000	DISCARD	gen=646 glyphs=4
2026-03-14T03:12:38.170243	8aef8872	116	29	1.0000	DISCARD	gen=690 glyphs=4
2026-03-14T03:12:40.588303	7ca87b42	116	29	1.0000	DISCARD	gen=646 glyphs=4
2026-03-14T03:12:40.851474	1917b11b	120	30	1.0000	DISCARD	gen=690 glyphs=4
2026-03-14T03:12:43.257618	5a06ca32	120	30	1.0000	DISCARD	gen=646 glyphs=4
2026-03-14T03:12:43.530406	0eaedb57	116	29	1.0000	DISCARD	gen=690 glyphs=4
2026-03-14T03:12:45.983634	5b9807ac	120	30	1.0000	DISCARD	gen=646 glyphs=4
2026-03-14T03:12:46.256602	8aef8872	116	29	1.0000	DISCARD	gen=690 glyphs=4
2026-03-14T03:12:48.703545	37f4017b	116	29	1.0000	DISCARD	gen=646 glyphs=4
2026-03-14T03:12:48.972226	ae44ace5	116	29	1.0000	DISCARD	gen=690 glyphs=4
2026-03-14T03:12:51.392873	71e2ba66	116	29	1.0000	DISCARD	gen=646 glyphs=4
2026-03-14T03:12:51.651313	a78f9454	120	30	1.0000	DISCARD	gen=690 glyphs=4
2026-03-14T03:12:54.106018	37f4017b	116	29	1.0000	DISCARD	gen=646 glyphs=4
2026-03-14T03:12:54.387291	19355583	120	30	1.0000	DISCARD	gen=690 glyphs=4
2026-03-14T03:12:56.793380	5a06ca32	120	30	1.0000	DISCARD	gen=646 glyphs=4
2026-03-14T03:12:57.062700	80752688	116	29	1.0000	DISCARD	gen=690 glyphs=4
2026-03-14T03:12:59.464689	37f4017b	116	29	1.0000	DISCARD	gen=647 glyphs=4
2026-03-14T03:12:59.747931	8aca6efd	116	29	1.0000	DISCARD	gen=690 glyphs=4
2026-03-14T03:13:02.145434	bfdf7cad	120	30	1.0000	DISCARD	gen=647 glyphs=4
2026-03-14T03:13:02.413794	19355583	120	30	1.0000	DISCARD	gen=691 glyphs=4
2026-03-14T03:13:04.810261	4c9b0dd4	120	30	1.0000	DISCARD	gen=647 glyphs=4
2026-03-14T03:13:05.075741	8aef8872	116	29	1.0000	DISCARD	gen=691 glyphs=4
2026-03-14T03:13:07.550805	b93f21dd	116	29	1.0000	DISCARD	gen=647 glyphs=4
2026-03-14T03:13:07.812901	827dc2e7	116	29	1.0000	DISCARD	gen=691 glyphs=4
2026-03-14T03:13:10.221001	5a06ca32	120	30	1.0000	DISCARD	gen=647 glyphs=4
2026-03-14T03:13:10.492191	7d33bc57	116	29	0.9500	DISCARD	gen=691 glyphs=4
2026-03-14T03:13:12.907175	fc1136c5	116	29	1.0000	DISCARD	gen=647 glyphs=4
2026-03-14T03:13:13.182282	1c43f267	120	30	0.9500	DISCARD	gen=691 glyphs=4
2026-03-14T03:13:15.569055	55d6c151	120	30	1.0000	DISCARD	gen=647 glyphs=4
2026-03-14T03:13:15.845179	0afe1bd2	116	29	1.0000	DISCARD	gen=691 glyphs=4
2026-03-14T03:13:18.241788	37f4017b	116	29	1.0000	DISCARD	gen=647 glyphs=4
2026-03-14T03:13:18.516844	e8c7f6cf	120	30	1.0000	DISCARD	gen=691 glyphs=4
2026-03-14T03:13:20.950129	5a06ca32	120	30	1.0000	DISCARD	gen=647 glyphs=4
2026-03-14T03:13:21.217131	a78f9454	120	30	1.0000	DISCARD	gen=691 glyphs=4
2026-03-14T03:13:23.612605	55d6c151	120	30	1.0000	DISCARD	gen=647 glyphs=4
2026-03-14T03:13:23.878838	050862ad	120	30	1.0000	DISCARD	gen=691 glyphs=4
2026-03-14T03:13:26.298102	37f4017b	116	29	1.0000	DISCARD	gen=648 glyphs=4
2026-03-14T03:13:26.567856	eca7ab6c	116	29	1.0000	DISCARD	gen=691 glyphs=4
2026-03-14T03:13:29.002041	bfdf7cad	120	30	1.0000	DISCARD	gen=648 glyphs=4
2026-03-14T03:13:29.271429	19355583	120	30	1.0000	DISCARD	gen=692 glyphs=4
2026-03-14T03:13:31.671268	2701cb73	116	29	1.0000	DISCARD	gen=648 glyphs=4
2026-03-14T03:13:31.931181	8aef8872	116	29	1.0000	DISCARD	gen=692 glyphs=4
2026-03-14T03:13:34.348847	5a06ca32	120	30	1.0000	DISCARD	gen=648 glyphs=4
2026-03-14T03:13:34.615668	8e76e68e	120	30	1.0000	DISCARD	gen=692 glyphs=4
2026-03-14T03:13:37.050166	bfdf7cad	120	30	1.0000	DISCARD	gen=648 glyphs=4
2026-03-14T03:13:37.326612	03fe1e12	116	29	1.0000	DISCARD	gen=692 glyphs=4
2026-03-14T03:13:39.837370	1d34459a	116	29	1.0000	DISCARD	gen=648 glyphs=4
2026-03-14T03:13:40.118622	1e5f0e21	116	29	1.0000	DISCARD	gen=692 glyphs=4
2026-03-14T03:13:42.550154	7ca87b42	116	29	1.0000	DISCARD	gen=648 glyphs=4
2026-03-14T03:13:42.810859	e6c4a9ef	120	30	1.0000	DISCARD	gen=692 glyphs=4
2026-03-14T03:13:45.233393	1d34459a	116	29	1.0000	DISCARD	gen=648 glyphs=4
2026-03-14T03:13:45.501045	e8c7f6cf	120	30	1.0000	DISCARD	gen=692 glyphs=4
2026-03-14T03:13:47.888254	6a213a36	116	29	1.0000	DISCARD	gen=648 glyphs=4
2026-03-14T03:13:48.169913	b7aed8e9	116	29	1.0000	DISCARD	gen=692 glyphs=4
2026-03-14T03:13:50.583255	55d6c151	120	30	1.0000	DISCARD	gen=648 glyphs=4
2026-03-14T03:13:50.845638	b57e7176	120	30	1.0000	DISCARD	gen=692 glyphs=4
2026-03-14T03:13:53.269333	37f4017b	116	29	1.0000	DISCARD	gen=649 glyphs=4
2026-03-14T03:13:53.541113	13dd547d	116	29	1.0000	DISCARD	gen=692 glyphs=4
2026-03-14T03:13:55.939575	bfdf7cad	120	30	1.0000	DISCARD	gen=649 glyphs=4
2026-03-14T03:13:56.196632	19355583	120	30	1.0000	DISCARD	gen=693 glyphs=4
2026-03-14T03:13:58.609562	4c9b0dd4	120	30	1.0000	DISCARD	gen=649 glyphs=4
2026-03-14T03:13:58.881891	8aef8872	116	29	1.0000	DISCARD	gen=693 glyphs=4
2026-03-14T03:14:01.287977	37f4017b	116	29	1.0000	DISCARD	gen=649 glyphs=4
2026-03-14T03:14:01.568334	0d2667cd	116	29	1.0000	DISCARD	gen=693 glyphs=4
2026-03-14T03:14:03.982795	d11c1062	120	30	1.0000	DISCARD	gen=649 glyphs=4
2026-03-14T03:14:04.245443	050862ad	120	30	1.0000	DISCARD	gen=693 glyphs=4
2026-03-14T03:14:06.674621	71e2ba66	116	29	1.0000	DISCARD	gen=649 glyphs=4
2026-03-14T03:14:06.944924	2f101410	120	30	1.0000	DISCARD	gen=693 glyphs=4
2026-03-14T03:14:09.349854	12b38c2d	116	29	1.0000	DISCARD	gen=649 glyphs=4
2026-03-14T03:14:09.648329	b7aed8e9	116	29	1.0000	DISCARD	gen=693 glyphs=4
2026-03-14T03:14:12.069013	37f4017b	116	29	1.0000	DISCARD	gen=649 glyphs=4
2026-03-14T03:14:12.334932	050862ad	120	30	1.0000	DISCARD	gen=693 glyphs=4
2026-03-14T03:14:14.765917	55d6c151	120	30	1.0000	DISCARD	gen=649 glyphs=4
2026-03-14T03:14:15.032798	1e5f0e21	116	29	1.0000	DISCARD	gen=693 glyphs=4
2026-03-14T03:14:17.458195	5a06ca32	120	30	1.0000	DISCARD	gen=649 glyphs=4
2026-03-14T03:14:17.728115	875e0f8a	116	29	1.0000	DISCARD	gen=693 glyphs=4
2026-03-14T03:14:20.141334	37f4017b	116	29	1.0000	DISCARD	gen=650 glyphs=4
2026-03-14T03:14:20.412268	19355583	120	30	1.0000	DISCARD	gen=693 glyphs=4
2026-03-14T03:14:22.842697	bfdf7cad	120	30	1.0000	DISCARD	gen=650 glyphs=4
2026-03-14T03:14:23.118754	19355583	120	30	1.0000	DISCARD	gen=694 glyphs=4
2026-03-14T03:14:25.539462	c1945f43	128	32	0.9000	DISCARD	gen=650 glyphs=4
2026-03-14T03:14:25.806532	8aef8872	116	29	1.0000	DISCARD	gen=694 glyphs=4
2026-03-14T03:14:28.234546	4c9b0dd4	120	30	1.0000	DISCARD	gen=650 glyphs=4
2026-03-14T03:14:28.503646	a409a4e1	120	30	1.0000	DISCARD	gen=694 glyphs=4
2026-03-14T03:14:30.895680	5a06ca32	120	30	1.0000	DISCARD	gen=650 glyphs=4
2026-03-14T03:14:31.174803	19355583	120	30	1.0000	DISCARD	gen=694 glyphs=4
2026-03-14T03:14:33.611675	94732dd9	116	29	1.0000	DISCARD	gen=650 glyphs=4
2026-03-14T03:14:33.879500	4580d37f	120	30	1.0000	DISCARD	gen=694 glyphs=4
2026-03-14T03:14:36.308150	d11c1062	120	30	1.0000	DISCARD	gen=650 glyphs=4
2026-03-14T03:14:36.568201	04ec246d	116	29	1.0000	DISCARD	gen=694 glyphs=4
2026-03-14T03:14:39.022764	1d34459a	116	29	1.0000	DISCARD	gen=650 glyphs=4
2026-03-14T03:14:39.293389	19355583	120	30	1.0000	DISCARD	gen=694 glyphs=4
2026-03-14T03:14:41.757598	55d6c151	120	30	1.0000	DISCARD	gen=650 glyphs=4
2026-03-14T03:14:42.022731	e2cd28ea	120	30	1.0000	DISCARD	gen=694 glyphs=4
2026-03-14T03:14:44.470502	a7b50094	116	29	1.0000	DISCARD	gen=650 glyphs=4
2026-03-14T03:14:44.735052	203a4ed7	120	30	1.0000	DISCARD	gen=694 glyphs=4
2026-03-14T03:14:47.120594	37f4017b	116	29	1.0000	DISCARD	gen=651 glyphs=4
2026-03-14T03:14:47.390328	19355583	120	30	1.0000	DISCARD	gen=694 glyphs=4
