timestamp	program_hash	spirv_size	word_count	fitness	status	description
2026-03-14T07:36:44.375090	3a734398	0	0	0.0000	CRASH	gen=169 glyphs=4
2026-03-14T07:36:44.375287	cf93b656	0	0	0.0000	CRASH	gen=169 glyphs=3
2026-03-14T07:36:44.375477	099964a4	0	0	0.0000	CRASH	gen=169 glyphs=4
2026-03-14T07:36:44.375672	099964a4	0	0	0.0000	CRASH	gen=169 glyphs=4
2026-03-14T07:36:44.375865	dcb1fb50	0	0	0.0000	CRASH	gen=169 glyphs=4
2026-03-14T07:36:44.376136	099964a4	0	0	0.0000	CRASH	gen=170 glyphs=4
2026-03-14T07:36:44.376334	099964a4	0	0	0.0000	CRASH	gen=170 glyphs=4
2026-03-14T07:36:44.376530	099964a4	0	0	0.0000	CRASH	gen=170 glyphs=4
2026-03-14T07:36:44.376721	099964a4	0	0	0.0000	CRASH	gen=170 glyphs=4
2026-03-14T07:36:44.376914	80cef82b	0	0	0.0000	CRASH	gen=170 glyphs=4
2026-03-14T07:36:44.377108	099964a4	0	0	0.0000	CRASH	gen=170 glyphs=4
2026-03-14T07:36:44.377299	099964a4	0	0	0.0000	CRASH	gen=170 glyphs=4
2026-03-14T07:36:44.377496	099964a4	0	0	0.0000	CRASH	gen=170 glyphs=4
2026-03-14T07:36:44.377689	cfa2a0d8	0	0	0.0000	CRASH	gen=170 glyphs=4
2026-03-14T07:36:44.377881	80cef82b	0	0	0.0000	CRASH	gen=170 glyphs=4
2026-03-14T07:36:44.378162	099964a4	0	0	0.0000	CRASH	gen=171 glyphs=4
2026-03-14T07:36:44.378358	099964a4	0	0	0.0000	CRASH	gen=171 glyphs=4
2026-03-14T07:36:44.378556	8da1f8d8	0	0	0.0000	CRASH	gen=171 glyphs=4
2026-03-14T07:36:44.378750	ff30496a	0	0	0.0000	CRASH	gen=171 glyphs=3
2026-03-14T07:36:44.378945	6f31211a	0	0	0.0000	CRASH	gen=171 glyphs=3
2026-03-14T07:36:44.379140	b0891d6d	0	0	0.0000	CRASH	gen=171 glyphs=4
2026-03-14T07:36:44.379334	8da1f8d8	0	0	0.0000	CRASH	gen=171 glyphs=4
2026-03-14T07:36:44.379535	099964a4	0	0	0.0000	CRASH	gen=171 glyphs=4
2026-03-14T07:36:44.379728	3ca14993	0	0	0.0000	CRASH	gen=171 glyphs=4
2026-03-14T07:36:44.379921	099964a4	0	0	0.0000	CRASH	gen=171 glyphs=4
2026-03-14T07:36:44.380190	099964a4	0	0	0.0000	CRASH	gen=172 glyphs=4
2026-03-14T07:36:44.380383	099964a4	0	0	0.0000	CRASH	gen=172 glyphs=4
2026-03-14T07:36:44.380582	099964a4	0	0	0.0000	CRASH	gen=172 glyphs=4
2026-03-14T07:36:44.380773	80cef82b	0	0	0.0000	CRASH	gen=172 glyphs=4
2026-03-14T07:36:44.380964	099964a4	0	0	0.0000	CRASH	gen=172 glyphs=4
2026-03-14T07:36:44.381153	099964a4	0	0	0.0000	CRASH	gen=172 glyphs=4
2026-03-14T07:36:44.381341	8c97da5f	0	0	0.0000	CRASH	gen=172 glyphs=4
2026-03-14T07:36:44.381535	099964a4	0	0	0.0000	CRASH	gen=172 glyphs=4
2026-03-14T07:36:44.381733	d40d36d4	0	0	0.0000	CRASH	gen=172 glyphs=2
2026-03-14T07:36:44.381927	80cef82b	0	0	0.0000	CRASH	gen=172 glyphs=4
2026-03-14T07:36:44.382197	099964a4	0	0	0.0000	CRASH	gen=173 glyphs=4
2026-03-14T07:36:44.382388	099964a4	0	0	0.0000	CRASH	gen=173 glyphs=4
2026-03-14T07:36:44.382584	099964a4	0	0	0.0000	CRASH	gen=173 glyphs=4
2026-03-14T07:36:44.382778	7ede4765	0	0	0.0000	CRASH	gen=173 glyphs=2
2026-03-14T07:36:44.382972	b5010126	0	0	0.0000	CRASH	gen=173 glyphs=5
2026-03-14T07:36:44.383168	099964a4	0	0	0.0000	CRASH	gen=173 glyphs=4
2026-03-14T07:36:44.383361	099964a4	0	0	0.0000	CRASH	gen=173 glyphs=4
2026-03-14T07:36:44.383554	8da1f8d8	0	0	0.0000	CRASH	gen=173 glyphs=4
2026-03-14T07:36:44.383758	80cef82b	0	0	0.0000	CRASH	gen=173 glyphs=4
2026-03-14T07:36:44.383953	3bc7646f	0	0	0.0000	CRASH	gen=173 glyphs=4
2026-03-14T07:36:44.384227	099964a4	0	0	0.0000	CRASH	gen=174 glyphs=4
2026-03-14T07:36:44.384421	099964a4	0	0	0.0000	CRASH	gen=174 glyphs=4
2026-03-14T07:36:44.384618	099964a4	0	0	0.0000	CRASH	gen=174 glyphs=4
2026-03-14T07:36:44.384814	099964a4	0	0	0.0000	CRASH	gen=174 glyphs=4
2026-03-14T07:36:44.385007	0a8d1494	0	0	0.0000	CRASH	gen=174 glyphs=4
2026-03-14T07:36:44.385198	099964a4	0	0	0.0000	CRASH	gen=174 glyphs=4
2026-03-14T07:36:44.385390	80cef82b	0	0	0.0000	CRASH	gen=174 glyphs=4
2026-03-14T07:36:44.385587	45056622	0	0	0.0000	CRASH	gen=174 glyphs=3
2026-03-14T07:36:44.385783	80cef82b	0	0	0.0000	CRASH	gen=174 glyphs=4
2026-03-14T07:36:44.385979	294eef43	0	0	0.0000	CRASH	gen=174 glyphs=3
2026-03-14T07:36:44.386255	099964a4	0	0	0.0000	CRASH	gen=175 glyphs=4
2026-03-14T07:36:44.386449	099964a4	0	0	0.0000	CRASH	gen=175 glyphs=4
2026-03-14T07:36:44.386644	3dff2344	0	0	0.0000	CRASH	gen=175 glyphs=4
2026-03-14T07:36:44.386839	4f8001e3	0	0	0.0000	CRASH	gen=175 glyphs=4
2026-03-14T07:36:44.387037	53b6f559	0	0	0.0000	CRASH	gen=175 glyphs=5
2026-03-14T07:36:44.387232	80cef82b	0	0	0.0000	CRASH	gen=175 glyphs=4
2026-03-14T07:36:44.387427	099964a4	0	0	0.0000	CRASH	gen=175 glyphs=4
2026-03-14T07:36:44.387622	5b251d39	0	0	0.0000	CRASH	gen=175 glyphs=3
2026-03-14T07:36:44.387818	6e1e06af	0	0	0.0000	CRASH	gen=175 glyphs=4
2026-03-14T07:36:44.388017	099964a4	0	0	0.0000	CRASH	gen=175 glyphs=4
2026-03-14T07:36:44.388289	099964a4	0	0	0.0000	CRASH	gen=176 glyphs=4
2026-03-14T07:36:44.388484	099964a4	0	0	0.0000	CRASH	gen=176 glyphs=4
2026-03-14T07:36:44.388680	7ede4765	0	0	0.0000	CRASH	gen=176 glyphs=2
2026-03-14T07:36:44.388873	dcb1fb50	0	0	0.0000	CRASH	gen=176 glyphs=4
2026-03-14T07:36:44.389069	099964a4	0	0	0.0000	CRASH	gen=176 glyphs=4
2026-03-14T07:36:44.389262	3ca14993	0	0	0.0000	CRASH	gen=176 glyphs=4
2026-03-14T07:36:44.389456	67db9d55	0	0	0.0000	CRASH	gen=176 glyphs=5
2026-03-14T07:36:44.389667	099964a4	0	0	0.0000	CRASH	gen=176 glyphs=4
2026-03-14T07:36:44.389861	099964a4	0	0	0.0000	CRASH	gen=176 glyphs=4
2026-03-14T07:36:44.390057	9ca199cc	0	0	0.0000	CRASH	gen=176 glyphs=4
2026-03-14T07:36:44.390339	099964a4	0	0	0.0000	CRASH	gen=177 glyphs=4
2026-03-14T07:36:44.390538	099964a4	0	0	0.0000	CRASH	gen=177 glyphs=4
2026-03-14T07:36:44.390731	3a734398	0	0	0.0000	CRASH	gen=177 glyphs=4
2026-03-14T07:36:44.390923	a0905f19	0	0	0.0000	CRASH	gen=177 glyphs=4
2026-03-14T07:36:44.391120	099964a4	0	0	0.0000	CRASH	gen=177 glyphs=4
2026-03-14T07:36:44.391311	af785ae0	0	0	0.0000	CRASH	gen=177 glyphs=2
2026-03-14T07:36:44.391503	80cef82b	0	0	0.0000	CRASH	gen=177 glyphs=4
2026-03-14T07:36:44.391698	ff30496a	0	0	0.0000	CRASH	gen=177 glyphs=3
2026-03-14T07:36:44.391895	4d590c38	0	0	0.0000	CRASH	gen=177 glyphs=4
2026-03-14T07:36:44.392090	ff30496a	0	0	0.0000	CRASH	gen=177 glyphs=3
2026-03-14T07:36:44.392356	099964a4	0	0	0.0000	CRASH	gen=178 glyphs=4
2026-03-14T07:36:44.392553	099964a4	0	0	0.0000	CRASH	gen=178 glyphs=4
2026-03-14T07:36:44.392746	ff30496a	0	0	0.0000	CRASH	gen=178 glyphs=3
2026-03-14T07:36:44.392939	68898dc5	0	0	0.0000	CRASH	gen=178 glyphs=1
2026-03-14T07:36:44.393129	f63e9aa4	0	0	0.0000	CRASH	gen=178 glyphs=4
2026-03-14T07:36:44.393328	099964a4	0	0	0.0000	CRASH	gen=178 glyphs=4
2026-03-14T07:36:44.393523	283bc68c	0	0	0.0000	CRASH	gen=178 glyphs=2
2026-03-14T07:36:44.393714	80cef82b	0	0	0.0000	CRASH	gen=178 glyphs=4
2026-03-14T07:36:44.393908	dcb1fb50	0	0	0.0000	CRASH	gen=178 glyphs=4
2026-03-14T07:36:44.394101	dcb1fb50	0	0	0.0000	CRASH	gen=178 glyphs=4
2026-03-14T07:36:44.394384	099964a4	0	0	0.0000	CRASH	gen=179 glyphs=4
2026-03-14T07:36:44.394589	099964a4	0	0	0.0000	CRASH	gen=179 glyphs=4
2026-03-14T07:36:44.394785	099964a4	0	0	0.0000	CRASH	gen=179 glyphs=4
2026-03-14T07:36:44.394980	099964a4	0	0	0.0000	CRASH	gen=179 glyphs=4
2026-03-14T07:36:44.395172	0bab2497	0	0	0.0000	CRASH	gen=179 glyphs=5
2026-03-14T07:36:44.395368	b25a45b5	0	0	0.0000	CRASH	gen=179 glyphs=3
2026-03-14T07:36:44.395568	099964a4	0	0	0.0000	CRASH	gen=179 glyphs=4
2026-03-14T07:36:44.395762	099964a4	0	0	0.0000	CRASH	gen=179 glyphs=4
2026-03-14T07:36:44.395968	099964a4	0	0	0.0000	CRASH	gen=179 glyphs=4
2026-03-14T07:36:44.396162	4925c52b	0	0	0.0000	CRASH	gen=179 glyphs=3
2026-03-14T07:36:44.396433	099964a4	0	0	0.0000	CRASH	gen=180 glyphs=4
2026-03-14T07:36:44.396635	099964a4	0	0	0.0000	CRASH	gen=180 glyphs=4
2026-03-14T07:36:44.396826	099964a4	0	0	0.0000	CRASH	gen=180 glyphs=4
2026-03-14T07:36:44.397015	80cef82b	0	0	0.0000	CRASH	gen=180 glyphs=4
2026-03-14T07:36:44.397206	50c6f4a1	0	0	0.0000	CRASH	gen=180 glyphs=4
2026-03-14T07:36:44.397397	099964a4	0	0	0.0000	CRASH	gen=180 glyphs=4
2026-03-14T07:36:44.397592	80cef82b	0	0	0.0000	CRASH	gen=180 glyphs=4
2026-03-14T07:36:44.397785	099964a4	0	0	0.0000	CRASH	gen=180 glyphs=4
2026-03-14T07:36:44.397976	cf93b656	0	0	0.0000	CRASH	gen=180 glyphs=3
2026-03-14T07:36:44.398172	099964a4	0	0	0.0000	CRASH	gen=180 glyphs=4
2026-03-14T07:36:44.398467	099964a4	0	0	0.0000	CRASH	gen=181 glyphs=4
2026-03-14T07:36:44.398667	099964a4	0	0	0.0000	CRASH	gen=181 glyphs=4
2026-03-14T07:36:44.398861	099964a4	0	0	0.0000	CRASH	gen=181 glyphs=4
2026-03-14T07:36:44.399051	099964a4	0	0	0.0000	CRASH	gen=181 glyphs=4
2026-03-14T07:36:44.399245	42131ca7	0	0	0.0000	CRASH	gen=181 glyphs=4
2026-03-14T07:36:44.399439	601074d0	0	0	0.0000	CRASH	gen=181 glyphs=3
2026-03-14T07:36:44.399635	ff30496a	0	0	0.0000	CRASH	gen=181 glyphs=3
2026-03-14T07:36:44.399831	3ca14993	0	0	0.0000	CRASH	gen=181 glyphs=4
2026-03-14T07:36:44.400027	64f32fa9	0	0	0.0000	CRASH	gen=181 glyphs=3
2026-03-14T07:36:44.400218	6d474c8b	0	0	0.0000	CRASH	gen=181 glyphs=4
2026-03-14T07:36:44.400495	099964a4	0	0	0.0000	CRASH	gen=182 glyphs=4
2026-03-14T07:36:44.400691	099964a4	0	0	0.0000	CRASH	gen=182 glyphs=4
2026-03-14T07:36:44.400887	099964a4	0	0	0.0000	CRASH	gen=182 glyphs=4
2026-03-14T07:36:44.401080	83d5e993	0	0	0.0000	CRASH	gen=182 glyphs=4
2026-03-14T07:36:44.401273	099964a4	0	0	0.0000	CRASH	gen=182 glyphs=4
2026-03-14T07:36:44.401464	099964a4	0	0	0.0000	CRASH	gen=182 glyphs=4
2026-03-14T07:36:44.401657	51b9b644	0	0	0.0000	CRASH	gen=182 glyphs=4
2026-03-14T07:36:44.401857	dcb1fb50	0	0	0.0000	CRASH	gen=182 glyphs=4
2026-03-14T07:36:44.402053	cf93b656	0	0	0.0000	CRASH	gen=182 glyphs=3
2026-03-14T07:36:44.402246	099964a4	0	0	0.0000	CRASH	gen=182 glyphs=4
2026-03-14T07:36:44.402513	099964a4	0	0	0.0000	CRASH	gen=183 glyphs=4
2026-03-14T07:36:44.402716	099964a4	0	0	0.0000	CRASH	gen=183 glyphs=4
2026-03-14T07:36:44.402916	099964a4	0	0	0.0000	CRASH	gen=183 glyphs=4
2026-03-14T07:36:44.403111	8da1f8d8	0	0	0.0000	CRASH	gen=183 glyphs=4
2026-03-14T07:36:44.403306	099964a4	0	0	0.0000	CRASH	gen=183 glyphs=4
2026-03-14T07:36:44.403498	099964a4	0	0	0.0000	CRASH	gen=183 glyphs=4
2026-03-14T07:36:44.403693	ff30496a	0	0	0.0000	CRASH	gen=183 glyphs=3
2026-03-14T07:36:44.403892	099964a4	0	0	0.0000	CRASH	gen=183 glyphs=4
2026-03-14T07:36:44.404087	099964a4	0	0	0.0000	CRASH	gen=183 glyphs=4
2026-03-14T07:36:44.404283	099964a4	0	0	0.0000	CRASH	gen=183 glyphs=4
2026-03-14T07:36:44.404553	099964a4	0	0	0.0000	CRASH	gen=184 glyphs=4
2026-03-14T07:36:44.404749	099964a4	0	0	0.0000	CRASH	gen=184 glyphs=4
2026-03-14T07:36:44.404947	ad58d10e	0	0	0.0000	CRASH	gen=184 glyphs=3
2026-03-14T07:36:44.405150	099964a4	0	0	0.0000	CRASH	gen=184 glyphs=4
2026-03-14T07:36:44.405342	ff30496a	0	0	0.0000	CRASH	gen=184 glyphs=3
2026-03-14T07:36:44.405535	099964a4	0	0	0.0000	CRASH	gen=184 glyphs=4
2026-03-14T07:36:44.405732	ff30496a	0	0	0.0000	CRASH	gen=184 glyphs=3
2026-03-14T07:36:44.405923	099964a4	0	0	0.0000	CRASH	gen=184 glyphs=4
2026-03-14T07:36:44.406130	0862d95b	0	0	0.0000	CRASH	gen=184 glyphs=3
2026-03-14T07:36:44.406334	3a734398	0	0	0.0000	CRASH	gen=184 glyphs=4
2026-03-14T07:36:44.406612	099964a4	0	0	0.0000	CRASH	gen=185 glyphs=4
2026-03-14T07:36:44.406809	099964a4	0	0	0.0000	CRASH	gen=185 glyphs=4
2026-03-14T07:36:44.407004	099964a4	0	0	0.0000	CRASH	gen=185 glyphs=4
2026-03-14T07:36:44.407201	099964a4	0	0	0.0000	CRASH	gen=185 glyphs=4
2026-03-14T07:36:44.407394	099964a4	0	0	0.0000	CRASH	gen=185 glyphs=4
2026-03-14T07:36:44.407589	099964a4	0	0	0.0000	CRASH	gen=185 glyphs=4
2026-03-14T07:36:44.407781	f3900b12	0	0	0.0000	CRASH	gen=185 glyphs=3
2026-03-14T07:36:44.407975	3a734398	0	0	0.0000	CRASH	gen=185 glyphs=4
2026-03-14T07:36:44.408172	099964a4	0	0	0.0000	CRASH	gen=185 glyphs=4
2026-03-14T07:36:44.408363	b571d916	0	0	0.0000	CRASH	gen=185 glyphs=3
2026-03-14T07:36:44.408654	099964a4	0	0	0.0000	CRASH	gen=186 glyphs=4
2026-03-14T07:36:44.408852	099964a4	0	0	0.0000	CRASH	gen=186 glyphs=4
2026-03-14T07:36:44.409046	7a5d7bda	0	0	0.0000	CRASH	gen=186 glyphs=4
2026-03-14T07:36:44.409245	7ede4765	0	0	0.0000	CRASH	gen=186 glyphs=2
2026-03-14T07:36:44.409440	a682f0fc	0	0	0.0000	CRASH	gen=186 glyphs=4
2026-03-14T07:36:44.409656	8da1f8d8	0	0	0.0000	CRASH	gen=186 glyphs=4
2026-03-14T07:36:44.409852	099964a4	0	0	0.0000	CRASH	gen=186 glyphs=4
2026-03-14T07:36:44.410045	e0146699	0	0	0.0000	CRASH	gen=186 glyphs=4
2026-03-14T07:36:44.410251	8da1f8d8	0	0	0.0000	CRASH	gen=186 glyphs=4
2026-03-14T07:36:44.410447	3b82e676	0	0	0.0000	CRASH	gen=186 glyphs=4
2026-03-14T07:36:44.410731	099964a4	0	0	0.0000	CRASH	gen=187 glyphs=4
2026-03-14T07:36:44.410925	099964a4	0	0	0.0000	CRASH	gen=187 glyphs=4
2026-03-14T07:36:44.411118	099964a4	0	0	0.0000	CRASH	gen=187 glyphs=4
2026-03-14T07:36:44.411313	835bd46b	0	0	0.0000	CRASH	gen=187 glyphs=3
2026-03-14T07:36:44.411507	099964a4	0	0	0.0000	CRASH	gen=187 glyphs=4
2026-03-14T07:36:44.411703	181958d4	0	0	0.0000	CRASH	gen=187 glyphs=4
2026-03-14T07:36:44.411898	677819a8	0	0	0.0000	CRASH	gen=187 glyphs=3
2026-03-14T07:36:44.412092	cf93b656	0	0	0.0000	CRASH	gen=187 glyphs=3
2026-03-14T07:36:44.412284	7ede4765	0	0	0.0000	CRASH	gen=187 glyphs=2
2026-03-14T07:36:44.412480	099964a4	0	0	0.0000	CRASH	gen=187 glyphs=4
2026-03-14T07:36:44.412764	099964a4	0	0	0.0000	CRASH	gen=188 glyphs=4
2026-03-14T07:36:44.412959	099964a4	0	0	0.0000	CRASH	gen=188 glyphs=4
2026-03-14T07:36:44.413152	8a798f21	0	0	0.0000	CRASH	gen=188 glyphs=3
2026-03-14T07:36:44.413347	04b5f6e7	0	0	0.0000	CRASH	gen=188 glyphs=4
2026-03-14T07:36:44.413550	099964a4	0	0	0.0000	CRASH	gen=188 glyphs=4
2026-03-14T07:36:44.413741	eb37b47e	0	0	0.0000	CRASH	gen=188 glyphs=5
2026-03-14T07:36:44.413935	156d3823	0	0	0.0000	CRASH	gen=188 glyphs=2
2026-03-14T07:36:44.414127	2db3fbff	0	0	0.0000	CRASH	gen=188 glyphs=4
2026-03-14T07:36:44.414324	1ed94a49	0	0	0.0000	CRASH	gen=188 glyphs=4
2026-03-14T07:36:44.414526	7ede4765	0	0	0.0000	CRASH	gen=188 glyphs=2
2026-03-14T07:36:44.414797	099964a4	0	0	0.0000	CRASH	gen=189 glyphs=4
2026-03-14T07:36:44.414993	099964a4	0	0	0.0000	CRASH	gen=189 glyphs=4
2026-03-14T07:36:44.415187	4eb838b5	0	0	0.0000	CRASH	gen=189 glyphs=4
2026-03-14T07:36:44.415382	099964a4	0	0	0.0000	CRASH	gen=189 glyphs=4
2026-03-14T07:36:44.415582	099964a4	0	0	0.0000	CRASH	gen=189 glyphs=4
2026-03-14T07:36:44.415776	099964a4	0	0	0.0000	CRASH	gen=189 glyphs=4
2026-03-14T07:36:44.415967	099964a4	0	0	0.0000	CRASH	gen=189 glyphs=4
2026-03-14T07:36:44.416161	ff30496a	0	0	0.0000	CRASH	gen=189 glyphs=3
2026-03-14T07:36:44.416357	9816b9c0	0	0	0.0000	CRASH	gen=189 glyphs=4
2026-03-14T07:36:44.416554	3ca14993	0	0	0.0000	CRASH	gen=189 glyphs=4
2026-03-14T07:36:44.416835	099964a4	0	0	0.0000	CRASH	gen=190 glyphs=4
2026-03-14T07:36:44.417030	099964a4	0	0	0.0000	CRASH	gen=190 glyphs=4
2026-03-14T07:36:44.417223	099964a4	0	0	0.0000	CRASH	gen=190 glyphs=4
2026-03-14T07:36:44.417415	ff30496a	0	0	0.0000	CRASH	gen=190 glyphs=3
2026-03-14T07:36:44.417611	099964a4	0	0	0.0000	CRASH	gen=190 glyphs=4
2026-03-14T07:36:44.417803	099964a4	0	0	0.0000	CRASH	gen=190 glyphs=4
2026-03-14T07:36:44.417995	099964a4	0	0	0.0000	CRASH	gen=190 glyphs=4
2026-03-14T07:36:44.418186	099964a4	0	0	0.0000	CRASH	gen=190 glyphs=4
2026-03-14T07:36:44.418383	dcb1fb50	0	0	0.0000	CRASH	gen=190 glyphs=4
2026-03-14T07:36:44.418589	425b73cd	0	0	0.0000	CRASH	gen=190 glyphs=4
2026-03-14T07:36:44.418874	099964a4	0	0	0.0000	CRASH	gen=191 glyphs=4
2026-03-14T07:36:44.419070	099964a4	0	0	0.0000	CRASH	gen=191 glyphs=4
2026-03-14T07:36:44.419266	099964a4	0	0	0.0000	CRASH	gen=191 glyphs=4
2026-03-14T07:36:44.419462	cf93b656	0	0	0.0000	CRASH	gen=191 glyphs=3
2026-03-14T07:36:44.419660	8da1f8d8	0	0	0.0000	CRASH	gen=191 glyphs=4
2026-03-14T07:36:44.419860	da6f3ba9	0	0	0.0000	CRASH	gen=191 glyphs=4
2026-03-14T07:36:44.420056	099964a4	0	0	0.0000	CRASH	gen=191 glyphs=4
2026-03-14T07:36:44.420253	de763601	0	0	0.0000	CRASH	gen=191 glyphs=3
2026-03-14T07:36:44.420448	f444322a	0	0	0.0000	CRASH	gen=191 glyphs=4
2026-03-14T07:36:44.420647	519a6a78	0	0	0.0000	CRASH	gen=191 glyphs=4
2026-03-14T07:36:44.420933	099964a4	0	0	0.0000	CRASH	gen=192 glyphs=4
2026-03-14T07:36:44.421130	099964a4	0	0	0.0000	CRASH	gen=192 glyphs=4
2026-03-14T07:36:44.421324	666345c3	0	0	0.0000	CRASH	gen=192 glyphs=4
2026-03-14T07:36:44.421523	099964a4	0	0	0.0000	CRASH	gen=192 glyphs=4
2026-03-14T07:36:44.421717	099964a4	0	0	0.0000	CRASH	gen=192 glyphs=4
2026-03-14T07:36:44.421913	099964a4	0	0	0.0000	CRASH	gen=192 glyphs=4
2026-03-14T07:36:44.422107	5b201c7f	0	0	0.0000	CRASH	gen=192 glyphs=4
2026-03-14T07:36:44.422302	bbaa6f0d	0	0	0.0000	CRASH	gen=192 glyphs=4
2026-03-14T07:36:44.422497	01c3e0f8	0	0	0.0000	CRASH	gen=192 glyphs=4
2026-03-14T07:36:44.422694	cef2702e	0	0	0.0000	CRASH	gen=192 glyphs=5
2026-03-14T07:36:44.422985	099964a4	0	0	0.0000	CRASH	gen=193 glyphs=4
2026-03-14T07:36:44.423182	099964a4	0	0	0.0000	CRASH	gen=193 glyphs=4
2026-03-14T07:36:44.423376	13df0fcd	0	0	0.0000	CRASH	gen=193 glyphs=4
2026-03-14T07:36:44.423571	099964a4	0	0	0.0000	CRASH	gen=193 glyphs=4
2026-03-14T07:36:44.423764	80cef82b	0	0	0.0000	CRASH	gen=193 glyphs=4
2026-03-14T07:36:44.423960	f5e9dab1	0	0	0.0000	CRASH	gen=193 glyphs=4
2026-03-14T07:36:44.424160	099964a4	0	0	0.0000	CRASH	gen=193 glyphs=4
2026-03-14T07:36:44.424354	dcb1fb50	0	0	0.0000	CRASH	gen=193 glyphs=4
2026-03-14T07:36:44.424555	0a7fe6bc	0	0	0.0000	CRASH	gen=193 glyphs=4
2026-03-14T07:36:44.424747	099964a4	0	0	0.0000	CRASH	gen=193 glyphs=4
2026-03-14T07:36:44.425030	099964a4	0	0	0.0000	CRASH	gen=194 glyphs=4
2026-03-14T07:36:44.425229	099964a4	0	0	0.0000	CRASH	gen=194 glyphs=4
2026-03-14T07:36:44.425422	3a734398	0	0	0.0000	CRASH	gen=194 glyphs=4
2026-03-14T07:36:44.425618	debab2f6	0	0	0.0000	CRASH	gen=194 glyphs=5
2026-03-14T07:36:44.425813	cf93b656	0	0	0.0000	CRASH	gen=194 glyphs=3
2026-03-14T07:36:44.426006	1ae39a73	0	0	0.0000	CRASH	gen=194 glyphs=4
2026-03-14T07:36:44.426203	8ff3b754	0	0	0.0000	CRASH	gen=194 glyphs=3
2026-03-14T07:36:44.426394	099964a4	0	0	0.0000	CRASH	gen=194 glyphs=4
2026-03-14T07:36:44.426591	099964a4	0	0	0.0000	CRASH	gen=194 glyphs=4
2026-03-14T07:36:44.426782	cf93b656	0	0	0.0000	CRASH	gen=194 glyphs=3
2026-03-14T07:36:44.427057	099964a4	0	0	0.0000	CRASH	gen=195 glyphs=4
2026-03-14T07:36:44.427257	099964a4	0	0	0.0000	CRASH	gen=195 glyphs=4
2026-03-14T07:36:44.427451	80cef82b	0	0	0.0000	CRASH	gen=195 glyphs=4
2026-03-14T07:36:44.427648	3ca14993	0	0	0.0000	CRASH	gen=195 glyphs=4
2026-03-14T07:36:44.427842	099964a4	0	0	0.0000	CRASH	gen=195 glyphs=4
2026-03-14T07:36:44.428034	dcb1fb50	0	0	0.0000	CRASH	gen=195 glyphs=4
2026-03-14T07:36:44.428228	ff30496a	0	0	0.0000	CRASH	gen=195 glyphs=3
2026-03-14T07:36:44.428423	134a2664	0	0	0.0000	CRASH	gen=195 glyphs=2
2026-03-14T07:36:44.428618	099964a4	0	0	0.0000	CRASH	gen=195 glyphs=4
2026-03-14T07:36:44.428809	04f1fa9e	0	0	0.0000	CRASH	gen=195 glyphs=3
2026-03-14T07:36:44.429086	099964a4	0	0	0.0000	CRASH	gen=196 glyphs=4
2026-03-14T07:36:44.429282	099964a4	0	0	0.0000	CRASH	gen=196 glyphs=4
2026-03-14T07:36:44.429481	cf93b656	0	0	0.0000	CRASH	gen=196 glyphs=3
2026-03-14T07:36:44.429677	bfb687fd	0	0	0.0000	CRASH	gen=196 glyphs=4
2026-03-14T07:36:44.429871	dcb1fb50	0	0	0.0000	CRASH	gen=196 glyphs=4
2026-03-14T07:36:44.430063	099964a4	0	0	0.0000	CRASH	gen=196 glyphs=4
2026-03-14T07:36:44.430257	485ec36d	0	0	0.0000	CRASH	gen=196 glyphs=4
2026-03-14T07:36:44.430448	099964a4	0	0	0.0000	CRASH	gen=196 glyphs=4
2026-03-14T07:36:44.430655	8da1f8d8	0	0	0.0000	CRASH	gen=196 glyphs=4
2026-03-14T07:36:44.430850	099964a4	0	0	0.0000	CRASH	gen=196 glyphs=4
2026-03-14T07:36:44.431129	099964a4	0	0	0.0000	CRASH	gen=197 glyphs=4
2026-03-14T07:36:44.431329	099964a4	0	0	0.0000	CRASH	gen=197 glyphs=4
2026-03-14T07:36:44.431542	1032711e	0	0	0.0000	CRASH	gen=197 glyphs=4
2026-03-14T07:36:44.431753	8a7062c0	0	0	0.0000	CRASH	gen=197 glyphs=3
2026-03-14T07:36:44.431961	099964a4	0	0	0.0000	CRASH	gen=197 glyphs=4
2026-03-14T07:36:44.432171	099964a4	0	0	0.0000	CRASH	gen=197 glyphs=4
2026-03-14T07:36:44.432376	099964a4	0	0	0.0000	CRASH	gen=197 glyphs=4
2026-03-14T07:36:44.432576	099964a4	0	0	0.0000	CRASH	gen=197 glyphs=4
2026-03-14T07:36:44.432786	099964a4	0	0	0.0000	CRASH	gen=197 glyphs=4
2026-03-14T07:36:44.432982	099964a4	0	0	0.0000	CRASH	gen=197 glyphs=4
2026-03-14T07:36:44.433248	099964a4	0	0	0.0000	CRASH	gen=198 glyphs=4
2026-03-14T07:36:44.433441	099964a4	0	0	0.0000	CRASH	gen=198 glyphs=4
2026-03-14T07:36:44.433638	31647c79	0	0	0.0000	CRASH	gen=198 glyphs=4
2026-03-14T07:36:44.433835	cf93b656	0	0	0.0000	CRASH	gen=198 glyphs=3
2026-03-14T07:36:44.434029	ff30496a	0	0	0.0000	CRASH	gen=198 glyphs=3
2026-03-14T07:36:44.434223	099964a4	0	0	0.0000	CRASH	gen=198 glyphs=4
2026-03-14T07:36:44.434417	099964a4	0	0	0.0000	CRASH	gen=198 glyphs=4
2026-03-14T07:36:44.434611	099964a4	0	0	0.0000	CRASH	gen=198 glyphs=4
2026-03-14T07:36:44.434813	099964a4	0	0	0.0000	CRASH	gen=198 glyphs=4
2026-03-14T07:36:44.435006	099964a4	0	0	0.0000	CRASH	gen=198 glyphs=4
2026-03-14T07:36:44.435295	099964a4	0	0	0.0000	CRASH	gen=199 glyphs=4
2026-03-14T07:36:44.435491	099964a4	0	0	0.0000	CRASH	gen=199 glyphs=4
2026-03-14T07:36:44.435689	7364c151	0	0	0.0000	CRASH	gen=199 glyphs=4
2026-03-14T07:36:44.435894	32f2a7a2	0	0	0.0000	CRASH	gen=199 glyphs=3
2026-03-14T07:36:44.436090	d294bd95	0	0	0.0000	CRASH	gen=199 glyphs=5
2026-03-14T07:36:44.436286	099964a4	0	0	0.0000	CRASH	gen=199 glyphs=4
2026-03-14T07:36:44.436480	099964a4	0	0	0.0000	CRASH	gen=199 glyphs=4
2026-03-14T07:36:44.436676	ba1cb072	0	0	0.0000	CRASH	gen=199 glyphs=3
2026-03-14T07:36:44.436878	ff30496a	0	0	0.0000	CRASH	gen=199 glyphs=3
2026-03-14T07:36:44.437069	a6bfb138	0	0	0.0000	CRASH	gen=199 glyphs=5
2026-03-14T07:36:44.437366	099964a4	0	0	0.0000	CRASH	gen=200 glyphs=4
2026-03-14T07:36:44.437567	099964a4	0	0	0.0000	CRASH	gen=200 glyphs=4
2026-03-14T07:36:44.437764	099964a4	0	0	0.0000	CRASH	gen=200 glyphs=4
2026-03-14T07:36:44.437961	55ab2d0a	0	0	0.0000	CRASH	gen=200 glyphs=4
2026-03-14T07:36:44.438155	099964a4	0	0	0.0000	CRASH	gen=200 glyphs=4
2026-03-14T07:36:44.438347	099964a4	0	0	0.0000	CRASH	gen=200 glyphs=4
2026-03-14T07:36:44.438539	099964a4	0	0	0.0000	CRASH	gen=200 glyphs=4
2026-03-14T07:36:44.438731	3ca14993	0	0	0.0000	CRASH	gen=200 glyphs=4
