timestamp	program_hash	spirv_size	word_count	fitness	status	description
2026-03-14T02:21:39.415090	37f4017b	116	29	1.0000	DISCARD	gen=534 glyphs=4
2026-03-14T02:21:39.686422	3fb56e7c	120	30	1.0000	DISCARD	gen=578 glyphs=4
2026-03-14T02:21:42.185600	71e2ba66	116	29	1.0000	DISCARD	gen=534 glyphs=4
2026-03-14T02:21:42.473670	1f948051	116	29	1.0000	DISCARD	gen=578 glyphs=4
2026-03-14T02:21:45.069271	1d34459a	116	29	1.0000	DISCARD	gen=534 glyphs=4
2026-03-14T02:21:45.351990	0eaedb57	116	29	1.0000	DISCARD	gen=578 glyphs=4
2026-03-14T02:21:47.829937	12b38c2d	116	29	1.0000	DISCARD	gen=534 glyphs=4
2026-03-14T02:21:48.116740	19355583	120	30	1.0000	DISCARD	gen=578 glyphs=4
2026-03-14T02:21:50.612053	55d6c151	120	30	1.0000	DISCARD	gen=534 glyphs=4
2026-03-14T02:21:50.883137	0eaedb57	116	29	1.0000	DISCARD	gen=578 glyphs=4
2026-03-14T02:21:53.367788	1d34459a	116	29	1.0000	DISCARD	gen=534 glyphs=4
2026-03-14T02:21:53.633789	fef5a852	116	29	1.0000	DISCARD	gen=578 glyphs=4
2026-03-14T02:21:56.127150	5a06ca32	120	30	1.0000	DISCARD	gen=534 glyphs=4
2026-03-14T02:21:56.399049	e2f866f8	116	29	1.0000	DISCARD	gen=578 glyphs=4
2026-03-14T02:21:58.867347	37f4017b	116	29	1.0000	DISCARD	gen=535 glyphs=4
2026-03-14T02:21:59.149192	f163562f	116	29	1.0000	DISCARD	gen=578 glyphs=4
2026-03-14T02:22:01.611716	bfdf7cad	120	30	1.0000	DISCARD	gen=535 glyphs=4
2026-03-14T02:22:01.868175	19355583	120	30	1.0000	DISCARD	gen=579 glyphs=4
2026-03-14T02:22:04.354160	71e2ba66	116	29	1.0000	DISCARD	gen=535 glyphs=4
2026-03-14T02:22:04.635939	8aef8872	116	29	1.0000	DISCARD	gen=579 glyphs=4
2026-03-14T02:22:07.126106	3a5e495e	120	30	1.0000	DISCARD	gen=535 glyphs=4
2026-03-14T02:22:07.394155	0eaedb57	116	29	1.0000	DISCARD	gen=579 glyphs=4
2026-03-14T02:22:09.893383	0a1ac75b	120	30	1.0000	DISCARD	gen=535 glyphs=4
2026-03-14T02:22:10.158377	ac94ff9c	116	29	0.9500	DISCARD	gen=579 glyphs=4
2026-03-14T02:22:12.628093	37f4017b	116	29	1.0000	DISCARD	gen=535 glyphs=4
2026-03-14T02:22:12.898261	050862ad	120	30	1.0000	DISCARD	gen=579 glyphs=4
2026-03-14T02:22:15.406969	df5f90fb	116	29	1.0000	DISCARD	gen=535 glyphs=4
2026-03-14T02:22:15.693460	050862ad	120	30	1.0000	DISCARD	gen=579 glyphs=4
2026-03-14T02:22:18.160968	d98b0299	116	29	1.0000	DISCARD	gen=535 glyphs=4
2026-03-14T02:22:18.441173	b57e7176	120	30	1.0000	DISCARD	gen=579 glyphs=4
2026-03-14T02:22:20.917375	2d32fe15	116	29	1.0000	DISCARD	gen=535 glyphs=4
2026-03-14T02:22:21.190200	b57e7176	120	30	1.0000	DISCARD	gen=579 glyphs=4
2026-03-14T02:22:23.643607	5a06ca32	120	30	1.0000	DISCARD	gen=535 glyphs=4
2026-03-14T02:22:23.918425	4eb642b2	116	29	1.0000	DISCARD	gen=579 glyphs=4
2026-03-14T02:22:26.390926	37f4017b	116	29	1.0000	DISCARD	gen=536 glyphs=4
2026-03-14T02:22:26.666283	875e0f8a	116	29	1.0000	DISCARD	gen=579 glyphs=4
2026-03-14T02:22:29.151108	bfdf7cad	120	30	1.0000	DISCARD	gen=536 glyphs=4
2026-03-14T02:22:29.419537	19355583	120	30	1.0000	DISCARD	gen=580 glyphs=4
2026-03-14T02:22:31.883315	37f4017b	116	29	1.0000	DISCARD	gen=536 glyphs=4
2026-03-14T02:22:32.157844	8aef8872	116	29	1.0000	DISCARD	gen=580 glyphs=4
2026-03-14T02:22:34.644370	5a06ca32	120	30	1.0000	DISCARD	gen=536 glyphs=4
2026-03-14T02:22:34.908631	19355583	120	30	1.0000	DISCARD	gen=580 glyphs=4
2026-03-14T02:22:37.394671	d34246a4	116	29	1.0000	DISCARD	gen=536 glyphs=4
2026-03-14T02:22:37.664950	9e34ede0	116	29	1.0000	DISCARD	gen=580 glyphs=4
2026-03-14T02:22:40.150410	37f4017b	116	29	1.0000	DISCARD	gen=536 glyphs=4
2026-03-14T02:22:40.423278	261100fa	116	29	1.0000	DISCARD	gen=580 glyphs=4
2026-03-14T02:22:42.893355	37f4017b	116	29	1.0000	DISCARD	gen=536 glyphs=4
2026-03-14T02:22:43.165205	1c6537db	116	29	1.0000	DISCARD	gen=580 glyphs=4
2026-03-14T02:22:45.626694	55d6c151	120	30	1.0000	DISCARD	gen=536 glyphs=4
2026-03-14T02:22:45.890864	9e34ede0	116	29	1.0000	DISCARD	gen=580 glyphs=4
2026-03-14T02:22:48.534045	37f4017b	116	29	1.0000	DISCARD	gen=536 glyphs=4
2026-03-14T02:22:48.802959	935c4b37	116	29	1.0000	DISCARD	gen=580 glyphs=4
2026-03-14T02:22:51.306935	1d34459a	116	29	1.0000	DISCARD	gen=536 glyphs=4
2026-03-14T02:22:51.581796	eb7ddc9c	120	30	1.0000	DISCARD	gen=580 glyphs=4
2026-03-14T02:22:54.027736	37f4017b	116	29	1.0000	DISCARD	gen=537 glyphs=4
2026-03-14T02:22:54.306803	050862ad	120	30	1.0000	DISCARD	gen=580 glyphs=4
2026-03-14T02:22:56.763229	bfdf7cad	120	30	1.0000	DISCARD	gen=537 glyphs=4
2026-03-14T02:22:57.029118	19355583	120	30	1.0000	DISCARD	gen=581 glyphs=4
2026-03-14T02:22:59.507886	55d6c151	120	30	1.0000	DISCARD	gen=537 glyphs=4
2026-03-14T02:22:59.791625	8aef8872	116	29	1.0000	DISCARD	gen=581 glyphs=4
2026-03-14T02:23:02.264222	55d6c151	120	30	1.0000	DISCARD	gen=537 glyphs=4
2026-03-14T02:23:02.544133	50dc991d	116	29	1.0000	DISCARD	gen=581 glyphs=4
2026-03-14T02:23:04.994548	2701cb73	116	29	1.0000	DISCARD	gen=537 glyphs=4
2026-03-14T02:23:05.270644	0eaedb57	116	29	1.0000	DISCARD	gen=581 glyphs=4
2026-03-14T02:23:07.760186	5a06ca32	120	30	1.0000	DISCARD	gen=537 glyphs=4
2026-03-14T02:23:08.040532	0eaedb57	116	29	1.0000	DISCARD	gen=581 glyphs=4
2026-03-14T02:23:10.530106	c3e3e453	116	29	1.0000	DISCARD	gen=537 glyphs=4
2026-03-14T02:23:10.791952	19355583	120	30	1.0000	DISCARD	gen=581 glyphs=4
2026-03-14T02:23:13.276545	cbd381c4	116	29	0.9500	DISCARD	gen=537 glyphs=4
2026-03-14T02:23:13.557862	70fe4fc0	116	29	1.0000	DISCARD	gen=581 glyphs=4
2026-03-14T02:23:16.016038	37f4017b	116	29	1.0000	DISCARD	gen=537 glyphs=4
2026-03-14T02:23:16.287607	19355583	120	30	1.0000	DISCARD	gen=581 glyphs=4
2026-03-14T02:23:18.780105	55d6c151	120	30	1.0000	DISCARD	gen=537 glyphs=4
2026-03-14T02:23:19.062067	b57e7176	120	30	1.0000	DISCARD	gen=581 glyphs=4
2026-03-14T02:23:21.562989	37f4017b	116	29	1.0000	DISCARD	gen=538 glyphs=4
2026-03-14T02:23:21.834433	1e5f0e21	116	29	1.0000	DISCARD	gen=581 glyphs=4
2026-03-14T02:23:24.290953	bfdf7cad	120	30	1.0000	DISCARD	gen=538 glyphs=4
2026-03-14T02:23:24.574825	19355583	120	30	1.0000	DISCARD	gen=582 glyphs=4
2026-03-14T02:23:27.023844	ed414374	120	30	1.0000	DISCARD	gen=538 glyphs=4
2026-03-14T02:23:27.303246	8aef8872	116	29	1.0000	DISCARD	gen=582 glyphs=4
2026-03-14T02:23:29.756671	250fbac3	120	30	1.0000	DISCARD	gen=538 glyphs=4
2026-03-14T02:23:30.026425	4ac49e19	120	30	1.0000	DISCARD	gen=582 glyphs=4
2026-03-14T02:23:32.505630	37f4017b	116	29	1.0000	DISCARD	gen=538 glyphs=4
2026-03-14T02:23:32.794563	050862ad	120	30	1.0000	DISCARD	gen=582 glyphs=4
2026-03-14T02:23:35.271062	37f4017b	116	29	1.0000	DISCARD	gen=538 glyphs=4
2026-03-14T02:23:35.548837	8aef8872	116	29	1.0000	DISCARD	gen=582 glyphs=4
2026-03-14T02:23:38.012328	13a23338	120	30	1.0000	DISCARD	gen=538 glyphs=4
2026-03-14T02:23:38.276810	67cb81be	120	30	1.0000	DISCARD	gen=582 glyphs=4
2026-03-14T02:23:40.733798	b8d2bd5c	116	29	1.0000	DISCARD	gen=538 glyphs=4
2026-03-14T02:23:41.000535	0eaedb57	116	29	1.0000	DISCARD	gen=582 glyphs=4
2026-03-14T02:23:43.448693	5a06ca32	120	30	1.0000	DISCARD	gen=538 glyphs=4
2026-03-14T02:23:43.725130	050862ad	120	30	1.0000	DISCARD	gen=582 glyphs=4
2026-03-14T02:23:46.206431	7ca87b42	116	29	1.0000	DISCARD	gen=538 glyphs=4
2026-03-14T02:23:46.484401	ac567cd1	120	30	1.0000	DISCARD	gen=582 glyphs=4
2026-03-14T02:23:48.905029	37f4017b	116	29	1.0000	DISCARD	gen=539 glyphs=4
2026-03-14T02:23:49.178064	19355583	120	30	1.0000	DISCARD	gen=582 glyphs=4
2026-03-14T02:23:51.756302	bfdf7cad	120	30	1.0000	DISCARD	gen=539 glyphs=4
2026-03-14T02:23:52.030692	19355583	120	30	1.0000	DISCARD	gen=583 glyphs=4
2026-03-14T02:23:54.466414	37f4017b	116	29	1.0000	DISCARD	gen=539 glyphs=4
2026-03-14T02:23:54.732833	8aef8872	116	29	1.0000	DISCARD	gen=583 glyphs=4
2026-03-14T02:23:57.236357	3d5108e6	116	29	1.0000	DISCARD	gen=539 glyphs=4
2026-03-14T02:23:57.504474	f6cc083e	120	30	1.0000	DISCARD	gen=583 glyphs=4
2026-03-14T02:24:00.009185	d11c1062	120	30	1.0000	DISCARD	gen=539 glyphs=4
2026-03-14T02:24:00.277681	14962435	116	29	1.0000	DISCARD	gen=583 glyphs=4
2026-03-14T02:24:02.767539	37f4017b	116	29	1.0000	DISCARD	gen=539 glyphs=4
2026-03-14T02:24:03.040598	9ee2fcb0	116	29	1.0000	DISCARD	gen=583 glyphs=4
2026-03-14T02:24:05.502659	5a06ca32	120	30	1.0000	DISCARD	gen=539 glyphs=4
2026-03-14T02:24:05.786662	67cb81be	120	30	1.0000	DISCARD	gen=583 glyphs=4
2026-03-14T02:24:08.285046	79378561	124	31	0.9500	DISCARD	gen=539 glyphs=4
2026-03-14T02:24:08.578410	24abc9d3	116	29	1.0000	DISCARD	gen=583 glyphs=4
2026-03-14T02:24:11.046746	5a06ca32	120	30	1.0000	DISCARD	gen=539 glyphs=4
2026-03-14T02:24:11.322094	8aef8872	116	29	1.0000	DISCARD	gen=583 glyphs=4
2026-03-14T02:24:13.785107	bfdf7cad	120	30	1.0000	DISCARD	gen=539 glyphs=4
2026-03-14T02:24:14.062837	67cb81be	120	30	1.0000	DISCARD	gen=583 glyphs=4
2026-03-14T02:24:16.540723	37f4017b	116	29	1.0000	DISCARD	gen=540 glyphs=4
2026-03-14T02:24:16.814912	b7aed8e9	116	29	1.0000	DISCARD	gen=583 glyphs=4
2026-03-14T02:24:19.290438	bfdf7cad	120	30	1.0000	DISCARD	gen=540 glyphs=4
2026-03-14T02:24:19.554243	19355583	120	30	1.0000	DISCARD	gen=584 glyphs=4
2026-03-14T02:24:22.076365	4c9b0dd4	120	30	1.0000	DISCARD	gen=540 glyphs=4
2026-03-14T02:24:22.373340	8aef8872	116	29	1.0000	DISCARD	gen=584 glyphs=4
2026-03-14T02:24:24.918582	19dd4f9e	116	29	1.0000	DISCARD	gen=540 glyphs=4
2026-03-14T02:24:25.196928	885eb36f	116	29	1.0000	DISCARD	gen=584 glyphs=4
2026-03-14T02:24:27.688521	4c9b0dd4	120	30	1.0000	DISCARD	gen=540 glyphs=4
2026-03-14T02:24:27.965017	19355583	120	30	1.0000	DISCARD	gen=584 glyphs=4
2026-03-14T02:24:30.443578	a21a1ec5	116	29	1.0000	DISCARD	gen=540 glyphs=4
2026-03-14T02:24:30.724190	9e34ede0	116	29	1.0000	DISCARD	gen=584 glyphs=4
2026-03-14T02:24:33.180281	37f4017b	116	29	1.0000	DISCARD	gen=540 glyphs=4
2026-03-14T02:24:33.458541	050862ad	120	30	1.0000	DISCARD	gen=584 glyphs=4
2026-03-14T02:24:35.941423	5a06ca32	120	30	1.0000	DISCARD	gen=540 glyphs=4
2026-03-14T02:24:36.217712	8aef8872	116	29	1.0000	DISCARD	gen=584 glyphs=4
2026-03-14T02:24:38.683718	55d6c151	120	30	1.0000	DISCARD	gen=540 glyphs=4
2026-03-14T02:24:38.955452	e2cd28ea	120	30	1.0000	DISCARD	gen=584 glyphs=4
2026-03-14T02:24:41.428680	5a06ca32	120	30	1.0000	DISCARD	gen=540 glyphs=4
2026-03-14T02:24:41.695991	0eaedb57	116	29	1.0000	DISCARD	gen=584 glyphs=4
2026-03-14T02:24:44.199697	37f4017b	116	29	1.0000	DISCARD	gen=541 glyphs=4
2026-03-14T02:24:44.474595	8aef8872	116	29	1.0000	DISCARD	gen=584 glyphs=4
2026-03-14T02:24:46.948949	bfdf7cad	120	30	1.0000	DISCARD	gen=541 glyphs=4
2026-03-14T02:24:47.223344	19355583	120	30	1.0000	DISCARD	gen=585 glyphs=4
2026-03-14T02:24:49.670019	55d6c151	120	30	1.0000	DISCARD	gen=541 glyphs=4
2026-03-14T02:24:49.939730	8aef8872	116	29	1.0000	DISCARD	gen=585 glyphs=4
2026-03-14T02:24:52.426113	4c9b0dd4	120	30	1.0000	DISCARD	gen=541 glyphs=4
2026-03-14T02:24:52.703308	104362cf	116	29	1.0000	DISCARD	gen=585 glyphs=4
2026-03-14T02:24:55.276563	5a06ca32	120	30	1.0000	DISCARD	gen=541 glyphs=4
2026-03-14T02:24:55.555321	050862ad	120	30	1.0000	DISCARD	gen=585 glyphs=4
2026-03-14T02:24:58.036553	21d08372	116	29	0.9500	DISCARD	gen=541 glyphs=4
2026-03-14T02:24:58.317345	19355583	120	30	1.0000	DISCARD	gen=585 glyphs=4
2026-03-14T02:25:00.771860	37f4017b	116	29	1.0000	DISCARD	gen=541 glyphs=4
2026-03-14T02:25:01.045156	e2cd28ea	120	30	1.0000	DISCARD	gen=585 glyphs=4
2026-03-14T02:25:03.531819	5b9807ac	120	30	1.0000	DISCARD	gen=541 glyphs=4
2026-03-14T02:25:03.826137	1e5f0e21	116	29	1.0000	DISCARD	gen=585 glyphs=4
2026-03-14T02:25:06.275339	d11c1062	120	30	1.0000	DISCARD	gen=541 glyphs=4
2026-03-14T02:25:06.557922	f9cc6b1c	116	29	1.0000	DISCARD	gen=585 glyphs=4
2026-03-14T02:25:09.021764	37f4017b	116	29	1.0000	DISCARD	gen=541 glyphs=4
2026-03-14T02:25:09.311899	e1684732	120	30	1.0000	DISCARD	gen=585 glyphs=4
2026-03-14T02:25:11.782490	37f4017b	116	29	1.0000	DISCARD	gen=542 glyphs=4
2026-03-14T02:25:12.050295	eca7ab6c	116	29	1.0000	DISCARD	gen=585 glyphs=4
2026-03-14T02:25:14.505334	bfdf7cad	120	30	1.0000	DISCARD	gen=542 glyphs=4
2026-03-14T02:25:14.784394	19355583	120	30	1.0000	DISCARD	gen=586 glyphs=4
2026-03-14T02:25:17.263619	5a06ca32	120	30	1.0000	DISCARD	gen=542 glyphs=4
2026-03-14T02:25:17.546086	8aef8872	116	29	1.0000	DISCARD	gen=586 glyphs=4
2026-03-14T02:25:20.015916	5a06ca32	120	30	1.0000	DISCARD	gen=542 glyphs=4
2026-03-14T02:25:20.289509	0eaedb57	116	29	1.0000	DISCARD	gen=586 glyphs=4
2026-03-14T02:25:22.795192	1d34459a	116	29	1.0000	DISCARD	gen=542 glyphs=4
2026-03-14T02:25:23.058297	050862ad	120	30	1.0000	DISCARD	gen=586 glyphs=4
2026-03-14T02:25:25.658605	d42b7d85	116	29	1.0000	DISCARD	gen=542 glyphs=4
2026-03-14T02:25:25.937825	e2cd28ea	120	30	1.0000	DISCARD	gen=586 glyphs=4
2026-03-14T02:25:28.407825	1d34459a	116	29	1.0000	DISCARD	gen=542 glyphs=4
2026-03-14T02:25:28.693376	050862ad	120	30	1.0000	DISCARD	gen=586 glyphs=4
2026-03-14T02:25:31.159066	5a06ca32	120	30	1.0000	DISCARD	gen=542 glyphs=4
2026-03-14T02:25:31.435842	3da2084a	116	29	1.0000	DISCARD	gen=586 glyphs=4
2026-03-14T02:25:33.924229	4eb609d7	116	29	1.0000	DISCARD	gen=542 glyphs=4
2026-03-14T02:25:34.210316	9e34ede0	116	29	1.0000	DISCARD	gen=586 glyphs=4
2026-03-14T02:25:36.675827	1acf6c97	116	29	1.0000	DISCARD	gen=542 glyphs=4
2026-03-14T02:25:36.965912	e4613519	116	29	1.0000	DISCARD	gen=586 glyphs=4
2026-03-14T02:25:39.454107	37f4017b	116	29	1.0000	DISCARD	gen=543 glyphs=4
2026-03-14T02:25:39.728147	b7aed8e9	116	29	1.0000	DISCARD	gen=586 glyphs=4
2026-03-14T02:25:42.200642	bfdf7cad	120	30	1.0000	DISCARD	gen=543 glyphs=4
2026-03-14T02:25:42.471584	19355583	120	30	1.0000	DISCARD	gen=587 glyphs=4
2026-03-14T02:25:44.979419	5b9807ac	120	30	1.0000	DISCARD	gen=543 glyphs=4
2026-03-14T02:25:45.251920	8aef8872	116	29	1.0000	DISCARD	gen=587 glyphs=4
2026-03-14T02:25:47.744083	4c9b0dd4	120	30	1.0000	DISCARD	gen=543 glyphs=4
2026-03-14T02:25:48.021378	8aef8872	116	29	1.0000	DISCARD	gen=587 glyphs=4
2026-03-14T02:25:50.530007	2701cb73	116	29	1.0000	DISCARD	gen=543 glyphs=4
2026-03-14T02:25:50.799717	e2cd28ea	120	30	1.0000	DISCARD	gen=587 glyphs=4
2026-03-14T02:25:53.278809	189756f4	116	29	1.0000	DISCARD	gen=543 glyphs=4
2026-03-14T02:25:53.552911	8aef8872	116	29	1.0000	DISCARD	gen=587 glyphs=4
2026-03-14T02:25:56.065976	7ca87b42	116	29	1.0000	DISCARD	gen=543 glyphs=4
2026-03-14T02:25:56.330195	8aef8872	116	29	1.0000	DISCARD	gen=587 glyphs=4
2026-03-14T02:25:58.842550	55d6c151	120	30	1.0000	DISCARD	gen=543 glyphs=4
2026-03-14T02:25:59.112767	8aef8872	116	29	1.0000	DISCARD	gen=587 glyphs=4
2026-03-14T02:26:01.585362	5a06ca32	120	30	1.0000	DISCARD	gen=543 glyphs=4
2026-03-14T02:26:01.849416	a78f9454	120	30	1.0000	DISCARD	gen=587 glyphs=4
2026-03-14T02:26:04.351607	37f4017b	116	29	1.0000	DISCARD	gen=543 glyphs=4
2026-03-14T02:26:04.636209	1e5f0e21	116	29	1.0000	DISCARD	gen=587 glyphs=4
2026-03-14T02:26:07.109428	37f4017b	116	29	1.0000	DISCARD	gen=544 glyphs=4
2026-03-14T02:26:07.386429	9e34ede0	116	29	1.0000	DISCARD	gen=587 glyphs=4
2026-03-14T02:26:09.849306	bfdf7cad	120	30	1.0000	DISCARD	gen=544 glyphs=4
2026-03-14T02:26:10.142814	19355583	120	30	1.0000	DISCARD	gen=588 glyphs=4
2026-03-14T02:26:12.590316	fdb5d108	120	30	1.0000	DISCARD	gen=544 glyphs=4
2026-03-14T02:26:12.863951	8aef8872	116	29	1.0000	DISCARD	gen=588 glyphs=4
2026-03-14T02:26:15.346359	4f66b6c3	116	29	1.0000	DISCARD	gen=544 glyphs=4
2026-03-14T02:26:15.625079	19355583	120	30	1.0000	DISCARD	gen=588 glyphs=4
2026-03-14T02:26:18.062531	7ca87b42	116	29	1.0000	DISCARD	gen=544 glyphs=4
2026-03-14T02:26:18.340069	7627c2c1	116	29	0.9500	DISCARD	gen=588 glyphs=4
2026-03-14T02:26:20.851526	972e2229	120	30	1.0000	DISCARD	gen=544 glyphs=4
2026-03-14T02:26:21.132244	12e81f60	120	30	1.0000	DISCARD	gen=588 glyphs=4
2026-03-14T02:26:23.612259	46f69130	116	29	1.0000	DISCARD	gen=544 glyphs=4
2026-03-14T02:26:23.876116	766fb233	116	29	1.0000	DISCARD	gen=588 glyphs=4
2026-03-14T02:26:26.326883	724b0f88	116	29	1.0000	DISCARD	gen=544 glyphs=4
2026-03-14T02:26:26.603020	8aef8872	116	29	1.0000	DISCARD	gen=588 glyphs=4
2026-03-14T02:26:29.091500	55d6c151	120	30	1.0000	DISCARD	gen=544 glyphs=4
2026-03-14T02:26:29.373874	19355583	120	30	1.0000	DISCARD	gen=588 glyphs=4
2026-03-14T02:26:31.896046	37f4017b	116	29	1.0000	DISCARD	gen=544 glyphs=4
2026-03-14T02:26:32.171800	b57e7176	120	30	1.0000	DISCARD	gen=588 glyphs=4
2026-03-14T02:26:34.629979	37f4017b	116	29	1.0000	DISCARD	gen=545 glyphs=4
2026-03-14T02:26:34.906365	ae44ace5	116	29	1.0000	DISCARD	gen=588 glyphs=4
2026-03-14T02:26:37.379170	bfdf7cad	120	30	1.0000	DISCARD	gen=545 glyphs=4
2026-03-14T02:26:37.661452	19355583	120	30	1.0000	DISCARD	gen=589 glyphs=4
2026-03-14T02:26:40.116807	37f4017b	116	29	1.0000	DISCARD	gen=545 glyphs=4
2026-03-14T02:26:40.389669	8aef8872	116	29	1.0000	DISCARD	gen=589 glyphs=4
2026-03-14T02:26:42.867930	77ba6cba	120	30	1.0000	DISCARD	gen=545 glyphs=4
2026-03-14T02:26:43.136383	e2cd28ea	120	30	1.0000	DISCARD	gen=589 glyphs=4
2026-03-14T02:26:45.612507	5a06ca32	120	30	1.0000	DISCARD	gen=545 glyphs=4
2026-03-14T02:26:45.888303	8aef8872	116	29	1.0000	DISCARD	gen=589 glyphs=4
2026-03-14T02:26:48.342687	22ac2a98	120	30	1.0000	DISCARD	gen=545 glyphs=4
2026-03-14T02:26:48.616721	0eaedb57	116	29	1.0000	DISCARD	gen=589 glyphs=4
2026-03-14T02:26:51.077966	5a06ca32	120	30	1.0000	DISCARD	gen=545 glyphs=4
2026-03-14T02:26:51.349685	19355583	120	30	1.0000	DISCARD	gen=589 glyphs=4
2026-03-14T02:26:53.817199	fbd37546	116	29	0.9500	DISCARD	gen=545 glyphs=4
2026-03-14T02:26:54.090545	eca7ab6c	116	29	1.0000	DISCARD	gen=589 glyphs=4
2026-03-14T02:26:56.549238	55d6c151	120	30	1.0000	DISCARD	gen=545 glyphs=4
2026-03-14T02:26:56.831813	4cd3f318	120	30	1.0000	DISCARD	gen=589 glyphs=4
2026-03-14T02:26:59.296736	37f4017b	116	29	1.0000	DISCARD	gen=545 glyphs=4
2026-03-14T02:26:59.577357	5e86065d	116	29	1.0000	DISCARD	gen=589 glyphs=4
2026-03-14T02:27:02.149178	37f4017b	116	29	1.0000	DISCARD	gen=546 glyphs=4
2026-03-14T02:27:02.432874	19355583	120	30	1.0000	DISCARD	gen=589 glyphs=4
2026-03-14T02:27:04.907305	bfdf7cad	120	30	1.0000	DISCARD	gen=546 glyphs=4
2026-03-14T02:27:05.181603	19355583	120	30	1.0000	DISCARD	gen=590 glyphs=4
2026-03-14T02:27:07.625383	55d6c151	120	30	1.0000	DISCARD	gen=546 glyphs=4
2026-03-14T02:27:07.895448	8aef8872	116	29	1.0000	DISCARD	gen=590 glyphs=4
2026-03-14T02:27:10.381548	37f4017b	116	29	1.0000	DISCARD	gen=546 glyphs=4
2026-03-14T02:27:10.658442	36849a2a	116	29	0.8500	DISCARD	gen=590 glyphs=4
2026-03-14T02:27:13.132751	5a06ca32	120	30	1.0000	DISCARD	gen=546 glyphs=4
2026-03-14T02:27:13.404010	19355583	120	30	1.0000	DISCARD	gen=590 glyphs=4
2026-03-14T02:27:15.834977	fdb5d108	120	30	1.0000	DISCARD	gen=546 glyphs=4
2026-03-14T02:27:16.111859	b7aed8e9	116	29	1.0000	DISCARD	gen=590 glyphs=4
2026-03-14T02:27:18.590274	e119fe29	116	29	1.0000	DISCARD	gen=546 glyphs=4
2026-03-14T02:27:18.858721	44bc330f	116	29	1.0000	DISCARD	gen=590 glyphs=4
2026-03-14T02:27:21.338995	fdb5d108	120	30	1.0000	DISCARD	gen=546 glyphs=4
2026-03-14T02:27:21.602040	0eaedb57	116	29	1.0000	DISCARD	gen=590 glyphs=4
2026-03-14T02:27:24.086924	55d6c151	120	30	1.0000	DISCARD	gen=546 glyphs=4
2026-03-14T02:27:24.365240	50dc991d	116	29	1.0000	DISCARD	gen=590 glyphs=4
2026-03-14T02:27:26.866928	12b38c2d	116	29	1.0000	DISCARD	gen=546 glyphs=4
2026-03-14T02:27:27.138771	eca7ab6c	116	29	1.0000	DISCARD	gen=590 glyphs=4
2026-03-14T02:27:29.624729	37f4017b	116	29	1.0000	DISCARD	gen=547 glyphs=4
2026-03-14T02:27:29.898615	eb923f25	116	29	1.0000	DISCARD	gen=590 glyphs=4
2026-03-14T02:27:32.382748	bfdf7cad	120	30	1.0000	DISCARD	gen=547 glyphs=4
2026-03-14T02:27:32.695844	19355583	120	30	1.0000	DISCARD	gen=591 glyphs=4
2026-03-14T02:27:35.267533	7ca87b42	116	29	1.0000	DISCARD	gen=547 glyphs=4
2026-03-14T02:27:35.545696	8aef8872	116	29	1.0000	DISCARD	gen=591 glyphs=4
2026-03-14T02:27:38.003225	6e71db2a	116	29	1.0000	DISCARD	gen=547 glyphs=4
2026-03-14T02:27:38.277831	e8c7f6cf	120	30	1.0000	DISCARD	gen=591 glyphs=4
2026-03-14T02:27:40.732401	bfdf7cad	120	30	1.0000	DISCARD	gen=547 glyphs=4
2026-03-14T02:27:40.999687	8aef8872	116	29	1.0000	DISCARD	gen=591 glyphs=4
2026-03-14T02:27:43.463139	fdb5d108	120	30	1.0000	DISCARD	gen=547 glyphs=4
2026-03-14T02:27:43.726823	e2cd28ea	120	30	1.0000	DISCARD	gen=591 glyphs=4
2026-03-14T02:27:46.220995	2483b074	120	30	1.0000	DISCARD	gen=547 glyphs=4
2026-03-14T02:27:46.494840	e8c7f6cf	120	30	1.0000	DISCARD	gen=591 glyphs=4
2026-03-14T02:27:48.960932	5a06ca32	120	30	1.0000	DISCARD	gen=547 glyphs=4
2026-03-14T02:27:49.236000	68706e12	116	29	1.0000	DISCARD	gen=591 glyphs=4
2026-03-14T02:27:51.726769	d11c1062	120	30	1.0000	DISCARD	gen=547 glyphs=4
2026-03-14T02:27:51.989852	e2cd28ea	120	30	1.0000	DISCARD	gen=591 glyphs=4
2026-03-14T02:27:54.455972	d173f4b7	116	29	1.0000	DISCARD	gen=547 glyphs=4
2026-03-14T02:27:54.734023	0eaedb57	116	29	1.0000	DISCARD	gen=591 glyphs=4
2026-03-14T02:27:57.183673	37f4017b	116	29	1.0000	DISCARD	gen=548 glyphs=4
2026-03-14T02:27:57.455240	19355583	120	30	1.0000	DISCARD	gen=591 glyphs=4
2026-03-14T02:27:59.934739	bfdf7cad	120	30	1.0000	DISCARD	gen=548 glyphs=4
2026-03-14T02:28:00.206913	19355583	120	30	1.0000	DISCARD	gen=592 glyphs=4
2026-03-14T02:28:02.651655	bfdf7cad	120	30	1.0000	DISCARD	gen=548 glyphs=4
2026-03-14T02:28:02.944246	8aef8872	116	29	1.0000	DISCARD	gen=592 glyphs=4
2026-03-14T02:28:05.477480	841ce96b	116	29	1.0000	DISCARD	gen=548 glyphs=4
2026-03-14T02:28:05.746796	67cb81be	120	30	1.0000	DISCARD	gen=592 glyphs=4
2026-03-14T02:28:08.221070	5a06ca32	120	30	1.0000	DISCARD	gen=548 glyphs=4
2026-03-14T02:28:08.496878	a78f9454	120	30	1.0000	DISCARD	gen=592 glyphs=4
2026-03-14T02:28:10.959406	f3777f65	116	29	1.0000	DISCARD	gen=548 glyphs=4
2026-03-14T02:28:11.230438	f62afd3a	120	30	1.0000	DISCARD	gen=592 glyphs=4
2026-03-14T02:28:13.667497	4b9e984e	120	30	1.0000	DISCARD	gen=548 glyphs=4
2026-03-14T02:28:13.946111	050862ad	120	30	1.0000	DISCARD	gen=592 glyphs=4
2026-03-14T02:28:16.388594	5a06ca32	120	30	1.0000	DISCARD	gen=548 glyphs=4
2026-03-14T02:28:16.664807	54af5c46	116	29	1.0000	DISCARD	gen=592 glyphs=4
2026-03-14T02:28:19.125602	55d6c151	120	30	1.0000	DISCARD	gen=548 glyphs=4
2026-03-14T02:28:19.406431	1c1c74d1	116	29	1.0000	DISCARD	gen=592 glyphs=4
