timestamp	program_hash	spirv_size	word_count	fitness	status	description
2026-03-14T01:22:10.116120	37f4017b	116	29	1.0000	DISCARD	gen=402 glyphs=4
2026-03-14T01:22:10.388538	8aef8872	116	29	1.0000	DISCARD	gen=446 glyphs=4
2026-03-14T01:22:12.885873	37f4017b	116	29	1.0000	DISCARD	gen=403 glyphs=4
2026-03-14T01:22:13.158860	a78f9454	120	30	1.0000	DISCARD	gen=446 glyphs=4
2026-03-14T01:22:15.766885	bfdf7cad	120	30	1.0000	DISCARD	gen=403 glyphs=4
2026-03-14T01:22:16.003381	19355583	120	30	1.0000	DISCARD	gen=447 glyphs=4
2026-03-14T01:22:18.440903	fdb5d108	120	30	1.0000	DISCARD	gen=403 glyphs=4
2026-03-14T01:22:18.708952	8aef8872	116	29	1.0000	DISCARD	gen=447 glyphs=4
2026-03-14T01:22:21.201401	bfdf7cad	120	30	1.0000	DISCARD	gen=403 glyphs=4
2026-03-14T01:22:21.476287	b57e7176	120	30	1.0000	DISCARD	gen=447 glyphs=4
2026-03-14T01:22:23.938851	c3b969d2	116	29	0.9500	DISCARD	gen=403 glyphs=4
2026-03-14T01:22:24.213410	e2cd28ea	120	30	1.0000	DISCARD	gen=447 glyphs=4
2026-03-14T01:22:26.670208	1d34459a	116	29	1.0000	DISCARD	gen=403 glyphs=4
2026-03-14T01:22:26.943620	b7aed8e9	116	29	1.0000	DISCARD	gen=447 glyphs=4
2026-03-14T01:22:29.372028	fdb5d108	120	30	1.0000	DISCARD	gen=403 glyphs=4
2026-03-14T01:22:29.652415	e8c7f6cf	120	30	1.0000	DISCARD	gen=447 glyphs=4
2026-03-14T01:22:32.062102	2701cb73	116	29	1.0000	DISCARD	gen=403 glyphs=4
2026-03-14T01:22:32.339717	f4476611	116	29	1.0000	DISCARD	gen=447 glyphs=4
2026-03-14T01:22:34.756563	c19f0c6a	120	30	1.0000	DISCARD	gen=403 glyphs=4
2026-03-14T01:22:35.020379	050862ad	120	30	1.0000	DISCARD	gen=447 glyphs=4
2026-03-14T01:22:37.484958	bfdf7cad	120	30	1.0000	DISCARD	gen=403 glyphs=4
2026-03-14T01:22:37.752720	67cb81be	120	30	1.0000	DISCARD	gen=447 glyphs=4
2026-03-14T01:22:40.188402	37f4017b	116	29	1.0000	DISCARD	gen=404 glyphs=4
2026-03-14T01:22:40.462361	8aef8872	116	29	1.0000	DISCARD	gen=447 glyphs=4
2026-03-14T01:22:43.045423	bfdf7cad	120	30	1.0000	DISCARD	gen=404 glyphs=4
2026-03-14T01:22:43.313911	19355583	120	30	1.0000	DISCARD	gen=448 glyphs=4
2026-03-14T01:22:45.731950	fdb5d108	120	30	1.0000	DISCARD	gen=404 glyphs=4
2026-03-14T01:22:46.004079	8aef8872	116	29	1.0000	DISCARD	gen=448 glyphs=4
2026-03-14T01:22:48.433455	37f4017b	116	29	1.0000	DISCARD	gen=404 glyphs=4
2026-03-14T01:22:48.692733	b57e7176	120	30	1.0000	DISCARD	gen=448 glyphs=4
2026-03-14T01:22:51.143175	5a06ca32	120	30	1.0000	DISCARD	gen=404 glyphs=4
2026-03-14T01:22:51.403745	7e39cd39	116	29	0.9500	DISCARD	gen=448 glyphs=4
2026-03-14T01:22:53.909360	7b0f3ad0	116	29	1.0000	DISCARD	gen=404 glyphs=4
2026-03-14T01:22:54.177444	815d1354	120	30	1.0000	DISCARD	gen=448 glyphs=4
2026-03-14T01:22:56.633092	fdb5d108	120	30	1.0000	DISCARD	gen=404 glyphs=4
2026-03-14T01:22:56.897587	eca7ab6c	116	29	1.0000	DISCARD	gen=448 glyphs=4
2026-03-14T01:22:59.335979	1d34459a	116	29	1.0000	DISCARD	gen=404 glyphs=4
2026-03-14T01:22:59.611134	1ffacbe9	116	29	1.0000	DISCARD	gen=448 glyphs=4
2026-03-14T01:23:02.039100	37f4017b	116	29	1.0000	DISCARD	gen=404 glyphs=4
2026-03-14T01:23:02.311785	8aef8872	116	29	1.0000	DISCARD	gen=448 glyphs=4
2026-03-14T01:23:04.732911	37f4017b	116	29	1.0000	DISCARD	gen=404 glyphs=4
2026-03-14T01:23:05.007611	b7aed8e9	116	29	1.0000	DISCARD	gen=448 glyphs=4
2026-03-14T01:23:07.464564	37f4017b	116	29	1.0000	DISCARD	gen=405 glyphs=4
2026-03-14T01:23:07.738916	c7586832	116	29	1.0000	DISCARD	gen=448 glyphs=4
2026-03-14T01:23:10.156435	bfdf7cad	120	30	1.0000	DISCARD	gen=405 glyphs=4
2026-03-14T01:23:10.433959	19355583	120	30	1.0000	DISCARD	gen=449 glyphs=4
2026-03-14T01:23:12.863423	55d6c151	120	30	1.0000	DISCARD	gen=405 glyphs=4
2026-03-14T01:23:13.132113	8aef8872	116	29	1.0000	DISCARD	gen=449 glyphs=4
2026-03-14T01:23:15.547740	71e2ba66	116	29	1.0000	DISCARD	gen=405 glyphs=4
2026-03-14T01:23:15.824172	cfe6f12a	116	29	1.0000	DISCARD	gen=449 glyphs=4
2026-03-14T01:23:18.259253	55d6c151	120	30	1.0000	DISCARD	gen=405 glyphs=4
2026-03-14T01:23:18.522481	19355583	120	30	1.0000	DISCARD	gen=449 glyphs=4
2026-03-14T01:23:20.934715	71e2ba66	116	29	1.0000	DISCARD	gen=405 glyphs=4
2026-03-14T01:23:21.214163	9e34ede0	116	29	1.0000	DISCARD	gen=449 glyphs=4
2026-03-14T01:23:23.702837	af80d935	120	30	1.0000	DISCARD	gen=405 glyphs=4
2026-03-14T01:23:23.993980	ae44ace5	116	29	1.0000	DISCARD	gen=449 glyphs=4
2026-03-14T01:23:26.467689	fbf11944	116	29	0.9500	DISCARD	gen=405 glyphs=4
2026-03-14T01:23:26.726697	8aef8872	116	29	1.0000	DISCARD	gen=449 glyphs=4
2026-03-14T01:23:29.116457	37f4017b	116	29	1.0000	DISCARD	gen=405 glyphs=4
2026-03-14T01:23:29.380129	50dc991d	116	29	1.0000	DISCARD	gen=449 glyphs=4
2026-03-14T01:23:31.815503	b9e89109	116	29	1.0000	DISCARD	gen=405 glyphs=4
2026-03-14T01:23:32.087471	ae44ace5	116	29	1.0000	DISCARD	gen=449 glyphs=4
2026-03-14T01:23:34.494684	37f4017b	116	29	1.0000	DISCARD	gen=406 glyphs=4
2026-03-14T01:23:34.768694	19355583	120	30	1.0000	DISCARD	gen=449 glyphs=4
2026-03-14T01:23:37.188158	bfdf7cad	120	30	1.0000	DISCARD	gen=406 glyphs=4
2026-03-14T01:23:37.456061	19355583	120	30	1.0000	DISCARD	gen=450 glyphs=4
2026-03-14T01:23:39.893074	37f4017b	116	29	1.0000	DISCARD	gen=406 glyphs=4
2026-03-14T01:23:40.163683	8aef8872	116	29	1.0000	DISCARD	gen=450 glyphs=4
2026-03-14T01:23:42.561115	37f4017b	116	29	1.0000	DISCARD	gen=406 glyphs=4
2026-03-14T01:23:42.836473	b57e7176	120	30	1.0000	DISCARD	gen=450 glyphs=4
2026-03-14T01:23:45.262866	55d6c151	120	30	1.0000	DISCARD	gen=406 glyphs=4
2026-03-14T01:23:45.553300	8aef8872	116	29	1.0000	DISCARD	gen=450 glyphs=4
2026-03-14T01:23:47.984153	37f4017b	116	29	1.0000	DISCARD	gen=406 glyphs=4
2026-03-14T01:23:48.248311	e97459cc	116	29	1.0000	DISCARD	gen=450 glyphs=4
2026-03-14T01:23:50.649356	1d352b2f	116	29	1.0000	DISCARD	gen=406 glyphs=4
2026-03-14T01:23:50.918223	67cb81be	120	30	1.0000	DISCARD	gen=450 glyphs=4
2026-03-14T01:23:53.385399	2701cb73	116	29	1.0000	DISCARD	gen=406 glyphs=4
2026-03-14T01:23:53.655103	36c39b26	116	29	1.0000	DISCARD	gen=450 glyphs=4
2026-03-14T01:23:56.098218	4c9b0dd4	120	30	1.0000	DISCARD	gen=406 glyphs=4
2026-03-14T01:23:56.375077	19355583	120	30	1.0000	DISCARD	gen=450 glyphs=4
2026-03-14T01:23:58.806885	4c9b0dd4	120	30	1.0000	DISCARD	gen=406 glyphs=4
2026-03-14T01:23:59.085673	19355583	120	30	1.0000	DISCARD	gen=450 glyphs=4
2026-03-14T01:24:01.503496	37f4017b	116	29	1.0000	DISCARD	gen=407 glyphs=4
2026-03-14T01:24:01.774904	10f051a2	116	29	1.0000	DISCARD	gen=450 glyphs=4
2026-03-14T01:24:04.183955	bfdf7cad	120	30	1.0000	DISCARD	gen=407 glyphs=4
2026-03-14T01:24:04.455503	19355583	120	30	1.0000	DISCARD	gen=451 glyphs=4
2026-03-14T01:24:06.889804	a259f018	116	29	0.9500	DISCARD	gen=407 glyphs=4
2026-03-14T01:24:07.164357	8aef8872	116	29	1.0000	DISCARD	gen=451 glyphs=4
2026-03-14T01:24:09.590142	5a06ca32	120	30	1.0000	DISCARD	gen=407 glyphs=4
2026-03-14T01:24:09.856849	ed720370	116	29	1.0000	DISCARD	gen=451 glyphs=4
2026-03-14T01:24:12.303743	75801383	116	29	1.0000	DISCARD	gen=407 glyphs=4
2026-03-14T01:24:12.581216	e2cd28ea	120	30	1.0000	DISCARD	gen=451 glyphs=4
2026-03-14T01:24:15.042810	fdb5d108	120	30	1.0000	DISCARD	gen=407 glyphs=4
2026-03-14T01:24:15.314169	8aef8872	116	29	1.0000	DISCARD	gen=451 glyphs=4
2026-03-14T01:24:17.834906	a2342b14	116	29	1.0000	DISCARD	gen=407 glyphs=4
2026-03-14T01:24:18.113922	67cb81be	120	30	1.0000	DISCARD	gen=451 glyphs=4
2026-03-14T01:24:20.593630	37f4017b	116	29	1.0000	DISCARD	gen=407 glyphs=4
2026-03-14T01:24:20.868900	b57e7176	120	30	1.0000	DISCARD	gen=451 glyphs=4
2026-03-14T01:24:23.328578	7c4d4e8a	120	30	1.0000	DISCARD	gen=407 glyphs=4
2026-03-14T01:24:23.599677	19355583	120	30	1.0000	DISCARD	gen=451 glyphs=4
2026-03-14T01:24:26.011757	37f4017b	116	29	1.0000	DISCARD	gen=407 glyphs=4
2026-03-14T01:24:26.280384	115dd29f	120	30	1.0000	DISCARD	gen=451 glyphs=4
2026-03-14T01:24:28.798960	37f4017b	116	29	1.0000	DISCARD	gen=408 glyphs=4
2026-03-14T01:24:29.087027	b57e7176	120	30	1.0000	DISCARD	gen=451 glyphs=4
2026-03-14T01:24:31.534581	bfdf7cad	120	30	1.0000	DISCARD	gen=408 glyphs=4
2026-03-14T01:24:31.799711	19355583	120	30	1.0000	DISCARD	gen=452 glyphs=4
2026-03-14T01:24:34.207431	5a06ca32	120	30	1.0000	DISCARD	gen=408 glyphs=4
2026-03-14T01:24:34.488229	8aef8872	116	29	1.0000	DISCARD	gen=452 glyphs=4
2026-03-14T01:24:36.908026	b3dbb3b3	120	30	1.0000	DISCARD	gen=408 glyphs=4
2026-03-14T01:24:37.181171	50dc991d	116	29	1.0000	DISCARD	gen=452 glyphs=4
2026-03-14T01:24:39.605195	37f4017b	116	29	1.0000	DISCARD	gen=408 glyphs=4
2026-03-14T01:24:39.874216	050862ad	120	30	1.0000	DISCARD	gen=452 glyphs=4
2026-03-14T01:24:42.309949	5a06ca32	120	30	1.0000	DISCARD	gen=408 glyphs=4
2026-03-14T01:24:42.588680	5429dfec	116	29	0.9500	DISCARD	gen=452 glyphs=4
2026-03-14T01:24:45.019396	bfdf7cad	120	30	1.0000	DISCARD	gen=408 glyphs=4
2026-03-14T01:24:45.288670	19355583	120	30	1.0000	DISCARD	gen=452 glyphs=4
2026-03-14T01:24:47.728142	55d6c151	120	30	1.0000	DISCARD	gen=408 glyphs=4
2026-03-14T01:24:47.989507	8aef8872	116	29	1.0000	DISCARD	gen=452 glyphs=4
2026-03-14T01:24:50.425055	5b9807ac	120	30	1.0000	DISCARD	gen=408 glyphs=4
2026-03-14T01:24:50.692321	73122dc3	116	29	0.9500	DISCARD	gen=452 glyphs=4
2026-03-14T01:24:53.114792	4529c7bc	116	29	1.0000	DISCARD	gen=408 glyphs=4
2026-03-14T01:24:53.376891	12686e97	116	29	1.0000	DISCARD	gen=452 glyphs=4
2026-03-14T01:24:55.802787	37f4017b	116	29	1.0000	DISCARD	gen=409 glyphs=4
2026-03-14T01:24:56.089333	19355583	120	30	1.0000	DISCARD	gen=452 glyphs=4
2026-03-14T01:24:58.503850	bfdf7cad	120	30	1.0000	DISCARD	gen=409 glyphs=4
2026-03-14T01:24:58.818179	19355583	120	30	1.0000	DISCARD	gen=453 glyphs=4
2026-03-14T01:25:01.350009	37f4017b	116	29	1.0000	DISCARD	gen=409 glyphs=4
2026-03-14T01:25:01.610886	8aef8872	116	29	1.0000	DISCARD	gen=453 glyphs=4
2026-03-14T01:25:04.041841	2701cb73	116	29	1.0000	DISCARD	gen=409 glyphs=4
2026-03-14T01:25:04.317560	875e0f8a	116	29	1.0000	DISCARD	gen=453 glyphs=4
2026-03-14T01:25:06.747892	091309b0	116	29	1.0000	DISCARD	gen=409 glyphs=4
2026-03-14T01:25:07.024338	19355583	120	30	1.0000	DISCARD	gen=453 glyphs=4
2026-03-14T01:25:09.479597	1d34459a	116	29	1.0000	DISCARD	gen=409 glyphs=4
2026-03-14T01:25:09.751303	8aef8872	116	29	1.0000	DISCARD	gen=453 glyphs=4
2026-03-14T01:25:12.179862	88346aeb	120	30	1.0000	DISCARD	gen=409 glyphs=4
2026-03-14T01:25:12.457855	a6a53678	120	30	1.0000	DISCARD	gen=453 glyphs=4
2026-03-14T01:25:14.903235	37f4017b	116	29	1.0000	DISCARD	gen=409 glyphs=4
2026-03-14T01:25:15.166477	8d91cd48	116	29	1.0000	DISCARD	gen=453 glyphs=4
2026-03-14T01:25:17.607818	5a06ca32	120	30	1.0000	DISCARD	gen=409 glyphs=4
2026-03-14T01:25:17.862775	87257dbc	120	30	1.0000	DISCARD	gen=453 glyphs=4
2026-03-14T01:25:20.305220	7ca87b42	116	29	1.0000	DISCARD	gen=409 glyphs=4
2026-03-14T01:25:20.569043	9e34ede0	116	29	1.0000	DISCARD	gen=453 glyphs=4
2026-03-14T01:25:23.028485	37f4017b	116	29	1.0000	DISCARD	gen=410 glyphs=4
2026-03-14T01:25:23.287673	67cb81be	120	30	1.0000	DISCARD	gen=453 glyphs=4
2026-03-14T01:25:25.698978	bfdf7cad	120	30	1.0000	DISCARD	gen=410 glyphs=4
2026-03-14T01:25:25.969296	19355583	120	30	1.0000	DISCARD	gen=454 glyphs=4
2026-03-14T01:25:28.413548	37f4017b	116	29	1.0000	DISCARD	gen=410 glyphs=4
2026-03-14T01:25:28.686180	8aef8872	116	29	1.0000	DISCARD	gen=454 glyphs=4
2026-03-14T01:25:31.167073	5a06ca32	120	30	1.0000	DISCARD	gen=410 glyphs=4
2026-03-14T01:25:31.452766	9e34ede0	116	29	1.0000	DISCARD	gen=454 glyphs=4
2026-03-14T01:25:33.888772	37f4017b	116	29	1.0000	DISCARD	gen=410 glyphs=4
2026-03-14T01:25:34.168075	e8c7f6cf	120	30	1.0000	DISCARD	gen=454 glyphs=4
2026-03-14T01:25:36.583298	c2c22380	116	29	1.0000	DISCARD	gen=410 glyphs=4
2026-03-14T01:25:36.859343	fef1ba07	116	29	1.0000	DISCARD	gen=454 glyphs=4
2026-03-14T01:25:39.264283	1d34459a	116	29	1.0000	DISCARD	gen=410 glyphs=4
2026-03-14T01:25:39.540531	0eaedb57	116	29	1.0000	DISCARD	gen=454 glyphs=4
2026-03-14T01:25:41.975721	eb748188	116	29	1.0000	DISCARD	gen=410 glyphs=4
2026-03-14T01:25:42.235166	e2cd28ea	120	30	1.0000	DISCARD	gen=454 glyphs=4
2026-03-14T01:25:44.685623	992087a3	116	29	1.0000	DISCARD	gen=410 glyphs=4
2026-03-14T01:25:44.953411	ab0f2b94	116	29	1.0000	DISCARD	gen=454 glyphs=4
2026-03-14T01:25:47.383585	2701cb73	116	29	1.0000	DISCARD	gen=410 glyphs=4
2026-03-14T01:25:47.645342	6be89b7d	116	29	1.0000	DISCARD	gen=454 glyphs=4
2026-03-14T01:25:50.057578	37f4017b	116	29	1.0000	DISCARD	gen=411 glyphs=4
2026-03-14T01:25:50.336057	28a08f28	116	29	1.0000	DISCARD	gen=454 glyphs=4
2026-03-14T01:25:52.786386	bfdf7cad	120	30	1.0000	DISCARD	gen=411 glyphs=4
2026-03-14T01:25:53.044974	19355583	120	30	1.0000	DISCARD	gen=455 glyphs=4
2026-03-14T01:25:55.466865	37f4017b	116	29	1.0000	DISCARD	gen=411 glyphs=4
2026-03-14T01:25:55.735457	8aef8872	116	29	1.0000	DISCARD	gen=455 glyphs=4
2026-03-14T01:25:58.144299	37f4017b	116	29	1.0000	DISCARD	gen=411 glyphs=4
2026-03-14T01:25:58.409541	8aef8872	116	29	1.0000	DISCARD	gen=455 glyphs=4
2026-03-14T01:26:00.853511	a7b53340	116	29	1.0000	DISCARD	gen=411 glyphs=4
2026-03-14T01:26:01.114019	bfdeb8c2	116	29	1.0000	DISCARD	gen=455 glyphs=4
2026-03-14T01:26:03.607470	a99ae8ee	120	30	1.0000	DISCARD	gen=411 glyphs=4
2026-03-14T01:26:03.878885	c28d593f	116	29	1.0000	DISCARD	gen=455 glyphs=4
2026-03-14T01:26:06.328811	12b38c2d	116	29	1.0000	DISCARD	gen=411 glyphs=4
2026-03-14T01:26:06.596861	e2cd28ea	120	30	1.0000	DISCARD	gen=455 glyphs=4
2026-03-14T01:26:09.022372	12b38c2d	116	29	1.0000	DISCARD	gen=411 glyphs=4
2026-03-14T01:26:09.274749	63756689	116	29	1.0000	DISCARD	gen=455 glyphs=4
2026-03-14T01:26:11.679461	7a6ee317	120	30	1.0000	DISCARD	gen=411 glyphs=4
2026-03-14T01:26:11.946860	305886dc	116	29	1.0000	DISCARD	gen=455 glyphs=4
2026-03-14T01:26:14.367808	1d34459a	116	29	1.0000	DISCARD	gen=411 glyphs=4
2026-03-14T01:26:14.634818	8aef8872	116	29	1.0000	DISCARD	gen=455 glyphs=4
2026-03-14T01:26:17.039807	37f4017b	116	29	1.0000	DISCARD	gen=412 glyphs=4
2026-03-14T01:26:17.297231	8aef8872	116	29	1.0000	DISCARD	gen=455 glyphs=4
2026-03-14T01:26:19.716885	bfdf7cad	120	30	1.0000	DISCARD	gen=412 glyphs=4
2026-03-14T01:26:19.973002	19355583	120	30	1.0000	DISCARD	gen=456 glyphs=4
2026-03-14T01:26:22.380345	d11c1062	120	30	1.0000	DISCARD	gen=412 glyphs=4
2026-03-14T01:26:22.646307	8aef8872	116	29	1.0000	DISCARD	gen=456 glyphs=4
2026-03-14T01:26:25.052409	5a06ca32	120	30	1.0000	DISCARD	gen=412 glyphs=4
2026-03-14T01:26:25.322085	19355583	120	30	1.0000	DISCARD	gen=456 glyphs=4
2026-03-14T01:26:27.735638	5b9807ac	120	30	1.0000	DISCARD	gen=412 glyphs=4
2026-03-14T01:26:28.004376	19355583	120	30	1.0000	DISCARD	gen=456 glyphs=4
2026-03-14T01:26:30.443217	5a06ca32	120	30	1.0000	DISCARD	gen=412 glyphs=4
2026-03-14T01:26:30.710895	a78f9454	120	30	1.0000	DISCARD	gen=456 glyphs=4
2026-03-14T01:26:33.144494	37f4017b	116	29	1.0000	DISCARD	gen=412 glyphs=4
2026-03-14T01:26:33.411636	0eaedb57	116	29	1.0000	DISCARD	gen=456 glyphs=4
2026-03-14T01:26:35.909401	71e2ba66	116	29	1.0000	DISCARD	gen=412 glyphs=4
2026-03-14T01:26:36.178890	19355583	120	30	1.0000	DISCARD	gen=456 glyphs=4
2026-03-14T01:26:38.608008	bfdf7cad	120	30	1.0000	DISCARD	gen=412 glyphs=4
2026-03-14T01:26:38.877822	0eaedb57	116	29	1.0000	DISCARD	gen=456 glyphs=4
2026-03-14T01:26:41.329925	d956581b	120	30	1.0000	DISCARD	gen=412 glyphs=4
2026-03-14T01:26:41.596150	a9b6a3a2	116	29	1.0000	DISCARD	gen=456 glyphs=4
2026-03-14T01:26:44.019655	37f4017b	116	29	1.0000	DISCARD	gen=413 glyphs=4
2026-03-14T01:26:44.293012	b57e7176	120	30	1.0000	DISCARD	gen=456 glyphs=4
2026-03-14T01:26:46.703212	bfdf7cad	120	30	1.0000	DISCARD	gen=413 glyphs=4
2026-03-14T01:26:46.972841	19355583	120	30	1.0000	DISCARD	gen=457 glyphs=4
2026-03-14T01:26:49.409009	5a06ca32	120	30	1.0000	DISCARD	gen=413 glyphs=4
2026-03-14T01:26:49.679938	8aef8872	116	29	1.0000	DISCARD	gen=457 glyphs=4
2026-03-14T01:26:52.127812	f1dd3cf2	116	29	1.0000	DISCARD	gen=413 glyphs=4
2026-03-14T01:26:52.397159	1b264529	116	29	0.9500	DISCARD	gen=457 glyphs=4
2026-03-14T01:26:54.826335	81067bc4	116	29	1.0000	DISCARD	gen=413 glyphs=4
2026-03-14T01:26:55.094952	497ee0cc	116	29	0.9500	DISCARD	gen=457 glyphs=4
2026-03-14T01:26:57.555717	55d6c151	120	30	1.0000	DISCARD	gen=413 glyphs=4
2026-03-14T01:26:57.824356	e8c7f6cf	120	30	1.0000	DISCARD	gen=457 glyphs=4
2026-03-14T01:27:00.281991	37f4017b	116	29	1.0000	DISCARD	gen=413 glyphs=4
2026-03-14T01:27:00.547375	fd559d9c	120	30	1.0000	DISCARD	gen=457 glyphs=4
2026-03-14T01:27:02.994464	37f4017b	116	29	1.0000	DISCARD	gen=413 glyphs=4
2026-03-14T01:27:03.256590	0eaedb57	116	29	1.0000	DISCARD	gen=457 glyphs=4
2026-03-14T01:27:05.678632	7ca87b42	116	29	1.0000	DISCARD	gen=413 glyphs=4
2026-03-14T01:27:05.943727	04b4c735	116	29	1.0000	DISCARD	gen=457 glyphs=4
2026-03-14T01:27:08.436821	5a06ca32	120	30	1.0000	DISCARD	gen=413 glyphs=4
2026-03-14T01:27:08.701668	e2cd28ea	120	30	1.0000	DISCARD	gen=457 glyphs=4
2026-03-14T01:27:11.136489	37f4017b	116	29	1.0000	DISCARD	gen=414 glyphs=4
2026-03-14T01:27:11.399946	e2cd28ea	120	30	1.0000	DISCARD	gen=457 glyphs=4
2026-03-14T01:27:13.843403	bfdf7cad	120	30	1.0000	DISCARD	gen=414 glyphs=4
2026-03-14T01:27:14.112010	19355583	120	30	1.0000	DISCARD	gen=458 glyphs=4
2026-03-14T01:27:16.556533	e5e0caa1	116	29	1.0000	DISCARD	gen=414 glyphs=4
2026-03-14T01:27:16.820913	8aef8872	116	29	1.0000	DISCARD	gen=458 glyphs=4
2026-03-14T01:27:19.266479	37f4017b	116	29	1.0000	DISCARD	gen=414 glyphs=4
2026-03-14T01:27:19.546333	19355583	120	30	1.0000	DISCARD	gen=458 glyphs=4
2026-03-14T01:27:21.966295	0db41772	120	30	1.0000	DISCARD	gen=414 glyphs=4
2026-03-14T01:27:22.232819	b57e7176	120	30	1.0000	DISCARD	gen=458 glyphs=4
2026-03-14T01:27:24.690660	f14a789b	120	30	1.0000	DISCARD	gen=414 glyphs=4
2026-03-14T01:27:24.959789	875e0f8a	116	29	1.0000	DISCARD	gen=458 glyphs=4
2026-03-14T01:27:27.376135	5651d057	120	30	1.0000	DISCARD	gen=414 glyphs=4
2026-03-14T01:27:27.635235	d7c8681b	120	30	1.0000	DISCARD	gen=458 glyphs=4
2026-03-14T01:27:30.067583	55d6c151	120	30	1.0000	DISCARD	gen=414 glyphs=4
2026-03-14T01:27:30.338132	e8c7f6cf	120	30	1.0000	DISCARD	gen=458 glyphs=4
2026-03-14T01:27:32.757661	37f4017b	116	29	1.0000	DISCARD	gen=414 glyphs=4
2026-03-14T01:27:33.028996	34a29706	120	30	1.0000	DISCARD	gen=458 glyphs=4
2026-03-14T01:27:35.453043	37f4017b	116	29	1.0000	DISCARD	gen=414 glyphs=4
2026-03-14T01:27:35.718628	fa85e526	116	29	1.0000	DISCARD	gen=458 glyphs=4
2026-03-14T01:27:38.211271	37f4017b	116	29	1.0000	DISCARD	gen=415 glyphs=4
2026-03-14T01:27:38.503634	e2cd28ea	120	30	1.0000	DISCARD	gen=458 glyphs=4
2026-03-14T01:27:40.951133	bfdf7cad	120	30	1.0000	DISCARD	gen=415 glyphs=4
2026-03-14T01:27:41.213427	19355583	120	30	1.0000	DISCARD	gen=459 glyphs=4
2026-03-14T01:27:43.646865	b50c7f36	116	29	0.9500	DISCARD	gen=415 glyphs=4
2026-03-14T01:27:43.921574	8aef8872	116	29	1.0000	DISCARD	gen=459 glyphs=4
2026-03-14T01:27:46.361596	4c9b0dd4	120	30	1.0000	DISCARD	gen=415 glyphs=4
2026-03-14T01:27:46.627640	67cb81be	120	30	1.0000	DISCARD	gen=459 glyphs=4
2026-03-14T01:27:49.074644	c45b5dc6	116	29	1.0000	DISCARD	gen=415 glyphs=4
2026-03-14T01:27:49.338953	c543d2b4	116	29	1.0000	DISCARD	gen=459 glyphs=4
2026-03-14T01:27:51.754119	71e2ba66	116	29	1.0000	DISCARD	gen=415 glyphs=4
2026-03-14T01:27:52.020361	31e4f4b7	116	29	0.9500	DISCARD	gen=459 glyphs=4
2026-03-14T01:27:54.434315	00578d2e	116	29	1.0000	DISCARD	gen=415 glyphs=4
2026-03-14T01:27:54.717068	8aef8872	116	29	1.0000	DISCARD	gen=459 glyphs=4
2026-03-14T01:27:57.150925	ece49080	116	29	1.0000	DISCARD	gen=415 glyphs=4
2026-03-14T01:27:57.414499	d7c8681b	120	30	1.0000	DISCARD	gen=459 glyphs=4
2026-03-14T01:27:59.853485	13fc9e34	116	29	0.9500	DISCARD	gen=415 glyphs=4
2026-03-14T01:28:00.121341	875e0f8a	116	29	1.0000	DISCARD	gen=459 glyphs=4
2026-03-14T01:28:02.534152	55d6c151	120	30	1.0000	DISCARD	gen=415 glyphs=4
2026-03-14T01:28:02.806010	0eaedb57	116	29	1.0000	DISCARD	gen=459 glyphs=4
2026-03-14T01:28:05.241066	37f4017b	116	29	1.0000	DISCARD	gen=416 glyphs=4
2026-03-14T01:28:05.511190	a78f9454	120	30	1.0000	DISCARD	gen=459 glyphs=4
2026-03-14T01:28:07.953596	bfdf7cad	120	30	1.0000	DISCARD	gen=416 glyphs=4
2026-03-14T01:28:08.216490	19355583	120	30	1.0000	DISCARD	gen=460 glyphs=4
2026-03-14T01:28:10.713607	5a06ca32	120	30	1.0000	DISCARD	gen=416 glyphs=4
2026-03-14T01:28:11.012713	8aef8872	116	29	1.0000	DISCARD	gen=460 glyphs=4
2026-03-14T01:28:13.434507	5a06ca32	120	30	1.0000	DISCARD	gen=416 glyphs=4
2026-03-14T01:28:13.710669	8aef8872	116	29	1.0000	DISCARD	gen=460 glyphs=4
2026-03-14T01:28:16.139240	93d6c003	116	29	1.0000	DISCARD	gen=416 glyphs=4
2026-03-14T01:28:16.410349	6679d68a	116	29	0.9500	DISCARD	gen=460 glyphs=4
2026-03-14T01:28:18.823077	55d6c151	120	30	1.0000	DISCARD	gen=416 glyphs=4
2026-03-14T01:28:19.098003	25921e9d	116	29	1.0000	DISCARD	gen=460 glyphs=4
2026-03-14T01:28:21.508639	37f4017b	116	29	1.0000	DISCARD	gen=416 glyphs=4
2026-03-14T01:28:21.784921	327955b0	116	29	1.0000	DISCARD	gen=460 glyphs=4
2026-03-14T01:28:24.189825	c53bd2bc	116	29	1.0000	DISCARD	gen=416 glyphs=4
2026-03-14T01:28:24.478508	eca7ab6c	116	29	1.0000	DISCARD	gen=460 glyphs=4
2026-03-14T01:28:26.911600	12b38c2d	116	29	1.0000	DISCARD	gen=416 glyphs=4
2026-03-14T01:28:27.172742	075c0fdd	116	29	1.0000	DISCARD	gen=460 glyphs=4
2026-03-14T01:28:29.627553	55d6c151	120	30	1.0000	DISCARD	gen=416 glyphs=4
2026-03-14T01:28:29.887309	e2cd28ea	120	30	1.0000	DISCARD	gen=460 glyphs=4
2026-03-14T01:28:32.305673	37f4017b	116	29	1.0000	DISCARD	gen=417 glyphs=4
2026-03-14T01:28:32.585852	2d89f5dd	120	30	1.0000	DISCARD	gen=460 glyphs=4
2026-03-14T01:28:35.002098	bfdf7cad	120	30	1.0000	DISCARD	gen=417 glyphs=4
2026-03-14T01:28:35.263277	19355583	120	30	1.0000	DISCARD	gen=461 glyphs=4
2026-03-14T01:28:37.690624	37f4017b	116	29	1.0000	DISCARD	gen=417 glyphs=4
2026-03-14T01:28:37.968893	8aef8872	116	29	1.0000	DISCARD	gen=461 glyphs=4
2026-03-14T01:28:40.352739	55d6c151	120	30	1.0000	DISCARD	gen=417 glyphs=4
2026-03-14T01:28:40.619577	6824c0e2	116	29	1.0000	DISCARD	gen=461 glyphs=4
2026-03-14T01:28:43.085523	37f4017b	116	29	1.0000	DISCARD	gen=417 glyphs=4
2026-03-14T01:28:43.357425	d7c8681b	120	30	1.0000	DISCARD	gen=461 glyphs=4
