timestamp	program_hash	spirv_size	word_count	fitness	status	description
2026-03-14T01:35:19.105607	bfdf7cad	120	30	1.0000	DISCARD	gen=432 glyphs=4
2026-03-14T01:35:19.373611	19355583	120	30	1.0000	DISCARD	gen=476 glyphs=4
2026-03-14T01:35:21.780205	fdb5d108	120	30	1.0000	DISCARD	gen=432 glyphs=4
2026-03-14T01:35:22.056126	8aef8872	116	29	1.0000	DISCARD	gen=476 glyphs=4
2026-03-14T01:35:24.462512	193c80f8	116	29	1.0000	DISCARD	gen=432 glyphs=4
2026-03-14T01:35:24.740649	e2cd28ea	120	30	1.0000	DISCARD	gen=476 glyphs=4
2026-03-14T01:35:27.154916	da802b98	120	30	1.0000	DISCARD	gen=432 glyphs=4
2026-03-14T01:35:27.420049	1e5f0e21	116	29	1.0000	DISCARD	gen=476 glyphs=4
2026-03-14T01:35:29.848566	37f4017b	116	29	1.0000	DISCARD	gen=432 glyphs=4
2026-03-14T01:35:30.116000	67cb81be	120	30	1.0000	DISCARD	gen=476 glyphs=4
2026-03-14T01:35:32.553325	55d6c151	120	30	1.0000	DISCARD	gen=432 glyphs=4
2026-03-14T01:35:32.820464	9e34ede0	116	29	1.0000	DISCARD	gen=476 glyphs=4
2026-03-14T01:35:35.323323	55d6c151	120	30	1.0000	DISCARD	gen=432 glyphs=4
2026-03-14T01:35:35.611724	19355583	120	30	1.0000	DISCARD	gen=476 glyphs=4
2026-03-14T01:35:38.073432	1d34459a	116	29	1.0000	DISCARD	gen=432 glyphs=4
2026-03-14T01:35:38.342320	8aef8872	116	29	1.0000	DISCARD	gen=476 glyphs=4
2026-03-14T01:35:40.782458	b0b81e4e	116	29	1.0000	DISCARD	gen=432 glyphs=4
2026-03-14T01:35:41.040981	0eaedb57	116	29	1.0000	DISCARD	gen=476 glyphs=4
2026-03-14T01:35:43.453631	37f4017b	116	29	1.0000	DISCARD	gen=433 glyphs=4
2026-03-14T01:35:43.719064	19355583	120	30	1.0000	DISCARD	gen=476 glyphs=4
2026-03-14T01:35:46.129411	bfdf7cad	120	30	1.0000	DISCARD	gen=433 glyphs=4
2026-03-14T01:35:46.395328	19355583	120	30	1.0000	DISCARD	gen=477 glyphs=4
2026-03-14T01:35:48.804634	5a06ca32	120	30	1.0000	DISCARD	gen=433 glyphs=4
2026-03-14T01:35:49.082277	8aef8872	116	29	1.0000	DISCARD	gen=477 glyphs=4
2026-03-14T01:35:51.514185	7ca87b42	116	29	1.0000	DISCARD	gen=433 glyphs=4
2026-03-14T01:35:51.780708	67cb81be	120	30	1.0000	DISCARD	gen=477 glyphs=4
2026-03-14T01:35:54.166781	12b38c2d	116	29	1.0000	DISCARD	gen=433 glyphs=4
2026-03-14T01:35:54.444695	d4d5e64a	116	29	1.0000	DISCARD	gen=477 glyphs=4
2026-03-14T01:35:56.867593	37f4017b	116	29	1.0000	DISCARD	gen=433 glyphs=4
2026-03-14T01:35:57.140056	7bafc5e5	120	30	1.0000	DISCARD	gen=477 glyphs=4
2026-03-14T01:35:59.551666	d8f99930	116	29	1.0000	DISCARD	gen=433 glyphs=4
2026-03-14T01:35:59.813774	1e5f0e21	116	29	1.0000	DISCARD	gen=477 glyphs=4
2026-03-14T01:36:02.223546	5a06ca32	120	30	1.0000	DISCARD	gen=433 glyphs=4
2026-03-14T01:36:02.498353	11733b61	116	29	1.0000	DISCARD	gen=477 glyphs=4
2026-03-14T01:36:04.911186	37f4017b	116	29	1.0000	DISCARD	gen=433 glyphs=4
2026-03-14T01:36:05.182170	aab110d6	116	29	1.0000	DISCARD	gen=477 glyphs=4
2026-03-14T01:36:07.623057	12b38c2d	116	29	1.0000	DISCARD	gen=433 glyphs=4
2026-03-14T01:36:07.896578	a78f9454	120	30	1.0000	DISCARD	gen=477 glyphs=4
2026-03-14T01:36:10.344367	37f4017b	116	29	1.0000	DISCARD	gen=434 glyphs=4
2026-03-14T01:36:10.609620	3128d65c	116	29	1.0000	DISCARD	gen=477 glyphs=4
2026-03-14T01:36:12.999123	bfdf7cad	120	30	1.0000	DISCARD	gen=434 glyphs=4
2026-03-14T01:36:13.262491	19355583	120	30	1.0000	DISCARD	gen=478 glyphs=4
2026-03-14T01:36:15.684193	1011d7f3	116	29	1.0000	DISCARD	gen=434 glyphs=4
2026-03-14T01:36:15.961507	8aef8872	116	29	1.0000	DISCARD	gen=478 glyphs=4
2026-03-14T01:36:18.415146	5b9807ac	120	30	1.0000	DISCARD	gen=434 glyphs=4
2026-03-14T01:36:18.689561	e8c7f6cf	120	30	1.0000	DISCARD	gen=478 glyphs=4
2026-03-14T01:36:21.072074	55d6c151	120	30	1.0000	DISCARD	gen=434 glyphs=4
2026-03-14T01:36:21.340342	0eaedb57	116	29	1.0000	DISCARD	gen=478 glyphs=4
2026-03-14T01:36:23.767550	1d34459a	116	29	1.0000	DISCARD	gen=434 glyphs=4
2026-03-14T01:36:24.038189	9e4d744a	116	29	1.0000	DISCARD	gen=478 glyphs=4
2026-03-14T01:36:26.458620	7507f3aa	116	29	1.0000	DISCARD	gen=434 glyphs=4
2026-03-14T01:36:26.726160	19355583	120	30	1.0000	DISCARD	gen=478 glyphs=4
2026-03-14T01:36:29.145690	5b9807ac	120	30	1.0000	DISCARD	gen=434 glyphs=4
2026-03-14T01:36:29.406378	d7c8681b	120	30	1.0000	DISCARD	gen=478 glyphs=4
2026-03-14T01:36:31.834506	12b38c2d	116	29	1.0000	DISCARD	gen=434 glyphs=4
2026-03-14T01:36:32.101299	8aef8872	116	29	1.0000	DISCARD	gen=478 glyphs=4
2026-03-14T01:36:34.518956	37f4017b	116	29	1.0000	DISCARD	gen=434 glyphs=4
2026-03-14T01:36:34.792806	ae44ace5	116	29	1.0000	DISCARD	gen=478 glyphs=4
2026-03-14T01:36:37.199206	37f4017b	116	29	1.0000	DISCARD	gen=435 glyphs=4
2026-03-14T01:36:37.463072	8aef8872	116	29	1.0000	DISCARD	gen=478 glyphs=4
2026-03-14T01:36:39.942606	bfdf7cad	120	30	1.0000	DISCARD	gen=435 glyphs=4
2026-03-14T01:36:40.226406	19355583	120	30	1.0000	DISCARD	gen=479 glyphs=4
2026-03-14T01:36:42.648077	61e8883e	116	29	1.0000	DISCARD	gen=435 glyphs=4
2026-03-14T01:36:42.911948	8aef8872	116	29	1.0000	DISCARD	gen=479 glyphs=4
2026-03-14T01:36:45.326931	2701cb73	116	29	1.0000	DISCARD	gen=435 glyphs=4
2026-03-14T01:36:45.594284	ec842d0f	116	29	1.0000	DISCARD	gen=479 glyphs=4
2026-03-14T01:36:47.994652	1d34459a	116	29	1.0000	DISCARD	gen=435 glyphs=4
2026-03-14T01:36:48.259001	19355583	120	30	1.0000	DISCARD	gen=479 glyphs=4
2026-03-14T01:36:50.663536	37f4017b	116	29	1.0000	DISCARD	gen=435 glyphs=4
2026-03-14T01:36:50.930371	1e5f0e21	116	29	1.0000	DISCARD	gen=479 glyphs=4
2026-03-14T01:36:53.362137	b756c5ab	116	29	1.0000	DISCARD	gen=435 glyphs=4
2026-03-14T01:36:53.631607	4352725e	116	29	1.0000	DISCARD	gen=479 glyphs=4
2026-03-14T01:36:56.050718	2701cb73	116	29	1.0000	DISCARD	gen=435 glyphs=4
2026-03-14T01:36:56.320483	84bdadbf	120	30	1.0000	DISCARD	gen=479 glyphs=4
2026-03-14T01:36:58.727508	37f4017b	116	29	1.0000	DISCARD	gen=435 glyphs=4
2026-03-14T01:36:59.006169	b57e7176	120	30	1.0000	DISCARD	gen=479 glyphs=4
2026-03-14T01:37:01.423194	1a1448b4	116	29	1.0000	DISCARD	gen=435 glyphs=4
2026-03-14T01:37:01.688433	19355583	120	30	1.0000	DISCARD	gen=479 glyphs=4
2026-03-14T01:37:04.106850	37f4017b	116	29	1.0000	DISCARD	gen=436 glyphs=4
2026-03-14T01:37:04.374311	4225609a	116	29	1.0000	DISCARD	gen=479 glyphs=4
2026-03-14T01:37:06.784338	bfdf7cad	120	30	1.0000	DISCARD	gen=436 glyphs=4
2026-03-14T01:37:07.048866	19355583	120	30	1.0000	DISCARD	gen=480 glyphs=4
2026-03-14T01:37:09.452904	1f446ce5	116	29	1.0000	DISCARD	gen=436 glyphs=4
2026-03-14T01:37:09.719698	8aef8872	116	29	1.0000	DISCARD	gen=480 glyphs=4
2026-03-14T01:37:12.246245	55d6c151	120	30	1.0000	DISCARD	gen=436 glyphs=4
2026-03-14T01:37:12.508300	8aef8872	116	29	1.0000	DISCARD	gen=480 glyphs=4
2026-03-14T01:37:14.940705	2475cb03	116	29	1.0000	DISCARD	gen=436 glyphs=4
2026-03-14T01:37:15.215921	81055519	116	29	0.9500	DISCARD	gen=480 glyphs=4
2026-03-14T01:37:17.618277	39331497	120	30	1.0000	DISCARD	gen=436 glyphs=4
2026-03-14T01:37:17.877551	8aef8872	116	29	1.0000	DISCARD	gen=480 glyphs=4
2026-03-14T01:37:20.303385	ff64b8d8	116	29	1.0000	DISCARD	gen=436 glyphs=4
2026-03-14T01:37:20.562371	ae44ace5	116	29	1.0000	DISCARD	gen=480 glyphs=4
2026-03-14T01:37:22.985173	4c9b0dd4	120	30	1.0000	DISCARD	gen=436 glyphs=4
2026-03-14T01:37:23.261239	1e5f0e21	116	29	1.0000	DISCARD	gen=480 glyphs=4
2026-03-14T01:37:25.707330	14302557	120	30	1.0000	DISCARD	gen=436 glyphs=4
2026-03-14T01:37:25.969265	0eaedb57	116	29	1.0000	DISCARD	gen=480 glyphs=4
2026-03-14T01:37:28.415409	71e2ba66	116	29	1.0000	DISCARD	gen=436 glyphs=4
2026-03-14T01:37:28.673506	e8c7f6cf	120	30	1.0000	DISCARD	gen=480 glyphs=4
2026-03-14T01:37:31.100462	37f4017b	116	29	1.0000	DISCARD	gen=437 glyphs=4
2026-03-14T01:37:31.369451	050862ad	120	30	1.0000	DISCARD	gen=480 glyphs=4
2026-03-14T01:37:33.778596	bfdf7cad	120	30	1.0000	DISCARD	gen=437 glyphs=4
2026-03-14T01:37:34.048396	19355583	120	30	1.0000	DISCARD	gen=481 glyphs=4
2026-03-14T01:37:36.476723	5a06ca32	120	30	1.0000	DISCARD	gen=437 glyphs=4
2026-03-14T01:37:36.742423	8aef8872	116	29	1.0000	DISCARD	gen=481 glyphs=4
2026-03-14T01:37:39.172272	5a06ca32	120	30	1.0000	DISCARD	gen=437 glyphs=4
2026-03-14T01:37:39.424741	9e34ede0	116	29	1.0000	DISCARD	gen=481 glyphs=4
2026-03-14T01:37:41.858323	fdb5d108	120	30	1.0000	DISCARD	gen=437 glyphs=4
2026-03-14T01:37:42.112961	875e0f8a	116	29	1.0000	DISCARD	gen=481 glyphs=4
2026-03-14T01:37:44.646569	38424bf4	120	30	1.0000	DISCARD	gen=437 glyphs=4
2026-03-14T01:37:44.914592	64b9547a	120	30	1.0000	DISCARD	gen=481 glyphs=4
2026-03-14T01:37:47.346225	bfdf7cad	120	30	1.0000	DISCARD	gen=437 glyphs=4
2026-03-14T01:37:47.613997	e8c7f6cf	120	30	1.0000	DISCARD	gen=481 glyphs=4
2026-03-14T01:37:50.049964	e549b498	116	29	1.0000	DISCARD	gen=437 glyphs=4
2026-03-14T01:37:50.319764	e8c7f6cf	120	30	1.0000	DISCARD	gen=481 glyphs=4
2026-03-14T01:37:52.736948	12b38c2d	116	29	1.0000	DISCARD	gen=437 glyphs=4
2026-03-14T01:37:52.998544	67cb81be	120	30	1.0000	DISCARD	gen=481 glyphs=4
2026-03-14T01:37:55.408271	0c0ad661	116	29	1.0000	DISCARD	gen=437 glyphs=4
2026-03-14T01:37:55.671237	1e5f0e21	116	29	1.0000	DISCARD	gen=481 glyphs=4
2026-03-14T01:37:58.079602	37f4017b	116	29	1.0000	DISCARD	gen=438 glyphs=4
2026-03-14T01:37:58.332822	8aef8872	116	29	1.0000	DISCARD	gen=481 glyphs=4
2026-03-14T01:38:00.760705	bfdf7cad	120	30	1.0000	DISCARD	gen=438 glyphs=4
2026-03-14T01:38:01.017511	19355583	120	30	1.0000	DISCARD	gen=482 glyphs=4
2026-03-14T01:38:03.455066	37f4017b	116	29	1.0000	DISCARD	gen=438 glyphs=4
2026-03-14T01:38:03.719556	8aef8872	116	29	1.0000	DISCARD	gen=482 glyphs=4
2026-03-14T01:38:06.151556	37f4017b	116	29	1.0000	DISCARD	gen=438 glyphs=4
2026-03-14T01:38:06.412083	d644a668	116	29	1.0000	DISCARD	gen=482 glyphs=4
2026-03-14T01:38:08.832932	5a06ca32	120	30	1.0000	DISCARD	gen=438 glyphs=4
2026-03-14T01:38:09.098329	8aef8872	116	29	1.0000	DISCARD	gen=482 glyphs=4
2026-03-14T01:38:11.512741	bfdf7cad	120	30	1.0000	DISCARD	gen=438 glyphs=4
2026-03-14T01:38:11.781020	b7aed8e9	116	29	1.0000	DISCARD	gen=482 glyphs=4
2026-03-14T01:38:14.244812	6f452011	120	30	1.0000	DISCARD	gen=438 glyphs=4
2026-03-14T01:38:14.511412	ae44ace5	116	29	1.0000	DISCARD	gen=482 glyphs=4
2026-03-14T01:38:16.958995	2701cb73	116	29	1.0000	DISCARD	gen=438 glyphs=4
2026-03-14T01:38:17.225564	8aef8872	116	29	1.0000	DISCARD	gen=482 glyphs=4
2026-03-14T01:38:19.645987	7a8e6830	116	29	1.0000	DISCARD	gen=438 glyphs=4
2026-03-14T01:38:19.916169	875e0f8a	116	29	1.0000	DISCARD	gen=482 glyphs=4
2026-03-14T01:38:22.331780	7ca87b42	116	29	1.0000	DISCARD	gen=438 glyphs=4
2026-03-14T01:38:22.605114	ba97c300	116	29	1.0000	DISCARD	gen=482 glyphs=4
2026-03-14T01:38:25.147376	37f4017b	116	29	1.0000	DISCARD	gen=439 glyphs=4
2026-03-14T01:38:25.436671	b10ab57c	116	29	1.0000	DISCARD	gen=482 glyphs=4
2026-03-14T01:38:27.954998	bfdf7cad	120	30	1.0000	DISCARD	gen=439 glyphs=4
2026-03-14T01:38:28.230167	19355583	120	30	1.0000	DISCARD	gen=483 glyphs=4
2026-03-14T01:38:30.724756	37f4017b	116	29	1.0000	DISCARD	gen=439 glyphs=4
2026-03-14T01:38:31.021053	8aef8872	116	29	1.0000	DISCARD	gen=483 glyphs=4
2026-03-14T01:38:33.570789	b924237d	120	30	1.0000	DISCARD	gen=439 glyphs=4
2026-03-14T01:38:33.837373	a78f9454	120	30	1.0000	DISCARD	gen=483 glyphs=4
2026-03-14T01:38:36.339951	37f4017b	116	29	1.0000	DISCARD	gen=439 glyphs=4
2026-03-14T01:38:36.611900	19355583	120	30	1.0000	DISCARD	gen=483 glyphs=4
2026-03-14T01:38:39.058798	37f4017b	116	29	1.0000	DISCARD	gen=439 glyphs=4
2026-03-14T01:38:39.330004	a78f9454	120	30	1.0000	DISCARD	gen=483 glyphs=4
2026-03-14T01:38:41.809879	7d7d50bd	120	30	1.0000	DISCARD	gen=439 glyphs=4
2026-03-14T01:38:42.089850	8aef8872	116	29	1.0000	DISCARD	gen=483 glyphs=4
2026-03-14T01:38:44.500668	fdb5d108	120	30	1.0000	DISCARD	gen=439 glyphs=4
2026-03-14T01:38:44.767337	2cb716b2	116	29	1.0000	DISCARD	gen=483 glyphs=4
2026-03-14T01:38:47.260574	37f4017b	116	29	1.0000	DISCARD	gen=439 glyphs=4
2026-03-14T01:38:47.546174	19355583	120	30	1.0000	DISCARD	gen=483 glyphs=4
2026-03-14T01:38:49.945573	3fd05958	124	31	0.9500	DISCARD	gen=439 glyphs=4
2026-03-14T01:38:50.203676	50dc991d	116	29	1.0000	DISCARD	gen=483 glyphs=4
2026-03-14T01:38:52.628801	37f4017b	116	29	1.0000	DISCARD	gen=440 glyphs=4
2026-03-14T01:38:52.900721	8aef8872	116	29	1.0000	DISCARD	gen=483 glyphs=4
2026-03-14T01:38:55.339283	bfdf7cad	120	30	1.0000	DISCARD	gen=440 glyphs=4
2026-03-14T01:38:55.606468	19355583	120	30	1.0000	DISCARD	gen=484 glyphs=4
2026-03-14T01:38:58.019616	55d6c151	120	30	1.0000	DISCARD	gen=440 glyphs=4
2026-03-14T01:38:58.274407	8aef8872	116	29	1.0000	DISCARD	gen=484 glyphs=4
2026-03-14T01:39:00.700072	9066ee28	120	30	1.0000	DISCARD	gen=440 glyphs=4
2026-03-14T01:39:00.980040	1e5f0e21	116	29	1.0000	DISCARD	gen=484 glyphs=4
2026-03-14T01:39:03.388249	37f4017b	116	29	1.0000	DISCARD	gen=440 glyphs=4
2026-03-14T01:39:03.654495	ccd3d4ad	116	29	0.9500	DISCARD	gen=484 glyphs=4
2026-03-14T01:39:06.064282	37f4017b	116	29	1.0000	DISCARD	gen=440 glyphs=4
2026-03-14T01:39:06.329619	d7c8681b	120	30	1.0000	DISCARD	gen=484 glyphs=4
2026-03-14T01:39:08.763268	37f4017b	116	29	1.0000	DISCARD	gen=440 glyphs=4
2026-03-14T01:39:09.031384	b7aed8e9	116	29	1.0000	DISCARD	gen=484 glyphs=4
2026-03-14T01:39:11.434337	55d6c151	120	30	1.0000	DISCARD	gen=440 glyphs=4
2026-03-14T01:39:11.707557	19355583	120	30	1.0000	DISCARD	gen=484 glyphs=4
2026-03-14T01:39:14.125145	55d6c151	120	30	1.0000	DISCARD	gen=440 glyphs=4
2026-03-14T01:39:14.407309	d7c8681b	120	30	1.0000	DISCARD	gen=484 glyphs=4
2026-03-14T01:39:16.805550	1a743bb5	120	30	1.0000	DISCARD	gen=440 glyphs=4
2026-03-14T01:39:17.064660	8aef8872	116	29	1.0000	DISCARD	gen=484 glyphs=4
2026-03-14T01:39:19.555160	37f4017b	116	29	1.0000	DISCARD	gen=441 glyphs=4
2026-03-14T01:39:19.821126	09b93a83	116	29	0.9500	DISCARD	gen=484 glyphs=4
2026-03-14T01:39:22.217375	bfdf7cad	120	30	1.0000	DISCARD	gen=441 glyphs=4
2026-03-14T01:39:22.483663	19355583	120	30	1.0000	DISCARD	gen=485 glyphs=4
2026-03-14T01:39:24.879216	23974747	116	29	1.0000	DISCARD	gen=441 glyphs=4
2026-03-14T01:39:25.147419	8aef8872	116	29	1.0000	DISCARD	gen=485 glyphs=4
2026-03-14T01:39:27.548846	5b9807ac	120	30	1.0000	DISCARD	gen=441 glyphs=4
2026-03-14T01:39:27.815016	d16398ad	116	29	1.0000	DISCARD	gen=485 glyphs=4
2026-03-14T01:39:30.238468	e5df09ae	116	29	1.0000	DISCARD	gen=441 glyphs=4
2026-03-14T01:39:30.523311	19355583	120	30	1.0000	DISCARD	gen=485 glyphs=4
2026-03-14T01:39:32.922791	71e2ba66	116	29	1.0000	DISCARD	gen=441 glyphs=4
2026-03-14T01:39:33.187138	8aef8872	116	29	1.0000	DISCARD	gen=485 glyphs=4
2026-03-14T01:39:35.594961	4c9b0dd4	120	30	1.0000	DISCARD	gen=441 glyphs=4
2026-03-14T01:39:35.862421	9e34ede0	116	29	1.0000	DISCARD	gen=485 glyphs=4
2026-03-14T01:39:38.283242	55d6c151	120	30	1.0000	DISCARD	gen=441 glyphs=4
2026-03-14T01:39:38.542559	c94ae09a	120	30	1.0000	DISCARD	gen=485 glyphs=4
2026-03-14T01:39:40.985487	fdb5d108	120	30	1.0000	DISCARD	gen=441 glyphs=4
2026-03-14T01:39:41.247374	0eaedb57	116	29	1.0000	DISCARD	gen=485 glyphs=4
2026-03-14T01:39:43.674146	7802e68a	116	29	1.0000	DISCARD	gen=441 glyphs=4
2026-03-14T01:39:43.943267	836febe4	120	30	1.0000	DISCARD	gen=485 glyphs=4
2026-03-14T01:39:46.346124	37f4017b	116	29	1.0000	DISCARD	gen=442 glyphs=4
2026-03-14T01:39:46.613301	744ccb34	116	29	1.0000	DISCARD	gen=485 glyphs=4
2026-03-14T01:39:49.012819	bfdf7cad	120	30	1.0000	DISCARD	gen=442 glyphs=4
2026-03-14T01:39:49.286361	19355583	120	30	1.0000	DISCARD	gen=486 glyphs=4
2026-03-14T01:39:51.808997	d11c1062	120	30	1.0000	DISCARD	gen=442 glyphs=4
2026-03-14T01:39:52.082297	8aef8872	116	29	1.0000	DISCARD	gen=486 glyphs=4
2026-03-14T01:39:54.495095	7ca87b42	116	29	1.0000	DISCARD	gen=442 glyphs=4
2026-03-14T01:39:54.763947	8aef8872	116	29	1.0000	DISCARD	gen=486 glyphs=4
2026-03-14T01:39:57.170830	5a06ca32	120	30	1.0000	DISCARD	gen=442 glyphs=4
2026-03-14T01:39:57.437990	875e0f8a	116	29	1.0000	DISCARD	gen=486 glyphs=4
2026-03-14T01:39:59.838270	37f4017b	116	29	1.0000	DISCARD	gen=442 glyphs=4
2026-03-14T01:40:00.110941	19355583	120	30	1.0000	DISCARD	gen=486 glyphs=4
2026-03-14T01:40:02.563708	db053f34	120	30	1.0000	DISCARD	gen=442 glyphs=4
2026-03-14T01:40:02.830046	67cb81be	120	30	1.0000	DISCARD	gen=486 glyphs=4
2026-03-14T01:40:05.235353	71e2ba66	116	29	1.0000	DISCARD	gen=442 glyphs=4
2026-03-14T01:40:05.500010	19355583	120	30	1.0000	DISCARD	gen=486 glyphs=4
2026-03-14T01:40:07.914402	fdb5d108	120	30	1.0000	DISCARD	gen=442 glyphs=4
2026-03-14T01:40:08.187190	57afc35d	120	30	1.0000	DISCARD	gen=486 glyphs=4
2026-03-14T01:40:10.604435	7ca87b42	116	29	1.0000	DISCARD	gen=442 glyphs=4
2026-03-14T01:40:10.869813	b57e7176	120	30	1.0000	DISCARD	gen=486 glyphs=4
2026-03-14T01:40:13.276878	37f4017b	116	29	1.0000	DISCARD	gen=443 glyphs=4
2026-03-14T01:40:13.541794	e2cd28ea	120	30	1.0000	DISCARD	gen=486 glyphs=4
2026-03-14T01:40:15.984007	bfdf7cad	120	30	1.0000	DISCARD	gen=443 glyphs=4
2026-03-14T01:40:16.251364	19355583	120	30	1.0000	DISCARD	gen=487 glyphs=4
2026-03-14T01:40:18.665034	71e2ba66	116	29	1.0000	DISCARD	gen=443 glyphs=4
2026-03-14T01:40:18.929446	8aef8872	116	29	1.0000	DISCARD	gen=487 glyphs=4
2026-03-14T01:40:21.397480	37f4017b	116	29	1.0000	DISCARD	gen=443 glyphs=4
2026-03-14T01:40:21.671076	17220926	116	29	1.0000	DISCARD	gen=487 glyphs=4
2026-03-14T01:40:24.099563	5b9807ac	120	30	1.0000	DISCARD	gen=443 glyphs=4
2026-03-14T01:40:24.365736	dafe81a7	116	29	1.0000	DISCARD	gen=487 glyphs=4
2026-03-14T01:40:26.773549	fdb5d108	120	30	1.0000	DISCARD	gen=443 glyphs=4
2026-03-14T01:40:27.048025	b57e7176	120	30	1.0000	DISCARD	gen=487 glyphs=4
2026-03-14T01:40:29.472075	e70b5469	120	30	1.0000	DISCARD	gen=443 glyphs=4
2026-03-14T01:40:29.741827	2c66cae2	116	29	1.0000	DISCARD	gen=487 glyphs=4
2026-03-14T01:40:32.164301	55d6c151	120	30	1.0000	DISCARD	gen=443 glyphs=4
2026-03-14T01:40:32.438489	19355583	120	30	1.0000	DISCARD	gen=487 glyphs=4
2026-03-14T01:40:34.858546	0cebc27c	116	29	1.0000	DISCARD	gen=443 glyphs=4
2026-03-14T01:40:35.122973	b4ddddbe	116	29	1.0000	DISCARD	gen=487 glyphs=4
2026-03-14T01:40:37.534222	5a06ca32	120	30	1.0000	DISCARD	gen=443 glyphs=4
2026-03-14T01:40:37.798608	8aef8872	116	29	1.0000	DISCARD	gen=487 glyphs=4
2026-03-14T01:40:40.194264	37f4017b	116	29	1.0000	DISCARD	gen=444 glyphs=4
2026-03-14T01:40:40.456138	b7aed8e9	116	29	1.0000	DISCARD	gen=487 glyphs=4
2026-03-14T01:40:42.865119	bfdf7cad	120	30	1.0000	DISCARD	gen=444 glyphs=4
2026-03-14T01:40:43.154114	19355583	120	30	1.0000	DISCARD	gen=488 glyphs=4
2026-03-14T01:40:45.570933	5b9807ac	120	30	1.0000	DISCARD	gen=444 glyphs=4
2026-03-14T01:40:45.849307	8aef8872	116	29	1.0000	DISCARD	gen=488 glyphs=4
2026-03-14T01:40:48.259255	37f4017b	116	29	1.0000	DISCARD	gen=444 glyphs=4
2026-03-14T01:40:48.530745	8aef8872	116	29	1.0000	DISCARD	gen=488 glyphs=4
2026-03-14T01:40:50.938391	37f4017b	116	29	1.0000	DISCARD	gen=444 glyphs=4
2026-03-14T01:40:51.198775	e919f2eb	120	30	1.0000	DISCARD	gen=488 glyphs=4
2026-03-14T01:40:53.717626	55d6c151	120	30	1.0000	DISCARD	gen=444 glyphs=4
2026-03-14T01:40:53.978505	0eaedb57	116	29	1.0000	DISCARD	gen=488 glyphs=4
2026-03-14T01:40:56.421438	5b9807ac	120	30	1.0000	DISCARD	gen=444 glyphs=4
2026-03-14T01:40:56.689717	b57e7176	120	30	1.0000	DISCARD	gen=488 glyphs=4
2026-03-14T01:40:59.108259	37f4017b	116	29	1.0000	DISCARD	gen=444 glyphs=4
2026-03-14T01:40:59.379380	b57e7176	120	30	1.0000	DISCARD	gen=488 glyphs=4
2026-03-14T01:41:01.790417	ca0d6c0f	116	29	1.0000	DISCARD	gen=444 glyphs=4
2026-03-14T01:41:02.058497	3ff1d6e0	116	29	1.0000	DISCARD	gen=488 glyphs=4
2026-03-14T01:41:04.476867	720b04fe	116	29	1.0000	DISCARD	gen=444 glyphs=4
2026-03-14T01:41:04.734351	2cf48aab	116	29	1.0000	DISCARD	gen=488 glyphs=4
2026-03-14T01:41:07.150352	37f4017b	116	29	1.0000	DISCARD	gen=445 glyphs=4
2026-03-14T01:41:07.429982	713af2cc	120	30	1.0000	DISCARD	gen=488 glyphs=4
2026-03-14T01:41:09.826261	bfdf7cad	120	30	1.0000	DISCARD	gen=445 glyphs=4
2026-03-14T01:41:10.086753	19355583	120	30	1.0000	DISCARD	gen=489 glyphs=4
2026-03-14T01:41:12.517197	5a06ca32	120	30	1.0000	DISCARD	gen=445 glyphs=4
2026-03-14T01:41:12.781833	8aef8872	116	29	1.0000	DISCARD	gen=489 glyphs=4
2026-03-14T01:41:15.176413	fdb5d108	120	30	1.0000	DISCARD	gen=445 glyphs=4
2026-03-14T01:41:15.442663	08f1dc87	116	29	1.0000	DISCARD	gen=489 glyphs=4
2026-03-14T01:41:17.882535	2701cb73	116	29	1.0000	DISCARD	gen=445 glyphs=4
2026-03-14T01:41:18.156737	ae44ace5	116	29	1.0000	DISCARD	gen=489 glyphs=4
2026-03-14T01:41:20.572792	fdb5d108	120	30	1.0000	DISCARD	gen=445 glyphs=4
2026-03-14T01:41:20.839217	d7c8681b	120	30	1.0000	DISCARD	gen=489 glyphs=4
2026-03-14T01:41:23.253653	55d6c151	120	30	1.0000	DISCARD	gen=445 glyphs=4
2026-03-14T01:41:23.527973	34cbc28d	120	30	1.0000	DISCARD	gen=489 glyphs=4
2026-03-14T01:41:26.048760	bfdf7cad	120	30	1.0000	DISCARD	gen=445 glyphs=4
2026-03-14T01:41:26.319772	d7c8681b	120	30	1.0000	DISCARD	gen=489 glyphs=4
2026-03-14T01:41:28.732147	55d6c151	120	30	1.0000	DISCARD	gen=445 glyphs=4
2026-03-14T01:41:29.000826	31f91be7	116	29	0.9500	DISCARD	gen=489 glyphs=4
2026-03-14T01:41:31.412244	37f4017b	116	29	1.0000	DISCARD	gen=445 glyphs=4
2026-03-14T01:41:31.678489	b57e7176	120	30	1.0000	DISCARD	gen=489 glyphs=4
2026-03-14T01:41:34.120663	37f4017b	116	29	1.0000	DISCARD	gen=446 glyphs=4
2026-03-14T01:41:34.384667	9e34ede0	116	29	1.0000	DISCARD	gen=489 glyphs=4
2026-03-14T01:41:36.807467	bfdf7cad	120	30	1.0000	DISCARD	gen=446 glyphs=4
2026-03-14T01:41:37.075169	19355583	120	30	1.0000	DISCARD	gen=490 glyphs=4
2026-03-14T01:41:39.470625	bfdf7cad	120	30	1.0000	DISCARD	gen=446 glyphs=4
2026-03-14T01:41:39.737371	8aef8872	116	29	1.0000	DISCARD	gen=490 glyphs=4
2026-03-14T01:41:42.144569	12b38c2d	116	29	1.0000	DISCARD	gen=446 glyphs=4
2026-03-14T01:41:42.417394	8530444d	116	29	0.9500	DISCARD	gen=490 glyphs=4
2026-03-14T01:41:44.871264	37f4017b	116	29	1.0000	DISCARD	gen=446 glyphs=4
2026-03-14T01:41:45.132666	e8c7f6cf	120	30	1.0000	DISCARD	gen=490 glyphs=4
2026-03-14T01:41:47.565159	37f4017b	116	29	1.0000	DISCARD	gen=446 glyphs=4
2026-03-14T01:41:47.833405	94019c63	116	29	1.0000	DISCARD	gen=490 glyphs=4
2026-03-14T01:41:50.222176	37f4017b	116	29	1.0000	DISCARD	gen=446 glyphs=4
2026-03-14T01:41:50.489248	19355583	120	30	1.0000	DISCARD	gen=490 glyphs=4
