timestamp	program_hash	spirv_size	word_count	fitness	status	description
2026-03-14T07:36:45.790121	099964a4	0	0	0.0000	CRASH	gen=858 glyphs=4
2026-03-14T07:36:45.790315	cf93b656	0	0	0.0000	CRASH	gen=858 glyphs=3
2026-03-14T07:36:45.790507	099964a4	0	0	0.0000	CRASH	gen=858 glyphs=4
2026-03-14T07:36:45.790701	3ca14993	0	0	0.0000	CRASH	gen=858 glyphs=4
2026-03-14T07:36:45.790895	099964a4	0	0	0.0000	CRASH	gen=858 glyphs=4
2026-03-14T07:36:45.791093	099964a4	0	0	0.0000	CRASH	gen=858 glyphs=4
2026-03-14T07:36:45.791286	3a734398	0	0	0.0000	CRASH	gen=858 glyphs=4
2026-03-14T07:36:45.791477	099964a4	0	0	0.0000	CRASH	gen=858 glyphs=4
2026-03-14T07:36:45.791672	b162d666	0	0	0.0000	CRASH	gen=858 glyphs=4
2026-03-14T07:36:45.791946	099964a4	0	0	0.0000	CRASH	gen=859 glyphs=4
2026-03-14T07:36:45.792147	099964a4	0	0	0.0000	CRASH	gen=859 glyphs=4
2026-03-14T07:36:45.792341	099964a4	0	0	0.0000	CRASH	gen=859 glyphs=4
2026-03-14T07:36:45.792537	8da1f8d8	0	0	0.0000	CRASH	gen=859 glyphs=4
2026-03-14T07:36:45.792733	cf93b656	0	0	0.0000	CRASH	gen=859 glyphs=3
2026-03-14T07:36:45.792924	099964a4	0	0	0.0000	CRASH	gen=859 glyphs=4
2026-03-14T07:36:45.793117	099964a4	0	0	0.0000	CRASH	gen=859 glyphs=4
2026-03-14T07:36:45.793312	c94f6781	0	0	0.0000	CRASH	gen=859 glyphs=1
2026-03-14T07:36:45.793504	099964a4	0	0	0.0000	CRASH	gen=859 glyphs=4
2026-03-14T07:36:45.793698	099964a4	0	0	0.0000	CRASH	gen=859 glyphs=4
2026-03-14T07:36:45.793966	099964a4	0	0	0.0000	CRASH	gen=860 glyphs=4
2026-03-14T07:36:45.794159	099964a4	0	0	0.0000	CRASH	gen=860 glyphs=4
2026-03-14T07:36:45.794356	5a234030	0	0	0.0000	CRASH	gen=860 glyphs=3
2026-03-14T07:36:45.794551	099964a4	0	0	0.0000	CRASH	gen=860 glyphs=4
2026-03-14T07:36:45.794743	3ca14993	0	0	0.0000	CRASH	gen=860 glyphs=4
2026-03-14T07:36:45.794934	099964a4	0	0	0.0000	CRASH	gen=860 glyphs=4
2026-03-14T07:36:45.795126	8da1f8d8	0	0	0.0000	CRASH	gen=860 glyphs=4
2026-03-14T07:36:45.795324	099964a4	0	0	0.0000	CRASH	gen=860 glyphs=4
2026-03-14T07:36:45.795523	099964a4	0	0	0.0000	CRASH	gen=860 glyphs=4
2026-03-14T07:36:45.795718	8da1f8d8	0	0	0.0000	CRASH	gen=860 glyphs=4
2026-03-14T07:36:45.796008	099964a4	0	0	0.0000	CRASH	gen=861 glyphs=4
2026-03-14T07:36:45.796213	099964a4	0	0	0.0000	CRASH	gen=861 glyphs=4
2026-03-14T07:36:45.796413	099964a4	0	0	0.0000	CRASH	gen=861 glyphs=4
2026-03-14T07:36:45.796609	ff30496a	0	0	0.0000	CRASH	gen=861 glyphs=3
2026-03-14T07:36:45.796803	3a734398	0	0	0.0000	CRASH	gen=861 glyphs=4
2026-03-14T07:36:45.796996	efbf6dd6	0	0	0.0000	CRASH	gen=861 glyphs=4
2026-03-14T07:36:45.797188	a45414b7	0	0	0.0000	CRASH	gen=861 glyphs=3
2026-03-14T07:36:45.797381	099964a4	0	0	0.0000	CRASH	gen=861 glyphs=4
2026-03-14T07:36:45.797575	099964a4	0	0	0.0000	CRASH	gen=861 glyphs=4
2026-03-14T07:36:45.797764	9ed2a685	0	0	0.0000	CRASH	gen=861 glyphs=4
2026-03-14T07:36:45.798035	099964a4	0	0	0.0000	CRASH	gen=862 glyphs=4
2026-03-14T07:36:45.798227	099964a4	0	0	0.0000	CRASH	gen=862 glyphs=4
2026-03-14T07:36:45.798422	099964a4	0	0	0.0000	CRASH	gen=862 glyphs=4
2026-03-14T07:36:45.798620	099964a4	0	0	0.0000	CRASH	gen=862 glyphs=4
2026-03-14T07:36:45.798812	88f3da4a	0	0	0.0000	CRASH	gen=862 glyphs=4
2026-03-14T07:36:45.799006	7152a22c	0	0	0.0000	CRASH	gen=862 glyphs=5
2026-03-14T07:36:45.799201	099964a4	0	0	0.0000	CRASH	gen=862 glyphs=4
2026-03-14T07:36:45.799394	db511581	0	0	0.0000	CRASH	gen=862 glyphs=4
2026-03-14T07:36:45.799604	099964a4	0	0	0.0000	CRASH	gen=862 glyphs=4
2026-03-14T07:36:45.799797	8da1f8d8	0	0	0.0000	CRASH	gen=862 glyphs=4
2026-03-14T07:36:45.800068	099964a4	0	0	0.0000	CRASH	gen=863 glyphs=4
2026-03-14T07:36:45.800262	099964a4	0	0	0.0000	CRASH	gen=863 glyphs=4
2026-03-14T07:36:45.800455	3a734398	0	0	0.0000	CRASH	gen=863 glyphs=4
2026-03-14T07:36:45.800657	099964a4	0	0	0.0000	CRASH	gen=863 glyphs=4
2026-03-14T07:36:45.800852	099964a4	0	0	0.0000	CRASH	gen=863 glyphs=4
2026-03-14T07:36:45.801046	d9ca29c5	0	0	0.0000	CRASH	gen=863 glyphs=4
2026-03-14T07:36:45.801239	676e9443	0	0	0.0000	CRASH	gen=863 glyphs=4
2026-03-14T07:36:45.801435	099964a4	0	0	0.0000	CRASH	gen=863 glyphs=4
2026-03-14T07:36:45.801635	099964a4	0	0	0.0000	CRASH	gen=863 glyphs=4
2026-03-14T07:36:45.801826	099964a4	0	0	0.0000	CRASH	gen=863 glyphs=4
2026-03-14T07:36:45.802114	099964a4	0	0	0.0000	CRASH	gen=864 glyphs=4
2026-03-14T07:36:45.802310	099964a4	0	0	0.0000	CRASH	gen=864 glyphs=4
2026-03-14T07:36:45.802504	099964a4	0	0	0.0000	CRASH	gen=864 glyphs=4
2026-03-14T07:36:45.802704	099964a4	0	0	0.0000	CRASH	gen=864 glyphs=4
2026-03-14T07:36:45.802897	099964a4	0	0	0.0000	CRASH	gen=864 glyphs=4
2026-03-14T07:36:45.803089	8da1f8d8	0	0	0.0000	CRASH	gen=864 glyphs=4
2026-03-14T07:36:45.803284	5233e0ca	0	0	0.0000	CRASH	gen=864 glyphs=4
2026-03-14T07:36:45.803480	2daeb18b	0	0	0.0000	CRASH	gen=864 glyphs=3
2026-03-14T07:36:45.803681	c8a0e326	0	0	0.0000	CRASH	gen=864 glyphs=4
2026-03-14T07:36:45.803883	86b81fed	0	0	0.0000	CRASH	gen=864 glyphs=5
2026-03-14T07:36:45.804159	099964a4	0	0	0.0000	CRASH	gen=865 glyphs=4
2026-03-14T07:36:45.804352	099964a4	0	0	0.0000	CRASH	gen=865 glyphs=4
2026-03-14T07:36:45.804546	bdf8f28b	0	0	0.0000	CRASH	gen=865 glyphs=4
2026-03-14T07:36:45.804738	7ede4765	0	0	0.0000	CRASH	gen=865 glyphs=2
2026-03-14T07:36:45.804938	099964a4	0	0	0.0000	CRASH	gen=865 glyphs=4
2026-03-14T07:36:45.805129	099964a4	0	0	0.0000	CRASH	gen=865 glyphs=4
2026-03-14T07:36:45.805322	099964a4	0	0	0.0000	CRASH	gen=865 glyphs=4
2026-03-14T07:36:45.805510	cf93b656	0	0	0.0000	CRASH	gen=865 glyphs=3
2026-03-14T07:36:45.805704	099964a4	0	0	0.0000	CRASH	gen=865 glyphs=4
2026-03-14T07:36:45.805898	5d0da6dd	0	0	0.0000	CRASH	gen=865 glyphs=3
2026-03-14T07:36:45.806171	099964a4	0	0	0.0000	CRASH	gen=866 glyphs=4
2026-03-14T07:36:45.806367	099964a4	0	0	0.0000	CRASH	gen=866 glyphs=4
2026-03-14T07:36:45.806564	099964a4	0	0	0.0000	CRASH	gen=866 glyphs=4
2026-03-14T07:36:45.806757	099964a4	0	0	0.0000	CRASH	gen=866 glyphs=4
2026-03-14T07:36:45.806955	ff30496a	0	0	0.0000	CRASH	gen=866 glyphs=3
2026-03-14T07:36:45.807149	0d907cb6	0	0	0.0000	CRASH	gen=866 glyphs=3
2026-03-14T07:36:45.807345	ff30496a	0	0	0.0000	CRASH	gen=866 glyphs=3
2026-03-14T07:36:45.807543	3ca14993	0	0	0.0000	CRASH	gen=866 glyphs=4
2026-03-14T07:36:45.807741	099964a4	0	0	0.0000	CRASH	gen=866 glyphs=4
2026-03-14T07:36:45.807936	a3738746	0	0	0.0000	CRASH	gen=866 glyphs=2
2026-03-14T07:36:45.808212	099964a4	0	0	0.0000	CRASH	gen=867 glyphs=4
2026-03-14T07:36:45.808411	099964a4	0	0	0.0000	CRASH	gen=867 glyphs=4
2026-03-14T07:36:45.808611	dcb1fb50	0	0	0.0000	CRASH	gen=867 glyphs=4
2026-03-14T07:36:45.808810	2aaea3bf	0	0	0.0000	CRASH	gen=867 glyphs=4
2026-03-14T07:36:45.809006	099964a4	0	0	0.0000	CRASH	gen=867 glyphs=4
2026-03-14T07:36:45.809203	099964a4	0	0	0.0000	CRASH	gen=867 glyphs=4
2026-03-14T07:36:45.809400	47750218	0	0	0.0000	CRASH	gen=867 glyphs=4
2026-03-14T07:36:45.809598	099964a4	0	0	0.0000	CRASH	gen=867 glyphs=4
2026-03-14T07:36:45.809792	3a734398	0	0	0.0000	CRASH	gen=867 glyphs=4
2026-03-14T07:36:45.809986	099964a4	0	0	0.0000	CRASH	gen=867 glyphs=4
2026-03-14T07:36:45.810278	099964a4	0	0	0.0000	CRASH	gen=868 glyphs=4
2026-03-14T07:36:45.810473	099964a4	0	0	0.0000	CRASH	gen=868 glyphs=4
2026-03-14T07:36:45.810671	7ede4765	0	0	0.0000	CRASH	gen=868 glyphs=2
2026-03-14T07:36:45.810865	ca6ca273	0	0	0.0000	CRASH	gen=868 glyphs=4
2026-03-14T07:36:45.811061	099964a4	0	0	0.0000	CRASH	gen=868 glyphs=4
2026-03-14T07:36:45.811260	3a734398	0	0	0.0000	CRASH	gen=868 glyphs=4
2026-03-14T07:36:45.811457	3ca14993	0	0	0.0000	CRASH	gen=868 glyphs=4
2026-03-14T07:36:45.811656	42564c5c	0	0	0.0000	CRASH	gen=868 glyphs=3
2026-03-14T07:36:45.811854	099964a4	0	0	0.0000	CRASH	gen=868 glyphs=4
2026-03-14T07:36:45.812048	099964a4	0	0	0.0000	CRASH	gen=868 glyphs=4
2026-03-14T07:36:45.812333	099964a4	0	0	0.0000	CRASH	gen=869 glyphs=4
2026-03-14T07:36:45.812534	099964a4	0	0	0.0000	CRASH	gen=869 glyphs=4
2026-03-14T07:36:45.812729	1043a439	0	0	0.0000	CRASH	gen=869 glyphs=5
2026-03-14T07:36:45.812926	099964a4	0	0	0.0000	CRASH	gen=869 glyphs=4
2026-03-14T07:36:45.813119	ec2b8550	0	0	0.0000	CRASH	gen=869 glyphs=4
2026-03-14T07:36:45.813316	099964a4	0	0	0.0000	CRASH	gen=869 glyphs=4
2026-03-14T07:36:45.813510	3dad96e0	0	0	0.0000	CRASH	gen=869 glyphs=4
2026-03-14T07:36:45.813709	099964a4	0	0	0.0000	CRASH	gen=869 glyphs=4
2026-03-14T07:36:45.813904	099964a4	0	0	0.0000	CRASH	gen=869 glyphs=4
2026-03-14T07:36:45.814093	099964a4	0	0	0.0000	CRASH	gen=869 glyphs=4
2026-03-14T07:36:45.814367	099964a4	0	0	0.0000	CRASH	gen=870 glyphs=4
2026-03-14T07:36:45.814567	099964a4	0	0	0.0000	CRASH	gen=870 glyphs=4
2026-03-14T07:36:45.814762	ff30496a	0	0	0.0000	CRASH	gen=870 glyphs=3
2026-03-14T07:36:45.814955	099964a4	0	0	0.0000	CRASH	gen=870 glyphs=4
2026-03-14T07:36:45.815146	87847edf	0	0	0.0000	CRASH	gen=870 glyphs=4
2026-03-14T07:36:45.815340	099964a4	0	0	0.0000	CRASH	gen=870 glyphs=4
2026-03-14T07:36:45.815540	099964a4	0	0	0.0000	CRASH	gen=870 glyphs=4
2026-03-14T07:36:45.815731	099964a4	0	0	0.0000	CRASH	gen=870 glyphs=4
2026-03-14T07:36:45.815923	dcb1fb50	0	0	0.0000	CRASH	gen=870 glyphs=4
2026-03-14T07:36:45.816116	80cef82b	0	0	0.0000	CRASH	gen=870 glyphs=4
2026-03-14T07:36:45.816400	099964a4	0	0	0.0000	CRASH	gen=871 glyphs=4
2026-03-14T07:36:45.816603	099964a4	0	0	0.0000	CRASH	gen=871 glyphs=4
2026-03-14T07:36:45.816796	099964a4	0	0	0.0000	CRASH	gen=871 glyphs=4
2026-03-14T07:36:45.816988	099964a4	0	0	0.0000	CRASH	gen=871 glyphs=4
2026-03-14T07:36:45.817177	099964a4	0	0	0.0000	CRASH	gen=871 glyphs=4
2026-03-14T07:36:45.817369	099964a4	0	0	0.0000	CRASH	gen=871 glyphs=4
2026-03-14T07:36:45.817567	ed9341e9	0	0	0.0000	CRASH	gen=871 glyphs=3
2026-03-14T07:36:45.817761	099964a4	0	0	0.0000	CRASH	gen=871 glyphs=4
2026-03-14T07:36:45.817955	099964a4	0	0	0.0000	CRASH	gen=871 glyphs=4
2026-03-14T07:36:45.818149	099964a4	0	0	0.0000	CRASH	gen=871 glyphs=4
2026-03-14T07:36:45.818418	099964a4	0	0	0.0000	CRASH	gen=872 glyphs=4
2026-03-14T07:36:45.818617	099964a4	0	0	0.0000	CRASH	gen=872 glyphs=4
2026-03-14T07:36:45.818813	099964a4	0	0	0.0000	CRASH	gen=872 glyphs=4
2026-03-14T07:36:45.819003	099964a4	0	0	0.0000	CRASH	gen=872 glyphs=4
2026-03-14T07:36:45.819195	099964a4	0	0	0.0000	CRASH	gen=872 glyphs=4
2026-03-14T07:36:45.819386	cf93b656	0	0	0.0000	CRASH	gen=872 glyphs=3
2026-03-14T07:36:45.819581	099964a4	0	0	0.0000	CRASH	gen=872 glyphs=4
2026-03-14T07:36:45.819776	099964a4	0	0	0.0000	CRASH	gen=872 glyphs=4
2026-03-14T07:36:45.819972	50c9e598	0	0	0.0000	CRASH	gen=872 glyphs=4
2026-03-14T07:36:45.820172	4106d40f	0	0	0.0000	CRASH	gen=872 glyphs=4
2026-03-14T07:36:45.820451	099964a4	0	0	0.0000	CRASH	gen=873 glyphs=4
2026-03-14T07:36:45.820651	099964a4	0	0	0.0000	CRASH	gen=873 glyphs=4
2026-03-14T07:36:45.820852	0b7e210e	0	0	0.0000	CRASH	gen=873 glyphs=4
2026-03-14T07:36:45.821050	099964a4	0	0	0.0000	CRASH	gen=873 glyphs=4
2026-03-14T07:36:45.821244	d5a77b1a	0	0	0.0000	CRASH	gen=873 glyphs=4
2026-03-14T07:36:45.821439	099964a4	0	0	0.0000	CRASH	gen=873 glyphs=4
2026-03-14T07:36:45.821636	76f0cb8c	0	0	0.0000	CRASH	gen=873 glyphs=4
2026-03-14T07:36:45.821830	43f4a810	0	0	0.0000	CRASH	gen=873 glyphs=3
2026-03-14T07:36:45.822030	099964a4	0	0	0.0000	CRASH	gen=873 glyphs=4
2026-03-14T07:36:45.822224	694bed37	0	0	0.0000	CRASH	gen=873 glyphs=2
2026-03-14T07:36:45.822489	099964a4	0	0	0.0000	CRASH	gen=874 glyphs=4
2026-03-14T07:36:45.822685	099964a4	0	0	0.0000	CRASH	gen=874 glyphs=4
2026-03-14T07:36:45.822878	099964a4	0	0	0.0000	CRASH	gen=874 glyphs=4
2026-03-14T07:36:45.823068	8da1f8d8	0	0	0.0000	CRASH	gen=874 glyphs=4
2026-03-14T07:36:45.823262	099964a4	0	0	0.0000	CRASH	gen=874 glyphs=4
2026-03-14T07:36:45.823452	ce215fc1	0	0	0.0000	CRASH	gen=874 glyphs=4
2026-03-14T07:36:45.823645	099964a4	0	0	0.0000	CRASH	gen=874 glyphs=4
2026-03-14T07:36:45.823836	5f4378d8	0	0	0.0000	CRASH	gen=874 glyphs=4
2026-03-14T07:36:45.824028	dcb1fb50	0	0	0.0000	CRASH	gen=874 glyphs=4
2026-03-14T07:36:45.824224	099964a4	0	0	0.0000	CRASH	gen=874 glyphs=4
2026-03-14T07:36:45.824503	099964a4	0	0	0.0000	CRASH	gen=875 glyphs=4
2026-03-14T07:36:45.824701	099964a4	0	0	0.0000	CRASH	gen=875 glyphs=4
2026-03-14T07:36:45.824896	80cef82b	0	0	0.0000	CRASH	gen=875 glyphs=4
2026-03-14T07:36:45.825091	099964a4	0	0	0.0000	CRASH	gen=875 glyphs=4
2026-03-14T07:36:45.825292	6fb454c9	0	0	0.0000	CRASH	gen=875 glyphs=4
2026-03-14T07:36:45.825483	3a734398	0	0	0.0000	CRASH	gen=875 glyphs=4
2026-03-14T07:36:45.825679	3a734398	0	0	0.0000	CRASH	gen=875 glyphs=4
2026-03-14T07:36:45.825870	099964a4	0	0	0.0000	CRASH	gen=875 glyphs=4
2026-03-14T07:36:45.826065	dcb1fb50	0	0	0.0000	CRASH	gen=875 glyphs=4
2026-03-14T07:36:45.826264	3ff6656d	0	0	0.0000	CRASH	gen=875 glyphs=3
2026-03-14T07:36:45.826541	099964a4	0	0	0.0000	CRASH	gen=876 glyphs=4
2026-03-14T07:36:45.826734	099964a4	0	0	0.0000	CRASH	gen=876 glyphs=4
2026-03-14T07:36:45.826925	1fb19909	0	0	0.0000	CRASH	gen=876 glyphs=4
2026-03-14T07:36:45.827119	099964a4	0	0	0.0000	CRASH	gen=876 glyphs=4
2026-03-14T07:36:45.827312	80cef82b	0	0	0.0000	CRASH	gen=876 glyphs=4
2026-03-14T07:36:45.827504	099964a4	0	0	0.0000	CRASH	gen=876 glyphs=4
2026-03-14T07:36:45.827699	099964a4	0	0	0.0000	CRASH	gen=876 glyphs=4
2026-03-14T07:36:45.827891	099964a4	0	0	0.0000	CRASH	gen=876 glyphs=4
2026-03-14T07:36:45.828086	2f5c4ae5	0	0	0.0000	CRASH	gen=876 glyphs=3
2026-03-14T07:36:45.828281	3ca14993	0	0	0.0000	CRASH	gen=876 glyphs=4
2026-03-14T07:36:45.828568	099964a4	0	0	0.0000	CRASH	gen=877 glyphs=4
2026-03-14T07:36:45.828763	099964a4	0	0	0.0000	CRASH	gen=877 glyphs=4
2026-03-14T07:36:45.828958	ab7ae933	0	0	0.0000	CRASH	gen=877 glyphs=3
2026-03-14T07:36:45.829154	3a734398	0	0	0.0000	CRASH	gen=877 glyphs=4
2026-03-14T07:36:45.829348	099964a4	0	0	0.0000	CRASH	gen=877 glyphs=4
2026-03-14T07:36:45.829547	cf93b656	0	0	0.0000	CRASH	gen=877 glyphs=3
2026-03-14T07:36:45.829739	7df05d53	0	0	0.0000	CRASH	gen=877 glyphs=3
2026-03-14T07:36:45.829932	7ede4765	0	0	0.0000	CRASH	gen=877 glyphs=2
2026-03-14T07:36:45.830128	60ae1192	0	0	0.0000	CRASH	gen=877 glyphs=4
2026-03-14T07:36:45.830324	099964a4	0	0	0.0000	CRASH	gen=877 glyphs=4
2026-03-14T07:36:45.830614	099964a4	0	0	0.0000	CRASH	gen=878 glyphs=4
2026-03-14T07:36:45.830810	099964a4	0	0	0.0000	CRASH	gen=878 glyphs=4
2026-03-14T07:36:45.831003	446d024f	0	0	0.0000	CRASH	gen=878 glyphs=3
2026-03-14T07:36:45.831198	099964a4	0	0	0.0000	CRASH	gen=878 glyphs=4
2026-03-14T07:36:45.831391	aa1de39e	0	0	0.0000	CRASH	gen=878 glyphs=4
2026-03-14T07:36:45.831594	099964a4	0	0	0.0000	CRASH	gen=878 glyphs=4
2026-03-14T07:36:45.831788	099964a4	0	0	0.0000	CRASH	gen=878 glyphs=4
2026-03-14T07:36:45.831979	099964a4	0	0	0.0000	CRASH	gen=878 glyphs=4
2026-03-14T07:36:45.832174	ca7e1223	0	0	0.0000	CRASH	gen=878 glyphs=4
2026-03-14T07:36:45.832369	14511819	0	0	0.0000	CRASH	gen=878 glyphs=2
2026-03-14T07:36:45.832661	099964a4	0	0	0.0000	CRASH	gen=879 glyphs=4
2026-03-14T07:36:45.832853	099964a4	0	0	0.0000	CRASH	gen=879 glyphs=4
2026-03-14T07:36:45.833047	79a5a3e2	0	0	0.0000	CRASH	gen=879 glyphs=4
2026-03-14T07:36:45.833239	4ddc4779	0	0	0.0000	CRASH	gen=879 glyphs=4
2026-03-14T07:36:45.833432	099964a4	0	0	0.0000	CRASH	gen=879 glyphs=4
2026-03-14T07:36:45.833626	099964a4	0	0	0.0000	CRASH	gen=879 glyphs=4
2026-03-14T07:36:45.833829	ff30496a	0	0	0.0000	CRASH	gen=879 glyphs=3
2026-03-14T07:36:45.834023	099964a4	0	0	0.0000	CRASH	gen=879 glyphs=4
2026-03-14T07:36:45.834215	099964a4	0	0	0.0000	CRASH	gen=879 glyphs=4
2026-03-14T07:36:45.834406	92d7b0c6	0	0	0.0000	CRASH	gen=879 glyphs=3
2026-03-14T07:36:45.834690	099964a4	0	0	0.0000	CRASH	gen=880 glyphs=4
2026-03-14T07:36:45.834883	099964a4	0	0	0.0000	CRASH	gen=880 glyphs=4
2026-03-14T07:36:45.835077	099964a4	0	0	0.0000	CRASH	gen=880 glyphs=4
2026-03-14T07:36:45.835267	099964a4	0	0	0.0000	CRASH	gen=880 glyphs=4
2026-03-14T07:36:45.835460	50df8498	0	0	0.0000	CRASH	gen=880 glyphs=4
2026-03-14T07:36:45.835656	8da1f8d8	0	0	0.0000	CRASH	gen=880 glyphs=4
2026-03-14T07:36:45.835851	099964a4	0	0	0.0000	CRASH	gen=880 glyphs=4
2026-03-14T07:36:45.836046	099964a4	0	0	0.0000	CRASH	gen=880 glyphs=4
2026-03-14T07:36:45.836240	cf93b656	0	0	0.0000	CRASH	gen=880 glyphs=3
2026-03-14T07:36:45.836432	099964a4	0	0	0.0000	CRASH	gen=880 glyphs=4
2026-03-14T07:36:45.836706	099964a4	0	0	0.0000	CRASH	gen=881 glyphs=4
2026-03-14T07:36:45.836899	099964a4	0	0	0.0000	CRASH	gen=881 glyphs=4
2026-03-14T07:36:45.837099	7ede4765	0	0	0.0000	CRASH	gen=881 glyphs=2
2026-03-14T07:36:45.837289	099964a4	0	0	0.0000	CRASH	gen=881 glyphs=4
2026-03-14T07:36:45.837481	099964a4	0	0	0.0000	CRASH	gen=881 glyphs=4
2026-03-14T07:36:45.837673	3a734398	0	0	0.0000	CRASH	gen=881 glyphs=4
2026-03-14T07:36:45.837863	27449030	0	0	0.0000	CRASH	gen=881 glyphs=4
2026-03-14T07:36:45.838058	80cef82b	0	0	0.0000	CRASH	gen=881 glyphs=4
2026-03-14T07:36:45.838249	099964a4	0	0	0.0000	CRASH	gen=881 glyphs=4
2026-03-14T07:36:45.838438	099964a4	0	0	0.0000	CRASH	gen=881 glyphs=4
2026-03-14T07:36:45.838716	099964a4	0	0	0.0000	CRASH	gen=882 glyphs=4
2026-03-14T07:36:45.838910	099964a4	0	0	0.0000	CRASH	gen=882 glyphs=4
2026-03-14T07:36:45.839107	a5ef60ea	0	0	0.0000	CRASH	gen=882 glyphs=2
2026-03-14T07:36:45.839298	213d1826	0	0	0.0000	CRASH	gen=882 glyphs=4
2026-03-14T07:36:45.839496	d3ff6487	0	0	0.0000	CRASH	gen=882 glyphs=4
2026-03-14T07:36:45.839690	c7754ffa	0	0	0.0000	CRASH	gen=882 glyphs=2
2026-03-14T07:36:45.839883	261a05b0	0	0	0.0000	CRASH	gen=882 glyphs=2
2026-03-14T07:36:45.840074	e4d83b31	0	0	0.0000	CRASH	gen=882 glyphs=4
2026-03-14T07:36:45.840276	ff30496a	0	0	0.0000	CRASH	gen=882 glyphs=3
2026-03-14T07:36:45.840469	099964a4	0	0	0.0000	CRASH	gen=882 glyphs=4
2026-03-14T07:36:45.840740	099964a4	0	0	0.0000	CRASH	gen=883 glyphs=4
2026-03-14T07:36:45.840948	099964a4	0	0	0.0000	CRASH	gen=883 glyphs=4
2026-03-14T07:36:45.841143	cf93b656	0	0	0.0000	CRASH	gen=883 glyphs=3
2026-03-14T07:36:45.841341	099964a4	0	0	0.0000	CRASH	gen=883 glyphs=4
2026-03-14T07:36:45.841531	099964a4	0	0	0.0000	CRASH	gen=883 glyphs=4
2026-03-14T07:36:45.841726	3ca14993	0	0	0.0000	CRASH	gen=883 glyphs=4
2026-03-14T07:36:45.841918	099964a4	0	0	0.0000	CRASH	gen=883 glyphs=4
2026-03-14T07:36:45.842111	099964a4	0	0	0.0000	CRASH	gen=883 glyphs=4
2026-03-14T07:36:45.842309	099964a4	0	0	0.0000	CRASH	gen=883 glyphs=4
2026-03-14T07:36:45.842503	dcb1fb50	0	0	0.0000	CRASH	gen=883 glyphs=4
2026-03-14T07:36:45.842783	099964a4	0	0	0.0000	CRASH	gen=884 glyphs=4
2026-03-14T07:36:45.842981	099964a4	0	0	0.0000	CRASH	gen=884 glyphs=4
2026-03-14T07:36:45.843176	ff30496a	0	0	0.0000	CRASH	gen=884 glyphs=3
2026-03-14T07:36:45.843374	806b63c0	0	0	0.0000	CRASH	gen=884 glyphs=4
2026-03-14T07:36:45.843570	5a65d681	0	0	0.0000	CRASH	gen=884 glyphs=4
2026-03-14T07:36:45.843762	099964a4	0	0	0.0000	CRASH	gen=884 glyphs=4
2026-03-14T07:36:45.843957	dcb1fb50	0	0	0.0000	CRASH	gen=884 glyphs=4
2026-03-14T07:36:45.844152	d4a5d25e	0	0	0.0000	CRASH	gen=884 glyphs=3
2026-03-14T07:36:45.844345	099964a4	0	0	0.0000	CRASH	gen=884 glyphs=4
2026-03-14T07:36:45.844543	ff30496a	0	0	0.0000	CRASH	gen=884 glyphs=3
2026-03-14T07:36:45.844808	099964a4	0	0	0.0000	CRASH	gen=885 glyphs=4
2026-03-14T07:36:45.844999	099964a4	0	0	0.0000	CRASH	gen=885 glyphs=4
2026-03-14T07:36:45.845189	ff30496a	0	0	0.0000	CRASH	gen=885 glyphs=3
2026-03-14T07:36:45.845383	099964a4	0	0	0.0000	CRASH	gen=885 glyphs=4
2026-03-14T07:36:45.845579	e69ed06e	0	0	0.0000	CRASH	gen=885 glyphs=3
2026-03-14T07:36:45.845770	3a734398	0	0	0.0000	CRASH	gen=885 glyphs=4
2026-03-14T07:36:45.845961	099964a4	0	0	0.0000	CRASH	gen=885 glyphs=4
2026-03-14T07:36:45.846153	ca3bffa6	0	0	0.0000	CRASH	gen=885 glyphs=4
2026-03-14T07:36:45.846343	099964a4	0	0	0.0000	CRASH	gen=885 glyphs=4
2026-03-14T07:36:45.846539	099964a4	0	0	0.0000	CRASH	gen=885 glyphs=4
2026-03-14T07:36:45.846809	099964a4	0	0	0.0000	CRASH	gen=886 glyphs=4
2026-03-14T07:36:45.847002	099964a4	0	0	0.0000	CRASH	gen=886 glyphs=4
2026-03-14T07:36:45.847193	0a34562b	0	0	0.0000	CRASH	gen=886 glyphs=4
2026-03-14T07:36:45.847384	099964a4	0	0	0.0000	CRASH	gen=886 glyphs=4
2026-03-14T07:36:45.847579	d702fa0f	0	0	0.0000	CRASH	gen=886 glyphs=3
2026-03-14T07:36:45.847773	f7125976	0	0	0.0000	CRASH	gen=886 glyphs=4
2026-03-14T07:36:45.847965	099964a4	0	0	0.0000	CRASH	gen=886 glyphs=4
2026-03-14T07:36:45.848158	7bc42e38	0	0	0.0000	CRASH	gen=886 glyphs=4
2026-03-14T07:36:45.848349	099964a4	0	0	0.0000	CRASH	gen=886 glyphs=4
2026-03-14T07:36:45.848544	099964a4	0	0	0.0000	CRASH	gen=886 glyphs=4
2026-03-14T07:36:45.848820	099964a4	0	0	0.0000	CRASH	gen=887 glyphs=4
2026-03-14T07:36:45.849018	099964a4	0	0	0.0000	CRASH	gen=887 glyphs=4
2026-03-14T07:36:45.849214	dcb1fb50	0	0	0.0000	CRASH	gen=887 glyphs=4
2026-03-14T07:36:45.849409	099964a4	0	0	0.0000	CRASH	gen=887 glyphs=4
2026-03-14T07:36:45.849608	159b1797	0	0	0.0000	CRASH	gen=887 glyphs=4
2026-03-14T07:36:45.849806	ff30496a	0	0	0.0000	CRASH	gen=887 glyphs=3
2026-03-14T07:36:45.849999	3ca14993	0	0	0.0000	CRASH	gen=887 glyphs=4
2026-03-14T07:36:45.850193	099964a4	0	0	0.0000	CRASH	gen=887 glyphs=4
2026-03-14T07:36:45.850389	07af4755	0	0	0.0000	CRASH	gen=887 glyphs=2
2026-03-14T07:36:45.850585	099964a4	0	0	0.0000	CRASH	gen=887 glyphs=4
2026-03-14T07:36:45.850864	099964a4	0	0	0.0000	CRASH	gen=888 glyphs=4
2026-03-14T07:36:45.851061	099964a4	0	0	0.0000	CRASH	gen=888 glyphs=4
2026-03-14T07:36:45.851254	8ade802d	0	0	0.0000	CRASH	gen=888 glyphs=4
2026-03-14T07:36:45.851448	099964a4	0	0	0.0000	CRASH	gen=888 glyphs=4
2026-03-14T07:36:45.851643	2bdfce44	0	0	0.0000	CRASH	gen=888 glyphs=4
2026-03-14T07:36:45.851838	da6844df	0	0	0.0000	CRASH	gen=888 glyphs=4
2026-03-14T07:36:45.852032	3ca14993	0	0	0.0000	CRASH	gen=888 glyphs=4
2026-03-14T07:36:45.852224	099964a4	0	0	0.0000	CRASH	gen=888 glyphs=4
2026-03-14T07:36:45.852414	7ede4765	0	0	0.0000	CRASH	gen=888 glyphs=2
2026-03-14T07:36:45.852606	099964a4	0	0	0.0000	CRASH	gen=888 glyphs=4
2026-03-14T07:36:45.852883	099964a4	0	0	0.0000	CRASH	gen=889 glyphs=4
2026-03-14T07:36:45.853075	099964a4	0	0	0.0000	CRASH	gen=889 glyphs=4
2026-03-14T07:36:45.853270	3a734398	0	0	0.0000	CRASH	gen=889 glyphs=4
2026-03-14T07:36:45.853462	099964a4	0	0	0.0000	CRASH	gen=889 glyphs=4
