timestamp	program_hash	spirv_size	word_count	fitness	status	description
2026-03-14T07:36:45.024164	099964a4	0	0	0.0000	CRASH	gen=482 glyphs=4
2026-03-14T07:36:45.024363	099964a4	0	0	0.0000	CRASH	gen=482 glyphs=4
2026-03-14T07:36:45.024562	808a3d9e	0	0	0.0000	CRASH	gen=482 glyphs=4
2026-03-14T07:36:45.024772	099964a4	0	0	0.0000	CRASH	gen=482 glyphs=4
2026-03-14T07:36:45.024974	099964a4	0	0	0.0000	CRASH	gen=482 glyphs=4
2026-03-14T07:36:45.025254	099964a4	0	0	0.0000	CRASH	gen=483 glyphs=4
2026-03-14T07:36:45.025455	099964a4	0	0	0.0000	CRASH	gen=483 glyphs=4
2026-03-14T07:36:45.025656	099964a4	0	0	0.0000	CRASH	gen=483 glyphs=4
2026-03-14T07:36:45.025859	11a022d3	0	0	0.0000	CRASH	gen=483 glyphs=1
2026-03-14T07:36:45.026058	099964a4	0	0	0.0000	CRASH	gen=483 glyphs=4
2026-03-14T07:36:45.026255	099964a4	0	0	0.0000	CRASH	gen=483 glyphs=4
2026-03-14T07:36:45.026455	099964a4	0	0	0.0000	CRASH	gen=483 glyphs=4
2026-03-14T07:36:45.026656	099964a4	0	0	0.0000	CRASH	gen=483 glyphs=4
2026-03-14T07:36:45.026856	592b4cd4	0	0	0.0000	CRASH	gen=483 glyphs=4
2026-03-14T07:36:45.027054	099964a4	0	0	0.0000	CRASH	gen=483 glyphs=4
2026-03-14T07:36:45.027341	099964a4	0	0	0.0000	CRASH	gen=484 glyphs=4
2026-03-14T07:36:45.027546	099964a4	0	0	0.0000	CRASH	gen=484 glyphs=4
2026-03-14T07:36:45.027745	1b727c23	0	0	0.0000	CRASH	gen=484 glyphs=4
2026-03-14T07:36:45.027944	099964a4	0	0	0.0000	CRASH	gen=484 glyphs=4
2026-03-14T07:36:45.028140	59f5f144	0	0	0.0000	CRASH	gen=484 glyphs=3
2026-03-14T07:36:45.028337	099964a4	0	0	0.0000	CRASH	gen=484 glyphs=4
2026-03-14T07:36:45.028536	099964a4	0	0	0.0000	CRASH	gen=484 glyphs=4
2026-03-14T07:36:45.028732	42136128	0	0	0.0000	CRASH	gen=484 glyphs=4
2026-03-14T07:36:45.028933	ff30496a	0	0	0.0000	CRASH	gen=484 glyphs=3
2026-03-14T07:36:45.029129	099964a4	0	0	0.0000	CRASH	gen=484 glyphs=4
2026-03-14T07:36:45.029415	099964a4	0	0	0.0000	CRASH	gen=485 glyphs=4
2026-03-14T07:36:45.029618	099964a4	0	0	0.0000	CRASH	gen=485 glyphs=4
2026-03-14T07:36:45.029812	0cdc51f2	0	0	0.0000	CRASH	gen=485 glyphs=4
2026-03-14T07:36:45.030008	099964a4	0	0	0.0000	CRASH	gen=485 glyphs=4
2026-03-14T07:36:45.030203	83b9af6c	0	0	0.0000	CRASH	gen=485 glyphs=2
2026-03-14T07:36:45.030395	94059f85	0	0	0.0000	CRASH	gen=485 glyphs=4
2026-03-14T07:36:45.030597	9fc98efe	0	0	0.0000	CRASH	gen=485 glyphs=4
2026-03-14T07:36:45.030792	ff30496a	0	0	0.0000	CRASH	gen=485 glyphs=3
2026-03-14T07:36:45.030989	099964a4	0	0	0.0000	CRASH	gen=485 glyphs=4
2026-03-14T07:36:45.031186	b677e4d8	0	0	0.0000	CRASH	gen=485 glyphs=4
2026-03-14T07:36:45.031462	099964a4	0	0	0.0000	CRASH	gen=486 glyphs=4
2026-03-14T07:36:45.031667	099964a4	0	0	0.0000	CRASH	gen=486 glyphs=4
2026-03-14T07:36:45.031864	099964a4	0	0	0.0000	CRASH	gen=486 glyphs=4
2026-03-14T07:36:45.032061	611e06f6	0	0	0.0000	CRASH	gen=486 glyphs=4
2026-03-14T07:36:45.032261	099964a4	0	0	0.0000	CRASH	gen=486 glyphs=4
2026-03-14T07:36:45.032456	f2f6c126	0	0	0.0000	CRASH	gen=486 glyphs=2
2026-03-14T07:36:45.032651	099964a4	0	0	0.0000	CRASH	gen=486 glyphs=4
2026-03-14T07:36:45.032849	3ca14993	0	0	0.0000	CRASH	gen=486 glyphs=4
2026-03-14T07:36:45.033050	099964a4	0	0	0.0000	CRASH	gen=486 glyphs=4
2026-03-14T07:36:45.033249	099964a4	0	0	0.0000	CRASH	gen=486 glyphs=4
2026-03-14T07:36:45.033506	099964a4	0	0	0.0000	CRASH	gen=487 glyphs=4
2026-03-14T07:36:45.033708	099964a4	0	0	0.0000	CRASH	gen=487 glyphs=4
2026-03-14T07:36:45.033906	dcb1fb50	0	0	0.0000	CRASH	gen=487 glyphs=4
2026-03-14T07:36:45.034101	099964a4	0	0	0.0000	CRASH	gen=487 glyphs=4
2026-03-14T07:36:45.034292	7ede4765	0	0	0.0000	CRASH	gen=487 glyphs=2
2026-03-14T07:36:45.034483	099964a4	0	0	0.0000	CRASH	gen=487 glyphs=4
2026-03-14T07:36:45.034680	099964a4	0	0	0.0000	CRASH	gen=487 glyphs=4
2026-03-14T07:36:45.034880	cf93b656	0	0	0.0000	CRASH	gen=487 glyphs=3
2026-03-14T07:36:45.035076	ff30496a	0	0	0.0000	CRASH	gen=487 glyphs=3
2026-03-14T07:36:45.035270	8da1f8d8	0	0	0.0000	CRASH	gen=487 glyphs=4
2026-03-14T07:36:45.035551	099964a4	0	0	0.0000	CRASH	gen=488 glyphs=4
2026-03-14T07:36:45.035751	099964a4	0	0	0.0000	CRASH	gen=488 glyphs=4
2026-03-14T07:36:45.035951	4e1c2343	0	0	0.0000	CRASH	gen=488 glyphs=3
2026-03-14T07:36:45.036150	099964a4	0	0	0.0000	CRASH	gen=488 glyphs=4
2026-03-14T07:36:45.036344	099964a4	0	0	0.0000	CRASH	gen=488 glyphs=4
2026-03-14T07:36:45.036541	099964a4	0	0	0.0000	CRASH	gen=488 glyphs=4
2026-03-14T07:36:45.036733	099964a4	0	0	0.0000	CRASH	gen=488 glyphs=4
2026-03-14T07:36:45.036928	a962eec3	0	0	0.0000	CRASH	gen=488 glyphs=4
2026-03-14T07:36:45.037128	099964a4	0	0	0.0000	CRASH	gen=488 glyphs=4
2026-03-14T07:36:45.037322	8da1f8d8	0	0	0.0000	CRASH	gen=488 glyphs=4
2026-03-14T07:36:45.037608	099964a4	0	0	0.0000	CRASH	gen=489 glyphs=4
2026-03-14T07:36:45.037805	099964a4	0	0	0.0000	CRASH	gen=489 glyphs=4
2026-03-14T07:36:45.038014	11c1e20c	0	0	0.0000	CRASH	gen=489 glyphs=4
2026-03-14T07:36:45.038213	3a734398	0	0	0.0000	CRASH	gen=489 glyphs=4
2026-03-14T07:36:45.038411	099964a4	0	0	0.0000	CRASH	gen=489 glyphs=4
2026-03-14T07:36:45.038611	71efb8f7	0	0	0.0000	CRASH	gen=489 glyphs=1
2026-03-14T07:36:45.038803	7ede4765	0	0	0.0000	CRASH	gen=489 glyphs=2
2026-03-14T07:36:45.038998	099964a4	0	0	0.0000	CRASH	gen=489 glyphs=4
2026-03-14T07:36:45.039198	3a734398	0	0	0.0000	CRASH	gen=489 glyphs=4
2026-03-14T07:36:45.039396	3a734398	0	0	0.0000	CRASH	gen=489 glyphs=4
2026-03-14T07:36:45.039686	099964a4	0	0	0.0000	CRASH	gen=490 glyphs=4
2026-03-14T07:36:45.039886	099964a4	0	0	0.0000	CRASH	gen=490 glyphs=4
2026-03-14T07:36:45.040083	099964a4	0	0	0.0000	CRASH	gen=490 glyphs=4
2026-03-14T07:36:45.040284	7ede4765	0	0	0.0000	CRASH	gen=490 glyphs=2
2026-03-14T07:36:45.040480	099964a4	0	0	0.0000	CRASH	gen=490 glyphs=4
2026-03-14T07:36:45.040676	099964a4	0	0	0.0000	CRASH	gen=490 glyphs=4
2026-03-14T07:36:45.040870	80cef82b	0	0	0.0000	CRASH	gen=490 glyphs=4
2026-03-14T07:36:45.041063	099964a4	0	0	0.0000	CRASH	gen=490 glyphs=4
2026-03-14T07:36:45.041261	099964a4	0	0	0.0000	CRASH	gen=490 glyphs=4
2026-03-14T07:36:45.041453	4328a1c4	0	0	0.0000	CRASH	gen=490 glyphs=4
2026-03-14T07:36:45.041737	099964a4	0	0	0.0000	CRASH	gen=491 glyphs=4
2026-03-14T07:36:45.041935	099964a4	0	0	0.0000	CRASH	gen=491 glyphs=4
2026-03-14T07:36:45.042129	099964a4	0	0	0.0000	CRASH	gen=491 glyphs=4
2026-03-14T07:36:45.042325	03c1ed11	0	0	0.0000	CRASH	gen=491 glyphs=4
2026-03-14T07:36:45.042522	a15efc8d	0	0	0.0000	CRASH	gen=491 glyphs=4
2026-03-14T07:36:45.042716	2d509ed7	0	0	0.0000	CRASH	gen=491 glyphs=4
2026-03-14T07:36:45.042912	099964a4	0	0	0.0000	CRASH	gen=491 glyphs=4
2026-03-14T07:36:45.043107	cf93b656	0	0	0.0000	CRASH	gen=491 glyphs=3
2026-03-14T07:36:45.043308	c853f3e3	0	0	0.0000	CRASH	gen=491 glyphs=5
2026-03-14T07:36:45.043508	099964a4	0	0	0.0000	CRASH	gen=491 glyphs=4
2026-03-14T07:36:45.043782	099964a4	0	0	0.0000	CRASH	gen=492 glyphs=4
2026-03-14T07:36:45.043978	099964a4	0	0	0.0000	CRASH	gen=492 glyphs=4
2026-03-14T07:36:45.044173	099964a4	0	0	0.0000	CRASH	gen=492 glyphs=4
2026-03-14T07:36:45.044370	099964a4	0	0	0.0000	CRASH	gen=492 glyphs=4
2026-03-14T07:36:45.044566	099964a4	0	0	0.0000	CRASH	gen=492 glyphs=4
2026-03-14T07:36:45.044758	cf93b656	0	0	0.0000	CRASH	gen=492 glyphs=3
2026-03-14T07:36:45.044957	74faedb9	0	0	0.0000	CRASH	gen=492 glyphs=3
2026-03-14T07:36:45.045154	099964a4	0	0	0.0000	CRASH	gen=492 glyphs=4
2026-03-14T07:36:45.045355	3a734398	0	0	0.0000	CRASH	gen=492 glyphs=4
2026-03-14T07:36:45.045559	58b7b188	0	0	0.0000	CRASH	gen=492 glyphs=3
2026-03-14T07:36:45.045832	099964a4	0	0	0.0000	CRASH	gen=493 glyphs=4
2026-03-14T07:36:45.046029	099964a4	0	0	0.0000	CRASH	gen=493 glyphs=4
2026-03-14T07:36:45.046226	099964a4	0	0	0.0000	CRASH	gen=493 glyphs=4
2026-03-14T07:36:45.046423	099964a4	0	0	0.0000	CRASH	gen=493 glyphs=4
2026-03-14T07:36:45.046622	099964a4	0	0	0.0000	CRASH	gen=493 glyphs=4
2026-03-14T07:36:45.046817	cf93b656	0	0	0.0000	CRASH	gen=493 glyphs=3
2026-03-14T07:36:45.047011	1610550d	0	0	0.0000	CRASH	gen=493 glyphs=4
2026-03-14T07:36:45.047207	e97a0dad	0	0	0.0000	CRASH	gen=493 glyphs=4
2026-03-14T07:36:45.047406	099964a4	0	0	0.0000	CRASH	gen=493 glyphs=4
2026-03-14T07:36:45.047610	7ede4765	0	0	0.0000	CRASH	gen=493 glyphs=2
2026-03-14T07:36:45.047890	099964a4	0	0	0.0000	CRASH	gen=494 glyphs=4
2026-03-14T07:36:45.048086	099964a4	0	0	0.0000	CRASH	gen=494 glyphs=4
2026-03-14T07:36:45.048280	c93feb62	0	0	0.0000	CRASH	gen=494 glyphs=4
2026-03-14T07:36:45.048477	099964a4	0	0	0.0000	CRASH	gen=494 glyphs=4
2026-03-14T07:36:45.048677	cc878f9a	0	0	0.0000	CRASH	gen=494 glyphs=4
2026-03-14T07:36:45.048874	ff30496a	0	0	0.0000	CRASH	gen=494 glyphs=3
2026-03-14T07:36:45.049068	18212b6e	0	0	0.0000	CRASH	gen=494 glyphs=4
2026-03-14T07:36:45.049262	cd23daf5	0	0	0.0000	CRASH	gen=494 glyphs=4
2026-03-14T07:36:45.049460	099964a4	0	0	0.0000	CRASH	gen=494 glyphs=4
2026-03-14T07:36:45.049662	88626317	0	0	0.0000	CRASH	gen=494 glyphs=4
2026-03-14T07:36:45.049956	099964a4	0	0	0.0000	CRASH	gen=495 glyphs=4
2026-03-14T07:36:45.050153	099964a4	0	0	0.0000	CRASH	gen=495 glyphs=4
2026-03-14T07:36:45.050350	54347f0f	0	0	0.0000	CRASH	gen=495 glyphs=4
2026-03-14T07:36:45.050552	099964a4	0	0	0.0000	CRASH	gen=495 glyphs=4
2026-03-14T07:36:45.050754	099964a4	0	0	0.0000	CRASH	gen=495 glyphs=4
2026-03-14T07:36:45.050948	28abac32	0	0	0.0000	CRASH	gen=495 glyphs=4
2026-03-14T07:36:45.051147	099964a4	0	0	0.0000	CRASH	gen=495 glyphs=4
2026-03-14T07:36:45.051342	099964a4	0	0	0.0000	CRASH	gen=495 glyphs=4
2026-03-14T07:36:45.051544	aa1609b6	0	0	0.0000	CRASH	gen=495 glyphs=4
2026-03-14T07:36:45.051747	099964a4	0	0	0.0000	CRASH	gen=495 glyphs=4
2026-03-14T07:36:45.052034	099964a4	0	0	0.0000	CRASH	gen=496 glyphs=4
2026-03-14T07:36:45.052232	099964a4	0	0	0.0000	CRASH	gen=496 glyphs=4
2026-03-14T07:36:45.052429	8c012671	0	0	0.0000	CRASH	gen=496 glyphs=4
2026-03-14T07:36:45.052629	099964a4	0	0	0.0000	CRASH	gen=496 glyphs=4
2026-03-14T07:36:45.052832	0a24ab8f	0	0	0.0000	CRASH	gen=496 glyphs=4
2026-03-14T07:36:45.053028	099964a4	0	0	0.0000	CRASH	gen=496 glyphs=4
2026-03-14T07:36:45.053225	7be9f33e	0	0	0.0000	CRASH	gen=496 glyphs=4
2026-03-14T07:36:45.053426	099964a4	0	0	0.0000	CRASH	gen=496 glyphs=4
2026-03-14T07:36:45.053627	8c6930d9	0	0	0.0000	CRASH	gen=496 glyphs=4
2026-03-14T07:36:45.053830	099964a4	0	0	0.0000	CRASH	gen=496 glyphs=4
2026-03-14T07:36:45.054124	099964a4	0	0	0.0000	CRASH	gen=497 glyphs=4
2026-03-14T07:36:45.054323	099964a4	0	0	0.0000	CRASH	gen=497 glyphs=4
2026-03-14T07:36:45.054526	099964a4	0	0	0.0000	CRASH	gen=497 glyphs=4
2026-03-14T07:36:45.054721	7a938e18	0	0	0.0000	CRASH	gen=497 glyphs=4
2026-03-14T07:36:45.054923	099964a4	0	0	0.0000	CRASH	gen=497 glyphs=4
2026-03-14T07:36:45.055118	099964a4	0	0	0.0000	CRASH	gen=497 glyphs=4
2026-03-14T07:36:45.055313	099964a4	0	0	0.0000	CRASH	gen=497 glyphs=4
2026-03-14T07:36:45.055513	67cadfd3	0	0	0.0000	CRASH	gen=497 glyphs=4
2026-03-14T07:36:45.055719	96104d35	0	0	0.0000	CRASH	gen=497 glyphs=2
2026-03-14T07:36:45.055918	df6d724c	0	0	0.0000	CRASH	gen=497 glyphs=4
2026-03-14T07:36:45.056209	099964a4	0	0	0.0000	CRASH	gen=498 glyphs=4
2026-03-14T07:36:45.056413	099964a4	0	0	0.0000	CRASH	gen=498 glyphs=4
2026-03-14T07:36:45.056620	099964a4	0	0	0.0000	CRASH	gen=498 glyphs=4
2026-03-14T07:36:45.056819	099964a4	0	0	0.0000	CRASH	gen=498 glyphs=4
2026-03-14T07:36:45.057016	4229c19a	0	0	0.0000	CRASH	gen=498 glyphs=3
2026-03-14T07:36:45.057212	80cef82b	0	0	0.0000	CRASH	gen=498 glyphs=4
2026-03-14T07:36:45.057409	099964a4	0	0	0.0000	CRASH	gen=498 glyphs=4
2026-03-14T07:36:45.057612	a8bc59b8	0	0	0.0000	CRASH	gen=498 glyphs=3
2026-03-14T07:36:45.057811	099964a4	0	0	0.0000	CRASH	gen=498 glyphs=4
2026-03-14T07:36:45.058015	ff30496a	0	0	0.0000	CRASH	gen=498 glyphs=3
2026-03-14T07:36:45.058288	099964a4	0	0	0.0000	CRASH	gen=499 glyphs=4
2026-03-14T07:36:45.058482	099964a4	0	0	0.0000	CRASH	gen=499 glyphs=4
2026-03-14T07:36:45.058678	f807e706	0	0	0.0000	CRASH	gen=499 glyphs=4
2026-03-14T07:36:45.058871	cf93b656	0	0	0.0000	CRASH	gen=499 glyphs=3
2026-03-14T07:36:45.059065	3a734398	0	0	0.0000	CRASH	gen=499 glyphs=4
2026-03-14T07:36:45.059258	428090f8	0	0	0.0000	CRASH	gen=499 glyphs=4
2026-03-14T07:36:45.059452	099964a4	0	0	0.0000	CRASH	gen=499 glyphs=4
2026-03-14T07:36:45.059647	099964a4	0	0	0.0000	CRASH	gen=499 glyphs=4
2026-03-14T07:36:45.059843	099964a4	0	0	0.0000	CRASH	gen=499 glyphs=4
2026-03-14T07:36:45.060038	099964a4	0	0	0.0000	CRASH	gen=499 glyphs=4
2026-03-14T07:36:45.060320	099964a4	0	0	0.0000	CRASH	gen=500 glyphs=4
2026-03-14T07:36:45.060515	099964a4	0	0	0.0000	CRASH	gen=500 glyphs=4
2026-03-14T07:36:45.060713	099964a4	0	0	0.0000	CRASH	gen=500 glyphs=4
2026-03-14T07:36:45.060906	ff30496a	0	0	0.0000	CRASH	gen=500 glyphs=3
2026-03-14T07:36:45.061100	cf93b656	0	0	0.0000	CRASH	gen=500 glyphs=3
2026-03-14T07:36:45.061296	0f4d03e2	0	0	0.0000	CRASH	gen=500 glyphs=4
2026-03-14T07:36:45.061491	099964a4	0	0	0.0000	CRASH	gen=500 glyphs=4
2026-03-14T07:36:45.061685	8da1f8d8	0	0	0.0000	CRASH	gen=500 glyphs=4
2026-03-14T07:36:45.061879	80cef82b	0	0	0.0000	CRASH	gen=500 glyphs=4
2026-03-14T07:36:45.062075	ff30496a	0	0	0.0000	CRASH	gen=500 glyphs=3
2026-03-14T07:36:45.062350	099964a4	0	0	0.0000	CRASH	gen=501 glyphs=4
2026-03-14T07:36:45.062551	099964a4	0	0	0.0000	CRASH	gen=501 glyphs=4
2026-03-14T07:36:45.062746	099964a4	0	0	0.0000	CRASH	gen=501 glyphs=4
2026-03-14T07:36:45.062939	099964a4	0	0	0.0000	CRASH	gen=501 glyphs=4
2026-03-14T07:36:45.063130	099964a4	0	0	0.0000	CRASH	gen=501 glyphs=4
2026-03-14T07:36:45.063325	099964a4	0	0	0.0000	CRASH	gen=501 glyphs=4
2026-03-14T07:36:45.063521	099964a4	0	0	0.0000	CRASH	gen=501 glyphs=4
2026-03-14T07:36:45.063713	cf93b656	0	0	0.0000	CRASH	gen=501 glyphs=3
2026-03-14T07:36:45.063909	e842f14e	0	0	0.0000	CRASH	gen=501 glyphs=4
2026-03-14T07:36:45.064105	7ede4765	0	0	0.0000	CRASH	gen=501 glyphs=2
2026-03-14T07:36:45.064387	099964a4	0	0	0.0000	CRASH	gen=502 glyphs=4
2026-03-14T07:36:45.064582	099964a4	0	0	0.0000	CRASH	gen=502 glyphs=4
2026-03-14T07:36:45.064773	099964a4	0	0	0.0000	CRASH	gen=502 glyphs=4
2026-03-14T07:36:45.064963	099964a4	0	0	0.0000	CRASH	gen=502 glyphs=4
2026-03-14T07:36:45.065151	8da1f8d8	0	0	0.0000	CRASH	gen=502 glyphs=4
2026-03-14T07:36:45.065343	da21d281	0	0	0.0000	CRASH	gen=502 glyphs=4
2026-03-14T07:36:45.065541	8da1f8d8	0	0	0.0000	CRASH	gen=502 glyphs=4
2026-03-14T07:36:45.065736	3a734398	0	0	0.0000	CRASH	gen=502 glyphs=4
2026-03-14T07:36:45.065928	099964a4	0	0	0.0000	CRASH	gen=502 glyphs=4
2026-03-14T07:36:45.066118	099964a4	0	0	0.0000	CRASH	gen=502 glyphs=4
2026-03-14T07:36:45.066386	099964a4	0	0	0.0000	CRASH	gen=503 glyphs=4
2026-03-14T07:36:45.066588	099964a4	0	0	0.0000	CRASH	gen=503 glyphs=4
2026-03-14T07:36:45.066781	099964a4	0	0	0.0000	CRASH	gen=503 glyphs=4
2026-03-14T07:36:45.066975	6c960aa9	0	0	0.0000	CRASH	gen=503 glyphs=4
2026-03-14T07:36:45.067169	099964a4	0	0	0.0000	CRASH	gen=503 glyphs=4
2026-03-14T07:36:45.067362	80cef82b	0	0	0.0000	CRASH	gen=503 glyphs=4
2026-03-14T07:36:45.067565	344a0787	0	0	0.0000	CRASH	gen=503 glyphs=3
2026-03-14T07:36:45.067759	cf93b656	0	0	0.0000	CRASH	gen=503 glyphs=3
2026-03-14T07:36:45.067959	099964a4	0	0	0.0000	CRASH	gen=503 glyphs=4
2026-03-14T07:36:45.068152	099964a4	0	0	0.0000	CRASH	gen=503 glyphs=4
2026-03-14T07:36:45.068427	099964a4	0	0	0.0000	CRASH	gen=504 glyphs=4
2026-03-14T07:36:45.068628	099964a4	0	0	0.0000	CRASH	gen=504 glyphs=4
2026-03-14T07:36:45.068823	7ede4765	0	0	0.0000	CRASH	gen=504 glyphs=2
2026-03-14T07:36:45.069016	099964a4	0	0	0.0000	CRASH	gen=504 glyphs=4
2026-03-14T07:36:45.069208	da0f4ea0	0	0	0.0000	CRASH	gen=504 glyphs=3
2026-03-14T07:36:45.069401	dcb1fb50	0	0	0.0000	CRASH	gen=504 glyphs=4
2026-03-14T07:36:45.069602	76f26990	0	0	0.0000	CRASH	gen=504 glyphs=4
2026-03-14T07:36:45.069795	099964a4	0	0	0.0000	CRASH	gen=504 glyphs=4
2026-03-14T07:36:45.069989	099964a4	0	0	0.0000	CRASH	gen=504 glyphs=4
2026-03-14T07:36:45.070181	7ede4765	0	0	0.0000	CRASH	gen=504 glyphs=2
2026-03-14T07:36:45.070455	099964a4	0	0	0.0000	CRASH	gen=505 glyphs=4
2026-03-14T07:36:45.070659	099964a4	0	0	0.0000	CRASH	gen=505 glyphs=4
2026-03-14T07:36:45.070854	099964a4	0	0	0.0000	CRASH	gen=505 glyphs=4
2026-03-14T07:36:45.071051	099964a4	0	0	0.0000	CRASH	gen=505 glyphs=4
2026-03-14T07:36:45.071245	506698d3	0	0	0.0000	CRASH	gen=505 glyphs=1
2026-03-14T07:36:45.071436	099964a4	0	0	0.0000	CRASH	gen=505 glyphs=4
2026-03-14T07:36:45.071633	8da1f8d8	0	0	0.0000	CRASH	gen=505 glyphs=4
2026-03-14T07:36:45.071834	fdd083d4	0	0	0.0000	CRASH	gen=505 glyphs=4
2026-03-14T07:36:45.072030	099964a4	0	0	0.0000	CRASH	gen=505 glyphs=4
2026-03-14T07:36:45.072224	099964a4	0	0	0.0000	CRASH	gen=505 glyphs=4
2026-03-14T07:36:45.072508	099964a4	0	0	0.0000	CRASH	gen=506 glyphs=4
2026-03-14T07:36:45.072706	099964a4	0	0	0.0000	CRASH	gen=506 glyphs=4
2026-03-14T07:36:45.072903	ff30496a	0	0	0.0000	CRASH	gen=506 glyphs=3
2026-03-14T07:36:45.073098	7ede4765	0	0	0.0000	CRASH	gen=506 glyphs=2
2026-03-14T07:36:45.073291	3ca14993	0	0	0.0000	CRASH	gen=506 glyphs=4
2026-03-14T07:36:45.073486	099964a4	0	0	0.0000	CRASH	gen=506 glyphs=4
2026-03-14T07:36:45.073682	c8f7dab0	0	0	0.0000	CRASH	gen=506 glyphs=5
2026-03-14T07:36:45.073887	3be994bd	0	0	0.0000	CRASH	gen=506 glyphs=4
2026-03-14T07:36:45.074084	4c72ad8e	0	0	0.0000	CRASH	gen=506 glyphs=4
2026-03-14T07:36:45.074278	ff30496a	0	0	0.0000	CRASH	gen=506 glyphs=3
2026-03-14T07:36:45.074565	099964a4	0	0	0.0000	CRASH	gen=507 glyphs=4
2026-03-14T07:36:45.074763	099964a4	0	0	0.0000	CRASH	gen=507 glyphs=4
2026-03-14T07:36:45.074965	70fdaa86	0	0	0.0000	CRASH	gen=507 glyphs=3
2026-03-14T07:36:45.075160	099964a4	0	0	0.0000	CRASH	gen=507 glyphs=4
2026-03-14T07:36:45.075355	73aec002	0	0	0.0000	CRASH	gen=507 glyphs=4
2026-03-14T07:36:45.075552	804966cc	0	0	0.0000	CRASH	gen=507 glyphs=4
2026-03-14T07:36:45.075746	e4459302	0	0	0.0000	CRASH	gen=507 glyphs=2
2026-03-14T07:36:45.075945	099964a4	0	0	0.0000	CRASH	gen=507 glyphs=4
2026-03-14T07:36:45.076141	737b7909	0	0	0.0000	CRASH	gen=507 glyphs=4
2026-03-14T07:36:45.076336	099964a4	0	0	0.0000	CRASH	gen=507 glyphs=4
2026-03-14T07:36:45.076606	099964a4	0	0	0.0000	CRASH	gen=508 glyphs=4
2026-03-14T07:36:45.076804	099964a4	0	0	0.0000	CRASH	gen=508 glyphs=4
2026-03-14T07:36:45.077002	099964a4	0	0	0.0000	CRASH	gen=508 glyphs=4
2026-03-14T07:36:45.077197	f53cb2ef	0	0	0.0000	CRASH	gen=508 glyphs=4
2026-03-14T07:36:45.077391	2f784126	0	0	0.0000	CRASH	gen=508 glyphs=3
2026-03-14T07:36:45.077589	099964a4	0	0	0.0000	CRASH	gen=508 glyphs=4
2026-03-14T07:36:45.077783	3f9df56c	0	0	0.0000	CRASH	gen=508 glyphs=3
2026-03-14T07:36:45.077975	099964a4	0	0	0.0000	CRASH	gen=508 glyphs=4
2026-03-14T07:36:45.078173	099964a4	0	0	0.0000	CRASH	gen=508 glyphs=4
2026-03-14T07:36:45.078367	dcb1fb50	0	0	0.0000	CRASH	gen=508 glyphs=4
2026-03-14T07:36:45.078642	099964a4	0	0	0.0000	CRASH	gen=509 glyphs=4
2026-03-14T07:36:45.078839	099964a4	0	0	0.0000	CRASH	gen=509 glyphs=4
2026-03-14T07:36:45.079035	099964a4	0	0	0.0000	CRASH	gen=509 glyphs=4
2026-03-14T07:36:45.079232	099964a4	0	0	0.0000	CRASH	gen=509 glyphs=4
2026-03-14T07:36:45.079424	37cb660c	0	0	0.0000	CRASH	gen=509 glyphs=4
2026-03-14T07:36:45.079619	099964a4	0	0	0.0000	CRASH	gen=509 glyphs=4
2026-03-14T07:36:45.079810	099964a4	0	0	0.0000	CRASH	gen=509 glyphs=4
2026-03-14T07:36:45.080001	cf93b656	0	0	0.0000	CRASH	gen=509 glyphs=3
2026-03-14T07:36:45.080199	6f6b7213	0	0	0.0000	CRASH	gen=509 glyphs=2
2026-03-14T07:36:45.080394	099964a4	0	0	0.0000	CRASH	gen=509 glyphs=4
2026-03-14T07:36:45.080677	099964a4	0	0	0.0000	CRASH	gen=510 glyphs=4
2026-03-14T07:36:45.080873	099964a4	0	0	0.0000	CRASH	gen=510 glyphs=4
2026-03-14T07:36:45.081067	099964a4	0	0	0.0000	CRASH	gen=510 glyphs=4
2026-03-14T07:36:45.081265	5d5892f5	0	0	0.0000	CRASH	gen=510 glyphs=3
2026-03-14T07:36:45.081459	ff30496a	0	0	0.0000	CRASH	gen=510 glyphs=3
2026-03-14T07:36:45.081656	099964a4	0	0	0.0000	CRASH	gen=510 glyphs=4
2026-03-14T07:36:45.081851	cbee5178	0	0	0.0000	CRASH	gen=510 glyphs=4
2026-03-14T07:36:45.082046	1d0a6360	0	0	0.0000	CRASH	gen=510 glyphs=3
2026-03-14T07:36:45.082239	099964a4	0	0	0.0000	CRASH	gen=510 glyphs=4
2026-03-14T07:36:45.082436	b65e459d	0	0	0.0000	CRASH	gen=510 glyphs=4
2026-03-14T07:36:45.082726	099964a4	0	0	0.0000	CRASH	gen=511 glyphs=4
2026-03-14T07:36:45.082925	099964a4	0	0	0.0000	CRASH	gen=511 glyphs=4
2026-03-14T07:36:45.083120	099964a4	0	0	0.0000	CRASH	gen=511 glyphs=4
2026-03-14T07:36:45.083314	7ede4765	0	0	0.0000	CRASH	gen=511 glyphs=2
2026-03-14T07:36:45.083510	099964a4	0	0	0.0000	CRASH	gen=511 glyphs=4
2026-03-14T07:36:45.083706	099964a4	0	0	0.0000	CRASH	gen=511 glyphs=4
2026-03-14T07:36:45.083899	099964a4	0	0	0.0000	CRASH	gen=511 glyphs=4
2026-03-14T07:36:45.084093	099964a4	0	0	0.0000	CRASH	gen=511 glyphs=4
2026-03-14T07:36:45.084287	16a01237	0	0	0.0000	CRASH	gen=511 glyphs=4
2026-03-14T07:36:45.084487	3a734398	0	0	0.0000	CRASH	gen=511 glyphs=4
2026-03-14T07:36:45.084762	099964a4	0	0	0.0000	CRASH	gen=512 glyphs=4
2026-03-14T07:36:45.084959	099964a4	0	0	0.0000	CRASH	gen=512 glyphs=4
2026-03-14T07:36:45.085154	8da1f8d8	0	0	0.0000	CRASH	gen=512 glyphs=4
2026-03-14T07:36:45.085349	53c09a69	0	0	0.0000	CRASH	gen=512 glyphs=4
2026-03-14T07:36:45.085549	099964a4	0	0	0.0000	CRASH	gen=512 glyphs=4
2026-03-14T07:36:45.085741	099964a4	0	0	0.0000	CRASH	gen=512 glyphs=4
2026-03-14T07:36:45.085936	dcb1fb50	0	0	0.0000	CRASH	gen=512 glyphs=4
2026-03-14T07:36:45.086129	4ec28d55	0	0	0.0000	CRASH	gen=512 glyphs=2
2026-03-14T07:36:45.086321	099964a4	0	0	0.0000	CRASH	gen=512 glyphs=4
2026-03-14T07:36:45.086512	ac8639da	0	0	0.0000	CRASH	gen=512 glyphs=4
2026-03-14T07:36:45.086792	099964a4	0	0	0.0000	CRASH	gen=513 glyphs=4
2026-03-14T07:36:45.086987	099964a4	0	0	0.0000	CRASH	gen=513 glyphs=4
2026-03-14T07:36:45.087183	099964a4	0	0	0.0000	CRASH	gen=513 glyphs=4
2026-03-14T07:36:45.087377	3ca14993	0	0	0.0000	CRASH	gen=513 glyphs=4
2026-03-14T07:36:45.087579	f5a1d64f	0	0	0.0000	CRASH	gen=513 glyphs=4
2026-03-14T07:36:45.087774	8da1f8d8	0	0	0.0000	CRASH	gen=513 glyphs=4
2026-03-14T07:36:45.087967	e9b18518	0	0	0.0000	CRASH	gen=513 glyphs=5
2026-03-14T07:36:45.088160	099964a4	0	0	0.0000	CRASH	gen=513 glyphs=4
