timestamp	program_hash	spirv_size	word_count	fitness	status	description
2026-03-14T07:36:44.183196	060de7dd	0	0	0.0000	CRASH	gen=75 glyphs=3
2026-03-14T07:36:44.183390	a34f10cf	0	0	0.0000	CRASH	gen=75 glyphs=4
2026-03-14T07:36:44.183589	dcb1fb50	0	0	0.0000	CRASH	gen=75 glyphs=4
2026-03-14T07:36:44.183787	099964a4	0	0	0.0000	CRASH	gen=75 glyphs=4
2026-03-14T07:36:44.183978	099964a4	0	0	0.0000	CRASH	gen=75 glyphs=4
2026-03-14T07:36:44.184172	099964a4	0	0	0.0000	CRASH	gen=75 glyphs=4
2026-03-14T07:36:44.184363	21f004c4	0	0	0.0000	CRASH	gen=75 glyphs=4
2026-03-14T07:36:44.184649	099964a4	0	0	0.0000	CRASH	gen=76 glyphs=4
2026-03-14T07:36:44.184850	099964a4	0	0	0.0000	CRASH	gen=76 glyphs=4
2026-03-14T07:36:44.185044	099964a4	0	0	0.0000	CRASH	gen=76 glyphs=4
2026-03-14T07:36:44.185238	099964a4	0	0	0.0000	CRASH	gen=76 glyphs=4
2026-03-14T07:36:44.185432	1b32b8dc	0	0	0.0000	CRASH	gen=76 glyphs=3
2026-03-14T07:36:44.185628	700932f1	0	0	0.0000	CRASH	gen=76 glyphs=3
2026-03-14T07:36:44.185825	128c2a9f	0	0	0.0000	CRASH	gen=76 glyphs=4
2026-03-14T07:36:44.186018	cf93b656	0	0	0.0000	CRASH	gen=76 glyphs=3
2026-03-14T07:36:44.186213	6b794ba4	0	0	0.0000	CRASH	gen=76 glyphs=3
2026-03-14T07:36:44.186405	099964a4	0	0	0.0000	CRASH	gen=76 glyphs=4
2026-03-14T07:36:44.186683	099964a4	0	0	0.0000	CRASH	gen=77 glyphs=4
2026-03-14T07:36:44.186885	099964a4	0	0	0.0000	CRASH	gen=77 glyphs=4
2026-03-14T07:36:44.187078	d6d2c09c	0	0	0.0000	CRASH	gen=77 glyphs=4
2026-03-14T07:36:44.187274	cf93b656	0	0	0.0000	CRASH	gen=77 glyphs=3
2026-03-14T07:36:44.187466	dcb1fb50	0	0	0.0000	CRASH	gen=77 glyphs=4
2026-03-14T07:36:44.187662	3a734398	0	0	0.0000	CRASH	gen=77 glyphs=4
2026-03-14T07:36:44.187856	099964a4	0	0	0.0000	CRASH	gen=77 glyphs=4
2026-03-14T07:36:44.188053	099964a4	0	0	0.0000	CRASH	gen=77 glyphs=4
2026-03-14T07:36:44.188248	099964a4	0	0	0.0000	CRASH	gen=77 glyphs=4
2026-03-14T07:36:44.188440	04884f47	0	0	0.0000	CRASH	gen=77 glyphs=4
2026-03-14T07:36:44.188715	099964a4	0	0	0.0000	CRASH	gen=78 glyphs=4
2026-03-14T07:36:44.188915	099964a4	0	0	0.0000	CRASH	gen=78 glyphs=4
2026-03-14T07:36:44.189118	3977970f	0	0	0.0000	CRASH	gen=78 glyphs=2
2026-03-14T07:36:44.189315	099964a4	0	0	0.0000	CRASH	gen=78 glyphs=4
2026-03-14T07:36:44.189513	099964a4	0	0	0.0000	CRASH	gen=78 glyphs=4
2026-03-14T07:36:44.189714	099964a4	0	0	0.0000	CRASH	gen=78 glyphs=4
2026-03-14T07:36:44.189910	099964a4	0	0	0.0000	CRASH	gen=78 glyphs=4
2026-03-14T07:36:44.190111	b1169125	0	0	0.0000	CRASH	gen=78 glyphs=3
2026-03-14T07:36:44.190311	099964a4	0	0	0.0000	CRASH	gen=78 glyphs=4
2026-03-14T07:36:44.190506	8c6a91df	0	0	0.0000	CRASH	gen=78 glyphs=3
2026-03-14T07:36:44.190785	099964a4	0	0	0.0000	CRASH	gen=79 glyphs=4
2026-03-14T07:36:44.190982	099964a4	0	0	0.0000	CRASH	gen=79 glyphs=4
2026-03-14T07:36:44.191184	d44b27df	0	0	0.0000	CRASH	gen=79 glyphs=4
2026-03-14T07:36:44.191381	d48feed3	0	0	0.0000	CRASH	gen=79 glyphs=4
2026-03-14T07:36:44.191578	099964a4	0	0	0.0000	CRASH	gen=79 glyphs=4
2026-03-14T07:36:44.191772	099964a4	0	0	0.0000	CRASH	gen=79 glyphs=4
2026-03-14T07:36:44.191964	099964a4	0	0	0.0000	CRASH	gen=79 glyphs=4
2026-03-14T07:36:44.192156	29998e70	0	0	0.0000	CRASH	gen=79 glyphs=4
2026-03-14T07:36:44.192355	099964a4	0	0	0.0000	CRASH	gen=79 glyphs=4
2026-03-14T07:36:44.192546	3a734398	0	0	0.0000	CRASH	gen=79 glyphs=4
2026-03-14T07:36:44.192835	099964a4	0	0	0.0000	CRASH	gen=80 glyphs=4
2026-03-14T07:36:44.193032	099964a4	0	0	0.0000	CRASH	gen=80 glyphs=4
2026-03-14T07:36:44.193224	d046d7f2	0	0	0.0000	CRASH	gen=80 glyphs=2
2026-03-14T07:36:44.193421	8e52b3d8	0	0	0.0000	CRASH	gen=80 glyphs=4
2026-03-14T07:36:44.193616	3ca14993	0	0	0.0000	CRASH	gen=80 glyphs=4
2026-03-14T07:36:44.193810	099964a4	0	0	0.0000	CRASH	gen=80 glyphs=4
2026-03-14T07:36:44.194001	099964a4	0	0	0.0000	CRASH	gen=80 glyphs=4
2026-03-14T07:36:44.194192	cf93b656	0	0	0.0000	CRASH	gen=80 glyphs=3
2026-03-14T07:36:44.194391	099964a4	0	0	0.0000	CRASH	gen=80 glyphs=4
2026-03-14T07:36:44.194586	322a0dc6	0	0	0.0000	CRASH	gen=80 glyphs=2
2026-03-14T07:36:44.194876	099964a4	0	0	0.0000	CRASH	gen=81 glyphs=4
2026-03-14T07:36:44.195070	099964a4	0	0	0.0000	CRASH	gen=81 glyphs=4
2026-03-14T07:36:44.195262	8da1f8d8	0	0	0.0000	CRASH	gen=81 glyphs=4
2026-03-14T07:36:44.195463	099964a4	0	0	0.0000	CRASH	gen=81 glyphs=4
2026-03-14T07:36:44.195657	1dbbc714	0	0	0.0000	CRASH	gen=81 glyphs=4
2026-03-14T07:36:44.195849	f4a35dd0	0	0	0.0000	CRASH	gen=81 glyphs=4
2026-03-14T07:36:44.196053	644f17c5	0	0	0.0000	CRASH	gen=81 glyphs=2
2026-03-14T07:36:44.196266	099964a4	0	0	0.0000	CRASH	gen=81 glyphs=4
2026-03-14T07:36:44.196481	099964a4	0	0	0.0000	CRASH	gen=81 glyphs=4
2026-03-14T07:36:44.196683	099964a4	0	0	0.0000	CRASH	gen=81 glyphs=4
2026-03-14T07:36:44.196963	099964a4	0	0	0.0000	CRASH	gen=82 glyphs=4
2026-03-14T07:36:44.197158	099964a4	0	0	0.0000	CRASH	gen=82 glyphs=4
2026-03-14T07:36:44.197351	099964a4	0	0	0.0000	CRASH	gen=82 glyphs=4
2026-03-14T07:36:44.197553	b1b51a0e	0	0	0.0000	CRASH	gen=82 glyphs=3
2026-03-14T07:36:44.197745	099964a4	0	0	0.0000	CRASH	gen=82 glyphs=4
2026-03-14T07:36:44.197950	099964a4	0	0	0.0000	CRASH	gen=82 glyphs=4
2026-03-14T07:36:44.198141	b178b658	0	0	0.0000	CRASH	gen=82 glyphs=4
2026-03-14T07:36:44.198334	099964a4	0	0	0.0000	CRASH	gen=82 glyphs=4
2026-03-14T07:36:44.198531	dcb1fb50	0	0	0.0000	CRASH	gen=82 glyphs=4
2026-03-14T07:36:44.198728	03620c13	0	0	0.0000	CRASH	gen=82 glyphs=4
2026-03-14T07:36:44.199011	099964a4	0	0	0.0000	CRASH	gen=83 glyphs=4
2026-03-14T07:36:44.199207	099964a4	0	0	0.0000	CRASH	gen=83 glyphs=4
2026-03-14T07:36:44.199418	ce322a85	0	0	0.0000	CRASH	gen=83 glyphs=5
2026-03-14T07:36:44.199637	80cef82b	0	0	0.0000	CRASH	gen=83 glyphs=4
2026-03-14T07:36:44.199836	1c193abf	0	0	0.0000	CRASH	gen=83 glyphs=3
2026-03-14T07:36:44.200031	099964a4	0	0	0.0000	CRASH	gen=83 glyphs=4
2026-03-14T07:36:44.200223	86e237d3	0	0	0.0000	CRASH	gen=83 glyphs=4
2026-03-14T07:36:44.200417	099964a4	0	0	0.0000	CRASH	gen=83 glyphs=4
2026-03-14T07:36:44.200615	099964a4	0	0	0.0000	CRASH	gen=83 glyphs=4
2026-03-14T07:36:44.200811	eb03af25	0	0	0.0000	CRASH	gen=83 glyphs=4
2026-03-14T07:36:44.201098	099964a4	0	0	0.0000	CRASH	gen=84 glyphs=4
2026-03-14T07:36:44.201291	099964a4	0	0	0.0000	CRASH	gen=84 glyphs=4
2026-03-14T07:36:44.201486	80cef82b	0	0	0.0000	CRASH	gen=84 glyphs=4
2026-03-14T07:36:44.201683	07c94def	0	0	0.0000	CRASH	gen=84 glyphs=4
2026-03-14T07:36:44.201881	ff332935	0	0	0.0000	CRASH	gen=84 glyphs=3
2026-03-14T07:36:44.202073	099964a4	0	0	0.0000	CRASH	gen=84 glyphs=4
2026-03-14T07:36:44.202266	1627fcf9	0	0	0.0000	CRASH	gen=84 glyphs=5
2026-03-14T07:36:44.202458	22d8c349	0	0	0.0000	CRASH	gen=84 glyphs=4
2026-03-14T07:36:44.202655	099964a4	0	0	0.0000	CRASH	gen=84 glyphs=4
2026-03-14T07:36:44.202849	cdc5bda1	0	0	0.0000	CRASH	gen=84 glyphs=5
2026-03-14T07:36:44.203129	099964a4	0	0	0.0000	CRASH	gen=85 glyphs=4
2026-03-14T07:36:44.203323	099964a4	0	0	0.0000	CRASH	gen=85 glyphs=4
2026-03-14T07:36:44.203523	718fc734	0	0	0.0000	CRASH	gen=85 glyphs=4
2026-03-14T07:36:44.203717	8cbe3429	0	0	0.0000	CRASH	gen=85 glyphs=4
2026-03-14T07:36:44.203917	ee5c5e3f	0	0	0.0000	CRASH	gen=85 glyphs=4
2026-03-14T07:36:44.204110	099964a4	0	0	0.0000	CRASH	gen=85 glyphs=4
2026-03-14T07:36:44.204303	099964a4	0	0	0.0000	CRASH	gen=85 glyphs=4
2026-03-14T07:36:44.204494	eb1756df	0	0	0.0000	CRASH	gen=85 glyphs=4
2026-03-14T07:36:44.204697	dcb1fb50	0	0	0.0000	CRASH	gen=85 glyphs=4
2026-03-14T07:36:44.204894	3a734398	0	0	0.0000	CRASH	gen=85 glyphs=4
2026-03-14T07:36:44.205160	099964a4	0	0	0.0000	CRASH	gen=86 glyphs=4
2026-03-14T07:36:44.205353	099964a4	0	0	0.0000	CRASH	gen=86 glyphs=4
2026-03-14T07:36:44.205547	099964a4	0	0	0.0000	CRASH	gen=86 glyphs=4
2026-03-14T07:36:44.205737	099964a4	0	0	0.0000	CRASH	gen=86 glyphs=4
2026-03-14T07:36:44.205928	099964a4	0	0	0.0000	CRASH	gen=86 glyphs=4
2026-03-14T07:36:44.206122	f780dae2	0	0	0.0000	CRASH	gen=86 glyphs=3
2026-03-14T07:36:44.206314	23e6475b	0	0	0.0000	CRASH	gen=86 glyphs=5
2026-03-14T07:36:44.206507	099964a4	0	0	0.0000	CRASH	gen=86 glyphs=4
2026-03-14T07:36:44.206702	ff30496a	0	0	0.0000	CRASH	gen=86 glyphs=3
2026-03-14T07:36:44.206891	099964a4	0	0	0.0000	CRASH	gen=86 glyphs=4
2026-03-14T07:36:44.207166	099964a4	0	0	0.0000	CRASH	gen=87 glyphs=4
2026-03-14T07:36:44.207362	099964a4	0	0	0.0000	CRASH	gen=87 glyphs=4
2026-03-14T07:36:44.207560	83b360f9	0	0	0.0000	CRASH	gen=87 glyphs=4
2026-03-14T07:36:44.207757	099964a4	0	0	0.0000	CRASH	gen=87 glyphs=4
2026-03-14T07:36:44.207951	d810f5c1	0	0	0.0000	CRASH	gen=87 glyphs=3
2026-03-14T07:36:44.208159	c68b922c	0	0	0.0000	CRASH	gen=87 glyphs=4
2026-03-14T07:36:44.208355	ff30496a	0	0	0.0000	CRASH	gen=87 glyphs=3
2026-03-14T07:36:44.208551	099964a4	0	0	0.0000	CRASH	gen=87 glyphs=4
2026-03-14T07:36:44.208744	6e423b1e	0	0	0.0000	CRASH	gen=87 glyphs=4
2026-03-14T07:36:44.208939	099964a4	0	0	0.0000	CRASH	gen=87 glyphs=4
2026-03-14T07:36:44.209216	099964a4	0	0	0.0000	CRASH	gen=88 glyphs=4
2026-03-14T07:36:44.209410	099964a4	0	0	0.0000	CRASH	gen=88 glyphs=4
2026-03-14T07:36:44.209605	099964a4	0	0	0.0000	CRASH	gen=88 glyphs=4
2026-03-14T07:36:44.209797	ecaeff6d	0	0	0.0000	CRASH	gen=88 glyphs=4
2026-03-14T07:36:44.209992	099964a4	0	0	0.0000	CRASH	gen=88 glyphs=4
2026-03-14T07:36:44.210183	099964a4	0	0	0.0000	CRASH	gen=88 glyphs=4
2026-03-14T07:36:44.210379	62b49e50	0	0	0.0000	CRASH	gen=88 glyphs=3
2026-03-14T07:36:44.210573	7ede4765	0	0	0.0000	CRASH	gen=88 glyphs=2
2026-03-14T07:36:44.210769	bc6ad311	0	0	0.0000	CRASH	gen=88 glyphs=4
2026-03-14T07:36:44.210964	cf93b656	0	0	0.0000	CRASH	gen=88 glyphs=3
2026-03-14T07:36:44.211241	099964a4	0	0	0.0000	CRASH	gen=89 glyphs=4
2026-03-14T07:36:44.211437	099964a4	0	0	0.0000	CRASH	gen=89 glyphs=4
2026-03-14T07:36:44.211632	cc3bc47a	0	0	0.0000	CRASH	gen=89 glyphs=4
2026-03-14T07:36:44.211825	7e492676	0	0	0.0000	CRASH	gen=89 glyphs=3
2026-03-14T07:36:44.212018	6c26a79f	0	0	0.0000	CRASH	gen=89 glyphs=4
2026-03-14T07:36:44.212212	099964a4	0	0	0.0000	CRASH	gen=89 glyphs=4
2026-03-14T07:36:44.212409	099964a4	0	0	0.0000	CRASH	gen=89 glyphs=4
2026-03-14T07:36:44.212607	099964a4	0	0	0.0000	CRASH	gen=89 glyphs=4
2026-03-14T07:36:44.212803	fca7099e	0	0	0.0000	CRASH	gen=89 glyphs=3
2026-03-14T07:36:44.212996	099964a4	0	0	0.0000	CRASH	gen=89 glyphs=4
2026-03-14T07:36:44.213269	099964a4	0	0	0.0000	CRASH	gen=90 glyphs=4
2026-03-14T07:36:44.213468	099964a4	0	0	0.0000	CRASH	gen=90 glyphs=4
2026-03-14T07:36:44.213665	4b9978da	0	0	0.0000	CRASH	gen=90 glyphs=4
2026-03-14T07:36:44.213859	099964a4	0	0	0.0000	CRASH	gen=90 glyphs=4
2026-03-14T07:36:44.214055	1734cdff	0	0	0.0000	CRASH	gen=90 glyphs=4
2026-03-14T07:36:44.214248	099964a4	0	0	0.0000	CRASH	gen=90 glyphs=4
2026-03-14T07:36:44.214443	c80ae264	0	0	0.0000	CRASH	gen=90 glyphs=4
2026-03-14T07:36:44.214641	8da1f8d8	0	0	0.0000	CRASH	gen=90 glyphs=4
2026-03-14T07:36:44.214839	099964a4	0	0	0.0000	CRASH	gen=90 glyphs=4
2026-03-14T07:36:44.215035	4c8f9fdc	0	0	0.0000	CRASH	gen=90 glyphs=2
2026-03-14T07:36:44.215317	099964a4	0	0	0.0000	CRASH	gen=91 glyphs=4
2026-03-14T07:36:44.215518	099964a4	0	0	0.0000	CRASH	gen=91 glyphs=4
2026-03-14T07:36:44.215718	099964a4	0	0	0.0000	CRASH	gen=91 glyphs=4
2026-03-14T07:36:44.215912	708d8e2a	0	0	0.0000	CRASH	gen=91 glyphs=4
2026-03-14T07:36:44.216105	aa62dad5	0	0	0.0000	CRASH	gen=91 glyphs=3
2026-03-14T07:36:44.216300	215bc3a9	0	0	0.0000	CRASH	gen=91 glyphs=5
2026-03-14T07:36:44.216497	099964a4	0	0	0.0000	CRASH	gen=91 glyphs=4
2026-03-14T07:36:44.216697	099964a4	0	0	0.0000	CRASH	gen=91 glyphs=4
2026-03-14T07:36:44.216892	099964a4	0	0	0.0000	CRASH	gen=91 glyphs=4
2026-03-14T07:36:44.217085	15aa3849	0	0	0.0000	CRASH	gen=91 glyphs=5
2026-03-14T07:36:44.217364	099964a4	0	0	0.0000	CRASH	gen=92 glyphs=4
2026-03-14T07:36:44.217561	099964a4	0	0	0.0000	CRASH	gen=92 glyphs=4
2026-03-14T07:36:44.217759	099964a4	0	0	0.0000	CRASH	gen=92 glyphs=4
2026-03-14T07:36:44.217950	099964a4	0	0	0.0000	CRASH	gen=92 glyphs=4
2026-03-14T07:36:44.218141	099964a4	0	0	0.0000	CRASH	gen=92 glyphs=4
2026-03-14T07:36:44.218331	099964a4	0	0	0.0000	CRASH	gen=92 glyphs=4
2026-03-14T07:36:44.218540	5bd7bf7a	0	0	0.0000	CRASH	gen=92 glyphs=4
2026-03-14T07:36:44.218736	3447a72c	0	0	0.0000	CRASH	gen=92 glyphs=4
2026-03-14T07:36:44.218936	8da1f8d8	0	0	0.0000	CRASH	gen=92 glyphs=4
2026-03-14T07:36:44.219130	099964a4	0	0	0.0000	CRASH	gen=92 glyphs=4
2026-03-14T07:36:44.219409	099964a4	0	0	0.0000	CRASH	gen=93 glyphs=4
2026-03-14T07:36:44.219611	099964a4	0	0	0.0000	CRASH	gen=93 glyphs=4
2026-03-14T07:36:44.219805	099964a4	0	0	0.0000	CRASH	gen=93 glyphs=4
2026-03-14T07:36:44.220000	80cef82b	0	0	0.0000	CRASH	gen=93 glyphs=4
2026-03-14T07:36:44.220197	c53c5747	0	0	0.0000	CRASH	gen=93 glyphs=4
2026-03-14T07:36:44.220390	099964a4	0	0	0.0000	CRASH	gen=93 glyphs=4
2026-03-14T07:36:44.220587	8f0992e1	0	0	0.0000	CRASH	gen=93 glyphs=3
2026-03-14T07:36:44.220781	80cef82b	0	0	0.0000	CRASH	gen=93 glyphs=4
2026-03-14T07:36:44.220980	099964a4	0	0	0.0000	CRASH	gen=93 glyphs=4
2026-03-14T07:36:44.221172	099964a4	0	0	0.0000	CRASH	gen=93 glyphs=4
2026-03-14T07:36:44.221456	099964a4	0	0	0.0000	CRASH	gen=94 glyphs=4
2026-03-14T07:36:44.221657	099964a4	0	0	0.0000	CRASH	gen=94 glyphs=4
2026-03-14T07:36:44.221855	ad21f94c	0	0	0.0000	CRASH	gen=94 glyphs=3
2026-03-14T07:36:44.222054	099964a4	0	0	0.0000	CRASH	gen=94 glyphs=4
2026-03-14T07:36:44.222250	63c502b8	0	0	0.0000	CRASH	gen=94 glyphs=4
2026-03-14T07:36:44.222447	099964a4	0	0	0.0000	CRASH	gen=94 glyphs=4
2026-03-14T07:36:44.222649	7ede4765	0	0	0.0000	CRASH	gen=94 glyphs=2
2026-03-14T07:36:44.222844	696d4db1	0	0	0.0000	CRASH	gen=94 glyphs=4
2026-03-14T07:36:44.223046	099964a4	0	0	0.0000	CRASH	gen=94 glyphs=4
2026-03-14T07:36:44.223241	d9b10d35	0	0	0.0000	CRASH	gen=94 glyphs=3
2026-03-14T07:36:44.223522	099964a4	0	0	0.0000	CRASH	gen=95 glyphs=4
2026-03-14T07:36:44.223716	099964a4	0	0	0.0000	CRASH	gen=95 glyphs=4
2026-03-14T07:36:44.223912	099964a4	0	0	0.0000	CRASH	gen=95 glyphs=4
2026-03-14T07:36:44.224110	099964a4	0	0	0.0000	CRASH	gen=95 glyphs=4
2026-03-14T07:36:44.224304	c164face	0	0	0.0000	CRASH	gen=95 glyphs=3
2026-03-14T07:36:44.224495	760b6b68	0	0	0.0000	CRASH	gen=95 glyphs=5
2026-03-14T07:36:44.224695	8543d82c	0	0	0.0000	CRASH	gen=95 glyphs=4
2026-03-14T07:36:44.224888	099964a4	0	0	0.0000	CRASH	gen=95 glyphs=4
2026-03-14T07:36:44.225081	ff30496a	0	0	0.0000	CRASH	gen=95 glyphs=3
2026-03-14T07:36:44.225278	cf93b656	0	0	0.0000	CRASH	gen=95 glyphs=3
2026-03-14T07:36:44.225556	099964a4	0	0	0.0000	CRASH	gen=96 glyphs=4
2026-03-14T07:36:44.225753	099964a4	0	0	0.0000	CRASH	gen=96 glyphs=4
2026-03-14T07:36:44.225946	099964a4	0	0	0.0000	CRASH	gen=96 glyphs=4
2026-03-14T07:36:44.226138	f8784d90	0	0	0.0000	CRASH	gen=96 glyphs=4
2026-03-14T07:36:44.226336	8ecb019c	0	0	0.0000	CRASH	gen=96 glyphs=4
2026-03-14T07:36:44.226536	099964a4	0	0	0.0000	CRASH	gen=96 glyphs=4
2026-03-14T07:36:44.226729	099964a4	0	0	0.0000	CRASH	gen=96 glyphs=4
2026-03-14T07:36:44.226923	099964a4	0	0	0.0000	CRASH	gen=96 glyphs=4
2026-03-14T07:36:44.227117	9a94e586	0	0	0.0000	CRASH	gen=96 glyphs=4
2026-03-14T07:36:44.227315	cf93b656	0	0	0.0000	CRASH	gen=96 glyphs=3
2026-03-14T07:36:44.227598	099964a4	0	0	0.0000	CRASH	gen=97 glyphs=4
2026-03-14T07:36:44.227796	099964a4	0	0	0.0000	CRASH	gen=97 glyphs=4
2026-03-14T07:36:44.227992	d81016af	0	0	0.0000	CRASH	gen=97 glyphs=4
2026-03-14T07:36:44.228189	ff30496a	0	0	0.0000	CRASH	gen=97 glyphs=3
2026-03-14T07:36:44.228389	9ef882fd	0	0	0.0000	CRASH	gen=97 glyphs=4
2026-03-14T07:36:44.228583	867c830c	0	0	0.0000	CRASH	gen=97 glyphs=4
2026-03-14T07:36:44.228779	099964a4	0	0	0.0000	CRASH	gen=97 glyphs=4
2026-03-14T07:36:44.228969	448410db	0	0	0.0000	CRASH	gen=97 glyphs=4
2026-03-14T07:36:44.229165	3ca14993	0	0	0.0000	CRASH	gen=97 glyphs=4
2026-03-14T07:36:44.229360	f085d3e1	0	0	0.0000	CRASH	gen=97 glyphs=3
2026-03-14T07:36:44.229648	099964a4	0	0	0.0000	CRASH	gen=98 glyphs=4
2026-03-14T07:36:44.229848	099964a4	0	0	0.0000	CRASH	gen=98 glyphs=4
2026-03-14T07:36:44.230044	099964a4	0	0	0.0000	CRASH	gen=98 glyphs=4
2026-03-14T07:36:44.230240	099964a4	0	0	0.0000	CRASH	gen=98 glyphs=4
2026-03-14T07:36:44.230438	eb23ea9c	0	0	0.0000	CRASH	gen=98 glyphs=3
2026-03-14T07:36:44.230641	30503816	0	0	0.0000	CRASH	gen=98 glyphs=3
2026-03-14T07:36:44.230836	099964a4	0	0	0.0000	CRASH	gen=98 glyphs=4
2026-03-14T07:36:44.231030	63815e1b	0	0	0.0000	CRASH	gen=98 glyphs=4
2026-03-14T07:36:44.231224	7ede4765	0	0	0.0000	CRASH	gen=98 glyphs=2
2026-03-14T07:36:44.231416	3a734398	0	0	0.0000	CRASH	gen=98 glyphs=4
2026-03-14T07:36:44.231689	099964a4	0	0	0.0000	CRASH	gen=99 glyphs=4
2026-03-14T07:36:44.231886	099964a4	0	0	0.0000	CRASH	gen=99 glyphs=4
2026-03-14T07:36:44.232084	9282a25c	0	0	0.0000	CRASH	gen=99 glyphs=4
2026-03-14T07:36:44.232276	cf93b656	0	0	0.0000	CRASH	gen=99 glyphs=3
2026-03-14T07:36:44.232468	099964a4	0	0	0.0000	CRASH	gen=99 glyphs=4
2026-03-14T07:36:44.232670	099964a4	0	0	0.0000	CRASH	gen=99 glyphs=4
2026-03-14T07:36:44.232862	80cef82b	0	0	0.0000	CRASH	gen=99 glyphs=4
2026-03-14T07:36:44.233054	099964a4	0	0	0.0000	CRASH	gen=99 glyphs=4
2026-03-14T07:36:44.233249	80cef82b	0	0	0.0000	CRASH	gen=99 glyphs=4
2026-03-14T07:36:44.233442	cf93b656	0	0	0.0000	CRASH	gen=99 glyphs=3
2026-03-14T07:36:44.233726	099964a4	0	0	0.0000	CRASH	gen=100 glyphs=4
2026-03-14T07:36:44.233921	099964a4	0	0	0.0000	CRASH	gen=100 glyphs=4
2026-03-14T07:36:44.234115	7ede4765	0	0	0.0000	CRASH	gen=100 glyphs=2
2026-03-14T07:36:44.234308	0bfd36bc	0	0	0.0000	CRASH	gen=100 glyphs=3
2026-03-14T07:36:44.234502	099964a4	0	0	0.0000	CRASH	gen=100 glyphs=4
2026-03-14T07:36:44.234695	099964a4	0	0	0.0000	CRASH	gen=100 glyphs=4
2026-03-14T07:36:44.234892	099964a4	0	0	0.0000	CRASH	gen=100 glyphs=4
2026-03-14T07:36:44.235083	8da1f8d8	0	0	0.0000	CRASH	gen=100 glyphs=4
2026-03-14T07:36:44.235277	373cf265	0	0	0.0000	CRASH	gen=100 glyphs=3
2026-03-14T07:36:44.235467	ca34d843	0	0	0.0000	CRASH	gen=100 glyphs=4
2026-03-14T07:36:44.235761	099964a4	0	0	0.0000	CRASH	gen=101 glyphs=4
2026-03-14T07:36:44.235960	099964a4	0	0	0.0000	CRASH	gen=101 glyphs=4
2026-03-14T07:36:44.236154	85a6684c	0	0	0.0000	CRASH	gen=101 glyphs=5
2026-03-14T07:36:44.236349	099964a4	0	0	0.0000	CRASH	gen=101 glyphs=4
2026-03-14T07:36:44.236544	099964a4	0	0	0.0000	CRASH	gen=101 glyphs=4
2026-03-14T07:36:44.236739	50d7d6c8	0	0	0.0000	CRASH	gen=101 glyphs=3
2026-03-14T07:36:44.236956	80cef82b	0	0	0.0000	CRASH	gen=101 glyphs=4
2026-03-14T07:36:44.237158	9815ff37	0	0	0.0000	CRASH	gen=101 glyphs=4
2026-03-14T07:36:44.237353	099964a4	0	0	0.0000	CRASH	gen=101 glyphs=4
2026-03-14T07:36:44.237547	099964a4	0	0	0.0000	CRASH	gen=101 glyphs=4
2026-03-14T07:36:44.237828	099964a4	0	0	0.0000	CRASH	gen=102 glyphs=4
2026-03-14T07:36:44.238027	099964a4	0	0	0.0000	CRASH	gen=102 glyphs=4
2026-03-14T07:36:44.238242	8e894d73	0	0	0.0000	CRASH	gen=102 glyphs=4
2026-03-14T07:36:44.238460	099964a4	0	0	0.0000	CRASH	gen=102 glyphs=4
2026-03-14T07:36:44.238680	caf3c97e	0	0	0.0000	CRASH	gen=102 glyphs=4
2026-03-14T07:36:44.238894	09db2d0f	0	0	0.0000	CRASH	gen=102 glyphs=4
2026-03-14T07:36:44.239110	529a9caa	0	0	0.0000	CRASH	gen=102 glyphs=3
2026-03-14T07:36:44.239321	3e18c658	0	0	0.0000	CRASH	gen=102 glyphs=4
2026-03-14T07:36:44.239532	099964a4	0	0	0.0000	CRASH	gen=102 glyphs=4
2026-03-14T07:36:44.239722	099964a4	0	0	0.0000	CRASH	gen=102 glyphs=4
2026-03-14T07:36:44.240009	099964a4	0	0	0.0000	CRASH	gen=103 glyphs=4
2026-03-14T07:36:44.240211	099964a4	0	0	0.0000	CRASH	gen=103 glyphs=4
2026-03-14T07:36:44.240408	099964a4	0	0	0.0000	CRASH	gen=103 glyphs=4
2026-03-14T07:36:44.240602	42fc5831	0	0	0.0000	CRASH	gen=103 glyphs=3
2026-03-14T07:36:44.240796	099964a4	0	0	0.0000	CRASH	gen=103 glyphs=4
2026-03-14T07:36:44.240987	7fddf3f8	0	0	0.0000	CRASH	gen=103 glyphs=3
2026-03-14T07:36:44.241185	3a734398	0	0	0.0000	CRASH	gen=103 glyphs=4
2026-03-14T07:36:44.241402	099964a4	0	0	0.0000	CRASH	gen=103 glyphs=4
2026-03-14T07:36:44.241623	099964a4	0	0	0.0000	CRASH	gen=103 glyphs=4
2026-03-14T07:36:44.241820	d8b2a0b2	0	0	0.0000	CRASH	gen=103 glyphs=4
2026-03-14T07:36:44.242094	099964a4	0	0	0.0000	CRASH	gen=104 glyphs=4
2026-03-14T07:36:44.242291	099964a4	0	0	0.0000	CRASH	gen=104 glyphs=4
2026-03-14T07:36:44.242499	a917db6b	0	0	0.0000	CRASH	gen=104 glyphs=4
2026-03-14T07:36:44.242703	099964a4	0	0	0.0000	CRASH	gen=104 glyphs=4
2026-03-14T07:36:44.242927	099964a4	0	0	0.0000	CRASH	gen=104 glyphs=4
2026-03-14T07:36:44.243127	099964a4	0	0	0.0000	CRASH	gen=104 glyphs=4
2026-03-14T07:36:44.243320	099964a4	0	0	0.0000	CRASH	gen=104 glyphs=4
2026-03-14T07:36:44.243508	4bd1287d	0	0	0.0000	CRASH	gen=104 glyphs=4
2026-03-14T07:36:44.243700	7ede4765	0	0	0.0000	CRASH	gen=104 glyphs=2
2026-03-14T07:36:44.243889	16ba0d00	0	0	0.0000	CRASH	gen=104 glyphs=4
2026-03-14T07:36:44.244158	099964a4	0	0	0.0000	CRASH	gen=105 glyphs=4
2026-03-14T07:36:44.244353	099964a4	0	0	0.0000	CRASH	gen=105 glyphs=4
2026-03-14T07:36:44.244551	7ede4765	0	0	0.0000	CRASH	gen=105 glyphs=2
2026-03-14T07:36:44.244743	cf93b656	0	0	0.0000	CRASH	gen=105 glyphs=3
2026-03-14T07:36:44.244935	7397556c	0	0	0.0000	CRASH	gen=105 glyphs=4
2026-03-14T07:36:44.245129	099964a4	0	0	0.0000	CRASH	gen=105 glyphs=4
2026-03-14T07:36:44.245321	cf93b656	0	0	0.0000	CRASH	gen=105 glyphs=3
2026-03-14T07:36:44.245521	3ca14993	0	0	0.0000	CRASH	gen=105 glyphs=4
2026-03-14T07:36:44.245717	099964a4	0	0	0.0000	CRASH	gen=105 glyphs=4
2026-03-14T07:36:44.245908	3a734398	0	0	0.0000	CRASH	gen=105 glyphs=4
2026-03-14T07:36:44.246173	099964a4	0	0	0.0000	CRASH	gen=106 glyphs=4
2026-03-14T07:36:44.246367	099964a4	0	0	0.0000	CRASH	gen=106 glyphs=4
2026-03-14T07:36:44.246570	dcb1fb50	0	0	0.0000	CRASH	gen=106 glyphs=4
2026-03-14T07:36:44.246761	099964a4	0	0	0.0000	CRASH	gen=106 glyphs=4
2026-03-14T07:36:44.246949	3ca14993	0	0	0.0000	CRASH	gen=106 glyphs=4
2026-03-14T07:36:44.247140	099964a4	0	0	0.0000	CRASH	gen=106 glyphs=4
2026-03-14T07:36:44.247329	9ef48f00	0	0	0.0000	CRASH	gen=106 glyphs=3
2026-03-14T07:36:44.247520	6bd9430f	0	0	0.0000	CRASH	gen=106 glyphs=4
2026-03-14T07:36:44.247715	099964a4	0	0	0.0000	CRASH	gen=106 glyphs=4
