timestamp	program_hash	spirv_size	word_count	fitness	status	description
2026-03-14T00:01:08.627761	b0f51c8a	116	29	1.0000	DISCARD	gen=227 glyphs=4
2026-03-14T00:01:08.905251	050862ad	120	30	1.0000	DISCARD	gen=271 glyphs=4
2026-03-14T00:01:11.354406	4c9b0dd4	120	30	1.0000	DISCARD	gen=227 glyphs=4
2026-03-14T00:01:11.623713	67cb81be	120	30	1.0000	DISCARD	gen=271 glyphs=4
2026-03-14T00:01:14.025121	b2dd16f4	116	29	1.0000	DISCARD	gen=227 glyphs=4
2026-03-14T00:01:14.282377	0eaedb57	116	29	1.0000	DISCARD	gen=271 glyphs=4
2026-03-14T00:01:16.714216	37f4017b	116	29	1.0000	DISCARD	gen=228 glyphs=4
2026-03-14T00:01:16.972090	0eaedb57	116	29	1.0000	DISCARD	gen=271 glyphs=4
2026-03-14T00:01:19.389717	bfdf7cad	120	30	1.0000	DISCARD	gen=228 glyphs=4
2026-03-14T00:01:19.654848	19355583	120	30	1.0000	DISCARD	gen=272 glyphs=4
2026-03-14T00:01:22.060306	55d6c151	120	30	1.0000	DISCARD	gen=228 glyphs=4
2026-03-14T00:01:22.318817	8aef8872	116	29	1.0000	DISCARD	gen=272 glyphs=4
2026-03-14T00:01:24.736396	d11c1062	120	30	1.0000	DISCARD	gen=228 glyphs=4
2026-03-14T00:01:24.998278	8109c163	116	29	1.0000	DISCARD	gen=272 glyphs=4
2026-03-14T00:01:27.439141	37f4017b	116	29	1.0000	DISCARD	gen=228 glyphs=4
2026-03-14T00:01:27.704268	2b459b57	116	29	1.0000	DISCARD	gen=272 glyphs=4
2026-03-14T00:01:30.096209	37f4017b	116	29	1.0000	DISCARD	gen=228 glyphs=4
2026-03-14T00:01:30.366022	875e0f8a	116	29	1.0000	DISCARD	gen=272 glyphs=4
2026-03-14T00:01:32.784712	75a2a972	120	30	1.0000	DISCARD	gen=228 glyphs=4
2026-03-14T00:01:33.055816	1e5f0e21	116	29	1.0000	DISCARD	gen=272 glyphs=4
2026-03-14T00:01:35.471146	2701cb73	116	29	1.0000	DISCARD	gen=228 glyphs=4
2026-03-14T00:01:35.734476	b7aed8e9	116	29	1.0000	DISCARD	gen=272 glyphs=4
2026-03-14T00:01:38.172167	2701cb73	116	29	1.0000	DISCARD	gen=228 glyphs=4
2026-03-14T00:01:38.433479	1e5f0e21	116	29	1.0000	DISCARD	gen=272 glyphs=4
2026-03-14T00:01:40.849631	8b01faaf	116	29	1.0000	DISCARD	gen=228 glyphs=4
2026-03-14T00:01:41.171806	0eaedb57	116	29	1.0000	DISCARD	gen=272 glyphs=4
2026-03-14T00:01:43.647734	37f4017b	116	29	1.0000	DISCARD	gen=229 glyphs=4
2026-03-14T00:01:43.923856	8aef8872	116	29	1.0000	DISCARD	gen=272 glyphs=4
2026-03-14T00:01:46.332047	bfdf7cad	120	30	1.0000	DISCARD	gen=229 glyphs=4
2026-03-14T00:01:46.595742	19355583	120	30	1.0000	DISCARD	gen=273 glyphs=4
2026-03-14T00:01:49.034210	55d6c151	120	30	1.0000	DISCARD	gen=229 glyphs=4
2026-03-14T00:01:49.306667	8aef8872	116	29	1.0000	DISCARD	gen=273 glyphs=4
2026-03-14T00:01:51.750623	37f4017b	116	29	1.0000	DISCARD	gen=229 glyphs=4
2026-03-14T00:01:52.009939	9e34ede0	116	29	1.0000	DISCARD	gen=273 glyphs=4
2026-03-14T00:01:54.433624	37f4017b	116	29	1.0000	DISCARD	gen=229 glyphs=4
2026-03-14T00:01:54.696485	12b0b721	116	29	1.0000	DISCARD	gen=273 glyphs=4
2026-03-14T00:01:57.156907	37f4017b	116	29	1.0000	DISCARD	gen=229 glyphs=4
2026-03-14T00:01:57.435987	9e34ede0	116	29	1.0000	DISCARD	gen=273 glyphs=4
2026-03-14T00:01:59.842278	55d6c151	120	30	1.0000	DISCARD	gen=229 glyphs=4
2026-03-14T00:02:00.108604	19355583	120	30	1.0000	DISCARD	gen=273 glyphs=4
2026-03-14T00:02:02.526568	12b38c2d	116	29	1.0000	DISCARD	gen=229 glyphs=4
2026-03-14T00:02:02.813431	19355583	120	30	1.0000	DISCARD	gen=273 glyphs=4
2026-03-14T00:02:05.219708	37f4017b	116	29	1.0000	DISCARD	gen=229 glyphs=4
2026-03-14T00:02:05.487207	b57e7176	120	30	1.0000	DISCARD	gen=273 glyphs=4
2026-03-14T00:02:07.923980	4c9b0dd4	120	30	1.0000	DISCARD	gen=229 glyphs=4
2026-03-14T00:02:08.197993	b7aed8e9	116	29	1.0000	DISCARD	gen=273 glyphs=4
2026-03-14T00:02:10.600205	37f4017b	116	29	1.0000	DISCARD	gen=230 glyphs=4
2026-03-14T00:02:10.860666	e2cd28ea	120	30	1.0000	DISCARD	gen=273 glyphs=4
2026-03-14T00:02:13.301175	bfdf7cad	120	30	1.0000	DISCARD	gen=230 glyphs=4
2026-03-14T00:02:13.612790	19355583	120	30	1.0000	DISCARD	gen=274 glyphs=4
2026-03-14T00:02:16.034791	2fac31ef	120	30	1.0000	DISCARD	gen=230 glyphs=4
2026-03-14T00:02:16.300160	8aef8872	116	29	1.0000	DISCARD	gen=274 glyphs=4
2026-03-14T00:02:18.762299	5b9807ac	120	30	1.0000	DISCARD	gen=230 glyphs=4
2026-03-14T00:02:19.023214	b57e7176	120	30	1.0000	DISCARD	gen=274 glyphs=4
2026-03-14T00:02:21.471845	c21ccdf8	116	29	1.0000	DISCARD	gen=230 glyphs=4
2026-03-14T00:02:21.737190	8aef8872	116	29	1.0000	DISCARD	gen=274 glyphs=4
2026-03-14T00:02:24.151291	49befb4e	116	29	1.0000	DISCARD	gen=230 glyphs=4
2026-03-14T00:02:24.421451	0c86de76	116	29	1.0000	DISCARD	gen=274 glyphs=4
2026-03-14T00:02:26.823786	37f4017b	116	29	1.0000	DISCARD	gen=230 glyphs=4
2026-03-14T00:02:27.089194	40caf018	116	29	0.9500	DISCARD	gen=274 glyphs=4
2026-03-14T00:02:29.487854	357f5726	116	29	1.0000	DISCARD	gen=230 glyphs=4
2026-03-14T00:02:29.754062	8af7d6a3	116	29	1.0000	DISCARD	gen=274 glyphs=4
2026-03-14T00:02:32.165548	5a06ca32	120	30	1.0000	DISCARD	gen=230 glyphs=4
2026-03-14T00:02:32.422315	c9c7d5bb	116	29	1.0000	DISCARD	gen=274 glyphs=4
2026-03-14T00:02:34.857371	d11c1062	120	30	1.0000	DISCARD	gen=230 glyphs=4
2026-03-14T00:02:35.116710	0eaedb57	116	29	1.0000	DISCARD	gen=274 glyphs=4
2026-03-14T00:02:37.531500	37f4017b	116	29	1.0000	DISCARD	gen=231 glyphs=4
2026-03-14T00:02:37.807113	ee045f8d	116	29	1.0000	DISCARD	gen=274 glyphs=4
2026-03-14T00:02:40.209654	bfdf7cad	120	30	1.0000	DISCARD	gen=231 glyphs=4
2026-03-14T00:02:40.477611	19355583	120	30	1.0000	DISCARD	gen=275 glyphs=4
2026-03-14T00:02:42.941164	434e62ed	120	30	1.0000	DISCARD	gen=231 glyphs=4
2026-03-14T00:02:43.210390	8aef8872	116	29	1.0000	DISCARD	gen=275 glyphs=4
2026-03-14T00:02:45.738910	55d6c151	120	30	1.0000	DISCARD	gen=231 glyphs=4
2026-03-14T00:02:46.000349	875e0f8a	116	29	1.0000	DISCARD	gen=275 glyphs=4
2026-03-14T00:02:48.450809	dca2c7f8	116	29	1.0000	DISCARD	gen=231 glyphs=4
2026-03-14T00:02:48.734945	67cb81be	120	30	1.0000	DISCARD	gen=275 glyphs=4
2026-03-14T00:02:51.242272	fdb5d108	120	30	1.0000	DISCARD	gen=231 glyphs=4
2026-03-14T00:02:51.508661	be7444ea	116	29	1.0000	DISCARD	gen=275 glyphs=4
2026-03-14T00:02:53.976439	5a06ca32	120	30	1.0000	DISCARD	gen=231 glyphs=4
2026-03-14T00:02:54.253468	041acc49	120	30	1.0000	DISCARD	gen=275 glyphs=4
2026-03-14T00:02:56.713470	37f4017b	116	29	1.0000	DISCARD	gen=231 glyphs=4
2026-03-14T00:02:56.990356	a2e62f75	116	29	1.0000	DISCARD	gen=275 glyphs=4
2026-03-14T00:02:59.450942	55d6c151	120	30	1.0000	DISCARD	gen=231 glyphs=4
2026-03-14T00:02:59.724187	19355583	120	30	1.0000	DISCARD	gen=275 glyphs=4
2026-03-14T00:03:02.179236	40e7d4fe	120	30	1.0000	DISCARD	gen=231 glyphs=4
2026-03-14T00:03:02.451398	b7aed8e9	116	29	1.0000	DISCARD	gen=275 glyphs=4
2026-03-14T00:03:04.916586	37f4017b	116	29	1.0000	DISCARD	gen=232 glyphs=4
2026-03-14T00:03:05.181675	050862ad	120	30	1.0000	DISCARD	gen=275 glyphs=4
2026-03-14T00:03:07.573858	bfdf7cad	120	30	1.0000	DISCARD	gen=232 glyphs=4
2026-03-14T00:03:07.848293	19355583	120	30	1.0000	DISCARD	gen=276 glyphs=4
2026-03-14T00:03:10.249057	d11c1062	120	30	1.0000	DISCARD	gen=232 glyphs=4
2026-03-14T00:03:10.521959	8aef8872	116	29	1.0000	DISCARD	gen=276 glyphs=4
2026-03-14T00:03:12.936492	4c9b0dd4	120	30	1.0000	DISCARD	gen=232 glyphs=4
2026-03-14T00:03:13.213380	1e5f0e21	116	29	1.0000	DISCARD	gen=276 glyphs=4
2026-03-14T00:03:15.620857	71e2ba66	116	29	1.0000	DISCARD	gen=232 glyphs=4
2026-03-14T00:03:15.883861	241c4c3e	116	29	1.0000	DISCARD	gen=276 glyphs=4
2026-03-14T00:03:18.339430	bfdf7cad	120	30	1.0000	DISCARD	gen=232 glyphs=4
2026-03-14T00:03:18.604875	b57e7176	120	30	1.0000	DISCARD	gen=276 glyphs=4
2026-03-14T00:03:21.027097	fdb5d108	120	30	1.0000	DISCARD	gen=232 glyphs=4
2026-03-14T00:03:21.287056	8aef8872	116	29	1.0000	DISCARD	gen=276 glyphs=4
2026-03-14T00:03:23.697691	8272ae14	116	29	1.0000	DISCARD	gen=232 glyphs=4
2026-03-14T00:03:23.965040	ca64885b	120	30	1.0000	DISCARD	gen=276 glyphs=4
2026-03-14T00:03:26.384137	bfdf7cad	120	30	1.0000	DISCARD	gen=232 glyphs=4
2026-03-14T00:03:26.647856	eca7ab6c	116	29	1.0000	DISCARD	gen=276 glyphs=4
2026-03-14T00:03:29.073187	4c9b0dd4	120	30	1.0000	DISCARD	gen=232 glyphs=4
2026-03-14T00:03:29.340663	8aef8872	116	29	1.0000	DISCARD	gen=276 glyphs=4
2026-03-14T00:03:31.766162	37f4017b	116	29	1.0000	DISCARD	gen=233 glyphs=4
2026-03-14T00:03:32.037102	1e5f0e21	116	29	1.0000	DISCARD	gen=276 glyphs=4
2026-03-14T00:03:34.431177	bfdf7cad	120	30	1.0000	DISCARD	gen=233 glyphs=4
2026-03-14T00:03:34.696886	19355583	120	30	1.0000	DISCARD	gen=277 glyphs=4
2026-03-14T00:03:37.123346	4e58ec1b	120	30	1.0000	DISCARD	gen=233 glyphs=4
2026-03-14T00:03:37.403267	8aef8872	116	29	1.0000	DISCARD	gen=277 glyphs=4
2026-03-14T00:03:39.809750	d11c1062	120	30	1.0000	DISCARD	gen=233 glyphs=4
2026-03-14T00:03:40.074185	d7c8681b	120	30	1.0000	DISCARD	gen=277 glyphs=4
2026-03-14T00:03:42.468838	37f4017b	116	29	1.0000	DISCARD	gen=233 glyphs=4
2026-03-14T00:03:42.741625	050862ad	120	30	1.0000	DISCARD	gen=277 glyphs=4
2026-03-14T00:03:45.138001	5a06ca32	120	30	1.0000	DISCARD	gen=233 glyphs=4
2026-03-14T00:03:45.404187	6c7627ff	116	29	1.0000	DISCARD	gen=277 glyphs=4
2026-03-14T00:03:47.820393	fdb5d108	120	30	1.0000	DISCARD	gen=233 glyphs=4
2026-03-14T00:03:48.080181	d7c8681b	120	30	1.0000	DISCARD	gen=277 glyphs=4
2026-03-14T00:03:50.624661	71e2ba66	116	29	1.0000	DISCARD	gen=233 glyphs=4
2026-03-14T00:03:50.885786	b951746e	116	29	1.0000	DISCARD	gen=277 glyphs=4
2026-03-14T00:03:53.289210	e58f1463	120	30	1.0000	DISCARD	gen=233 glyphs=4
2026-03-14T00:03:53.549784	67cb81be	120	30	1.0000	DISCARD	gen=277 glyphs=4
2026-03-14T00:03:55.971349	a67e91e8	116	29	1.0000	DISCARD	gen=233 glyphs=4
2026-03-14T00:03:56.241585	2bf63ecb	116	29	1.0000	DISCARD	gen=277 glyphs=4
2026-03-14T00:03:58.639022	37f4017b	116	29	1.0000	DISCARD	gen=234 glyphs=4
2026-03-14T00:03:58.906196	19355583	120	30	1.0000	DISCARD	gen=277 glyphs=4
2026-03-14T00:04:01.329954	bfdf7cad	120	30	1.0000	DISCARD	gen=234 glyphs=4
2026-03-14T00:04:01.598051	19355583	120	30	1.0000	DISCARD	gen=278 glyphs=4
2026-03-14T00:04:04.005025	55d6c151	120	30	1.0000	DISCARD	gen=234 glyphs=4
2026-03-14T00:04:04.268178	8aef8872	116	29	1.0000	DISCARD	gen=278 glyphs=4
2026-03-14T00:04:06.701093	55d6c151	120	30	1.0000	DISCARD	gen=234 glyphs=4
2026-03-14T00:04:06.975620	ae44ace5	116	29	1.0000	DISCARD	gen=278 glyphs=4
2026-03-14T00:04:09.391197	456e7509	120	30	1.0000	DISCARD	gen=234 glyphs=4
2026-03-14T00:04:09.647118	19355583	120	30	1.0000	DISCARD	gen=278 glyphs=4
2026-03-14T00:04:12.107409	7ca87b42	116	29	1.0000	DISCARD	gen=234 glyphs=4
2026-03-14T00:04:12.373679	15df0265	120	30	1.0000	DISCARD	gen=278 glyphs=4
2026-03-14T00:04:14.784748	5a06ca32	120	30	1.0000	DISCARD	gen=234 glyphs=4
2026-03-14T00:04:15.051340	b7aed8e9	116	29	1.0000	DISCARD	gen=278 glyphs=4
2026-03-14T00:04:17.503267	4c9b0dd4	120	30	1.0000	DISCARD	gen=234 glyphs=4
2026-03-14T00:04:17.768601	b57e7176	120	30	1.0000	DISCARD	gen=278 glyphs=4
2026-03-14T00:04:20.160878	bfdf7cad	120	30	1.0000	DISCARD	gen=234 glyphs=4
2026-03-14T00:04:20.478011	875e0f8a	116	29	1.0000	DISCARD	gen=278 glyphs=4
2026-03-14T00:04:22.924014	37f4017b	116	29	1.0000	DISCARD	gen=234 glyphs=4
2026-03-14T00:04:23.186973	8aef8872	116	29	1.0000	DISCARD	gen=278 glyphs=4
2026-03-14T00:04:25.576004	37f4017b	116	29	1.0000	DISCARD	gen=235 glyphs=4
2026-03-14T00:04:25.842948	f4902d6e	116	29	1.0000	DISCARD	gen=278 glyphs=4
2026-03-14T00:04:28.251172	bfdf7cad	120	30	1.0000	DISCARD	gen=235 glyphs=4
2026-03-14T00:04:28.533796	19355583	120	30	1.0000	DISCARD	gen=279 glyphs=4
2026-03-14T00:04:30.983435	4d0fa1ab	116	29	1.0000	DISCARD	gen=235 glyphs=4
2026-03-14T00:04:31.250562	8aef8872	116	29	1.0000	DISCARD	gen=279 glyphs=4
2026-03-14T00:04:33.653834	9289b6da	116	29	1.0000	DISCARD	gen=235 glyphs=4
2026-03-14T00:04:33.931215	050862ad	120	30	1.0000	DISCARD	gen=279 glyphs=4
2026-03-14T00:04:36.370531	37f4017b	116	29	1.0000	DISCARD	gen=235 glyphs=4
2026-03-14T00:04:36.635544	a78f9454	120	30	1.0000	DISCARD	gen=279 glyphs=4
2026-03-14T00:04:39.038360	2701cb73	116	29	1.0000	DISCARD	gen=235 glyphs=4
2026-03-14T00:04:39.307368	45f84f01	116	29	1.0000	DISCARD	gen=279 glyphs=4
2026-03-14T00:04:41.709093	8103d88d	116	29	1.0000	DISCARD	gen=235 glyphs=4
2026-03-14T00:04:41.972364	50dc991d	116	29	1.0000	DISCARD	gen=279 glyphs=4
2026-03-14T00:04:44.435136	fdb5d108	120	30	1.0000	DISCARD	gen=235 glyphs=4
2026-03-14T00:04:44.694687	8aef8872	116	29	1.0000	DISCARD	gen=279 glyphs=4
2026-03-14T00:04:47.128903	bd60edf0	120	30	1.0000	DISCARD	gen=235 glyphs=4
2026-03-14T00:04:47.392075	ae44ace5	116	29	1.0000	DISCARD	gen=279 glyphs=4
2026-03-14T00:04:49.828765	37f4017b	116	29	1.0000	DISCARD	gen=235 glyphs=4
2026-03-14T00:04:50.092126	549be6bb	120	30	1.0000	DISCARD	gen=279 glyphs=4
2026-03-14T00:04:52.542395	37f4017b	116	29	1.0000	DISCARD	gen=236 glyphs=4
2026-03-14T00:04:52.839591	b3d12a20	116	29	1.0000	DISCARD	gen=279 glyphs=4
2026-03-14T00:04:55.266551	bfdf7cad	120	30	1.0000	DISCARD	gen=236 glyphs=4
2026-03-14T00:04:55.526654	19355583	120	30	1.0000	DISCARD	gen=280 glyphs=4
2026-03-14T00:04:57.934746	97ffb7f5	116	29	1.0000	DISCARD	gen=236 glyphs=4
2026-03-14T00:04:58.213926	8aef8872	116	29	1.0000	DISCARD	gen=280 glyphs=4
2026-03-14T00:05:00.817019	37f4017b	116	29	1.0000	DISCARD	gen=236 glyphs=4
2026-03-14T00:05:01.108527	154d17ed	116	29	1.0000	DISCARD	gen=280 glyphs=4
2026-03-14T00:05:03.561221	12b38c2d	116	29	1.0000	DISCARD	gen=236 glyphs=4
2026-03-14T00:05:03.831302	a78f9454	120	30	1.0000	DISCARD	gen=280 glyphs=4
2026-03-14T00:05:06.302806	a1f03535	120	30	1.0000	DISCARD	gen=236 glyphs=4
2026-03-14T00:05:06.572730	d7c8681b	120	30	1.0000	DISCARD	gen=280 glyphs=4
2026-03-14T00:05:09.281706	5b9807ac	120	30	1.0000	DISCARD	gen=236 glyphs=4
2026-03-14T00:05:09.660957	ae44ace5	116	29	1.0000	DISCARD	gen=280 glyphs=4
2026-03-14T00:05:12.814151	5a06ca32	120	30	1.0000	DISCARD	gen=236 glyphs=4
2026-03-14T00:05:13.182936	56471ab6	120	30	1.0000	DISCARD	gen=280 glyphs=4
2026-03-14T00:05:16.052843	5a06ca32	120	30	1.0000	DISCARD	gen=236 glyphs=4
2026-03-14T00:05:16.325052	a78f9454	120	30	1.0000	DISCARD	gen=280 glyphs=4
2026-03-14T00:05:18.738618	2701cb73	116	29	1.0000	DISCARD	gen=236 glyphs=4
2026-03-14T00:05:19.014036	875e0f8a	116	29	1.0000	DISCARD	gen=280 glyphs=4
2026-03-14T00:05:21.622587	37f4017b	116	29	1.0000	DISCARD	gen=237 glyphs=4
2026-03-14T00:05:21.848968	8aef8872	116	29	1.0000	DISCARD	gen=280 glyphs=4
2026-03-14T00:05:24.346562	bfdf7cad	120	30	1.0000	DISCARD	gen=237 glyphs=4
2026-03-14T00:05:24.643523	19355583	120	30	1.0000	DISCARD	gen=281 glyphs=4
2026-03-14T00:05:27.111256	37f4017b	116	29	1.0000	DISCARD	gen=237 glyphs=4
2026-03-14T00:05:27.375574	8aef8872	116	29	1.0000	DISCARD	gen=281 glyphs=4
2026-03-14T00:05:29.810665	bfdf7cad	120	30	1.0000	DISCARD	gen=237 glyphs=4
2026-03-14T00:05:30.089831	0eaedb57	116	29	1.0000	DISCARD	gen=281 glyphs=4
2026-03-14T00:05:32.532545	12b38c2d	116	29	1.0000	DISCARD	gen=237 glyphs=4
2026-03-14T00:05:32.811159	d6e7d1af	116	29	1.0000	DISCARD	gen=281 glyphs=4
2026-03-14T00:05:35.225312	2664fd50	120	30	1.0000	DISCARD	gen=237 glyphs=4
2026-03-14T00:05:35.516562	50dc991d	116	29	1.0000	DISCARD	gen=281 glyphs=4
2026-03-14T00:05:37.949510	6bf754f2	116	29	1.0000	DISCARD	gen=237 glyphs=4
2026-03-14T00:05:38.227530	050862ad	120	30	1.0000	DISCARD	gen=281 glyphs=4
2026-03-14T00:05:40.667479	fdb5d108	120	30	1.0000	DISCARD	gen=237 glyphs=4
2026-03-14T00:05:40.951184	ef54229f	120	30	1.0000	DISCARD	gen=281 glyphs=4
2026-03-14T00:05:43.394991	54e80060	120	30	1.0000	DISCARD	gen=237 glyphs=4
2026-03-14T00:05:43.668710	384fd8c6	120	30	1.0000	DISCARD	gen=281 glyphs=4
2026-03-14T00:05:46.083369	2701cb73	116	29	1.0000	DISCARD	gen=237 glyphs=4
2026-03-14T00:05:46.358123	ad5ed434	116	29	1.0000	DISCARD	gen=281 glyphs=4
2026-03-14T00:05:48.774433	37f4017b	116	29	1.0000	DISCARD	gen=238 glyphs=4
2026-03-14T00:05:49.037065	19355583	120	30	1.0000	DISCARD	gen=281 glyphs=4
2026-03-14T00:05:51.480363	bfdf7cad	120	30	1.0000	DISCARD	gen=238 glyphs=4
2026-03-14T00:05:51.749484	19355583	120	30	1.0000	DISCARD	gen=282 glyphs=4
2026-03-14T00:05:54.177118	7ba6daba	116	29	0.9500	DISCARD	gen=238 glyphs=4
2026-03-14T00:05:54.440769	8aef8872	116	29	1.0000	DISCARD	gen=282 glyphs=4
2026-03-14T00:05:56.960892	37f4017b	116	29	1.0000	DISCARD	gen=238 glyphs=4
2026-03-14T00:05:57.235248	3fffd6db	116	29	1.0000	DISCARD	gen=282 glyphs=4
2026-03-14T00:05:59.652502	37f4017b	116	29	1.0000	DISCARD	gen=238 glyphs=4
2026-03-14T00:05:59.910661	19355583	120	30	1.0000	DISCARD	gen=282 glyphs=4
2026-03-14T00:06:02.350949	5a06ca32	120	30	1.0000	DISCARD	gen=238 glyphs=4
2026-03-14T00:06:02.611022	19355583	120	30	1.0000	DISCARD	gen=282 glyphs=4
2026-03-14T00:06:05.042611	773621d9	120	30	1.0000	DISCARD	gen=238 glyphs=4
2026-03-14T00:06:05.305686	e49d3359	116	29	1.0000	DISCARD	gen=282 glyphs=4
2026-03-14T00:06:07.941311	37f4017b	116	29	1.0000	DISCARD	gen=238 glyphs=4
2026-03-14T00:06:08.216487	33674e7b	116	29	1.0000	DISCARD	gen=282 glyphs=4
2026-03-14T00:06:10.684210	7ca87b42	116	29	1.0000	DISCARD	gen=238 glyphs=4
2026-03-14T00:06:10.950057	19355583	120	30	1.0000	DISCARD	gen=282 glyphs=4
2026-03-14T00:06:13.375913	62eb6632	120	30	1.0000	DISCARD	gen=238 glyphs=4
2026-03-14T00:06:13.643717	b57e7176	120	30	1.0000	DISCARD	gen=282 glyphs=4
2026-03-14T00:06:16.109091	37f4017b	116	29	1.0000	DISCARD	gen=239 glyphs=4
2026-03-14T00:06:16.380168	b7aed8e9	116	29	1.0000	DISCARD	gen=282 glyphs=4
2026-03-14T00:06:18.846103	bfdf7cad	120	30	1.0000	DISCARD	gen=239 glyphs=4
2026-03-14T00:06:19.109442	19355583	120	30	1.0000	DISCARD	gen=283 glyphs=4
2026-03-14T00:06:21.531531	55d6c151	120	30	1.0000	DISCARD	gen=239 glyphs=4
2026-03-14T00:06:21.812918	8aef8872	116	29	1.0000	DISCARD	gen=283 glyphs=4
2026-03-14T00:06:24.250107	37f4017b	116	29	1.0000	DISCARD	gen=239 glyphs=4
2026-03-14T00:06:24.517298	8aef8872	116	29	1.0000	DISCARD	gen=283 glyphs=4
2026-03-14T00:06:26.955432	6302d202	120	30	0.9500	DISCARD	gen=239 glyphs=4
2026-03-14T00:06:27.225572	b57e7176	120	30	1.0000	DISCARD	gen=283 glyphs=4
2026-03-14T00:06:29.752163	37f4017b	116	29	1.0000	DISCARD	gen=239 glyphs=4
2026-03-14T00:06:30.028929	d877fe7c	116	29	1.0000	DISCARD	gen=283 glyphs=4
2026-03-14T00:06:32.430362	5a06ca32	120	30	1.0000	DISCARD	gen=239 glyphs=4
2026-03-14T00:06:32.711986	acd7507e	120	30	1.0000	DISCARD	gen=283 glyphs=4
2026-03-14T00:06:35.159295	55d6c151	120	30	1.0000	DISCARD	gen=239 glyphs=4
2026-03-14T00:06:35.425935	13ec4e1c	116	29	1.0000	DISCARD	gen=283 glyphs=4
2026-03-14T00:06:37.855367	5a06ca32	120	30	1.0000	DISCARD	gen=239 glyphs=4
2026-03-14T00:06:38.126471	0eaedb57	116	29	1.0000	DISCARD	gen=283 glyphs=4
2026-03-14T00:06:40.552265	37f4017b	116	29	1.0000	DISCARD	gen=239 glyphs=4
2026-03-14T00:06:40.820627	8f415543	116	29	1.0000	DISCARD	gen=283 glyphs=4
2026-03-14T00:06:43.262188	37f4017b	116	29	1.0000	DISCARD	gen=240 glyphs=4
2026-03-14T00:06:43.530178	a9c2d46a	116	29	1.0000	DISCARD	gen=283 glyphs=4
2026-03-14T00:06:45.974226	bfdf7cad	120	30	1.0000	DISCARD	gen=240 glyphs=4
2026-03-14T00:06:46.237589	19355583	120	30	1.0000	DISCARD	gen=284 glyphs=4
2026-03-14T00:06:48.677994	7ca87b42	116	29	1.0000	DISCARD	gen=240 glyphs=4
2026-03-14T00:06:48.955992	8aef8872	116	29	1.0000	DISCARD	gen=284 glyphs=4
2026-03-14T00:06:51.384940	37f4017b	116	29	1.0000	DISCARD	gen=240 glyphs=4
2026-03-14T00:06:51.645645	b7aed8e9	116	29	1.0000	DISCARD	gen=284 glyphs=4
2026-03-14T00:06:54.089823	dcd6c3f0	116	29	1.0000	DISCARD	gen=240 glyphs=4
2026-03-14T00:06:54.358963	d54d6f27	116	29	1.0000	DISCARD	gen=284 glyphs=4
2026-03-14T00:06:56.798083	55d6c151	120	30	1.0000	DISCARD	gen=240 glyphs=4
2026-03-14T00:06:57.067364	a78f9454	120	30	1.0000	DISCARD	gen=284 glyphs=4
2026-03-14T00:06:59.544400	cb94cc2d	120	30	1.0000	DISCARD	gen=240 glyphs=4
2026-03-14T00:06:59.857248	8aef8872	116	29	1.0000	DISCARD	gen=284 glyphs=4
2026-03-14T00:07:02.291360	10d7375c	116	29	1.0000	DISCARD	gen=240 glyphs=4
2026-03-14T00:07:02.549996	9d5679df	116	29	1.0000	DISCARD	gen=284 glyphs=4
2026-03-14T00:07:04.968980	fdb5d108	120	30	1.0000	DISCARD	gen=240 glyphs=4
2026-03-14T00:07:05.239029	a13280ea	116	29	1.0000	DISCARD	gen=284 glyphs=4
2026-03-14T00:07:07.666348	e729754b	116	29	0.9500	DISCARD	gen=240 glyphs=4
2026-03-14T00:07:07.925058	a82f2b2a	120	30	1.0000	DISCARD	gen=284 glyphs=4
2026-03-14T00:07:10.338806	37f4017b	116	29	1.0000	DISCARD	gen=241 glyphs=4
2026-03-14T00:07:10.606719	b57e7176	120	30	1.0000	DISCARD	gen=284 glyphs=4
2026-03-14T00:07:13.034866	bfdf7cad	120	30	1.0000	DISCARD	gen=241 glyphs=4
2026-03-14T00:07:13.323230	19355583	120	30	1.0000	DISCARD	gen=285 glyphs=4
2026-03-14T00:07:15.726326	fbabc6c1	120	30	1.0000	DISCARD	gen=241 glyphs=4
2026-03-14T00:07:15.994813	8aef8872	116	29	1.0000	DISCARD	gen=285 glyphs=4
2026-03-14T00:07:18.542990	67a9b5ae	116	29	1.0000	DISCARD	gen=241 glyphs=4
2026-03-14T00:07:18.818045	b4acf16b	116	29	1.0000	DISCARD	gen=285 glyphs=4
2026-03-14T00:07:21.281672	d077d302	120	30	1.0000	DISCARD	gen=241 glyphs=4
2026-03-14T00:07:21.561406	7d4ab17f	116	29	0.9500	DISCARD	gen=285 glyphs=4
2026-03-14T00:07:24.055295	ae360585	116	29	1.0000	DISCARD	gen=241 glyphs=4
2026-03-14T00:07:24.314697	70393f0d	120	30	1.0000	DISCARD	gen=285 glyphs=4
2026-03-14T00:07:26.915569	d11c1062	120	30	1.0000	DISCARD	gen=241 glyphs=4
2026-03-14T00:07:27.286627	e261840f	116	29	1.0000	DISCARD	gen=285 glyphs=4
2026-03-14T00:07:30.178656	5b9807ac	120	30	1.0000	DISCARD	gen=241 glyphs=4
2026-03-14T00:07:30.452680	19355583	120	30	1.0000	DISCARD	gen=285 glyphs=4
2026-03-14T00:07:33.735677	309cd104	116	29	1.0000	DISCARD	gen=241 glyphs=4
2026-03-14T00:07:34.036015	050862ad	120	30	1.0000	DISCARD	gen=285 glyphs=4
2026-03-14T00:07:36.588874	0749b0e3	116	29	1.0000	DISCARD	gen=241 glyphs=4
2026-03-14T00:07:36.856036	685f48d9	116	29	1.0000	DISCARD	gen=285 glyphs=4
2026-03-14T00:07:39.317655	37f4017b	116	29	1.0000	DISCARD	gen=242 glyphs=4
2026-03-14T00:07:39.596185	10876678	120	30	1.0000	DISCARD	gen=285 glyphs=4
2026-03-14T00:07:42.066406	bfdf7cad	120	30	1.0000	DISCARD	gen=242 glyphs=4
2026-03-14T00:07:42.337370	19355583	120	30	1.0000	DISCARD	gen=286 glyphs=4
2026-03-14T00:07:44.941898	5a06ca32	120	30	1.0000	DISCARD	gen=242 glyphs=4
2026-03-14T00:07:45.210589	8aef8872	116	29	1.0000	DISCARD	gen=286 glyphs=4
