timestamp	program_hash	spirv_size	word_count	fitness	status	description
2026-03-14T00:07:47.677992	bfdf7cad	120	30	1.0000	DISCARD	gen=242 glyphs=4
2026-03-14T00:07:47.953711	9b356c03	116	29	1.0000	DISCARD	gen=286 glyphs=4
2026-03-14T00:07:50.382944	059c6795	120	30	1.0000	DISCARD	gen=242 glyphs=4
2026-03-14T00:07:50.661270	0739c7c2	116	29	1.0000	DISCARD	gen=286 glyphs=4
2026-03-14T00:07:53.113607	7ca87b42	116	29	1.0000	DISCARD	gen=242 glyphs=4
2026-03-14T00:07:53.375047	50dc991d	116	29	1.0000	DISCARD	gen=286 glyphs=4
2026-03-14T00:07:55.856702	f94045a5	120	30	1.0000	DISCARD	gen=242 glyphs=4
2026-03-14T00:07:56.128241	e9c3381a	120	30	1.0000	DISCARD	gen=286 glyphs=4
2026-03-14T00:07:58.562134	7ca87b42	116	29	1.0000	DISCARD	gen=242 glyphs=4
2026-03-14T00:07:58.838523	7ed0c842	116	29	1.0000	DISCARD	gen=286 glyphs=4
2026-03-14T00:08:01.256477	37f4017b	116	29	1.0000	DISCARD	gen=242 glyphs=4
2026-03-14T00:08:01.529148	b7aed8e9	116	29	1.0000	DISCARD	gen=286 glyphs=4
2026-03-14T00:08:35.757785	ff5204cb	120	30	1.0000	DISCARD	gen=242 glyphs=4
2026-03-14T00:08:36.084357	8aef8872	116	29	1.0000	DISCARD	gen=286 glyphs=4
2026-03-14T00:08:38.604313	37f4017b	116	29	1.0000	DISCARD	gen=243 glyphs=4
2026-03-14T00:08:38.883279	ae44ace5	116	29	1.0000	DISCARD	gen=286 glyphs=4
2026-03-14T00:08:41.534207	bfdf7cad	120	30	1.0000	DISCARD	gen=243 glyphs=4
2026-03-14T00:08:41.819840	19355583	120	30	1.0000	DISCARD	gen=287 glyphs=4
2026-03-14T00:08:44.326772	7ca87b42	116	29	1.0000	DISCARD	gen=243 glyphs=4
2026-03-14T00:08:44.610154	8aef8872	116	29	1.0000	DISCARD	gen=287 glyphs=4
2026-03-14T00:08:47.062931	4c9b0dd4	120	30	1.0000	DISCARD	gen=243 glyphs=4
2026-03-14T00:08:47.337705	67cb81be	120	30	1.0000	DISCARD	gen=287 glyphs=4
2026-03-14T00:08:50.064537	5a06ca32	120	30	1.0000	DISCARD	gen=243 glyphs=4
2026-03-14T00:08:50.352185	875e0f8a	116	29	1.0000	DISCARD	gen=287 glyphs=4
2026-03-14T00:08:52.848968	2e182fb5	116	29	0.9500	DISCARD	gen=243 glyphs=4
2026-03-14T00:08:53.120172	050862ad	120	30	1.0000	DISCARD	gen=287 glyphs=4
2026-03-14T00:08:55.647729	dd8deccb	116	29	1.0000	DISCARD	gen=243 glyphs=4
2026-03-14T00:08:55.916016	0eecfa3a	120	30	1.0000	DISCARD	gen=287 glyphs=4
2026-03-14T00:08:58.432146	5f2687a4	120	30	1.0000	DISCARD	gen=243 glyphs=4
2026-03-14T00:08:58.724340	025fc535	116	29	1.0000	DISCARD	gen=287 glyphs=4
2026-03-14T00:09:01.329222	5c4618fa	120	30	1.0000	DISCARD	gen=243 glyphs=4
2026-03-14T00:09:01.619073	19355583	120	30	1.0000	DISCARD	gen=287 glyphs=4
2026-03-14T00:09:04.278483	37f4017b	116	29	1.0000	DISCARD	gen=243 glyphs=4
2026-03-14T00:09:04.564431	cf69ba4f	116	29	0.9500	DISCARD	gen=287 glyphs=4
2026-03-14T00:09:07.202241	37f4017b	116	29	1.0000	DISCARD	gen=244 glyphs=4
2026-03-14T00:09:07.501986	67cb81be	120	30	1.0000	DISCARD	gen=287 glyphs=4
2026-03-14T00:09:10.149140	bfdf7cad	120	30	1.0000	DISCARD	gen=244 glyphs=4
2026-03-14T00:09:10.424229	19355583	120	30	1.0000	DISCARD	gen=288 glyphs=4
2026-03-14T00:09:12.897569	d11c1062	120	30	1.0000	DISCARD	gen=244 glyphs=4
2026-03-14T00:09:13.169493	8aef8872	116	29	1.0000	DISCARD	gen=288 glyphs=4
2026-03-14T00:09:15.633262	1d83c3e4	116	29	1.0000	DISCARD	gen=244 glyphs=4
2026-03-14T00:09:15.914437	19355583	120	30	1.0000	DISCARD	gen=288 glyphs=4
2026-03-14T00:09:18.407162	bfdf7cad	120	30	1.0000	DISCARD	gen=244 glyphs=4
2026-03-14T00:09:18.691740	875e0f8a	116	29	1.0000	DISCARD	gen=288 glyphs=4
2026-03-14T00:09:21.180278	55d6c151	120	30	1.0000	DISCARD	gen=244 glyphs=4
2026-03-14T00:09:21.444630	ae44ace5	116	29	1.0000	DISCARD	gen=288 glyphs=4
2026-03-14T00:09:23.908507	338666c1	116	29	1.0000	DISCARD	gen=244 glyphs=4
2026-03-14T00:09:24.184044	bbfcc7dc	116	29	1.0000	DISCARD	gen=288 glyphs=4
2026-03-14T00:09:26.648142	0de82f60	120	30	1.0000	DISCARD	gen=244 glyphs=4
2026-03-14T00:09:26.916683	9b552e77	116	29	1.0000	DISCARD	gen=288 glyphs=4
2026-03-14T00:09:29.377243	2abdf73a	116	29	1.0000	DISCARD	gen=244 glyphs=4
2026-03-14T00:09:29.650166	1e5f0e21	116	29	1.0000	DISCARD	gen=288 glyphs=4
2026-03-14T00:09:32.105988	1b361c58	116	29	1.0000	DISCARD	gen=244 glyphs=4
2026-03-14T00:09:32.387747	cacddd0c	116	29	0.9500	DISCARD	gen=288 glyphs=4
2026-03-14T00:09:34.818964	37f4017b	116	29	1.0000	DISCARD	gen=245 glyphs=4
2026-03-14T00:09:35.099774	ae44ace5	116	29	1.0000	DISCARD	gen=288 glyphs=4
2026-03-14T00:09:37.555578	bfdf7cad	120	30	1.0000	DISCARD	gen=245 glyphs=4
2026-03-14T00:09:37.827594	19355583	120	30	1.0000	DISCARD	gen=289 glyphs=4
2026-03-14T00:09:40.371757	5a06ca32	120	30	1.0000	DISCARD	gen=245 glyphs=4
2026-03-14T00:09:40.651028	8aef8872	116	29	1.0000	DISCARD	gen=289 glyphs=4
2026-03-14T00:09:43.110559	37f4017b	116	29	1.0000	DISCARD	gen=245 glyphs=4
2026-03-14T00:09:43.382064	67cb81be	120	30	1.0000	DISCARD	gen=289 glyphs=4
2026-03-14T00:09:45.834269	37f4017b	116	29	1.0000	DISCARD	gen=245 glyphs=4
2026-03-14T00:09:46.107023	e2cd28ea	120	30	1.0000	DISCARD	gen=289 glyphs=4
2026-03-14T00:09:48.551208	37f4017b	116	29	1.0000	DISCARD	gen=245 glyphs=4
2026-03-14T00:09:48.826723	772619ff	116	29	1.0000	DISCARD	gen=289 glyphs=4
2026-03-14T00:09:51.253276	52793c90	116	29	1.0000	DISCARD	gen=245 glyphs=4
2026-03-14T00:09:51.518433	9e34ede0	116	29	1.0000	DISCARD	gen=289 glyphs=4
2026-03-14T00:09:53.958303	bee83fd4	120	30	1.0000	DISCARD	gen=245 glyphs=4
2026-03-14T00:09:54.226778	ae44ace5	116	29	1.0000	DISCARD	gen=289 glyphs=4
2026-03-14T00:09:56.678049	5a06ca32	120	30	1.0000	DISCARD	gen=245 glyphs=4
2026-03-14T00:09:56.943943	0eaedb57	116	29	1.0000	DISCARD	gen=289 glyphs=4
2026-03-14T00:09:59.389869	2701cb73	116	29	1.0000	DISCARD	gen=245 glyphs=4
2026-03-14T00:09:59.655973	8aef8872	116	29	1.0000	DISCARD	gen=289 glyphs=4
2026-03-14T00:10:02.123935	37f4017b	116	29	1.0000	DISCARD	gen=246 glyphs=4
2026-03-14T00:10:02.397332	19355583	120	30	1.0000	DISCARD	gen=289 glyphs=4
2026-03-14T00:10:04.863114	bfdf7cad	120	30	1.0000	DISCARD	gen=246 glyphs=4
2026-03-14T00:10:05.146266	19355583	120	30	1.0000	DISCARD	gen=290 glyphs=4
2026-03-14T00:10:07.640605	1d34459a	116	29	1.0000	DISCARD	gen=246 glyphs=4
2026-03-14T00:10:07.910395	8aef8872	116	29	1.0000	DISCARD	gen=290 glyphs=4
2026-03-14T00:10:10.381797	5a06ca32	120	30	1.0000	DISCARD	gen=246 glyphs=4
2026-03-14T00:10:10.659633	296fd804	116	29	1.0000	DISCARD	gen=290 glyphs=4
2026-03-14T00:10:13.216555	3cb8d66b	116	29	1.0000	DISCARD	gen=246 glyphs=4
2026-03-14T00:10:13.480067	50dc991d	116	29	1.0000	DISCARD	gen=290 glyphs=4
2026-03-14T00:10:15.956298	83a77c37	116	29	1.0000	DISCARD	gen=246 glyphs=4
2026-03-14T00:10:16.222087	9e34ede0	116	29	1.0000	DISCARD	gen=290 glyphs=4
2026-03-14T00:10:18.701490	5b9807ac	120	30	1.0000	DISCARD	gen=246 glyphs=4
2026-03-14T00:10:18.976932	0eaedb57	116	29	1.0000	DISCARD	gen=290 glyphs=4
2026-03-14T00:10:21.445043	71e2ba66	116	29	1.0000	DISCARD	gen=246 glyphs=4
2026-03-14T00:10:21.726073	d7c8681b	120	30	1.0000	DISCARD	gen=290 glyphs=4
2026-03-14T00:10:24.196514	7ca87b42	116	29	1.0000	DISCARD	gen=246 glyphs=4
2026-03-14T00:10:24.470458	050862ad	120	30	1.0000	DISCARD	gen=290 glyphs=4
2026-03-14T00:10:26.958313	55d6c151	120	30	1.0000	DISCARD	gen=246 glyphs=4
2026-03-14T00:10:27.233716	e8c7f6cf	120	30	1.0000	DISCARD	gen=290 glyphs=4
2026-03-14T00:10:29.695145	37f4017b	116	29	1.0000	DISCARD	gen=247 glyphs=4
2026-03-14T00:10:29.963166	ae44ace5	116	29	1.0000	DISCARD	gen=290 glyphs=4
2026-03-14T00:10:32.452655	bfdf7cad	120	30	1.0000	DISCARD	gen=247 glyphs=4
2026-03-14T00:10:32.734020	19355583	120	30	1.0000	DISCARD	gen=291 glyphs=4
2026-03-14T00:10:35.209944	8f982104	116	29	1.0000	DISCARD	gen=247 glyphs=4
2026-03-14T00:10:35.484975	8aef8872	116	29	1.0000	DISCARD	gen=291 glyphs=4
2026-03-14T00:10:37.996500	8862548d	116	29	1.0000	DISCARD	gen=247 glyphs=4
2026-03-14T00:10:38.260606	5f260b0c	116	29	1.0000	DISCARD	gen=291 glyphs=4
2026-03-14T00:10:40.724059	fdb5d108	120	30	1.0000	DISCARD	gen=247 glyphs=4
2026-03-14T00:10:40.998466	b7aed8e9	116	29	1.0000	DISCARD	gen=291 glyphs=4
2026-03-14T00:10:43.529975	b39af3c5	120	30	0.9500	DISCARD	gen=247 glyphs=4
2026-03-14T00:10:43.805384	050862ad	120	30	1.0000	DISCARD	gen=291 glyphs=4
2026-03-14T00:10:46.293490	fdb5d108	120	30	1.0000	DISCARD	gen=247 glyphs=4
2026-03-14T00:10:46.567344	a3a59796	116	29	1.0000	DISCARD	gen=291 glyphs=4
2026-03-14T00:10:49.033347	1d34459a	116	29	1.0000	DISCARD	gen=247 glyphs=4
2026-03-14T00:10:49.308694	eca7ab6c	116	29	1.0000	DISCARD	gen=291 glyphs=4
2026-03-14T00:10:51.773985	55d6c151	120	30	1.0000	DISCARD	gen=247 glyphs=4
2026-03-14T00:10:52.056798	b57e7176	120	30	1.0000	DISCARD	gen=291 glyphs=4
2026-03-14T00:10:54.551242	5a06ca32	120	30	1.0000	DISCARD	gen=247 glyphs=4
2026-03-14T00:10:54.818379	8aef8872	116	29	1.0000	DISCARD	gen=291 glyphs=4
2026-03-14T00:10:57.288125	37f4017b	116	29	1.0000	DISCARD	gen=248 glyphs=4
2026-03-14T00:10:57.575126	d7c8681b	120	30	1.0000	DISCARD	gen=291 glyphs=4
2026-03-14T00:11:00.045827	bfdf7cad	120	30	1.0000	DISCARD	gen=248 glyphs=4
2026-03-14T00:11:00.315587	19355583	120	30	1.0000	DISCARD	gen=292 glyphs=4
2026-03-14T00:11:02.801994	bfdf7cad	120	30	1.0000	DISCARD	gen=248 glyphs=4
2026-03-14T00:11:03.077163	8aef8872	116	29	1.0000	DISCARD	gen=292 glyphs=4
2026-03-14T00:11:05.582747	9d0b51b8	116	29	1.0000	DISCARD	gen=248 glyphs=4
2026-03-14T00:11:05.849050	0eaedb57	116	29	1.0000	DISCARD	gen=292 glyphs=4
2026-03-14T00:11:08.314113	5c22b45b	120	30	1.0000	DISCARD	gen=248 glyphs=4
2026-03-14T00:11:08.589712	19355583	120	30	1.0000	DISCARD	gen=292 glyphs=4
2026-03-14T00:11:11.053295	37f4017b	116	29	1.0000	DISCARD	gen=248 glyphs=4
2026-03-14T00:11:11.327275	19355583	120	30	1.0000	DISCARD	gen=292 glyphs=4
2026-03-14T00:11:13.778442	0e5bbda8	116	29	1.0000	DISCARD	gen=248 glyphs=4
2026-03-14T00:11:14.044337	19e46a78	116	29	1.0000	DISCARD	gen=292 glyphs=4
2026-03-14T00:11:16.636448	55d6c151	120	30	1.0000	DISCARD	gen=248 glyphs=4
2026-03-14T00:11:16.904503	c434a029	116	29	1.0000	DISCARD	gen=292 glyphs=4
2026-03-14T00:11:19.359933	5a06ca32	120	30	1.0000	DISCARD	gen=248 glyphs=4
2026-03-14T00:11:19.652141	c53ea9f1	116	29	1.0000	DISCARD	gen=292 glyphs=4
2026-03-14T00:11:22.088269	37f4017b	116	29	1.0000	DISCARD	gen=248 glyphs=4
2026-03-14T00:11:22.355680	486ed9be	120	30	1.0000	DISCARD	gen=292 glyphs=4
2026-03-14T00:11:24.793962	37f4017b	116	29	1.0000	DISCARD	gen=249 glyphs=4
2026-03-14T00:11:25.069917	a78f9454	120	30	1.0000	DISCARD	gen=292 glyphs=4
2026-03-14T00:11:27.509072	bfdf7cad	120	30	1.0000	DISCARD	gen=249 glyphs=4
2026-03-14T00:11:27.776953	19355583	120	30	1.0000	DISCARD	gen=293 glyphs=4
2026-03-14T00:11:30.220514	063935f0	120	30	1.0000	DISCARD	gen=249 glyphs=4
2026-03-14T00:11:30.486369	8aef8872	116	29	1.0000	DISCARD	gen=293 glyphs=4
2026-03-14T00:11:32.932318	71e2ba66	116	29	1.0000	DISCARD	gen=249 glyphs=4
2026-03-14T00:11:33.217015	0eaedb57	116	29	1.0000	DISCARD	gen=293 glyphs=4
2026-03-14T00:11:35.658010	be016050	120	30	1.0000	DISCARD	gen=249 glyphs=4
2026-03-14T00:11:35.929435	ee828060	116	29	1.0000	DISCARD	gen=293 glyphs=4
2026-03-14T00:11:38.362823	5a06ca32	120	30	1.0000	DISCARD	gen=249 glyphs=4
2026-03-14T00:11:38.643405	1e5f0e21	116	29	1.0000	DISCARD	gen=293 glyphs=4
2026-03-14T00:11:41.109439	37f4017b	116	29	1.0000	DISCARD	gen=249 glyphs=4
2026-03-14T00:11:41.377305	1e5f0e21	116	29	1.0000	DISCARD	gen=293 glyphs=4
2026-03-14T00:11:43.848614	7ca87b42	116	29	1.0000	DISCARD	gen=249 glyphs=4
2026-03-14T00:11:44.133477	9e34ede0	116	29	1.0000	DISCARD	gen=293 glyphs=4
2026-03-14T00:11:46.622022	d11c1062	120	30	1.0000	DISCARD	gen=249 glyphs=4
2026-03-14T00:11:46.897243	3e827561	120	30	1.0000	DISCARD	gen=293 glyphs=4
2026-03-14T00:11:49.370624	55d6c151	120	30	1.0000	DISCARD	gen=249 glyphs=4
2026-03-14T00:11:49.647116	be6ea8c0	120	30	1.0000	DISCARD	gen=293 glyphs=4
2026-03-14T00:11:52.112128	37f4017b	116	29	1.0000	DISCARD	gen=250 glyphs=4
2026-03-14T00:11:52.389005	e8c7f6cf	120	30	1.0000	DISCARD	gen=293 glyphs=4
2026-03-14T00:11:54.841804	bfdf7cad	120	30	1.0000	DISCARD	gen=250 glyphs=4
2026-03-14T00:11:55.110095	19355583	120	30	1.0000	DISCARD	gen=294 glyphs=4
2026-03-14T00:11:57.556086	285911a0	116	29	1.0000	DISCARD	gen=250 glyphs=4
2026-03-14T00:11:57.832674	8aef8872	116	29	1.0000	DISCARD	gen=294 glyphs=4
2026-03-14T00:12:00.294136	5b9807ac	120	30	1.0000	DISCARD	gen=250 glyphs=4
2026-03-14T00:12:00.561880	d7c8681b	120	30	1.0000	DISCARD	gen=294 glyphs=4
2026-03-14T00:12:03.029554	55d6c151	120	30	1.0000	DISCARD	gen=250 glyphs=4
2026-03-14T00:12:03.307724	ae3dd21f	116	29	1.0000	DISCARD	gen=294 glyphs=4
2026-03-14T00:12:05.756091	37f4017b	116	29	1.0000	DISCARD	gen=250 glyphs=4
2026-03-14T00:12:06.026994	050862ad	120	30	1.0000	DISCARD	gen=294 glyphs=4
2026-03-14T00:12:08.487170	ada61335	120	30	1.0000	DISCARD	gen=250 glyphs=4
2026-03-14T00:12:08.761766	b7aed8e9	116	29	1.0000	DISCARD	gen=294 glyphs=4
2026-03-14T00:12:11.228596	5a06ca32	120	30	1.0000	DISCARD	gen=250 glyphs=4
2026-03-14T00:12:11.499306	e2cd28ea	120	30	1.0000	DISCARD	gen=294 glyphs=4
2026-03-14T00:12:13.971640	5a06ca32	120	30	1.0000	DISCARD	gen=250 glyphs=4
2026-03-14T00:12:14.235748	165c757b	116	29	1.0000	DISCARD	gen=294 glyphs=4
2026-03-14T00:12:16.715498	5a06ca32	120	30	1.0000	DISCARD	gen=250 glyphs=4
2026-03-14T00:12:17.001479	8aef8872	116	29	1.0000	DISCARD	gen=294 glyphs=4
2026-03-14T00:12:19.478453	37f4017b	116	29	1.0000	DISCARD	gen=251 glyphs=4
2026-03-14T00:12:19.742053	83816eb5	116	29	1.0000	DISCARD	gen=294 glyphs=4
2026-03-14T00:12:22.216419	bfdf7cad	120	30	1.0000	DISCARD	gen=251 glyphs=4
2026-03-14T00:12:22.498817	19355583	120	30	1.0000	DISCARD	gen=295 glyphs=4
2026-03-14T00:12:24.950995	37f4017b	116	29	1.0000	DISCARD	gen=251 glyphs=4
2026-03-14T00:12:25.236013	8aef8872	116	29	1.0000	DISCARD	gen=295 glyphs=4
2026-03-14T00:12:27.700221	139a832e	120	30	1.0000	DISCARD	gen=251 glyphs=4
2026-03-14T00:12:27.984396	581a9aca	116	29	1.0000	DISCARD	gen=295 glyphs=4
2026-03-14T00:12:30.418231	16b38ed6	116	29	1.0000	DISCARD	gen=251 glyphs=4
2026-03-14T00:12:30.691884	8aef8872	116	29	1.0000	DISCARD	gen=295 glyphs=4
2026-03-14T00:12:33.145183	1d34459a	116	29	1.0000	DISCARD	gen=251 glyphs=4
2026-03-14T00:12:33.418344	5e3343ce	116	29	1.0000	DISCARD	gen=295 glyphs=4
2026-03-14T00:12:35.886080	1d34459a	116	29	1.0000	DISCARD	gen=251 glyphs=4
2026-03-14T00:12:36.155851	dd42c4c7	116	29	1.0000	DISCARD	gen=295 glyphs=4
2026-03-14T00:12:38.618567	1d34459a	116	29	1.0000	DISCARD	gen=251 glyphs=4
2026-03-14T00:12:38.885992	67cb81be	120	30	1.0000	DISCARD	gen=295 glyphs=4
2026-03-14T00:12:41.337336	66d81825	116	29	1.0000	DISCARD	gen=251 glyphs=4
2026-03-14T00:12:41.606960	8aef8872	116	29	1.0000	DISCARD	gen=295 glyphs=4
2026-03-14T00:12:44.078963	71e2ba66	116	29	1.0000	DISCARD	gen=251 glyphs=4
2026-03-14T00:12:44.357677	b7aed8e9	116	29	1.0000	DISCARD	gen=295 glyphs=4
2026-03-14T00:12:46.830410	37f4017b	116	29	1.0000	DISCARD	gen=252 glyphs=4
2026-03-14T00:12:47.094968	1e5f0e21	116	29	1.0000	DISCARD	gen=295 glyphs=4
2026-03-14T00:12:49.544293	bfdf7cad	120	30	1.0000	DISCARD	gen=252 glyphs=4
2026-03-14T00:12:49.805846	19355583	120	30	1.0000	DISCARD	gen=296 glyphs=4
2026-03-14T00:12:52.366905	7ca87b42	116	29	1.0000	DISCARD	gen=252 glyphs=4
2026-03-14T00:12:52.630287	8aef8872	116	29	1.0000	DISCARD	gen=296 glyphs=4
2026-03-14T00:12:55.097452	bfdf7cad	120	30	1.0000	DISCARD	gen=252 glyphs=4
2026-03-14T00:12:55.361972	67cb81be	120	30	1.0000	DISCARD	gen=296 glyphs=4
2026-03-14T00:12:57.824185	37f4017b	116	29	1.0000	DISCARD	gen=252 glyphs=4
2026-03-14T00:12:58.091870	050862ad	120	30	1.0000	DISCARD	gen=296 glyphs=4
2026-03-14T00:13:00.540466	fdb5d108	120	30	1.0000	DISCARD	gen=252 glyphs=4
2026-03-14T00:13:00.811061	21d74099	116	29	1.0000	DISCARD	gen=296 glyphs=4
2026-03-14T00:13:03.326548	fdb5d108	120	30	1.0000	DISCARD	gen=252 glyphs=4
2026-03-14T00:13:03.599388	875e0f8a	116	29	1.0000	DISCARD	gen=296 glyphs=4
2026-03-14T00:13:06.037795	7ca87b42	116	29	1.0000	DISCARD	gen=252 glyphs=4
2026-03-14T00:13:06.323858	eb6f38b3	116	29	1.0000	DISCARD	gen=296 glyphs=4
2026-03-14T00:13:08.790702	5a06ca32	120	30	1.0000	DISCARD	gen=252 glyphs=4
2026-03-14T00:13:09.076930	050862ad	120	30	1.0000	DISCARD	gen=296 glyphs=4
2026-03-14T00:13:11.555792	ea3d1bdd	120	30	1.0000	DISCARD	gen=252 glyphs=4
2026-03-14T00:13:11.822781	0eaedb57	116	29	1.0000	DISCARD	gen=296 glyphs=4
2026-03-14T00:13:14.330666	37f4017b	116	29	1.0000	DISCARD	gen=253 glyphs=4
2026-03-14T00:13:14.604794	8aef8872	116	29	1.0000	DISCARD	gen=296 glyphs=4
2026-03-14T00:13:17.045770	bfdf7cad	120	30	1.0000	DISCARD	gen=253 glyphs=4
2026-03-14T00:13:17.323084	19355583	120	30	1.0000	DISCARD	gen=297 glyphs=4
2026-03-14T00:13:19.768281	71e2ba66	116	29	1.0000	DISCARD	gen=253 glyphs=4
2026-03-14T00:13:20.044568	8aef8872	116	29	1.0000	DISCARD	gen=297 glyphs=4
2026-03-14T00:13:22.574187	55d6c151	120	30	1.0000	DISCARD	gen=253 glyphs=4
2026-03-14T00:13:22.841141	b7aed8e9	116	29	1.0000	DISCARD	gen=297 glyphs=4
2026-03-14T00:13:25.313994	67510d1f	116	29	1.0000	DISCARD	gen=253 glyphs=4
2026-03-14T00:13:25.578645	e8c7f6cf	120	30	1.0000	DISCARD	gen=297 glyphs=4
2026-03-14T00:13:28.025120	dc0f0fe7	120	30	1.0000	DISCARD	gen=253 glyphs=4
2026-03-14T00:13:28.291729	d7c8681b	120	30	1.0000	DISCARD	gen=297 glyphs=4
2026-03-14T00:13:30.755390	55d6c151	120	30	1.0000	DISCARD	gen=253 glyphs=4
2026-03-14T00:13:31.021059	ae44ace5	116	29	1.0000	DISCARD	gen=297 glyphs=4
2026-03-14T00:13:33.467944	0cd22303	120	30	1.0000	DISCARD	gen=253 glyphs=4
2026-03-14T00:13:33.740656	0eaedb57	116	29	1.0000	DISCARD	gen=297 glyphs=4
2026-03-14T00:13:36.188860	5b9807ac	120	30	1.0000	DISCARD	gen=253 glyphs=4
2026-03-14T00:13:36.457926	8aef8872	116	29	1.0000	DISCARD	gen=297 glyphs=4
2026-03-14T00:13:38.930114	5a06ca32	120	30	1.0000	DISCARD	gen=253 glyphs=4
2026-03-14T00:13:39.217983	8aef8872	116	29	1.0000	DISCARD	gen=297 glyphs=4
2026-03-14T00:13:41.666894	37f4017b	116	29	1.0000	DISCARD	gen=254 glyphs=4
2026-03-14T00:13:41.941773	0eaedb57	116	29	1.0000	DISCARD	gen=297 glyphs=4
2026-03-14T00:13:44.425015	bfdf7cad	120	30	1.0000	DISCARD	gen=254 glyphs=4
2026-03-14T00:13:44.695135	19355583	120	30	1.0000	DISCARD	gen=298 glyphs=4
2026-03-14T00:13:47.148949	37f4017b	116	29	1.0000	DISCARD	gen=254 glyphs=4
2026-03-14T00:13:47.418480	8aef8872	116	29	1.0000	DISCARD	gen=298 glyphs=4
2026-03-14T00:13:49.894938	37f4017b	116	29	1.0000	DISCARD	gen=254 glyphs=4
2026-03-14T00:13:50.175931	b7aed8e9	116	29	1.0000	DISCARD	gen=298 glyphs=4
2026-03-14T00:13:52.625046	37f4017b	116	29	1.0000	DISCARD	gen=254 glyphs=4
2026-03-14T00:13:52.907806	1e5f0e21	116	29	1.0000	DISCARD	gen=298 glyphs=4
2026-03-14T00:13:55.421478	5a06ca32	120	30	1.0000	DISCARD	gen=254 glyphs=4
2026-03-14T00:13:55.689317	b7aed8e9	116	29	1.0000	DISCARD	gen=298 glyphs=4
2026-03-14T00:13:58.164250	d11c1062	120	30	1.0000	DISCARD	gen=254 glyphs=4
2026-03-14T00:13:58.426934	050862ad	120	30	1.0000	DISCARD	gen=298 glyphs=4
2026-03-14T00:14:00.879432	bfdf7cad	120	30	1.0000	DISCARD	gen=254 glyphs=4
2026-03-14T00:14:01.163290	050862ad	120	30	1.0000	DISCARD	gen=298 glyphs=4
2026-03-14T00:14:03.623764	5a06ca32	120	30	1.0000	DISCARD	gen=254 glyphs=4
2026-03-14T00:14:03.894645	8aef8872	116	29	1.0000	DISCARD	gen=298 glyphs=4
2026-03-14T00:14:06.361392	37f4017b	116	29	1.0000	DISCARD	gen=254 glyphs=4
2026-03-14T00:14:06.622925	e2cd28ea	120	30	1.0000	DISCARD	gen=298 glyphs=4
2026-03-14T00:14:09.126670	37f4017b	116	29	1.0000	DISCARD	gen=255 glyphs=4
2026-03-14T00:14:09.397208	13272e6b	120	30	1.0000	DISCARD	gen=298 glyphs=4
2026-03-14T00:14:11.864589	bfdf7cad	120	30	1.0000	DISCARD	gen=255 glyphs=4
2026-03-14T00:14:12.142142	19355583	120	30	1.0000	DISCARD	gen=299 glyphs=4
2026-03-14T00:14:14.594623	f42ebdcc	116	29	1.0000	DISCARD	gen=255 glyphs=4
2026-03-14T00:14:14.866286	8aef8872	116	29	1.0000	DISCARD	gen=299 glyphs=4
2026-03-14T00:14:17.339622	e2ec6126	116	29	1.0000	DISCARD	gen=255 glyphs=4
2026-03-14T00:14:17.622588	19355583	120	30	1.0000	DISCARD	gen=299 glyphs=4
2026-03-14T00:14:20.076677	bfdf7cad	120	30	1.0000	DISCARD	gen=255 glyphs=4
2026-03-14T00:14:20.361114	eca7ab6c	116	29	1.0000	DISCARD	gen=299 glyphs=4
2026-03-14T00:14:22.848883	55d6c151	120	30	1.0000	DISCARD	gen=255 glyphs=4
2026-03-14T00:14:23.119480	ae44ace5	116	29	1.0000	DISCARD	gen=299 glyphs=4
2026-03-14T00:14:25.611269	37f4017b	116	29	1.0000	DISCARD	gen=255 glyphs=4
2026-03-14T00:14:25.893236	050862ad	120	30	1.0000	DISCARD	gen=299 glyphs=4
2026-03-14T00:14:28.326526	37f4017b	116	29	1.0000	DISCARD	gen=255 glyphs=4
2026-03-14T00:14:28.602594	8aef8872	116	29	1.0000	DISCARD	gen=299 glyphs=4
2026-03-14T00:14:31.059971	2c903d2a	116	29	1.0000	DISCARD	gen=255 glyphs=4
2026-03-14T00:14:31.351717	85030f0b	116	29	1.0000	DISCARD	gen=299 glyphs=4
2026-03-14T00:14:33.816127	5a06ca32	120	30	1.0000	DISCARD	gen=255 glyphs=4
2026-03-14T00:14:34.102075	9e34ede0	116	29	1.0000	DISCARD	gen=299 glyphs=4
2026-03-14T00:14:36.552514	37f4017b	116	29	1.0000	DISCARD	gen=256 glyphs=4
2026-03-14T00:14:36.834487	a78f9454	120	30	1.0000	DISCARD	gen=299 glyphs=4
2026-03-14T00:14:39.277045	bfdf7cad	120	30	1.0000	DISCARD	gen=256 glyphs=4
2026-03-14T00:14:39.543381	19355583	120	30	1.0000	DISCARD	gen=300 glyphs=4
2026-03-14T00:14:41.997971	4c9b0dd4	120	30	1.0000	DISCARD	gen=256 glyphs=4
2026-03-14T00:14:42.270849	8aef8872	116	29	1.0000	DISCARD	gen=300 glyphs=4
2026-03-14T00:14:44.715757	55d6c151	120	30	1.0000	DISCARD	gen=256 glyphs=4
2026-03-14T00:14:44.987431	050862ad	120	30	1.0000	DISCARD	gen=300 glyphs=4
2026-03-14T00:14:47.451874	6e87734b	116	29	0.9500	DISCARD	gen=256 glyphs=4
2026-03-14T00:14:47.724036	b7aed8e9	116	29	1.0000	DISCARD	gen=300 glyphs=4
2026-03-14T00:14:50.174539	37f4017b	116	29	1.0000	DISCARD	gen=256 glyphs=4
2026-03-14T00:14:50.446265	d3effe23	116	29	1.0000	DISCARD	gen=300 glyphs=4
2026-03-14T00:14:52.914366	d11c1062	120	30	1.0000	DISCARD	gen=256 glyphs=4
2026-03-14T00:14:53.185687	d7c8681b	120	30	1.0000	DISCARD	gen=300 glyphs=4
2026-03-14T00:14:55.657768	1d34459a	116	29	1.0000	DISCARD	gen=256 glyphs=4
2026-03-14T00:14:55.923885	eca7ab6c	116	29	1.0000	DISCARD	gen=300 glyphs=4
2026-03-14T00:14:58.426831	f598ebc3	116	29	1.0000	DISCARD	gen=256 glyphs=4
2026-03-14T00:14:58.709716	8aef8872	116	29	1.0000	DISCARD	gen=300 glyphs=4
