timestamp	program_hash	spirv_size	word_count	fitness	status	description
2026-03-13T23:47:56.066072	fdb5d108	120	30	1.0000	DISCARD	gen=198 glyphs=4
2026-03-13T23:47:56.327673	19355583	120	30	1.0000	DISCARD	gen=242 glyphs=4
2026-03-13T23:47:58.772620	37f4017b	116	29	1.0000	DISCARD	gen=198 glyphs=4
2026-03-13T23:47:59.041662	19355583	120	30	1.0000	DISCARD	gen=242 glyphs=4
2026-03-13T23:48:01.462597	ecfb8b24	116	29	0.9500	DISCARD	gen=198 glyphs=4
2026-03-13T23:48:01.738205	92f25793	116	29	0.9500	DISCARD	gen=242 glyphs=4
2026-03-13T23:48:04.159157	aab29aee	120	30	1.0000	DISCARD	gen=198 glyphs=4
2026-03-13T23:48:04.420042	19355583	120	30	1.0000	DISCARD	gen=242 glyphs=4
2026-03-13T23:48:06.861122	12b38c2d	116	29	1.0000	DISCARD	gen=198 glyphs=4
2026-03-13T23:48:07.121782	19355583	120	30	1.0000	DISCARD	gen=242 glyphs=4
2026-03-13T23:48:09.564122	37f4017b	116	29	1.0000	DISCARD	gen=199 glyphs=4
2026-03-13T23:48:09.832124	8aef8872	116	29	1.0000	DISCARD	gen=242 glyphs=4
2026-03-13T23:48:12.288960	bfdf7cad	120	30	1.0000	DISCARD	gen=199 glyphs=4
2026-03-13T23:48:12.562370	19355583	120	30	1.0000	DISCARD	gen=243 glyphs=4
2026-03-13T23:48:15.037319	5a06ca32	120	30	1.0000	DISCARD	gen=199 glyphs=4
2026-03-13T23:48:15.305848	8aef8872	116	29	1.0000	DISCARD	gen=243 glyphs=4
2026-03-13T23:48:17.765856	55d6c151	120	30	1.0000	DISCARD	gen=199 glyphs=4
2026-03-13T23:48:18.035169	3105b2cf	116	29	1.0000	DISCARD	gen=243 glyphs=4
2026-03-13T23:48:20.455883	fdb5d108	120	30	1.0000	DISCARD	gen=199 glyphs=4
2026-03-13T23:48:20.728253	8aef8872	116	29	1.0000	DISCARD	gen=243 glyphs=4
2026-03-13T23:48:23.129815	2701cb73	116	29	1.0000	DISCARD	gen=199 glyphs=4
2026-03-13T23:48:23.395249	19355583	120	30	1.0000	DISCARD	gen=243 glyphs=4
2026-03-13T23:48:25.796235	37f4017b	116	29	1.0000	DISCARD	gen=199 glyphs=4
2026-03-13T23:48:26.071904	340c7d7c	120	30	1.0000	DISCARD	gen=243 glyphs=4
2026-03-13T23:48:28.601850	37f4017b	116	29	1.0000	DISCARD	gen=199 glyphs=4
2026-03-13T23:48:28.874045	d7302202	116	29	1.0000	DISCARD	gen=243 glyphs=4
2026-03-13T23:48:31.318033	5a06ca32	120	30	1.0000	DISCARD	gen=199 glyphs=4
2026-03-13T23:48:31.589837	e8c7f6cf	120	30	1.0000	DISCARD	gen=243 glyphs=4
2026-03-13T23:48:34.000199	55d6c151	120	30	1.0000	DISCARD	gen=199 glyphs=4
2026-03-13T23:48:34.276120	50dc991d	116	29	1.0000	DISCARD	gen=243 glyphs=4
2026-03-13T23:48:36.720733	37f4017b	116	29	1.0000	DISCARD	gen=200 glyphs=4
2026-03-13T23:48:36.992806	b2d66c55	116	29	1.0000	DISCARD	gen=243 glyphs=4
2026-03-13T23:48:39.430071	bfdf7cad	120	30	1.0000	DISCARD	gen=200 glyphs=4
2026-03-13T23:48:39.716158	19355583	120	30	1.0000	DISCARD	gen=244 glyphs=4
2026-03-13T23:48:42.151574	37f4017b	116	29	1.0000	DISCARD	gen=200 glyphs=4
2026-03-13T23:48:42.416057	8aef8872	116	29	1.0000	DISCARD	gen=244 glyphs=4
2026-03-13T23:48:44.826812	5a06ca32	120	30	1.0000	DISCARD	gen=200 glyphs=4
2026-03-13T23:48:45.108329	050862ad	120	30	1.0000	DISCARD	gen=244 glyphs=4
2026-03-13T23:48:47.530294	61862c77	116	29	0.9500	DISCARD	gen=200 glyphs=4
2026-03-13T23:48:47.799121	d7c8681b	120	30	1.0000	DISCARD	gen=244 glyphs=4
2026-03-13T23:48:50.241295	2fba19ea	120	30	1.0000	DISCARD	gen=200 glyphs=4
2026-03-13T23:48:50.498459	2161055e	116	29	1.0000	DISCARD	gen=244 glyphs=4
2026-03-13T23:48:52.942464	6b4bbbd8	116	29	1.0000	DISCARD	gen=200 glyphs=4
2026-03-13T23:48:53.208702	1e5f0e21	116	29	1.0000	DISCARD	gen=244 glyphs=4
2026-03-13T23:48:55.649633	1d34459a	116	29	1.0000	DISCARD	gen=200 glyphs=4
2026-03-13T23:48:55.916619	8294565f	116	29	1.0000	DISCARD	gen=244 glyphs=4
2026-03-13T23:48:58.371842	5b9807ac	120	30	1.0000	DISCARD	gen=200 glyphs=4
2026-03-13T23:48:58.636858	99f89227	116	29	1.0000	DISCARD	gen=244 glyphs=4
2026-03-13T23:49:01.190180	0c97d71e	116	29	1.0000	DISCARD	gen=200 glyphs=4
2026-03-13T23:49:01.476118	0e63b939	116	29	1.0000	DISCARD	gen=244 glyphs=4
2026-03-13T23:49:04.019283	37f4017b	116	29	1.0000	DISCARD	gen=201 glyphs=4
2026-03-13T23:49:04.300294	f07f7dc2	116	29	1.0000	DISCARD	gen=244 glyphs=4
2026-03-13T23:49:06.782763	bfdf7cad	120	30	1.0000	DISCARD	gen=201 glyphs=4
2026-03-13T23:49:07.060974	19355583	120	30	1.0000	DISCARD	gen=245 glyphs=4
2026-03-13T23:49:09.555756	f8c4676d	120	30	1.0000	DISCARD	gen=201 glyphs=4
2026-03-13T23:49:09.827363	8aef8872	116	29	1.0000	DISCARD	gen=245 glyphs=4
2026-03-13T23:49:12.314468	922c63f9	120	30	1.0000	DISCARD	gen=201 glyphs=4
2026-03-13T23:49:12.596912	e540a862	116	29	1.0000	DISCARD	gen=245 glyphs=4
2026-03-13T23:49:15.083629	a1938a39	120	30	0.9500	DISCARD	gen=201 glyphs=4
2026-03-13T23:49:15.354127	69928914	116	29	1.0000	DISCARD	gen=245 glyphs=4
2026-03-13T23:49:17.842463	065aabe7	116	29	1.0000	DISCARD	gen=201 glyphs=4
2026-03-13T23:49:18.117643	e8c7f6cf	120	30	1.0000	DISCARD	gen=245 glyphs=4
2026-03-13T23:49:20.560042	f17e51fd	116	29	1.0000	DISCARD	gen=201 glyphs=4
2026-03-13T23:49:20.828779	19355583	120	30	1.0000	DISCARD	gen=245 glyphs=4
2026-03-13T23:49:23.288059	37f4017b	116	29	1.0000	DISCARD	gen=201 glyphs=4
2026-03-13T23:49:23.563741	1e5f0e21	116	29	1.0000	DISCARD	gen=245 glyphs=4
2026-03-13T23:49:25.972818	5a06ca32	120	30	1.0000	DISCARD	gen=201 glyphs=4
2026-03-13T23:49:26.246641	0eaedb57	116	29	1.0000	DISCARD	gen=245 glyphs=4
2026-03-13T23:49:28.658165	fdb5d108	120	30	1.0000	DISCARD	gen=201 glyphs=4
2026-03-13T23:49:28.928840	19355583	120	30	1.0000	DISCARD	gen=245 glyphs=4
2026-03-13T23:49:31.413239	37f4017b	116	29	1.0000	DISCARD	gen=202 glyphs=4
2026-03-13T23:49:31.685948	050862ad	120	30	1.0000	DISCARD	gen=245 glyphs=4
2026-03-13T23:49:34.165492	bfdf7cad	120	30	1.0000	DISCARD	gen=202 glyphs=4
2026-03-13T23:49:34.444752	19355583	120	30	1.0000	DISCARD	gen=246 glyphs=4
2026-03-13T23:49:36.977734	55d6c151	120	30	1.0000	DISCARD	gen=202 glyphs=4
2026-03-13T23:49:37.267163	8aef8872	116	29	1.0000	DISCARD	gen=246 glyphs=4
2026-03-13T23:49:39.763429	37f4017b	116	29	1.0000	DISCARD	gen=202 glyphs=4
2026-03-13T23:49:40.035995	238d370d	116	29	1.0000	DISCARD	gen=246 glyphs=4
2026-03-13T23:49:42.502835	12b38c2d	116	29	1.0000	DISCARD	gen=202 glyphs=4
2026-03-13T23:49:42.775198	1a311f58	116	29	0.9500	DISCARD	gen=246 glyphs=4
2026-03-13T23:49:45.251558	5a06ca32	120	30	1.0000	DISCARD	gen=202 glyphs=4
2026-03-13T23:49:45.521925	8aef8872	116	29	1.0000	DISCARD	gen=246 glyphs=4
2026-03-13T23:49:48.142833	2701cb73	116	29	1.0000	DISCARD	gen=202 glyphs=4
2026-03-13T23:49:48.429994	9e34ede0	116	29	1.0000	DISCARD	gen=246 glyphs=4
2026-03-13T23:49:50.947274	b99a6db8	120	30	1.0000	DISCARD	gen=202 glyphs=4
2026-03-13T23:49:51.218052	186e187b	116	29	1.0000	DISCARD	gen=246 glyphs=4
2026-03-13T23:49:53.658738	56b7b210	120	30	1.0000	DISCARD	gen=202 glyphs=4
2026-03-13T23:49:53.937206	19355583	120	30	1.0000	DISCARD	gen=246 glyphs=4
2026-03-13T23:49:56.394973	3ed7fd43	116	29	1.0000	DISCARD	gen=202 glyphs=4
2026-03-13T23:49:56.664504	eca7ab6c	116	29	1.0000	DISCARD	gen=246 glyphs=4
2026-03-13T23:49:59.132637	37f4017b	116	29	1.0000	DISCARD	gen=203 glyphs=4
2026-03-13T23:49:59.391529	d7c8681b	120	30	1.0000	DISCARD	gen=246 glyphs=4
2026-03-13T23:50:01.814995	bfdf7cad	120	30	1.0000	DISCARD	gen=203 glyphs=4
2026-03-13T23:50:02.083632	19355583	120	30	1.0000	DISCARD	gen=247 glyphs=4
2026-03-13T23:50:04.628710	37f4017b	116	29	1.0000	DISCARD	gen=203 glyphs=4
2026-03-13T23:50:04.896922	8aef8872	116	29	1.0000	DISCARD	gen=247 glyphs=4
2026-03-13T23:50:07.315563	71e2ba66	116	29	1.0000	DISCARD	gen=203 glyphs=4
2026-03-13T23:50:07.580566	72532a26	116	29	1.0000	DISCARD	gen=247 glyphs=4
2026-03-13T23:50:10.054296	db43cd01	116	29	1.0000	DISCARD	gen=203 glyphs=4
2026-03-13T23:50:10.332912	1e5f0e21	116	29	1.0000	DISCARD	gen=247 glyphs=4
2026-03-13T23:50:12.753057	5a06ca32	120	30	1.0000	DISCARD	gen=203 glyphs=4
2026-03-13T23:50:13.020939	050862ad	120	30	1.0000	DISCARD	gen=247 glyphs=4
2026-03-13T23:50:15.487961	0566b515	120	30	0.9500	DISCARD	gen=203 glyphs=4
2026-03-13T23:50:15.760645	365d7944	116	29	1.0000	DISCARD	gen=247 glyphs=4
2026-03-13T23:50:18.177070	1ed7a2e3	120	30	1.0000	DISCARD	gen=203 glyphs=4
2026-03-13T23:50:18.443612	8aef8872	116	29	1.0000	DISCARD	gen=247 glyphs=4
2026-03-13T23:50:20.888354	5a06ca32	120	30	1.0000	DISCARD	gen=203 glyphs=4
2026-03-13T23:50:21.158630	8058b4ca	116	29	1.0000	DISCARD	gen=247 glyphs=4
2026-03-13T23:50:23.594022	5a06ca32	120	30	1.0000	DISCARD	gen=203 glyphs=4
2026-03-13T23:50:23.852485	c8567380	120	30	1.0000	DISCARD	gen=247 glyphs=4
2026-03-13T23:50:26.290276	37f4017b	116	29	1.0000	DISCARD	gen=204 glyphs=4
2026-03-13T23:50:26.564381	200242a1	116	29	1.0000	DISCARD	gen=247 glyphs=4
2026-03-13T23:50:28.976540	bfdf7cad	120	30	1.0000	DISCARD	gen=204 glyphs=4
2026-03-13T23:50:29.251337	19355583	120	30	1.0000	DISCARD	gen=248 glyphs=4
2026-03-13T23:50:31.688825	55d6c151	120	30	1.0000	DISCARD	gen=204 glyphs=4
2026-03-13T23:50:31.957866	8aef8872	116	29	1.0000	DISCARD	gen=248 glyphs=4
2026-03-13T23:50:34.389144	1d34459a	116	29	1.0000	DISCARD	gen=204 glyphs=4
2026-03-13T23:50:34.685038	8aef8872	116	29	1.0000	DISCARD	gen=248 glyphs=4
2026-03-13T23:50:37.165828	37f4017b	116	29	1.0000	DISCARD	gen=204 glyphs=4
2026-03-13T23:50:37.437018	e2cd28ea	120	30	1.0000	DISCARD	gen=248 glyphs=4
2026-03-13T23:50:39.857368	37f4017b	116	29	1.0000	DISCARD	gen=204 glyphs=4
2026-03-13T23:50:40.126672	ab042f6f	116	29	1.0000	DISCARD	gen=248 glyphs=4
2026-03-13T23:50:42.591028	5a06ca32	120	30	1.0000	DISCARD	gen=204 glyphs=4
2026-03-13T23:50:42.866062	1e5f0e21	116	29	1.0000	DISCARD	gen=248 glyphs=4
2026-03-13T23:50:45.300711	12b38c2d	116	29	1.0000	DISCARD	gen=204 glyphs=4
2026-03-13T23:50:45.566703	9e34ede0	116	29	1.0000	DISCARD	gen=248 glyphs=4
2026-03-13T23:50:47.975665	90d72dfa	116	29	1.0000	DISCARD	gen=204 glyphs=4
2026-03-13T23:50:48.252926	eca7ab6c	116	29	1.0000	DISCARD	gen=248 glyphs=4
2026-03-13T23:50:50.684462	f8b79659	116	29	1.0000	DISCARD	gen=204 glyphs=4
2026-03-13T23:50:50.954622	2383048e	120	30	1.0000	DISCARD	gen=248 glyphs=4
2026-03-13T23:50:53.370071	37f4017b	116	29	1.0000	DISCARD	gen=205 glyphs=4
2026-03-13T23:50:53.651345	19355583	120	30	1.0000	DISCARD	gen=248 glyphs=4
2026-03-13T23:50:56.107336	bfdf7cad	120	30	1.0000	DISCARD	gen=205 glyphs=4
2026-03-13T23:50:56.377430	19355583	120	30	1.0000	DISCARD	gen=249 glyphs=4
2026-03-13T23:50:58.822289	821243c8	116	29	1.0000	DISCARD	gen=205 glyphs=4
2026-03-13T23:50:59.082956	8aef8872	116	29	1.0000	DISCARD	gen=249 glyphs=4
2026-03-13T23:51:01.513661	37f4017b	116	29	1.0000	DISCARD	gen=205 glyphs=4
2026-03-13T23:51:01.783125	875e0f8a	116	29	1.0000	DISCARD	gen=249 glyphs=4
2026-03-13T23:51:04.226342	77c52fbf	116	29	1.0000	DISCARD	gen=205 glyphs=4
2026-03-13T23:51:04.506660	8aef8872	116	29	1.0000	DISCARD	gen=249 glyphs=4
2026-03-13T23:51:06.988411	4f594cc6	116	29	1.0000	DISCARD	gen=205 glyphs=4
2026-03-13T23:51:07.272317	0eaedb57	116	29	1.0000	DISCARD	gen=249 glyphs=4
2026-03-13T23:51:09.754692	d7e19e5e	116	29	1.0000	DISCARD	gen=205 glyphs=4
2026-03-13T23:51:10.017584	e8c76b46	120	30	1.0000	DISCARD	gen=249 glyphs=4
2026-03-13T23:51:12.415474	b789f7ee	116	29	1.0000	DISCARD	gen=205 glyphs=4
2026-03-13T23:51:12.678539	ae44ace5	116	29	1.0000	DISCARD	gen=249 glyphs=4
2026-03-13T23:51:15.090060	37f4017b	116	29	1.0000	DISCARD	gen=205 glyphs=4
2026-03-13T23:51:15.347034	67cb81be	120	30	1.0000	DISCARD	gen=249 glyphs=4
2026-03-13T23:51:17.808211	5a06ca32	120	30	1.0000	DISCARD	gen=205 glyphs=4
2026-03-13T23:51:18.071503	a78f9454	120	30	1.0000	DISCARD	gen=249 glyphs=4
2026-03-13T23:51:20.500651	37f4017b	116	29	1.0000	DISCARD	gen=206 glyphs=4
2026-03-13T23:51:20.775680	59a5316a	116	29	1.0000	DISCARD	gen=249 glyphs=4
2026-03-13T23:51:23.221127	bfdf7cad	120	30	1.0000	DISCARD	gen=206 glyphs=4
2026-03-13T23:51:23.485978	19355583	120	30	1.0000	DISCARD	gen=250 glyphs=4
2026-03-13T23:51:25.897046	5a06ca32	120	30	1.0000	DISCARD	gen=206 glyphs=4
2026-03-13T23:51:26.179648	8aef8872	116	29	1.0000	DISCARD	gen=250 glyphs=4
2026-03-13T23:51:28.616304	30a82cf5	116	29	1.0000	DISCARD	gen=206 glyphs=4
2026-03-13T23:51:28.903583	0eaedb57	116	29	1.0000	DISCARD	gen=250 glyphs=4
2026-03-13T23:51:31.316089	5a06ca32	120	30	1.0000	DISCARD	gen=206 glyphs=4
2026-03-13T23:51:31.588938	050862ad	120	30	1.0000	DISCARD	gen=250 glyphs=4
2026-03-13T23:51:34.005094	7dca72c4	116	29	0.9500	DISCARD	gen=206 glyphs=4
2026-03-13T23:51:34.273464	67cb81be	120	30	1.0000	DISCARD	gen=250 glyphs=4
2026-03-13T23:51:36.708101	37f4017b	116	29	1.0000	DISCARD	gen=206 glyphs=4
2026-03-13T23:51:36.993066	8aef8872	116	29	1.0000	DISCARD	gen=250 glyphs=4
2026-03-13T23:51:39.505608	d11c1062	120	30	1.0000	DISCARD	gen=206 glyphs=4
2026-03-13T23:51:39.792263	d5a51768	120	30	0.9500	DISCARD	gen=250 glyphs=4
2026-03-13T23:51:42.215800	6f885ccb	120	30	1.0000	DISCARD	gen=206 glyphs=4
2026-03-13T23:51:42.482531	b57e7176	120	30	1.0000	DISCARD	gen=250 glyphs=4
2026-03-13T23:51:44.920300	d11c1062	120	30	1.0000	DISCARD	gen=206 glyphs=4
2026-03-13T23:51:45.201309	ae44ace5	116	29	1.0000	DISCARD	gen=250 glyphs=4
2026-03-13T23:51:47.640106	37f4017b	116	29	1.0000	DISCARD	gen=207 glyphs=4
2026-03-13T23:51:47.898903	e2cd28ea	120	30	1.0000	DISCARD	gen=250 glyphs=4
2026-03-13T23:51:50.341448	bfdf7cad	120	30	1.0000	DISCARD	gen=207 glyphs=4
2026-03-13T23:51:50.610935	19355583	120	30	1.0000	DISCARD	gen=251 glyphs=4
2026-03-13T23:51:53.024260	d11c1062	120	30	1.0000	DISCARD	gen=207 glyphs=4
2026-03-13T23:51:53.294386	8aef8872	116	29	1.0000	DISCARD	gen=251 glyphs=4
2026-03-13T23:51:55.726239	71e2ba66	116	29	1.0000	DISCARD	gen=207 glyphs=4
2026-03-13T23:51:55.998496	9e34ede0	116	29	1.0000	DISCARD	gen=251 glyphs=4
2026-03-13T23:51:58.457940	dd09b674	116	29	1.0000	DISCARD	gen=207 glyphs=4
2026-03-13T23:51:58.727588	0eaedb57	116	29	1.0000	DISCARD	gen=251 glyphs=4
2026-03-13T23:52:01.172479	c1206a26	116	29	1.0000	DISCARD	gen=207 glyphs=4
2026-03-13T23:52:01.433559	e8c7f6cf	120	30	1.0000	DISCARD	gen=251 glyphs=4
2026-03-13T23:52:03.857611	12b38c2d	116	29	1.0000	DISCARD	gen=207 glyphs=4
2026-03-13T23:52:04.135574	50dc991d	116	29	1.0000	DISCARD	gen=251 glyphs=4
2026-03-13T23:52:06.565636	3d585ee5	116	29	0.9500	DISCARD	gen=207 glyphs=4
2026-03-13T23:52:06.827462	050862ad	120	30	1.0000	DISCARD	gen=251 glyphs=4
2026-03-13T23:52:09.225662	5a06ca32	120	30	1.0000	DISCARD	gen=207 glyphs=4
2026-03-13T23:52:09.507102	19355583	120	30	1.0000	DISCARD	gen=251 glyphs=4
2026-03-13T23:52:12.024902	5a06ca32	120	30	1.0000	DISCARD	gen=207 glyphs=4
2026-03-13T23:52:12.306516	9e34ede0	116	29	1.0000	DISCARD	gen=251 glyphs=4
2026-03-13T23:52:14.699926	37f4017b	116	29	1.0000	DISCARD	gen=208 glyphs=4
2026-03-13T23:52:14.975417	19355583	120	30	1.0000	DISCARD	gen=251 glyphs=4
2026-03-13T23:52:17.416751	bfdf7cad	120	30	1.0000	DISCARD	gen=208 glyphs=4
2026-03-13T23:52:17.692030	19355583	120	30	1.0000	DISCARD	gen=252 glyphs=4
2026-03-13T23:52:20.143240	37f4017b	116	29	1.0000	DISCARD	gen=208 glyphs=4
2026-03-13T23:52:20.412030	8aef8872	116	29	1.0000	DISCARD	gen=252 glyphs=4
2026-03-13T23:52:22.853776	558406c7	116	29	1.0000	DISCARD	gen=208 glyphs=4
2026-03-13T23:52:23.121460	875e0f8a	116	29	1.0000	DISCARD	gen=252 glyphs=4
2026-03-13T23:52:25.540546	d11c1062	120	30	1.0000	DISCARD	gen=208 glyphs=4
2026-03-13T23:52:25.809012	b7aed8e9	116	29	1.0000	DISCARD	gen=252 glyphs=4
2026-03-13T23:52:28.226813	9a4bc5a3	120	30	1.0000	DISCARD	gen=208 glyphs=4
2026-03-13T23:52:28.500810	19355583	120	30	1.0000	DISCARD	gen=252 glyphs=4
2026-03-13T23:52:30.929315	21a72cea	116	29	1.0000	DISCARD	gen=208 glyphs=4
2026-03-13T23:52:31.203791	8aef8872	116	29	1.0000	DISCARD	gen=252 glyphs=4
2026-03-13T23:52:33.655867	e03383ce	116	29	1.0000	DISCARD	gen=208 glyphs=4
2026-03-13T23:52:33.924485	c317d4f4	116	29	1.0000	DISCARD	gen=252 glyphs=4
2026-03-13T23:52:36.350095	bfdf7cad	120	30	1.0000	DISCARD	gen=208 glyphs=4
2026-03-13T23:52:36.619225	bb1d1f07	116	29	1.0000	DISCARD	gen=252 glyphs=4
2026-03-13T23:52:39.035360	5a06ca32	120	30	1.0000	DISCARD	gen=208 glyphs=4
2026-03-13T23:52:39.331807	19355583	120	30	1.0000	DISCARD	gen=252 glyphs=4
2026-03-13T23:52:41.828088	37f4017b	116	29	1.0000	DISCARD	gen=209 glyphs=4
2026-03-13T23:52:42.093632	8aef8872	116	29	1.0000	DISCARD	gen=252 glyphs=4
2026-03-13T23:52:44.578289	bfdf7cad	120	30	1.0000	DISCARD	gen=209 glyphs=4
2026-03-13T23:52:44.850162	19355583	120	30	1.0000	DISCARD	gen=253 glyphs=4
2026-03-13T23:52:47.295335	5b9807ac	120	30	1.0000	DISCARD	gen=209 glyphs=4
2026-03-13T23:52:47.565751	8aef8872	116	29	1.0000	DISCARD	gen=253 glyphs=4
2026-03-13T23:52:49.975265	9995eb6f	120	30	1.0000	DISCARD	gen=209 glyphs=4
2026-03-13T23:52:50.242919	e8c7f6cf	120	30	1.0000	DISCARD	gen=253 glyphs=4
2026-03-13T23:52:52.687629	6057a50c	116	29	1.0000	DISCARD	gen=209 glyphs=4
2026-03-13T23:52:52.953133	1e5f0e21	116	29	1.0000	DISCARD	gen=253 glyphs=4
2026-03-13T23:52:55.393388	36584d97	116	29	1.0000	DISCARD	gen=209 glyphs=4
2026-03-13T23:52:55.676003	050862ad	120	30	1.0000	DISCARD	gen=253 glyphs=4
2026-03-13T23:52:58.092557	a2130df3	116	29	1.0000	DISCARD	gen=209 glyphs=4
2026-03-13T23:52:58.374606	78c3db40	120	30	1.0000	DISCARD	gen=253 glyphs=4
2026-03-13T23:53:00.804150	12b38c2d	116	29	1.0000	DISCARD	gen=209 glyphs=4
2026-03-13T23:53:01.075003	eca7ab6c	116	29	1.0000	DISCARD	gen=253 glyphs=4
2026-03-13T23:53:03.497728	5a06ca32	120	30	1.0000	DISCARD	gen=209 glyphs=4
2026-03-13T23:53:03.780493	b57e7176	120	30	1.0000	DISCARD	gen=253 glyphs=4
2026-03-13T23:53:06.209189	55d6c151	120	30	1.0000	DISCARD	gen=209 glyphs=4
2026-03-13T23:53:06.490727	a78f9454	120	30	1.0000	DISCARD	gen=253 glyphs=4
2026-03-13T23:53:08.918905	37f4017b	116	29	1.0000	DISCARD	gen=210 glyphs=4
2026-03-13T23:53:09.189538	67cb81be	120	30	1.0000	DISCARD	gen=253 glyphs=4
2026-03-13T23:53:11.635834	bfdf7cad	120	30	1.0000	DISCARD	gen=210 glyphs=4
2026-03-13T23:53:11.906789	19355583	120	30	1.0000	DISCARD	gen=254 glyphs=4
2026-03-13T23:53:14.421533	bfdf7cad	120	30	1.0000	DISCARD	gen=210 glyphs=4
2026-03-13T23:53:14.694855	8aef8872	116	29	1.0000	DISCARD	gen=254 glyphs=4
2026-03-13T23:53:17.140576	5a06ca32	120	30	1.0000	DISCARD	gen=210 glyphs=4
2026-03-13T23:53:17.411268	b57e7176	120	30	1.0000	DISCARD	gen=254 glyphs=4
2026-03-13T23:53:19.861843	fdb5d108	120	30	1.0000	DISCARD	gen=210 glyphs=4
2026-03-13T23:53:20.128727	e8c7f6cf	120	30	1.0000	DISCARD	gen=254 glyphs=4
2026-03-13T23:53:22.565267	5a06ca32	120	30	1.0000	DISCARD	gen=210 glyphs=4
2026-03-13T23:53:22.838852	b7aed8e9	116	29	1.0000	DISCARD	gen=254 glyphs=4
2026-03-13T23:53:25.256645	5b9807ac	120	30	1.0000	DISCARD	gen=210 glyphs=4
2026-03-13T23:53:25.524449	453c94fe	116	29	1.0000	DISCARD	gen=254 glyphs=4
2026-03-13T23:53:27.944498	d11c1062	120	30	1.0000	DISCARD	gen=210 glyphs=4
2026-03-13T23:53:28.212513	9e34ede0	116	29	1.0000	DISCARD	gen=254 glyphs=4
2026-03-13T23:53:30.622835	1d34459a	116	29	1.0000	DISCARD	gen=210 glyphs=4
2026-03-13T23:53:30.892996	42c1c6bc	116	29	1.0000	DISCARD	gen=254 glyphs=4
2026-03-13T23:53:33.297330	ac847f09	120	30	1.0000	DISCARD	gen=210 glyphs=4
2026-03-13T23:53:33.568831	0eaedb57	116	29	1.0000	DISCARD	gen=254 glyphs=4
2026-03-13T23:53:36.022367	37f4017b	116	29	1.0000	DISCARD	gen=211 glyphs=4
2026-03-13T23:53:36.291720	050862ad	120	30	1.0000	DISCARD	gen=254 glyphs=4
2026-03-13T23:53:38.712718	bfdf7cad	120	30	1.0000	DISCARD	gen=211 glyphs=4
2026-03-13T23:53:38.981552	19355583	120	30	1.0000	DISCARD	gen=255 glyphs=4
2026-03-13T23:53:41.401929	1d34459a	116	29	1.0000	DISCARD	gen=211 glyphs=4
2026-03-13T23:53:41.692864	8aef8872	116	29	1.0000	DISCARD	gen=255 glyphs=4
2026-03-13T23:53:44.106951	5a06ca32	120	30	1.0000	DISCARD	gen=211 glyphs=4
2026-03-13T23:53:44.380754	0eaedb57	116	29	1.0000	DISCARD	gen=255 glyphs=4
2026-03-13T23:53:46.893922	37f4017b	116	29	1.0000	DISCARD	gen=211 glyphs=4
2026-03-13T23:53:47.170508	1dbb8cd5	116	29	1.0000	DISCARD	gen=255 glyphs=4
2026-03-13T23:53:49.617119	5b9807ac	120	30	1.0000	DISCARD	gen=211 glyphs=4
2026-03-13T23:53:49.885854	8aef8872	116	29	1.0000	DISCARD	gen=255 glyphs=4
2026-03-13T23:53:52.316434	5a06ca32	120	30	1.0000	DISCARD	gen=211 glyphs=4
2026-03-13T23:53:52.588644	c4f71538	116	29	1.0000	DISCARD	gen=255 glyphs=4
2026-03-13T23:53:55.040616	5a06ca32	120	30	1.0000	DISCARD	gen=211 glyphs=4
2026-03-13T23:53:55.301597	8acdba12	116	29	0.9500	DISCARD	gen=255 glyphs=4
2026-03-13T23:53:57.749205	37f4017b	116	29	1.0000	DISCARD	gen=211 glyphs=4
2026-03-13T23:53:58.013683	f356394e	120	30	0.9500	DISCARD	gen=255 glyphs=4
2026-03-13T23:54:00.458146	bfdf7cad	120	30	1.0000	DISCARD	gen=211 glyphs=4
2026-03-13T23:54:00.742255	19355583	120	30	1.0000	DISCARD	gen=255 glyphs=4
2026-03-13T23:54:03.212151	37f4017b	116	29	1.0000	DISCARD	gen=212 glyphs=4
2026-03-13T23:54:03.477600	b57e7176	120	30	1.0000	DISCARD	gen=255 glyphs=4
2026-03-13T23:54:05.925992	bfdf7cad	120	30	1.0000	DISCARD	gen=212 glyphs=4
2026-03-13T23:54:06.192582	19355583	120	30	1.0000	DISCARD	gen=256 glyphs=4
2026-03-13T23:54:08.647819	11196e10	116	29	1.0000	DISCARD	gen=212 glyphs=4
2026-03-13T23:54:08.914385	8aef8872	116	29	1.0000	DISCARD	gen=256 glyphs=4
2026-03-13T23:54:11.331964	460078e3	120	30	1.0000	DISCARD	gen=212 glyphs=4
2026-03-13T23:54:11.599329	8aef8872	116	29	1.0000	DISCARD	gen=256 glyphs=4
2026-03-13T23:54:14.032537	55d6c151	120	30	1.0000	DISCARD	gen=212 glyphs=4
2026-03-13T23:54:14.303326	050862ad	120	30	1.0000	DISCARD	gen=256 glyphs=4
2026-03-13T23:54:16.757928	5a06ca32	120	30	1.0000	DISCARD	gen=212 glyphs=4
2026-03-13T23:54:17.022214	19355583	120	30	1.0000	DISCARD	gen=256 glyphs=4
2026-03-13T23:54:19.562506	37f4017b	116	29	1.0000	DISCARD	gen=212 glyphs=4
2026-03-13T23:54:19.834415	0eaedb57	116	29	1.0000	DISCARD	gen=256 glyphs=4
2026-03-13T23:54:22.252203	37f4017b	116	29	1.0000	DISCARD	gen=212 glyphs=4
2026-03-13T23:54:22.526378	17881fac	120	30	1.0000	DISCARD	gen=256 glyphs=4
2026-03-13T23:54:24.944770	d11c1062	120	30	1.0000	DISCARD	gen=212 glyphs=4
2026-03-13T23:54:25.215677	eca7ab6c	116	29	1.0000	DISCARD	gen=256 glyphs=4
2026-03-13T23:54:27.652393	5a06ca32	120	30	1.0000	DISCARD	gen=212 glyphs=4
2026-03-13T23:54:27.935113	67cb81be	120	30	1.0000	DISCARD	gen=256 glyphs=4
2026-03-13T23:54:30.330711	37f4017b	116	29	1.0000	DISCARD	gen=213 glyphs=4
2026-03-13T23:54:30.604921	8aef8872	116	29	1.0000	DISCARD	gen=256 glyphs=4
