timestamp	program_hash	spirv_size	word_count	fitness	status	description
2026-03-14T02:28:21.841616	55d6c151	120	30	1.0000	DISCARD	gen=548 glyphs=4
2026-03-14T02:28:22.117029	9e34ede0	116	29	1.0000	DISCARD	gen=592 glyphs=4
2026-03-14T02:28:24.592503	37f4017b	116	29	1.0000	DISCARD	gen=549 glyphs=4
2026-03-14T02:28:24.856016	5a08a317	116	29	1.0000	DISCARD	gen=592 glyphs=4
2026-03-14T02:28:27.338990	bfdf7cad	120	30	1.0000	DISCARD	gen=549 glyphs=4
2026-03-14T02:28:27.614114	19355583	120	30	1.0000	DISCARD	gen=593 glyphs=4
2026-03-14T02:28:30.044436	d5c1c356	116	29	1.0000	DISCARD	gen=549 glyphs=4
2026-03-14T02:28:30.303670	8aef8872	116	29	1.0000	DISCARD	gen=593 glyphs=4
2026-03-14T02:28:32.759435	5a06ca32	120	30	1.0000	DISCARD	gen=549 glyphs=4
2026-03-14T02:28:33.036532	9e34ede0	116	29	1.0000	DISCARD	gen=593 glyphs=4
2026-03-14T02:28:35.479832	b539778f	120	30	1.0000	DISCARD	gen=549 glyphs=4
2026-03-14T02:28:35.755080	9e34ede0	116	29	1.0000	DISCARD	gen=593 glyphs=4
2026-03-14T02:28:38.295762	37f4017b	116	29	1.0000	DISCARD	gen=549 glyphs=4
2026-03-14T02:28:38.566064	875e0f8a	116	29	1.0000	DISCARD	gen=593 glyphs=4
2026-03-14T02:28:41.027495	71e2ba66	116	29	1.0000	DISCARD	gen=549 glyphs=4
2026-03-14T02:28:41.305208	b57e7176	120	30	1.0000	DISCARD	gen=593 glyphs=4
2026-03-14T02:28:43.777436	4cc70296	120	30	1.0000	DISCARD	gen=549 glyphs=4
2026-03-14T02:28:44.045737	19355583	120	30	1.0000	DISCARD	gen=593 glyphs=4
2026-03-14T02:28:46.489712	37f4017b	116	29	1.0000	DISCARD	gen=549 glyphs=4
2026-03-14T02:28:46.761569	94ca08c7	120	30	1.0000	DISCARD	gen=593 glyphs=4
2026-03-14T02:28:49.220072	5a06ca32	120	30	1.0000	DISCARD	gen=549 glyphs=4
2026-03-14T02:28:49.496232	b375ec84	116	29	1.0000	DISCARD	gen=593 glyphs=4
2026-03-14T02:28:51.985291	37f4017b	116	29	1.0000	DISCARD	gen=550 glyphs=4
2026-03-14T02:28:52.269107	875e0f8a	116	29	1.0000	DISCARD	gen=593 glyphs=4
2026-03-14T02:28:54.736697	bfdf7cad	120	30	1.0000	DISCARD	gen=550 glyphs=4
2026-03-14T02:28:55.028204	19355583	120	30	1.0000	DISCARD	gen=594 glyphs=4
2026-03-14T02:28:57.490990	1d34459a	116	29	1.0000	DISCARD	gen=550 glyphs=4
2026-03-14T02:28:57.758215	8aef8872	116	29	1.0000	DISCARD	gen=594 glyphs=4
2026-03-14T02:29:00.218872	12b38c2d	116	29	1.0000	DISCARD	gen=550 glyphs=4
2026-03-14T02:29:00.496218	b57e7176	120	30	1.0000	DISCARD	gen=594 glyphs=4
2026-03-14T02:29:02.983834	d61ba0d8	116	29	1.0000	DISCARD	gen=550 glyphs=4
2026-03-14T02:29:03.262746	50dc991d	116	29	1.0000	DISCARD	gen=594 glyphs=4
2026-03-14T02:29:05.714467	bfdf7cad	120	30	1.0000	DISCARD	gen=550 glyphs=4
2026-03-14T02:29:05.990386	5d3cefb0	116	29	1.0000	DISCARD	gen=594 glyphs=4
2026-03-14T02:29:08.458401	4c9b0dd4	120	30	1.0000	DISCARD	gen=550 glyphs=4
2026-03-14T02:29:08.740920	f9245cd0	116	29	1.0000	DISCARD	gen=594 glyphs=4
2026-03-14T02:29:11.223214	37f4017b	116	29	1.0000	DISCARD	gen=550 glyphs=4
2026-03-14T02:29:11.503297	19355583	120	30	1.0000	DISCARD	gen=594 glyphs=4
2026-03-14T02:29:13.974108	37f4017b	116	29	1.0000	DISCARD	gen=550 glyphs=4
2026-03-14T02:29:14.240343	9e34ede0	116	29	1.0000	DISCARD	gen=594 glyphs=4
2026-03-14T02:29:16.712962	5a06ca32	120	30	1.0000	DISCARD	gen=550 glyphs=4
2026-03-14T02:29:16.993037	d7c8681b	120	30	1.0000	DISCARD	gen=594 glyphs=4
2026-03-14T02:29:19.475333	37f4017b	116	29	1.0000	DISCARD	gen=551 glyphs=4
2026-03-14T02:29:19.751691	7da8ae6a	120	30	1.0000	DISCARD	gen=594 glyphs=4
2026-03-14T02:29:22.209651	bfdf7cad	120	30	1.0000	DISCARD	gen=551 glyphs=4
2026-03-14T02:29:22.485897	19355583	120	30	1.0000	DISCARD	gen=595 glyphs=4
2026-03-14T02:29:24.984216	5d92645a	116	29	1.0000	DISCARD	gen=551 glyphs=4
2026-03-14T02:29:25.270850	8aef8872	116	29	1.0000	DISCARD	gen=595 glyphs=4
2026-03-14T02:29:27.760953	d11c1062	120	30	1.0000	DISCARD	gen=551 glyphs=4
2026-03-14T02:29:28.026837	b7aed8e9	116	29	1.0000	DISCARD	gen=595 glyphs=4
2026-03-14T02:29:30.533998	37f4017b	116	29	1.0000	DISCARD	gen=551 glyphs=4
2026-03-14T02:29:30.796338	50dc991d	116	29	1.0000	DISCARD	gen=595 glyphs=4
2026-03-14T02:29:33.261179	5a06ca32	120	30	1.0000	DISCARD	gen=551 glyphs=4
2026-03-14T02:29:33.531906	a78f9454	120	30	1.0000	DISCARD	gen=595 glyphs=4
2026-03-14T02:29:36.002484	ee93f874	116	29	1.0000	DISCARD	gen=551 glyphs=4
2026-03-14T02:29:36.277043	67cb81be	120	30	1.0000	DISCARD	gen=595 glyphs=4
2026-03-14T02:29:38.735546	00374749	116	29	1.0000	DISCARD	gen=551 glyphs=4
2026-03-14T02:29:39.002097	b57e7176	120	30	1.0000	DISCARD	gen=595 glyphs=4
2026-03-14T02:29:41.576967	37f4017b	116	29	1.0000	DISCARD	gen=551 glyphs=4
2026-03-14T02:29:41.864040	67cb81be	120	30	1.0000	DISCARD	gen=595 glyphs=4
2026-03-14T02:29:44.323124	5a06ca32	120	30	1.0000	DISCARD	gen=551 glyphs=4
2026-03-14T02:29:44.587830	050862ad	120	30	1.0000	DISCARD	gen=595 glyphs=4
2026-03-14T02:29:47.030804	37f4017b	116	29	1.0000	DISCARD	gen=552 glyphs=4
2026-03-14T02:29:47.307555	050862ad	120	30	1.0000	DISCARD	gen=595 glyphs=4
2026-03-14T02:29:49.785477	bfdf7cad	120	30	1.0000	DISCARD	gen=552 glyphs=4
2026-03-14T02:29:50.058935	19355583	120	30	1.0000	DISCARD	gen=596 glyphs=4
2026-03-14T02:29:52.546365	b3515e48	120	30	1.0000	DISCARD	gen=552 glyphs=4
2026-03-14T02:29:52.815173	8aef8872	116	29	1.0000	DISCARD	gen=596 glyphs=4
2026-03-14T02:29:55.283845	f85928e7	116	29	1.0000	DISCARD	gen=552 glyphs=4
2026-03-14T02:29:55.558560	050862ad	120	30	1.0000	DISCARD	gen=596 glyphs=4
2026-03-14T02:29:58.017680	1d34459a	116	29	1.0000	DISCARD	gen=552 glyphs=4
2026-03-14T02:29:58.291548	050862ad	120	30	1.0000	DISCARD	gen=596 glyphs=4
2026-03-14T02:30:00.797948	5a06ca32	120	30	1.0000	DISCARD	gen=552 glyphs=4
2026-03-14T02:30:01.082356	5b4b6dbe	116	29	1.0000	DISCARD	gen=596 glyphs=4
2026-03-14T02:30:03.545585	5a06ca32	120	30	1.0000	DISCARD	gen=552 glyphs=4
2026-03-14T02:30:03.819115	8aef8872	116	29	1.0000	DISCARD	gen=596 glyphs=4
2026-03-14T02:30:06.278049	55d6c151	120	30	1.0000	DISCARD	gen=552 glyphs=4
2026-03-14T02:30:06.560914	b7aed8e9	116	29	1.0000	DISCARD	gen=596 glyphs=4
2026-03-14T02:30:09.068862	2701cb73	116	29	1.0000	DISCARD	gen=552 glyphs=4
2026-03-14T02:30:09.336162	ae44ace5	116	29	1.0000	DISCARD	gen=596 glyphs=4
2026-03-14T02:30:11.871424	5b9807ac	120	30	1.0000	DISCARD	gen=552 glyphs=4
2026-03-14T02:30:12.150082	0e3617c0	116	29	1.0000	DISCARD	gen=596 glyphs=4
2026-03-14T02:30:14.651522	37f4017b	116	29	1.0000	DISCARD	gen=553 glyphs=4
2026-03-14T02:30:14.927120	67cb81be	120	30	1.0000	DISCARD	gen=596 glyphs=4
2026-03-14T02:30:17.373274	bfdf7cad	120	30	1.0000	DISCARD	gen=553 glyphs=4
2026-03-14T02:30:17.644363	19355583	120	30	1.0000	DISCARD	gen=597 glyphs=4
2026-03-14T02:30:20.134339	37f4017b	116	29	1.0000	DISCARD	gen=553 glyphs=4
2026-03-14T02:30:20.402119	8aef8872	116	29	1.0000	DISCARD	gen=597 glyphs=4
2026-03-14T02:30:22.882086	ede7249b	116	29	1.0000	DISCARD	gen=553 glyphs=4
2026-03-14T02:30:23.146701	d7c8681b	120	30	1.0000	DISCARD	gen=597 glyphs=4
2026-03-14T02:30:25.630696	55d6c151	120	30	1.0000	DISCARD	gen=553 glyphs=4
2026-03-14T02:30:25.912963	1e5f0e21	116	29	1.0000	DISCARD	gen=597 glyphs=4
2026-03-14T02:30:28.387461	2701cb73	116	29	1.0000	DISCARD	gen=553 glyphs=4
2026-03-14T02:30:28.658123	7d3d8795	116	29	1.0000	DISCARD	gen=597 glyphs=4
2026-03-14T02:30:31.118796	71e2ba66	116	29	1.0000	DISCARD	gen=553 glyphs=4
2026-03-14T02:30:31.385993	0eaedb57	116	29	1.0000	DISCARD	gen=597 glyphs=4
2026-03-14T02:30:33.871579	86a8cb7f	116	29	1.0000	DISCARD	gen=553 glyphs=4
2026-03-14T02:30:34.140117	8aef8872	116	29	1.0000	DISCARD	gen=597 glyphs=4
2026-03-14T02:30:36.597988	71e2ba66	116	29	1.0000	DISCARD	gen=553 glyphs=4
2026-03-14T02:30:36.876094	9e34ede0	116	29	1.0000	DISCARD	gen=597 glyphs=4
2026-03-14T02:30:39.334110	53ca84bb	120	30	1.0000	DISCARD	gen=553 glyphs=4
2026-03-14T02:30:39.604210	e2cd28ea	120	30	1.0000	DISCARD	gen=597 glyphs=4
2026-03-14T02:30:42.076037	37f4017b	116	29	1.0000	DISCARD	gen=554 glyphs=4
2026-03-14T02:30:42.360676	9e34ede0	116	29	1.0000	DISCARD	gen=597 glyphs=4
2026-03-14T02:30:44.928247	bfdf7cad	120	30	1.0000	DISCARD	gen=554 glyphs=4
2026-03-14T02:30:45.202549	19355583	120	30	1.0000	DISCARD	gen=598 glyphs=4
2026-03-14T02:30:47.664465	5b9807ac	120	30	1.0000	DISCARD	gen=554 glyphs=4
2026-03-14T02:30:47.944442	8aef8872	116	29	1.0000	DISCARD	gen=598 glyphs=4
2026-03-14T02:30:50.406332	5a06ca32	120	30	1.0000	DISCARD	gen=554 glyphs=4
2026-03-14T02:30:50.681262	a78f9454	120	30	1.0000	DISCARD	gen=598 glyphs=4
2026-03-14T02:30:53.146379	55d6c151	120	30	1.0000	DISCARD	gen=554 glyphs=4
2026-03-14T02:30:53.418454	41cfc15d	116	29	1.0000	DISCARD	gen=598 glyphs=4
2026-03-14T02:30:55.889765	4ff0f69b	120	30	1.0000	DISCARD	gen=554 glyphs=4
2026-03-14T02:30:56.156188	19355583	120	30	1.0000	DISCARD	gen=598 glyphs=4
2026-03-14T02:30:58.641161	82aff5f0	116	29	1.0000	DISCARD	gen=554 glyphs=4
2026-03-14T02:30:58.916803	152d1749	116	29	1.0000	DISCARD	gen=598 glyphs=4
2026-03-14T02:31:01.414331	5a06ca32	120	30	1.0000	DISCARD	gen=554 glyphs=4
2026-03-14T02:31:01.697186	2be1c1fc	116	29	1.0000	DISCARD	gen=598 glyphs=4
2026-03-14T02:31:04.160255	37f4017b	116	29	1.0000	DISCARD	gen=554 glyphs=4
2026-03-14T02:31:04.437574	e8c7f6cf	120	30	1.0000	DISCARD	gen=598 glyphs=4
2026-03-14T02:31:06.891123	2701cb73	116	29	1.0000	DISCARD	gen=554 glyphs=4
2026-03-14T02:31:07.180285	0eaedb57	116	29	1.0000	DISCARD	gen=598 glyphs=4
2026-03-14T02:31:09.660011	37f4017b	116	29	1.0000	DISCARD	gen=555 glyphs=4
2026-03-14T02:31:09.936296	8aef8872	116	29	1.0000	DISCARD	gen=598 glyphs=4
2026-03-14T02:31:12.400151	bfdf7cad	120	30	1.0000	DISCARD	gen=555 glyphs=4
2026-03-14T02:31:12.671427	19355583	120	30	1.0000	DISCARD	gen=599 glyphs=4
2026-03-14T02:31:15.132977	fdb5d108	120	30	1.0000	DISCARD	gen=555 glyphs=4
2026-03-14T02:31:15.459367	8aef8872	116	29	1.0000	DISCARD	gen=599 glyphs=4
2026-03-14T02:31:17.959913	71e2ba66	116	29	1.0000	DISCARD	gen=555 glyphs=4
2026-03-14T02:31:18.235558	c206f84e	116	29	0.9500	DISCARD	gen=599 glyphs=4
2026-03-14T02:31:20.675986	a964b86c	120	30	1.0000	DISCARD	gen=555 glyphs=4
2026-03-14T02:31:20.952108	050862ad	120	30	1.0000	DISCARD	gen=599 glyphs=4
2026-03-14T02:31:23.388059	5a06ca32	120	30	1.0000	DISCARD	gen=555 glyphs=4
2026-03-14T02:31:23.660609	19355583	120	30	1.0000	DISCARD	gen=599 glyphs=4
2026-03-14T02:31:26.151441	37f4017b	116	29	1.0000	DISCARD	gen=555 glyphs=4
2026-03-14T02:31:26.420656	cda69ae1	116	29	0.9500	DISCARD	gen=599 glyphs=4
2026-03-14T02:31:28.899671	37f4017b	116	29	1.0000	DISCARD	gen=555 glyphs=4
2026-03-14T02:31:29.166340	dc63d637	120	30	1.0000	DISCARD	gen=599 glyphs=4
2026-03-14T02:31:31.629288	7ca87b42	116	29	1.0000	DISCARD	gen=555 glyphs=4
2026-03-14T02:31:31.904402	1e5f0e21	116	29	1.0000	DISCARD	gen=599 glyphs=4
2026-03-14T02:31:34.366758	37861cb1	120	30	1.0000	DISCARD	gen=555 glyphs=4
2026-03-14T02:31:34.641440	19355583	120	30	1.0000	DISCARD	gen=599 glyphs=4
2026-03-14T02:31:37.097736	37f4017b	116	29	1.0000	DISCARD	gen=556 glyphs=4
2026-03-14T02:31:37.371934	b7aed8e9	116	29	1.0000	DISCARD	gen=599 glyphs=4
2026-03-14T02:31:39.834124	bfdf7cad	120	30	1.0000	DISCARD	gen=556 glyphs=4
2026-03-14T02:31:40.112917	19355583	120	30	1.0000	DISCARD	gen=600 glyphs=4
2026-03-14T02:31:42.569442	760997f5	116	29	1.0000	DISCARD	gen=556 glyphs=4
2026-03-14T02:31:42.835454	8aef8872	116	29	1.0000	DISCARD	gen=600 glyphs=4
2026-03-14T02:31:45.288177	55d6c151	120	30	1.0000	DISCARD	gen=556 glyphs=4
2026-03-14T02:31:45.568535	9e34ede0	116	29	1.0000	DISCARD	gen=600 glyphs=4
2026-03-14T02:31:48.105544	37f4017b	116	29	1.0000	DISCARD	gen=556 glyphs=4
2026-03-14T02:31:48.383079	5ee7c832	116	29	1.0000	DISCARD	gen=600 glyphs=4
2026-03-14T02:31:50.858252	7ca87b42	116	29	1.0000	DISCARD	gen=556 glyphs=4
2026-03-14T02:31:51.131171	44c62abb	116	29	1.0000	DISCARD	gen=600 glyphs=4
2026-03-14T02:31:53.643192	e3c5c44c	120	30	1.0000	DISCARD	gen=556 glyphs=4
2026-03-14T02:31:53.925285	e2cd28ea	120	30	1.0000	DISCARD	gen=600 glyphs=4
2026-03-14T02:31:56.377177	900aa951	116	29	1.0000	DISCARD	gen=556 glyphs=4
2026-03-14T02:31:56.651903	875e0f8a	116	29	1.0000	DISCARD	gen=600 glyphs=4
2026-03-14T02:31:59.098529	8ddbd1a1	116	29	1.0000	DISCARD	gen=556 glyphs=4
2026-03-14T02:31:59.382433	5de43ce9	120	30	1.0000	DISCARD	gen=600 glyphs=4
2026-03-14T02:32:01.854275	fdb5d108	120	30	1.0000	DISCARD	gen=556 glyphs=4
2026-03-14T02:32:02.132299	1b959e31	116	29	1.0000	DISCARD	gen=600 glyphs=4
2026-03-14T02:32:04.606029	37f4017b	116	29	1.0000	DISCARD	gen=557 glyphs=4
2026-03-14T02:32:04.866735	0eaedb57	116	29	1.0000	DISCARD	gen=600 glyphs=4
2026-03-14T02:32:07.358576	bfdf7cad	120	30	1.0000	DISCARD	gen=557 glyphs=4
2026-03-14T02:32:07.626527	19355583	120	30	1.0000	DISCARD	gen=601 glyphs=4
2026-03-14T02:32:10.102859	37f4017b	116	29	1.0000	DISCARD	gen=557 glyphs=4
2026-03-14T02:32:10.377363	8aef8872	116	29	1.0000	DISCARD	gen=601 glyphs=4
2026-03-14T02:32:12.834280	37f4017b	116	29	1.0000	DISCARD	gen=557 glyphs=4
2026-03-14T02:32:13.115677	19355583	120	30	1.0000	DISCARD	gen=601 glyphs=4
2026-03-14T02:32:15.586599	bc3ab5a8	116	29	1.0000	DISCARD	gen=557 glyphs=4
2026-03-14T02:32:15.854562	87e90be6	116	29	1.0000	DISCARD	gen=601 glyphs=4
2026-03-14T02:32:18.334903	5a06ca32	120	30	1.0000	DISCARD	gen=557 glyphs=4
2026-03-14T02:32:18.614434	19355583	120	30	1.0000	DISCARD	gen=601 glyphs=4
2026-03-14T02:32:21.175991	7ca87b42	116	29	1.0000	DISCARD	gen=557 glyphs=4
2026-03-14T02:32:21.443487	0eaedb57	116	29	1.0000	DISCARD	gen=601 glyphs=4
2026-03-14T02:32:23.941221	9d930436	116	29	0.9500	DISCARD	gen=557 glyphs=4
2026-03-14T02:32:24.216116	0027133c	116	29	1.0000	DISCARD	gen=601 glyphs=4
2026-03-14T02:32:26.757632	5a06ca32	120	30	1.0000	DISCARD	gen=557 glyphs=4
2026-03-14T02:32:27.030883	0eaedb57	116	29	1.0000	DISCARD	gen=601 glyphs=4
2026-03-14T02:32:29.514119	37f4017b	116	29	1.0000	DISCARD	gen=557 glyphs=4
2026-03-14T02:32:29.788330	72990966	116	29	1.0000	DISCARD	gen=601 glyphs=4
2026-03-14T02:32:32.255971	37f4017b	116	29	1.0000	DISCARD	gen=558 glyphs=4
2026-03-14T02:32:32.521499	0eaedb57	116	29	1.0000	DISCARD	gen=601 glyphs=4
2026-03-14T02:32:34.975214	bfdf7cad	120	30	1.0000	DISCARD	gen=558 glyphs=4
2026-03-14T02:32:35.244482	19355583	120	30	1.0000	DISCARD	gen=602 glyphs=4
2026-03-14T02:32:37.738575	bfdf7cad	120	30	1.0000	DISCARD	gen=558 glyphs=4
2026-03-14T02:32:38.004045	8aef8872	116	29	1.0000	DISCARD	gen=602 glyphs=4
2026-03-14T02:32:40.466269	599d3e51	116	29	1.0000	DISCARD	gen=558 glyphs=4
2026-03-14T02:32:40.730779	a2815ac9	116	29	1.0000	DISCARD	gen=602 glyphs=4
2026-03-14T02:32:43.235190	55d6c151	120	30	1.0000	DISCARD	gen=558 glyphs=4
2026-03-14T02:32:43.517333	d63ceb59	120	30	1.0000	DISCARD	gen=602 glyphs=4
2026-03-14T02:32:45.986596	1d34459a	116	29	1.0000	DISCARD	gen=558 glyphs=4
2026-03-14T02:32:46.256149	b7aed8e9	116	29	1.0000	DISCARD	gen=602 glyphs=4
2026-03-14T02:32:48.777929	9ff6c0fb	116	29	1.0000	DISCARD	gen=558 glyphs=4
2026-03-14T02:32:49.049734	83def9f1	116	29	1.0000	DISCARD	gen=602 glyphs=4
2026-03-14T02:32:51.589624	2701cb73	116	29	1.0000	DISCARD	gen=558 glyphs=4
2026-03-14T02:32:51.858687	875e0f8a	116	29	1.0000	DISCARD	gen=602 glyphs=4
2026-03-14T02:32:54.340168	12b38c2d	116	29	1.0000	DISCARD	gen=558 glyphs=4
2026-03-14T02:32:54.637874	e2a55b29	124	31	0.9500	DISCARD	gen=602 glyphs=4
2026-03-14T02:32:57.105282	55d6c151	120	30	1.0000	DISCARD	gen=558 glyphs=4
2026-03-14T02:32:57.371472	8aef8872	116	29	1.0000	DISCARD	gen=602 glyphs=4
2026-03-14T02:32:59.843871	37f4017b	116	29	1.0000	DISCARD	gen=559 glyphs=4
2026-03-14T02:33:00.114275	bb1503ee	120	30	0.9500	DISCARD	gen=602 glyphs=4
2026-03-14T02:33:02.589159	bfdf7cad	120	30	1.0000	DISCARD	gen=559 glyphs=4
2026-03-14T02:33:02.865131	19355583	120	30	1.0000	DISCARD	gen=603 glyphs=4
2026-03-14T02:33:05.347311	d0815b8c	124	31	0.9500	DISCARD	gen=559 glyphs=4
2026-03-14T02:33:05.619663	8aef8872	116	29	1.0000	DISCARD	gen=603 glyphs=4
2026-03-14T02:33:08.063726	be1290c3	124	31	0.9500	DISCARD	gen=559 glyphs=4
2026-03-14T02:33:08.349992	050862ad	120	30	1.0000	DISCARD	gen=603 glyphs=4
2026-03-14T02:33:10.859975	37f4017b	116	29	1.0000	DISCARD	gen=559 glyphs=4
2026-03-14T02:33:11.130662	ba9f07bf	116	29	1.0000	DISCARD	gen=603 glyphs=4
2026-03-14T02:33:13.587202	b4807259	116	29	1.0000	DISCARD	gen=559 glyphs=4
2026-03-14T02:33:13.856062	eca7ab6c	116	29	1.0000	DISCARD	gen=603 glyphs=4
2026-03-14T02:33:16.321690	738853a0	120	30	1.0000	DISCARD	gen=559 glyphs=4
2026-03-14T02:33:16.588535	8aef8872	116	29	1.0000	DISCARD	gen=603 glyphs=4
2026-03-14T02:33:19.054958	e604142f	120	30	1.0000	DISCARD	gen=559 glyphs=4
2026-03-14T02:33:19.342452	e8b1b0c2	116	29	1.0000	DISCARD	gen=603 glyphs=4
2026-03-14T02:33:21.828947	fdb5d108	120	30	1.0000	DISCARD	gen=559 glyphs=4
2026-03-14T02:33:22.107853	9e34ede0	116	29	1.0000	DISCARD	gen=603 glyphs=4
2026-03-14T02:33:24.663544	b0ce20bc	120	30	1.0000	DISCARD	gen=559 glyphs=4
2026-03-14T02:33:24.934290	875e0f8a	116	29	1.0000	DISCARD	gen=603 glyphs=4
2026-03-14T02:33:27.443405	37f4017b	116	29	1.0000	DISCARD	gen=560 glyphs=4
2026-03-14T02:33:27.720581	8aef8872	116	29	1.0000	DISCARD	gen=603 glyphs=4
2026-03-14T02:33:30.215211	bfdf7cad	120	30	1.0000	DISCARD	gen=560 glyphs=4
2026-03-14T02:33:30.489089	19355583	120	30	1.0000	DISCARD	gen=604 glyphs=4
2026-03-14T02:33:32.960562	37f4017b	116	29	1.0000	DISCARD	gen=560 glyphs=4
2026-03-14T02:33:33.229419	8aef8872	116	29	1.0000	DISCARD	gen=604 glyphs=4
2026-03-14T02:33:35.687472	55d6c151	120	30	1.0000	DISCARD	gen=560 glyphs=4
2026-03-14T02:33:35.961031	a78f9454	120	30	1.0000	DISCARD	gen=604 glyphs=4
2026-03-14T02:33:38.400785	5a06ca32	120	30	1.0000	DISCARD	gen=560 glyphs=4
2026-03-14T02:33:38.670189	0eaedb57	116	29	1.0000	DISCARD	gen=604 glyphs=4
2026-03-14T02:33:41.137775	81e358ce	116	29	1.0000	DISCARD	gen=560 glyphs=4
2026-03-14T02:33:41.390368	e7bbb2ee	116	29	0.9500	DISCARD	gen=604 glyphs=4
2026-03-14T02:33:43.863599	37f4017b	116	29	1.0000	DISCARD	gen=560 glyphs=4
2026-03-14T02:33:44.146376	6c3f78fb	116	29	0.9500	DISCARD	gen=604 glyphs=4
2026-03-14T02:33:46.612370	37f4017b	116	29	1.0000	DISCARD	gen=560 glyphs=4
2026-03-14T02:33:46.901148	af9198f8	116	29	1.0000	DISCARD	gen=604 glyphs=4
2026-03-14T02:33:49.378107	37f4017b	116	29	1.0000	DISCARD	gen=560 glyphs=4
2026-03-14T02:33:49.648552	9e34ede0	116	29	1.0000	DISCARD	gen=604 glyphs=4
2026-03-14T02:33:52.086653	55d6c151	120	30	1.0000	DISCARD	gen=560 glyphs=4
2026-03-14T02:33:52.358199	8814a207	116	29	0.9500	DISCARD	gen=604 glyphs=4
2026-03-14T02:33:54.907767	37f4017b	116	29	1.0000	DISCARD	gen=561 glyphs=4
2026-03-14T02:33:55.188797	74a9e52e	116	29	1.0000	DISCARD	gen=604 glyphs=4
2026-03-14T02:33:57.673830	bfdf7cad	120	30	1.0000	DISCARD	gen=561 glyphs=4
2026-03-14T02:33:57.935441	19355583	120	30	1.0000	DISCARD	gen=605 glyphs=4
2026-03-14T02:34:00.422501	7ca87b42	116	29	1.0000	DISCARD	gen=561 glyphs=4
2026-03-14T02:34:00.695097	8aef8872	116	29	1.0000	DISCARD	gen=605 glyphs=4
2026-03-14T02:34:03.164880	5a06ca32	120	30	1.0000	DISCARD	gen=561 glyphs=4
2026-03-14T02:34:03.440883	e8c7f6cf	120	30	1.0000	DISCARD	gen=605 glyphs=4
2026-03-14T02:34:05.912474	2701cb73	116	29	1.0000	DISCARD	gen=561 glyphs=4
2026-03-14T02:34:06.185935	8aef8872	116	29	1.0000	DISCARD	gen=605 glyphs=4
2026-03-14T02:34:08.650213	d11c1062	120	30	1.0000	DISCARD	gen=561 glyphs=4
2026-03-14T02:34:08.935057	d7c8681b	120	30	1.0000	DISCARD	gen=605 glyphs=4
2026-03-14T02:34:11.410179	88cbbb14	120	30	1.0000	DISCARD	gen=561 glyphs=4
2026-03-14T02:34:11.673494	8aef8872	116	29	1.0000	DISCARD	gen=605 glyphs=4
2026-03-14T02:34:14.128626	71e2ba66	116	29	1.0000	DISCARD	gen=561 glyphs=4
2026-03-14T02:34:14.400530	a9243d99	120	30	0.9000	DISCARD	gen=605 glyphs=4
2026-03-14T02:34:16.846101	12b38c2d	116	29	1.0000	DISCARD	gen=561 glyphs=4
2026-03-14T02:34:17.118440	ae44ace5	116	29	1.0000	DISCARD	gen=605 glyphs=4
2026-03-14T02:34:19.576363	bfdf7cad	120	30	1.0000	DISCARD	gen=561 glyphs=4
2026-03-14T02:34:19.842272	67cb81be	120	30	1.0000	DISCARD	gen=605 glyphs=4
2026-03-14T02:34:22.320097	37f4017b	116	29	1.0000	DISCARD	gen=562 glyphs=4
2026-03-14T02:34:22.596034	4ae36c11	120	30	1.0000	DISCARD	gen=605 glyphs=4
2026-03-14T02:34:25.078122	bfdf7cad	120	30	1.0000	DISCARD	gen=562 glyphs=4
2026-03-14T02:34:25.352957	19355583	120	30	1.0000	DISCARD	gen=606 glyphs=4
2026-03-14T02:34:27.939039	bfdf7cad	120	30	1.0000	DISCARD	gen=562 glyphs=4
2026-03-14T02:34:28.205569	8aef8872	116	29	1.0000	DISCARD	gen=606 glyphs=4
2026-03-14T02:34:30.663459	5a06ca32	120	30	1.0000	DISCARD	gen=562 glyphs=4
2026-03-14T02:34:30.944595	0eaedb57	116	29	1.0000	DISCARD	gen=606 glyphs=4
2026-03-14T02:34:33.406714	37f4017b	116	29	1.0000	DISCARD	gen=562 glyphs=4
2026-03-14T02:34:33.670383	050862ad	120	30	1.0000	DISCARD	gen=606 glyphs=4
2026-03-14T02:34:36.146756	37f4017b	116	29	1.0000	DISCARD	gen=562 glyphs=4
2026-03-14T02:34:36.430727	297d1877	116	29	1.0000	DISCARD	gen=606 glyphs=4
2026-03-14T02:34:38.882314	37f4017b	116	29	1.0000	DISCARD	gen=562 glyphs=4
2026-03-14T02:34:39.148182	7046a67d	116	29	1.0000	DISCARD	gen=606 glyphs=4
2026-03-14T02:34:41.603700	ca0546c6	116	29	1.0000	DISCARD	gen=562 glyphs=4
2026-03-14T02:34:41.868168	050862ad	120	30	1.0000	DISCARD	gen=606 glyphs=4
2026-03-14T02:34:44.310245	4c9b0dd4	120	30	1.0000	DISCARD	gen=562 glyphs=4
2026-03-14T02:34:44.575723	050862ad	120	30	1.0000	DISCARD	gen=606 glyphs=4
2026-03-14T02:34:47.008155	95bfe81e	116	29	1.0000	DISCARD	gen=562 glyphs=4
2026-03-14T02:34:47.281642	eca7ab6c	116	29	1.0000	DISCARD	gen=606 glyphs=4
2026-03-14T02:34:49.753787	37f4017b	116	29	1.0000	DISCARD	gen=563 glyphs=4
2026-03-14T02:34:50.029039	8aef8872	116	29	1.0000	DISCARD	gen=606 glyphs=4
2026-03-14T02:34:52.534084	bfdf7cad	120	30	1.0000	DISCARD	gen=563 glyphs=4
2026-03-14T02:34:52.793067	19355583	120	30	1.0000	DISCARD	gen=607 glyphs=4
2026-03-14T02:34:55.246029	6c8f2f62	116	29	1.0000	DISCARD	gen=563 glyphs=4
2026-03-14T02:34:55.528595	8aef8872	116	29	1.0000	DISCARD	gen=607 glyphs=4
2026-03-14T02:34:58.038748	5a06ca32	120	30	1.0000	DISCARD	gen=563 glyphs=4
2026-03-14T02:34:58.336571	ae44ace5	116	29	1.0000	DISCARD	gen=607 glyphs=4
2026-03-14T02:35:00.846750	d606d6d4	116	29	1.0000	DISCARD	gen=563 glyphs=4
2026-03-14T02:35:01.128411	8aef8872	116	29	1.0000	DISCARD	gen=607 glyphs=4
