timestamp	program_hash	spirv_size	word_count	fitness	status	description
2026-03-14T07:36:44.831564	1df31570	0	0	0.0000	CRASH	gen=388 glyphs=3
2026-03-14T07:36:44.831764	cf93b656	0	0	0.0000	CRASH	gen=388 glyphs=3
2026-03-14T07:36:44.831962	2feea5d8	0	0	0.0000	CRASH	gen=388 glyphs=3
2026-03-14T07:36:44.832154	3ca14993	0	0	0.0000	CRASH	gen=388 glyphs=4
2026-03-14T07:36:44.832432	099964a4	0	0	0.0000	CRASH	gen=389 glyphs=4
2026-03-14T07:36:44.832631	099964a4	0	0	0.0000	CRASH	gen=389 glyphs=4
2026-03-14T07:36:44.832828	099964a4	0	0	0.0000	CRASH	gen=389 glyphs=4
2026-03-14T07:36:44.833024	ff30496a	0	0	0.0000	CRASH	gen=389 glyphs=3
2026-03-14T07:36:44.833219	099964a4	0	0	0.0000	CRASH	gen=389 glyphs=4
2026-03-14T07:36:44.833412	d9aa9609	0	0	0.0000	CRASH	gen=389 glyphs=3
2026-03-14T07:36:44.833610	dcb1fb50	0	0	0.0000	CRASH	gen=389 glyphs=4
2026-03-14T07:36:44.833805	099964a4	0	0	0.0000	CRASH	gen=389 glyphs=4
2026-03-14T07:36:44.834003	099964a4	0	0	0.0000	CRASH	gen=389 glyphs=4
2026-03-14T07:36:44.834201	099964a4	0	0	0.0000	CRASH	gen=389 glyphs=4
2026-03-14T07:36:44.834470	099964a4	0	0	0.0000	CRASH	gen=390 glyphs=4
2026-03-14T07:36:44.834668	099964a4	0	0	0.0000	CRASH	gen=390 glyphs=4
2026-03-14T07:36:44.834863	099964a4	0	0	0.0000	CRASH	gen=390 glyphs=4
2026-03-14T07:36:44.835060	ca3c2d03	0	0	0.0000	CRASH	gen=390 glyphs=3
2026-03-14T07:36:44.835259	099964a4	0	0	0.0000	CRASH	gen=390 glyphs=4
2026-03-14T07:36:44.835453	099964a4	0	0	0.0000	CRASH	gen=390 glyphs=4
2026-03-14T07:36:44.835653	cf93b656	0	0	0.0000	CRASH	gen=390 glyphs=3
2026-03-14T07:36:44.835848	85d1a967	0	0	0.0000	CRASH	gen=390 glyphs=3
2026-03-14T07:36:44.836042	099964a4	0	0	0.0000	CRASH	gen=390 glyphs=4
2026-03-14T07:36:44.836241	1c1546e7	0	0	0.0000	CRASH	gen=390 glyphs=5
2026-03-14T07:36:44.836527	099964a4	0	0	0.0000	CRASH	gen=391 glyphs=4
2026-03-14T07:36:44.836723	099964a4	0	0	0.0000	CRASH	gen=391 glyphs=4
2026-03-14T07:36:44.836920	099964a4	0	0	0.0000	CRASH	gen=391 glyphs=4
2026-03-14T07:36:44.837113	099964a4	0	0	0.0000	CRASH	gen=391 glyphs=4
2026-03-14T07:36:44.837310	e18ae4e6	0	0	0.0000	CRASH	gen=391 glyphs=4
2026-03-14T07:36:44.837506	099964a4	0	0	0.0000	CRASH	gen=391 glyphs=4
2026-03-14T07:36:44.837702	93310c30	0	0	0.0000	CRASH	gen=391 glyphs=4
2026-03-14T07:36:44.837898	099964a4	0	0	0.0000	CRASH	gen=391 glyphs=4
2026-03-14T07:36:44.838093	099964a4	0	0	0.0000	CRASH	gen=391 glyphs=4
2026-03-14T07:36:44.838286	533037d3	0	0	0.0000	CRASH	gen=391 glyphs=3
2026-03-14T07:36:44.838571	099964a4	0	0	0.0000	CRASH	gen=392 glyphs=4
2026-03-14T07:36:44.838768	099964a4	0	0	0.0000	CRASH	gen=392 glyphs=4
2026-03-14T07:36:44.838962	ad106884	0	0	0.0000	CRASH	gen=392 glyphs=4
2026-03-14T07:36:44.839156	099964a4	0	0	0.0000	CRASH	gen=392 glyphs=4
2026-03-14T07:36:44.839348	8f102e8e	0	0	0.0000	CRASH	gen=392 glyphs=5
2026-03-14T07:36:44.839548	8da1f8d8	0	0	0.0000	CRASH	gen=392 glyphs=4
2026-03-14T07:36:44.839741	06af5730	0	0	0.0000	CRASH	gen=392 glyphs=2
2026-03-14T07:36:44.839935	099964a4	0	0	0.0000	CRASH	gen=392 glyphs=4
2026-03-14T07:36:44.840134	099964a4	0	0	0.0000	CRASH	gen=392 glyphs=4
2026-03-14T07:36:44.840327	099964a4	0	0	0.0000	CRASH	gen=392 glyphs=4
2026-03-14T07:36:44.840606	099964a4	0	0	0.0000	CRASH	gen=393 glyphs=4
2026-03-14T07:36:44.840806	099964a4	0	0	0.0000	CRASH	gen=393 glyphs=4
2026-03-14T07:36:44.841002	099964a4	0	0	0.0000	CRASH	gen=393 glyphs=4
2026-03-14T07:36:44.841194	099964a4	0	0	0.0000	CRASH	gen=393 glyphs=4
2026-03-14T07:36:44.841386	ad467e57	0	0	0.0000	CRASH	gen=393 glyphs=4
2026-03-14T07:36:44.841589	099964a4	0	0	0.0000	CRASH	gen=393 glyphs=4
2026-03-14T07:36:44.841783	dcb1fb50	0	0	0.0000	CRASH	gen=393 glyphs=4
2026-03-14T07:36:44.841979	80cef82b	0	0	0.0000	CRASH	gen=393 glyphs=4
2026-03-14T07:36:44.842177	e62e0251	0	0	0.0000	CRASH	gen=393 glyphs=3
2026-03-14T07:36:44.842372	dcb1fb50	0	0	0.0000	CRASH	gen=393 glyphs=4
2026-03-14T07:36:44.842647	099964a4	0	0	0.0000	CRASH	gen=394 glyphs=4
2026-03-14T07:36:44.842844	099964a4	0	0	0.0000	CRASH	gen=394 glyphs=4
2026-03-14T07:36:44.843036	dcb1fb50	0	0	0.0000	CRASH	gen=394 glyphs=4
2026-03-14T07:36:44.843232	099964a4	0	0	0.0000	CRASH	gen=394 glyphs=4
2026-03-14T07:36:44.843426	8da1f8d8	0	0	0.0000	CRASH	gen=394 glyphs=4
2026-03-14T07:36:44.843629	099964a4	0	0	0.0000	CRASH	gen=394 glyphs=4
2026-03-14T07:36:44.843823	099964a4	0	0	0.0000	CRASH	gen=394 glyphs=4
2026-03-14T07:36:44.844016	a3edcb05	0	0	0.0000	CRASH	gen=394 glyphs=3
2026-03-14T07:36:44.844212	80cef82b	0	0	0.0000	CRASH	gen=394 glyphs=4
2026-03-14T07:36:44.844408	8da1f8d8	0	0	0.0000	CRASH	gen=394 glyphs=4
2026-03-14T07:36:44.844691	099964a4	0	0	0.0000	CRASH	gen=395 glyphs=4
2026-03-14T07:36:44.844887	099964a4	0	0	0.0000	CRASH	gen=395 glyphs=4
2026-03-14T07:36:44.845084	80cef82b	0	0	0.0000	CRASH	gen=395 glyphs=4
2026-03-14T07:36:44.845280	7ede4765	0	0	0.0000	CRASH	gen=395 glyphs=2
2026-03-14T07:36:44.845473	099964a4	0	0	0.0000	CRASH	gen=395 glyphs=4
2026-03-14T07:36:44.845687	280eb47a	0	0	0.0000	CRASH	gen=395 glyphs=3
2026-03-14T07:36:44.845888	c13f0c80	0	0	0.0000	CRASH	gen=395 glyphs=1
2026-03-14T07:36:44.846081	bbb8a63f	0	0	0.0000	CRASH	gen=395 glyphs=1
2026-03-14T07:36:44.846275	a61e2bb0	0	0	0.0000	CRASH	gen=395 glyphs=4
2026-03-14T07:36:44.846467	92e243ea	0	0	0.0000	CRASH	gen=395 glyphs=3
2026-03-14T07:36:44.846743	099964a4	0	0	0.0000	CRASH	gen=396 glyphs=4
2026-03-14T07:36:44.846943	099964a4	0	0	0.0000	CRASH	gen=396 glyphs=4
2026-03-14T07:36:44.847139	099964a4	0	0	0.0000	CRASH	gen=396 glyphs=4
2026-03-14T07:36:44.847333	a8553258	0	0	0.0000	CRASH	gen=396 glyphs=5
2026-03-14T07:36:44.847533	3a734398	0	0	0.0000	CRASH	gen=396 glyphs=4
2026-03-14T07:36:44.847727	099964a4	0	0	0.0000	CRASH	gen=396 glyphs=4
2026-03-14T07:36:44.847925	cf93b656	0	0	0.0000	CRASH	gen=396 glyphs=3
2026-03-14T07:36:44.848120	099964a4	0	0	0.0000	CRASH	gen=396 glyphs=4
2026-03-14T07:36:44.848314	c893fe76	0	0	0.0000	CRASH	gen=396 glyphs=4
2026-03-14T07:36:44.848507	f6df5812	0	0	0.0000	CRASH	gen=396 glyphs=4
2026-03-14T07:36:44.848772	099964a4	0	0	0.0000	CRASH	gen=397 glyphs=4
2026-03-14T07:36:44.848972	099964a4	0	0	0.0000	CRASH	gen=397 glyphs=4
2026-03-14T07:36:44.849166	099964a4	0	0	0.0000	CRASH	gen=397 glyphs=4
2026-03-14T07:36:44.849362	099964a4	0	0	0.0000	CRASH	gen=397 glyphs=4
2026-03-14T07:36:44.849559	cf93b656	0	0	0.0000	CRASH	gen=397 glyphs=3
2026-03-14T07:36:44.849753	099964a4	0	0	0.0000	CRASH	gen=397 glyphs=4
2026-03-14T07:36:44.849945	7ede4765	0	0	0.0000	CRASH	gen=397 glyphs=2
2026-03-14T07:36:44.850142	7ede4765	0	0	0.0000	CRASH	gen=397 glyphs=2
2026-03-14T07:36:44.850337	75bc295b	0	0	0.0000	CRASH	gen=397 glyphs=4
2026-03-14T07:36:44.850533	099964a4	0	0	0.0000	CRASH	gen=397 glyphs=4
2026-03-14T07:36:44.850809	099964a4	0	0	0.0000	CRASH	gen=398 glyphs=4
2026-03-14T07:36:44.851003	099964a4	0	0	0.0000	CRASH	gen=398 glyphs=4
2026-03-14T07:36:44.851199	9edec599	0	0	0.0000	CRASH	gen=398 glyphs=4
2026-03-14T07:36:44.851394	099964a4	0	0	0.0000	CRASH	gen=398 glyphs=4
2026-03-14T07:36:44.851591	af1f178d	0	0	0.0000	CRASH	gen=398 glyphs=4
2026-03-14T07:36:44.851785	099964a4	0	0	0.0000	CRASH	gen=398 glyphs=4
2026-03-14T07:36:44.851976	dcb1fb50	0	0	0.0000	CRASH	gen=398 glyphs=4
2026-03-14T07:36:44.852171	4a3cd308	0	0	0.0000	CRASH	gen=398 glyphs=3
2026-03-14T07:36:44.852364	099964a4	0	0	0.0000	CRASH	gen=398 glyphs=4
2026-03-14T07:36:44.852562	099964a4	0	0	0.0000	CRASH	gen=398 glyphs=4
2026-03-14T07:36:44.852837	099964a4	0	0	0.0000	CRASH	gen=399 glyphs=4
2026-03-14T07:36:44.853034	099964a4	0	0	0.0000	CRASH	gen=399 glyphs=4
2026-03-14T07:36:44.853228	dcb1fb50	0	0	0.0000	CRASH	gen=399 glyphs=4
2026-03-14T07:36:44.853423	ab8bdc1f	0	0	0.0000	CRASH	gen=399 glyphs=3
2026-03-14T07:36:44.853617	099964a4	0	0	0.0000	CRASH	gen=399 glyphs=4
2026-03-14T07:36:44.853808	099964a4	0	0	0.0000	CRASH	gen=399 glyphs=4
2026-03-14T07:36:44.853999	09f485fe	0	0	0.0000	CRASH	gen=399 glyphs=4
2026-03-14T07:36:44.854192	914e4295	0	0	0.0000	CRASH	gen=399 glyphs=3
2026-03-14T07:36:44.854393	099964a4	0	0	0.0000	CRASH	gen=399 glyphs=4
2026-03-14T07:36:44.854589	099964a4	0	0	0.0000	CRASH	gen=399 glyphs=4
2026-03-14T07:36:44.854858	099964a4	0	0	0.0000	CRASH	gen=400 glyphs=4
2026-03-14T07:36:44.855055	099964a4	0	0	0.0000	CRASH	gen=400 glyphs=4
2026-03-14T07:36:44.855249	099964a4	0	0	0.0000	CRASH	gen=400 glyphs=4
2026-03-14T07:36:44.855448	099964a4	0	0	0.0000	CRASH	gen=400 glyphs=4
2026-03-14T07:36:44.855647	3a734398	0	0	0.0000	CRASH	gen=400 glyphs=4
2026-03-14T07:36:44.855840	1abd221b	0	0	0.0000	CRASH	gen=400 glyphs=4
2026-03-14T07:36:44.856033	099964a4	0	0	0.0000	CRASH	gen=400 glyphs=4
2026-03-14T07:36:44.856226	099964a4	0	0	0.0000	CRASH	gen=400 glyphs=4
2026-03-14T07:36:44.856420	80cef82b	0	0	0.0000	CRASH	gen=400 glyphs=4
2026-03-14T07:36:44.856628	099964a4	0	0	0.0000	CRASH	gen=400 glyphs=4
2026-03-14T07:36:44.856909	099964a4	0	0	0.0000	CRASH	gen=401 glyphs=4
2026-03-14T07:36:44.857107	099964a4	0	0	0.0000	CRASH	gen=401 glyphs=4
2026-03-14T07:36:44.857302	0a216bf5	0	0	0.0000	CRASH	gen=401 glyphs=2
2026-03-14T07:36:44.857493	9a0c1f2f	0	0	0.0000	CRASH	gen=401 glyphs=4
2026-03-14T07:36:44.857698	7ede4765	0	0	0.0000	CRASH	gen=401 glyphs=2
2026-03-14T07:36:44.857891	7ede4765	0	0	0.0000	CRASH	gen=401 glyphs=2
2026-03-14T07:36:44.858082	ff30496a	0	0	0.0000	CRASH	gen=401 glyphs=3
2026-03-14T07:36:44.858275	099964a4	0	0	0.0000	CRASH	gen=401 glyphs=4
2026-03-14T07:36:44.858470	05545fcb	0	0	0.0000	CRASH	gen=401 glyphs=3
2026-03-14T07:36:44.858689	3ca14993	0	0	0.0000	CRASH	gen=401 glyphs=4
2026-03-14T07:36:44.858976	099964a4	0	0	0.0000	CRASH	gen=402 glyphs=4
2026-03-14T07:36:44.859175	099964a4	0	0	0.0000	CRASH	gen=402 glyphs=4
2026-03-14T07:36:44.859373	d405400a	0	0	0.0000	CRASH	gen=402 glyphs=4
2026-03-14T07:36:44.859573	7ede4765	0	0	0.0000	CRASH	gen=402 glyphs=2
2026-03-14T07:36:44.859772	7ede4765	0	0	0.0000	CRASH	gen=402 glyphs=2
2026-03-14T07:36:44.859971	3ca14993	0	0	0.0000	CRASH	gen=402 glyphs=4
2026-03-14T07:36:44.860170	099964a4	0	0	0.0000	CRASH	gen=402 glyphs=4
2026-03-14T07:36:44.860367	80cef82b	0	0	0.0000	CRASH	gen=402 glyphs=4
2026-03-14T07:36:44.860572	099964a4	0	0	0.0000	CRASH	gen=402 glyphs=4
2026-03-14T07:36:44.860769	3a734398	0	0	0.0000	CRASH	gen=402 glyphs=4
2026-03-14T07:36:44.861050	099964a4	0	0	0.0000	CRASH	gen=403 glyphs=4
2026-03-14T07:36:44.861245	099964a4	0	0	0.0000	CRASH	gen=403 glyphs=4
2026-03-14T07:36:44.861439	565ca488	0	0	0.0000	CRASH	gen=403 glyphs=2
2026-03-14T07:36:44.861634	7003f5c2	0	0	0.0000	CRASH	gen=403 glyphs=2
2026-03-14T07:36:44.861829	dcb1fb50	0	0	0.0000	CRASH	gen=403 glyphs=4
2026-03-14T07:36:44.862028	099964a4	0	0	0.0000	CRASH	gen=403 glyphs=4
2026-03-14T07:36:44.862220	1a381f07	0	0	0.0000	CRASH	gen=403 glyphs=4
2026-03-14T07:36:44.862412	5a70dc6f	0	0	0.0000	CRASH	gen=403 glyphs=4
2026-03-14T07:36:44.862620	099964a4	0	0	0.0000	CRASH	gen=403 glyphs=4
2026-03-14T07:36:44.862815	1db30ae4	0	0	0.0000	CRASH	gen=403 glyphs=2
2026-03-14T07:36:44.863094	099964a4	0	0	0.0000	CRASH	gen=404 glyphs=4
2026-03-14T07:36:44.863292	099964a4	0	0	0.0000	CRASH	gen=404 glyphs=4
2026-03-14T07:36:44.863484	099964a4	0	0	0.0000	CRASH	gen=404 glyphs=4
2026-03-14T07:36:44.863683	443ed375	0	0	0.0000	CRASH	gen=404 glyphs=4
2026-03-14T07:36:44.863891	099964a4	0	0	0.0000	CRASH	gen=404 glyphs=4
2026-03-14T07:36:44.864096	099964a4	0	0	0.0000	CRASH	gen=404 glyphs=4
2026-03-14T07:36:44.864304	7ede4765	0	0	0.0000	CRASH	gen=404 glyphs=2
2026-03-14T07:36:44.864519	6c3287a1	0	0	0.0000	CRASH	gen=404 glyphs=4
2026-03-14T07:36:44.864721	2358b119	0	0	0.0000	CRASH	gen=404 glyphs=4
2026-03-14T07:36:44.864919	099964a4	0	0	0.0000	CRASH	gen=404 glyphs=4
2026-03-14T07:36:44.865210	099964a4	0	0	0.0000	CRASH	gen=405 glyphs=4
2026-03-14T07:36:44.865424	099964a4	0	0	0.0000	CRASH	gen=405 glyphs=4
2026-03-14T07:36:44.865640	b366cdcd	0	0	0.0000	CRASH	gen=405 glyphs=5
2026-03-14T07:36:44.865834	099964a4	0	0	0.0000	CRASH	gen=405 glyphs=4
2026-03-14T07:36:44.866027	aad6a970	0	0	0.0000	CRASH	gen=405 glyphs=3
2026-03-14T07:36:44.866220	099964a4	0	0	0.0000	CRASH	gen=405 glyphs=4
2026-03-14T07:36:44.866416	ed729e83	0	0	0.0000	CRASH	gen=405 glyphs=3
2026-03-14T07:36:44.866613	099964a4	0	0	0.0000	CRASH	gen=405 glyphs=4
2026-03-14T07:36:44.866806	ee6b9cce	0	0	0.0000	CRASH	gen=405 glyphs=5
2026-03-14T07:36:44.867000	80cef82b	0	0	0.0000	CRASH	gen=405 glyphs=4
2026-03-14T07:36:44.867276	099964a4	0	0	0.0000	CRASH	gen=406 glyphs=4
2026-03-14T07:36:44.867475	099964a4	0	0	0.0000	CRASH	gen=406 glyphs=4
2026-03-14T07:36:44.867673	d3e2d7b1	0	0	0.0000	CRASH	gen=406 glyphs=3
2026-03-14T07:36:44.867870	099964a4	0	0	0.0000	CRASH	gen=406 glyphs=4
2026-03-14T07:36:44.868062	80cef82b	0	0	0.0000	CRASH	gen=406 glyphs=4
2026-03-14T07:36:44.868257	099964a4	0	0	0.0000	CRASH	gen=406 glyphs=4
2026-03-14T07:36:44.868455	dcb1fb50	0	0	0.0000	CRASH	gen=406 glyphs=4
2026-03-14T07:36:44.868654	099964a4	0	0	0.0000	CRASH	gen=406 glyphs=4
2026-03-14T07:36:44.868855	dc7a3d91	0	0	0.0000	CRASH	gen=406 glyphs=3
2026-03-14T07:36:44.869051	099964a4	0	0	0.0000	CRASH	gen=406 glyphs=4
2026-03-14T07:36:44.869316	099964a4	0	0	0.0000	CRASH	gen=407 glyphs=4
2026-03-14T07:36:44.869515	099964a4	0	0	0.0000	CRASH	gen=407 glyphs=4
2026-03-14T07:36:44.869714	d073732f	0	0	0.0000	CRASH	gen=407 glyphs=4
2026-03-14T07:36:44.869914	326772f3	0	0	0.0000	CRASH	gen=407 glyphs=4
2026-03-14T07:36:44.870110	59196efa	0	0	0.0000	CRASH	gen=407 glyphs=3
2026-03-14T07:36:44.870307	099964a4	0	0	0.0000	CRASH	gen=407 glyphs=4
2026-03-14T07:36:44.870499	8da1f8d8	0	0	0.0000	CRASH	gen=407 glyphs=4
2026-03-14T07:36:44.870699	9ccee957	0	0	0.0000	CRASH	gen=407 glyphs=3
2026-03-14T07:36:44.870892	fd1e36da	0	0	0.0000	CRASH	gen=407 glyphs=3
2026-03-14T07:36:44.871085	3a734398	0	0	0.0000	CRASH	gen=407 glyphs=4
2026-03-14T07:36:44.871366	099964a4	0	0	0.0000	CRASH	gen=408 glyphs=4
2026-03-14T07:36:44.871569	099964a4	0	0	0.0000	CRASH	gen=408 glyphs=4
2026-03-14T07:36:44.871768	dcb1fb50	0	0	0.0000	CRASH	gen=408 glyphs=4
2026-03-14T07:36:44.871971	099964a4	0	0	0.0000	CRASH	gen=408 glyphs=4
2026-03-14T07:36:44.872165	9f12a11d	0	0	0.0000	CRASH	gen=408 glyphs=2
2026-03-14T07:36:44.872356	099964a4	0	0	0.0000	CRASH	gen=408 glyphs=4
2026-03-14T07:36:44.872552	099964a4	0	0	0.0000	CRASH	gen=408 glyphs=4
2026-03-14T07:36:44.872750	ff30496a	0	0	0.0000	CRASH	gen=408 glyphs=3
2026-03-14T07:36:44.872947	099964a4	0	0	0.0000	CRASH	gen=408 glyphs=4
2026-03-14T07:36:44.873143	282d7fd0	0	0	0.0000	CRASH	gen=408 glyphs=4
2026-03-14T07:36:44.873432	099964a4	0	0	0.0000	CRASH	gen=409 glyphs=4
2026-03-14T07:36:44.873638	099964a4	0	0	0.0000	CRASH	gen=409 glyphs=4
2026-03-14T07:36:44.873838	099964a4	0	0	0.0000	CRASH	gen=409 glyphs=4
2026-03-14T07:36:44.874034	099964a4	0	0	0.0000	CRASH	gen=409 glyphs=4
2026-03-14T07:36:44.874229	099964a4	0	0	0.0000	CRASH	gen=409 glyphs=4
2026-03-14T07:36:44.874421	8212e0af	0	0	0.0000	CRASH	gen=409 glyphs=3
2026-03-14T07:36:44.874620	0f35b2d0	0	0	0.0000	CRASH	gen=409 glyphs=4
2026-03-14T07:36:44.874820	254a3245	0	0	0.0000	CRASH	gen=409 glyphs=4
2026-03-14T07:36:44.875016	7ede4765	0	0	0.0000	CRASH	gen=409 glyphs=2
2026-03-14T07:36:44.875210	c7e36315	0	0	0.0000	CRASH	gen=409 glyphs=4
2026-03-14T07:36:44.875495	099964a4	0	0	0.0000	CRASH	gen=410 glyphs=4
2026-03-14T07:36:44.875695	099964a4	0	0	0.0000	CRASH	gen=410 glyphs=4
2026-03-14T07:36:44.875891	80cef82b	0	0	0.0000	CRASH	gen=410 glyphs=4
2026-03-14T07:36:44.876086	099964a4	0	0	0.0000	CRASH	gen=410 glyphs=4
2026-03-14T07:36:44.876278	099964a4	0	0	0.0000	CRASH	gen=410 glyphs=4
2026-03-14T07:36:44.876470	099964a4	0	0	0.0000	CRASH	gen=410 glyphs=4
2026-03-14T07:36:44.876664	ec1371d7	0	0	0.0000	CRASH	gen=410 glyphs=3
2026-03-14T07:36:44.876856	dcb1fb50	0	0	0.0000	CRASH	gen=410 glyphs=4
2026-03-14T07:36:44.877057	099964a4	0	0	0.0000	CRASH	gen=410 glyphs=4
2026-03-14T07:36:44.877251	cef2ac1a	0	0	0.0000	CRASH	gen=410 glyphs=4
2026-03-14T07:36:44.877547	099964a4	0	0	0.0000	CRASH	gen=411 glyphs=4
2026-03-14T07:36:44.877743	099964a4	0	0	0.0000	CRASH	gen=411 glyphs=4
2026-03-14T07:36:44.877937	db3328ba	0	0	0.0000	CRASH	gen=411 glyphs=4
2026-03-14T07:36:44.878136	099964a4	0	0	0.0000	CRASH	gen=411 glyphs=4
2026-03-14T07:36:44.878329	7ede4765	0	0	0.0000	CRASH	gen=411 glyphs=2
2026-03-14T07:36:44.878525	099964a4	0	0	0.0000	CRASH	gen=411 glyphs=4
2026-03-14T07:36:44.878720	dcb1fb50	0	0	0.0000	CRASH	gen=411 glyphs=4
2026-03-14T07:36:44.878921	b26c79ed	0	0	0.0000	CRASH	gen=411 glyphs=4
2026-03-14T07:36:44.879131	77ae5db3	0	0	0.0000	CRASH	gen=411 glyphs=1
2026-03-14T07:36:44.879323	8da1f8d8	0	0	0.0000	CRASH	gen=411 glyphs=4
2026-03-14T07:36:44.879613	099964a4	0	0	0.0000	CRASH	gen=412 glyphs=4
2026-03-14T07:36:44.879810	099964a4	0	0	0.0000	CRASH	gen=412 glyphs=4
2026-03-14T07:36:44.880004	e8e3d210	0	0	0.0000	CRASH	gen=412 glyphs=2
2026-03-14T07:36:44.880200	2a91075b	0	0	0.0000	CRASH	gen=412 glyphs=3
2026-03-14T07:36:44.880392	6eb102a0	0	0	0.0000	CRASH	gen=412 glyphs=3
2026-03-14T07:36:44.880590	099964a4	0	0	0.0000	CRASH	gen=412 glyphs=4
2026-03-14T07:36:44.880782	33d3e948	0	0	0.0000	CRASH	gen=412 glyphs=3
2026-03-14T07:36:44.880973	7ede4765	0	0	0.0000	CRASH	gen=412 glyphs=2
2026-03-14T07:36:44.881168	d6909720	0	0	0.0000	CRASH	gen=412 glyphs=4
2026-03-14T07:36:44.881367	099964a4	0	0	0.0000	CRASH	gen=412 glyphs=4
2026-03-14T07:36:44.881653	099964a4	0	0	0.0000	CRASH	gen=413 glyphs=4
2026-03-14T07:36:44.881852	099964a4	0	0	0.0000	CRASH	gen=413 glyphs=4
2026-03-14T07:36:44.882048	80cef82b	0	0	0.0000	CRASH	gen=413 glyphs=4
2026-03-14T07:36:44.882241	c2e9b15e	0	0	0.0000	CRASH	gen=413 glyphs=3
2026-03-14T07:36:44.882440	099964a4	0	0	0.0000	CRASH	gen=413 glyphs=4
2026-03-14T07:36:44.882635	099964a4	0	0	0.0000	CRASH	gen=413 glyphs=4
2026-03-14T07:36:44.882827	099964a4	0	0	0.0000	CRASH	gen=413 glyphs=4
2026-03-14T07:36:44.883019	ff30496a	0	0	0.0000	CRASH	gen=413 glyphs=3
2026-03-14T07:36:44.883212	3a734398	0	0	0.0000	CRASH	gen=413 glyphs=4
2026-03-14T07:36:44.883412	099964a4	0	0	0.0000	CRASH	gen=413 glyphs=4
2026-03-14T07:36:44.883681	099964a4	0	0	0.0000	CRASH	gen=414 glyphs=4
2026-03-14T07:36:44.883876	099964a4	0	0	0.0000	CRASH	gen=414 glyphs=4
2026-03-14T07:36:44.884070	3f7b534e	0	0	0.0000	CRASH	gen=414 glyphs=4
2026-03-14T07:36:44.884264	099964a4	0	0	0.0000	CRASH	gen=414 glyphs=4
2026-03-14T07:36:44.884460	099964a4	0	0	0.0000	CRASH	gen=414 glyphs=4
2026-03-14T07:36:44.884653	dcb1fb50	0	0	0.0000	CRASH	gen=414 glyphs=4
2026-03-14T07:36:44.884848	099964a4	0	0	0.0000	CRASH	gen=414 glyphs=4
2026-03-14T07:36:44.885040	099964a4	0	0	0.0000	CRASH	gen=414 glyphs=4
2026-03-14T07:36:44.885238	94cabeee	0	0	0.0000	CRASH	gen=414 glyphs=3
2026-03-14T07:36:44.885436	099964a4	0	0	0.0000	CRASH	gen=414 glyphs=4
2026-03-14T07:36:44.885711	099964a4	0	0	0.0000	CRASH	gen=415 glyphs=4
2026-03-14T07:36:44.885909	099964a4	0	0	0.0000	CRASH	gen=415 glyphs=4
2026-03-14T07:36:44.886103	099964a4	0	0	0.0000	CRASH	gen=415 glyphs=4
2026-03-14T07:36:44.886300	dcb1fb50	0	0	0.0000	CRASH	gen=415 glyphs=4
2026-03-14T07:36:44.886496	8b3703f4	0	0	0.0000	CRASH	gen=415 glyphs=4
2026-03-14T07:36:44.886697	dcb1fb50	0	0	0.0000	CRASH	gen=415 glyphs=4
2026-03-14T07:36:44.886892	7ede4765	0	0	0.0000	CRASH	gen=415 glyphs=2
2026-03-14T07:36:44.887083	38d1921d	0	0	0.0000	CRASH	gen=415 glyphs=3
2026-03-14T07:36:44.887275	dc201fc8	0	0	0.0000	CRASH	gen=415 glyphs=3
2026-03-14T07:36:44.887468	dcb1fb50	0	0	0.0000	CRASH	gen=415 glyphs=4
2026-03-14T07:36:44.887738	099964a4	0	0	0.0000	CRASH	gen=416 glyphs=4
2026-03-14T07:36:44.887933	099964a4	0	0	0.0000	CRASH	gen=416 glyphs=4
2026-03-14T07:36:44.888126	dcb1fb50	0	0	0.0000	CRASH	gen=416 glyphs=4
2026-03-14T07:36:44.888321	099964a4	0	0	0.0000	CRASH	gen=416 glyphs=4
2026-03-14T07:36:44.888515	099964a4	0	0	0.0000	CRASH	gen=416 glyphs=4
2026-03-14T07:36:44.888716	099964a4	0	0	0.0000	CRASH	gen=416 glyphs=4
2026-03-14T07:36:44.888909	099964a4	0	0	0.0000	CRASH	gen=416 glyphs=4
2026-03-14T07:36:44.889103	90e01962	0	0	0.0000	CRASH	gen=416 glyphs=3
2026-03-14T07:36:44.889299	3a734398	0	0	0.0000	CRASH	gen=416 glyphs=4
2026-03-14T07:36:44.889491	099964a4	0	0	0.0000	CRASH	gen=416 glyphs=4
2026-03-14T07:36:44.889774	099964a4	0	0	0.0000	CRASH	gen=417 glyphs=4
2026-03-14T07:36:44.889969	099964a4	0	0	0.0000	CRASH	gen=417 glyphs=4
2026-03-14T07:36:44.890163	8da1f8d8	0	0	0.0000	CRASH	gen=417 glyphs=4
2026-03-14T07:36:44.890358	473873cd	0	0	0.0000	CRASH	gen=417 glyphs=2
2026-03-14T07:36:44.890555	099964a4	0	0	0.0000	CRASH	gen=417 glyphs=4
2026-03-14T07:36:44.890749	099964a4	0	0	0.0000	CRASH	gen=417 glyphs=4
2026-03-14T07:36:44.890944	099964a4	0	0	0.0000	CRASH	gen=417 glyphs=4
2026-03-14T07:36:44.891138	b38a3a38	0	0	0.0000	CRASH	gen=417 glyphs=4
2026-03-14T07:36:44.891334	ff30496a	0	0	0.0000	CRASH	gen=417 glyphs=3
2026-03-14T07:36:44.891533	6374c14e	0	0	0.0000	CRASH	gen=417 glyphs=3
2026-03-14T07:36:44.891813	099964a4	0	0	0.0000	CRASH	gen=418 glyphs=4
2026-03-14T07:36:44.892012	099964a4	0	0	0.0000	CRASH	gen=418 glyphs=4
2026-03-14T07:36:44.892207	eb1b29ea	0	0	0.0000	CRASH	gen=418 glyphs=2
2026-03-14T07:36:44.892405	dcb1fb50	0	0	0.0000	CRASH	gen=418 glyphs=4
2026-03-14T07:36:44.892609	191a6b78	0	0	0.0000	CRASH	gen=418 glyphs=4
2026-03-14T07:36:44.892807	a1ec12af	0	0	0.0000	CRASH	gen=418 glyphs=5
2026-03-14T07:36:44.893007	0f13bbcf	0	0	0.0000	CRASH	gen=418 glyphs=2
2026-03-14T07:36:44.893201	82dc8d7d	0	0	0.0000	CRASH	gen=418 glyphs=3
2026-03-14T07:36:44.893397	3a734398	0	0	0.0000	CRASH	gen=418 glyphs=4
2026-03-14T07:36:44.893594	ff30496a	0	0	0.0000	CRASH	gen=418 glyphs=3
2026-03-14T07:36:44.893872	099964a4	0	0	0.0000	CRASH	gen=419 glyphs=4
2026-03-14T07:36:44.894080	099964a4	0	0	0.0000	CRASH	gen=419 glyphs=4
2026-03-14T07:36:44.894275	308f3396	0	0	0.0000	CRASH	gen=419 glyphs=4
2026-03-14T07:36:44.894468	099964a4	0	0	0.0000	CRASH	gen=419 glyphs=4
2026-03-14T07:36:44.894664	099964a4	0	0	0.0000	CRASH	gen=419 glyphs=4
2026-03-14T07:36:44.894856	ff30496a	0	0	0.0000	CRASH	gen=419 glyphs=3
2026-03-14T07:36:44.895050	104c7763	0	0	0.0000	CRASH	gen=419 glyphs=5
2026-03-14T07:36:44.895244	099964a4	0	0	0.0000	CRASH	gen=419 glyphs=4
2026-03-14T07:36:44.895443	099964a4	0	0	0.0000	CRASH	gen=419 glyphs=4
