timestamp	program_hash	spirv_size	word_count	fitness	status	description
2026-03-14T01:41:52.906988	6696d55a	116	29	1.0000	DISCARD	gen=446 glyphs=4
2026-03-14T01:41:53.170538	19355583	120	30	1.0000	DISCARD	gen=490 glyphs=4
2026-03-14T01:41:55.588613	8789c6a9	116	29	1.0000	DISCARD	gen=446 glyphs=4
2026-03-14T01:41:55.852613	050862ad	120	30	1.0000	DISCARD	gen=490 glyphs=4
2026-03-14T01:41:58.343100	fdb5d108	120	30	1.0000	DISCARD	gen=446 glyphs=4
2026-03-14T01:41:58.610727	0eaedb57	116	29	1.0000	DISCARD	gen=490 glyphs=4
2026-03-14T01:42:01.034303	37f4017b	116	29	1.0000	DISCARD	gen=447 glyphs=4
2026-03-14T01:42:01.299953	eca7ab6c	116	29	1.0000	DISCARD	gen=490 glyphs=4
2026-03-14T01:42:03.713266	bfdf7cad	120	30	1.0000	DISCARD	gen=447 glyphs=4
2026-03-14T01:42:03.991064	19355583	120	30	1.0000	DISCARD	gen=491 glyphs=4
2026-03-14T01:42:06.419392	5a06ca32	120	30	1.0000	DISCARD	gen=447 glyphs=4
2026-03-14T01:42:06.689816	8aef8872	116	29	1.0000	DISCARD	gen=491 glyphs=4
2026-03-14T01:42:09.114435	72c8e6d6	116	29	1.0000	DISCARD	gen=447 glyphs=4
2026-03-14T01:42:09.381479	19355583	120	30	1.0000	DISCARD	gen=491 glyphs=4
2026-03-14T01:42:11.794426	4c9b0dd4	120	30	1.0000	DISCARD	gen=447 glyphs=4
2026-03-14T01:42:12.056122	c34fc90c	116	29	1.0000	DISCARD	gen=491 glyphs=4
2026-03-14T01:42:14.486342	5a06ca32	120	30	1.0000	DISCARD	gen=447 glyphs=4
2026-03-14T01:42:14.752289	abb59f8b	116	29	1.0000	DISCARD	gen=491 glyphs=4
2026-03-14T01:42:17.190289	37f4017b	116	29	1.0000	DISCARD	gen=447 glyphs=4
2026-03-14T01:42:17.458433	19355583	120	30	1.0000	DISCARD	gen=491 glyphs=4
2026-03-14T01:42:19.870657	8e461ac2	116	29	1.0000	DISCARD	gen=447 glyphs=4
2026-03-14T01:42:20.158971	050862ad	120	30	1.0000	DISCARD	gen=491 glyphs=4
2026-03-14T01:42:22.561023	1d34459a	116	29	1.0000	DISCARD	gen=447 glyphs=4
2026-03-14T01:42:22.827410	9e34ede0	116	29	1.0000	DISCARD	gen=491 glyphs=4
2026-03-14T01:42:25.226210	1918364a	116	29	1.0000	DISCARD	gen=447 glyphs=4
2026-03-14T01:42:25.493480	50dc991d	116	29	1.0000	DISCARD	gen=491 glyphs=4
2026-03-14T01:42:27.920633	37f4017b	116	29	1.0000	DISCARD	gen=448 glyphs=4
2026-03-14T01:42:28.192330	8aef8872	116	29	1.0000	DISCARD	gen=491 glyphs=4
2026-03-14T01:42:30.682458	bfdf7cad	120	30	1.0000	DISCARD	gen=448 glyphs=4
2026-03-14T01:42:30.952933	19355583	120	30	1.0000	DISCARD	gen=492 glyphs=4
2026-03-14T01:42:33.378332	12b38c2d	116	29	1.0000	DISCARD	gen=448 glyphs=4
2026-03-14T01:42:33.642250	8aef8872	116	29	1.0000	DISCARD	gen=492 glyphs=4
2026-03-14T01:42:36.061271	12b38c2d	116	29	1.0000	DISCARD	gen=448 glyphs=4
2026-03-14T01:42:36.331483	87e99ef1	116	29	1.0000	DISCARD	gen=492 glyphs=4
2026-03-14T01:42:38.786252	37f4017b	116	29	1.0000	DISCARD	gen=448 glyphs=4
2026-03-14T01:42:39.047134	e2cd28ea	120	30	1.0000	DISCARD	gen=492 glyphs=4
2026-03-14T01:42:41.504636	1c37751e	120	30	1.0000	DISCARD	gen=448 glyphs=4
2026-03-14T01:42:41.772725	ae44ace5	116	29	1.0000	DISCARD	gen=492 glyphs=4
2026-03-14T01:42:44.209300	2701cb73	116	29	1.0000	DISCARD	gen=448 glyphs=4
2026-03-14T01:42:44.472858	0eaedb57	116	29	1.0000	DISCARD	gen=492 glyphs=4
2026-03-14T01:42:46.932288	37f4017b	116	29	1.0000	DISCARD	gen=448 glyphs=4
2026-03-14T01:42:47.195820	4de46b18	120	30	1.0000	DISCARD	gen=492 glyphs=4
2026-03-14T01:42:49.624365	5a06ca32	120	30	1.0000	DISCARD	gen=448 glyphs=4
2026-03-14T01:42:49.893563	19355583	120	30	1.0000	DISCARD	gen=492 glyphs=4
2026-03-14T01:42:52.324243	37f4017b	116	29	1.0000	DISCARD	gen=448 glyphs=4
2026-03-14T01:42:52.584555	bea57e5b	116	29	1.0000	DISCARD	gen=492 glyphs=4
2026-03-14T01:42:55.004368	37f4017b	116	29	1.0000	DISCARD	gen=449 glyphs=4
2026-03-14T01:42:55.270946	b57e7176	120	30	1.0000	DISCARD	gen=492 glyphs=4
2026-03-14T01:42:57.689559	bfdf7cad	120	30	1.0000	DISCARD	gen=449 glyphs=4
2026-03-14T01:42:57.955073	19355583	120	30	1.0000	DISCARD	gen=493 glyphs=4
2026-03-14T01:43:00.407345	2701cb73	116	29	1.0000	DISCARD	gen=449 glyphs=4
2026-03-14T01:43:00.707523	8aef8872	116	29	1.0000	DISCARD	gen=493 glyphs=4
2026-03-14T01:43:03.140560	91e89b88	116	29	1.0000	DISCARD	gen=449 glyphs=4
2026-03-14T01:43:03.422971	0b87c02c	120	30	1.0000	DISCARD	gen=493 glyphs=4
2026-03-14T01:43:05.838434	55d6c151	120	30	1.0000	DISCARD	gen=449 glyphs=4
2026-03-14T01:43:06.103568	0eaedb57	116	29	1.0000	DISCARD	gen=493 glyphs=4
2026-03-14T01:43:08.519619	cf219893	120	30	1.0000	DISCARD	gen=449 glyphs=4
2026-03-14T01:43:08.778928	8aef8872	116	29	1.0000	DISCARD	gen=493 glyphs=4
2026-03-14T01:43:11.185050	5a06ca32	120	30	1.0000	DISCARD	gen=449 glyphs=4
2026-03-14T01:43:11.460640	8aef8872	116	29	1.0000	DISCARD	gen=493 glyphs=4
2026-03-14T01:43:13.873533	fdb5d108	120	30	1.0000	DISCARD	gen=449 glyphs=4
2026-03-14T01:43:14.147886	15dbd9e2	120	30	1.0000	DISCARD	gen=493 glyphs=4
2026-03-14T01:43:16.564127	5a06ca32	120	30	1.0000	DISCARD	gen=449 glyphs=4
2026-03-14T01:43:16.830216	19355583	120	30	1.0000	DISCARD	gen=493 glyphs=4
2026-03-14T01:43:19.239769	5cfc93e2	116	29	1.0000	DISCARD	gen=449 glyphs=4
2026-03-14T01:43:19.513321	9371d1dd	120	30	1.0000	DISCARD	gen=493 glyphs=4
2026-03-14T01:43:21.923978	37f4017b	116	29	1.0000	DISCARD	gen=450 glyphs=4
2026-03-14T01:43:22.192371	b7aed8e9	116	29	1.0000	DISCARD	gen=493 glyphs=4
2026-03-14T01:43:24.596502	bfdf7cad	120	30	1.0000	DISCARD	gen=450 glyphs=4
2026-03-14T01:43:24.863397	19355583	120	30	1.0000	DISCARD	gen=494 glyphs=4
2026-03-14T01:43:27.283018	fdb5d108	120	30	1.0000	DISCARD	gen=450 glyphs=4
2026-03-14T01:43:27.550862	8aef8872	116	29	1.0000	DISCARD	gen=494 glyphs=4
2026-03-14T01:43:29.949471	55d6c151	120	30	1.0000	DISCARD	gen=450 glyphs=4
2026-03-14T01:43:30.203628	fdfcd38d	116	29	1.0000	DISCARD	gen=494 glyphs=4
2026-03-14T01:43:32.655928	1ff79c73	116	29	1.0000	DISCARD	gen=450 glyphs=4
2026-03-14T01:43:32.917380	09de7428	116	29	1.0000	DISCARD	gen=494 glyphs=4
2026-03-14T01:43:35.368475	3ed76819	116	29	1.0000	DISCARD	gen=450 glyphs=4
2026-03-14T01:43:35.638338	a43e0c9e	116	29	1.0000	DISCARD	gen=494 glyphs=4
2026-03-14T01:43:38.047039	d11c1062	120	30	1.0000	DISCARD	gen=450 glyphs=4
2026-03-14T01:43:38.325088	50dc991d	116	29	1.0000	DISCARD	gen=494 glyphs=4
2026-03-14T01:43:40.762269	37f4017b	116	29	1.0000	DISCARD	gen=450 glyphs=4
2026-03-14T01:43:41.032791	b57e7176	120	30	1.0000	DISCARD	gen=494 glyphs=4
2026-03-14T01:43:43.463836	37f4017b	116	29	1.0000	DISCARD	gen=450 glyphs=4
2026-03-14T01:43:43.731017	b57e7176	120	30	1.0000	DISCARD	gen=494 glyphs=4
2026-03-14T01:43:46.181301	5a06ca32	120	30	1.0000	DISCARD	gen=450 glyphs=4
2026-03-14T01:43:46.450245	e2cd28ea	120	30	1.0000	DISCARD	gen=494 glyphs=4
2026-03-14T01:43:48.886677	37f4017b	116	29	1.0000	DISCARD	gen=451 glyphs=4
2026-03-14T01:43:49.156655	8aef8872	116	29	1.0000	DISCARD	gen=494 glyphs=4
2026-03-14T01:43:51.581992	bfdf7cad	120	30	1.0000	DISCARD	gen=451 glyphs=4
2026-03-14T01:43:51.856677	19355583	120	30	1.0000	DISCARD	gen=495 glyphs=4
2026-03-14T01:43:54.254884	c56af953	116	29	1.0000	DISCARD	gen=451 glyphs=4
2026-03-14T01:43:54.533056	8aef8872	116	29	1.0000	DISCARD	gen=495 glyphs=4
2026-03-14T01:43:56.972157	55d6c151	120	30	1.0000	DISCARD	gen=451 glyphs=4
2026-03-14T01:43:57.246994	19355583	120	30	1.0000	DISCARD	gen=495 glyphs=4
2026-03-14T01:43:59.669630	4c8cce4c	116	29	1.0000	DISCARD	gen=451 glyphs=4
2026-03-14T01:43:59.935068	8aef8872	116	29	1.0000	DISCARD	gen=495 glyphs=4
2026-03-14T01:44:02.322944	3ea994f1	116	29	1.0000	DISCARD	gen=451 glyphs=4
2026-03-14T01:44:02.591251	19355583	120	30	1.0000	DISCARD	gen=495 glyphs=4
2026-03-14T01:44:05.082127	aab41c56	116	29	1.0000	DISCARD	gen=451 glyphs=4
2026-03-14T01:44:05.361101	e2cd28ea	120	30	1.0000	DISCARD	gen=495 glyphs=4
2026-03-14T01:44:07.778836	be673d4b	116	29	1.0000	DISCARD	gen=451 glyphs=4
2026-03-14T01:44:08.045180	8b7695dc	116	29	1.0000	DISCARD	gen=495 glyphs=4
2026-03-14T01:44:10.455181	bfdf7cad	120	30	1.0000	DISCARD	gen=451 glyphs=4
2026-03-14T01:44:10.723334	2205872f	120	30	1.0000	DISCARD	gen=495 glyphs=4
2026-03-14T01:44:13.143768	e24c7e5f	116	29	0.9500	DISCARD	gen=451 glyphs=4
2026-03-14T01:44:13.416616	2509e00b	120	30	1.0000	DISCARD	gen=495 glyphs=4
2026-03-14T01:44:15.887106	37f4017b	116	29	1.0000	DISCARD	gen=452 glyphs=4
2026-03-14T01:44:16.159436	e8c7f6cf	120	30	1.0000	DISCARD	gen=495 glyphs=4
2026-03-14T01:44:18.616532	bfdf7cad	120	30	1.0000	DISCARD	gen=452 glyphs=4
2026-03-14T01:44:18.889336	19355583	120	30	1.0000	DISCARD	gen=496 glyphs=4
2026-03-14T01:44:21.359694	d11c1062	120	30	1.0000	DISCARD	gen=452 glyphs=4
2026-03-14T01:44:21.630821	8aef8872	116	29	1.0000	DISCARD	gen=496 glyphs=4
2026-03-14T01:44:24.102776	9268d768	120	30	1.0000	DISCARD	gen=452 glyphs=4
2026-03-14T01:44:24.383154	19355583	120	30	1.0000	DISCARD	gen=496 glyphs=4
2026-03-14T01:44:26.860749	fdb5d108	120	30	1.0000	DISCARD	gen=452 glyphs=4
2026-03-14T01:44:27.130046	0eaedb57	116	29	1.0000	DISCARD	gen=496 glyphs=4
2026-03-14T01:44:29.595888	7ca87b42	116	29	1.0000	DISCARD	gen=452 glyphs=4
2026-03-14T01:44:29.865808	50dc991d	116	29	1.0000	DISCARD	gen=496 glyphs=4
2026-03-14T01:44:32.327500	5a06ca32	120	30	1.0000	DISCARD	gen=452 glyphs=4
2026-03-14T01:44:32.608424	0eaedb57	116	29	1.0000	DISCARD	gen=496 glyphs=4
2026-03-14T01:44:35.045794	2701cb73	116	29	1.0000	DISCARD	gen=452 glyphs=4
2026-03-14T01:44:35.323897	6fa49202	116	29	1.0000	DISCARD	gen=496 glyphs=4
2026-03-14T01:44:37.801189	4c9b0dd4	120	30	1.0000	DISCARD	gen=452 glyphs=4
2026-03-14T01:44:38.073031	8aef8872	116	29	1.0000	DISCARD	gen=496 glyphs=4
2026-03-14T01:44:40.463659	fdb5d108	120	30	1.0000	DISCARD	gen=452 glyphs=4
2026-03-14T01:44:40.723443	061369bb	120	30	0.9500	DISCARD	gen=496 glyphs=4
2026-03-14T01:44:43.120751	37f4017b	116	29	1.0000	DISCARD	gen=453 glyphs=4
2026-03-14T01:44:43.395764	e43da9ca	116	29	1.0000	DISCARD	gen=496 glyphs=4
2026-03-14T01:44:45.790816	bfdf7cad	120	30	1.0000	DISCARD	gen=453 glyphs=4
2026-03-14T01:44:46.056055	19355583	120	30	1.0000	DISCARD	gen=497 glyphs=4
2026-03-14T01:44:48.505075	94434bf9	120	30	1.0000	DISCARD	gen=453 glyphs=4
2026-03-14T01:44:48.770141	8aef8872	116	29	1.0000	DISCARD	gen=497 glyphs=4
2026-03-14T01:44:51.157575	55d6c151	120	30	1.0000	DISCARD	gen=453 glyphs=4
2026-03-14T01:44:51.434594	b7aed8e9	116	29	1.0000	DISCARD	gen=497 glyphs=4
2026-03-14T01:44:53.833091	37f4017b	116	29	1.0000	DISCARD	gen=453 glyphs=4
2026-03-14T01:44:54.101234	050862ad	120	30	1.0000	DISCARD	gen=497 glyphs=4
2026-03-14T01:44:56.501911	5a06ca32	120	30	1.0000	DISCARD	gen=453 glyphs=4
2026-03-14T01:44:56.764649	b7aed8e9	116	29	1.0000	DISCARD	gen=497 glyphs=4
2026-03-14T01:44:59.189859	5b9807ac	120	30	1.0000	DISCARD	gen=453 glyphs=4
2026-03-14T01:44:59.455704	19355583	120	30	1.0000	DISCARD	gen=497 glyphs=4
2026-03-14T01:45:01.884788	4fba4ecb	116	29	1.0000	DISCARD	gen=453 glyphs=4
2026-03-14T01:45:02.156697	6cd539c7	116	29	0.9500	DISCARD	gen=497 glyphs=4
2026-03-14T01:45:04.582617	fdb5d108	120	30	1.0000	DISCARD	gen=453 glyphs=4
2026-03-14T01:45:04.839699	14b62ba8	120	30	1.0000	DISCARD	gen=497 glyphs=4
2026-03-14T01:45:07.273989	dff26904	120	30	1.0000	DISCARD	gen=453 glyphs=4
2026-03-14T01:45:07.597512	8aef8872	116	29	1.0000	DISCARD	gen=497 glyphs=4
2026-03-14T01:45:10.062873	37f4017b	116	29	1.0000	DISCARD	gen=454 glyphs=4
2026-03-14T01:45:10.330568	ae44ace5	116	29	1.0000	DISCARD	gen=497 glyphs=4
2026-03-14T01:45:12.757527	bfdf7cad	120	30	1.0000	DISCARD	gen=454 glyphs=4
2026-03-14T01:45:13.040591	19355583	120	30	1.0000	DISCARD	gen=498 glyphs=4
2026-03-14T01:45:15.493624	5a06ca32	120	30	1.0000	DISCARD	gen=454 glyphs=4
2026-03-14T01:45:15.760638	8aef8872	116	29	1.0000	DISCARD	gen=498 glyphs=4
2026-03-14T01:45:18.175863	7fd60d01	116	29	1.0000	DISCARD	gen=454 glyphs=4
2026-03-14T01:45:18.436662	8c5fd1e7	116	29	1.0000	DISCARD	gen=498 glyphs=4
2026-03-14T01:45:20.871068	bfdf7cad	120	30	1.0000	DISCARD	gen=454 glyphs=4
2026-03-14T01:45:21.160317	050862ad	120	30	1.0000	DISCARD	gen=498 glyphs=4
2026-03-14T01:45:23.574237	fdb5d108	120	30	1.0000	DISCARD	gen=454 glyphs=4
2026-03-14T01:45:23.842703	0eaedb57	116	29	1.0000	DISCARD	gen=498 glyphs=4
2026-03-14T01:45:26.276115	bacfe884	124	31	0.9500	DISCARD	gen=454 glyphs=4
2026-03-14T01:45:26.549950	2953107c	116	29	1.0000	DISCARD	gen=498 glyphs=4
2026-03-14T01:45:28.964416	1c597a0f	116	29	1.0000	DISCARD	gen=454 glyphs=4
2026-03-14T01:45:29.235613	50dc991d	116	29	1.0000	DISCARD	gen=498 glyphs=4
2026-03-14T01:45:31.670233	5a06ca32	120	30	1.0000	DISCARD	gen=454 glyphs=4
2026-03-14T01:45:31.940975	19355583	120	30	1.0000	DISCARD	gen=498 glyphs=4
2026-03-14T01:45:34.373943	fdb5d108	120	30	1.0000	DISCARD	gen=454 glyphs=4
2026-03-14T01:45:34.647310	8aef8872	116	29	1.0000	DISCARD	gen=498 glyphs=4
2026-03-14T01:45:37.094163	37f4017b	116	29	1.0000	DISCARD	gen=455 glyphs=4
2026-03-14T01:45:37.361257	8aef8872	116	29	1.0000	DISCARD	gen=498 glyphs=4
2026-03-14T01:45:39.805793	bfdf7cad	120	30	1.0000	DISCARD	gen=455 glyphs=4
2026-03-14T01:45:40.100958	19355583	120	30	1.0000	DISCARD	gen=499 glyphs=4
2026-03-14T01:45:42.540996	d656a10e	116	29	1.0000	DISCARD	gen=455 glyphs=4
2026-03-14T01:45:42.811286	8aef8872	116	29	1.0000	DISCARD	gen=499 glyphs=4
2026-03-14T01:45:45.256942	37f4017b	116	29	1.0000	DISCARD	gen=455 glyphs=4
2026-03-14T01:45:45.533660	94ca8cef	116	29	1.0000	DISCARD	gen=499 glyphs=4
2026-03-14T01:45:47.964029	5a06ca32	120	30	1.0000	DISCARD	gen=455 glyphs=4
2026-03-14T01:45:48.227052	8aef8872	116	29	1.0000	DISCARD	gen=499 glyphs=4
2026-03-14T01:45:50.645633	55d6c151	120	30	1.0000	DISCARD	gen=455 glyphs=4
2026-03-14T01:45:50.922681	eca7ab6c	116	29	1.0000	DISCARD	gen=499 glyphs=4
2026-03-14T01:45:53.337996	55d6c151	120	30	1.0000	DISCARD	gen=455 glyphs=4
2026-03-14T01:45:53.621964	8aef8872	116	29	1.0000	DISCARD	gen=499 glyphs=4
2026-03-14T01:45:56.023009	2701cb73	116	29	1.0000	DISCARD	gen=455 glyphs=4
2026-03-14T01:45:56.287841	050862ad	120	30	1.0000	DISCARD	gen=499 glyphs=4
2026-03-14T01:45:58.701315	37f4017b	116	29	1.0000	DISCARD	gen=455 glyphs=4
2026-03-14T01:45:58.971326	e8c7f6cf	120	30	1.0000	DISCARD	gen=499 glyphs=4
2026-03-14T01:46:01.365038	5b9807ac	120	30	1.0000	DISCARD	gen=455 glyphs=4
2026-03-14T01:46:01.631415	d7c8681b	120	30	1.0000	DISCARD	gen=499 glyphs=4
2026-03-14T01:46:04.064961	37f4017b	116	29	1.0000	DISCARD	gen=456 glyphs=4
2026-03-14T01:46:04.324133	19355583	120	30	1.0000	DISCARD	gen=499 glyphs=4
2026-03-14T01:46:06.752094	bfdf7cad	120	30	1.0000	DISCARD	gen=456 glyphs=4
2026-03-14T01:46:07.018079	19355583	120	30	1.0000	DISCARD	gen=500 glyphs=4
2026-03-14T01:46:09.457593	37f4017b	116	29	1.0000	DISCARD	gen=456 glyphs=4
2026-03-14T01:46:09.719532	8aef8872	116	29	1.0000	DISCARD	gen=500 glyphs=4
2026-03-14T01:46:12.239743	5a06ca32	120	30	1.0000	DISCARD	gen=456 glyphs=4
2026-03-14T01:46:12.519223	0eaedb57	116	29	1.0000	DISCARD	gen=500 glyphs=4
2026-03-14T01:46:14.950072	55d6c151	120	30	1.0000	DISCARD	gen=456 glyphs=4
2026-03-14T01:46:15.219644	8aef8872	116	29	1.0000	DISCARD	gen=500 glyphs=4
2026-03-14T01:46:17.646216	b5ece366	120	30	1.0000	DISCARD	gen=456 glyphs=4
2026-03-14T01:46:17.914815	8aef8872	116	29	1.0000	DISCARD	gen=500 glyphs=4
2026-03-14T01:46:20.333309	eb354b9f	116	29	1.0000	DISCARD	gen=456 glyphs=4
2026-03-14T01:46:20.601984	67cb81be	120	30	1.0000	DISCARD	gen=500 glyphs=4
2026-03-14T01:46:23.066263	7ca87b42	116	29	1.0000	DISCARD	gen=456 glyphs=4
2026-03-14T01:46:23.325727	050862ad	120	30	1.0000	DISCARD	gen=500 glyphs=4
2026-03-14T01:46:25.753176	7ca87b42	116	29	1.0000	DISCARD	gen=456 glyphs=4
2026-03-14T01:46:26.015131	e2cd28ea	120	30	1.0000	DISCARD	gen=500 glyphs=4
2026-03-14T01:46:28.438574	37f4017b	116	29	1.0000	DISCARD	gen=456 glyphs=4
2026-03-14T01:46:28.708150	875e0f8a	116	29	1.0000	DISCARD	gen=500 glyphs=4
2026-03-14T01:46:31.123084	37f4017b	116	29	1.0000	DISCARD	gen=457 glyphs=4
2026-03-14T01:46:31.393438	050862ad	120	30	1.0000	DISCARD	gen=500 glyphs=4
2026-03-14T01:46:33.908836	bfdf7cad	120	30	1.0000	DISCARD	gen=457 glyphs=4
2026-03-14T01:46:34.202232	19355583	120	30	1.0000	DISCARD	gen=501 glyphs=4
2026-03-14T01:46:36.694919	5a06ca32	120	30	1.0000	DISCARD	gen=457 glyphs=4
2026-03-14T01:46:36.970368	8aef8872	116	29	1.0000	DISCARD	gen=501 glyphs=4
2026-03-14T01:46:39.441188	5a06ca32	120	30	1.0000	DISCARD	gen=457 glyphs=4
2026-03-14T01:46:39.720566	33668d6c	116	29	1.0000	DISCARD	gen=501 glyphs=4
2026-03-14T01:46:42.192628	5a06ca32	120	30	1.0000	DISCARD	gen=457 glyphs=4
2026-03-14T01:46:42.466622	7ccc714b	116	29	1.0000	DISCARD	gen=501 glyphs=4
2026-03-14T01:46:44.946387	c8e608af	116	29	1.0000	DISCARD	gen=457 glyphs=4
2026-03-14T01:46:45.219425	19355583	120	30	1.0000	DISCARD	gen=501 glyphs=4
2026-03-14T01:46:47.734196	7f176239	120	30	1.0000	DISCARD	gen=457 glyphs=4
2026-03-14T01:46:48.031332	1e5f0e21	116	29	1.0000	DISCARD	gen=501 glyphs=4
2026-03-14T01:46:50.455964	7d7d3e57	116	29	1.0000	DISCARD	gen=457 glyphs=4
2026-03-14T01:46:50.726479	19355583	120	30	1.0000	DISCARD	gen=501 glyphs=4
2026-03-14T01:46:53.155838	5a06ca32	120	30	1.0000	DISCARD	gen=457 glyphs=4
2026-03-14T01:46:53.430616	8aef8872	116	29	1.0000	DISCARD	gen=501 glyphs=4
2026-03-14T01:46:55.856426	1d34459a	116	29	1.0000	DISCARD	gen=457 glyphs=4
2026-03-14T01:46:56.125896	19355583	120	30	1.0000	DISCARD	gen=501 glyphs=4
2026-03-14T01:46:58.578718	37f4017b	116	29	1.0000	DISCARD	gen=458 glyphs=4
2026-03-14T01:46:58.847537	9e34ede0	116	29	1.0000	DISCARD	gen=501 glyphs=4
2026-03-14T01:47:01.236137	bfdf7cad	120	30	1.0000	DISCARD	gen=458 glyphs=4
2026-03-14T01:47:01.508217	19355583	120	30	1.0000	DISCARD	gen=502 glyphs=4
2026-03-14T01:47:03.952437	1d34459a	116	29	1.0000	DISCARD	gen=458 glyphs=4
2026-03-14T01:47:04.211841	8aef8872	116	29	1.0000	DISCARD	gen=502 glyphs=4
2026-03-14T01:47:06.632934	71e2ba66	116	29	1.0000	DISCARD	gen=458 glyphs=4
2026-03-14T01:47:06.900862	050862ad	120	30	1.0000	DISCARD	gen=502 glyphs=4
2026-03-14T01:47:09.318562	75fdd755	116	29	1.0000	DISCARD	gen=458 glyphs=4
2026-03-14T01:47:09.595995	050862ad	120	30	1.0000	DISCARD	gen=502 glyphs=4
2026-03-14T01:47:12.010322	5a06ca32	120	30	1.0000	DISCARD	gen=458 glyphs=4
2026-03-14T01:47:12.279791	0eaedb57	116	29	1.0000	DISCARD	gen=502 glyphs=4
2026-03-14T01:47:14.696019	37f4017b	116	29	1.0000	DISCARD	gen=458 glyphs=4
2026-03-14T01:47:15.000846	ae44ace5	116	29	1.0000	DISCARD	gen=502 glyphs=4
2026-03-14T01:47:17.481243	fdb5d108	120	30	1.0000	DISCARD	gen=458 glyphs=4
2026-03-14T01:47:17.757262	47ba32ee	120	30	1.0000	DISCARD	gen=502 glyphs=4
2026-03-14T01:47:20.175432	5a06ca32	120	30	1.0000	DISCARD	gen=458 glyphs=4
2026-03-14T01:47:20.447506	b62cca27	116	29	0.9500	DISCARD	gen=502 glyphs=4
2026-03-14T01:47:22.865051	5a06ca32	120	30	1.0000	DISCARD	gen=458 glyphs=4
2026-03-14T01:47:23.129881	0eaedb57	116	29	1.0000	DISCARD	gen=502 glyphs=4
2026-03-14T01:47:25.561321	37f4017b	116	29	1.0000	DISCARD	gen=459 glyphs=4
2026-03-14T01:47:25.832413	67cb81be	120	30	1.0000	DISCARD	gen=502 glyphs=4
2026-03-14T01:47:28.246339	bfdf7cad	120	30	1.0000	DISCARD	gen=459 glyphs=4
2026-03-14T01:47:28.514283	19355583	120	30	1.0000	DISCARD	gen=503 glyphs=4
2026-03-14T01:47:30.955249	20416d22	116	29	1.0000	DISCARD	gen=459 glyphs=4
2026-03-14T01:47:31.221882	8aef8872	116	29	1.0000	DISCARD	gen=503 glyphs=4
2026-03-14T01:47:33.649787	d24ef9f6	116	29	1.0000	DISCARD	gen=459 glyphs=4
2026-03-14T01:47:33.918343	5185eed2	116	29	1.0000	DISCARD	gen=503 glyphs=4
2026-03-14T01:47:36.332332	55d6c151	120	30	1.0000	DISCARD	gen=459 glyphs=4
2026-03-14T01:47:36.600084	8aef8872	116	29	1.0000	DISCARD	gen=503 glyphs=4
2026-03-14T01:47:39.042581	37f4017b	116	29	1.0000	DISCARD	gen=459 glyphs=4
2026-03-14T01:47:39.310688	d7c8681b	120	30	1.0000	DISCARD	gen=503 glyphs=4
2026-03-14T01:47:41.747209	12b38c2d	116	29	1.0000	DISCARD	gen=459 glyphs=4
2026-03-14T01:47:42.021507	19355583	120	30	1.0000	DISCARD	gen=503 glyphs=4
2026-03-14T01:47:44.460109	5a06ca32	120	30	1.0000	DISCARD	gen=459 glyphs=4
2026-03-14T01:47:44.733581	8aef8872	116	29	1.0000	DISCARD	gen=503 glyphs=4
2026-03-14T01:47:47.195343	eb597a58	116	29	1.0000	DISCARD	gen=459 glyphs=4
2026-03-14T01:47:47.490548	875e0f8a	116	29	1.0000	DISCARD	gen=503 glyphs=4
2026-03-14T01:47:49.938703	38398957	120	30	1.0000	DISCARD	gen=459 glyphs=4
2026-03-14T01:47:50.198998	0eaedb57	116	29	1.0000	DISCARD	gen=503 glyphs=4
2026-03-14T01:47:52.630965	37f4017b	116	29	1.0000	DISCARD	gen=460 glyphs=4
2026-03-14T01:47:52.900414	0eaedb57	116	29	1.0000	DISCARD	gen=503 glyphs=4
2026-03-14T01:47:55.312141	bfdf7cad	120	30	1.0000	DISCARD	gen=460 glyphs=4
2026-03-14T01:47:55.587350	19355583	120	30	1.0000	DISCARD	gen=504 glyphs=4
2026-03-14T01:47:57.997715	fdb5d108	120	30	1.0000	DISCARD	gen=460 glyphs=4
2026-03-14T01:47:58.267028	8aef8872	116	29	1.0000	DISCARD	gen=504 glyphs=4
2026-03-14T01:48:00.678877	d8203b38	124	31	0.9500	DISCARD	gen=460 glyphs=4
2026-03-14T01:48:00.956821	8aef8872	116	29	1.0000	DISCARD	gen=504 glyphs=4
2026-03-14T01:48:03.385272	1d34459a	116	29	1.0000	DISCARD	gen=460 glyphs=4
2026-03-14T01:48:03.659166	a7b420f8	120	30	1.0000	DISCARD	gen=504 glyphs=4
2026-03-14T01:48:06.116664	5a06ca32	120	30	1.0000	DISCARD	gen=460 glyphs=4
2026-03-14T01:48:06.385015	4801562b	116	29	1.0000	DISCARD	gen=504 glyphs=4
2026-03-14T01:48:08.832638	1d34459a	116	29	1.0000	DISCARD	gen=460 glyphs=4
2026-03-14T01:48:09.090114	19355583	120	30	1.0000	DISCARD	gen=504 glyphs=4
2026-03-14T01:48:11.541163	55d6c151	120	30	1.0000	DISCARD	gen=460 glyphs=4
2026-03-14T01:48:11.800984	19355583	120	30	1.0000	DISCARD	gen=504 glyphs=4
2026-03-14T01:48:14.240403	55d6c151	120	30	1.0000	DISCARD	gen=460 glyphs=4
2026-03-14T01:48:14.503404	b7aed8e9	116	29	1.0000	DISCARD	gen=504 glyphs=4
2026-03-14T01:48:16.951341	b865d474	116	29	1.0000	DISCARD	gen=460 glyphs=4
2026-03-14T01:48:17.221797	b7aed8e9	116	29	1.0000	DISCARD	gen=504 glyphs=4
2026-03-14T01:48:19.749468	37f4017b	116	29	1.0000	DISCARD	gen=461 glyphs=4
2026-03-14T01:48:20.025645	a05b65b5	116	29	1.0000	DISCARD	gen=504 glyphs=4
2026-03-14T01:48:22.475634	bfdf7cad	120	30	1.0000	DISCARD	gen=461 glyphs=4
2026-03-14T01:48:22.737295	19355583	120	30	1.0000	DISCARD	gen=505 glyphs=4
2026-03-14T01:48:25.161003	37f4017b	116	29	1.0000	DISCARD	gen=461 glyphs=4
2026-03-14T01:48:25.434145	8aef8872	116	29	1.0000	DISCARD	gen=505 glyphs=4
