timestamp	program_hash	spirv_size	word_count	fitness	status	description
2026-03-14T00:48:19.046066	fa11678d	120	30	1.0000	DISCARD	gen=329 glyphs=4
2026-03-14T00:48:19.307740	a78f9454	120	30	1.0000	DISCARD	gen=373 glyphs=4
2026-03-14T00:48:21.766501	37f4017b	116	29	1.0000	DISCARD	gen=330 glyphs=4
2026-03-14T00:48:22.037888	8aef8872	116	29	1.0000	DISCARD	gen=373 glyphs=4
2026-03-14T00:48:24.617956	bfdf7cad	120	30	1.0000	DISCARD	gen=330 glyphs=4
2026-03-14T00:48:24.879536	19355583	120	30	1.0000	DISCARD	gen=374 glyphs=4
2026-03-14T00:48:27.319108	1d34459a	116	29	1.0000	DISCARD	gen=330 glyphs=4
2026-03-14T00:48:27.590903	8aef8872	116	29	1.0000	DISCARD	gen=374 glyphs=4
2026-03-14T00:48:30.016035	55d6c151	120	30	1.0000	DISCARD	gen=330 glyphs=4
2026-03-14T00:48:30.296656	cdfe4b50	120	30	1.0000	DISCARD	gen=374 glyphs=4
2026-03-14T00:48:32.742306	37f4017b	116	29	1.0000	DISCARD	gen=330 glyphs=4
2026-03-14T00:48:33.009928	7aac4814	116	29	1.0000	DISCARD	gen=374 glyphs=4
2026-03-14T00:48:35.453615	2701cb73	116	29	1.0000	DISCARD	gen=330 glyphs=4
2026-03-14T00:48:35.725466	eca7ab6c	116	29	1.0000	DISCARD	gen=374 glyphs=4
2026-03-14T00:48:38.152842	4c9b0dd4	120	30	1.0000	DISCARD	gen=330 glyphs=4
2026-03-14T00:48:38.423380	a78f9454	120	30	1.0000	DISCARD	gen=374 glyphs=4
2026-03-14T00:48:40.836189	5a06ca32	120	30	1.0000	DISCARD	gen=330 glyphs=4
2026-03-14T00:48:41.105837	005937fc	116	29	1.0000	DISCARD	gen=374 glyphs=4
2026-03-14T00:48:43.566476	23e22721	120	30	1.0000	DISCARD	gen=330 glyphs=4
2026-03-14T00:48:43.828733	67cb81be	120	30	1.0000	DISCARD	gen=374 glyphs=4
2026-03-14T00:48:46.309265	6c9d783d	116	29	1.0000	DISCARD	gen=330 glyphs=4
2026-03-14T00:48:46.575750	d7c8681b	120	30	1.0000	DISCARD	gen=374 glyphs=4
2026-03-14T00:48:49.040982	37f4017b	116	29	1.0000	DISCARD	gen=331 glyphs=4
2026-03-14T00:48:49.312364	050862ad	120	30	1.0000	DISCARD	gen=374 glyphs=4
2026-03-14T00:48:51.728704	bfdf7cad	120	30	1.0000	DISCARD	gen=331 glyphs=4
2026-03-14T00:48:51.995292	19355583	120	30	1.0000	DISCARD	gen=375 glyphs=4
2026-03-14T00:48:54.450098	1d34459a	116	29	1.0000	DISCARD	gen=331 glyphs=4
2026-03-14T00:48:54.725284	8aef8872	116	29	1.0000	DISCARD	gen=375 glyphs=4
2026-03-14T00:48:57.223807	37f4017b	116	29	1.0000	DISCARD	gen=331 glyphs=4
2026-03-14T00:48:57.498991	050862ad	120	30	1.0000	DISCARD	gen=375 glyphs=4
2026-03-14T00:48:59.942234	bfdf7cad	120	30	1.0000	DISCARD	gen=331 glyphs=4
2026-03-14T00:49:00.214824	b57e7176	120	30	1.0000	DISCARD	gen=375 glyphs=4
2026-03-14T00:49:02.778971	5a06ca32	120	30	1.0000	DISCARD	gen=331 glyphs=4
2026-03-14T00:49:03.068322	3f8c173e	116	29	1.0000	DISCARD	gen=375 glyphs=4
2026-03-14T00:49:05.594539	37f4017b	116	29	1.0000	DISCARD	gen=331 glyphs=4
2026-03-14T00:49:05.869476	8e8296b6	116	29	1.0000	DISCARD	gen=375 glyphs=4
2026-03-14T00:49:08.363773	2701cb73	116	29	1.0000	DISCARD	gen=331 glyphs=4
2026-03-14T00:49:08.639198	8aef8872	116	29	1.0000	DISCARD	gen=375 glyphs=4
2026-03-14T00:49:11.146429	d11c1062	120	30	1.0000	DISCARD	gen=331 glyphs=4
2026-03-14T00:49:11.424778	0eaedb57	116	29	1.0000	DISCARD	gen=375 glyphs=4
2026-03-14T00:49:13.900677	7ca87b42	116	29	1.0000	DISCARD	gen=331 glyphs=4
2026-03-14T00:49:14.165592	a11a0203	116	29	1.0000	DISCARD	gen=375 glyphs=4
2026-03-14T00:49:16.752148	37f4017b	116	29	1.0000	DISCARD	gen=332 glyphs=4
2026-03-14T00:49:17.025234	87b402fd	120	30	0.9500	DISCARD	gen=375 glyphs=4
2026-03-14T00:49:19.482983	bfdf7cad	120	30	1.0000	DISCARD	gen=332 glyphs=4
2026-03-14T00:49:19.771507	19355583	120	30	1.0000	DISCARD	gen=376 glyphs=4
2026-03-14T00:49:22.240909	d11c1062	120	30	1.0000	DISCARD	gen=332 glyphs=4
2026-03-14T00:49:22.527687	8aef8872	116	29	1.0000	DISCARD	gen=376 glyphs=4
2026-03-14T00:49:24.969787	65c0552e	116	29	1.0000	DISCARD	gen=332 glyphs=4
2026-03-14T00:49:25.243922	6920d230	116	29	1.0000	DISCARD	gen=376 glyphs=4
2026-03-14T00:49:27.749645	fa56dcd4	120	30	1.0000	DISCARD	gen=332 glyphs=4
2026-03-14T00:49:28.018714	a78f9454	120	30	1.0000	DISCARD	gen=376 glyphs=4
2026-03-14T00:49:30.462385	5a06ca32	120	30	1.0000	DISCARD	gen=332 glyphs=4
2026-03-14T00:49:30.733384	05bd35da	116	29	1.0000	DISCARD	gen=376 glyphs=4
2026-03-14T00:49:33.193175	37f4017b	116	29	1.0000	DISCARD	gen=332 glyphs=4
2026-03-14T00:49:33.468194	b57e7176	120	30	1.0000	DISCARD	gen=376 glyphs=4
2026-03-14T00:49:36.006001	37f4017b	116	29	1.0000	DISCARD	gen=332 glyphs=4
2026-03-14T00:49:36.291193	e6168b9c	116	29	1.0000	DISCARD	gen=376 glyphs=4
2026-03-14T00:49:38.868729	5b9807ac	120	30	1.0000	DISCARD	gen=332 glyphs=4
2026-03-14T00:49:39.142671	e8c7f6cf	120	30	1.0000	DISCARD	gen=376 glyphs=4
2026-03-14T00:49:41.664600	bfdf7cad	120	30	1.0000	DISCARD	gen=332 glyphs=4
2026-03-14T00:49:41.944340	875e0f8a	116	29	1.0000	DISCARD	gen=376 glyphs=4
2026-03-14T00:49:44.441960	37f4017b	116	29	1.0000	DISCARD	gen=333 glyphs=4
2026-03-14T00:49:44.730315	ae44ace5	116	29	1.0000	DISCARD	gen=376 glyphs=4
2026-03-14T00:49:47.192074	bfdf7cad	120	30	1.0000	DISCARD	gen=333 glyphs=4
2026-03-14T00:49:47.475136	19355583	120	30	1.0000	DISCARD	gen=377 glyphs=4
2026-03-14T00:49:50.021459	37f4017b	116	29	1.0000	DISCARD	gen=333 glyphs=4
2026-03-14T00:49:50.308631	8aef8872	116	29	1.0000	DISCARD	gen=377 glyphs=4
2026-03-14T00:49:52.784669	5a06ca32	120	30	1.0000	DISCARD	gen=333 glyphs=4
2026-03-14T00:49:53.048086	ae44ace5	116	29	1.0000	DISCARD	gen=377 glyphs=4
2026-03-14T00:49:55.501476	fdb5d108	120	30	1.0000	DISCARD	gen=333 glyphs=4
2026-03-14T00:49:55.765176	050862ad	120	30	1.0000	DISCARD	gen=377 glyphs=4
2026-03-14T00:49:58.301962	fdb5d108	120	30	1.0000	DISCARD	gen=333 glyphs=4
2026-03-14T00:49:58.604277	a78f9454	120	30	1.0000	DISCARD	gen=377 glyphs=4
2026-03-14T00:50:01.090145	2701cb73	116	29	1.0000	DISCARD	gen=333 glyphs=4
2026-03-14T00:50:01.371322	d7c8681b	120	30	1.0000	DISCARD	gen=377 glyphs=4
2026-03-14T00:50:03.824983	37f4017b	116	29	1.0000	DISCARD	gen=333 glyphs=4
2026-03-14T00:50:04.097920	0eaedb57	116	29	1.0000	DISCARD	gen=377 glyphs=4
2026-03-14T00:50:06.581759	3a2bf209	116	29	1.0000	DISCARD	gen=333 glyphs=4
2026-03-14T00:50:06.876174	8aef8872	116	29	1.0000	DISCARD	gen=377 glyphs=4
2026-03-14T00:50:09.340087	5a06ca32	120	30	1.0000	DISCARD	gen=333 glyphs=4
2026-03-14T00:50:09.614016	0eaedb57	116	29	1.0000	DISCARD	gen=377 glyphs=4
2026-03-14T00:50:12.067273	37f4017b	116	29	1.0000	DISCARD	gen=334 glyphs=4
2026-03-14T00:50:12.357633	86ab9375	116	29	1.0000	DISCARD	gen=377 glyphs=4
2026-03-14T00:50:14.825100	bfdf7cad	120	30	1.0000	DISCARD	gen=334 glyphs=4
2026-03-14T00:50:15.104307	19355583	120	30	1.0000	DISCARD	gen=378 glyphs=4
2026-03-14T00:50:17.572280	5a06ca32	120	30	1.0000	DISCARD	gen=334 glyphs=4
2026-03-14T00:50:17.838607	8aef8872	116	29	1.0000	DISCARD	gen=378 glyphs=4
2026-03-14T00:50:20.293668	bfdf7cad	120	30	1.0000	DISCARD	gen=334 glyphs=4
2026-03-14T00:50:20.568872	8aef8872	116	29	1.0000	DISCARD	gen=378 glyphs=4
2026-03-14T00:50:23.019003	1d34459a	116	29	1.0000	DISCARD	gen=334 glyphs=4
2026-03-14T00:50:23.280779	050862ad	120	30	1.0000	DISCARD	gen=378 glyphs=4
2026-03-14T00:50:25.735923	37f4017b	116	29	1.0000	DISCARD	gen=334 glyphs=4
2026-03-14T00:50:26.013745	a6ce43fe	120	30	1.0000	DISCARD	gen=378 glyphs=4
2026-03-14T00:50:28.496856	5a06ca32	120	30	1.0000	DISCARD	gen=334 glyphs=4
2026-03-14T00:50:28.767189	050862ad	120	30	1.0000	DISCARD	gen=378 glyphs=4
2026-03-14T00:50:31.360495	cd690f8c	116	29	1.0000	DISCARD	gen=334 glyphs=4
2026-03-14T00:50:31.641839	e2cd28ea	120	30	1.0000	DISCARD	gen=378 glyphs=4
2026-03-14T00:50:34.103620	fdb5d108	120	30	1.0000	DISCARD	gen=334 glyphs=4
2026-03-14T00:50:34.378183	9e34ede0	116	29	1.0000	DISCARD	gen=378 glyphs=4
2026-03-14T00:50:36.867680	5a06ca32	120	30	1.0000	DISCARD	gen=334 glyphs=4
2026-03-14T00:50:37.135921	b2662f6e	116	29	1.0000	DISCARD	gen=378 glyphs=4
2026-03-14T00:50:39.617910	37f4017b	116	29	1.0000	DISCARD	gen=335 glyphs=4
2026-03-14T00:50:39.883014	a78f9454	120	30	1.0000	DISCARD	gen=378 glyphs=4
2026-03-14T00:50:42.363698	bfdf7cad	120	30	1.0000	DISCARD	gen=335 glyphs=4
2026-03-14T00:50:42.641497	19355583	120	30	1.0000	DISCARD	gen=379 glyphs=4
2026-03-14T00:50:45.133482	37f4017b	116	29	1.0000	DISCARD	gen=335 glyphs=4
2026-03-14T00:50:45.409447	8aef8872	116	29	1.0000	DISCARD	gen=379 glyphs=4
2026-03-14T00:50:47.874199	5a06ca32	120	30	1.0000	DISCARD	gen=335 glyphs=4
2026-03-14T00:50:48.146563	d53c1d01	120	30	1.0000	DISCARD	gen=379 glyphs=4
2026-03-14T00:50:50.615308	37f4017b	116	29	1.0000	DISCARD	gen=335 glyphs=4
2026-03-14T00:50:50.889797	19355583	120	30	1.0000	DISCARD	gen=379 glyphs=4
2026-03-14T00:50:53.371478	f3ed316e	120	30	1.0000	DISCARD	gen=335 glyphs=4
2026-03-14T00:50:53.642145	25372e0a	116	29	1.0000	DISCARD	gen=379 glyphs=4
2026-03-14T00:50:56.105206	416b2a5e	120	30	1.0000	DISCARD	gen=335 glyphs=4
2026-03-14T00:50:56.390373	67cb81be	120	30	1.0000	DISCARD	gen=379 glyphs=4
2026-03-14T00:50:58.885165	070b728a	120	30	1.0000	DISCARD	gen=335 glyphs=4
2026-03-14T00:50:59.158438	19355583	120	30	1.0000	DISCARD	gen=379 glyphs=4
2026-03-14T00:51:01.683905	12b38c2d	116	29	1.0000	DISCARD	gen=335 glyphs=4
2026-03-14T00:51:01.959109	050862ad	120	30	1.0000	DISCARD	gen=379 glyphs=4
2026-03-14T00:51:04.472307	5a06ca32	120	30	1.0000	DISCARD	gen=335 glyphs=4
2026-03-14T00:51:04.744854	9e34ede0	116	29	1.0000	DISCARD	gen=379 glyphs=4
2026-03-14T00:51:07.220039	37f4017b	116	29	1.0000	DISCARD	gen=336 glyphs=4
2026-03-14T00:51:07.511764	9e34ede0	116	29	1.0000	DISCARD	gen=379 glyphs=4
2026-03-14T00:51:10.002799	bfdf7cad	120	30	1.0000	DISCARD	gen=336 glyphs=4
2026-03-14T00:51:10.271429	19355583	120	30	1.0000	DISCARD	gen=380 glyphs=4
2026-03-14T00:51:12.751540	5a06ca32	120	30	1.0000	DISCARD	gen=336 glyphs=4
2026-03-14T00:51:13.025980	8aef8872	116	29	1.0000	DISCARD	gen=380 glyphs=4
2026-03-14T00:51:15.514541	7ca87b42	116	29	1.0000	DISCARD	gen=336 glyphs=4
2026-03-14T00:51:15.783387	1e5f0e21	116	29	1.0000	DISCARD	gen=380 glyphs=4
2026-03-14T00:51:18.242172	1d34459a	116	29	1.0000	DISCARD	gen=336 glyphs=4
2026-03-14T00:51:18.508791	a78f9454	120	30	1.0000	DISCARD	gen=380 glyphs=4
2026-03-14T00:51:20.985211	7ca87b42	116	29	1.0000	DISCARD	gen=336 glyphs=4
2026-03-14T00:51:21.251289	ae44ace5	116	29	1.0000	DISCARD	gen=380 glyphs=4
2026-03-14T00:51:23.726366	5a06ca32	120	30	1.0000	DISCARD	gen=336 glyphs=4
2026-03-14T00:51:24.000822	9e34ede0	116	29	1.0000	DISCARD	gen=380 glyphs=4
2026-03-14T00:51:26.487515	14c168f9	116	29	1.0000	DISCARD	gen=336 glyphs=4
2026-03-14T00:51:26.759221	19355583	120	30	1.0000	DISCARD	gen=380 glyphs=4
2026-03-14T00:51:29.232337	0a2ad70f	124	31	0.9500	DISCARD	gen=336 glyphs=4
2026-03-14T00:51:29.513681	83aaf318	116	29	1.0000	DISCARD	gen=380 glyphs=4
2026-03-14T00:51:32.019244	55d6c151	120	30	1.0000	DISCARD	gen=336 glyphs=4
2026-03-14T00:51:32.296224	8aef8872	116	29	1.0000	DISCARD	gen=380 glyphs=4
2026-03-14T00:51:34.813901	37f4017b	116	29	1.0000	DISCARD	gen=337 glyphs=4
2026-03-14T00:51:35.100339	811e1a41	116	29	1.0000	DISCARD	gen=380 glyphs=4
2026-03-14T00:51:37.567429	bfdf7cad	120	30	1.0000	DISCARD	gen=337 glyphs=4
2026-03-14T00:51:37.835749	19355583	120	30	1.0000	DISCARD	gen=381 glyphs=4
2026-03-14T00:51:40.319996	12b38c2d	116	29	1.0000	DISCARD	gen=337 glyphs=4
2026-03-14T00:51:40.607340	8aef8872	116	29	1.0000	DISCARD	gen=381 glyphs=4
2026-03-14T00:51:43.061082	5a06ca32	120	30	1.0000	DISCARD	gen=337 glyphs=4
2026-03-14T00:51:43.340357	65ec2f04	116	29	1.0000	DISCARD	gen=381 glyphs=4
2026-03-14T00:51:45.798576	fdb5d108	120	30	1.0000	DISCARD	gen=337 glyphs=4
2026-03-14T00:51:46.076282	95b3ea16	116	29	1.0000	DISCARD	gen=381 glyphs=4
2026-03-14T00:51:48.526187	37f4017b	116	29	1.0000	DISCARD	gen=337 glyphs=4
2026-03-14T00:51:48.800473	8aef8872	116	29	1.0000	DISCARD	gen=381 glyphs=4
2026-03-14T00:51:51.295080	37f4017b	116	29	1.0000	DISCARD	gen=337 glyphs=4
2026-03-14T00:51:51.568280	ae44ace5	116	29	1.0000	DISCARD	gen=381 glyphs=4
2026-03-14T00:51:54.030238	5a06ca32	120	30	1.0000	DISCARD	gen=337 glyphs=4
2026-03-14T00:51:54.295255	b7aed8e9	116	29	1.0000	DISCARD	gen=381 glyphs=4
2026-03-14T00:51:56.785491	37f4017b	116	29	1.0000	DISCARD	gen=337 glyphs=4
2026-03-14T00:51:57.060799	8aef8872	116	29	1.0000	DISCARD	gen=381 glyphs=4
2026-03-14T00:51:59.500292	5093fb7d	120	30	1.0000	DISCARD	gen=337 glyphs=4
2026-03-14T00:51:59.773627	050862ad	120	30	1.0000	DISCARD	gen=381 glyphs=4
2026-03-14T00:52:02.272221	37f4017b	116	29	1.0000	DISCARD	gen=338 glyphs=4
2026-03-14T00:52:02.559567	b57e7176	120	30	1.0000	DISCARD	gen=381 glyphs=4
2026-03-14T00:52:05.100808	bfdf7cad	120	30	1.0000	DISCARD	gen=338 glyphs=4
2026-03-14T00:52:05.381938	19355583	120	30	1.0000	DISCARD	gen=382 glyphs=4
2026-03-14T00:52:07.912200	fdb5d108	120	30	1.0000	DISCARD	gen=338 glyphs=4
2026-03-14T00:52:08.192350	8aef8872	116	29	1.0000	DISCARD	gen=382 glyphs=4
2026-03-14T00:52:10.657580	55d6c151	120	30	1.0000	DISCARD	gen=338 glyphs=4
2026-03-14T00:52:10.940353	0eaedb57	116	29	1.0000	DISCARD	gen=382 glyphs=4
2026-03-14T00:52:13.430125	bfdf7cad	120	30	1.0000	DISCARD	gen=338 glyphs=4
2026-03-14T00:52:13.712785	dc416438	116	29	1.0000	DISCARD	gen=382 glyphs=4
2026-03-14T00:52:16.182693	e4fb6ee7	116	29	1.0000	DISCARD	gen=338 glyphs=4
2026-03-14T00:52:16.441798	0eaedb57	116	29	1.0000	DISCARD	gen=382 glyphs=4
2026-03-14T00:52:18.925411	1d34459a	116	29	1.0000	DISCARD	gen=338 glyphs=4
2026-03-14T00:52:19.199625	50dc991d	116	29	1.0000	DISCARD	gen=382 glyphs=4
2026-03-14T00:52:21.661807	5a06ca32	120	30	1.0000	DISCARD	gen=338 glyphs=4
2026-03-14T00:52:21.931095	0eaedb57	116	29	1.0000	DISCARD	gen=382 glyphs=4
2026-03-14T00:52:24.430435	e8a1c67b	116	29	1.0000	DISCARD	gen=338 glyphs=4
2026-03-14T00:52:24.710262	ed69312f	120	30	1.0000	DISCARD	gen=382 glyphs=4
2026-03-14T00:52:27.191098	55d6c151	120	30	1.0000	DISCARD	gen=338 glyphs=4
2026-03-14T00:52:27.465191	b7aed8e9	116	29	1.0000	DISCARD	gen=382 glyphs=4
2026-03-14T00:52:29.946625	37f4017b	116	29	1.0000	DISCARD	gen=339 glyphs=4
2026-03-14T00:52:30.219295	935f1c4f	116	29	1.0000	DISCARD	gen=382 glyphs=4
2026-03-14T00:52:32.703489	bfdf7cad	120	30	1.0000	DISCARD	gen=339 glyphs=4
2026-03-14T00:52:32.979554	19355583	120	30	1.0000	DISCARD	gen=383 glyphs=4
2026-03-14T00:52:35.436160	37f4017b	116	29	1.0000	DISCARD	gen=339 glyphs=4
2026-03-14T00:52:35.705460	8aef8872	116	29	1.0000	DISCARD	gen=383 glyphs=4
2026-03-14T00:52:38.269024	37f4017b	116	29	1.0000	DISCARD	gen=339 glyphs=4
2026-03-14T00:52:38.549093	ed4d51fe	116	29	1.0000	DISCARD	gen=383 glyphs=4
2026-03-14T00:52:41.012400	5a06ca32	120	30	1.0000	DISCARD	gen=339 glyphs=4
2026-03-14T00:52:41.283945	86b5c179	120	30	1.0000	DISCARD	gen=383 glyphs=4
2026-03-14T00:52:43.798816	fdb5d108	120	30	1.0000	DISCARD	gen=339 glyphs=4
2026-03-14T00:52:44.070003	3d4be636	116	29	1.0000	DISCARD	gen=383 glyphs=4
2026-03-14T00:52:46.538596	55d6c151	120	30	1.0000	DISCARD	gen=339 glyphs=4
2026-03-14T00:52:46.831499	8aef8872	116	29	1.0000	DISCARD	gen=383 glyphs=4
2026-03-14T00:52:49.294966	043cb4da	116	29	1.0000	DISCARD	gen=339 glyphs=4
2026-03-14T00:52:49.572145	f4502bca	116	29	1.0000	DISCARD	gen=383 glyphs=4
2026-03-14T00:52:52.044012	37f4017b	116	29	1.0000	DISCARD	gen=339 glyphs=4
2026-03-14T00:52:52.305643	e2cd28ea	120	30	1.0000	DISCARD	gen=383 glyphs=4
2026-03-14T00:52:54.756898	37f4017b	116	29	1.0000	DISCARD	gen=339 glyphs=4
2026-03-14T00:52:55.049124	b7aed8e9	116	29	1.0000	DISCARD	gen=383 glyphs=4
2026-03-14T00:52:57.542941	37f4017b	116	29	1.0000	DISCARD	gen=340 glyphs=4
2026-03-14T00:52:57.826126	050862ad	120	30	1.0000	DISCARD	gen=383 glyphs=4
2026-03-14T00:53:00.327297	bfdf7cad	120	30	1.0000	DISCARD	gen=340 glyphs=4
2026-03-14T00:53:00.615121	19355583	120	30	1.0000	DISCARD	gen=384 glyphs=4
2026-03-14T00:53:03.101146	55d6c151	120	30	1.0000	DISCARD	gen=340 glyphs=4
2026-03-14T00:53:03.377627	8aef8872	116	29	1.0000	DISCARD	gen=384 glyphs=4
2026-03-14T00:53:05.857548	12b38c2d	116	29	1.0000	DISCARD	gen=340 glyphs=4
2026-03-14T00:53:06.140727	0eaedb57	116	29	1.0000	DISCARD	gen=384 glyphs=4
2026-03-14T00:53:08.653772	fdb5d108	120	30	1.0000	DISCARD	gen=340 glyphs=4
2026-03-14T00:53:08.938102	c865b7cf	120	30	1.0000	DISCARD	gen=384 glyphs=4
2026-03-14T00:53:11.453847	37f4017b	116	29	1.0000	DISCARD	gen=340 glyphs=4
2026-03-14T00:53:11.719812	0eaedb57	116	29	1.0000	DISCARD	gen=384 glyphs=4
2026-03-14T00:53:14.180852	ecbcd104	120	30	1.0000	DISCARD	gen=340 glyphs=4
2026-03-14T00:53:14.454350	19355583	120	30	1.0000	DISCARD	gen=384 glyphs=4
2026-03-14T00:53:16.926701	71e2ba66	116	29	1.0000	DISCARD	gen=340 glyphs=4
2026-03-14T00:53:17.201406	b57e7176	120	30	1.0000	DISCARD	gen=384 glyphs=4
2026-03-14T00:53:19.640418	55d6c151	120	30	1.0000	DISCARD	gen=340 glyphs=4
2026-03-14T00:53:19.909935	8aef8872	116	29	1.0000	DISCARD	gen=384 glyphs=4
2026-03-14T00:53:22.369744	37f4017b	116	29	1.0000	DISCARD	gen=340 glyphs=4
2026-03-14T00:53:22.646111	50dc991d	116	29	1.0000	DISCARD	gen=384 glyphs=4
2026-03-14T00:53:25.122395	37f4017b	116	29	1.0000	DISCARD	gen=341 glyphs=4
2026-03-14T00:53:25.405906	050862ad	120	30	1.0000	DISCARD	gen=384 glyphs=4
2026-03-14T00:53:27.882027	bfdf7cad	120	30	1.0000	DISCARD	gen=341 glyphs=4
2026-03-14T00:53:28.150783	19355583	120	30	1.0000	DISCARD	gen=385 glyphs=4
2026-03-14T00:53:30.634383	37f4017b	116	29	1.0000	DISCARD	gen=341 glyphs=4
2026-03-14T00:53:30.913067	8aef8872	116	29	1.0000	DISCARD	gen=385 glyphs=4
2026-03-14T00:53:33.366185	37f4017b	116	29	1.0000	DISCARD	gen=341 glyphs=4
2026-03-14T00:53:33.641403	9e34ede0	116	29	1.0000	DISCARD	gen=385 glyphs=4
2026-03-14T00:53:36.121183	e13711cc	116	29	0.9500	DISCARD	gen=341 glyphs=4
2026-03-14T00:53:36.409568	eca7ab6c	116	29	1.0000	DISCARD	gen=385 glyphs=4
2026-03-14T00:53:38.831212	5a06ca32	120	30	1.0000	DISCARD	gen=341 glyphs=4
2026-03-14T00:53:39.102917	b57e7176	120	30	1.0000	DISCARD	gen=385 glyphs=4
2026-03-14T00:53:41.641352	37f4017b	116	29	1.0000	DISCARD	gen=341 glyphs=4
2026-03-14T00:53:41.931956	a67c4d9e	120	30	1.0000	DISCARD	gen=385 glyphs=4
2026-03-14T00:53:44.390320	37f4017b	116	29	1.0000	DISCARD	gen=341 glyphs=4
2026-03-14T00:53:44.662259	9bdcbe8a	116	29	1.0000	DISCARD	gen=385 glyphs=4
2026-03-14T00:53:47.106251	55d6c151	120	30	1.0000	DISCARD	gen=341 glyphs=4
2026-03-14T00:53:47.382494	050862ad	120	30	1.0000	DISCARD	gen=385 glyphs=4
2026-03-14T00:53:49.835393	12b38c2d	116	29	1.0000	DISCARD	gen=341 glyphs=4
2026-03-14T00:53:50.103085	8aef8872	116	29	1.0000	DISCARD	gen=385 glyphs=4
2026-03-14T00:53:52.545202	37f4017b	116	29	1.0000	DISCARD	gen=342 glyphs=4
2026-03-14T00:53:52.818046	19355583	120	30	1.0000	DISCARD	gen=385 glyphs=4
2026-03-14T00:53:55.256282	bfdf7cad	120	30	1.0000	DISCARD	gen=342 glyphs=4
2026-03-14T00:53:55.530346	19355583	120	30	1.0000	DISCARD	gen=386 glyphs=4
2026-03-14T00:53:57.962882	26ade9c8	116	29	1.0000	DISCARD	gen=342 glyphs=4
2026-03-14T00:53:58.237146	8aef8872	116	29	1.0000	DISCARD	gen=386 glyphs=4
2026-03-14T00:54:00.677635	5a06ca32	120	30	1.0000	DISCARD	gen=342 glyphs=4
2026-03-14T00:54:00.939653	ed3a62d2	116	29	1.0000	DISCARD	gen=386 glyphs=4
2026-03-14T00:54:03.417078	39cc6ec4	120	30	1.0000	DISCARD	gen=342 glyphs=4
2026-03-14T00:54:03.678911	19355583	120	30	1.0000	DISCARD	gen=386 glyphs=4
2026-03-14T00:54:06.143900	55d6c151	120	30	1.0000	DISCARD	gen=342 glyphs=4
2026-03-14T00:54:06.423295	a214b91b	116	29	1.0000	DISCARD	gen=386 glyphs=4
2026-03-14T00:54:08.875139	55d6c151	120	30	1.0000	DISCARD	gen=342 glyphs=4
2026-03-14T00:54:09.141077	5b9279ce	116	29	1.0000	DISCARD	gen=386 glyphs=4
2026-03-14T00:54:11.585428	bf23d721	120	30	1.0000	DISCARD	gen=342 glyphs=4
2026-03-14T00:54:11.860027	ae44ace5	116	29	1.0000	DISCARD	gen=386 glyphs=4
2026-03-14T00:54:14.420501	7df1afe5	116	29	1.0000	DISCARD	gen=342 glyphs=4
2026-03-14T00:54:14.691141	19355583	120	30	1.0000	DISCARD	gen=386 glyphs=4
2026-03-14T00:54:17.199160	37f4017b	116	29	1.0000	DISCARD	gen=342 glyphs=4
2026-03-14T00:54:17.469995	61d77fd1	120	30	1.0000	DISCARD	gen=386 glyphs=4
2026-03-14T00:54:19.956475	37f4017b	116	29	1.0000	DISCARD	gen=343 glyphs=4
2026-03-14T00:54:20.219668	28e2cc95	116	29	1.0000	DISCARD	gen=386 glyphs=4
2026-03-14T00:54:22.687222	bfdf7cad	120	30	1.0000	DISCARD	gen=343 glyphs=4
2026-03-14T00:54:22.973627	19355583	120	30	1.0000	DISCARD	gen=387 glyphs=4
2026-03-14T00:54:25.446860	f3372a6d	116	29	1.0000	DISCARD	gen=343 glyphs=4
2026-03-14T00:54:25.727778	8aef8872	116	29	1.0000	DISCARD	gen=387 glyphs=4
2026-03-14T00:54:28.182389	5a06ca32	120	30	1.0000	DISCARD	gen=343 glyphs=4
2026-03-14T00:54:28.461529	a757bf71	116	29	1.0000	DISCARD	gen=387 glyphs=4
2026-03-14T00:54:30.973008	fdb5d108	120	30	1.0000	DISCARD	gen=343 glyphs=4
2026-03-14T00:54:31.248153	0eaedb57	116	29	1.0000	DISCARD	gen=387 glyphs=4
2026-03-14T00:54:33.706950	55d6c151	120	30	1.0000	DISCARD	gen=343 glyphs=4
2026-03-14T00:54:33.983749	8aef8872	116	29	1.0000	DISCARD	gen=387 glyphs=4
2026-03-14T00:54:36.451195	5b9807ac	120	30	1.0000	DISCARD	gen=343 glyphs=4
2026-03-14T00:54:36.732446	9e34ede0	116	29	1.0000	DISCARD	gen=387 glyphs=4
2026-03-14T00:54:39.199755	55d6c151	120	30	1.0000	DISCARD	gen=343 glyphs=4
2026-03-14T00:54:39.474555	3ca2baaa	120	30	1.0000	DISCARD	gen=387 glyphs=4
2026-03-14T00:54:41.954496	12b38c2d	116	29	1.0000	DISCARD	gen=343 glyphs=4
2026-03-14T00:54:42.234407	9d634fa8	120	30	1.0000	DISCARD	gen=387 glyphs=4
2026-03-14T00:54:44.825763	37f4017b	116	29	1.0000	DISCARD	gen=343 glyphs=4
2026-03-14T00:54:45.089350	b7aed8e9	116	29	1.0000	DISCARD	gen=387 glyphs=4
2026-03-14T00:54:47.588524	37f4017b	116	29	1.0000	DISCARD	gen=344 glyphs=4
2026-03-14T00:54:47.865871	8aef8872	116	29	1.0000	DISCARD	gen=387 glyphs=4
2026-03-14T00:54:50.318660	bfdf7cad	120	30	1.0000	DISCARD	gen=344 glyphs=4
2026-03-14T00:54:50.590501	19355583	120	30	1.0000	DISCARD	gen=388 glyphs=4
2026-03-14T00:54:53.081137	37f4017b	116	29	1.0000	DISCARD	gen=344 glyphs=4
2026-03-14T00:54:53.360731	8aef8872	116	29	1.0000	DISCARD	gen=388 glyphs=4
2026-03-14T00:54:55.839727	464ddcb5	120	30	1.0000	DISCARD	gen=344 glyphs=4
2026-03-14T00:54:56.109123	b57e7176	120	30	1.0000	DISCARD	gen=388 glyphs=4
2026-03-14T00:54:58.557643	5a06ca32	120	30	1.0000	DISCARD	gen=344 glyphs=4
2026-03-14T00:54:58.832387	050862ad	120	30	1.0000	DISCARD	gen=388 glyphs=4
