timestamp	program_hash	spirv_size	word_count	fitness	status	description
2026-03-14T01:08:32.758289	37f4017b	116	29	1.0000	DISCARD	gen=373 glyphs=4
2026-03-14T01:08:33.024854	0eaedb57	116	29	1.0000	DISCARD	gen=417 glyphs=4
2026-03-14T01:08:35.534636	55d6c151	120	30	1.0000	DISCARD	gen=373 glyphs=4
2026-03-14T01:08:35.816252	0eaedb57	116	29	1.0000	DISCARD	gen=417 glyphs=4
2026-03-14T01:08:38.296808	a32634ac	116	29	1.0000	DISCARD	gen=373 glyphs=4
2026-03-14T01:08:38.579178	eca7ab6c	116	29	1.0000	DISCARD	gen=417 glyphs=4
2026-03-14T01:08:41.067327	37f4017b	116	29	1.0000	DISCARD	gen=374 glyphs=4
2026-03-14T01:08:41.334424	ae44ace5	116	29	1.0000	DISCARD	gen=417 glyphs=4
2026-03-14T01:08:43.818326	bfdf7cad	120	30	1.0000	DISCARD	gen=374 glyphs=4
2026-03-14T01:08:44.092187	19355583	120	30	1.0000	DISCARD	gen=418 glyphs=4
2026-03-14T01:08:46.594564	4c9b0dd4	120	30	1.0000	DISCARD	gen=374 glyphs=4
2026-03-14T01:08:46.877062	8aef8872	116	29	1.0000	DISCARD	gen=418 glyphs=4
2026-03-14T01:08:49.355890	41688a08	116	29	1.0000	DISCARD	gen=374 glyphs=4
2026-03-14T01:08:49.626311	19355583	120	30	1.0000	DISCARD	gen=418 glyphs=4
2026-03-14T01:08:52.128243	a20b6b1d	116	29	0.9500	DISCARD	gen=374 glyphs=4
2026-03-14T01:08:52.415650	b57e7176	120	30	1.0000	DISCARD	gen=418 glyphs=4
2026-03-14T01:08:54.892776	55d6c151	120	30	1.0000	DISCARD	gen=374 glyphs=4
2026-03-14T01:08:55.166773	5eed87dd	116	29	1.0000	DISCARD	gen=418 glyphs=4
2026-03-14T01:08:57.656018	fdb5d108	120	30	1.0000	DISCARD	gen=374 glyphs=4
2026-03-14T01:08:57.929748	3b2092fa	116	29	1.0000	DISCARD	gen=418 glyphs=4
2026-03-14T01:09:00.405838	d48daef1	116	29	1.0000	DISCARD	gen=374 glyphs=4
2026-03-14T01:09:00.679946	8aef8872	116	29	1.0000	DISCARD	gen=418 glyphs=4
2026-03-14T01:09:03.157500	2701cb73	116	29	1.0000	DISCARD	gen=374 glyphs=4
2026-03-14T01:09:03.488954	67528752	116	29	1.0000	DISCARD	gen=418 glyphs=4
2026-03-14T01:09:06.023067	bfdf7cad	120	30	1.0000	DISCARD	gen=374 glyphs=4
2026-03-14T01:09:06.311743	e8c7f6cf	120	30	1.0000	DISCARD	gen=418 glyphs=4
2026-03-14T01:09:08.834381	37f4017b	116	29	1.0000	DISCARD	gen=375 glyphs=4
2026-03-14T01:09:09.111488	eca7ab6c	116	29	1.0000	DISCARD	gen=418 glyphs=4
2026-03-14T01:09:11.626993	bfdf7cad	120	30	1.0000	DISCARD	gen=375 glyphs=4
2026-03-14T01:09:11.894845	19355583	120	30	1.0000	DISCARD	gen=419 glyphs=4
2026-03-14T01:09:14.567120	3b076d7f	120	30	1.0000	DISCARD	gen=375 glyphs=4
2026-03-14T01:09:14.842942	8aef8872	116	29	1.0000	DISCARD	gen=419 glyphs=4
2026-03-14T01:09:17.339681	d11c1062	120	30	1.0000	DISCARD	gen=375 glyphs=4
2026-03-14T01:09:17.614435	0a409d8b	120	30	1.0000	DISCARD	gen=419 glyphs=4
2026-03-14T01:09:20.226309	3b7b3c79	116	29	0.9500	DISCARD	gen=375 glyphs=4
2026-03-14T01:09:20.507282	59a77e92	116	29	0.9500	DISCARD	gen=419 glyphs=4
2026-03-14T01:09:22.981559	7ca87b42	116	29	1.0000	DISCARD	gen=375 glyphs=4
2026-03-14T01:09:23.259104	4ec70d33	116	29	1.0000	DISCARD	gen=419 glyphs=4
2026-03-14T01:09:25.772333	aca4d291	116	29	1.0000	DISCARD	gen=375 glyphs=4
2026-03-14T01:09:26.038663	eea7880e	116	29	0.9500	DISCARD	gen=419 glyphs=4
2026-03-14T01:09:28.506864	f9182c2e	120	30	1.0000	DISCARD	gen=375 glyphs=4
2026-03-14T01:09:28.792803	0eaedb57	116	29	1.0000	DISCARD	gen=419 glyphs=4
2026-03-14T01:09:31.293726	37f4017b	116	29	1.0000	DISCARD	gen=375 glyphs=4
2026-03-14T01:09:31.576055	0eaedb57	116	29	1.0000	DISCARD	gen=419 glyphs=4
2026-03-14T01:09:34.065419	71e2ba66	116	29	1.0000	DISCARD	gen=375 glyphs=4
2026-03-14T01:09:34.350894	e2cd28ea	120	30	1.0000	DISCARD	gen=419 glyphs=4
2026-03-14T01:09:36.956932	37f4017b	116	29	1.0000	DISCARD	gen=376 glyphs=4
2026-03-14T01:09:37.240931	ae44ace5	116	29	1.0000	DISCARD	gen=419 glyphs=4
2026-03-14T01:09:39.705434	bfdf7cad	120	30	1.0000	DISCARD	gen=376 glyphs=4
2026-03-14T01:09:39.980282	19355583	120	30	1.0000	DISCARD	gen=420 glyphs=4
2026-03-14T01:09:42.467711	37f4017b	116	29	1.0000	DISCARD	gen=376 glyphs=4
2026-03-14T01:09:42.742946	8aef8872	116	29	1.0000	DISCARD	gen=420 glyphs=4
2026-03-14T01:09:45.235039	37f4017b	116	29	1.0000	DISCARD	gen=376 glyphs=4
2026-03-14T01:09:45.529282	c3e41613	116	29	1.0000	DISCARD	gen=420 glyphs=4
2026-03-14T01:09:48.032751	de94da16	120	30	1.0000	DISCARD	gen=376 glyphs=4
2026-03-14T01:09:48.296170	56000812	116	29	0.9500	DISCARD	gen=420 glyphs=4
2026-03-14T01:09:51.000387	cb58e3f7	116	29	0.9500	DISCARD	gen=376 glyphs=4
2026-03-14T01:09:51.269640	50dc991d	116	29	1.0000	DISCARD	gen=420 glyphs=4
2026-03-14T01:09:53.787205	4901769c	116	29	1.0000	DISCARD	gen=376 glyphs=4
2026-03-14T01:09:54.064943	e5b252a5	116	29	1.0000	DISCARD	gen=420 glyphs=4
2026-03-14T01:09:56.576733	55d6c151	120	30	1.0000	DISCARD	gen=376 glyphs=4
2026-03-14T01:09:56.861019	0eaedb57	116	29	1.0000	DISCARD	gen=420 glyphs=4
2026-03-14T01:10:00.050221	5a06ca32	120	30	1.0000	DISCARD	gen=376 glyphs=4
2026-03-14T01:10:00.339509	ae44ace5	116	29	1.0000	DISCARD	gen=420 glyphs=4
2026-03-14T01:10:03.526659	37f4017b	116	29	1.0000	DISCARD	gen=376 glyphs=4
2026-03-14T01:10:03.890288	25cbaa36	116	29	1.0000	DISCARD	gen=420 glyphs=4
2026-03-14T01:10:07.027868	37f4017b	116	29	1.0000	DISCARD	gen=377 glyphs=4
2026-03-14T01:10:07.591536	54fe8baa	116	29	1.0000	DISCARD	gen=420 glyphs=4
2026-03-14T01:10:10.758434	bfdf7cad	120	30	1.0000	DISCARD	gen=377 glyphs=4
2026-03-14T01:10:11.050121	19355583	120	30	1.0000	DISCARD	gen=421 glyphs=4
2026-03-14T01:10:13.546587	bfdf7cad	120	30	1.0000	DISCARD	gen=377 glyphs=4
2026-03-14T01:10:13.808449	8aef8872	116	29	1.0000	DISCARD	gen=421 glyphs=4
2026-03-14T01:10:16.479748	5a06ca32	120	30	1.0000	DISCARD	gen=377 glyphs=4
2026-03-14T01:10:16.754149	9e34ede0	116	29	1.0000	DISCARD	gen=421 glyphs=4
2026-03-14T01:10:19.219138	5a06ca32	120	30	1.0000	DISCARD	gen=377 glyphs=4
2026-03-14T01:10:19.496181	050862ad	120	30	1.0000	DISCARD	gen=421 glyphs=4
2026-03-14T01:10:22.004755	55d6c151	120	30	1.0000	DISCARD	gen=377 glyphs=4
2026-03-14T01:10:22.281554	8aef8872	116	29	1.0000	DISCARD	gen=421 glyphs=4
2026-03-14T01:10:24.755446	4c9b0dd4	120	30	1.0000	DISCARD	gen=377 glyphs=4
2026-03-14T01:10:25.027374	93c94ea1	120	30	0.9500	DISCARD	gen=421 glyphs=4
2026-03-14T01:10:27.510947	bf97a8a9	116	29	1.0000	DISCARD	gen=377 glyphs=4
2026-03-14T01:10:27.794216	8aef8872	116	29	1.0000	DISCARD	gen=421 glyphs=4
2026-03-14T01:10:30.285092	f0048f7b	120	30	1.0000	DISCARD	gen=377 glyphs=4
2026-03-14T01:10:30.566179	8aef8872	116	29	1.0000	DISCARD	gen=421 glyphs=4
2026-03-14T01:10:33.109469	37f4017b	116	29	1.0000	DISCARD	gen=377 glyphs=4
2026-03-14T01:10:33.391672	19355583	120	30	1.0000	DISCARD	gen=421 glyphs=4
2026-03-14T01:10:35.887272	37f4017b	116	29	1.0000	DISCARD	gen=378 glyphs=4
2026-03-14T01:10:36.154291	d7c8681b	120	30	1.0000	DISCARD	gen=421 glyphs=4
2026-03-14T01:10:38.633248	bfdf7cad	120	30	1.0000	DISCARD	gen=378 glyphs=4
2026-03-14T01:10:38.902649	19355583	120	30	1.0000	DISCARD	gen=422 glyphs=4
2026-03-14T01:10:41.464117	55d6c151	120	30	1.0000	DISCARD	gen=378 glyphs=4
2026-03-14T01:10:41.728659	8aef8872	116	29	1.0000	DISCARD	gen=422 glyphs=4
2026-03-14T01:10:44.264872	37f4017b	116	29	1.0000	DISCARD	gen=378 glyphs=4
2026-03-14T01:10:44.539354	0eaedb57	116	29	1.0000	DISCARD	gen=422 glyphs=4
2026-03-14T01:10:47.041215	55d6c151	120	30	1.0000	DISCARD	gen=378 glyphs=4
2026-03-14T01:10:47.322510	1e5f0e21	116	29	1.0000	DISCARD	gen=422 glyphs=4
2026-03-14T01:10:49.805890	03932bb4	116	29	0.9500	DISCARD	gen=378 glyphs=4
2026-03-14T01:10:50.082302	553f2ab2	116	29	1.0000	DISCARD	gen=422 glyphs=4
2026-03-14T01:10:52.541945	5a06ca32	120	30	1.0000	DISCARD	gen=378 glyphs=4
2026-03-14T01:10:52.825160	06ba0c54	116	29	1.0000	DISCARD	gen=422 glyphs=4
2026-03-14T01:10:55.316890	0cf99712	120	30	1.0000	DISCARD	gen=378 glyphs=4
2026-03-14T01:10:55.603108	19355583	120	30	1.0000	DISCARD	gen=422 glyphs=4
2026-03-14T01:10:58.071084	2701cb73	116	29	1.0000	DISCARD	gen=378 glyphs=4
2026-03-14T01:10:58.348765	e2cd28ea	120	30	1.0000	DISCARD	gen=422 glyphs=4
2026-03-14T01:11:00.821991	5a06ca32	120	30	1.0000	DISCARD	gen=378 glyphs=4
2026-03-14T01:11:01.105244	e8c7f6cf	120	30	1.0000	DISCARD	gen=422 glyphs=4
2026-03-14T01:11:03.583780	37f4017b	116	29	1.0000	DISCARD	gen=379 glyphs=4
2026-03-14T01:11:03.865482	8aef8872	116	29	1.0000	DISCARD	gen=422 glyphs=4
2026-03-14T01:11:06.349432	bfdf7cad	120	30	1.0000	DISCARD	gen=379 glyphs=4
2026-03-14T01:11:06.625059	19355583	120	30	1.0000	DISCARD	gen=423 glyphs=4
2026-03-14T01:11:09.070505	c05e58c2	120	30	1.0000	DISCARD	gen=379 glyphs=4
2026-03-14T01:11:09.346187	8aef8872	116	29	1.0000	DISCARD	gen=423 glyphs=4
2026-03-14T01:11:12.789884	46111116	120	30	1.0000	DISCARD	gen=379 glyphs=4
2026-03-14T01:11:13.221106	875e0f8a	116	29	1.0000	DISCARD	gen=423 glyphs=4
2026-03-14T01:11:16.249366	37f4017b	116	29	1.0000	DISCARD	gen=379 glyphs=4
2026-03-14T01:11:16.521039	b7aed8e9	116	29	1.0000	DISCARD	gen=423 glyphs=4
2026-03-14T01:11:19.068273	12b38c2d	116	29	1.0000	DISCARD	gen=379 glyphs=4
2026-03-14T01:11:19.348651	1d477f83	116	29	1.0000	DISCARD	gen=423 glyphs=4
2026-03-14T01:11:22.519864	7ca87b42	116	29	1.0000	DISCARD	gen=379 glyphs=4
2026-03-14T01:11:22.891092	19a15bb4	116	29	1.0000	DISCARD	gen=423 glyphs=4
2026-03-14T01:11:25.544860	4c9b0dd4	120	30	1.0000	DISCARD	gen=379 glyphs=4
2026-03-14T01:11:25.820203	67cb81be	120	30	1.0000	DISCARD	gen=423 glyphs=4
2026-03-14T01:11:28.303061	1d34459a	116	29	1.0000	DISCARD	gen=379 glyphs=4
2026-03-14T01:11:28.578943	42f101d4	116	29	1.0000	DISCARD	gen=423 glyphs=4
2026-03-14T01:11:31.075919	5b9807ac	120	30	1.0000	DISCARD	gen=379 glyphs=4
2026-03-14T01:11:31.345247	67cb81be	120	30	1.0000	DISCARD	gen=423 glyphs=4
2026-03-14T01:11:33.837161	37f4017b	116	29	1.0000	DISCARD	gen=380 glyphs=4
2026-03-14T01:11:34.099883	5a99bee4	116	29	0.9500	DISCARD	gen=423 glyphs=4
2026-03-14T01:11:36.780360	bfdf7cad	120	30	1.0000	DISCARD	gen=380 glyphs=4
2026-03-14T01:11:37.063993	19355583	120	30	1.0000	DISCARD	gen=424 glyphs=4
2026-03-14T01:11:39.571064	5a06ca32	120	30	1.0000	DISCARD	gen=380 glyphs=4
2026-03-14T01:11:39.857580	8aef8872	116	29	1.0000	DISCARD	gen=424 glyphs=4
2026-03-14T01:11:42.357822	3b4c6c76	116	29	1.0000	DISCARD	gen=380 glyphs=4
2026-03-14T01:11:42.633601	6027d8bd	116	29	1.0000	DISCARD	gen=424 glyphs=4
2026-03-14T01:11:45.204306	3224bd3c	116	29	1.0000	DISCARD	gen=380 glyphs=4
2026-03-14T01:11:45.482009	19355583	120	30	1.0000	DISCARD	gen=424 glyphs=4
2026-03-14T01:11:47.990254	fdb5d108	120	30	1.0000	DISCARD	gen=380 glyphs=4
2026-03-14T01:11:48.261786	21b05aca	116	29	1.0000	DISCARD	gen=424 glyphs=4
2026-03-14T01:11:50.736791	bfdf7cad	120	30	1.0000	DISCARD	gen=380 glyphs=4
2026-03-14T01:11:51.022141	c0b80105	120	30	1.0000	DISCARD	gen=424 glyphs=4
2026-03-14T01:11:53.522279	1b21f299	120	30	1.0000	DISCARD	gen=380 glyphs=4
2026-03-14T01:11:53.797210	0eaedb57	116	29	1.0000	DISCARD	gen=424 glyphs=4
2026-03-14T01:11:56.286958	fdb5d108	120	30	1.0000	DISCARD	gen=380 glyphs=4
2026-03-14T01:11:56.569974	c65a02c3	116	29	1.0000	DISCARD	gen=424 glyphs=4
2026-03-14T01:11:59.060665	7ca87b42	116	29	1.0000	DISCARD	gen=380 glyphs=4
2026-03-14T01:11:59.345593	8df78625	116	29	1.0000	DISCARD	gen=424 glyphs=4
2026-03-14T01:12:01.875566	37f4017b	116	29	1.0000	DISCARD	gen=381 glyphs=4
2026-03-14T01:12:02.150177	082e237d	116	29	1.0000	DISCARD	gen=424 glyphs=4
2026-03-14T01:12:04.652303	bfdf7cad	120	30	1.0000	DISCARD	gen=381 glyphs=4
2026-03-14T01:12:04.939001	19355583	120	30	1.0000	DISCARD	gen=425 glyphs=4
2026-03-14T01:12:07.427713	5a06ca32	120	30	1.0000	DISCARD	gen=381 glyphs=4
2026-03-14T01:12:07.721613	8aef8872	116	29	1.0000	DISCARD	gen=425 glyphs=4
2026-03-14T01:12:10.239706	d37d712d	116	29	1.0000	DISCARD	gen=381 glyphs=4
2026-03-14T01:12:10.512832	67cb81be	120	30	1.0000	DISCARD	gen=425 glyphs=4
2026-03-14T01:12:13.012940	5a06ca32	120	30	1.0000	DISCARD	gen=381 glyphs=4
2026-03-14T01:12:13.308575	50dc991d	116	29	1.0000	DISCARD	gen=425 glyphs=4
2026-03-14T01:12:15.813103	2701cb73	116	29	1.0000	DISCARD	gen=381 glyphs=4
2026-03-14T01:12:16.091134	a3c452b6	120	30	1.0000	DISCARD	gen=425 glyphs=4
2026-03-14T01:12:18.587804	3137b8ae	116	29	1.0000	DISCARD	gen=381 glyphs=4
2026-03-14T01:12:18.854054	1e5f0e21	116	29	1.0000	DISCARD	gen=425 glyphs=4
2026-03-14T01:12:21.364532	37f4017b	116	29	1.0000	DISCARD	gen=381 glyphs=4
2026-03-14T01:12:21.643767	8aef8872	116	29	1.0000	DISCARD	gen=425 glyphs=4
2026-03-14T01:12:24.121480	5a06ca32	120	30	1.0000	DISCARD	gen=381 glyphs=4
2026-03-14T01:12:24.420078	8aef8872	116	29	1.0000	DISCARD	gen=425 glyphs=4
2026-03-14T01:12:26.928314	fdb5d108	120	30	1.0000	DISCARD	gen=381 glyphs=4
2026-03-14T01:12:27.202856	0eaedb57	116	29	1.0000	DISCARD	gen=425 glyphs=4
2026-03-14T01:12:29.696496	37f4017b	116	29	1.0000	DISCARD	gen=382 glyphs=4
2026-03-14T01:12:29.984137	19355583	120	30	1.0000	DISCARD	gen=425 glyphs=4
2026-03-14T01:12:32.472231	bfdf7cad	120	30	1.0000	DISCARD	gen=382 glyphs=4
2026-03-14T01:12:32.752171	19355583	120	30	1.0000	DISCARD	gen=426 glyphs=4
2026-03-14T01:12:35.262703	5b9807ac	120	30	1.0000	DISCARD	gen=382 glyphs=4
2026-03-14T01:12:35.546296	8aef8872	116	29	1.0000	DISCARD	gen=426 glyphs=4
2026-03-14T01:12:38.034666	f2b4193b	120	30	1.0000	DISCARD	gen=382 glyphs=4
2026-03-14T01:12:38.305785	eca7ab6c	116	29	1.0000	DISCARD	gen=426 glyphs=4
2026-03-14T01:12:40.793481	55d6c151	120	30	1.0000	DISCARD	gen=382 glyphs=4
2026-03-14T01:12:41.070224	da7201c7	120	30	1.0000	DISCARD	gen=426 glyphs=4
2026-03-14T01:12:43.572888	c29998af	116	29	1.0000	DISCARD	gen=382 glyphs=4
2026-03-14T01:12:43.857313	19355583	120	30	1.0000	DISCARD	gen=426 glyphs=4
2026-03-14T01:12:46.432282	8c390933	116	29	1.0000	DISCARD	gen=382 glyphs=4
2026-03-14T01:12:46.714243	8438affb	116	29	1.0000	DISCARD	gen=426 glyphs=4
2026-03-14T01:12:49.253915	37f4017b	116	29	1.0000	DISCARD	gen=382 glyphs=4
2026-03-14T01:12:49.532989	35e6f7a6	116	29	1.0000	DISCARD	gen=426 glyphs=4
2026-03-14T01:12:52.209044	12b38c2d	116	29	1.0000	DISCARD	gen=382 glyphs=4
2026-03-14T01:12:52.489994	cee2626b	116	29	1.0000	DISCARD	gen=426 glyphs=4
2026-03-14T01:12:54.995072	5a06ca32	120	30	1.0000	DISCARD	gen=382 glyphs=4
2026-03-14T01:12:55.268617	50dc991d	116	29	1.0000	DISCARD	gen=426 glyphs=4
2026-03-14T01:12:57.754505	37f4017b	116	29	1.0000	DISCARD	gen=383 glyphs=4
2026-03-14T01:12:58.037004	a1f114cf	116	29	1.0000	DISCARD	gen=426 glyphs=4
2026-03-14T01:13:00.536330	bfdf7cad	120	30	1.0000	DISCARD	gen=383 glyphs=4
2026-03-14T01:13:00.802846	19355583	120	30	1.0000	DISCARD	gen=427 glyphs=4
2026-03-14T01:13:03.330941	71e2ba66	116	29	1.0000	DISCARD	gen=383 glyphs=4
2026-03-14T01:13:03.606718	8aef8872	116	29	1.0000	DISCARD	gen=427 glyphs=4
2026-03-14T01:13:06.072661	bfdf7cad	120	30	1.0000	DISCARD	gen=383 glyphs=4
2026-03-14T01:13:06.360583	fb69938b	116	29	1.0000	DISCARD	gen=427 glyphs=4
2026-03-14T01:13:08.839129	5b9807ac	120	30	1.0000	DISCARD	gen=383 glyphs=4
2026-03-14T01:13:09.113703	d7c8681b	120	30	1.0000	DISCARD	gen=427 glyphs=4
2026-03-14T01:13:11.563005	56969a88	120	30	1.0000	DISCARD	gen=383 glyphs=4
2026-03-14T01:13:11.847040	e2cd28ea	120	30	1.0000	DISCARD	gen=427 glyphs=4
2026-03-14T01:13:14.341181	fdb5d108	120	30	1.0000	DISCARD	gen=383 glyphs=4
2026-03-14T01:13:14.617567	19355583	120	30	1.0000	DISCARD	gen=427 glyphs=4
2026-03-14T01:13:17.078936	f160b54b	120	30	1.0000	DISCARD	gen=383 glyphs=4
2026-03-14T01:13:17.350448	0eaedb57	116	29	1.0000	DISCARD	gen=427 glyphs=4
2026-03-14T01:13:19.969099	f8969594	116	29	1.0000	DISCARD	gen=383 glyphs=4
2026-03-14T01:13:20.238361	67cb81be	120	30	1.0000	DISCARD	gen=427 glyphs=4
2026-03-14T01:13:22.699342	bfdf7cad	120	30	1.0000	DISCARD	gen=383 glyphs=4
2026-03-14T01:13:22.975825	050862ad	120	30	1.0000	DISCARD	gen=427 glyphs=4
2026-03-14T01:13:25.456453	37f4017b	116	29	1.0000	DISCARD	gen=384 glyphs=4
2026-03-14T01:13:25.731824	050862ad	120	30	1.0000	DISCARD	gen=427 glyphs=4
2026-03-14T01:13:28.244095	bfdf7cad	120	30	1.0000	DISCARD	gen=384 glyphs=4
2026-03-14T01:13:28.521063	19355583	120	30	1.0000	DISCARD	gen=428 glyphs=4
2026-03-14T01:13:31.005065	1bf49acd	120	30	1.0000	DISCARD	gen=384 glyphs=4
2026-03-14T01:13:31.279237	8aef8872	116	29	1.0000	DISCARD	gen=428 glyphs=4
2026-03-14T01:13:33.782806	37f4017b	116	29	1.0000	DISCARD	gen=384 glyphs=4
2026-03-14T01:13:34.054671	67cb81be	120	30	1.0000	DISCARD	gen=428 glyphs=4
2026-03-14T01:13:36.526490	5a06ca32	120	30	1.0000	DISCARD	gen=384 glyphs=4
2026-03-14T01:13:36.793599	b57e7176	120	30	1.0000	DISCARD	gen=428 glyphs=4
2026-03-14T01:13:39.287807	8f7c7bd1	116	29	1.0000	DISCARD	gen=384 glyphs=4
2026-03-14T01:13:39.553251	7fca6f87	116	29	1.0000	DISCARD	gen=428 glyphs=4
2026-03-14T01:13:42.037608	01a804ef	116	29	0.9500	DISCARD	gen=384 glyphs=4
2026-03-14T01:13:42.313917	19355583	120	30	1.0000	DISCARD	gen=428 glyphs=4
2026-03-14T01:13:44.789411	87e36770	120	30	1.0000	DISCARD	gen=384 glyphs=4
2026-03-14T01:13:45.072891	337cc697	116	29	1.0000	DISCARD	gen=428 glyphs=4
2026-03-14T01:13:47.568010	5b9807ac	120	30	1.0000	DISCARD	gen=384 glyphs=4
2026-03-14T01:13:47.840213	e8c7f6cf	120	30	1.0000	DISCARD	gen=428 glyphs=4
2026-03-14T01:13:50.406453	5a06ca32	120	30	1.0000	DISCARD	gen=384 glyphs=4
2026-03-14T01:13:50.695428	b7aed8e9	116	29	1.0000	DISCARD	gen=428 glyphs=4
2026-03-14T01:13:53.152670	37f4017b	116	29	1.0000	DISCARD	gen=385 glyphs=4
2026-03-14T01:13:53.424514	a1d0af71	116	29	1.0000	DISCARD	gen=428 glyphs=4
2026-03-14T01:13:55.870159	bfdf7cad	120	30	1.0000	DISCARD	gen=385 glyphs=4
2026-03-14T01:13:56.154828	19355583	120	30	1.0000	DISCARD	gen=429 glyphs=4
2026-03-14T01:13:58.643403	37f4017b	116	29	1.0000	DISCARD	gen=385 glyphs=4
2026-03-14T01:13:58.905723	8aef8872	116	29	1.0000	DISCARD	gen=429 glyphs=4
2026-03-14T01:14:01.741955	bfdf7cad	120	30	1.0000	DISCARD	gen=385 glyphs=4
2026-03-14T01:14:02.008691	e2cd28ea	120	30	1.0000	DISCARD	gen=429 glyphs=4
2026-03-14T01:14:04.472399	2ed00764	120	30	1.0000	DISCARD	gen=385 glyphs=4
2026-03-14T01:14:04.760968	0eaedb57	116	29	1.0000	DISCARD	gen=429 glyphs=4
2026-03-14T01:14:07.186315	358027be	120	30	1.0000	DISCARD	gen=385 glyphs=4
2026-03-14T01:14:07.464648	19355583	120	30	1.0000	DISCARD	gen=429 glyphs=4
2026-03-14T01:14:09.948606	55d6c151	120	30	1.0000	DISCARD	gen=385 glyphs=4
2026-03-14T01:14:10.217869	f92d9e1e	116	29	1.0000	DISCARD	gen=429 glyphs=4
2026-03-14T01:14:12.662358	8925e6fa	116	29	1.0000	DISCARD	gen=385 glyphs=4
2026-03-14T01:14:12.941002	fddb7a82	116	29	0.9500	DISCARD	gen=429 glyphs=4
2026-03-14T01:14:15.411124	5a06ca32	120	30	1.0000	DISCARD	gen=385 glyphs=4
2026-03-14T01:14:15.691372	ae44ace5	116	29	1.0000	DISCARD	gen=429 glyphs=4
2026-03-14T01:14:18.160858	5a06ca32	120	30	1.0000	DISCARD	gen=385 glyphs=4
2026-03-14T01:14:18.436266	ad4a2b2c	120	30	1.0000	DISCARD	gen=429 glyphs=4
2026-03-14T01:14:20.868940	37f4017b	116	29	1.0000	DISCARD	gen=386 glyphs=4
2026-03-14T01:14:21.142909	50dc991d	116	29	1.0000	DISCARD	gen=429 glyphs=4
2026-03-14T01:14:23.709059	bfdf7cad	120	30	1.0000	DISCARD	gen=386 glyphs=4
2026-03-14T01:14:23.978613	19355583	120	30	1.0000	DISCARD	gen=430 glyphs=4
2026-03-14T01:14:26.432539	bdb58eda	116	29	1.0000	DISCARD	gen=386 glyphs=4
2026-03-14T01:14:26.713108	8aef8872	116	29	1.0000	DISCARD	gen=430 glyphs=4
2026-03-14T01:14:29.170465	7ca87b42	116	29	1.0000	DISCARD	gen=386 glyphs=4
2026-03-14T01:14:29.447060	f42d8d0b	116	29	1.0000	DISCARD	gen=430 glyphs=4
2026-03-14T01:14:31.890237	5b9807ac	120	30	1.0000	DISCARD	gen=386 glyphs=4
2026-03-14T01:14:32.159730	8aef8872	116	29	1.0000	DISCARD	gen=430 glyphs=4
2026-03-14T01:14:34.600107	918f6580	120	30	1.0000	DISCARD	gen=386 glyphs=4
2026-03-14T01:14:34.870213	9e34ede0	116	29	1.0000	DISCARD	gen=430 glyphs=4
2026-03-14T01:14:37.369225	37f4017b	116	29	1.0000	DISCARD	gen=386 glyphs=4
2026-03-14T01:14:37.651203	b7aed8e9	116	29	1.0000	DISCARD	gen=430 glyphs=4
2026-03-14T01:14:40.104241	bfdf7cad	120	30	1.0000	DISCARD	gen=386 glyphs=4
2026-03-14T01:14:40.374645	b62b64c5	116	29	1.0000	DISCARD	gen=430 glyphs=4
2026-03-14T01:14:42.849877	5a06ca32	120	30	1.0000	DISCARD	gen=386 glyphs=4
2026-03-14T01:14:43.123678	9f81ad51	120	30	1.0000	DISCARD	gen=430 glyphs=4
2026-03-14T01:14:45.575875	c305d3b6	116	29	1.0000	DISCARD	gen=386 glyphs=4
2026-03-14T01:14:45.844585	50dc991d	116	29	1.0000	DISCARD	gen=430 glyphs=4
2026-03-14T01:14:48.294201	37f4017b	116	29	1.0000	DISCARD	gen=387 glyphs=4
2026-03-14T01:14:48.568529	511ec68b	116	29	1.0000	DISCARD	gen=430 glyphs=4
2026-03-14T01:14:50.999549	bfdf7cad	120	30	1.0000	DISCARD	gen=387 glyphs=4
2026-03-14T01:14:51.275507	19355583	120	30	1.0000	DISCARD	gen=431 glyphs=4
2026-03-14T01:14:53.779088	bfdf7cad	120	30	1.0000	DISCARD	gen=387 glyphs=4
2026-03-14T01:14:54.061159	8aef8872	116	29	1.0000	DISCARD	gen=431 glyphs=4
2026-03-14T01:14:56.549244	7ca87b42	116	29	1.0000	DISCARD	gen=387 glyphs=4
2026-03-14T01:14:56.820377	050862ad	120	30	1.0000	DISCARD	gen=431 glyphs=4
2026-03-14T01:14:59.268681	5a06ca32	120	30	1.0000	DISCARD	gen=387 glyphs=4
2026-03-14T01:14:59.548139	932d4757	116	29	1.0000	DISCARD	gen=431 glyphs=4
2026-03-14T01:15:01.995014	19092c6a	116	29	0.9500	DISCARD	gen=387 glyphs=4
2026-03-14T01:15:02.262860	e8c7f6cf	120	30	1.0000	DISCARD	gen=431 glyphs=4
2026-03-14T01:15:04.722635	37f4017b	116	29	1.0000	DISCARD	gen=387 glyphs=4
2026-03-14T01:15:04.990202	b7aed8e9	116	29	1.0000	DISCARD	gen=431 glyphs=4
2026-03-14T01:15:07.459097	12b38c2d	116	29	1.0000	DISCARD	gen=387 glyphs=4
2026-03-14T01:15:07.738557	e8c7f6cf	120	30	1.0000	DISCARD	gen=431 glyphs=4
2026-03-14T01:15:10.215311	7ca87b42	116	29	1.0000	DISCARD	gen=387 glyphs=4
2026-03-14T01:15:10.486344	eca7ab6c	116	29	1.0000	DISCARD	gen=431 glyphs=4
2026-03-14T01:15:12.948298	50b9b587	120	30	1.0000	DISCARD	gen=387 glyphs=4
2026-03-14T01:15:13.224492	050862ad	120	30	1.0000	DISCARD	gen=431 glyphs=4
2026-03-14T01:15:15.665549	37f4017b	116	29	1.0000	DISCARD	gen=388 glyphs=4
2026-03-14T01:15:15.936821	8aef8872	116	29	1.0000	DISCARD	gen=431 glyphs=4
2026-03-14T01:15:18.365345	bfdf7cad	120	30	1.0000	DISCARD	gen=388 glyphs=4
2026-03-14T01:15:18.634358	19355583	120	30	1.0000	DISCARD	gen=432 glyphs=4
2026-03-14T01:15:21.095543	37f4017b	116	29	1.0000	DISCARD	gen=388 glyphs=4
2026-03-14T01:15:21.358230	8aef8872	116	29	1.0000	DISCARD	gen=432 glyphs=4
