timestamp	program_hash	spirv_size	word_count	fitness	status	description
2026-03-13T22:39:46.880208	8aef8872	116	29	1.0000	DISCARD	gen=96 glyphs=4
2026-03-13T22:39:47.439373	37f4017b	116	29	1.0000	DISCARD	gen=52 glyphs=4
2026-03-13T22:39:49.641817	b7aed8e9	116	29	1.0000	DISCARD	gen=96 glyphs=4
2026-03-13T22:39:50.215221	d11c1062	120	30	1.0000	DISCARD	gen=52 glyphs=4
2026-03-13T22:39:52.401175	19355583	120	30	1.0000	DISCARD	gen=96 glyphs=4
2026-03-13T22:39:52.956041	87fb1c5f	120	30	1.0000	DISCARD	gen=52 glyphs=4
2026-03-13T22:39:55.106445	954aee0f	116	29	1.0000	DISCARD	gen=96 glyphs=4
2026-03-13T22:39:55.657448	4c9b0dd4	120	30	1.0000	DISCARD	gen=52 glyphs=4
2026-03-13T22:39:57.823994	0eaedb57	116	29	1.0000	DISCARD	gen=96 glyphs=4
2026-03-13T22:39:58.395748	fd11cece	120	30	1.0000	DISCARD	gen=52 glyphs=4
2026-03-13T22:40:00.608207	1e5f0e21	116	29	1.0000	DISCARD	gen=96 glyphs=4
2026-03-13T22:40:01.172634	0522d721	120	30	1.0000	DISCARD	gen=52 glyphs=4
2026-03-13T22:40:03.380420	19355583	120	30	1.0000	DISCARD	gen=96 glyphs=4
2026-03-13T22:40:03.930642	55d6c151	120	30	1.0000	DISCARD	gen=52 glyphs=4
2026-03-13T22:40:06.129378	b7aed8e9	116	29	1.0000	DISCARD	gen=96 glyphs=4
2026-03-13T22:40:06.685260	37f4017b	116	29	1.0000	DISCARD	gen=52 glyphs=4
2026-03-13T22:40:08.945514	e8c7f6cf	120	30	1.0000	DISCARD	gen=96 glyphs=4
2026-03-13T22:40:09.492442	37f4017b	116	29	1.0000	DISCARD	gen=53 glyphs=4
2026-03-13T22:40:11.679197	19355583	120	30	1.0000	DISCARD	gen=97 glyphs=4
2026-03-13T22:40:12.217242	bfdf7cad	120	30	1.0000	DISCARD	gen=53 glyphs=4
2026-03-13T22:40:14.414134	8aef8872	116	29	1.0000	DISCARD	gen=97 glyphs=4
2026-03-13T22:40:14.967035	37f4017b	116	29	1.0000	DISCARD	gen=53 glyphs=4
2026-03-13T22:40:17.148787	67cb81be	120	30	1.0000	DISCARD	gen=97 glyphs=4
2026-03-13T22:40:17.704547	55d6c151	120	30	1.0000	DISCARD	gen=53 glyphs=4
2026-03-13T22:40:19.920219	26955092	116	29	0.9500	DISCARD	gen=97 glyphs=4
2026-03-13T22:40:20.467004	4c9b0dd4	120	30	1.0000	DISCARD	gen=53 glyphs=4
2026-03-13T22:40:22.659747	8aef8872	116	29	1.0000	DISCARD	gen=97 glyphs=4
2026-03-13T22:40:23.215870	5a06ca32	120	30	1.0000	DISCARD	gen=53 glyphs=4
2026-03-13T22:40:25.569116	050862ad	120	30	1.0000	DISCARD	gen=97 glyphs=4
2026-03-13T22:40:26.127222	677bdfda	116	29	1.0000	DISCARD	gen=53 glyphs=4
2026-03-13T22:40:28.349478	0eaedb57	116	29	1.0000	DISCARD	gen=97 glyphs=4
2026-03-13T22:40:28.887186	5a06ca32	120	30	1.0000	DISCARD	gen=53 glyphs=4
2026-03-13T22:40:31.111468	1e5f0e21	116	29	1.0000	DISCARD	gen=97 glyphs=4
2026-03-13T22:40:31.663164	12b38c2d	116	29	1.0000	DISCARD	gen=53 glyphs=4
2026-03-13T22:40:33.865014	e8c7f6cf	120	30	1.0000	DISCARD	gen=97 glyphs=4
2026-03-13T22:40:34.407314	8c249d24	116	29	1.0000	DISCARD	gen=53 glyphs=4
2026-03-13T22:40:36.607912	050862ad	120	30	1.0000	DISCARD	gen=97 glyphs=4
2026-03-13T22:40:37.154237	37f4017b	116	29	1.0000	DISCARD	gen=54 glyphs=4
2026-03-13T22:40:39.348244	19355583	120	30	1.0000	DISCARD	gen=98 glyphs=4
2026-03-13T22:40:39.909029	bfdf7cad	120	30	1.0000	DISCARD	gen=54 glyphs=4
2026-03-13T22:40:42.183223	8aef8872	116	29	1.0000	DISCARD	gen=98 glyphs=4
2026-03-13T22:40:42.735657	37f4017b	116	29	1.0000	DISCARD	gen=54 glyphs=4
2026-03-13T22:40:44.916104	875e0f8a	116	29	1.0000	DISCARD	gen=98 glyphs=4
2026-03-13T22:40:45.461694	78e67067	116	29	1.0000	DISCARD	gen=54 glyphs=4
2026-03-13T22:40:47.669277	19355583	120	30	1.0000	DISCARD	gen=98 glyphs=4
2026-03-13T22:40:48.228506	37f4017b	116	29	1.0000	DISCARD	gen=54 glyphs=4
2026-03-13T22:40:50.410969	19355583	120	30	1.0000	DISCARD	gen=98 glyphs=4
2026-03-13T22:40:54.389191	bfdf7cad	120	30	1.0000	DISCARD	gen=54 glyphs=4
2026-03-13T22:40:56.564183	8aef8872	116	29	1.0000	DISCARD	gen=98 glyphs=4
2026-03-13T22:40:57.119332	2c3965b2	116	29	1.0000	DISCARD	gen=54 glyphs=4
2026-03-13T22:40:59.326225	8aef8872	116	29	1.0000	DISCARD	gen=98 glyphs=4
2026-03-13T22:40:59.869642	55d6c151	120	30	1.0000	DISCARD	gen=54 glyphs=4
2026-03-13T22:41:02.083351	323f7173	120	30	1.0000	DISCARD	gen=98 glyphs=4
2026-03-13T22:41:02.642828	fdb5d108	120	30	1.0000	DISCARD	gen=54 glyphs=4
2026-03-13T22:41:04.830209	9e34ede0	116	29	1.0000	DISCARD	gen=98 glyphs=4
2026-03-13T22:41:05.377868	b9d1013e	120	30	1.0000	DISCARD	gen=54 glyphs=4
2026-03-13T22:41:07.597469	19355583	120	30	1.0000	DISCARD	gen=98 glyphs=4
2026-03-13T22:41:08.139347	37f4017b	116	29	1.0000	DISCARD	gen=55 glyphs=4
2026-03-13T22:41:10.357550	19355583	120	30	1.0000	DISCARD	gen=99 glyphs=4
2026-03-13T22:41:10.896975	bfdf7cad	120	30	1.0000	DISCARD	gen=55 glyphs=4
2026-03-13T22:41:13.089675	8aef8872	116	29	1.0000	DISCARD	gen=99 glyphs=4
2026-03-13T22:41:13.655614	ab2bd9b8	116	29	1.0000	DISCARD	gen=55 glyphs=4
2026-03-13T22:41:15.845094	8aef8872	116	29	1.0000	DISCARD	gen=99 glyphs=4
2026-03-13T22:41:16.405242	9e1db83c	120	30	1.0000	DISCARD	gen=55 glyphs=4
2026-03-13T22:41:18.569653	8aef8872	116	29	1.0000	DISCARD	gen=99 glyphs=4
2026-03-13T22:41:19.123073	37f4017b	116	29	1.0000	DISCARD	gen=55 glyphs=4
2026-03-13T22:41:21.331817	e2cd28ea	120	30	1.0000	DISCARD	gen=99 glyphs=4
2026-03-13T22:41:21.887207	37f4017b	116	29	1.0000	DISCARD	gen=55 glyphs=4
2026-03-13T22:41:24.107909	1e5f0e21	116	29	1.0000	DISCARD	gen=99 glyphs=4
2026-03-13T22:41:24.647460	37f4017b	116	29	1.0000	DISCARD	gen=55 glyphs=4
2026-03-13T22:41:26.844239	e2cd28ea	120	30	1.0000	DISCARD	gen=99 glyphs=4
2026-03-13T22:41:27.399530	060df265	116	29	1.0000	DISCARD	gen=55 glyphs=4
2026-03-13T22:41:29.572515	19355583	120	30	1.0000	DISCARD	gen=99 glyphs=4
2026-03-13T22:41:30.118464	4821c9f3	116	29	1.0000	DISCARD	gen=55 glyphs=4
2026-03-13T22:41:32.311611	19355583	120	30	1.0000	DISCARD	gen=99 glyphs=4
2026-03-13T22:41:32.852746	bfdf7cad	120	30	1.0000	DISCARD	gen=55 glyphs=4
2026-03-13T22:41:35.037977	e8c7f6cf	120	30	1.0000	DISCARD	gen=99 glyphs=4
2026-03-13T22:41:35.594969	37f4017b	116	29	1.0000	DISCARD	gen=56 glyphs=4
2026-03-13T22:41:37.778723	19355583	120	30	1.0000	DISCARD	gen=100 glyphs=4
2026-03-13T22:41:38.333457	bfdf7cad	120	30	1.0000	DISCARD	gen=56 glyphs=4
2026-03-13T22:41:40.566671	8aef8872	116	29	1.0000	DISCARD	gen=100 glyphs=4
2026-03-13T22:41:41.119783	37f4017b	116	29	1.0000	DISCARD	gen=56 glyphs=4
2026-03-13T22:41:43.339998	19355583	120	30	1.0000	DISCARD	gen=100 glyphs=4
2026-03-13T22:41:43.906234	63dd37d3	116	29	1.0000	DISCARD	gen=56 glyphs=4
2026-03-13T22:41:46.172143	b9a210f9	116	29	0.9500	DISCARD	gen=100 glyphs=4
2026-03-13T22:41:46.708986	07a243af	116	29	1.0000	DISCARD	gen=56 glyphs=4
2026-03-13T22:41:48.892988	cd5b0187	120	30	1.0000	DISCARD	gen=100 glyphs=4
2026-03-13T22:41:49.441605	e116bb24	116	29	0.9500	DISCARD	gen=56 glyphs=4
2026-03-13T22:41:51.642151	e8c7f6cf	120	30	1.0000	DISCARD	gen=100 glyphs=4
2026-03-13T22:41:52.182793	fdb5d108	120	30	1.0000	DISCARD	gen=56 glyphs=4
2026-03-13T22:41:54.351268	9e34ede0	116	29	1.0000	DISCARD	gen=100 glyphs=4
2026-03-13T22:41:54.896094	1785f7b4	120	30	1.0000	DISCARD	gen=56 glyphs=4
2026-03-13T22:41:57.074053	050862ad	120	30	1.0000	DISCARD	gen=100 glyphs=4
2026-03-13T22:41:57.619274	4c9b0dd4	120	30	1.0000	DISCARD	gen=56 glyphs=4
2026-03-13T22:41:59.768723	8aef8872	116	29	1.0000	DISCARD	gen=100 glyphs=4
2026-03-13T22:42:00.308701	37f4017b	116	29	1.0000	DISCARD	gen=56 glyphs=4
2026-03-13T22:42:02.481178	d7c8681b	120	30	1.0000	DISCARD	gen=100 glyphs=4
2026-03-13T22:42:03.020439	37f4017b	116	29	1.0000	DISCARD	gen=57 glyphs=4
2026-03-13T22:42:05.173375	19355583	120	30	1.0000	DISCARD	gen=101 glyphs=4
2026-03-13T22:42:05.718069	bfdf7cad	120	30	1.0000	DISCARD	gen=57 glyphs=4
2026-03-13T22:42:07.923037	8aef8872	116	29	1.0000	DISCARD	gen=101 glyphs=4
2026-03-13T22:42:08.467994	84251277	116	29	1.0000	DISCARD	gen=57 glyphs=4
2026-03-13T22:42:10.683709	e2cd28ea	120	30	1.0000	DISCARD	gen=101 glyphs=4
2026-03-13T22:42:11.239196	5a06ca32	120	30	1.0000	DISCARD	gen=57 glyphs=4
2026-03-13T22:42:13.406467	b5d2a19b	116	29	1.0000	DISCARD	gen=101 glyphs=4
2026-03-13T22:42:13.947838	fdb5d108	120	30	1.0000	DISCARD	gen=57 glyphs=4
2026-03-13T22:42:16.161652	b7aed8e9	116	29	1.0000	DISCARD	gen=101 glyphs=4
2026-03-13T22:42:16.746740	5a06ca32	120	30	1.0000	DISCARD	gen=57 glyphs=4
2026-03-13T22:42:19.054537	67cb81be	120	30	1.0000	DISCARD	gen=101 glyphs=4
2026-03-13T22:42:19.585366	cf851777	116	29	1.0000	DISCARD	gen=57 glyphs=4
2026-03-13T22:42:21.778105	b97ac20f	120	30	1.0000	DISCARD	gen=101 glyphs=4
2026-03-13T22:42:22.332908	5a06ca32	120	30	1.0000	DISCARD	gen=57 glyphs=4
2026-03-13T22:42:24.631348	7769fd5b	120	30	1.0000	DISCARD	gen=101 glyphs=4
2026-03-13T22:42:25.172466	5a06ca32	120	30	1.0000	DISCARD	gen=57 glyphs=4
2026-03-13T22:42:27.346490	2ea1ccee	116	29	1.0000	DISCARD	gen=101 glyphs=4
2026-03-13T22:42:27.879230	4c9b0dd4	120	30	1.0000	DISCARD	gen=57 glyphs=4
2026-03-13T22:42:30.067004	cbab25d4	116	29	1.0000	DISCARD	gen=101 glyphs=4
2026-03-13T22:42:30.613757	37f4017b	116	29	1.0000	DISCARD	gen=58 glyphs=4
2026-03-13T22:42:32.811646	19355583	120	30	1.0000	DISCARD	gen=102 glyphs=4
2026-03-13T22:42:33.346135	bfdf7cad	120	30	1.0000	DISCARD	gen=58 glyphs=4
2026-03-13T22:42:35.524635	8aef8872	116	29	1.0000	DISCARD	gen=102 glyphs=4
2026-03-13T22:42:36.054878	1d34459a	116	29	1.0000	DISCARD	gen=58 glyphs=4
2026-03-13T22:42:38.285349	47a02948	120	30	1.0000	DISCARD	gen=102 glyphs=4
2026-03-13T22:42:38.824182	644cf5a6	116	29	1.0000	DISCARD	gen=58 glyphs=4
2026-03-13T22:42:41.010410	e7bef66f	116	29	1.0000	DISCARD	gen=102 glyphs=4
2026-03-13T22:42:41.546018	796b4be3	116	29	1.0000	DISCARD	gen=58 glyphs=4
2026-03-13T22:42:43.713206	19355583	120	30	1.0000	DISCARD	gen=102 glyphs=4
2026-03-13T22:42:44.252184	f5268cd7	120	30	1.0000	DISCARD	gen=58 glyphs=4
2026-03-13T22:42:46.428481	69d96f22	116	29	1.0000	DISCARD	gen=102 glyphs=4
2026-03-13T22:42:46.983152	a2231474	116	29	1.0000	DISCARD	gen=58 glyphs=4
2026-03-13T22:42:49.202786	b7aed8e9	116	29	1.0000	DISCARD	gen=102 glyphs=4
2026-03-13T22:42:49.768406	d32a9d77	116	29	1.0000	DISCARD	gen=58 glyphs=4
2026-03-13T22:42:51.930643	8aef8872	116	29	1.0000	DISCARD	gen=102 glyphs=4
2026-03-13T22:42:52.479725	55d6c151	120	30	1.0000	DISCARD	gen=58 glyphs=4
2026-03-13T22:42:54.660460	50dc991d	116	29	1.0000	DISCARD	gen=102 glyphs=4
2026-03-13T22:42:55.196568	d524af79	116	29	1.0000	DISCARD	gen=58 glyphs=4
2026-03-13T22:42:57.368571	8c6e127e	116	29	1.0000	DISCARD	gen=102 glyphs=4
2026-03-13T22:42:57.901256	37f4017b	116	29	1.0000	DISCARD	gen=59 glyphs=4
2026-03-13T22:43:00.051703	19355583	120	30	1.0000	DISCARD	gen=103 glyphs=4
2026-03-13T22:43:00.605380	bfdf7cad	120	30	1.0000	DISCARD	gen=59 glyphs=4
2026-03-13T22:43:02.773317	8aef8872	116	29	1.0000	DISCARD	gen=103 glyphs=4
2026-03-13T22:43:03.312649	12b38c2d	116	29	1.0000	DISCARD	gen=59 glyphs=4
2026-03-13T22:43:05.478349	304bd8d7	116	29	0.9500	DISCARD	gen=103 glyphs=4
2026-03-13T22:43:06.012963	7ca87b42	116	29	1.0000	DISCARD	gen=59 glyphs=4
2026-03-13T22:43:08.174330	0eaedb57	116	29	1.0000	DISCARD	gen=103 glyphs=4
2026-03-13T22:43:08.737053	5a06ca32	120	30	1.0000	DISCARD	gen=59 glyphs=4
2026-03-13T22:43:10.912848	8aef8872	116	29	1.0000	DISCARD	gen=103 glyphs=4
2026-03-13T22:43:11.464639	55d6c151	120	30	1.0000	DISCARD	gen=59 glyphs=4
2026-03-13T22:43:13.624073	eca7ab6c	116	29	1.0000	DISCARD	gen=103 glyphs=4
2026-03-13T22:43:14.174637	3447cd3d	120	30	1.0000	DISCARD	gen=59 glyphs=4
2026-03-13T22:43:16.335295	050862ad	120	30	1.0000	DISCARD	gen=103 glyphs=4
2026-03-13T22:43:16.866055	5a06ca32	120	30	1.0000	DISCARD	gen=59 glyphs=4
2026-03-13T22:43:19.034106	cb733c54	116	29	1.0000	DISCARD	gen=103 glyphs=4
2026-03-13T22:43:19.631730	55d6c151	120	30	1.0000	DISCARD	gen=59 glyphs=4
2026-03-13T22:43:21.845777	19355583	120	30	1.0000	DISCARD	gen=103 glyphs=4
2026-03-13T22:43:22.391889	464e6bb0	116	29	1.0000	DISCARD	gen=59 glyphs=4
2026-03-13T22:43:24.539220	a78f9454	120	30	1.0000	DISCARD	gen=103 glyphs=4
2026-03-13T22:43:25.081417	37f4017b	116	29	1.0000	DISCARD	gen=60 glyphs=4
2026-03-13T22:43:27.248779	19355583	120	30	1.0000	DISCARD	gen=104 glyphs=4
2026-03-13T22:43:27.798400	bfdf7cad	120	30	1.0000	DISCARD	gen=60 glyphs=4
2026-03-13T22:43:29.961532	8aef8872	116	29	1.0000	DISCARD	gen=104 glyphs=4
2026-03-13T22:43:30.516636	fdb5d108	120	30	1.0000	DISCARD	gen=60 glyphs=4
2026-03-13T22:43:32.680568	e2cd28ea	120	30	1.0000	DISCARD	gen=104 glyphs=4
2026-03-13T22:43:33.235889	37f4017b	116	29	1.0000	DISCARD	gen=60 glyphs=4
2026-03-13T22:43:35.445412	15d5ebd7	120	30	1.0000	DISCARD	gen=104 glyphs=4
2026-03-13T22:43:35.995993	48d7b177	116	29	1.0000	DISCARD	gen=60 glyphs=4
2026-03-13T22:43:38.178555	eca7ab6c	116	29	1.0000	DISCARD	gen=104 glyphs=4
2026-03-13T22:43:38.716340	5a06ca32	120	30	1.0000	DISCARD	gen=60 glyphs=4
2026-03-13T22:43:41.016604	4f47f4e5	120	30	1.0000	DISCARD	gen=104 glyphs=4
2026-03-13T22:43:41.567259	f3af051d	116	29	1.0000	DISCARD	gen=60 glyphs=4
2026-03-13T22:43:43.721031	24db32fd	116	29	1.0000	DISCARD	gen=104 glyphs=4
2026-03-13T22:43:44.266964	5a06ca32	120	30	1.0000	DISCARD	gen=60 glyphs=4
2026-03-13T22:43:46.445847	9e222b98	116	29	1.0000	DISCARD	gen=104 glyphs=4
2026-03-13T22:43:46.999252	37f4017b	116	29	1.0000	DISCARD	gen=60 glyphs=4
2026-03-13T22:43:49.172180	b7aed8e9	116	29	1.0000	DISCARD	gen=104 glyphs=4
2026-03-13T22:43:49.710807	55d6c151	120	30	1.0000	DISCARD	gen=60 glyphs=4
2026-03-13T22:43:51.925352	e8c7f6cf	120	30	1.0000	DISCARD	gen=104 glyphs=4
2026-03-13T22:43:52.491170	37f4017b	116	29	1.0000	DISCARD	gen=61 glyphs=4
2026-03-13T22:43:54.662602	19355583	120	30	1.0000	DISCARD	gen=105 glyphs=4
2026-03-13T22:43:55.192523	bfdf7cad	120	30	1.0000	DISCARD	gen=61 glyphs=4
2026-03-13T22:43:57.346438	8aef8872	116	29	1.0000	DISCARD	gen=105 glyphs=4
2026-03-13T22:43:57.892640	326b9146	116	29	1.0000	DISCARD	gen=61 glyphs=4
2026-03-13T22:44:00.097952	0eaedb57	116	29	1.0000	DISCARD	gen=105 glyphs=4
2026-03-13T22:44:00.643847	5a06ca32	120	30	1.0000	DISCARD	gen=61 glyphs=4
2026-03-13T22:44:02.808817	19355583	120	30	1.0000	DISCARD	gen=105 glyphs=4
2026-03-13T22:44:03.353605	5a06ca32	120	30	1.0000	DISCARD	gen=61 glyphs=4
2026-03-13T22:44:05.521332	875e0f8a	116	29	1.0000	DISCARD	gen=105 glyphs=4
2026-03-13T22:44:06.062474	3be900a0	116	29	0.9500	DISCARD	gen=61 glyphs=4
2026-03-13T22:44:08.237547	19355583	120	30	1.0000	DISCARD	gen=105 glyphs=4
2026-03-13T22:44:08.761550	9ce12b16	116	29	0.9500	DISCARD	gen=61 glyphs=4
2026-03-13T22:44:10.910812	eca7ab6c	116	29	1.0000	DISCARD	gen=105 glyphs=4
2026-03-13T22:44:11.441139	f5325830	116	29	1.0000	DISCARD	gen=61 glyphs=4
2026-03-13T22:44:13.619986	0eaedb57	116	29	1.0000	DISCARD	gen=105 glyphs=4
2026-03-13T22:44:14.161863	55d6c151	120	30	1.0000	DISCARD	gen=61 glyphs=4
2026-03-13T22:44:16.345507	e8c7f6cf	120	30	1.0000	DISCARD	gen=105 glyphs=4
2026-03-13T22:44:16.886886	5a06ca32	120	30	1.0000	DISCARD	gen=61 glyphs=4
2026-03-13T22:44:19.054662	8aef8872	116	29	1.0000	DISCARD	gen=105 glyphs=4
2026-03-13T22:44:19.595242	37f4017b	116	29	1.0000	DISCARD	gen=62 glyphs=4
2026-03-13T22:44:21.746838	19355583	120	30	1.0000	DISCARD	gen=106 glyphs=4
2026-03-13T22:44:22.286971	bfdf7cad	120	30	1.0000	DISCARD	gen=62 glyphs=4
2026-03-13T22:44:24.506206	8aef8872	116	29	1.0000	DISCARD	gen=106 glyphs=4
2026-03-13T22:44:25.049604	0f2f11f6	116	29	1.0000	DISCARD	gen=62 glyphs=4
2026-03-13T22:44:27.208420	8aef8872	116	29	1.0000	DISCARD	gen=106 glyphs=4
2026-03-13T22:44:27.754603	51c3994d	116	29	1.0000	DISCARD	gen=62 glyphs=4
2026-03-13T22:44:29.918408	8aef8872	116	29	1.0000	DISCARD	gen=106 glyphs=4
2026-03-13T22:44:30.488464	a0a01919	120	30	1.0000	DISCARD	gen=62 glyphs=4
2026-03-13T22:44:32.702687	1e5f0e21	116	29	1.0000	DISCARD	gen=106 glyphs=4
2026-03-13T22:44:33.265082	12b38c2d	116	29	1.0000	DISCARD	gen=62 glyphs=4
2026-03-13T22:44:35.421221	eca7ab6c	116	29	1.0000	DISCARD	gen=106 glyphs=4
2026-03-13T22:44:35.957036	3e086c3d	116	29	1.0000	DISCARD	gen=62 glyphs=4
2026-03-13T22:44:38.106654	a78f9454	120	30	1.0000	DISCARD	gen=106 glyphs=4
2026-03-13T22:44:38.657154	7e334a5b	116	29	1.0000	DISCARD	gen=62 glyphs=4
2026-03-13T22:44:40.811424	8aef8872	116	29	1.0000	DISCARD	gen=106 glyphs=4
2026-03-13T22:44:41.353513	4c768ad6	116	29	1.0000	DISCARD	gen=62 glyphs=4
2026-03-13T22:44:43.520707	0eaedb57	116	29	1.0000	DISCARD	gen=106 glyphs=4
2026-03-13T22:44:44.065114	37f4017b	116	29	1.0000	DISCARD	gen=62 glyphs=4
2026-03-13T22:44:46.230697	a78f9454	120	30	1.0000	DISCARD	gen=106 glyphs=4
2026-03-13T22:44:46.763819	37f4017b	116	29	1.0000	DISCARD	gen=63 glyphs=4
2026-03-13T22:44:48.915528	19355583	120	30	1.0000	DISCARD	gen=107 glyphs=4
2026-03-13T22:44:49.451792	bfdf7cad	120	30	1.0000	DISCARD	gen=63 glyphs=4
2026-03-13T22:44:51.596528	8aef8872	116	29	1.0000	DISCARD	gen=107 glyphs=4
2026-03-13T22:44:52.137295	22a012a1	116	29	1.0000	DISCARD	gen=63 glyphs=4
2026-03-13T22:44:54.301597	3d10c8c0	120	30	1.0000	DISCARD	gen=107 glyphs=4
2026-03-13T22:44:54.874192	34b3a800	116	29	0.9500	DISCARD	gen=63 glyphs=4
2026-03-13T22:44:57.076097	b57e7176	120	30	1.0000	DISCARD	gen=107 glyphs=4
2026-03-13T22:44:57.640970	4c9b0dd4	120	30	1.0000	DISCARD	gen=63 glyphs=4
2026-03-13T22:44:59.873291	875e0f8a	116	29	1.0000	DISCARD	gen=107 glyphs=4
2026-03-13T22:45:00.416108	5e4a3ae9	116	29	1.0000	DISCARD	gen=63 glyphs=4
2026-03-13T22:45:02.634194	a78f9454	120	30	1.0000	DISCARD	gen=107 glyphs=4
2026-03-13T22:45:03.177156	785b56b1	120	30	1.0000	DISCARD	gen=63 glyphs=4
2026-03-13T22:45:10.690165	a78f9454	120	30	1.0000	DISCARD	gen=107 glyphs=4
2026-03-13T22:45:11.239887	37f4017b	116	29	1.0000	DISCARD	gen=63 glyphs=4
2026-03-13T22:45:13.434072	f36a7165	116	29	1.0000	DISCARD	gen=107 glyphs=4
2026-03-13T22:45:14.001310	55d6c151	120	30	1.0000	DISCARD	gen=63 glyphs=4
2026-03-13T22:45:18.111583	e2cd28ea	120	30	1.0000	DISCARD	gen=107 glyphs=4
2026-03-13T22:45:18.679151	7a1281ec	116	29	0.9500	DISCARD	gen=63 glyphs=4
2026-03-13T22:45:20.880042	56665886	116	29	1.0000	DISCARD	gen=107 glyphs=4
2026-03-13T22:45:21.451456	37f4017b	116	29	1.0000	DISCARD	gen=64 glyphs=4
2026-03-13T22:45:23.653730	19355583	120	30	1.0000	DISCARD	gen=108 glyphs=4
2026-03-13T22:45:24.386513	bfdf7cad	120	30	1.0000	DISCARD	gen=64 glyphs=4
2026-03-13T22:45:29.876657	8aef8872	116	29	1.0000	DISCARD	gen=108 glyphs=4
2026-03-13T22:45:30.429917	37f4017b	116	29	1.0000	DISCARD	gen=64 glyphs=4
2026-03-13T22:45:32.637889	014f9358	116	29	1.0000	DISCARD	gen=108 glyphs=4
2026-03-13T22:45:33.183828	fd0e93f6	116	29	1.0000	DISCARD	gen=64 glyphs=4
2026-03-13T22:45:35.420213	e00e28a7	120	30	0.9500	DISCARD	gen=108 glyphs=4
2026-03-13T22:45:35.981737	fddc1ce1	116	29	1.0000	DISCARD	gen=64 glyphs=4
2026-03-13T22:45:38.175359	28d4329d	120	30	1.0000	DISCARD	gen=108 glyphs=4
2026-03-13T22:45:38.725255	dd38d791	120	30	1.0000	DISCARD	gen=64 glyphs=4
2026-03-13T22:45:40.940328	33f17780	116	29	1.0000	DISCARD	gen=108 glyphs=4
2026-03-13T22:45:41.484031	31596e04	120	30	1.0000	DISCARD	gen=64 glyphs=4
2026-03-13T22:45:43.671859	6665b6ed	116	29	1.0000	DISCARD	gen=108 glyphs=4
2026-03-13T22:45:44.218533	5a06ca32	120	30	1.0000	DISCARD	gen=64 glyphs=4
2026-03-13T22:45:46.398775	5e9dac2e	116	29	1.0000	DISCARD	gen=108 glyphs=4
2026-03-13T22:45:46.941012	fdb5d108	120	30	1.0000	DISCARD	gen=64 glyphs=4
2026-03-13T22:45:49.131432	67cb81be	120	30	1.0000	DISCARD	gen=108 glyphs=4
2026-03-13T22:45:49.659224	31b1b770	116	29	1.0000	DISCARD	gen=64 glyphs=4
2026-03-13T22:45:51.836844	eca7ab6c	116	29	1.0000	DISCARD	gen=108 glyphs=4
2026-03-13T22:45:52.382130	37f4017b	116	29	1.0000	DISCARD	gen=65 glyphs=4
2026-03-13T22:45:54.565490	19355583	120	30	1.0000	DISCARD	gen=109 glyphs=4
2026-03-13T22:45:55.111805	bfdf7cad	120	30	1.0000	DISCARD	gen=65 glyphs=4
2026-03-13T22:45:57.306534	8aef8872	116	29	1.0000	DISCARD	gen=109 glyphs=4
2026-03-13T22:45:57.852250	6d615669	120	30	1.0000	DISCARD	gen=65 glyphs=4
2026-03-13T22:46:00.110829	19355583	120	30	1.0000	DISCARD	gen=109 glyphs=4
2026-03-13T22:46:00.653615	37f4017b	116	29	1.0000	DISCARD	gen=65 glyphs=4
2026-03-13T22:46:02.832064	9e34ede0	116	29	1.0000	DISCARD	gen=109 glyphs=4
2026-03-13T22:46:03.371184	13a65159	120	30	1.0000	DISCARD	gen=65 glyphs=4
2026-03-13T22:46:05.581808	1e5f0e21	116	29	1.0000	DISCARD	gen=109 glyphs=4
2026-03-13T22:46:06.130819	12b38c2d	116	29	1.0000	DISCARD	gen=65 glyphs=4
2026-03-13T22:46:08.316596	19355583	120	30	1.0000	DISCARD	gen=109 glyphs=4
2026-03-13T22:46:08.857425	fdb5d108	120	30	1.0000	DISCARD	gen=65 glyphs=4
2026-03-13T22:46:11.047082	e2cd28ea	120	30	1.0000	DISCARD	gen=109 glyphs=4
2026-03-13T22:46:11.594079	f4194812	116	29	1.0000	DISCARD	gen=65 glyphs=4
2026-03-13T22:46:13.756553	19355583	120	30	1.0000	DISCARD	gen=109 glyphs=4
2026-03-13T22:46:14.298607	9a83b76d	116	29	1.0000	DISCARD	gen=65 glyphs=4
2026-03-13T22:46:16.462415	a78f9454	120	30	1.0000	DISCARD	gen=109 glyphs=4
2026-03-13T22:46:17.007577	55d6c151	120	30	1.0000	DISCARD	gen=65 glyphs=4
2026-03-13T22:46:19.182499	050862ad	120	30	1.0000	DISCARD	gen=109 glyphs=4
2026-03-13T22:46:19.728594	37f4017b	116	29	1.0000	DISCARD	gen=66 glyphs=4
2026-03-13T22:46:21.915122	19355583	120	30	1.0000	DISCARD	gen=110 glyphs=4
2026-03-13T22:46:22.460077	bfdf7cad	120	30	1.0000	DISCARD	gen=66 glyphs=4
2026-03-13T22:46:24.623566	8aef8872	116	29	1.0000	DISCARD	gen=110 glyphs=4
2026-03-13T22:46:25.158101	55d6c151	120	30	1.0000	DISCARD	gen=66 glyphs=4
2026-03-13T22:46:27.333472	13a917ab	120	30	1.0000	DISCARD	gen=110 glyphs=4
2026-03-13T22:46:27.873342	bb84c83d	116	29	1.0000	DISCARD	gen=66 glyphs=4
2026-03-13T22:46:30.065378	ae44ace5	116	29	1.0000	DISCARD	gen=110 glyphs=4
2026-03-13T22:46:30.630687	37f4017b	116	29	1.0000	DISCARD	gen=66 glyphs=4
2026-03-13T22:46:32.912621	b7aed8e9	116	29	1.0000	DISCARD	gen=110 glyphs=4
2026-03-13T22:46:33.468850	5b9807ac	120	30	1.0000	DISCARD	gen=66 glyphs=4
2026-03-13T22:46:35.683134	875e0f8a	116	29	1.0000	DISCARD	gen=110 glyphs=4
2026-03-13T22:46:36.241193	2701cb73	116	29	1.0000	DISCARD	gen=66 glyphs=4
2026-03-13T22:46:38.414649	050862ad	120	30	1.0000	DISCARD	gen=110 glyphs=4
2026-03-13T22:46:38.958619	5a06ca32	120	30	1.0000	DISCARD	gen=66 glyphs=4
2026-03-13T22:46:41.163384	b57e7176	120	30	1.0000	DISCARD	gen=110 glyphs=4
2026-03-13T22:46:41.718586	c8d8e3b5	116	29	1.0000	DISCARD	gen=66 glyphs=4
