timestamp	program_hash	spirv_size	word_count	fitness	status	description
2026-03-14T07:36:45.536104	099964a4	0	0	0.0000	CRASH	gen=732 glyphs=4
2026-03-14T07:36:45.536383	099964a4	0	0	0.0000	CRASH	gen=733 glyphs=4
2026-03-14T07:36:45.536582	099964a4	0	0	0.0000	CRASH	gen=733 glyphs=4
2026-03-14T07:36:45.536781	c9737f14	0	0	0.0000	CRASH	gen=733 glyphs=4
2026-03-14T07:36:45.536978	099964a4	0	0	0.0000	CRASH	gen=733 glyphs=4
2026-03-14T07:36:45.537169	ff30496a	0	0	0.0000	CRASH	gen=733 glyphs=3
2026-03-14T07:36:45.537362	8157b75c	0	0	0.0000	CRASH	gen=733 glyphs=4
2026-03-14T07:36:45.537558	099964a4	0	0	0.0000	CRASH	gen=733 glyphs=4
2026-03-14T07:36:45.537751	73486eb8	0	0	0.0000	CRASH	gen=733 glyphs=1
2026-03-14T07:36:45.537947	099964a4	0	0	0.0000	CRASH	gen=733 glyphs=4
2026-03-14T07:36:45.538138	099964a4	0	0	0.0000	CRASH	gen=733 glyphs=4
2026-03-14T07:36:45.538406	099964a4	0	0	0.0000	CRASH	gen=734 glyphs=4
2026-03-14T07:36:45.538603	099964a4	0	0	0.0000	CRASH	gen=734 glyphs=4
2026-03-14T07:36:45.538797	33d33752	0	0	0.0000	CRASH	gen=734 glyphs=4
2026-03-14T07:36:45.538991	b1c877d7	0	0	0.0000	CRASH	gen=734 glyphs=4
2026-03-14T07:36:45.539185	099964a4	0	0	0.0000	CRASH	gen=734 glyphs=4
2026-03-14T07:36:45.539375	099964a4	0	0	0.0000	CRASH	gen=734 glyphs=4
2026-03-14T07:36:45.539570	099964a4	0	0	0.0000	CRASH	gen=734 glyphs=4
2026-03-14T07:36:45.539761	099964a4	0	0	0.0000	CRASH	gen=734 glyphs=4
2026-03-14T07:36:45.539961	3a734398	0	0	0.0000	CRASH	gen=734 glyphs=4
2026-03-14T07:36:45.540155	099964a4	0	0	0.0000	CRASH	gen=734 glyphs=4
2026-03-14T07:36:45.540431	099964a4	0	0	0.0000	CRASH	gen=735 glyphs=4
2026-03-14T07:36:45.540628	099964a4	0	0	0.0000	CRASH	gen=735 glyphs=4
2026-03-14T07:36:45.540822	099964a4	0	0	0.0000	CRASH	gen=735 glyphs=4
2026-03-14T07:36:45.541019	099964a4	0	0	0.0000	CRASH	gen=735 glyphs=4
2026-03-14T07:36:45.541213	099964a4	0	0	0.0000	CRASH	gen=735 glyphs=4
2026-03-14T07:36:45.541406	8cc25bea	0	0	0.0000	CRASH	gen=735 glyphs=2
2026-03-14T07:36:45.541601	9eb27453	0	0	0.0000	CRASH	gen=735 glyphs=3
2026-03-14T07:36:45.541795	099964a4	0	0	0.0000	CRASH	gen=735 glyphs=4
2026-03-14T07:36:45.541988	b1bff38e	0	0	0.0000	CRASH	gen=735 glyphs=4
2026-03-14T07:36:45.542187	3ca14993	0	0	0.0000	CRASH	gen=735 glyphs=4
2026-03-14T07:36:45.542463	099964a4	0	0	0.0000	CRASH	gen=736 glyphs=4
2026-03-14T07:36:45.542662	099964a4	0	0	0.0000	CRASH	gen=736 glyphs=4
2026-03-14T07:36:45.542856	099964a4	0	0	0.0000	CRASH	gen=736 glyphs=4
2026-03-14T07:36:45.543050	80cef82b	0	0	0.0000	CRASH	gen=736 glyphs=4
2026-03-14T07:36:45.543245	3d5da827	0	0	0.0000	CRASH	gen=736 glyphs=5
2026-03-14T07:36:45.543438	099964a4	0	0	0.0000	CRASH	gen=736 glyphs=4
2026-03-14T07:36:45.543634	099964a4	0	0	0.0000	CRASH	gen=736 glyphs=4
2026-03-14T07:36:45.543826	099964a4	0	0	0.0000	CRASH	gen=736 glyphs=4
2026-03-14T07:36:45.544023	ffefe3e2	0	0	0.0000	CRASH	gen=736 glyphs=3
2026-03-14T07:36:45.544221	7ede4765	0	0	0.0000	CRASH	gen=736 glyphs=2
2026-03-14T07:36:45.544497	099964a4	0	0	0.0000	CRASH	gen=737 glyphs=4
2026-03-14T07:36:45.544693	099964a4	0	0	0.0000	CRASH	gen=737 glyphs=4
2026-03-14T07:36:45.544886	3ae4e41c	0	0	0.0000	CRASH	gen=737 glyphs=4
2026-03-14T07:36:45.545079	aa0d13ea	0	0	0.0000	CRASH	gen=737 glyphs=2
2026-03-14T07:36:45.545276	099964a4	0	0	0.0000	CRASH	gen=737 glyphs=4
2026-03-14T07:36:45.545469	ba8e3126	0	0	0.0000	CRASH	gen=737 glyphs=4
2026-03-14T07:36:45.545668	8cc6d696	0	0	0.0000	CRASH	gen=737 glyphs=4
2026-03-14T07:36:45.545862	099964a4	0	0	0.0000	CRASH	gen=737 glyphs=4
2026-03-14T07:36:45.546056	698175ef	0	0	0.0000	CRASH	gen=737 glyphs=3
2026-03-14T07:36:45.546247	3a734398	0	0	0.0000	CRASH	gen=737 glyphs=4
2026-03-14T07:36:45.546533	099964a4	0	0	0.0000	CRASH	gen=738 glyphs=4
2026-03-14T07:36:45.546727	099964a4	0	0	0.0000	CRASH	gen=738 glyphs=4
2026-03-14T07:36:45.546919	9f08a89c	0	0	0.0000	CRASH	gen=738 glyphs=3
2026-03-14T07:36:45.547112	099964a4	0	0	0.0000	CRASH	gen=738 glyphs=4
2026-03-14T07:36:45.547303	099964a4	0	0	0.0000	CRASH	gen=738 glyphs=4
2026-03-14T07:36:45.547497	5c23c07d	0	0	0.0000	CRASH	gen=738 glyphs=3
2026-03-14T07:36:45.547695	099964a4	0	0	0.0000	CRASH	gen=738 glyphs=4
2026-03-14T07:36:45.547889	a73f21d4	0	0	0.0000	CRASH	gen=738 glyphs=2
2026-03-14T07:36:45.548084	099964a4	0	0	0.0000	CRASH	gen=738 glyphs=4
2026-03-14T07:36:45.548277	cf93b656	0	0	0.0000	CRASH	gen=738 glyphs=3
2026-03-14T07:36:45.548560	099964a4	0	0	0.0000	CRASH	gen=739 glyphs=4
2026-03-14T07:36:45.548758	099964a4	0	0	0.0000	CRASH	gen=739 glyphs=4
2026-03-14T07:36:45.548951	099964a4	0	0	0.0000	CRASH	gen=739 glyphs=4
2026-03-14T07:36:45.549143	7ede4765	0	0	0.0000	CRASH	gen=739 glyphs=2
2026-03-14T07:36:45.549335	099964a4	0	0	0.0000	CRASH	gen=739 glyphs=4
2026-03-14T07:36:45.549535	ff30496a	0	0	0.0000	CRASH	gen=739 glyphs=3
2026-03-14T07:36:45.549730	099964a4	0	0	0.0000	CRASH	gen=739 glyphs=4
2026-03-14T07:36:45.549922	099964a4	0	0	0.0000	CRASH	gen=739 glyphs=4
2026-03-14T07:36:45.550114	8da1f8d8	0	0	0.0000	CRASH	gen=739 glyphs=4
2026-03-14T07:36:45.550306	099964a4	0	0	0.0000	CRASH	gen=739 glyphs=4
2026-03-14T07:36:45.550585	099964a4	0	0	0.0000	CRASH	gen=740 glyphs=4
2026-03-14T07:36:45.550780	099964a4	0	0	0.0000	CRASH	gen=740 glyphs=4
2026-03-14T07:36:45.550973	099964a4	0	0	0.0000	CRASH	gen=740 glyphs=4
2026-03-14T07:36:45.551166	099964a4	0	0	0.0000	CRASH	gen=740 glyphs=4
2026-03-14T07:36:45.551358	7e646be3	0	0	0.0000	CRASH	gen=740 glyphs=4
2026-03-14T07:36:45.551555	099964a4	0	0	0.0000	CRASH	gen=740 glyphs=4
2026-03-14T07:36:45.551750	099964a4	0	0	0.0000	CRASH	gen=740 glyphs=4
2026-03-14T07:36:45.551944	3903508f	0	0	0.0000	CRASH	gen=740 glyphs=4
2026-03-14T07:36:45.552141	099964a4	0	0	0.0000	CRASH	gen=740 glyphs=4
2026-03-14T07:36:45.552331	099964a4	0	0	0.0000	CRASH	gen=740 glyphs=4
2026-03-14T07:36:45.552620	099964a4	0	0	0.0000	CRASH	gen=741 glyphs=4
2026-03-14T07:36:45.552819	099964a4	0	0	0.0000	CRASH	gen=741 glyphs=4
2026-03-14T07:36:45.553015	099964a4	0	0	0.0000	CRASH	gen=741 glyphs=4
2026-03-14T07:36:45.553207	62e962bb	0	0	0.0000	CRASH	gen=741 glyphs=4
2026-03-14T07:36:45.553400	3ca14993	0	0	0.0000	CRASH	gen=741 glyphs=4
2026-03-14T07:36:45.553596	099964a4	0	0	0.0000	CRASH	gen=741 glyphs=4
2026-03-14T07:36:45.553792	099964a4	0	0	0.0000	CRASH	gen=741 glyphs=4
2026-03-14T07:36:45.553982	099964a4	0	0	0.0000	CRASH	gen=741 glyphs=4
2026-03-14T07:36:45.554175	099964a4	0	0	0.0000	CRASH	gen=741 glyphs=4
2026-03-14T07:36:45.554368	ff30496a	0	0	0.0000	CRASH	gen=741 glyphs=3
2026-03-14T07:36:45.554645	099964a4	0	0	0.0000	CRASH	gen=742 glyphs=4
2026-03-14T07:36:45.554841	099964a4	0	0	0.0000	CRASH	gen=742 glyphs=4
2026-03-14T07:36:45.555034	099964a4	0	0	0.0000	CRASH	gen=742 glyphs=4
2026-03-14T07:36:45.555223	8d9d7d33	0	0	0.0000	CRASH	gen=742 glyphs=4
2026-03-14T07:36:45.555413	099964a4	0	0	0.0000	CRASH	gen=742 glyphs=4
2026-03-14T07:36:45.555603	9052833f	0	0	0.0000	CRASH	gen=742 glyphs=4
2026-03-14T07:36:45.555795	099964a4	0	0	0.0000	CRASH	gen=742 glyphs=4
2026-03-14T07:36:45.555989	8689a9b3	0	0	0.0000	CRASH	gen=742 glyphs=3
2026-03-14T07:36:45.556180	12a6cd1e	0	0	0.0000	CRASH	gen=742 glyphs=4
2026-03-14T07:36:45.556370	48c79b8b	0	0	0.0000	CRASH	gen=742 glyphs=4
2026-03-14T07:36:45.556648	099964a4	0	0	0.0000	CRASH	gen=743 glyphs=4
2026-03-14T07:36:45.556843	099964a4	0	0	0.0000	CRASH	gen=743 glyphs=4
2026-03-14T07:36:45.557042	099964a4	0	0	0.0000	CRASH	gen=743 glyphs=4
2026-03-14T07:36:45.557236	6d2d7b48	0	0	0.0000	CRASH	gen=743 glyphs=4
2026-03-14T07:36:45.557429	099964a4	0	0	0.0000	CRASH	gen=743 glyphs=4
2026-03-14T07:36:45.557624	099964a4	0	0	0.0000	CRASH	gen=743 glyphs=4
2026-03-14T07:36:45.557818	099964a4	0	0	0.0000	CRASH	gen=743 glyphs=4
2026-03-14T07:36:45.558015	099964a4	0	0	0.0000	CRASH	gen=743 glyphs=4
2026-03-14T07:36:45.558208	ff30496a	0	0	0.0000	CRASH	gen=743 glyphs=3
2026-03-14T07:36:45.558401	099964a4	0	0	0.0000	CRASH	gen=743 glyphs=4
2026-03-14T07:36:45.558671	099964a4	0	0	0.0000	CRASH	gen=744 glyphs=4
2026-03-14T07:36:45.558865	099964a4	0	0	0.0000	CRASH	gen=744 glyphs=4
2026-03-14T07:36:45.559060	099964a4	0	0	0.0000	CRASH	gen=744 glyphs=4
2026-03-14T07:36:45.559253	099964a4	0	0	0.0000	CRASH	gen=744 glyphs=4
2026-03-14T07:36:45.559443	ff30496a	0	0	0.0000	CRASH	gen=744 glyphs=3
2026-03-14T07:36:45.559648	099964a4	0	0	0.0000	CRASH	gen=744 glyphs=4
2026-03-14T07:36:45.559839	099964a4	0	0	0.0000	CRASH	gen=744 glyphs=4
2026-03-14T07:36:45.560028	c0d8ffa6	0	0	0.0000	CRASH	gen=744 glyphs=4
2026-03-14T07:36:45.560226	099964a4	0	0	0.0000	CRASH	gen=744 glyphs=4
2026-03-14T07:36:45.560416	099964a4	0	0	0.0000	CRASH	gen=744 glyphs=4
2026-03-14T07:36:45.560688	099964a4	0	0	0.0000	CRASH	gen=745 glyphs=4
2026-03-14T07:36:45.560882	099964a4	0	0	0.0000	CRASH	gen=745 glyphs=4
2026-03-14T07:36:45.561076	099964a4	0	0	0.0000	CRASH	gen=745 glyphs=4
2026-03-14T07:36:45.561274	099964a4	0	0	0.0000	CRASH	gen=745 glyphs=4
2026-03-14T07:36:45.561469	bfed28cb	0	0	0.0000	CRASH	gen=745 glyphs=2
2026-03-14T07:36:45.561666	d626ca92	0	0	0.0000	CRASH	gen=745 glyphs=1
2026-03-14T07:36:45.561860	e4422085	0	0	0.0000	CRASH	gen=745 glyphs=2
2026-03-14T07:36:45.562055	5d906872	0	0	0.0000	CRASH	gen=745 glyphs=4
2026-03-14T07:36:45.562255	0921278b	0	0	0.0000	CRASH	gen=745 glyphs=3
2026-03-14T07:36:45.562451	cf93b656	0	0	0.0000	CRASH	gen=745 glyphs=3
2026-03-14T07:36:45.562737	099964a4	0	0	0.0000	CRASH	gen=746 glyphs=4
2026-03-14T07:36:45.562934	099964a4	0	0	0.0000	CRASH	gen=746 glyphs=4
2026-03-14T07:36:45.563128	099964a4	0	0	0.0000	CRASH	gen=746 glyphs=4
2026-03-14T07:36:45.563325	099964a4	0	0	0.0000	CRASH	gen=746 glyphs=4
2026-03-14T07:36:45.563524	099964a4	0	0	0.0000	CRASH	gen=746 glyphs=4
2026-03-14T07:36:45.563717	49fa8bfc	0	0	0.0000	CRASH	gen=746 glyphs=3
2026-03-14T07:36:45.563911	099964a4	0	0	0.0000	CRASH	gen=746 glyphs=4
2026-03-14T07:36:45.564107	80cef82b	0	0	0.0000	CRASH	gen=746 glyphs=4
2026-03-14T07:36:45.564300	099964a4	0	0	0.0000	CRASH	gen=746 glyphs=4
2026-03-14T07:36:45.564494	bee7a9f1	0	0	0.0000	CRASH	gen=746 glyphs=4
2026-03-14T07:36:45.564774	099964a4	0	0	0.0000	CRASH	gen=747 glyphs=4
2026-03-14T07:36:45.564968	099964a4	0	0	0.0000	CRASH	gen=747 glyphs=4
2026-03-14T07:36:45.565160	92d627cd	0	0	0.0000	CRASH	gen=747 glyphs=3
2026-03-14T07:36:45.565353	e0b84b20	0	0	0.0000	CRASH	gen=747 glyphs=4
2026-03-14T07:36:45.565554	099964a4	0	0	0.0000	CRASH	gen=747 glyphs=4
2026-03-14T07:36:45.565744	099964a4	0	0	0.0000	CRASH	gen=747 glyphs=4
2026-03-14T07:36:45.565934	099964a4	0	0	0.0000	CRASH	gen=747 glyphs=4
2026-03-14T07:36:45.566125	ed4a853e	0	0	0.0000	CRASH	gen=747 glyphs=4
2026-03-14T07:36:45.566318	099964a4	0	0	0.0000	CRASH	gen=747 glyphs=4
2026-03-14T07:36:45.566520	099964a4	0	0	0.0000	CRASH	gen=747 glyphs=4
2026-03-14T07:36:45.566795	099964a4	0	0	0.0000	CRASH	gen=748 glyphs=4
2026-03-14T07:36:45.566991	099964a4	0	0	0.0000	CRASH	gen=748 glyphs=4
2026-03-14T07:36:45.567183	3a734398	0	0	0.0000	CRASH	gen=748 glyphs=4
2026-03-14T07:36:45.567379	3ca14993	0	0	0.0000	CRASH	gen=748 glyphs=4
2026-03-14T07:36:45.567581	3ca14993	0	0	0.0000	CRASH	gen=748 glyphs=4
2026-03-14T07:36:45.567775	2c1e2038	0	0	0.0000	CRASH	gen=748 glyphs=4
2026-03-14T07:36:45.567968	cf93b656	0	0	0.0000	CRASH	gen=748 glyphs=3
2026-03-14T07:36:45.568160	80cef82b	0	0	0.0000	CRASH	gen=748 glyphs=4
2026-03-14T07:36:45.568351	099964a4	0	0	0.0000	CRASH	gen=748 glyphs=4
2026-03-14T07:36:45.568547	ff30496a	0	0	0.0000	CRASH	gen=748 glyphs=3
2026-03-14T07:36:45.568812	099964a4	0	0	0.0000	CRASH	gen=749 glyphs=4
2026-03-14T07:36:45.569006	099964a4	0	0	0.0000	CRASH	gen=749 glyphs=4
2026-03-14T07:36:45.569198	7fd6b293	0	0	0.0000	CRASH	gen=749 glyphs=4
2026-03-14T07:36:45.569391	099964a4	0	0	0.0000	CRASH	gen=749 glyphs=4
2026-03-14T07:36:45.569587	80cef82b	0	0	0.0000	CRASH	gen=749 glyphs=4
2026-03-14T07:36:45.569781	099964a4	0	0	0.0000	CRASH	gen=749 glyphs=4
2026-03-14T07:36:45.569969	0ce37936	0	0	0.0000	CRASH	gen=749 glyphs=4
2026-03-14T07:36:45.570162	099964a4	0	0	0.0000	CRASH	gen=749 glyphs=4
2026-03-14T07:36:45.570357	099964a4	0	0	0.0000	CRASH	gen=749 glyphs=4
2026-03-14T07:36:45.570553	ff30496a	0	0	0.0000	CRASH	gen=749 glyphs=3
2026-03-14T07:36:45.570817	099964a4	0	0	0.0000	CRASH	gen=750 glyphs=4
2026-03-14T07:36:45.571011	099964a4	0	0	0.0000	CRASH	gen=750 glyphs=4
2026-03-14T07:36:45.571202	ff30496a	0	0	0.0000	CRASH	gen=750 glyphs=3
2026-03-14T07:36:45.571392	099964a4	0	0	0.0000	CRASH	gen=750 glyphs=4
2026-03-14T07:36:45.571586	099964a4	0	0	0.0000	CRASH	gen=750 glyphs=4
2026-03-14T07:36:45.571780	099964a4	0	0	0.0000	CRASH	gen=750 glyphs=4
2026-03-14T07:36:45.571969	099964a4	0	0	0.0000	CRASH	gen=750 glyphs=4
2026-03-14T07:36:45.572160	099964a4	0	0	0.0000	CRASH	gen=750 glyphs=4
2026-03-14T07:36:45.572352	3ca14993	0	0	0.0000	CRASH	gen=750 glyphs=4
2026-03-14T07:36:45.572548	8da1f8d8	0	0	0.0000	CRASH	gen=750 glyphs=4
2026-03-14T07:36:45.572831	099964a4	0	0	0.0000	CRASH	gen=751 glyphs=4
2026-03-14T07:36:45.573025	099964a4	0	0	0.0000	CRASH	gen=751 glyphs=4
2026-03-14T07:36:45.573214	ca32de10	0	0	0.0000	CRASH	gen=751 glyphs=4
2026-03-14T07:36:45.573403	80cef82b	0	0	0.0000	CRASH	gen=751 glyphs=4
2026-03-14T07:36:45.573598	a7c42b01	0	0	0.0000	CRASH	gen=751 glyphs=3
2026-03-14T07:36:45.573787	099964a4	0	0	0.0000	CRASH	gen=751 glyphs=4
2026-03-14T07:36:45.573979	099964a4	0	0	0.0000	CRASH	gen=751 glyphs=4
2026-03-14T07:36:45.574169	4f668f7b	0	0	0.0000	CRASH	gen=751 glyphs=4
2026-03-14T07:36:45.574360	5666ecb1	0	0	0.0000	CRASH	gen=751 glyphs=3
2026-03-14T07:36:45.574554	099964a4	0	0	0.0000	CRASH	gen=751 glyphs=4
2026-03-14T07:36:45.574822	099964a4	0	0	0.0000	CRASH	gen=752 glyphs=4
2026-03-14T07:36:45.575022	099964a4	0	0	0.0000	CRASH	gen=752 glyphs=4
2026-03-14T07:36:45.575217	099964a4	0	0	0.0000	CRASH	gen=752 glyphs=4
2026-03-14T07:36:45.575410	099964a4	0	0	0.0000	CRASH	gen=752 glyphs=4
2026-03-14T07:36:45.575606	099964a4	0	0	0.0000	CRASH	gen=752 glyphs=4
2026-03-14T07:36:45.575801	099964a4	0	0	0.0000	CRASH	gen=752 glyphs=4
2026-03-14T07:36:45.575997	204c85c9	0	0	0.0000	CRASH	gen=752 glyphs=4
2026-03-14T07:36:45.576192	5443f638	0	0	0.0000	CRASH	gen=752 glyphs=4
2026-03-14T07:36:45.576389	80cef82b	0	0	0.0000	CRASH	gen=752 glyphs=4
2026-03-14T07:36:45.576586	dcb1fb50	0	0	0.0000	CRASH	gen=752 glyphs=4
2026-03-14T07:36:45.576857	099964a4	0	0	0.0000	CRASH	gen=753 glyphs=4
2026-03-14T07:36:45.577057	099964a4	0	0	0.0000	CRASH	gen=753 glyphs=4
2026-03-14T07:36:45.577252	099964a4	0	0	0.0000	CRASH	gen=753 glyphs=4
2026-03-14T07:36:45.577445	a7c68421	0	0	0.0000	CRASH	gen=753 glyphs=3
2026-03-14T07:36:45.577642	058060af	0	0	0.0000	CRASH	gen=753 glyphs=4
2026-03-14T07:36:45.577834	cf93b656	0	0	0.0000	CRASH	gen=753 glyphs=3
2026-03-14T07:36:45.578029	2fd68662	0	0	0.0000	CRASH	gen=753 glyphs=4
2026-03-14T07:36:45.578224	cf93b656	0	0	0.0000	CRASH	gen=753 glyphs=3
2026-03-14T07:36:45.578419	15f2b501	0	0	0.0000	CRASH	gen=753 glyphs=3
2026-03-14T07:36:45.578618	cf93b656	0	0	0.0000	CRASH	gen=753 glyphs=3
2026-03-14T07:36:45.578886	099964a4	0	0	0.0000	CRASH	gen=754 glyphs=4
2026-03-14T07:36:45.579080	099964a4	0	0	0.0000	CRASH	gen=754 glyphs=4
2026-03-14T07:36:45.579275	099964a4	0	0	0.0000	CRASH	gen=754 glyphs=4
2026-03-14T07:36:45.579467	099964a4	0	0	0.0000	CRASH	gen=754 glyphs=4
2026-03-14T07:36:45.579663	dcb1fb50	0	0	0.0000	CRASH	gen=754 glyphs=4
2026-03-14T07:36:45.579857	3ca14993	0	0	0.0000	CRASH	gen=754 glyphs=4
2026-03-14T07:36:45.580049	67257abf	0	0	0.0000	CRASH	gen=754 glyphs=4
2026-03-14T07:36:45.580248	52a3fb2e	0	0	0.0000	CRASH	gen=754 glyphs=4
2026-03-14T07:36:45.580444	099964a4	0	0	0.0000	CRASH	gen=754 glyphs=4
2026-03-14T07:36:45.580640	3a734398	0	0	0.0000	CRASH	gen=754 glyphs=4
2026-03-14T07:36:45.580911	099964a4	0	0	0.0000	CRASH	gen=755 glyphs=4
2026-03-14T07:36:45.581104	099964a4	0	0	0.0000	CRASH	gen=755 glyphs=4
2026-03-14T07:36:45.581301	099964a4	0	0	0.0000	CRASH	gen=755 glyphs=4
2026-03-14T07:36:45.581492	099964a4	0	0	0.0000	CRASH	gen=755 glyphs=4
2026-03-14T07:36:45.581687	099964a4	0	0	0.0000	CRASH	gen=755 glyphs=4
2026-03-14T07:36:45.581879	cf93b656	0	0	0.0000	CRASH	gen=755 glyphs=3
2026-03-14T07:36:45.582070	3ca14993	0	0	0.0000	CRASH	gen=755 glyphs=4
2026-03-14T07:36:45.582262	e784a020	0	0	0.0000	CRASH	gen=755 glyphs=3
2026-03-14T07:36:45.582459	099964a4	0	0	0.0000	CRASH	gen=755 glyphs=4
2026-03-14T07:36:45.582652	099964a4	0	0	0.0000	CRASH	gen=755 glyphs=4
2026-03-14T07:36:45.582919	099964a4	0	0	0.0000	CRASH	gen=756 glyphs=4
2026-03-14T07:36:45.583110	099964a4	0	0	0.0000	CRASH	gen=756 glyphs=4
2026-03-14T07:36:45.583302	099964a4	0	0	0.0000	CRASH	gen=756 glyphs=4
2026-03-14T07:36:45.583494	ba27a1a4	0	0	0.0000	CRASH	gen=756 glyphs=4
2026-03-14T07:36:45.583690	099964a4	0	0	0.0000	CRASH	gen=756 glyphs=4
2026-03-14T07:36:45.583881	3ca14993	0	0	0.0000	CRASH	gen=756 glyphs=4
2026-03-14T07:36:45.584073	3ca14993	0	0	0.0000	CRASH	gen=756 glyphs=4
2026-03-14T07:36:45.584267	3a734398	0	0	0.0000	CRASH	gen=756 glyphs=4
2026-03-14T07:36:45.584463	f7c98c25	0	0	0.0000	CRASH	gen=756 glyphs=3
2026-03-14T07:36:45.584660	7ede4765	0	0	0.0000	CRASH	gen=756 glyphs=2
2026-03-14T07:36:45.584927	099964a4	0	0	0.0000	CRASH	gen=757 glyphs=4
2026-03-14T07:36:45.585121	099964a4	0	0	0.0000	CRASH	gen=757 glyphs=4
2026-03-14T07:36:45.585315	ea335a00	0	0	0.0000	CRASH	gen=757 glyphs=2
2026-03-14T07:36:45.585513	099964a4	0	0	0.0000	CRASH	gen=757 glyphs=4
2026-03-14T07:36:45.585710	ad5d3cce	0	0	0.0000	CRASH	gen=757 glyphs=3
2026-03-14T07:36:45.585904	dcb1fb50	0	0	0.0000	CRASH	gen=757 glyphs=4
2026-03-14T07:36:45.586098	099964a4	0	0	0.0000	CRASH	gen=757 glyphs=4
2026-03-14T07:36:45.586290	87ea1681	0	0	0.0000	CRASH	gen=757 glyphs=3
2026-03-14T07:36:45.586487	099964a4	0	0	0.0000	CRASH	gen=757 glyphs=4
2026-03-14T07:36:45.586686	3ca14993	0	0	0.0000	CRASH	gen=757 glyphs=4
2026-03-14T07:36:45.586959	099964a4	0	0	0.0000	CRASH	gen=758 glyphs=4
2026-03-14T07:36:45.587154	099964a4	0	0	0.0000	CRASH	gen=758 glyphs=4
2026-03-14T07:36:45.587346	7ede4765	0	0	0.0000	CRASH	gen=758 glyphs=2
2026-03-14T07:36:45.587540	f912ec7b	0	0	0.0000	CRASH	gen=758 glyphs=4
2026-03-14T07:36:45.587736	099964a4	0	0	0.0000	CRASH	gen=758 glyphs=4
2026-03-14T07:36:45.587927	099964a4	0	0	0.0000	CRASH	gen=758 glyphs=4
2026-03-14T07:36:45.588121	099964a4	0	0	0.0000	CRASH	gen=758 glyphs=4
2026-03-14T07:36:45.588314	9f5a3c3a	0	0	0.0000	CRASH	gen=758 glyphs=3
2026-03-14T07:36:45.588507	099964a4	0	0	0.0000	CRASH	gen=758 glyphs=4
2026-03-14T07:36:45.588705	ff30496a	0	0	0.0000	CRASH	gen=758 glyphs=3
2026-03-14T07:36:45.588979	099964a4	0	0	0.0000	CRASH	gen=759 glyphs=4
2026-03-14T07:36:45.589174	099964a4	0	0	0.0000	CRASH	gen=759 glyphs=4
2026-03-14T07:36:45.589368	099964a4	0	0	0.0000	CRASH	gen=759 glyphs=4
2026-03-14T07:36:45.589563	8da1f8d8	0	0	0.0000	CRASH	gen=759 glyphs=4
2026-03-14T07:36:45.589776	cf93b656	0	0	0.0000	CRASH	gen=759 glyphs=3
2026-03-14T07:36:45.589968	099964a4	0	0	0.0000	CRASH	gen=759 glyphs=4
2026-03-14T07:36:45.590160	099964a4	0	0	0.0000	CRASH	gen=759 glyphs=4
2026-03-14T07:36:45.590352	fb385e2a	0	0	0.0000	CRASH	gen=759 glyphs=4
2026-03-14T07:36:45.590552	d87b6f11	0	0	0.0000	CRASH	gen=759 glyphs=4
2026-03-14T07:36:45.590752	099964a4	0	0	0.0000	CRASH	gen=759 glyphs=4
2026-03-14T07:36:45.591028	099964a4	0	0	0.0000	CRASH	gen=760 glyphs=4
2026-03-14T07:36:45.591224	099964a4	0	0	0.0000	CRASH	gen=760 glyphs=4
2026-03-14T07:36:45.591417	099964a4	0	0	0.0000	CRASH	gen=760 glyphs=4
2026-03-14T07:36:45.591613	099964a4	0	0	0.0000	CRASH	gen=760 glyphs=4
2026-03-14T07:36:45.591808	3bc83805	0	0	0.0000	CRASH	gen=760 glyphs=3
2026-03-14T07:36:45.592000	f56aaff0	0	0	0.0000	CRASH	gen=760 glyphs=4
2026-03-14T07:36:45.592192	099964a4	0	0	0.0000	CRASH	gen=760 glyphs=4
2026-03-14T07:36:45.592386	6abbf651	0	0	0.0000	CRASH	gen=760 glyphs=3
2026-03-14T07:36:45.592580	ff30496a	0	0	0.0000	CRASH	gen=760 glyphs=3
2026-03-14T07:36:45.592774	45f95570	0	0	0.0000	CRASH	gen=760 glyphs=4
2026-03-14T07:36:45.593068	099964a4	0	0	0.0000	CRASH	gen=761 glyphs=4
2026-03-14T07:36:45.593266	099964a4	0	0	0.0000	CRASH	gen=761 glyphs=4
2026-03-14T07:36:45.593461	099964a4	0	0	0.0000	CRASH	gen=761 glyphs=4
2026-03-14T07:36:45.593657	cf93b656	0	0	0.0000	CRASH	gen=761 glyphs=3
2026-03-14T07:36:45.593851	3ca14993	0	0	0.0000	CRASH	gen=761 glyphs=4
2026-03-14T07:36:45.594050	099964a4	0	0	0.0000	CRASH	gen=761 glyphs=4
2026-03-14T07:36:45.594244	3a734398	0	0	0.0000	CRASH	gen=761 glyphs=4
2026-03-14T07:36:45.594439	35be4635	0	0	0.0000	CRASH	gen=761 glyphs=3
2026-03-14T07:36:45.594636	099964a4	0	0	0.0000	CRASH	gen=761 glyphs=4
2026-03-14T07:36:45.594824	099964a4	0	0	0.0000	CRASH	gen=761 glyphs=4
2026-03-14T07:36:45.595088	099964a4	0	0	0.0000	CRASH	gen=762 glyphs=4
2026-03-14T07:36:45.595281	099964a4	0	0	0.0000	CRASH	gen=762 glyphs=4
2026-03-14T07:36:45.595470	7ede4765	0	0	0.0000	CRASH	gen=762 glyphs=2
2026-03-14T07:36:45.595665	099964a4	0	0	0.0000	CRASH	gen=762 glyphs=4
2026-03-14T07:36:45.595854	b422b6d1	0	0	0.0000	CRASH	gen=762 glyphs=3
2026-03-14T07:36:45.596050	3a734398	0	0	0.0000	CRASH	gen=762 glyphs=4
2026-03-14T07:36:45.596241	bfbfd4f6	0	0	0.0000	CRASH	gen=762 glyphs=3
2026-03-14T07:36:45.596434	099964a4	0	0	0.0000	CRASH	gen=762 glyphs=4
2026-03-14T07:36:45.596627	099964a4	0	0	0.0000	CRASH	gen=762 glyphs=4
2026-03-14T07:36:45.596816	45b3d541	0	0	0.0000	CRASH	gen=762 glyphs=3
2026-03-14T07:36:45.597094	099964a4	0	0	0.0000	CRASH	gen=763 glyphs=4
2026-03-14T07:36:45.597286	099964a4	0	0	0.0000	CRASH	gen=763 glyphs=4
2026-03-14T07:36:45.597480	099964a4	0	0	0.0000	CRASH	gen=763 glyphs=4
2026-03-14T07:36:45.597675	099964a4	0	0	0.0000	CRASH	gen=763 glyphs=4
2026-03-14T07:36:45.597868	099964a4	0	0	0.0000	CRASH	gen=763 glyphs=4
2026-03-14T07:36:45.598069	099964a4	0	0	0.0000	CRASH	gen=763 glyphs=4
2026-03-14T07:36:45.598266	099964a4	0	0	0.0000	CRASH	gen=763 glyphs=4
2026-03-14T07:36:45.598456	099964a4	0	0	0.0000	CRASH	gen=763 glyphs=4
2026-03-14T07:36:45.598650	ff30496a	0	0	0.0000	CRASH	gen=763 glyphs=3
2026-03-14T07:36:45.598838	80cef82b	0	0	0.0000	CRASH	gen=763 glyphs=4
2026-03-14T07:36:45.599112	099964a4	0	0	0.0000	CRASH	gen=764 glyphs=4
2026-03-14T07:36:45.599312	099964a4	0	0	0.0000	CRASH	gen=764 glyphs=4
