timestamp	program_hash	spirv_size	word_count	fitness	status	description
2026-03-14T07:38:05.779782	2974ac2e	116	29	1.0000	DISCARD	gen=33 glyphs=3
2026-03-14T07:38:05.785243	fd2be326	116	29	1.0000	DISCARD	gen=34 glyphs=4
2026-03-14T07:38:05.790847	e9e25320	120	30	1.0000	DISCARD	gen=34 glyphs=2
2026-03-14T07:38:05.796388	a3cd0fa9	116	29	1.0000	DISCARD	gen=34 glyphs=3
2026-03-14T07:38:05.801039	68a0cd67	116	29	0.9600	DISCARD	gen=35 glyphs=5
2026-03-14T07:38:05.806920	7134e4ce	120	30	1.0000	DISCARD	gen=35 glyphs=5
2026-03-14T07:38:05.812932	2974ac2e	116	29	1.0000	DISCARD	gen=35 glyphs=3
2026-03-14T07:38:05.818367	879e5ad4	120	30	1.0000	DISCARD	gen=36 glyphs=6
2026-03-14T07:38:05.823499	7134e4ce	120	30	1.0000	DISCARD	gen=36 glyphs=5
2026-03-14T07:38:05.828170	fd2be326	116	29	1.0000	DISCARD	gen=36 glyphs=4
2026-03-14T07:38:05.832678	6ff15767	116	29	0.9333	DISCARD	gen=37 glyphs=3
2026-03-14T07:38:05.837783	2974ac2e	116	29	1.0000	DISCARD	gen=37 glyphs=3
2026-03-14T07:38:05.842513	fd2be326	116	29	1.0000	DISCARD	gen=37 glyphs=4
2026-03-14T07:38:05.847718	b10a3450	116	29	1.0000	DISCARD	gen=38 glyphs=3
2026-03-14T07:38:05.852651	7134e4ce	120	30	1.0000	DISCARD	gen=38 glyphs=5
2026-03-14T07:38:05.858339	514dd2af	120	30	0.9667	DISCARD	gen=38 glyphs=6
2026-03-14T07:38:05.863638	2974ac2e	116	29	1.0000	DISCARD	gen=39 glyphs=3
2026-03-14T07:38:05.868564	2974ac2e	116	29	1.0000	DISCARD	gen=39 glyphs=3
2026-03-14T07:38:05.873752	2974ac2e	116	29	1.0000	DISCARD	gen=39 glyphs=3
2026-03-14T07:38:05.880255	2974ac2e	116	29	1.0000	DISCARD	gen=40 glyphs=3
2026-03-14T07:38:05.885950	fcabb557	116	29	1.0000	DISCARD	gen=40 glyphs=4
2026-03-14T07:38:05.891749	2974ac2e	116	29	1.0000	DISCARD	gen=40 glyphs=3
2026-03-14T07:38:05.897663	f910a02b	116	29	1.0000	DISCARD	gen=41 glyphs=4
2026-03-14T07:38:05.903608	7fe047bb	120	30	1.0000	DISCARD	gen=41 glyphs=3
2026-03-14T07:38:05.909304	fd2be326	116	29	1.0000	DISCARD	gen=41 glyphs=4
2026-03-14T07:38:05.915188	b10a3450	116	29	1.0000	DISCARD	gen=42 glyphs=3
2026-03-14T07:38:05.921144	13ac7569	116	29	1.0000	DISCARD	gen=42 glyphs=2
2026-03-14T07:38:05.926781	be7eac6c	124	31	0.9429	DISCARD	gen=42 glyphs=7
2026-03-14T07:38:05.932097	ae76ed03	116	29	1.0000	DISCARD	gen=43 glyphs=2
2026-03-14T07:38:05.937460	b10a3450	116	29	1.0000	DISCARD	gen=43 glyphs=3
2026-03-14T07:38:05.943347	7134e4ce	120	30	1.0000	DISCARD	gen=43 glyphs=5
2026-03-14T07:38:05.949458	5b887abb	116	29	0.9000	DISCARD	gen=44 glyphs=2
2026-03-14T07:38:05.955260	b10a3450	116	29	1.0000	DISCARD	gen=44 glyphs=3
2026-03-14T07:38:05.960355	b10a3450	116	29	1.0000	DISCARD	gen=44 glyphs=3
2026-03-14T07:38:05.966409	7134e4ce	120	30	1.0000	DISCARD	gen=45 glyphs=5
2026-03-14T07:38:05.972120	2974ac2e	116	29	1.0000	DISCARD	gen=45 glyphs=3
2026-03-14T07:38:05.978169	d2b12228	116	29	1.0000	DISCARD	gen=45 glyphs=4
2026-03-14T07:38:05.985178	004baf40	116	29	1.0000	DISCARD	gen=46 glyphs=3
2026-03-14T07:38:05.990104	aa182d69	116	29	1.0000	DISCARD	gen=46 glyphs=3
2026-03-14T07:38:05.994846	2e032eeb	116	29	1.0000	DISCARD	gen=46 glyphs=3
2026-03-14T07:38:06.000616	b10a3450	116	29	1.0000	DISCARD	gen=47 glyphs=3
2026-03-14T07:38:06.006979	2974ac2e	116	29	1.0000	DISCARD	gen=47 glyphs=3
2026-03-14T07:38:06.013352	f323ca37	116	29	1.0000	DISCARD	gen=47 glyphs=2
2026-03-14T07:38:06.019391	fd2be326	116	29	1.0000	DISCARD	gen=48 glyphs=4
2026-03-14T07:38:06.025560	debc2c99	120	30	1.0000	DISCARD	gen=48 glyphs=6
2026-03-14T07:38:06.030724	7134e4ce	120	30	1.0000	DISCARD	gen=48 glyphs=5
2026-03-14T07:38:06.035328	2a299aba	116	29	1.0000	DISCARD	gen=49 glyphs=3
2026-03-14T07:38:06.041158	2974ac2e	116	29	1.0000	DISCARD	gen=49 glyphs=3
2026-03-14T07:38:06.047029	b10a3450	116	29	1.0000	DISCARD	gen=49 glyphs=3
2026-03-14T07:47:31.132235	099964a4	0	0	0.0000	CRASH	gen=0 glyphs=4
2026-03-14T07:47:31.137898	099964a4	0	0	0.0000	CRASH	gen=0 glyphs=4
2026-03-14T07:47:31.142781	099964a4	0	0	0.0000	CRASH	gen=0 glyphs=4
2026-03-14T07:47:31.147481	ccc0c612	120	30	1.0000	DISCARD	gen=1 glyphs=4
2026-03-14T07:47:31.153930	e86219c7	120	30	1.0000	DISCARD	gen=1 glyphs=3
2026-03-14T07:47:31.160599	5f9b9b4e	120	30	1.0000	DISCARD	gen=1 glyphs=4
2026-03-14T07:47:31.166715	ccc0c612	120	30	1.0000	DISCARD	gen=2 glyphs=4
2026-03-14T07:47:31.173137	03748720	116	29	1.0000	DISCARD	gen=2 glyphs=4
2026-03-14T07:47:31.178287	ccc0c612	120	30	1.0000	DISCARD	gen=2 glyphs=4
2026-03-14T07:47:31.184407	0386edc8	120	30	1.0000	DISCARD	gen=3 glyphs=3
2026-03-14T07:47:31.189567	ff37cce0	120	30	1.0000	DISCARD	gen=3 glyphs=3
2026-03-14T07:47:31.194526	9b1a50ad	116	29	0.9500	DISCARD	gen=3 glyphs=4
2026-03-14T07:47:31.199840	4276b31e	116	29	1.0000	DISCARD	gen=4 glyphs=3
2026-03-14T07:47:31.205099	e86219c7	120	30	1.0000	DISCARD	gen=4 glyphs=3
2026-03-14T07:47:31.211146	ccc0c612	120	30	1.0000	DISCARD	gen=4 glyphs=4
2026-03-14T07:47:31.217083	e86219c7	120	30	1.0000	DISCARD	gen=5 glyphs=3
2026-03-14T07:47:31.223112	ccc0c612	120	30	1.0000	DISCARD	gen=5 glyphs=4
2026-03-14T07:47:31.227768	ccc0c612	120	30	1.0000	DISCARD	gen=5 glyphs=4
2026-03-14T07:47:31.233769	ccc0c612	120	30	1.0000	DISCARD	gen=6 glyphs=4
2026-03-14T07:47:31.238549	ccc0c612	120	30	1.0000	DISCARD	gen=6 glyphs=4
2026-03-14T07:47:31.243145	ccc0c612	120	30	1.0000	DISCARD	gen=6 glyphs=4
2026-03-14T07:47:31.248096	a4191f67	120	30	1.0000	DISCARD	gen=7 glyphs=4
2026-03-14T07:47:31.252577	ccc0c612	120	30	1.0000	DISCARD	gen=7 glyphs=4
2026-03-14T07:47:31.257638	4276b31e	116	29	1.0000	DISCARD	gen=7 glyphs=3
2026-03-14T07:47:31.262625	4276b31e	116	29	1.0000	DISCARD	gen=8 glyphs=3
2026-03-14T07:47:31.267470	5f9b9b4e	120	30	1.0000	DISCARD	gen=8 glyphs=4
2026-03-14T07:47:31.272161	5f9b9b4e	120	30	1.0000	DISCARD	gen=8 glyphs=4
2026-03-14T07:47:31.278920	e86219c7	120	30	1.0000	DISCARD	gen=9 glyphs=3
2026-03-14T07:47:31.284336	ccc0c612	120	30	1.0000	DISCARD	gen=9 glyphs=4
2026-03-14T07:47:31.289386	ccc0c612	120	30	1.0000	DISCARD	gen=9 glyphs=4
2026-03-14T07:47:31.294543	e86219c7	120	30	1.0000	DISCARD	gen=10 glyphs=3
2026-03-14T07:47:31.299636	e86219c7	120	30	1.0000	DISCARD	gen=10 glyphs=3
2026-03-14T07:47:31.304636	1152c171	120	30	1.0000	DISCARD	gen=10 glyphs=3
2026-03-14T07:47:31.309773	5f9b9b4e	120	30	1.0000	DISCARD	gen=11 glyphs=4
2026-03-14T07:47:31.314585	5f9b9b4e	120	30	1.0000	DISCARD	gen=11 glyphs=4
2026-03-14T07:47:31.319368	c6994e0f	116	29	1.0000	DISCARD	gen=11 glyphs=4
2026-03-14T07:47:31.325995	5f9b9b4e	120	30	1.0000	DISCARD	gen=12 glyphs=4
2026-03-14T07:47:31.332449	5f9b9b4e	120	30	1.0000	DISCARD	gen=12 glyphs=4
2026-03-14T07:47:31.337661	ccc0c612	120	30	1.0000	DISCARD	gen=12 glyphs=4
2026-03-14T07:47:31.342211	5f9b9b4e	120	30	1.0000	DISCARD	gen=13 glyphs=4
2026-03-14T07:47:31.347231	5f9b9b4e	120	30	1.0000	DISCARD	gen=13 glyphs=4
2026-03-14T07:47:31.354256	5f9b9b4e	120	30	1.0000	DISCARD	gen=13 glyphs=4
2026-03-14T07:47:31.359426	e86219c7	120	30	1.0000	DISCARD	gen=14 glyphs=3
2026-03-14T07:47:31.369217	e86219c7	120	30	1.0000	DISCARD	gen=14 glyphs=3
2026-03-14T07:47:31.375410	c91827ff	116	29	1.0000	DISCARD	gen=14 glyphs=4
2026-03-14T07:47:31.391698	fe4a8b84	120	30	1.0000	DISCARD	gen=15 glyphs=3
2026-03-14T07:47:31.408598	5f9b9b4e	120	30	1.0000	DISCARD	gen=15 glyphs=4
2026-03-14T07:47:31.418852	b8aeeb62	116	29	1.0000	DISCARD	gen=15 glyphs=3
2026-03-14T07:47:31.430421	26505b5f	116	29	1.0000	DISCARD	gen=16 glyphs=3
2026-03-14T07:47:31.445364	5f9b9b4e	120	30	1.0000	DISCARD	gen=16 glyphs=4
2026-03-14T07:47:31.452284	4276b31e	116	29	1.0000	DISCARD	gen=16 glyphs=3
2026-03-14T07:47:31.457802	5f9b9b4e	120	30	1.0000	DISCARD	gen=17 glyphs=4
2026-03-14T07:47:31.464762	ccc0c612	120	30	1.0000	DISCARD	gen=17 glyphs=4
2026-03-14T07:47:31.469585	4276b31e	116	29	1.0000	DISCARD	gen=17 glyphs=3
2026-03-14T07:47:31.474497	ccc0c612	120	30	1.0000	DISCARD	gen=18 glyphs=4
2026-03-14T07:47:31.481492	ccc0c612	120	30	1.0000	DISCARD	gen=18 glyphs=4
2026-03-14T07:47:31.488655	ccc0c612	120	30	1.0000	DISCARD	gen=18 glyphs=4
2026-03-14T07:47:31.494411	8f19fec1	120	30	1.0000	DISCARD	gen=19 glyphs=4
2026-03-14T07:47:31.501365	e86219c7	120	30	1.0000	DISCARD	gen=19 glyphs=3
2026-03-14T07:47:31.508157	ccc0c612	120	30	1.0000	DISCARD	gen=19 glyphs=4
2026-03-14T07:47:31.514675	ccc0c612	120	30	1.0000	DISCARD	gen=20 glyphs=4
2026-03-14T07:47:31.520553	4276b31e	116	29	1.0000	DISCARD	gen=20 glyphs=3
2026-03-14T07:47:31.527353	ccc0c612	120	30	1.0000	DISCARD	gen=20 glyphs=4
2026-03-14T07:47:31.532750	fb1d19c5	116	29	1.0000	DISCARD	gen=21 glyphs=4
2026-03-14T07:47:31.538645	e86219c7	120	30	1.0000	DISCARD	gen=21 glyphs=3
2026-03-14T07:47:31.543353	ecb38f1b	116	29	0.9333	DISCARD	gen=21 glyphs=3
2026-03-14T07:47:31.549337	4276b31e	116	29	1.0000	DISCARD	gen=22 glyphs=3
2026-03-14T07:47:31.555226	bfbddaac	124	31	0.9500	DISCARD	gen=22 glyphs=4
2026-03-14T07:47:31.561868	5f9b9b4e	120	30	1.0000	DISCARD	gen=22 glyphs=4
2026-03-14T07:47:31.568187	5f9b9b4e	120	30	1.0000	DISCARD	gen=23 glyphs=4
2026-03-14T07:47:31.574815	6a84b177	120	30	1.0000	DISCARD	gen=23 glyphs=4
2026-03-14T07:47:31.580272	e86219c7	120	30	1.0000	DISCARD	gen=23 glyphs=3
2026-03-14T07:47:31.584702	03ccadfa	116	29	1.0000	DISCARD	gen=24 glyphs=3
2026-03-14T07:47:31.588960	ccc0c612	120	30	1.0000	DISCARD	gen=24 glyphs=4
2026-03-14T07:47:31.594344	5f9b9b4e	120	30	1.0000	DISCARD	gen=24 glyphs=4
2026-03-14T07:47:31.602475	ccc0c612	120	30	1.0000	DISCARD	gen=25 glyphs=4
2026-03-14T07:47:31.608772	15ede63a	120	30	1.0000	DISCARD	gen=25 glyphs=4
2026-03-14T07:47:31.615830	e86219c7	120	30	1.0000	DISCARD	gen=25 glyphs=3
2026-03-14T07:47:31.621316	ccc0c612	120	30	1.0000	DISCARD	gen=26 glyphs=4
2026-03-14T07:47:31.626097	ea2da345	120	30	1.0000	DISCARD	gen=26 glyphs=2
2026-03-14T07:47:31.631753	5f9b9b4e	120	30	1.0000	DISCARD	gen=26 glyphs=4
2026-03-14T07:47:31.637405	5f9b9b4e	120	30	1.0000	DISCARD	gen=27 glyphs=4
2026-03-14T07:47:31.642300	5f9b9b4e	120	30	1.0000	DISCARD	gen=27 glyphs=4
2026-03-14T07:47:31.647440	e86219c7	120	30	1.0000	DISCARD	gen=27 glyphs=3
2026-03-14T07:47:31.652552	4ceb8a50	120	30	1.0000	DISCARD	gen=28 glyphs=3
2026-03-14T07:47:31.658947	4276b31e	116	29	1.0000	DISCARD	gen=28 glyphs=3
2026-03-14T07:47:31.665133	2f0b7bd4	120	30	1.0000	DISCARD	gen=28 glyphs=4
2026-03-14T07:47:31.670617	5f9b9b4e	120	30	1.0000	DISCARD	gen=29 glyphs=4
2026-03-14T07:47:31.675888	5f9b9b4e	120	30	1.0000	DISCARD	gen=29 glyphs=4
2026-03-14T07:47:31.680776	e86219c7	120	30	1.0000	DISCARD	gen=29 glyphs=3
2026-03-14T07:47:31.686211	5f9b9b4e	120	30	1.0000	DISCARD	gen=30 glyphs=4
2026-03-14T07:47:31.691471	4276b31e	116	29	1.0000	DISCARD	gen=30 glyphs=3
2026-03-14T07:47:31.697053	4276b31e	116	29	1.0000	DISCARD	gen=30 glyphs=3
2026-03-14T07:47:31.702964	e86219c7	120	30	1.0000	DISCARD	gen=31 glyphs=3
2026-03-14T07:47:31.707916	2c3288ab	120	30	1.0000	DISCARD	gen=31 glyphs=3
2026-03-14T07:47:31.712325	ccc0c612	120	30	1.0000	DISCARD	gen=31 glyphs=4
2026-03-14T07:47:31.717054	3c523c66	116	29	1.0000	DISCARD	gen=32 glyphs=3
2026-03-14T07:47:31.721956	4276b31e	116	29	1.0000	DISCARD	gen=32 glyphs=3
2026-03-14T07:47:31.726417	51d11597	120	30	1.0000	DISCARD	gen=32 glyphs=4
2026-03-14T07:47:31.731026	ccc0c612	120	30	1.0000	DISCARD	gen=33 glyphs=4
2026-03-14T07:47:31.735801	5f9b9b4e	120	30	1.0000	DISCARD	gen=33 glyphs=4
2026-03-14T07:47:31.740017	ccc0c612	120	30	1.0000	DISCARD	gen=33 glyphs=4
2026-03-14T07:47:31.744504	8fad0c1c	120	30	1.0000	DISCARD	gen=34 glyphs=4
2026-03-14T07:47:31.749929	ccc0c612	120	30	1.0000	DISCARD	gen=34 glyphs=4
2026-03-14T07:47:31.755088	b631bf61	116	29	1.0000	DISCARD	gen=34 glyphs=2
2026-03-14T07:47:31.760093	4276b31e	116	29	1.0000	DISCARD	gen=35 glyphs=3
2026-03-14T07:47:31.765498	e86219c7	120	30	1.0000	DISCARD	gen=35 glyphs=3
2026-03-14T07:47:31.771475	4276b31e	116	29	1.0000	DISCARD	gen=35 glyphs=3
2026-03-14T07:47:31.777771	ccc0c612	120	30	1.0000	DISCARD	gen=36 glyphs=4
2026-03-14T07:47:31.784189	4276b31e	116	29	1.0000	DISCARD	gen=36 glyphs=3
2026-03-14T07:47:31.789156	ccc0c612	120	30	1.0000	DISCARD	gen=36 glyphs=4
2026-03-14T07:47:31.793548	5f9b9b4e	120	30	1.0000	DISCARD	gen=37 glyphs=4
2026-03-14T07:47:31.798866	4276b31e	116	29	1.0000	DISCARD	gen=37 glyphs=3
2026-03-14T07:47:31.804283	1ca3b4e9	120	30	1.0000	DISCARD	gen=37 glyphs=3
2026-03-14T07:47:31.810303	ccc0c612	120	30	1.0000	DISCARD	gen=38 glyphs=4
2026-03-14T07:47:31.816236	5f9b9b4e	120	30	1.0000	DISCARD	gen=38 glyphs=4
2026-03-14T07:47:31.822260	77ce017e	120	30	1.0000	DISCARD	gen=38 glyphs=4
2026-03-14T07:47:31.827709	99248754	116	29	1.0000	DISCARD	gen=39 glyphs=3
2026-03-14T07:47:31.832448	fbacd082	116	29	1.0000	DISCARD	gen=39 glyphs=3
2026-03-14T07:47:31.837199	e86219c7	120	30	1.0000	DISCARD	gen=39 glyphs=3
2026-03-14T07:47:31.843106	16488342	120	30	1.0000	DISCARD	gen=40 glyphs=4
2026-03-14T07:47:31.848613	e9f782e0	116	29	1.0000	DISCARD	gen=40 glyphs=4
2026-03-14T07:47:31.854085	4276b31e	116	29	1.0000	DISCARD	gen=40 glyphs=3
2026-03-14T07:47:31.858971	ccc0c612	120	30	1.0000	DISCARD	gen=41 glyphs=4
2026-03-14T07:47:31.864246	d1d4ddc8	116	29	1.0000	DISCARD	gen=41 glyphs=4
2026-03-14T07:47:31.870109	e86219c7	120	30	1.0000	DISCARD	gen=41 glyphs=3
2026-03-14T07:47:31.875548	595e7b66	120	30	1.0000	DISCARD	gen=42 glyphs=2
2026-03-14T07:47:31.879876	06fe061d	116	29	1.0000	DISCARD	gen=42 glyphs=2
2026-03-14T07:47:31.885543	ccc0c612	120	30	1.0000	DISCARD	gen=42 glyphs=4
2026-03-14T07:47:31.891422	90a8aea1	116	29	1.0000	DISCARD	gen=43 glyphs=3
2026-03-14T07:47:31.896439	ccc0c612	120	30	1.0000	DISCARD	gen=43 glyphs=4
2026-03-14T07:47:31.901823	4276b31e	116	29	1.0000	DISCARD	gen=43 glyphs=3
2026-03-14T07:47:31.906769	e86219c7	120	30	1.0000	DISCARD	gen=44 glyphs=3
2026-03-14T07:47:31.911286	1ca065b3	116	29	1.0000	DISCARD	gen=44 glyphs=4
2026-03-14T07:47:31.917005	4276b31e	116	29	1.0000	DISCARD	gen=44 glyphs=3
2026-03-14T07:47:31.922370	5f9b9b4e	120	30	1.0000	DISCARD	gen=45 glyphs=4
2026-03-14T07:47:31.928724	5f9b9b4e	120	30	1.0000	DISCARD	gen=45 glyphs=4
2026-03-14T07:47:31.933453	ccc0c612	120	30	1.0000	DISCARD	gen=45 glyphs=4
2026-03-14T07:47:31.938321	e86219c7	120	30	1.0000	DISCARD	gen=46 glyphs=3
2026-03-14T07:47:31.943649	e86219c7	120	30	1.0000	DISCARD	gen=46 glyphs=3
2026-03-14T07:47:31.948730	0db8a203	116	29	1.0000	DISCARD	gen=46 glyphs=2
2026-03-14T07:47:31.954320	ccc0c612	120	30	1.0000	DISCARD	gen=47 glyphs=4
2026-03-14T07:47:31.959636	e86219c7	120	30	1.0000	DISCARD	gen=47 glyphs=3
2026-03-14T07:47:31.964445	5f9b9b4e	120	30	1.0000	DISCARD	gen=47 glyphs=4
2026-03-14T07:47:31.970501	e86219c7	120	30	1.0000	DISCARD	gen=48 glyphs=3
2026-03-14T07:47:31.976420	5f9b9b4e	120	30	1.0000	DISCARD	gen=48 glyphs=4
2026-03-14T07:47:31.981554	cb0f39d9	120	30	1.0000	DISCARD	gen=48 glyphs=4
2026-03-14T07:47:31.987224	5f9b9b4e	120	30	1.0000	DISCARD	gen=49 glyphs=4
2026-03-14T07:47:31.992447	ccc0c612	120	30	1.0000	DISCARD	gen=49 glyphs=4
2026-03-14T07:47:31.998318	42ddf35f	120	30	1.0000	DISCARD	gen=49 glyphs=4
