timestamp	program_hash	spirv_size	word_count	fitness	status	description
2026-03-14T07:36:44.053636	990e8f9a	0	0	0.0000	CRASH	gen=11 glyphs=3
2026-03-14T07:36:44.053912	099964a4	0	0	0.0000	CRASH	gen=12 glyphs=4
2026-03-14T07:36:44.054110	099964a4	0	0	0.0000	CRASH	gen=12 glyphs=4
2026-03-14T07:36:44.054303	099964a4	0	0	0.0000	CRASH	gen=12 glyphs=4
2026-03-14T07:36:44.054495	099964a4	0	0	0.0000	CRASH	gen=12 glyphs=4
2026-03-14T07:36:44.054688	7c7858ce	0	0	0.0000	CRASH	gen=12 glyphs=3
2026-03-14T07:36:44.054880	099964a4	0	0	0.0000	CRASH	gen=12 glyphs=4
2026-03-14T07:36:44.055080	099964a4	0	0	0.0000	CRASH	gen=12 glyphs=4
2026-03-14T07:36:44.055272	ff30496a	0	0	0.0000	CRASH	gen=12 glyphs=3
2026-03-14T07:36:44.055465	099964a4	0	0	0.0000	CRASH	gen=12 glyphs=4
2026-03-14T07:36:44.055658	ff30496a	0	0	0.0000	CRASH	gen=12 glyphs=3
2026-03-14T07:36:44.055938	099964a4	0	0	0.0000	CRASH	gen=13 glyphs=4
2026-03-14T07:36:44.056136	099964a4	0	0	0.0000	CRASH	gen=13 glyphs=4
2026-03-14T07:36:44.056329	099964a4	0	0	0.0000	CRASH	gen=13 glyphs=4
2026-03-14T07:36:44.056532	cf93b656	0	0	0.0000	CRASH	gen=13 glyphs=3
2026-03-14T07:36:44.056726	099964a4	0	0	0.0000	CRASH	gen=13 glyphs=4
2026-03-14T07:36:44.056920	099964a4	0	0	0.0000	CRASH	gen=13 glyphs=4
2026-03-14T07:36:44.057117	099964a4	0	0	0.0000	CRASH	gen=13 glyphs=4
2026-03-14T07:36:44.057307	099964a4	0	0	0.0000	CRASH	gen=13 glyphs=4
2026-03-14T07:36:44.057500	099964a4	0	0	0.0000	CRASH	gen=13 glyphs=4
2026-03-14T07:36:44.057693	099964a4	0	0	0.0000	CRASH	gen=13 glyphs=4
2026-03-14T07:36:44.057974	099964a4	0	0	0.0000	CRASH	gen=14 glyphs=4
2026-03-14T07:36:44.058179	099964a4	0	0	0.0000	CRASH	gen=14 glyphs=4
2026-03-14T07:36:44.058375	7ede4765	0	0	0.0000	CRASH	gen=14 glyphs=2
2026-03-14T07:36:44.058577	f3147355	0	0	0.0000	CRASH	gen=14 glyphs=4
2026-03-14T07:36:44.058776	925dadd4	0	0	0.0000	CRASH	gen=14 glyphs=3
2026-03-14T07:36:44.058973	cf93b656	0	0	0.0000	CRASH	gen=14 glyphs=3
2026-03-14T07:36:44.059173	099964a4	0	0	0.0000	CRASH	gen=14 glyphs=4
2026-03-14T07:36:44.059370	099964a4	0	0	0.0000	CRASH	gen=14 glyphs=4
2026-03-14T07:36:44.059567	099964a4	0	0	0.0000	CRASH	gen=14 glyphs=4
2026-03-14T07:36:44.059761	099964a4	0	0	0.0000	CRASH	gen=14 glyphs=4
2026-03-14T07:36:44.060040	099964a4	0	0	0.0000	CRASH	gen=15 glyphs=4
2026-03-14T07:36:44.060235	099964a4	0	0	0.0000	CRASH	gen=15 glyphs=4
2026-03-14T07:36:44.060437	3a734398	0	0	0.0000	CRASH	gen=15 glyphs=4
2026-03-14T07:36:44.060633	925b9ee3	0	0	0.0000	CRASH	gen=15 glyphs=4
2026-03-14T07:36:44.060828	3a734398	0	0	0.0000	CRASH	gen=15 glyphs=4
2026-03-14T07:36:44.061021	099964a4	0	0	0.0000	CRASH	gen=15 glyphs=4
2026-03-14T07:36:44.061212	cf93b656	0	0	0.0000	CRASH	gen=15 glyphs=3
2026-03-14T07:36:44.061412	aa851094	0	0	0.0000	CRASH	gen=15 glyphs=4
2026-03-14T07:36:44.061611	cf93b656	0	0	0.0000	CRASH	gen=15 glyphs=3
2026-03-14T07:36:44.061802	d732332d	0	0	0.0000	CRASH	gen=15 glyphs=3
2026-03-14T07:36:44.062084	099964a4	0	0	0.0000	CRASH	gen=16 glyphs=4
2026-03-14T07:36:44.062281	099964a4	0	0	0.0000	CRASH	gen=16 glyphs=4
2026-03-14T07:36:44.062479	099964a4	0	0	0.0000	CRASH	gen=16 glyphs=4
2026-03-14T07:36:44.062672	099964a4	0	0	0.0000	CRASH	gen=16 glyphs=4
2026-03-14T07:36:44.062885	783c7892	0	0	0.0000	CRASH	gen=16 glyphs=4
2026-03-14T07:36:44.063081	ff30496a	0	0	0.0000	CRASH	gen=16 glyphs=3
2026-03-14T07:36:44.063325	7ede4765	0	0	0.0000	CRASH	gen=16 glyphs=2
2026-03-14T07:36:44.063577	099964a4	0	0	0.0000	CRASH	gen=16 glyphs=4
2026-03-14T07:36:44.063779	d2fb1b0c	0	0	0.0000	CRASH	gen=16 glyphs=3
2026-03-14T07:36:44.063972	099964a4	0	0	0.0000	CRASH	gen=16 glyphs=4
2026-03-14T07:36:44.064255	099964a4	0	0	0.0000	CRASH	gen=17 glyphs=4
2026-03-14T07:36:44.064450	099964a4	0	0	0.0000	CRASH	gen=17 glyphs=4
2026-03-14T07:36:44.064651	099964a4	0	0	0.0000	CRASH	gen=17 glyphs=4
2026-03-14T07:36:44.064845	099964a4	0	0	0.0000	CRASH	gen=17 glyphs=4
2026-03-14T07:36:44.065038	099964a4	0	0	0.0000	CRASH	gen=17 glyphs=4
2026-03-14T07:36:44.065233	348ca20c	0	0	0.0000	CRASH	gen=17 glyphs=3
2026-03-14T07:36:44.065428	59585ea5	0	0	0.0000	CRASH	gen=17 glyphs=4
2026-03-14T07:36:44.065640	ee4b7d95	0	0	0.0000	CRASH	gen=17 glyphs=3
2026-03-14T07:36:44.065834	099964a4	0	0	0.0000	CRASH	gen=17 glyphs=4
2026-03-14T07:36:44.066028	caad033f	0	0	0.0000	CRASH	gen=17 glyphs=3
2026-03-14T07:36:44.066303	099964a4	0	0	0.0000	CRASH	gen=18 glyphs=4
2026-03-14T07:36:44.066497	099964a4	0	0	0.0000	CRASH	gen=18 glyphs=4
2026-03-14T07:36:44.066700	099964a4	0	0	0.0000	CRASH	gen=18 glyphs=4
2026-03-14T07:36:44.066900	099964a4	0	0	0.0000	CRASH	gen=18 glyphs=4
2026-03-14T07:36:44.067098	ff30496a	0	0	0.0000	CRASH	gen=18 glyphs=3
2026-03-14T07:36:44.067297	099964a4	0	0	0.0000	CRASH	gen=18 glyphs=4
2026-03-14T07:36:44.067491	099964a4	0	0	0.0000	CRASH	gen=18 glyphs=4
2026-03-14T07:36:44.067686	099964a4	0	0	0.0000	CRASH	gen=18 glyphs=4
2026-03-14T07:36:44.067882	cf93b656	0	0	0.0000	CRASH	gen=18 glyphs=3
2026-03-14T07:36:44.068073	099964a4	0	0	0.0000	CRASH	gen=18 glyphs=4
2026-03-14T07:36:44.068339	099964a4	0	0	0.0000	CRASH	gen=19 glyphs=4
2026-03-14T07:36:44.068534	099964a4	0	0	0.0000	CRASH	gen=19 glyphs=4
2026-03-14T07:36:44.068735	099964a4	0	0	0.0000	CRASH	gen=19 glyphs=4
2026-03-14T07:36:44.068931	dcb1fb50	0	0	0.0000	CRASH	gen=19 glyphs=4
2026-03-14T07:36:44.069126	dcb1fb50	0	0	0.0000	CRASH	gen=19 glyphs=4
2026-03-14T07:36:44.069321	dcb1fb50	0	0	0.0000	CRASH	gen=19 glyphs=4
2026-03-14T07:36:44.069513	099964a4	0	0	0.0000	CRASH	gen=19 glyphs=4
2026-03-14T07:36:44.069705	ff30496a	0	0	0.0000	CRASH	gen=19 glyphs=3
2026-03-14T07:36:44.069903	dcb1fb50	0	0	0.0000	CRASH	gen=19 glyphs=4
2026-03-14T07:36:44.070102	cf93b656	0	0	0.0000	CRASH	gen=19 glyphs=3
2026-03-14T07:36:44.070374	099964a4	0	0	0.0000	CRASH	gen=20 glyphs=4
2026-03-14T07:36:44.070571	099964a4	0	0	0.0000	CRASH	gen=20 glyphs=4
2026-03-14T07:36:44.070764	85478547	0	0	0.0000	CRASH	gen=20 glyphs=4
2026-03-14T07:36:44.070968	38e383f4	0	0	0.0000	CRASH	gen=20 glyphs=3
2026-03-14T07:36:44.071164	8da1f8d8	0	0	0.0000	CRASH	gen=20 glyphs=4
2026-03-14T07:36:44.071360	099964a4	0	0	0.0000	CRASH	gen=20 glyphs=4
2026-03-14T07:36:44.071556	099964a4	0	0	0.0000	CRASH	gen=20 glyphs=4
2026-03-14T07:36:44.071749	099964a4	0	0	0.0000	CRASH	gen=20 glyphs=4
2026-03-14T07:36:44.071940	099964a4	0	0	0.0000	CRASH	gen=20 glyphs=4
2026-03-14T07:36:44.072148	7ede4765	0	0	0.0000	CRASH	gen=20 glyphs=2
2026-03-14T07:36:44.072427	099964a4	0	0	0.0000	CRASH	gen=21 glyphs=4
2026-03-14T07:36:44.072625	099964a4	0	0	0.0000	CRASH	gen=21 glyphs=4
2026-03-14T07:36:44.072825	74726afe	0	0	0.0000	CRASH	gen=21 glyphs=1
2026-03-14T07:36:44.073016	f4483fb8	0	0	0.0000	CRASH	gen=21 glyphs=4
2026-03-14T07:36:44.073217	099964a4	0	0	0.0000	CRASH	gen=21 glyphs=4
2026-03-14T07:36:44.073409	099964a4	0	0	0.0000	CRASH	gen=21 glyphs=4
2026-03-14T07:36:44.073609	099964a4	0	0	0.0000	CRASH	gen=21 glyphs=4
2026-03-14T07:36:44.073801	e0bb97b3	0	0	0.0000	CRASH	gen=21 glyphs=4
2026-03-14T07:36:44.073996	80cef82b	0	0	0.0000	CRASH	gen=21 glyphs=4
2026-03-14T07:36:44.074193	099964a4	0	0	0.0000	CRASH	gen=21 glyphs=4
2026-03-14T07:36:44.074478	099964a4	0	0	0.0000	CRASH	gen=22 glyphs=4
2026-03-14T07:36:44.074676	099964a4	0	0	0.0000	CRASH	gen=22 glyphs=4
2026-03-14T07:36:44.074869	099964a4	0	0	0.0000	CRASH	gen=22 glyphs=4
2026-03-14T07:36:44.075062	11bd5f4c	0	0	0.0000	CRASH	gen=22 glyphs=4
2026-03-14T07:36:44.075260	099964a4	0	0	0.0000	CRASH	gen=22 glyphs=4
2026-03-14T07:36:44.075453	099964a4	0	0	0.0000	CRASH	gen=22 glyphs=4
2026-03-14T07:36:44.075648	099964a4	0	0	0.0000	CRASH	gen=22 glyphs=4
2026-03-14T07:36:44.075838	13b92ad4	0	0	0.0000	CRASH	gen=22 glyphs=3
2026-03-14T07:36:44.076032	63c9681e	0	0	0.0000	CRASH	gen=22 glyphs=3
2026-03-14T07:36:44.076227	3a734398	0	0	0.0000	CRASH	gen=22 glyphs=4
2026-03-14T07:36:44.076497	099964a4	0	0	0.0000	CRASH	gen=23 glyphs=4
2026-03-14T07:36:44.076693	099964a4	0	0	0.0000	CRASH	gen=23 glyphs=4
2026-03-14T07:36:44.076888	099964a4	0	0	0.0000	CRASH	gen=23 glyphs=4
2026-03-14T07:36:44.077078	099964a4	0	0	0.0000	CRASH	gen=23 glyphs=4
2026-03-14T07:36:44.077270	3a734398	0	0	0.0000	CRASH	gen=23 glyphs=4
2026-03-14T07:36:44.077465	3ca14993	0	0	0.0000	CRASH	gen=23 glyphs=4
2026-03-14T07:36:44.077662	4a54e1af	0	0	0.0000	CRASH	gen=23 glyphs=4
2026-03-14T07:36:44.077856	099964a4	0	0	0.0000	CRASH	gen=23 glyphs=4
2026-03-14T07:36:44.078059	ee4d39b4	0	0	0.0000	CRASH	gen=23 glyphs=4
2026-03-14T07:36:44.078255	099964a4	0	0	0.0000	CRASH	gen=23 glyphs=4
2026-03-14T07:36:44.078533	099964a4	0	0	0.0000	CRASH	gen=24 glyphs=4
2026-03-14T07:36:44.078736	099964a4	0	0	0.0000	CRASH	gen=24 glyphs=4
2026-03-14T07:36:44.078958	099964a4	0	0	0.0000	CRASH	gen=24 glyphs=4
2026-03-14T07:36:44.079152	099964a4	0	0	0.0000	CRASH	gen=24 glyphs=4
2026-03-14T07:36:44.079348	ff30496a	0	0	0.0000	CRASH	gen=24 glyphs=3
2026-03-14T07:36:44.079548	3ca14993	0	0	0.0000	CRASH	gen=24 glyphs=4
2026-03-14T07:36:44.079744	099964a4	0	0	0.0000	CRASH	gen=24 glyphs=4
2026-03-14T07:36:44.079938	1c80aa76	0	0	0.0000	CRASH	gen=24 glyphs=4
2026-03-14T07:36:44.080135	099964a4	0	0	0.0000	CRASH	gen=24 glyphs=4
2026-03-14T07:36:44.080330	099964a4	0	0	0.0000	CRASH	gen=24 glyphs=4
2026-03-14T07:36:44.080616	099964a4	0	0	0.0000	CRASH	gen=25 glyphs=4
2026-03-14T07:36:44.080812	099964a4	0	0	0.0000	CRASH	gen=25 glyphs=4
2026-03-14T07:36:44.081005	dcb1fb50	0	0	0.0000	CRASH	gen=25 glyphs=4
2026-03-14T07:36:44.081201	e7233177	0	0	0.0000	CRASH	gen=25 glyphs=3
2026-03-14T07:36:44.081396	8da1f8d8	0	0	0.0000	CRASH	gen=25 glyphs=4
2026-03-14T07:36:44.081597	099964a4	0	0	0.0000	CRASH	gen=25 glyphs=4
2026-03-14T07:36:44.081791	099964a4	0	0	0.0000	CRASH	gen=25 glyphs=4
2026-03-14T07:36:44.081983	099964a4	0	0	0.0000	CRASH	gen=25 glyphs=4
2026-03-14T07:36:44.082178	80cef82b	0	0	0.0000	CRASH	gen=25 glyphs=4
2026-03-14T07:36:44.082376	262d34f1	0	0	0.0000	CRASH	gen=25 glyphs=4
2026-03-14T07:36:44.082667	099964a4	0	0	0.0000	CRASH	gen=26 glyphs=4
2026-03-14T07:36:44.082866	099964a4	0	0	0.0000	CRASH	gen=26 glyphs=4
2026-03-14T07:36:44.083061	099964a4	0	0	0.0000	CRASH	gen=26 glyphs=4
2026-03-14T07:36:44.083266	3ca14993	0	0	0.0000	CRASH	gen=26 glyphs=4
2026-03-14T07:36:44.083461	709c99e7	0	0	0.0000	CRASH	gen=26 glyphs=4
2026-03-14T07:36:44.083659	274fe79e	0	0	0.0000	CRASH	gen=26 glyphs=3
2026-03-14T07:36:44.083857	099964a4	0	0	0.0000	CRASH	gen=26 glyphs=4
2026-03-14T07:36:44.084056	7ede4765	0	0	0.0000	CRASH	gen=26 glyphs=2
2026-03-14T07:36:44.084253	099964a4	0	0	0.0000	CRASH	gen=26 glyphs=4
2026-03-14T07:36:44.084452	3ca14993	0	0	0.0000	CRASH	gen=26 glyphs=4
2026-03-14T07:36:44.084738	099964a4	0	0	0.0000	CRASH	gen=27 glyphs=4
2026-03-14T07:36:44.084936	099964a4	0	0	0.0000	CRASH	gen=27 glyphs=4
2026-03-14T07:36:44.085128	099964a4	0	0	0.0000	CRASH	gen=27 glyphs=4
2026-03-14T07:36:44.085319	e49d658f	0	0	0.0000	CRASH	gen=27 glyphs=3
2026-03-14T07:36:44.085518	099964a4	0	0	0.0000	CRASH	gen=27 glyphs=4
2026-03-14T07:36:44.085711	a9d060d9	0	0	0.0000	CRASH	gen=27 glyphs=4
2026-03-14T07:36:44.085912	82cfbef8	0	0	0.0000	CRASH	gen=27 glyphs=4
2026-03-14T07:36:44.086107	099964a4	0	0	0.0000	CRASH	gen=27 glyphs=4
2026-03-14T07:36:44.086301	099964a4	0	0	0.0000	CRASH	gen=27 glyphs=4
2026-03-14T07:36:44.086490	099964a4	0	0	0.0000	CRASH	gen=27 glyphs=4
2026-03-14T07:36:44.086770	099964a4	0	0	0.0000	CRASH	gen=28 glyphs=4
2026-03-14T07:36:44.086970	099964a4	0	0	0.0000	CRASH	gen=28 glyphs=4
2026-03-14T07:36:44.087164	099964a4	0	0	0.0000	CRASH	gen=28 glyphs=4
2026-03-14T07:36:44.087355	9323b45e	0	0	0.0000	CRASH	gen=28 glyphs=4
2026-03-14T07:36:44.087550	ff30496a	0	0	0.0000	CRASH	gen=28 glyphs=3
2026-03-14T07:36:44.087742	7d184288	0	0	0.0000	CRASH	gen=28 glyphs=4
2026-03-14T07:36:44.087934	099964a4	0	0	0.0000	CRASH	gen=28 glyphs=4
2026-03-14T07:36:44.088130	099964a4	0	0	0.0000	CRASH	gen=28 glyphs=4
2026-03-14T07:36:44.088320	099964a4	0	0	0.0000	CRASH	gen=28 glyphs=4
2026-03-14T07:36:44.088511	7ede4765	0	0	0.0000	CRASH	gen=28 glyphs=2
2026-03-14T07:36:44.088774	099964a4	0	0	0.0000	CRASH	gen=29 glyphs=4
2026-03-14T07:36:44.088969	099964a4	0	0	0.0000	CRASH	gen=29 glyphs=4
2026-03-14T07:36:44.089170	099964a4	0	0	0.0000	CRASH	gen=29 glyphs=4
2026-03-14T07:36:44.089363	9692d306	0	0	0.0000	CRASH	gen=29 glyphs=4
2026-03-14T07:36:44.089561	c865fcfa	0	0	0.0000	CRASH	gen=29 glyphs=4
2026-03-14T07:36:44.089753	cf93b656	0	0	0.0000	CRASH	gen=29 glyphs=3
2026-03-14T07:36:44.089946	dcb1fb50	0	0	0.0000	CRASH	gen=29 glyphs=4
2026-03-14T07:36:44.090144	099964a4	0	0	0.0000	CRASH	gen=29 glyphs=4
2026-03-14T07:36:44.090339	099964a4	0	0	0.0000	CRASH	gen=29 glyphs=4
2026-03-14T07:36:44.090535	099964a4	0	0	0.0000	CRASH	gen=29 glyphs=4
2026-03-14T07:36:44.090817	099964a4	0	0	0.0000	CRASH	gen=30 glyphs=4
2026-03-14T07:36:44.091013	099964a4	0	0	0.0000	CRASH	gen=30 glyphs=4
2026-03-14T07:36:44.091212	6df1c752	0	0	0.0000	CRASH	gen=30 glyphs=4
2026-03-14T07:36:44.091405	099964a4	0	0	0.0000	CRASH	gen=30 glyphs=4
2026-03-14T07:36:44.091599	099964a4	0	0	0.0000	CRASH	gen=30 glyphs=4
2026-03-14T07:36:44.091791	adf7ed5c	0	0	0.0000	CRASH	gen=30 glyphs=3
2026-03-14T07:36:44.091985	099964a4	0	0	0.0000	CRASH	gen=30 glyphs=4
2026-03-14T07:36:44.092176	099964a4	0	0	0.0000	CRASH	gen=30 glyphs=4
2026-03-14T07:36:44.092373	099964a4	0	0	0.0000	CRASH	gen=30 glyphs=4
2026-03-14T07:36:44.092566	099964a4	0	0	0.0000	CRASH	gen=30 glyphs=4
2026-03-14T07:36:44.092852	099964a4	0	0	0.0000	CRASH	gen=31 glyphs=4
2026-03-14T07:36:44.093046	099964a4	0	0	0.0000	CRASH	gen=31 glyphs=4
2026-03-14T07:36:44.093240	0b0a97d8	0	0	0.0000	CRASH	gen=31 glyphs=5
2026-03-14T07:36:44.093438	099964a4	0	0	0.0000	CRASH	gen=31 glyphs=4
2026-03-14T07:36:44.093631	38d4f9e5	0	0	0.0000	CRASH	gen=31 glyphs=4
2026-03-14T07:36:44.093824	099964a4	0	0	0.0000	CRASH	gen=31 glyphs=4
2026-03-14T07:36:44.094013	7ede4765	0	0	0.0000	CRASH	gen=31 glyphs=2
2026-03-14T07:36:44.094202	099964a4	0	0	0.0000	CRASH	gen=31 glyphs=4
2026-03-14T07:36:44.094399	099964a4	0	0	0.0000	CRASH	gen=31 glyphs=4
2026-03-14T07:36:44.094592	14ffa6af	0	0	0.0000	CRASH	gen=31 glyphs=4
2026-03-14T07:36:44.094878	099964a4	0	0	0.0000	CRASH	gen=32 glyphs=4
2026-03-14T07:36:44.095074	099964a4	0	0	0.0000	CRASH	gen=32 glyphs=4
2026-03-14T07:36:44.095269	099964a4	0	0	0.0000	CRASH	gen=32 glyphs=4
2026-03-14T07:36:44.095463	099964a4	0	0	0.0000	CRASH	gen=32 glyphs=4
2026-03-14T07:36:44.095658	cf20ee35	0	0	0.0000	CRASH	gen=32 glyphs=3
2026-03-14T07:36:44.095854	fbf18705	0	0	0.0000	CRASH	gen=32 glyphs=3
2026-03-14T07:36:44.096049	099964a4	0	0	0.0000	CRASH	gen=32 glyphs=4
2026-03-14T07:36:44.096245	dcb1fb50	0	0	0.0000	CRASH	gen=32 glyphs=4
2026-03-14T07:36:44.096447	84b1d728	0	0	0.0000	CRASH	gen=32 glyphs=4
2026-03-14T07:36:44.096647	099964a4	0	0	0.0000	CRASH	gen=32 glyphs=4
2026-03-14T07:36:44.096933	099964a4	0	0	0.0000	CRASH	gen=33 glyphs=4
2026-03-14T07:36:44.097127	099964a4	0	0	0.0000	CRASH	gen=33 glyphs=4
2026-03-14T07:36:44.097322	560fe3e9	0	0	0.0000	CRASH	gen=33 glyphs=4
2026-03-14T07:36:44.097514	2c6d54ca	0	0	0.0000	CRASH	gen=33 glyphs=4
2026-03-14T07:36:44.097717	9d85c5a3	0	0	0.0000	CRASH	gen=33 glyphs=4
2026-03-14T07:36:44.097910	ff30496a	0	0	0.0000	CRASH	gen=33 glyphs=3
2026-03-14T07:36:44.098103	3ca14993	0	0	0.0000	CRASH	gen=33 glyphs=4
2026-03-14T07:36:44.098298	14b3ee9b	0	0	0.0000	CRASH	gen=33 glyphs=4
2026-03-14T07:36:44.098494	9e611720	0	0	0.0000	CRASH	gen=33 glyphs=3
2026-03-14T07:36:44.098693	099964a4	0	0	0.0000	CRASH	gen=33 glyphs=4
2026-03-14T07:36:44.098964	099964a4	0	0	0.0000	CRASH	gen=34 glyphs=4
2026-03-14T07:36:44.099159	099964a4	0	0	0.0000	CRASH	gen=34 glyphs=4
2026-03-14T07:36:44.099354	099964a4	0	0	0.0000	CRASH	gen=34 glyphs=4
2026-03-14T07:36:44.099565	558de7f2	0	0	0.0000	CRASH	gen=34 glyphs=3
2026-03-14T07:36:44.099762	099964a4	0	0	0.0000	CRASH	gen=34 glyphs=4
2026-03-14T07:36:44.099955	099964a4	0	0	0.0000	CRASH	gen=34 glyphs=4
2026-03-14T07:36:44.100146	099964a4	0	0	0.0000	CRASH	gen=34 glyphs=4
2026-03-14T07:36:44.100337	dd2b4c74	0	0	0.0000	CRASH	gen=34 glyphs=3
2026-03-14T07:36:44.100532	8ecf2b69	0	0	0.0000	CRASH	gen=34 glyphs=4
2026-03-14T07:36:44.100724	099964a4	0	0	0.0000	CRASH	gen=34 glyphs=4
2026-03-14T07:36:44.100999	099964a4	0	0	0.0000	CRASH	gen=35 glyphs=4
2026-03-14T07:36:44.101194	099964a4	0	0	0.0000	CRASH	gen=35 glyphs=4
2026-03-14T07:36:44.101388	099964a4	0	0	0.0000	CRASH	gen=35 glyphs=4
2026-03-14T07:36:44.101582	87f983b5	0	0	0.0000	CRASH	gen=35 glyphs=4
2026-03-14T07:36:44.101778	099964a4	0	0	0.0000	CRASH	gen=35 glyphs=4
2026-03-14T07:36:44.101975	80cef82b	0	0	0.0000	CRASH	gen=35 glyphs=4
2026-03-14T07:36:44.102170	099964a4	0	0	0.0000	CRASH	gen=35 glyphs=4
2026-03-14T07:36:44.102361	6fd99370	0	0	0.0000	CRASH	gen=35 glyphs=3
2026-03-14T07:36:44.102559	dcb1fb50	0	0	0.0000	CRASH	gen=35 glyphs=4
2026-03-14T07:36:44.102752	099964a4	0	0	0.0000	CRASH	gen=35 glyphs=4
2026-03-14T07:36:44.103035	099964a4	0	0	0.0000	CRASH	gen=36 glyphs=4
2026-03-14T07:36:44.103229	099964a4	0	0	0.0000	CRASH	gen=36 glyphs=4
2026-03-14T07:36:44.103418	099964a4	0	0	0.0000	CRASH	gen=36 glyphs=4
2026-03-14T07:36:44.103609	2a60a99b	0	0	0.0000	CRASH	gen=36 glyphs=3
2026-03-14T07:36:44.103801	8da1f8d8	0	0	0.0000	CRASH	gen=36 glyphs=4
2026-03-14T07:36:44.103993	3ca14993	0	0	0.0000	CRASH	gen=36 glyphs=4
2026-03-14T07:36:44.104186	a38fd323	0	0	0.0000	CRASH	gen=36 glyphs=4
2026-03-14T07:36:44.104378	dcb1fb50	0	0	0.0000	CRASH	gen=36 glyphs=4
2026-03-14T07:36:44.104570	2778b8e4	0	0	0.0000	CRASH	gen=36 glyphs=4
2026-03-14T07:36:44.104761	2759c393	0	0	0.0000	CRASH	gen=36 glyphs=4
2026-03-14T07:36:44.105044	099964a4	0	0	0.0000	CRASH	gen=37 glyphs=4
2026-03-14T07:36:44.105240	099964a4	0	0	0.0000	CRASH	gen=37 glyphs=4
2026-03-14T07:36:44.105432	b607471c	0	0	0.0000	CRASH	gen=37 glyphs=4
2026-03-14T07:36:44.105627	7d94dd05	0	0	0.0000	CRASH	gen=37 glyphs=4
2026-03-14T07:36:44.105821	dcb1fb50	0	0	0.0000	CRASH	gen=37 glyphs=4
2026-03-14T07:36:44.106012	208ce636	0	0	0.0000	CRASH	gen=37 glyphs=3
2026-03-14T07:36:44.106209	17e7a6a7	0	0	0.0000	CRASH	gen=37 glyphs=4
2026-03-14T07:36:44.106403	099964a4	0	0	0.0000	CRASH	gen=37 glyphs=4
2026-03-14T07:36:44.106598	099964a4	0	0	0.0000	CRASH	gen=37 glyphs=4
2026-03-14T07:36:44.106787	099964a4	0	0	0.0000	CRASH	gen=37 glyphs=4
2026-03-14T07:36:44.107055	099964a4	0	0	0.0000	CRASH	gen=38 glyphs=4
2026-03-14T07:36:44.107254	099964a4	0	0	0.0000	CRASH	gen=38 glyphs=4
2026-03-14T07:36:44.107444	f34e5376	0	0	0.0000	CRASH	gen=38 glyphs=3
2026-03-14T07:36:44.107638	ff30496a	0	0	0.0000	CRASH	gen=38 glyphs=3
2026-03-14T07:36:44.107828	80cef82b	0	0	0.0000	CRASH	gen=38 glyphs=4
2026-03-14T07:36:44.108021	099964a4	0	0	0.0000	CRASH	gen=38 glyphs=4
2026-03-14T07:36:44.108212	3ca14993	0	0	0.0000	CRASH	gen=38 glyphs=4
2026-03-14T07:36:44.108409	ddbe3958	0	0	0.0000	CRASH	gen=38 glyphs=3
2026-03-14T07:36:44.108604	099964a4	0	0	0.0000	CRASH	gen=38 glyphs=4
2026-03-14T07:36:44.108796	cf93b656	0	0	0.0000	CRASH	gen=38 glyphs=3
2026-03-14T07:36:44.109074	099964a4	0	0	0.0000	CRASH	gen=39 glyphs=4
2026-03-14T07:36:44.109267	099964a4	0	0	0.0000	CRASH	gen=39 glyphs=4
2026-03-14T07:36:44.109463	099964a4	0	0	0.0000	CRASH	gen=39 glyphs=4
2026-03-14T07:36:44.109657	3a734398	0	0	0.0000	CRASH	gen=39 glyphs=4
2026-03-14T07:36:44.109851	eec28358	0	0	0.0000	CRASH	gen=39 glyphs=3
2026-03-14T07:36:44.110043	099964a4	0	0	0.0000	CRASH	gen=39 glyphs=4
2026-03-14T07:36:44.110235	f086df4a	0	0	0.0000	CRASH	gen=39 glyphs=3
2026-03-14T07:36:44.110431	099964a4	0	0	0.0000	CRASH	gen=39 glyphs=4
2026-03-14T07:36:44.110623	099964a4	0	0	0.0000	CRASH	gen=39 glyphs=4
2026-03-14T07:36:44.110812	cf93b656	0	0	0.0000	CRASH	gen=39 glyphs=3
2026-03-14T07:36:44.111082	099964a4	0	0	0.0000	CRASH	gen=40 glyphs=4
2026-03-14T07:36:44.111277	099964a4	0	0	0.0000	CRASH	gen=40 glyphs=4
2026-03-14T07:36:44.111469	099964a4	0	0	0.0000	CRASH	gen=40 glyphs=4
2026-03-14T07:36:44.111665	d7564706	0	0	0.0000	CRASH	gen=40 glyphs=3
2026-03-14T07:36:44.111855	ad83b598	0	0	0.0000	CRASH	gen=40 glyphs=4
2026-03-14T07:36:44.112047	79443998	0	0	0.0000	CRASH	gen=40 glyphs=4
2026-03-14T07:36:44.112239	7ede4765	0	0	0.0000	CRASH	gen=40 glyphs=2
2026-03-14T07:36:44.112429	4129c3d2	0	0	0.0000	CRASH	gen=40 glyphs=4
2026-03-14T07:36:44.112627	c237b27b	0	0	0.0000	CRASH	gen=40 glyphs=2
2026-03-14T07:36:44.112820	8da1f8d8	0	0	0.0000	CRASH	gen=40 glyphs=4
2026-03-14T07:36:44.113087	099964a4	0	0	0.0000	CRASH	gen=41 glyphs=4
2026-03-14T07:36:44.113280	099964a4	0	0	0.0000	CRASH	gen=41 glyphs=4
2026-03-14T07:36:44.113472	90b1a13c	0	0	0.0000	CRASH	gen=41 glyphs=3
2026-03-14T07:36:44.113670	3a734398	0	0	0.0000	CRASH	gen=41 glyphs=4
2026-03-14T07:36:44.113868	099964a4	0	0	0.0000	CRASH	gen=41 glyphs=4
2026-03-14T07:36:44.114075	ff30496a	0	0	0.0000	CRASH	gen=41 glyphs=3
2026-03-14T07:36:44.114270	099964a4	0	0	0.0000	CRASH	gen=41 glyphs=4
2026-03-14T07:36:44.114460	7ede4765	0	0	0.0000	CRASH	gen=41 glyphs=2
2026-03-14T07:36:44.114659	652d8869	0	0	0.0000	CRASH	gen=41 glyphs=4
2026-03-14T07:36:44.114856	5d5a0fad	0	0	0.0000	CRASH	gen=41 glyphs=3
2026-03-14T07:36:44.115137	099964a4	0	0	0.0000	CRASH	gen=42 glyphs=4
2026-03-14T07:36:44.115336	099964a4	0	0	0.0000	CRASH	gen=42 glyphs=4
2026-03-14T07:36:44.115534	7ede4765	0	0	0.0000	CRASH	gen=42 glyphs=2
2026-03-14T07:36:44.115729	7ede4765	0	0	0.0000	CRASH	gen=42 glyphs=2
2026-03-14T07:36:44.115923	e5a71d30	0	0	0.0000	CRASH	gen=42 glyphs=3
2026-03-14T07:36:44.116115	099964a4	0	0	0.0000	CRASH	gen=42 glyphs=4
2026-03-14T07:36:44.116320	f74fd467	0	0	0.0000	CRASH	gen=42 glyphs=4
2026-03-14T07:36:44.116513	e0db88d6	0	0	0.0000	CRASH	gen=42 glyphs=4
2026-03-14T07:36:44.116714	099964a4	0	0	0.0000	CRASH	gen=42 glyphs=4
2026-03-14T07:36:44.116913	3a734398	0	0	0.0000	CRASH	gen=42 glyphs=4
2026-03-14T07:36:44.117175	099964a4	0	0	0.0000	CRASH	gen=43 glyphs=4
2026-03-14T07:36:44.117369	099964a4	0	0	0.0000	CRASH	gen=43 glyphs=4
2026-03-14T07:36:44.117566	099964a4	0	0	0.0000	CRASH	gen=43 glyphs=4
2026-03-14T07:36:44.117758	099964a4	0	0	0.0000	CRASH	gen=43 glyphs=4
2026-03-14T07:36:44.117956	7ede4765	0	0	0.0000	CRASH	gen=43 glyphs=2
2026-03-14T07:36:44.118147	099964a4	0	0	0.0000	CRASH	gen=43 glyphs=4
