timestamp	program_hash	spirv_size	word_count	fitness	status	description
2026-03-14T07:36:45.088352	099964a4	0	0	0.0000	CRASH	gen=513 glyphs=4
2026-03-14T07:36:45.088544	3a734398	0	0	0.0000	CRASH	gen=513 glyphs=4
2026-03-14T07:36:45.088814	099964a4	0	0	0.0000	CRASH	gen=514 glyphs=4
2026-03-14T07:36:45.089011	099964a4	0	0	0.0000	CRASH	gen=514 glyphs=4
2026-03-14T07:36:45.089205	ff30496a	0	0	0.0000	CRASH	gen=514 glyphs=3
2026-03-14T07:36:45.089397	0a98fba0	0	0	0.0000	CRASH	gen=514 glyphs=4
2026-03-14T07:36:45.089593	c2ffcd95	0	0	0.0000	CRASH	gen=514 glyphs=4
2026-03-14T07:36:45.089793	80cef82b	0	0	0.0000	CRASH	gen=514 glyphs=4
2026-03-14T07:36:45.089987	099964a4	0	0	0.0000	CRASH	gen=514 glyphs=4
2026-03-14T07:36:45.090178	90874685	0	0	0.0000	CRASH	gen=514 glyphs=4
2026-03-14T07:36:45.090372	099964a4	0	0	0.0000	CRASH	gen=514 glyphs=4
2026-03-14T07:36:45.090566	d7ee5302	0	0	0.0000	CRASH	gen=514 glyphs=4
2026-03-14T07:36:45.090834	099964a4	0	0	0.0000	CRASH	gen=515 glyphs=4
2026-03-14T07:36:45.091028	099964a4	0	0	0.0000	CRASH	gen=515 glyphs=4
2026-03-14T07:36:45.091218	099964a4	0	0	0.0000	CRASH	gen=515 glyphs=4
2026-03-14T07:36:45.091406	3ca14993	0	0	0.0000	CRASH	gen=515 glyphs=4
2026-03-14T07:36:45.091600	afff9d6d	0	0	0.0000	CRASH	gen=515 glyphs=4
2026-03-14T07:36:45.091793	099964a4	0	0	0.0000	CRASH	gen=515 glyphs=4
2026-03-14T07:36:45.091985	099964a4	0	0	0.0000	CRASH	gen=515 glyphs=4
2026-03-14T07:36:45.092179	099964a4	0	0	0.0000	CRASH	gen=515 glyphs=4
2026-03-14T07:36:45.092369	80cef82b	0	0	0.0000	CRASH	gen=515 glyphs=4
2026-03-14T07:36:45.092561	099964a4	0	0	0.0000	CRASH	gen=515 glyphs=4
2026-03-14T07:36:45.092825	099964a4	0	0	0.0000	CRASH	gen=516 glyphs=4
2026-03-14T07:36:45.093021	099964a4	0	0	0.0000	CRASH	gen=516 glyphs=4
2026-03-14T07:36:45.093215	099964a4	0	0	0.0000	CRASH	gen=516 glyphs=4
2026-03-14T07:36:45.093406	e81b01f3	0	0	0.0000	CRASH	gen=516 glyphs=3
2026-03-14T07:36:45.093603	099964a4	0	0	0.0000	CRASH	gen=516 glyphs=4
2026-03-14T07:36:45.093795	dcb1fb50	0	0	0.0000	CRASH	gen=516 glyphs=4
2026-03-14T07:36:45.093993	177471f7	0	0	0.0000	CRASH	gen=516 glyphs=4
2026-03-14T07:36:45.094188	099964a4	0	0	0.0000	CRASH	gen=516 glyphs=4
2026-03-14T07:36:45.094381	96ff7d17	0	0	0.0000	CRASH	gen=516 glyphs=4
2026-03-14T07:36:45.094578	099964a4	0	0	0.0000	CRASH	gen=516 glyphs=4
2026-03-14T07:36:45.094851	099964a4	0	0	0.0000	CRASH	gen=517 glyphs=4
2026-03-14T07:36:45.095047	099964a4	0	0	0.0000	CRASH	gen=517 glyphs=4
2026-03-14T07:36:45.095246	475752d8	0	0	0.0000	CRASH	gen=517 glyphs=4
2026-03-14T07:36:45.095447	a91f2f8c	0	0	0.0000	CRASH	gen=517 glyphs=4
2026-03-14T07:36:45.095656	099964a4	0	0	0.0000	CRASH	gen=517 glyphs=4
2026-03-14T07:36:45.095859	a8f26012	0	0	0.0000	CRASH	gen=517 glyphs=4
2026-03-14T07:36:45.096054	099964a4	0	0	0.0000	CRASH	gen=517 glyphs=4
2026-03-14T07:36:45.096247	099964a4	0	0	0.0000	CRASH	gen=517 glyphs=4
2026-03-14T07:36:45.096440	099964a4	0	0	0.0000	CRASH	gen=517 glyphs=4
2026-03-14T07:36:45.096652	099964a4	0	0	0.0000	CRASH	gen=517 glyphs=4
2026-03-14T07:36:45.096955	099964a4	0	0	0.0000	CRASH	gen=518 glyphs=4
2026-03-14T07:36:45.097155	099964a4	0	0	0.0000	CRASH	gen=518 glyphs=4
2026-03-14T07:36:45.097348	099964a4	0	0	0.0000	CRASH	gen=518 glyphs=4
2026-03-14T07:36:45.097548	6571be38	0	0	0.0000	CRASH	gen=518 glyphs=3
2026-03-14T07:36:45.097763	3a734398	0	0	0.0000	CRASH	gen=518 glyphs=4
2026-03-14T07:36:45.097968	8beaf924	0	0	0.0000	CRASH	gen=518 glyphs=4
2026-03-14T07:36:45.098163	099964a4	0	0	0.0000	CRASH	gen=518 glyphs=4
2026-03-14T07:36:45.098378	099964a4	0	0	0.0000	CRASH	gen=518 glyphs=4
2026-03-14T07:36:45.098604	8da1f8d8	0	0	0.0000	CRASH	gen=518 glyphs=4
2026-03-14T07:36:45.098806	099964a4	0	0	0.0000	CRASH	gen=518 glyphs=4
2026-03-14T07:36:45.099095	099964a4	0	0	0.0000	CRASH	gen=519 glyphs=4
2026-03-14T07:36:45.099294	099964a4	0	0	0.0000	CRASH	gen=519 glyphs=4
2026-03-14T07:36:45.099506	099964a4	0	0	0.0000	CRASH	gen=519 glyphs=4
2026-03-14T07:36:45.099722	e85f7963	0	0	0.0000	CRASH	gen=519 glyphs=4
2026-03-14T07:36:45.099921	80cef82b	0	0	0.0000	CRASH	gen=519 glyphs=4
2026-03-14T07:36:45.100116	099964a4	0	0	0.0000	CRASH	gen=519 glyphs=4
2026-03-14T07:36:45.100313	cf93b656	0	0	0.0000	CRASH	gen=519 glyphs=3
2026-03-14T07:36:45.100506	d22ba528	0	0	0.0000	CRASH	gen=519 glyphs=4
2026-03-14T07:36:45.100703	3a734398	0	0	0.0000	CRASH	gen=519 glyphs=4
2026-03-14T07:36:45.100895	099964a4	0	0	0.0000	CRASH	gen=519 glyphs=4
2026-03-14T07:36:45.101178	099964a4	0	0	0.0000	CRASH	gen=520 glyphs=4
2026-03-14T07:36:45.101378	099964a4	0	0	0.0000	CRASH	gen=520 glyphs=4
2026-03-14T07:36:45.101574	3a734398	0	0	0.0000	CRASH	gen=520 glyphs=4
2026-03-14T07:36:45.101768	099964a4	0	0	0.0000	CRASH	gen=520 glyphs=4
2026-03-14T07:36:45.101960	099964a4	0	0	0.0000	CRASH	gen=520 glyphs=4
2026-03-14T07:36:45.102153	3a3a434d	0	0	0.0000	CRASH	gen=520 glyphs=4
2026-03-14T07:36:45.102346	9842021b	0	0	0.0000	CRASH	gen=520 glyphs=3
2026-03-14T07:36:45.102547	08d64b73	0	0	0.0000	CRASH	gen=520 glyphs=4
2026-03-14T07:36:45.102741	099964a4	0	0	0.0000	CRASH	gen=520 glyphs=4
2026-03-14T07:36:45.102934	099964a4	0	0	0.0000	CRASH	gen=520 glyphs=4
2026-03-14T07:36:45.103212	099964a4	0	0	0.0000	CRASH	gen=521 glyphs=4
2026-03-14T07:36:45.103407	099964a4	0	0	0.0000	CRASH	gen=521 glyphs=4
2026-03-14T07:36:45.103610	8da1f8d8	0	0	0.0000	CRASH	gen=521 glyphs=4
2026-03-14T07:36:45.103804	099964a4	0	0	0.0000	CRASH	gen=521 glyphs=4
2026-03-14T07:36:45.103998	099964a4	0	0	0.0000	CRASH	gen=521 glyphs=4
2026-03-14T07:36:45.104191	ff30496a	0	0	0.0000	CRASH	gen=521 glyphs=3
2026-03-14T07:36:45.104384	099964a4	0	0	0.0000	CRASH	gen=521 glyphs=4
2026-03-14T07:36:45.104584	099964a4	0	0	0.0000	CRASH	gen=521 glyphs=4
2026-03-14T07:36:45.104777	ff30496a	0	0	0.0000	CRASH	gen=521 glyphs=3
2026-03-14T07:36:45.104968	099964a4	0	0	0.0000	CRASH	gen=521 glyphs=4
2026-03-14T07:36:45.105248	099964a4	0	0	0.0000	CRASH	gen=522 glyphs=4
2026-03-14T07:36:45.105443	099964a4	0	0	0.0000	CRASH	gen=522 glyphs=4
2026-03-14T07:36:45.105643	0c7e9a70	0	0	0.0000	CRASH	gen=522 glyphs=4
2026-03-14T07:36:45.105842	099964a4	0	0	0.0000	CRASH	gen=522 glyphs=4
2026-03-14T07:36:45.106037	06278f5a	0	0	0.0000	CRASH	gen=522 glyphs=5
2026-03-14T07:36:45.106234	099964a4	0	0	0.0000	CRASH	gen=522 glyphs=4
2026-03-14T07:36:45.106425	099964a4	0	0	0.0000	CRASH	gen=522 glyphs=4
2026-03-14T07:36:45.106623	80cef82b	0	0	0.0000	CRASH	gen=522 glyphs=4
2026-03-14T07:36:45.106820	ba4f5f5b	0	0	0.0000	CRASH	gen=522 glyphs=3
2026-03-14T07:36:45.107010	3ca14993	0	0	0.0000	CRASH	gen=522 glyphs=4
2026-03-14T07:36:45.107292	099964a4	0	0	0.0000	CRASH	gen=523 glyphs=4
2026-03-14T07:36:45.107486	099964a4	0	0	0.0000	CRASH	gen=523 glyphs=4
2026-03-14T07:36:45.107690	099964a4	0	0	0.0000	CRASH	gen=523 glyphs=4
2026-03-14T07:36:45.107884	9a83d30c	0	0	0.0000	CRASH	gen=523 glyphs=4
2026-03-14T07:36:45.108077	dcb1fb50	0	0	0.0000	CRASH	gen=523 glyphs=4
2026-03-14T07:36:45.108270	4dbf9258	0	0	0.0000	CRASH	gen=523 glyphs=4
2026-03-14T07:36:45.108463	f5b18e7f	0	0	0.0000	CRASH	gen=523 glyphs=5
2026-03-14T07:36:45.108662	f590156c	0	0	0.0000	CRASH	gen=523 glyphs=3
2026-03-14T07:36:45.108865	099964a4	0	0	0.0000	CRASH	gen=523 glyphs=4
2026-03-14T07:36:45.109058	099964a4	0	0	0.0000	CRASH	gen=523 glyphs=4
2026-03-14T07:36:45.109330	099964a4	0	0	0.0000	CRASH	gen=524 glyphs=4
2026-03-14T07:36:45.109528	099964a4	0	0	0.0000	CRASH	gen=524 glyphs=4
2026-03-14T07:36:45.109724	099964a4	0	0	0.0000	CRASH	gen=524 glyphs=4
2026-03-14T07:36:45.109932	099964a4	0	0	0.0000	CRASH	gen=524 glyphs=4
2026-03-14T07:36:45.110128	099964a4	0	0	0.0000	CRASH	gen=524 glyphs=4
2026-03-14T07:36:45.110321	099964a4	0	0	0.0000	CRASH	gen=524 glyphs=4
2026-03-14T07:36:45.110511	099964a4	0	0	0.0000	CRASH	gen=524 glyphs=4
2026-03-14T07:36:45.110708	099964a4	0	0	0.0000	CRASH	gen=524 glyphs=4
2026-03-14T07:36:45.110908	3722bd92	0	0	0.0000	CRASH	gen=524 glyphs=4
2026-03-14T07:36:45.111112	099964a4	0	0	0.0000	CRASH	gen=524 glyphs=4
2026-03-14T07:36:45.111392	099964a4	0	0	0.0000	CRASH	gen=525 glyphs=4
2026-03-14T07:36:45.111592	099964a4	0	0	0.0000	CRASH	gen=525 glyphs=4
2026-03-14T07:36:45.111785	5968fc57	0	0	0.0000	CRASH	gen=525 glyphs=3
2026-03-14T07:36:45.111981	099964a4	0	0	0.0000	CRASH	gen=525 glyphs=4
2026-03-14T07:36:45.112178	cf93b656	0	0	0.0000	CRASH	gen=525 glyphs=3
2026-03-14T07:36:45.112372	9817410e	0	0	0.0000	CRASH	gen=525 glyphs=2
2026-03-14T07:36:45.112566	0e0346ec	0	0	0.0000	CRASH	gen=525 glyphs=4
2026-03-14T07:36:45.112762	11922f0d	0	0	0.0000	CRASH	gen=525 glyphs=3
2026-03-14T07:36:45.112957	3a734398	0	0	0.0000	CRASH	gen=525 glyphs=4
2026-03-14T07:36:45.113162	099964a4	0	0	0.0000	CRASH	gen=525 glyphs=4
2026-03-14T07:36:45.113433	099964a4	0	0	0.0000	CRASH	gen=526 glyphs=4
2026-03-14T07:36:45.113633	099964a4	0	0	0.0000	CRASH	gen=526 glyphs=4
2026-03-14T07:36:45.113829	cf93b656	0	0	0.0000	CRASH	gen=526 glyphs=3
2026-03-14T07:36:45.114022	099964a4	0	0	0.0000	CRASH	gen=526 glyphs=4
2026-03-14T07:36:45.114222	371aca2b	0	0	0.0000	CRASH	gen=526 glyphs=4
2026-03-14T07:36:45.114417	099964a4	0	0	0.0000	CRASH	gen=526 glyphs=4
2026-03-14T07:36:45.114612	099964a4	0	0	0.0000	CRASH	gen=526 glyphs=4
2026-03-14T07:36:45.114805	099964a4	0	0	0.0000	CRASH	gen=526 glyphs=4
2026-03-14T07:36:45.115001	dcb1fb50	0	0	0.0000	CRASH	gen=526 glyphs=4
2026-03-14T07:36:45.115195	ff6b4eeb	0	0	0.0000	CRASH	gen=526 glyphs=4
2026-03-14T07:36:45.115488	099964a4	0	0	0.0000	CRASH	gen=527 glyphs=4
2026-03-14T07:36:45.115689	099964a4	0	0	0.0000	CRASH	gen=527 glyphs=4
2026-03-14T07:36:45.115883	3a352c49	0	0	0.0000	CRASH	gen=527 glyphs=4
2026-03-14T07:36:45.116076	099964a4	0	0	0.0000	CRASH	gen=527 glyphs=4
2026-03-14T07:36:45.116268	7de42297	0	0	0.0000	CRASH	gen=527 glyphs=2
2026-03-14T07:36:45.116467	099964a4	0	0	0.0000	CRASH	gen=527 glyphs=4
2026-03-14T07:36:45.116660	05a770f2	0	0	0.0000	CRASH	gen=527 glyphs=3
2026-03-14T07:36:45.116855	099964a4	0	0	0.0000	CRASH	gen=527 glyphs=4
2026-03-14T07:36:45.117050	dcb1fb50	0	0	0.0000	CRASH	gen=527 glyphs=4
2026-03-14T07:36:45.117247	8da1f8d8	0	0	0.0000	CRASH	gen=527 glyphs=4
2026-03-14T07:36:45.117540	099964a4	0	0	0.0000	CRASH	gen=528 glyphs=4
2026-03-14T07:36:45.117738	099964a4	0	0	0.0000	CRASH	gen=528 glyphs=4
2026-03-14T07:36:45.117934	099964a4	0	0	0.0000	CRASH	gen=528 glyphs=4
2026-03-14T07:36:45.118130	18768bba	0	0	0.0000	CRASH	gen=528 glyphs=5
2026-03-14T07:36:45.118329	ff30496a	0	0	0.0000	CRASH	gen=528 glyphs=3
2026-03-14T07:36:45.118527	8e669b9a	0	0	0.0000	CRASH	gen=528 glyphs=4
2026-03-14T07:36:45.118722	099964a4	0	0	0.0000	CRASH	gen=528 glyphs=4
2026-03-14T07:36:45.118916	8da1f8d8	0	0	0.0000	CRASH	gen=528 glyphs=4
2026-03-14T07:36:45.119115	099964a4	0	0	0.0000	CRASH	gen=528 glyphs=4
2026-03-14T07:36:45.119311	099964a4	0	0	0.0000	CRASH	gen=528 glyphs=4
2026-03-14T07:36:45.119593	099964a4	0	0	0.0000	CRASH	gen=529 glyphs=4
2026-03-14T07:36:45.119791	099964a4	0	0	0.0000	CRASH	gen=529 glyphs=4
2026-03-14T07:36:45.119988	099964a4	0	0	0.0000	CRASH	gen=529 glyphs=4
2026-03-14T07:36:45.120183	099964a4	0	0	0.0000	CRASH	gen=529 glyphs=4
2026-03-14T07:36:45.120378	099964a4	0	0	0.0000	CRASH	gen=529 glyphs=4
2026-03-14T07:36:45.120576	099964a4	0	0	0.0000	CRASH	gen=529 glyphs=4
2026-03-14T07:36:45.120779	099964a4	0	0	0.0000	CRASH	gen=529 glyphs=4
2026-03-14T07:36:45.120974	099964a4	0	0	0.0000	CRASH	gen=529 glyphs=4
2026-03-14T07:36:45.121167	48a5d358	0	0	0.0000	CRASH	gen=529 glyphs=4
2026-03-14T07:36:45.121361	099964a4	0	0	0.0000	CRASH	gen=529 glyphs=4
2026-03-14T07:36:45.121641	099964a4	0	0	0.0000	CRASH	gen=530 glyphs=4
2026-03-14T07:36:45.121841	099964a4	0	0	0.0000	CRASH	gen=530 glyphs=4
2026-03-14T07:36:45.122040	099964a4	0	0	0.0000	CRASH	gen=530 glyphs=4
2026-03-14T07:36:45.122232	099964a4	0	0	0.0000	CRASH	gen=530 glyphs=4
2026-03-14T07:36:45.122426	dd92266c	0	0	0.0000	CRASH	gen=530 glyphs=4
2026-03-14T07:36:45.122623	39e28cb2	0	0	0.0000	CRASH	gen=530 glyphs=4
2026-03-14T07:36:45.122819	099964a4	0	0	0.0000	CRASH	gen=530 glyphs=4
2026-03-14T07:36:45.123012	97fd15e9	0	0	0.0000	CRASH	gen=530 glyphs=4
2026-03-14T07:36:45.123205	099964a4	0	0	0.0000	CRASH	gen=530 glyphs=4
2026-03-14T07:36:45.123397	8da1f8d8	0	0	0.0000	CRASH	gen=530 glyphs=4
2026-03-14T07:36:45.123680	099964a4	0	0	0.0000	CRASH	gen=531 glyphs=4
2026-03-14T07:36:45.123876	099964a4	0	0	0.0000	CRASH	gen=531 glyphs=4
2026-03-14T07:36:45.124075	099964a4	0	0	0.0000	CRASH	gen=531 glyphs=4
2026-03-14T07:36:45.124269	099964a4	0	0	0.0000	CRASH	gen=531 glyphs=4
2026-03-14T07:36:45.124462	099964a4	0	0	0.0000	CRASH	gen=531 glyphs=4
2026-03-14T07:36:45.124658	54b92c52	0	0	0.0000	CRASH	gen=531 glyphs=3
2026-03-14T07:36:45.124851	dcb1fb50	0	0	0.0000	CRASH	gen=531 glyphs=4
2026-03-14T07:36:45.125049	099964a4	0	0	0.0000	CRASH	gen=531 glyphs=4
2026-03-14T07:36:45.125241	099964a4	0	0	0.0000	CRASH	gen=531 glyphs=4
2026-03-14T07:36:45.125436	099964a4	0	0	0.0000	CRASH	gen=531 glyphs=4
2026-03-14T07:36:45.125705	099964a4	0	0	0.0000	CRASH	gen=532 glyphs=4
2026-03-14T07:36:45.125897	099964a4	0	0	0.0000	CRASH	gen=532 glyphs=4
2026-03-14T07:36:45.126095	7ede4765	0	0	0.0000	CRASH	gen=532 glyphs=2
2026-03-14T07:36:45.126289	099964a4	0	0	0.0000	CRASH	gen=532 glyphs=4
2026-03-14T07:36:45.126480	dbe403de	0	0	0.0000	CRASH	gen=532 glyphs=2
2026-03-14T07:36:45.126674	7ede4765	0	0	0.0000	CRASH	gen=532 glyphs=2
2026-03-14T07:36:45.126868	099964a4	0	0	0.0000	CRASH	gen=532 glyphs=4
2026-03-14T07:36:45.127060	099964a4	0	0	0.0000	CRASH	gen=532 glyphs=4
2026-03-14T07:36:45.127256	5d748ac8	0	0	0.0000	CRASH	gen=532 glyphs=2
2026-03-14T07:36:45.127450	099964a4	0	0	0.0000	CRASH	gen=532 glyphs=4
2026-03-14T07:36:45.127717	099964a4	0	0	0.0000	CRASH	gen=533 glyphs=4
2026-03-14T07:36:45.127912	099964a4	0	0	0.0000	CRASH	gen=533 glyphs=4
2026-03-14T07:36:45.128104	d618e7d8	0	0	0.0000	CRASH	gen=533 glyphs=3
2026-03-14T07:36:45.128299	099964a4	0	0	0.0000	CRASH	gen=533 glyphs=4
2026-03-14T07:36:45.128487	099964a4	0	0	0.0000	CRASH	gen=533 glyphs=4
2026-03-14T07:36:45.128679	6062c38e	0	0	0.0000	CRASH	gen=533 glyphs=2
2026-03-14T07:36:45.128868	099964a4	0	0	0.0000	CRASH	gen=533 glyphs=4
2026-03-14T07:36:45.129057	7ede4765	0	0	0.0000	CRASH	gen=533 glyphs=2
2026-03-14T07:36:45.129251	099964a4	0	0	0.0000	CRASH	gen=533 glyphs=4
2026-03-14T07:36:45.129443	1b6e09b8	0	0	0.0000	CRASH	gen=533 glyphs=4
2026-03-14T07:36:45.129723	099964a4	0	0	0.0000	CRASH	gen=534 glyphs=4
2026-03-14T07:36:45.129917	099964a4	0	0	0.0000	CRASH	gen=534 glyphs=4
2026-03-14T07:36:45.130112	7ede4765	0	0	0.0000	CRASH	gen=534 glyphs=2
2026-03-14T07:36:45.130307	87aad101	0	0	0.0000	CRASH	gen=534 glyphs=4
2026-03-14T07:36:45.130503	099964a4	0	0	0.0000	CRASH	gen=534 glyphs=4
2026-03-14T07:36:45.130699	3ca14993	0	0	0.0000	CRASH	gen=534 glyphs=4
2026-03-14T07:36:45.130894	099964a4	0	0	0.0000	CRASH	gen=534 glyphs=4
2026-03-14T07:36:45.131087	099964a4	0	0	0.0000	CRASH	gen=534 glyphs=4
2026-03-14T07:36:45.131280	099964a4	0	0	0.0000	CRASH	gen=534 glyphs=4
2026-03-14T07:36:45.131475	92f4b66c	0	0	0.0000	CRASH	gen=534 glyphs=4
2026-03-14T07:36:45.131759	099964a4	0	0	0.0000	CRASH	gen=535 glyphs=4
2026-03-14T07:36:45.131954	099964a4	0	0	0.0000	CRASH	gen=535 glyphs=4
2026-03-14T07:36:45.132147	0c331283	0	0	0.0000	CRASH	gen=535 glyphs=4
2026-03-14T07:36:45.132340	099964a4	0	0	0.0000	CRASH	gen=535 glyphs=4
2026-03-14T07:36:45.132538	933700ee	0	0	0.0000	CRASH	gen=535 glyphs=5
2026-03-14T07:36:45.132732	099964a4	0	0	0.0000	CRASH	gen=535 glyphs=4
2026-03-14T07:36:45.132924	80cef82b	0	0	0.0000	CRASH	gen=535 glyphs=4
2026-03-14T07:36:45.133118	a5616a07	0	0	0.0000	CRASH	gen=535 glyphs=3
2026-03-14T07:36:45.133312	ca03ec76	0	0	0.0000	CRASH	gen=535 glyphs=3
2026-03-14T07:36:45.133512	ec4a0a4f	0	0	0.0000	CRASH	gen=535 glyphs=2
2026-03-14T07:36:45.133794	099964a4	0	0	0.0000	CRASH	gen=536 glyphs=4
2026-03-14T07:36:45.133993	099964a4	0	0	0.0000	CRASH	gen=536 glyphs=4
2026-03-14T07:36:45.134187	dcb1fb50	0	0	0.0000	CRASH	gen=536 glyphs=4
2026-03-14T07:36:45.134384	099964a4	0	0	0.0000	CRASH	gen=536 glyphs=4
2026-03-14T07:36:45.134586	326e3bc0	0	0	0.0000	CRASH	gen=536 glyphs=5
2026-03-14T07:36:45.134803	dcb1fb50	0	0	0.0000	CRASH	gen=536 glyphs=4
2026-03-14T07:36:45.135010	f3292309	0	0	0.0000	CRASH	gen=536 glyphs=4
2026-03-14T07:36:45.135203	d8995287	0	0	0.0000	CRASH	gen=536 glyphs=4
2026-03-14T07:36:45.135398	099964a4	0	0	0.0000	CRASH	gen=536 glyphs=4
2026-03-14T07:36:45.135597	099964a4	0	0	0.0000	CRASH	gen=536 glyphs=4
2026-03-14T07:36:45.135870	099964a4	0	0	0.0000	CRASH	gen=537 glyphs=4
2026-03-14T07:36:45.136068	099964a4	0	0	0.0000	CRASH	gen=537 glyphs=4
2026-03-14T07:36:45.136262	cf93b656	0	0	0.0000	CRASH	gen=537 glyphs=3
2026-03-14T07:36:45.136455	0b778499	0	0	0.0000	CRASH	gen=537 glyphs=2
2026-03-14T07:36:45.136655	25332201	0	0	0.0000	CRASH	gen=537 glyphs=2
2026-03-14T07:36:45.136847	80cef82b	0	0	0.0000	CRASH	gen=537 glyphs=4
2026-03-14T07:36:45.137040	1661b0fe	0	0	0.0000	CRASH	gen=537 glyphs=1
2026-03-14T07:36:45.137229	099964a4	0	0	0.0000	CRASH	gen=537 glyphs=4
2026-03-14T07:36:45.137423	dcb1fb50	0	0	0.0000	CRASH	gen=537 glyphs=4
2026-03-14T07:36:45.137622	ff30496a	0	0	0.0000	CRASH	gen=537 glyphs=3
2026-03-14T07:36:45.137908	099964a4	0	0	0.0000	CRASH	gen=538 glyphs=4
2026-03-14T07:36:45.138102	099964a4	0	0	0.0000	CRASH	gen=538 glyphs=4
2026-03-14T07:36:45.138298	815f377a	0	0	0.0000	CRASH	gen=538 glyphs=4
2026-03-14T07:36:45.138492	eb12bc3e	0	0	0.0000	CRASH	gen=538 glyphs=2
2026-03-14T07:36:45.138688	099964a4	0	0	0.0000	CRASH	gen=538 glyphs=4
2026-03-14T07:36:45.138884	0ddd281d	0	0	0.0000	CRASH	gen=538 glyphs=5
2026-03-14T07:36:45.139083	98ebc802	0	0	0.0000	CRASH	gen=538 glyphs=3
2026-03-14T07:36:45.139276	c165bb9b	0	0	0.0000	CRASH	gen=538 glyphs=3
2026-03-14T07:36:45.139472	7ede4765	0	0	0.0000	CRASH	gen=538 glyphs=2
2026-03-14T07:36:45.139669	099964a4	0	0	0.0000	CRASH	gen=538 glyphs=4
2026-03-14T07:36:45.139968	099964a4	0	0	0.0000	CRASH	gen=539 glyphs=4
2026-03-14T07:36:45.140175	099964a4	0	0	0.0000	CRASH	gen=539 glyphs=4
2026-03-14T07:36:45.140373	099964a4	0	0	0.0000	CRASH	gen=539 glyphs=4
2026-03-14T07:36:45.140582	6383a9b7	0	0	0.0000	CRASH	gen=539 glyphs=4
2026-03-14T07:36:45.140776	a37c704b	0	0	0.0000	CRASH	gen=539 glyphs=3
2026-03-14T07:36:45.140970	099964a4	0	0	0.0000	CRASH	gen=539 glyphs=4
2026-03-14T07:36:45.141162	099964a4	0	0	0.0000	CRASH	gen=539 glyphs=4
2026-03-14T07:36:45.141353	7ede4765	0	0	0.0000	CRASH	gen=539 glyphs=2
2026-03-14T07:36:45.141548	8fd5894c	0	0	0.0000	CRASH	gen=539 glyphs=4
2026-03-14T07:36:45.141738	099964a4	0	0	0.0000	CRASH	gen=539 glyphs=4
2026-03-14T07:36:45.142010	099964a4	0	0	0.0000	CRASH	gen=540 glyphs=4
2026-03-14T07:36:45.142212	099964a4	0	0	0.0000	CRASH	gen=540 glyphs=4
2026-03-14T07:36:45.142405	099964a4	0	0	0.0000	CRASH	gen=540 glyphs=4
2026-03-14T07:36:45.142597	36a2d76a	0	0	0.0000	CRASH	gen=540 glyphs=4
2026-03-14T07:36:45.142789	6b0f1d7b	0	0	0.0000	CRASH	gen=540 glyphs=4
2026-03-14T07:36:45.142982	099964a4	0	0	0.0000	CRASH	gen=540 glyphs=4
2026-03-14T07:36:45.143176	099964a4	0	0	0.0000	CRASH	gen=540 glyphs=4
2026-03-14T07:36:45.143365	cb234fc2	0	0	0.0000	CRASH	gen=540 glyphs=4
2026-03-14T07:36:45.143560	37af6d00	0	0	0.0000	CRASH	gen=540 glyphs=3
2026-03-14T07:36:45.143754	e67dce46	0	0	0.0000	CRASH	gen=540 glyphs=2
2026-03-14T07:36:45.144029	099964a4	0	0	0.0000	CRASH	gen=541 glyphs=4
2026-03-14T07:36:45.144228	099964a4	0	0	0.0000	CRASH	gen=541 glyphs=4
2026-03-14T07:36:45.144422	aa2ec4b0	0	0	0.0000	CRASH	gen=541 glyphs=3
2026-03-14T07:36:45.144619	099964a4	0	0	0.0000	CRASH	gen=541 glyphs=4
2026-03-14T07:36:45.144810	099964a4	0	0	0.0000	CRASH	gen=541 glyphs=4
2026-03-14T07:36:45.145002	099964a4	0	0	0.0000	CRASH	gen=541 glyphs=4
2026-03-14T07:36:45.145190	94638dea	0	0	0.0000	CRASH	gen=541 glyphs=5
2026-03-14T07:36:45.145386	099964a4	0	0	0.0000	CRASH	gen=541 glyphs=4
2026-03-14T07:36:45.145578	c074295f	0	0	0.0000	CRASH	gen=541 glyphs=3
2026-03-14T07:36:45.145770	099964a4	0	0	0.0000	CRASH	gen=541 glyphs=4
2026-03-14T07:36:45.146042	099964a4	0	0	0.0000	CRASH	gen=542 glyphs=4
2026-03-14T07:36:45.146235	099964a4	0	0	0.0000	CRASH	gen=542 glyphs=4
2026-03-14T07:36:45.146432	099964a4	0	0	0.0000	CRASH	gen=542 glyphs=4
2026-03-14T07:36:45.146627	099964a4	0	0	0.0000	CRASH	gen=542 glyphs=4
2026-03-14T07:36:45.146818	099964a4	0	0	0.0000	CRASH	gen=542 glyphs=4
2026-03-14T07:36:45.147011	226673cf	0	0	0.0000	CRASH	gen=542 glyphs=4
2026-03-14T07:36:45.147203	099964a4	0	0	0.0000	CRASH	gen=542 glyphs=4
2026-03-14T07:36:45.147396	099964a4	0	0	0.0000	CRASH	gen=542 glyphs=4
2026-03-14T07:36:45.147592	099964a4	0	0	0.0000	CRASH	gen=542 glyphs=4
2026-03-14T07:36:45.147783	dcb1fb50	0	0	0.0000	CRASH	gen=542 glyphs=4
2026-03-14T07:36:45.148059	099964a4	0	0	0.0000	CRASH	gen=543 glyphs=4
2026-03-14T07:36:45.148253	099964a4	0	0	0.0000	CRASH	gen=543 glyphs=4
2026-03-14T07:36:45.148445	f46622ef	0	0	0.0000	CRASH	gen=543 glyphs=3
2026-03-14T07:36:45.148640	ff30496a	0	0	0.0000	CRASH	gen=543 glyphs=3
2026-03-14T07:36:45.148831	099964a4	0	0	0.0000	CRASH	gen=543 glyphs=4
2026-03-14T07:36:45.149021	099964a4	0	0	0.0000	CRASH	gen=543 glyphs=4
2026-03-14T07:36:45.149211	f6284a42	0	0	0.0000	CRASH	gen=543 glyphs=4
2026-03-14T07:36:45.149403	099964a4	0	0	0.0000	CRASH	gen=543 glyphs=4
2026-03-14T07:36:45.149605	597f88cd	0	0	0.0000	CRASH	gen=543 glyphs=3
2026-03-14T07:36:45.149798	099964a4	0	0	0.0000	CRASH	gen=543 glyphs=4
2026-03-14T07:36:45.150083	099964a4	0	0	0.0000	CRASH	gen=544 glyphs=4
2026-03-14T07:36:45.150277	099964a4	0	0	0.0000	CRASH	gen=544 glyphs=4
2026-03-14T07:36:45.150472	099964a4	0	0	0.0000	CRASH	gen=544 glyphs=4
2026-03-14T07:36:45.150670	4a06aae7	0	0	0.0000	CRASH	gen=544 glyphs=4
2026-03-14T07:36:45.150862	2038be76	0	0	0.0000	CRASH	gen=544 glyphs=4
2026-03-14T07:36:45.151054	e16df4b1	0	0	0.0000	CRASH	gen=544 glyphs=3
2026-03-14T07:36:45.151246	cf93b656	0	0	0.0000	CRASH	gen=544 glyphs=3
2026-03-14T07:36:45.151438	3a734398	0	0	0.0000	CRASH	gen=544 glyphs=4
2026-03-14T07:36:45.151639	43423800	0	0	0.0000	CRASH	gen=544 glyphs=4
2026-03-14T07:36:45.151833	bee52e0f	0	0	0.0000	CRASH	gen=544 glyphs=3
2026-03-14T07:36:45.152113	099964a4	0	0	0.0000	CRASH	gen=545 glyphs=4
