timestamp	program_hash	spirv_size	word_count	fitness	status	description
2026-03-13T23:34:41.627214	4c9b0dd4	120	30	1.0000	DISCARD	gen=169 glyphs=4
2026-03-13T23:34:41.963576	d7c8681b	120	30	1.0000	DISCARD	gen=213 glyphs=4
2026-03-13T23:34:44.472033	accfeba3	116	29	1.0000	DISCARD	gen=169 glyphs=4
2026-03-13T23:34:44.738731	e2db5bb6	116	29	1.0000	DISCARD	gen=213 glyphs=4
2026-03-13T23:34:47.194028	5b9807ac	120	30	1.0000	DISCARD	gen=169 glyphs=4
2026-03-13T23:34:47.465774	8aef8872	116	29	1.0000	DISCARD	gen=213 glyphs=4
2026-03-13T23:34:49.909105	37f4017b	116	29	1.0000	DISCARD	gen=169 glyphs=4
2026-03-13T23:34:50.167042	19355583	120	30	1.0000	DISCARD	gen=213 glyphs=4
2026-03-13T23:34:52.602475	37f4017b	116	29	1.0000	DISCARD	gen=169 glyphs=4
2026-03-13T23:34:52.872633	19355583	120	30	1.0000	DISCARD	gen=213 glyphs=4
2026-03-13T23:34:55.311131	55d6c151	120	30	1.0000	DISCARD	gen=169 glyphs=4
2026-03-13T23:34:55.585685	0eaedb57	116	29	1.0000	DISCARD	gen=213 glyphs=4
2026-03-13T23:34:58.028101	fdb5d108	120	30	1.0000	DISCARD	gen=169 glyphs=4
2026-03-13T23:34:58.301093	e2cd28ea	120	30	1.0000	DISCARD	gen=213 glyphs=4
2026-03-13T23:35:00.746777	37f4017b	116	29	1.0000	DISCARD	gen=170 glyphs=4
2026-03-13T23:35:01.028609	d7c8681b	120	30	1.0000	DISCARD	gen=213 glyphs=4
2026-03-13T23:35:03.492222	bfdf7cad	120	30	1.0000	DISCARD	gen=170 glyphs=4
2026-03-13T23:35:03.759414	19355583	120	30	1.0000	DISCARD	gen=214 glyphs=4
2026-03-13T23:35:06.208465	4c9b0dd4	120	30	1.0000	DISCARD	gen=170 glyphs=4
2026-03-13T23:35:06.477927	8aef8872	116	29	1.0000	DISCARD	gen=214 glyphs=4
2026-03-13T23:35:08.949468	5a06ca32	120	30	1.0000	DISCARD	gen=170 glyphs=4
2026-03-13T23:35:09.219258	ae44ace5	116	29	1.0000	DISCARD	gen=214 glyphs=4
2026-03-13T23:35:11.689241	37f4017b	116	29	1.0000	DISCARD	gen=170 glyphs=4
2026-03-13T23:35:11.955644	8aef8872	116	29	1.0000	DISCARD	gen=214 glyphs=4
2026-03-13T23:35:14.497044	7ca87b42	116	29	1.0000	DISCARD	gen=170 glyphs=4
2026-03-13T23:35:14.779129	0eaedb57	116	29	1.0000	DISCARD	gen=214 glyphs=4
2026-03-13T23:35:17.263774	37f4017b	116	29	1.0000	DISCARD	gen=170 glyphs=4
2026-03-13T23:35:17.541718	e4f5be57	116	29	1.0000	DISCARD	gen=214 glyphs=4
2026-03-13T23:35:19.986567	aec25c92	116	29	1.0000	DISCARD	gen=170 glyphs=4
2026-03-13T23:35:20.251734	a78f9454	120	30	1.0000	DISCARD	gen=214 glyphs=4
2026-03-13T23:35:22.732056	c64c9629	116	29	1.0000	DISCARD	gen=170 glyphs=4
2026-03-13T23:35:23.010815	94152a7a	116	29	0.9500	DISCARD	gen=214 glyphs=4
2026-03-13T23:35:25.477954	82581bb2	116	29	1.0000	DISCARD	gen=170 glyphs=4
2026-03-13T23:35:25.746879	19355583	120	30	1.0000	DISCARD	gen=214 glyphs=4
2026-03-13T23:35:28.189914	37f4017b	116	29	1.0000	DISCARD	gen=171 glyphs=4
2026-03-13T23:35:28.456747	8aef8872	116	29	1.0000	DISCARD	gen=214 glyphs=4
2026-03-13T23:35:30.925662	bfdf7cad	120	30	1.0000	DISCARD	gen=171 glyphs=4
2026-03-13T23:35:31.209930	19355583	120	30	1.0000	DISCARD	gen=215 glyphs=4
2026-03-13T23:35:33.662856	d11c1062	120	30	1.0000	DISCARD	gen=171 glyphs=4
2026-03-13T23:35:33.929671	8aef8872	116	29	1.0000	DISCARD	gen=215 glyphs=4
2026-03-13T23:35:36.409680	8de9118d	116	29	1.0000	DISCARD	gen=171 glyphs=4
2026-03-13T23:35:36.679151	875e0f8a	116	29	1.0000	DISCARD	gen=215 glyphs=4
2026-03-13T23:35:39.144863	5a06ca32	120	30	1.0000	DISCARD	gen=171 glyphs=4
2026-03-13T23:35:39.442329	9730280f	116	29	1.0000	DISCARD	gen=215 glyphs=4
2026-03-13T23:35:41.913392	4c9b0dd4	120	30	1.0000	DISCARD	gen=171 glyphs=4
2026-03-13T23:35:42.177708	27d2b653	116	29	1.0000	DISCARD	gen=215 glyphs=4
2026-03-13T23:35:44.641940	5a06ca32	120	30	1.0000	DISCARD	gen=171 glyphs=4
2026-03-13T23:35:44.921545	8aef8872	116	29	1.0000	DISCARD	gen=215 glyphs=4
2026-03-13T23:35:47.492121	197da1b7	120	30	0.9500	DISCARD	gen=171 glyphs=4
2026-03-13T23:35:47.764210	8aef8872	116	29	1.0000	DISCARD	gen=215 glyphs=4
2026-03-13T23:35:50.419977	37f4017b	116	29	1.0000	DISCARD	gen=171 glyphs=4
2026-03-13T23:35:50.682497	0bc7e282	116	29	1.0000	DISCARD	gen=215 glyphs=4
2026-03-13T23:35:53.159078	37f4017b	116	29	1.0000	DISCARD	gen=171 glyphs=4
2026-03-13T23:35:53.431410	d0949104	116	29	1.0000	DISCARD	gen=215 glyphs=4
2026-03-13T23:35:55.882482	37f4017b	116	29	1.0000	DISCARD	gen=172 glyphs=4
2026-03-13T23:35:56.150205	67cb81be	120	30	1.0000	DISCARD	gen=215 glyphs=4
2026-03-13T23:35:58.624348	bfdf7cad	120	30	1.0000	DISCARD	gen=172 glyphs=4
2026-03-13T23:35:58.908694	19355583	120	30	1.0000	DISCARD	gen=216 glyphs=4
2026-03-13T23:36:01.389538	d11c1062	120	30	1.0000	DISCARD	gen=172 glyphs=4
2026-03-13T23:36:01.661795	8aef8872	116	29	1.0000	DISCARD	gen=216 glyphs=4
2026-03-13T23:36:04.143018	37f4017b	116	29	1.0000	DISCARD	gen=172 glyphs=4
2026-03-13T23:36:04.414727	eca7ab6c	116	29	1.0000	DISCARD	gen=216 glyphs=4
2026-03-13T23:36:06.826818	6e868038	116	29	1.0000	DISCARD	gen=172 glyphs=4
2026-03-13T23:36:07.101414	99f0e7c8	116	29	1.0000	DISCARD	gen=216 glyphs=4
2026-03-13T23:36:09.566408	37f4017b	116	29	1.0000	DISCARD	gen=172 glyphs=4
2026-03-13T23:36:09.841217	050862ad	120	30	1.0000	DISCARD	gen=216 glyphs=4
2026-03-13T23:36:12.302617	71e2ba66	116	29	1.0000	DISCARD	gen=172 glyphs=4
2026-03-13T23:36:12.575709	87ce0b4d	116	29	1.0000	DISCARD	gen=216 glyphs=4
2026-03-13T23:36:15.080894	ec32cef3	120	30	0.9500	DISCARD	gen=172 glyphs=4
2026-03-13T23:36:15.354143	5ae2b95a	116	29	1.0000	DISCARD	gen=216 glyphs=4
2026-03-13T23:36:17.931812	60cd6a03	116	29	1.0000	DISCARD	gen=172 glyphs=4
2026-03-13T23:36:18.214688	ae44ace5	116	29	1.0000	DISCARD	gen=216 glyphs=4
2026-03-13T23:36:20.679063	b375562f	120	30	1.0000	DISCARD	gen=172 glyphs=4
2026-03-13T23:36:20.953629	0eaedb57	116	29	1.0000	DISCARD	gen=216 glyphs=4
2026-03-13T23:36:23.393221	37f4017b	116	29	1.0000	DISCARD	gen=173 glyphs=4
2026-03-13T23:36:23.660466	50dc991d	116	29	1.0000	DISCARD	gen=216 glyphs=4
2026-03-13T23:36:26.125722	bfdf7cad	120	30	1.0000	DISCARD	gen=173 glyphs=4
2026-03-13T23:36:26.407556	19355583	120	30	1.0000	DISCARD	gen=217 glyphs=4
2026-03-13T23:36:28.845176	5a06ca32	120	30	1.0000	DISCARD	gen=173 glyphs=4
2026-03-13T23:36:29.111704	8aef8872	116	29	1.0000	DISCARD	gen=217 glyphs=4
2026-03-13T23:36:31.543750	5b9807ac	120	30	1.0000	DISCARD	gen=173 glyphs=4
2026-03-13T23:36:31.805322	d7c8681b	120	30	1.0000	DISCARD	gen=217 glyphs=4
2026-03-13T23:36:34.281374	5a06ca32	120	30	1.0000	DISCARD	gen=173 glyphs=4
2026-03-13T23:36:34.548122	b57e7176	120	30	1.0000	DISCARD	gen=217 glyphs=4
2026-03-13T23:36:36.980307	37f4017b	116	29	1.0000	DISCARD	gen=173 glyphs=4
2026-03-13T23:36:37.261435	67cb81be	120	30	1.0000	DISCARD	gen=217 glyphs=4
2026-03-13T23:36:39.744190	5a06ca32	120	30	1.0000	DISCARD	gen=173 glyphs=4
2026-03-13T23:36:40.012049	0eaedb57	116	29	1.0000	DISCARD	gen=217 glyphs=4
2026-03-13T23:36:42.460146	2701cb73	116	29	1.0000	DISCARD	gen=173 glyphs=4
2026-03-13T23:36:42.741605	0231e8e0	120	30	1.0000	DISCARD	gen=217 glyphs=4
2026-03-13T23:36:45.179233	cf76c4b7	120	30	1.0000	DISCARD	gen=173 glyphs=4
2026-03-13T23:36:45.453999	32ebe5c2	116	29	1.0000	DISCARD	gen=217 glyphs=4
2026-03-13T23:36:47.889395	37f4017b	116	29	1.0000	DISCARD	gen=173 glyphs=4
2026-03-13T23:36:48.167175	0eaedb57	116	29	1.0000	DISCARD	gen=217 glyphs=4
2026-03-13T23:36:50.716257	37f4017b	116	29	1.0000	DISCARD	gen=174 glyphs=4
2026-03-13T23:36:50.986706	0eaedb57	116	29	1.0000	DISCARD	gen=217 glyphs=4
2026-03-13T23:36:53.459246	bfdf7cad	120	30	1.0000	DISCARD	gen=174 glyphs=4
2026-03-13T23:36:53.739875	19355583	120	30	1.0000	DISCARD	gen=218 glyphs=4
2026-03-13T23:36:56.233135	37f4017b	116	29	1.0000	DISCARD	gen=174 glyphs=4
2026-03-13T23:36:56.515897	8aef8872	116	29	1.0000	DISCARD	gen=218 glyphs=4
2026-03-13T23:36:58.949304	fdb5d108	120	30	1.0000	DISCARD	gen=174 glyphs=4
2026-03-13T23:36:59.214774	19355583	120	30	1.0000	DISCARD	gen=218 glyphs=4
2026-03-13T23:37:01.670493	37f4017b	116	29	1.0000	DISCARD	gen=174 glyphs=4
2026-03-13T23:37:01.937559	050862ad	120	30	1.0000	DISCARD	gen=218 glyphs=4
2026-03-13T23:37:04.439905	fdb5d108	120	30	1.0000	DISCARD	gen=174 glyphs=4
2026-03-13T23:37:04.700660	8aef8872	116	29	1.0000	DISCARD	gen=218 glyphs=4
2026-03-13T23:37:07.167846	5a06ca32	120	30	1.0000	DISCARD	gen=174 glyphs=4
2026-03-13T23:37:07.440851	b57e7176	120	30	1.0000	DISCARD	gen=218 glyphs=4
2026-03-13T23:37:09.919145	1d34459a	116	29	1.0000	DISCARD	gen=174 glyphs=4
2026-03-13T23:37:10.192949	8aef8872	116	29	1.0000	DISCARD	gen=218 glyphs=4
2026-03-13T23:37:12.683323	12b38c2d	116	29	1.0000	DISCARD	gen=174 glyphs=4
2026-03-13T23:37:12.943139	9e6494da	116	29	1.0000	DISCARD	gen=218 glyphs=4
2026-03-13T23:37:15.404258	5a06ca32	120	30	1.0000	DISCARD	gen=174 glyphs=4
2026-03-13T23:37:15.691033	1e5f0e21	116	29	1.0000	DISCARD	gen=218 glyphs=4
2026-03-13T23:37:18.104653	37f4017b	116	29	1.0000	DISCARD	gen=175 glyphs=4
2026-03-13T23:37:18.361739	875e0f8a	116	29	1.0000	DISCARD	gen=218 glyphs=4
2026-03-13T23:37:20.877084	bfdf7cad	120	30	1.0000	DISCARD	gen=175 glyphs=4
2026-03-13T23:37:21.146183	19355583	120	30	1.0000	DISCARD	gen=219 glyphs=4
2026-03-13T23:37:23.573849	dc86dc71	116	29	1.0000	DISCARD	gen=175 glyphs=4
2026-03-13T23:37:23.839052	8aef8872	116	29	1.0000	DISCARD	gen=219 glyphs=4
2026-03-13T23:37:26.272257	37f4017b	116	29	1.0000	DISCARD	gen=175 glyphs=4
2026-03-13T23:37:26.534973	0146cb3f	120	30	1.0000	DISCARD	gen=219 glyphs=4
2026-03-13T23:37:28.953964	37f4017b	116	29	1.0000	DISCARD	gen=175 glyphs=4
2026-03-13T23:37:29.229363	8aef8872	116	29	1.0000	DISCARD	gen=219 glyphs=4
2026-03-13T23:37:31.677228	5a06ca32	120	30	1.0000	DISCARD	gen=175 glyphs=4
2026-03-13T23:37:31.944994	43c589f9	116	29	1.0000	DISCARD	gen=219 glyphs=4
2026-03-13T23:37:34.358394	5a06ca32	120	30	1.0000	DISCARD	gen=175 glyphs=4
2026-03-13T23:37:34.633370	8aef8872	116	29	1.0000	DISCARD	gen=219 glyphs=4
2026-03-13T23:37:37.049864	5a06ca32	120	30	1.0000	DISCARD	gen=175 glyphs=4
2026-03-13T23:37:37.310638	720fc7d9	116	29	0.9500	DISCARD	gen=219 glyphs=4
2026-03-13T23:37:39.759276	68d50bbb	116	29	0.9500	DISCARD	gen=175 glyphs=4
2026-03-13T23:37:40.034417	0eaedb57	116	29	1.0000	DISCARD	gen=219 glyphs=4
2026-03-13T23:37:42.453743	37f4017b	116	29	1.0000	DISCARD	gen=175 glyphs=4
2026-03-13T23:37:42.737908	0eaedb57	116	29	1.0000	DISCARD	gen=219 glyphs=4
2026-03-13T23:37:45.176487	37f4017b	116	29	1.0000	DISCARD	gen=176 glyphs=4
2026-03-13T23:37:45.462934	80b34888	116	29	1.0000	DISCARD	gen=219 glyphs=4
2026-03-13T23:37:47.872917	bfdf7cad	120	30	1.0000	DISCARD	gen=176 glyphs=4
2026-03-13T23:37:48.146779	19355583	120	30	1.0000	DISCARD	gen=220 glyphs=4
2026-03-13T23:37:50.579140	5a06ca32	120	30	1.0000	DISCARD	gen=176 glyphs=4
2026-03-13T23:37:50.838386	8aef8872	116	29	1.0000	DISCARD	gen=220 glyphs=4
2026-03-13T23:37:53.321305	9071b719	116	29	1.0000	DISCARD	gen=176 glyphs=4
2026-03-13T23:37:53.589136	50dc991d	116	29	1.0000	DISCARD	gen=220 glyphs=4
2026-03-13T23:37:56.035993	37f4017b	116	29	1.0000	DISCARD	gen=176 glyphs=4
2026-03-13T23:37:56.307377	e2cd28ea	120	30	1.0000	DISCARD	gen=220 glyphs=4
2026-03-13T23:37:58.750582	6017cb64	116	29	1.0000	DISCARD	gen=176 glyphs=4
2026-03-13T23:37:59.010217	c0809a4e	116	29	1.0000	DISCARD	gen=220 glyphs=4
2026-03-13T23:38:01.511770	fdb5d108	120	30	1.0000	DISCARD	gen=176 glyphs=4
2026-03-13T23:38:01.780943	875e0f8a	116	29	1.0000	DISCARD	gen=220 glyphs=4
2026-03-13T23:38:04.228318	fdb5d108	120	30	1.0000	DISCARD	gen=176 glyphs=4
2026-03-13T23:38:04.491930	1b2ca2ed	116	29	1.0000	DISCARD	gen=220 glyphs=4
2026-03-13T23:38:06.899112	1d34459a	116	29	1.0000	DISCARD	gen=176 glyphs=4
2026-03-13T23:38:07.164200	2bd47145	116	29	1.0000	DISCARD	gen=220 glyphs=4
2026-03-13T23:38:09.598838	55d6c151	120	30	1.0000	DISCARD	gen=176 glyphs=4
2026-03-13T23:38:09.888684	e5513f5c	116	29	1.0000	DISCARD	gen=220 glyphs=4
2026-03-13T23:38:12.305622	37f4017b	116	29	1.0000	DISCARD	gen=177 glyphs=4
2026-03-13T23:38:12.590918	e2cd28ea	120	30	1.0000	DISCARD	gen=220 glyphs=4
2026-03-13T23:38:15.021255	bfdf7cad	120	30	1.0000	DISCARD	gen=177 glyphs=4
2026-03-13T23:38:15.288285	19355583	120	30	1.0000	DISCARD	gen=221 glyphs=4
2026-03-13T23:38:17.705810	5a06ca32	120	30	1.0000	DISCARD	gen=177 glyphs=4
2026-03-13T23:38:17.983798	8aef8872	116	29	1.0000	DISCARD	gen=221 glyphs=4
2026-03-13T23:38:20.402058	bfdf7cad	120	30	1.0000	DISCARD	gen=177 glyphs=4
2026-03-13T23:38:20.665037	1e5f0e21	116	29	1.0000	DISCARD	gen=221 glyphs=4
2026-03-13T23:38:23.147107	37f4017b	116	29	1.0000	DISCARD	gen=177 glyphs=4
2026-03-13T23:38:23.416257	19355583	120	30	1.0000	DISCARD	gen=221 glyphs=4
2026-03-13T23:38:25.891727	37f4017b	116	29	1.0000	DISCARD	gen=177 glyphs=4
2026-03-13T23:38:26.169247	19355583	120	30	1.0000	DISCARD	gen=221 glyphs=4
2026-03-13T23:38:28.601286	4c9b0dd4	120	30	1.0000	DISCARD	gen=177 glyphs=4
2026-03-13T23:38:28.871563	8aef8872	116	29	1.0000	DISCARD	gen=221 glyphs=4
2026-03-13T23:38:31.306669	bfdf7cad	120	30	1.0000	DISCARD	gen=177 glyphs=4
2026-03-13T23:38:31.572590	19355583	120	30	1.0000	DISCARD	gen=221 glyphs=4
2026-03-13T23:38:34.057091	fdb5d108	120	30	1.0000	DISCARD	gen=177 glyphs=4
2026-03-13T23:38:34.325543	e6436274	116	29	1.0000	DISCARD	gen=221 glyphs=4
2026-03-13T23:38:36.749012	87f026e7	120	30	1.0000	DISCARD	gen=177 glyphs=4
2026-03-13T23:38:37.015544	50dc991d	116	29	1.0000	DISCARD	gen=221 glyphs=4
2026-03-13T23:38:39.419515	37f4017b	116	29	1.0000	DISCARD	gen=178 glyphs=4
2026-03-13T23:38:39.690123	d7c8681b	120	30	1.0000	DISCARD	gen=221 glyphs=4
2026-03-13T23:38:42.140294	bfdf7cad	120	30	1.0000	DISCARD	gen=178 glyphs=4
2026-03-13T23:38:42.408668	19355583	120	30	1.0000	DISCARD	gen=222 glyphs=4
2026-03-13T23:38:44.825220	5a06ca32	120	30	1.0000	DISCARD	gen=178 glyphs=4
2026-03-13T23:38:45.092320	8aef8872	116	29	1.0000	DISCARD	gen=222 glyphs=4
2026-03-13T23:38:47.546795	7ca87b42	116	29	1.0000	DISCARD	gen=178 glyphs=4
2026-03-13T23:38:47.810280	050862ad	120	30	1.0000	DISCARD	gen=222 glyphs=4
2026-03-13T23:38:50.263405	53841cad	120	30	1.0000	DISCARD	gen=178 glyphs=4
2026-03-13T23:38:50.537060	0eaedb57	116	29	1.0000	DISCARD	gen=222 glyphs=4
2026-03-13T23:38:52.928844	55d6c151	120	30	1.0000	DISCARD	gen=178 glyphs=4
2026-03-13T23:38:53.193827	67cb81be	120	30	1.0000	DISCARD	gen=222 glyphs=4
2026-03-13T23:38:55.687846	55d6c151	120	30	1.0000	DISCARD	gen=178 glyphs=4
2026-03-13T23:38:55.983031	875e0f8a	116	29	1.0000	DISCARD	gen=222 glyphs=4
2026-03-13T23:38:58.407650	55d6c151	120	30	1.0000	DISCARD	gen=178 glyphs=4
2026-03-13T23:38:58.675023	1e5f0e21	116	29	1.0000	DISCARD	gen=222 glyphs=4
2026-03-13T23:39:01.097370	e87400cc	120	30	1.0000	DISCARD	gen=178 glyphs=4
2026-03-13T23:39:01.362312	8aef8872	116	29	1.0000	DISCARD	gen=222 glyphs=4
2026-03-13T23:39:03.796277	bfdf7cad	120	30	1.0000	DISCARD	gen=178 glyphs=4
2026-03-13T23:39:04.072599	8aef8872	116	29	1.0000	DISCARD	gen=222 glyphs=4
2026-03-13T23:39:06.513276	37f4017b	116	29	1.0000	DISCARD	gen=179 glyphs=4
2026-03-13T23:39:06.770377	19355583	120	30	1.0000	DISCARD	gen=222 glyphs=4
2026-03-13T23:39:09.201904	bfdf7cad	120	30	1.0000	DISCARD	gen=179 glyphs=4
2026-03-13T23:39:09.465972	19355583	120	30	1.0000	DISCARD	gen=223 glyphs=4
2026-03-13T23:39:11.886409	61b782c7	116	29	1.0000	DISCARD	gen=179 glyphs=4
2026-03-13T23:39:12.155703	8aef8872	116	29	1.0000	DISCARD	gen=223 glyphs=4
2026-03-13T23:39:14.592079	5a06ca32	120	30	1.0000	DISCARD	gen=179 glyphs=4
2026-03-13T23:39:14.858109	0eaedb57	116	29	1.0000	DISCARD	gen=223 glyphs=4
2026-03-13T23:39:17.332427	61fc7b76	116	29	1.0000	DISCARD	gen=179 glyphs=4
2026-03-13T23:39:17.590242	9d3218ff	116	29	1.0000	DISCARD	gen=223 glyphs=4
2026-03-13T23:39:20.049853	f4becd67	116	29	1.0000	DISCARD	gen=179 glyphs=4
2026-03-13T23:39:20.319386	d7c8681b	120	30	1.0000	DISCARD	gen=223 glyphs=4
2026-03-13T23:39:22.750880	37f4017b	116	29	1.0000	DISCARD	gen=179 glyphs=4
2026-03-13T23:39:23.030673	19355583	120	30	1.0000	DISCARD	gen=223 glyphs=4
2026-03-13T23:39:25.449791	55d6c151	120	30	1.0000	DISCARD	gen=179 glyphs=4
2026-03-13T23:39:25.721204	050862ad	120	30	1.0000	DISCARD	gen=223 glyphs=4
2026-03-13T23:39:28.178729	55d6c151	120	30	1.0000	DISCARD	gen=179 glyphs=4
2026-03-13T23:39:28.448305	a78f9454	120	30	1.0000	DISCARD	gen=223 glyphs=4
2026-03-13T23:39:30.857839	d11c1062	120	30	1.0000	DISCARD	gen=179 glyphs=4
2026-03-13T23:39:31.139299	0eaedb57	116	29	1.0000	DISCARD	gen=223 glyphs=4
2026-03-13T23:39:33.601192	37f4017b	116	29	1.0000	DISCARD	gen=180 glyphs=4
2026-03-13T23:39:33.871446	e6876727	116	29	0.9500	DISCARD	gen=223 glyphs=4
2026-03-13T23:39:36.286466	bfdf7cad	120	30	1.0000	DISCARD	gen=180 glyphs=4
2026-03-13T23:39:36.555392	19355583	120	30	1.0000	DISCARD	gen=224 glyphs=4
2026-03-13T23:39:38.975981	12b38c2d	116	29	1.0000	DISCARD	gen=180 glyphs=4
2026-03-13T23:39:39.239202	8aef8872	116	29	1.0000	DISCARD	gen=224 glyphs=4
2026-03-13T23:39:41.661218	bfdf7cad	120	30	1.0000	DISCARD	gen=180 glyphs=4
2026-03-13T23:39:41.929017	888b93d1	116	29	1.0000	DISCARD	gen=224 glyphs=4
2026-03-13T23:39:44.363443	71e2ba66	116	29	1.0000	DISCARD	gen=180 glyphs=4
2026-03-13T23:39:44.632653	b2d903e8	116	29	1.0000	DISCARD	gen=224 glyphs=4
2026-03-13T23:39:47.050673	5a06ca32	120	30	1.0000	DISCARD	gen=180 glyphs=4
2026-03-13T23:39:47.319576	b7aed8e9	116	29	1.0000	DISCARD	gen=224 glyphs=4
2026-03-13T23:39:49.757991	f8d2e2ed	120	30	1.0000	DISCARD	gen=180 glyphs=4
2026-03-13T23:39:50.036190	050862ad	120	30	1.0000	DISCARD	gen=224 glyphs=4
2026-03-13T23:39:52.476971	2701cb73	116	29	1.0000	DISCARD	gen=180 glyphs=4
2026-03-13T23:39:52.747916	67cb81be	120	30	1.0000	DISCARD	gen=224 glyphs=4
2026-03-13T23:39:55.144509	27d1583e	120	30	0.9500	DISCARD	gen=180 glyphs=4
2026-03-13T23:39:55.406459	19355583	120	30	1.0000	DISCARD	gen=224 glyphs=4
2026-03-13T23:39:57.829360	5a06ca32	120	30	1.0000	DISCARD	gen=180 glyphs=4
2026-03-13T23:39:58.101688	b7aed8e9	116	29	1.0000	DISCARD	gen=224 glyphs=4
2026-03-13T23:40:00.610863	37f4017b	116	29	1.0000	DISCARD	gen=181 glyphs=4
2026-03-13T23:40:00.886240	8aef8872	116	29	1.0000	DISCARD	gen=224 glyphs=4
2026-03-13T23:40:03.337610	bfdf7cad	120	30	1.0000	DISCARD	gen=181 glyphs=4
2026-03-13T23:40:03.604774	19355583	120	30	1.0000	DISCARD	gen=225 glyphs=4
2026-03-13T23:40:06.018250	55d6c151	120	30	1.0000	DISCARD	gen=181 glyphs=4
2026-03-13T23:40:06.285367	8aef8872	116	29	1.0000	DISCARD	gen=225 glyphs=4
2026-03-13T23:40:08.739314	a5218cb9	120	30	1.0000	DISCARD	gen=181 glyphs=4
2026-03-13T23:40:09.009817	47cc15ee	120	30	0.9500	DISCARD	gen=225 glyphs=4
2026-03-13T23:40:11.450610	5a06ca32	120	30	1.0000	DISCARD	gen=181 glyphs=4
2026-03-13T23:40:11.721028	e6fd1af0	116	29	0.9500	DISCARD	gen=225 glyphs=4
2026-03-13T23:40:14.153240	37f4017b	116	29	1.0000	DISCARD	gen=181 glyphs=4
2026-03-13T23:40:14.415242	0eaedb57	116	29	1.0000	DISCARD	gen=225 glyphs=4
2026-03-13T23:40:16.849776	5a06ca32	120	30	1.0000	DISCARD	gen=181 glyphs=4
2026-03-13T23:40:17.124713	d7c8681b	120	30	1.0000	DISCARD	gen=225 glyphs=4
2026-03-13T23:40:19.558741	7ca87b42	116	29	1.0000	DISCARD	gen=181 glyphs=4
2026-03-13T23:40:19.829291	8aef8872	116	29	1.0000	DISCARD	gen=225 glyphs=4
2026-03-13T23:40:22.261326	5a06ca32	120	30	1.0000	DISCARD	gen=181 glyphs=4
2026-03-13T23:40:22.525439	8aef8872	116	29	1.0000	DISCARD	gen=225 glyphs=4
2026-03-13T23:40:24.998588	37f4017b	116	29	1.0000	DISCARD	gen=181 glyphs=4
2026-03-13T23:40:25.260575	382f6ee9	116	29	1.0000	DISCARD	gen=225 glyphs=4
2026-03-13T23:40:27.724809	37f4017b	116	29	1.0000	DISCARD	gen=182 glyphs=4
2026-03-13T23:40:27.997109	d81ba194	120	30	1.0000	DISCARD	gen=225 glyphs=4
2026-03-13T23:40:30.525981	bfdf7cad	120	30	1.0000	DISCARD	gen=182 glyphs=4
2026-03-13T23:40:30.810863	19355583	120	30	1.0000	DISCARD	gen=226 glyphs=4
2026-03-13T23:40:33.276485	37f4017b	116	29	1.0000	DISCARD	gen=182 glyphs=4
2026-03-13T23:40:33.554734	8aef8872	116	29	1.0000	DISCARD	gen=226 glyphs=4
2026-03-13T23:40:35.988713	37f4017b	116	29	1.0000	DISCARD	gen=182 glyphs=4
2026-03-13T23:40:36.261105	19355583	120	30	1.0000	DISCARD	gen=226 glyphs=4
2026-03-13T23:40:38.688570	37f4017b	116	29	1.0000	DISCARD	gen=182 glyphs=4
2026-03-13T23:40:38.950755	9e34ede0	116	29	1.0000	DISCARD	gen=226 glyphs=4
2026-03-13T23:40:41.397820	5a06ca32	120	30	1.0000	DISCARD	gen=182 glyphs=4
2026-03-13T23:40:41.674320	e62de16a	120	30	0.9500	DISCARD	gen=226 glyphs=4
2026-03-13T23:40:44.109641	37f4017b	116	29	1.0000	DISCARD	gen=182 glyphs=4
2026-03-13T23:40:44.372704	e2cd28ea	120	30	1.0000	DISCARD	gen=226 glyphs=4
2026-03-13T23:40:46.795733	5b9807ac	120	30	1.0000	DISCARD	gen=182 glyphs=4
2026-03-13T23:40:47.075864	e9693b2f	120	30	1.0000	DISCARD	gen=226 glyphs=4
2026-03-13T23:40:49.498013	5b9807ac	120	30	1.0000	DISCARD	gen=182 glyphs=4
2026-03-13T23:40:49.765347	31ca2883	120	30	1.0000	DISCARD	gen=226 glyphs=4
2026-03-13T23:40:52.185488	f0f6744b	116	29	0.9500	DISCARD	gen=182 glyphs=4
2026-03-13T23:40:52.457000	0eaedb57	116	29	1.0000	DISCARD	gen=226 glyphs=4
2026-03-13T23:40:54.889951	37f4017b	116	29	1.0000	DISCARD	gen=183 glyphs=4
2026-03-13T23:40:55.162706	f0097c63	124	31	0.9500	DISCARD	gen=226 glyphs=4
2026-03-13T23:40:57.587006	bfdf7cad	120	30	1.0000	DISCARD	gen=183 glyphs=4
2026-03-13T23:40:57.878544	19355583	120	30	1.0000	DISCARD	gen=227 glyphs=4
2026-03-13T23:41:00.309063	37f4017b	116	29	1.0000	DISCARD	gen=183 glyphs=4
2026-03-13T23:41:00.580263	8aef8872	116	29	1.0000	DISCARD	gen=227 glyphs=4
2026-03-13T23:41:03.083759	5b9807ac	120	30	1.0000	DISCARD	gen=183 glyphs=4
2026-03-13T23:41:03.370393	e8c7f6cf	120	30	1.0000	DISCARD	gen=227 glyphs=4
2026-03-13T23:41:05.825009	55d6c151	120	30	1.0000	DISCARD	gen=183 glyphs=4
2026-03-13T23:41:06.105591	1b2b45e9	116	29	1.0000	DISCARD	gen=227 glyphs=4
2026-03-13T23:41:08.550120	5b9807ac	120	30	1.0000	DISCARD	gen=183 glyphs=4
2026-03-13T23:41:08.826098	b57e7176	120	30	1.0000	DISCARD	gen=227 glyphs=4
2026-03-13T23:41:11.268477	fdb5d108	120	30	1.0000	DISCARD	gen=183 glyphs=4
2026-03-13T23:41:11.540245	a78f9454	120	30	1.0000	DISCARD	gen=227 glyphs=4
2026-03-13T23:41:13.978332	1d34459a	116	29	1.0000	DISCARD	gen=183 glyphs=4
2026-03-13T23:41:14.259671	e2cd28ea	120	30	1.0000	DISCARD	gen=227 glyphs=4
2026-03-13T23:41:16.678551	37f4017b	116	29	1.0000	DISCARD	gen=183 glyphs=4
2026-03-13T23:41:16.959055	e2cd28ea	120	30	1.0000	DISCARD	gen=227 glyphs=4
