timestamp	program_hash	spirv_size	word_count	fitness	status	description
2026-03-14T07:36:45.216483	099964a4	0	0	0.0000	CRASH	gen=576 glyphs=4
2026-03-14T07:36:45.216678	b4ebc1da	0	0	0.0000	CRASH	gen=576 glyphs=4
2026-03-14T07:36:45.216875	25a22fa0	0	0	0.0000	CRASH	gen=576 glyphs=4
2026-03-14T07:36:45.217072	479ba801	0	0	0.0000	CRASH	gen=576 glyphs=3
2026-03-14T07:36:45.217269	099964a4	0	0	0.0000	CRASH	gen=576 glyphs=4
2026-03-14T07:36:45.217465	099964a4	0	0	0.0000	CRASH	gen=576 glyphs=4
2026-03-14T07:36:45.217751	099964a4	0	0	0.0000	CRASH	gen=577 glyphs=4
2026-03-14T07:36:45.217946	099964a4	0	0	0.0000	CRASH	gen=577 glyphs=4
2026-03-14T07:36:45.218146	b14b0bf6	0	0	0.0000	CRASH	gen=577 glyphs=4
2026-03-14T07:36:45.218341	3a734398	0	0	0.0000	CRASH	gen=577 glyphs=4
2026-03-14T07:36:45.218538	921930ea	0	0	0.0000	CRASH	gen=577 glyphs=3
2026-03-14T07:36:45.218732	099964a4	0	0	0.0000	CRASH	gen=577 glyphs=4
2026-03-14T07:36:45.218929	099964a4	0	0	0.0000	CRASH	gen=577 glyphs=4
2026-03-14T07:36:45.219123	421e5ad8	0	0	0.0000	CRASH	gen=577 glyphs=2
2026-03-14T07:36:45.219321	099964a4	0	0	0.0000	CRASH	gen=577 glyphs=4
2026-03-14T07:36:45.219512	83869f9b	0	0	0.0000	CRASH	gen=577 glyphs=4
2026-03-14T07:36:45.219793	099964a4	0	0	0.0000	CRASH	gen=578 glyphs=4
2026-03-14T07:36:45.219991	099964a4	0	0	0.0000	CRASH	gen=578 glyphs=4
2026-03-14T07:36:45.220186	f8f8799b	0	0	0.0000	CRASH	gen=578 glyphs=3
2026-03-14T07:36:45.220384	3a734398	0	0	0.0000	CRASH	gen=578 glyphs=4
2026-03-14T07:36:45.220582	8da1f8d8	0	0	0.0000	CRASH	gen=578 glyphs=4
2026-03-14T07:36:45.220776	099964a4	0	0	0.0000	CRASH	gen=578 glyphs=4
2026-03-14T07:36:45.220973	8da1f8d8	0	0	0.0000	CRASH	gen=578 glyphs=4
2026-03-14T07:36:45.221168	3ca14993	0	0	0.0000	CRASH	gen=578 glyphs=4
2026-03-14T07:36:45.221370	099964a4	0	0	0.0000	CRASH	gen=578 glyphs=4
2026-03-14T07:36:45.221569	099964a4	0	0	0.0000	CRASH	gen=578 glyphs=4
2026-03-14T07:36:45.221849	099964a4	0	0	0.0000	CRASH	gen=579 glyphs=4
2026-03-14T07:36:45.222045	099964a4	0	0	0.0000	CRASH	gen=579 glyphs=4
2026-03-14T07:36:45.222241	8da1f8d8	0	0	0.0000	CRASH	gen=579 glyphs=4
2026-03-14T07:36:45.222443	81324844	0	0	0.0000	CRASH	gen=579 glyphs=4
2026-03-14T07:36:45.222641	aadb559b	0	0	0.0000	CRASH	gen=579 glyphs=5
2026-03-14T07:36:45.222836	099964a4	0	0	0.0000	CRASH	gen=579 glyphs=4
2026-03-14T07:36:45.223027	099964a4	0	0	0.0000	CRASH	gen=579 glyphs=4
2026-03-14T07:36:45.223218	099964a4	0	0	0.0000	CRASH	gen=579 glyphs=4
2026-03-14T07:36:45.223415	8da1f8d8	0	0	0.0000	CRASH	gen=579 glyphs=4
2026-03-14T07:36:45.223610	cf93b656	0	0	0.0000	CRASH	gen=579 glyphs=3
2026-03-14T07:36:45.223876	099964a4	0	0	0.0000	CRASH	gen=580 glyphs=4
2026-03-14T07:36:45.224071	099964a4	0	0	0.0000	CRASH	gen=580 glyphs=4
2026-03-14T07:36:45.224266	80cef82b	0	0	0.0000	CRASH	gen=580 glyphs=4
2026-03-14T07:36:45.224466	099964a4	0	0	0.0000	CRASH	gen=580 glyphs=4
2026-03-14T07:36:45.224661	846013db	0	0	0.0000	CRASH	gen=580 glyphs=3
2026-03-14T07:36:45.224854	3a734398	0	0	0.0000	CRASH	gen=580 glyphs=4
2026-03-14T07:36:45.225047	099964a4	0	0	0.0000	CRASH	gen=580 glyphs=4
2026-03-14T07:36:45.225236	099964a4	0	0	0.0000	CRASH	gen=580 glyphs=4
2026-03-14T07:36:45.225430	3ca14993	0	0	0.0000	CRASH	gen=580 glyphs=4
2026-03-14T07:36:45.225631	099964a4	0	0	0.0000	CRASH	gen=580 glyphs=4
2026-03-14T07:36:45.225907	099964a4	0	0	0.0000	CRASH	gen=581 glyphs=4
2026-03-14T07:36:45.226103	099964a4	0	0	0.0000	CRASH	gen=581 glyphs=4
2026-03-14T07:36:45.226296	099964a4	0	0	0.0000	CRASH	gen=581 glyphs=4
2026-03-14T07:36:45.226490	099964a4	0	0	0.0000	CRASH	gen=581 glyphs=4
2026-03-14T07:36:45.226691	ce01df30	0	0	0.0000	CRASH	gen=581 glyphs=3
2026-03-14T07:36:45.226884	dcb1fb50	0	0	0.0000	CRASH	gen=581 glyphs=4
2026-03-14T07:36:45.227081	099964a4	0	0	0.0000	CRASH	gen=581 glyphs=4
2026-03-14T07:36:45.227278	099964a4	0	0	0.0000	CRASH	gen=581 glyphs=4
2026-03-14T07:36:45.227473	c3d339d3	0	0	0.0000	CRASH	gen=581 glyphs=4
2026-03-14T07:36:45.227677	84107486	0	0	0.0000	CRASH	gen=581 glyphs=2
2026-03-14T07:36:45.227950	099964a4	0	0	0.0000	CRASH	gen=582 glyphs=4
2026-03-14T07:36:45.228146	099964a4	0	0	0.0000	CRASH	gen=582 glyphs=4
2026-03-14T07:36:45.228340	9bc9c1b5	0	0	0.0000	CRASH	gen=582 glyphs=4
2026-03-14T07:36:45.228536	099964a4	0	0	0.0000	CRASH	gen=582 glyphs=4
2026-03-14T07:36:45.228733	05e5e6cd	0	0	0.0000	CRASH	gen=582 glyphs=4
2026-03-14T07:36:45.228929	352ec577	0	0	0.0000	CRASH	gen=582 glyphs=4
2026-03-14T07:36:45.229126	099964a4	0	0	0.0000	CRASH	gen=582 glyphs=4
2026-03-14T07:36:45.229318	099964a4	0	0	0.0000	CRASH	gen=582 glyphs=4
2026-03-14T07:36:45.229516	ff30496a	0	0	0.0000	CRASH	gen=582 glyphs=3
2026-03-14T07:36:45.229709	099964a4	0	0	0.0000	CRASH	gen=582 glyphs=4
2026-03-14T07:36:45.230000	099964a4	0	0	0.0000	CRASH	gen=583 glyphs=4
2026-03-14T07:36:45.230198	099964a4	0	0	0.0000	CRASH	gen=583 glyphs=4
2026-03-14T07:36:45.230394	7cddac72	0	0	0.0000	CRASH	gen=583 glyphs=3
2026-03-14T07:36:45.230594	099964a4	0	0	0.0000	CRASH	gen=583 glyphs=4
2026-03-14T07:36:45.230790	a5a1e601	0	0	0.0000	CRASH	gen=583 glyphs=3
2026-03-14T07:36:45.230996	cf93b656	0	0	0.0000	CRASH	gen=583 glyphs=3
2026-03-14T07:36:45.231193	7ede4765	0	0	0.0000	CRASH	gen=583 glyphs=2
2026-03-14T07:36:45.231390	dcb1fb50	0	0	0.0000	CRASH	gen=583 glyphs=4
2026-03-14T07:36:45.231595	7ede4765	0	0	0.0000	CRASH	gen=583 glyphs=2
2026-03-14T07:36:45.231795	62e3527e	0	0	0.0000	CRASH	gen=583 glyphs=2
2026-03-14T07:36:45.232091	099964a4	0	0	0.0000	CRASH	gen=584 glyphs=4
2026-03-14T07:36:45.232293	099964a4	0	0	0.0000	CRASH	gen=584 glyphs=4
2026-03-14T07:36:45.232487	099964a4	0	0	0.0000	CRASH	gen=584 glyphs=4
2026-03-14T07:36:45.232684	3a734398	0	0	0.0000	CRASH	gen=584 glyphs=4
2026-03-14T07:36:45.232881	46ee51ec	0	0	0.0000	CRASH	gen=584 glyphs=4
2026-03-14T07:36:45.233078	dcb1fb50	0	0	0.0000	CRASH	gen=584 glyphs=4
2026-03-14T07:36:45.233277	338c274d	0	0	0.0000	CRASH	gen=584 glyphs=4
2026-03-14T07:36:45.233471	318bdaab	0	0	0.0000	CRASH	gen=584 glyphs=4
2026-03-14T07:36:45.233668	099964a4	0	0	0.0000	CRASH	gen=584 glyphs=4
2026-03-14T07:36:45.233861	099964a4	0	0	0.0000	CRASH	gen=584 glyphs=4
2026-03-14T07:36:45.234133	099964a4	0	0	0.0000	CRASH	gen=585 glyphs=4
2026-03-14T07:36:45.234335	099964a4	0	0	0.0000	CRASH	gen=585 glyphs=4
2026-03-14T07:36:45.234532	22a7549d	0	0	0.0000	CRASH	gen=585 glyphs=4
2026-03-14T07:36:45.234729	9d113f03	0	0	0.0000	CRASH	gen=585 glyphs=3
2026-03-14T07:36:45.234920	099964a4	0	0	0.0000	CRASH	gen=585 glyphs=4
2026-03-14T07:36:45.235112	3ca14993	0	0	0.0000	CRASH	gen=585 glyphs=4
2026-03-14T07:36:45.235310	099964a4	0	0	0.0000	CRASH	gen=585 glyphs=4
2026-03-14T07:36:45.235503	099964a4	0	0	0.0000	CRASH	gen=585 glyphs=4
2026-03-14T07:36:45.235698	099964a4	0	0	0.0000	CRASH	gen=585 glyphs=4
2026-03-14T07:36:45.235890	80cef82b	0	0	0.0000	CRASH	gen=585 glyphs=4
2026-03-14T07:36:45.236164	099964a4	0	0	0.0000	CRASH	gen=586 glyphs=4
2026-03-14T07:36:45.236365	099964a4	0	0	0.0000	CRASH	gen=586 glyphs=4
2026-03-14T07:36:45.236562	5caa9115	0	0	0.0000	CRASH	gen=586 glyphs=4
2026-03-14T07:36:45.236758	099964a4	0	0	0.0000	CRASH	gen=586 glyphs=4
2026-03-14T07:36:45.236952	3ca14993	0	0	0.0000	CRASH	gen=586 glyphs=4
2026-03-14T07:36:45.237147	868989f1	0	0	0.0000	CRASH	gen=586 glyphs=4
2026-03-14T07:36:45.237342	099964a4	0	0	0.0000	CRASH	gen=586 glyphs=4
2026-03-14T07:36:45.237544	ff30496a	0	0	0.0000	CRASH	gen=586 glyphs=3
2026-03-14T07:36:45.237740	099964a4	0	0	0.0000	CRASH	gen=586 glyphs=4
2026-03-14T07:36:45.237932	099964a4	0	0	0.0000	CRASH	gen=586 glyphs=4
2026-03-14T07:36:45.238200	099964a4	0	0	0.0000	CRASH	gen=587 glyphs=4
2026-03-14T07:36:45.238395	099964a4	0	0	0.0000	CRASH	gen=587 glyphs=4
2026-03-14T07:36:45.238594	099964a4	0	0	0.0000	CRASH	gen=587 glyphs=4
2026-03-14T07:36:45.238786	099964a4	0	0	0.0000	CRASH	gen=587 glyphs=4
2026-03-14T07:36:45.238977	099964a4	0	0	0.0000	CRASH	gen=587 glyphs=4
2026-03-14T07:36:45.239168	099964a4	0	0	0.0000	CRASH	gen=587 glyphs=4
2026-03-14T07:36:45.239359	7ede4765	0	0	0.0000	CRASH	gen=587 glyphs=2
2026-03-14T07:36:45.239558	099964a4	0	0	0.0000	CRASH	gen=587 glyphs=4
2026-03-14T07:36:45.239753	fb032b97	0	0	0.0000	CRASH	gen=587 glyphs=4
2026-03-14T07:36:45.239949	099964a4	0	0	0.0000	CRASH	gen=587 glyphs=4
2026-03-14T07:36:45.240215	099964a4	0	0	0.0000	CRASH	gen=588 glyphs=4
2026-03-14T07:36:45.240412	099964a4	0	0	0.0000	CRASH	gen=588 glyphs=4
2026-03-14T07:36:45.240617	099964a4	0	0	0.0000	CRASH	gen=588 glyphs=4
2026-03-14T07:36:45.240813	099964a4	0	0	0.0000	CRASH	gen=588 glyphs=4
2026-03-14T07:36:45.241010	099964a4	0	0	0.0000	CRASH	gen=588 glyphs=4
2026-03-14T07:36:45.241204	099964a4	0	0	0.0000	CRASH	gen=588 glyphs=4
2026-03-14T07:36:45.241398	ff30496a	0	0	0.0000	CRASH	gen=588 glyphs=3
2026-03-14T07:36:45.241599	099964a4	0	0	0.0000	CRASH	gen=588 glyphs=4
2026-03-14T07:36:45.241795	80cef82b	0	0	0.0000	CRASH	gen=588 glyphs=4
2026-03-14T07:36:45.241991	099964a4	0	0	0.0000	CRASH	gen=588 glyphs=4
2026-03-14T07:36:45.242270	099964a4	0	0	0.0000	CRASH	gen=589 glyphs=4
2026-03-14T07:36:45.242468	099964a4	0	0	0.0000	CRASH	gen=589 glyphs=4
2026-03-14T07:36:45.242684	e99a5523	0	0	0.0000	CRASH	gen=589 glyphs=4
2026-03-14T07:36:45.242885	db66945f	0	0	0.0000	CRASH	gen=589 glyphs=4
2026-03-14T07:36:45.243080	521c65a6	0	0	0.0000	CRASH	gen=589 glyphs=4
2026-03-14T07:36:45.243275	099964a4	0	0	0.0000	CRASH	gen=589 glyphs=4
2026-03-14T07:36:45.243471	099964a4	0	0	0.0000	CRASH	gen=589 glyphs=4
2026-03-14T07:36:45.243668	099964a4	0	0	0.0000	CRASH	gen=589 glyphs=4
2026-03-14T07:36:45.243869	099964a4	0	0	0.0000	CRASH	gen=589 glyphs=4
2026-03-14T07:36:45.244062	099964a4	0	0	0.0000	CRASH	gen=589 glyphs=4
2026-03-14T07:36:45.244336	099964a4	0	0	0.0000	CRASH	gen=590 glyphs=4
2026-03-14T07:36:45.244533	099964a4	0	0	0.0000	CRASH	gen=590 glyphs=4
2026-03-14T07:36:45.244725	099964a4	0	0	0.0000	CRASH	gen=590 glyphs=4
2026-03-14T07:36:45.244920	099964a4	0	0	0.0000	CRASH	gen=590 glyphs=4
2026-03-14T07:36:45.245114	099964a4	0	0	0.0000	CRASH	gen=590 glyphs=4
2026-03-14T07:36:45.245308	099964a4	0	0	0.0000	CRASH	gen=590 glyphs=4
2026-03-14T07:36:45.245504	ff30496a	0	0	0.0000	CRASH	gen=590 glyphs=3
2026-03-14T07:36:45.245702	099964a4	0	0	0.0000	CRASH	gen=590 glyphs=4
2026-03-14T07:36:45.245900	dcb1fb50	0	0	0.0000	CRASH	gen=590 glyphs=4
2026-03-14T07:36:45.246101	d85a1173	0	0	0.0000	CRASH	gen=590 glyphs=4
2026-03-14T07:36:45.246380	099964a4	0	0	0.0000	CRASH	gen=591 glyphs=4
2026-03-14T07:36:45.246584	099964a4	0	0	0.0000	CRASH	gen=591 glyphs=4
2026-03-14T07:36:45.246783	3a734398	0	0	0.0000	CRASH	gen=591 glyphs=4
2026-03-14T07:36:45.246978	099964a4	0	0	0.0000	CRASH	gen=591 glyphs=4
2026-03-14T07:36:45.247177	80cef82b	0	0	0.0000	CRASH	gen=591 glyphs=4
2026-03-14T07:36:45.247374	099964a4	0	0	0.0000	CRASH	gen=591 glyphs=4
2026-03-14T07:36:45.247569	099964a4	0	0	0.0000	CRASH	gen=591 glyphs=4
2026-03-14T07:36:45.247762	099964a4	0	0	0.0000	CRASH	gen=591 glyphs=4
2026-03-14T07:36:45.247959	1459e61c	0	0	0.0000	CRASH	gen=591 glyphs=4
2026-03-14T07:36:45.248161	099964a4	0	0	0.0000	CRASH	gen=591 glyphs=4
2026-03-14T07:36:45.248440	099964a4	0	0	0.0000	CRASH	gen=592 glyphs=4
2026-03-14T07:36:45.248635	099964a4	0	0	0.0000	CRASH	gen=592 glyphs=4
2026-03-14T07:36:45.248828	11edcbf2	0	0	0.0000	CRASH	gen=592 glyphs=4
2026-03-14T07:36:45.249023	099964a4	0	0	0.0000	CRASH	gen=592 glyphs=4
2026-03-14T07:36:45.249219	099964a4	0	0	0.0000	CRASH	gen=592 glyphs=4
2026-03-14T07:36:45.249410	099964a4	0	0	0.0000	CRASH	gen=592 glyphs=4
2026-03-14T07:36:45.249603	8300d1be	0	0	0.0000	CRASH	gen=592 glyphs=3
2026-03-14T07:36:45.249796	97c12f6d	0	0	0.0000	CRASH	gen=592 glyphs=4
2026-03-14T07:36:45.249990	099964a4	0	0	0.0000	CRASH	gen=592 glyphs=4
2026-03-14T07:36:45.250180	099964a4	0	0	0.0000	CRASH	gen=592 glyphs=4
2026-03-14T07:36:45.250461	099964a4	0	0	0.0000	CRASH	gen=593 glyphs=4
2026-03-14T07:36:45.250661	099964a4	0	0	0.0000	CRASH	gen=593 glyphs=4
2026-03-14T07:36:45.250854	7ede4765	0	0	0.0000	CRASH	gen=593 glyphs=2
2026-03-14T07:36:45.251045	099964a4	0	0	0.0000	CRASH	gen=593 glyphs=4
2026-03-14T07:36:45.251236	099964a4	0	0	0.0000	CRASH	gen=593 glyphs=4
2026-03-14T07:36:45.251432	0182f018	0	0	0.0000	CRASH	gen=593 glyphs=4
2026-03-14T07:36:45.251627	099964a4	0	0	0.0000	CRASH	gen=593 glyphs=4
2026-03-14T07:36:45.251821	1c6cc0cb	0	0	0.0000	CRASH	gen=593 glyphs=4
2026-03-14T07:36:45.252018	099964a4	0	0	0.0000	CRASH	gen=593 glyphs=4
2026-03-14T07:36:45.252211	099964a4	0	0	0.0000	CRASH	gen=593 glyphs=4
2026-03-14T07:36:45.252482	099964a4	0	0	0.0000	CRASH	gen=594 glyphs=4
2026-03-14T07:36:45.252678	099964a4	0	0	0.0000	CRASH	gen=594 glyphs=4
2026-03-14T07:36:45.252871	558f964b	0	0	0.0000	CRASH	gen=594 glyphs=4
2026-03-14T07:36:45.253065	099964a4	0	0	0.0000	CRASH	gen=594 glyphs=4
2026-03-14T07:36:45.253257	3a734398	0	0	0.0000	CRASH	gen=594 glyphs=4
2026-03-14T07:36:45.253457	5390366d	0	0	0.0000	CRASH	gen=594 glyphs=4
2026-03-14T07:36:45.253654	cf93b656	0	0	0.0000	CRASH	gen=594 glyphs=3
2026-03-14T07:36:45.253847	099964a4	0	0	0.0000	CRASH	gen=594 glyphs=4
2026-03-14T07:36:45.254039	490d144e	0	0	0.0000	CRASH	gen=594 glyphs=4
2026-03-14T07:36:45.254234	099964a4	0	0	0.0000	CRASH	gen=594 glyphs=4
2026-03-14T07:36:45.254509	099964a4	0	0	0.0000	CRASH	gen=595 glyphs=4
2026-03-14T07:36:45.254709	099964a4	0	0	0.0000	CRASH	gen=595 glyphs=4
2026-03-14T07:36:45.254901	ff30496a	0	0	0.0000	CRASH	gen=595 glyphs=3
2026-03-14T07:36:45.255093	88ec5194	0	0	0.0000	CRASH	gen=595 glyphs=4
2026-03-14T07:36:45.255287	80cef82b	0	0	0.0000	CRASH	gen=595 glyphs=4
2026-03-14T07:36:45.255479	099964a4	0	0	0.0000	CRASH	gen=595 glyphs=4
2026-03-14T07:36:45.255678	3ca14993	0	0	0.0000	CRASH	gen=595 glyphs=4
2026-03-14T07:36:45.255869	099964a4	0	0	0.0000	CRASH	gen=595 glyphs=4
2026-03-14T07:36:45.256064	099964a4	0	0	0.0000	CRASH	gen=595 glyphs=4
2026-03-14T07:36:45.256257	3a734398	0	0	0.0000	CRASH	gen=595 glyphs=4
2026-03-14T07:36:45.256531	099964a4	0	0	0.0000	CRASH	gen=596 glyphs=4
2026-03-14T07:36:45.256728	099964a4	0	0	0.0000	CRASH	gen=596 glyphs=4
2026-03-14T07:36:45.256917	099964a4	0	0	0.0000	CRASH	gen=596 glyphs=4
2026-03-14T07:36:45.257107	099964a4	0	0	0.0000	CRASH	gen=596 glyphs=4
2026-03-14T07:36:45.257300	29e1a1f9	0	0	0.0000	CRASH	gen=596 glyphs=2
2026-03-14T07:36:45.257494	099964a4	0	0	0.0000	CRASH	gen=596 glyphs=4
2026-03-14T07:36:45.257689	099964a4	0	0	0.0000	CRASH	gen=596 glyphs=4
2026-03-14T07:36:45.257884	099964a4	0	0	0.0000	CRASH	gen=596 glyphs=4
2026-03-14T07:36:45.258078	099964a4	0	0	0.0000	CRASH	gen=596 glyphs=4
2026-03-14T07:36:45.258270	15278172	0	0	0.0000	CRASH	gen=596 glyphs=3
2026-03-14T07:36:45.258552	099964a4	0	0	0.0000	CRASH	gen=597 glyphs=4
2026-03-14T07:36:45.258748	099964a4	0	0	0.0000	CRASH	gen=597 glyphs=4
2026-03-14T07:36:45.258945	99520032	0	0	0.0000	CRASH	gen=597 glyphs=3
2026-03-14T07:36:45.259137	099964a4	0	0	0.0000	CRASH	gen=597 glyphs=4
2026-03-14T07:36:45.259332	099964a4	0	0	0.0000	CRASH	gen=597 glyphs=4
2026-03-14T07:36:45.259528	8da1f8d8	0	0	0.0000	CRASH	gen=597 glyphs=4
2026-03-14T07:36:45.259723	cc1e740c	0	0	0.0000	CRASH	gen=597 glyphs=4
2026-03-14T07:36:45.259921	099964a4	0	0	0.0000	CRASH	gen=597 glyphs=4
2026-03-14T07:36:45.260118	099964a4	0	0	0.0000	CRASH	gen=597 glyphs=4
2026-03-14T07:36:45.260312	099964a4	0	0	0.0000	CRASH	gen=597 glyphs=4
2026-03-14T07:36:45.260576	099964a4	0	0	0.0000	CRASH	gen=598 glyphs=4
2026-03-14T07:36:45.260769	099964a4	0	0	0.0000	CRASH	gen=598 glyphs=4
2026-03-14T07:36:45.260965	099964a4	0	0	0.0000	CRASH	gen=598 glyphs=4
2026-03-14T07:36:45.261159	099964a4	0	0	0.0000	CRASH	gen=598 glyphs=4
2026-03-14T07:36:45.261353	099964a4	0	0	0.0000	CRASH	gen=598 glyphs=4
2026-03-14T07:36:45.261548	099964a4	0	0	0.0000	CRASH	gen=598 glyphs=4
2026-03-14T07:36:45.261741	099964a4	0	0	0.0000	CRASH	gen=598 glyphs=4
2026-03-14T07:36:45.261933	099964a4	0	0	0.0000	CRASH	gen=598 glyphs=4
2026-03-14T07:36:45.262127	80cef82b	0	0	0.0000	CRASH	gen=598 glyphs=4
2026-03-14T07:36:45.262320	099964a4	0	0	0.0000	CRASH	gen=598 glyphs=4
2026-03-14T07:36:45.262588	099964a4	0	0	0.0000	CRASH	gen=599 glyphs=4
2026-03-14T07:36:45.262781	099964a4	0	0	0.0000	CRASH	gen=599 glyphs=4
2026-03-14T07:36:45.262974	dcb1fb50	0	0	0.0000	CRASH	gen=599 glyphs=4
2026-03-14T07:36:45.263169	ff30496a	0	0	0.0000	CRASH	gen=599 glyphs=3
2026-03-14T07:36:45.263361	ff30496a	0	0	0.0000	CRASH	gen=599 glyphs=3
2026-03-14T07:36:45.263554	099964a4	0	0	0.0000	CRASH	gen=599 glyphs=4
2026-03-14T07:36:45.263746	80c14d94	0	0	0.0000	CRASH	gen=599 glyphs=4
2026-03-14T07:36:45.263938	099964a4	0	0	0.0000	CRASH	gen=599 glyphs=4
2026-03-14T07:36:45.264139	099964a4	0	0	0.0000	CRASH	gen=599 glyphs=4
2026-03-14T07:36:45.264331	099964a4	0	0	0.0000	CRASH	gen=599 glyphs=4
2026-03-14T07:36:45.264614	099964a4	0	0	0.0000	CRASH	gen=600 glyphs=4
2026-03-14T07:36:45.264809	099964a4	0	0	0.0000	CRASH	gen=600 glyphs=4
2026-03-14T07:36:45.265002	ae4ff189	0	0	0.0000	CRASH	gen=600 glyphs=4
2026-03-14T07:36:45.265199	ab1c2952	0	0	0.0000	CRASH	gen=600 glyphs=3
2026-03-14T07:36:45.265393	099964a4	0	0	0.0000	CRASH	gen=600 glyphs=4
2026-03-14T07:36:45.265587	065e9a4f	0	0	0.0000	CRASH	gen=600 glyphs=4
2026-03-14T07:36:45.265782	099964a4	0	0	0.0000	CRASH	gen=600 glyphs=4
2026-03-14T07:36:45.265974	7ede4765	0	0	0.0000	CRASH	gen=600 glyphs=2
2026-03-14T07:36:45.266165	115da430	0	0	0.0000	CRASH	gen=600 glyphs=4
2026-03-14T07:36:45.266359	7c10bfa1	0	0	0.0000	CRASH	gen=600 glyphs=3
2026-03-14T07:36:45.266637	099964a4	0	0	0.0000	CRASH	gen=601 glyphs=4
2026-03-14T07:36:45.266831	099964a4	0	0	0.0000	CRASH	gen=601 glyphs=4
2026-03-14T07:36:45.267025	dcb1fb50	0	0	0.0000	CRASH	gen=601 glyphs=4
2026-03-14T07:36:45.267218	3a734398	0	0	0.0000	CRASH	gen=601 glyphs=4
2026-03-14T07:36:45.267414	3ca14993	0	0	0.0000	CRASH	gen=601 glyphs=4
2026-03-14T07:36:45.267610	adb502ae	0	0	0.0000	CRASH	gen=601 glyphs=4
2026-03-14T07:36:45.267803	099964a4	0	0	0.0000	CRASH	gen=601 glyphs=4
2026-03-14T07:36:45.267994	099964a4	0	0	0.0000	CRASH	gen=601 glyphs=4
2026-03-14T07:36:45.268187	ff30496a	0	0	0.0000	CRASH	gen=601 glyphs=3
2026-03-14T07:36:45.268381	099964a4	0	0	0.0000	CRASH	gen=601 glyphs=4
2026-03-14T07:36:45.268659	099964a4	0	0	0.0000	CRASH	gen=602 glyphs=4
2026-03-14T07:36:45.268852	099964a4	0	0	0.0000	CRASH	gen=602 glyphs=4
2026-03-14T07:36:45.269046	5b83059e	0	0	0.0000	CRASH	gen=602 glyphs=3
2026-03-14T07:36:45.269237	8da1f8d8	0	0	0.0000	CRASH	gen=602 glyphs=4
2026-03-14T07:36:45.269434	dcb1fb50	0	0	0.0000	CRASH	gen=602 glyphs=4
2026-03-14T07:36:45.269629	0f7cadd8	0	0	0.0000	CRASH	gen=602 glyphs=4
2026-03-14T07:36:45.269823	51a04fa8	0	0	0.0000	CRASH	gen=602 glyphs=5
2026-03-14T07:36:45.270018	7d2d19c4	0	0	0.0000	CRASH	gen=602 glyphs=5
2026-03-14T07:36:45.270212	099964a4	0	0	0.0000	CRASH	gen=602 glyphs=4
2026-03-14T07:36:45.270401	099964a4	0	0	0.0000	CRASH	gen=602 glyphs=4
2026-03-14T07:36:45.270682	099964a4	0	0	0.0000	CRASH	gen=603 glyphs=4
2026-03-14T07:36:45.270876	099964a4	0	0	0.0000	CRASH	gen=603 glyphs=4
2026-03-14T07:36:45.271070	7ede4765	0	0	0.0000	CRASH	gen=603 glyphs=2
2026-03-14T07:36:45.271265	7156fe5b	0	0	0.0000	CRASH	gen=603 glyphs=2
2026-03-14T07:36:45.271460	099964a4	0	0	0.0000	CRASH	gen=603 glyphs=4
2026-03-14T07:36:45.271657	6a4f418e	0	0	0.0000	CRASH	gen=603 glyphs=4
2026-03-14T07:36:45.271853	099964a4	0	0	0.0000	CRASH	gen=603 glyphs=4
2026-03-14T07:36:45.272043	099964a4	0	0	0.0000	CRASH	gen=603 glyphs=4
2026-03-14T07:36:45.272239	099964a4	0	0	0.0000	CRASH	gen=603 glyphs=4
2026-03-14T07:36:45.272431	099964a4	0	0	0.0000	CRASH	gen=603 glyphs=4
2026-03-14T07:36:45.272714	099964a4	0	0	0.0000	CRASH	gen=604 glyphs=4
2026-03-14T07:36:45.272907	099964a4	0	0	0.0000	CRASH	gen=604 glyphs=4
2026-03-14T07:36:45.273099	099964a4	0	0	0.0000	CRASH	gen=604 glyphs=4
2026-03-14T07:36:45.273293	099964a4	0	0	0.0000	CRASH	gen=604 glyphs=4
2026-03-14T07:36:45.273484	c433c4d8	0	0	0.0000	CRASH	gen=604 glyphs=4
2026-03-14T07:36:45.273683	3a734398	0	0	0.0000	CRASH	gen=604 glyphs=4
2026-03-14T07:36:45.273876	099964a4	0	0	0.0000	CRASH	gen=604 glyphs=4
2026-03-14T07:36:45.274073	099964a4	0	0	0.0000	CRASH	gen=604 glyphs=4
2026-03-14T07:36:45.274267	099964a4	0	0	0.0000	CRASH	gen=604 glyphs=4
2026-03-14T07:36:45.274458	099964a4	0	0	0.0000	CRASH	gen=604 glyphs=4
2026-03-14T07:36:45.274743	099964a4	0	0	0.0000	CRASH	gen=605 glyphs=4
2026-03-14T07:36:45.274941	099964a4	0	0	0.0000	CRASH	gen=605 glyphs=4
2026-03-14T07:36:45.275136	3a734398	0	0	0.0000	CRASH	gen=605 glyphs=4
2026-03-14T07:36:45.275328	7ede4765	0	0	0.0000	CRASH	gen=605 glyphs=2
2026-03-14T07:36:45.275523	68a8f049	0	0	0.0000	CRASH	gen=605 glyphs=4
2026-03-14T07:36:45.275715	dce9b137	0	0	0.0000	CRASH	gen=605 glyphs=4
2026-03-14T07:36:45.275911	34333fac	0	0	0.0000	CRASH	gen=605 glyphs=4
2026-03-14T07:36:45.276104	099964a4	0	0	0.0000	CRASH	gen=605 glyphs=4
2026-03-14T07:36:45.276299	099964a4	0	0	0.0000	CRASH	gen=605 glyphs=4
2026-03-14T07:36:45.276494	099964a4	0	0	0.0000	CRASH	gen=605 glyphs=4
2026-03-14T07:36:45.276775	099964a4	0	0	0.0000	CRASH	gen=606 glyphs=4
2026-03-14T07:36:45.276975	099964a4	0	0	0.0000	CRASH	gen=606 glyphs=4
2026-03-14T07:36:45.277170	099964a4	0	0	0.0000	CRASH	gen=606 glyphs=4
2026-03-14T07:36:45.277363	ad6da778	0	0	0.0000	CRASH	gen=606 glyphs=4
2026-03-14T07:36:45.277564	b86bd4db	0	0	0.0000	CRASH	gen=606 glyphs=2
2026-03-14T07:36:45.277763	757e0972	0	0	0.0000	CRASH	gen=606 glyphs=5
2026-03-14T07:36:45.277965	7ede4765	0	0	0.0000	CRASH	gen=606 glyphs=2
2026-03-14T07:36:45.278159	cbea4fcd	0	0	0.0000	CRASH	gen=606 glyphs=3
2026-03-14T07:36:45.278355	cf93b656	0	0	0.0000	CRASH	gen=606 glyphs=3
2026-03-14T07:36:45.278551	7ede4765	0	0	0.0000	CRASH	gen=606 glyphs=2
2026-03-14T07:36:45.278833	099964a4	0	0	0.0000	CRASH	gen=607 glyphs=4
2026-03-14T07:36:45.279036	099964a4	0	0	0.0000	CRASH	gen=607 glyphs=4
2026-03-14T07:36:45.279235	3aa6b1e6	0	0	0.0000	CRASH	gen=607 glyphs=3
2026-03-14T07:36:45.279434	ce5525b9	0	0	0.0000	CRASH	gen=607 glyphs=3
2026-03-14T07:36:45.279635	5704b3f8	0	0	0.0000	CRASH	gen=607 glyphs=4
2026-03-14T07:36:45.279834	b2da7c80	0	0	0.0000	CRASH	gen=607 glyphs=4
2026-03-14T07:36:45.280040	099964a4	0	0	0.0000	CRASH	gen=607 glyphs=4
