timestamp	program_hash	spirv_size	word_count	fitness	status	description
2026-03-14T03:41:43.272664	d911f93d	120	30	0.9500	DISCARD	gen=709 glyphs=4
2026-03-14T03:41:43.599188	cbc2e23f	116	29	0.9500	DISCARD	gen=753 glyphs=4
2026-03-14T03:41:46.027347	fdb5d108	120	30	1.0000	DISCARD	gen=709 glyphs=4
2026-03-14T03:41:46.300401	eca7ab6c	116	29	1.0000	DISCARD	gen=753 glyphs=4
2026-03-14T03:41:48.698786	fdb5d108	120	30	1.0000	DISCARD	gen=709 glyphs=4
2026-03-14T03:41:48.968739	9e2fa8de	116	29	1.0000	DISCARD	gen=753 glyphs=4
2026-03-14T03:41:51.398486	02e944fd	116	29	1.0000	DISCARD	gen=709 glyphs=4
2026-03-14T03:41:51.668947	4a5f3d08	116	29	1.0000	DISCARD	gen=753 glyphs=4
2026-03-14T03:41:54.094370	71e2ba66	116	29	1.0000	DISCARD	gen=709 glyphs=4
2026-03-14T03:41:54.363557	19355583	120	30	1.0000	DISCARD	gen=753 glyphs=4
2026-03-14T03:41:56.757780	37f4017b	116	29	1.0000	DISCARD	gen=710 glyphs=4
2026-03-14T03:41:57.029911	ae44ace5	116	29	1.0000	DISCARD	gen=753 glyphs=4
2026-03-14T03:41:59.440855	bfdf7cad	120	30	1.0000	DISCARD	gen=710 glyphs=4
2026-03-14T03:41:59.706246	19355583	120	30	1.0000	DISCARD	gen=754 glyphs=4
2026-03-14T03:42:02.130626	37f4017b	116	29	1.0000	DISCARD	gen=710 glyphs=4
2026-03-14T03:42:02.394331	8aef8872	116	29	1.0000	DISCARD	gen=754 glyphs=4
2026-03-14T03:42:04.810803	7ca87b42	116	29	1.0000	DISCARD	gen=710 glyphs=4
2026-03-14T03:42:05.079123	b7aed8e9	116	29	1.0000	DISCARD	gen=754 glyphs=4
2026-03-14T03:42:07.507648	37f4017b	116	29	1.0000	DISCARD	gen=710 glyphs=4
2026-03-14T03:42:07.770067	875e0f8a	116	29	1.0000	DISCARD	gen=754 glyphs=4
2026-03-14T03:42:10.212298	aacb6617	116	29	1.0000	DISCARD	gen=710 glyphs=4
2026-03-14T03:42:10.485071	f79d6015	116	29	0.9500	DISCARD	gen=754 glyphs=4
2026-03-14T03:42:12.896063	bfdf7cad	120	30	1.0000	DISCARD	gen=710 glyphs=4
2026-03-14T03:42:13.166981	e2cd28ea	120	30	1.0000	DISCARD	gen=754 glyphs=4
2026-03-14T03:42:15.640967	37f4017b	116	29	1.0000	DISCARD	gen=710 glyphs=4
2026-03-14T03:42:15.927144	36e6fb9e	116	29	1.0000	DISCARD	gen=754 glyphs=4
2026-03-14T03:42:18.377537	9973b158	116	29	1.0000	DISCARD	gen=710 glyphs=4
2026-03-14T03:42:18.641446	50dc991d	116	29	1.0000	DISCARD	gen=754 glyphs=4
2026-03-14T03:42:21.048713	bfdf7cad	120	30	1.0000	DISCARD	gen=710 glyphs=4
2026-03-14T03:42:21.318637	7bc2fae0	120	30	1.0000	DISCARD	gen=754 glyphs=4
2026-03-14T03:42:23.757284	37f4017b	116	29	1.0000	DISCARD	gen=711 glyphs=4
2026-03-14T03:42:24.025435	875e0f8a	116	29	1.0000	DISCARD	gen=754 glyphs=4
2026-03-14T03:42:26.474363	bfdf7cad	120	30	1.0000	DISCARD	gen=711 glyphs=4
2026-03-14T03:42:26.749341	19355583	120	30	1.0000	DISCARD	gen=755 glyphs=4
2026-03-14T03:42:29.159411	5a06ca32	120	30	1.0000	DISCARD	gen=711 glyphs=4
2026-03-14T03:42:29.423733	8aef8872	116	29	1.0000	DISCARD	gen=755 glyphs=4
2026-03-14T03:42:31.871244	5a06ca32	120	30	1.0000	DISCARD	gen=711 glyphs=4
2026-03-14T03:42:32.152695	8aef8872	116	29	1.0000	DISCARD	gen=755 glyphs=4
2026-03-14T03:42:34.589412	fdb5d108	120	30	1.0000	DISCARD	gen=711 glyphs=4
2026-03-14T03:42:34.864959	671eaa82	116	29	1.0000	DISCARD	gen=755 glyphs=4
2026-03-14T03:42:37.255025	7ca87b42	116	29	1.0000	DISCARD	gen=711 glyphs=4
2026-03-14T03:42:37.524716	916049f8	116	29	1.0000	DISCARD	gen=755 glyphs=4
2026-03-14T03:42:39.961618	37f4017b	116	29	1.0000	DISCARD	gen=711 glyphs=4
2026-03-14T03:42:40.242644	b0c911d9	116	29	1.0000	DISCARD	gen=755 glyphs=4
2026-03-14T03:42:42.684436	d11c1062	120	30	1.0000	DISCARD	gen=711 glyphs=4
2026-03-14T03:42:42.950085	18cdfd5f	120	30	1.0000	DISCARD	gen=755 glyphs=4
2026-03-14T03:42:45.384606	bfdf7cad	120	30	1.0000	DISCARD	gen=711 glyphs=4
2026-03-14T03:42:45.651380	0eaedb57	116	29	1.0000	DISCARD	gen=755 glyphs=4
2026-03-14T03:42:48.180321	5a06ca32	120	30	1.0000	DISCARD	gen=711 glyphs=4
2026-03-14T03:42:48.441024	9e34ede0	116	29	1.0000	DISCARD	gen=755 glyphs=4
2026-03-14T03:42:50.846302	37f4017b	116	29	1.0000	DISCARD	gen=712 glyphs=4
2026-03-14T03:42:51.130267	0eaedb57	116	29	1.0000	DISCARD	gen=755 glyphs=4
2026-03-14T03:42:53.549065	bfdf7cad	120	30	1.0000	DISCARD	gen=712 glyphs=4
2026-03-14T03:42:53.826397	19355583	120	30	1.0000	DISCARD	gen=756 glyphs=4
2026-03-14T03:42:56.254575	5b9807ac	120	30	1.0000	DISCARD	gen=712 glyphs=4
2026-03-14T03:42:56.519917	8aef8872	116	29	1.0000	DISCARD	gen=756 glyphs=4
2026-03-14T03:42:58.953345	0d996faf	120	30	1.0000	DISCARD	gen=712 glyphs=4
2026-03-14T03:42:59.221514	a1a10bbd	116	29	1.0000	DISCARD	gen=756 glyphs=4
2026-03-14T03:43:01.647627	2701cb73	116	29	1.0000	DISCARD	gen=712 glyphs=4
2026-03-14T03:43:01.921038	ae44ace5	116	29	1.0000	DISCARD	gen=756 glyphs=4
2026-03-14T03:43:04.326645	5b9807ac	120	30	1.0000	DISCARD	gen=712 glyphs=4
2026-03-14T03:43:04.592067	67cb81be	120	30	1.0000	DISCARD	gen=756 glyphs=4
2026-03-14T03:43:06.999889	5a06ca32	120	30	1.0000	DISCARD	gen=712 glyphs=4
2026-03-14T03:43:07.273112	a9043b94	116	29	1.0000	DISCARD	gen=756 glyphs=4
2026-03-14T03:43:09.675650	12b38c2d	116	29	1.0000	DISCARD	gen=712 glyphs=4
2026-03-14T03:43:09.946148	19355583	120	30	1.0000	DISCARD	gen=756 glyphs=4
2026-03-14T03:43:12.392782	7ca87b42	116	29	1.0000	DISCARD	gen=712 glyphs=4
2026-03-14T03:43:12.655830	8aef8872	116	29	1.0000	DISCARD	gen=756 glyphs=4
2026-03-14T03:43:15.076980	37f4017b	116	29	1.0000	DISCARD	gen=712 glyphs=4
2026-03-14T03:43:15.351578	e2cd28ea	120	30	1.0000	DISCARD	gen=756 glyphs=4
2026-03-14T03:43:17.748952	37f4017b	116	29	1.0000	DISCARD	gen=713 glyphs=4
2026-03-14T03:43:18.014054	d7c8681b	120	30	1.0000	DISCARD	gen=756 glyphs=4
2026-03-14T03:43:20.508863	bfdf7cad	120	30	1.0000	DISCARD	gen=713 glyphs=4
2026-03-14T03:43:20.776910	19355583	120	30	1.0000	DISCARD	gen=757 glyphs=4
2026-03-14T03:43:23.188019	bfdf7cad	120	30	1.0000	DISCARD	gen=713 glyphs=4
2026-03-14T03:43:23.453559	8aef8872	116	29	1.0000	DISCARD	gen=757 glyphs=4
2026-03-14T03:43:25.852633	37f4017b	116	29	1.0000	DISCARD	gen=713 glyphs=4
2026-03-14T03:43:26.119200	8aef8872	116	29	1.0000	DISCARD	gen=757 glyphs=4
2026-03-14T03:43:28.528319	5a06ca32	120	30	1.0000	DISCARD	gen=713 glyphs=4
2026-03-14T03:43:28.798443	67cb81be	120	30	1.0000	DISCARD	gen=757 glyphs=4
2026-03-14T03:43:31.196906	0dec5331	120	30	1.0000	DISCARD	gen=713 glyphs=4
2026-03-14T03:43:31.460923	875e0f8a	116	29	1.0000	DISCARD	gen=757 glyphs=4
2026-03-14T03:43:33.871668	5b9807ac	120	30	1.0000	DISCARD	gen=713 glyphs=4
2026-03-14T03:43:34.125931	875e0f8a	116	29	1.0000	DISCARD	gen=757 glyphs=4
2026-03-14T03:43:36.536021	bfdf7cad	120	30	1.0000	DISCARD	gen=713 glyphs=4
2026-03-14T03:43:36.794156	0eaedb57	116	29	1.0000	DISCARD	gen=757 glyphs=4
2026-03-14T03:43:39.183778	55d6c151	120	30	1.0000	DISCARD	gen=713 glyphs=4
2026-03-14T03:43:39.442819	0eaedb57	116	29	1.0000	DISCARD	gen=757 glyphs=4
2026-03-14T03:43:41.860066	37f4017b	116	29	1.0000	DISCARD	gen=713 glyphs=4
2026-03-14T03:43:42.130483	8e905063	116	29	0.9500	DISCARD	gen=757 glyphs=4
2026-03-14T03:43:44.546169	37f4017b	116	29	1.0000	DISCARD	gen=714 glyphs=4
2026-03-14T03:43:44.820612	6c6eaf19	120	30	1.0000	DISCARD	gen=757 glyphs=4
2026-03-14T03:43:47.245041	bfdf7cad	120	30	1.0000	DISCARD	gen=714 glyphs=4
2026-03-14T03:43:47.518967	19355583	120	30	1.0000	DISCARD	gen=758 glyphs=4
2026-03-14T03:43:49.949571	a1cf87c8	116	29	1.0000	DISCARD	gen=714 glyphs=4
2026-03-14T03:43:50.208095	8aef8872	116	29	1.0000	DISCARD	gen=758 glyphs=4
2026-03-14T03:43:52.708109	5a06ca32	120	30	1.0000	DISCARD	gen=714 glyphs=4
2026-03-14T03:43:52.990485	0eaedb57	116	29	1.0000	DISCARD	gen=758 glyphs=4
2026-03-14T03:43:55.396876	ab481f82	120	30	1.0000	DISCARD	gen=714 glyphs=4
2026-03-14T03:43:55.658476	1e5f0e21	116	29	1.0000	DISCARD	gen=758 glyphs=4
2026-03-14T03:43:58.094265	d11c1062	120	30	1.0000	DISCARD	gen=714 glyphs=4
2026-03-14T03:43:58.361265	e2cd28ea	120	30	1.0000	DISCARD	gen=758 glyphs=4
2026-03-14T03:44:00.773816	5a06ca32	120	30	1.0000	DISCARD	gen=714 glyphs=4
2026-03-14T03:44:01.048072	19355583	120	30	1.0000	DISCARD	gen=758 glyphs=4
2026-03-14T03:44:03.447923	1d34459a	116	29	1.0000	DISCARD	gen=714 glyphs=4
2026-03-14T03:44:03.715320	19355583	120	30	1.0000	DISCARD	gen=758 glyphs=4
2026-03-14T03:44:06.157826	5a06ca32	120	30	1.0000	DISCARD	gen=714 glyphs=4
2026-03-14T03:44:06.428423	b57e7176	120	30	1.0000	DISCARD	gen=758 glyphs=4
2026-03-14T03:44:08.832636	37f4017b	116	29	1.0000	DISCARD	gen=714 glyphs=4
2026-03-14T03:44:09.105864	ddb25296	120	30	1.0000	DISCARD	gen=758 glyphs=4
2026-03-14T03:44:11.510386	37f4017b	116	29	1.0000	DISCARD	gen=715 glyphs=4
2026-03-14T03:44:11.777796	b7aed8e9	116	29	1.0000	DISCARD	gen=758 glyphs=4
2026-03-14T03:44:14.205042	bfdf7cad	120	30	1.0000	DISCARD	gen=715 glyphs=4
2026-03-14T03:44:14.468831	19355583	120	30	1.0000	DISCARD	gen=759 glyphs=4
2026-03-14T03:44:16.870740	24f2d59d	116	29	1.0000	DISCARD	gen=715 glyphs=4
2026-03-14T03:44:17.146354	8aef8872	116	29	1.0000	DISCARD	gen=759 glyphs=4
2026-03-14T03:44:19.576751	37f4017b	116	29	1.0000	DISCARD	gen=715 glyphs=4
2026-03-14T03:44:19.848120	050862ad	120	30	1.0000	DISCARD	gen=759 glyphs=4
2026-03-14T03:44:22.255607	37f4017b	116	29	1.0000	DISCARD	gen=715 glyphs=4
2026-03-14T03:44:22.556697	19355583	120	30	1.0000	DISCARD	gen=759 glyphs=4
2026-03-14T03:44:25.012650	422864de	120	30	1.0000	DISCARD	gen=715 glyphs=4
2026-03-14T03:44:25.277462	b7aed8e9	116	29	1.0000	DISCARD	gen=759 glyphs=4
2026-03-14T03:44:27.681417	5a06ca32	120	30	1.0000	DISCARD	gen=715 glyphs=4
2026-03-14T03:44:27.956154	19355583	120	30	1.0000	DISCARD	gen=759 glyphs=4
2026-03-14T03:44:30.363345	37f4017b	116	29	1.0000	DISCARD	gen=715 glyphs=4
2026-03-14T03:44:30.635045	8aef8872	116	29	1.0000	DISCARD	gen=759 glyphs=4
2026-03-14T03:44:33.040191	c6110c3f	116	29	1.0000	DISCARD	gen=715 glyphs=4
2026-03-14T03:44:33.295132	e8c7f6cf	120	30	1.0000	DISCARD	gen=759 glyphs=4
2026-03-14T03:44:35.679624	37f4017b	116	29	1.0000	DISCARD	gen=715 glyphs=4
2026-03-14T03:44:35.948350	9e34ede0	116	29	1.0000	DISCARD	gen=759 glyphs=4
2026-03-14T03:44:38.382057	37f4017b	116	29	1.0000	DISCARD	gen=716 glyphs=4
2026-03-14T03:44:38.649251	875e0f8a	116	29	1.0000	DISCARD	gen=759 glyphs=4
2026-03-14T03:44:41.051621	bfdf7cad	120	30	1.0000	DISCARD	gen=716 glyphs=4
2026-03-14T03:44:41.328187	19355583	120	30	1.0000	DISCARD	gen=760 glyphs=4
2026-03-14T03:44:43.755469	5b9807ac	120	30	1.0000	DISCARD	gen=716 glyphs=4
2026-03-14T03:44:44.019644	8aef8872	116	29	1.0000	DISCARD	gen=760 glyphs=4
2026-03-14T03:44:46.433793	4c9b0dd4	120	30	1.0000	DISCARD	gen=716 glyphs=4
2026-03-14T03:44:46.706324	c1e8cb1e	120	30	1.0000	DISCARD	gen=760 glyphs=4
2026-03-14T03:44:49.135700	37f4017b	116	29	1.0000	DISCARD	gen=716 glyphs=4
2026-03-14T03:44:49.401982	b93449c3	120	30	1.0000	DISCARD	gen=760 glyphs=4
2026-03-14T03:44:51.818425	5a06ca32	120	30	1.0000	DISCARD	gen=716 glyphs=4
2026-03-14T03:44:52.075667	ae44ace5	116	29	1.0000	DISCARD	gen=760 glyphs=4
2026-03-14T03:44:54.544653	e34431f3	116	29	1.0000	DISCARD	gen=716 glyphs=4
2026-03-14T03:44:54.811689	0eaedb57	116	29	1.0000	DISCARD	gen=760 glyphs=4
2026-03-14T03:44:57.281648	5a06ca32	120	30	1.0000	DISCARD	gen=716 glyphs=4
2026-03-14T03:44:57.546656	9aaf17b4	120	30	1.0000	DISCARD	gen=760 glyphs=4
2026-03-14T03:44:59.946591	37f4017b	116	29	1.0000	DISCARD	gen=716 glyphs=4
2026-03-14T03:45:00.213703	19c3e5da	116	29	1.0000	DISCARD	gen=760 glyphs=4
2026-03-14T03:45:02.664431	55d6c151	120	30	1.0000	DISCARD	gen=716 glyphs=4
2026-03-14T03:45:02.922990	de050466	116	29	1.0000	DISCARD	gen=760 glyphs=4
2026-03-14T03:45:05.364504	37f4017b	116	29	1.0000	DISCARD	gen=717 glyphs=4
2026-03-14T03:45:05.640111	70da0cc6	116	29	0.9500	DISCARD	gen=760 glyphs=4
2026-03-14T03:45:08.076348	bfdf7cad	120	30	1.0000	DISCARD	gen=717 glyphs=4
2026-03-14T03:45:08.345427	19355583	120	30	1.0000	DISCARD	gen=761 glyphs=4
2026-03-14T03:45:10.789507	37f4017b	116	29	1.0000	DISCARD	gen=717 glyphs=4
2026-03-14T03:45:11.073347	8aef8872	116	29	1.0000	DISCARD	gen=761 glyphs=4
2026-03-14T03:45:13.492864	5b9807ac	120	30	1.0000	DISCARD	gen=717 glyphs=4
2026-03-14T03:45:13.757536	67cb81be	120	30	1.0000	DISCARD	gen=761 glyphs=4
2026-03-14T03:45:16.182324	37f4017b	116	29	1.0000	DISCARD	gen=717 glyphs=4
2026-03-14T03:45:16.454086	8aef8872	116	29	1.0000	DISCARD	gen=761 glyphs=4
2026-03-14T03:45:18.878874	7ca87b42	116	29	1.0000	DISCARD	gen=717 glyphs=4
2026-03-14T03:45:19.147715	b8844960	116	29	1.0000	DISCARD	gen=761 glyphs=4
2026-03-14T03:45:21.583908	6aa7548a	116	29	1.0000	DISCARD	gen=717 glyphs=4
2026-03-14T03:45:21.867543	f65b2170	116	29	1.0000	DISCARD	gen=761 glyphs=4
2026-03-14T03:45:24.294214	5a06ca32	120	30	1.0000	DISCARD	gen=717 glyphs=4
2026-03-14T03:45:24.560785	9afbd104	116	29	1.0000	DISCARD	gen=761 glyphs=4
2026-03-14T03:45:27.079735	8657dd42	116	29	0.9500	DISCARD	gen=717 glyphs=4
2026-03-14T03:45:27.359428	31a1abe3	120	30	1.0000	DISCARD	gen=761 glyphs=4
2026-03-14T03:45:29.804523	5a06ca32	120	30	1.0000	DISCARD	gen=717 glyphs=4
2026-03-14T03:45:30.074500	0eaedb57	116	29	1.0000	DISCARD	gen=761 glyphs=4
2026-03-14T03:45:32.537792	37f4017b	116	29	1.0000	DISCARD	gen=718 glyphs=4
2026-03-14T03:45:32.813040	d7c8681b	120	30	1.0000	DISCARD	gen=761 glyphs=4
2026-03-14T03:45:35.224725	bfdf7cad	120	30	1.0000	DISCARD	gen=718 glyphs=4
2026-03-14T03:45:35.493115	19355583	120	30	1.0000	DISCARD	gen=762 glyphs=4
2026-03-14T03:45:37.913389	a5d70568	116	29	1.0000	DISCARD	gen=718 glyphs=4
2026-03-14T03:45:38.174513	8aef8872	116	29	1.0000	DISCARD	gen=762 glyphs=4
2026-03-14T03:45:40.629686	bfdf7cad	120	30	1.0000	DISCARD	gen=718 glyphs=4
2026-03-14T03:45:40.891797	0eaedb57	116	29	1.0000	DISCARD	gen=762 glyphs=4
2026-03-14T03:45:43.348572	55d6c151	120	30	1.0000	DISCARD	gen=718 glyphs=4
2026-03-14T03:45:43.631451	67cb81be	120	30	1.0000	DISCARD	gen=762 glyphs=4
2026-03-14T03:45:46.072398	5b9807ac	120	30	1.0000	DISCARD	gen=718 glyphs=4
2026-03-14T03:45:46.343512	8aef8872	116	29	1.0000	DISCARD	gen=762 glyphs=4
2026-03-14T03:45:48.769674	12b38c2d	116	29	1.0000	DISCARD	gen=718 glyphs=4
2026-03-14T03:45:49.049269	50dc991d	116	29	1.0000	DISCARD	gen=762 glyphs=4
2026-03-14T07:36:44.029142	099964a4	0	0	0.0000	CRASH	gen=0 glyphs=4
2026-03-14T07:36:44.029420	099964a4	0	0	0.0000	CRASH	gen=0 glyphs=4
2026-03-14T07:36:44.029640	7b113f67	0	0	0.0000	CRASH	gen=0 glyphs=3
2026-03-14T07:36:44.029849	099964a4	0	0	0.0000	CRASH	gen=0 glyphs=4
2026-03-14T07:36:44.030055	099964a4	0	0	0.0000	CRASH	gen=0 glyphs=4
2026-03-14T07:36:44.030261	099964a4	0	0	0.0000	CRASH	gen=0 glyphs=4
2026-03-14T07:36:44.030461	099964a4	0	0	0.0000	CRASH	gen=0 glyphs=4
2026-03-14T07:36:44.030660	c5f7b243	0	0	0.0000	CRASH	gen=0 glyphs=4
2026-03-14T07:36:44.030856	c1b7a93e	0	0	0.0000	CRASH	gen=0 glyphs=3
2026-03-14T07:36:44.031060	0b891026	0	0	0.0000	CRASH	gen=0 glyphs=4
2026-03-14T07:36:44.031392	099964a4	0	0	0.0000	CRASH	gen=1 glyphs=4
2026-03-14T07:36:44.031593	099964a4	0	0	0.0000	CRASH	gen=1 glyphs=4
2026-03-14T07:36:44.031790	93587a1f	0	0	0.0000	CRASH	gen=1 glyphs=4
2026-03-14T07:36:44.031984	ff30496a	0	0	0.0000	CRASH	gen=1 glyphs=3
2026-03-14T07:36:44.032178	099964a4	0	0	0.0000	CRASH	gen=1 glyphs=4
2026-03-14T07:36:44.032379	099964a4	0	0	0.0000	CRASH	gen=1 glyphs=4
2026-03-14T07:36:44.032577	cb30b341	0	0	0.0000	CRASH	gen=1 glyphs=3
2026-03-14T07:36:44.032770	099964a4	0	0	0.0000	CRASH	gen=1 glyphs=4
2026-03-14T07:36:44.032961	099964a4	0	0	0.0000	CRASH	gen=1 glyphs=4
2026-03-14T07:36:44.033150	80cef82b	0	0	0.0000	CRASH	gen=1 glyphs=4
2026-03-14T07:36:44.033437	099964a4	0	0	0.0000	CRASH	gen=2 glyphs=4
2026-03-14T07:36:44.033634	099964a4	0	0	0.0000	CRASH	gen=2 glyphs=4
2026-03-14T07:36:44.033827	099964a4	0	0	0.0000	CRASH	gen=2 glyphs=4
2026-03-14T07:36:44.034018	700606fb	0	0	0.0000	CRASH	gen=2 glyphs=3
2026-03-14T07:36:44.034209	0cf61838	0	0	0.0000	CRASH	gen=2 glyphs=4
2026-03-14T07:36:44.034405	d89a9a93	0	0	0.0000	CRASH	gen=2 glyphs=4
2026-03-14T07:36:44.034599	431c9885	0	0	0.0000	CRASH	gen=2 glyphs=4
2026-03-14T07:36:44.034795	29aa7608	0	0	0.0000	CRASH	gen=2 glyphs=4
2026-03-14T07:36:44.034984	79eb9a0d	0	0	0.0000	CRASH	gen=2 glyphs=4
2026-03-14T07:36:44.035175	099964a4	0	0	0.0000	CRASH	gen=2 glyphs=4
2026-03-14T07:36:44.035448	099964a4	0	0	0.0000	CRASH	gen=3 glyphs=4
2026-03-14T07:36:44.035649	099964a4	0	0	0.0000	CRASH	gen=3 glyphs=4
2026-03-14T07:36:44.035850	e428df39	0	0	0.0000	CRASH	gen=3 glyphs=4
2026-03-14T07:36:44.036044	3a734398	0	0	0.0000	CRASH	gen=3 glyphs=4
2026-03-14T07:36:44.036235	099964a4	0	0	0.0000	CRASH	gen=3 glyphs=4
2026-03-14T07:36:44.036462	c4f79e10	0	0	0.0000	CRASH	gen=3 glyphs=3
2026-03-14T07:36:44.036684	099964a4	0	0	0.0000	CRASH	gen=3 glyphs=4
2026-03-14T07:36:44.036876	099964a4	0	0	0.0000	CRASH	gen=3 glyphs=4
2026-03-14T07:36:44.037070	099964a4	0	0	0.0000	CRASH	gen=3 glyphs=4
2026-03-14T07:36:44.037261	099964a4	0	0	0.0000	CRASH	gen=3 glyphs=4
2026-03-14T07:36:44.037541	099964a4	0	0	0.0000	CRASH	gen=4 glyphs=4
2026-03-14T07:36:44.037750	099964a4	0	0	0.0000	CRASH	gen=4 glyphs=4
2026-03-14T07:36:44.037944	fe8cb676	0	0	0.0000	CRASH	gen=4 glyphs=2
2026-03-14T07:36:44.038139	a900a7c1	0	0	0.0000	CRASH	gen=4 glyphs=4
2026-03-14T07:36:44.038333	099964a4	0	0	0.0000	CRASH	gen=4 glyphs=4
2026-03-14T07:36:44.038529	099964a4	0	0	0.0000	CRASH	gen=4 glyphs=4
2026-03-14T07:36:44.038728	099964a4	0	0	0.0000	CRASH	gen=4 glyphs=4
2026-03-14T07:36:44.038923	765a9d9c	0	0	0.0000	CRASH	gen=4 glyphs=4
2026-03-14T07:36:44.039120	099964a4	0	0	0.0000	CRASH	gen=4 glyphs=4
2026-03-14T07:36:44.039309	099964a4	0	0	0.0000	CRASH	gen=4 glyphs=4
2026-03-14T07:36:44.039597	099964a4	0	0	0.0000	CRASH	gen=5 glyphs=4
2026-03-14T07:36:44.039793	099964a4	0	0	0.0000	CRASH	gen=5 glyphs=4
2026-03-14T07:36:44.039986	099964a4	0	0	0.0000	CRASH	gen=5 glyphs=4
2026-03-14T07:36:44.040184	7219052b	0	0	0.0000	CRASH	gen=5 glyphs=5
2026-03-14T07:36:44.040384	3ca14993	0	0	0.0000	CRASH	gen=5 glyphs=4
2026-03-14T07:36:44.040586	077c1666	0	0	0.0000	CRASH	gen=5 glyphs=3
2026-03-14T07:36:44.040784	208f5c40	0	0	0.0000	CRASH	gen=5 glyphs=4
2026-03-14T07:36:44.040992	099964a4	0	0	0.0000	CRASH	gen=5 glyphs=4
2026-03-14T07:36:44.041194	099964a4	0	0	0.0000	CRASH	gen=5 glyphs=4
2026-03-14T07:36:44.041389	ff30496a	0	0	0.0000	CRASH	gen=5 glyphs=3
2026-03-14T07:36:44.041660	099964a4	0	0	0.0000	CRASH	gen=6 glyphs=4
2026-03-14T07:36:44.041858	099964a4	0	0	0.0000	CRASH	gen=6 glyphs=4
2026-03-14T07:36:44.042049	099964a4	0	0	0.0000	CRASH	gen=6 glyphs=4
2026-03-14T07:36:44.042245	099964a4	0	0	0.0000	CRASH	gen=6 glyphs=4
2026-03-14T07:36:44.042434	3ca14993	0	0	0.0000	CRASH	gen=6 glyphs=4
2026-03-14T07:36:44.042633	099964a4	0	0	0.0000	CRASH	gen=6 glyphs=4
2026-03-14T07:36:44.042824	099964a4	0	0	0.0000	CRASH	gen=6 glyphs=4
2026-03-14T07:36:44.043014	099964a4	0	0	0.0000	CRASH	gen=6 glyphs=4
2026-03-14T07:36:44.043205	099964a4	0	0	0.0000	CRASH	gen=6 glyphs=4
2026-03-14T07:36:44.043398	099964a4	0	0	0.0000	CRASH	gen=6 glyphs=4
2026-03-14T07:36:44.043684	099964a4	0	0	0.0000	CRASH	gen=7 glyphs=4
2026-03-14T07:36:44.043880	099964a4	0	0	0.0000	CRASH	gen=7 glyphs=4
2026-03-14T07:36:44.044074	cf93b656	0	0	0.0000	CRASH	gen=7 glyphs=3
2026-03-14T07:36:44.044274	099964a4	0	0	0.0000	CRASH	gen=7 glyphs=4
2026-03-14T07:36:44.044471	099964a4	0	0	0.0000	CRASH	gen=7 glyphs=4
2026-03-14T07:36:44.044665	7aec7d37	0	0	0.0000	CRASH	gen=7 glyphs=1
2026-03-14T07:36:44.044859	099964a4	0	0	0.0000	CRASH	gen=7 glyphs=4
2026-03-14T07:36:44.045051	dc733beb	0	0	0.0000	CRASH	gen=7 glyphs=4
2026-03-14T07:36:44.045249	099964a4	0	0	0.0000	CRASH	gen=7 glyphs=4
2026-03-14T07:36:44.045458	099964a4	0	0	0.0000	CRASH	gen=7 glyphs=4
2026-03-14T07:36:44.045749	099964a4	0	0	0.0000	CRASH	gen=8 glyphs=4
2026-03-14T07:36:44.045949	099964a4	0	0	0.0000	CRASH	gen=8 glyphs=4
2026-03-14T07:36:44.046141	7ede4765	0	0	0.0000	CRASH	gen=8 glyphs=2
2026-03-14T07:36:44.046333	8da1f8d8	0	0	0.0000	CRASH	gen=8 glyphs=4
2026-03-14T07:36:44.046534	099964a4	0	0	0.0000	CRASH	gen=8 glyphs=4
2026-03-14T07:36:44.046725	cf93b656	0	0	0.0000	CRASH	gen=8 glyphs=3
2026-03-14T07:36:44.046915	099964a4	0	0	0.0000	CRASH	gen=8 glyphs=4
2026-03-14T07:36:44.047106	099964a4	0	0	0.0000	CRASH	gen=8 glyphs=4
2026-03-14T07:36:44.047298	0cb0a020	0	0	0.0000	CRASH	gen=8 glyphs=3
2026-03-14T07:36:44.047489	099964a4	0	0	0.0000	CRASH	gen=8 glyphs=4
2026-03-14T07:36:44.047777	099964a4	0	0	0.0000	CRASH	gen=9 glyphs=4
2026-03-14T07:36:44.047972	099964a4	0	0	0.0000	CRASH	gen=9 glyphs=4
2026-03-14T07:36:44.048167	099964a4	0	0	0.0000	CRASH	gen=9 glyphs=4
2026-03-14T07:36:44.048359	099964a4	0	0	0.0000	CRASH	gen=9 glyphs=4
2026-03-14T07:36:44.048559	80cef82b	0	0	0.0000	CRASH	gen=9 glyphs=4
2026-03-14T07:36:44.048755	099964a4	0	0	0.0000	CRASH	gen=9 glyphs=4
2026-03-14T07:36:44.048949	099964a4	0	0	0.0000	CRASH	gen=9 glyphs=4
2026-03-14T07:36:44.049140	099964a4	0	0	0.0000	CRASH	gen=9 glyphs=4
2026-03-14T07:36:44.049334	099964a4	0	0	0.0000	CRASH	gen=9 glyphs=4
2026-03-14T07:36:44.049531	3a734398	0	0	0.0000	CRASH	gen=9 glyphs=4
2026-03-14T07:36:44.049803	099964a4	0	0	0.0000	CRASH	gen=10 glyphs=4
2026-03-14T07:36:44.049998	099964a4	0	0	0.0000	CRASH	gen=10 glyphs=4
2026-03-14T07:36:44.050194	3ca14993	0	0	0.0000	CRASH	gen=10 glyphs=4
2026-03-14T07:36:44.050389	6efaff3a	0	0	0.0000	CRASH	gen=10 glyphs=4
2026-03-14T07:36:44.050588	cf93b656	0	0	0.0000	CRASH	gen=10 glyphs=3
2026-03-14T07:36:44.050786	c46f23f1	0	0	0.0000	CRASH	gen=10 glyphs=3
2026-03-14T07:36:44.050990	8da1f8d8	0	0	0.0000	CRASH	gen=10 glyphs=4
2026-03-14T07:36:44.051189	099964a4	0	0	0.0000	CRASH	gen=10 glyphs=4
2026-03-14T07:36:44.051387	80cef82b	0	0	0.0000	CRASH	gen=10 glyphs=4
2026-03-14T07:36:44.051584	099964a4	0	0	0.0000	CRASH	gen=10 glyphs=4
2026-03-14T07:36:44.051875	099964a4	0	0	0.0000	CRASH	gen=11 glyphs=4
2026-03-14T07:36:44.052071	099964a4	0	0	0.0000	CRASH	gen=11 glyphs=4
2026-03-14T07:36:44.052267	099964a4	0	0	0.0000	CRASH	gen=11 glyphs=4
2026-03-14T07:36:44.052459	7ede4765	0	0	0.0000	CRASH	gen=11 glyphs=2
2026-03-14T07:36:44.052655	30e35745	0	0	0.0000	CRASH	gen=11 glyphs=3
2026-03-14T07:36:44.052853	dcb1fb50	0	0	0.0000	CRASH	gen=11 glyphs=4
2026-03-14T07:36:44.053049	bb6fab4d	0	0	0.0000	CRASH	gen=11 glyphs=3
2026-03-14T07:36:44.053243	ff30496a	0	0	0.0000	CRASH	gen=11 glyphs=3
2026-03-14T07:36:44.053439	7ede4765	0	0	0.0000	CRASH	gen=11 glyphs=2
