timestamp	program_hash	spirv_size	word_count	fitness	status	description
2026-03-13T22:17:19.763582	9098b31e	116	29	0.9500	DISCARD	gen=51 glyphs=4
2026-03-13T22:17:20.342947	c59d69f2	116	29	1.0000	DISCARD	gen=7 glyphs=4
2026-03-13T22:17:22.676117	9e34ede0	116	29	1.0000	DISCARD	gen=51 glyphs=4
2026-03-13T22:17:23.247463	7ca87b42	116	29	1.0000	DISCARD	gen=7 glyphs=4
2026-03-13T22:17:25.545742	88cc32e1	120	30	1.0000	DISCARD	gen=51 glyphs=4
2026-03-13T22:17:26.107414	37f4017b	116	29	1.0000	DISCARD	gen=8 glyphs=4
2026-03-13T22:17:28.411049	19355583	120	30	1.0000	DISCARD	gen=52 glyphs=4
2026-03-13T22:17:29.124737	bfdf7cad	120	30	1.0000	DISCARD	gen=8 glyphs=4
2026-03-13T22:17:31.457614	8aef8872	116	29	1.0000	DISCARD	gen=52 glyphs=4
2026-03-13T22:17:32.018826	5a06ca32	120	30	1.0000	DISCARD	gen=8 glyphs=4
2026-03-13T22:17:34.331068	19355583	120	30	1.0000	DISCARD	gen=52 glyphs=4
2026-03-13T22:17:34.914464	bb7cbea7	120	30	1.0000	DISCARD	gen=8 glyphs=4
2026-03-13T22:17:37.248444	7e3d9aca	120	30	0.9500	DISCARD	gen=52 glyphs=4
2026-03-13T22:17:37.822757	37f4017b	116	29	1.0000	DISCARD	gen=8 glyphs=4
2026-03-13T22:17:40.118038	8aef8872	116	29	1.0000	DISCARD	gen=52 glyphs=4
2026-03-13T22:17:40.700989	5a06ca32	120	30	1.0000	DISCARD	gen=8 glyphs=4
2026-03-13T22:17:43.010508	050862ad	120	30	1.0000	DISCARD	gen=52 glyphs=4
2026-03-13T22:17:43.601653	66340259	120	30	0.9500	DISCARD	gen=8 glyphs=4
2026-03-13T22:17:46.068345	19355583	120	30	1.0000	DISCARD	gen=52 glyphs=4
2026-03-13T22:17:46.665980	5b9807ac	120	30	1.0000	DISCARD	gen=8 glyphs=4
2026-03-13T22:17:48.976840	30743a2b	116	29	1.0000	DISCARD	gen=52 glyphs=4
2026-03-13T22:17:49.564497	5a06ca32	120	30	1.0000	DISCARD	gen=8 glyphs=4
2026-03-13T22:17:52.113725	a78f9454	120	30	1.0000	DISCARD	gen=52 glyphs=4
2026-03-13T22:17:52.713951	5a06ca32	120	30	1.0000	DISCARD	gen=8 glyphs=4
2026-03-13T22:17:55.044510	a78f9454	120	30	1.0000	DISCARD	gen=52 glyphs=4
2026-03-13T22:17:55.634804	37f4017b	116	29	1.0000	DISCARD	gen=9 glyphs=4
2026-03-13T22:17:57.952727	19355583	120	30	1.0000	DISCARD	gen=53 glyphs=4
2026-03-13T22:17:58.553513	bfdf7cad	120	30	1.0000	DISCARD	gen=9 glyphs=4
2026-03-13T22:18:01.011546	8aef8872	116	29	1.0000	DISCARD	gen=53 glyphs=4
2026-03-13T22:18:01.611147	12b38c2d	116	29	1.0000	DISCARD	gen=9 glyphs=4
2026-03-13T22:18:07.660045	8aef8872	116	29	1.0000	DISCARD	gen=53 glyphs=4
2026-03-13T22:18:08.231409	37f4017b	116	29	1.0000	DISCARD	gen=9 glyphs=4
2026-03-13T22:18:10.560764	e2cd28ea	120	30	1.0000	DISCARD	gen=53 glyphs=4
2026-03-13T22:18:11.140783	66be75e2	120	30	1.0000	DISCARD	gen=9 glyphs=4
2026-03-13T22:18:13.641671	0b5cd287	116	29	1.0000	DISCARD	gen=53 glyphs=4
2026-03-13T22:18:14.223352	d27f99b2	120	30	1.0000	DISCARD	gen=9 glyphs=4
2026-03-13T22:18:16.565085	49ef6f5a	120	30	1.0000	DISCARD	gen=53 glyphs=4
2026-03-13T22:18:17.139153	5a06ca32	120	30	1.0000	DISCARD	gen=9 glyphs=4
2026-03-13T22:18:19.501340	67cb81be	120	30	1.0000	DISCARD	gen=53 glyphs=4
2026-03-13T22:18:20.078770	42124fd1	120	30	1.0000	DISCARD	gen=9 glyphs=4
2026-03-13T22:18:22.454473	8aef8872	116	29	1.0000	DISCARD	gen=53 glyphs=4
2026-03-13T22:18:23.070354	6d355e2f	120	30	1.0000	DISCARD	gen=9 glyphs=4
2026-03-13T22:18:25.433005	2ff2db21	120	30	1.0000	DISCARD	gen=53 glyphs=4
2026-03-13T22:18:26.023747	71e2ba66	116	29	1.0000	DISCARD	gen=9 glyphs=4
2026-03-13T22:18:28.363652	050862ad	120	30	1.0000	DISCARD	gen=53 glyphs=4
2026-03-13T22:18:28.937220	37f4017b	116	29	1.0000	DISCARD	gen=10 glyphs=4
2026-03-13T22:18:31.246387	19355583	120	30	1.0000	DISCARD	gen=54 glyphs=4
2026-03-13T22:18:31.831883	bfdf7cad	120	30	1.0000	DISCARD	gen=10 glyphs=4
2026-03-13T22:18:34.194136	8aef8872	116	29	1.0000	DISCARD	gen=54 glyphs=4
2026-03-13T22:18:34.772774	eefc3d68	116	29	1.0000	DISCARD	gen=10 glyphs=4
2026-03-13T22:18:37.244508	1242e5d4	116	29	1.0000	DISCARD	gen=54 glyphs=4
2026-03-13T22:18:37.837974	53c0387f	120	30	1.0000	DISCARD	gen=10 glyphs=4
2026-03-13T22:18:40.145967	19355583	120	30	1.0000	DISCARD	gen=54 glyphs=4
2026-03-13T22:18:40.724830	6df8d9fa	116	29	1.0000	DISCARD	gen=10 glyphs=4
2026-03-13T22:18:43.054431	a7ba804e	120	30	1.0000	DISCARD	gen=54 glyphs=4
2026-03-13T22:18:43.629529	37f4017b	116	29	1.0000	DISCARD	gen=10 glyphs=4
2026-03-13T22:18:45.947308	19355583	120	30	1.0000	DISCARD	gen=54 glyphs=4
2026-03-13T22:18:46.530193	1d34459a	116	29	1.0000	DISCARD	gen=10 glyphs=4
2026-03-13T22:18:48.862642	aae005d0	116	29	0.9500	DISCARD	gen=54 glyphs=4
2026-03-13T22:18:49.455250	37f4017b	116	29	1.0000	DISCARD	gen=10 glyphs=4
2026-03-13T22:18:51.956099	8aef8872	116	29	1.0000	DISCARD	gen=54 glyphs=4
2026-03-13T22:18:52.536222	1edf179a	116	29	1.0000	DISCARD	gen=10 glyphs=4
2026-03-13T22:18:54.925328	f48c3dfb	116	29	1.0000	DISCARD	gen=54 glyphs=4
2026-03-13T22:18:55.505951	12b38c2d	116	29	1.0000	DISCARD	gen=10 glyphs=4
2026-03-13T22:19:01.256930	8aef8872	116	29	1.0000	DISCARD	gen=54 glyphs=4
2026-03-13T22:19:01.843507	37f4017b	116	29	1.0000	DISCARD	gen=11 glyphs=4
2026-03-13T22:19:04.136036	19355583	120	30	1.0000	DISCARD	gen=55 glyphs=4
2026-03-13T22:19:04.703975	bfdf7cad	120	30	1.0000	DISCARD	gen=11 glyphs=4
2026-03-13T22:19:07.034007	8aef8872	116	29	1.0000	DISCARD	gen=55 glyphs=4
2026-03-13T22:19:07.611504	37f4017b	116	29	1.0000	DISCARD	gen=11 glyphs=4
2026-03-13T22:19:13.595609	8aef8872	116	29	1.0000	DISCARD	gen=55 glyphs=4
2026-03-13T22:19:14.158917	5a06ca32	120	30	1.0000	DISCARD	gen=11 glyphs=4
2026-03-13T22:19:16.462825	67cb81be	120	30	1.0000	DISCARD	gen=55 glyphs=4
2026-03-13T22:19:17.037663	5a06ca32	120	30	1.0000	DISCARD	gen=11 glyphs=4
2026-03-13T22:19:19.331964	0eaedb57	116	29	1.0000	DISCARD	gen=55 glyphs=4
2026-03-13T22:19:19.893107	75311ea7	120	30	1.0000	DISCARD	gen=11 glyphs=4
2026-03-13T22:19:22.230427	a78f9454	120	30	1.0000	DISCARD	gen=55 glyphs=4
2026-03-13T22:19:22.791202	1672820e	120	30	1.0000	DISCARD	gen=11 glyphs=4
2026-03-13T22:19:31.317288	0eaedb57	116	29	1.0000	DISCARD	gen=55 glyphs=4
2026-03-13T22:19:31.898297	83cc142b	116	29	1.0000	DISCARD	gen=11 glyphs=4
2026-03-13T22:19:34.219157	8aef8872	116	29	1.0000	DISCARD	gen=55 glyphs=4
2026-03-13T22:19:34.796945	4c9b0dd4	120	30	1.0000	DISCARD	gen=11 glyphs=4
2026-03-13T22:19:37.096354	30754e7e	116	29	1.0000	DISCARD	gen=55 glyphs=4
2026-03-13T22:19:37.671755	bbbb733b	116	29	1.0000	DISCARD	gen=11 glyphs=4
2026-03-13T22:19:48.086031	e8c7f6cf	120	30	1.0000	DISCARD	gen=55 glyphs=4
2026-03-13T22:19:48.660418	37f4017b	116	29	1.0000	DISCARD	gen=12 glyphs=4
2026-03-13T22:19:50.993765	19355583	120	30	1.0000	DISCARD	gen=56 glyphs=4
2026-03-13T22:19:51.574349	bfdf7cad	120	30	1.0000	DISCARD	gen=12 glyphs=4
2026-03-13T22:19:53.884128	8aef8872	116	29	1.0000	DISCARD	gen=56 glyphs=4
2026-03-13T22:19:54.449654	5a06ca32	120	30	1.0000	DISCARD	gen=12 glyphs=4
2026-03-13T22:20:05.027167	0eaedb57	116	29	1.0000	DISCARD	gen=56 glyphs=4
2026-03-13T22:20:05.605758	d11c1062	120	30	1.0000	DISCARD	gen=12 glyphs=4
2026-03-13T22:20:38.445829	b57e7176	120	30	1.0000	DISCARD	gen=56 glyphs=4
2026-03-13T22:20:39.018590	55d6c151	120	30	1.0000	DISCARD	gen=12 glyphs=4
2026-03-13T22:20:41.337093	e2cd28ea	120	30	1.0000	DISCARD	gen=56 glyphs=4
2026-03-13T22:20:41.923235	37f4017b	116	29	1.0000	DISCARD	gen=12 glyphs=4
2026-03-13T22:20:44.251533	4e4a4fc2	116	29	1.0000	DISCARD	gen=56 glyphs=4
2026-03-13T22:20:44.825991	15a52fab	116	29	1.0000	DISCARD	gen=12 glyphs=4
2026-03-13T22:20:47.120281	0eaedb57	116	29	1.0000	DISCARD	gen=56 glyphs=4
2026-03-13T22:20:47.692082	fdb5d108	120	30	1.0000	DISCARD	gen=12 glyphs=4
2026-03-13T22:20:50.016979	875e0f8a	116	29	1.0000	DISCARD	gen=56 glyphs=4
2026-03-13T22:20:50.590403	55d6c151	120	30	1.0000	DISCARD	gen=12 glyphs=4
2026-03-13T22:20:52.916790	50dc991d	116	29	1.0000	DISCARD	gen=56 glyphs=4
2026-03-13T22:20:53.507126	5a06ca32	120	30	1.0000	DISCARD	gen=12 glyphs=4
2026-03-13T22:20:55.951559	eca7ab6c	116	29	1.0000	DISCARD	gen=56 glyphs=4
2026-03-13T22:21:07.264230	37f4017b	116	29	1.0000	DISCARD	gen=13 glyphs=4
2026-03-13T22:21:09.578574	19355583	120	30	1.0000	DISCARD	gen=57 glyphs=4
2026-03-13T22:21:10.164758	bfdf7cad	120	30	1.0000	DISCARD	gen=13 glyphs=4
2026-03-13T22:21:12.486057	8aef8872	116	29	1.0000	DISCARD	gen=57 glyphs=4
2026-03-13T22:21:13.055734	8b2a26dc	116	29	1.0000	DISCARD	gen=13 glyphs=4
2026-03-13T22:21:15.347485	050862ad	120	30	1.0000	DISCARD	gen=57 glyphs=4
2026-03-13T22:21:15.914813	37f4017b	116	29	1.0000	DISCARD	gen=13 glyphs=4
2026-03-13T22:21:18.217119	d0dfe77c	116	29	1.0000	DISCARD	gen=57 glyphs=4
2026-03-13T22:21:18.773749	55d6c151	120	30	1.0000	DISCARD	gen=13 glyphs=4
2026-03-13T22:21:21.243023	7607cfc8	120	30	1.0000	DISCARD	gen=57 glyphs=4
2026-03-13T22:21:21.808225	c58e01f9	116	29	1.0000	DISCARD	gen=13 glyphs=4
2026-03-13T22:21:24.147759	70e17200	116	29	1.0000	DISCARD	gen=57 glyphs=4
2026-03-13T22:21:24.721258	37f4017b	116	29	1.0000	DISCARD	gen=13 glyphs=4
2026-03-13T22:21:27.056346	8aef8872	116	29	1.0000	DISCARD	gen=57 glyphs=4
2026-03-13T22:21:27.650879	6c7fedee	116	29	1.0000	DISCARD	gen=13 glyphs=4
2026-03-13T22:21:29.936173	19355583	120	30	1.0000	DISCARD	gen=57 glyphs=4
2026-03-13T22:21:30.508441	ce903e95	120	30	1.0000	DISCARD	gen=13 glyphs=4
2026-03-13T22:21:36.916196	f21238bb	120	30	1.0000	DISCARD	gen=57 glyphs=4
2026-03-13T22:21:37.503387	d11c1062	120	30	1.0000	DISCARD	gen=13 glyphs=4
2026-03-13T22:21:39.825816	a5588096	116	29	1.0000	DISCARD	gen=57 glyphs=4
2026-03-13T22:21:40.397562	37f4017b	116	29	1.0000	DISCARD	gen=14 glyphs=4
2026-03-13T22:21:42.696662	19355583	120	30	1.0000	DISCARD	gen=58 glyphs=4
2026-03-13T22:21:43.260855	bfdf7cad	120	30	1.0000	DISCARD	gen=14 glyphs=4
2026-03-13T22:21:45.533913	8aef8872	116	29	1.0000	DISCARD	gen=58 glyphs=4
2026-03-13T22:21:46.147337	5a06ca32	120	30	1.0000	DISCARD	gen=14 glyphs=4
2026-03-13T22:21:48.453989	b57e7176	120	30	1.0000	DISCARD	gen=58 glyphs=4
2026-03-13T22:21:49.026154	12b38c2d	116	29	1.0000	DISCARD	gen=14 glyphs=4
2026-03-13T22:21:51.299160	606be831	116	29	1.0000	DISCARD	gen=58 glyphs=4
2026-03-13T22:21:51.873289	37f4017b	116	29	1.0000	DISCARD	gen=14 glyphs=4
2026-03-13T22:21:54.153414	8aef8872	116	29	1.0000	DISCARD	gen=58 glyphs=4
2026-03-13T22:21:54.716840	3ced50ba	116	29	1.0000	DISCARD	gen=14 glyphs=4
2026-03-13T22:21:56.965413	19355583	120	30	1.0000	DISCARD	gen=58 glyphs=4
2026-03-13T22:21:57.537709	71e2ba66	116	29	1.0000	DISCARD	gen=14 glyphs=4
2026-03-13T22:21:59.780144	8aef8872	116	29	1.0000	DISCARD	gen=58 glyphs=4
2026-03-13T22:22:00.366950	37f4017b	116	29	1.0000	DISCARD	gen=14 glyphs=4
2026-03-13T22:22:02.620030	0eaedb57	116	29	1.0000	DISCARD	gen=58 glyphs=4
2026-03-13T22:22:03.189844	76907f5a	116	29	1.0000	DISCARD	gen=14 glyphs=4
2026-03-13T22:22:05.429168	87aff1b7	116	29	0.9500	DISCARD	gen=58 glyphs=4
2026-03-13T22:22:05.993703	7ac95ca2	116	29	1.0000	DISCARD	gen=14 glyphs=4
2026-03-13T22:22:08.348112	875e0f8a	116	29	1.0000	DISCARD	gen=58 glyphs=4
2026-03-13T22:22:08.921929	37f4017b	116	29	1.0000	DISCARD	gen=15 glyphs=4
2026-03-13T22:22:11.206811	19355583	120	30	1.0000	DISCARD	gen=59 glyphs=4
2026-03-13T22:22:11.795997	bfdf7cad	120	30	1.0000	DISCARD	gen=15 glyphs=4
2026-03-13T22:22:14.165507	8aef8872	116	29	1.0000	DISCARD	gen=59 glyphs=4
2026-03-13T22:22:14.759304	55d6c151	120	30	1.0000	DISCARD	gen=15 glyphs=4
2026-03-13T22:22:17.146652	d7c8681b	120	30	1.0000	DISCARD	gen=59 glyphs=4
2026-03-13T22:22:17.737661	00487ae1	120	30	1.0000	DISCARD	gen=15 glyphs=4
2026-03-13T22:22:20.020784	0eaedb57	116	29	1.0000	DISCARD	gen=59 glyphs=4
2026-03-13T22:22:20.600613	d11c1062	120	30	1.0000	DISCARD	gen=15 glyphs=4
2026-03-13T22:22:22.893350	1e5f0e21	116	29	1.0000	DISCARD	gen=59 glyphs=4
2026-03-13T22:22:23.471320	27a13120	120	30	1.0000	DISCARD	gen=15 glyphs=4
2026-03-13T22:22:25.793231	b57e7176	120	30	1.0000	DISCARD	gen=59 glyphs=4
2026-03-13T22:22:26.364458	5a06ca32	120	30	1.0000	DISCARD	gen=15 glyphs=4
2026-03-13T22:22:28.687304	19355583	120	30	1.0000	DISCARD	gen=59 glyphs=4
2026-03-13T22:22:29.273904	1d34459a	116	29	1.0000	DISCARD	gen=15 glyphs=4
2026-03-13T22:22:31.600284	0eaedb57	116	29	1.0000	DISCARD	gen=59 glyphs=4
2026-03-13T22:22:32.169339	b9e5af9a	116	29	1.0000	DISCARD	gen=15 glyphs=4
2026-03-13T22:22:34.459383	ae44ace5	116	29	1.0000	DISCARD	gen=59 glyphs=4
2026-03-13T22:22:35.022742	c6326fa4	120	30	1.0000	DISCARD	gen=15 glyphs=4
2026-03-13T22:22:37.307850	19355583	120	30	1.0000	DISCARD	gen=59 glyphs=4
2026-03-13T22:22:37.872488	37f4017b	116	29	1.0000	DISCARD	gen=16 glyphs=4
2026-03-13T22:22:40.207499	19355583	120	30	1.0000	DISCARD	gen=60 glyphs=4
2026-03-13T22:22:40.771139	bfdf7cad	120	30	1.0000	DISCARD	gen=16 glyphs=4
2026-03-13T22:22:43.092372	8aef8872	116	29	1.0000	DISCARD	gen=60 glyphs=4
2026-03-13T22:22:43.660326	5a06ca32	120	30	1.0000	DISCARD	gen=16 glyphs=4
2026-03-13T22:22:46.051742	e2cd28ea	120	30	1.0000	DISCARD	gen=60 glyphs=4
2026-03-13T22:22:46.648873	55d6c151	120	30	1.0000	DISCARD	gen=16 glyphs=4
2026-03-13T22:22:49.009880	eca7ab6c	116	29	1.0000	DISCARD	gen=60 glyphs=4
2026-03-13T22:22:49.578145	5a06ca32	120	30	1.0000	DISCARD	gen=16 glyphs=4
2026-03-13T22:22:51.902670	e8c7f6cf	120	30	1.0000	DISCARD	gen=60 glyphs=4
2026-03-13T22:22:52.483154	37f4017b	116	29	1.0000	DISCARD	gen=16 glyphs=4
2026-03-13T22:22:54.767744	0eaedb57	116	29	1.0000	DISCARD	gen=60 glyphs=4
2026-03-13T22:22:55.335079	55d6c151	120	30	1.0000	DISCARD	gen=16 glyphs=4
2026-03-13T22:22:57.613652	b7aed8e9	116	29	1.0000	DISCARD	gen=60 glyphs=4
2026-03-13T22:22:58.218500	37f4017b	116	29	1.0000	DISCARD	gen=16 glyphs=4
2026-03-13T22:23:00.528958	1e5f0e21	116	29	1.0000	DISCARD	gen=60 glyphs=4
2026-03-13T22:23:01.094474	4c9b0dd4	120	30	1.0000	DISCARD	gen=16 glyphs=4
2026-03-13T22:23:03.412954	0c5a2a2b	116	29	1.0000	DISCARD	gen=60 glyphs=4
2026-03-13T22:23:03.986939	902e7fae	116	29	0.9500	DISCARD	gen=16 glyphs=4
2026-03-13T22:23:06.313058	e8c7f6cf	120	30	1.0000	DISCARD	gen=60 glyphs=4
2026-03-13T22:23:06.894132	37f4017b	116	29	1.0000	DISCARD	gen=17 glyphs=4
2026-03-13T22:23:09.135151	19355583	120	30	1.0000	DISCARD	gen=61 glyphs=4
2026-03-13T22:23:09.702746	bfdf7cad	120	30	1.0000	DISCARD	gen=17 glyphs=4
2026-03-13T22:23:12.093201	8aef8872	116	29	1.0000	DISCARD	gen=61 glyphs=4
2026-03-13T22:23:12.666909	37f4017b	116	29	1.0000	DISCARD	gen=17 glyphs=4
2026-03-13T22:23:14.925864	19355583	120	30	1.0000	DISCARD	gen=61 glyphs=4
2026-03-13T22:23:15.505687	5b9807ac	120	30	1.0000	DISCARD	gen=17 glyphs=4
2026-03-13T22:23:17.771510	aeac6514	116	29	1.0000	DISCARD	gen=61 glyphs=4
2026-03-13T22:23:18.354315	37f4017b	116	29	1.0000	DISCARD	gen=17 glyphs=4
2026-03-13T22:23:20.595137	0eaedb57	116	29	1.0000	DISCARD	gen=61 glyphs=4
2026-03-13T22:23:21.158194	37f4017b	116	29	1.0000	DISCARD	gen=17 glyphs=4
2026-03-13T22:23:23.415046	ce184033	120	30	0.9500	DISCARD	gen=61 glyphs=4
2026-03-13T22:23:23.980018	5a06ca32	120	30	1.0000	DISCARD	gen=17 glyphs=4
2026-03-13T22:23:26.248457	a78f9454	120	30	1.0000	DISCARD	gen=61 glyphs=4
2026-03-13T22:23:26.809319	fdb5d108	120	30	1.0000	DISCARD	gen=17 glyphs=4
2026-03-13T22:23:29.064461	3dfe2134	116	29	1.0000	DISCARD	gen=61 glyphs=4
2026-03-13T22:23:29.640396	37f4017b	116	29	1.0000	DISCARD	gen=17 glyphs=4
2026-03-13T22:23:31.886401	050862ad	120	30	1.0000	DISCARD	gen=61 glyphs=4
2026-03-13T22:23:32.450896	88413a7e	120	30	1.0000	DISCARD	gen=17 glyphs=4
2026-03-13T22:23:34.729514	19355583	120	30	1.0000	DISCARD	gen=61 glyphs=4
2026-03-13T22:23:35.284170	37f4017b	116	29	1.0000	DISCARD	gen=18 glyphs=4
2026-03-13T22:23:37.526034	19355583	120	30	1.0000	DISCARD	gen=62 glyphs=4
2026-03-13T22:23:38.091942	bfdf7cad	120	30	1.0000	DISCARD	gen=18 glyphs=4
2026-03-13T22:23:40.336722	8aef8872	116	29	1.0000	DISCARD	gen=62 glyphs=4
2026-03-13T22:23:40.908597	fdb5d108	120	30	1.0000	DISCARD	gen=18 glyphs=4
2026-03-13T22:23:43.218620	530c14bd	116	29	1.0000	DISCARD	gen=62 glyphs=4
2026-03-13T22:23:43.789713	28101cdb	120	30	1.0000	DISCARD	gen=18 glyphs=4
2026-03-13T22:23:46.022970	0eaedb57	116	29	1.0000	DISCARD	gen=62 glyphs=4
2026-03-13T22:23:46.574029	55d6c151	120	30	1.0000	DISCARD	gen=18 glyphs=4
2026-03-13T22:23:48.822380	875e0f8a	116	29	1.0000	DISCARD	gen=62 glyphs=4
2026-03-13T22:23:49.376548	81a3fbfe	116	29	1.0000	DISCARD	gen=18 glyphs=4
2026-03-13T22:23:51.607993	b7aed8e9	116	29	1.0000	DISCARD	gen=62 glyphs=4
2026-03-13T22:23:52.172815	5a06ca32	120	30	1.0000	DISCARD	gen=18 glyphs=4
2026-03-13T22:23:54.449776	19355583	120	30	1.0000	DISCARD	gen=62 glyphs=4
2026-03-13T22:23:55.029973	5a06ca32	120	30	1.0000	DISCARD	gen=18 glyphs=4
2026-03-13T22:23:57.300503	8aef8872	116	29	1.0000	DISCARD	gen=62 glyphs=4
2026-03-13T22:23:57.856350	fdb5d108	120	30	1.0000	DISCARD	gen=18 glyphs=4
2026-03-13T22:24:00.110918	3b881a91	120	30	1.0000	DISCARD	gen=62 glyphs=4
2026-03-13T22:24:00.690148	5a06ca32	120	30	1.0000	DISCARD	gen=18 glyphs=4
2026-03-13T22:24:02.961326	56a6aad3	116	29	1.0000	DISCARD	gen=62 glyphs=4
2026-03-13T22:24:03.511579	37f4017b	116	29	1.0000	DISCARD	gen=19 glyphs=4
2026-03-13T22:24:05.795784	19355583	120	30	1.0000	DISCARD	gen=63 glyphs=4
2026-03-13T22:24:06.360530	bfdf7cad	120	30	1.0000	DISCARD	gen=19 glyphs=4
2026-03-13T22:24:08.606841	8aef8872	116	29	1.0000	DISCARD	gen=63 glyphs=4
2026-03-13T22:24:09.183911	5a06ca32	120	30	1.0000	DISCARD	gen=19 glyphs=4
2026-03-13T22:24:11.463952	e97e78ec	120	30	1.0000	DISCARD	gen=63 glyphs=4
2026-03-13T22:24:12.037235	4c9b0dd4	120	30	1.0000	DISCARD	gen=19 glyphs=4
2026-03-13T22:24:14.349950	e2cd28ea	120	30	1.0000	DISCARD	gen=63 glyphs=4
2026-03-13T22:24:14.949275	5b9807ac	120	30	1.0000	DISCARD	gen=19 glyphs=4
2026-03-13T22:24:17.195160	1e5f0e21	116	29	1.0000	DISCARD	gen=63 glyphs=4
2026-03-13T22:24:17.763293	b35db0fe	116	29	1.0000	DISCARD	gen=19 glyphs=4
2026-03-13T22:24:20.034061	626dbec1	116	29	1.0000	DISCARD	gen=63 glyphs=4
2026-03-13T22:24:20.608061	37f4017b	116	29	1.0000	DISCARD	gen=19 glyphs=4
2026-03-13T22:24:22.860143	8aef8872	116	29	1.0000	DISCARD	gen=63 glyphs=4
2026-03-13T22:24:23.439361	afaa7daa	116	29	1.0000	DISCARD	gen=19 glyphs=4
2026-03-13T22:24:25.701419	0eaedb57	116	29	1.0000	DISCARD	gen=63 glyphs=4
2026-03-13T22:24:26.258731	55d6c151	120	30	1.0000	DISCARD	gen=19 glyphs=4
2026-03-13T22:24:28.535935	d7c8681b	120	30	1.0000	DISCARD	gen=63 glyphs=4
2026-03-13T22:24:29.113507	2701cb73	116	29	1.0000	DISCARD	gen=19 glyphs=4
2026-03-13T22:24:31.371123	050862ad	120	30	1.0000	DISCARD	gen=63 glyphs=4
2026-03-13T22:24:31.926495	37f4017b	116	29	1.0000	DISCARD	gen=20 glyphs=4
2026-03-13T22:24:34.189202	19355583	120	30	1.0000	DISCARD	gen=64 glyphs=4
2026-03-13T22:24:34.757604	bfdf7cad	120	30	1.0000	DISCARD	gen=20 glyphs=4
2026-03-13T22:24:37.023053	8aef8872	116	29	1.0000	DISCARD	gen=64 glyphs=4
2026-03-13T22:24:37.584396	6abf5082	116	29	1.0000	DISCARD	gen=20 glyphs=4
2026-03-13T22:24:39.845244	0eaedb57	116	29	1.0000	DISCARD	gen=64 glyphs=4
2026-03-13T22:24:40.416458	71e2ba66	116	29	1.0000	DISCARD	gen=20 glyphs=4
2026-03-13T22:24:42.704924	8aef8872	116	29	1.0000	DISCARD	gen=64 glyphs=4
2026-03-13T22:24:43.282527	37f4017b	116	29	1.0000	DISCARD	gen=20 glyphs=4
2026-03-13T22:24:45.583680	050862ad	120	30	1.0000	DISCARD	gen=64 glyphs=4
2026-03-13T22:24:46.210957	5a06ca32	120	30	1.0000	DISCARD	gen=20 glyphs=4
2026-03-13T22:24:48.557271	3e7a513e	120	30	1.0000	DISCARD	gen=64 glyphs=4
2026-03-13T22:24:49.119386	5a06ca32	120	30	1.0000	DISCARD	gen=20 glyphs=4
2026-03-13T22:24:51.407205	68b429c6	116	29	1.0000	DISCARD	gen=64 glyphs=4
2026-03-13T22:24:51.975296	1d34459a	116	29	1.0000	DISCARD	gen=20 glyphs=4
2026-03-13T22:24:54.243226	0eaedb57	116	29	1.0000	DISCARD	gen=64 glyphs=4
2026-03-13T22:24:54.799412	17772965	116	29	1.0000	DISCARD	gen=20 glyphs=4
2026-03-13T22:24:57.044668	8aef8872	116	29	1.0000	DISCARD	gen=64 glyphs=4
2026-03-13T22:24:57.605836	37f4017b	116	29	1.0000	DISCARD	gen=20 glyphs=4
2026-03-13T22:24:59.881371	1e5f0e21	116	29	1.0000	DISCARD	gen=64 glyphs=4
2026-03-13T22:25:00.457677	37f4017b	116	29	1.0000	DISCARD	gen=21 glyphs=4
2026-03-13T22:25:02.770083	19355583	120	30	1.0000	DISCARD	gen=65 glyphs=4
2026-03-13T22:25:03.334796	bfdf7cad	120	30	1.0000	DISCARD	gen=21 glyphs=4
2026-03-13T22:25:05.609945	8aef8872	116	29	1.0000	DISCARD	gen=65 glyphs=4
2026-03-13T22:25:06.178758	37f4017b	116	29	1.0000	DISCARD	gen=21 glyphs=4
2026-03-13T22:25:08.488560	50dc991d	116	29	1.0000	DISCARD	gen=65 glyphs=4
2026-03-13T22:25:09.066380	396973b0	120	30	1.0000	DISCARD	gen=21 glyphs=4
2026-03-13T22:25:11.351723	eca7ab6c	116	29	1.0000	DISCARD	gen=65 glyphs=4
2026-03-13T22:25:11.932538	37f4017b	116	29	1.0000	DISCARD	gen=21 glyphs=4
2026-03-13T22:25:14.208754	67cb81be	120	30	1.0000	DISCARD	gen=65 glyphs=4
2026-03-13T22:25:14.774180	56042cfe	116	29	0.9500	DISCARD	gen=21 glyphs=4
2026-03-13T22:25:17.051547	58a0971f	116	29	1.0000	DISCARD	gen=65 glyphs=4
2026-03-13T22:25:17.637659	12b38c2d	116	29	1.0000	DISCARD	gen=21 glyphs=4
2026-03-13T22:25:20.043309	576613d5	120	30	1.0000	DISCARD	gen=65 glyphs=4
2026-03-13T22:25:20.628458	ce9e5b70	116	29	1.0000	DISCARD	gen=21 glyphs=4
2026-03-13T22:25:22.969082	0eaedb57	116	29	1.0000	DISCARD	gen=65 glyphs=4
2026-03-13T22:25:23.553104	bbc34150	120	30	1.0000	DISCARD	gen=21 glyphs=4
2026-03-13T22:25:25.864948	b57e7176	120	30	1.0000	DISCARD	gen=65 glyphs=4
2026-03-13T22:25:26.452814	37f4017b	116	29	1.0000	DISCARD	gen=21 glyphs=4
2026-03-13T22:25:28.807700	a78f9454	120	30	1.0000	DISCARD	gen=65 glyphs=4
2026-03-13T22:25:29.399682	37f4017b	116	29	1.0000	DISCARD	gen=22 glyphs=4
2026-03-13T22:25:31.725388	19355583	120	30	1.0000	DISCARD	gen=66 glyphs=4
2026-03-13T22:25:32.306902	bfdf7cad	120	30	1.0000	DISCARD	gen=22 glyphs=4
2026-03-13T22:25:34.728495	8aef8872	116	29	1.0000	DISCARD	gen=66 glyphs=4
2026-03-13T22:25:35.307038	5a06ca32	120	30	1.0000	DISCARD	gen=22 glyphs=4
2026-03-13T22:25:37.608176	19355583	120	30	1.0000	DISCARD	gen=66 glyphs=4
2026-03-13T22:25:38.189755	37f4017b	116	29	1.0000	DISCARD	gen=22 glyphs=4
2026-03-13T22:25:40.468976	050862ad	120	30	1.0000	DISCARD	gen=66 glyphs=4
2026-03-13T22:25:41.056127	5a06ca32	120	30	1.0000	DISCARD	gen=22 glyphs=4
2026-03-13T22:25:43.458941	a78f9454	120	30	1.0000	DISCARD	gen=66 glyphs=4
2026-03-13T22:25:44.031942	5995fb29	116	29	1.0000	DISCARD	gen=22 glyphs=4
