timestamp	program_hash	spirv_size	word_count	fitness	status	description
2026-03-14T07:36:45.853659	099964a4	0	0	0.0000	CRASH	gen=889 glyphs=4
2026-03-14T07:36:45.853850	099964a4	0	0	0.0000	CRASH	gen=889 glyphs=4
2026-03-14T07:36:45.854046	83a66f3f	0	0	0.0000	CRASH	gen=889 glyphs=4
2026-03-14T07:36:45.854240	099964a4	0	0	0.0000	CRASH	gen=889 glyphs=4
2026-03-14T07:36:45.854436	099964a4	0	0	0.0000	CRASH	gen=889 glyphs=4
2026-03-14T07:36:45.854634	a0129d43	0	0	0.0000	CRASH	gen=889 glyphs=4
2026-03-14T07:36:45.854904	099964a4	0	0	0.0000	CRASH	gen=890 glyphs=4
2026-03-14T07:36:45.855100	099964a4	0	0	0.0000	CRASH	gen=890 glyphs=4
2026-03-14T07:36:45.855292	9a827ced	0	0	0.0000	CRASH	gen=890 glyphs=4
2026-03-14T07:36:45.855487	099964a4	0	0	0.0000	CRASH	gen=890 glyphs=4
2026-03-14T07:36:45.855683	b5308b4f	0	0	0.0000	CRASH	gen=890 glyphs=3
2026-03-14T07:36:45.855877	099964a4	0	0	0.0000	CRASH	gen=890 glyphs=4
2026-03-14T07:36:45.856072	8da1f8d8	0	0	0.0000	CRASH	gen=890 glyphs=4
2026-03-14T07:36:45.856265	099964a4	0	0	0.0000	CRASH	gen=890 glyphs=4
2026-03-14T07:36:45.856458	099964a4	0	0	0.0000	CRASH	gen=890 glyphs=4
2026-03-14T07:36:45.856650	3a734398	0	0	0.0000	CRASH	gen=890 glyphs=4
2026-03-14T07:36:45.856928	099964a4	0	0	0.0000	CRASH	gen=891 glyphs=4
2026-03-14T07:36:45.857128	099964a4	0	0	0.0000	CRASH	gen=891 glyphs=4
2026-03-14T07:36:45.857325	cc8cb10f	0	0	0.0000	CRASH	gen=891 glyphs=3
2026-03-14T07:36:45.857522	121a1089	0	0	0.0000	CRASH	gen=891 glyphs=4
2026-03-14T07:36:45.857718	099964a4	0	0	0.0000	CRASH	gen=891 glyphs=4
2026-03-14T07:36:45.857911	099964a4	0	0	0.0000	CRASH	gen=891 glyphs=4
2026-03-14T07:36:45.858104	2b7248b0	0	0	0.0000	CRASH	gen=891 glyphs=3
2026-03-14T07:36:45.858301	40d3054b	0	0	0.0000	CRASH	gen=891 glyphs=2
2026-03-14T07:36:45.858497	099964a4	0	0	0.0000	CRASH	gen=891 glyphs=4
2026-03-14T07:36:45.858694	662cef9d	0	0	0.0000	CRASH	gen=891 glyphs=4
2026-03-14T07:36:45.858976	099964a4	0	0	0.0000	CRASH	gen=892 glyphs=4
2026-03-14T07:36:45.859174	099964a4	0	0	0.0000	CRASH	gen=892 glyphs=4
2026-03-14T07:36:45.859373	099964a4	0	0	0.0000	CRASH	gen=892 glyphs=4
2026-03-14T07:36:45.859571	c8cd8b9b	0	0	0.0000	CRASH	gen=892 glyphs=4
2026-03-14T07:36:45.859766	8da1f8d8	0	0	0.0000	CRASH	gen=892 glyphs=4
2026-03-14T07:36:45.859962	099964a4	0	0	0.0000	CRASH	gen=892 glyphs=4
2026-03-14T07:36:45.860156	099964a4	0	0	0.0000	CRASH	gen=892 glyphs=4
2026-03-14T07:36:45.860355	099964a4	0	0	0.0000	CRASH	gen=892 glyphs=4
2026-03-14T07:36:45.860554	ff30496a	0	0	0.0000	CRASH	gen=892 glyphs=3
2026-03-14T07:36:45.860755	6621806d	0	0	0.0000	CRASH	gen=892 glyphs=4
2026-03-14T07:36:45.861032	099964a4	0	0	0.0000	CRASH	gen=893 glyphs=4
2026-03-14T07:36:45.861238	099964a4	0	0	0.0000	CRASH	gen=893 glyphs=4
2026-03-14T07:36:45.861438	c577ba33	0	0	0.0000	CRASH	gen=893 glyphs=3
2026-03-14T07:36:45.861636	099964a4	0	0	0.0000	CRASH	gen=893 glyphs=4
2026-03-14T07:36:45.861831	7ede4765	0	0	0.0000	CRASH	gen=893 glyphs=2
2026-03-14T07:36:45.862023	7cdcc5c8	0	0	0.0000	CRASH	gen=893 glyphs=3
2026-03-14T07:36:45.862218	ff30496a	0	0	0.0000	CRASH	gen=893 glyphs=3
2026-03-14T07:36:45.862421	099964a4	0	0	0.0000	CRASH	gen=893 glyphs=4
2026-03-14T07:36:45.862621	099964a4	0	0	0.0000	CRASH	gen=893 glyphs=4
2026-03-14T07:36:45.862815	099964a4	0	0	0.0000	CRASH	gen=893 glyphs=4
2026-03-14T07:36:45.863080	099964a4	0	0	0.0000	CRASH	gen=894 glyphs=4
2026-03-14T07:36:45.863274	099964a4	0	0	0.0000	CRASH	gen=894 glyphs=4
2026-03-14T07:36:45.863471	099964a4	0	0	0.0000	CRASH	gen=894 glyphs=4
2026-03-14T07:36:45.863667	099964a4	0	0	0.0000	CRASH	gen=894 glyphs=4
2026-03-14T07:36:45.863859	099964a4	0	0	0.0000	CRASH	gen=894 glyphs=4
2026-03-14T07:36:45.864047	099964a4	0	0	0.0000	CRASH	gen=894 glyphs=4
2026-03-14T07:36:45.864238	5a342646	0	0	0.0000	CRASH	gen=894 glyphs=4
2026-03-14T07:36:45.864430	099964a4	0	0	0.0000	CRASH	gen=894 glyphs=4
2026-03-14T07:36:45.864630	099964a4	0	0	0.0000	CRASH	gen=894 glyphs=4
2026-03-14T07:36:45.864820	ff30496a	0	0	0.0000	CRASH	gen=894 glyphs=3
2026-03-14T07:36:45.865094	099964a4	0	0	0.0000	CRASH	gen=895 glyphs=4
2026-03-14T07:36:45.865287	099964a4	0	0	0.0000	CRASH	gen=895 glyphs=4
2026-03-14T07:36:45.865478	099964a4	0	0	0.0000	CRASH	gen=895 glyphs=4
2026-03-14T07:36:45.865676	099964a4	0	0	0.0000	CRASH	gen=895 glyphs=4
2026-03-14T07:36:45.865868	099964a4	0	0	0.0000	CRASH	gen=895 glyphs=4
2026-03-14T07:36:45.866059	099964a4	0	0	0.0000	CRASH	gen=895 glyphs=4
2026-03-14T07:36:45.866253	cb7cbe13	0	0	0.0000	CRASH	gen=895 glyphs=4
2026-03-14T07:36:45.866448	dcb1fb50	0	0	0.0000	CRASH	gen=895 glyphs=4
2026-03-14T07:36:45.866661	099964a4	0	0	0.0000	CRASH	gen=895 glyphs=4
2026-03-14T07:36:45.866855	139df6ad	0	0	0.0000	CRASH	gen=895 glyphs=4
2026-03-14T07:36:45.867129	099964a4	0	0	0.0000	CRASH	gen=896 glyphs=4
2026-03-14T07:36:45.867327	099964a4	0	0	0.0000	CRASH	gen=896 glyphs=4
2026-03-14T07:36:45.867529	099964a4	0	0	0.0000	CRASH	gen=896 glyphs=4
2026-03-14T07:36:45.867728	dcb1fb50	0	0	0.0000	CRASH	gen=896 glyphs=4
2026-03-14T07:36:45.867925	dcb1fb50	0	0	0.0000	CRASH	gen=896 glyphs=4
2026-03-14T07:36:45.868122	099964a4	0	0	0.0000	CRASH	gen=896 glyphs=4
2026-03-14T07:36:45.868316	ff30496a	0	0	0.0000	CRASH	gen=896 glyphs=3
2026-03-14T07:36:45.868509	ff30496a	0	0	0.0000	CRASH	gen=896 glyphs=3
2026-03-14T07:36:45.868707	eb395184	0	0	0.0000	CRASH	gen=896 glyphs=4
2026-03-14T07:36:45.868904	2e5831ad	0	0	0.0000	CRASH	gen=896 glyphs=1
2026-03-14T07:36:45.869173	099964a4	0	0	0.0000	CRASH	gen=897 glyphs=4
2026-03-14T07:36:45.869369	099964a4	0	0	0.0000	CRASH	gen=897 glyphs=4
2026-03-14T07:36:45.869565	099964a4	0	0	0.0000	CRASH	gen=897 glyphs=4
2026-03-14T07:36:45.869757	099964a4	0	0	0.0000	CRASH	gen=897 glyphs=4
2026-03-14T07:36:45.869953	099964a4	0	0	0.0000	CRASH	gen=897 glyphs=4
2026-03-14T07:36:45.870144	099964a4	0	0	0.0000	CRASH	gen=897 glyphs=4
2026-03-14T07:36:45.870334	8da1f8d8	0	0	0.0000	CRASH	gen=897 glyphs=4
2026-03-14T07:36:45.870531	099964a4	0	0	0.0000	CRASH	gen=897 glyphs=4
2026-03-14T07:36:45.870724	80cef82b	0	0	0.0000	CRASH	gen=897 glyphs=4
2026-03-14T07:36:45.870923	099964a4	0	0	0.0000	CRASH	gen=897 glyphs=4
2026-03-14T07:36:45.871200	099964a4	0	0	0.0000	CRASH	gen=898 glyphs=4
2026-03-14T07:36:45.871394	099964a4	0	0	0.0000	CRASH	gen=898 glyphs=4
2026-03-14T07:36:45.871592	38ee5a18	0	0	0.0000	CRASH	gen=898 glyphs=4
2026-03-14T07:36:45.871785	099964a4	0	0	0.0000	CRASH	gen=898 glyphs=4
2026-03-14T07:36:45.871982	099964a4	0	0	0.0000	CRASH	gen=898 glyphs=4
2026-03-14T07:36:45.872172	8f1d1470	0	0	0.0000	CRASH	gen=898 glyphs=4
2026-03-14T07:36:45.872367	8da1f8d8	0	0	0.0000	CRASH	gen=898 glyphs=4
2026-03-14T07:36:45.872563	3a734398	0	0	0.0000	CRASH	gen=898 glyphs=4
2026-03-14T07:36:45.872765	582180ed	0	0	0.0000	CRASH	gen=898 glyphs=4
2026-03-14T07:36:45.872959	44ef7dd2	0	0	0.0000	CRASH	gen=898 glyphs=3
2026-03-14T07:36:45.873241	099964a4	0	0	0.0000	CRASH	gen=899 glyphs=4
2026-03-14T07:36:45.873437	099964a4	0	0	0.0000	CRASH	gen=899 glyphs=4
2026-03-14T07:36:45.873633	ff30496a	0	0	0.0000	CRASH	gen=899 glyphs=3
2026-03-14T07:36:45.873828	80cef82b	0	0	0.0000	CRASH	gen=899 glyphs=4
2026-03-14T07:36:45.874021	18d3fc05	0	0	0.0000	CRASH	gen=899 glyphs=3
2026-03-14T07:36:45.874216	aadf6b01	0	0	0.0000	CRASH	gen=899 glyphs=4
2026-03-14T07:36:45.874412	099964a4	0	0	0.0000	CRASH	gen=899 glyphs=4
2026-03-14T07:36:45.874608	dcb1fb50	0	0	0.0000	CRASH	gen=899 glyphs=4
2026-03-14T07:36:45.874802	099964a4	0	0	0.0000	CRASH	gen=899 glyphs=4
2026-03-14T07:36:45.874993	7ede4765	0	0	0.0000	CRASH	gen=899 glyphs=2
2026-03-14T07:36:45.875270	099964a4	0	0	0.0000	CRASH	gen=900 glyphs=4
2026-03-14T07:36:45.875463	099964a4	0	0	0.0000	CRASH	gen=900 glyphs=4
2026-03-14T07:36:45.875657	8da1f8d8	0	0	0.0000	CRASH	gen=900 glyphs=4
2026-03-14T07:36:45.875852	099964a4	0	0	0.0000	CRASH	gen=900 glyphs=4
2026-03-14T07:36:45.876042	cf93b656	0	0	0.0000	CRASH	gen=900 glyphs=3
2026-03-14T07:36:45.876236	099964a4	0	0	0.0000	CRASH	gen=900 glyphs=4
2026-03-14T07:36:45.876427	099964a4	0	0	0.0000	CRASH	gen=900 glyphs=4
2026-03-14T07:36:45.876621	ac9e0df6	0	0	0.0000	CRASH	gen=900 glyphs=4
2026-03-14T07:36:45.876816	099964a4	0	0	0.0000	CRASH	gen=900 glyphs=4
2026-03-14T07:36:45.877008	099964a4	0	0	0.0000	CRASH	gen=900 glyphs=4
2026-03-14T07:36:45.877297	099964a4	0	0	0.0000	CRASH	gen=901 glyphs=4
2026-03-14T07:36:45.877493	099964a4	0	0	0.0000	CRASH	gen=901 glyphs=4
2026-03-14T07:36:45.877689	3e58ec22	0	0	0.0000	CRASH	gen=901 glyphs=4
2026-03-14T07:36:45.877885	37101e60	0	0	0.0000	CRASH	gen=901 glyphs=5
2026-03-14T07:36:45.878077	cff02457	0	0	0.0000	CRASH	gen=901 glyphs=4
2026-03-14T07:36:45.878277	099964a4	0	0	0.0000	CRASH	gen=901 glyphs=4
2026-03-14T07:36:45.878469	a1c32920	0	0	0.0000	CRASH	gen=901 glyphs=2
2026-03-14T07:36:45.878665	c61f4ba6	0	0	0.0000	CRASH	gen=901 glyphs=3
2026-03-14T07:36:45.878859	099964a4	0	0	0.0000	CRASH	gen=901 glyphs=4
2026-03-14T07:36:45.879050	e161ce7a	0	0	0.0000	CRASH	gen=901 glyphs=4
2026-03-14T07:36:45.879324	099964a4	0	0	0.0000	CRASH	gen=902 glyphs=4
2026-03-14T07:36:45.879523	099964a4	0	0	0.0000	CRASH	gen=902 glyphs=4
2026-03-14T07:36:45.879716	25dc355a	0	0	0.0000	CRASH	gen=902 glyphs=4
2026-03-14T07:36:45.879911	099964a4	0	0	0.0000	CRASH	gen=902 glyphs=4
2026-03-14T07:36:45.880103	4ac6afc5	0	0	0.0000	CRASH	gen=902 glyphs=4
2026-03-14T07:36:45.880295	cf93b656	0	0	0.0000	CRASH	gen=902 glyphs=3
2026-03-14T07:36:45.880492	099964a4	0	0	0.0000	CRASH	gen=902 glyphs=4
2026-03-14T07:36:45.880687	099964a4	0	0	0.0000	CRASH	gen=902 glyphs=4
2026-03-14T07:36:45.880885	3ca14993	0	0	0.0000	CRASH	gen=902 glyphs=4
2026-03-14T07:36:45.881078	099964a4	0	0	0.0000	CRASH	gen=902 glyphs=4
2026-03-14T07:36:45.881349	099964a4	0	0	0.0000	CRASH	gen=903 glyphs=4
2026-03-14T07:36:45.881549	099964a4	0	0	0.0000	CRASH	gen=903 glyphs=4
2026-03-14T07:36:45.881742	099964a4	0	0	0.0000	CRASH	gen=903 glyphs=4
2026-03-14T07:36:45.881930	099964a4	0	0	0.0000	CRASH	gen=903 glyphs=4
2026-03-14T07:36:45.882118	099964a4	0	0	0.0000	CRASH	gen=903 glyphs=4
2026-03-14T07:36:45.882307	3ca14993	0	0	0.0000	CRASH	gen=903 glyphs=4
2026-03-14T07:36:45.882500	099964a4	0	0	0.0000	CRASH	gen=903 glyphs=4
2026-03-14T07:36:45.882722	ff30496a	0	0	0.0000	CRASH	gen=903 glyphs=3
2026-03-14T07:36:45.882913	5cd5b5ec	0	0	0.0000	CRASH	gen=903 glyphs=3
2026-03-14T07:36:45.883106	099964a4	0	0	0.0000	CRASH	gen=903 glyphs=4
2026-03-14T07:36:45.883383	099964a4	0	0	0.0000	CRASH	gen=904 glyphs=4
2026-03-14T07:36:45.883588	099964a4	0	0	0.0000	CRASH	gen=904 glyphs=4
2026-03-14T07:36:45.883786	d0684187	0	0	0.0000	CRASH	gen=904 glyphs=4
2026-03-14T07:36:45.883985	c1193d2a	0	0	0.0000	CRASH	gen=904 glyphs=4
2026-03-14T07:36:45.884183	d72fe3bd	0	0	0.0000	CRASH	gen=904 glyphs=4
2026-03-14T07:36:45.884379	099964a4	0	0	0.0000	CRASH	gen=904 glyphs=4
2026-03-14T07:36:45.884575	3a734398	0	0	0.0000	CRASH	gen=904 glyphs=4
2026-03-14T07:36:45.884772	93f1e9f9	0	0	0.0000	CRASH	gen=904 glyphs=3
2026-03-14T07:36:45.884966	9e8bad2e	0	0	0.0000	CRASH	gen=904 glyphs=3
2026-03-14T07:36:45.885159	099964a4	0	0	0.0000	CRASH	gen=904 glyphs=4
2026-03-14T07:36:45.885435	099964a4	0	0	0.0000	CRASH	gen=905 glyphs=4
2026-03-14T07:36:45.885632	099964a4	0	0	0.0000	CRASH	gen=905 glyphs=4
2026-03-14T07:36:45.885830	099964a4	0	0	0.0000	CRASH	gen=905 glyphs=4
2026-03-14T07:36:45.886024	8f745d2a	0	0	0.0000	CRASH	gen=905 glyphs=3
2026-03-14T07:36:45.886217	099964a4	0	0	0.0000	CRASH	gen=905 glyphs=4
2026-03-14T07:36:45.886409	dcb1fb50	0	0	0.0000	CRASH	gen=905 glyphs=4
2026-03-14T07:36:45.886604	c5974b39	0	0	0.0000	CRASH	gen=905 glyphs=2
2026-03-14T07:36:45.886802	099964a4	0	0	0.0000	CRASH	gen=905 glyphs=4
2026-03-14T07:36:45.886996	8d600f8b	0	0	0.0000	CRASH	gen=905 glyphs=3
2026-03-14T07:36:45.887191	2a59c603	0	0	0.0000	CRASH	gen=905 glyphs=4
2026-03-14T07:36:45.887463	099964a4	0	0	0.0000	CRASH	gen=906 glyphs=4
2026-03-14T07:36:45.887658	099964a4	0	0	0.0000	CRASH	gen=906 glyphs=4
2026-03-14T07:36:45.887856	099964a4	0	0	0.0000	CRASH	gen=906 glyphs=4
2026-03-14T07:36:45.888049	084fa98f	0	0	0.0000	CRASH	gen=906 glyphs=4
2026-03-14T07:36:45.888242	099964a4	0	0	0.0000	CRASH	gen=906 glyphs=4
2026-03-14T07:36:45.888434	099964a4	0	0	0.0000	CRASH	gen=906 glyphs=4
2026-03-14T07:36:45.888629	85fde1a4	0	0	0.0000	CRASH	gen=906 glyphs=4
2026-03-14T07:36:45.888828	099964a4	0	0	0.0000	CRASH	gen=906 glyphs=4
2026-03-14T07:36:45.889023	cf93b656	0	0	0.0000	CRASH	gen=906 glyphs=3
2026-03-14T07:36:45.889228	099964a4	0	0	0.0000	CRASH	gen=906 glyphs=4
2026-03-14T07:36:45.889499	099964a4	0	0	0.0000	CRASH	gen=907 glyphs=4
2026-03-14T07:36:45.889695	099964a4	0	0	0.0000	CRASH	gen=907 glyphs=4
2026-03-14T07:36:45.889888	76feebe7	0	0	0.0000	CRASH	gen=907 glyphs=3
2026-03-14T07:36:45.890083	8d246b63	0	0	0.0000	CRASH	gen=907 glyphs=4
2026-03-14T07:36:45.890274	e70f075c	0	0	0.0000	CRASH	gen=907 glyphs=4
2026-03-14T07:36:45.890466	099964a4	0	0	0.0000	CRASH	gen=907 glyphs=4
2026-03-14T07:36:45.890658	099964a4	0	0	0.0000	CRASH	gen=907 glyphs=4
2026-03-14T07:36:45.890848	099964a4	0	0	0.0000	CRASH	gen=907 glyphs=4
2026-03-14T07:36:45.891045	c3c55919	0	0	0.0000	CRASH	gen=907 glyphs=3
2026-03-14T07:36:45.891238	31f3beb4	0	0	0.0000	CRASH	gen=907 glyphs=4
2026-03-14T07:36:45.891502	099964a4	0	0	0.0000	CRASH	gen=908 glyphs=4
2026-03-14T07:36:45.891701	099964a4	0	0	0.0000	CRASH	gen=908 glyphs=4
2026-03-14T07:36:45.891893	c9d89c72	0	0	0.0000	CRASH	gen=908 glyphs=4
2026-03-14T07:36:45.892092	099964a4	0	0	0.0000	CRASH	gen=908 glyphs=4
2026-03-14T07:36:45.892295	099964a4	0	0	0.0000	CRASH	gen=908 glyphs=4
2026-03-14T07:36:45.892487	099964a4	0	0	0.0000	CRASH	gen=908 glyphs=4
2026-03-14T07:36:45.892681	099964a4	0	0	0.0000	CRASH	gen=908 glyphs=4
2026-03-14T07:36:45.892873	89971369	0	0	0.0000	CRASH	gen=908 glyphs=3
2026-03-14T07:36:45.893072	099964a4	0	0	0.0000	CRASH	gen=908 glyphs=4
2026-03-14T07:36:45.893264	099964a4	0	0	0.0000	CRASH	gen=908 glyphs=4
2026-03-14T07:36:45.893537	099964a4	0	0	0.0000	CRASH	gen=909 glyphs=4
2026-03-14T07:36:45.893732	099964a4	0	0	0.0000	CRASH	gen=909 glyphs=4
2026-03-14T07:36:45.893924	099964a4	0	0	0.0000	CRASH	gen=909 glyphs=4
2026-03-14T07:36:45.894120	edfe1d78	0	0	0.0000	CRASH	gen=909 glyphs=4
2026-03-14T07:36:45.894314	099964a4	0	0	0.0000	CRASH	gen=909 glyphs=4
2026-03-14T07:36:45.894503	e4a6322a	0	0	0.0000	CRASH	gen=909 glyphs=2
2026-03-14T07:36:45.894695	3a6ef47c	0	0	0.0000	CRASH	gen=909 glyphs=4
2026-03-14T07:36:45.894887	ff30496a	0	0	0.0000	CRASH	gen=909 glyphs=3
2026-03-14T07:36:45.895077	17cfd2eb	0	0	0.0000	CRASH	gen=909 glyphs=3
2026-03-14T07:36:45.895274	099964a4	0	0	0.0000	CRASH	gen=909 glyphs=4
2026-03-14T07:36:45.895554	099964a4	0	0	0.0000	CRASH	gen=910 glyphs=4
2026-03-14T07:36:45.895748	099964a4	0	0	0.0000	CRASH	gen=910 glyphs=4
2026-03-14T07:36:45.895940	80cef82b	0	0	0.0000	CRASH	gen=910 glyphs=4
2026-03-14T07:36:45.896133	dfaab8fa	0	0	0.0000	CRASH	gen=910 glyphs=3
2026-03-14T07:36:45.896330	ad877745	0	0	0.0000	CRASH	gen=910 glyphs=4
2026-03-14T07:36:45.896528	3a734398	0	0	0.0000	CRASH	gen=910 glyphs=4
2026-03-14T07:36:45.896721	3ca14993	0	0	0.0000	CRASH	gen=910 glyphs=4
2026-03-14T07:36:45.896917	7ede4765	0	0	0.0000	CRASH	gen=910 glyphs=2
2026-03-14T07:36:45.897105	099964a4	0	0	0.0000	CRASH	gen=910 glyphs=4
2026-03-14T07:36:45.897298	099964a4	0	0	0.0000	CRASH	gen=910 glyphs=4
2026-03-14T07:36:45.897584	099964a4	0	0	0.0000	CRASH	gen=911 glyphs=4
2026-03-14T07:36:45.897780	099964a4	0	0	0.0000	CRASH	gen=911 glyphs=4
2026-03-14T07:36:45.897973	bbcb15f0	0	0	0.0000	CRASH	gen=911 glyphs=4
2026-03-14T07:36:45.898167	8114b094	0	0	0.0000	CRASH	gen=911 glyphs=4
2026-03-14T07:36:45.898365	099964a4	0	0	0.0000	CRASH	gen=911 glyphs=4
2026-03-14T07:36:45.898560	099964a4	0	0	0.0000	CRASH	gen=911 glyphs=4
2026-03-14T07:36:45.898753	099964a4	0	0	0.0000	CRASH	gen=911 glyphs=4
2026-03-14T07:36:45.898944	099964a4	0	0	0.0000	CRASH	gen=911 glyphs=4
2026-03-14T07:36:45.899138	099964a4	0	0	0.0000	CRASH	gen=911 glyphs=4
2026-03-14T07:36:45.899328	1d7e2ce7	0	0	0.0000	CRASH	gen=911 glyphs=3
2026-03-14T07:36:45.899606	099964a4	0	0	0.0000	CRASH	gen=912 glyphs=4
2026-03-14T07:36:45.899800	099964a4	0	0	0.0000	CRASH	gen=912 glyphs=4
2026-03-14T07:36:45.899989	099964a4	0	0	0.0000	CRASH	gen=912 glyphs=4
2026-03-14T07:36:45.900179	099964a4	0	0	0.0000	CRASH	gen=912 glyphs=4
2026-03-14T07:36:45.900367	857352eb	0	0	0.0000	CRASH	gen=912 glyphs=5
2026-03-14T07:36:45.900565	099964a4	0	0	0.0000	CRASH	gen=912 glyphs=4
2026-03-14T07:36:45.900753	099964a4	0	0	0.0000	CRASH	gen=912 glyphs=4
2026-03-14T07:36:45.900942	eaccc5f1	0	0	0.0000	CRASH	gen=912 glyphs=4
2026-03-14T07:36:45.901133	099964a4	0	0	0.0000	CRASH	gen=912 glyphs=4
2026-03-14T07:36:45.901327	099964a4	0	0	0.0000	CRASH	gen=912 glyphs=4
2026-03-14T07:36:45.901622	099964a4	0	0	0.0000	CRASH	gen=913 glyphs=4
2026-03-14T07:36:45.901816	099964a4	0	0	0.0000	CRASH	gen=913 glyphs=4
2026-03-14T07:36:45.902008	cfde0d9a	0	0	0.0000	CRASH	gen=913 glyphs=4
2026-03-14T07:36:45.902202	099964a4	0	0	0.0000	CRASH	gen=913 glyphs=4
2026-03-14T07:36:45.902396	099964a4	0	0	0.0000	CRASH	gen=913 glyphs=4
2026-03-14T07:36:45.902601	099964a4	0	0	0.0000	CRASH	gen=913 glyphs=4
2026-03-14T07:36:45.902794	dcb1fb50	0	0	0.0000	CRASH	gen=913 glyphs=4
2026-03-14T07:36:45.902988	099964a4	0	0	0.0000	CRASH	gen=913 glyphs=4
2026-03-14T07:36:45.903179	cccbaa59	0	0	0.0000	CRASH	gen=913 glyphs=4
2026-03-14T07:36:45.903373	f7ab74be	0	0	0.0000	CRASH	gen=913 glyphs=2
2026-03-14T07:36:45.903651	099964a4	0	0	0.0000	CRASH	gen=914 glyphs=4
2026-03-14T07:36:45.903845	099964a4	0	0	0.0000	CRASH	gen=914 glyphs=4
2026-03-14T07:36:45.904037	099964a4	0	0	0.0000	CRASH	gen=914 glyphs=4
2026-03-14T07:36:45.904232	24838eff	0	0	0.0000	CRASH	gen=914 glyphs=4
2026-03-14T07:36:45.904430	8da1f8d8	0	0	0.0000	CRASH	gen=914 glyphs=4
2026-03-14T07:36:45.904627	099964a4	0	0	0.0000	CRASH	gen=914 glyphs=4
2026-03-14T07:36:45.904823	ed49e049	0	0	0.0000	CRASH	gen=914 glyphs=3
2026-03-14T07:36:45.905017	cf93b656	0	0	0.0000	CRASH	gen=914 glyphs=3
2026-03-14T07:36:45.905208	7bea3d63	0	0	0.0000	CRASH	gen=914 glyphs=4
2026-03-14T07:36:45.905400	099964a4	0	0	0.0000	CRASH	gen=914 glyphs=4
2026-03-14T07:36:45.905688	099964a4	0	0	0.0000	CRASH	gen=915 glyphs=4
2026-03-14T07:36:45.905888	099964a4	0	0	0.0000	CRASH	gen=915 glyphs=4
2026-03-14T07:36:45.906079	65cfea24	0	0	0.0000	CRASH	gen=915 glyphs=3
2026-03-14T07:36:45.906273	97659fe0	0	0	0.0000	CRASH	gen=915 glyphs=4
2026-03-14T07:36:45.906465	cfbd5535	0	0	0.0000	CRASH	gen=915 glyphs=2
2026-03-14T07:36:45.906663	099964a4	0	0	0.0000	CRASH	gen=915 glyphs=4
2026-03-14T07:36:45.906857	099964a4	0	0	0.0000	CRASH	gen=915 glyphs=4
2026-03-14T07:36:45.907049	3ca14993	0	0	0.0000	CRASH	gen=915 glyphs=4
2026-03-14T07:36:45.907244	a214cd1c	0	0	0.0000	CRASH	gen=915 glyphs=5
2026-03-14T07:36:45.907438	79804e88	0	0	0.0000	CRASH	gen=915 glyphs=5
2026-03-14T07:36:45.907720	099964a4	0	0	0.0000	CRASH	gen=916 glyphs=4
2026-03-14T07:36:45.907916	099964a4	0	0	0.0000	CRASH	gen=916 glyphs=4
2026-03-14T07:36:45.908108	099964a4	0	0	0.0000	CRASH	gen=916 glyphs=4
2026-03-14T07:36:45.908301	099964a4	0	0	0.0000	CRASH	gen=916 glyphs=4
2026-03-14T07:36:45.908492	099964a4	0	0	0.0000	CRASH	gen=916 glyphs=4
2026-03-14T07:36:45.908684	4cda9aa6	0	0	0.0000	CRASH	gen=916 glyphs=2
2026-03-14T07:36:45.908878	a2630e40	0	0	0.0000	CRASH	gen=916 glyphs=3
2026-03-14T07:36:45.909074	80cef82b	0	0	0.0000	CRASH	gen=916 glyphs=4
2026-03-14T07:36:45.909267	099964a4	0	0	0.0000	CRASH	gen=916 glyphs=4
2026-03-14T07:36:45.909458	cf93b656	0	0	0.0000	CRASH	gen=916 glyphs=3
2026-03-14T07:36:45.909734	099964a4	0	0	0.0000	CRASH	gen=917 glyphs=4
2026-03-14T07:36:45.909933	099964a4	0	0	0.0000	CRASH	gen=917 glyphs=4
2026-03-14T07:36:45.910130	155e7363	0	0	0.0000	CRASH	gen=917 glyphs=2
2026-03-14T07:36:45.910322	cf93b656	0	0	0.0000	CRASH	gen=917 glyphs=3
2026-03-14T07:36:45.910514	099964a4	0	0	0.0000	CRASH	gen=917 glyphs=4
2026-03-14T07:36:45.910708	099964a4	0	0	0.0000	CRASH	gen=917 glyphs=4
2026-03-14T07:36:45.910901	38cde996	0	0	0.0000	CRASH	gen=917 glyphs=3
2026-03-14T07:36:45.911100	099964a4	0	0	0.0000	CRASH	gen=917 glyphs=4
2026-03-14T07:36:45.911297	099964a4	0	0	0.0000	CRASH	gen=917 glyphs=4
2026-03-14T07:36:45.911493	099964a4	0	0	0.0000	CRASH	gen=917 glyphs=4
2026-03-14T07:36:45.911773	099964a4	0	0	0.0000	CRASH	gen=918 glyphs=4
2026-03-14T07:36:45.911968	099964a4	0	0	0.0000	CRASH	gen=918 glyphs=4
2026-03-14T07:36:45.912166	d511e18a	0	0	0.0000	CRASH	gen=918 glyphs=4
2026-03-14T07:36:45.912359	8da1f8d8	0	0	0.0000	CRASH	gen=918 glyphs=4
2026-03-14T07:36:45.912554	099964a4	0	0	0.0000	CRASH	gen=918 glyphs=4
2026-03-14T07:36:45.912745	dcb1fb50	0	0	0.0000	CRASH	gen=918 glyphs=4
2026-03-14T07:36:45.912937	39e2ac49	0	0	0.0000	CRASH	gen=918 glyphs=5
2026-03-14T07:36:45.913131	950453f5	0	0	0.0000	CRASH	gen=918 glyphs=3
2026-03-14T07:36:45.913326	099964a4	0	0	0.0000	CRASH	gen=918 glyphs=4
2026-03-14T07:36:45.913519	d9425f86	0	0	0.0000	CRASH	gen=918 glyphs=5
2026-03-14T07:36:45.913797	099964a4	0	0	0.0000	CRASH	gen=919 glyphs=4
2026-03-14T07:36:45.913991	099964a4	0	0	0.0000	CRASH	gen=919 glyphs=4
2026-03-14T07:36:45.914187	a20199d2	0	0	0.0000	CRASH	gen=919 glyphs=3
2026-03-14T07:36:45.914382	099964a4	0	0	0.0000	CRASH	gen=919 glyphs=4
2026-03-14T07:36:45.914577	dcb1fb50	0	0	0.0000	CRASH	gen=919 glyphs=4
2026-03-14T07:36:45.914769	099964a4	0	0	0.0000	CRASH	gen=919 glyphs=4
2026-03-14T07:36:45.914962	099964a4	0	0	0.0000	CRASH	gen=919 glyphs=4
2026-03-14T07:36:45.915152	099964a4	0	0	0.0000	CRASH	gen=919 glyphs=4
2026-03-14T07:36:45.915352	099964a4	0	0	0.0000	CRASH	gen=919 glyphs=4
2026-03-14T07:36:45.915548	099964a4	0	0	0.0000	CRASH	gen=919 glyphs=4
2026-03-14T07:36:45.915820	099964a4	0	0	0.0000	CRASH	gen=920 glyphs=4
2026-03-14T07:36:45.916017	099964a4	0	0	0.0000	CRASH	gen=920 glyphs=4
2026-03-14T07:36:45.916208	4282c208	0	0	0.0000	CRASH	gen=920 glyphs=3
2026-03-14T07:36:45.916405	099964a4	0	0	0.0000	CRASH	gen=920 glyphs=4
2026-03-14T07:36:45.916596	6a663610	0	0	0.0000	CRASH	gen=920 glyphs=3
2026-03-14T07:36:45.916789	d4e3605d	0	0	0.0000	CRASH	gen=920 glyphs=3
2026-03-14T07:36:45.916982	099964a4	0	0	0.0000	CRASH	gen=920 glyphs=4
