timestamp	program_hash	spirv_size	word_count	fitness	status	description
2026-03-13T21:58:45.353748	099964a4	0	0	0.0000	CRASH	gen=0 glyphs=4
2026-03-13T21:58:47.037679	04c4ecc6	0	0	0.0000	CRASH	gen=0 glyphs=4
2026-03-13T21:58:48.756440	5e47268f	116	29	0.9500	KEEP	gen=0 glyphs=4
2026-03-13T21:58:50.455264	099964a4	0	0	0.0000	CRASH	gen=0 glyphs=4
2026-03-13T21:58:52.135396	a0a00c11	0	0	0.0000	CRASH	gen=0 glyphs=4
2026-03-13T21:58:53.772804	099964a4	0	0	0.0000	CRASH	gen=0 glyphs=4
2026-03-13T21:58:55.432268	099964a4	0	0	0.0000	CRASH	gen=0 glyphs=4
2026-03-13T21:58:57.102832	099964a4	0	0	0.0000	CRASH	gen=0 glyphs=4
2026-03-13T21:58:58.754420	470cd12c	0	0	0.0000	CRASH	gen=0 glyphs=4
2026-03-13T21:59:00.425112	099964a4	0	0	0.0000	CRASH	gen=0 glyphs=4
2026-03-13T21:59:02.088822	046a6e56	120	30	0.9500	DISCARD	gen=1 glyphs=4
2026-03-13T21:59:03.787693	099964a4	0	0	0.0000	CRASH	gen=1 glyphs=4
2026-03-13T21:59:05.466167	099964a4	0	0	0.0000	CRASH	gen=1 glyphs=4
2026-03-13T21:59:07.120097	099964a4	0	0	0.0000	CRASH	gen=1 glyphs=4
2026-03-13T21:59:08.779227	b57e7176	120	30	1.0000	DISCARD	gen=1 glyphs=4
2026-03-13T21:59:10.437403	1e5f0e21	116	29	1.0000	DISCARD	gen=1 glyphs=4
2026-03-13T21:59:12.098052	8aef8872	116	29	1.0000	DISCARD	gen=1 glyphs=4
2026-03-13T21:59:13.800757	0eaedb57	116	29	1.0000	DISCARD	gen=1 glyphs=4
2026-03-13T21:59:15.475286	5e47268f	116	29	0.9500	DISCARD	gen=1 glyphs=4
2026-03-13T21:59:17.144175	a75ce236	116	29	0.9500	DISCARD	gen=1 glyphs=4
2026-03-13T21:59:18.832183	19355583	120	30	1.0000	DISCARD	gen=2 glyphs=4
2026-03-13T21:59:20.505415	8aef8872	116	29	1.0000	DISCARD	gen=2 glyphs=4
2026-03-13T21:59:22.175879	420f193c	120	30	1.0000	DISCARD	gen=2 glyphs=4
2026-03-13T21:59:23.852983	19355583	120	30	1.0000	DISCARD	gen=2 glyphs=4
2026-03-13T21:59:25.514676	f2765ea6	116	29	1.0000	DISCARD	gen=2 glyphs=4
2026-03-13T21:59:27.174909	67cb81be	120	30	1.0000	DISCARD	gen=2 glyphs=4
2026-03-13T21:59:28.849800	19355583	120	30	1.0000	DISCARD	gen=2 glyphs=4
2026-03-13T21:59:30.517835	28b31068	116	29	1.0000	DISCARD	gen=2 glyphs=4
2026-03-13T21:59:32.178686	e8c7f6cf	120	30	1.0000	DISCARD	gen=2 glyphs=4
2026-03-13T21:59:33.858138	0eaedb57	116	29	1.0000	DISCARD	gen=2 glyphs=4
2026-03-13T21:59:35.556061	19355583	120	30	1.0000	DISCARD	gen=3 glyphs=4
2026-03-13T21:59:37.219525	8aef8872	116	29	1.0000	DISCARD	gen=3 glyphs=4
2026-03-13T21:59:38.877878	d3237b6e	116	29	0.9500	DISCARD	gen=3 glyphs=4
2026-03-13T21:59:40.547924	eca7ab6c	116	29	1.0000	DISCARD	gen=3 glyphs=4
2026-03-13T21:59:42.216545	8aef8872	116	29	1.0000	DISCARD	gen=3 glyphs=4
2026-03-13T21:59:43.879822	b7aed8e9	116	29	1.0000	DISCARD	gen=3 glyphs=4
2026-03-13T21:59:45.559584	0eaedb57	116	29	1.0000	DISCARD	gen=3 glyphs=4
2026-03-13T21:59:47.231968	050862ad	120	30	1.0000	DISCARD	gen=3 glyphs=4
2026-03-13T21:59:48.907935	19355583	120	30	1.0000	DISCARD	gen=3 glyphs=4
2026-03-13T21:59:50.668271	0eaedb57	116	29	1.0000	DISCARD	gen=3 glyphs=4
2026-03-13T21:59:52.353338	19355583	120	30	1.0000	DISCARD	gen=4 glyphs=4
2026-03-13T21:59:54.030021	8aef8872	116	29	1.0000	DISCARD	gen=4 glyphs=4
2026-03-13T21:59:55.732396	67cb81be	120	30	1.0000	DISCARD	gen=4 glyphs=4
2026-03-13T21:59:57.404017	8aef8872	116	29	1.0000	DISCARD	gen=4 glyphs=4
2026-03-13T21:59:59.083802	a992f022	116	29	1.0000	DISCARD	gen=4 glyphs=4
2026-03-13T22:00:00.744070	ae44ace5	116	29	1.0000	DISCARD	gen=4 glyphs=4
2026-03-13T22:00:02.440642	a78f9454	120	30	1.0000	DISCARD	gen=4 glyphs=4
2026-03-13T22:00:04.119191	8aef8872	116	29	1.0000	DISCARD	gen=4 glyphs=4
2026-03-13T22:00:05.807350	22cc7e21	116	29	1.0000	DISCARD	gen=4 glyphs=4
2026-03-13T22:00:07.499451	b7aed8e9	116	29	1.0000	DISCARD	gen=4 glyphs=4
2026-03-13T22:00:09.181923	19355583	120	30	1.0000	DISCARD	gen=5 glyphs=4
2026-03-13T22:00:10.848957	8aef8872	116	29	1.0000	DISCARD	gen=5 glyphs=4
2026-03-13T22:00:12.542703	4eae0799	116	29	1.0000	DISCARD	gen=5 glyphs=4
2026-03-13T22:00:14.261349	050862ad	120	30	1.0000	DISCARD	gen=5 glyphs=4
2026-03-13T22:00:15.958226	19355583	120	30	1.0000	DISCARD	gen=5 glyphs=4
2026-03-13T22:00:17.637270	41a7dfaa	116	29	1.0000	DISCARD	gen=5 glyphs=4
2026-03-13T22:00:19.309250	ae44ace5	116	29	1.0000	DISCARD	gen=5 glyphs=4
2026-03-13T22:00:21.037295	a78f9454	120	30	1.0000	DISCARD	gen=5 glyphs=4
2026-03-13T22:00:22.785794	6eb58410	116	29	1.0000	DISCARD	gen=5 glyphs=4
2026-03-13T22:00:24.477643	0ef57364	116	29	1.0000	DISCARD	gen=5 glyphs=4
2026-03-13T22:00:26.174049	19355583	120	30	1.0000	DISCARD	gen=6 glyphs=4
2026-03-13T22:00:27.873944	8aef8872	116	29	1.0000	DISCARD	gen=6 glyphs=4
2026-03-13T22:00:29.547510	50dc991d	116	29	1.0000	DISCARD	gen=6 glyphs=4
2026-03-13T22:00:31.224277	19355583	120	30	1.0000	DISCARD	gen=6 glyphs=4
2026-03-13T22:00:32.927041	050862ad	120	30	1.0000	DISCARD	gen=6 glyphs=4
2026-03-13T22:00:34.598818	8aef8872	116	29	1.0000	DISCARD	gen=6 glyphs=4
2026-03-13T22:00:36.293563	8aef8872	116	29	1.0000	DISCARD	gen=6 glyphs=4
2026-03-13T22:00:37.973853	d53b87b3	120	30	1.0000	DISCARD	gen=6 glyphs=4
2026-03-13T22:00:39.673544	e2cd28ea	120	30	1.0000	DISCARD	gen=6 glyphs=4
2026-03-13T22:00:41.378449	050862ad	120	30	1.0000	DISCARD	gen=6 glyphs=4
2026-03-13T22:00:43.071584	19355583	120	30	1.0000	DISCARD	gen=7 glyphs=4
2026-03-13T22:00:44.769732	8aef8872	116	29	1.0000	DISCARD	gen=7 glyphs=4
2026-03-13T22:00:46.471048	0eaedb57	116	29	1.0000	DISCARD	gen=7 glyphs=4
2026-03-13T22:00:48.167551	142af0b7	116	29	0.9500	DISCARD	gen=7 glyphs=4
2026-03-13T22:00:49.844186	3cc97f71	116	29	1.0000	DISCARD	gen=7 glyphs=4
2026-03-13T22:01:05.236600	050862ad	120	30	1.0000	DISCARD	gen=7 glyphs=4
2026-03-13T22:01:06.913114	19355583	120	30	1.0000	DISCARD	gen=7 glyphs=4
2026-03-13T22:01:08.610103	19355583	120	30	1.0000	DISCARD	gen=7 glyphs=4
2026-03-13T22:01:10.326506	a81bb232	116	29	1.0000	DISCARD	gen=7 glyphs=4
2026-03-13T22:01:12.008409	875e0f8a	116	29	1.0000	DISCARD	gen=7 glyphs=4
2026-03-13T22:01:13.713898	19355583	120	30	1.0000	DISCARD	gen=8 glyphs=4
2026-03-13T22:01:15.422186	8aef8872	116	29	1.0000	DISCARD	gen=8 glyphs=4
2026-03-13T22:01:17.102138	242aa41c	116	29	1.0000	DISCARD	gen=8 glyphs=4
2026-03-13T22:01:18.809819	e2cd28ea	120	30	1.0000	DISCARD	gen=8 glyphs=4
2026-03-13T22:01:31.165694	46985da7	116	29	1.0000	DISCARD	gen=8 glyphs=4
2026-03-13T22:01:32.880944	e2cd28ea	120	30	1.0000	DISCARD	gen=8 glyphs=4
2026-03-13T22:01:34.579822	8aef8872	116	29	1.0000	DISCARD	gen=8 glyphs=4
2026-03-13T22:01:36.280201	1e5f0e21	116	29	1.0000	DISCARD	gen=8 glyphs=4
2026-03-13T22:01:38.166942	9e34ede0	116	29	1.0000	DISCARD	gen=8 glyphs=4
2026-03-13T22:01:39.862118	feaa5adb	124	31	0.9500	DISCARD	gen=8 glyphs=4
2026-03-13T22:01:41.572610	19355583	120	30	1.0000	DISCARD	gen=9 glyphs=4
2026-03-13T22:01:43.267008	8aef8872	116	29	1.0000	DISCARD	gen=9 glyphs=4
2026-03-13T22:01:44.975877	050862ad	120	30	1.0000	DISCARD	gen=9 glyphs=4
2026-03-13T22:01:46.661263	0eaedb57	116	29	1.0000	DISCARD	gen=9 glyphs=4
2026-03-13T22:01:48.351961	1e5f0e21	116	29	1.0000	DISCARD	gen=9 glyphs=4
2026-03-13T22:01:50.045082	55256360	116	29	1.0000	DISCARD	gen=9 glyphs=4
2026-03-13T22:01:51.741132	e8c7f6cf	120	30	1.0000	DISCARD	gen=9 glyphs=4
2026-03-13T22:01:53.433897	0a27917f	116	29	1.0000	DISCARD	gen=9 glyphs=4
2026-03-13T22:01:55.141409	5999dfc5	120	30	1.0000	DISCARD	gen=9 glyphs=4
2026-03-13T22:01:56.915371	b7aed8e9	116	29	1.0000	DISCARD	gen=9 glyphs=4
2026-03-13T22:01:58.642854	19355583	120	30	1.0000	DISCARD	gen=10 glyphs=4
2026-03-13T22:02:00.336531	8aef8872	116	29	1.0000	DISCARD	gen=10 glyphs=4
2026-03-13T22:02:02.034043	875e0f8a	116	29	1.0000	DISCARD	gen=10 glyphs=4
2026-03-13T22:02:03.750622	ae44ace5	116	29	1.0000	DISCARD	gen=10 glyphs=4
2026-03-13T22:02:05.443686	b7aed8e9	116	29	1.0000	DISCARD	gen=10 glyphs=4
2026-03-13T22:02:07.151703	e8c7f6cf	120	30	1.0000	DISCARD	gen=10 glyphs=4
2026-03-13T22:02:08.840279	8aef8872	116	29	1.0000	DISCARD	gen=10 glyphs=4
2026-03-13T22:02:10.535632	19355583	120	30	1.0000	DISCARD	gen=10 glyphs=4
2026-03-13T22:02:12.240112	8aef8872	116	29	1.0000	DISCARD	gen=10 glyphs=4
2026-03-13T22:02:13.943182	50dc991d	116	29	1.0000	DISCARD	gen=10 glyphs=4
2026-03-13T22:02:15.642982	19355583	120	30	1.0000	DISCARD	gen=11 glyphs=4
2026-03-13T22:02:17.354073	8aef8872	116	29	1.0000	DISCARD	gen=11 glyphs=4
2026-03-13T22:02:19.049523	9448883b	120	30	1.0000	DISCARD	gen=11 glyphs=4
2026-03-13T22:02:20.747167	19355583	120	30	1.0000	DISCARD	gen=11 glyphs=4
2026-03-13T22:02:22.453384	8aef8872	116	29	1.0000	DISCARD	gen=11 glyphs=4
2026-03-13T22:02:24.174691	9bf205eb	120	30	1.0000	DISCARD	gen=11 glyphs=4
2026-03-13T22:02:25.913114	c3cea47e	116	29	1.0000	DISCARD	gen=11 glyphs=4
2026-03-13T22:02:27.656656	a78f9454	120	30	1.0000	DISCARD	gen=11 glyphs=4
2026-03-13T22:02:29.411381	0eaedb57	116	29	1.0000	DISCARD	gen=11 glyphs=4
2026-03-13T22:02:31.106803	8aef8872	116	29	1.0000	DISCARD	gen=11 glyphs=4
2026-03-13T22:02:32.815913	19355583	120	30	1.0000	DISCARD	gen=12 glyphs=4
2026-03-13T22:02:34.544373	8aef8872	116	29	1.0000	DISCARD	gen=12 glyphs=4
2026-03-13T22:02:36.259475	af5ddf65	116	29	1.0000	DISCARD	gen=12 glyphs=4
2026-03-13T22:02:37.989476	8aef8872	116	29	1.0000	DISCARD	gen=12 glyphs=4
2026-03-13T22:02:39.713356	b9197639	116	29	1.0000	DISCARD	gen=12 glyphs=4
2026-03-13T22:02:41.431619	875e0f8a	116	29	1.0000	DISCARD	gen=12 glyphs=4
2026-03-13T22:02:43.120882	67cb81be	120	30	1.0000	DISCARD	gen=12 glyphs=4
2026-03-13T22:02:44.831564	54af73ca	116	29	1.0000	DISCARD	gen=12 glyphs=4
2026-03-13T22:02:46.541250	0eaedb57	116	29	1.0000	DISCARD	gen=12 glyphs=4
2026-03-13T22:02:48.250319	875e0f8a	116	29	1.0000	DISCARD	gen=12 glyphs=4
2026-03-13T22:02:49.969770	19355583	120	30	1.0000	DISCARD	gen=13 glyphs=4
2026-03-13T22:02:51.680595	8aef8872	116	29	1.0000	DISCARD	gen=13 glyphs=4
2026-03-13T22:02:53.382977	19355583	120	30	1.0000	DISCARD	gen=13 glyphs=4
2026-03-13T22:02:55.089510	eca7ab6c	116	29	1.0000	DISCARD	gen=13 glyphs=4
2026-03-13T22:02:56.816672	50dc991d	116	29	1.0000	DISCARD	gen=13 glyphs=4
2026-03-13T22:02:58.515321	8aef8872	116	29	1.0000	DISCARD	gen=13 glyphs=4
2026-03-13T22:03:00.276027	c8459c81	120	30	1.0000	DISCARD	gen=13 glyphs=4
2026-03-13T22:03:01.991842	0eaedb57	116	29	1.0000	DISCARD	gen=13 glyphs=4
2026-03-13T22:03:03.686158	58a83e3e	120	30	0.9500	DISCARD	gen=13 glyphs=4
2026-03-13T22:03:05.394863	f083f5aa	120	30	1.0000	DISCARD	gen=13 glyphs=4
2026-03-13T22:03:07.101489	19355583	120	30	1.0000	DISCARD	gen=14 glyphs=4
2026-03-13T22:03:08.828627	8aef8872	116	29	1.0000	DISCARD	gen=14 glyphs=4
2026-03-13T22:03:10.527351	e8c7f6cf	120	30	1.0000	DISCARD	gen=14 glyphs=4
2026-03-13T22:03:12.254067	6c98ee8a	116	29	1.0000	DISCARD	gen=14 glyphs=4
2026-03-13T22:03:13.965793	67cb81be	120	30	1.0000	DISCARD	gen=14 glyphs=4
2026-03-13T22:03:15.675626	8aef8872	116	29	1.0000	DISCARD	gen=14 glyphs=4
2026-03-13T22:03:17.367386	e2cd28ea	120	30	1.0000	DISCARD	gen=14 glyphs=4
2026-03-13T22:03:19.070450	ab321dc6	116	29	1.0000	DISCARD	gen=14 glyphs=4
2026-03-13T22:03:20.778510	90705cbe	116	29	1.0000	DISCARD	gen=14 glyphs=4
2026-03-13T22:03:22.496426	050862ad	120	30	1.0000	DISCARD	gen=14 glyphs=4
2026-03-13T22:03:24.216438	19355583	120	30	1.0000	DISCARD	gen=15 glyphs=4
2026-03-13T22:03:25.942841	8aef8872	116	29	1.0000	DISCARD	gen=15 glyphs=4
2026-03-13T22:03:27.673871	2decd666	116	29	0.9500	DISCARD	gen=15 glyphs=4
2026-03-13T22:03:29.361345	050862ad	120	30	1.0000	DISCARD	gen=15 glyphs=4
2026-03-13T22:03:31.126500	de9a39c6	116	29	1.0000	DISCARD	gen=15 glyphs=4
2026-03-13T22:03:37.870854	0eaedb57	116	29	1.0000	DISCARD	gen=15 glyphs=4
2026-03-13T22:03:39.546996	b7aed8e9	116	29	1.0000	DISCARD	gen=15 glyphs=4
2026-03-13T22:03:41.248172	95f562fa	116	29	1.0000	DISCARD	gen=15 glyphs=4
2026-03-13T22:03:42.956605	e2cd28ea	120	30	1.0000	DISCARD	gen=15 glyphs=4
2026-03-13T22:03:44.644642	19355583	120	30	1.0000	DISCARD	gen=15 glyphs=4
2026-03-13T22:03:46.348437	19355583	120	30	1.0000	DISCARD	gen=16 glyphs=4
2026-03-13T22:03:48.042701	8aef8872	116	29	1.0000	DISCARD	gen=16 glyphs=4
2026-03-13T22:03:49.729339	c79393bb	120	30	1.0000	DISCARD	gen=16 glyphs=4
2026-03-13T22:03:51.437415	e2cd28ea	120	30	1.0000	DISCARD	gen=16 glyphs=4
2026-03-13T22:03:53.143538	b57e7176	120	30	1.0000	DISCARD	gen=16 glyphs=4
2026-03-13T22:03:54.830589	19355583	120	30	1.0000	DISCARD	gen=16 glyphs=4
2026-03-13T22:03:56.540388	ae44ace5	116	29	1.0000	DISCARD	gen=16 glyphs=4
2026-03-13T22:03:58.246910	050862ad	120	30	1.0000	DISCARD	gen=16 glyphs=4
2026-03-13T22:03:59.946076	3f6d5f6e	116	29	1.0000	DISCARD	gen=16 glyphs=4
2026-03-13T22:04:01.647701	0dd312d5	116	29	1.0000	DISCARD	gen=16 glyphs=4
2026-03-13T22:04:03.454557	19355583	120	30	1.0000	DISCARD	gen=17 glyphs=4
2026-03-13T22:04:05.168584	8aef8872	116	29	1.0000	DISCARD	gen=17 glyphs=4
2026-03-13T22:04:06.886764	050862ad	120	30	1.0000	DISCARD	gen=17 glyphs=4
2026-03-13T22:04:08.622838	40fa55d4	120	30	1.0000	DISCARD	gen=17 glyphs=4
2026-03-13T22:04:10.340938	a41171a7	116	29	1.0000	DISCARD	gen=17 glyphs=4
2026-03-13T22:04:12.063768	cb9e904f	116	29	1.0000	DISCARD	gen=17 glyphs=4
2026-03-13T22:04:13.768935	50dc991d	116	29	1.0000	DISCARD	gen=17 glyphs=4
2026-03-13T22:04:15.485505	cae6e45f	120	30	0.9500	DISCARD	gen=17 glyphs=4
2026-03-13T22:04:17.173656	e090e30c	116	29	1.0000	DISCARD	gen=17 glyphs=4
2026-03-13T22:04:18.894318	0eaedb57	116	29	1.0000	DISCARD	gen=17 glyphs=4
2026-03-13T22:04:20.666342	19355583	120	30	1.0000	DISCARD	gen=18 glyphs=4
2026-03-13T22:04:22.403716	8aef8872	116	29	1.0000	DISCARD	gen=18 glyphs=4
2026-03-13T22:04:24.111010	9e34ede0	116	29	1.0000	DISCARD	gen=18 glyphs=4
2026-03-13T22:04:25.829401	67cb81be	120	30	1.0000	DISCARD	gen=18 glyphs=4
2026-03-13T22:04:27.556568	fc9fed35	116	29	1.0000	DISCARD	gen=18 glyphs=4
2026-03-13T22:04:29.281063	2611df5e	116	29	0.9500	DISCARD	gen=18 glyphs=4
2026-03-13T22:04:30.976930	b7aed8e9	116	29	1.0000	DISCARD	gen=18 glyphs=4
2026-03-13T22:04:32.712182	e431980b	120	30	1.0000	DISCARD	gen=18 glyphs=4
2026-03-13T22:04:34.447876	050862ad	120	30	1.0000	DISCARD	gen=18 glyphs=4
2026-03-13T22:04:36.200200	a78f9454	120	30	1.0000	DISCARD	gen=18 glyphs=4
2026-03-13T22:04:37.913191	19355583	120	30	1.0000	DISCARD	gen=19 glyphs=4
2026-03-13T22:04:39.658099	8aef8872	116	29	1.0000	DISCARD	gen=19 glyphs=4
2026-03-13T22:04:41.370162	1e5f0e21	116	29	1.0000	DISCARD	gen=19 glyphs=4
2026-03-13T22:04:43.090128	74888562	116	29	1.0000	DISCARD	gen=19 glyphs=4
2026-03-13T22:04:44.810144	207dc911	124	31	0.9500	DISCARD	gen=19 glyphs=4
2026-03-13T22:04:46.531094	62ae9200	120	30	1.0000	DISCARD	gen=19 glyphs=4
2026-03-13T22:04:48.254058	2e3bbaef	120	30	1.0000	DISCARD	gen=19 glyphs=4
2026-03-13T22:04:49.972658	b7aed8e9	116	29	1.0000	DISCARD	gen=19 glyphs=4
2026-03-13T22:04:51.679923	50169021	116	29	1.0000	DISCARD	gen=19 glyphs=4
2026-03-13T22:04:53.387412	ae44ace5	116	29	1.0000	DISCARD	gen=19 glyphs=4
2026-03-13T22:04:55.085382	19355583	120	30	1.0000	DISCARD	gen=20 glyphs=4
2026-03-13T22:05:00.088790	8aef8872	116	29	1.0000	DISCARD	gen=20 glyphs=4
2026-03-13T22:05:01.786073	cc7c2342	116	29	1.0000	DISCARD	gen=20 glyphs=4
2026-03-13T22:05:03.514610	eca7ab6c	116	29	1.0000	DISCARD	gen=20 glyphs=4
2026-03-13T22:05:05.229441	19355583	120	30	1.0000	DISCARD	gen=20 glyphs=4
2026-03-13T22:05:07.056540	eca7ab6c	116	29	1.0000	DISCARD	gen=20 glyphs=4
2026-03-13T22:05:08.782000	d7c8681b	120	30	1.0000	DISCARD	gen=20 glyphs=4
2026-03-13T22:05:10.471753	8aef8872	116	29	1.0000	DISCARD	gen=20 glyphs=4
2026-03-13T22:05:12.179824	67cb81be	120	30	1.0000	DISCARD	gen=20 glyphs=4
2026-03-13T22:05:13.874243	050862ad	120	30	1.0000	DISCARD	gen=20 glyphs=4
2026-03-13T22:05:15.589978	19355583	120	30	1.0000	DISCARD	gen=21 glyphs=4
2026-03-13T22:05:17.289886	8aef8872	116	29	1.0000	DISCARD	gen=21 glyphs=4
2026-03-13T22:05:18.997767	854a4589	116	29	1.0000	DISCARD	gen=21 glyphs=4
2026-03-13T22:05:24.446761	8aef8872	116	29	1.0000	DISCARD	gen=21 glyphs=4
2026-03-13T22:05:26.148640	19355583	120	30	1.0000	DISCARD	gen=21 glyphs=4
2026-03-13T22:05:27.855144	ae44ace5	116	29	1.0000	DISCARD	gen=21 glyphs=4
2026-03-13T22:05:29.752651	c789cfed	116	29	1.0000	DISCARD	gen=21 glyphs=4
2026-03-13T22:05:31.474709	9e34ede0	116	29	1.0000	DISCARD	gen=21 glyphs=4
2026-03-13T22:05:33.183919	8aef8872	116	29	1.0000	DISCARD	gen=21 glyphs=4
2026-03-13T22:05:34.869319	e875d546	116	29	0.9500	DISCARD	gen=21 glyphs=4
2026-03-13T22:05:44.965752	19355583	120	30	1.0000	DISCARD	gen=22 glyphs=4
2026-03-13T22:05:46.687371	8aef8872	116	29	1.0000	DISCARD	gen=22 glyphs=4
2026-03-13T22:05:48.418669	e2cd28ea	120	30	1.0000	DISCARD	gen=22 glyphs=4
2026-03-13T22:05:50.124065	b7aed8e9	116	29	1.0000	DISCARD	gen=22 glyphs=4
2026-03-13T22:05:51.821706	95f9de7d	120	30	1.0000	DISCARD	gen=22 glyphs=4
2026-03-13T22:05:53.522890	0eaedb57	116	29	1.0000	DISCARD	gen=22 glyphs=4
2026-03-13T22:05:55.251239	0eaedb57	116	29	1.0000	DISCARD	gen=22 glyphs=4
2026-03-13T22:05:56.977900	0eaedb57	116	29	1.0000	DISCARD	gen=22 glyphs=4
2026-03-13T22:05:58.694231	1d68d50c	116	29	1.0000	DISCARD	gen=22 glyphs=4
2026-03-13T22:06:00.402291	1e5f0e21	116	29	1.0000	DISCARD	gen=22 glyphs=4
2026-03-13T22:06:02.121769	19355583	120	30	1.0000	DISCARD	gen=23 glyphs=4
2026-03-13T22:06:03.839588	8aef8872	116	29	1.0000	DISCARD	gen=23 glyphs=4
2026-03-13T22:06:05.577141	0eaedb57	116	29	1.0000	DISCARD	gen=23 glyphs=4
2026-03-13T22:06:07.282971	b57e7176	120	30	1.0000	DISCARD	gen=23 glyphs=4
2026-03-13T22:06:09.001003	050862ad	120	30	1.0000	DISCARD	gen=23 glyphs=4
2026-03-13T22:06:10.769533	d7c8681b	120	30	1.0000	DISCARD	gen=23 glyphs=4
2026-03-13T22:06:12.507665	8aef8872	116	29	1.0000	DISCARD	gen=23 glyphs=4
2026-03-13T22:06:14.221809	050862ad	120	30	1.0000	DISCARD	gen=23 glyphs=4
2026-03-13T22:06:15.948370	67cb81be	120	30	1.0000	DISCARD	gen=23 glyphs=4
2026-03-13T22:06:17.676535	8aef8872	116	29	1.0000	DISCARD	gen=23 glyphs=4
2026-03-13T22:06:19.402184	19355583	120	30	1.0000	DISCARD	gen=24 glyphs=4
2026-03-13T22:06:21.160648	8aef8872	116	29	1.0000	DISCARD	gen=24 glyphs=4
2026-03-13T22:06:22.914465	e8c7f6cf	120	30	1.0000	DISCARD	gen=24 glyphs=4
2026-03-13T22:06:24.628424	050862ad	120	30	1.0000	DISCARD	gen=24 glyphs=4
2026-03-13T22:06:26.343610	19355583	120	30	1.0000	DISCARD	gen=24 glyphs=4
2026-03-13T22:06:28.073329	050862ad	120	30	1.0000	DISCARD	gen=24 glyphs=4
2026-03-13T22:06:29.815340	99c2e9f6	120	30	1.0000	DISCARD	gen=24 glyphs=4
2026-03-13T22:06:31.534605	289fb9db	116	29	1.0000	DISCARD	gen=24 glyphs=4
2026-03-13T22:06:33.244416	c3731552	116	29	1.0000	DISCARD	gen=24 glyphs=4
2026-03-13T22:06:35.025152	d099a39e	116	29	1.0000	DISCARD	gen=24 glyphs=4
2026-03-13T22:06:36.767824	19355583	120	30	1.0000	DISCARD	gen=25 glyphs=4
2026-03-13T22:06:38.496249	8aef8872	116	29	1.0000	DISCARD	gen=25 glyphs=4
2026-03-13T22:06:40.231171	875e0f8a	116	29	1.0000	DISCARD	gen=25 glyphs=4
2026-03-13T22:06:41.970068	2cf60714	116	29	1.0000	DISCARD	gen=25 glyphs=4
2026-03-13T22:06:43.700992	8aef8872	116	29	1.0000	DISCARD	gen=25 glyphs=4
2026-03-13T22:06:45.409982	4c2a30e7	116	29	1.0000	DISCARD	gen=25 glyphs=4
2026-03-13T22:06:47.122202	050862ad	120	30	1.0000	DISCARD	gen=25 glyphs=4
2026-03-13T22:06:48.845073	0eaedb57	116	29	1.0000	DISCARD	gen=25 glyphs=4
2026-03-13T22:06:50.559066	19355583	120	30	1.0000	DISCARD	gen=25 glyphs=4
2026-03-13T22:06:52.275097	e2cd28ea	120	30	1.0000	DISCARD	gen=25 glyphs=4
2026-03-13T22:06:53.981656	19355583	120	30	1.0000	DISCARD	gen=26 glyphs=4
2026-03-13T22:06:55.733294	8aef8872	116	29	1.0000	DISCARD	gen=26 glyphs=4
2026-03-13T22:06:57.438403	0eaedb57	116	29	1.0000	DISCARD	gen=26 glyphs=4
2026-03-13T22:06:59.146763	19355583	120	30	1.0000	DISCARD	gen=26 glyphs=4
2026-03-13T22:07:00.859966	67cb81be	120	30	1.0000	DISCARD	gen=26 glyphs=4
2026-03-13T22:07:02.584883	50dc991d	116	29	1.0000	DISCARD	gen=26 glyphs=4
2026-03-13T22:07:04.304122	3d82c4b6	116	29	1.0000	DISCARD	gen=26 glyphs=4
2026-03-13T22:07:06.031728	8aef8872	116	29	1.0000	DISCARD	gen=26 glyphs=4
2026-03-13T22:07:07.755490	eca7ab6c	116	29	1.0000	DISCARD	gen=26 glyphs=4
2026-03-13T22:07:09.476061	50dc991d	116	29	1.0000	DISCARD	gen=26 glyphs=4
2026-03-13T22:07:11.189778	19355583	120	30	1.0000	DISCARD	gen=27 glyphs=4
2026-03-13T22:07:12.908582	8aef8872	116	29	1.0000	DISCARD	gen=27 glyphs=4
2026-03-13T22:07:14.775248	4cdd876f	120	30	1.0000	DISCARD	gen=27 glyphs=4
2026-03-13T22:07:16.516577	8aef8872	116	29	1.0000	DISCARD	gen=27 glyphs=4
2026-03-13T22:07:18.241082	b7aed8e9	116	29	1.0000	DISCARD	gen=27 glyphs=4
2026-03-13T22:07:19.987814	cc7a6aba	120	30	1.0000	DISCARD	gen=27 glyphs=4
2026-03-13T22:07:21.705080	1d5fdb24	116	29	1.0000	DISCARD	gen=27 glyphs=4
2026-03-13T22:07:23.446757	9e34ede0	116	29	1.0000	DISCARD	gen=27 glyphs=4
2026-03-13T22:07:25.183488	1e5f0e21	116	29	1.0000	DISCARD	gen=27 glyphs=4
2026-03-13T22:07:26.915915	19355583	120	30	1.0000	DISCARD	gen=27 glyphs=4
2026-03-13T22:07:28.629318	19355583	120	30	1.0000	DISCARD	gen=28 glyphs=4
2026-03-13T22:07:30.365562	8aef8872	116	29	1.0000	DISCARD	gen=28 glyphs=4
2026-03-13T22:07:32.088159	c36b29ce	116	29	1.0000	DISCARD	gen=28 glyphs=4
2026-03-13T22:07:33.826151	0eaedb57	116	29	1.0000	DISCARD	gen=28 glyphs=4
2026-03-13T22:07:35.585768	ed4c31d3	120	30	1.0000	DISCARD	gen=28 glyphs=4
2026-03-13T22:07:37.327723	e8c7f6cf	120	30	1.0000	DISCARD	gen=28 glyphs=4
2026-03-13T22:07:39.086313	ae44ace5	116	29	1.0000	DISCARD	gen=28 glyphs=4
2026-03-13T22:07:40.786376	8aef8872	116	29	1.0000	DISCARD	gen=28 glyphs=4
2026-03-13T22:07:42.516381	50dc991d	116	29	1.0000	DISCARD	gen=28 glyphs=4
2026-03-13T22:07:44.268372	ae44ace5	116	29	1.0000	DISCARD	gen=28 glyphs=4
2026-03-13T22:07:46.142812	19355583	120	30	1.0000	DISCARD	gen=29 glyphs=4
2026-03-13T22:07:47.899537	8aef8872	116	29	1.0000	DISCARD	gen=29 glyphs=4
2026-03-13T22:07:49.651835	9e34ede0	116	29	1.0000	DISCARD	gen=29 glyphs=4
2026-03-13T22:07:51.420076	67cb81be	120	30	1.0000	DISCARD	gen=29 glyphs=4
2026-03-13T22:07:53.188272	0eaedb57	116	29	1.0000	DISCARD	gen=29 glyphs=4
2026-03-13T22:07:54.937600	67cb81be	120	30	1.0000	DISCARD	gen=29 glyphs=4
2026-03-13T22:07:56.681716	50dc991d	116	29	1.0000	DISCARD	gen=29 glyphs=4
