timestamp	program_hash	spirv_size	word_count	fitness	status	description
2026-03-14T02:48:22.294744	fdb5d108	120	30	1.0000	DISCARD	gen=592 glyphs=4
2026-03-14T02:48:22.581582	1e5f0e21	116	29	1.0000	DISCARD	gen=636 glyphs=4
2026-03-14T02:48:25.030280	e07b4614	116	29	1.0000	DISCARD	gen=592 glyphs=4
2026-03-14T02:48:25.297559	e2cd28ea	120	30	1.0000	DISCARD	gen=636 glyphs=4
2026-03-14T02:48:27.760144	08671261	116	29	0.9500	DISCARD	gen=592 glyphs=4
2026-03-14T02:48:28.042400	727a9659	116	29	0.9500	DISCARD	gen=636 glyphs=4
2026-03-14T02:48:30.496816	37f4017b	116	29	1.0000	DISCARD	gen=593 glyphs=4
2026-03-14T02:48:30.774979	ae44ace5	116	29	1.0000	DISCARD	gen=636 glyphs=4
2026-03-14T02:48:33.242776	bfdf7cad	120	30	1.0000	DISCARD	gen=593 glyphs=4
2026-03-14T02:48:33.509226	19355583	120	30	1.0000	DISCARD	gen=637 glyphs=4
2026-03-14T02:48:35.961686	5a06ca32	120	30	1.0000	DISCARD	gen=593 glyphs=4
2026-03-14T02:48:36.230256	8aef8872	116	29	1.0000	DISCARD	gen=637 glyphs=4
2026-03-14T02:48:38.725711	a24e0041	120	30	1.0000	DISCARD	gen=593 glyphs=4
2026-03-14T02:48:38.992233	48c164fc	116	29	1.0000	DISCARD	gen=637 glyphs=4
2026-03-14T02:48:41.415574	605a8234	116	29	1.0000	DISCARD	gen=593 glyphs=4
2026-03-14T02:48:41.686258	9e34ede0	116	29	1.0000	DISCARD	gen=637 glyphs=4
2026-03-14T02:48:44.104457	37f4017b	116	29	1.0000	DISCARD	gen=593 glyphs=4
2026-03-14T02:48:44.381368	e2cd28ea	120	30	1.0000	DISCARD	gen=637 glyphs=4
2026-03-14T02:48:46.900023	d11c1062	120	30	1.0000	DISCARD	gen=593 glyphs=4
2026-03-14T02:48:47.167114	0eaedb57	116	29	1.0000	DISCARD	gen=637 glyphs=4
2026-03-14T02:48:49.597537	8f08117e	116	29	1.0000	DISCARD	gen=593 glyphs=4
2026-03-14T02:48:49.868870	c7dca7b3	116	29	1.0000	DISCARD	gen=637 glyphs=4
2026-03-14T02:48:52.296536	1d34459a	116	29	1.0000	DISCARD	gen=593 glyphs=4
2026-03-14T02:48:52.564572	210770d4	116	29	1.0000	DISCARD	gen=637 glyphs=4
2026-03-14T02:48:55.046958	4c9b0dd4	120	30	1.0000	DISCARD	gen=593 glyphs=4
2026-03-14T02:48:55.315935	0eaedb57	116	29	1.0000	DISCARD	gen=637 glyphs=4
2026-03-14T02:48:57.759037	37f4017b	116	29	1.0000	DISCARD	gen=594 glyphs=4
2026-03-14T02:48:58.036924	8aef8872	116	29	1.0000	DISCARD	gen=637 glyphs=4
2026-03-14T02:49:00.493938	bfdf7cad	120	30	1.0000	DISCARD	gen=594 glyphs=4
2026-03-14T02:49:00.764011	19355583	120	30	1.0000	DISCARD	gen=638 glyphs=4
2026-03-14T02:49:03.314622	37f4017b	116	29	1.0000	DISCARD	gen=594 glyphs=4
2026-03-14T02:49:03.596765	8aef8872	116	29	1.0000	DISCARD	gen=638 glyphs=4
2026-03-14T02:49:06.077656	5a06ca32	120	30	1.0000	DISCARD	gen=594 glyphs=4
2026-03-14T02:49:06.358288	8aef8872	116	29	1.0000	DISCARD	gen=638 glyphs=4
2026-03-14T02:49:08.827256	37f4017b	116	29	1.0000	DISCARD	gen=594 glyphs=4
2026-03-14T02:49:09.109130	eca7ab6c	116	29	1.0000	DISCARD	gen=638 glyphs=4
2026-03-14T02:49:11.592588	1d34459a	116	29	1.0000	DISCARD	gen=594 glyphs=4
2026-03-14T02:49:11.854060	eca7ab6c	116	29	1.0000	DISCARD	gen=638 glyphs=4
2026-03-14T02:49:14.298252	5a06ca32	120	30	1.0000	DISCARD	gen=594 glyphs=4
2026-03-14T02:49:14.579268	741a708e	116	29	1.0000	DISCARD	gen=638 glyphs=4
2026-03-14T02:49:17.112468	37f4017b	116	29	1.0000	DISCARD	gen=594 glyphs=4
2026-03-14T02:49:17.408383	9e34ede0	116	29	1.0000	DISCARD	gen=638 glyphs=4
2026-03-14T02:49:19.890044	5a06ca32	120	30	1.0000	DISCARD	gen=594 glyphs=4
2026-03-14T02:49:20.161888	19355583	120	30	1.0000	DISCARD	gen=638 glyphs=4
2026-03-14T02:49:22.621622	1e61f44c	116	29	1.0000	DISCARD	gen=594 glyphs=4
2026-03-14T02:49:22.895217	050862ad	120	30	1.0000	DISCARD	gen=638 glyphs=4
2026-03-14T02:49:25.354364	37f4017b	116	29	1.0000	DISCARD	gen=595 glyphs=4
2026-03-14T02:49:25.622454	5554683a	116	29	1.0000	DISCARD	gen=638 glyphs=4
2026-03-14T02:49:28.064336	bfdf7cad	120	30	1.0000	DISCARD	gen=595 glyphs=4
2026-03-14T02:49:28.331127	19355583	120	30	1.0000	DISCARD	gen=639 glyphs=4
2026-03-14T02:49:30.757565	37f4017b	116	29	1.0000	DISCARD	gen=595 glyphs=4
2026-03-14T02:49:31.036267	8aef8872	116	29	1.0000	DISCARD	gen=639 glyphs=4
2026-03-14T02:49:33.470334	fdb5d108	120	30	1.0000	DISCARD	gen=595 glyphs=4
2026-03-14T02:49:33.746361	a78f9454	120	30	1.0000	DISCARD	gen=639 glyphs=4
2026-03-14T02:49:36.264753	55d6c151	120	30	1.0000	DISCARD	gen=595 glyphs=4
2026-03-14T02:49:36.545156	b57e7176	120	30	1.0000	DISCARD	gen=639 glyphs=4
2026-03-14T02:49:39.083560	d7f4ff0f	120	30	0.9500	DISCARD	gen=595 glyphs=4
2026-03-14T02:49:39.362637	8aef8872	116	29	1.0000	DISCARD	gen=639 glyphs=4
2026-03-14T02:49:41.829739	5a06ca32	120	30	1.0000	DISCARD	gen=595 glyphs=4
2026-03-14T02:49:42.118830	050862ad	120	30	1.0000	DISCARD	gen=639 glyphs=4
2026-03-14T02:49:44.636160	5a06ca32	120	30	1.0000	DISCARD	gen=595 glyphs=4
2026-03-14T02:49:44.898638	050862ad	120	30	1.0000	DISCARD	gen=639 glyphs=4
2026-03-14T02:49:47.347051	7ca87b42	116	29	1.0000	DISCARD	gen=595 glyphs=4
2026-03-14T02:49:47.608577	875e0f8a	116	29	1.0000	DISCARD	gen=639 glyphs=4
2026-03-14T02:49:50.219345	7ca87b42	116	29	1.0000	DISCARD	gen=595 glyphs=4
2026-03-14T02:49:50.504025	9e34ede0	116	29	1.0000	DISCARD	gen=639 glyphs=4
2026-03-14T02:49:52.949875	37f4017b	116	29	1.0000	DISCARD	gen=596 glyphs=4
2026-03-14T02:49:53.219715	eca7ab6c	116	29	1.0000	DISCARD	gen=639 glyphs=4
2026-03-14T02:49:55.666161	bfdf7cad	120	30	1.0000	DISCARD	gen=596 glyphs=4
2026-03-14T02:49:55.919387	19355583	120	30	1.0000	DISCARD	gen=640 glyphs=4
2026-03-14T02:49:58.348902	55d6c151	120	30	1.0000	DISCARD	gen=596 glyphs=4
2026-03-14T02:49:58.615512	8aef8872	116	29	1.0000	DISCARD	gen=640 glyphs=4
2026-03-14T02:50:01.036650	55d6c151	120	30	1.0000	DISCARD	gen=596 glyphs=4
2026-03-14T02:50:01.324610	eab9dbec	116	29	0.9500	DISCARD	gen=640 glyphs=4
2026-03-14T02:50:03.743351	37f4017b	116	29	1.0000	DISCARD	gen=596 glyphs=4
2026-03-14T02:50:04.013279	7aa836ed	120	30	1.0000	DISCARD	gen=640 glyphs=4
2026-03-14T02:50:06.500994	20d941d6	120	30	1.0000	DISCARD	gen=596 glyphs=4
2026-03-14T02:50:06.764025	339af21d	116	29	1.0000	DISCARD	gen=640 glyphs=4
2026-03-14T02:50:09.211939	37f4017b	116	29	1.0000	DISCARD	gen=596 glyphs=4
2026-03-14T02:50:09.491152	8c4a1828	116	29	1.0000	DISCARD	gen=640 glyphs=4
2026-03-14T02:50:11.920610	aea73d64	116	29	1.0000	DISCARD	gen=596 glyphs=4
2026-03-14T02:50:12.190355	0062fac9	120	30	0.9500	DISCARD	gen=640 glyphs=4
2026-03-14T02:50:14.635667	37f4017b	116	29	1.0000	DISCARD	gen=596 glyphs=4
2026-03-14T02:50:14.903186	b57e7176	120	30	1.0000	DISCARD	gen=640 glyphs=4
2026-03-14T02:50:17.346804	5a06ca32	120	30	1.0000	DISCARD	gen=596 glyphs=4
2026-03-14T02:50:17.615981	8aef8872	116	29	1.0000	DISCARD	gen=640 glyphs=4
2026-03-14T02:50:20.054967	37f4017b	116	29	1.0000	DISCARD	gen=597 glyphs=4
2026-03-14T02:50:20.354993	1e5f0e21	116	29	1.0000	DISCARD	gen=640 glyphs=4
2026-03-14T02:50:22.864093	bfdf7cad	120	30	1.0000	DISCARD	gen=597 glyphs=4
2026-03-14T02:50:23.143440	19355583	120	30	1.0000	DISCARD	gen=641 glyphs=4
2026-03-14T02:50:25.610546	2701cb73	116	29	1.0000	DISCARD	gen=597 glyphs=4
2026-03-14T02:50:25.881039	8aef8872	116	29	1.0000	DISCARD	gen=641 glyphs=4
2026-03-14T02:50:28.350342	cab0d726	116	29	1.0000	DISCARD	gen=597 glyphs=4
2026-03-14T02:50:28.623443	b7aed8e9	116	29	1.0000	DISCARD	gen=641 glyphs=4
2026-03-14T02:50:31.035012	37f4017b	116	29	1.0000	DISCARD	gen=597 glyphs=4
2026-03-14T02:50:31.329091	050862ad	120	30	1.0000	DISCARD	gen=641 glyphs=4
2026-03-14T02:50:33.777381	37f4017b	116	29	1.0000	DISCARD	gen=597 glyphs=4
2026-03-14T02:50:34.040003	b7aed8e9	116	29	1.0000	DISCARD	gen=641 glyphs=4
2026-03-14T02:50:36.507362	1d34459a	116	29	1.0000	DISCARD	gen=597 glyphs=4
2026-03-14T02:50:36.789534	d7c8681b	120	30	1.0000	DISCARD	gen=641 glyphs=4
2026-03-14T02:50:39.250881	5a06ca32	120	30	1.0000	DISCARD	gen=597 glyphs=4
2026-03-14T02:50:39.517600	050862ad	120	30	1.0000	DISCARD	gen=641 glyphs=4
2026-03-14T02:50:41.940995	4ee8794c	116	29	1.0000	DISCARD	gen=597 glyphs=4
2026-03-14T02:50:42.213259	99f748b6	120	30	0.9500	DISCARD	gen=641 glyphs=4
2026-03-14T02:50:44.658995	3fd6e0de	116	29	1.0000	DISCARD	gen=597 glyphs=4
2026-03-14T02:50:44.937454	c82fd622	116	29	1.0000	DISCARD	gen=641 glyphs=4
2026-03-14T02:50:47.373135	37f4017b	116	29	1.0000	DISCARD	gen=598 glyphs=4
2026-03-14T02:50:47.648969	8aef8872	116	29	1.0000	DISCARD	gen=641 glyphs=4
2026-03-14T02:50:50.053585	bfdf7cad	120	30	1.0000	DISCARD	gen=598 glyphs=4
2026-03-14T02:50:50.318992	19355583	120	30	1.0000	DISCARD	gen=642 glyphs=4
2026-03-14T02:50:53.155197	37f4017b	116	29	1.0000	DISCARD	gen=598 glyphs=4
2026-03-14T02:50:53.428454	8aef8872	116	29	1.0000	DISCARD	gen=642 glyphs=4
2026-03-14T02:50:55.873295	12b38c2d	116	29	1.0000	DISCARD	gen=598 glyphs=4
2026-03-14T02:50:56.138975	ae44ace5	116	29	1.0000	DISCARD	gen=642 glyphs=4
2026-03-14T02:50:58.592436	fdb5d108	120	30	1.0000	DISCARD	gen=598 glyphs=4
2026-03-14T02:50:58.869220	9e34ede0	116	29	1.0000	DISCARD	gen=642 glyphs=4
2026-03-14T02:51:01.394114	986b828c	120	30	1.0000	DISCARD	gen=598 glyphs=4
2026-03-14T02:51:01.665128	19355583	120	30	1.0000	DISCARD	gen=642 glyphs=4
2026-03-14T02:51:04.121591	5a06ca32	120	30	1.0000	DISCARD	gen=598 glyphs=4
2026-03-14T02:51:04.397159	8aef8872	116	29	1.0000	DISCARD	gen=642 glyphs=4
2026-03-14T02:51:06.820502	f90b9bf8	120	30	1.0000	DISCARD	gen=598 glyphs=4
2026-03-14T02:51:07.089301	875e0f8a	116	29	1.0000	DISCARD	gen=642 glyphs=4
2026-03-14T02:51:09.665234	5a06ca32	120	30	1.0000	DISCARD	gen=598 glyphs=4
2026-03-14T02:51:09.937079	16226588	116	29	1.0000	DISCARD	gen=642 glyphs=4
2026-03-14T02:51:12.394079	bfdf7cad	120	30	1.0000	DISCARD	gen=598 glyphs=4
2026-03-14T02:51:12.665513	b57e7176	120	30	1.0000	DISCARD	gen=642 glyphs=4
2026-03-14T02:51:15.094989	37f4017b	116	29	1.0000	DISCARD	gen=599 glyphs=4
2026-03-14T02:51:15.364361	050862ad	120	30	1.0000	DISCARD	gen=642 glyphs=4
2026-03-14T02:51:18.034914	bfdf7cad	120	30	1.0000	DISCARD	gen=599 glyphs=4
2026-03-14T02:51:18.289035	19355583	120	30	1.0000	DISCARD	gen=643 glyphs=4
2026-03-14T02:51:20.720648	7ca87b42	116	29	1.0000	DISCARD	gen=599 glyphs=4
2026-03-14T02:51:20.989453	8aef8872	116	29	1.0000	DISCARD	gen=643 glyphs=4
2026-03-14T02:51:23.460381	36a86566	116	29	1.0000	DISCARD	gen=599 glyphs=4
2026-03-14T02:51:23.726159	1e5f0e21	116	29	1.0000	DISCARD	gen=643 glyphs=4
2026-03-14T02:51:26.480611	1d2728f0	116	29	1.0000	DISCARD	gen=599 glyphs=4
2026-03-14T02:51:26.752887	8aef8872	116	29	1.0000	DISCARD	gen=643 glyphs=4
2026-03-14T02:51:29.178800	32585e8f	120	30	1.0000	DISCARD	gen=599 glyphs=4
2026-03-14T02:51:29.451822	884cb8bb	116	29	1.0000	DISCARD	gen=643 glyphs=4
2026-03-14T02:51:31.935176	55d6c151	120	30	1.0000	DISCARD	gen=599 glyphs=4
2026-03-14T02:51:32.198645	19355583	120	30	1.0000	DISCARD	gen=643 glyphs=4
2026-03-14T02:51:34.632415	71e2ba66	116	29	1.0000	DISCARD	gen=599 glyphs=4
2026-03-14T02:51:34.906016	8c7984e6	120	30	1.0000	DISCARD	gen=643 glyphs=4
2026-03-14T02:51:37.342520	fdb5d108	120	30	1.0000	DISCARD	gen=599 glyphs=4
2026-03-14T02:51:37.620704	050862ad	120	30	1.0000	DISCARD	gen=643 glyphs=4
2026-03-14T02:51:40.054441	37f4017b	116	29	1.0000	DISCARD	gen=599 glyphs=4
2026-03-14T02:51:40.325314	b7aed8e9	116	29	1.0000	DISCARD	gen=643 glyphs=4
2026-03-14T02:51:42.750934	37f4017b	116	29	1.0000	DISCARD	gen=600 glyphs=4
2026-03-14T02:51:43.033298	e8c7f6cf	120	30	1.0000	DISCARD	gen=643 glyphs=4
2026-03-14T02:51:45.455751	bfdf7cad	120	30	1.0000	DISCARD	gen=600 glyphs=4
2026-03-14T02:51:45.733254	19355583	120	30	1.0000	DISCARD	gen=644 glyphs=4
2026-03-14T02:51:48.175960	71e2ba66	116	29	1.0000	DISCARD	gen=600 glyphs=4
2026-03-14T02:51:48.447632	8aef8872	116	29	1.0000	DISCARD	gen=644 glyphs=4
2026-03-14T02:51:50.861409	fdb5d108	120	30	1.0000	DISCARD	gen=600 glyphs=4
2026-03-14T02:51:51.135617	96e9986d	116	29	1.0000	DISCARD	gen=644 glyphs=4
2026-03-14T02:51:53.602351	71e2ba66	116	29	1.0000	DISCARD	gen=600 glyphs=4
2026-03-14T02:51:53.865512	e2cd28ea	120	30	1.0000	DISCARD	gen=644 glyphs=4
2026-03-14T02:51:56.371837	2701cb73	116	29	1.0000	DISCARD	gen=600 glyphs=4
2026-03-14T02:51:56.655169	eca7ab6c	116	29	1.0000	DISCARD	gen=644 glyphs=4
2026-03-14T02:51:59.107719	5b9807ac	120	30	1.0000	DISCARD	gen=600 glyphs=4
2026-03-14T02:51:59.366524	d7c8681b	120	30	1.0000	DISCARD	gen=644 glyphs=4
2026-03-14T02:52:01.824938	5b9807ac	120	30	1.0000	DISCARD	gen=600 glyphs=4
2026-03-14T02:52:02.094467	f442b663	116	29	1.0000	DISCARD	gen=644 glyphs=4
2026-03-14T02:52:04.519662	f99e1fc2	116	29	1.0000	DISCARD	gen=600 glyphs=4
2026-03-14T02:52:04.787708	3cebd364	116	29	1.0000	DISCARD	gen=644 glyphs=4
2026-03-14T02:52:07.267451	fdb5d108	120	30	1.0000	DISCARD	gen=600 glyphs=4
2026-03-14T02:52:07.548836	b7aed8e9	116	29	1.0000	DISCARD	gen=644 glyphs=4
2026-03-14T02:52:09.995320	37f4017b	116	29	1.0000	DISCARD	gen=601 glyphs=4
2026-03-14T02:52:10.274427	17432bde	116	29	1.0000	DISCARD	gen=644 glyphs=4
2026-03-14T02:52:12.701530	bfdf7cad	120	30	1.0000	DISCARD	gen=601 glyphs=4
2026-03-14T02:52:12.971288	19355583	120	30	1.0000	DISCARD	gen=645 glyphs=4
2026-03-14T02:52:15.391144	fdb5d108	120	30	1.0000	DISCARD	gen=601 glyphs=4
2026-03-14T02:52:15.659596	8aef8872	116	29	1.0000	DISCARD	gen=645 glyphs=4
2026-03-14T02:52:18.233682	5d7a918f	120	30	1.0000	DISCARD	gen=601 glyphs=4
2026-03-14T02:52:18.498473	0eaedb57	116	29	1.0000	DISCARD	gen=645 glyphs=4
2026-03-14T02:52:20.934093	a6b49586	120	30	1.0000	DISCARD	gen=601 glyphs=4
2026-03-14T02:52:21.203123	d7c8681b	120	30	1.0000	DISCARD	gen=645 glyphs=4
2026-03-14T02:52:23.638973	37f4017b	116	29	1.0000	DISCARD	gen=601 glyphs=4
2026-03-14T02:52:23.906292	ae44ace5	116	29	1.0000	DISCARD	gen=645 glyphs=4
2026-03-14T02:52:26.316384	5a06ca32	120	30	1.0000	DISCARD	gen=601 glyphs=4
2026-03-14T02:52:26.578025	b57e7176	120	30	1.0000	DISCARD	gen=645 glyphs=4
2026-03-14T02:52:29.136377	37f4017b	116	29	1.0000	DISCARD	gen=601 glyphs=4
2026-03-14T02:52:29.422198	f1d9b57d	120	30	1.0000	DISCARD	gen=645 glyphs=4
2026-03-14T02:52:31.883255	5a06ca32	120	30	1.0000	DISCARD	gen=601 glyphs=4
2026-03-14T02:52:32.153806	b7aed8e9	116	29	1.0000	DISCARD	gen=645 glyphs=4
2026-03-14T02:52:34.575649	7ca87b42	116	29	1.0000	DISCARD	gen=601 glyphs=4
2026-03-14T02:52:34.856715	30337963	116	29	1.0000	DISCARD	gen=645 glyphs=4
2026-03-14T02:52:37.297605	37f4017b	116	29	1.0000	DISCARD	gen=602 glyphs=4
2026-03-14T02:52:37.566536	b2217c82	116	29	1.0000	DISCARD	gen=645 glyphs=4
2026-03-14T02:52:40.025181	bfdf7cad	120	30	1.0000	DISCARD	gen=602 glyphs=4
2026-03-14T02:52:40.304223	19355583	120	30	1.0000	DISCARD	gen=646 glyphs=4
2026-03-14T02:52:42.736428	5a06ca32	120	30	1.0000	DISCARD	gen=602 glyphs=4
2026-03-14T02:52:43.010756	8aef8872	116	29	1.0000	DISCARD	gen=646 glyphs=4
2026-03-14T02:52:45.650867	4c9b0dd4	120	30	1.0000	DISCARD	gen=602 glyphs=4
2026-03-14T02:52:45.922695	b7aed8e9	116	29	1.0000	DISCARD	gen=646 glyphs=4
2026-03-14T02:52:48.352060	5a06ca32	120	30	1.0000	DISCARD	gen=602 glyphs=4
2026-03-14T02:52:48.629471	d38273b9	120	30	1.0000	DISCARD	gen=646 glyphs=4
2026-03-14T02:52:51.069469	5a06ca32	120	30	1.0000	DISCARD	gen=602 glyphs=4
2026-03-14T02:52:51.343744	8aef8872	116	29	1.0000	DISCARD	gen=646 glyphs=4
2026-03-14T02:52:53.814591	97f089a9	116	29	1.0000	DISCARD	gen=602 glyphs=4
2026-03-14T02:52:54.073485	1e5f0e21	116	29	1.0000	DISCARD	gen=646 glyphs=4
2026-03-14T02:52:56.749412	5a06ca32	120	30	1.0000	DISCARD	gen=602 glyphs=4
2026-03-14T02:52:57.009633	eca7ab6c	116	29	1.0000	DISCARD	gen=646 glyphs=4
2026-03-14T02:52:59.462641	37f4017b	116	29	1.0000	DISCARD	gen=602 glyphs=4
2026-03-14T02:52:59.739918	19355583	120	30	1.0000	DISCARD	gen=646 glyphs=4
2026-03-14T02:53:02.175574	5a06ca32	120	30	1.0000	DISCARD	gen=602 glyphs=4
2026-03-14T02:53:02.441762	1e5f0e21	116	29	1.0000	DISCARD	gen=646 glyphs=4
2026-03-14T02:53:04.857180	37f4017b	116	29	1.0000	DISCARD	gen=603 glyphs=4
2026-03-14T02:53:05.122168	e2cd28ea	120	30	1.0000	DISCARD	gen=646 glyphs=4
2026-03-14T02:53:07.591720	bfdf7cad	120	30	1.0000	DISCARD	gen=603 glyphs=4
2026-03-14T02:53:07.860627	19355583	120	30	1.0000	DISCARD	gen=647 glyphs=4
2026-03-14T02:53:10.284784	9538bd69	116	29	1.0000	DISCARD	gen=603 glyphs=4
2026-03-14T02:53:10.553503	8aef8872	116	29	1.0000	DISCARD	gen=647 glyphs=4
2026-03-14T02:53:12.997323	55d6c151	120	30	1.0000	DISCARD	gen=603 glyphs=4
2026-03-14T02:53:13.267448	aa6f5541	116	29	1.0000	DISCARD	gen=647 glyphs=4
2026-03-14T02:53:15.713218	3e0336ed	116	29	1.0000	DISCARD	gen=603 glyphs=4
2026-03-14T02:53:15.990377	a6ab051b	116	29	1.0000	DISCARD	gen=647 glyphs=4
2026-03-14T02:53:18.609806	5a06ca32	120	30	1.0000	DISCARD	gen=603 glyphs=4
2026-03-14T02:53:18.888527	050862ad	120	30	1.0000	DISCARD	gen=647 glyphs=4
2026-03-14T02:53:21.313597	0b8cf692	116	29	1.0000	DISCARD	gen=603 glyphs=4
2026-03-14T02:53:21.575953	3e2efe24	116	29	1.0000	DISCARD	gen=647 glyphs=4
2026-03-14T02:53:24.040132	bfdf7cad	120	30	1.0000	DISCARD	gen=603 glyphs=4
2026-03-14T02:53:24.308273	ab601d70	116	29	1.0000	DISCARD	gen=647 glyphs=4
2026-03-14T02:53:26.960583	70982378	116	29	1.0000	DISCARD	gen=603 glyphs=4
2026-03-14T02:53:27.235499	875e0f8a	116	29	1.0000	DISCARD	gen=647 glyphs=4
2026-03-14T02:53:29.679706	71e2ba66	116	29	1.0000	DISCARD	gen=603 glyphs=4
2026-03-14T02:53:29.938343	67cb81be	120	30	1.0000	DISCARD	gen=647 glyphs=4
2026-03-14T02:53:32.409586	37f4017b	116	29	1.0000	DISCARD	gen=604 glyphs=4
2026-03-14T02:53:32.682203	8aef8872	116	29	1.0000	DISCARD	gen=647 glyphs=4
2026-03-14T02:53:35.094824	bfdf7cad	120	30	1.0000	DISCARD	gen=604 glyphs=4
2026-03-14T02:53:35.363943	19355583	120	30	1.0000	DISCARD	gen=648 glyphs=4
2026-03-14T02:53:37.814279	37f4017b	116	29	1.0000	DISCARD	gen=604 glyphs=4
2026-03-14T02:53:38.085080	8aef8872	116	29	1.0000	DISCARD	gen=648 glyphs=4
2026-03-14T02:53:40.544660	5b9807ac	120	30	1.0000	DISCARD	gen=604 glyphs=4
2026-03-14T02:53:40.822190	3619725b	120	30	1.0000	DISCARD	gen=648 glyphs=4
2026-03-14T02:53:43.229233	af09e9de	116	29	1.0000	DISCARD	gen=604 glyphs=4
2026-03-14T02:53:43.505590	b57e7176	120	30	1.0000	DISCARD	gen=648 glyphs=4
2026-03-14T02:53:45.983503	1d34459a	116	29	1.0000	DISCARD	gen=604 glyphs=4
2026-03-14T02:53:46.254592	8aef8872	116	29	1.0000	DISCARD	gen=648 glyphs=4
2026-03-14T02:53:48.703412	55d6c151	120	30	1.0000	DISCARD	gen=604 glyphs=4
2026-03-14T02:53:48.967062	8aef8872	116	29	1.0000	DISCARD	gen=648 glyphs=4
2026-03-14T02:53:51.401003	5b9807ac	120	30	1.0000	DISCARD	gen=604 glyphs=4
2026-03-14T02:53:51.673946	050862ad	120	30	1.0000	DISCARD	gen=648 glyphs=4
2026-03-14T02:53:54.121886	37f4017b	116	29	1.0000	DISCARD	gen=604 glyphs=4
2026-03-14T02:53:54.391120	17496d85	120	30	1.0000	DISCARD	gen=648 glyphs=4
2026-03-14T02:53:56.810115	afeffc3d	120	30	1.0000	DISCARD	gen=604 glyphs=4
2026-03-14T02:53:57.078985	19355583	120	30	1.0000	DISCARD	gen=648 glyphs=4
2026-03-14T02:53:59.493854	37f4017b	116	29	1.0000	DISCARD	gen=605 glyphs=4
2026-03-14T02:53:59.870045	e8c7f6cf	120	30	1.0000	DISCARD	gen=648 glyphs=4
2026-03-14T02:54:02.423201	bfdf7cad	120	30	1.0000	DISCARD	gen=605 glyphs=4
2026-03-14T02:54:02.690796	19355583	120	30	1.0000	DISCARD	gen=649 glyphs=4
2026-03-14T02:54:05.197249	1d34459a	116	29	1.0000	DISCARD	gen=605 glyphs=4
2026-03-14T02:54:05.476073	8aef8872	116	29	1.0000	DISCARD	gen=649 glyphs=4
2026-03-14T02:54:07.910524	83359ac6	120	30	1.0000	DISCARD	gen=605 glyphs=4
2026-03-14T02:54:08.177240	8aef8872	116	29	1.0000	DISCARD	gen=649 glyphs=4
2026-03-14T02:54:10.618242	55d6c151	120	30	1.0000	DISCARD	gen=605 glyphs=4
2026-03-14T02:54:10.878249	cfdf100e	116	29	1.0000	DISCARD	gen=649 glyphs=4
2026-03-14T02:54:13.345843	33c6c2b0	120	30	0.9500	DISCARD	gen=605 glyphs=4
2026-03-14T02:54:13.606502	67cb81be	120	30	1.0000	DISCARD	gen=649 glyphs=4
2026-03-14T02:54:16.040545	37f4017b	116	29	1.0000	DISCARD	gen=605 glyphs=4
2026-03-14T02:54:16.314769	0eaedb57	116	29	1.0000	DISCARD	gen=649 glyphs=4
2026-03-14T02:54:18.760374	9caadba5	116	29	1.0000	DISCARD	gen=605 glyphs=4
2026-03-14T02:54:19.029928	b3fdaf00	120	30	1.0000	DISCARD	gen=649 glyphs=4
2026-03-14T02:54:21.447437	37f4017b	116	29	1.0000	DISCARD	gen=605 glyphs=4
2026-03-14T02:54:21.710049	0eaedb57	116	29	1.0000	DISCARD	gen=649 glyphs=4
2026-03-14T02:54:24.162929	12b38c2d	116	29	1.0000	DISCARD	gen=605 glyphs=4
2026-03-14T02:54:24.426414	8aef8872	116	29	1.0000	DISCARD	gen=649 glyphs=4
2026-03-14T02:54:26.887938	37f4017b	116	29	1.0000	DISCARD	gen=606 glyphs=4
2026-03-14T02:54:27.177718	d8644bb6	116	29	1.0000	DISCARD	gen=649 glyphs=4
2026-03-14T02:54:29.639458	bfdf7cad	120	30	1.0000	DISCARD	gen=606 glyphs=4
2026-03-14T02:54:29.909425	19355583	120	30	1.0000	DISCARD	gen=650 glyphs=4
2026-03-14T02:54:32.370850	2701cb73	116	29	1.0000	DISCARD	gen=606 glyphs=4
2026-03-14T02:54:32.643445	8aef8872	116	29	1.0000	DISCARD	gen=650 glyphs=4
2026-03-14T02:54:35.126440	fdb5d108	120	30	1.0000	DISCARD	gen=606 glyphs=4
2026-03-14T02:54:35.420549	67cb81be	120	30	1.0000	DISCARD	gen=650 glyphs=4
2026-03-14T02:54:37.870979	5b9807ac	120	30	1.0000	DISCARD	gen=606 glyphs=4
2026-03-14T02:54:38.141842	050862ad	120	30	1.0000	DISCARD	gen=650 glyphs=4
2026-03-14T02:54:40.574973	37f4017b	116	29	1.0000	DISCARD	gen=606 glyphs=4
2026-03-14T02:54:40.841792	8aef8872	116	29	1.0000	DISCARD	gen=650 glyphs=4
2026-03-14T02:54:43.281152	b6d489e1	116	29	1.0000	DISCARD	gen=606 glyphs=4
2026-03-14T02:54:43.544395	50dc991d	116	29	1.0000	DISCARD	gen=650 glyphs=4
2026-03-14T02:54:45.992702	958f1768	116	29	1.0000	DISCARD	gen=606 glyphs=4
2026-03-14T02:54:46.262916	a78f9454	120	30	1.0000	DISCARD	gen=650 glyphs=4
2026-03-14T02:54:48.702047	15021215	116	29	1.0000	DISCARD	gen=606 glyphs=4
2026-03-14T02:54:48.976504	d7c8681b	120	30	1.0000	DISCARD	gen=650 glyphs=4
2026-03-14T02:54:51.437205	7ca87b42	116	29	1.0000	DISCARD	gen=606 glyphs=4
2026-03-14T02:54:51.707651	eca7ab6c	116	29	1.0000	DISCARD	gen=650 glyphs=4
2026-03-14T02:54:54.148496	37f4017b	116	29	1.0000	DISCARD	gen=607 glyphs=4
2026-03-14T02:54:54.421594	b7aed8e9	116	29	1.0000	DISCARD	gen=650 glyphs=4
2026-03-14T02:54:56.855956	bfdf7cad	120	30	1.0000	DISCARD	gen=607 glyphs=4
2026-03-14T02:54:57.133667	19355583	120	30	1.0000	DISCARD	gen=651 glyphs=4
2026-03-14T02:54:59.566922	d11c1062	120	30	1.0000	DISCARD	gen=607 glyphs=4
2026-03-14T02:54:59.838470	8aef8872	116	29	1.0000	DISCARD	gen=651 glyphs=4
