timestamp	program_hash	spirv_size	word_count	fitness	status	description
2026-03-14T01:55:03.381136	37f4017b	116	29	1.0000	DISCARD	gen=475 glyphs=4
2026-03-14T01:55:03.645301	8aef8872	116	29	1.0000	DISCARD	gen=519 glyphs=4
2026-03-14T01:55:06.057333	37f4017b	116	29	1.0000	DISCARD	gen=476 glyphs=4
2026-03-14T01:55:06.313300	ee48418e	116	29	1.0000	DISCARD	gen=519 glyphs=4
2026-03-14T01:55:08.754872	bfdf7cad	120	30	1.0000	DISCARD	gen=476 glyphs=4
2026-03-14T01:55:09.030631	19355583	120	30	1.0000	DISCARD	gen=520 glyphs=4
2026-03-14T01:55:11.464600	d1ea4c9c	120	30	1.0000	DISCARD	gen=476 glyphs=4
2026-03-14T01:55:11.742097	8aef8872	116	29	1.0000	DISCARD	gen=520 glyphs=4
2026-03-14T01:55:14.238603	50da96a1	120	30	0.9500	DISCARD	gen=476 glyphs=4
2026-03-14T01:55:14.504725	1e5f0e21	116	29	1.0000	DISCARD	gen=520 glyphs=4
2026-03-14T01:55:16.914397	2701cb73	116	29	1.0000	DISCARD	gen=476 glyphs=4
2026-03-14T01:55:17.180353	8aef8872	116	29	1.0000	DISCARD	gen=520 glyphs=4
2026-03-14T01:55:19.602600	5a06ca32	120	30	1.0000	DISCARD	gen=476 glyphs=4
2026-03-14T01:55:19.862711	45420217	120	30	1.0000	DISCARD	gen=520 glyphs=4
2026-03-14T01:55:22.262496	1d34459a	116	29	1.0000	DISCARD	gen=476 glyphs=4
2026-03-14T01:55:22.530331	8aef8872	116	29	1.0000	DISCARD	gen=520 glyphs=4
2026-03-14T01:55:24.935827	379dc4cb	116	29	1.0000	DISCARD	gen=476 glyphs=4
2026-03-14T01:55:25.193476	8aef8872	116	29	1.0000	DISCARD	gen=520 glyphs=4
2026-03-14T01:55:27.612131	c02c4aa8	116	29	1.0000	DISCARD	gen=476 glyphs=4
2026-03-14T01:55:27.878914	875e0f8a	116	29	1.0000	DISCARD	gen=520 glyphs=4
2026-03-14T01:55:30.279613	7ca87b42	116	29	1.0000	DISCARD	gen=476 glyphs=4
2026-03-14T01:55:30.548106	b20c39e0	116	29	1.0000	DISCARD	gen=520 glyphs=4
2026-03-14T01:55:32.968188	37f4017b	116	29	1.0000	DISCARD	gen=477 glyphs=4
2026-03-14T01:55:33.234930	e8dd4149	116	29	1.0000	DISCARD	gen=520 glyphs=4
2026-03-14T01:55:35.633331	bfdf7cad	120	30	1.0000	DISCARD	gen=477 glyphs=4
2026-03-14T01:55:35.900703	19355583	120	30	1.0000	DISCARD	gen=521 glyphs=4
2026-03-14T01:55:38.297096	c457214e	116	29	1.0000	DISCARD	gen=477 glyphs=4
2026-03-14T01:55:38.570844	8aef8872	116	29	1.0000	DISCARD	gen=521 glyphs=4
2026-03-14T01:55:40.974309	6f75194e	116	29	1.0000	DISCARD	gen=477 glyphs=4
2026-03-14T01:55:41.241417	8aef8872	116	29	1.0000	DISCARD	gen=521 glyphs=4
2026-03-14T01:55:43.626511	17096cb1	120	30	1.0000	DISCARD	gen=477 glyphs=4
2026-03-14T01:55:43.936759	eca7ab6c	116	29	1.0000	DISCARD	gen=521 glyphs=4
2026-03-14T01:55:46.403389	2701cb73	116	29	1.0000	DISCARD	gen=477 glyphs=4
2026-03-14T01:55:46.677048	8aef8872	116	29	1.0000	DISCARD	gen=521 glyphs=4
2026-03-14T01:55:49.071880	37f4017b	116	29	1.0000	DISCARD	gen=477 glyphs=4
2026-03-14T01:55:49.335290	4c75ac04	116	29	1.0000	DISCARD	gen=521 glyphs=4
2026-03-14T01:55:51.725051	12b38c2d	116	29	1.0000	DISCARD	gen=477 glyphs=4
2026-03-14T01:55:51.990147	875e0f8a	116	29	1.0000	DISCARD	gen=521 glyphs=4
2026-03-14T01:55:54.406327	55d6c151	120	30	1.0000	DISCARD	gen=477 glyphs=4
2026-03-14T01:55:54.666960	54d96d60	120	30	1.0000	DISCARD	gen=521 glyphs=4
2026-03-14T01:55:57.057742	de70207d	116	29	1.0000	DISCARD	gen=477 glyphs=4
2026-03-14T01:55:57.321407	1db50978	120	30	1.0000	DISCARD	gen=521 glyphs=4
2026-03-14T01:55:59.737119	37f4017b	116	29	1.0000	DISCARD	gen=478 glyphs=4
2026-03-14T01:56:00.000962	ae44ace5	116	29	1.0000	DISCARD	gen=521 glyphs=4
2026-03-14T01:56:02.392720	bfdf7cad	120	30	1.0000	DISCARD	gen=478 glyphs=4
2026-03-14T01:56:02.652824	19355583	120	30	1.0000	DISCARD	gen=522 glyphs=4
2026-03-14T01:56:05.074586	5b9807ac	120	30	1.0000	DISCARD	gen=478 glyphs=4
2026-03-14T01:56:05.340525	8aef8872	116	29	1.0000	DISCARD	gen=522 glyphs=4
2026-03-14T01:56:07.724469	5a06ca32	120	30	1.0000	DISCARD	gen=478 glyphs=4
2026-03-14T01:56:07.996674	0eaedb57	116	29	1.0000	DISCARD	gen=522 glyphs=4
2026-03-14T01:56:10.391178	37f4017b	116	29	1.0000	DISCARD	gen=478 glyphs=4
2026-03-14T01:56:10.656994	eca7ab6c	116	29	1.0000	DISCARD	gen=522 glyphs=4
2026-03-14T01:56:13.049233	fdb5d108	120	30	1.0000	DISCARD	gen=478 glyphs=4
2026-03-14T01:56:13.307760	8aef8872	116	29	1.0000	DISCARD	gen=522 glyphs=4
2026-03-14T01:56:15.768262	d11c1062	120	30	1.0000	DISCARD	gen=478 glyphs=4
2026-03-14T01:56:16.030091	9e34ede0	116	29	1.0000	DISCARD	gen=522 glyphs=4
2026-03-14T01:56:18.461627	5b9807ac	120	30	1.0000	DISCARD	gen=478 glyphs=4
2026-03-14T01:56:18.732223	8aef8872	116	29	1.0000	DISCARD	gen=522 glyphs=4
2026-03-14T01:56:21.153018	7ca87b42	116	29	1.0000	DISCARD	gen=478 glyphs=4
2026-03-14T01:56:21.417756	19355583	120	30	1.0000	DISCARD	gen=522 glyphs=4
2026-03-14T01:56:23.786761	37f4017b	116	29	1.0000	DISCARD	gen=478 glyphs=4
2026-03-14T01:56:24.050748	0eaedb57	116	29	1.0000	DISCARD	gen=522 glyphs=4
2026-03-14T01:56:26.450814	37f4017b	116	29	1.0000	DISCARD	gen=479 glyphs=4
2026-03-14T01:56:26.719624	050862ad	120	30	1.0000	DISCARD	gen=522 glyphs=4
2026-03-14T01:56:29.105106	bfdf7cad	120	30	1.0000	DISCARD	gen=479 glyphs=4
2026-03-14T01:56:29.383821	19355583	120	30	1.0000	DISCARD	gen=523 glyphs=4
2026-03-14T01:56:31.765896	2701cb73	116	29	1.0000	DISCARD	gen=479 glyphs=4
2026-03-14T01:56:32.035579	8aef8872	116	29	1.0000	DISCARD	gen=523 glyphs=4
2026-03-14T01:56:34.458020	55d6c151	120	30	1.0000	DISCARD	gen=479 glyphs=4
2026-03-14T01:56:34.718143	1715e081	116	29	1.0000	DISCARD	gen=523 glyphs=4
2026-03-14T01:56:37.092880	37f4017b	116	29	1.0000	DISCARD	gen=479 glyphs=4
2026-03-14T01:56:37.371437	19355583	120	30	1.0000	DISCARD	gen=523 glyphs=4
2026-03-14T01:56:39.737717	7ca87b42	116	29	1.0000	DISCARD	gen=479 glyphs=4
2026-03-14T01:56:40.001859	b57e7176	120	30	1.0000	DISCARD	gen=523 glyphs=4
2026-03-14T01:56:42.397191	d11c1062	120	30	1.0000	DISCARD	gen=479 glyphs=4
2026-03-14T01:56:42.668923	875e0f8a	116	29	1.0000	DISCARD	gen=523 glyphs=4
2026-03-14T01:56:45.084653	fdb5d108	120	30	1.0000	DISCARD	gen=479 glyphs=4
2026-03-14T01:56:45.356432	50dc991d	116	29	1.0000	DISCARD	gen=523 glyphs=4
2026-03-14T01:56:47.820529	d47e78af	116	29	0.9500	DISCARD	gen=479 glyphs=4
2026-03-14T01:56:48.107617	eca7ab6c	116	29	1.0000	DISCARD	gen=523 glyphs=4
2026-03-14T01:56:50.545856	12b38c2d	116	29	1.0000	DISCARD	gen=479 glyphs=4
2026-03-14T01:56:50.812273	9e34ede0	116	29	1.0000	DISCARD	gen=523 glyphs=4
2026-03-14T01:56:53.191347	37f4017b	116	29	1.0000	DISCARD	gen=480 glyphs=4
2026-03-14T01:56:53.472279	8c6f006e	120	30	1.0000	DISCARD	gen=523 glyphs=4
2026-03-14T01:56:55.864900	bfdf7cad	120	30	1.0000	DISCARD	gen=480 glyphs=4
2026-03-14T01:56:56.129877	19355583	120	30	1.0000	DISCARD	gen=524 glyphs=4
2026-03-14T01:56:58.527199	f8e219db	124	31	0.9000	DISCARD	gen=480 glyphs=4
2026-03-14T01:56:58.793954	8aef8872	116	29	1.0000	DISCARD	gen=524 glyphs=4
2026-03-14T01:57:01.214720	fdb5d108	120	30	1.0000	DISCARD	gen=480 glyphs=4
2026-03-14T01:57:01.487983	4f38ca87	116	29	1.0000	DISCARD	gen=524 glyphs=4
2026-03-14T01:57:03.894535	55d6c151	120	30	1.0000	DISCARD	gen=480 glyphs=4
2026-03-14T01:57:04.163546	0eaedb57	116	29	1.0000	DISCARD	gen=524 glyphs=4
2026-03-14T01:57:06.547789	12b38c2d	116	29	1.0000	DISCARD	gen=480 glyphs=4
2026-03-14T01:57:06.821331	0eaedb57	116	29	1.0000	DISCARD	gen=524 glyphs=4
2026-03-14T01:57:09.213326	37f4017b	116	29	1.0000	DISCARD	gen=480 glyphs=4
2026-03-14T01:57:09.470425	050862ad	120	30	1.0000	DISCARD	gen=524 glyphs=4
2026-03-14T01:57:11.879236	2ccb7d91	116	29	1.0000	DISCARD	gen=480 glyphs=4
2026-03-14T01:57:12.135527	e8c7f6cf	120	30	1.0000	DISCARD	gen=524 glyphs=4
2026-03-14T01:57:14.548939	fdb5d108	120	30	1.0000	DISCARD	gen=480 glyphs=4
2026-03-14T01:57:14.814998	8aef8872	116	29	1.0000	DISCARD	gen=524 glyphs=4
2026-03-14T01:57:17.256393	1d34459a	116	29	1.0000	DISCARD	gen=480 glyphs=4
2026-03-14T01:57:17.519332	d2dafd52	116	29	1.0000	DISCARD	gen=524 glyphs=4
2026-03-14T01:57:20.007662	37f4017b	116	29	1.0000	DISCARD	gen=481 glyphs=4
2026-03-14T01:57:20.284252	1e5f0e21	116	29	1.0000	DISCARD	gen=524 glyphs=4
2026-03-14T01:57:22.692730	bfdf7cad	120	30	1.0000	DISCARD	gen=481 glyphs=4
2026-03-14T01:57:22.953932	19355583	120	30	1.0000	DISCARD	gen=525 glyphs=4
2026-03-14T01:57:25.366613	37f4017b	116	29	1.0000	DISCARD	gen=481 glyphs=4
2026-03-14T01:57:25.633501	8aef8872	116	29	1.0000	DISCARD	gen=525 glyphs=4
2026-03-14T01:57:28.020660	5a06ca32	120	30	1.0000	DISCARD	gen=481 glyphs=4
2026-03-14T01:57:28.283607	d7c8681b	120	30	1.0000	DISCARD	gen=525 glyphs=4
2026-03-14T01:57:30.694089	37f4017b	116	29	1.0000	DISCARD	gen=481 glyphs=4
2026-03-14T01:57:30.950762	0eaedb57	116	29	1.0000	DISCARD	gen=525 glyphs=4
2026-03-14T01:57:33.382257	5a06ca32	120	30	1.0000	DISCARD	gen=481 glyphs=4
2026-03-14T01:57:33.655761	19355583	120	30	1.0000	DISCARD	gen=525 glyphs=4
2026-03-14T01:57:36.052682	37f4017b	116	29	1.0000	DISCARD	gen=481 glyphs=4
2026-03-14T01:57:36.316409	0eaedb57	116	29	1.0000	DISCARD	gen=525 glyphs=4
2026-03-14T01:57:38.719598	aa61f8d8	116	29	1.0000	DISCARD	gen=481 glyphs=4
2026-03-14T01:57:38.983108	a1009da0	120	30	0.9500	DISCARD	gen=525 glyphs=4
2026-03-14T01:57:41.416356	5a06ca32	120	30	1.0000	DISCARD	gen=481 glyphs=4
2026-03-14T01:57:41.688677	f364316f	120	30	1.0000	DISCARD	gen=525 glyphs=4
2026-03-14T01:57:44.109852	0e07a3ef	116	29	1.0000	DISCARD	gen=481 glyphs=4
2026-03-14T01:57:44.380728	f605cf48	120	30	1.0000	DISCARD	gen=525 glyphs=4
2026-03-14T01:57:46.789203	37f4017b	116	29	1.0000	DISCARD	gen=482 glyphs=4
2026-03-14T01:57:47.076010	510317c5	116	29	1.0000	DISCARD	gen=525 glyphs=4
2026-03-14T01:57:49.500461	bfdf7cad	120	30	1.0000	DISCARD	gen=482 glyphs=4
2026-03-14T01:57:49.759159	19355583	120	30	1.0000	DISCARD	gen=526 glyphs=4
2026-03-14T01:57:52.268032	5a06ca32	120	30	1.0000	DISCARD	gen=482 glyphs=4
2026-03-14T01:57:52.529100	8aef8872	116	29	1.0000	DISCARD	gen=526 glyphs=4
2026-03-14T01:57:54.948000	9469fc67	124	31	0.9500	DISCARD	gen=482 glyphs=4
2026-03-14T01:57:55.221267	50dc991d	116	29	1.0000	DISCARD	gen=526 glyphs=4
2026-03-14T01:57:57.612312	5a06ca32	120	30	1.0000	DISCARD	gen=482 glyphs=4
2026-03-14T01:57:57.881990	050862ad	120	30	1.0000	DISCARD	gen=526 glyphs=4
2026-03-14T01:58:00.282997	37f4017b	116	29	1.0000	DISCARD	gen=482 glyphs=4
2026-03-14T01:58:00.549044	8aef8872	116	29	1.0000	DISCARD	gen=526 glyphs=4
2026-03-14T01:58:02.957072	ddc20542	116	29	1.0000	DISCARD	gen=482 glyphs=4
2026-03-14T01:58:03.232240	8aef8872	116	29	1.0000	DISCARD	gen=526 glyphs=4
2026-03-14T01:58:05.641803	e088ac4b	120	30	1.0000	DISCARD	gen=482 glyphs=4
2026-03-14T01:58:05.915597	a78f9454	120	30	1.0000	DISCARD	gen=526 glyphs=4
2026-03-14T01:58:08.322445	5a06ca32	120	30	1.0000	DISCARD	gen=482 glyphs=4
2026-03-14T01:58:08.587069	0eaedb57	116	29	1.0000	DISCARD	gen=526 glyphs=4
2026-03-14T01:58:11.002557	5a06ca32	120	30	1.0000	DISCARD	gen=482 glyphs=4
2026-03-14T01:58:11.281982	19355583	120	30	1.0000	DISCARD	gen=526 glyphs=4
2026-03-14T01:58:13.699803	37f4017b	116	29	1.0000	DISCARD	gen=483 glyphs=4
2026-03-14T01:58:13.970228	ae44ace5	116	29	1.0000	DISCARD	gen=526 glyphs=4
2026-03-14T01:58:16.368400	bfdf7cad	120	30	1.0000	DISCARD	gen=483 glyphs=4
2026-03-14T01:58:16.635957	19355583	120	30	1.0000	DISCARD	gen=527 glyphs=4
2026-03-14T01:58:19.017578	37f4017b	116	29	1.0000	DISCARD	gen=483 glyphs=4
2026-03-14T01:58:19.281935	8aef8872	116	29	1.0000	DISCARD	gen=527 glyphs=4
2026-03-14T01:58:21.690630	4660b1a7	120	30	1.0000	DISCARD	gen=483 glyphs=4
2026-03-14T01:58:21.957547	8b2c9d87	120	30	1.0000	DISCARD	gen=527 glyphs=4
2026-03-14T01:58:24.452595	37f4017b	116	29	1.0000	DISCARD	gen=483 glyphs=4
2026-03-14T01:58:24.722825	1e5f0e21	116	29	1.0000	DISCARD	gen=527 glyphs=4
2026-03-14T01:58:27.111828	8201505f	116	29	1.0000	DISCARD	gen=483 glyphs=4
2026-03-14T01:58:27.385992	67cb81be	120	30	1.0000	DISCARD	gen=527 glyphs=4
2026-03-14T01:58:29.765300	5b9807ac	120	30	1.0000	DISCARD	gen=483 glyphs=4
2026-03-14T01:58:30.030253	050862ad	120	30	1.0000	DISCARD	gen=527 glyphs=4
2026-03-14T01:58:32.435625	37f4017b	116	29	1.0000	DISCARD	gen=483 glyphs=4
2026-03-14T01:58:32.692179	8aef8872	116	29	1.0000	DISCARD	gen=527 glyphs=4
2026-03-14T01:58:35.103905	55d6c151	120	30	1.0000	DISCARD	gen=483 glyphs=4
2026-03-14T01:58:35.367160	9e34ede0	116	29	1.0000	DISCARD	gen=527 glyphs=4
2026-03-14T01:58:37.775175	a4c635f5	116	29	0.9500	DISCARD	gen=483 glyphs=4
2026-03-14T01:58:38.041917	89824074	116	29	1.0000	DISCARD	gen=527 glyphs=4
2026-03-14T01:58:40.473235	37f4017b	116	29	1.0000	DISCARD	gen=484 glyphs=4
2026-03-14T01:58:40.751947	d4dc08d0	116	29	0.9500	DISCARD	gen=527 glyphs=4
2026-03-14T01:58:43.152483	bfdf7cad	120	30	1.0000	DISCARD	gen=484 glyphs=4
2026-03-14T01:58:43.425639	19355583	120	30	1.0000	DISCARD	gen=528 glyphs=4
2026-03-14T01:58:45.828741	fdb5d108	120	30	1.0000	DISCARD	gen=484 glyphs=4
2026-03-14T01:58:46.081955	8aef8872	116	29	1.0000	DISCARD	gen=528 glyphs=4
2026-03-14T01:58:48.496989	d11c1062	120	30	1.0000	DISCARD	gen=484 glyphs=4
2026-03-14T01:58:48.758968	8aef8872	116	29	1.0000	DISCARD	gen=528 glyphs=4
2026-03-14T01:58:51.156458	5a06ca32	120	30	1.0000	DISCARD	gen=484 glyphs=4
2026-03-14T01:58:51.429287	050862ad	120	30	1.0000	DISCARD	gen=528 glyphs=4
2026-03-14T01:58:53.842717	7ca87b42	116	29	1.0000	DISCARD	gen=484 glyphs=4
2026-03-14T01:58:54.113098	8aef8872	116	29	1.0000	DISCARD	gen=528 glyphs=4
2026-03-14T01:58:56.573276	5a06ca32	120	30	1.0000	DISCARD	gen=484 glyphs=4
2026-03-14T01:58:56.851061	875e0f8a	116	29	1.0000	DISCARD	gen=528 glyphs=4
2026-03-14T01:58:59.253114	2701cb73	116	29	1.0000	DISCARD	gen=484 glyphs=4
2026-03-14T01:58:59.515827	1e5f0e21	116	29	1.0000	DISCARD	gen=528 glyphs=4
2026-03-14T01:59:01.911620	c9e5ac39	120	30	1.0000	DISCARD	gen=484 glyphs=4
2026-03-14T01:59:02.173495	e47ffa7a	120	30	1.0000	DISCARD	gen=528 glyphs=4
2026-03-14T01:59:04.559979	2701cb73	116	29	1.0000	DISCARD	gen=484 glyphs=4
2026-03-14T01:59:04.822770	0eaedb57	116	29	1.0000	DISCARD	gen=528 glyphs=4
2026-03-14T01:59:07.213119	37f4017b	116	29	1.0000	DISCARD	gen=485 glyphs=4
2026-03-14T01:59:07.475255	68f08bcb	116	29	0.9500	DISCARD	gen=528 glyphs=4
2026-03-14T01:59:09.883017	bfdf7cad	120	30	1.0000	DISCARD	gen=485 glyphs=4
2026-03-14T01:59:10.146452	19355583	120	30	1.0000	DISCARD	gen=529 glyphs=4
2026-03-14T01:59:12.549402	1cab1db3	116	29	1.0000	DISCARD	gen=485 glyphs=4
2026-03-14T01:59:12.827987	8aef8872	116	29	1.0000	DISCARD	gen=529 glyphs=4
2026-03-14T01:59:15.217028	71e2ba66	116	29	1.0000	DISCARD	gen=485 glyphs=4
2026-03-14T01:59:15.480835	050862ad	120	30	1.0000	DISCARD	gen=529 glyphs=4
2026-03-14T01:59:17.868467	b3c1bedb	120	30	1.0000	DISCARD	gen=485 glyphs=4
2026-03-14T01:59:18.145035	1e5f0e21	116	29	1.0000	DISCARD	gen=529 glyphs=4
2026-03-14T01:59:20.515130	1d34459a	116	29	1.0000	DISCARD	gen=485 glyphs=4
2026-03-14T01:59:20.780376	8aef8872	116	29	1.0000	DISCARD	gen=529 glyphs=4
2026-03-14T01:59:23.172715	469514ab	120	30	1.0000	DISCARD	gen=485 glyphs=4
2026-03-14T01:59:23.435740	e8c7f6cf	120	30	1.0000	DISCARD	gen=529 glyphs=4
2026-03-14T01:59:25.817291	5b9807ac	120	30	1.0000	DISCARD	gen=485 glyphs=4
2026-03-14T01:59:26.092906	a78f9454	120	30	1.0000	DISCARD	gen=529 glyphs=4
2026-03-14T01:59:28.608242	4c9b0dd4	120	30	1.0000	DISCARD	gen=485 glyphs=4
2026-03-14T01:59:28.879012	a78f9454	120	30	1.0000	DISCARD	gen=529 glyphs=4
2026-03-14T01:59:31.281254	55d6c151	120	30	1.0000	DISCARD	gen=485 glyphs=4
2026-03-14T01:59:31.547711	050862ad	120	30	1.0000	DISCARD	gen=529 glyphs=4
2026-03-14T01:59:34.002877	37f4017b	116	29	1.0000	DISCARD	gen=486 glyphs=4
2026-03-14T01:59:34.278448	eaa5efc5	116	29	1.0000	DISCARD	gen=529 glyphs=4
2026-03-14T01:59:36.656628	bfdf7cad	120	30	1.0000	DISCARD	gen=486 glyphs=4
2026-03-14T01:59:36.924754	19355583	120	30	1.0000	DISCARD	gen=530 glyphs=4
2026-03-14T01:59:39.334268	37f4017b	116	29	1.0000	DISCARD	gen=486 glyphs=4
2026-03-14T01:59:39.593026	8aef8872	116	29	1.0000	DISCARD	gen=530 glyphs=4
2026-03-14T01:59:41.981598	5a06ca32	120	30	1.0000	DISCARD	gen=486 glyphs=4
2026-03-14T01:59:42.260561	050862ad	120	30	1.0000	DISCARD	gen=530 glyphs=4
2026-03-14T01:59:44.654304	bfdf7cad	120	30	1.0000	DISCARD	gen=486 glyphs=4
2026-03-14T01:59:44.926443	b7aed8e9	116	29	1.0000	DISCARD	gen=530 glyphs=4
2026-03-14T01:59:47.335871	2d706f31	116	29	0.9500	DISCARD	gen=486 glyphs=4
2026-03-14T01:59:47.592498	050862ad	120	30	1.0000	DISCARD	gen=530 glyphs=4
2026-03-14T01:59:50.006221	1d34459a	116	29	1.0000	DISCARD	gen=486 glyphs=4
2026-03-14T01:59:50.271296	050862ad	120	30	1.0000	DISCARD	gen=530 glyphs=4
2026-03-14T01:59:52.690740	f85b8639	120	30	1.0000	DISCARD	gen=486 glyphs=4
2026-03-14T01:59:52.954860	a78f9454	120	30	1.0000	DISCARD	gen=530 glyphs=4
2026-03-14T01:59:55.353597	fdb5d108	120	30	1.0000	DISCARD	gen=486 glyphs=4
2026-03-14T01:59:55.621426	8aef8872	116	29	1.0000	DISCARD	gen=530 glyphs=4
2026-03-14T01:59:58.008197	55d6c151	120	30	1.0000	DISCARD	gen=486 glyphs=4
2026-03-14T01:59:58.275649	050862ad	120	30	1.0000	DISCARD	gen=530 glyphs=4
2026-03-14T02:00:00.774797	37f4017b	116	29	1.0000	DISCARD	gen=487 glyphs=4
2026-03-14T02:00:01.042817	d7c8681b	120	30	1.0000	DISCARD	gen=530 glyphs=4
2026-03-14T02:00:03.488055	bfdf7cad	120	30	1.0000	DISCARD	gen=487 glyphs=4
2026-03-14T02:00:03.761005	19355583	120	30	1.0000	DISCARD	gen=531 glyphs=4
2026-03-14T02:00:06.177898	12b38c2d	116	29	1.0000	DISCARD	gen=487 glyphs=4
2026-03-14T02:00:06.455796	8aef8872	116	29	1.0000	DISCARD	gen=531 glyphs=4
2026-03-14T02:00:08.882917	271a7d27	120	30	1.0000	DISCARD	gen=487 glyphs=4
2026-03-14T02:00:09.151101	19355583	120	30	1.0000	DISCARD	gen=531 glyphs=4
2026-03-14T02:00:11.570761	eaed89be	120	30	0.9500	DISCARD	gen=487 glyphs=4
2026-03-14T02:00:11.856143	50dc991d	116	29	1.0000	DISCARD	gen=531 glyphs=4
2026-03-14T02:00:14.290742	37f4017b	116	29	1.0000	DISCARD	gen=487 glyphs=4
2026-03-14T02:00:14.557224	a3b26439	120	30	1.0000	DISCARD	gen=531 glyphs=4
2026-03-14T02:00:16.961467	71e2ba66	116	29	1.0000	DISCARD	gen=487 glyphs=4
2026-03-14T02:00:17.227254	8aef8872	116	29	1.0000	DISCARD	gen=531 glyphs=4
2026-03-14T02:00:19.653379	55d6c151	120	30	1.0000	DISCARD	gen=487 glyphs=4
2026-03-14T02:00:19.929645	050862ad	120	30	1.0000	DISCARD	gen=531 glyphs=4
2026-03-14T02:00:22.356046	55d6c151	120	30	1.0000	DISCARD	gen=487 glyphs=4
2026-03-14T02:00:22.626962	b7aed8e9	116	29	1.0000	DISCARD	gen=531 glyphs=4
2026-03-14T02:00:25.054836	4c9b0dd4	120	30	1.0000	DISCARD	gen=487 glyphs=4
2026-03-14T02:00:25.315068	dfabd7ea	116	29	0.9500	DISCARD	gen=531 glyphs=4
2026-03-14T02:00:27.732964	37f4017b	116	29	1.0000	DISCARD	gen=488 glyphs=4
2026-03-14T02:00:28.005579	8aef8872	116	29	1.0000	DISCARD	gen=531 glyphs=4
2026-03-14T02:00:30.488476	bfdf7cad	120	30	1.0000	DISCARD	gen=488 glyphs=4
2026-03-14T02:00:30.754881	19355583	120	30	1.0000	DISCARD	gen=532 glyphs=4
2026-03-14T02:00:33.208165	5a06ca32	120	30	1.0000	DISCARD	gen=488 glyphs=4
2026-03-14T02:00:33.464389	8aef8872	116	29	1.0000	DISCARD	gen=532 glyphs=4
2026-03-14T02:00:35.890683	55d6c151	120	30	1.0000	DISCARD	gen=488 glyphs=4
2026-03-14T02:00:36.155828	50dc991d	116	29	1.0000	DISCARD	gen=532 glyphs=4
2026-03-14T02:00:38.569470	f504bb71	116	29	1.0000	DISCARD	gen=488 glyphs=4
2026-03-14T02:00:38.834783	e8c7f6cf	120	30	1.0000	DISCARD	gen=532 glyphs=4
2026-03-14T02:00:41.223200	7ca87b42	116	29	1.0000	DISCARD	gen=488 glyphs=4
2026-03-14T02:00:41.486393	0eaedb57	116	29	1.0000	DISCARD	gen=532 glyphs=4
2026-03-14T02:00:43.900933	708b8ad6	120	30	1.0000	DISCARD	gen=488 glyphs=4
2026-03-14T02:00:44.167505	15d7e9d8	116	29	0.9500	DISCARD	gen=532 glyphs=4
2026-03-14T02:00:46.567213	48f20aba	116	29	0.9500	DISCARD	gen=488 glyphs=4
2026-03-14T02:00:46.827753	10648614	116	29	1.0000	DISCARD	gen=532 glyphs=4
2026-03-14T02:00:49.231503	d11c1062	120	30	1.0000	DISCARD	gen=488 glyphs=4
2026-03-14T02:00:49.495322	54bf521d	116	29	1.0000	DISCARD	gen=532 glyphs=4
2026-03-14T02:00:51.907855	d31670a2	116	29	1.0000	DISCARD	gen=488 glyphs=4
2026-03-14T02:00:52.184595	a78f9454	120	30	1.0000	DISCARD	gen=532 glyphs=4
2026-03-14T02:00:54.626155	37f4017b	116	29	1.0000	DISCARD	gen=489 glyphs=4
2026-03-14T02:00:54.886384	050862ad	120	30	1.0000	DISCARD	gen=532 glyphs=4
2026-03-14T02:00:57.307443	bfdf7cad	120	30	1.0000	DISCARD	gen=489 glyphs=4
2026-03-14T02:00:57.575535	19355583	120	30	1.0000	DISCARD	gen=533 glyphs=4
2026-03-14T02:00:59.973954	6bb4fb14	116	29	1.0000	DISCARD	gen=489 glyphs=4
2026-03-14T02:01:00.248569	8aef8872	116	29	1.0000	DISCARD	gen=533 glyphs=4
2026-03-14T02:01:02.774456	0dc33aca	116	29	0.9500	DISCARD	gen=489 glyphs=4
2026-03-14T02:01:03.045972	a132fbb4	116	29	1.0000	DISCARD	gen=533 glyphs=4
2026-03-14T02:01:05.490796	423e65d6	116	29	1.0000	DISCARD	gen=489 glyphs=4
2026-03-14T02:01:05.766484	6ee79b93	116	29	1.0000	DISCARD	gen=533 glyphs=4
2026-03-14T02:01:08.175481	71e2ba66	116	29	1.0000	DISCARD	gen=489 glyphs=4
2026-03-14T02:01:08.447553	591f87bd	124	31	0.9500	DISCARD	gen=533 glyphs=4
2026-03-14T02:01:10.873355	bfdf7cad	120	30	1.0000	DISCARD	gen=489 glyphs=4
2026-03-14T02:01:11.135023	5f00c3a3	116	29	1.0000	DISCARD	gen=533 glyphs=4
2026-03-14T02:01:13.529158	55d6c151	120	30	1.0000	DISCARD	gen=489 glyphs=4
2026-03-14T02:01:13.794757	ffab2518	116	29	1.0000	DISCARD	gen=533 glyphs=4
2026-03-14T02:01:16.199478	37f4017b	116	29	1.0000	DISCARD	gen=489 glyphs=4
2026-03-14T02:01:16.474356	b57e7176	120	30	1.0000	DISCARD	gen=533 glyphs=4
2026-03-14T02:01:18.888302	447ac641	116	29	1.0000	DISCARD	gen=489 glyphs=4
2026-03-14T02:01:19.149299	0eaedb57	116	29	1.0000	DISCARD	gen=533 glyphs=4
2026-03-14T02:01:21.556825	37f4017b	116	29	1.0000	DISCARD	gen=490 glyphs=4
2026-03-14T02:01:21.832415	8aef8872	116	29	1.0000	DISCARD	gen=533 glyphs=4
2026-03-14T02:01:24.225314	bfdf7cad	120	30	1.0000	DISCARD	gen=490 glyphs=4
2026-03-14T02:01:24.500216	19355583	120	30	1.0000	DISCARD	gen=534 glyphs=4
2026-03-14T02:01:26.920703	e8a63894	116	29	1.0000	DISCARD	gen=490 glyphs=4
2026-03-14T02:01:27.192045	8aef8872	116	29	1.0000	DISCARD	gen=534 glyphs=4
2026-03-14T02:01:29.593513	5b9807ac	120	30	1.0000	DISCARD	gen=490 glyphs=4
2026-03-14T02:01:29.862315	4f04ecac	116	29	1.0000	DISCARD	gen=534 glyphs=4
2026-03-14T02:01:32.261178	b1d28f45	124	31	0.9500	DISCARD	gen=490 glyphs=4
2026-03-14T02:01:32.538226	50dc991d	116	29	1.0000	DISCARD	gen=534 glyphs=4
