timestamp	program_hash	spirv_size	word_count	fitness	status	description
2026-03-14T07:36:45.662932	099964a4	0	0	0.0000	CRASH	gen=795 glyphs=4
2026-03-14T07:36:45.663135	c46d11ed	0	0	0.0000	CRASH	gen=795 glyphs=3
2026-03-14T07:36:45.663328	099964a4	0	0	0.0000	CRASH	gen=795 glyphs=4
2026-03-14T07:36:45.663521	3ca14993	0	0	0.0000	CRASH	gen=795 glyphs=4
2026-03-14T07:36:45.663719	099964a4	0	0	0.0000	CRASH	gen=795 glyphs=4
2026-03-14T07:36:45.663997	099964a4	0	0	0.0000	CRASH	gen=796 glyphs=4
2026-03-14T07:36:45.664194	099964a4	0	0	0.0000	CRASH	gen=796 glyphs=4
2026-03-14T07:36:45.664387	a46781cf	0	0	0.0000	CRASH	gen=796 glyphs=4
2026-03-14T07:36:45.664585	a9342a48	0	0	0.0000	CRASH	gen=796 glyphs=4
2026-03-14T07:36:45.664785	099964a4	0	0	0.0000	CRASH	gen=796 glyphs=4
2026-03-14T07:36:45.664978	8a081ab1	0	0	0.0000	CRASH	gen=796 glyphs=4
2026-03-14T07:36:45.665171	099964a4	0	0	0.0000	CRASH	gen=796 glyphs=4
2026-03-14T07:36:45.665364	099964a4	0	0	0.0000	CRASH	gen=796 glyphs=4
2026-03-14T07:36:45.665560	099964a4	0	0	0.0000	CRASH	gen=796 glyphs=4
2026-03-14T07:36:45.665751	099964a4	0	0	0.0000	CRASH	gen=796 glyphs=4
2026-03-14T07:36:45.666031	099964a4	0	0	0.0000	CRASH	gen=797 glyphs=4
2026-03-14T07:36:45.666225	099964a4	0	0	0.0000	CRASH	gen=797 glyphs=4
2026-03-14T07:36:45.666417	099964a4	0	0	0.0000	CRASH	gen=797 glyphs=4
2026-03-14T07:36:45.666613	e9004a25	0	0	0.0000	CRASH	gen=797 glyphs=3
2026-03-14T07:36:45.666804	604e69ed	0	0	0.0000	CRASH	gen=797 glyphs=4
2026-03-14T07:36:45.666999	099964a4	0	0	0.0000	CRASH	gen=797 glyphs=4
2026-03-14T07:36:45.667188	226791cb	0	0	0.0000	CRASH	gen=797 glyphs=2
2026-03-14T07:36:45.667379	cf93b656	0	0	0.0000	CRASH	gen=797 glyphs=3
2026-03-14T07:36:45.667573	10006e95	0	0	0.0000	CRASH	gen=797 glyphs=2
2026-03-14T07:36:45.667766	099964a4	0	0	0.0000	CRASH	gen=797 glyphs=4
2026-03-14T07:36:45.668051	099964a4	0	0	0.0000	CRASH	gen=798 glyphs=4
2026-03-14T07:36:45.668245	099964a4	0	0	0.0000	CRASH	gen=798 glyphs=4
2026-03-14T07:36:45.668440	099964a4	0	0	0.0000	CRASH	gen=798 glyphs=4
2026-03-14T07:36:45.668636	760aa83d	0	0	0.0000	CRASH	gen=798 glyphs=3
2026-03-14T07:36:45.668832	099964a4	0	0	0.0000	CRASH	gen=798 glyphs=4
2026-03-14T07:36:45.669029	8d4de65b	0	0	0.0000	CRASH	gen=798 glyphs=4
2026-03-14T07:36:45.669223	099964a4	0	0	0.0000	CRASH	gen=798 glyphs=4
2026-03-14T07:36:45.669415	dcb1fb50	0	0	0.0000	CRASH	gen=798 glyphs=4
2026-03-14T07:36:45.669613	36fa1dc1	0	0	0.0000	CRASH	gen=798 glyphs=4
2026-03-14T07:36:45.669805	099964a4	0	0	0.0000	CRASH	gen=798 glyphs=4
2026-03-14T07:36:45.670082	099964a4	0	0	0.0000	CRASH	gen=799 glyphs=4
2026-03-14T07:36:45.670276	099964a4	0	0	0.0000	CRASH	gen=799 glyphs=4
2026-03-14T07:36:45.670471	099964a4	0	0	0.0000	CRASH	gen=799 glyphs=4
2026-03-14T07:36:45.670669	099964a4	0	0	0.0000	CRASH	gen=799 glyphs=4
2026-03-14T07:36:45.670862	099964a4	0	0	0.0000	CRASH	gen=799 glyphs=4
2026-03-14T07:36:45.671058	119e68d3	0	0	0.0000	CRASH	gen=799 glyphs=4
2026-03-14T07:36:45.671256	016b3958	0	0	0.0000	CRASH	gen=799 glyphs=3
2026-03-14T07:36:45.671448	82797a9d	0	0	0.0000	CRASH	gen=799 glyphs=4
2026-03-14T07:36:45.671644	099964a4	0	0	0.0000	CRASH	gen=799 glyphs=4
2026-03-14T07:36:45.671834	099964a4	0	0	0.0000	CRASH	gen=799 glyphs=4
2026-03-14T07:36:45.672113	099964a4	0	0	0.0000	CRASH	gen=800 glyphs=4
2026-03-14T07:36:45.672310	099964a4	0	0	0.0000	CRASH	gen=800 glyphs=4
2026-03-14T07:36:45.672507	3a734398	0	0	0.0000	CRASH	gen=800 glyphs=4
2026-03-14T07:36:45.672702	5fa09414	0	0	0.0000	CRASH	gen=800 glyphs=4
2026-03-14T07:36:45.672900	099964a4	0	0	0.0000	CRASH	gen=800 glyphs=4
2026-03-14T07:36:45.673092	099964a4	0	0	0.0000	CRASH	gen=800 glyphs=4
2026-03-14T07:36:45.673289	cf3ce05f	0	0	0.0000	CRASH	gen=800 glyphs=4
2026-03-14T07:36:45.673482	099964a4	0	0	0.0000	CRASH	gen=800 glyphs=4
2026-03-14T07:36:45.673678	80cef82b	0	0	0.0000	CRASH	gen=800 glyphs=4
2026-03-14T07:36:45.673872	8da1f8d8	0	0	0.0000	CRASH	gen=800 glyphs=4
2026-03-14T07:36:45.674148	099964a4	0	0	0.0000	CRASH	gen=801 glyphs=4
2026-03-14T07:36:45.674346	099964a4	0	0	0.0000	CRASH	gen=801 glyphs=4
2026-03-14T07:36:45.674544	dcb1fb50	0	0	0.0000	CRASH	gen=801 glyphs=4
2026-03-14T07:36:45.674739	099964a4	0	0	0.0000	CRASH	gen=801 glyphs=4
2026-03-14T07:36:45.674930	099964a4	0	0	0.0000	CRASH	gen=801 glyphs=4
2026-03-14T07:36:45.675120	099964a4	0	0	0.0000	CRASH	gen=801 glyphs=4
2026-03-14T07:36:45.675316	099964a4	0	0	0.0000	CRASH	gen=801 glyphs=4
2026-03-14T07:36:45.675508	099964a4	0	0	0.0000	CRASH	gen=801 glyphs=4
2026-03-14T07:36:45.675707	099964a4	0	0	0.0000	CRASH	gen=801 glyphs=4
2026-03-14T07:36:45.675900	099964a4	0	0	0.0000	CRASH	gen=801 glyphs=4
2026-03-14T07:36:45.676175	099964a4	0	0	0.0000	CRASH	gen=802 glyphs=4
2026-03-14T07:36:45.676375	099964a4	0	0	0.0000	CRASH	gen=802 glyphs=4
2026-03-14T07:36:45.676570	dcb1fb50	0	0	0.0000	CRASH	gen=802 glyphs=4
2026-03-14T07:36:45.676767	099964a4	0	0	0.0000	CRASH	gen=802 glyphs=4
2026-03-14T07:36:45.676959	099964a4	0	0	0.0000	CRASH	gen=802 glyphs=4
2026-03-14T07:36:45.677149	627833ab	0	0	0.0000	CRASH	gen=802 glyphs=4
2026-03-14T07:36:45.677342	099964a4	0	0	0.0000	CRASH	gen=802 glyphs=4
2026-03-14T07:36:45.677543	099964a4	0	0	0.0000	CRASH	gen=802 glyphs=4
2026-03-14T07:36:45.677735	7a5393c6	0	0	0.0000	CRASH	gen=802 glyphs=3
2026-03-14T07:36:45.677926	099964a4	0	0	0.0000	CRASH	gen=802 glyphs=4
2026-03-14T07:36:45.678209	099964a4	0	0	0.0000	CRASH	gen=803 glyphs=4
2026-03-14T07:36:45.678405	099964a4	0	0	0.0000	CRASH	gen=803 glyphs=4
2026-03-14T07:36:45.678603	099964a4	0	0	0.0000	CRASH	gen=803 glyphs=4
2026-03-14T07:36:45.678796	f3d4ffd1	0	0	0.0000	CRASH	gen=803 glyphs=4
2026-03-14T07:36:45.678992	099964a4	0	0	0.0000	CRASH	gen=803 glyphs=4
2026-03-14T07:36:45.679184	68474bba	0	0	0.0000	CRASH	gen=803 glyphs=4
2026-03-14T07:36:45.679379	099964a4	0	0	0.0000	CRASH	gen=803 glyphs=4
2026-03-14T07:36:45.679576	099964a4	0	0	0.0000	CRASH	gen=803 glyphs=4
2026-03-14T07:36:45.679768	dcb1fb50	0	0	0.0000	CRASH	gen=803 glyphs=4
2026-03-14T07:36:45.679962	110b6155	0	0	0.0000	CRASH	gen=803 glyphs=3
2026-03-14T07:36:45.680241	099964a4	0	0	0.0000	CRASH	gen=804 glyphs=4
2026-03-14T07:36:45.680439	099964a4	0	0	0.0000	CRASH	gen=804 glyphs=4
2026-03-14T07:36:45.680640	099964a4	0	0	0.0000	CRASH	gen=804 glyphs=4
2026-03-14T07:36:45.680831	cf93b656	0	0	0.0000	CRASH	gen=804 glyphs=3
2026-03-14T07:36:45.681025	099964a4	0	0	0.0000	CRASH	gen=804 glyphs=4
2026-03-14T07:36:45.681216	ff30496a	0	0	0.0000	CRASH	gen=804 glyphs=3
2026-03-14T07:36:45.681408	5f49c751	0	0	0.0000	CRASH	gen=804 glyphs=3
2026-03-14T07:36:45.681605	733dfe6d	0	0	0.0000	CRASH	gen=804 glyphs=5
2026-03-14T07:36:45.681802	099964a4	0	0	0.0000	CRASH	gen=804 glyphs=4
2026-03-14T07:36:45.681993	7ede4765	0	0	0.0000	CRASH	gen=804 glyphs=2
2026-03-14T07:36:45.682262	099964a4	0	0	0.0000	CRASH	gen=805 glyphs=4
2026-03-14T07:36:45.682458	099964a4	0	0	0.0000	CRASH	gen=805 glyphs=4
2026-03-14T07:36:45.682661	4da87966	0	0	0.0000	CRASH	gen=805 glyphs=3
2026-03-14T07:36:45.682857	099964a4	0	0	0.0000	CRASH	gen=805 glyphs=4
2026-03-14T07:36:45.683053	099964a4	0	0	0.0000	CRASH	gen=805 glyphs=4
2026-03-14T07:36:45.683246	099964a4	0	0	0.0000	CRASH	gen=805 glyphs=4
2026-03-14T07:36:45.683441	099964a4	0	0	0.0000	CRASH	gen=805 glyphs=4
2026-03-14T07:36:45.683637	244bd8be	0	0	0.0000	CRASH	gen=805 glyphs=3
2026-03-14T07:36:45.683839	099964a4	0	0	0.0000	CRASH	gen=805 glyphs=4
2026-03-14T07:36:45.684035	5c8982a8	0	0	0.0000	CRASH	gen=805 glyphs=4
2026-03-14T07:36:45.684314	099964a4	0	0	0.0000	CRASH	gen=806 glyphs=4
2026-03-14T07:36:45.684512	099964a4	0	0	0.0000	CRASH	gen=806 glyphs=4
2026-03-14T07:36:45.684710	cf93b656	0	0	0.0000	CRASH	gen=806 glyphs=3
2026-03-14T07:36:45.684912	80cef82b	0	0	0.0000	CRASH	gen=806 glyphs=4
2026-03-14T07:36:45.685107	dcb1fb50	0	0	0.0000	CRASH	gen=806 glyphs=4
2026-03-14T07:36:45.685303	3ca14993	0	0	0.0000	CRASH	gen=806 glyphs=4
2026-03-14T07:36:45.685500	099964a4	0	0	0.0000	CRASH	gen=806 glyphs=4
2026-03-14T07:36:45.685696	941c6029	0	0	0.0000	CRASH	gen=806 glyphs=5
2026-03-14T07:36:45.685892	6479cad5	0	0	0.0000	CRASH	gen=806 glyphs=4
2026-03-14T07:36:45.686092	099964a4	0	0	0.0000	CRASH	gen=806 glyphs=4
2026-03-14T07:36:45.686362	099964a4	0	0	0.0000	CRASH	gen=807 glyphs=4
2026-03-14T07:36:45.686561	099964a4	0	0	0.0000	CRASH	gen=807 glyphs=4
2026-03-14T07:36:45.686755	099964a4	0	0	0.0000	CRASH	gen=807 glyphs=4
2026-03-14T07:36:45.686946	099964a4	0	0	0.0000	CRASH	gen=807 glyphs=4
2026-03-14T07:36:45.687143	099964a4	0	0	0.0000	CRASH	gen=807 glyphs=4
2026-03-14T07:36:45.687334	5d557e5e	0	0	0.0000	CRASH	gen=807 glyphs=4
2026-03-14T07:36:45.687531	099964a4	0	0	0.0000	CRASH	gen=807 glyphs=4
2026-03-14T07:36:45.687723	099964a4	0	0	0.0000	CRASH	gen=807 glyphs=4
2026-03-14T07:36:45.687919	099964a4	0	0	0.0000	CRASH	gen=807 glyphs=4
2026-03-14T07:36:45.688114	80cef82b	0	0	0.0000	CRASH	gen=807 glyphs=4
2026-03-14T07:36:45.688403	099964a4	0	0	0.0000	CRASH	gen=808 glyphs=4
2026-03-14T07:36:45.688598	099964a4	0	0	0.0000	CRASH	gen=808 glyphs=4
2026-03-14T07:36:45.688789	099964a4	0	0	0.0000	CRASH	gen=808 glyphs=4
2026-03-14T07:36:45.688980	379b19bf	0	0	0.0000	CRASH	gen=808 glyphs=4
2026-03-14T07:36:45.689171	4ca2b653	0	0	0.0000	CRASH	gen=808 glyphs=4
2026-03-14T07:36:45.689369	3a734398	0	0	0.0000	CRASH	gen=808 glyphs=4
2026-03-14T07:36:45.689562	71f6da22	0	0	0.0000	CRASH	gen=808 glyphs=3
2026-03-14T07:36:45.689754	f2a6e419	0	0	0.0000	CRASH	gen=808 glyphs=4
2026-03-14T07:36:45.689945	099964a4	0	0	0.0000	CRASH	gen=808 glyphs=4
2026-03-14T07:36:45.690136	099964a4	0	0	0.0000	CRASH	gen=808 glyphs=4
2026-03-14T07:36:45.690413	099964a4	0	0	0.0000	CRASH	gen=809 glyphs=4
2026-03-14T07:36:45.690620	099964a4	0	0	0.0000	CRASH	gen=809 glyphs=4
2026-03-14T07:36:45.690816	099964a4	0	0	0.0000	CRASH	gen=809 glyphs=4
2026-03-14T07:36:45.691007	80cef82b	0	0	0.0000	CRASH	gen=809 glyphs=4
2026-03-14T07:36:45.691202	8da1f8d8	0	0	0.0000	CRASH	gen=809 glyphs=4
2026-03-14T07:36:45.691401	4b528c37	0	0	0.0000	CRASH	gen=809 glyphs=4
2026-03-14T07:36:45.691600	099964a4	0	0	0.0000	CRASH	gen=809 glyphs=4
2026-03-14T07:36:45.691793	37a84c78	0	0	0.0000	CRASH	gen=809 glyphs=4
2026-03-14T07:36:45.691988	cf93b656	0	0	0.0000	CRASH	gen=809 glyphs=3
2026-03-14T07:36:45.692183	7ede4765	0	0	0.0000	CRASH	gen=809 glyphs=2
2026-03-14T07:36:45.692464	099964a4	0	0	0.0000	CRASH	gen=810 glyphs=4
2026-03-14T07:36:45.692661	099964a4	0	0	0.0000	CRASH	gen=810 glyphs=4
2026-03-14T07:36:45.692857	099964a4	0	0	0.0000	CRASH	gen=810 glyphs=4
2026-03-14T07:36:45.693049	e38aafdb	0	0	0.0000	CRASH	gen=810 glyphs=4
2026-03-14T07:36:45.693244	d93c1683	0	0	0.0000	CRASH	gen=810 glyphs=4
2026-03-14T07:36:45.693437	099964a4	0	0	0.0000	CRASH	gen=810 glyphs=4
2026-03-14T07:36:45.693638	80cef82b	0	0	0.0000	CRASH	gen=810 glyphs=4
2026-03-14T07:36:45.693831	099964a4	0	0	0.0000	CRASH	gen=810 glyphs=4
2026-03-14T07:36:45.694023	099964a4	0	0	0.0000	CRASH	gen=810 glyphs=4
2026-03-14T07:36:45.694212	099964a4	0	0	0.0000	CRASH	gen=810 glyphs=4
2026-03-14T07:36:45.694493	099964a4	0	0	0.0000	CRASH	gen=811 glyphs=4
2026-03-14T07:36:45.694703	099964a4	0	0	0.0000	CRASH	gen=811 glyphs=4
2026-03-14T07:36:45.694899	80cef82b	0	0	0.0000	CRASH	gen=811 glyphs=4
2026-03-14T07:36:45.695096	7ede4765	0	0	0.0000	CRASH	gen=811 glyphs=2
2026-03-14T07:36:45.695290	0d4cd152	0	0	0.0000	CRASH	gen=811 glyphs=3
2026-03-14T07:36:45.695483	e342e43f	0	0	0.0000	CRASH	gen=811 glyphs=4
2026-03-14T07:36:45.695688	099964a4	0	0	0.0000	CRASH	gen=811 glyphs=4
2026-03-14T07:36:45.695883	5f29bbdb	0	0	0.0000	CRASH	gen=811 glyphs=4
2026-03-14T07:36:45.696078	dcb1fb50	0	0	0.0000	CRASH	gen=811 glyphs=4
2026-03-14T07:36:45.696271	099964a4	0	0	0.0000	CRASH	gen=811 glyphs=4
2026-03-14T07:36:45.696545	099964a4	0	0	0.0000	CRASH	gen=812 glyphs=4
2026-03-14T07:36:45.696742	099964a4	0	0	0.0000	CRASH	gen=812 glyphs=4
2026-03-14T07:36:45.696937	099964a4	0	0	0.0000	CRASH	gen=812 glyphs=4
2026-03-14T07:36:45.697131	099964a4	0	0	0.0000	CRASH	gen=812 glyphs=4
2026-03-14T07:36:45.697325	099964a4	0	0	0.0000	CRASH	gen=812 glyphs=4
2026-03-14T07:36:45.697520	29d25ce8	0	0	0.0000	CRASH	gen=812 glyphs=3
2026-03-14T07:36:45.697714	c0ce10e7	0	0	0.0000	CRASH	gen=812 glyphs=4
2026-03-14T07:36:45.697911	8da1f8d8	0	0	0.0000	CRASH	gen=812 glyphs=4
2026-03-14T07:36:45.698105	653bb90d	0	0	0.0000	CRASH	gen=812 glyphs=3
2026-03-14T07:36:45.698298	099964a4	0	0	0.0000	CRASH	gen=812 glyphs=4
2026-03-14T07:36:45.698577	099964a4	0	0	0.0000	CRASH	gen=813 glyphs=4
2026-03-14T07:36:45.698774	099964a4	0	0	0.0000	CRASH	gen=813 glyphs=4
2026-03-14T07:36:45.698976	80cef82b	0	0	0.0000	CRASH	gen=813 glyphs=4
2026-03-14T07:36:45.699173	3ca14993	0	0	0.0000	CRASH	gen=813 glyphs=4
2026-03-14T07:36:45.699369	099964a4	0	0	0.0000	CRASH	gen=813 glyphs=4
2026-03-14T07:36:45.699570	cf93b656	0	0	0.0000	CRASH	gen=813 glyphs=3
2026-03-14T07:36:45.699765	099964a4	0	0	0.0000	CRASH	gen=813 glyphs=4
2026-03-14T07:36:45.699962	099964a4	0	0	0.0000	CRASH	gen=813 glyphs=4
2026-03-14T07:36:45.700159	dcb1fb50	0	0	0.0000	CRASH	gen=813 glyphs=4
2026-03-14T07:36:45.700357	099964a4	0	0	0.0000	CRASH	gen=813 glyphs=4
2026-03-14T07:36:45.700625	099964a4	0	0	0.0000	CRASH	gen=814 glyphs=4
2026-03-14T07:36:45.700819	099964a4	0	0	0.0000	CRASH	gen=814 glyphs=4
2026-03-14T07:36:45.701015	3ca14993	0	0	0.0000	CRASH	gen=814 glyphs=4
2026-03-14T07:36:45.701210	7ede4765	0	0	0.0000	CRASH	gen=814 glyphs=2
2026-03-14T07:36:45.701403	7ede4765	0	0	0.0000	CRASH	gen=814 glyphs=2
2026-03-14T07:36:45.701598	099964a4	0	0	0.0000	CRASH	gen=814 glyphs=4
2026-03-14T07:36:45.701791	099964a4	0	0	0.0000	CRASH	gen=814 glyphs=4
2026-03-14T07:36:45.701982	3a734398	0	0	0.0000	CRASH	gen=814 glyphs=4
2026-03-14T07:36:45.702181	099964a4	0	0	0.0000	CRASH	gen=814 glyphs=4
2026-03-14T07:36:45.702373	099964a4	0	0	0.0000	CRASH	gen=814 glyphs=4
2026-03-14T07:36:45.702642	099964a4	0	0	0.0000	CRASH	gen=815 glyphs=4
2026-03-14T07:36:45.702837	099964a4	0	0	0.0000	CRASH	gen=815 glyphs=4
2026-03-14T07:36:45.703033	099964a4	0	0	0.0000	CRASH	gen=815 glyphs=4
2026-03-14T07:36:45.703237	ff30496a	0	0	0.0000	CRASH	gen=815 glyphs=3
2026-03-14T07:36:45.703431	099964a4	0	0	0.0000	CRASH	gen=815 glyphs=4
2026-03-14T07:36:45.703625	dcb1fb50	0	0	0.0000	CRASH	gen=815 glyphs=4
2026-03-14T07:36:45.703821	099964a4	0	0	0.0000	CRASH	gen=815 glyphs=4
2026-03-14T07:36:45.704023	050dd7f1	0	0	0.0000	CRASH	gen=815 glyphs=3
2026-03-14T07:36:45.704215	cbe5666f	0	0	0.0000	CRASH	gen=815 glyphs=4
2026-03-14T07:36:45.704412	cf93b656	0	0	0.0000	CRASH	gen=815 glyphs=3
2026-03-14T07:36:45.704689	099964a4	0	0	0.0000	CRASH	gen=816 glyphs=4
2026-03-14T07:36:45.704883	099964a4	0	0	0.0000	CRASH	gen=816 glyphs=4
2026-03-14T07:36:45.705079	099964a4	0	0	0.0000	CRASH	gen=816 glyphs=4
2026-03-14T07:36:45.705271	0415c214	0	0	0.0000	CRASH	gen=816 glyphs=3
2026-03-14T07:36:45.705467	f363fb03	0	0	0.0000	CRASH	gen=816 glyphs=4
2026-03-14T07:36:45.705664	099964a4	0	0	0.0000	CRASH	gen=816 glyphs=4
2026-03-14T07:36:45.705858	fda8d8d9	0	0	0.0000	CRASH	gen=816 glyphs=4
2026-03-14T07:36:45.706053	4dd893ee	0	0	0.0000	CRASH	gen=816 glyphs=4
2026-03-14T07:36:45.706248	099964a4	0	0	0.0000	CRASH	gen=816 glyphs=4
2026-03-14T07:36:45.706441	8da1f8d8	0	0	0.0000	CRASH	gen=816 glyphs=4
2026-03-14T07:36:45.706726	099964a4	0	0	0.0000	CRASH	gen=817 glyphs=4
2026-03-14T07:36:45.706921	099964a4	0	0	0.0000	CRASH	gen=817 glyphs=4
2026-03-14T07:36:45.707116	099964a4	0	0	0.0000	CRASH	gen=817 glyphs=4
2026-03-14T07:36:45.707308	099964a4	0	0	0.0000	CRASH	gen=817 glyphs=4
2026-03-14T07:36:45.707501	099964a4	0	0	0.0000	CRASH	gen=817 glyphs=4
2026-03-14T07:36:45.707705	c9f41bd7	0	0	0.0000	CRASH	gen=817 glyphs=4
2026-03-14T07:36:45.707902	099964a4	0	0	0.0000	CRASH	gen=817 glyphs=4
2026-03-14T07:36:45.708092	012e71b8	0	0	0.0000	CRASH	gen=817 glyphs=3
2026-03-14T07:36:45.708290	ff30496a	0	0	0.0000	CRASH	gen=817 glyphs=3
2026-03-14T07:36:45.708484	099964a4	0	0	0.0000	CRASH	gen=817 glyphs=4
2026-03-14T07:36:45.708762	099964a4	0	0	0.0000	CRASH	gen=818 glyphs=4
2026-03-14T07:36:45.708956	099964a4	0	0	0.0000	CRASH	gen=818 glyphs=4
2026-03-14T07:36:45.709149	80cef82b	0	0	0.0000	CRASH	gen=818 glyphs=4
2026-03-14T07:36:45.709344	099964a4	0	0	0.0000	CRASH	gen=818 glyphs=4
2026-03-14T07:36:45.709537	7ede4765	0	0	0.0000	CRASH	gen=818 glyphs=2
2026-03-14T07:36:45.709728	099964a4	0	0	0.0000	CRASH	gen=818 glyphs=4
2026-03-14T07:36:45.709925	a2bfdf6e	0	0	0.0000	CRASH	gen=818 glyphs=3
2026-03-14T07:36:45.710118	3a734398	0	0	0.0000	CRASH	gen=818 glyphs=4
2026-03-14T07:36:45.710311	099964a4	0	0	0.0000	CRASH	gen=818 glyphs=4
2026-03-14T07:36:45.710502	cf93b656	0	0	0.0000	CRASH	gen=818 glyphs=3
2026-03-14T07:36:45.710773	099964a4	0	0	0.0000	CRASH	gen=819 glyphs=4
2026-03-14T07:36:45.710971	099964a4	0	0	0.0000	CRASH	gen=819 glyphs=4
2026-03-14T07:36:45.711166	099964a4	0	0	0.0000	CRASH	gen=819 glyphs=4
2026-03-14T07:36:45.711358	8c10eceb	0	0	0.0000	CRASH	gen=819 glyphs=4
2026-03-14T07:36:45.711553	7ede4765	0	0	0.0000	CRASH	gen=819 glyphs=2
2026-03-14T07:36:45.711744	099964a4	0	0	0.0000	CRASH	gen=819 glyphs=4
2026-03-14T07:36:45.711939	80cef82b	0	0	0.0000	CRASH	gen=819 glyphs=4
2026-03-14T07:36:45.712133	099964a4	0	0	0.0000	CRASH	gen=819 glyphs=4
2026-03-14T07:36:45.712325	099964a4	0	0	0.0000	CRASH	gen=819 glyphs=4
2026-03-14T07:36:45.712514	3a734398	0	0	0.0000	CRASH	gen=819 glyphs=4
2026-03-14T07:36:45.712786	099964a4	0	0	0.0000	CRASH	gen=820 glyphs=4
2026-03-14T07:36:45.712984	099964a4	0	0	0.0000	CRASH	gen=820 glyphs=4
2026-03-14T07:36:45.713177	7c22f06f	0	0	0.0000	CRASH	gen=820 glyphs=4
2026-03-14T07:36:45.713369	099964a4	0	0	0.0000	CRASH	gen=820 glyphs=4
2026-03-14T07:36:45.713563	099964a4	0	0	0.0000	CRASH	gen=820 glyphs=4
2026-03-14T07:36:45.713755	099964a4	0	0	0.0000	CRASH	gen=820 glyphs=4
2026-03-14T07:36:45.713946	099964a4	0	0	0.0000	CRASH	gen=820 glyphs=4
2026-03-14T07:36:45.714152	099964a4	0	0	0.0000	CRASH	gen=820 glyphs=4
2026-03-14T07:36:45.714345	80cef82b	0	0	0.0000	CRASH	gen=820 glyphs=4
2026-03-14T07:36:45.714538	80cef82b	0	0	0.0000	CRASH	gen=820 glyphs=4
2026-03-14T07:36:45.714818	099964a4	0	0	0.0000	CRASH	gen=821 glyphs=4
2026-03-14T07:36:45.715014	099964a4	0	0	0.0000	CRASH	gen=821 glyphs=4
2026-03-14T07:36:45.715215	0e504eb3	0	0	0.0000	CRASH	gen=821 glyphs=4
2026-03-14T07:36:45.715408	2740b48d	0	0	0.0000	CRASH	gen=821 glyphs=4
2026-03-14T07:36:45.715606	099964a4	0	0	0.0000	CRASH	gen=821 glyphs=4
2026-03-14T07:36:45.715796	081ca320	0	0	0.0000	CRASH	gen=821 glyphs=4
2026-03-14T07:36:45.715990	803879d6	0	0	0.0000	CRASH	gen=821 glyphs=4
2026-03-14T07:36:45.716186	099964a4	0	0	0.0000	CRASH	gen=821 glyphs=4
2026-03-14T07:36:45.716381	8da1f8d8	0	0	0.0000	CRASH	gen=821 glyphs=4
2026-03-14T07:36:45.716578	dcb1fb50	0	0	0.0000	CRASH	gen=821 glyphs=4
2026-03-14T07:36:45.716859	099964a4	0	0	0.0000	CRASH	gen=822 glyphs=4
2026-03-14T07:36:45.717053	099964a4	0	0	0.0000	CRASH	gen=822 glyphs=4
2026-03-14T07:36:45.717249	fb8c46a5	0	0	0.0000	CRASH	gen=822 glyphs=3
2026-03-14T07:36:45.717440	099964a4	0	0	0.0000	CRASH	gen=822 glyphs=4
2026-03-14T07:36:45.717635	099964a4	0	0	0.0000	CRASH	gen=822 glyphs=4
2026-03-14T07:36:45.717834	ff30496a	0	0	0.0000	CRASH	gen=822 glyphs=3
2026-03-14T07:36:45.718026	2ea69437	0	0	0.0000	CRASH	gen=822 glyphs=4
2026-03-14T07:36:45.718221	99bfdae0	0	0	0.0000	CRASH	gen=822 glyphs=3
2026-03-14T07:36:45.718424	099964a4	0	0	0.0000	CRASH	gen=822 glyphs=4
2026-03-14T07:36:45.718619	5b97f7cd	0	0	0.0000	CRASH	gen=822 glyphs=5
2026-03-14T07:36:45.718894	099964a4	0	0	0.0000	CRASH	gen=823 glyphs=4
2026-03-14T07:36:45.719087	099964a4	0	0	0.0000	CRASH	gen=823 glyphs=4
2026-03-14T07:36:45.719280	099964a4	0	0	0.0000	CRASH	gen=823 glyphs=4
2026-03-14T07:36:45.719480	099964a4	0	0	0.0000	CRASH	gen=823 glyphs=4
2026-03-14T07:36:45.719674	80cef82b	0	0	0.0000	CRASH	gen=823 glyphs=4
2026-03-14T07:36:45.719867	099964a4	0	0	0.0000	CRASH	gen=823 glyphs=4
2026-03-14T07:36:45.720057	099964a4	0	0	0.0000	CRASH	gen=823 glyphs=4
2026-03-14T07:36:45.720250	099964a4	0	0	0.0000	CRASH	gen=823 glyphs=4
2026-03-14T07:36:45.720444	9fa5f8ee	0	0	0.0000	CRASH	gen=823 glyphs=2
2026-03-14T07:36:45.720648	099964a4	0	0	0.0000	CRASH	gen=823 glyphs=4
2026-03-14T07:36:45.720912	099964a4	0	0	0.0000	CRASH	gen=824 glyphs=4
2026-03-14T07:36:45.721105	099964a4	0	0	0.0000	CRASH	gen=824 glyphs=4
2026-03-14T07:36:45.721299	099964a4	0	0	0.0000	CRASH	gen=824 glyphs=4
2026-03-14T07:36:45.721488	099964a4	0	0	0.0000	CRASH	gen=824 glyphs=4
2026-03-14T07:36:45.721688	8fc0ed2d	0	0	0.0000	CRASH	gen=824 glyphs=5
2026-03-14T07:36:45.721881	80cef82b	0	0	0.0000	CRASH	gen=824 glyphs=4
2026-03-14T07:36:45.722074	60053f23	0	0	0.0000	CRASH	gen=824 glyphs=5
2026-03-14T07:36:45.722267	d4744604	0	0	0.0000	CRASH	gen=824 glyphs=4
2026-03-14T07:36:45.722462	099964a4	0	0	0.0000	CRASH	gen=824 glyphs=4
2026-03-14T07:36:45.722660	099964a4	0	0	0.0000	CRASH	gen=824 glyphs=4
2026-03-14T07:36:45.722939	099964a4	0	0	0.0000	CRASH	gen=825 glyphs=4
2026-03-14T07:36:45.723133	099964a4	0	0	0.0000	CRASH	gen=825 glyphs=4
2026-03-14T07:36:45.723325	099964a4	0	0	0.0000	CRASH	gen=825 glyphs=4
2026-03-14T07:36:45.723515	099964a4	0	0	0.0000	CRASH	gen=825 glyphs=4
2026-03-14T07:36:45.723716	099964a4	0	0	0.0000	CRASH	gen=825 glyphs=4
2026-03-14T07:36:45.723905	ff30496a	0	0	0.0000	CRASH	gen=825 glyphs=3
2026-03-14T07:36:45.724095	1df04f5e	0	0	0.0000	CRASH	gen=825 glyphs=3
2026-03-14T07:36:45.724285	cf93b656	0	0	0.0000	CRASH	gen=825 glyphs=3
2026-03-14T07:36:45.724476	457b2064	0	0	0.0000	CRASH	gen=825 glyphs=3
2026-03-14T07:36:45.724673	80cef82b	0	0	0.0000	CRASH	gen=825 glyphs=4
2026-03-14T07:36:45.724954	099964a4	0	0	0.0000	CRASH	gen=826 glyphs=4
2026-03-14T07:36:45.725148	099964a4	0	0	0.0000	CRASH	gen=826 glyphs=4
2026-03-14T07:36:45.725343	8da1f8d8	0	0	0.0000	CRASH	gen=826 glyphs=4
2026-03-14T07:36:45.725542	099964a4	0	0	0.0000	CRASH	gen=826 glyphs=4
2026-03-14T07:36:45.725734	cf93b656	0	0	0.0000	CRASH	gen=826 glyphs=3
2026-03-14T07:36:45.725931	37da0b27	0	0	0.0000	CRASH	gen=826 glyphs=3
2026-03-14T07:36:45.726123	099964a4	0	0	0.0000	CRASH	gen=826 glyphs=4
2026-03-14T07:36:45.726314	099964a4	0	0	0.0000	CRASH	gen=826 glyphs=4
