timestamp	program_hash	spirv_size	word_count	fitness	status	description
2026-03-14T07:36:44.311501	099964a4	0	0	0.0000	CRASH	gen=138 glyphs=4
2026-03-14T07:36:44.311698	8201d86f	0	0	0.0000	CRASH	gen=138 glyphs=4
2026-03-14T07:36:44.311892	099964a4	0	0	0.0000	CRASH	gen=138 glyphs=4
2026-03-14T07:36:44.312092	80cef82b	0	0	0.0000	CRASH	gen=138 glyphs=4
2026-03-14T07:36:44.312286	099964a4	0	0	0.0000	CRASH	gen=138 glyphs=4
2026-03-14T07:36:44.312475	6fc67b9d	0	0	0.0000	CRASH	gen=138 glyphs=4
2026-03-14T07:36:44.312672	099964a4	0	0	0.0000	CRASH	gen=138 glyphs=4
2026-03-14T07:36:44.312868	3ca14993	0	0	0.0000	CRASH	gen=138 glyphs=4
2026-03-14T07:36:44.313146	099964a4	0	0	0.0000	CRASH	gen=139 glyphs=4
2026-03-14T07:36:44.313341	099964a4	0	0	0.0000	CRASH	gen=139 glyphs=4
2026-03-14T07:36:44.313537	16177042	0	0	0.0000	CRASH	gen=139 glyphs=5
2026-03-14T07:36:44.313734	099964a4	0	0	0.0000	CRASH	gen=139 glyphs=4
2026-03-14T07:36:44.313938	606a877b	0	0	0.0000	CRASH	gen=139 glyphs=2
2026-03-14T07:36:44.314131	099964a4	0	0	0.0000	CRASH	gen=139 glyphs=4
2026-03-14T07:36:44.314321	099964a4	0	0	0.0000	CRASH	gen=139 glyphs=4
2026-03-14T07:36:44.314513	3a734398	0	0	0.0000	CRASH	gen=139 glyphs=4
2026-03-14T07:36:44.314707	e952c094	0	0	0.0000	CRASH	gen=139 glyphs=3
2026-03-14T07:36:44.314901	88787f01	0	0	0.0000	CRASH	gen=139 glyphs=4
2026-03-14T07:36:44.315173	099964a4	0	0	0.0000	CRASH	gen=140 glyphs=4
2026-03-14T07:36:44.315377	099964a4	0	0	0.0000	CRASH	gen=140 glyphs=4
2026-03-14T07:36:44.315584	099964a4	0	0	0.0000	CRASH	gen=140 glyphs=4
2026-03-14T07:36:44.315777	099964a4	0	0	0.0000	CRASH	gen=140 glyphs=4
2026-03-14T07:36:44.315972	8da1f8d8	0	0	0.0000	CRASH	gen=140 glyphs=4
2026-03-14T07:36:44.316164	099964a4	0	0	0.0000	CRASH	gen=140 glyphs=4
2026-03-14T07:36:44.316355	3a734398	0	0	0.0000	CRASH	gen=140 glyphs=4
2026-03-14T07:36:44.316548	099964a4	0	0	0.0000	CRASH	gen=140 glyphs=4
2026-03-14T07:36:44.316742	099964a4	0	0	0.0000	CRASH	gen=140 glyphs=4
2026-03-14T07:36:44.316936	7aab3c5a	0	0	0.0000	CRASH	gen=140 glyphs=4
2026-03-14T07:36:44.317220	099964a4	0	0	0.0000	CRASH	gen=141 glyphs=4
2026-03-14T07:36:44.317415	099964a4	0	0	0.0000	CRASH	gen=141 glyphs=4
2026-03-14T07:36:44.317611	cf93b656	0	0	0.0000	CRASH	gen=141 glyphs=3
2026-03-14T07:36:44.317802	7ede4765	0	0	0.0000	CRASH	gen=141 glyphs=2
2026-03-14T07:36:44.317991	099964a4	0	0	0.0000	CRASH	gen=141 glyphs=4
2026-03-14T07:36:44.318183	73d75522	0	0	0.0000	CRASH	gen=141 glyphs=4
2026-03-14T07:36:44.318380	23223e3d	0	0	0.0000	CRASH	gen=141 glyphs=4
2026-03-14T07:36:44.318583	80cef82b	0	0	0.0000	CRASH	gen=141 glyphs=4
2026-03-14T07:36:44.318780	099964a4	0	0	0.0000	CRASH	gen=141 glyphs=4
2026-03-14T07:36:44.318969	3ca14993	0	0	0.0000	CRASH	gen=141 glyphs=4
2026-03-14T07:36:44.319244	099964a4	0	0	0.0000	CRASH	gen=142 glyphs=4
2026-03-14T07:36:44.319442	099964a4	0	0	0.0000	CRASH	gen=142 glyphs=4
2026-03-14T07:36:44.319639	5ae75120	0	0	0.0000	CRASH	gen=142 glyphs=3
2026-03-14T07:36:44.319832	099964a4	0	0	0.0000	CRASH	gen=142 glyphs=4
2026-03-14T07:36:44.320023	099964a4	0	0	0.0000	CRASH	gen=142 glyphs=4
2026-03-14T07:36:44.320221	7ede4765	0	0	0.0000	CRASH	gen=142 glyphs=2
2026-03-14T07:36:44.320412	099964a4	0	0	0.0000	CRASH	gen=142 glyphs=4
2026-03-14T07:36:44.320606	4e6bdc32	0	0	0.0000	CRASH	gen=142 glyphs=3
2026-03-14T07:36:44.320801	099964a4	0	0	0.0000	CRASH	gen=142 glyphs=4
2026-03-14T07:36:44.320994	099964a4	0	0	0.0000	CRASH	gen=142 glyphs=4
2026-03-14T07:36:44.321265	099964a4	0	0	0.0000	CRASH	gen=143 glyphs=4
2026-03-14T07:36:44.321466	099964a4	0	0	0.0000	CRASH	gen=143 glyphs=4
2026-03-14T07:36:44.321667	099964a4	0	0	0.0000	CRASH	gen=143 glyphs=4
2026-03-14T07:36:44.321859	ff30496a	0	0	0.0000	CRASH	gen=143 glyphs=3
2026-03-14T07:36:44.322050	dcb1fb50	0	0	0.0000	CRASH	gen=143 glyphs=4
2026-03-14T07:36:44.322243	dcb1fb50	0	0	0.0000	CRASH	gen=143 glyphs=4
2026-03-14T07:36:44.322436	099964a4	0	0	0.0000	CRASH	gen=143 glyphs=4
2026-03-14T07:36:44.322627	b3c6cf5d	0	0	0.0000	CRASH	gen=143 glyphs=5
2026-03-14T07:36:44.322825	3a734398	0	0	0.0000	CRASH	gen=143 glyphs=4
2026-03-14T07:36:44.323019	099964a4	0	0	0.0000	CRASH	gen=143 glyphs=4
2026-03-14T07:36:44.323296	099964a4	0	0	0.0000	CRASH	gen=144 glyphs=4
2026-03-14T07:36:44.323493	099964a4	0	0	0.0000	CRASH	gen=144 glyphs=4
2026-03-14T07:36:44.323689	099964a4	0	0	0.0000	CRASH	gen=144 glyphs=4
2026-03-14T07:36:44.323883	099964a4	0	0	0.0000	CRASH	gen=144 glyphs=4
2026-03-14T07:36:44.324075	0fb798e9	0	0	0.0000	CRASH	gen=144 glyphs=3
2026-03-14T07:36:44.324266	099964a4	0	0	0.0000	CRASH	gen=144 glyphs=4
2026-03-14T07:36:44.324462	8da1f8d8	0	0	0.0000	CRASH	gen=144 glyphs=4
2026-03-14T07:36:44.324660	099964a4	0	0	0.0000	CRASH	gen=144 glyphs=4
2026-03-14T07:36:44.324855	a023c030	0	0	0.0000	CRASH	gen=144 glyphs=5
2026-03-14T07:36:44.325053	099964a4	0	0	0.0000	CRASH	gen=144 glyphs=4
2026-03-14T07:36:44.325312	099964a4	0	0	0.0000	CRASH	gen=145 glyphs=4
2026-03-14T07:36:44.325510	099964a4	0	0	0.0000	CRASH	gen=145 glyphs=4
2026-03-14T07:36:44.325707	ff30496a	0	0	0.0000	CRASH	gen=145 glyphs=3
2026-03-14T07:36:44.325900	099964a4	0	0	0.0000	CRASH	gen=145 glyphs=4
2026-03-14T07:36:44.326093	f29b1e77	0	0	0.0000	CRASH	gen=145 glyphs=4
2026-03-14T07:36:44.326287	e416172f	0	0	0.0000	CRASH	gen=145 glyphs=2
2026-03-14T07:36:44.326479	80cef82b	0	0	0.0000	CRASH	gen=145 glyphs=4
2026-03-14T07:36:44.326677	099964a4	0	0	0.0000	CRASH	gen=145 glyphs=4
2026-03-14T07:36:44.326868	099964a4	0	0	0.0000	CRASH	gen=145 glyphs=4
2026-03-14T07:36:44.327060	099964a4	0	0	0.0000	CRASH	gen=145 glyphs=4
2026-03-14T07:36:44.327334	099964a4	0	0	0.0000	CRASH	gen=146 glyphs=4
2026-03-14T07:36:44.327534	099964a4	0	0	0.0000	CRASH	gen=146 glyphs=4
2026-03-14T07:36:44.327733	099964a4	0	0	0.0000	CRASH	gen=146 glyphs=4
2026-03-14T07:36:44.327926	099964a4	0	0	0.0000	CRASH	gen=146 glyphs=4
2026-03-14T07:36:44.328121	099964a4	0	0	0.0000	CRASH	gen=146 glyphs=4
2026-03-14T07:36:44.328313	099964a4	0	0	0.0000	CRASH	gen=146 glyphs=4
2026-03-14T07:36:44.328506	dcb1fb50	0	0	0.0000	CRASH	gen=146 glyphs=4
2026-03-14T07:36:44.328707	099964a4	0	0	0.0000	CRASH	gen=146 glyphs=4
2026-03-14T07:36:44.328904	ff30496a	0	0	0.0000	CRASH	gen=146 glyphs=3
2026-03-14T07:36:44.329097	393225ca	0	0	0.0000	CRASH	gen=146 glyphs=4
2026-03-14T07:36:44.329371	099964a4	0	0	0.0000	CRASH	gen=147 glyphs=4
2026-03-14T07:36:44.329569	099964a4	0	0	0.0000	CRASH	gen=147 glyphs=4
2026-03-14T07:36:44.329769	099964a4	0	0	0.0000	CRASH	gen=147 glyphs=4
2026-03-14T07:36:44.329964	67ce6d2b	0	0	0.0000	CRASH	gen=147 glyphs=4
2026-03-14T07:36:44.330159	cf8e3128	0	0	0.0000	CRASH	gen=147 glyphs=3
2026-03-14T07:36:44.330354	099964a4	0	0	0.0000	CRASH	gen=147 glyphs=4
2026-03-14T07:36:44.330547	099964a4	0	0	0.0000	CRASH	gen=147 glyphs=4
2026-03-14T07:36:44.330743	099964a4	0	0	0.0000	CRASH	gen=147 glyphs=4
2026-03-14T07:36:44.330939	be71ba2f	0	0	0.0000	CRASH	gen=147 glyphs=4
2026-03-14T07:36:44.331133	cf93b656	0	0	0.0000	CRASH	gen=147 glyphs=3
2026-03-14T07:36:44.331401	099964a4	0	0	0.0000	CRASH	gen=148 glyphs=4
2026-03-14T07:36:44.331597	099964a4	0	0	0.0000	CRASH	gen=148 glyphs=4
2026-03-14T07:36:44.331790	099964a4	0	0	0.0000	CRASH	gen=148 glyphs=4
2026-03-14T07:36:44.331983	099964a4	0	0	0.0000	CRASH	gen=148 glyphs=4
2026-03-14T07:36:44.332175	3ca14993	0	0	0.0000	CRASH	gen=148 glyphs=4
2026-03-14T07:36:44.332367	099964a4	0	0	0.0000	CRASH	gen=148 glyphs=4
2026-03-14T07:36:44.332562	14923ae5	0	0	0.0000	CRASH	gen=148 glyphs=4
2026-03-14T07:36:44.332755	099964a4	0	0	0.0000	CRASH	gen=148 glyphs=4
2026-03-14T07:36:44.332950	80cef82b	0	0	0.0000	CRASH	gen=148 glyphs=4
2026-03-14T07:36:44.333142	099964a4	0	0	0.0000	CRASH	gen=148 glyphs=4
2026-03-14T07:36:44.333413	099964a4	0	0	0.0000	CRASH	gen=149 glyphs=4
2026-03-14T07:36:44.333609	099964a4	0	0	0.0000	CRASH	gen=149 glyphs=4
2026-03-14T07:36:44.333804	099964a4	0	0	0.0000	CRASH	gen=149 glyphs=4
2026-03-14T07:36:44.334001	a55e6f31	0	0	0.0000	CRASH	gen=149 glyphs=4
2026-03-14T07:36:44.334195	3a734398	0	0	0.0000	CRASH	gen=149 glyphs=4
2026-03-14T07:36:44.334388	099964a4	0	0	0.0000	CRASH	gen=149 glyphs=4
2026-03-14T07:36:44.334583	099964a4	0	0	0.0000	CRASH	gen=149 glyphs=4
2026-03-14T07:36:44.334775	109599d8	0	0	0.0000	CRASH	gen=149 glyphs=5
2026-03-14T07:36:44.334975	8364dd24	0	0	0.0000	CRASH	gen=149 glyphs=2
2026-03-14T07:36:44.335170	099964a4	0	0	0.0000	CRASH	gen=149 glyphs=4
2026-03-14T07:36:44.335442	099964a4	0	0	0.0000	CRASH	gen=150 glyphs=4
2026-03-14T07:36:44.335639	099964a4	0	0	0.0000	CRASH	gen=150 glyphs=4
2026-03-14T07:36:44.335832	055c486f	0	0	0.0000	CRASH	gen=150 glyphs=4
2026-03-14T07:36:44.336024	4f351c8d	0	0	0.0000	CRASH	gen=150 glyphs=3
2026-03-14T07:36:44.336221	099964a4	0	0	0.0000	CRASH	gen=150 glyphs=4
2026-03-14T07:36:44.336413	8da1f8d8	0	0	0.0000	CRASH	gen=150 glyphs=4
2026-03-14T07:36:44.336608	d78dfb8d	0	0	0.0000	CRASH	gen=150 glyphs=4
2026-03-14T07:36:44.336801	010cd3ee	0	0	0.0000	CRASH	gen=150 glyphs=4
2026-03-14T07:36:44.336998	099964a4	0	0	0.0000	CRASH	gen=150 glyphs=4
2026-03-14T07:36:44.337196	099964a4	0	0	0.0000	CRASH	gen=150 glyphs=4
2026-03-14T07:36:44.337472	099964a4	0	0	0.0000	CRASH	gen=151 glyphs=4
2026-03-14T07:36:44.337670	099964a4	0	0	0.0000	CRASH	gen=151 glyphs=4
2026-03-14T07:36:44.337866	77df8d4b	0	0	0.0000	CRASH	gen=151 glyphs=3
2026-03-14T07:36:44.338062	3ca14993	0	0	0.0000	CRASH	gen=151 glyphs=4
2026-03-14T07:36:44.338263	099964a4	0	0	0.0000	CRASH	gen=151 glyphs=4
2026-03-14T07:36:44.338458	099964a4	0	0	0.0000	CRASH	gen=151 glyphs=4
2026-03-14T07:36:44.338653	099964a4	0	0	0.0000	CRASH	gen=151 glyphs=4
2026-03-14T07:36:44.338845	099964a4	0	0	0.0000	CRASH	gen=151 glyphs=4
2026-03-14T07:36:44.339038	cf93b656	0	0	0.0000	CRASH	gen=151 glyphs=3
2026-03-14T07:36:44.339230	7ede4765	0	0	0.0000	CRASH	gen=151 glyphs=2
2026-03-14T07:36:44.339518	099964a4	0	0	0.0000	CRASH	gen=152 glyphs=4
2026-03-14T07:36:44.339713	099964a4	0	0	0.0000	CRASH	gen=152 glyphs=4
2026-03-14T07:36:44.339906	8da1f8d8	0	0	0.0000	CRASH	gen=152 glyphs=4
2026-03-14T07:36:44.340100	55a2a76c	0	0	0.0000	CRASH	gen=152 glyphs=2
2026-03-14T07:36:44.340293	dcb1fb50	0	0	0.0000	CRASH	gen=152 glyphs=4
2026-03-14T07:36:44.340487	1d2d9b4a	0	0	0.0000	CRASH	gen=152 glyphs=4
2026-03-14T07:36:44.340684	3ca14993	0	0	0.0000	CRASH	gen=152 glyphs=4
2026-03-14T07:36:44.340877	3ca14993	0	0	0.0000	CRASH	gen=152 glyphs=4
2026-03-14T07:36:44.341074	db9cb417	0	0	0.0000	CRASH	gen=152 glyphs=5
2026-03-14T07:36:44.341270	099964a4	0	0	0.0000	CRASH	gen=152 glyphs=4
2026-03-14T07:36:44.341543	099964a4	0	0	0.0000	CRASH	gen=153 glyphs=4
2026-03-14T07:36:44.341738	099964a4	0	0	0.0000	CRASH	gen=153 glyphs=4
2026-03-14T07:36:44.341933	099964a4	0	0	0.0000	CRASH	gen=153 glyphs=4
2026-03-14T07:36:44.342124	ea147c16	0	0	0.0000	CRASH	gen=153 glyphs=4
2026-03-14T07:36:44.342318	099964a4	0	0	0.0000	CRASH	gen=153 glyphs=4
2026-03-14T07:36:44.342514	22b4a649	0	0	0.0000	CRASH	gen=153 glyphs=2
2026-03-14T07:36:44.342711	32e34084	0	0	0.0000	CRASH	gen=153 glyphs=4
2026-03-14T07:36:44.342906	099964a4	0	0	0.0000	CRASH	gen=153 glyphs=4
2026-03-14T07:36:44.343100	cf93b656	0	0	0.0000	CRASH	gen=153 glyphs=3
2026-03-14T07:36:44.343296	099964a4	0	0	0.0000	CRASH	gen=153 glyphs=4
2026-03-14T07:36:44.343581	099964a4	0	0	0.0000	CRASH	gen=154 glyphs=4
2026-03-14T07:36:44.343774	099964a4	0	0	0.0000	CRASH	gen=154 glyphs=4
2026-03-14T07:36:44.343968	7270c506	0	0	0.0000	CRASH	gen=154 glyphs=5
2026-03-14T07:36:44.344165	099964a4	0	0	0.0000	CRASH	gen=154 glyphs=4
2026-03-14T07:36:44.344360	7d91921b	0	0	0.0000	CRASH	gen=154 glyphs=3
2026-03-14T07:36:44.344558	fd83e7f8	0	0	0.0000	CRASH	gen=154 glyphs=4
2026-03-14T07:36:44.344754	8f725e2d	0	0	0.0000	CRASH	gen=154 glyphs=4
2026-03-14T07:36:44.344948	7ede4765	0	0	0.0000	CRASH	gen=154 glyphs=2
2026-03-14T07:36:44.345144	80cef82b	0	0	0.0000	CRASH	gen=154 glyphs=4
2026-03-14T07:36:44.345339	099964a4	0	0	0.0000	CRASH	gen=154 glyphs=4
2026-03-14T07:36:44.345611	099964a4	0	0	0.0000	CRASH	gen=155 glyphs=4
2026-03-14T07:36:44.345806	099964a4	0	0	0.0000	CRASH	gen=155 glyphs=4
2026-03-14T07:36:44.346002	099964a4	0	0	0.0000	CRASH	gen=155 glyphs=4
2026-03-14T07:36:44.346195	3a734398	0	0	0.0000	CRASH	gen=155 glyphs=4
2026-03-14T07:36:44.346389	099964a4	0	0	0.0000	CRASH	gen=155 glyphs=4
2026-03-14T07:36:44.346603	cf93b656	0	0	0.0000	CRASH	gen=155 glyphs=3
2026-03-14T07:36:44.346803	099964a4	0	0	0.0000	CRASH	gen=155 glyphs=4
2026-03-14T07:36:44.346999	ff30496a	0	0	0.0000	CRASH	gen=155 glyphs=3
2026-03-14T07:36:44.347194	099964a4	0	0	0.0000	CRASH	gen=155 glyphs=4
2026-03-14T07:36:44.347387	099964a4	0	0	0.0000	CRASH	gen=155 glyphs=4
2026-03-14T07:36:44.347663	099964a4	0	0	0.0000	CRASH	gen=156 glyphs=4
2026-03-14T07:36:44.347864	099964a4	0	0	0.0000	CRASH	gen=156 glyphs=4
2026-03-14T07:36:44.348058	099964a4	0	0	0.0000	CRASH	gen=156 glyphs=4
2026-03-14T07:36:44.348253	d2e2033e	0	0	0.0000	CRASH	gen=156 glyphs=3
2026-03-14T07:36:44.348448	099964a4	0	0	0.0000	CRASH	gen=156 glyphs=4
2026-03-14T07:36:44.348645	099964a4	0	0	0.0000	CRASH	gen=156 glyphs=4
2026-03-14T07:36:44.348842	e0493cff	0	0	0.0000	CRASH	gen=156 glyphs=4
2026-03-14T07:36:44.349040	9716a787	0	0	0.0000	CRASH	gen=156 glyphs=3
2026-03-14T07:36:44.349238	099964a4	0	0	0.0000	CRASH	gen=156 glyphs=4
2026-03-14T07:36:44.349433	5f4d6d8e	0	0	0.0000	CRASH	gen=156 glyphs=4
2026-03-14T07:36:44.349703	099964a4	0	0	0.0000	CRASH	gen=157 glyphs=4
2026-03-14T07:36:44.349902	099964a4	0	0	0.0000	CRASH	gen=157 glyphs=4
2026-03-14T07:36:44.350097	099964a4	0	0	0.0000	CRASH	gen=157 glyphs=4
2026-03-14T07:36:44.350291	099964a4	0	0	0.0000	CRASH	gen=157 glyphs=4
2026-03-14T07:36:44.350483	099964a4	0	0	0.0000	CRASH	gen=157 glyphs=4
2026-03-14T07:36:44.350680	099964a4	0	0	0.0000	CRASH	gen=157 glyphs=4
2026-03-14T07:36:44.350874	099964a4	0	0	0.0000	CRASH	gen=157 glyphs=4
2026-03-14T07:36:44.351071	8da1f8d8	0	0	0.0000	CRASH	gen=157 glyphs=4
2026-03-14T07:36:44.351265	099964a4	0	0	0.0000	CRASH	gen=157 glyphs=4
2026-03-14T07:36:44.351454	099964a4	0	0	0.0000	CRASH	gen=157 glyphs=4
2026-03-14T07:36:44.351717	099964a4	0	0	0.0000	CRASH	gen=158 glyphs=4
2026-03-14T07:36:44.351914	099964a4	0	0	0.0000	CRASH	gen=158 glyphs=4
2026-03-14T07:36:44.352113	cf93b656	0	0	0.0000	CRASH	gen=158 glyphs=3
2026-03-14T07:36:44.352306	099964a4	0	0	0.0000	CRASH	gen=158 glyphs=4
2026-03-14T07:36:44.352499	099964a4	0	0	0.0000	CRASH	gen=158 glyphs=4
2026-03-14T07:36:44.352695	099964a4	0	0	0.0000	CRASH	gen=158 glyphs=4
2026-03-14T07:36:44.352889	099964a4	0	0	0.0000	CRASH	gen=158 glyphs=4
2026-03-14T07:36:44.353086	099964a4	0	0	0.0000	CRASH	gen=158 glyphs=4
2026-03-14T07:36:44.353282	099964a4	0	0	0.0000	CRASH	gen=158 glyphs=4
2026-03-14T07:36:44.353476	6fc9d62f	0	0	0.0000	CRASH	gen=158 glyphs=5
2026-03-14T07:36:44.353757	099964a4	0	0	0.0000	CRASH	gen=159 glyphs=4
2026-03-14T07:36:44.353952	099964a4	0	0	0.0000	CRASH	gen=159 glyphs=4
2026-03-14T07:36:44.354149	12e75c33	0	0	0.0000	CRASH	gen=159 glyphs=4
2026-03-14T07:36:44.354345	3ca14993	0	0	0.0000	CRASH	gen=159 glyphs=4
2026-03-14T07:36:44.354543	099964a4	0	0	0.0000	CRASH	gen=159 glyphs=4
2026-03-14T07:36:44.354737	099964a4	0	0	0.0000	CRASH	gen=159 glyphs=4
2026-03-14T07:36:44.354930	7dbf4bfe	0	0	0.0000	CRASH	gen=159 glyphs=4
2026-03-14T07:36:44.355123	099964a4	0	0	0.0000	CRASH	gen=159 glyphs=4
2026-03-14T07:36:44.355320	f9e553d7	0	0	0.0000	CRASH	gen=159 glyphs=4
2026-03-14T07:36:44.355515	cf93b656	0	0	0.0000	CRASH	gen=159 glyphs=3
2026-03-14T07:36:44.355790	099964a4	0	0	0.0000	CRASH	gen=160 glyphs=4
2026-03-14T07:36:44.355986	099964a4	0	0	0.0000	CRASH	gen=160 glyphs=4
2026-03-14T07:36:44.356180	099964a4	0	0	0.0000	CRASH	gen=160 glyphs=4
2026-03-14T07:36:44.356377	11d154cf	0	0	0.0000	CRASH	gen=160 glyphs=4
2026-03-14T07:36:44.356577	19957222	0	0	0.0000	CRASH	gen=160 glyphs=3
2026-03-14T07:36:44.356771	099964a4	0	0	0.0000	CRASH	gen=160 glyphs=4
2026-03-14T07:36:44.356964	099964a4	0	0	0.0000	CRASH	gen=160 glyphs=4
2026-03-14T07:36:44.357157	7ede4765	0	0	0.0000	CRASH	gen=160 glyphs=2
2026-03-14T07:36:44.357356	099964a4	0	0	0.0000	CRASH	gen=160 glyphs=4
2026-03-14T07:36:44.357553	7e0ee0d8	0	0	0.0000	CRASH	gen=160 glyphs=3
2026-03-14T07:36:44.357845	099964a4	0	0	0.0000	CRASH	gen=161 glyphs=4
2026-03-14T07:36:44.358041	099964a4	0	0	0.0000	CRASH	gen=161 glyphs=4
2026-03-14T07:36:44.358236	099964a4	0	0	0.0000	CRASH	gen=161 glyphs=4
2026-03-14T07:36:44.358434	32c780a2	0	0	0.0000	CRASH	gen=161 glyphs=3
2026-03-14T07:36:44.358631	099964a4	0	0	0.0000	CRASH	gen=161 glyphs=4
2026-03-14T07:36:44.358826	f1283e5d	0	0	0.0000	CRASH	gen=161 glyphs=4
2026-03-14T07:36:44.359021	317f814d	0	0	0.0000	CRASH	gen=161 glyphs=5
2026-03-14T07:36:44.359215	099964a4	0	0	0.0000	CRASH	gen=161 glyphs=4
2026-03-14T07:36:44.359412	099964a4	0	0	0.0000	CRASH	gen=161 glyphs=4
2026-03-14T07:36:44.359606	099964a4	0	0	0.0000	CRASH	gen=161 glyphs=4
2026-03-14T07:36:44.359885	099964a4	0	0	0.0000	CRASH	gen=162 glyphs=4
2026-03-14T07:36:44.360079	099964a4	0	0	0.0000	CRASH	gen=162 glyphs=4
2026-03-14T07:36:44.360273	cf93b656	0	0	0.0000	CRASH	gen=162 glyphs=3
2026-03-14T07:36:44.360467	d910107a	0	0	0.0000	CRASH	gen=162 glyphs=2
2026-03-14T07:36:44.360663	e7b5d950	0	0	0.0000	CRASH	gen=162 glyphs=4
2026-03-14T07:36:44.360856	56bba73f	0	0	0.0000	CRASH	gen=162 glyphs=3
2026-03-14T07:36:44.361049	3ca14993	0	0	0.0000	CRASH	gen=162 glyphs=4
2026-03-14T07:36:44.361244	8da1f8d8	0	0	0.0000	CRASH	gen=162 glyphs=4
2026-03-14T07:36:44.361439	e5b3bb5f	0	0	0.0000	CRASH	gen=162 glyphs=3
2026-03-14T07:36:44.361638	099964a4	0	0	0.0000	CRASH	gen=162 glyphs=4
2026-03-14T07:36:44.361907	099964a4	0	0	0.0000	CRASH	gen=163 glyphs=4
2026-03-14T07:36:44.362101	099964a4	0	0	0.0000	CRASH	gen=163 glyphs=4
2026-03-14T07:36:44.362291	099964a4	0	0	0.0000	CRASH	gen=163 glyphs=4
2026-03-14T07:36:44.362484	099964a4	0	0	0.0000	CRASH	gen=163 glyphs=4
2026-03-14T07:36:44.362682	7ede4765	0	0	0.0000	CRASH	gen=163 glyphs=2
2026-03-14T07:36:44.362876	40cbbbd9	0	0	0.0000	CRASH	gen=163 glyphs=4
2026-03-14T07:36:44.363070	23820a56	0	0	0.0000	CRASH	gen=163 glyphs=4
2026-03-14T07:36:44.363279	099964a4	0	0	0.0000	CRASH	gen=163 glyphs=4
2026-03-14T07:36:44.363473	099964a4	0	0	0.0000	CRASH	gen=163 glyphs=4
2026-03-14T07:36:44.363673	7ede4765	0	0	0.0000	CRASH	gen=163 glyphs=2
2026-03-14T07:36:44.363950	099964a4	0	0	0.0000	CRASH	gen=164 glyphs=4
2026-03-14T07:36:44.364144	099964a4	0	0	0.0000	CRASH	gen=164 glyphs=4
2026-03-14T07:36:44.364338	099964a4	0	0	0.0000	CRASH	gen=164 glyphs=4
2026-03-14T07:36:44.364532	1be0f2b5	0	0	0.0000	CRASH	gen=164 glyphs=4
2026-03-14T07:36:44.364732	80cef82b	0	0	0.0000	CRASH	gen=164 glyphs=4
2026-03-14T07:36:44.364926	80cf019e	0	0	0.0000	CRASH	gen=164 glyphs=4
2026-03-14T07:36:44.365122	9e42c0e1	0	0	0.0000	CRASH	gen=164 glyphs=4
2026-03-14T07:36:44.365316	099964a4	0	0	0.0000	CRASH	gen=164 glyphs=4
2026-03-14T07:36:44.365509	a7c0adb5	0	0	0.0000	CRASH	gen=164 glyphs=4
2026-03-14T07:36:44.365706	e0b583a8	0	0	0.0000	CRASH	gen=164 glyphs=2
2026-03-14T07:36:44.365990	099964a4	0	0	0.0000	CRASH	gen=165 glyphs=4
2026-03-14T07:36:44.366187	099964a4	0	0	0.0000	CRASH	gen=165 glyphs=4
2026-03-14T07:36:44.366383	099964a4	0	0	0.0000	CRASH	gen=165 glyphs=4
2026-03-14T07:36:44.366580	099964a4	0	0	0.0000	CRASH	gen=165 glyphs=4
2026-03-14T07:36:44.366777	099964a4	0	0	0.0000	CRASH	gen=165 glyphs=4
2026-03-14T07:36:44.366971	7211b41b	0	0	0.0000	CRASH	gen=165 glyphs=4
2026-03-14T07:36:44.367166	099964a4	0	0	0.0000	CRASH	gen=165 glyphs=4
2026-03-14T07:36:44.367361	87c4156f	0	0	0.0000	CRASH	gen=165 glyphs=3
2026-03-14T07:36:44.367559	099964a4	0	0	0.0000	CRASH	gen=165 glyphs=4
2026-03-14T07:36:44.367750	099964a4	0	0	0.0000	CRASH	gen=165 glyphs=4
2026-03-14T07:36:44.368037	099964a4	0	0	0.0000	CRASH	gen=166 glyphs=4
2026-03-14T07:36:44.368232	099964a4	0	0	0.0000	CRASH	gen=166 glyphs=4
2026-03-14T07:36:44.368424	099964a4	0	0	0.0000	CRASH	gen=166 glyphs=4
2026-03-14T07:36:44.368620	099964a4	0	0	0.0000	CRASH	gen=166 glyphs=4
2026-03-14T07:36:44.368812	400fefc0	0	0	0.0000	CRASH	gen=166 glyphs=3
2026-03-14T07:36:44.369008	099964a4	0	0	0.0000	CRASH	gen=166 glyphs=4
2026-03-14T07:36:44.369202	099964a4	0	0	0.0000	CRASH	gen=166 glyphs=4
2026-03-14T07:36:44.369394	099964a4	0	0	0.0000	CRASH	gen=166 glyphs=4
2026-03-14T07:36:44.369588	75b48113	0	0	0.0000	CRASH	gen=166 glyphs=4
2026-03-14T07:36:44.369782	dcb1fb50	0	0	0.0000	CRASH	gen=166 glyphs=4
2026-03-14T07:36:44.370068	099964a4	0	0	0.0000	CRASH	gen=167 glyphs=4
2026-03-14T07:36:44.370263	099964a4	0	0	0.0000	CRASH	gen=167 glyphs=4
2026-03-14T07:36:44.370458	099964a4	0	0	0.0000	CRASH	gen=167 glyphs=4
2026-03-14T07:36:44.370650	8da1f8d8	0	0	0.0000	CRASH	gen=167 glyphs=4
2026-03-14T07:36:44.370846	d6642558	0	0	0.0000	CRASH	gen=167 glyphs=4
2026-03-14T07:36:44.371044	3ca14993	0	0	0.0000	CRASH	gen=167 glyphs=4
2026-03-14T07:36:44.371239	099964a4	0	0	0.0000	CRASH	gen=167 glyphs=4
2026-03-14T07:36:44.371430	099964a4	0	0	0.0000	CRASH	gen=167 glyphs=4
2026-03-14T07:36:44.371625	dcb1fb50	0	0	0.0000	CRASH	gen=167 glyphs=4
2026-03-14T07:36:44.371819	099964a4	0	0	0.0000	CRASH	gen=167 glyphs=4
2026-03-14T07:36:44.372097	099964a4	0	0	0.0000	CRASH	gen=168 glyphs=4
2026-03-14T07:36:44.372290	099964a4	0	0	0.0000	CRASH	gen=168 glyphs=4
2026-03-14T07:36:44.372483	099964a4	0	0	0.0000	CRASH	gen=168 glyphs=4
2026-03-14T07:36:44.372677	099964a4	0	0	0.0000	CRASH	gen=168 glyphs=4
2026-03-14T07:36:44.372868	ff30496a	0	0	0.0000	CRASH	gen=168 glyphs=3
2026-03-14T07:36:44.373057	5fd1a319	0	0	0.0000	CRASH	gen=168 glyphs=4
2026-03-14T07:36:44.373256	80cef82b	0	0	0.0000	CRASH	gen=168 glyphs=4
2026-03-14T07:36:44.373449	099964a4	0	0	0.0000	CRASH	gen=168 glyphs=4
2026-03-14T07:36:44.373651	865395a3	0	0	0.0000	CRASH	gen=168 glyphs=3
2026-03-14T07:36:44.373843	8da1f8d8	0	0	0.0000	CRASH	gen=168 glyphs=4
2026-03-14T07:36:44.374116	099964a4	0	0	0.0000	CRASH	gen=169 glyphs=4
2026-03-14T07:36:44.374314	099964a4	0	0	0.0000	CRASH	gen=169 glyphs=4
2026-03-14T07:36:44.374509	dcb1fb50	0	0	0.0000	CRASH	gen=169 glyphs=4
2026-03-14T07:36:44.374706	5dd07744	0	0	0.0000	CRASH	gen=169 glyphs=4
2026-03-14T07:36:44.374898	8da1f8d8	0	0	0.0000	CRASH	gen=169 glyphs=4
