timestamp	program_hash	spirv_size	word_count	fitness	status	description
2026-03-14T07:36:44.639197	4811c1a9	0	0	0.0000	CRASH	gen=294 glyphs=3
2026-03-14T07:36:44.639393	401f4674	0	0	0.0000	CRASH	gen=294 glyphs=4
2026-03-14T07:36:44.639591	3a734398	0	0	0.0000	CRASH	gen=294 glyphs=4
2026-03-14T07:36:44.639873	099964a4	0	0	0.0000	CRASH	gen=295 glyphs=4
2026-03-14T07:36:44.640071	099964a4	0	0	0.0000	CRASH	gen=295 glyphs=4
2026-03-14T07:36:44.640266	ea08ead1	0	0	0.0000	CRASH	gen=295 glyphs=3
2026-03-14T07:36:44.640459	099964a4	0	0	0.0000	CRASH	gen=295 glyphs=4
2026-03-14T07:36:44.640656	60abd5d3	0	0	0.0000	CRASH	gen=295 glyphs=4
2026-03-14T07:36:44.640853	099964a4	0	0	0.0000	CRASH	gen=295 glyphs=4
2026-03-14T07:36:44.641053	cf93b656	0	0	0.0000	CRASH	gen=295 glyphs=3
2026-03-14T07:36:44.641247	099964a4	0	0	0.0000	CRASH	gen=295 glyphs=4
2026-03-14T07:36:44.641442	099964a4	0	0	0.0000	CRASH	gen=295 glyphs=4
2026-03-14T07:36:44.641640	099964a4	0	0	0.0000	CRASH	gen=295 glyphs=4
2026-03-14T07:36:44.641916	099964a4	0	0	0.0000	CRASH	gen=296 glyphs=4
2026-03-14T07:36:44.642122	099964a4	0	0	0.0000	CRASH	gen=296 glyphs=4
2026-03-14T07:36:44.642315	099964a4	0	0	0.0000	CRASH	gen=296 glyphs=4
2026-03-14T07:36:44.642508	099964a4	0	0	0.0000	CRASH	gen=296 glyphs=4
2026-03-14T07:36:44.642707	099964a4	0	0	0.0000	CRASH	gen=296 glyphs=4
2026-03-14T07:36:44.642901	099964a4	0	0	0.0000	CRASH	gen=296 glyphs=4
2026-03-14T07:36:44.643099	80cef82b	0	0	0.0000	CRASH	gen=296 glyphs=4
2026-03-14T07:36:44.643296	ffcc2bcc	0	0	0.0000	CRASH	gen=296 glyphs=4
2026-03-14T07:36:44.643496	cf93b656	0	0	0.0000	CRASH	gen=296 glyphs=3
2026-03-14T07:36:44.643696	099964a4	0	0	0.0000	CRASH	gen=296 glyphs=4
2026-03-14T07:36:44.643979	099964a4	0	0	0.0000	CRASH	gen=297 glyphs=4
2026-03-14T07:36:44.644180	099964a4	0	0	0.0000	CRASH	gen=297 glyphs=4
2026-03-14T07:36:44.644376	dcb1fb50	0	0	0.0000	CRASH	gen=297 glyphs=4
2026-03-14T07:36:44.644574	5b4e9e8d	0	0	0.0000	CRASH	gen=297 glyphs=4
2026-03-14T07:36:44.644771	c85e0954	0	0	0.0000	CRASH	gen=297 glyphs=2
2026-03-14T07:36:44.644962	dcb1fb50	0	0	0.0000	CRASH	gen=297 glyphs=4
2026-03-14T07:36:44.645158	de6bee82	0	0	0.0000	CRASH	gen=297 glyphs=2
2026-03-14T07:36:44.645354	bc0df415	0	0	0.0000	CRASH	gen=297 glyphs=2
2026-03-14T07:36:44.645553	b9b4ec89	0	0	0.0000	CRASH	gen=297 glyphs=4
2026-03-14T07:36:44.645765	099964a4	0	0	0.0000	CRASH	gen=297 glyphs=4
2026-03-14T07:36:44.646042	099964a4	0	0	0.0000	CRASH	gen=298 glyphs=4
2026-03-14T07:36:44.646240	099964a4	0	0	0.0000	CRASH	gen=298 glyphs=4
2026-03-14T07:36:44.646438	099964a4	0	0	0.0000	CRASH	gen=298 glyphs=4
2026-03-14T07:36:44.646633	9c6bb097	0	0	0.0000	CRASH	gen=298 glyphs=4
2026-03-14T07:36:44.646827	099964a4	0	0	0.0000	CRASH	gen=298 glyphs=4
2026-03-14T07:36:44.647018	099964a4	0	0	0.0000	CRASH	gen=298 glyphs=4
2026-03-14T07:36:44.647211	099964a4	0	0	0.0000	CRASH	gen=298 glyphs=4
2026-03-14T07:36:44.647409	ff30496a	0	0	0.0000	CRASH	gen=298 glyphs=3
2026-03-14T07:36:44.647608	cf93b656	0	0	0.0000	CRASH	gen=298 glyphs=3
2026-03-14T07:36:44.647802	8da1f8d8	0	0	0.0000	CRASH	gen=298 glyphs=4
2026-03-14T07:36:44.648085	099964a4	0	0	0.0000	CRASH	gen=299 glyphs=4
2026-03-14T07:36:44.648282	099964a4	0	0	0.0000	CRASH	gen=299 glyphs=4
2026-03-14T07:36:44.648479	710c71eb	0	0	0.0000	CRASH	gen=299 glyphs=3
2026-03-14T07:36:44.648678	cf93b656	0	0	0.0000	CRASH	gen=299 glyphs=3
2026-03-14T07:36:44.648875	dcb1fb50	0	0	0.0000	CRASH	gen=299 glyphs=4
2026-03-14T07:36:44.649073	df525500	0	0	0.0000	CRASH	gen=299 glyphs=5
2026-03-14T07:36:44.649271	099964a4	0	0	0.0000	CRASH	gen=299 glyphs=4
2026-03-14T07:36:44.649471	beb3f7dd	0	0	0.0000	CRASH	gen=299 glyphs=3
2026-03-14T07:36:44.649669	099964a4	0	0	0.0000	CRASH	gen=299 glyphs=4
2026-03-14T07:36:44.649863	953b1f7a	0	0	0.0000	CRASH	gen=299 glyphs=4
2026-03-14T07:36:44.650151	099964a4	0	0	0.0000	CRASH	gen=300 glyphs=4
2026-03-14T07:36:44.650349	099964a4	0	0	0.0000	CRASH	gen=300 glyphs=4
2026-03-14T07:36:44.650549	099964a4	0	0	0.0000	CRASH	gen=300 glyphs=4
2026-03-14T07:36:44.650742	099964a4	0	0	0.0000	CRASH	gen=300 glyphs=4
2026-03-14T07:36:44.650935	ff30496a	0	0	0.0000	CRASH	gen=300 glyphs=3
2026-03-14T07:36:44.651128	099964a4	0	0	0.0000	CRASH	gen=300 glyphs=4
2026-03-14T07:36:44.651319	099964a4	0	0	0.0000	CRASH	gen=300 glyphs=4
2026-03-14T07:36:44.651511	099964a4	0	0	0.0000	CRASH	gen=300 glyphs=4
2026-03-14T07:36:44.651715	8da1f8d8	0	0	0.0000	CRASH	gen=300 glyphs=4
2026-03-14T07:36:44.651910	85371329	0	0	0.0000	CRASH	gen=300 glyphs=3
2026-03-14T07:36:44.652197	099964a4	0	0	0.0000	CRASH	gen=301 glyphs=4
2026-03-14T07:36:44.652393	099964a4	0	0	0.0000	CRASH	gen=301 glyphs=4
2026-03-14T07:36:44.652591	dcb1fb50	0	0	0.0000	CRASH	gen=301 glyphs=4
2026-03-14T07:36:44.652794	3a734398	0	0	0.0000	CRASH	gen=301 glyphs=4
2026-03-14T07:36:44.652988	bf3c4e27	0	0	0.0000	CRASH	gen=301 glyphs=4
2026-03-14T07:36:44.653180	099964a4	0	0	0.0000	CRASH	gen=301 glyphs=4
2026-03-14T07:36:44.653372	099964a4	0	0	0.0000	CRASH	gen=301 glyphs=4
2026-03-14T07:36:44.653568	099964a4	0	0	0.0000	CRASH	gen=301 glyphs=4
2026-03-14T07:36:44.653767	099964a4	0	0	0.0000	CRASH	gen=301 glyphs=4
2026-03-14T07:36:44.653963	5198219f	0	0	0.0000	CRASH	gen=301 glyphs=5
2026-03-14T07:36:44.654234	099964a4	0	0	0.0000	CRASH	gen=302 glyphs=4
2026-03-14T07:36:44.654429	099964a4	0	0	0.0000	CRASH	gen=302 glyphs=4
2026-03-14T07:36:44.654628	ff30496a	0	0	0.0000	CRASH	gen=302 glyphs=3
2026-03-14T07:36:44.654830	ec18c0ea	0	0	0.0000	CRASH	gen=302 glyphs=4
2026-03-14T07:36:44.655027	adefaca7	0	0	0.0000	CRASH	gen=302 glyphs=4
2026-03-14T07:36:44.655224	099964a4	0	0	0.0000	CRASH	gen=302 glyphs=4
2026-03-14T07:36:44.655418	45ab4e8b	0	0	0.0000	CRASH	gen=302 glyphs=4
2026-03-14T07:36:44.655618	dcb1fb50	0	0	0.0000	CRASH	gen=302 glyphs=4
2026-03-14T07:36:44.655815	099964a4	0	0	0.0000	CRASH	gen=302 glyphs=4
2026-03-14T07:36:44.656007	099964a4	0	0	0.0000	CRASH	gen=302 glyphs=4
2026-03-14T07:36:44.656277	099964a4	0	0	0.0000	CRASH	gen=303 glyphs=4
2026-03-14T07:36:44.656474	099964a4	0	0	0.0000	CRASH	gen=303 glyphs=4
2026-03-14T07:36:44.656673	7ede4765	0	0	0.0000	CRASH	gen=303 glyphs=2
2026-03-14T07:36:44.656865	09a86b1f	0	0	0.0000	CRASH	gen=303 glyphs=4
2026-03-14T07:36:44.657065	099964a4	0	0	0.0000	CRASH	gen=303 glyphs=4
2026-03-14T07:36:44.657258	099964a4	0	0	0.0000	CRASH	gen=303 glyphs=4
2026-03-14T07:36:44.657452	3ca14993	0	0	0.0000	CRASH	gen=303 glyphs=4
2026-03-14T07:36:44.657655	099964a4	0	0	0.0000	CRASH	gen=303 glyphs=4
2026-03-14T07:36:44.657859	394cf64e	0	0	0.0000	CRASH	gen=303 glyphs=3
2026-03-14T07:36:44.658062	deece313	0	0	0.0000	CRASH	gen=303 glyphs=3
2026-03-14T07:36:44.658341	099964a4	0	0	0.0000	CRASH	gen=304 glyphs=4
2026-03-14T07:36:44.658539	099964a4	0	0	0.0000	CRASH	gen=304 glyphs=4
2026-03-14T07:36:44.658731	099964a4	0	0	0.0000	CRASH	gen=304 glyphs=4
2026-03-14T07:36:44.658923	42cf19f4	0	0	0.0000	CRASH	gen=304 glyphs=3
2026-03-14T07:36:44.659122	099964a4	0	0	0.0000	CRASH	gen=304 glyphs=4
2026-03-14T07:36:44.659313	099964a4	0	0	0.0000	CRASH	gen=304 glyphs=4
2026-03-14T07:36:44.659506	c000fa2d	0	0	0.0000	CRASH	gen=304 glyphs=4
2026-03-14T07:36:44.659704	099964a4	0	0	0.0000	CRASH	gen=304 glyphs=4
2026-03-14T07:36:44.659897	5f56732e	0	0	0.0000	CRASH	gen=304 glyphs=3
2026-03-14T07:36:44.660095	63db8104	0	0	0.0000	CRASH	gen=304 glyphs=4
2026-03-14T07:36:44.660375	099964a4	0	0	0.0000	CRASH	gen=305 glyphs=4
2026-03-14T07:36:44.660572	099964a4	0	0	0.0000	CRASH	gen=305 glyphs=4
2026-03-14T07:36:44.660764	3a734398	0	0	0.0000	CRASH	gen=305 glyphs=4
2026-03-14T07:36:44.660955	3a734398	0	0	0.0000	CRASH	gen=305 glyphs=4
2026-03-14T07:36:44.661149	8da1f8d8	0	0	0.0000	CRASH	gen=305 glyphs=4
2026-03-14T07:36:44.661344	3ca14993	0	0	0.0000	CRASH	gen=305 glyphs=4
2026-03-14T07:36:44.661541	65f1348c	0	0	0.0000	CRASH	gen=305 glyphs=4
2026-03-14T07:36:44.661736	dcb1fb50	0	0	0.0000	CRASH	gen=305 glyphs=4
2026-03-14T07:36:44.661933	75cf224d	0	0	0.0000	CRASH	gen=305 glyphs=5
2026-03-14T07:36:44.662127	ff24b698	0	0	0.0000	CRASH	gen=305 glyphs=2
2026-03-14T07:36:44.662406	099964a4	0	0	0.0000	CRASH	gen=306 glyphs=4
2026-03-14T07:36:44.662604	099964a4	0	0	0.0000	CRASH	gen=306 glyphs=4
2026-03-14T07:36:44.662797	ad2dbbeb	0	0	0.0000	CRASH	gen=306 glyphs=2
2026-03-14T07:36:44.662989	cf93b656	0	0	0.0000	CRASH	gen=306 glyphs=3
2026-03-14T07:36:44.663180	11561b61	0	0	0.0000	CRASH	gen=306 glyphs=5
2026-03-14T07:36:44.663380	3a734398	0	0	0.0000	CRASH	gen=306 glyphs=4
2026-03-14T07:36:44.663573	061d058b	0	0	0.0000	CRASH	gen=306 glyphs=4
2026-03-14T07:36:44.663765	099964a4	0	0	0.0000	CRASH	gen=306 glyphs=4
2026-03-14T07:36:44.663963	099964a4	0	0	0.0000	CRASH	gen=306 glyphs=4
2026-03-14T07:36:44.664160	099964a4	0	0	0.0000	CRASH	gen=306 glyphs=4
2026-03-14T07:36:44.664443	099964a4	0	0	0.0000	CRASH	gen=307 glyphs=4
2026-03-14T07:36:44.664643	099964a4	0	0	0.0000	CRASH	gen=307 glyphs=4
2026-03-14T07:36:44.664839	d4bd8b65	0	0	0.0000	CRASH	gen=307 glyphs=4
2026-03-14T07:36:44.665034	3a734398	0	0	0.0000	CRASH	gen=307 glyphs=4
2026-03-14T07:36:44.665229	a5b87673	0	0	0.0000	CRASH	gen=307 glyphs=4
2026-03-14T07:36:44.665429	80cef82b	0	0	0.0000	CRASH	gen=307 glyphs=4
2026-03-14T07:36:44.665627	3a734398	0	0	0.0000	CRASH	gen=307 glyphs=4
2026-03-14T07:36:44.665821	ff30496a	0	0	0.0000	CRASH	gen=307 glyphs=3
2026-03-14T07:36:44.666021	099964a4	0	0	0.0000	CRASH	gen=307 glyphs=4
2026-03-14T07:36:44.666216	099964a4	0	0	0.0000	CRASH	gen=307 glyphs=4
2026-03-14T07:36:44.666502	099964a4	0	0	0.0000	CRASH	gen=308 glyphs=4
2026-03-14T07:36:44.666707	099964a4	0	0	0.0000	CRASH	gen=308 glyphs=4
2026-03-14T07:36:44.666910	815c9156	0	0	0.0000	CRASH	gen=308 glyphs=3
2026-03-14T07:36:44.667106	db319ca2	0	0	0.0000	CRASH	gen=308 glyphs=4
2026-03-14T07:36:44.667304	80cef82b	0	0	0.0000	CRASH	gen=308 glyphs=4
2026-03-14T07:36:44.667499	099964a4	0	0	0.0000	CRASH	gen=308 glyphs=4
2026-03-14T07:36:44.667703	cf93b656	0	0	0.0000	CRASH	gen=308 glyphs=3
2026-03-14T07:36:44.667897	099964a4	0	0	0.0000	CRASH	gen=308 glyphs=4
2026-03-14T07:36:44.668091	cf93b656	0	0	0.0000	CRASH	gen=308 glyphs=3
2026-03-14T07:36:44.668282	ff30496a	0	0	0.0000	CRASH	gen=308 glyphs=3
2026-03-14T07:36:44.668563	099964a4	0	0	0.0000	CRASH	gen=309 glyphs=4
2026-03-14T07:36:44.668764	099964a4	0	0	0.0000	CRASH	gen=309 glyphs=4
2026-03-14T07:36:44.668958	099964a4	0	0	0.0000	CRASH	gen=309 glyphs=4
2026-03-14T07:36:44.669152	099964a4	0	0	0.0000	CRASH	gen=309 glyphs=4
2026-03-14T07:36:44.669347	099964a4	0	0	0.0000	CRASH	gen=309 glyphs=4
2026-03-14T07:36:44.669543	099964a4	0	0	0.0000	CRASH	gen=309 glyphs=4
2026-03-14T07:36:44.669742	099964a4	0	0	0.0000	CRASH	gen=309 glyphs=4
2026-03-14T07:36:44.669934	099964a4	0	0	0.0000	CRASH	gen=309 glyphs=4
2026-03-14T07:36:44.670128	099964a4	0	0	0.0000	CRASH	gen=309 glyphs=4
2026-03-14T07:36:44.670323	099964a4	0	0	0.0000	CRASH	gen=309 glyphs=4
2026-03-14T07:36:44.670600	099964a4	0	0	0.0000	CRASH	gen=310 glyphs=4
2026-03-14T07:36:44.670801	099964a4	0	0	0.0000	CRASH	gen=310 glyphs=4
2026-03-14T07:36:44.670994	ff30496a	0	0	0.0000	CRASH	gen=310 glyphs=3
2026-03-14T07:36:44.671189	6d3cc152	0	0	0.0000	CRASH	gen=310 glyphs=2
2026-03-14T07:36:44.671382	dcb1fb50	0	0	0.0000	CRASH	gen=310 glyphs=4
2026-03-14T07:36:44.671582	dcb1fb50	0	0	0.0000	CRASH	gen=310 glyphs=4
2026-03-14T07:36:44.671780	8da1f8d8	0	0	0.0000	CRASH	gen=310 glyphs=4
2026-03-14T07:36:44.671976	ff30496a	0	0	0.0000	CRASH	gen=310 glyphs=3
2026-03-14T07:36:44.672169	099964a4	0	0	0.0000	CRASH	gen=310 glyphs=4
2026-03-14T07:36:44.672362	3ca14993	0	0	0.0000	CRASH	gen=310 glyphs=4
2026-03-14T07:36:44.672654	099964a4	0	0	0.0000	CRASH	gen=311 glyphs=4
2026-03-14T07:36:44.672863	099964a4	0	0	0.0000	CRASH	gen=311 glyphs=4
2026-03-14T07:36:44.673059	099964a4	0	0	0.0000	CRASH	gen=311 glyphs=4
2026-03-14T07:36:44.673251	099964a4	0	0	0.0000	CRASH	gen=311 glyphs=4
2026-03-14T07:36:44.673443	099964a4	0	0	0.0000	CRASH	gen=311 glyphs=4
2026-03-14T07:36:44.673639	3a734398	0	0	0.0000	CRASH	gen=311 glyphs=4
2026-03-14T07:36:44.673830	099964a4	0	0	0.0000	CRASH	gen=311 glyphs=4
2026-03-14T07:36:44.674023	099964a4	0	0	0.0000	CRASH	gen=311 glyphs=4
2026-03-14T07:36:44.674221	099964a4	0	0	0.0000	CRASH	gen=311 glyphs=4
2026-03-14T07:36:44.674415	dcb1fb50	0	0	0.0000	CRASH	gen=311 glyphs=4
2026-03-14T07:36:44.674689	099964a4	0	0	0.0000	CRASH	gen=312 glyphs=4
2026-03-14T07:36:44.674883	099964a4	0	0	0.0000	CRASH	gen=312 glyphs=4
2026-03-14T07:36:44.675083	dcb1fb50	0	0	0.0000	CRASH	gen=312 glyphs=4
2026-03-14T07:36:44.675280	099964a4	0	0	0.0000	CRASH	gen=312 glyphs=4
2026-03-14T07:36:44.675472	3ca14993	0	0	0.0000	CRASH	gen=312 glyphs=4
2026-03-14T07:36:44.675669	cf93b656	0	0	0.0000	CRASH	gen=312 glyphs=3
2026-03-14T07:36:44.675863	88779dbb	0	0	0.0000	CRASH	gen=312 glyphs=4
2026-03-14T07:36:44.676064	8da1f8d8	0	0	0.0000	CRASH	gen=312 glyphs=4
2026-03-14T07:36:44.676262	099964a4	0	0	0.0000	CRASH	gen=312 glyphs=4
2026-03-14T07:36:44.676455	57d1d412	0	0	0.0000	CRASH	gen=312 glyphs=4
2026-03-14T07:36:44.676729	099964a4	0	0	0.0000	CRASH	gen=313 glyphs=4
2026-03-14T07:36:44.676925	099964a4	0	0	0.0000	CRASH	gen=313 glyphs=4
2026-03-14T07:36:44.677124	3a734398	0	0	0.0000	CRASH	gen=313 glyphs=4
2026-03-14T07:36:44.677318	099964a4	0	0	0.0000	CRASH	gen=313 glyphs=4
2026-03-14T07:36:44.677509	099964a4	0	0	0.0000	CRASH	gen=313 glyphs=4
2026-03-14T07:36:44.677704	8da1f8d8	0	0	0.0000	CRASH	gen=313 glyphs=4
2026-03-14T07:36:44.677901	099964a4	0	0	0.0000	CRASH	gen=313 glyphs=4
2026-03-14T07:36:44.678095	099964a4	0	0	0.0000	CRASH	gen=313 glyphs=4
2026-03-14T07:36:44.678291	099964a4	0	0	0.0000	CRASH	gen=313 glyphs=4
2026-03-14T07:36:44.678485	099964a4	0	0	0.0000	CRASH	gen=313 glyphs=4
2026-03-14T07:36:44.678764	099964a4	0	0	0.0000	CRASH	gen=314 glyphs=4
2026-03-14T07:36:44.678961	099964a4	0	0	0.0000	CRASH	gen=314 glyphs=4
2026-03-14T07:36:44.679157	099964a4	0	0	0.0000	CRASH	gen=314 glyphs=4
2026-03-14T07:36:44.679352	ce2e46a6	0	0	0.0000	CRASH	gen=314 glyphs=2
2026-03-14T07:36:44.679548	e4dae3da	0	0	0.0000	CRASH	gen=314 glyphs=4
2026-03-14T07:36:44.679745	802df3de	0	0	0.0000	CRASH	gen=314 glyphs=4
2026-03-14T07:36:44.679941	3c261964	0	0	0.0000	CRASH	gen=314 glyphs=4
2026-03-14T07:36:44.680135	dcb1fb50	0	0	0.0000	CRASH	gen=314 glyphs=4
2026-03-14T07:36:44.680336	3a734398	0	0	0.0000	CRASH	gen=314 glyphs=4
2026-03-14T07:36:44.680530	42bfebf5	0	0	0.0000	CRASH	gen=314 glyphs=3
2026-03-14T07:36:44.680821	099964a4	0	0	0.0000	CRASH	gen=315 glyphs=4
2026-03-14T07:36:44.681015	099964a4	0	0	0.0000	CRASH	gen=315 glyphs=4
2026-03-14T07:36:44.681210	bba3c305	0	0	0.0000	CRASH	gen=315 glyphs=2
2026-03-14T07:36:44.681408	099964a4	0	0	0.0000	CRASH	gen=315 glyphs=4
2026-03-14T07:36:44.681603	07c0167d	0	0	0.0000	CRASH	gen=315 glyphs=3
2026-03-14T07:36:44.681797	8da1f8d8	0	0	0.0000	CRASH	gen=315 glyphs=4
2026-03-14T07:36:44.681992	dcb1fb50	0	0	0.0000	CRASH	gen=315 glyphs=4
2026-03-14T07:36:44.682187	7c964f66	0	0	0.0000	CRASH	gen=315 glyphs=4
2026-03-14T07:36:44.682388	1cae48a2	0	0	0.0000	CRASH	gen=315 glyphs=4
2026-03-14T07:36:44.682586	099964a4	0	0	0.0000	CRASH	gen=315 glyphs=4
2026-03-14T07:36:44.682858	099964a4	0	0	0.0000	CRASH	gen=316 glyphs=4
2026-03-14T07:36:44.683056	099964a4	0	0	0.0000	CRASH	gen=316 glyphs=4
2026-03-14T07:36:44.683251	099964a4	0	0	0.0000	CRASH	gen=316 glyphs=4
2026-03-14T07:36:44.683452	5949886c	0	0	0.0000	CRASH	gen=316 glyphs=4
2026-03-14T07:36:44.683652	3197ebab	0	0	0.0000	CRASH	gen=316 glyphs=3
2026-03-14T07:36:44.683849	099964a4	0	0	0.0000	CRASH	gen=316 glyphs=4
2026-03-14T07:36:44.684044	80cef82b	0	0	0.0000	CRASH	gen=316 glyphs=4
2026-03-14T07:36:44.684241	dcb1fb50	0	0	0.0000	CRASH	gen=316 glyphs=4
2026-03-14T07:36:44.684441	099964a4	0	0	0.0000	CRASH	gen=316 glyphs=4
2026-03-14T07:36:44.684637	099964a4	0	0	0.0000	CRASH	gen=316 glyphs=4
2026-03-14T07:36:44.684914	099964a4	0	0	0.0000	CRASH	gen=317 glyphs=4
2026-03-14T07:36:44.685109	099964a4	0	0	0.0000	CRASH	gen=317 glyphs=4
2026-03-14T07:36:44.685308	099964a4	0	0	0.0000	CRASH	gen=317 glyphs=4
2026-03-14T07:36:44.685505	5ec30dbe	0	0	0.0000	CRASH	gen=317 glyphs=4
2026-03-14T07:36:44.685725	099964a4	0	0	0.0000	CRASH	gen=317 glyphs=4
2026-03-14T07:36:44.685945	099964a4	0	0	0.0000	CRASH	gen=317 glyphs=4
2026-03-14T07:36:44.686150	099964a4	0	0	0.0000	CRASH	gen=317 glyphs=4
2026-03-14T07:36:44.686343	099964a4	0	0	0.0000	CRASH	gen=317 glyphs=4
2026-03-14T07:36:44.686548	099964a4	0	0	0.0000	CRASH	gen=317 glyphs=4
2026-03-14T07:36:44.686743	099964a4	0	0	0.0000	CRASH	gen=317 glyphs=4
2026-03-14T07:36:44.687009	099964a4	0	0	0.0000	CRASH	gen=318 glyphs=4
2026-03-14T07:36:44.687206	099964a4	0	0	0.0000	CRASH	gen=318 glyphs=4
2026-03-14T07:36:44.687404	64cbb33e	0	0	0.0000	CRASH	gen=318 glyphs=4
2026-03-14T07:36:44.687607	099964a4	0	0	0.0000	CRASH	gen=318 glyphs=4
2026-03-14T07:36:44.687803	099964a4	0	0	0.0000	CRASH	gen=318 glyphs=4
2026-03-14T07:36:44.687994	d407cadb	0	0	0.0000	CRASH	gen=318 glyphs=4
2026-03-14T07:36:44.688189	80cef82b	0	0	0.0000	CRASH	gen=318 glyphs=4
2026-03-14T07:36:44.688382	ff30496a	0	0	0.0000	CRASH	gen=318 glyphs=3
2026-03-14T07:36:44.688581	dcb1fb50	0	0	0.0000	CRASH	gen=318 glyphs=4
2026-03-14T07:36:44.688782	099964a4	0	0	0.0000	CRASH	gen=318 glyphs=4
2026-03-14T07:36:44.689060	099964a4	0	0	0.0000	CRASH	gen=319 glyphs=4
2026-03-14T07:36:44.689256	099964a4	0	0	0.0000	CRASH	gen=319 glyphs=4
2026-03-14T07:36:44.689453	0af08d8c	0	0	0.0000	CRASH	gen=319 glyphs=3
2026-03-14T07:36:44.689656	006bdbe1	0	0	0.0000	CRASH	gen=319 glyphs=3
2026-03-14T07:36:44.689870	099964a4	0	0	0.0000	CRASH	gen=319 glyphs=4
2026-03-14T07:36:44.690082	099964a4	0	0	0.0000	CRASH	gen=319 glyphs=4
2026-03-14T07:36:44.690274	099964a4	0	0	0.0000	CRASH	gen=319 glyphs=4
2026-03-14T07:36:44.690466	099964a4	0	0	0.0000	CRASH	gen=319 glyphs=4
2026-03-14T07:36:44.690663	099964a4	0	0	0.0000	CRASH	gen=319 glyphs=4
2026-03-14T07:36:44.690858	7ede4765	0	0	0.0000	CRASH	gen=319 glyphs=2
2026-03-14T07:36:44.691132	099964a4	0	0	0.0000	CRASH	gen=320 glyphs=4
2026-03-14T07:36:44.691328	099964a4	0	0	0.0000	CRASH	gen=320 glyphs=4
2026-03-14T07:36:44.691530	099964a4	0	0	0.0000	CRASH	gen=320 glyphs=4
2026-03-14T07:36:44.691733	099964a4	0	0	0.0000	CRASH	gen=320 glyphs=4
2026-03-14T07:36:44.691931	f4294016	0	0	0.0000	CRASH	gen=320 glyphs=3
2026-03-14T07:36:44.692125	3a734398	0	0	0.0000	CRASH	gen=320 glyphs=4
2026-03-14T07:36:44.692324	099964a4	0	0	0.0000	CRASH	gen=320 glyphs=4
2026-03-14T07:36:44.692522	8da1f8d8	0	0	0.0000	CRASH	gen=320 glyphs=4
2026-03-14T07:36:44.692722	6c2f20ee	0	0	0.0000	CRASH	gen=320 glyphs=4
2026-03-14T07:36:44.692924	65f23d11	0	0	0.0000	CRASH	gen=320 glyphs=2
2026-03-14T07:36:44.693193	099964a4	0	0	0.0000	CRASH	gen=321 glyphs=4
2026-03-14T07:36:44.693395	099964a4	0	0	0.0000	CRASH	gen=321 glyphs=4
2026-03-14T07:36:44.693595	099964a4	0	0	0.0000	CRASH	gen=321 glyphs=4
2026-03-14T07:36:44.693791	55a612bf	0	0	0.0000	CRASH	gen=321 glyphs=5
2026-03-14T07:36:44.693992	86537732	0	0	0.0000	CRASH	gen=321 glyphs=4
2026-03-14T07:36:44.694188	099964a4	0	0	0.0000	CRASH	gen=321 glyphs=4
2026-03-14T07:36:44.694381	099964a4	0	0	0.0000	CRASH	gen=321 glyphs=4
2026-03-14T07:36:44.694579	5505f9d5	0	0	0.0000	CRASH	gen=321 glyphs=2
2026-03-14T07:36:44.694772	3a734398	0	0	0.0000	CRASH	gen=321 glyphs=4
2026-03-14T07:36:44.694969	099964a4	0	0	0.0000	CRASH	gen=321 glyphs=4
2026-03-14T07:36:44.695236	099964a4	0	0	0.0000	CRASH	gen=322 glyphs=4
2026-03-14T07:36:44.695438	099964a4	0	0	0.0000	CRASH	gen=322 glyphs=4
2026-03-14T07:36:44.695640	dcb1fb50	0	0	0.0000	CRASH	gen=322 glyphs=4
2026-03-14T07:36:44.695840	099964a4	0	0	0.0000	CRASH	gen=322 glyphs=4
2026-03-14T07:36:44.696043	099964a4	0	0	0.0000	CRASH	gen=322 glyphs=4
2026-03-14T07:36:44.696239	7ede4765	0	0	0.0000	CRASH	gen=322 glyphs=2
2026-03-14T07:36:44.696433	099964a4	0	0	0.0000	CRASH	gen=322 glyphs=4
2026-03-14T07:36:44.696633	099964a4	0	0	0.0000	CRASH	gen=322 glyphs=4
2026-03-14T07:36:44.696832	099964a4	0	0	0.0000	CRASH	gen=322 glyphs=4
2026-03-14T07:36:44.697028	099964a4	0	0	0.0000	CRASH	gen=322 glyphs=4
2026-03-14T07:36:44.697304	099964a4	0	0	0.0000	CRASH	gen=323 glyphs=4
2026-03-14T07:36:44.697500	099964a4	0	0	0.0000	CRASH	gen=323 glyphs=4
2026-03-14T07:36:44.697696	099964a4	0	0	0.0000	CRASH	gen=323 glyphs=4
2026-03-14T07:36:44.697904	7061ea29	0	0	0.0000	CRASH	gen=323 glyphs=4
2026-03-14T07:36:44.698106	099964a4	0	0	0.0000	CRASH	gen=323 glyphs=4
2026-03-14T07:36:44.698303	099964a4	0	0	0.0000	CRASH	gen=323 glyphs=4
2026-03-14T07:36:44.698500	099964a4	0	0	0.0000	CRASH	gen=323 glyphs=4
2026-03-14T07:36:44.698697	099964a4	0	0	0.0000	CRASH	gen=323 glyphs=4
2026-03-14T07:36:44.698890	099964a4	0	0	0.0000	CRASH	gen=323 glyphs=4
2026-03-14T07:36:44.699082	099964a4	0	0	0.0000	CRASH	gen=323 glyphs=4
2026-03-14T07:36:44.699365	099964a4	0	0	0.0000	CRASH	gen=324 glyphs=4
2026-03-14T07:36:44.699565	099964a4	0	0	0.0000	CRASH	gen=324 glyphs=4
2026-03-14T07:36:44.699765	49188a97	0	0	0.0000	CRASH	gen=324 glyphs=4
2026-03-14T07:36:44.699967	099964a4	0	0	0.0000	CRASH	gen=324 glyphs=4
2026-03-14T07:36:44.700163	580a6d36	0	0	0.0000	CRASH	gen=324 glyphs=2
2026-03-14T07:36:44.700360	7ede4765	0	0	0.0000	CRASH	gen=324 glyphs=2
2026-03-14T07:36:44.700559	ff30496a	0	0	0.0000	CRASH	gen=324 glyphs=3
2026-03-14T07:36:44.700759	099964a4	0	0	0.0000	CRASH	gen=324 glyphs=4
2026-03-14T07:36:44.700959	099964a4	0	0	0.0000	CRASH	gen=324 glyphs=4
2026-03-14T07:36:44.701152	099964a4	0	0	0.0000	CRASH	gen=324 glyphs=4
2026-03-14T07:36:44.701444	099964a4	0	0	0.0000	CRASH	gen=325 glyphs=4
2026-03-14T07:36:44.701644	099964a4	0	0	0.0000	CRASH	gen=325 glyphs=4
2026-03-14T07:36:44.701840	7ede4765	0	0	0.0000	CRASH	gen=325 glyphs=2
2026-03-14T07:36:44.702036	099964a4	0	0	0.0000	CRASH	gen=325 glyphs=4
2026-03-14T07:36:44.702232	f38b6883	0	0	0.0000	CRASH	gen=325 glyphs=4
2026-03-14T07:36:44.702436	80cef82b	0	0	0.0000	CRASH	gen=325 glyphs=4
2026-03-14T07:36:44.702635	099964a4	0	0	0.0000	CRASH	gen=325 glyphs=4
2026-03-14T07:36:44.702830	3ca14993	0	0	0.0000	CRASH	gen=325 glyphs=4
2026-03-14T07:36:44.703027	099964a4	0	0	0.0000	CRASH	gen=325 glyphs=4
2026-03-14T07:36:44.703221	099964a4	0	0	0.0000	CRASH	gen=325 glyphs=4
