timestamp	program_hash	spirv_size	word_count	fitness	status	description
2026-03-14T01:28:45.793162	f4d5ea10	120	30	1.0000	DISCARD	gen=417 glyphs=4
2026-03-14T01:28:46.061690	e8c7f6cf	120	30	1.0000	DISCARD	gen=461 glyphs=4
2026-03-14T01:28:48.503325	3d3196c5	116	29	0.9500	DISCARD	gen=417 glyphs=4
2026-03-14T01:28:48.786029	0eaedb57	116	29	1.0000	DISCARD	gen=461 glyphs=4
2026-03-14T01:28:51.198972	7ca87b42	116	29	1.0000	DISCARD	gen=417 glyphs=4
2026-03-14T01:28:51.469917	1e5f0e21	116	29	1.0000	DISCARD	gen=461 glyphs=4
2026-03-14T01:28:53.855503	37f4017b	116	29	1.0000	DISCARD	gen=417 glyphs=4
2026-03-14T01:28:54.129603	0eaedb57	116	29	1.0000	DISCARD	gen=461 glyphs=4
2026-03-14T01:28:56.557677	55d6c151	120	30	1.0000	DISCARD	gen=417 glyphs=4
2026-03-14T01:28:56.827342	cfd3a5ce	120	30	1.0000	DISCARD	gen=461 glyphs=4
2026-03-14T01:28:59.234682	37f4017b	116	29	1.0000	DISCARD	gen=418 glyphs=4
2026-03-14T01:28:59.503498	d7c8681b	120	30	1.0000	DISCARD	gen=461 glyphs=4
2026-03-14T01:29:01.893996	bfdf7cad	120	30	1.0000	DISCARD	gen=418 glyphs=4
2026-03-14T01:29:02.160609	19355583	120	30	1.0000	DISCARD	gen=462 glyphs=4
2026-03-14T01:29:04.573608	7ca87b42	116	29	1.0000	DISCARD	gen=418 glyphs=4
2026-03-14T01:29:04.847186	8aef8872	116	29	1.0000	DISCARD	gen=462 glyphs=4
2026-03-14T01:29:07.264480	37f4017b	116	29	1.0000	DISCARD	gen=418 glyphs=4
2026-03-14T01:29:07.534998	49ff3457	116	29	0.9500	DISCARD	gen=462 glyphs=4
2026-03-14T01:29:09.947974	37f4017b	116	29	1.0000	DISCARD	gen=418 glyphs=4
2026-03-14T01:29:10.205842	8aef8872	116	29	1.0000	DISCARD	gen=462 glyphs=4
2026-03-14T01:29:12.648457	7ca87b42	116	29	1.0000	DISCARD	gen=418 glyphs=4
2026-03-14T01:29:12.913016	df99e6c3	116	29	1.0000	DISCARD	gen=462 glyphs=4
2026-03-14T01:29:15.410736	37f4017b	116	29	1.0000	DISCARD	gen=418 glyphs=4
2026-03-14T01:29:15.675680	050862ad	120	30	1.0000	DISCARD	gen=462 glyphs=4
2026-03-14T01:29:18.101790	55d6c151	120	30	1.0000	DISCARD	gen=418 glyphs=4
2026-03-14T01:29:18.368967	67cb81be	120	30	1.0000	DISCARD	gen=462 glyphs=4
2026-03-14T01:29:20.776490	55d6c151	120	30	1.0000	DISCARD	gen=418 glyphs=4
2026-03-14T01:29:21.048103	19355583	120	30	1.0000	DISCARD	gen=462 glyphs=4
2026-03-14T01:29:23.444424	37f4017b	116	29	1.0000	DISCARD	gen=418 glyphs=4
2026-03-14T01:29:23.704705	d7c8681b	120	30	1.0000	DISCARD	gen=462 glyphs=4
2026-03-14T01:29:26.121045	37f4017b	116	29	1.0000	DISCARD	gen=419 glyphs=4
2026-03-14T01:29:26.389500	4a2fb466	120	30	1.0000	DISCARD	gen=462 glyphs=4
2026-03-14T01:29:28.834025	bfdf7cad	120	30	1.0000	DISCARD	gen=419 glyphs=4
2026-03-14T01:29:29.095774	19355583	120	30	1.0000	DISCARD	gen=463 glyphs=4
2026-03-14T01:29:31.501280	60fb8e54	120	30	1.0000	DISCARD	gen=419 glyphs=4
2026-03-14T01:29:31.767435	8aef8872	116	29	1.0000	DISCARD	gen=463 glyphs=4
2026-03-14T01:29:34.155557	37f4017b	116	29	1.0000	DISCARD	gen=419 glyphs=4
2026-03-14T01:29:34.429071	015c1ac5	120	30	1.0000	DISCARD	gen=463 glyphs=4
2026-03-14T01:29:36.844099	f90ee923	120	30	0.9500	DISCARD	gen=419 glyphs=4
2026-03-14T01:29:37.107870	e8c7f6cf	120	30	1.0000	DISCARD	gen=463 glyphs=4
2026-03-14T01:29:39.501935	55d6c151	120	30	1.0000	DISCARD	gen=419 glyphs=4
2026-03-14T01:29:39.770724	a78f9454	120	30	1.0000	DISCARD	gen=463 glyphs=4
2026-03-14T01:29:42.178464	e7cfb680	120	30	1.0000	DISCARD	gen=419 glyphs=4
2026-03-14T01:29:42.454973	8aef8872	116	29	1.0000	DISCARD	gen=463 glyphs=4
2026-03-14T01:29:44.879037	fdb5d108	120	30	1.0000	DISCARD	gen=419 glyphs=4
2026-03-14T01:29:45.211117	8aef8872	116	29	1.0000	DISCARD	gen=463 glyphs=4
2026-03-14T01:29:47.685907	71e2ba66	116	29	1.0000	DISCARD	gen=419 glyphs=4
2026-03-14T01:29:47.945746	e8c7f6cf	120	30	1.0000	DISCARD	gen=463 glyphs=4
2026-03-14T01:29:50.354979	37f4017b	116	29	1.0000	DISCARD	gen=419 glyphs=4
2026-03-14T01:29:50.618139	0eaedb57	116	29	1.0000	DISCARD	gen=463 glyphs=4
2026-03-14T01:29:53.041709	37f4017b	116	29	1.0000	DISCARD	gen=420 glyphs=4
2026-03-14T01:29:53.308068	d7c8681b	120	30	1.0000	DISCARD	gen=463 glyphs=4
2026-03-14T01:29:55.712499	bfdf7cad	120	30	1.0000	DISCARD	gen=420 glyphs=4
2026-03-14T01:29:55.973664	19355583	120	30	1.0000	DISCARD	gen=464 glyphs=4
2026-03-14T01:29:58.368785	5a06ca32	120	30	1.0000	DISCARD	gen=420 glyphs=4
2026-03-14T01:29:58.636188	8aef8872	116	29	1.0000	DISCARD	gen=464 glyphs=4
2026-03-14T01:30:01.056095	5b9807ac	120	30	1.0000	DISCARD	gen=420 glyphs=4
2026-03-14T01:30:01.329654	0eaedb57	116	29	1.0000	DISCARD	gen=464 glyphs=4
2026-03-14T01:30:03.761644	55d6c151	120	30	1.0000	DISCARD	gen=420 glyphs=4
2026-03-14T01:30:04.027501	aca74a6e	120	30	1.0000	DISCARD	gen=464 glyphs=4
2026-03-14T01:30:06.438052	93c6965d	116	29	1.0000	DISCARD	gen=420 glyphs=4
2026-03-14T01:30:06.697930	875e0f8a	116	29	1.0000	DISCARD	gen=464 glyphs=4
2026-03-14T01:30:09.138486	37f4017b	116	29	1.0000	DISCARD	gen=420 glyphs=4
2026-03-14T01:30:09.405316	3dc29c3c	116	29	1.0000	DISCARD	gen=464 glyphs=4
2026-03-14T01:30:11.815450	bfdf7cad	120	30	1.0000	DISCARD	gen=420 glyphs=4
2026-03-14T01:30:12.080684	b57e7176	120	30	1.0000	DISCARD	gen=464 glyphs=4
2026-03-14T01:30:14.509560	55d6c151	120	30	1.0000	DISCARD	gen=420 glyphs=4
2026-03-14T01:30:14.765854	19355583	120	30	1.0000	DISCARD	gen=464 glyphs=4
2026-03-14T01:30:17.247050	fdb5d108	120	30	1.0000	DISCARD	gen=420 glyphs=4
2026-03-14T01:30:17.525404	b7aed8e9	116	29	1.0000	DISCARD	gen=464 glyphs=4
2026-03-14T01:30:19.974972	37f4017b	116	29	1.0000	DISCARD	gen=421 glyphs=4
2026-03-14T01:30:20.233259	e2cd28ea	120	30	1.0000	DISCARD	gen=464 glyphs=4
2026-03-14T01:30:22.679108	bfdf7cad	120	30	1.0000	DISCARD	gen=421 glyphs=4
2026-03-14T01:30:22.944063	19355583	120	30	1.0000	DISCARD	gen=465 glyphs=4
2026-03-14T01:30:25.376122	8f729c55	116	29	1.0000	DISCARD	gen=421 glyphs=4
2026-03-14T01:30:25.644021	8aef8872	116	29	1.0000	DISCARD	gen=465 glyphs=4
2026-03-14T01:30:28.035138	37f4017b	116	29	1.0000	DISCARD	gen=421 glyphs=4
2026-03-14T01:30:28.299958	f9b8c11a	120	30	0.9500	DISCARD	gen=465 glyphs=4
2026-03-14T01:30:30.698903	71e2ba66	116	29	1.0000	DISCARD	gen=421 glyphs=4
2026-03-14T01:30:30.974643	67cb81be	120	30	1.0000	DISCARD	gen=465 glyphs=4
2026-03-14T01:30:33.399634	37f4017b	116	29	1.0000	DISCARD	gen=421 glyphs=4
2026-03-14T01:30:33.675675	e2cd28ea	120	30	1.0000	DISCARD	gen=465 glyphs=4
2026-03-14T01:30:36.073494	64defc10	120	30	1.0000	DISCARD	gen=421 glyphs=4
2026-03-14T01:30:36.338953	67cb81be	120	30	1.0000	DISCARD	gen=465 glyphs=4
2026-03-14T01:30:38.766975	5a06ca32	120	30	1.0000	DISCARD	gen=421 glyphs=4
2026-03-14T01:30:39.035989	e8c7f6cf	120	30	1.0000	DISCARD	gen=465 glyphs=4
2026-03-14T01:30:41.453884	05defc45	116	29	1.0000	DISCARD	gen=421 glyphs=4
2026-03-14T01:30:41.718579	51b8e5c5	116	29	1.0000	DISCARD	gen=465 glyphs=4
2026-03-14T01:30:44.130001	5a06ca32	120	30	1.0000	DISCARD	gen=421 glyphs=4
2026-03-14T01:30:44.391774	b7aed8e9	116	29	1.0000	DISCARD	gen=465 glyphs=4
2026-03-14T01:30:46.834029	37f4017b	116	29	1.0000	DISCARD	gen=422 glyphs=4
2026-03-14T01:30:47.099994	19355583	120	30	1.0000	DISCARD	gen=465 glyphs=4
2026-03-14T01:30:49.572661	bfdf7cad	120	30	1.0000	DISCARD	gen=422 glyphs=4
2026-03-14T01:30:49.841110	19355583	120	30	1.0000	DISCARD	gen=466 glyphs=4
2026-03-14T01:30:52.248458	4c9b0dd4	120	30	1.0000	DISCARD	gen=422 glyphs=4
2026-03-14T01:30:52.511609	8aef8872	116	29	1.0000	DISCARD	gen=466 glyphs=4
2026-03-14T01:30:54.918371	5a06ca32	120	30	1.0000	DISCARD	gen=422 glyphs=4
2026-03-14T01:30:55.200708	e2cd28ea	120	30	1.0000	DISCARD	gen=466 glyphs=4
2026-03-14T01:30:57.646061	12b38c2d	116	29	1.0000	DISCARD	gen=422 glyphs=4
2026-03-14T01:30:57.911532	050862ad	120	30	1.0000	DISCARD	gen=466 glyphs=4
2026-03-14T01:31:00.334407	07cd997b	120	30	1.0000	DISCARD	gen=422 glyphs=4
2026-03-14T01:31:00.600514	a3ac6e5e	124	31	0.9500	DISCARD	gen=466 glyphs=4
2026-03-14T01:31:03.023873	37f4017b	116	29	1.0000	DISCARD	gen=422 glyphs=4
2026-03-14T01:31:03.306099	bfb573f3	116	29	1.0000	DISCARD	gen=466 glyphs=4
2026-03-14T01:31:05.743044	77899327	120	30	1.0000	DISCARD	gen=422 glyphs=4
2026-03-14T01:31:06.012403	a1737fbb	116	29	1.0000	DISCARD	gen=466 glyphs=4
2026-03-14T01:31:08.440333	37f4017b	116	29	1.0000	DISCARD	gen=422 glyphs=4
2026-03-14T01:31:08.715563	0eaedb57	116	29	1.0000	DISCARD	gen=466 glyphs=4
2026-03-14T01:31:11.174277	bfdf7cad	120	30	1.0000	DISCARD	gen=422 glyphs=4
2026-03-14T01:31:11.444016	749c7c5c	120	30	1.0000	DISCARD	gen=466 glyphs=4
2026-03-14T01:31:13.893738	37f4017b	116	29	1.0000	DISCARD	gen=423 glyphs=4
2026-03-14T01:31:14.159248	050862ad	120	30	1.0000	DISCARD	gen=466 glyphs=4
2026-03-14T01:31:16.545477	bfdf7cad	120	30	1.0000	DISCARD	gen=423 glyphs=4
2026-03-14T01:31:16.814870	19355583	120	30	1.0000	DISCARD	gen=467 glyphs=4
2026-03-14T01:31:19.239914	8a650f2b	116	29	1.0000	DISCARD	gen=423 glyphs=4
2026-03-14T01:31:19.503628	8aef8872	116	29	1.0000	DISCARD	gen=467 glyphs=4
2026-03-14T01:31:21.991003	7ca87b42	116	29	1.0000	DISCARD	gen=423 glyphs=4
2026-03-14T01:31:22.270062	d7c8681b	120	30	1.0000	DISCARD	gen=467 glyphs=4
2026-03-14T01:31:24.704580	fdb5d108	120	30	1.0000	DISCARD	gen=423 glyphs=4
2026-03-14T01:31:24.970191	15a89bc4	116	29	1.0000	DISCARD	gen=467 glyphs=4
2026-03-14T01:31:27.393769	4c9b0dd4	120	30	1.0000	DISCARD	gen=423 glyphs=4
2026-03-14T01:31:27.659813	67cb81be	120	30	1.0000	DISCARD	gen=467 glyphs=4
2026-03-14T01:31:30.086843	b660bddc	124	31	0.9500	DISCARD	gen=423 glyphs=4
2026-03-14T01:31:30.347932	0eaedb57	116	29	1.0000	DISCARD	gen=467 glyphs=4
2026-03-14T01:31:32.761544	55d6c151	120	30	1.0000	DISCARD	gen=423 glyphs=4
2026-03-14T01:31:33.033662	eca7ab6c	116	29	1.0000	DISCARD	gen=467 glyphs=4
2026-03-14T01:31:35.460257	37f4017b	116	29	1.0000	DISCARD	gen=423 glyphs=4
2026-03-14T01:31:35.735986	b7aed8e9	116	29	1.0000	DISCARD	gen=467 glyphs=4
2026-03-14T01:31:38.144272	5b9807ac	120	30	1.0000	DISCARD	gen=423 glyphs=4
2026-03-14T01:31:38.417414	0eaedb57	116	29	1.0000	DISCARD	gen=467 glyphs=4
2026-03-14T01:31:40.828407	37f4017b	116	29	1.0000	DISCARD	gen=424 glyphs=4
2026-03-14T01:31:41.108138	bcab8dcc	116	29	1.0000	DISCARD	gen=467 glyphs=4
2026-03-14T01:31:43.538557	bfdf7cad	120	30	1.0000	DISCARD	gen=424 glyphs=4
2026-03-14T01:31:43.817796	19355583	120	30	1.0000	DISCARD	gen=468 glyphs=4
2026-03-14T01:31:46.248601	37f4017b	116	29	1.0000	DISCARD	gen=424 glyphs=4
2026-03-14T01:31:46.517853	8aef8872	116	29	1.0000	DISCARD	gen=468 glyphs=4
2026-03-14T01:31:48.949016	37f4017b	116	29	1.0000	DISCARD	gen=424 glyphs=4
2026-03-14T01:31:49.215324	50dc991d	116	29	1.0000	DISCARD	gen=468 glyphs=4
2026-03-14T01:31:51.664416	96221ec1	116	29	1.0000	DISCARD	gen=424 glyphs=4
2026-03-14T01:31:51.939500	848a1261	116	29	1.0000	DISCARD	gen=468 glyphs=4
2026-03-14T01:31:54.425025	90bcff5e	116	29	1.0000	DISCARD	gen=424 glyphs=4
2026-03-14T01:31:54.690216	050862ad	120	30	1.0000	DISCARD	gen=468 glyphs=4
2026-03-14T01:31:57.120856	c710615e	120	30	1.0000	DISCARD	gen=424 glyphs=4
2026-03-14T01:31:57.386499	9e34ede0	116	29	1.0000	DISCARD	gen=468 glyphs=4
2026-03-14T01:31:59.798890	37f4017b	116	29	1.0000	DISCARD	gen=424 glyphs=4
2026-03-14T01:32:00.061680	875e0f8a	116	29	1.0000	DISCARD	gen=468 glyphs=4
2026-03-14T01:32:02.469609	a4d31d29	116	29	1.0000	DISCARD	gen=424 glyphs=4
2026-03-14T01:32:02.735578	96bb356b	120	30	0.9500	DISCARD	gen=468 glyphs=4
2026-03-14T01:32:05.150641	55d6c151	120	30	1.0000	DISCARD	gen=424 glyphs=4
2026-03-14T01:32:05.420983	b57e7176	120	30	1.0000	DISCARD	gen=468 glyphs=4
2026-03-14T01:32:07.818707	37f4017b	116	29	1.0000	DISCARD	gen=425 glyphs=4
2026-03-14T01:32:08.090084	21d37cca	116	29	1.0000	DISCARD	gen=468 glyphs=4
2026-03-14T01:32:10.481928	bfdf7cad	120	30	1.0000	DISCARD	gen=425 glyphs=4
2026-03-14T01:32:10.741011	19355583	120	30	1.0000	DISCARD	gen=469 glyphs=4
2026-03-14T01:32:13.174797	33fea986	116	29	1.0000	DISCARD	gen=425 glyphs=4
2026-03-14T01:32:13.452194	8aef8872	116	29	1.0000	DISCARD	gen=469 glyphs=4
2026-03-14T01:32:15.901955	8dd2c004	116	29	1.0000	DISCARD	gen=425 glyphs=4
2026-03-14T01:32:16.178649	50dc991d	116	29	1.0000	DISCARD	gen=469 glyphs=4
2026-03-14T01:32:18.570082	37f4017b	116	29	1.0000	DISCARD	gen=425 glyphs=4
2026-03-14T01:32:18.855933	67cb81be	120	30	1.0000	DISCARD	gen=469 glyphs=4
2026-03-14T01:32:21.260310	fdb5d108	120	30	1.0000	DISCARD	gen=425 glyphs=4
2026-03-14T01:32:21.530144	df05a014	116	29	1.0000	DISCARD	gen=469 glyphs=4
2026-03-14T01:32:23.959646	31a0ee40	116	29	1.0000	DISCARD	gen=425 glyphs=4
2026-03-14T01:32:24.272067	cad7e71b	116	29	1.0000	DISCARD	gen=469 glyphs=4
2026-03-14T01:32:26.747751	5a06ca32	120	30	1.0000	DISCARD	gen=425 glyphs=4
2026-03-14T01:32:27.015390	9e34ede0	116	29	1.0000	DISCARD	gen=469 glyphs=4
2026-03-14T01:32:29.419064	37f4017b	116	29	1.0000	DISCARD	gen=425 glyphs=4
2026-03-14T01:32:29.693679	d7c8681b	120	30	1.0000	DISCARD	gen=469 glyphs=4
2026-03-14T01:32:32.119078	37f4017b	116	29	1.0000	DISCARD	gen=425 glyphs=4
2026-03-14T01:32:32.379751	8a04008b	116	29	1.0000	DISCARD	gen=469 glyphs=4
2026-03-14T01:32:34.805219	37f4017b	116	29	1.0000	DISCARD	gen=426 glyphs=4
2026-03-14T01:32:35.081596	cc09e6eb	116	29	1.0000	DISCARD	gen=469 glyphs=4
2026-03-14T01:32:37.493557	bfdf7cad	120	30	1.0000	DISCARD	gen=426 glyphs=4
2026-03-14T01:32:37.756873	19355583	120	30	1.0000	DISCARD	gen=470 glyphs=4
2026-03-14T01:32:40.180057	235a07f6	116	29	1.0000	DISCARD	gen=426 glyphs=4
2026-03-14T01:32:40.446070	8aef8872	116	29	1.0000	DISCARD	gen=470 glyphs=4
2026-03-14T01:32:42.852381	5a06ca32	120	30	1.0000	DISCARD	gen=426 glyphs=4
2026-03-14T01:32:43.117219	e8c7f6cf	120	30	1.0000	DISCARD	gen=470 glyphs=4
2026-03-14T01:32:45.542380	bfdf7cad	120	30	1.0000	DISCARD	gen=426 glyphs=4
2026-03-14T01:32:45.804618	d7c8681b	120	30	1.0000	DISCARD	gen=470 glyphs=4
2026-03-14T01:32:48.228077	37f4017b	116	29	1.0000	DISCARD	gen=426 glyphs=4
2026-03-14T01:32:48.497069	50dc991d	116	29	1.0000	DISCARD	gen=470 glyphs=4
2026-03-14T01:32:50.880050	2701cb73	116	29	1.0000	DISCARD	gen=426 glyphs=4
2026-03-14T01:32:51.146658	e8c7f6cf	120	30	1.0000	DISCARD	gen=470 glyphs=4
2026-03-14T01:32:53.565636	37f4017b	116	29	1.0000	DISCARD	gen=426 glyphs=4
2026-03-14T01:32:53.832620	957b878e	120	30	1.0000	DISCARD	gen=470 glyphs=4
2026-03-14T01:32:56.324192	fdb5d108	120	30	1.0000	DISCARD	gen=426 glyphs=4
2026-03-14T01:32:56.616923	67cb81be	120	30	1.0000	DISCARD	gen=470 glyphs=4
2026-03-14T01:32:59.099261	79ecbf7f	116	29	1.0000	DISCARD	gen=426 glyphs=4
2026-03-14T01:32:59.360990	8aef8872	116	29	1.0000	DISCARD	gen=470 glyphs=4
2026-03-14T01:33:01.775649	37f4017b	116	29	1.0000	DISCARD	gen=427 glyphs=4
2026-03-14T01:33:02.041471	50dc991d	116	29	1.0000	DISCARD	gen=470 glyphs=4
2026-03-14T01:33:04.447453	bfdf7cad	120	30	1.0000	DISCARD	gen=427 glyphs=4
2026-03-14T01:33:04.726417	19355583	120	30	1.0000	DISCARD	gen=471 glyphs=4
2026-03-14T01:33:07.141934	d6758a09	116	29	1.0000	DISCARD	gen=427 glyphs=4
2026-03-14T01:33:07.423025	8aef8872	116	29	1.0000	DISCARD	gen=471 glyphs=4
2026-03-14T01:33:09.840304	5a06ca32	120	30	1.0000	DISCARD	gen=427 glyphs=4
2026-03-14T01:33:10.115655	3ea0a172	120	30	1.0000	DISCARD	gen=471 glyphs=4
2026-03-14T01:33:12.515605	4c9b0dd4	120	30	1.0000	DISCARD	gen=427 glyphs=4
2026-03-14T01:33:12.790680	67cb81be	120	30	1.0000	DISCARD	gen=471 glyphs=4
2026-03-14T01:33:15.235092	1d34459a	116	29	1.0000	DISCARD	gen=427 glyphs=4
2026-03-14T01:33:15.501883	50dc991d	116	29	1.0000	DISCARD	gen=471 glyphs=4
2026-03-14T01:33:17.938933	7ca87b42	116	29	1.0000	DISCARD	gen=427 glyphs=4
2026-03-14T01:33:18.205924	0e1629ff	116	29	1.0000	DISCARD	gen=471 glyphs=4
2026-03-14T01:33:20.625969	37f4017b	116	29	1.0000	DISCARD	gen=427 glyphs=4
2026-03-14T01:33:20.901349	337de711	116	29	1.0000	DISCARD	gen=471 glyphs=4
2026-03-14T01:33:23.300897	fdb5d108	120	30	1.0000	DISCARD	gen=427 glyphs=4
2026-03-14T01:33:23.574856	d7c8681b	120	30	1.0000	DISCARD	gen=471 glyphs=4
2026-03-14T01:33:25.999098	5a06ca32	120	30	1.0000	DISCARD	gen=427 glyphs=4
2026-03-14T01:33:26.261441	6d601dc4	116	29	1.0000	DISCARD	gen=471 glyphs=4
2026-03-14T01:33:28.686907	37f4017b	116	29	1.0000	DISCARD	gen=428 glyphs=4
2026-03-14T01:33:28.967152	8aef8872	116	29	1.0000	DISCARD	gen=471 glyphs=4
2026-03-14T01:33:31.419757	bfdf7cad	120	30	1.0000	DISCARD	gen=428 glyphs=4
2026-03-14T01:33:31.687594	19355583	120	30	1.0000	DISCARD	gen=472 glyphs=4
2026-03-14T01:33:34.103676	5b9807ac	120	30	1.0000	DISCARD	gen=428 glyphs=4
2026-03-14T01:33:34.371389	8aef8872	116	29	1.0000	DISCARD	gen=472 glyphs=4
2026-03-14T01:33:36.774158	fb9633a6	116	29	1.0000	DISCARD	gen=428 glyphs=4
2026-03-14T01:33:37.041324	742f61ce	116	29	1.0000	DISCARD	gen=472 glyphs=4
2026-03-14T01:33:39.470892	37f4017b	116	29	1.0000	DISCARD	gen=428 glyphs=4
2026-03-14T01:33:39.736454	0d8ed76a	116	29	0.9500	DISCARD	gen=472 glyphs=4
2026-03-14T01:33:42.143859	1b053be3	116	29	1.0000	DISCARD	gen=428 glyphs=4
2026-03-14T01:33:42.418720	e2cd28ea	120	30	1.0000	DISCARD	gen=472 glyphs=4
2026-03-14T01:33:44.834407	3755e0c4	116	29	1.0000	DISCARD	gen=428 glyphs=4
2026-03-14T01:33:45.101292	eca7ab6c	116	29	1.0000	DISCARD	gen=472 glyphs=4
2026-03-14T01:33:47.530379	f2247c3c	116	29	0.9500	DISCARD	gen=428 glyphs=4
2026-03-14T01:33:47.797952	e366b500	120	30	1.0000	DISCARD	gen=472 glyphs=4
2026-03-14T01:33:50.192634	4c9b0dd4	120	30	1.0000	DISCARD	gen=428 glyphs=4
2026-03-14T01:33:50.467687	b57e7176	120	30	1.0000	DISCARD	gen=472 glyphs=4
2026-03-14T01:33:52.878007	5b69b225	116	29	1.0000	DISCARD	gen=428 glyphs=4
2026-03-14T01:33:53.139439	e8c7f6cf	120	30	1.0000	DISCARD	gen=472 glyphs=4
2026-03-14T01:33:55.594414	37f4017b	116	29	1.0000	DISCARD	gen=429 glyphs=4
2026-03-14T01:33:55.862219	662c47ab	116	29	1.0000	DISCARD	gen=472 glyphs=4
2026-03-14T01:33:58.266489	bfdf7cad	120	30	1.0000	DISCARD	gen=429 glyphs=4
2026-03-14T01:33:58.532874	19355583	120	30	1.0000	DISCARD	gen=473 glyphs=4
2026-03-14T01:34:01.063753	71e2ba66	116	29	1.0000	DISCARD	gen=429 glyphs=4
2026-03-14T01:34:01.333296	8aef8872	116	29	1.0000	DISCARD	gen=473 glyphs=4
2026-03-14T01:34:03.741430	7ca87b42	116	29	1.0000	DISCARD	gen=429 glyphs=4
2026-03-14T01:34:04.011746	b57e7176	120	30	1.0000	DISCARD	gen=473 glyphs=4
2026-03-14T01:34:06.453559	45bb7c17	120	30	1.0000	DISCARD	gen=429 glyphs=4
2026-03-14T01:34:06.719750	93b66782	120	30	1.0000	DISCARD	gen=473 glyphs=4
2026-03-14T01:34:09.162303	37f4017b	116	29	1.0000	DISCARD	gen=429 glyphs=4
2026-03-14T01:34:09.421472	9e34ede0	116	29	1.0000	DISCARD	gen=473 glyphs=4
2026-03-14T01:34:11.849065	4c9b0dd4	120	30	1.0000	DISCARD	gen=429 glyphs=4
2026-03-14T01:34:12.116797	ed472d73	120	30	1.0000	DISCARD	gen=473 glyphs=4
2026-03-14T01:34:14.530852	37f4017b	116	29	1.0000	DISCARD	gen=429 glyphs=4
2026-03-14T01:34:14.796724	a638a851	116	29	1.0000	DISCARD	gen=473 glyphs=4
2026-03-14T01:34:17.203473	5a06ca32	120	30	1.0000	DISCARD	gen=429 glyphs=4
2026-03-14T01:34:17.471627	19355583	120	30	1.0000	DISCARD	gen=473 glyphs=4
2026-03-14T01:34:19.884557	5a06ca32	120	30	1.0000	DISCARD	gen=429 glyphs=4
2026-03-14T01:34:20.151707	622dcdaf	120	30	1.0000	DISCARD	gen=473 glyphs=4
2026-03-14T01:34:22.591460	37f4017b	116	29	1.0000	DISCARD	gen=430 glyphs=4
2026-03-14T01:34:22.852307	ae44ace5	116	29	1.0000	DISCARD	gen=473 glyphs=4
2026-03-14T01:34:25.277228	bfdf7cad	120	30	1.0000	DISCARD	gen=430 glyphs=4
2026-03-14T01:34:25.552686	19355583	120	30	1.0000	DISCARD	gen=474 glyphs=4
2026-03-14T01:34:27.956379	37f4017b	116	29	1.0000	DISCARD	gen=430 glyphs=4
2026-03-14T01:34:28.227606	8aef8872	116	29	1.0000	DISCARD	gen=474 glyphs=4
2026-03-14T01:34:30.639088	5a06ca32	120	30	1.0000	DISCARD	gen=430 glyphs=4
2026-03-14T01:34:30.903237	8fe3b53b	116	29	1.0000	DISCARD	gen=474 glyphs=4
2026-03-14T01:34:33.415175	7ca87b42	116	29	1.0000	DISCARD	gen=430 glyphs=4
2026-03-14T01:34:33.698109	ae44ace5	116	29	1.0000	DISCARD	gen=474 glyphs=4
2026-03-14T01:34:36.123807	5a06ca32	120	30	1.0000	DISCARD	gen=430 glyphs=4
2026-03-14T01:34:36.397083	a72c2b2f	120	30	1.0000	DISCARD	gen=474 glyphs=4
2026-03-14T01:34:38.816815	c9d851ed	116	29	1.0000	DISCARD	gen=430 glyphs=4
2026-03-14T01:34:39.083371	ae44ace5	116	29	1.0000	DISCARD	gen=474 glyphs=4
2026-03-14T01:34:41.477917	44fb6351	120	30	1.0000	DISCARD	gen=430 glyphs=4
2026-03-14T01:34:41.742783	36ed4dd9	116	29	1.0000	DISCARD	gen=474 glyphs=4
2026-03-14T01:34:44.169863	4c9b0dd4	120	30	1.0000	DISCARD	gen=430 glyphs=4
2026-03-14T01:34:44.434655	0eaedb57	116	29	1.0000	DISCARD	gen=474 glyphs=4
2026-03-14T01:34:46.828374	37f4017b	116	29	1.0000	DISCARD	gen=430 glyphs=4
2026-03-14T01:34:47.091564	d7c8681b	120	30	1.0000	DISCARD	gen=474 glyphs=4
2026-03-14T01:34:49.504937	37f4017b	116	29	1.0000	DISCARD	gen=431 glyphs=4
2026-03-14T01:34:49.768874	d7c8681b	120	30	1.0000	DISCARD	gen=474 glyphs=4
2026-03-14T01:34:52.195438	bfdf7cad	120	30	1.0000	DISCARD	gen=431 glyphs=4
2026-03-14T01:34:52.465141	19355583	120	30	1.0000	DISCARD	gen=475 glyphs=4
2026-03-14T01:34:54.867021	3617d19a	116	29	1.0000	DISCARD	gen=431 glyphs=4
2026-03-14T01:34:55.125821	8aef8872	116	29	1.0000	DISCARD	gen=475 glyphs=4
2026-03-14T01:34:57.538433	37f4017b	116	29	1.0000	DISCARD	gen=431 glyphs=4
2026-03-14T01:34:57.806220	04e95783	116	29	1.0000	DISCARD	gen=475 glyphs=4
2026-03-14T01:35:00.206973	5a06ca32	120	30	1.0000	DISCARD	gen=431 glyphs=4
2026-03-14T01:35:00.473819	8aef8872	116	29	1.0000	DISCARD	gen=475 glyphs=4
2026-03-14T01:35:02.910522	1d6b6815	116	29	1.0000	DISCARD	gen=431 glyphs=4
2026-03-14T01:35:03.191246	399729fc	116	29	1.0000	DISCARD	gen=475 glyphs=4
2026-03-14T01:35:05.649437	fdb5d108	120	30	1.0000	DISCARD	gen=431 glyphs=4
2026-03-14T01:35:05.914453	51e5e520	116	29	0.9500	DISCARD	gen=475 glyphs=4
2026-03-14T01:35:08.327441	5a06ca32	120	30	1.0000	DISCARD	gen=431 glyphs=4
2026-03-14T01:35:08.597644	0eaedb57	116	29	1.0000	DISCARD	gen=475 glyphs=4
2026-03-14T01:35:11.033275	55d6c151	120	30	1.0000	DISCARD	gen=431 glyphs=4
2026-03-14T01:35:11.309392	1e5f0e21	116	29	1.0000	DISCARD	gen=475 glyphs=4
2026-03-14T01:35:13.725006	eda0d720	116	29	0.9500	DISCARD	gen=431 glyphs=4
2026-03-14T01:35:13.994157	ae44ace5	116	29	1.0000	DISCARD	gen=475 glyphs=4
2026-03-14T01:35:16.441611	37f4017b	116	29	1.0000	DISCARD	gen=432 glyphs=4
2026-03-14T01:35:16.707334	1e5f0e21	116	29	1.0000	DISCARD	gen=475 glyphs=4
