timestamp	program_hash	spirv_size	word_count	fitness	status	description
2026-03-13T23:13:31.977719	050862ad	120	30	1.0000	DISCARD	gen=169 glyphs=4
2026-03-13T23:13:32.520327	d11c1062	120	30	1.0000	DISCARD	gen=125 glyphs=4
2026-03-13T23:13:34.658648	a78f9454	120	30	1.0000	DISCARD	gen=169 glyphs=4
2026-03-13T23:13:35.189165	098f533c	116	29	1.0000	DISCARD	gen=125 glyphs=4
2026-03-13T23:13:37.313547	0eaedb57	116	29	1.0000	DISCARD	gen=169 glyphs=4
2026-03-13T23:13:37.873702	55d6c151	120	30	1.0000	DISCARD	gen=125 glyphs=4
2026-03-13T23:13:40.009162	50dc991d	116	29	1.0000	DISCARD	gen=169 glyphs=4
2026-03-13T23:13:40.533539	55d6c151	120	30	1.0000	DISCARD	gen=125 glyphs=4
2026-03-13T23:13:42.683044	ae44ace5	116	29	1.0000	DISCARD	gen=169 glyphs=4
2026-03-13T23:13:43.229939	5a06ca32	120	30	1.0000	DISCARD	gen=125 glyphs=4
2026-03-13T23:13:45.370186	e8c7f6cf	120	30	1.0000	DISCARD	gen=169 glyphs=4
2026-03-13T23:13:45.928082	37f4017b	116	29	1.0000	DISCARD	gen=126 glyphs=4
2026-03-13T23:13:48.066522	19355583	120	30	1.0000	DISCARD	gen=170 glyphs=4
2026-03-13T23:13:48.595012	bfdf7cad	120	30	1.0000	DISCARD	gen=126 glyphs=4
2026-03-13T23:13:50.722501	8aef8872	116	29	1.0000	DISCARD	gen=170 glyphs=4
2026-03-13T23:13:51.272578	c0af7ca8	120	30	1.0000	DISCARD	gen=126 glyphs=4
2026-03-13T23:13:53.408783	84f44683	116	29	0.9500	DISCARD	gen=170 glyphs=4
2026-03-13T23:13:53.937620	37f4017b	116	29	1.0000	DISCARD	gen=126 glyphs=4
2026-03-13T23:13:56.098171	63e8cc51	116	29	0.9500	DISCARD	gen=170 glyphs=4
2026-03-13T23:13:56.633627	fdb5d108	120	30	1.0000	DISCARD	gen=126 glyphs=4
2026-03-13T23:13:58.778970	eca7ab6c	116	29	1.0000	DISCARD	gen=170 glyphs=4
2026-03-13T23:13:59.310549	d98a201a	120	30	1.0000	DISCARD	gen=126 glyphs=4
2026-03-13T23:14:01.483994	ae44ace5	116	29	1.0000	DISCARD	gen=170 glyphs=4
2026-03-13T23:14:02.015841	7ca87b42	116	29	1.0000	DISCARD	gen=126 glyphs=4
2026-03-13T23:14:04.245764	d7c8681b	120	30	1.0000	DISCARD	gen=170 glyphs=4
2026-03-13T23:14:04.788140	fdb5d108	120	30	1.0000	DISCARD	gen=126 glyphs=4
2026-03-13T23:14:06.943838	932907eb	120	30	1.0000	DISCARD	gen=170 glyphs=4
2026-03-13T23:14:07.474043	5a06ca32	120	30	1.0000	DISCARD	gen=126 glyphs=4
2026-03-13T23:14:09.600553	050862ad	120	30	1.0000	DISCARD	gen=170 glyphs=4
2026-03-13T23:14:10.129196	83879f5f	120	30	1.0000	DISCARD	gen=126 glyphs=4
2026-03-13T23:14:12.260721	0eaedb57	116	29	1.0000	DISCARD	gen=170 glyphs=4
2026-03-13T23:14:12.789479	37f4017b	116	29	1.0000	DISCARD	gen=127 glyphs=4
2026-03-13T23:14:14.937305	19355583	120	30	1.0000	DISCARD	gen=171 glyphs=4
2026-03-13T23:14:15.470515	bfdf7cad	120	30	1.0000	DISCARD	gen=127 glyphs=4
2026-03-13T23:14:17.616047	8aef8872	116	29	1.0000	DISCARD	gen=171 glyphs=4
2026-03-13T23:14:18.158835	fdb5d108	120	30	1.0000	DISCARD	gen=127 glyphs=4
2026-03-13T23:14:20.294757	1643553f	116	29	1.0000	DISCARD	gen=171 glyphs=4
2026-03-13T23:14:20.849015	5b9807ac	120	30	1.0000	DISCARD	gen=127 glyphs=4
2026-03-13T23:14:22.983282	e8c7f6cf	120	30	1.0000	DISCARD	gen=171 glyphs=4
2026-03-13T23:14:23.525799	5a06ca32	120	30	1.0000	DISCARD	gen=127 glyphs=4
2026-03-13T23:14:25.671179	ae44ace5	116	29	1.0000	DISCARD	gen=171 glyphs=4
2026-03-13T23:14:26.198154	5a06ca32	120	30	1.0000	DISCARD	gen=127 glyphs=4
2026-03-13T23:14:28.371547	0eaedb57	116	29	1.0000	DISCARD	gen=171 glyphs=4
2026-03-13T23:14:28.909383	5a06ca32	120	30	1.0000	DISCARD	gen=127 glyphs=4
2026-03-13T23:14:31.019424	0eaedb57	116	29	1.0000	DISCARD	gen=171 glyphs=4
2026-03-13T23:14:31.551904	bfdf7cad	120	30	1.0000	DISCARD	gen=127 glyphs=4
2026-03-13T23:14:33.712899	50dc991d	116	29	1.0000	DISCARD	gen=171 glyphs=4
2026-03-13T23:14:34.284757	7090d764	120	30	1.0000	DISCARD	gen=127 glyphs=4
2026-03-13T23:14:36.495132	cd3d9aa3	116	29	1.0000	DISCARD	gen=171 glyphs=4
2026-03-13T23:14:37.028200	12b38c2d	116	29	1.0000	DISCARD	gen=127 glyphs=4
2026-03-13T23:14:39.176673	050862ad	120	30	1.0000	DISCARD	gen=171 glyphs=4
2026-03-13T23:14:39.711909	37f4017b	116	29	1.0000	DISCARD	gen=128 glyphs=4
2026-03-13T23:14:41.845990	19355583	120	30	1.0000	DISCARD	gen=172 glyphs=4
2026-03-13T23:14:42.389303	bfdf7cad	120	30	1.0000	DISCARD	gen=128 glyphs=4
2026-03-13T23:14:44.529012	8aef8872	116	29	1.0000	DISCARD	gen=172 glyphs=4
2026-03-13T23:14:45.098018	5a06ca32	120	30	1.0000	DISCARD	gen=128 glyphs=4
2026-03-13T23:14:47.243086	19355583	120	30	1.0000	DISCARD	gen=172 glyphs=4
2026-03-13T23:14:47.763630	bfdf7cad	120	30	1.0000	DISCARD	gen=128 glyphs=4
2026-03-13T23:14:49.912417	ae44ace5	116	29	1.0000	DISCARD	gen=172 glyphs=4
2026-03-13T23:14:50.439021	8a248910	120	30	1.0000	DISCARD	gen=128 glyphs=4
2026-03-13T23:14:52.618857	e2cd28ea	120	30	1.0000	DISCARD	gen=172 glyphs=4
2026-03-13T23:14:53.145107	37f4017b	116	29	1.0000	DISCARD	gen=128 glyphs=4
2026-03-13T23:14:55.296600	7741d6d8	116	29	1.0000	DISCARD	gen=172 glyphs=4
2026-03-13T23:14:55.833163	bfdf7cad	120	30	1.0000	DISCARD	gen=128 glyphs=4
2026-03-13T23:14:57.990640	b7aed8e9	116	29	1.0000	DISCARD	gen=172 glyphs=4
2026-03-13T23:14:58.520580	4c9b0dd4	120	30	1.0000	DISCARD	gen=128 glyphs=4
2026-03-13T23:15:00.645830	8aef8872	116	29	1.0000	DISCARD	gen=172 glyphs=4
2026-03-13T23:15:01.192428	12b38c2d	116	29	1.0000	DISCARD	gen=128 glyphs=4
2026-03-13T23:15:03.364916	8aef8872	116	29	1.0000	DISCARD	gen=172 glyphs=4
2026-03-13T23:15:03.923546	71e2ba66	116	29	1.0000	DISCARD	gen=128 glyphs=4
2026-03-13T23:15:06.146424	1e5f0e21	116	29	1.0000	DISCARD	gen=172 glyphs=4
2026-03-13T23:15:06.718225	37f4017b	116	29	1.0000	DISCARD	gen=129 glyphs=4
2026-03-13T23:15:08.903235	19355583	120	30	1.0000	DISCARD	gen=173 glyphs=4
2026-03-13T23:15:09.433067	bfdf7cad	120	30	1.0000	DISCARD	gen=129 glyphs=4
2026-03-13T23:15:11.592006	8aef8872	116	29	1.0000	DISCARD	gen=173 glyphs=4
2026-03-13T23:15:12.126394	37f4017b	116	29	1.0000	DISCARD	gen=129 glyphs=4
2026-03-13T23:15:14.279708	e2cd28ea	120	30	1.0000	DISCARD	gen=173 glyphs=4
2026-03-13T23:15:14.827013	71e2ba66	116	29	1.0000	DISCARD	gen=129 glyphs=4
2026-03-13T23:15:16.980696	050862ad	120	30	1.0000	DISCARD	gen=173 glyphs=4
2026-03-13T23:15:17.537903	71e2ba66	116	29	1.0000	DISCARD	gen=129 glyphs=4
2026-03-13T23:15:19.695962	875e0f8a	116	29	1.0000	DISCARD	gen=173 glyphs=4
2026-03-13T23:15:20.242030	1ab41d3b	116	29	0.9500	DISCARD	gen=129 glyphs=4
2026-03-13T23:15:22.369471	afe33c19	116	29	1.0000	DISCARD	gen=173 glyphs=4
2026-03-13T23:15:22.915850	37f4017b	116	29	1.0000	DISCARD	gen=129 glyphs=4
2026-03-13T23:15:25.060594	1e5f0e21	116	29	1.0000	DISCARD	gen=173 glyphs=4
2026-03-13T23:15:25.603164	5a06ca32	120	30	1.0000	DISCARD	gen=129 glyphs=4
2026-03-13T23:15:27.747801	eca7ab6c	116	29	1.0000	DISCARD	gen=173 glyphs=4
2026-03-13T23:15:28.292185	f52e6006	116	29	1.0000	DISCARD	gen=129 glyphs=4
2026-03-13T23:15:30.450953	875e0f8a	116	29	1.0000	DISCARD	gen=173 glyphs=4
2026-03-13T23:15:30.970251	fdb5d108	120	30	1.0000	DISCARD	gen=129 glyphs=4
2026-03-13T23:15:33.119455	ae44ace5	116	29	1.0000	DISCARD	gen=173 glyphs=4
2026-03-13T23:15:33.645328	37f4017b	116	29	1.0000	DISCARD	gen=130 glyphs=4
2026-03-13T23:15:35.798547	19355583	120	30	1.0000	DISCARD	gen=174 glyphs=4
2026-03-13T23:15:36.324912	bfdf7cad	120	30	1.0000	DISCARD	gen=130 glyphs=4
2026-03-13T23:15:38.559338	8aef8872	116	29	1.0000	DISCARD	gen=174 glyphs=4
2026-03-13T23:15:39.099615	bfdf7cad	120	30	1.0000	DISCARD	gen=130 glyphs=4
2026-03-13T23:15:41.235365	67cb81be	120	30	1.0000	DISCARD	gen=174 glyphs=4
2026-03-13T23:15:41.770712	850d04a0	120	30	1.0000	DISCARD	gen=130 glyphs=4
2026-03-13T23:15:43.899895	b9bddc36	120	30	1.0000	DISCARD	gen=174 glyphs=4
2026-03-13T23:15:44.434506	71e2ba66	116	29	1.0000	DISCARD	gen=130 glyphs=4
2026-03-13T23:15:46.589998	0cd9ec23	116	29	1.0000	DISCARD	gen=174 glyphs=4
2026-03-13T23:15:47.131642	5a06ca32	120	30	1.0000	DISCARD	gen=130 glyphs=4
2026-03-13T23:15:49.287634	b7aed8e9	116	29	1.0000	DISCARD	gen=174 glyphs=4
2026-03-13T23:15:49.826226	bc29cd3e	116	29	1.0000	DISCARD	gen=130 glyphs=4
2026-03-13T23:15:52.010089	19355583	120	30	1.0000	DISCARD	gen=174 glyphs=4
2026-03-13T23:15:52.537664	55d6c151	120	30	1.0000	DISCARD	gen=130 glyphs=4
2026-03-13T23:15:54.703499	19355583	120	30	1.0000	DISCARD	gen=174 glyphs=4
2026-03-13T23:15:55.241966	5a06ca32	120	30	1.0000	DISCARD	gen=130 glyphs=4
2026-03-13T23:15:57.380894	19355583	120	30	1.0000	DISCARD	gen=174 glyphs=4
2026-03-13T23:15:57.934997	4c9b0dd4	120	30	1.0000	DISCARD	gen=130 glyphs=4
2026-03-13T23:16:00.108597	0eaedb57	116	29	1.0000	DISCARD	gen=174 glyphs=4
2026-03-13T23:16:00.667533	37f4017b	116	29	1.0000	DISCARD	gen=131 glyphs=4
2026-03-13T23:16:02.822007	19355583	120	30	1.0000	DISCARD	gen=175 glyphs=4
2026-03-13T23:16:03.362905	bfdf7cad	120	30	1.0000	DISCARD	gen=131 glyphs=4
2026-03-13T23:16:05.500553	8aef8872	116	29	1.0000	DISCARD	gen=175 glyphs=4
2026-03-13T23:16:06.041789	d11c1062	120	30	1.0000	DISCARD	gen=131 glyphs=4
2026-03-13T23:16:08.229541	b57e7176	120	30	1.0000	DISCARD	gen=175 glyphs=4
2026-03-13T23:16:08.777974	2701cb73	116	29	1.0000	DISCARD	gen=131 glyphs=4
2026-03-13T23:16:11.002882	0eaedb57	116	29	1.0000	DISCARD	gen=175 glyphs=4
2026-03-13T23:16:11.549138	37f4017b	116	29	1.0000	DISCARD	gen=131 glyphs=4
2026-03-13T23:16:13.693320	e8c7f6cf	120	30	1.0000	DISCARD	gen=175 glyphs=4
2026-03-13T23:16:14.230011	1d99b026	116	29	1.0000	DISCARD	gen=131 glyphs=4
2026-03-13T23:16:16.368929	eca7ab6c	116	29	1.0000	DISCARD	gen=175 glyphs=4
2026-03-13T23:16:16.918749	12b38c2d	116	29	1.0000	DISCARD	gen=131 glyphs=4
2026-03-13T23:16:19.039522	50dc991d	116	29	1.0000	DISCARD	gen=175 glyphs=4
2026-03-13T23:16:19.580207	aef7370e	116	29	1.0000	DISCARD	gen=131 glyphs=4
2026-03-13T23:16:21.731610	ae44ace5	116	29	1.0000	DISCARD	gen=175 glyphs=4
2026-03-13T23:16:22.271780	31d1bc18	116	29	1.0000	DISCARD	gen=131 glyphs=4
2026-03-13T23:16:24.434000	8cb289fa	116	29	1.0000	DISCARD	gen=175 glyphs=4
2026-03-13T23:16:24.970243	5b9807ac	120	30	1.0000	DISCARD	gen=131 glyphs=4
2026-03-13T23:16:27.112070	8aef8872	116	29	1.0000	DISCARD	gen=175 glyphs=4
2026-03-13T23:16:27.644343	37f4017b	116	29	1.0000	DISCARD	gen=132 glyphs=4
2026-03-13T23:16:29.764750	19355583	120	30	1.0000	DISCARD	gen=176 glyphs=4
2026-03-13T23:16:30.302543	bfdf7cad	120	30	1.0000	DISCARD	gen=132 glyphs=4
2026-03-13T23:16:32.442375	8aef8872	116	29	1.0000	DISCARD	gen=176 glyphs=4
2026-03-13T23:16:32.980978	4c2ba842	116	29	1.0000	DISCARD	gen=132 glyphs=4
2026-03-13T23:16:35.112344	9e34ede0	116	29	1.0000	DISCARD	gen=176 glyphs=4
2026-03-13T23:16:35.652382	6574736d	120	30	1.0000	DISCARD	gen=132 glyphs=4
2026-03-13T23:16:37.783667	bb551ad9	116	29	1.0000	DISCARD	gen=176 glyphs=4
2026-03-13T23:16:38.325732	2a85ed80	116	29	0.9500	DISCARD	gen=132 glyphs=4
2026-03-13T23:16:40.479364	dccb6005	120	30	1.0000	DISCARD	gen=176 glyphs=4
2026-03-13T23:16:41.015326	18bdca0d	116	29	1.0000	DISCARD	gen=132 glyphs=4
2026-03-13T23:16:43.233891	0b0a1196	116	29	1.0000	DISCARD	gen=176 glyphs=4
2026-03-13T23:16:43.767802	bfdf7cad	120	30	1.0000	DISCARD	gen=132 glyphs=4
2026-03-13T23:16:45.932016	10e77efd	116	29	1.0000	DISCARD	gen=176 glyphs=4
2026-03-13T23:16:46.491977	f61774a5	116	29	1.0000	DISCARD	gen=132 glyphs=4
2026-03-13T23:16:48.735290	8aef8872	116	29	1.0000	DISCARD	gen=176 glyphs=4
2026-03-13T23:16:49.290700	7ca87b42	116	29	1.0000	DISCARD	gen=132 glyphs=4
2026-03-13T23:16:51.487489	b31f7cdd	120	30	0.9500	DISCARD	gen=176 glyphs=4
2026-03-13T23:16:52.018405	37f4017b	116	29	1.0000	DISCARD	gen=132 glyphs=4
2026-03-13T23:16:54.164005	e2cd28ea	120	30	1.0000	DISCARD	gen=176 glyphs=4
2026-03-13T23:16:54.704498	37f4017b	116	29	1.0000	DISCARD	gen=133 glyphs=4
2026-03-13T23:16:56.833380	19355583	120	30	1.0000	DISCARD	gen=177 glyphs=4
2026-03-13T23:16:57.376166	bfdf7cad	120	30	1.0000	DISCARD	gen=133 glyphs=4
2026-03-13T23:16:59.522990	8aef8872	116	29	1.0000	DISCARD	gen=177 glyphs=4
2026-03-13T23:17:00.062822	c4d0e0c5	116	29	1.0000	DISCARD	gen=133 glyphs=4
2026-03-13T23:17:02.199526	19355583	120	30	1.0000	DISCARD	gen=177 glyphs=4
2026-03-13T23:17:02.749463	478901c8	120	30	1.0000	DISCARD	gen=133 glyphs=4
2026-03-13T23:17:04.905326	8aef8872	116	29	1.0000	DISCARD	gen=177 glyphs=4
2026-03-13T23:17:05.429975	97861e69	116	29	0.9500	DISCARD	gen=133 glyphs=4
2026-03-13T23:17:07.589821	50dc991d	116	29	1.0000	DISCARD	gen=177 glyphs=4
2026-03-13T23:17:08.143389	bfdf7cad	120	30	1.0000	DISCARD	gen=133 glyphs=4
2026-03-13T23:17:10.280047	b57e7176	120	30	1.0000	DISCARD	gen=177 glyphs=4
2026-03-13T23:17:10.805276	37f4017b	116	29	1.0000	DISCARD	gen=133 glyphs=4
2026-03-13T23:17:12.936008	a78f9454	120	30	1.0000	DISCARD	gen=177 glyphs=4
2026-03-13T23:17:13.546117	cb93c5bf	116	29	1.0000	DISCARD	gen=133 glyphs=4
2026-03-13T23:17:15.719188	050862ad	120	30	1.0000	DISCARD	gen=177 glyphs=4
2026-03-13T23:17:16.248785	d322bab6	116	29	1.0000	DISCARD	gen=133 glyphs=4
2026-03-13T23:17:18.393088	ae44ace5	116	29	1.0000	DISCARD	gen=177 glyphs=4
2026-03-13T23:17:18.926683	37f4017b	116	29	1.0000	DISCARD	gen=133 glyphs=4
2026-03-13T23:17:21.068019	875e0f8a	116	29	1.0000	DISCARD	gen=177 glyphs=4
2026-03-13T23:17:21.610200	37f4017b	116	29	1.0000	DISCARD	gen=134 glyphs=4
2026-03-13T23:17:24.355089	19355583	120	30	1.0000	DISCARD	gen=178 glyphs=4
2026-03-13T23:17:24.910423	bfdf7cad	120	30	1.0000	DISCARD	gen=134 glyphs=4
2026-03-13T23:17:27.033442	8aef8872	116	29	1.0000	DISCARD	gen=178 glyphs=4
2026-03-13T23:17:27.572085	5a06ca32	120	30	1.0000	DISCARD	gen=134 glyphs=4
2026-03-13T23:17:41.512472	e8c7f6cf	120	30	1.0000	DISCARD	gen=178 glyphs=4
2026-03-13T23:17:42.056368	5a06ca32	120	30	1.0000	DISCARD	gen=134 glyphs=4
2026-03-13T23:17:44.268026	ae723713	120	30	1.0000	DISCARD	gen=178 glyphs=4
2026-03-13T23:17:44.823727	5b9807ac	120	30	1.0000	DISCARD	gen=134 glyphs=4
2026-03-13T23:17:47.229151	fa1a9c56	120	30	1.0000	DISCARD	gen=178 glyphs=4
2026-03-13T23:17:47.865811	37f4017b	116	29	1.0000	DISCARD	gen=134 glyphs=4
2026-03-13T23:17:50.108914	cf511de1	116	29	1.0000	DISCARD	gen=178 glyphs=4
2026-03-13T23:17:50.650814	4a9387da	116	29	1.0000	DISCARD	gen=134 glyphs=4
2026-03-13T23:17:52.855798	50dc991d	116	29	1.0000	DISCARD	gen=178 glyphs=4
2026-03-13T23:17:53.417185	1d34459a	116	29	1.0000	DISCARD	gen=134 glyphs=4
2026-03-13T23:17:55.622060	c7f0b3b2	120	30	0.9500	DISCARD	gen=178 glyphs=4
2026-03-13T23:17:56.171844	37f4017b	116	29	1.0000	DISCARD	gen=134 glyphs=4
2026-03-13T23:17:58.355699	2db857b2	116	29	1.0000	DISCARD	gen=178 glyphs=4
2026-03-13T23:17:58.902271	5a06ca32	120	30	1.0000	DISCARD	gen=134 glyphs=4
2026-03-13T23:18:09.416032	37f4017b	116	29	1.0000	DISCARD	gen=135 glyphs=4
2026-03-13T23:18:09.434677	8aef8872	116	29	1.0000	DISCARD	gen=178 glyphs=4
2026-03-13T23:18:12.379366	19355583	120	30	1.0000	DISCARD	gen=179 glyphs=4
2026-03-13T23:18:12.449405	bfdf7cad	120	30	1.0000	DISCARD	gen=135 glyphs=4
2026-03-13T23:18:15.347761	8aef8872	116	29	1.0000	DISCARD	gen=179 glyphs=4
2026-03-13T23:18:15.351340	5a06ca32	120	30	1.0000	DISCARD	gen=135 glyphs=4
2026-03-13T23:18:18.201170	55d6c151	120	30	1.0000	DISCARD	gen=135 glyphs=4
2026-03-13T23:18:18.205436	8aef8872	116	29	1.0000	DISCARD	gen=179 glyphs=4
2026-03-13T23:18:21.051503	19355583	120	30	1.0000	DISCARD	gen=179 glyphs=4
2026-03-13T23:18:21.388993	37f4017b	116	29	1.0000	DISCARD	gen=135 glyphs=4
2026-03-13T23:18:23.967099	d7c8681b	120	30	1.0000	DISCARD	gen=179 glyphs=4
2026-03-13T23:18:24.237383	55d6c151	120	30	1.0000	DISCARD	gen=135 glyphs=4
2026-03-13T23:18:27.835058	19355583	120	30	1.0000	DISCARD	gen=179 glyphs=4
2026-03-13T23:18:28.121497	0c6a7c73	116	29	1.0000	DISCARD	gen=135 glyphs=4
2026-03-13T23:18:30.567296	e8c7f6cf	120	30	1.0000	DISCARD	gen=179 glyphs=4
2026-03-13T23:18:30.840994	89bae5e2	120	30	1.0000	DISCARD	gen=135 glyphs=4
2026-03-13T23:18:33.301542	19355583	120	30	1.0000	DISCARD	gen=179 glyphs=4
2026-03-13T23:18:33.698145	5a06ca32	120	30	1.0000	DISCARD	gen=135 glyphs=4
2026-03-13T23:18:36.187753	9e34ede0	116	29	1.0000	DISCARD	gen=179 glyphs=4
2026-03-13T23:18:36.455831	37f4017b	116	29	1.0000	DISCARD	gen=135 glyphs=4
2026-03-13T23:18:39.087816	e8c7f6cf	120	30	1.0000	DISCARD	gen=179 glyphs=4
2026-03-13T23:18:39.370401	37f4017b	116	29	1.0000	DISCARD	gen=136 glyphs=4
2026-03-13T23:18:41.813472	19355583	120	30	1.0000	DISCARD	gen=180 glyphs=4
2026-03-13T23:18:42.088374	bfdf7cad	120	30	1.0000	DISCARD	gen=136 glyphs=4
2026-03-13T23:18:44.687130	8aef8872	116	29	1.0000	DISCARD	gen=180 glyphs=4
2026-03-13T23:18:44.962246	37f4017b	116	29	1.0000	DISCARD	gen=136 glyphs=4
2026-03-13T23:18:47.428994	8aef8872	116	29	1.0000	DISCARD	gen=180 glyphs=4
2026-03-13T23:18:47.695014	76bccf20	116	29	1.0000	DISCARD	gen=136 glyphs=4
2026-03-13T23:18:50.394507	ec3315eb	116	29	1.0000	DISCARD	gen=180 glyphs=4
2026-03-13T23:18:50.696213	5a06ca32	120	30	1.0000	DISCARD	gen=136 glyphs=4
2026-03-13T23:18:53.142007	b57e7176	120	30	1.0000	DISCARD	gen=180 glyphs=4
2026-03-13T23:18:53.417467	5a06ca32	120	30	1.0000	DISCARD	gen=136 glyphs=4
2026-03-13T23:18:55.893233	0eaedb57	116	29	1.0000	DISCARD	gen=180 glyphs=4
2026-03-13T23:18:56.180718	5b9807ac	120	30	1.0000	DISCARD	gen=136 glyphs=4
2026-03-13T23:18:58.654330	5aaa87b9	116	29	1.0000	DISCARD	gen=180 glyphs=4
2026-03-13T23:18:58.931160	12b38c2d	116	29	1.0000	DISCARD	gen=136 glyphs=4
2026-03-13T23:19:01.391232	0eaedb57	116	29	1.0000	DISCARD	gen=180 glyphs=4
2026-03-13T23:19:01.655634	7ca87b42	116	29	1.0000	DISCARD	gen=136 glyphs=4
2026-03-13T23:19:04.124395	f26c9d85	120	30	1.0000	DISCARD	gen=180 glyphs=4
2026-03-13T23:19:04.392328	55d6c151	120	30	1.0000	DISCARD	gen=136 glyphs=4
2026-03-13T23:19:06.817876	50dc991d	116	29	1.0000	DISCARD	gen=180 glyphs=4
2026-03-13T23:19:07.103372	37f4017b	116	29	1.0000	DISCARD	gen=137 glyphs=4
2026-03-13T23:19:09.523026	19355583	120	30	1.0000	DISCARD	gen=181 glyphs=4
2026-03-13T23:19:09.788020	bfdf7cad	120	30	1.0000	DISCARD	gen=137 glyphs=4
2026-03-13T23:19:12.233360	8aef8872	116	29	1.0000	DISCARD	gen=181 glyphs=4
2026-03-13T23:19:12.501661	5b9807ac	120	30	1.0000	DISCARD	gen=137 glyphs=4
2026-03-13T23:19:14.975107	050862ad	120	30	1.0000	DISCARD	gen=181 glyphs=4
2026-03-13T23:19:15.256102	37f4017b	116	29	1.0000	DISCARD	gen=137 glyphs=4
2026-03-13T23:19:17.704636	050862ad	120	30	1.0000	DISCARD	gen=181 glyphs=4
2026-03-13T23:19:17.989932	55d6c151	120	30	1.0000	DISCARD	gen=137 glyphs=4
2026-03-13T23:19:42.360343	8aef8872	116	29	1.0000	DISCARD	gen=181 glyphs=4
2026-03-13T23:19:42.651778	9550bbde	116	29	1.0000	DISCARD	gen=137 glyphs=4
2026-03-13T23:19:45.415763	5a06ca32	120	30	1.0000	DISCARD	gen=137 glyphs=4
2026-03-13T23:19:45.446287	db4e8390	116	29	1.0000	DISCARD	gen=181 glyphs=4
2026-03-13T23:19:49.188343	e2cd28ea	120	30	1.0000	DISCARD	gen=181 glyphs=4
2026-03-13T23:19:49.188771	175ce258	116	29	1.0000	DISCARD	gen=137 glyphs=4
2026-03-13T23:19:52.338910	42ad59f2	116	29	1.0000	DISCARD	gen=137 glyphs=4
2026-03-13T23:19:52.686353	875e0f8a	116	29	1.0000	DISCARD	gen=181 glyphs=4
2026-03-13T23:19:55.330286	fdb5d108	120	30	1.0000	DISCARD	gen=137 glyphs=4
2026-03-13T23:19:55.620007	d7c8681b	120	30	1.0000	DISCARD	gen=181 glyphs=4
2026-03-13T23:19:58.072816	37f4017b	116	29	1.0000	DISCARD	gen=138 glyphs=4
2026-03-13T23:19:58.347770	7e1595e2	116	29	1.0000	DISCARD	gen=181 glyphs=4
2026-03-13T23:20:00.938560	bfdf7cad	120	30	1.0000	DISCARD	gen=138 glyphs=4
2026-03-13T23:20:01.213104	19355583	120	30	1.0000	DISCARD	gen=182 glyphs=4
2026-03-13T23:20:03.672366	47bcf998	116	29	1.0000	DISCARD	gen=138 glyphs=4
2026-03-13T23:20:03.940615	8aef8872	116	29	1.0000	DISCARD	gen=182 glyphs=4
2026-03-13T23:20:06.399729	fdb5d108	120	30	1.0000	DISCARD	gen=138 glyphs=4
2026-03-13T23:20:06.670252	0eaedb57	116	29	1.0000	DISCARD	gen=182 glyphs=4
2026-03-13T23:20:09.149674	37f4017b	116	29	1.0000	DISCARD	gen=138 glyphs=4
2026-03-13T23:20:09.427104	b57e7176	120	30	1.0000	DISCARD	gen=182 glyphs=4
2026-03-13T23:20:11.904300	1d34459a	116	29	1.0000	DISCARD	gen=138 glyphs=4
2026-03-13T23:20:12.171324	ae44ace5	116	29	1.0000	DISCARD	gen=182 glyphs=4
2026-03-13T23:20:14.643034	5b9807ac	120	30	1.0000	DISCARD	gen=138 glyphs=4
2026-03-13T23:20:14.918708	e85ec7c8	116	29	1.0000	DISCARD	gen=182 glyphs=4
2026-03-13T23:20:17.380255	e02ed8f6	120	30	1.0000	DISCARD	gen=138 glyphs=4
2026-03-13T23:20:17.653713	2af1ce92	116	29	1.0000	DISCARD	gen=182 glyphs=4
2026-03-13T23:20:20.122441	55d6c151	120	30	1.0000	DISCARD	gen=138 glyphs=4
2026-03-13T23:20:20.389114	0eaedb57	116	29	1.0000	DISCARD	gen=182 glyphs=4
2026-03-13T23:20:22.839167	d11c1062	120	30	1.0000	DISCARD	gen=138 glyphs=4
2026-03-13T23:20:23.111964	8aef8872	116	29	1.0000	DISCARD	gen=182 glyphs=4
2026-03-13T23:20:25.634871	37f4017b	116	29	1.0000	DISCARD	gen=139 glyphs=4
2026-03-13T23:20:25.915481	3f565b7b	120	30	1.0000	DISCARD	gen=182 glyphs=4
2026-03-13T23:20:28.394624	bfdf7cad	120	30	1.0000	DISCARD	gen=139 glyphs=4
2026-03-13T23:20:28.665934	19355583	120	30	1.0000	DISCARD	gen=183 glyphs=4
2026-03-13T23:20:31.129767	22b497f8	116	29	1.0000	DISCARD	gen=139 glyphs=4
2026-03-13T23:20:31.397253	8aef8872	116	29	1.0000	DISCARD	gen=183 glyphs=4
2026-03-13T23:20:33.845609	55d6c151	120	30	1.0000	DISCARD	gen=139 glyphs=4
2026-03-13T23:20:34.113538	8aef8872	116	29	1.0000	DISCARD	gen=183 glyphs=4
2026-03-13T23:20:36.542545	5a06ca32	120	30	1.0000	DISCARD	gen=139 glyphs=4
2026-03-13T23:20:36.817101	1e5f0e21	116	29	1.0000	DISCARD	gen=183 glyphs=4
2026-03-13T23:20:39.260210	bfdf7cad	120	30	1.0000	DISCARD	gen=139 glyphs=4
2026-03-13T23:20:39.541559	19355583	120	30	1.0000	DISCARD	gen=183 glyphs=4
2026-03-13T23:20:41.993826	55d6c151	120	30	1.0000	DISCARD	gen=139 glyphs=4
2026-03-13T23:20:42.267577	19355583	120	30	1.0000	DISCARD	gen=183 glyphs=4
2026-03-13T23:20:44.759395	5b9807ac	120	30	1.0000	DISCARD	gen=139 glyphs=4
2026-03-13T23:20:45.026762	d7c8681b	120	30	1.0000	DISCARD	gen=183 glyphs=4
2026-03-13T23:20:47.458214	ecad4fd5	120	30	1.0000	DISCARD	gen=139 glyphs=4
2026-03-13T23:20:47.737333	b64f6240	116	29	1.0000	DISCARD	gen=183 glyphs=4
2026-03-13T23:20:50.181704	12b38c2d	116	29	1.0000	DISCARD	gen=139 glyphs=4
2026-03-13T23:20:50.455993	a78f9454	120	30	1.0000	DISCARD	gen=183 glyphs=4
2026-03-13T23:20:57.188531	37f4017b	116	29	1.0000	DISCARD	gen=140 glyphs=4
2026-03-13T23:20:57.480922	0eaedb57	116	29	1.0000	DISCARD	gen=183 glyphs=4
