timestamp	program_hash	spirv_size	word_count	fitness	status	description
2026-03-13T22:25:46.307711	050862ad	120	30	1.0000	DISCARD	gen=66 glyphs=4
2026-03-13T22:25:46.878039	37f4017b	116	29	1.0000	DISCARD	gen=22 glyphs=4
2026-03-13T22:25:49.202137	b7aed8e9	116	29	1.0000	DISCARD	gen=66 glyphs=4
2026-03-13T22:25:49.956073	5a06ca32	120	30	1.0000	DISCARD	gen=22 glyphs=4
2026-03-13T22:25:52.245456	67cb81be	120	30	1.0000	DISCARD	gen=66 glyphs=4
2026-03-13T22:25:52.806045	bfdf7cad	120	30	1.0000	DISCARD	gen=22 glyphs=4
2026-03-13T22:25:55.074277	8aef8872	116	29	1.0000	DISCARD	gen=66 glyphs=4
2026-03-13T22:25:55.632452	55d6c151	120	30	1.0000	DISCARD	gen=22 glyphs=4
2026-03-13T22:25:57.872719	50dc991d	116	29	1.0000	DISCARD	gen=66 glyphs=4
2026-03-13T22:25:58.434474	37f4017b	116	29	1.0000	DISCARD	gen=23 glyphs=4
2026-03-13T22:26:00.841370	19355583	120	30	1.0000	DISCARD	gen=67 glyphs=4
2026-03-13T22:26:01.407368	bfdf7cad	120	30	1.0000	DISCARD	gen=23 glyphs=4
2026-03-13T22:26:03.669160	8aef8872	116	29	1.0000	DISCARD	gen=67 glyphs=4
2026-03-13T22:26:04.253154	4c9b0dd4	120	30	1.0000	DISCARD	gen=23 glyphs=4
2026-03-13T22:26:06.493317	050862ad	120	30	1.0000	DISCARD	gen=67 glyphs=4
2026-03-13T22:26:07.052836	12b38c2d	116	29	1.0000	DISCARD	gen=23 glyphs=4
2026-03-13T22:26:09.302096	0012a2b9	116	29	1.0000	DISCARD	gen=67 glyphs=4
2026-03-13T22:26:09.852104	e0f55c36	120	30	1.0000	DISCARD	gen=23 glyphs=4
2026-03-13T22:26:12.154014	1e5f0e21	116	29	1.0000	DISCARD	gen=67 glyphs=4
2026-03-13T22:26:12.728753	7ca87b42	116	29	1.0000	DISCARD	gen=23 glyphs=4
2026-03-13T22:26:15.071848	ad2a5e28	120	30	1.0000	DISCARD	gen=67 glyphs=4
2026-03-13T22:26:15.665543	55d6c151	120	30	1.0000	DISCARD	gen=23 glyphs=4
2026-03-13T22:26:17.993201	b57e7176	120	30	1.0000	DISCARD	gen=67 glyphs=4
2026-03-13T22:26:18.601088	5b9807ac	120	30	1.0000	DISCARD	gen=23 glyphs=4
2026-03-13T22:26:20.847696	f8014213	116	29	1.0000	DISCARD	gen=67 glyphs=4
2026-03-13T22:26:21.498310	56c77a30	120	30	1.0000	DISCARD	gen=23 glyphs=4
2026-03-13T22:26:23.874862	875e0f8a	116	29	1.0000	DISCARD	gen=67 glyphs=4
2026-03-13T22:26:24.453082	bd294a3d	120	30	1.0000	DISCARD	gen=23 glyphs=4
2026-03-13T22:26:26.727017	17ae67e6	116	29	1.0000	DISCARD	gen=67 glyphs=4
2026-03-13T22:26:27.302004	37f4017b	116	29	1.0000	DISCARD	gen=24 glyphs=4
2026-03-13T22:26:29.580047	19355583	120	30	1.0000	DISCARD	gen=68 glyphs=4
2026-03-13T22:26:30.160436	bfdf7cad	120	30	1.0000	DISCARD	gen=24 glyphs=4
2026-03-13T22:26:32.395106	8aef8872	116	29	1.0000	DISCARD	gen=68 glyphs=4
2026-03-13T22:26:32.963681	07ae1d60	116	29	1.0000	DISCARD	gen=24 glyphs=4
2026-03-13T22:26:35.283467	8aef8872	116	29	1.0000	DISCARD	gen=68 glyphs=4
2026-03-13T22:26:35.837210	37f4017b	116	29	1.0000	DISCARD	gen=24 glyphs=4
2026-03-13T22:26:38.075187	d7c8681b	120	30	1.0000	DISCARD	gen=68 glyphs=4
2026-03-13T22:26:38.632560	37f4017b	116	29	1.0000	DISCARD	gen=24 glyphs=4
2026-03-13T22:26:40.889246	050862ad	120	30	1.0000	DISCARD	gen=68 glyphs=4
2026-03-13T22:26:41.449458	5a06ca32	120	30	1.0000	DISCARD	gen=24 glyphs=4
2026-03-13T22:26:43.766665	d7c8681b	120	30	1.0000	DISCARD	gen=68 glyphs=4
2026-03-13T22:26:44.309412	d11c1062	120	30	1.0000	DISCARD	gen=24 glyphs=4
2026-03-13T22:26:46.522407	d7c8681b	120	30	1.0000	DISCARD	gen=68 glyphs=4
2026-03-13T22:26:47.097914	55d6c151	120	30	1.0000	DISCARD	gen=24 glyphs=4
2026-03-13T22:26:49.312373	ae44ace5	116	29	1.0000	DISCARD	gen=68 glyphs=4
2026-03-13T22:26:49.865545	7d52481f	120	30	1.0000	DISCARD	gen=24 glyphs=4
2026-03-13T22:26:52.134033	8aef8872	116	29	1.0000	DISCARD	gen=68 glyphs=4
2026-03-13T22:26:52.696487	55d6c151	120	30	1.0000	DISCARD	gen=24 glyphs=4
2026-03-13T22:26:55.041003	8aef8872	116	29	1.0000	DISCARD	gen=68 glyphs=4
2026-03-13T22:26:55.605414	37f4017b	116	29	1.0000	DISCARD	gen=25 glyphs=4
2026-03-13T22:26:57.991203	19355583	120	30	1.0000	DISCARD	gen=69 glyphs=4
2026-03-13T22:26:58.583459	bfdf7cad	120	30	1.0000	DISCARD	gen=25 glyphs=4
2026-03-13T22:27:01.006471	8aef8872	116	29	1.0000	DISCARD	gen=69 glyphs=4
2026-03-13T22:27:01.580659	b6e3cc16	116	29	1.0000	DISCARD	gen=25 glyphs=4
2026-03-13T22:27:03.885449	27d5fb79	116	29	1.0000	DISCARD	gen=69 glyphs=4
2026-03-13T22:27:04.440268	37f4017b	116	29	1.0000	DISCARD	gen=25 glyphs=4
2026-03-13T22:27:06.827487	bbeb7002	120	30	1.0000	DISCARD	gen=69 glyphs=4
2026-03-13T22:27:07.386296	55d6c151	120	30	1.0000	DISCARD	gen=25 glyphs=4
2026-03-13T22:27:09.701179	67cb81be	120	30	1.0000	DISCARD	gen=69 glyphs=4
2026-03-13T22:27:10.281672	5a06ca32	120	30	1.0000	DISCARD	gen=25 glyphs=4
2026-03-13T22:27:12.682412	8aef8872	116	29	1.0000	DISCARD	gen=69 glyphs=4
2026-03-13T22:27:13.290394	75a4c1f4	120	30	1.0000	DISCARD	gen=25 glyphs=4
2026-03-13T22:27:15.560056	0eaedb57	116	29	1.0000	DISCARD	gen=69 glyphs=4
2026-03-13T22:27:16.144477	55d6c151	120	30	1.0000	DISCARD	gen=25 glyphs=4
2026-03-13T22:27:18.394544	19355583	120	30	1.0000	DISCARD	gen=69 glyphs=4
2026-03-13T22:27:18.958843	37f4017b	116	29	1.0000	DISCARD	gen=25 glyphs=4
2026-03-13T22:27:21.201460	a78f9454	120	30	1.0000	DISCARD	gen=69 glyphs=4
2026-03-13T22:27:21.774419	5a06ca32	120	30	1.0000	DISCARD	gen=25 glyphs=4
2026-03-13T22:27:24.011618	e2cd28ea	120	30	1.0000	DISCARD	gen=69 glyphs=4
2026-03-13T22:27:24.559202	37f4017b	116	29	1.0000	DISCARD	gen=26 glyphs=4
2026-03-13T22:27:26.902745	19355583	120	30	1.0000	DISCARD	gen=70 glyphs=4
2026-03-13T22:27:27.457599	bfdf7cad	120	30	1.0000	DISCARD	gen=26 glyphs=4
2026-03-13T22:27:29.685456	8aef8872	116	29	1.0000	DISCARD	gen=70 glyphs=4
2026-03-13T22:27:30.239006	d11c1062	120	30	1.0000	DISCARD	gen=26 glyphs=4
2026-03-13T22:27:32.477755	9e34ede0	116	29	1.0000	DISCARD	gen=70 glyphs=4
2026-03-13T22:27:33.032997	5b9807ac	120	30	1.0000	DISCARD	gen=26 glyphs=4
2026-03-13T22:27:35.421992	0eaedb57	116	29	1.0000	DISCARD	gen=70 glyphs=4
2026-03-13T22:27:35.991015	12b38c2d	116	29	1.0000	DISCARD	gen=26 glyphs=4
2026-03-13T22:27:38.260055	0eaedb57	116	29	1.0000	DISCARD	gen=70 glyphs=4
2026-03-13T22:27:38.814743	37f4017b	116	29	1.0000	DISCARD	gen=26 glyphs=4
2026-03-13T22:27:41.043432	10c1ff71	120	30	1.0000	DISCARD	gen=70 glyphs=4
2026-03-13T22:27:41.612688	5a06ca32	120	30	1.0000	DISCARD	gen=26 glyphs=4
2026-03-13T22:27:43.870436	ff2e265d	116	29	1.0000	DISCARD	gen=70 glyphs=4
2026-03-13T22:27:44.443672	37f4017b	116	29	1.0000	DISCARD	gen=26 glyphs=4
2026-03-13T22:27:46.694444	d7c8681b	120	30	1.0000	DISCARD	gen=70 glyphs=4
2026-03-13T22:27:47.264950	37f4017b	116	29	1.0000	DISCARD	gen=26 glyphs=4
2026-03-13T22:27:49.623214	50dc991d	116	29	1.0000	DISCARD	gen=70 glyphs=4
2026-03-13T22:27:50.217082	c27de4b4	120	30	1.0000	DISCARD	gen=26 glyphs=4
2026-03-13T22:27:52.522737	d7c8681b	120	30	1.0000	DISCARD	gen=70 glyphs=4
2026-03-13T22:27:53.107813	37f4017b	116	29	1.0000	DISCARD	gen=27 glyphs=4
2026-03-13T22:27:55.410789	19355583	120	30	1.0000	DISCARD	gen=71 glyphs=4
2026-03-13T22:27:55.997264	bfdf7cad	120	30	1.0000	DISCARD	gen=27 glyphs=4
2026-03-13T22:27:58.569861	8aef8872	116	29	1.0000	DISCARD	gen=71 glyphs=4
2026-03-13T22:27:59.127037	fdb5d108	120	30	1.0000	DISCARD	gen=27 glyphs=4
2026-03-13T22:28:01.351957	ed8c5b3c	116	29	1.0000	DISCARD	gen=71 glyphs=4
2026-03-13T22:28:01.896006	a4661d81	116	29	1.0000	DISCARD	gen=27 glyphs=4
2026-03-13T22:28:04.157824	155e1818	116	29	1.0000	DISCARD	gen=71 glyphs=4
2026-03-13T22:28:04.744318	37f4017b	116	29	1.0000	DISCARD	gen=27 glyphs=4
2026-03-13T22:28:07.022399	e8c7f6cf	120	30	1.0000	DISCARD	gen=71 glyphs=4
2026-03-13T22:28:07.589595	55d6c151	120	30	1.0000	DISCARD	gen=27 glyphs=4
2026-03-13T22:28:09.943989	6f453a52	116	29	1.0000	DISCARD	gen=71 glyphs=4
2026-03-13T22:28:10.524675	5a06ca32	120	30	1.0000	DISCARD	gen=27 glyphs=4
2026-03-13T22:28:12.850134	0eaedb57	116	29	1.0000	DISCARD	gen=71 glyphs=4
2026-03-13T22:28:13.417985	5a06ca32	120	30	1.0000	DISCARD	gen=27 glyphs=4
2026-03-13T22:28:15.699411	875e0f8a	116	29	1.0000	DISCARD	gen=71 glyphs=4
2026-03-13T22:28:16.274678	5a06ca32	120	30	1.0000	DISCARD	gen=27 glyphs=4
2026-03-13T22:28:18.520110	b7aed8e9	116	29	1.0000	DISCARD	gen=71 glyphs=4
2026-03-13T22:28:19.099559	d11c1062	120	30	1.0000	DISCARD	gen=27 glyphs=4
2026-03-13T22:28:21.358641	8aef8872	116	29	1.0000	DISCARD	gen=71 glyphs=4
2026-03-13T22:28:21.932438	37f4017b	116	29	1.0000	DISCARD	gen=28 glyphs=4
2026-03-13T22:28:24.188695	19355583	120	30	1.0000	DISCARD	gen=72 glyphs=4
2026-03-13T22:28:24.757194	bfdf7cad	120	30	1.0000	DISCARD	gen=28 glyphs=4
2026-03-13T22:28:27.030473	8aef8872	116	29	1.0000	DISCARD	gen=72 glyphs=4
2026-03-13T22:28:27.589636	2701cb73	116	29	1.0000	DISCARD	gen=28 glyphs=4
2026-03-13T22:28:29.930959	3528c3a1	120	30	1.0000	DISCARD	gen=72 glyphs=4
2026-03-13T22:28:30.494248	1d34459a	116	29	1.0000	DISCARD	gen=28 glyphs=4
2026-03-13T22:28:32.809774	40fea504	120	30	1.0000	DISCARD	gen=72 glyphs=4
2026-03-13T22:28:33.367034	55d6c151	120	30	1.0000	DISCARD	gen=28 glyphs=4
2026-03-13T22:28:35.654749	19355583	120	30	1.0000	DISCARD	gen=72 glyphs=4
2026-03-13T22:28:36.234396	37f4017b	116	29	1.0000	DISCARD	gen=28 glyphs=4
2026-03-13T22:28:38.517636	0eaedb57	116	29	1.0000	DISCARD	gen=72 glyphs=4
2026-03-13T22:28:39.073610	37f4017b	116	29	1.0000	DISCARD	gen=28 glyphs=4
2026-03-13T22:28:41.367765	eca7ab6c	116	29	1.0000	DISCARD	gen=72 glyphs=4
2026-03-13T22:28:41.937958	355c9432	124	31	0.9500	DISCARD	gen=28 glyphs=4
2026-03-13T22:28:44.206943	d7c8681b	120	30	1.0000	DISCARD	gen=72 glyphs=4
2026-03-13T22:28:44.798079	cc1fcf59	116	29	1.0000	DISCARD	gen=28 glyphs=4
2026-03-13T22:28:47.065398	0eaedb57	116	29	1.0000	DISCARD	gen=72 glyphs=4
2026-03-13T22:28:47.632630	3879cb1d	120	30	0.9500	DISCARD	gen=28 glyphs=4
2026-03-13T22:28:49.953072	342569d7	116	29	1.0000	DISCARD	gen=72 glyphs=4
2026-03-13T22:28:50.542446	37f4017b	116	29	1.0000	DISCARD	gen=29 glyphs=4
2026-03-13T22:28:52.800873	19355583	120	30	1.0000	DISCARD	gen=73 glyphs=4
2026-03-13T22:28:53.376545	bfdf7cad	120	30	1.0000	DISCARD	gen=29 glyphs=4
2026-03-13T22:28:55.677342	8aef8872	116	29	1.0000	DISCARD	gen=73 glyphs=4
2026-03-13T22:28:56.256778	bb71d256	116	29	1.0000	DISCARD	gen=29 glyphs=4
2026-03-13T22:28:58.499646	19355583	120	30	1.0000	DISCARD	gen=73 glyphs=4
2026-03-13T22:28:59.078676	fdb5d108	120	30	1.0000	DISCARD	gen=29 glyphs=4
2026-03-13T22:29:01.411788	1cb051c5	116	29	1.0000	DISCARD	gen=73 glyphs=4
2026-03-13T22:29:02.009957	37f4017b	116	29	1.0000	DISCARD	gen=29 glyphs=4
2026-03-13T22:29:04.310026	0eaedb57	116	29	1.0000	DISCARD	gen=73 glyphs=4
2026-03-13T22:29:04.884144	ab5ef37e	116	29	1.0000	DISCARD	gen=29 glyphs=4
2026-03-13T22:29:07.187731	0eaedb57	116	29	1.0000	DISCARD	gen=73 glyphs=4
2026-03-13T22:29:07.765007	fdb5d108	120	30	1.0000	DISCARD	gen=29 glyphs=4
2026-03-13T22:29:10.059806	0eaedb57	116	29	1.0000	DISCARD	gen=73 glyphs=4
2026-03-13T22:29:10.627474	12b38c2d	116	29	1.0000	DISCARD	gen=29 glyphs=4
2026-03-13T22:29:12.916067	19355583	120	30	1.0000	DISCARD	gen=73 glyphs=4
2026-03-13T22:29:13.520968	7108bfe8	120	30	1.0000	DISCARD	gen=29 glyphs=4
2026-03-13T22:29:15.850899	d7c8681b	120	30	1.0000	DISCARD	gen=73 glyphs=4
2026-03-13T22:29:16.427625	55d6c151	120	30	1.0000	DISCARD	gen=29 glyphs=4
2026-03-13T22:29:18.764478	ec82f4dd	116	29	0.9500	DISCARD	gen=73 glyphs=4
2026-03-13T22:29:19.349780	37f4017b	116	29	1.0000	DISCARD	gen=30 glyphs=4
2026-03-13T22:29:21.655248	19355583	120	30	1.0000	DISCARD	gen=74 glyphs=4
2026-03-13T22:29:22.216681	bfdf7cad	120	30	1.0000	DISCARD	gen=30 glyphs=4
2026-03-13T22:29:24.493982	8aef8872	116	29	1.0000	DISCARD	gen=74 glyphs=4
2026-03-13T22:29:25.061133	5a06ca32	120	30	1.0000	DISCARD	gen=30 glyphs=4
2026-03-13T22:29:27.272351	3e48d748	116	29	1.0000	DISCARD	gen=74 glyphs=4
2026-03-13T22:29:27.847929	37f4017b	116	29	1.0000	DISCARD	gen=30 glyphs=4
2026-03-13T22:29:30.084168	8aef8872	116	29	1.0000	DISCARD	gen=74 glyphs=4
2026-03-13T22:29:30.650809	5017ecfb	116	29	1.0000	DISCARD	gen=30 glyphs=4
2026-03-13T22:29:32.936215	a78f9454	120	30	1.0000	DISCARD	gen=74 glyphs=4
2026-03-13T22:29:33.530082	49d7ce37	116	29	1.0000	DISCARD	gen=30 glyphs=4
2026-03-13T22:29:35.787143	c3fa0eee	120	30	1.0000	DISCARD	gen=74 glyphs=4
2026-03-13T22:29:36.353773	12b38c2d	116	29	1.0000	DISCARD	gen=30 glyphs=4
2026-03-13T22:29:38.614079	0eaedb57	116	29	1.0000	DISCARD	gen=74 glyphs=4
2026-03-13T22:29:39.185497	fdb5d108	120	30	1.0000	DISCARD	gen=30 glyphs=4
2026-03-13T22:29:41.469012	9e34ede0	116	29	1.0000	DISCARD	gen=74 glyphs=4
2026-03-13T22:29:42.025242	71e2ba66	116	29	1.0000	DISCARD	gen=30 glyphs=4
2026-03-13T22:29:44.279862	8aef8872	116	29	1.0000	DISCARD	gen=74 glyphs=4
2026-03-13T22:29:44.836179	37f4017b	116	29	1.0000	DISCARD	gen=30 glyphs=4
2026-03-13T22:29:47.114239	8aef8872	116	29	1.0000	DISCARD	gen=74 glyphs=4
2026-03-13T22:29:47.673958	37f4017b	116	29	1.0000	DISCARD	gen=31 glyphs=4
2026-03-13T22:29:49.916268	19355583	120	30	1.0000	DISCARD	gen=75 glyphs=4
2026-03-13T22:29:50.488954	bfdf7cad	120	30	1.0000	DISCARD	gen=31 glyphs=4
2026-03-13T22:29:52.775171	8aef8872	116	29	1.0000	DISCARD	gen=75 glyphs=4
2026-03-13T22:29:53.339121	fdb5d108	120	30	1.0000	DISCARD	gen=31 glyphs=4
2026-03-13T22:29:55.605285	5a360a29	116	29	1.0000	DISCARD	gen=75 glyphs=4
2026-03-13T22:29:56.176608	858262bd	120	30	1.0000	DISCARD	gen=31 glyphs=4
2026-03-13T22:29:58.445158	0b1c0ca6	120	30	1.0000	DISCARD	gen=75 glyphs=4
2026-03-13T22:29:58.995740	266f03b6	116	29	0.9500	DISCARD	gen=31 glyphs=4
2026-03-13T22:30:01.259171	1e5f0e21	116	29	1.0000	DISCARD	gen=75 glyphs=4
2026-03-13T22:30:01.817839	7ca87b42	116	29	1.0000	DISCARD	gen=31 glyphs=4
2026-03-13T22:30:04.080739	0eaedb57	116	29	1.0000	DISCARD	gen=75 glyphs=4
2026-03-13T22:30:04.667629	55d6c151	120	30	1.0000	DISCARD	gen=31 glyphs=4
2026-03-13T22:30:06.942799	050862ad	120	30	1.0000	DISCARD	gen=75 glyphs=4
2026-03-13T22:30:07.539407	ce2db771	120	30	1.0000	DISCARD	gen=31 glyphs=4
2026-03-13T22:30:09.783509	050862ad	120	30	1.0000	DISCARD	gen=75 glyphs=4
2026-03-13T22:30:10.359277	d11c1062	120	30	1.0000	DISCARD	gen=31 glyphs=4
2026-03-13T22:30:12.605606	dc489d4b	120	30	1.0000	DISCARD	gen=75 glyphs=4
2026-03-13T22:30:13.160092	3761a9f4	116	29	1.0000	DISCARD	gen=31 glyphs=4
2026-03-13T22:30:15.393492	0eaedb57	116	29	1.0000	DISCARD	gen=75 glyphs=4
2026-03-13T22:30:15.964659	37f4017b	116	29	1.0000	DISCARD	gen=32 glyphs=4
2026-03-13T22:30:18.214397	19355583	120	30	1.0000	DISCARD	gen=76 glyphs=4
2026-03-13T22:30:18.778554	bfdf7cad	120	30	1.0000	DISCARD	gen=32 glyphs=4
2026-03-13T22:30:21.019036	8aef8872	116	29	1.0000	DISCARD	gen=76 glyphs=4
2026-03-13T22:30:21.587840	b76b0d7b	120	30	1.0000	DISCARD	gen=32 glyphs=4
2026-03-13T22:30:23.852178	8aef8872	116	29	1.0000	DISCARD	gen=76 glyphs=4
2026-03-13T22:30:24.417468	37f4017b	116	29	1.0000	DISCARD	gen=32 glyphs=4
2026-03-13T22:30:26.653003	19355583	120	30	1.0000	DISCARD	gen=76 glyphs=4
2026-03-13T22:30:27.230639	37f4017b	116	29	1.0000	DISCARD	gen=32 glyphs=4
2026-03-13T22:30:29.483070	050862ad	120	30	1.0000	DISCARD	gen=76 glyphs=4
2026-03-13T22:30:30.065968	55d6c151	120	30	1.0000	DISCARD	gen=32 glyphs=4
2026-03-13T22:30:32.311484	b7aed8e9	116	29	1.0000	DISCARD	gen=76 glyphs=4
2026-03-13T22:30:32.875172	04e92516	116	29	0.9500	DISCARD	gen=32 glyphs=4
2026-03-13T22:30:35.124758	a78f9454	120	30	1.0000	DISCARD	gen=76 glyphs=4
2026-03-13T22:30:35.682100	37f4017b	116	29	1.0000	DISCARD	gen=32 glyphs=4
2026-03-13T22:30:38.038595	19355583	120	30	1.0000	DISCARD	gen=76 glyphs=4
2026-03-13T22:30:38.608903	37f4017b	116	29	1.0000	DISCARD	gen=32 glyphs=4
2026-03-13T22:30:40.980402	b57e7176	120	30	1.0000	DISCARD	gen=76 glyphs=4
2026-03-13T22:30:41.592242	37f4017b	116	29	1.0000	DISCARD	gen=32 glyphs=4
2026-03-13T22:30:44.061038	9bb5d9b0	120	30	1.0000	DISCARD	gen=76 glyphs=4
2026-03-13T22:30:44.667268	37f4017b	116	29	1.0000	DISCARD	gen=33 glyphs=4
2026-03-13T22:30:47.108914	19355583	120	30	1.0000	DISCARD	gen=77 glyphs=4
2026-03-13T22:30:47.711659	bfdf7cad	120	30	1.0000	DISCARD	gen=33 glyphs=4
2026-03-13T22:30:50.159479	8aef8872	116	29	1.0000	DISCARD	gen=77 glyphs=4
2026-03-13T22:30:50.774684	1d34459a	116	29	1.0000	DISCARD	gen=33 glyphs=4
2026-03-13T22:30:53.111030	0eaedb57	116	29	1.0000	DISCARD	gen=77 glyphs=4
2026-03-13T22:30:53.674681	5a06ca32	120	30	1.0000	DISCARD	gen=33 glyphs=4
2026-03-13T22:30:56.005052	b57e7176	120	30	1.0000	DISCARD	gen=77 glyphs=4
2026-03-13T22:30:56.587677	e3b37888	124	31	0.9500	DISCARD	gen=33 glyphs=4
2026-03-13T22:30:58.928838	67cb81be	120	30	1.0000	DISCARD	gen=77 glyphs=4
2026-03-13T22:30:59.515703	08fb4b26	120	30	1.0000	DISCARD	gen=33 glyphs=4
2026-03-13T22:31:01.854775	19355583	120	30	1.0000	DISCARD	gen=77 glyphs=4
2026-03-13T22:31:02.423050	37f4017b	116	29	1.0000	DISCARD	gen=33 glyphs=4
2026-03-13T22:31:04.757141	67cb81be	120	30	1.0000	DISCARD	gen=77 glyphs=4
2026-03-13T22:31:05.346375	55d6c151	120	30	1.0000	DISCARD	gen=33 glyphs=4
2026-03-13T22:31:07.693449	eca7ab6c	116	29	1.0000	DISCARD	gen=77 glyphs=4
2026-03-13T22:31:08.335500	d11c1062	120	30	1.0000	DISCARD	gen=33 glyphs=4
2026-03-13T22:31:10.746548	19355583	120	30	1.0000	DISCARD	gen=77 glyphs=4
2026-03-13T22:31:11.318636	5b9807ac	120	30	1.0000	DISCARD	gen=33 glyphs=4
2026-03-13T22:31:13.675208	58fcb0cf	116	29	1.0000	DISCARD	gen=77 glyphs=4
2026-03-13T22:31:14.254370	37f4017b	116	29	1.0000	DISCARD	gen=34 glyphs=4
2026-03-13T22:31:16.614719	19355583	120	30	1.0000	DISCARD	gen=78 glyphs=4
2026-03-13T22:31:17.203024	bfdf7cad	120	30	1.0000	DISCARD	gen=34 glyphs=4
2026-03-13T22:31:19.585089	8aef8872	116	29	1.0000	DISCARD	gen=78 glyphs=4
2026-03-13T22:31:20.172312	fdb5d108	120	30	1.0000	DISCARD	gen=34 glyphs=4
2026-03-13T22:31:22.516832	9345db5c	116	29	1.0000	DISCARD	gen=78 glyphs=4
2026-03-13T22:31:23.097761	37f4017b	116	29	1.0000	DISCARD	gen=34 glyphs=4
2026-03-13T22:31:25.388227	1ba7dcf0	120	30	1.0000	DISCARD	gen=78 glyphs=4
2026-03-13T22:31:25.961035	08a2feba	116	29	1.0000	DISCARD	gen=34 glyphs=4
2026-03-13T22:31:28.216060	8aef8872	116	29	1.0000	DISCARD	gen=78 glyphs=4
2026-03-13T22:31:28.781462	37f4017b	116	29	1.0000	DISCARD	gen=34 glyphs=4
2026-03-13T22:31:31.012172	050862ad	120	30	1.0000	DISCARD	gen=78 glyphs=4
2026-03-13T22:31:31.601080	129160d0	124	31	0.9500	DISCARD	gen=34 glyphs=4
2026-03-13T22:31:33.881215	19355583	120	30	1.0000	DISCARD	gen=78 glyphs=4
2026-03-13T22:31:34.431296	fdb5d108	120	30	1.0000	DISCARD	gen=34 glyphs=4
2026-03-13T22:31:36.704653	a78f9454	120	30	1.0000	DISCARD	gen=78 glyphs=4
2026-03-13T22:31:37.251250	5a06ca32	120	30	1.0000	DISCARD	gen=34 glyphs=4
2026-03-13T22:31:39.515100	b57e7176	120	30	1.0000	DISCARD	gen=78 glyphs=4
2026-03-13T22:31:40.136331	5a06ca32	120	30	1.0000	DISCARD	gen=34 glyphs=4
2026-03-13T22:31:42.416686	f6e2fe07	116	29	1.0000	DISCARD	gen=78 glyphs=4
2026-03-13T22:31:42.979613	37f4017b	116	29	1.0000	DISCARD	gen=35 glyphs=4
2026-03-13T22:31:45.227950	19355583	120	30	1.0000	DISCARD	gen=79 glyphs=4
2026-03-13T22:31:45.819946	bfdf7cad	120	30	1.0000	DISCARD	gen=35 glyphs=4
2026-03-13T22:31:48.078523	8aef8872	116	29	1.0000	DISCARD	gen=79 glyphs=4
2026-03-13T22:31:48.632178	9b803c1b	116	29	0.9500	DISCARD	gen=35 glyphs=4
2026-03-13T22:31:50.870028	ae44ace5	116	29	1.0000	DISCARD	gen=79 glyphs=4
2026-03-13T22:31:51.438884	c1413149	120	30	1.0000	DISCARD	gen=35 glyphs=4
2026-03-13T22:31:53.669002	8aef8872	116	29	1.0000	DISCARD	gen=79 glyphs=4
2026-03-13T22:31:54.235027	12b38c2d	116	29	1.0000	DISCARD	gen=35 glyphs=4
2026-03-13T22:31:56.458479	7fb8da17	116	29	1.0000	DISCARD	gen=79 glyphs=4
2026-03-13T22:31:57.009363	58236af0	116	29	1.0000	DISCARD	gen=35 glyphs=4
2026-03-13T22:31:59.225756	8aef8872	116	29	1.0000	DISCARD	gen=79 glyphs=4
2026-03-13T22:31:59.788563	8e0b87a8	116	29	1.0000	DISCARD	gen=35 glyphs=4
2026-03-13T22:32:02.030987	671acf87	120	30	1.0000	DISCARD	gen=79 glyphs=4
2026-03-13T22:32:02.589882	020d27b3	116	29	1.0000	DISCARD	gen=35 glyphs=4
2026-03-13T22:32:04.799447	d81989b4	120	30	1.0000	DISCARD	gen=79 glyphs=4
2026-03-13T22:32:05.356834	2aa96faf	116	29	0.9500	DISCARD	gen=35 glyphs=4
2026-03-13T22:32:07.546872	e8c7f6cf	120	30	1.0000	DISCARD	gen=79 glyphs=4
2026-03-13T22:32:08.099129	c84aa061	116	29	1.0000	DISCARD	gen=35 glyphs=4
2026-03-13T22:32:10.298928	67cb81be	120	30	1.0000	DISCARD	gen=79 glyphs=4
2026-03-13T22:32:10.848042	37f4017b	116	29	1.0000	DISCARD	gen=36 glyphs=4
2026-03-13T22:32:13.151458	19355583	120	30	1.0000	DISCARD	gen=80 glyphs=4
2026-03-13T22:32:13.705641	bfdf7cad	120	30	1.0000	DISCARD	gen=36 glyphs=4
2026-03-13T22:32:15.889814	8aef8872	116	29	1.0000	DISCARD	gen=80 glyphs=4
2026-03-13T22:32:16.434205	d11c1062	120	30	1.0000	DISCARD	gen=36 glyphs=4
2026-03-13T22:32:18.629639	d7c8681b	120	30	1.0000	DISCARD	gen=80 glyphs=4
2026-03-13T22:32:19.166268	12b38c2d	116	29	1.0000	DISCARD	gen=36 glyphs=4
2026-03-13T22:32:21.392419	eca7ab6c	116	29	1.0000	DISCARD	gen=80 glyphs=4
2026-03-13T22:32:21.938676	12b38c2d	116	29	1.0000	DISCARD	gen=36 glyphs=4
2026-03-13T22:32:24.143310	8aef8872	116	29	1.0000	DISCARD	gen=80 glyphs=4
2026-03-13T22:32:24.707864	5a06ca32	120	30	1.0000	DISCARD	gen=36 glyphs=4
2026-03-13T22:32:26.894914	b57e7176	120	30	1.0000	DISCARD	gen=80 glyphs=4
2026-03-13T22:32:27.452161	37f4017b	116	29	1.0000	DISCARD	gen=36 glyphs=4
2026-03-13T22:32:29.708005	10c4fc38	116	29	1.0000	DISCARD	gen=80 glyphs=4
2026-03-13T22:32:30.290766	37f4017b	116	29	1.0000	DISCARD	gen=36 glyphs=4
2026-03-13T22:32:32.540157	04078577	116	29	1.0000	DISCARD	gen=80 glyphs=4
2026-03-13T22:32:33.078805	37f4017b	116	29	1.0000	DISCARD	gen=36 glyphs=4
2026-03-13T22:32:35.300799	875e0f8a	116	29	1.0000	DISCARD	gen=80 glyphs=4
2026-03-13T22:32:35.862972	2835182e	120	30	1.0000	DISCARD	gen=36 glyphs=4
2026-03-13T22:32:38.092745	a78f9454	120	30	1.0000	DISCARD	gen=80 glyphs=4
2026-03-13T22:32:38.634727	37f4017b	116	29	1.0000	DISCARD	gen=37 glyphs=4
2026-03-13T22:32:40.860515	19355583	120	30	1.0000	DISCARD	gen=81 glyphs=4
2026-03-13T22:32:41.410663	bfdf7cad	120	30	1.0000	DISCARD	gen=37 glyphs=4
2026-03-13T22:32:43.646523	8aef8872	116	29	1.0000	DISCARD	gen=81 glyphs=4
2026-03-13T22:32:44.217202	3a147dac	124	31	0.9500	DISCARD	gen=37 glyphs=4
2026-03-13T22:32:46.442347	7ba4118a	116	29	1.0000	DISCARD	gen=81 glyphs=4
2026-03-13T22:32:47.000817	37f4017b	116	29	1.0000	DISCARD	gen=37 glyphs=4
