timestamp	program_hash	spirv_size	word_count	fitness	status	description
2026-03-14T07:36:44.502738	099964a4	0	0	0.0000	CRASH	gen=232 glyphs=4
2026-03-14T07:36:44.502936	099964a4	0	0	0.0000	CRASH	gen=232 glyphs=4
2026-03-14T07:36:44.503130	97588bbe	0	0	0.0000	CRASH	gen=232 glyphs=4
2026-03-14T07:36:44.503323	099964a4	0	0	0.0000	CRASH	gen=232 glyphs=4
2026-03-14T07:36:44.503514	10fff33a	0	0	0.0000	CRASH	gen=232 glyphs=5
2026-03-14T07:36:44.503710	784ec7ee	0	0	0.0000	CRASH	gen=232 glyphs=2
2026-03-14T07:36:44.503905	cf93b656	0	0	0.0000	CRASH	gen=232 glyphs=3
2026-03-14T07:36:44.504099	ff30496a	0	0	0.0000	CRASH	gen=232 glyphs=3
2026-03-14T07:36:44.504291	099964a4	0	0	0.0000	CRASH	gen=232 glyphs=4
2026-03-14T07:36:44.504568	099964a4	0	0	0.0000	CRASH	gen=233 glyphs=4
2026-03-14T07:36:44.504760	099964a4	0	0	0.0000	CRASH	gen=233 glyphs=4
2026-03-14T07:36:44.504957	099964a4	0	0	0.0000	CRASH	gen=233 glyphs=4
2026-03-14T07:36:44.505149	099964a4	0	0	0.0000	CRASH	gen=233 glyphs=4
2026-03-14T07:36:44.505340	13937f44	0	0	0.0000	CRASH	gen=233 glyphs=2
2026-03-14T07:36:44.505533	7ede4765	0	0	0.0000	CRASH	gen=233 glyphs=2
2026-03-14T07:36:44.505725	8da1f8d8	0	0	0.0000	CRASH	gen=233 glyphs=4
2026-03-14T07:36:44.505920	3a734398	0	0	0.0000	CRASH	gen=233 glyphs=4
2026-03-14T07:36:44.506116	099964a4	0	0	0.0000	CRASH	gen=233 glyphs=4
2026-03-14T07:36:44.506305	8da1f8d8	0	0	0.0000	CRASH	gen=233 glyphs=4
2026-03-14T07:36:44.506583	099964a4	0	0	0.0000	CRASH	gen=234 glyphs=4
2026-03-14T07:36:44.506775	099964a4	0	0	0.0000	CRASH	gen=234 glyphs=4
2026-03-14T07:36:44.506967	099964a4	0	0	0.0000	CRASH	gen=234 glyphs=4
2026-03-14T07:36:44.507164	ff30496a	0	0	0.0000	CRASH	gen=234 glyphs=3
2026-03-14T07:36:44.507353	3ca14993	0	0	0.0000	CRASH	gen=234 glyphs=4
2026-03-14T07:36:44.507547	3ca14993	0	0	0.0000	CRASH	gen=234 glyphs=4
2026-03-14T07:36:44.507737	099964a4	0	0	0.0000	CRASH	gen=234 glyphs=4
2026-03-14T07:36:44.507926	7ede4765	0	0	0.0000	CRASH	gen=234 glyphs=2
2026-03-14T07:36:44.508119	28de5b0c	0	0	0.0000	CRASH	gen=234 glyphs=3
2026-03-14T07:36:44.508311	80cef82b	0	0	0.0000	CRASH	gen=234 glyphs=4
2026-03-14T07:36:44.508590	099964a4	0	0	0.0000	CRASH	gen=235 glyphs=4
2026-03-14T07:36:44.508787	099964a4	0	0	0.0000	CRASH	gen=235 glyphs=4
2026-03-14T07:36:44.508982	099964a4	0	0	0.0000	CRASH	gen=235 glyphs=4
2026-03-14T07:36:44.509182	099964a4	0	0	0.0000	CRASH	gen=235 glyphs=4
2026-03-14T07:36:44.509378	40c030a8	0	0	0.0000	CRASH	gen=235 glyphs=4
2026-03-14T07:36:44.509580	099964a4	0	0	0.0000	CRASH	gen=235 glyphs=4
2026-03-14T07:36:44.509773	099964a4	0	0	0.0000	CRASH	gen=235 glyphs=4
2026-03-14T07:36:44.509966	099964a4	0	0	0.0000	CRASH	gen=235 glyphs=4
2026-03-14T07:36:44.510158	b96fb3ab	0	0	0.0000	CRASH	gen=235 glyphs=4
2026-03-14T07:36:44.510355	099964a4	0	0	0.0000	CRASH	gen=235 glyphs=4
2026-03-14T07:36:44.510630	099964a4	0	0	0.0000	CRASH	gen=236 glyphs=4
2026-03-14T07:36:44.510824	099964a4	0	0	0.0000	CRASH	gen=236 glyphs=4
2026-03-14T07:36:44.511014	c1a84919	0	0	0.0000	CRASH	gen=236 glyphs=4
2026-03-14T07:36:44.511206	7bc75880	0	0	0.0000	CRASH	gen=236 glyphs=4
2026-03-14T07:36:44.511403	099964a4	0	0	0.0000	CRASH	gen=236 glyphs=4
2026-03-14T07:36:44.511596	3a734398	0	0	0.0000	CRASH	gen=236 glyphs=4
2026-03-14T07:36:44.511787	dcb1fb50	0	0	0.0000	CRASH	gen=236 glyphs=4
2026-03-14T07:36:44.511979	be077e7d	0	0	0.0000	CRASH	gen=236 glyphs=4
2026-03-14T07:36:44.512177	099964a4	0	0	0.0000	CRASH	gen=236 glyphs=4
2026-03-14T07:36:44.512379	099964a4	0	0	0.0000	CRASH	gen=236 glyphs=4
2026-03-14T07:36:44.512653	099964a4	0	0	0.0000	CRASH	gen=237 glyphs=4
2026-03-14T07:36:44.512847	099964a4	0	0	0.0000	CRASH	gen=237 glyphs=4
2026-03-14T07:36:44.513040	3ca14993	0	0	0.0000	CRASH	gen=237 glyphs=4
2026-03-14T07:36:44.513236	cf93b656	0	0	0.0000	CRASH	gen=237 glyphs=3
2026-03-14T07:36:44.513432	099964a4	0	0	0.0000	CRASH	gen=237 glyphs=4
2026-03-14T07:36:44.513629	099964a4	0	0	0.0000	CRASH	gen=237 glyphs=4
2026-03-14T07:36:44.513823	099964a4	0	0	0.0000	CRASH	gen=237 glyphs=4
2026-03-14T07:36:44.514013	8da1f8d8	0	0	0.0000	CRASH	gen=237 glyphs=4
2026-03-14T07:36:44.514211	a4db8370	0	0	0.0000	CRASH	gen=237 glyphs=4
2026-03-14T07:36:44.514406	8f664128	0	0	0.0000	CRASH	gen=237 glyphs=4
2026-03-14T07:36:44.514687	099964a4	0	0	0.0000	CRASH	gen=238 glyphs=4
2026-03-14T07:36:44.514886	099964a4	0	0	0.0000	CRASH	gen=238 glyphs=4
2026-03-14T07:36:44.515081	80cef82b	0	0	0.0000	CRASH	gen=238 glyphs=4
2026-03-14T07:36:44.515276	3ca14993	0	0	0.0000	CRASH	gen=238 glyphs=4
2026-03-14T07:36:44.515471	099964a4	0	0	0.0000	CRASH	gen=238 glyphs=4
2026-03-14T07:36:44.515670	b416291b	0	0	0.0000	CRASH	gen=238 glyphs=4
2026-03-14T07:36:44.515867	d3d68f7a	0	0	0.0000	CRASH	gen=238 glyphs=4
2026-03-14T07:36:44.516063	099964a4	0	0	0.0000	CRASH	gen=238 glyphs=4
2026-03-14T07:36:44.516261	3ca14993	0	0	0.0000	CRASH	gen=238 glyphs=4
2026-03-14T07:36:44.516458	099964a4	0	0	0.0000	CRASH	gen=238 glyphs=4
2026-03-14T07:36:44.516746	099964a4	0	0	0.0000	CRASH	gen=239 glyphs=4
2026-03-14T07:36:44.516942	099964a4	0	0	0.0000	CRASH	gen=239 glyphs=4
2026-03-14T07:36:44.517139	39d3407f	0	0	0.0000	CRASH	gen=239 glyphs=5
2026-03-14T07:36:44.517336	099964a4	0	0	0.0000	CRASH	gen=239 glyphs=4
2026-03-14T07:36:44.517532	3ca14993	0	0	0.0000	CRASH	gen=239 glyphs=4
2026-03-14T07:36:44.517733	099964a4	0	0	0.0000	CRASH	gen=239 glyphs=4
2026-03-14T07:36:44.517926	099964a4	0	0	0.0000	CRASH	gen=239 glyphs=4
2026-03-14T07:36:44.518118	7ede4765	0	0	0.0000	CRASH	gen=239 glyphs=2
2026-03-14T07:36:44.518311	3a734398	0	0	0.0000	CRASH	gen=239 glyphs=4
2026-03-14T07:36:44.518501	2a691b1e	0	0	0.0000	CRASH	gen=239 glyphs=4
2026-03-14T07:36:44.518782	099964a4	0	0	0.0000	CRASH	gen=240 glyphs=4
2026-03-14T07:36:44.518976	099964a4	0	0	0.0000	CRASH	gen=240 glyphs=4
2026-03-14T07:36:44.519171	099964a4	0	0	0.0000	CRASH	gen=240 glyphs=4
2026-03-14T07:36:44.519363	099964a4	0	0	0.0000	CRASH	gen=240 glyphs=4
2026-03-14T07:36:44.519557	8da1f8d8	0	0	0.0000	CRASH	gen=240 glyphs=4
2026-03-14T07:36:44.519755	0eaac986	0	0	0.0000	CRASH	gen=240 glyphs=4
2026-03-14T07:36:44.519950	099964a4	0	0	0.0000	CRASH	gen=240 glyphs=4
2026-03-14T07:36:44.520142	099964a4	0	0	0.0000	CRASH	gen=240 glyphs=4
2026-03-14T07:36:44.520337	2a8d075e	0	0	0.0000	CRASH	gen=240 glyphs=4
2026-03-14T07:36:44.520536	099964a4	0	0	0.0000	CRASH	gen=240 glyphs=4
2026-03-14T07:36:44.520827	099964a4	0	0	0.0000	CRASH	gen=241 glyphs=4
2026-03-14T07:36:44.521022	099964a4	0	0	0.0000	CRASH	gen=241 glyphs=4
2026-03-14T07:36:44.521217	ff30496a	0	0	0.0000	CRASH	gen=241 glyphs=3
2026-03-14T07:36:44.521408	099964a4	0	0	0.0000	CRASH	gen=241 glyphs=4
2026-03-14T07:36:44.521603	9559601a	0	0	0.0000	CRASH	gen=241 glyphs=4
2026-03-14T07:36:44.521795	3a734398	0	0	0.0000	CRASH	gen=241 glyphs=4
2026-03-14T07:36:44.521991	099964a4	0	0	0.0000	CRASH	gen=241 glyphs=4
2026-03-14T07:36:44.522182	065d9b53	0	0	0.0000	CRASH	gen=241 glyphs=5
2026-03-14T07:36:44.522376	099964a4	0	0	0.0000	CRASH	gen=241 glyphs=4
2026-03-14T07:36:44.522570	6ffd1b69	0	0	0.0000	CRASH	gen=241 glyphs=2
2026-03-14T07:36:44.522852	099964a4	0	0	0.0000	CRASH	gen=242 glyphs=4
2026-03-14T07:36:44.523052	099964a4	0	0	0.0000	CRASH	gen=242 glyphs=4
2026-03-14T07:36:44.523247	29d1b4d3	0	0	0.0000	CRASH	gen=242 glyphs=3
2026-03-14T07:36:44.523441	099964a4	0	0	0.0000	CRASH	gen=242 glyphs=4
2026-03-14T07:36:44.523636	099964a4	0	0	0.0000	CRASH	gen=242 glyphs=4
2026-03-14T07:36:44.523828	8da1f8d8	0	0	0.0000	CRASH	gen=242 glyphs=4
2026-03-14T07:36:44.524027	099964a4	0	0	0.0000	CRASH	gen=242 glyphs=4
2026-03-14T07:36:44.524218	15f4de52	0	0	0.0000	CRASH	gen=242 glyphs=3
2026-03-14T07:36:44.524415	099964a4	0	0	0.0000	CRASH	gen=242 glyphs=4
2026-03-14T07:36:44.524613	099964a4	0	0	0.0000	CRASH	gen=242 glyphs=4
2026-03-14T07:36:44.524912	099964a4	0	0	0.0000	CRASH	gen=243 glyphs=4
2026-03-14T07:36:44.525112	099964a4	0	0	0.0000	CRASH	gen=243 glyphs=4
2026-03-14T07:36:44.525307	c7a3d088	0	0	0.0000	CRASH	gen=243 glyphs=2
2026-03-14T07:36:44.525501	3a734398	0	0	0.0000	CRASH	gen=243 glyphs=4
2026-03-14T07:36:44.525702	c7a55058	0	0	0.0000	CRASH	gen=243 glyphs=3
2026-03-14T07:36:44.525896	099964a4	0	0	0.0000	CRASH	gen=243 glyphs=4
2026-03-14T07:36:44.526093	099964a4	0	0	0.0000	CRASH	gen=243 glyphs=4
2026-03-14T07:36:44.526285	099964a4	0	0	0.0000	CRASH	gen=243 glyphs=4
2026-03-14T07:36:44.526476	f4d5c304	0	0	0.0000	CRASH	gen=243 glyphs=5
2026-03-14T07:36:44.526673	f177f4fa	0	0	0.0000	CRASH	gen=243 glyphs=4
2026-03-14T07:36:44.526951	099964a4	0	0	0.0000	CRASH	gen=244 glyphs=4
2026-03-14T07:36:44.527155	099964a4	0	0	0.0000	CRASH	gen=244 glyphs=4
2026-03-14T07:36:44.527353	7ef27408	0	0	0.0000	CRASH	gen=244 glyphs=3
2026-03-14T07:36:44.527550	272dc046	0	0	0.0000	CRASH	gen=244 glyphs=4
2026-03-14T07:36:44.527747	099964a4	0	0	0.0000	CRASH	gen=244 glyphs=4
2026-03-14T07:36:44.527943	cf93b656	0	0	0.0000	CRASH	gen=244 glyphs=3
2026-03-14T07:36:44.528139	7ede4765	0	0	0.0000	CRASH	gen=244 glyphs=2
2026-03-14T07:36:44.528334	78ba45a8	0	0	0.0000	CRASH	gen=244 glyphs=4
2026-03-14T07:36:44.528534	099964a4	0	0	0.0000	CRASH	gen=244 glyphs=4
2026-03-14T07:36:44.528726	099964a4	0	0	0.0000	CRASH	gen=244 glyphs=4
2026-03-14T07:36:44.529013	099964a4	0	0	0.0000	CRASH	gen=245 glyphs=4
2026-03-14T07:36:44.529211	099964a4	0	0	0.0000	CRASH	gen=245 glyphs=4
2026-03-14T07:36:44.529408	6f794e3e	0	0	0.0000	CRASH	gen=245 glyphs=3
2026-03-14T07:36:44.529604	98068e90	0	0	0.0000	CRASH	gen=245 glyphs=3
2026-03-14T07:36:44.529799	099964a4	0	0	0.0000	CRASH	gen=245 glyphs=4
2026-03-14T07:36:44.529990	099964a4	0	0	0.0000	CRASH	gen=245 glyphs=4
2026-03-14T07:36:44.530185	5e3d36bf	0	0	0.0000	CRASH	gen=245 glyphs=3
2026-03-14T07:36:44.530384	099964a4	0	0	0.0000	CRASH	gen=245 glyphs=4
2026-03-14T07:36:44.530581	099964a4	0	0	0.0000	CRASH	gen=245 glyphs=4
2026-03-14T07:36:44.530775	ea8d31f2	0	0	0.0000	CRASH	gen=245 glyphs=2
2026-03-14T07:36:44.531043	099964a4	0	0	0.0000	CRASH	gen=246 glyphs=4
2026-03-14T07:36:44.531238	099964a4	0	0	0.0000	CRASH	gen=246 glyphs=4
2026-03-14T07:36:44.531435	b8ca0764	0	0	0.0000	CRASH	gen=246 glyphs=3
2026-03-14T07:36:44.531635	fd75ae3c	0	0	0.0000	CRASH	gen=246 glyphs=3
2026-03-14T07:36:44.531827	dcb1fb50	0	0	0.0000	CRASH	gen=246 glyphs=4
2026-03-14T07:36:44.532022	ff30496a	0	0	0.0000	CRASH	gen=246 glyphs=3
2026-03-14T07:36:44.532212	7ede4765	0	0	0.0000	CRASH	gen=246 glyphs=2
2026-03-14T07:36:44.532408	cf93b656	0	0	0.0000	CRASH	gen=246 glyphs=3
2026-03-14T07:36:44.532601	099964a4	0	0	0.0000	CRASH	gen=246 glyphs=4
2026-03-14T07:36:44.532792	099964a4	0	0	0.0000	CRASH	gen=246 glyphs=4
2026-03-14T07:36:44.533075	099964a4	0	0	0.0000	CRASH	gen=247 glyphs=4
2026-03-14T07:36:44.533271	099964a4	0	0	0.0000	CRASH	gen=247 glyphs=4
2026-03-14T07:36:44.533471	099964a4	0	0	0.0000	CRASH	gen=247 glyphs=4
2026-03-14T07:36:44.533668	e78da2ac	0	0	0.0000	CRASH	gen=247 glyphs=3
2026-03-14T07:36:44.533863	099964a4	0	0	0.0000	CRASH	gen=247 glyphs=4
2026-03-14T07:36:44.534057	099964a4	0	0	0.0000	CRASH	gen=247 glyphs=4
2026-03-14T07:36:44.534249	994e9fd8	0	0	0.0000	CRASH	gen=247 glyphs=3
2026-03-14T07:36:44.534443	099964a4	0	0	0.0000	CRASH	gen=247 glyphs=4
2026-03-14T07:36:44.534644	099964a4	0	0	0.0000	CRASH	gen=247 glyphs=4
2026-03-14T07:36:44.534834	dcb1fb50	0	0	0.0000	CRASH	gen=247 glyphs=4
2026-03-14T07:36:44.535105	099964a4	0	0	0.0000	CRASH	gen=248 glyphs=4
2026-03-14T07:36:44.535299	099964a4	0	0	0.0000	CRASH	gen=248 glyphs=4
2026-03-14T07:36:44.535495	099964a4	0	0	0.0000	CRASH	gen=248 glyphs=4
2026-03-14T07:36:44.535694	4baab5ab	0	0	0.0000	CRASH	gen=248 glyphs=4
2026-03-14T07:36:44.535892	7ede4765	0	0	0.0000	CRASH	gen=248 glyphs=2
2026-03-14T07:36:44.536085	6afbfe93	0	0	0.0000	CRASH	gen=248 glyphs=4
2026-03-14T07:36:44.536281	099964a4	0	0	0.0000	CRASH	gen=248 glyphs=4
2026-03-14T07:36:44.536474	099964a4	0	0	0.0000	CRASH	gen=248 glyphs=4
2026-03-14T07:36:44.536676	8f5eee08	0	0	0.0000	CRASH	gen=248 glyphs=4
2026-03-14T07:36:44.536870	2b074686	0	0	0.0000	CRASH	gen=248 glyphs=4
2026-03-14T07:36:44.537144	099964a4	0	0	0.0000	CRASH	gen=249 glyphs=4
2026-03-14T07:36:44.537338	099964a4	0	0	0.0000	CRASH	gen=249 glyphs=4
2026-03-14T07:36:44.537534	6d1ced55	0	0	0.0000	CRASH	gen=249 glyphs=3
2026-03-14T07:36:44.537735	099964a4	0	0	0.0000	CRASH	gen=249 glyphs=4
2026-03-14T07:36:44.537930	099964a4	0	0	0.0000	CRASH	gen=249 glyphs=4
2026-03-14T07:36:44.538120	099964a4	0	0	0.0000	CRASH	gen=249 glyphs=4
2026-03-14T07:36:44.538314	8da1f8d8	0	0	0.0000	CRASH	gen=249 glyphs=4
2026-03-14T07:36:44.538507	099964a4	0	0	0.0000	CRASH	gen=249 glyphs=4
2026-03-14T07:36:44.538709	ff30496a	0	0	0.0000	CRASH	gen=249 glyphs=3
2026-03-14T07:36:44.538899	cd662943	0	0	0.0000	CRASH	gen=249 glyphs=4
2026-03-14T07:36:44.539182	099964a4	0	0	0.0000	CRASH	gen=250 glyphs=4
2026-03-14T07:36:44.539377	099964a4	0	0	0.0000	CRASH	gen=250 glyphs=4
2026-03-14T07:36:44.539576	099964a4	0	0	0.0000	CRASH	gen=250 glyphs=4
2026-03-14T07:36:44.539774	099964a4	0	0	0.0000	CRASH	gen=250 glyphs=4
2026-03-14T07:36:44.539967	099964a4	0	0	0.0000	CRASH	gen=250 glyphs=4
2026-03-14T07:36:44.540157	fad8312d	0	0	0.0000	CRASH	gen=250 glyphs=4
2026-03-14T07:36:44.540351	099964a4	0	0	0.0000	CRASH	gen=250 glyphs=4
2026-03-14T07:36:44.540543	38c3d1c9	0	0	0.0000	CRASH	gen=250 glyphs=4
2026-03-14T07:36:44.540739	099964a4	0	0	0.0000	CRASH	gen=250 glyphs=4
2026-03-14T07:36:44.540933	099964a4	0	0	0.0000	CRASH	gen=250 glyphs=4
2026-03-14T07:36:44.541218	099964a4	0	0	0.0000	CRASH	gen=251 glyphs=4
2026-03-14T07:36:44.541414	099964a4	0	0	0.0000	CRASH	gen=251 glyphs=4
2026-03-14T07:36:44.541611	8da1f8d8	0	0	0.0000	CRASH	gen=251 glyphs=4
2026-03-14T07:36:44.541805	099964a4	0	0	0.0000	CRASH	gen=251 glyphs=4
2026-03-14T07:36:44.542007	8369c0fd	0	0	0.0000	CRASH	gen=251 glyphs=5
2026-03-14T07:36:44.542211	099964a4	0	0	0.0000	CRASH	gen=251 glyphs=4
2026-03-14T07:36:44.542420	099964a4	0	0	0.0000	CRASH	gen=251 glyphs=4
2026-03-14T07:36:44.542635	3ca14993	0	0	0.0000	CRASH	gen=251 glyphs=4
2026-03-14T07:36:44.542856	099964a4	0	0	0.0000	CRASH	gen=251 glyphs=4
2026-03-14T07:36:44.543078	099964a4	0	0	0.0000	CRASH	gen=251 glyphs=4
2026-03-14T07:36:44.543378	099964a4	0	0	0.0000	CRASH	gen=252 glyphs=4
2026-03-14T07:36:44.543600	099964a4	0	0	0.0000	CRASH	gen=252 glyphs=4
2026-03-14T07:36:44.543815	099964a4	0	0	0.0000	CRASH	gen=252 glyphs=4
2026-03-14T07:36:44.544037	5a39a8b2	0	0	0.0000	CRASH	gen=252 glyphs=3
2026-03-14T07:36:44.544256	099964a4	0	0	0.0000	CRASH	gen=252 glyphs=4
2026-03-14T07:36:44.544469	099964a4	0	0	0.0000	CRASH	gen=252 glyphs=4
2026-03-14T07:36:44.544687	80cef82b	0	0	0.0000	CRASH	gen=252 glyphs=4
2026-03-14T07:36:44.544901	2f6e565f	0	0	0.0000	CRASH	gen=252 glyphs=3
2026-03-14T07:36:44.545118	099964a4	0	0	0.0000	CRASH	gen=252 glyphs=4
2026-03-14T07:36:44.545332	ef88c887	0	0	0.0000	CRASH	gen=252 glyphs=5
2026-03-14T07:36:44.545624	099964a4	0	0	0.0000	CRASH	gen=253 glyphs=4
2026-03-14T07:36:44.545841	099964a4	0	0	0.0000	CRASH	gen=253 glyphs=4
2026-03-14T07:36:44.546056	099964a4	0	0	0.0000	CRASH	gen=253 glyphs=4
2026-03-14T07:36:44.546279	cf93b656	0	0	0.0000	CRASH	gen=253 glyphs=3
2026-03-14T07:36:44.546494	fa04ccb5	0	0	0.0000	CRASH	gen=253 glyphs=3
2026-03-14T07:36:44.546711	ff30496a	0	0	0.0000	CRASH	gen=253 glyphs=3
2026-03-14T07:36:44.546928	099964a4	0	0	0.0000	CRASH	gen=253 glyphs=4
2026-03-14T07:36:44.547146	7ede4765	0	0	0.0000	CRASH	gen=253 glyphs=2
2026-03-14T07:36:44.547368	099964a4	0	0	0.0000	CRASH	gen=253 glyphs=4
2026-03-14T07:36:44.547585	099964a4	0	0	0.0000	CRASH	gen=253 glyphs=4
2026-03-14T07:36:44.547894	099964a4	0	0	0.0000	CRASH	gen=254 glyphs=4
2026-03-14T07:36:44.548109	099964a4	0	0	0.0000	CRASH	gen=254 glyphs=4
2026-03-14T07:36:44.548333	099964a4	0	0	0.0000	CRASH	gen=254 glyphs=4
2026-03-14T07:36:44.548551	099964a4	0	0	0.0000	CRASH	gen=254 glyphs=4
2026-03-14T07:36:44.548770	c5bc747c	0	0	0.0000	CRASH	gen=254 glyphs=3
2026-03-14T07:36:44.548990	3ca14993	0	0	0.0000	CRASH	gen=254 glyphs=4
2026-03-14T07:36:44.549215	8da1f8d8	0	0	0.0000	CRASH	gen=254 glyphs=4
2026-03-14T07:36:44.549441	e3575c8f	0	0	0.0000	CRASH	gen=254 glyphs=1
2026-03-14T07:36:44.549663	8d98b2da	0	0	0.0000	CRASH	gen=254 glyphs=2
2026-03-14T07:36:44.549883	67a609a0	0	0	0.0000	CRASH	gen=254 glyphs=4
2026-03-14T07:36:44.550205	099964a4	0	0	0.0000	CRASH	gen=255 glyphs=4
2026-03-14T07:36:44.550433	099964a4	0	0	0.0000	CRASH	gen=255 glyphs=4
2026-03-14T07:36:44.550659	099964a4	0	0	0.0000	CRASH	gen=255 glyphs=4
2026-03-14T07:36:44.550877	099964a4	0	0	0.0000	CRASH	gen=255 glyphs=4
2026-03-14T07:36:44.551099	099964a4	0	0	0.0000	CRASH	gen=255 glyphs=4
2026-03-14T07:36:44.551319	ac51b406	0	0	0.0000	CRASH	gen=255 glyphs=4
2026-03-14T07:36:44.551551	0137aaec	0	0	0.0000	CRASH	gen=255 glyphs=3
2026-03-14T07:36:44.551776	099964a4	0	0	0.0000	CRASH	gen=255 glyphs=4
2026-03-14T07:36:44.552001	95f6bd51	0	0	0.0000	CRASH	gen=255 glyphs=5
2026-03-14T07:36:44.552223	099964a4	0	0	0.0000	CRASH	gen=255 glyphs=4
2026-03-14T07:36:44.552529	099964a4	0	0	0.0000	CRASH	gen=256 glyphs=4
2026-03-14T07:36:44.552751	099964a4	0	0	0.0000	CRASH	gen=256 glyphs=4
2026-03-14T07:36:44.552969	385050c5	0	0	0.0000	CRASH	gen=256 glyphs=4
2026-03-14T07:36:44.553194	2f4386d0	0	0	0.0000	CRASH	gen=256 glyphs=3
2026-03-14T07:36:44.553418	099964a4	0	0	0.0000	CRASH	gen=256 glyphs=4
2026-03-14T07:36:44.553646	099964a4	0	0	0.0000	CRASH	gen=256 glyphs=4
2026-03-14T07:36:44.553865	099964a4	0	0	0.0000	CRASH	gen=256 glyphs=4
2026-03-14T07:36:44.554083	099964a4	0	0	0.0000	CRASH	gen=256 glyphs=4
2026-03-14T07:36:44.554300	099964a4	0	0	0.0000	CRASH	gen=256 glyphs=4
2026-03-14T07:36:44.554513	099964a4	0	0	0.0000	CRASH	gen=256 glyphs=4
2026-03-14T07:36:44.554821	099964a4	0	0	0.0000	CRASH	gen=257 glyphs=4
2026-03-14T07:36:44.555047	099964a4	0	0	0.0000	CRASH	gen=257 glyphs=4
2026-03-14T07:36:44.555270	099964a4	0	0	0.0000	CRASH	gen=257 glyphs=4
2026-03-14T07:36:44.555493	099964a4	0	0	0.0000	CRASH	gen=257 glyphs=4
2026-03-14T07:36:44.555715	099964a4	0	0	0.0000	CRASH	gen=257 glyphs=4
2026-03-14T07:36:44.555933	cf93b656	0	0	0.0000	CRASH	gen=257 glyphs=3
2026-03-14T07:36:44.556151	80cef82b	0	0	0.0000	CRASH	gen=257 glyphs=4
2026-03-14T07:36:44.556377	099964a4	0	0	0.0000	CRASH	gen=257 glyphs=4
2026-03-14T07:36:44.556605	dcb1fb50	0	0	0.0000	CRASH	gen=257 glyphs=4
2026-03-14T07:36:44.556832	099964a4	0	0	0.0000	CRASH	gen=257 glyphs=4
2026-03-14T07:36:44.557149	099964a4	0	0	0.0000	CRASH	gen=258 glyphs=4
2026-03-14T07:36:44.557368	099964a4	0	0	0.0000	CRASH	gen=258 glyphs=4
2026-03-14T07:36:44.557589	099964a4	0	0	0.0000	CRASH	gen=258 glyphs=4
2026-03-14T07:36:44.557804	3ac7588f	0	0	0.0000	CRASH	gen=258 glyphs=4
2026-03-14T07:36:44.558031	d0000e18	0	0	0.0000	CRASH	gen=258 glyphs=4
2026-03-14T07:36:44.558251	8da1f8d8	0	0	0.0000	CRASH	gen=258 glyphs=4
2026-03-14T07:36:44.558473	099964a4	0	0	0.0000	CRASH	gen=258 glyphs=4
2026-03-14T07:36:44.558694	1e0d752f	0	0	0.0000	CRASH	gen=258 glyphs=3
2026-03-14T07:36:44.558920	0106ae74	0	0	0.0000	CRASH	gen=258 glyphs=3
2026-03-14T07:36:44.559141	d1dbec27	0	0	0.0000	CRASH	gen=258 glyphs=4
2026-03-14T07:36:44.559454	099964a4	0	0	0.0000	CRASH	gen=259 glyphs=4
2026-03-14T07:36:44.559677	099964a4	0	0	0.0000	CRASH	gen=259 glyphs=4
2026-03-14T07:36:44.559892	dcbc72dc	0	0	0.0000	CRASH	gen=259 glyphs=4
2026-03-14T07:36:44.560111	099964a4	0	0	0.0000	CRASH	gen=259 glyphs=4
2026-03-14T07:36:44.560321	bbd1b56a	0	0	0.0000	CRASH	gen=259 glyphs=3
2026-03-14T07:36:44.560539	2ef58529	0	0	0.0000	CRASH	gen=259 glyphs=3
2026-03-14T07:36:44.560753	a80a8462	0	0	0.0000	CRASH	gen=259 glyphs=4
2026-03-14T07:36:44.560967	099964a4	0	0	0.0000	CRASH	gen=259 glyphs=4
2026-03-14T07:36:44.561191	099964a4	0	0	0.0000	CRASH	gen=259 glyphs=4
2026-03-14T07:36:44.561407	dcb1fb50	0	0	0.0000	CRASH	gen=259 glyphs=4
2026-03-14T07:36:44.561728	099964a4	0	0	0.0000	CRASH	gen=260 glyphs=4
2026-03-14T07:36:44.561946	099964a4	0	0	0.0000	CRASH	gen=260 glyphs=4
2026-03-14T07:36:44.562174	920dc18b	0	0	0.0000	CRASH	gen=260 glyphs=2
2026-03-14T07:36:44.562393	f0172817	0	0	0.0000	CRASH	gen=260 glyphs=2
2026-03-14T07:36:44.562613	099964a4	0	0	0.0000	CRASH	gen=260 glyphs=4
2026-03-14T07:36:44.562826	099964a4	0	0	0.0000	CRASH	gen=260 glyphs=4
2026-03-14T07:36:44.563038	ffaedd28	0	0	0.0000	CRASH	gen=260 glyphs=4
2026-03-14T07:36:44.563255	099964a4	0	0	0.0000	CRASH	gen=260 glyphs=4
2026-03-14T07:36:44.563467	099964a4	0	0	0.0000	CRASH	gen=260 glyphs=4
2026-03-14T07:36:44.563674	7e6a5498	0	0	0.0000	CRASH	gen=260 glyphs=5
2026-03-14T07:36:44.563982	099964a4	0	0	0.0000	CRASH	gen=261 glyphs=4
2026-03-14T07:36:44.564201	099964a4	0	0	0.0000	CRASH	gen=261 glyphs=4
2026-03-14T07:36:44.564415	ee130f3a	0	0	0.0000	CRASH	gen=261 glyphs=4
2026-03-14T07:36:44.564630	ff30496a	0	0	0.0000	CRASH	gen=261 glyphs=3
2026-03-14T07:36:44.564843	7a31de24	0	0	0.0000	CRASH	gen=261 glyphs=3
2026-03-14T07:36:44.565053	33119dbb	0	0	0.0000	CRASH	gen=261 glyphs=3
2026-03-14T07:36:44.565267	dcf10d5a	0	0	0.0000	CRASH	gen=261 glyphs=3
2026-03-14T07:36:44.565482	099964a4	0	0	0.0000	CRASH	gen=261 glyphs=4
2026-03-14T07:36:44.565704	cf93b656	0	0	0.0000	CRASH	gen=261 glyphs=3
2026-03-14T07:36:44.565919	3a734398	0	0	0.0000	CRASH	gen=261 glyphs=4
2026-03-14T07:36:44.566218	099964a4	0	0	0.0000	CRASH	gen=262 glyphs=4
2026-03-14T07:36:44.566436	099964a4	0	0	0.0000	CRASH	gen=262 glyphs=4
2026-03-14T07:36:44.566651	8da1f8d8	0	0	0.0000	CRASH	gen=262 glyphs=4
2026-03-14T07:36:44.566862	099964a4	0	0	0.0000	CRASH	gen=262 glyphs=4
2026-03-14T07:36:44.567072	099964a4	0	0	0.0000	CRASH	gen=262 glyphs=4
2026-03-14T07:36:44.567285	ff30496a	0	0	0.0000	CRASH	gen=262 glyphs=3
2026-03-14T07:36:44.567503	3ca14993	0	0	0.0000	CRASH	gen=262 glyphs=4
2026-03-14T07:36:44.567720	099964a4	0	0	0.0000	CRASH	gen=262 glyphs=4
2026-03-14T07:36:44.567935	099964a4	0	0	0.0000	CRASH	gen=262 glyphs=4
2026-03-14T07:36:44.568145	ad1d9ee5	0	0	0.0000	CRASH	gen=262 glyphs=4
2026-03-14T07:36:44.568453	099964a4	0	0	0.0000	CRASH	gen=263 glyphs=4
2026-03-14T07:36:44.568678	099964a4	0	0	0.0000	CRASH	gen=263 glyphs=4
2026-03-14T07:36:44.568898	099964a4	0	0	0.0000	CRASH	gen=263 glyphs=4
2026-03-14T07:36:44.569114	099964a4	0	0	0.0000	CRASH	gen=263 glyphs=4
