timestamp	program_hash	spirv_size	word_count	fitness	status	description
2026-03-14T07:36:45.152305	099964a4	0	0	0.0000	CRASH	gen=545 glyphs=4
2026-03-14T07:36:45.152499	8da1f8d8	0	0	0.0000	CRASH	gen=545 glyphs=4
2026-03-14T07:36:45.152698	099964a4	0	0	0.0000	CRASH	gen=545 glyphs=4
2026-03-14T07:36:45.152891	099964a4	0	0	0.0000	CRASH	gen=545 glyphs=4
2026-03-14T07:36:45.153083	cf93b656	0	0	0.0000	CRASH	gen=545 glyphs=3
2026-03-14T07:36:45.153276	7ede4765	0	0	0.0000	CRASH	gen=545 glyphs=2
2026-03-14T07:36:45.153468	03bf80dd	0	0	0.0000	CRASH	gen=545 glyphs=4
2026-03-14T07:36:45.153670	099964a4	0	0	0.0000	CRASH	gen=545 glyphs=4
2026-03-14T07:36:45.153869	099964a4	0	0	0.0000	CRASH	gen=545 glyphs=4
2026-03-14T07:36:45.154137	099964a4	0	0	0.0000	CRASH	gen=546 glyphs=4
2026-03-14T07:36:45.154331	099964a4	0	0	0.0000	CRASH	gen=546 glyphs=4
2026-03-14T07:36:45.154529	099964a4	0	0	0.0000	CRASH	gen=546 glyphs=4
2026-03-14T07:36:45.154721	c0af2d44	0	0	0.0000	CRASH	gen=546 glyphs=3
2026-03-14T07:36:45.154922	fccfc8a3	0	0	0.0000	CRASH	gen=546 glyphs=4
2026-03-14T07:36:45.155118	099964a4	0	0	0.0000	CRASH	gen=546 glyphs=4
2026-03-14T07:36:45.155312	099964a4	0	0	0.0000	CRASH	gen=546 glyphs=4
2026-03-14T07:36:45.155505	3a734398	0	0	0.0000	CRASH	gen=546 glyphs=4
2026-03-14T07:36:45.155702	099964a4	0	0	0.0000	CRASH	gen=546 glyphs=4
2026-03-14T07:36:45.155897	099964a4	0	0	0.0000	CRASH	gen=546 glyphs=4
2026-03-14T07:36:45.156157	099964a4	0	0	0.0000	CRASH	gen=547 glyphs=4
2026-03-14T07:36:45.156349	099964a4	0	0	0.0000	CRASH	gen=547 glyphs=4
2026-03-14T07:36:45.156548	099964a4	0	0	0.0000	CRASH	gen=547 glyphs=4
2026-03-14T07:36:45.156740	099964a4	0	0	0.0000	CRASH	gen=547 glyphs=4
2026-03-14T07:36:45.156949	3a734398	0	0	0.0000	CRASH	gen=547 glyphs=4
2026-03-14T07:36:45.157140	3ca14993	0	0	0.0000	CRASH	gen=547 glyphs=4
2026-03-14T07:36:45.157342	57e4808f	0	0	0.0000	CRASH	gen=547 glyphs=4
2026-03-14T07:36:45.157544	099964a4	0	0	0.0000	CRASH	gen=547 glyphs=4
2026-03-14T07:36:45.157739	099964a4	0	0	0.0000	CRASH	gen=547 glyphs=4
2026-03-14T07:36:45.157938	099964a4	0	0	0.0000	CRASH	gen=547 glyphs=4
2026-03-14T07:36:45.158242	099964a4	0	0	0.0000	CRASH	gen=548 glyphs=4
2026-03-14T07:36:45.158445	099964a4	0	0	0.0000	CRASH	gen=548 glyphs=4
2026-03-14T07:36:45.158644	c54965ca	0	0	0.0000	CRASH	gen=548 glyphs=4
2026-03-14T07:36:45.158840	80cef82b	0	0	0.0000	CRASH	gen=548 glyphs=4
2026-03-14T07:36:45.159040	e4bd3d66	0	0	0.0000	CRASH	gen=548 glyphs=2
2026-03-14T07:36:45.159232	cf93b656	0	0	0.0000	CRASH	gen=548 glyphs=3
2026-03-14T07:36:45.159424	099964a4	0	0	0.0000	CRASH	gen=548 glyphs=4
2026-03-14T07:36:45.159622	099964a4	0	0	0.0000	CRASH	gen=548 glyphs=4
2026-03-14T07:36:45.159818	099964a4	0	0	0.0000	CRASH	gen=548 glyphs=4
2026-03-14T07:36:45.160011	e8202a9b	0	0	0.0000	CRASH	gen=548 glyphs=4
2026-03-14T07:36:45.160302	099964a4	0	0	0.0000	CRASH	gen=549 glyphs=4
2026-03-14T07:36:45.160495	099964a4	0	0	0.0000	CRASH	gen=549 glyphs=4
2026-03-14T07:36:45.160695	b83ff13c	0	0	0.0000	CRASH	gen=549 glyphs=3
2026-03-14T07:36:45.160888	b685cb9d	0	0	0.0000	CRASH	gen=549 glyphs=5
2026-03-14T07:36:45.161085	79cd45c6	0	0	0.0000	CRASH	gen=549 glyphs=4
2026-03-14T07:36:45.161286	fbce400a	0	0	0.0000	CRASH	gen=549 glyphs=4
2026-03-14T07:36:45.161481	099964a4	0	0	0.0000	CRASH	gen=549 glyphs=4
2026-03-14T07:36:45.161674	e7bb87ee	0	0	0.0000	CRASH	gen=549 glyphs=4
2026-03-14T07:36:45.161869	55353282	0	0	0.0000	CRASH	gen=549 glyphs=2
2026-03-14T07:36:45.162062	09d3b2bd	0	0	0.0000	CRASH	gen=549 glyphs=4
2026-03-14T07:36:45.162342	099964a4	0	0	0.0000	CRASH	gen=550 glyphs=4
2026-03-14T07:36:45.162542	099964a4	0	0	0.0000	CRASH	gen=550 glyphs=4
2026-03-14T07:36:45.162737	3a734398	0	0	0.0000	CRASH	gen=550 glyphs=4
2026-03-14T07:36:45.162931	cf93b656	0	0	0.0000	CRASH	gen=550 glyphs=3
2026-03-14T07:36:45.163123	099964a4	0	0	0.0000	CRASH	gen=550 glyphs=4
2026-03-14T07:36:45.163317	099964a4	0	0	0.0000	CRASH	gen=550 glyphs=4
2026-03-14T07:36:45.163510	3a734398	0	0	0.0000	CRASH	gen=550 glyphs=4
2026-03-14T07:36:45.163707	cdac178d	0	0	0.0000	CRASH	gen=550 glyphs=3
2026-03-14T07:36:45.163903	099964a4	0	0	0.0000	CRASH	gen=550 glyphs=4
2026-03-14T07:36:45.164096	099964a4	0	0	0.0000	CRASH	gen=550 glyphs=4
2026-03-14T07:36:45.164378	099964a4	0	0	0.0000	CRASH	gen=551 glyphs=4
2026-03-14T07:36:45.164582	099964a4	0	0	0.0000	CRASH	gen=551 glyphs=4
2026-03-14T07:36:45.164777	ab412f3c	0	0	0.0000	CRASH	gen=551 glyphs=3
2026-03-14T07:36:45.164972	27a4057d	0	0	0.0000	CRASH	gen=551 glyphs=2
2026-03-14T07:36:45.165168	099964a4	0	0	0.0000	CRASH	gen=551 glyphs=4
2026-03-14T07:36:45.165362	099964a4	0	0	0.0000	CRASH	gen=551 glyphs=4
2026-03-14T07:36:45.165565	8da1f8d8	0	0	0.0000	CRASH	gen=551 glyphs=4
2026-03-14T07:36:45.165761	099964a4	0	0	0.0000	CRASH	gen=551 glyphs=4
2026-03-14T07:36:45.165956	0b57552f	0	0	0.0000	CRASH	gen=551 glyphs=4
2026-03-14T07:36:45.166153	099964a4	0	0	0.0000	CRASH	gen=551 glyphs=4
2026-03-14T07:36:45.166425	099964a4	0	0	0.0000	CRASH	gen=552 glyphs=4
2026-03-14T07:36:45.166631	099964a4	0	0	0.0000	CRASH	gen=552 glyphs=4
2026-03-14T07:36:45.166828	4af2f0dd	0	0	0.0000	CRASH	gen=552 glyphs=2
2026-03-14T07:36:45.167026	3ca14993	0	0	0.0000	CRASH	gen=552 glyphs=4
2026-03-14T07:36:45.167223	8da1f8d8	0	0	0.0000	CRASH	gen=552 glyphs=4
2026-03-14T07:36:45.167419	9c0964cf	0	0	0.0000	CRASH	gen=552 glyphs=3
2026-03-14T07:36:45.167620	73cc40ee	0	0	0.0000	CRASH	gen=552 glyphs=4
2026-03-14T07:36:45.167815	099964a4	0	0	0.0000	CRASH	gen=552 glyphs=4
2026-03-14T07:36:45.168011	099964a4	0	0	0.0000	CRASH	gen=552 glyphs=4
2026-03-14T07:36:45.168205	8bf004e9	0	0	0.0000	CRASH	gen=552 glyphs=4
2026-03-14T07:36:45.168481	099964a4	0	0	0.0000	CRASH	gen=553 glyphs=4
2026-03-14T07:36:45.168685	099964a4	0	0	0.0000	CRASH	gen=553 glyphs=4
2026-03-14T07:36:45.168884	099964a4	0	0	0.0000	CRASH	gen=553 glyphs=4
2026-03-14T07:36:45.169082	ff30496a	0	0	0.0000	CRASH	gen=553 glyphs=3
2026-03-14T07:36:45.169278	099964a4	0	0	0.0000	CRASH	gen=553 glyphs=4
2026-03-14T07:36:45.169472	ff30496a	0	0	0.0000	CRASH	gen=553 glyphs=3
2026-03-14T07:36:45.169672	ae0eef6d	0	0	0.0000	CRASH	gen=553 glyphs=4
2026-03-14T07:36:45.169876	bd8db848	0	0	0.0000	CRASH	gen=553 glyphs=4
2026-03-14T07:36:45.170071	099964a4	0	0	0.0000	CRASH	gen=553 glyphs=4
2026-03-14T07:36:45.170263	5c2f0505	0	0	0.0000	CRASH	gen=553 glyphs=3
2026-03-14T07:36:45.170541	099964a4	0	0	0.0000	CRASH	gen=554 glyphs=4
2026-03-14T07:36:45.170737	099964a4	0	0	0.0000	CRASH	gen=554 glyphs=4
2026-03-14T07:36:45.170939	099964a4	0	0	0.0000	CRASH	gen=554 glyphs=4
2026-03-14T07:36:45.171133	3ca14993	0	0	0.0000	CRASH	gen=554 glyphs=4
2026-03-14T07:36:45.171328	7e71b71c	0	0	0.0000	CRASH	gen=554 glyphs=5
2026-03-14T07:36:45.171525	3a734398	0	0	0.0000	CRASH	gen=554 glyphs=4
2026-03-14T07:36:45.171717	fd11005f	0	0	0.0000	CRASH	gen=554 glyphs=4
2026-03-14T07:36:45.171910	099964a4	0	0	0.0000	CRASH	gen=554 glyphs=4
2026-03-14T07:36:45.172113	099964a4	0	0	0.0000	CRASH	gen=554 glyphs=4
2026-03-14T07:36:45.172310	447b5216	0	0	0.0000	CRASH	gen=554 glyphs=3
2026-03-14T07:36:45.172585	099964a4	0	0	0.0000	CRASH	gen=555 glyphs=4
2026-03-14T07:36:45.172779	099964a4	0	0	0.0000	CRASH	gen=555 glyphs=4
2026-03-14T07:36:45.172973	099964a4	0	0	0.0000	CRASH	gen=555 glyphs=4
2026-03-14T07:36:45.173173	099964a4	0	0	0.0000	CRASH	gen=555 glyphs=4
2026-03-14T07:36:45.173369	099964a4	0	0	0.0000	CRASH	gen=555 glyphs=4
2026-03-14T07:36:45.173565	604d4102	0	0	0.0000	CRASH	gen=555 glyphs=4
2026-03-14T07:36:45.173762	099964a4	0	0	0.0000	CRASH	gen=555 glyphs=4
2026-03-14T07:36:45.173956	225c9830	0	0	0.0000	CRASH	gen=555 glyphs=4
2026-03-14T07:36:45.174153	099964a4	0	0	0.0000	CRASH	gen=555 glyphs=4
2026-03-14T07:36:45.174348	099964a4	0	0	0.0000	CRASH	gen=555 glyphs=4
2026-03-14T07:36:45.174635	099964a4	0	0	0.0000	CRASH	gen=556 glyphs=4
2026-03-14T07:36:45.174832	099964a4	0	0	0.0000	CRASH	gen=556 glyphs=4
2026-03-14T07:36:45.175027	099964a4	0	0	0.0000	CRASH	gen=556 glyphs=4
2026-03-14T07:36:45.175223	099964a4	0	0	0.0000	CRASH	gen=556 glyphs=4
2026-03-14T07:36:45.175426	099964a4	0	0	0.0000	CRASH	gen=556 glyphs=4
2026-03-14T07:36:45.175623	099964a4	0	0	0.0000	CRASH	gen=556 glyphs=4
2026-03-14T07:36:45.175818	3ca14993	0	0	0.0000	CRASH	gen=556 glyphs=4
2026-03-14T07:36:45.176014	099964a4	0	0	0.0000	CRASH	gen=556 glyphs=4
2026-03-14T07:36:45.176209	80cef82b	0	0	0.0000	CRASH	gen=556 glyphs=4
2026-03-14T07:36:45.176411	554f11e2	0	0	0.0000	CRASH	gen=556 glyphs=2
2026-03-14T07:36:45.176697	099964a4	0	0	0.0000	CRASH	gen=557 glyphs=4
2026-03-14T07:36:45.176890	099964a4	0	0	0.0000	CRASH	gen=557 glyphs=4
2026-03-14T07:36:45.177085	2b02daad	0	0	0.0000	CRASH	gen=557 glyphs=3
2026-03-14T07:36:45.177279	bb9841c7	0	0	0.0000	CRASH	gen=557 glyphs=4
2026-03-14T07:36:45.177475	56574960	0	0	0.0000	CRASH	gen=557 glyphs=2
2026-03-14T07:36:45.177675	099964a4	0	0	0.0000	CRASH	gen=557 glyphs=4
2026-03-14T07:36:45.177868	e55a8e74	0	0	0.0000	CRASH	gen=557 glyphs=3
2026-03-14T07:36:45.178061	099964a4	0	0	0.0000	CRASH	gen=557 glyphs=4
2026-03-14T07:36:45.178257	099964a4	0	0	0.0000	CRASH	gen=557 glyphs=4
2026-03-14T07:36:45.178451	3a734398	0	0	0.0000	CRASH	gen=557 glyphs=4
2026-03-14T07:36:45.179146	099964a4	0	0	0.0000	CRASH	gen=558 glyphs=4
2026-03-14T07:36:45.179343	099964a4	0	0	0.0000	CRASH	gen=558 glyphs=4
2026-03-14T07:36:45.179545	cb25cd44	0	0	0.0000	CRASH	gen=558 glyphs=5
2026-03-14T07:36:45.179743	099964a4	0	0	0.0000	CRASH	gen=558 glyphs=4
2026-03-14T07:36:45.179935	099964a4	0	0	0.0000	CRASH	gen=558 glyphs=4
2026-03-14T07:36:45.180130	099964a4	0	0	0.0000	CRASH	gen=558 glyphs=4
2026-03-14T07:36:45.180322	099964a4	0	0	0.0000	CRASH	gen=558 glyphs=4
2026-03-14T07:36:45.180520	9fe2af03	0	0	0.0000	CRASH	gen=558 glyphs=4
2026-03-14T07:36:45.180716	a1ac816b	0	0	0.0000	CRASH	gen=558 glyphs=3
2026-03-14T07:36:45.180907	ff30496a	0	0	0.0000	CRASH	gen=558 glyphs=3
2026-03-14T07:36:45.181187	099964a4	0	0	0.0000	CRASH	gen=559 glyphs=4
2026-03-14T07:36:45.181382	099964a4	0	0	0.0000	CRASH	gen=559 glyphs=4
2026-03-14T07:36:45.181580	099964a4	0	0	0.0000	CRASH	gen=559 glyphs=4
2026-03-14T07:36:45.181774	cf93b656	0	0	0.0000	CRASH	gen=559 glyphs=3
2026-03-14T07:36:45.181968	cf93b656	0	0	0.0000	CRASH	gen=559 glyphs=3
2026-03-14T07:36:45.182166	895b81fa	0	0	0.0000	CRASH	gen=559 glyphs=3
2026-03-14T07:36:45.182358	ff30496a	0	0	0.0000	CRASH	gen=559 glyphs=3
2026-03-14T07:36:45.182552	099964a4	0	0	0.0000	CRASH	gen=559 glyphs=4
2026-03-14T07:36:45.182748	57e0d0bc	0	0	0.0000	CRASH	gen=559 glyphs=4
2026-03-14T07:36:45.182944	cf93b656	0	0	0.0000	CRASH	gen=559 glyphs=3
2026-03-14T07:36:45.183216	099964a4	0	0	0.0000	CRASH	gen=560 glyphs=4
2026-03-14T07:36:45.183412	099964a4	0	0	0.0000	CRASH	gen=560 glyphs=4
2026-03-14T07:36:45.183609	099964a4	0	0	0.0000	CRASH	gen=560 glyphs=4
2026-03-14T07:36:45.183805	099964a4	0	0	0.0000	CRASH	gen=560 glyphs=4
2026-03-14T07:36:45.184001	099964a4	0	0	0.0000	CRASH	gen=560 glyphs=4
2026-03-14T07:36:45.184196	099964a4	0	0	0.0000	CRASH	gen=560 glyphs=4
2026-03-14T07:36:45.184394	cf93b656	0	0	0.0000	CRASH	gen=560 glyphs=3
2026-03-14T07:36:45.184594	099964a4	0	0	0.0000	CRASH	gen=560 glyphs=4
2026-03-14T07:36:45.184789	3ca14993	0	0	0.0000	CRASH	gen=560 glyphs=4
2026-03-14T07:36:45.184982	374bc52a	0	0	0.0000	CRASH	gen=560 glyphs=3
2026-03-14T07:36:45.185264	099964a4	0	0	0.0000	CRASH	gen=561 glyphs=4
2026-03-14T07:36:45.185462	099964a4	0	0	0.0000	CRASH	gen=561 glyphs=4
2026-03-14T07:36:45.185661	8da1f8d8	0	0	0.0000	CRASH	gen=561 glyphs=4
2026-03-14T07:36:45.185855	099964a4	0	0	0.0000	CRASH	gen=561 glyphs=4
2026-03-14T07:36:45.186047	f937c688	0	0	0.0000	CRASH	gen=561 glyphs=3
2026-03-14T07:36:45.186239	7ede4765	0	0	0.0000	CRASH	gen=561 glyphs=2
2026-03-14T07:36:45.186434	08eb1a30	0	0	0.0000	CRASH	gen=561 glyphs=4
2026-03-14T07:36:45.186629	099964a4	0	0	0.0000	CRASH	gen=561 glyphs=4
2026-03-14T07:36:45.186821	099964a4	0	0	0.0000	CRASH	gen=561 glyphs=4
2026-03-14T07:36:45.187010	099964a4	0	0	0.0000	CRASH	gen=561 glyphs=4
2026-03-14T07:36:45.187273	099964a4	0	0	0.0000	CRASH	gen=562 glyphs=4
2026-03-14T07:36:45.187474	099964a4	0	0	0.0000	CRASH	gen=562 glyphs=4
2026-03-14T07:36:45.187672	099964a4	0	0	0.0000	CRASH	gen=562 glyphs=4
2026-03-14T07:36:45.187864	4e384286	0	0	0.0000	CRASH	gen=562 glyphs=3
2026-03-14T07:36:45.188058	e7d84c3a	0	0	0.0000	CRASH	gen=562 glyphs=4
2026-03-14T07:36:45.188253	3ca14993	0	0	0.0000	CRASH	gen=562 glyphs=4
2026-03-14T07:36:45.188447	ff30496a	0	0	0.0000	CRASH	gen=562 glyphs=3
2026-03-14T07:36:45.188646	099964a4	0	0	0.0000	CRASH	gen=562 glyphs=4
2026-03-14T07:36:45.188840	099964a4	0	0	0.0000	CRASH	gen=562 glyphs=4
2026-03-14T07:36:45.189033	099964a4	0	0	0.0000	CRASH	gen=562 glyphs=4
2026-03-14T07:36:45.189303	099964a4	0	0	0.0000	CRASH	gen=563 glyphs=4
2026-03-14T07:36:45.189498	099964a4	0	0	0.0000	CRASH	gen=563 glyphs=4
2026-03-14T07:36:45.189699	a3a81f24	0	0	0.0000	CRASH	gen=563 glyphs=4
2026-03-14T07:36:45.189894	ecc87970	0	0	0.0000	CRASH	gen=563 glyphs=4
2026-03-14T07:36:45.190092	81856ea5	0	0	0.0000	CRASH	gen=563 glyphs=4
2026-03-14T07:36:45.190283	3a734398	0	0	0.0000	CRASH	gen=563 glyphs=4
2026-03-14T07:36:45.190476	099964a4	0	0	0.0000	CRASH	gen=563 glyphs=4
2026-03-14T07:36:45.190674	3ca14993	0	0	0.0000	CRASH	gen=563 glyphs=4
2026-03-14T07:36:45.190872	099964a4	0	0	0.0000	CRASH	gen=563 glyphs=4
2026-03-14T07:36:45.191067	099964a4	0	0	0.0000	CRASH	gen=563 glyphs=4
2026-03-14T07:36:45.191349	099964a4	0	0	0.0000	CRASH	gen=564 glyphs=4
2026-03-14T07:36:45.191545	099964a4	0	0	0.0000	CRASH	gen=564 glyphs=4
2026-03-14T07:36:45.191741	099964a4	0	0	0.0000	CRASH	gen=564 glyphs=4
2026-03-14T07:36:45.191935	099964a4	0	0	0.0000	CRASH	gen=564 glyphs=4
2026-03-14T07:36:45.192126	099964a4	0	0	0.0000	CRASH	gen=564 glyphs=4
2026-03-14T07:36:45.192318	099964a4	0	0	0.0000	CRASH	gen=564 glyphs=4
2026-03-14T07:36:45.192509	d0d84f8c	0	0	0.0000	CRASH	gen=564 glyphs=4
2026-03-14T07:36:45.192705	099964a4	0	0	0.0000	CRASH	gen=564 glyphs=4
2026-03-14T07:36:45.192900	f9fc2f4c	0	0	0.0000	CRASH	gen=564 glyphs=4
2026-03-14T07:36:45.193092	099964a4	0	0	0.0000	CRASH	gen=564 glyphs=4
2026-03-14T07:36:45.193376	099964a4	0	0	0.0000	CRASH	gen=565 glyphs=4
2026-03-14T07:36:45.193572	099964a4	0	0	0.0000	CRASH	gen=565 glyphs=4
2026-03-14T07:36:45.193765	2c109f5a	0	0	0.0000	CRASH	gen=565 glyphs=3
2026-03-14T07:36:45.193962	099964a4	0	0	0.0000	CRASH	gen=565 glyphs=4
2026-03-14T07:36:45.194155	099964a4	0	0	0.0000	CRASH	gen=565 glyphs=4
2026-03-14T07:36:45.194346	099964a4	0	0	0.0000	CRASH	gen=565 glyphs=4
2026-03-14T07:36:45.194540	099964a4	0	0	0.0000	CRASH	gen=565 glyphs=4
2026-03-14T07:36:45.194733	b24c6b7f	0	0	0.0000	CRASH	gen=565 glyphs=4
2026-03-14T07:36:45.194934	099964a4	0	0	0.0000	CRASH	gen=565 glyphs=4
2026-03-14T07:36:45.195129	dcb1fb50	0	0	0.0000	CRASH	gen=565 glyphs=4
2026-03-14T07:36:45.195408	099964a4	0	0	0.0000	CRASH	gen=566 glyphs=4
2026-03-14T07:36:45.195609	099964a4	0	0	0.0000	CRASH	gen=566 glyphs=4
2026-03-14T07:36:45.195804	ac699542	0	0	0.0000	CRASH	gen=566 glyphs=4
2026-03-14T07:36:45.196003	099964a4	0	0	0.0000	CRASH	gen=566 glyphs=4
2026-03-14T07:36:45.196198	099964a4	0	0	0.0000	CRASH	gen=566 glyphs=4
2026-03-14T07:36:45.196391	dcb1fb50	0	0	0.0000	CRASH	gen=566 glyphs=4
2026-03-14T07:36:45.196590	7a1f2c12	0	0	0.0000	CRASH	gen=566 glyphs=4
2026-03-14T07:36:45.196785	7c6a3ee3	0	0	0.0000	CRASH	gen=566 glyphs=4
2026-03-14T07:36:45.196982	099964a4	0	0	0.0000	CRASH	gen=566 glyphs=4
2026-03-14T07:36:45.197174	ff30496a	0	0	0.0000	CRASH	gen=566 glyphs=3
2026-03-14T07:36:45.197454	099964a4	0	0	0.0000	CRASH	gen=567 glyphs=4
2026-03-14T07:36:45.197651	099964a4	0	0	0.0000	CRASH	gen=567 glyphs=4
2026-03-14T07:36:45.197844	099964a4	0	0	0.0000	CRASH	gen=567 glyphs=4
2026-03-14T07:36:45.198040	099964a4	0	0	0.0000	CRASH	gen=567 glyphs=4
2026-03-14T07:36:45.198233	dcb1fb50	0	0	0.0000	CRASH	gen=567 glyphs=4
2026-03-14T07:36:45.198426	7ede4765	0	0	0.0000	CRASH	gen=567 glyphs=2
2026-03-14T07:36:45.198621	099964a4	0	0	0.0000	CRASH	gen=567 glyphs=4
2026-03-14T07:36:45.198812	cf93b656	0	0	0.0000	CRASH	gen=567 glyphs=3
2026-03-14T07:36:45.199005	55fdbf89	0	0	0.0000	CRASH	gen=567 glyphs=4
2026-03-14T07:36:45.199205	099964a4	0	0	0.0000	CRASH	gen=567 glyphs=4
2026-03-14T07:36:45.199474	099964a4	0	0	0.0000	CRASH	gen=568 glyphs=4
2026-03-14T07:36:45.199672	099964a4	0	0	0.0000	CRASH	gen=568 glyphs=4
2026-03-14T07:36:45.199868	099964a4	0	0	0.0000	CRASH	gen=568 glyphs=4
2026-03-14T07:36:45.200059	099964a4	0	0	0.0000	CRASH	gen=568 glyphs=4
2026-03-14T07:36:45.200255	3ca14993	0	0	0.0000	CRASH	gen=568 glyphs=4
2026-03-14T07:36:45.200449	a64dc1cd	0	0	0.0000	CRASH	gen=568 glyphs=4
2026-03-14T07:36:45.200648	c3af4614	0	0	0.0000	CRASH	gen=568 glyphs=4
2026-03-14T07:36:45.200843	80cef82b	0	0	0.0000	CRASH	gen=568 glyphs=4
2026-03-14T07:36:45.201039	ff30496a	0	0	0.0000	CRASH	gen=568 glyphs=3
2026-03-14T07:36:45.201239	099964a4	0	0	0.0000	CRASH	gen=568 glyphs=4
2026-03-14T07:36:45.201507	099964a4	0	0	0.0000	CRASH	gen=569 glyphs=4
2026-03-14T07:36:45.201702	099964a4	0	0	0.0000	CRASH	gen=569 glyphs=4
2026-03-14T07:36:45.201898	099964a4	0	0	0.0000	CRASH	gen=569 glyphs=4
2026-03-14T07:36:45.202090	099964a4	0	0	0.0000	CRASH	gen=569 glyphs=4
2026-03-14T07:36:45.202286	099964a4	0	0	0.0000	CRASH	gen=569 glyphs=4
2026-03-14T07:36:45.202476	099964a4	0	0	0.0000	CRASH	gen=569 glyphs=4
2026-03-14T07:36:45.202670	099964a4	0	0	0.0000	CRASH	gen=569 glyphs=4
2026-03-14T07:36:45.202861	099964a4	0	0	0.0000	CRASH	gen=569 glyphs=4
2026-03-14T07:36:45.203056	a959ca18	0	0	0.0000	CRASH	gen=569 glyphs=4
2026-03-14T07:36:45.203249	099964a4	0	0	0.0000	CRASH	gen=569 glyphs=4
2026-03-14T07:36:45.203537	099964a4	0	0	0.0000	CRASH	gen=570 glyphs=4
2026-03-14T07:36:45.203731	099964a4	0	0	0.0000	CRASH	gen=570 glyphs=4
2026-03-14T07:36:45.203925	3ff78aff	0	0	0.0000	CRASH	gen=570 glyphs=3
2026-03-14T07:36:45.204118	0384ea74	0	0	0.0000	CRASH	gen=570 glyphs=4
2026-03-14T07:36:45.204313	099964a4	0	0	0.0000	CRASH	gen=570 glyphs=4
2026-03-14T07:36:45.204508	3ca14993	0	0	0.0000	CRASH	gen=570 glyphs=4
2026-03-14T07:36:45.204704	099964a4	0	0	0.0000	CRASH	gen=570 glyphs=4
2026-03-14T07:36:45.204898	3df91323	0	0	0.0000	CRASH	gen=570 glyphs=4
2026-03-14T07:36:45.205093	dcb1fb50	0	0	0.0000	CRASH	gen=570 glyphs=4
2026-03-14T07:36:45.205287	85e37040	0	0	0.0000	CRASH	gen=570 glyphs=4
2026-03-14T07:36:45.205568	099964a4	0	0	0.0000	CRASH	gen=571 glyphs=4
2026-03-14T07:36:45.205765	099964a4	0	0	0.0000	CRASH	gen=571 glyphs=4
2026-03-14T07:36:45.205960	cdc6b223	0	0	0.0000	CRASH	gen=571 glyphs=3
2026-03-14T07:36:45.206151	099964a4	0	0	0.0000	CRASH	gen=571 glyphs=4
2026-03-14T07:36:45.206344	3a734398	0	0	0.0000	CRASH	gen=571 glyphs=4
2026-03-14T07:36:45.206542	099964a4	0	0	0.0000	CRASH	gen=571 glyphs=4
2026-03-14T07:36:45.206733	099964a4	0	0	0.0000	CRASH	gen=571 glyphs=4
2026-03-14T07:36:45.206922	66856a98	0	0	0.0000	CRASH	gen=571 glyphs=4
2026-03-14T07:36:45.207114	26f88f39	0	0	0.0000	CRASH	gen=571 glyphs=4
2026-03-14T07:36:45.207306	099964a4	0	0	0.0000	CRASH	gen=571 glyphs=4
2026-03-14T07:36:45.207586	099964a4	0	0	0.0000	CRASH	gen=572 glyphs=4
2026-03-14T07:36:45.207779	099964a4	0	0	0.0000	CRASH	gen=572 glyphs=4
2026-03-14T07:36:45.207974	de672966	0	0	0.0000	CRASH	gen=572 glyphs=3
2026-03-14T07:36:45.208170	ff30496a	0	0	0.0000	CRASH	gen=572 glyphs=3
2026-03-14T07:36:45.208368	099964a4	0	0	0.0000	CRASH	gen=572 glyphs=4
2026-03-14T07:36:45.208566	7df9badf	0	0	0.0000	CRASH	gen=572 glyphs=4
2026-03-14T07:36:45.208762	099964a4	0	0	0.0000	CRASH	gen=572 glyphs=4
2026-03-14T07:36:45.208957	099964a4	0	0	0.0000	CRASH	gen=572 glyphs=4
2026-03-14T07:36:45.209151	c430d350	0	0	0.0000	CRASH	gen=572 glyphs=3
2026-03-14T07:36:45.209343	6bdae044	0	0	0.0000	CRASH	gen=572 glyphs=4
2026-03-14T07:36:45.209620	099964a4	0	0	0.0000	CRASH	gen=573 glyphs=4
2026-03-14T07:36:45.209818	099964a4	0	0	0.0000	CRASH	gen=573 glyphs=4
2026-03-14T07:36:45.210010	099964a4	0	0	0.0000	CRASH	gen=573 glyphs=4
2026-03-14T07:36:45.210205	099964a4	0	0	0.0000	CRASH	gen=573 glyphs=4
2026-03-14T07:36:45.210396	099964a4	0	0	0.0000	CRASH	gen=573 glyphs=4
2026-03-14T07:36:45.210589	099964a4	0	0	0.0000	CRASH	gen=573 glyphs=4
2026-03-14T07:36:45.210784	3a734398	0	0	0.0000	CRASH	gen=573 glyphs=4
2026-03-14T07:36:45.210975	1a8d8992	0	0	0.0000	CRASH	gen=573 glyphs=4
2026-03-14T07:36:45.211168	1d8d0a12	0	0	0.0000	CRASH	gen=573 glyphs=4
2026-03-14T07:36:45.211361	099964a4	0	0	0.0000	CRASH	gen=573 glyphs=4
2026-03-14T07:36:45.211646	099964a4	0	0	0.0000	CRASH	gen=574 glyphs=4
2026-03-14T07:36:45.211846	099964a4	0	0	0.0000	CRASH	gen=574 glyphs=4
2026-03-14T07:36:45.212041	ff30496a	0	0	0.0000	CRASH	gen=574 glyphs=3
2026-03-14T07:36:45.212237	21180139	0	0	0.0000	CRASH	gen=574 glyphs=4
2026-03-14T07:36:45.212433	ff30496a	0	0	0.0000	CRASH	gen=574 glyphs=3
2026-03-14T07:36:45.212629	b7e228ee	0	0	0.0000	CRASH	gen=574 glyphs=4
2026-03-14T07:36:45.212827	099964a4	0	0	0.0000	CRASH	gen=574 glyphs=4
2026-03-14T07:36:45.213017	099964a4	0	0	0.0000	CRASH	gen=574 glyphs=4
2026-03-14T07:36:45.213211	7ede4765	0	0	0.0000	CRASH	gen=574 glyphs=2
2026-03-14T07:36:45.213402	8edd69cb	0	0	0.0000	CRASH	gen=574 glyphs=3
2026-03-14T07:36:45.213676	099964a4	0	0	0.0000	CRASH	gen=575 glyphs=4
2026-03-14T07:36:45.213875	099964a4	0	0	0.0000	CRASH	gen=575 glyphs=4
2026-03-14T07:36:45.214072	099964a4	0	0	0.0000	CRASH	gen=575 glyphs=4
2026-03-14T07:36:45.214266	3f564cf6	0	0	0.0000	CRASH	gen=575 glyphs=5
2026-03-14T07:36:45.214461	099964a4	0	0	0.0000	CRASH	gen=575 glyphs=4
2026-03-14T07:36:45.214658	c86eb80c	0	0	0.0000	CRASH	gen=575 glyphs=4
2026-03-14T07:36:45.214853	099964a4	0	0	0.0000	CRASH	gen=575 glyphs=4
2026-03-14T07:36:45.215051	c3496f85	0	0	0.0000	CRASH	gen=575 glyphs=4
2026-03-14T07:36:45.215247	cf93b656	0	0	0.0000	CRASH	gen=575 glyphs=3
2026-03-14T07:36:45.215438	8548bf2c	0	0	0.0000	CRASH	gen=575 glyphs=2
2026-03-14T07:36:45.215702	099964a4	0	0	0.0000	CRASH	gen=576 glyphs=4
2026-03-14T07:36:45.215898	099964a4	0	0	0.0000	CRASH	gen=576 glyphs=4
2026-03-14T07:36:45.216094	e545d34d	0	0	0.0000	CRASH	gen=576 glyphs=4
2026-03-14T07:36:45.216286	3c63e44f	0	0	0.0000	CRASH	gen=576 glyphs=4
