timestamp	program_hash	spirv_size	word_count	fitness	status	description
2026-03-14T03:27:56.114033	7ca87b42	116	29	1.0000	DISCARD	gen=680 glyphs=4
2026-03-14T03:27:56.457713	b57e7176	120	30	1.0000	DISCARD	gen=724 glyphs=4
2026-03-14T03:27:58.933592	5a06ca32	120	30	1.0000	DISCARD	gen=680 glyphs=4
2026-03-14T03:27:59.190904	1e5f0e21	116	29	1.0000	DISCARD	gen=724 glyphs=4
2026-03-14T03:28:01.615041	55d6c151	120	30	1.0000	DISCARD	gen=680 glyphs=4
2026-03-14T03:28:01.880424	12a770d0	120	30	1.0000	DISCARD	gen=724 glyphs=4
2026-03-14T03:28:04.331426	fdb5d108	120	30	1.0000	DISCARD	gen=680 glyphs=4
2026-03-14T03:28:04.589481	b3057c42	124	31	0.9500	DISCARD	gen=724 glyphs=4
2026-03-14T03:28:07.022618	5a06ca32	120	30	1.0000	DISCARD	gen=680 glyphs=4
2026-03-14T03:28:07.286823	1b7159f2	116	29	1.0000	DISCARD	gen=724 glyphs=4
2026-03-14T03:28:09.704045	e7eca763	116	29	1.0000	DISCARD	gen=680 glyphs=4
2026-03-14T03:28:09.984547	e2cd28ea	120	30	1.0000	DISCARD	gen=724 glyphs=4
2026-03-14T03:28:12.379760	5a06ca32	120	30	1.0000	DISCARD	gen=680 glyphs=4
2026-03-14T03:28:12.657253	81d36393	120	30	1.0000	DISCARD	gen=724 glyphs=4
2026-03-14T03:28:15.048260	37f4017b	116	29	1.0000	DISCARD	gen=681 glyphs=4
2026-03-14T03:28:15.313459	c9f9c437	116	29	1.0000	DISCARD	gen=724 glyphs=4
2026-03-14T03:28:17.724773	bfdf7cad	120	30	1.0000	DISCARD	gen=681 glyphs=4
2026-03-14T03:28:17.999758	19355583	120	30	1.0000	DISCARD	gen=725 glyphs=4
2026-03-14T03:28:20.379603	5a06ca32	120	30	1.0000	DISCARD	gen=681 glyphs=4
2026-03-14T03:28:20.647337	8aef8872	116	29	1.0000	DISCARD	gen=725 glyphs=4
2026-03-14T03:28:23.049621	45a38fe1	120	30	1.0000	DISCARD	gen=681 glyphs=4
2026-03-14T03:28:23.314986	ffa1ffde	116	29	1.0000	DISCARD	gen=725 glyphs=4
2026-03-14T03:28:25.712948	12b38c2d	116	29	1.0000	DISCARD	gen=681 glyphs=4
2026-03-14T03:28:25.987628	67cb81be	120	30	1.0000	DISCARD	gen=725 glyphs=4
2026-03-14T03:28:28.466502	cfa98ff0	120	30	1.0000	DISCARD	gen=681 glyphs=4
2026-03-14T03:28:28.737532	93e359e8	116	29	1.0000	DISCARD	gen=725 glyphs=4
2026-03-14T03:28:31.186240	37f4017b	116	29	1.0000	DISCARD	gen=681 glyphs=4
2026-03-14T03:28:31.440442	e8c7f6cf	120	30	1.0000	DISCARD	gen=725 glyphs=4
2026-03-14T03:28:33.883674	37f4017b	116	29	1.0000	DISCARD	gen=681 glyphs=4
2026-03-14T03:28:34.156512	1cccb5c8	116	29	1.0000	DISCARD	gen=725 glyphs=4
2026-03-14T03:28:36.579566	37f4017b	116	29	1.0000	DISCARD	gen=681 glyphs=4
2026-03-14T03:28:36.845489	72c84f87	120	30	1.0000	DISCARD	gen=725 glyphs=4
2026-03-14T03:28:39.239981	be210caf	116	29	1.0000	DISCARD	gen=681 glyphs=4
2026-03-14T03:28:39.525489	9e34ede0	116	29	1.0000	DISCARD	gen=725 glyphs=4
2026-03-14T03:28:41.940599	37f4017b	116	29	1.0000	DISCARD	gen=682 glyphs=4
2026-03-14T03:28:42.205940	19355583	120	30	1.0000	DISCARD	gen=725 glyphs=4
2026-03-14T03:28:44.630543	bfdf7cad	120	30	1.0000	DISCARD	gen=682 glyphs=4
2026-03-14T03:28:44.891061	19355583	120	30	1.0000	DISCARD	gen=726 glyphs=4
2026-03-14T03:28:47.329998	37f4017b	116	29	1.0000	DISCARD	gen=682 glyphs=4
2026-03-14T03:28:47.597922	8aef8872	116	29	1.0000	DISCARD	gen=726 glyphs=4
2026-03-14T03:28:50.009282	12b38c2d	116	29	1.0000	DISCARD	gen=682 glyphs=4
2026-03-14T03:28:50.276956	0eaedb57	116	29	1.0000	DISCARD	gen=726 glyphs=4
2026-03-14T03:28:52.719560	37f4017b	116	29	1.0000	DISCARD	gen=682 glyphs=4
2026-03-14T03:28:52.980753	0eaedb57	116	29	1.0000	DISCARD	gen=726 glyphs=4
2026-03-14T03:28:55.387101	39c8694d	120	30	1.0000	DISCARD	gen=682 glyphs=4
2026-03-14T03:28:55.662207	19355583	120	30	1.0000	DISCARD	gen=726 glyphs=4
2026-03-14T03:28:58.090019	5b9807ac	120	30	1.0000	DISCARD	gen=682 glyphs=4
2026-03-14T03:28:58.349037	c0e957ff	116	29	1.0000	DISCARD	gen=726 glyphs=4
2026-03-14T03:29:00.889946	4c9b0dd4	120	30	1.0000	DISCARD	gen=682 glyphs=4
2026-03-14T03:29:01.169811	a78f9454	120	30	1.0000	DISCARD	gen=726 glyphs=4
2026-03-14T03:29:03.602201	5a06ca32	120	30	1.0000	DISCARD	gen=682 glyphs=4
2026-03-14T03:29:03.879430	e2cd28ea	120	30	1.0000	DISCARD	gen=726 glyphs=4
2026-03-14T03:29:06.283545	37f4017b	116	29	1.0000	DISCARD	gen=682 glyphs=4
2026-03-14T03:29:06.564475	ebadb559	116	29	1.0000	DISCARD	gen=726 glyphs=4
2026-03-14T03:29:09.001345	37f4017b	116	29	1.0000	DISCARD	gen=683 glyphs=4
2026-03-14T03:29:09.283197	875e0f8a	116	29	1.0000	DISCARD	gen=726 glyphs=4
2026-03-14T03:29:11.725661	bfdf7cad	120	30	1.0000	DISCARD	gen=683 glyphs=4
2026-03-14T03:29:11.992590	19355583	120	30	1.0000	DISCARD	gen=727 glyphs=4
2026-03-14T03:29:14.421052	5a06ca32	120	30	1.0000	DISCARD	gen=683 glyphs=4
2026-03-14T03:29:14.683503	8aef8872	116	29	1.0000	DISCARD	gen=727 glyphs=4
2026-03-14T03:29:17.095789	5b9807ac	120	30	1.0000	DISCARD	gen=683 glyphs=4
2026-03-14T03:29:17.372293	eca7ab6c	116	29	1.0000	DISCARD	gen=727 glyphs=4
2026-03-14T03:29:19.780810	b219a352	116	29	1.0000	DISCARD	gen=683 glyphs=4
2026-03-14T03:29:20.046923	dce36262	116	29	0.9500	DISCARD	gen=727 glyphs=4
2026-03-14T03:29:22.465964	7ca87b42	116	29	1.0000	DISCARD	gen=683 glyphs=4
2026-03-14T03:29:22.727560	8aef8872	116	29	1.0000	DISCARD	gen=727 glyphs=4
2026-03-14T03:29:25.162538	5a06ca32	120	30	1.0000	DISCARD	gen=683 glyphs=4
2026-03-14T03:29:25.429712	9f567b2a	116	29	1.0000	DISCARD	gen=727 glyphs=4
2026-03-14T03:29:27.848777	37f4017b	116	29	1.0000	DISCARD	gen=683 glyphs=4
2026-03-14T03:29:28.120621	0eaedb57	116	29	1.0000	DISCARD	gen=727 glyphs=4
2026-03-14T03:29:30.515796	5a06ca32	120	30	1.0000	DISCARD	gen=683 glyphs=4
2026-03-14T03:29:30.782299	050862ad	120	30	1.0000	DISCARD	gen=727 glyphs=4
2026-03-14T03:29:33.324283	37f4017b	116	29	1.0000	DISCARD	gen=683 glyphs=4
2026-03-14T03:29:33.592002	0eaedb57	116	29	1.0000	DISCARD	gen=727 glyphs=4
2026-03-14T03:29:36.030862	37f4017b	116	29	1.0000	DISCARD	gen=684 glyphs=4
2026-03-14T03:29:36.314330	8aef8872	116	29	1.0000	DISCARD	gen=727 glyphs=4
2026-03-14T03:29:38.761660	bfdf7cad	120	30	1.0000	DISCARD	gen=684 glyphs=4
2026-03-14T03:29:39.032540	19355583	120	30	1.0000	DISCARD	gen=728 glyphs=4
2026-03-14T03:29:41.493560	fdb5d108	120	30	1.0000	DISCARD	gen=684 glyphs=4
2026-03-14T03:29:41.762891	8aef8872	116	29	1.0000	DISCARD	gen=728 glyphs=4
2026-03-14T03:29:44.195391	55d6c151	120	30	1.0000	DISCARD	gen=684 glyphs=4
2026-03-14T03:29:44.464045	0a422fd4	116	29	1.0000	DISCARD	gen=728 glyphs=4
2026-03-14T03:29:46.891400	68585e69	116	29	1.0000	DISCARD	gen=684 glyphs=4
2026-03-14T03:29:47.158820	0eaedb57	116	29	1.0000	DISCARD	gen=728 glyphs=4
2026-03-14T03:29:49.549413	1d34459a	116	29	1.0000	DISCARD	gen=684 glyphs=4
2026-03-14T03:29:49.816085	781187d7	116	29	1.0000	DISCARD	gen=728 glyphs=4
2026-03-14T03:29:52.260356	9807687e	120	30	1.0000	DISCARD	gen=684 glyphs=4
2026-03-14T03:29:52.523192	8aef8872	116	29	1.0000	DISCARD	gen=728 glyphs=4
2026-03-14T03:29:54.943481	37f4017b	116	29	1.0000	DISCARD	gen=684 glyphs=4
2026-03-14T03:29:55.220758	050862ad	120	30	1.0000	DISCARD	gen=728 glyphs=4
2026-03-14T03:29:57.636983	37f4017b	116	29	1.0000	DISCARD	gen=684 glyphs=4
2026-03-14T03:29:57.911225	59ba2cb3	116	29	1.0000	DISCARD	gen=728 glyphs=4
2026-03-14T03:30:00.335876	55d6c151	120	30	1.0000	DISCARD	gen=684 glyphs=4
2026-03-14T03:30:00.594640	19355583	120	30	1.0000	DISCARD	gen=728 glyphs=4
2026-03-14T03:30:03.020484	37f4017b	116	29	1.0000	DISCARD	gen=685 glyphs=4
2026-03-14T03:30:03.286756	937f12ad	116	29	1.0000	DISCARD	gen=728 glyphs=4
2026-03-14T03:30:05.794021	bfdf7cad	120	30	1.0000	DISCARD	gen=685 glyphs=4
2026-03-14T03:30:06.062112	19355583	120	30	1.0000	DISCARD	gen=729 glyphs=4
2026-03-14T03:30:08.476274	5a06ca32	120	30	1.0000	DISCARD	gen=685 glyphs=4
2026-03-14T03:30:08.747729	8aef8872	116	29	1.0000	DISCARD	gen=729 glyphs=4
2026-03-14T03:30:11.159335	edd494aa	116	29	1.0000	DISCARD	gen=685 glyphs=4
2026-03-14T03:30:11.426384	feba1fc1	116	29	1.0000	DISCARD	gen=729 glyphs=4
2026-03-14T03:30:13.843395	fdb5d108	120	30	1.0000	DISCARD	gen=685 glyphs=4
2026-03-14T03:30:14.112122	d7c8681b	120	30	1.0000	DISCARD	gen=729 glyphs=4
2026-03-14T03:30:16.560171	314818d8	116	29	1.0000	DISCARD	gen=685 glyphs=4
2026-03-14T03:30:16.827161	83a5af43	116	29	1.0000	DISCARD	gen=729 glyphs=4
2026-03-14T03:30:19.223181	12b38c2d	116	29	1.0000	DISCARD	gen=685 glyphs=4
2026-03-14T03:30:19.489290	1e5f0e21	116	29	1.0000	DISCARD	gen=729 glyphs=4
2026-03-14T03:30:21.930576	71e2ba66	116	29	1.0000	DISCARD	gen=685 glyphs=4
2026-03-14T03:30:22.199092	050862ad	120	30	1.0000	DISCARD	gen=729 glyphs=4
2026-03-14T03:30:24.614960	71e2ba66	116	29	1.0000	DISCARD	gen=685 glyphs=4
2026-03-14T03:30:24.887680	0eaedb57	116	29	1.0000	DISCARD	gen=729 glyphs=4
2026-03-14T03:30:27.294588	12b38c2d	116	29	1.0000	DISCARD	gen=685 glyphs=4
2026-03-14T03:30:27.571104	4b5d0c8d	116	29	1.0000	DISCARD	gen=729 glyphs=4
2026-03-14T03:30:29.978392	37f4017b	116	29	1.0000	DISCARD	gen=686 glyphs=4
2026-03-14T03:30:30.251761	1e5f0e21	116	29	1.0000	DISCARD	gen=729 glyphs=4
2026-03-14T03:30:32.681463	bfdf7cad	120	30	1.0000	DISCARD	gen=686 glyphs=4
2026-03-14T03:30:32.951012	19355583	120	30	1.0000	DISCARD	gen=730 glyphs=4
2026-03-14T03:30:35.356816	5a06ca32	120	30	1.0000	DISCARD	gen=686 glyphs=4
2026-03-14T03:30:35.635145	8aef8872	116	29	1.0000	DISCARD	gen=730 glyphs=4
2026-03-14T03:30:38.076336	2701cb73	116	29	1.0000	DISCARD	gen=686 glyphs=4
2026-03-14T03:30:38.334423	e8c7f6cf	120	30	1.0000	DISCARD	gen=730 glyphs=4
2026-03-14T03:30:40.747685	67ce8046	116	29	1.0000	DISCARD	gen=686 glyphs=4
2026-03-14T03:30:41.035082	4023dca0	116	29	1.0000	DISCARD	gen=730 glyphs=4
2026-03-14T03:30:43.461701	37f4017b	116	29	1.0000	DISCARD	gen=686 glyphs=4
2026-03-14T03:30:43.724954	9e34ede0	116	29	1.0000	DISCARD	gen=730 glyphs=4
2026-03-14T03:30:46.135164	0783826a	116	29	1.0000	DISCARD	gen=686 glyphs=4
2026-03-14T03:30:46.390971	6863327b	116	29	1.0000	DISCARD	gen=730 glyphs=4
2026-03-14T03:30:48.782007	37f4017b	116	29	1.0000	DISCARD	gen=686 glyphs=4
2026-03-14T03:30:49.036603	b57e7176	120	30	1.0000	DISCARD	gen=730 glyphs=4
2026-03-14T03:30:51.429966	e4471f48	116	29	1.0000	DISCARD	gen=686 glyphs=4
2026-03-14T03:30:51.690620	875e0f8a	116	29	1.0000	DISCARD	gen=730 glyphs=4
2026-03-14T03:30:54.101457	5a06ca32	120	30	1.0000	DISCARD	gen=686 glyphs=4
2026-03-14T03:30:54.361536	eca7ab6c	116	29	1.0000	DISCARD	gen=730 glyphs=4
2026-03-14T03:30:56.860864	37f4017b	116	29	1.0000	DISCARD	gen=687 glyphs=4
2026-03-14T03:30:57.149304	a78f9454	120	30	1.0000	DISCARD	gen=730 glyphs=4
2026-03-14T03:30:59.668193	bfdf7cad	120	30	1.0000	DISCARD	gen=687 glyphs=4
2026-03-14T03:30:59.947344	19355583	120	30	1.0000	DISCARD	gen=731 glyphs=4
2026-03-14T03:31:02.426827	5a06ca32	120	30	1.0000	DISCARD	gen=687 glyphs=4
2026-03-14T03:31:02.706948	8aef8872	116	29	1.0000	DISCARD	gen=731 glyphs=4
2026-03-14T03:31:05.147078	55d6c151	120	30	1.0000	DISCARD	gen=687 glyphs=4
2026-03-14T03:31:05.412365	9e34ede0	116	29	1.0000	DISCARD	gen=731 glyphs=4
2026-03-14T03:31:07.835978	5b9807ac	120	30	1.0000	DISCARD	gen=687 glyphs=4
2026-03-14T03:31:08.104344	40a6a467	124	31	0.9500	DISCARD	gen=731 glyphs=4
2026-03-14T03:31:10.542249	71e2ba66	116	29	1.0000	DISCARD	gen=687 glyphs=4
2026-03-14T03:31:10.827277	954e1dba	120	30	1.0000	DISCARD	gen=731 glyphs=4
2026-03-14T03:31:13.239743	fdb5d108	120	30	1.0000	DISCARD	gen=687 glyphs=4
2026-03-14T03:31:13.503786	8e0f9dea	116	29	1.0000	DISCARD	gen=731 glyphs=4
2026-03-14T03:31:15.923134	574218b0	116	29	1.0000	DISCARD	gen=687 glyphs=4
2026-03-14T03:31:16.189441	1e5f0e21	116	29	1.0000	DISCARD	gen=731 glyphs=4
2026-03-14T03:31:18.585975	170b7d46	116	29	1.0000	DISCARD	gen=687 glyphs=4
2026-03-14T03:31:18.843121	d0967ff4	116	29	1.0000	DISCARD	gen=731 glyphs=4
2026-03-14T03:31:21.259211	d11c1062	120	30	1.0000	DISCARD	gen=687 glyphs=4
2026-03-14T03:31:21.517031	7c87bdde	120	30	1.0000	DISCARD	gen=731 glyphs=4
2026-03-14T03:31:23.937218	37f4017b	116	29	1.0000	DISCARD	gen=688 glyphs=4
2026-03-14T03:31:24.203444	46db3e3d	120	30	1.0000	DISCARD	gen=731 glyphs=4
2026-03-14T03:31:26.654294	bfdf7cad	120	30	1.0000	DISCARD	gen=688 glyphs=4
2026-03-14T03:31:26.918764	19355583	120	30	1.0000	DISCARD	gen=732 glyphs=4
2026-03-14T03:31:29.335661	37f4017b	116	29	1.0000	DISCARD	gen=688 glyphs=4
2026-03-14T03:31:29.621426	8aef8872	116	29	1.0000	DISCARD	gen=732 glyphs=4
2026-03-14T03:31:32.031830	d9eeb1f6	116	29	1.0000	DISCARD	gen=688 glyphs=4
2026-03-14T03:31:32.306088	6061bd5d	120	30	1.0000	DISCARD	gen=732 glyphs=4
2026-03-14T03:31:34.716706	fdb5d108	120	30	1.0000	DISCARD	gen=688 glyphs=4
2026-03-14T03:31:34.984261	9f9bbfac	120	30	1.0000	DISCARD	gen=732 glyphs=4
2026-03-14T03:31:37.384598	1d34459a	116	29	1.0000	DISCARD	gen=688 glyphs=4
2026-03-14T03:31:37.648126	f69b0a8f	120	30	1.0000	DISCARD	gen=732 glyphs=4
2026-03-14T03:31:40.161889	fdb5d108	120	30	1.0000	DISCARD	gen=688 glyphs=4
2026-03-14T03:31:40.437998	8aef8872	116	29	1.0000	DISCARD	gen=732 glyphs=4
2026-03-14T03:31:42.870571	69c5afed	120	30	1.0000	DISCARD	gen=688 glyphs=4
2026-03-14T03:31:43.129527	ae44ace5	116	29	1.0000	DISCARD	gen=732 glyphs=4
2026-03-14T03:31:45.537614	f34c6497	120	30	1.0000	DISCARD	gen=688 glyphs=4
2026-03-14T03:31:45.800110	7c6011b0	116	29	1.0000	DISCARD	gen=732 glyphs=4
2026-03-14T03:31:48.225943	4c9b0dd4	120	30	1.0000	DISCARD	gen=688 glyphs=4
2026-03-14T03:31:48.497269	96d8da05	120	30	1.0000	DISCARD	gen=732 glyphs=4
2026-03-14T03:31:50.939398	37f4017b	116	29	1.0000	DISCARD	gen=689 glyphs=4
2026-03-14T03:31:51.202895	19355583	120	30	1.0000	DISCARD	gen=732 glyphs=4
2026-03-14T03:31:53.629989	bfdf7cad	120	30	1.0000	DISCARD	gen=689 glyphs=4
2026-03-14T03:31:53.895317	19355583	120	30	1.0000	DISCARD	gen=733 glyphs=4
2026-03-14T03:31:56.304404	55d6c151	120	30	1.0000	DISCARD	gen=689 glyphs=4
2026-03-14T03:31:56.572967	8aef8872	116	29	1.0000	DISCARD	gen=733 glyphs=4
2026-03-14T03:31:58.982938	0c8d42b8	120	30	1.0000	DISCARD	gen=689 glyphs=4
2026-03-14T03:31:59.255771	50dc991d	116	29	1.0000	DISCARD	gen=733 glyphs=4
2026-03-14T03:32:01.674497	2701cb73	116	29	1.0000	DISCARD	gen=689 glyphs=4
2026-03-14T03:32:01.942268	050862ad	120	30	1.0000	DISCARD	gen=733 glyphs=4
2026-03-14T03:32:04.367681	4c59b76d	120	30	1.0000	DISCARD	gen=689 glyphs=4
2026-03-14T03:32:04.641771	8aef8872	116	29	1.0000	DISCARD	gen=733 glyphs=4
2026-03-14T03:32:07.077486	5a06ca32	120	30	1.0000	DISCARD	gen=689 glyphs=4
2026-03-14T03:32:07.333680	0eaedb57	116	29	1.0000	DISCARD	gen=733 glyphs=4
2026-03-14T03:32:09.758835	7ca87b42	116	29	1.0000	DISCARD	gen=689 glyphs=4
2026-03-14T03:32:10.023185	5c1f92cb	124	31	0.9500	DISCARD	gen=733 glyphs=4
2026-03-14T03:32:12.548278	bfdf7cad	120	30	1.0000	DISCARD	gen=689 glyphs=4
2026-03-14T03:32:12.822170	eca7ab6c	116	29	1.0000	DISCARD	gen=733 glyphs=4
2026-03-14T03:32:15.232307	37f4017b	116	29	1.0000	DISCARD	gen=689 glyphs=4
2026-03-14T03:32:15.498983	8aef8872	116	29	1.0000	DISCARD	gen=733 glyphs=4
2026-03-14T03:32:17.904958	37f4017b	116	29	1.0000	DISCARD	gen=690 glyphs=4
2026-03-14T03:32:18.191798	d8c5d7e3	120	30	1.0000	DISCARD	gen=733 glyphs=4
2026-03-14T03:32:20.601399	bfdf7cad	120	30	1.0000	DISCARD	gen=690 glyphs=4
2026-03-14T03:32:20.870124	19355583	120	30	1.0000	DISCARD	gen=734 glyphs=4
2026-03-14T03:32:23.280263	7ca87b42	116	29	1.0000	DISCARD	gen=690 glyphs=4
2026-03-14T03:32:23.540131	8aef8872	116	29	1.0000	DISCARD	gen=734 glyphs=4
2026-03-14T03:32:25.948531	4a1b26e5	116	29	1.0000	DISCARD	gen=690 glyphs=4
2026-03-14T03:32:26.217844	ae0a7df2	116	29	1.0000	DISCARD	gen=734 glyphs=4
2026-03-14T03:32:28.644513	8a10d678	116	29	1.0000	DISCARD	gen=690 glyphs=4
2026-03-14T03:32:28.910770	eca7ab6c	116	29	1.0000	DISCARD	gen=734 glyphs=4
2026-03-14T03:32:31.316795	4c9b0dd4	120	30	1.0000	DISCARD	gen=690 glyphs=4
2026-03-14T03:32:31.587620	8aef8872	116	29	1.0000	DISCARD	gen=734 glyphs=4
2026-03-14T03:32:33.970525	5a06ca32	120	30	1.0000	DISCARD	gen=690 glyphs=4
2026-03-14T03:32:34.245057	8aef8872	116	29	1.0000	DISCARD	gen=734 glyphs=4
2026-03-14T03:32:36.668382	5a06ca32	120	30	1.0000	DISCARD	gen=690 glyphs=4
2026-03-14T03:32:36.925194	5248db9c	120	30	1.0000	DISCARD	gen=734 glyphs=4
2026-03-14T03:32:39.386274	1ff9185e	120	30	1.0000	DISCARD	gen=690 glyphs=4
2026-03-14T03:32:39.646523	b57e7176	120	30	1.0000	DISCARD	gen=734 glyphs=4
2026-03-14T03:32:42.065420	fdb5d108	120	30	1.0000	DISCARD	gen=690 glyphs=4
2026-03-14T03:32:42.333699	d7c8681b	120	30	1.0000	DISCARD	gen=734 glyphs=4
2026-03-14T03:32:44.828476	37f4017b	116	29	1.0000	DISCARD	gen=691 glyphs=4
2026-03-14T03:32:45.109479	ae44ace5	116	29	1.0000	DISCARD	gen=734 glyphs=4
2026-03-14T03:32:47.513528	bfdf7cad	120	30	1.0000	DISCARD	gen=691 glyphs=4
2026-03-14T03:32:47.780235	19355583	120	30	1.0000	DISCARD	gen=735 glyphs=4
2026-03-14T03:32:50.199421	12b38c2d	116	29	1.0000	DISCARD	gen=691 glyphs=4
2026-03-14T03:32:50.469975	8aef8872	116	29	1.0000	DISCARD	gen=735 glyphs=4
2026-03-14T03:32:52.887793	5db7ae7a	116	29	1.0000	DISCARD	gen=691 glyphs=4
2026-03-14T03:32:53.154099	b7aed8e9	116	29	1.0000	DISCARD	gen=735 glyphs=4
2026-03-14T03:32:55.583366	844d82b7	116	29	1.0000	DISCARD	gen=691 glyphs=4
2026-03-14T03:32:55.843659	050862ad	120	30	1.0000	DISCARD	gen=735 glyphs=4
2026-03-14T03:32:58.284033	b367ed8a	120	30	1.0000	DISCARD	gen=691 glyphs=4
2026-03-14T03:32:58.550649	ae44ace5	116	29	1.0000	DISCARD	gen=735 glyphs=4
2026-03-14T03:33:00.959336	12b38c2d	116	29	1.0000	DISCARD	gen=691 glyphs=4
2026-03-14T03:33:01.231122	8aef8872	116	29	1.0000	DISCARD	gen=735 glyphs=4
2026-03-14T03:33:03.666796	55d6c151	120	30	1.0000	DISCARD	gen=691 glyphs=4
2026-03-14T03:33:03.930606	417179bc	116	29	0.9500	DISCARD	gen=735 glyphs=4
2026-03-14T03:33:06.333006	fdb5d108	120	30	1.0000	DISCARD	gen=691 glyphs=4
2026-03-14T03:33:06.602366	050862ad	120	30	1.0000	DISCARD	gen=735 glyphs=4
2026-03-14T03:33:09.027983	5a06ca32	120	30	1.0000	DISCARD	gen=691 glyphs=4
2026-03-14T03:33:09.305070	1e5f0e21	116	29	1.0000	DISCARD	gen=735 glyphs=4
2026-03-14T03:33:11.747169	37f4017b	116	29	1.0000	DISCARD	gen=692 glyphs=4
2026-03-14T03:33:12.005604	b7aed8e9	116	29	1.0000	DISCARD	gen=735 glyphs=4
2026-03-14T03:33:14.410488	bfdf7cad	120	30	1.0000	DISCARD	gen=692 glyphs=4
2026-03-14T03:33:14.748757	19355583	120	30	1.0000	DISCARD	gen=736 glyphs=4
2026-03-14T03:33:17.219478	5a06ca32	120	30	1.0000	DISCARD	gen=692 glyphs=4
2026-03-14T03:33:17.479635	8aef8872	116	29	1.0000	DISCARD	gen=736 glyphs=4
2026-03-14T03:33:19.883020	37f4017b	116	29	1.0000	DISCARD	gen=692 glyphs=4
2026-03-14T03:33:20.156224	cdaf1d8b	116	29	1.0000	DISCARD	gen=736 glyphs=4
2026-03-14T03:33:22.567084	5a06ca32	120	30	1.0000	DISCARD	gen=692 glyphs=4
2026-03-14T03:33:22.834699	8aef8872	116	29	1.0000	DISCARD	gen=736 glyphs=4
2026-03-14T03:33:25.268434	2701cb73	116	29	1.0000	DISCARD	gen=692 glyphs=4
2026-03-14T03:33:25.527059	050862ad	120	30	1.0000	DISCARD	gen=736 glyphs=4
2026-03-14T03:33:27.955606	37f4017b	116	29	1.0000	DISCARD	gen=692 glyphs=4
2026-03-14T03:33:28.211227	0eaedb57	116	29	1.0000	DISCARD	gen=736 glyphs=4
2026-03-14T03:33:30.609746	37f4017b	116	29	1.0000	DISCARD	gen=692 glyphs=4
2026-03-14T03:33:30.877449	dd52445b	116	29	0.9500	DISCARD	gen=736 glyphs=4
2026-03-14T03:33:33.324394	fdb5d108	120	30	1.0000	DISCARD	gen=692 glyphs=4
2026-03-14T03:33:33.591986	cd4db767	120	30	1.0000	DISCARD	gen=736 glyphs=4
2026-03-14T03:33:35.997312	5a06ca32	120	30	1.0000	DISCARD	gen=692 glyphs=4
2026-03-14T03:33:36.265857	8aef8872	116	29	1.0000	DISCARD	gen=736 glyphs=4
2026-03-14T03:33:38.692542	37f4017b	116	29	1.0000	DISCARD	gen=693 glyphs=4
2026-03-14T03:33:38.959069	4751b79e	120	30	1.0000	DISCARD	gen=736 glyphs=4
2026-03-14T03:33:41.402316	bfdf7cad	120	30	1.0000	DISCARD	gen=693 glyphs=4
2026-03-14T03:33:41.665247	19355583	120	30	1.0000	DISCARD	gen=737 glyphs=4
2026-03-14T03:33:44.067699	2a333ed6	116	29	1.0000	DISCARD	gen=693 glyphs=4
2026-03-14T03:33:44.335633	8aef8872	116	29	1.0000	DISCARD	gen=737 glyphs=4
2026-03-14T03:34:01.969767	5a06ca32	120	30	1.0000	DISCARD	gen=693 glyphs=4
2026-03-14T03:34:02.242253	1e5f0e21	116	29	1.0000	DISCARD	gen=737 glyphs=4
2026-03-14T03:34:04.681734	451a1a5d	116	29	1.0000	DISCARD	gen=693 glyphs=4
2026-03-14T03:34:04.957565	67cb81be	120	30	1.0000	DISCARD	gen=737 glyphs=4
2026-03-14T03:34:07.420834	7edc9fad	120	30	1.0000	DISCARD	gen=693 glyphs=4
2026-03-14T03:34:07.690375	0eaedb57	116	29	1.0000	DISCARD	gen=737 glyphs=4
2026-03-14T03:34:10.117887	55d6c151	120	30	1.0000	DISCARD	gen=693 glyphs=4
2026-03-14T03:34:10.402226	0eaedb57	116	29	1.0000	DISCARD	gen=737 glyphs=4
2026-03-14T03:34:12.891922	37f4017b	116	29	1.0000	DISCARD	gen=693 glyphs=4
2026-03-14T03:34:13.170300	8aef8872	116	29	1.0000	DISCARD	gen=737 glyphs=4
2026-03-14T03:34:15.624646	268d5b5b	116	29	1.0000	DISCARD	gen=693 glyphs=4
2026-03-14T03:34:15.890564	de98fa52	116	29	1.0000	DISCARD	gen=737 glyphs=4
2026-03-14T03:34:18.414141	fc003eb1	120	30	1.0000	DISCARD	gen=693 glyphs=4
2026-03-14T03:34:18.716322	8aef8872	116	29	1.0000	DISCARD	gen=737 glyphs=4
2026-03-14T03:34:21.199211	37f4017b	116	29	1.0000	DISCARD	gen=694 glyphs=4
2026-03-14T03:34:21.476330	0eaedb57	116	29	1.0000	DISCARD	gen=737 glyphs=4
2026-03-14T03:34:23.940307	bfdf7cad	120	30	1.0000	DISCARD	gen=694 glyphs=4
2026-03-14T03:34:24.210636	19355583	120	30	1.0000	DISCARD	gen=738 glyphs=4
2026-03-14T03:34:26.680385	12b38c2d	116	29	1.0000	DISCARD	gen=694 glyphs=4
2026-03-14T03:34:26.957361	8aef8872	116	29	1.0000	DISCARD	gen=738 glyphs=4
2026-03-14T03:34:29.418480	37f4017b	116	29	1.0000	DISCARD	gen=694 glyphs=4
2026-03-14T03:34:29.679068	d7c8681b	120	30	1.0000	DISCARD	gen=738 glyphs=4
2026-03-14T03:34:32.144234	c06ab9c9	116	29	1.0000	DISCARD	gen=694 glyphs=4
2026-03-14T03:34:32.419529	19355583	120	30	1.0000	DISCARD	gen=738 glyphs=4
2026-03-14T03:34:34.883968	23ef857d	116	29	1.0000	DISCARD	gen=694 glyphs=4
2026-03-14T03:34:35.164389	67cb81be	120	30	1.0000	DISCARD	gen=738 glyphs=4
2026-03-14T03:34:37.645948	aacc7cf3	120	30	1.0000	DISCARD	gen=694 glyphs=4
2026-03-14T03:34:37.934809	19355583	120	30	1.0000	DISCARD	gen=738 glyphs=4
2026-03-14T03:34:40.406104	12b38c2d	116	29	1.0000	DISCARD	gen=694 glyphs=4
2026-03-14T03:34:40.679883	1205400e	116	29	1.0000	DISCARD	gen=738 glyphs=4
2026-03-14T03:34:43.219819	c98b5e80	116	29	1.0000	DISCARD	gen=694 glyphs=4
2026-03-14T03:34:43.495341	33a521c7	120	30	1.0000	DISCARD	gen=738 glyphs=4
