timestamp	program_hash	spirv_size	word_count	fitness	status	description
2026-03-14T07:36:44.895637	ff30496a	0	0	0.0000	CRASH	gen=419 glyphs=3
2026-03-14T07:36:44.895906	099964a4	0	0	0.0000	CRASH	gen=420 glyphs=4
2026-03-14T07:36:44.896102	099964a4	0	0	0.0000	CRASH	gen=420 glyphs=4
2026-03-14T07:36:44.896295	cf93b656	0	0	0.0000	CRASH	gen=420 glyphs=3
2026-03-14T07:36:44.896492	2a339c79	0	0	0.0000	CRASH	gen=420 glyphs=4
2026-03-14T07:36:44.896690	7ede4765	0	0	0.0000	CRASH	gen=420 glyphs=2
2026-03-14T07:36:44.896883	099964a4	0	0	0.0000	CRASH	gen=420 glyphs=4
2026-03-14T07:36:44.897076	eb93ac67	0	0	0.0000	CRASH	gen=420 glyphs=3
2026-03-14T07:36:44.897274	099964a4	0	0	0.0000	CRASH	gen=420 glyphs=4
2026-03-14T07:36:44.897474	8da1f8d8	0	0	0.0000	CRASH	gen=420 glyphs=4
2026-03-14T07:36:44.897675	04ffea40	0	0	0.0000	CRASH	gen=420 glyphs=4
2026-03-14T07:36:44.897955	099964a4	0	0	0.0000	CRASH	gen=421 glyphs=4
2026-03-14T07:36:44.898152	099964a4	0	0	0.0000	CRASH	gen=421 glyphs=4
2026-03-14T07:36:44.898345	27977ba4	0	0	0.0000	CRASH	gen=421 glyphs=4
2026-03-14T07:36:44.898547	80cef82b	0	0	0.0000	CRASH	gen=421 glyphs=4
2026-03-14T07:36:44.898743	50edf557	0	0	0.0000	CRASH	gen=421 glyphs=4
2026-03-14T07:36:44.898936	dcb1fb50	0	0	0.0000	CRASH	gen=421 glyphs=4
2026-03-14T07:36:44.899144	099964a4	0	0	0.0000	CRASH	gen=421 glyphs=4
2026-03-14T07:36:44.899336	142c4f48	0	0	0.0000	CRASH	gen=421 glyphs=3
2026-03-14T07:36:44.899532	7ede4765	0	0	0.0000	CRASH	gen=421 glyphs=2
2026-03-14T07:36:44.899728	45ba271b	0	0	0.0000	CRASH	gen=421 glyphs=3
2026-03-14T07:36:44.899997	099964a4	0	0	0.0000	CRASH	gen=422 glyphs=4
2026-03-14T07:36:44.900194	099964a4	0	0	0.0000	CRASH	gen=422 glyphs=4
2026-03-14T07:36:44.900388	323d2fd6	0	0	0.0000	CRASH	gen=422 glyphs=3
2026-03-14T07:36:44.900587	ff30496a	0	0	0.0000	CRASH	gen=422 glyphs=3
2026-03-14T07:36:44.900784	099964a4	0	0	0.0000	CRASH	gen=422 glyphs=4
2026-03-14T07:36:44.900979	b0ad6367	0	0	0.0000	CRASH	gen=422 glyphs=4
2026-03-14T07:36:44.901173	099964a4	0	0	0.0000	CRASH	gen=422 glyphs=4
2026-03-14T07:36:44.901366	099964a4	0	0	0.0000	CRASH	gen=422 glyphs=4
2026-03-14T07:36:44.901563	ff30496a	0	0	0.0000	CRASH	gen=422 glyphs=3
2026-03-14T07:36:44.901760	099964a4	0	0	0.0000	CRASH	gen=422 glyphs=4
2026-03-14T07:36:44.902029	099964a4	0	0	0.0000	CRASH	gen=423 glyphs=4
2026-03-14T07:36:44.902226	099964a4	0	0	0.0000	CRASH	gen=423 glyphs=4
2026-03-14T07:36:44.902420	099964a4	0	0	0.0000	CRASH	gen=423 glyphs=4
2026-03-14T07:36:44.902615	170bcd09	0	0	0.0000	CRASH	gen=423 glyphs=4
2026-03-14T07:36:44.902813	ff30496a	0	0	0.0000	CRASH	gen=423 glyphs=3
2026-03-14T07:36:44.903004	099964a4	0	0	0.0000	CRASH	gen=423 glyphs=4
2026-03-14T07:36:44.903195	099964a4	0	0	0.0000	CRASH	gen=423 glyphs=4
2026-03-14T07:36:44.903387	099964a4	0	0	0.0000	CRASH	gen=423 glyphs=4
2026-03-14T07:36:44.903583	82cfaa4e	0	0	0.0000	CRASH	gen=423 glyphs=4
2026-03-14T07:36:44.903779	099964a4	0	0	0.0000	CRASH	gen=423 glyphs=4
2026-03-14T07:36:44.904059	099964a4	0	0	0.0000	CRASH	gen=424 glyphs=4
2026-03-14T07:36:44.904254	099964a4	0	0	0.0000	CRASH	gen=424 glyphs=4
2026-03-14T07:36:44.904450	4d36f809	0	0	0.0000	CRASH	gen=424 glyphs=4
2026-03-14T07:36:44.904648	099964a4	0	0	0.0000	CRASH	gen=424 glyphs=4
2026-03-14T07:36:44.904843	dcb1fb50	0	0	0.0000	CRASH	gen=424 glyphs=4
2026-03-14T07:36:44.905040	ff30496a	0	0	0.0000	CRASH	gen=424 glyphs=3
2026-03-14T07:36:44.905236	099964a4	0	0	0.0000	CRASH	gen=424 glyphs=4
2026-03-14T07:36:44.905429	099964a4	0	0	0.0000	CRASH	gen=424 glyphs=4
2026-03-14T07:36:44.905631	3ca14993	0	0	0.0000	CRASH	gen=424 glyphs=4
2026-03-14T07:36:44.905827	099964a4	0	0	0.0000	CRASH	gen=424 glyphs=4
2026-03-14T07:36:44.906102	099964a4	0	0	0.0000	CRASH	gen=425 glyphs=4
2026-03-14T07:36:44.906297	099964a4	0	0	0.0000	CRASH	gen=425 glyphs=4
2026-03-14T07:36:44.906491	3a734398	0	0	0.0000	CRASH	gen=425 glyphs=4
2026-03-14T07:36:44.906686	099964a4	0	0	0.0000	CRASH	gen=425 glyphs=4
2026-03-14T07:36:44.906879	099964a4	0	0	0.0000	CRASH	gen=425 glyphs=4
2026-03-14T07:36:44.907075	099964a4	0	0	0.0000	CRASH	gen=425 glyphs=4
2026-03-14T07:36:44.907267	cf93b656	0	0	0.0000	CRASH	gen=425 glyphs=3
2026-03-14T07:36:44.907459	93050aeb	0	0	0.0000	CRASH	gen=425 glyphs=4
2026-03-14T07:36:44.907660	eee0a62d	0	0	0.0000	CRASH	gen=425 glyphs=2
2026-03-14T07:36:44.907854	0d40b65b	0	0	0.0000	CRASH	gen=425 glyphs=4
2026-03-14T07:36:44.908128	099964a4	0	0	0.0000	CRASH	gen=426 glyphs=4
2026-03-14T07:36:44.908323	099964a4	0	0	0.0000	CRASH	gen=426 glyphs=4
2026-03-14T07:36:44.908518	099964a4	0	0	0.0000	CRASH	gen=426 glyphs=4
2026-03-14T07:36:44.908711	099964a4	0	0	0.0000	CRASH	gen=426 glyphs=4
2026-03-14T07:36:44.908902	099964a4	0	0	0.0000	CRASH	gen=426 glyphs=4
2026-03-14T07:36:44.909095	099964a4	0	0	0.0000	CRASH	gen=426 glyphs=4
2026-03-14T07:36:44.909288	099964a4	0	0	0.0000	CRASH	gen=426 glyphs=4
2026-03-14T07:36:44.909479	099964a4	0	0	0.0000	CRASH	gen=426 glyphs=4
2026-03-14T07:36:44.909673	3ca14993	0	0	0.0000	CRASH	gen=426 glyphs=4
2026-03-14T07:36:44.909864	099964a4	0	0	0.0000	CRASH	gen=426 glyphs=4
2026-03-14T07:36:44.910133	099964a4	0	0	0.0000	CRASH	gen=427 glyphs=4
2026-03-14T07:36:44.910329	099964a4	0	0	0.0000	CRASH	gen=427 glyphs=4
2026-03-14T07:36:44.910525	0f139aa1	0	0	0.0000	CRASH	gen=427 glyphs=3
2026-03-14T07:36:44.910716	099964a4	0	0	0.0000	CRASH	gen=427 glyphs=4
2026-03-14T07:36:44.910909	43898178	0	0	0.0000	CRASH	gen=427 glyphs=3
2026-03-14T07:36:44.911099	108c66c8	0	0	0.0000	CRASH	gen=427 glyphs=3
2026-03-14T07:36:44.911296	099964a4	0	0	0.0000	CRASH	gen=427 glyphs=4
2026-03-14T07:36:44.911487	099964a4	0	0	0.0000	CRASH	gen=427 glyphs=4
2026-03-14T07:36:44.911683	4adc2343	0	0	0.0000	CRASH	gen=427 glyphs=4
2026-03-14T07:36:44.911878	099964a4	0	0	0.0000	CRASH	gen=427 glyphs=4
2026-03-14T07:36:44.912149	099964a4	0	0	0.0000	CRASH	gen=428 glyphs=4
2026-03-14T07:36:44.912349	099964a4	0	0	0.0000	CRASH	gen=428 glyphs=4
2026-03-14T07:36:44.912546	099964a4	0	0	0.0000	CRASH	gen=428 glyphs=4
2026-03-14T07:36:44.912736	3ca14993	0	0	0.0000	CRASH	gen=428 glyphs=4
2026-03-14T07:36:44.912928	099964a4	0	0	0.0000	CRASH	gen=428 glyphs=4
2026-03-14T07:36:44.913116	22294a98	0	0	0.0000	CRASH	gen=428 glyphs=3
2026-03-14T07:36:44.913306	099964a4	0	0	0.0000	CRASH	gen=428 glyphs=4
2026-03-14T07:36:44.913500	46d4be09	0	0	0.0000	CRASH	gen=428 glyphs=4
2026-03-14T07:36:44.913694	099964a4	0	0	0.0000	CRASH	gen=428 glyphs=4
2026-03-14T07:36:44.913888	1584f362	0	0	0.0000	CRASH	gen=428 glyphs=4
2026-03-14T07:36:44.914162	099964a4	0	0	0.0000	CRASH	gen=429 glyphs=4
2026-03-14T07:36:44.914355	099964a4	0	0	0.0000	CRASH	gen=429 glyphs=4
2026-03-14T07:36:44.914556	099964a4	0	0	0.0000	CRASH	gen=429 glyphs=4
2026-03-14T07:36:44.914750	099964a4	0	0	0.0000	CRASH	gen=429 glyphs=4
2026-03-14T07:36:44.914941	0e7da528	0	0	0.0000	CRASH	gen=429 glyphs=4
2026-03-14T07:36:44.915135	099964a4	0	0	0.0000	CRASH	gen=429 glyphs=4
2026-03-14T07:36:44.915327	3b98bfb8	0	0	0.0000	CRASH	gen=429 glyphs=5
2026-03-14T07:36:44.915526	099964a4	0	0	0.0000	CRASH	gen=429 glyphs=4
2026-03-14T07:36:44.915719	099964a4	0	0	0.0000	CRASH	gen=429 glyphs=4
2026-03-14T07:36:44.915911	ff30496a	0	0	0.0000	CRASH	gen=429 glyphs=3
2026-03-14T07:36:44.916177	099964a4	0	0	0.0000	CRASH	gen=430 glyphs=4
2026-03-14T07:36:44.916370	099964a4	0	0	0.0000	CRASH	gen=430 glyphs=4
2026-03-14T07:36:44.916566	71d0c0cb	0	0	0.0000	CRASH	gen=430 glyphs=4
2026-03-14T07:36:44.916760	099964a4	0	0	0.0000	CRASH	gen=430 glyphs=4
2026-03-14T07:36:44.916952	099964a4	0	0	0.0000	CRASH	gen=430 glyphs=4
2026-03-14T07:36:44.917144	7ede4765	0	0	0.0000	CRASH	gen=430 glyphs=2
2026-03-14T07:36:44.917336	3ca14993	0	0	0.0000	CRASH	gen=430 glyphs=4
2026-03-14T07:36:44.917534	80cef82b	0	0	0.0000	CRASH	gen=430 glyphs=4
2026-03-14T07:36:44.917732	3bded3b7	0	0	0.0000	CRASH	gen=430 glyphs=4
2026-03-14T07:36:44.917924	a7b68563	0	0	0.0000	CRASH	gen=430 glyphs=4
2026-03-14T07:36:44.918208	099964a4	0	0	0.0000	CRASH	gen=431 glyphs=4
2026-03-14T07:36:44.918403	099964a4	0	0	0.0000	CRASH	gen=431 glyphs=4
2026-03-14T07:36:44.918601	9ba66fcd	0	0	0.0000	CRASH	gen=431 glyphs=4
2026-03-14T07:36:44.918800	3a734398	0	0	0.0000	CRASH	gen=431 glyphs=4
2026-03-14T07:36:44.918994	099964a4	0	0	0.0000	CRASH	gen=431 glyphs=4
2026-03-14T07:36:44.919187	e983ad70	0	0	0.0000	CRASH	gen=431 glyphs=4
2026-03-14T07:36:44.919380	099964a4	0	0	0.0000	CRASH	gen=431 glyphs=4
2026-03-14T07:36:44.919575	47a54f47	0	0	0.0000	CRASH	gen=431 glyphs=4
2026-03-14T07:36:44.919769	099964a4	0	0	0.0000	CRASH	gen=431 glyphs=4
2026-03-14T07:36:44.919962	099964a4	0	0	0.0000	CRASH	gen=431 glyphs=4
2026-03-14T07:36:44.920238	099964a4	0	0	0.0000	CRASH	gen=432 glyphs=4
2026-03-14T07:36:44.920430	099964a4	0	0	0.0000	CRASH	gen=432 glyphs=4
2026-03-14T07:36:44.920628	099964a4	0	0	0.0000	CRASH	gen=432 glyphs=4
2026-03-14T07:36:44.920818	dcb1fb50	0	0	0.0000	CRASH	gen=432 glyphs=4
2026-03-14T07:36:44.921016	099964a4	0	0	0.0000	CRASH	gen=432 glyphs=4
2026-03-14T07:36:44.921207	386bdbaa	0	0	0.0000	CRASH	gen=432 glyphs=4
2026-03-14T07:36:44.921400	8f693410	0	0	0.0000	CRASH	gen=432 glyphs=4
2026-03-14T07:36:44.921595	099964a4	0	0	0.0000	CRASH	gen=432 glyphs=4
2026-03-14T07:36:44.921790	8da1f8d8	0	0	0.0000	CRASH	gen=432 glyphs=4
2026-03-14T07:36:44.921992	099964a4	0	0	0.0000	CRASH	gen=432 glyphs=4
2026-03-14T07:36:44.922270	099964a4	0	0	0.0000	CRASH	gen=433 glyphs=4
2026-03-14T07:36:44.922467	099964a4	0	0	0.0000	CRASH	gen=433 glyphs=4
2026-03-14T07:36:44.922665	099964a4	0	0	0.0000	CRASH	gen=433 glyphs=4
2026-03-14T07:36:44.922859	099964a4	0	0	0.0000	CRASH	gen=433 glyphs=4
2026-03-14T07:36:44.923058	7ede4765	0	0	0.0000	CRASH	gen=433 glyphs=2
2026-03-14T07:36:44.923251	f96dd9f9	0	0	0.0000	CRASH	gen=433 glyphs=3
2026-03-14T07:36:44.923444	55b33369	0	0	0.0000	CRASH	gen=433 glyphs=3
2026-03-14T07:36:44.923639	bbd98514	0	0	0.0000	CRASH	gen=433 glyphs=3
2026-03-14T07:36:44.923835	435857c9	0	0	0.0000	CRASH	gen=433 glyphs=3
2026-03-14T07:36:44.924030	099964a4	0	0	0.0000	CRASH	gen=433 glyphs=4
2026-03-14T07:36:44.924313	099964a4	0	0	0.0000	CRASH	gen=434 glyphs=4
2026-03-14T07:36:44.924506	099964a4	0	0	0.0000	CRASH	gen=434 glyphs=4
2026-03-14T07:36:44.924702	b218fc5c	0	0	0.0000	CRASH	gen=434 glyphs=4
2026-03-14T07:36:44.924894	8da1f8d8	0	0	0.0000	CRASH	gen=434 glyphs=4
2026-03-14T07:36:44.925089	099964a4	0	0	0.0000	CRASH	gen=434 glyphs=4
2026-03-14T07:36:44.925284	099964a4	0	0	0.0000	CRASH	gen=434 glyphs=4
2026-03-14T07:36:44.925475	8da1f8d8	0	0	0.0000	CRASH	gen=434 glyphs=4
2026-03-14T07:36:44.925669	0c2e505d	0	0	0.0000	CRASH	gen=434 glyphs=4
2026-03-14T07:36:44.925861	7fd24cf4	0	0	0.0000	CRASH	gen=434 glyphs=4
2026-03-14T07:36:44.926055	6fa8fa5e	0	0	0.0000	CRASH	gen=434 glyphs=3
2026-03-14T07:36:44.926333	099964a4	0	0	0.0000	CRASH	gen=435 glyphs=4
2026-03-14T07:36:44.926533	099964a4	0	0	0.0000	CRASH	gen=435 glyphs=4
2026-03-14T07:36:44.926726	099964a4	0	0	0.0000	CRASH	gen=435 glyphs=4
2026-03-14T07:36:44.926920	cd442351	0	0	0.0000	CRASH	gen=435 glyphs=3
2026-03-14T07:36:44.927113	099964a4	0	0	0.0000	CRASH	gen=435 glyphs=4
2026-03-14T07:36:44.927311	dcb1fb50	0	0	0.0000	CRASH	gen=435 glyphs=4
2026-03-14T07:36:44.927505	8da1f8d8	0	0	0.0000	CRASH	gen=435 glyphs=4
2026-03-14T07:36:44.927700	19cd28a5	0	0	0.0000	CRASH	gen=435 glyphs=3
2026-03-14T07:36:44.927894	099964a4	0	0	0.0000	CRASH	gen=435 glyphs=4
2026-03-14T07:36:44.928084	099964a4	0	0	0.0000	CRASH	gen=435 glyphs=4
2026-03-14T07:36:44.928359	099964a4	0	0	0.0000	CRASH	gen=436 glyphs=4
2026-03-14T07:36:44.928555	099964a4	0	0	0.0000	CRASH	gen=436 glyphs=4
2026-03-14T07:36:44.928748	099964a4	0	0	0.0000	CRASH	gen=436 glyphs=4
2026-03-14T07:36:44.928939	ff30496a	0	0	0.0000	CRASH	gen=436 glyphs=3
2026-03-14T07:36:44.929130	099964a4	0	0	0.0000	CRASH	gen=436 glyphs=4
2026-03-14T07:36:44.929324	099964a4	0	0	0.0000	CRASH	gen=436 glyphs=4
2026-03-14T07:36:44.929523	de82856e	0	0	0.0000	CRASH	gen=436 glyphs=4
2026-03-14T07:36:44.929717	0e918773	0	0	0.0000	CRASH	gen=436 glyphs=4
2026-03-14T07:36:44.929912	ff30496a	0	0	0.0000	CRASH	gen=436 glyphs=3
2026-03-14T07:36:44.930104	7ede4765	0	0	0.0000	CRASH	gen=436 glyphs=2
2026-03-14T07:36:44.930381	099964a4	0	0	0.0000	CRASH	gen=437 glyphs=4
2026-03-14T07:36:44.930583	099964a4	0	0	0.0000	CRASH	gen=437 glyphs=4
2026-03-14T07:36:44.930778	099964a4	0	0	0.0000	CRASH	gen=437 glyphs=4
2026-03-14T07:36:44.930972	7d8ef19d	0	0	0.0000	CRASH	gen=437 glyphs=2
2026-03-14T07:36:44.931166	099964a4	0	0	0.0000	CRASH	gen=437 glyphs=4
2026-03-14T07:36:44.931358	099964a4	0	0	0.0000	CRASH	gen=437 glyphs=4
2026-03-14T07:36:44.931551	3ca14993	0	0	0.0000	CRASH	gen=437 glyphs=4
2026-03-14T07:36:44.931749	5204995d	0	0	0.0000	CRASH	gen=437 glyphs=3
2026-03-14T07:36:44.931945	099964a4	0	0	0.0000	CRASH	gen=437 glyphs=4
2026-03-14T07:36:44.932137	099964a4	0	0	0.0000	CRASH	gen=437 glyphs=4
2026-03-14T07:36:44.932409	099964a4	0	0	0.0000	CRASH	gen=438 glyphs=4
2026-03-14T07:36:44.932606	099964a4	0	0	0.0000	CRASH	gen=438 glyphs=4
2026-03-14T07:36:44.932805	099964a4	0	0	0.0000	CRASH	gen=438 glyphs=4
2026-03-14T07:36:44.933001	099964a4	0	0	0.0000	CRASH	gen=438 glyphs=4
2026-03-14T07:36:44.933196	8da1f8d8	0	0	0.0000	CRASH	gen=438 glyphs=4
2026-03-14T07:36:44.933391	a9454f24	0	0	0.0000	CRASH	gen=438 glyphs=3
2026-03-14T07:36:44.933589	e7f33900	0	0	0.0000	CRASH	gen=438 glyphs=3
2026-03-14T07:36:44.933789	ac869715	0	0	0.0000	CRASH	gen=438 glyphs=3
2026-03-14T07:36:44.933986	099964a4	0	0	0.0000	CRASH	gen=438 glyphs=4
2026-03-14T07:36:44.934179	7fc317b7	0	0	0.0000	CRASH	gen=438 glyphs=4
2026-03-14T07:36:44.934461	099964a4	0	0	0.0000	CRASH	gen=439 glyphs=4
2026-03-14T07:36:44.934661	099964a4	0	0	0.0000	CRASH	gen=439 glyphs=4
2026-03-14T07:36:44.934860	099964a4	0	0	0.0000	CRASH	gen=439 glyphs=4
2026-03-14T07:36:44.935056	9b253560	0	0	0.0000	CRASH	gen=439 glyphs=3
2026-03-14T07:36:44.935254	099964a4	0	0	0.0000	CRASH	gen=439 glyphs=4
2026-03-14T07:36:44.935447	099964a4	0	0	0.0000	CRASH	gen=439 glyphs=4
2026-03-14T07:36:44.935646	ff30496a	0	0	0.0000	CRASH	gen=439 glyphs=3
2026-03-14T07:36:44.935848	099964a4	0	0	0.0000	CRASH	gen=439 glyphs=4
2026-03-14T07:36:44.936045	099964a4	0	0	0.0000	CRASH	gen=439 glyphs=4
2026-03-14T07:36:44.936239	099964a4	0	0	0.0000	CRASH	gen=439 glyphs=4
2026-03-14T07:36:44.936518	099964a4	0	0	0.0000	CRASH	gen=440 glyphs=4
2026-03-14T07:36:44.936714	099964a4	0	0	0.0000	CRASH	gen=440 glyphs=4
2026-03-14T07:36:44.936913	099964a4	0	0	0.0000	CRASH	gen=440 glyphs=4
2026-03-14T07:36:44.937106	96930677	0	0	0.0000	CRASH	gen=440 glyphs=4
2026-03-14T07:36:44.937302	099964a4	0	0	0.0000	CRASH	gen=440 glyphs=4
2026-03-14T07:36:44.937495	23514c73	0	0	0.0000	CRASH	gen=440 glyphs=4
2026-03-14T07:36:44.937692	8c4a2a36	0	0	0.0000	CRASH	gen=440 glyphs=3
2026-03-14T07:36:44.937886	3ca14993	0	0	0.0000	CRASH	gen=440 glyphs=4
2026-03-14T07:36:44.938090	099964a4	0	0	0.0000	CRASH	gen=440 glyphs=4
2026-03-14T07:36:44.938283	099964a4	0	0	0.0000	CRASH	gen=440 glyphs=4
2026-03-14T07:36:44.938575	099964a4	0	0	0.0000	CRASH	gen=441 glyphs=4
2026-03-14T07:36:44.938777	099964a4	0	0	0.0000	CRASH	gen=441 glyphs=4
2026-03-14T07:36:44.938971	099964a4	0	0	0.0000	CRASH	gen=441 glyphs=4
2026-03-14T07:36:44.939167	34818413	0	0	0.0000	CRASH	gen=441 glyphs=4
2026-03-14T07:36:44.939364	93fa4fb9	0	0	0.0000	CRASH	gen=441 glyphs=3
2026-03-14T07:36:44.939563	3ca14993	0	0	0.0000	CRASH	gen=441 glyphs=4
2026-03-14T07:36:44.939763	099964a4	0	0	0.0000	CRASH	gen=441 glyphs=4
2026-03-14T07:36:44.939959	099964a4	0	0	0.0000	CRASH	gen=441 glyphs=4
2026-03-14T07:36:44.940163	f77d79f3	0	0	0.0000	CRASH	gen=441 glyphs=4
2026-03-14T07:36:44.940358	099964a4	0	0	0.0000	CRASH	gen=441 glyphs=4
2026-03-14T07:36:44.940644	099964a4	0	0	0.0000	CRASH	gen=442 glyphs=4
2026-03-14T07:36:44.940844	099964a4	0	0	0.0000	CRASH	gen=442 glyphs=4
2026-03-14T07:36:44.941043	0d215f7d	0	0	0.0000	CRASH	gen=442 glyphs=3
2026-03-14T07:36:44.941245	099964a4	0	0	0.0000	CRASH	gen=442 glyphs=4
2026-03-14T07:36:44.941445	099964a4	0	0	0.0000	CRASH	gen=442 glyphs=4
2026-03-14T07:36:44.941646	099964a4	0	0	0.0000	CRASH	gen=442 glyphs=4
2026-03-14T07:36:44.941841	80cef82b	0	0	0.0000	CRASH	gen=442 glyphs=4
2026-03-14T07:36:44.942037	7ede4765	0	0	0.0000	CRASH	gen=442 glyphs=2
2026-03-14T07:36:44.942233	80cef82b	0	0	0.0000	CRASH	gen=442 glyphs=4
2026-03-14T07:36:44.942436	a88f2687	0	0	0.0000	CRASH	gen=442 glyphs=4
2026-03-14T07:36:44.942714	099964a4	0	0	0.0000	CRASH	gen=443 glyphs=4
2026-03-14T07:36:44.942909	099964a4	0	0	0.0000	CRASH	gen=443 glyphs=4
2026-03-14T07:36:44.943104	8da1f8d8	0	0	0.0000	CRASH	gen=443 glyphs=4
2026-03-14T07:36:44.943301	16391241	0	0	0.0000	CRASH	gen=443 glyphs=2
2026-03-14T07:36:44.943501	099964a4	0	0	0.0000	CRASH	gen=443 glyphs=4
2026-03-14T07:36:44.943695	099964a4	0	0	0.0000	CRASH	gen=443 glyphs=4
2026-03-14T07:36:44.943887	a1922891	0	0	0.0000	CRASH	gen=443 glyphs=4
2026-03-14T07:36:44.944080	099964a4	0	0	0.0000	CRASH	gen=443 glyphs=4
2026-03-14T07:36:44.944273	099964a4	0	0	0.0000	CRASH	gen=443 glyphs=4
2026-03-14T07:36:44.944467	099964a4	0	0	0.0000	CRASH	gen=443 glyphs=4
2026-03-14T07:36:44.944736	099964a4	0	0	0.0000	CRASH	gen=444 glyphs=4
2026-03-14T07:36:44.944930	099964a4	0	0	0.0000	CRASH	gen=444 glyphs=4
2026-03-14T07:36:44.945126	3df4ecfa	0	0	0.0000	CRASH	gen=444 glyphs=3
2026-03-14T07:36:44.945319	099964a4	0	0	0.0000	CRASH	gen=444 glyphs=4
2026-03-14T07:36:44.945512	e2547290	0	0	0.0000	CRASH	gen=444 glyphs=2
2026-03-14T07:36:44.945708	3a734398	0	0	0.0000	CRASH	gen=444 glyphs=4
2026-03-14T07:36:44.945902	3ca14993	0	0	0.0000	CRASH	gen=444 glyphs=4
2026-03-14T07:36:44.946096	099964a4	0	0	0.0000	CRASH	gen=444 glyphs=4
2026-03-14T07:36:44.946291	099964a4	0	0	0.0000	CRASH	gen=444 glyphs=4
2026-03-14T07:36:44.946483	099964a4	0	0	0.0000	CRASH	gen=444 glyphs=4
2026-03-14T07:36:44.946758	099964a4	0	0	0.0000	CRASH	gen=445 glyphs=4
2026-03-14T07:36:44.946956	099964a4	0	0	0.0000	CRASH	gen=445 glyphs=4
2026-03-14T07:36:44.947151	099964a4	0	0	0.0000	CRASH	gen=445 glyphs=4
2026-03-14T07:36:44.947345	cf93b656	0	0	0.0000	CRASH	gen=445 glyphs=3
2026-03-14T07:36:44.947539	e30dc56c	0	0	0.0000	CRASH	gen=445 glyphs=3
2026-03-14T07:36:44.947735	099964a4	0	0	0.0000	CRASH	gen=445 glyphs=4
2026-03-14T07:36:44.947929	099964a4	0	0	0.0000	CRASH	gen=445 glyphs=4
2026-03-14T07:36:44.948122	099964a4	0	0	0.0000	CRASH	gen=445 glyphs=4
2026-03-14T07:36:44.948314	099964a4	0	0	0.0000	CRASH	gen=445 glyphs=4
2026-03-14T07:36:44.948506	c677fa25	0	0	0.0000	CRASH	gen=445 glyphs=2
2026-03-14T07:36:44.948784	099964a4	0	0	0.0000	CRASH	gen=446 glyphs=4
2026-03-14T07:36:44.948980	099964a4	0	0	0.0000	CRASH	gen=446 glyphs=4
2026-03-14T07:36:44.949173	d7341a0f	0	0	0.0000	CRASH	gen=446 glyphs=3
2026-03-14T07:36:44.949366	099964a4	0	0	0.0000	CRASH	gen=446 glyphs=4
2026-03-14T07:36:44.949559	099964a4	0	0	0.0000	CRASH	gen=446 glyphs=4
2026-03-14T07:36:44.949750	099964a4	0	0	0.0000	CRASH	gen=446 glyphs=4
2026-03-14T07:36:44.949945	7ede4765	0	0	0.0000	CRASH	gen=446 glyphs=2
2026-03-14T07:36:44.950134	099964a4	0	0	0.0000	CRASH	gen=446 glyphs=4
2026-03-14T07:36:44.950324	099964a4	0	0	0.0000	CRASH	gen=446 glyphs=4
2026-03-14T07:36:44.950510	099964a4	0	0	0.0000	CRASH	gen=446 glyphs=4
2026-03-14T07:36:44.950782	099964a4	0	0	0.0000	CRASH	gen=447 glyphs=4
2026-03-14T07:36:44.950977	099964a4	0	0	0.0000	CRASH	gen=447 glyphs=4
2026-03-14T07:36:44.951168	28c76d78	0	0	0.0000	CRASH	gen=447 glyphs=4
2026-03-14T07:36:44.951362	099964a4	0	0	0.0000	CRASH	gen=447 glyphs=4
2026-03-14T07:36:44.951555	099964a4	0	0	0.0000	CRASH	gen=447 glyphs=4
2026-03-14T07:36:44.951749	ff30496a	0	0	0.0000	CRASH	gen=447 glyphs=3
2026-03-14T07:36:44.951939	3a734398	0	0	0.0000	CRASH	gen=447 glyphs=4
2026-03-14T07:36:44.952135	099964a4	0	0	0.0000	CRASH	gen=447 glyphs=4
2026-03-14T07:36:44.952329	af60020d	0	0	0.0000	CRASH	gen=447 glyphs=3
2026-03-14T07:36:44.952524	3a734398	0	0	0.0000	CRASH	gen=447 glyphs=4
2026-03-14T07:36:44.952798	099964a4	0	0	0.0000	CRASH	gen=448 glyphs=4
2026-03-14T07:36:44.952994	099964a4	0	0	0.0000	CRASH	gen=448 glyphs=4
2026-03-14T07:36:44.953197	8da1f8d8	0	0	0.0000	CRASH	gen=448 glyphs=4
2026-03-14T07:36:44.953393	ff30496a	0	0	0.0000	CRASH	gen=448 glyphs=3
2026-03-14T07:36:44.953588	099964a4	0	0	0.0000	CRASH	gen=448 glyphs=4
2026-03-14T07:36:44.953782	80cef82b	0	0	0.0000	CRASH	gen=448 glyphs=4
2026-03-14T07:36:44.953975	3ca14993	0	0	0.0000	CRASH	gen=448 glyphs=4
2026-03-14T07:36:44.954167	4e17f7b4	0	0	0.0000	CRASH	gen=448 glyphs=4
2026-03-14T07:36:44.954370	099964a4	0	0	0.0000	CRASH	gen=448 glyphs=4
2026-03-14T07:36:44.954564	ce8a26c9	0	0	0.0000	CRASH	gen=448 glyphs=4
2026-03-14T07:36:44.954843	099964a4	0	0	0.0000	CRASH	gen=449 glyphs=4
2026-03-14T07:36:44.955041	099964a4	0	0	0.0000	CRASH	gen=449 glyphs=4
2026-03-14T07:36:44.955234	4fa8870e	0	0	0.0000	CRASH	gen=449 glyphs=3
2026-03-14T07:36:44.955434	099964a4	0	0	0.0000	CRASH	gen=449 glyphs=4
2026-03-14T07:36:44.955630	099964a4	0	0	0.0000	CRASH	gen=449 glyphs=4
2026-03-14T07:36:44.955828	3ca14993	0	0	0.0000	CRASH	gen=449 glyphs=4
2026-03-14T07:36:44.956022	acacf4e0	0	0	0.0000	CRASH	gen=449 glyphs=4
2026-03-14T07:36:44.956218	099964a4	0	0	0.0000	CRASH	gen=449 glyphs=4
2026-03-14T07:36:44.956421	099964a4	0	0	0.0000	CRASH	gen=449 glyphs=4
2026-03-14T07:36:44.956618	3ca14993	0	0	0.0000	CRASH	gen=449 glyphs=4
2026-03-14T07:36:44.956894	099964a4	0	0	0.0000	CRASH	gen=450 glyphs=4
2026-03-14T07:36:44.957093	099964a4	0	0	0.0000	CRASH	gen=450 glyphs=4
2026-03-14T07:36:44.957293	099964a4	0	0	0.0000	CRASH	gen=450 glyphs=4
2026-03-14T07:36:44.957489	80c30230	0	0	0.0000	CRASH	gen=450 glyphs=4
2026-03-14T07:36:44.957692	099964a4	0	0	0.0000	CRASH	gen=450 glyphs=4
2026-03-14T07:36:44.957885	3ca14993	0	0	0.0000	CRASH	gen=450 glyphs=4
2026-03-14T07:36:44.958079	caa1422f	0	0	0.0000	CRASH	gen=450 glyphs=4
2026-03-14T07:36:44.958272	099964a4	0	0	0.0000	CRASH	gen=450 glyphs=4
2026-03-14T07:36:44.958465	a4c11f1f	0	0	0.0000	CRASH	gen=450 glyphs=3
2026-03-14T07:36:44.958671	8576a0d3	0	0	0.0000	CRASH	gen=450 glyphs=3
2026-03-14T07:36:44.958962	099964a4	0	0	0.0000	CRASH	gen=451 glyphs=4
2026-03-14T07:36:44.959165	099964a4	0	0	0.0000	CRASH	gen=451 glyphs=4
