timestamp	program_hash	spirv_size	word_count	fitness	status	description
2026-03-13T22:46:43.966327	b57e7176	120	30	1.0000	DISCARD	gen=110 glyphs=4
2026-03-13T22:46:44.494372	37f4017b	116	29	1.0000	DISCARD	gen=66 glyphs=4
2026-03-13T22:46:46.674992	0eaedb57	116	29	1.0000	DISCARD	gen=110 glyphs=4
2026-03-13T22:46:47.261278	37f4017b	116	29	1.0000	DISCARD	gen=67 glyphs=4
2026-03-13T22:46:49.515986	19355583	120	30	1.0000	DISCARD	gen=111 glyphs=4
2026-03-13T22:46:50.067686	bfdf7cad	120	30	1.0000	DISCARD	gen=67 glyphs=4
2026-03-13T22:46:52.240489	8aef8872	116	29	1.0000	DISCARD	gen=111 glyphs=4
2026-03-13T22:46:52.799890	37f4017b	116	29	1.0000	DISCARD	gen=67 glyphs=4
2026-03-13T22:46:54.953653	02f8538e	116	29	1.0000	DISCARD	gen=111 glyphs=4
2026-03-13T22:46:55.490280	37f4017b	116	29	1.0000	DISCARD	gen=67 glyphs=4
2026-03-13T22:46:57.642633	ae44ace5	116	29	1.0000	DISCARD	gen=111 glyphs=4
2026-03-13T22:46:58.191401	71e2ba66	116	29	1.0000	DISCARD	gen=67 glyphs=4
2026-03-13T22:47:00.327245	8893e37f	120	30	1.0000	DISCARD	gen=111 glyphs=4
2026-03-13T22:47:00.852347	55d6c151	120	30	1.0000	DISCARD	gen=67 glyphs=4
2026-03-13T22:47:03.083124	2e326a48	116	29	1.0000	DISCARD	gen=111 glyphs=4
2026-03-13T22:47:03.620531	5a06ca32	120	30	1.0000	DISCARD	gen=67 glyphs=4
2026-03-13T22:47:05.788807	b57e7176	120	30	1.0000	DISCARD	gen=111 glyphs=4
2026-03-13T22:47:06.328803	71e2ba66	116	29	1.0000	DISCARD	gen=67 glyphs=4
2026-03-13T22:47:08.462631	1e5f0e21	116	29	1.0000	DISCARD	gen=111 glyphs=4
2026-03-13T22:47:08.984168	e0ab8add	116	29	1.0000	DISCARD	gen=67 glyphs=4
2026-03-13T22:47:11.134414	56d183fa	116	29	1.0000	DISCARD	gen=111 glyphs=4
2026-03-13T22:47:11.669455	71e2ba66	116	29	1.0000	DISCARD	gen=67 glyphs=4
2026-03-13T22:47:13.820287	8814ce8c	116	29	1.0000	DISCARD	gen=111 glyphs=4
2026-03-13T22:47:14.360749	37f4017b	116	29	1.0000	DISCARD	gen=68 glyphs=4
2026-03-13T22:47:16.485859	19355583	120	30	1.0000	DISCARD	gen=112 glyphs=4
2026-03-13T22:47:17.021133	bfdf7cad	120	30	1.0000	DISCARD	gen=68 glyphs=4
2026-03-13T22:47:19.174636	8aef8872	116	29	1.0000	DISCARD	gen=112 glyphs=4
2026-03-13T22:47:19.713277	37f4017b	116	29	1.0000	DISCARD	gen=68 glyphs=4
2026-03-13T22:47:21.848796	8c5a29b3	120	30	1.0000	DISCARD	gen=112 glyphs=4
2026-03-13T22:47:22.384871	55d6c151	120	30	1.0000	DISCARD	gen=68 glyphs=4
2026-03-13T22:47:24.519780	0eaedb57	116	29	1.0000	DISCARD	gen=112 glyphs=4
2026-03-13T22:47:25.090170	fdb5d108	120	30	1.0000	DISCARD	gen=68 glyphs=4
2026-03-13T22:47:27.225365	8aef8872	116	29	1.0000	DISCARD	gen=112 glyphs=4
2026-03-13T22:47:27.761444	fdb5d108	120	30	1.0000	DISCARD	gen=68 glyphs=4
2026-03-13T22:47:29.916310	0eaedb57	116	29	1.0000	DISCARD	gen=112 glyphs=4
2026-03-13T22:47:30.452469	5a06ca32	120	30	1.0000	DISCARD	gen=68 glyphs=4
2026-03-13T22:47:32.597447	875e0f8a	116	29	1.0000	DISCARD	gen=112 glyphs=4
2026-03-13T22:47:33.138498	37f4017b	116	29	1.0000	DISCARD	gen=68 glyphs=4
2026-03-13T22:47:35.347762	ae44ace5	116	29	1.0000	DISCARD	gen=112 glyphs=4
2026-03-13T22:47:35.882308	2701cb73	116	29	1.0000	DISCARD	gen=68 glyphs=4
2026-03-13T22:47:38.032889	8aef8872	116	29	1.0000	DISCARD	gen=112 glyphs=4
2026-03-13T22:47:38.572813	37f4017b	116	29	1.0000	DISCARD	gen=68 glyphs=4
2026-03-13T22:47:40.760682	0eaedb57	116	29	1.0000	DISCARD	gen=112 glyphs=4
2026-03-13T22:47:41.313001	37f4017b	116	29	1.0000	DISCARD	gen=69 glyphs=4
2026-03-13T22:47:43.470588	19355583	120	30	1.0000	DISCARD	gen=113 glyphs=4
2026-03-13T22:47:43.994806	bfdf7cad	120	30	1.0000	DISCARD	gen=69 glyphs=4
2026-03-13T22:47:46.160018	8aef8872	116	29	1.0000	DISCARD	gen=113 glyphs=4
2026-03-13T22:47:46.699501	fdb5d108	120	30	1.0000	DISCARD	gen=69 glyphs=4
2026-03-13T22:47:48.857329	f7b42d32	116	29	1.0000	DISCARD	gen=113 glyphs=4
2026-03-13T22:47:49.403956	7ca87b42	116	29	1.0000	DISCARD	gen=69 glyphs=4
2026-03-13T22:47:51.548407	9968cc29	120	30	1.0000	DISCARD	gen=113 glyphs=4
2026-03-13T22:47:52.088967	d11c1062	120	30	1.0000	DISCARD	gen=69 glyphs=4
2026-03-13T22:47:54.215654	8aef8872	116	29	1.0000	DISCARD	gen=113 glyphs=4
2026-03-13T22:47:54.772023	fdb5d108	120	30	1.0000	DISCARD	gen=69 glyphs=4
2026-03-13T22:47:56.950938	b7aed8e9	116	29	1.0000	DISCARD	gen=113 glyphs=4
2026-03-13T22:47:57.495235	1e02c189	116	29	1.0000	DISCARD	gen=69 glyphs=4
2026-03-13T22:47:59.631096	8aef8872	116	29	1.0000	DISCARD	gen=113 glyphs=4
2026-03-13T22:48:00.164537	dd347633	116	29	0.9500	DISCARD	gen=69 glyphs=4
2026-03-13T22:48:02.317754	a78f9454	120	30	1.0000	DISCARD	gen=113 glyphs=4
2026-03-13T22:48:02.855876	15e24b0d	116	29	1.0000	DISCARD	gen=69 glyphs=4
2026-03-13T22:48:05.017884	0eaedb57	116	29	1.0000	DISCARD	gen=113 glyphs=4
2026-03-13T22:48:05.634199	37f4017b	116	29	1.0000	DISCARD	gen=69 glyphs=4
2026-03-13T22:48:07.809348	b57e7176	120	30	1.0000	DISCARD	gen=113 glyphs=4
2026-03-13T22:48:08.345258	37f4017b	116	29	1.0000	DISCARD	gen=70 glyphs=4
2026-03-13T22:48:10.492040	19355583	120	30	1.0000	DISCARD	gen=114 glyphs=4
2026-03-13T22:48:11.044322	bfdf7cad	120	30	1.0000	DISCARD	gen=70 glyphs=4
2026-03-13T22:48:13.217679	8aef8872	116	29	1.0000	DISCARD	gen=114 glyphs=4
2026-03-13T22:48:13.744566	5b9807ac	120	30	1.0000	DISCARD	gen=70 glyphs=4
2026-03-13T22:48:15.890171	19355583	120	30	1.0000	DISCARD	gen=114 glyphs=4
2026-03-13T22:48:16.422876	5a06ca32	120	30	1.0000	DISCARD	gen=70 glyphs=4
2026-03-13T22:48:18.579162	67cb81be	120	30	1.0000	DISCARD	gen=114 glyphs=4
2026-03-13T22:48:19.127461	37f4017b	116	29	1.0000	DISCARD	gen=70 glyphs=4
2026-03-13T22:48:21.299096	1e5f0e21	116	29	1.0000	DISCARD	gen=114 glyphs=4
2026-03-13T22:48:21.842295	55d6c151	120	30	1.0000	DISCARD	gen=70 glyphs=4
2026-03-13T22:48:23.979424	0eaedb57	116	29	1.0000	DISCARD	gen=114 glyphs=4
2026-03-13T22:48:24.515050	5b9807ac	120	30	1.0000	DISCARD	gen=70 glyphs=4
2026-03-13T22:48:26.652174	19355583	120	30	1.0000	DISCARD	gen=114 glyphs=4
2026-03-13T22:48:27.188981	e6087cbd	116	29	1.0000	DISCARD	gen=70 glyphs=4
2026-03-13T22:48:29.349572	1009a804	116	29	1.0000	DISCARD	gen=114 glyphs=4
2026-03-13T22:48:29.873826	f996e779	116	29	1.0000	DISCARD	gen=70 glyphs=4
2026-03-13T22:48:32.042388	c3136873	120	30	1.0000	DISCARD	gen=114 glyphs=4
2026-03-13T22:48:32.569466	1d34459a	116	29	1.0000	DISCARD	gen=70 glyphs=4
2026-03-13T22:48:34.723075	d7c8681b	120	30	1.0000	DISCARD	gen=114 glyphs=4
2026-03-13T22:48:35.260286	37f4017b	116	29	1.0000	DISCARD	gen=71 glyphs=4
2026-03-13T22:48:37.448633	19355583	120	30	1.0000	DISCARD	gen=115 glyphs=4
2026-03-13T22:48:38.007871	bfdf7cad	120	30	1.0000	DISCARD	gen=71 glyphs=4
2026-03-13T22:48:40.214723	8aef8872	116	29	1.0000	DISCARD	gen=115 glyphs=4
2026-03-13T22:48:40.756610	5a06ca32	120	30	1.0000	DISCARD	gen=71 glyphs=4
2026-03-13T22:48:42.919251	b6a7301d	116	29	0.9500	DISCARD	gen=115 glyphs=4
2026-03-13T22:48:43.446871	1d34459a	116	29	1.0000	DISCARD	gen=71 glyphs=4
2026-03-13T22:48:45.616989	1e5f0e21	116	29	1.0000	DISCARD	gen=115 glyphs=4
2026-03-13T22:48:46.174361	e577a5ed	116	29	1.0000	DISCARD	gen=71 glyphs=4
2026-03-13T22:48:48.337148	19355583	120	30	1.0000	DISCARD	gen=115 glyphs=4
2026-03-13T22:48:48.887941	37f4017b	116	29	1.0000	DISCARD	gen=71 glyphs=4
2026-03-13T22:48:51.043820	67cb81be	120	30	1.0000	DISCARD	gen=115 glyphs=4
2026-03-13T22:48:51.588223	5a06ca32	120	30	1.0000	DISCARD	gen=71 glyphs=4
2026-03-13T22:48:53.724183	19355583	120	30	1.0000	DISCARD	gen=115 glyphs=4
2026-03-13T22:48:54.267955	7ca87b42	116	29	1.0000	DISCARD	gen=71 glyphs=4
2026-03-13T22:48:56.434541	0eaedb57	116	29	1.0000	DISCARD	gen=115 glyphs=4
2026-03-13T22:48:56.971186	5a06ca32	120	30	1.0000	DISCARD	gen=71 glyphs=4
2026-03-13T22:48:59.120237	7a03b092	116	29	1.0000	DISCARD	gen=115 glyphs=4
2026-03-13T22:48:59.657655	1af949f3	116	29	1.0000	DISCARD	gen=71 glyphs=4
2026-03-13T22:49:01.864095	a78f9454	120	30	1.0000	DISCARD	gen=115 glyphs=4
2026-03-13T22:49:02.436238	37f4017b	116	29	1.0000	DISCARD	gen=72 glyphs=4
2026-03-13T22:49:04.691178	19355583	120	30	1.0000	DISCARD	gen=116 glyphs=4
2026-03-13T22:49:05.247204	bfdf7cad	120	30	1.0000	DISCARD	gen=72 glyphs=4
2026-03-13T22:49:07.439223	8aef8872	116	29	1.0000	DISCARD	gen=116 glyphs=4
2026-03-13T22:49:07.986047	5b9807ac	120	30	1.0000	DISCARD	gen=72 glyphs=4
2026-03-13T22:49:10.243747	19355583	120	30	1.0000	DISCARD	gen=116 glyphs=4
2026-03-13T22:49:10.829364	2701cb73	116	29	1.0000	DISCARD	gen=72 glyphs=4
2026-03-13T22:49:13.021129	0eaedb57	116	29	1.0000	DISCARD	gen=116 glyphs=4
2026-03-13T22:49:13.553145	fdb5d108	120	30	1.0000	DISCARD	gen=72 glyphs=4
2026-03-13T22:49:15.761822	8aef8872	116	29	1.0000	DISCARD	gen=116 glyphs=4
2026-03-13T22:49:16.339388	637554a5	116	29	1.0000	DISCARD	gen=72 glyphs=4
2026-03-13T22:49:18.556186	0eaedb57	116	29	1.0000	DISCARD	gen=116 glyphs=4
2026-03-13T22:49:19.118405	1742c0ab	116	29	1.0000	DISCARD	gen=72 glyphs=4
2026-03-13T22:49:21.236088	0eaedb57	116	29	1.0000	DISCARD	gen=116 glyphs=4
2026-03-13T22:49:21.778123	61080723	116	29	0.9500	DISCARD	gen=72 glyphs=4
2026-03-13T22:49:23.969477	b7aed8e9	116	29	1.0000	DISCARD	gen=116 glyphs=4
2026-03-13T22:49:24.499504	fdb5d108	120	30	1.0000	DISCARD	gen=72 glyphs=4
2026-03-13T22:49:26.664007	e2cd28ea	120	30	1.0000	DISCARD	gen=116 glyphs=4
2026-03-13T22:49:27.207311	5a06ca32	120	30	1.0000	DISCARD	gen=72 glyphs=4
2026-03-13T22:49:29.390491	ae44ace5	116	29	1.0000	DISCARD	gen=116 glyphs=4
2026-03-13T22:49:29.937080	37f4017b	116	29	1.0000	DISCARD	gen=73 glyphs=4
2026-03-13T22:49:32.110894	19355583	120	30	1.0000	DISCARD	gen=117 glyphs=4
2026-03-13T22:49:32.652078	bfdf7cad	120	30	1.0000	DISCARD	gen=73 glyphs=4
2026-03-13T22:49:34.813382	8aef8872	116	29	1.0000	DISCARD	gen=117 glyphs=4
2026-03-13T22:49:35.386729	71e2ba66	116	29	1.0000	DISCARD	gen=73 glyphs=4
2026-03-13T22:49:37.655344	50dc991d	116	29	1.0000	DISCARD	gen=117 glyphs=4
2026-03-13T22:49:38.220441	2701cb73	116	29	1.0000	DISCARD	gen=73 glyphs=4
2026-03-13T22:49:40.450203	0eaedb57	116	29	1.0000	DISCARD	gen=117 glyphs=4
2026-03-13T22:49:41.049214	42b6e6eb	116	29	0.9500	DISCARD	gen=73 glyphs=4
2026-03-13T22:49:43.258936	c3759e13	116	29	1.0000	DISCARD	gen=117 glyphs=4
2026-03-13T22:49:43.808959	f0a02d92	116	29	1.0000	DISCARD	gen=73 glyphs=4
2026-03-13T22:49:46.062437	50dc991d	116	29	1.0000	DISCARD	gen=117 glyphs=4
2026-03-13T22:49:46.599623	2701cb73	116	29	1.0000	DISCARD	gen=73 glyphs=4
2026-03-13T22:49:48.768570	113ccc1e	116	29	1.0000	DISCARD	gen=117 glyphs=4
2026-03-13T22:49:49.337847	9fcc559b	120	30	1.0000	DISCARD	gen=73 glyphs=4
2026-03-13T22:49:51.582587	1e5f0e21	116	29	1.0000	DISCARD	gen=117 glyphs=4
2026-03-13T22:49:52.130971	12b38c2d	116	29	1.0000	DISCARD	gen=73 glyphs=4
2026-03-13T22:49:54.284403	19355583	120	30	1.0000	DISCARD	gen=117 glyphs=4
2026-03-13T22:49:54.825267	37f4017b	116	29	1.0000	DISCARD	gen=73 glyphs=4
2026-03-13T22:49:56.988178	726d20ef	116	29	1.0000	DISCARD	gen=117 glyphs=4
2026-03-13T22:49:57.524790	37f4017b	116	29	1.0000	DISCARD	gen=74 glyphs=4
2026-03-13T22:49:59.678082	19355583	120	30	1.0000	DISCARD	gen=118 glyphs=4
2026-03-13T22:50:00.216099	bfdf7cad	120	30	1.0000	DISCARD	gen=74 glyphs=4
2026-03-13T22:50:02.374284	8aef8872	116	29	1.0000	DISCARD	gen=118 glyphs=4
2026-03-13T22:50:02.915278	4c9b0dd4	120	30	1.0000	DISCARD	gen=74 glyphs=4
2026-03-13T22:50:05.111483	19355583	120	30	1.0000	DISCARD	gen=118 glyphs=4
2026-03-13T22:50:05.642881	bfdf7cad	120	30	1.0000	DISCARD	gen=74 glyphs=4
2026-03-13T22:50:07.826722	67cb81be	120	30	1.0000	DISCARD	gen=118 glyphs=4
2026-03-13T22:50:08.367996	d11c1062	120	30	1.0000	DISCARD	gen=74 glyphs=4
2026-03-13T22:50:10.550119	f3882af1	120	30	1.0000	DISCARD	gen=118 glyphs=4
2026-03-13T22:50:11.089799	c4b12a78	120	30	0.9500	DISCARD	gen=74 glyphs=4
2026-03-13T22:50:13.344280	9e34ede0	116	29	1.0000	DISCARD	gen=118 glyphs=4
2026-03-13T22:50:13.933496	2701cb73	116	29	1.0000	DISCARD	gen=74 glyphs=4
2026-03-13T22:50:16.088991	19355583	120	30	1.0000	DISCARD	gen=118 glyphs=4
2026-03-13T22:50:16.645067	37f4017b	116	29	1.0000	DISCARD	gen=74 glyphs=4
2026-03-13T22:50:18.808991	8aef8872	116	29	1.0000	DISCARD	gen=118 glyphs=4
2026-03-13T22:50:19.340960	5a06ca32	120	30	1.0000	DISCARD	gen=74 glyphs=4
2026-03-13T22:50:21.510928	8aef8872	116	29	1.0000	DISCARD	gen=118 glyphs=4
2026-03-13T22:50:22.049545	3d94e3d1	120	30	1.0000	DISCARD	gen=74 glyphs=4
2026-03-13T22:50:24.236384	050862ad	120	30	1.0000	DISCARD	gen=118 glyphs=4
2026-03-13T22:50:24.776650	37f4017b	116	29	1.0000	DISCARD	gen=75 glyphs=4
2026-03-13T22:50:26.954140	19355583	120	30	1.0000	DISCARD	gen=119 glyphs=4
2026-03-13T22:50:27.500615	bfdf7cad	120	30	1.0000	DISCARD	gen=75 glyphs=4
2026-03-13T22:50:29.710009	8aef8872	116	29	1.0000	DISCARD	gen=119 glyphs=4
2026-03-13T22:50:30.243700	9b76aff6	116	29	1.0000	DISCARD	gen=75 glyphs=4
2026-03-13T22:50:32.412923	dfe6eaab	120	30	1.0000	DISCARD	gen=119 glyphs=4
2026-03-13T22:50:32.953094	1814e4f6	116	29	1.0000	DISCARD	gen=75 glyphs=4
2026-03-13T22:50:35.125450	b7aed8e9	116	29	1.0000	DISCARD	gen=119 glyphs=4
2026-03-13T22:50:35.667364	55d6c151	120	30	1.0000	DISCARD	gen=75 glyphs=4
2026-03-13T22:50:37.837459	b57e7176	120	30	1.0000	DISCARD	gen=119 glyphs=4
2026-03-13T22:50:38.380877	f13ad197	116	29	1.0000	DISCARD	gen=75 glyphs=4
2026-03-13T22:50:40.538283	41342cf8	116	29	1.0000	DISCARD	gen=119 glyphs=4
2026-03-13T22:50:41.071385	d11c1062	120	30	1.0000	DISCARD	gen=75 glyphs=4
2026-03-13T22:50:43.272462	0f41a3cf	116	29	0.9500	DISCARD	gen=119 glyphs=4
2026-03-13T22:50:43.812971	2701cb73	116	29	1.0000	DISCARD	gen=75 glyphs=4
2026-03-13T22:50:46.048208	67cb81be	120	30	1.0000	DISCARD	gen=119 glyphs=4
2026-03-13T22:50:46.602853	161152b9	116	29	1.0000	DISCARD	gen=75 glyphs=4
2026-03-13T22:50:48.763749	050862ad	120	30	1.0000	DISCARD	gen=119 glyphs=4
2026-03-13T22:50:49.305592	bfdf7cad	120	30	1.0000	DISCARD	gen=75 glyphs=4
2026-03-13T22:50:51.471210	8aef8872	116	29	1.0000	DISCARD	gen=119 glyphs=4
2026-03-13T22:50:52.011221	37f4017b	116	29	1.0000	DISCARD	gen=76 glyphs=4
2026-03-13T22:50:54.163433	19355583	120	30	1.0000	DISCARD	gen=120 glyphs=4
2026-03-13T22:50:54.699412	bfdf7cad	120	30	1.0000	DISCARD	gen=76 glyphs=4
2026-03-13T22:50:56.863632	8aef8872	116	29	1.0000	DISCARD	gen=120 glyphs=4
2026-03-13T22:50:57.409381	5a06ca32	120	30	1.0000	DISCARD	gen=76 glyphs=4
2026-03-13T22:50:59.591978	5bf50d91	116	29	1.0000	DISCARD	gen=120 glyphs=4
2026-03-13T22:51:04.887037	37f4017b	116	29	1.0000	DISCARD	gen=76 glyphs=4
2026-03-13T22:51:07.082143	050862ad	120	30	1.0000	DISCARD	gen=120 glyphs=4
2026-03-13T22:51:07.632827	95795596	116	29	1.0000	DISCARD	gen=76 glyphs=4
2026-03-13T22:51:09.796657	8aef8872	116	29	1.0000	DISCARD	gen=120 glyphs=4
2026-03-13T22:51:10.338598	d11c1062	120	30	1.0000	DISCARD	gen=76 glyphs=4
2026-03-13T22:51:12.686666	0eaedb57	116	29	1.0000	DISCARD	gen=120 glyphs=4
2026-03-13T22:51:13.233370	60707a8f	120	30	1.0000	DISCARD	gen=76 glyphs=4
2026-03-13T22:51:15.391247	b7aed8e9	116	29	1.0000	DISCARD	gen=120 glyphs=4
2026-03-13T22:51:15.925788	71e2ba66	116	29	1.0000	DISCARD	gen=76 glyphs=4
2026-03-13T22:51:18.193194	50dc991d	116	29	1.0000	DISCARD	gen=120 glyphs=4
2026-03-13T22:51:18.731161	ba1f5f02	116	29	1.0000	DISCARD	gen=76 glyphs=4
2026-03-13T22:51:21.058967	19355583	120	30	1.0000	DISCARD	gen=120 glyphs=4
2026-03-13T22:51:21.603699	097377b5	116	29	1.0000	DISCARD	gen=76 glyphs=4
2026-03-13T22:51:23.772278	050862ad	120	30	1.0000	DISCARD	gen=120 glyphs=4
2026-03-13T22:51:24.318350	37f4017b	116	29	1.0000	DISCARD	gen=77 glyphs=4
2026-03-13T22:51:26.485408	19355583	120	30	1.0000	DISCARD	gen=121 glyphs=4
2026-03-13T22:51:27.025307	bfdf7cad	120	30	1.0000	DISCARD	gen=77 glyphs=4
2026-03-13T22:51:29.242464	8aef8872	116	29	1.0000	DISCARD	gen=121 glyphs=4
2026-03-13T22:51:29.780038	4c9b0dd4	120	30	1.0000	DISCARD	gen=77 glyphs=4
2026-03-13T22:51:31.943662	bbce3b4e	120	30	1.0000	DISCARD	gen=121 glyphs=4
2026-03-13T22:51:32.507017	9bb4afcc	116	29	1.0000	DISCARD	gen=77 glyphs=4
2026-03-13T22:51:34.680125	9e34ede0	116	29	1.0000	DISCARD	gen=121 glyphs=4
2026-03-13T22:51:35.221682	37f4017b	116	29	1.0000	DISCARD	gen=77 glyphs=4
2026-03-13T22:51:37.373070	19355583	120	30	1.0000	DISCARD	gen=121 glyphs=4
2026-03-13T22:51:37.915826	8093b206	120	30	1.0000	DISCARD	gen=77 glyphs=4
2026-03-13T22:51:40.074309	19355583	120	30	1.0000	DISCARD	gen=121 glyphs=4
2026-03-13T22:51:40.635484	37f4017b	116	29	1.0000	DISCARD	gen=77 glyphs=4
2026-03-13T22:51:42.820703	8279dca9	120	30	1.0000	DISCARD	gen=121 glyphs=4
2026-03-13T22:51:43.365252	8ddc1e68	120	30	1.0000	DISCARD	gen=77 glyphs=4
2026-03-13T22:51:45.533291	91ba78f6	120	30	1.0000	DISCARD	gen=121 glyphs=4
2026-03-13T22:51:46.068838	5a06ca32	120	30	1.0000	DISCARD	gen=77 glyphs=4
2026-03-13T22:51:48.285166	050862ad	120	30	1.0000	DISCARD	gen=121 glyphs=4
2026-03-13T22:51:48.816640	12b38c2d	116	29	1.0000	DISCARD	gen=77 glyphs=4
2026-03-13T22:51:50.976512	6c1219d2	116	29	1.0000	DISCARD	gen=121 glyphs=4
2026-03-13T22:51:51.506145	37f4017b	116	29	1.0000	DISCARD	gen=78 glyphs=4
2026-03-13T22:51:53.665639	19355583	120	30	1.0000	DISCARD	gen=122 glyphs=4
2026-03-13T22:51:54.201301	bfdf7cad	120	30	1.0000	DISCARD	gen=78 glyphs=4
2026-03-13T22:51:56.337022	8aef8872	116	29	1.0000	DISCARD	gen=122 glyphs=4
2026-03-13T22:51:56.878391	5a06ca32	120	30	1.0000	DISCARD	gen=78 glyphs=4
2026-03-13T22:51:59.043613	8aef8872	116	29	1.0000	DISCARD	gen=122 glyphs=4
2026-03-13T22:51:59.584493	4c9b0dd4	120	30	1.0000	DISCARD	gen=78 glyphs=4
2026-03-13T22:52:01.771127	8aef8872	116	29	1.0000	DISCARD	gen=122 glyphs=4
2026-03-13T22:52:02.310028	12b38c2d	116	29	1.0000	DISCARD	gen=78 glyphs=4
2026-03-13T22:52:04.484745	a78f9454	120	30	1.0000	DISCARD	gen=122 glyphs=4
2026-03-13T22:52:05.026203	b6dbd330	120	30	1.0000	DISCARD	gen=78 glyphs=4
2026-03-13T22:52:07.181758	e2cd28ea	120	30	1.0000	DISCARD	gen=122 glyphs=4
2026-03-13T22:52:07.713152	9dbfd563	120	30	1.0000	DISCARD	gen=78 glyphs=4
2026-03-13T22:52:09.879410	ae44ace5	116	29	1.0000	DISCARD	gen=122 glyphs=4
2026-03-13T22:52:10.435942	12b38c2d	116	29	1.0000	DISCARD	gen=78 glyphs=4
2026-03-13T22:52:12.584447	8aef8872	116	29	1.0000	DISCARD	gen=122 glyphs=4
2026-03-13T22:52:13.129032	d11c1062	120	30	1.0000	DISCARD	gen=78 glyphs=4
2026-03-13T22:52:15.270995	e8c7f6cf	120	30	1.0000	DISCARD	gen=122 glyphs=4
2026-03-13T22:52:15.805014	a9fcb4fc	116	29	1.0000	DISCARD	gen=78 glyphs=4
2026-03-13T22:52:17.945806	72160e66	116	29	0.9500	DISCARD	gen=122 glyphs=4
2026-03-13T22:52:18.504224	37f4017b	116	29	1.0000	DISCARD	gen=79 glyphs=4
2026-03-13T22:52:20.686940	19355583	120	30	1.0000	DISCARD	gen=123 glyphs=4
2026-03-13T22:52:21.239933	bfdf7cad	120	30	1.0000	DISCARD	gen=79 glyphs=4
2026-03-13T22:52:23.402646	8aef8872	116	29	1.0000	DISCARD	gen=123 glyphs=4
2026-03-13T22:52:23.934012	37f4017b	116	29	1.0000	DISCARD	gen=79 glyphs=4
2026-03-13T22:52:26.108080	7ea892fe	120	30	1.0000	DISCARD	gen=123 glyphs=4
2026-03-13T22:52:26.643042	7ca87b42	116	29	1.0000	DISCARD	gen=79 glyphs=4
2026-03-13T22:52:28.815068	9c036287	116	29	1.0000	DISCARD	gen=123 glyphs=4
2026-03-13T22:52:29.372453	fdb5d108	120	30	1.0000	DISCARD	gen=79 glyphs=4
2026-03-13T22:52:31.507503	34aa178c	116	29	1.0000	DISCARD	gen=123 glyphs=4
2026-03-13T22:52:32.062538	37f4017b	116	29	1.0000	DISCARD	gen=79 glyphs=4
2026-03-13T22:52:34.254677	65145eca	116	29	1.0000	DISCARD	gen=123 glyphs=4
2026-03-13T22:52:34.795955	1d34459a	116	29	1.0000	DISCARD	gen=79 glyphs=4
2026-03-13T22:52:36.956499	8aef8872	116	29	1.0000	DISCARD	gen=123 glyphs=4
2026-03-13T22:52:37.499664	5a06ca32	120	30	1.0000	DISCARD	gen=79 glyphs=4
2026-03-13T22:52:39.652408	875e0f8a	116	29	1.0000	DISCARD	gen=123 glyphs=4
2026-03-13T22:52:40.176414	94488d12	116	29	1.0000	DISCARD	gen=79 glyphs=4
2026-03-13T22:52:42.361480	b04a0251	116	29	1.0000	DISCARD	gen=123 glyphs=4
2026-03-13T22:52:42.892077	96a9e22d	116	29	1.0000	DISCARD	gen=79 glyphs=4
2026-03-13T22:52:45.065427	e8c7f6cf	120	30	1.0000	DISCARD	gen=123 glyphs=4
2026-03-13T22:52:45.588317	37f4017b	116	29	1.0000	DISCARD	gen=80 glyphs=4
2026-03-13T22:52:47.765411	19355583	120	30	1.0000	DISCARD	gen=124 glyphs=4
2026-03-13T22:52:48.304286	bfdf7cad	120	30	1.0000	DISCARD	gen=80 glyphs=4
2026-03-13T22:52:50.464132	8aef8872	116	29	1.0000	DISCARD	gen=124 glyphs=4
2026-03-13T22:52:51.008383	5a06ca32	120	30	1.0000	DISCARD	gen=80 glyphs=4
2026-03-13T22:52:53.240246	eca7ab6c	116	29	1.0000	DISCARD	gen=124 glyphs=4
2026-03-13T22:52:53.788484	71e2ba66	116	29	1.0000	DISCARD	gen=80 glyphs=4
2026-03-13T22:52:55.943072	8aef8872	116	29	1.0000	DISCARD	gen=124 glyphs=4
2026-03-13T22:52:56.474538	5cc74b6b	116	29	1.0000	DISCARD	gen=80 glyphs=4
2026-03-13T22:52:58.667250	8aef8872	116	29	1.0000	DISCARD	gen=124 glyphs=4
2026-03-13T22:52:59.220948	7ca87b42	116	29	1.0000	DISCARD	gen=80 glyphs=4
2026-03-13T22:53:01.384075	050862ad	120	30	1.0000	DISCARD	gen=124 glyphs=4
2026-03-13T22:53:01.911969	37f4017b	116	29	1.0000	DISCARD	gen=80 glyphs=4
2026-03-13T22:53:04.064389	d823d333	120	30	1.0000	DISCARD	gen=124 glyphs=4
2026-03-13T22:53:04.613704	71e2ba66	116	29	1.0000	DISCARD	gen=80 glyphs=4
2026-03-13T22:53:06.763858	c73e2502	116	29	1.0000	DISCARD	gen=124 glyphs=4
2026-03-13T22:53:07.300493	5a06ca32	120	30	1.0000	DISCARD	gen=80 glyphs=4
2026-03-13T22:53:09.502949	8aef8872	116	29	1.0000	DISCARD	gen=124 glyphs=4
2026-03-13T22:53:10.029025	1ab3b1b8	116	29	1.0000	DISCARD	gen=80 glyphs=4
2026-03-13T22:53:12.220043	c318f103	120	30	1.0000	DISCARD	gen=124 glyphs=4
2026-03-13T22:53:12.774305	37f4017b	116	29	1.0000	DISCARD	gen=81 glyphs=4
2026-03-13T22:53:14.931505	19355583	120	30	1.0000	DISCARD	gen=125 glyphs=4
2026-03-13T22:53:15.475437	bfdf7cad	120	30	1.0000	DISCARD	gen=81 glyphs=4
2026-03-13T22:53:17.645878	8aef8872	116	29	1.0000	DISCARD	gen=125 glyphs=4
2026-03-13T22:53:18.183981	f16df3c3	120	30	1.0000	DISCARD	gen=81 glyphs=4
2026-03-13T22:53:20.328566	50dc991d	116	29	1.0000	DISCARD	gen=125 glyphs=4
2026-03-13T22:53:20.861116	55d6c151	120	30	1.0000	DISCARD	gen=81 glyphs=4
2026-03-13T22:53:23.042326	e2cd28ea	120	30	1.0000	DISCARD	gen=125 glyphs=4
2026-03-13T22:53:23.626563	37f4017b	116	29	1.0000	DISCARD	gen=81 glyphs=4
2026-03-13T22:53:25.770476	0eaedb57	116	29	1.0000	DISCARD	gen=125 glyphs=4
2026-03-13T22:53:26.310425	2701cb73	116	29	1.0000	DISCARD	gen=81 glyphs=4
