timestamp	program_hash	spirv_size	word_count	fitness	status	description
2026-03-14T01:15:23.795788	55d6c151	120	30	1.0000	DISCARD	gen=388 glyphs=4
2026-03-14T01:15:24.067272	0eaedb57	116	29	1.0000	DISCARD	gen=432 glyphs=4
2026-03-14T01:15:26.575584	12b38c2d	116	29	1.0000	DISCARD	gen=388 glyphs=4
2026-03-14T01:15:26.856001	19355583	120	30	1.0000	DISCARD	gen=432 glyphs=4
2026-03-14T01:15:29.287107	5a06ca32	120	30	1.0000	DISCARD	gen=388 glyphs=4
2026-03-14T01:15:29.549332	0eaedb57	116	29	1.0000	DISCARD	gen=432 glyphs=4
2026-03-14T01:15:32.010969	2701cb73	116	29	1.0000	DISCARD	gen=388 glyphs=4
2026-03-14T01:15:32.267648	19355583	120	30	1.0000	DISCARD	gen=432 glyphs=4
2026-03-14T01:15:34.682455	c9fd1faa	120	30	1.0000	DISCARD	gen=388 glyphs=4
2026-03-14T01:15:34.952632	875e0f8a	116	29	1.0000	DISCARD	gen=432 glyphs=4
2026-03-14T01:15:37.407419	37f4017b	116	29	1.0000	DISCARD	gen=388 glyphs=4
2026-03-14T01:15:37.667229	050862ad	120	30	1.0000	DISCARD	gen=432 glyphs=4
2026-03-14T01:15:40.140649	bfdf7cad	120	30	1.0000	DISCARD	gen=388 glyphs=4
2026-03-14T01:15:40.401606	050862ad	120	30	1.0000	DISCARD	gen=432 glyphs=4
2026-03-14T01:15:42.841497	37f4017b	116	29	1.0000	DISCARD	gen=389 glyphs=4
2026-03-14T01:15:43.127891	050862ad	120	30	1.0000	DISCARD	gen=432 glyphs=4
2026-03-14T01:15:45.773024	bfdf7cad	120	30	1.0000	DISCARD	gen=389 glyphs=4
2026-03-14T01:15:46.055259	19355583	120	30	1.0000	DISCARD	gen=433 glyphs=4
2026-03-14T01:15:48.539951	f3d4b36e	120	30	1.0000	DISCARD	gen=389 glyphs=4
2026-03-14T01:15:48.821644	8aef8872	116	29	1.0000	DISCARD	gen=433 glyphs=4
2026-03-14T01:15:51.302435	37f4017b	116	29	1.0000	DISCARD	gen=389 glyphs=4
2026-03-14T01:15:51.597832	c5c0490b	120	30	1.0000	DISCARD	gen=433 glyphs=4
2026-03-14T01:15:54.716857	58533601	120	30	0.9500	DISCARD	gen=389 glyphs=4
2026-03-14T01:15:54.998384	8aef8872	116	29	1.0000	DISCARD	gen=433 glyphs=4
2026-03-14T01:15:58.202029	2f2a4b81	116	29	1.0000	DISCARD	gen=389 glyphs=4
2026-03-14T01:15:58.559109	07bafc98	120	30	1.0000	DISCARD	gen=433 glyphs=4
2026-03-14T01:16:01.975365	99a07289	116	29	1.0000	DISCARD	gen=389 glyphs=4
2026-03-14T01:16:02.539543	ae44ace5	116	29	1.0000	DISCARD	gen=433 glyphs=4
2026-03-14T01:16:05.257427	55d6c151	120	30	1.0000	DISCARD	gen=389 glyphs=4
2026-03-14T01:16:05.526288	50dc991d	116	29	1.0000	DISCARD	gen=433 glyphs=4
2026-03-14T01:16:07.987850	2701cb73	116	29	1.0000	DISCARD	gen=389 glyphs=4
2026-03-14T01:16:08.254975	0eaedb57	116	29	1.0000	DISCARD	gen=433 glyphs=4
2026-03-14T01:16:10.691887	37f4017b	116	29	1.0000	DISCARD	gen=389 glyphs=4
2026-03-14T01:16:10.950756	f7c49412	120	30	1.0000	DISCARD	gen=433 glyphs=4
2026-03-14T01:16:13.451525	37f4017b	116	29	1.0000	DISCARD	gen=390 glyphs=4
2026-03-14T01:16:13.711710	d7c8681b	120	30	1.0000	DISCARD	gen=433 glyphs=4
2026-03-14T01:16:16.196510	bfdf7cad	120	30	1.0000	DISCARD	gen=390 glyphs=4
2026-03-14T01:16:16.473698	19355583	120	30	1.0000	DISCARD	gen=434 glyphs=4
2026-03-14T01:16:18.928724	4c9b0dd4	120	30	1.0000	DISCARD	gen=390 glyphs=4
2026-03-14T01:16:19.197206	8aef8872	116	29	1.0000	DISCARD	gen=434 glyphs=4
2026-03-14T01:16:21.638989	5a06ca32	120	30	1.0000	DISCARD	gen=390 glyphs=4
2026-03-14T01:16:21.911955	e8c7f6cf	120	30	1.0000	DISCARD	gen=434 glyphs=4
2026-03-14T01:16:24.382669	4c9b0dd4	120	30	1.0000	DISCARD	gen=390 glyphs=4
2026-03-14T01:16:24.663379	2f9c6ab5	116	29	1.0000	DISCARD	gen=434 glyphs=4
2026-03-14T01:16:27.122278	bcf11fa8	116	29	1.0000	DISCARD	gen=390 glyphs=4
2026-03-14T01:16:27.397722	8aef8872	116	29	1.0000	DISCARD	gen=434 glyphs=4
2026-03-14T01:16:29.872817	1d34459a	116	29	1.0000	DISCARD	gen=390 glyphs=4
2026-03-14T01:16:30.155401	8aef8872	116	29	1.0000	DISCARD	gen=434 glyphs=4
2026-03-14T01:16:32.633559	bfdf7cad	120	30	1.0000	DISCARD	gen=390 glyphs=4
2026-03-14T01:16:32.897775	b57e7176	120	30	1.0000	DISCARD	gen=434 glyphs=4
2026-03-14T01:16:35.375351	55d6c151	120	30	1.0000	DISCARD	gen=390 glyphs=4
2026-03-14T01:16:35.640352	8aef8872	116	29	1.0000	DISCARD	gen=434 glyphs=4
2026-03-14T01:16:38.108485	5a06ca32	120	30	1.0000	DISCARD	gen=390 glyphs=4
2026-03-14T01:16:38.370059	ae44ace5	116	29	1.0000	DISCARD	gen=434 glyphs=4
2026-03-14T01:16:40.854460	37f4017b	116	29	1.0000	DISCARD	gen=391 glyphs=4
2026-03-14T01:16:41.122088	e2cd28ea	120	30	1.0000	DISCARD	gen=434 glyphs=4
2026-03-14T01:16:43.584281	bfdf7cad	120	30	1.0000	DISCARD	gen=391 glyphs=4
2026-03-14T01:16:43.852453	19355583	120	30	1.0000	DISCARD	gen=435 glyphs=4
2026-03-14T01:16:46.335639	2701cb73	116	29	1.0000	DISCARD	gen=391 glyphs=4
2026-03-14T01:16:46.597298	8aef8872	116	29	1.0000	DISCARD	gen=435 glyphs=4
2026-03-14T01:16:49.029976	d11c1062	120	30	1.0000	DISCARD	gen=391 glyphs=4
2026-03-14T01:16:49.319069	b97d2f2a	116	29	1.0000	DISCARD	gen=435 glyphs=4
2026-03-14T01:16:51.770034	1d492b5f	120	30	1.0000	DISCARD	gen=391 glyphs=4
2026-03-14T01:16:52.037484	67cb81be	120	30	1.0000	DISCARD	gen=435 glyphs=4
2026-03-14T01:16:54.466625	7ca87b42	116	29	1.0000	DISCARD	gen=391 glyphs=4
2026-03-14T01:16:54.738986	8aef8872	116	29	1.0000	DISCARD	gen=435 glyphs=4
2026-03-14T01:16:57.180145	1d233a0c	120	30	1.0000	DISCARD	gen=391 glyphs=4
2026-03-14T01:16:57.452035	f45d1d9d	120	30	1.0000	DISCARD	gen=435 glyphs=4
2026-03-14T01:16:59.914563	4a0d7dc6	116	29	1.0000	DISCARD	gen=391 glyphs=4
2026-03-14T01:17:00.182829	50dc991d	116	29	1.0000	DISCARD	gen=435 glyphs=4
2026-03-14T01:17:02.713585	5a06ca32	120	30	1.0000	DISCARD	gen=391 glyphs=4
2026-03-14T01:17:02.994574	19355583	120	30	1.0000	DISCARD	gen=435 glyphs=4
2026-03-14T01:17:05.450977	37f4017b	116	29	1.0000	DISCARD	gen=391 glyphs=4
2026-03-14T01:17:05.727465	cb00fc14	116	29	1.0000	DISCARD	gen=435 glyphs=4
2026-03-14T01:17:08.155997	37f4017b	116	29	1.0000	DISCARD	gen=392 glyphs=4
2026-03-14T01:17:08.426805	8aef8872	116	29	1.0000	DISCARD	gen=435 glyphs=4
2026-03-14T01:17:10.880740	bfdf7cad	120	30	1.0000	DISCARD	gen=392 glyphs=4
2026-03-14T01:17:11.153397	19355583	120	30	1.0000	DISCARD	gen=436 glyphs=4
2026-03-14T01:17:13.595434	99d87c54	116	29	0.9500	DISCARD	gen=392 glyphs=4
2026-03-14T01:17:13.873493	8aef8872	116	29	1.0000	DISCARD	gen=436 glyphs=4
2026-03-14T01:17:16.302323	55d6c151	120	30	1.0000	DISCARD	gen=392 glyphs=4
2026-03-14T01:17:16.574940	b7aed8e9	116	29	1.0000	DISCARD	gen=436 glyphs=4
2026-03-14T01:17:19.023144	37f4017b	116	29	1.0000	DISCARD	gen=392 glyphs=4
2026-03-14T01:17:19.294799	0eaedb57	116	29	1.0000	DISCARD	gen=436 glyphs=4
2026-03-14T01:17:21.713465	5a06ca32	120	30	1.0000	DISCARD	gen=392 glyphs=4
2026-03-14T01:17:21.980833	64aef50f	116	29	1.0000	DISCARD	gen=436 glyphs=4
2026-03-14T01:17:24.421953	5a06ca32	120	30	1.0000	DISCARD	gen=392 glyphs=4
2026-03-14T01:17:24.698868	67cb81be	120	30	1.0000	DISCARD	gen=436 glyphs=4
2026-03-14T01:17:27.148635	55d6c151	120	30	1.0000	DISCARD	gen=392 glyphs=4
2026-03-14T01:17:27.414810	ae44ace5	116	29	1.0000	DISCARD	gen=436 glyphs=4
2026-03-14T01:17:29.863281	5a06ca32	120	30	1.0000	DISCARD	gen=392 glyphs=4
2026-03-14T01:17:30.129020	0eaedb57	116	29	1.0000	DISCARD	gen=436 glyphs=4
2026-03-14T01:17:32.621604	55d6c151	120	30	1.0000	DISCARD	gen=392 glyphs=4
2026-03-14T01:17:32.938502	b7aed8e9	116	29	1.0000	DISCARD	gen=436 glyphs=4
2026-03-14T01:17:35.447316	37f4017b	116	29	1.0000	DISCARD	gen=393 glyphs=4
2026-03-14T01:17:35.715237	875e0f8a	116	29	1.0000	DISCARD	gen=436 glyphs=4
2026-03-14T01:17:38.192373	bfdf7cad	120	30	1.0000	DISCARD	gen=393 glyphs=4
2026-03-14T01:17:38.452820	19355583	120	30	1.0000	DISCARD	gen=437 glyphs=4
2026-03-14T01:17:40.902715	5b9807ac	120	30	1.0000	DISCARD	gen=393 glyphs=4
2026-03-14T01:17:41.180925	8aef8872	116	29	1.0000	DISCARD	gen=437 glyphs=4
2026-03-14T01:17:43.662171	5a06ca32	120	30	1.0000	DISCARD	gen=393 glyphs=4
2026-03-14T01:17:43.930050	b2bfef94	120	30	1.0000	DISCARD	gen=437 glyphs=4
2026-03-14T01:17:46.357350	b87f62f3	116	29	0.9500	DISCARD	gen=393 glyphs=4
2026-03-14T01:17:46.632505	e8c7f6cf	120	30	1.0000	DISCARD	gen=437 glyphs=4
2026-03-14T01:17:49.085954	5b9807ac	120	30	1.0000	DISCARD	gen=393 glyphs=4
2026-03-14T01:17:49.344791	1e5f0e21	116	29	1.0000	DISCARD	gen=437 glyphs=4
2026-03-14T01:17:51.765314	8670fa7d	116	29	0.9500	DISCARD	gen=393 glyphs=4
2026-03-14T01:17:52.055815	eca7ab6c	116	29	1.0000	DISCARD	gen=437 glyphs=4
2026-03-14T01:17:54.464768	55d6c151	120	30	1.0000	DISCARD	gen=393 glyphs=4
2026-03-14T01:17:54.738532	f6feceea	116	29	1.0000	DISCARD	gen=437 glyphs=4
2026-03-14T01:17:57.170321	2701cb73	116	29	1.0000	DISCARD	gen=393 glyphs=4
2026-03-14T01:17:57.444442	ae44ace5	116	29	1.0000	DISCARD	gen=437 glyphs=4
2026-03-14T01:17:59.850601	37f4017b	116	29	1.0000	DISCARD	gen=393 glyphs=4
2026-03-14T01:18:00.125062	d7c8681b	120	30	1.0000	DISCARD	gen=437 glyphs=4
2026-03-14T01:18:02.547270	37f4017b	116	29	1.0000	DISCARD	gen=394 glyphs=4
2026-03-14T01:18:02.812823	e2cd28ea	120	30	1.0000	DISCARD	gen=437 glyphs=4
2026-03-14T01:18:05.367218	bfdf7cad	120	30	1.0000	DISCARD	gen=394 glyphs=4
2026-03-14T01:18:05.634432	19355583	120	30	1.0000	DISCARD	gen=438 glyphs=4
2026-03-14T01:18:08.253934	bfdf7cad	120	30	1.0000	DISCARD	gen=394 glyphs=4
2026-03-14T01:18:08.520684	8aef8872	116	29	1.0000	DISCARD	gen=438 glyphs=4
2026-03-14T01:18:10.958281	5a06ca32	120	30	1.0000	DISCARD	gen=394 glyphs=4
2026-03-14T01:18:11.226120	875e0f8a	116	29	1.0000	DISCARD	gen=438 glyphs=4
2026-03-14T01:18:13.663717	37f4017b	116	29	1.0000	DISCARD	gen=394 glyphs=4
2026-03-14T01:18:13.932631	e8c7f6cf	120	30	1.0000	DISCARD	gen=438 glyphs=4
2026-03-14T01:18:16.381332	37f4017b	116	29	1.0000	DISCARD	gen=394 glyphs=4
2026-03-14T01:18:16.649483	a78f9454	120	30	1.0000	DISCARD	gen=438 glyphs=4
2026-03-14T01:18:19.061457	12b38c2d	116	29	1.0000	DISCARD	gen=394 glyphs=4
2026-03-14T01:18:19.333693	0eaedb57	116	29	1.0000	DISCARD	gen=438 glyphs=4
2026-03-14T01:18:21.783272	bfdf7cad	120	30	1.0000	DISCARD	gen=394 glyphs=4
2026-03-14T01:18:22.052427	7af7e282	116	29	1.0000	DISCARD	gen=438 glyphs=4
2026-03-14T01:18:24.474802	5b9807ac	120	30	1.0000	DISCARD	gen=394 glyphs=4
2026-03-14T01:18:24.766063	eca7ab6c	116	29	1.0000	DISCARD	gen=438 glyphs=4
2026-03-14T01:18:27.211908	bdf0a332	116	29	1.0000	DISCARD	gen=394 glyphs=4
2026-03-14T01:18:27.492789	19355583	120	30	1.0000	DISCARD	gen=438 glyphs=4
2026-03-14T01:18:29.928805	37f4017b	116	29	1.0000	DISCARD	gen=395 glyphs=4
2026-03-14T01:18:30.190618	050862ad	120	30	1.0000	DISCARD	gen=438 glyphs=4
2026-03-14T01:18:32.645584	bfdf7cad	120	30	1.0000	DISCARD	gen=395 glyphs=4
2026-03-14T01:18:32.911992	19355583	120	30	1.0000	DISCARD	gen=439 glyphs=4
2026-03-14T01:18:35.380130	d11c1062	120	30	1.0000	DISCARD	gen=395 glyphs=4
2026-03-14T01:18:35.671847	8aef8872	116	29	1.0000	DISCARD	gen=439 glyphs=4
2026-03-14T01:18:38.166362	37f4017b	116	29	1.0000	DISCARD	gen=395 glyphs=4
2026-03-14T01:18:38.445118	1f2ba3e8	120	30	1.0000	DISCARD	gen=439 glyphs=4
2026-03-14T01:18:40.898611	4c9b0dd4	120	30	1.0000	DISCARD	gen=395 glyphs=4
2026-03-14T01:18:41.164302	1e5f0e21	116	29	1.0000	DISCARD	gen=439 glyphs=4
2026-03-14T01:18:43.611634	5a06ca32	120	30	1.0000	DISCARD	gen=395 glyphs=4
2026-03-14T01:18:43.883643	09f21ef7	120	30	1.0000	DISCARD	gen=439 glyphs=4
2026-03-14T01:18:46.312648	fdb5d108	120	30	1.0000	DISCARD	gen=395 glyphs=4
2026-03-14T01:18:46.586078	8aef8872	116	29	1.0000	DISCARD	gen=439 glyphs=4
2026-03-14T01:18:49.000714	5b3f6fe2	116	29	1.0000	DISCARD	gen=395 glyphs=4
2026-03-14T01:18:49.266970	0eaedb57	116	29	1.0000	DISCARD	gen=439 glyphs=4
2026-03-14T01:18:51.716412	fdb5d108	120	30	1.0000	DISCARD	gen=395 glyphs=4
2026-03-14T01:18:51.985947	1e5f0e21	116	29	1.0000	DISCARD	gen=439 glyphs=4
2026-03-14T01:18:54.457428	5b9807ac	120	30	1.0000	DISCARD	gen=395 glyphs=4
2026-03-14T01:18:54.724058	8aef8872	116	29	1.0000	DISCARD	gen=439 glyphs=4
2026-03-14T01:18:57.153549	37f4017b	116	29	1.0000	DISCARD	gen=396 glyphs=4
2026-03-14T01:18:57.430665	e2cd28ea	120	30	1.0000	DISCARD	gen=439 glyphs=4
2026-03-14T01:18:59.860930	bfdf7cad	120	30	1.0000	DISCARD	gen=396 glyphs=4
2026-03-14T01:19:00.130162	19355583	120	30	1.0000	DISCARD	gen=440 glyphs=4
2026-03-14T01:19:02.572413	37f4017b	116	29	1.0000	DISCARD	gen=396 glyphs=4
2026-03-14T01:19:02.838818	8aef8872	116	29	1.0000	DISCARD	gen=440 glyphs=4
2026-03-14T01:19:05.262679	fdb5d108	120	30	1.0000	DISCARD	gen=396 glyphs=4
2026-03-14T01:19:05.539935	eca7ab6c	116	29	1.0000	DISCARD	gen=440 glyphs=4
2026-03-14T01:19:07.974069	12e3906f	116	29	1.0000	DISCARD	gen=396 glyphs=4
2026-03-14T01:19:08.314184	0eaedb57	116	29	1.0000	DISCARD	gen=440 glyphs=4
2026-03-14T01:19:10.805845	5a06ca32	120	30	1.0000	DISCARD	gen=396 glyphs=4
2026-03-14T01:19:11.073938	f348409d	116	29	1.0000	DISCARD	gen=440 glyphs=4
2026-03-14T01:19:13.480928	25b31742	120	30	1.0000	DISCARD	gen=396 glyphs=4
2026-03-14T01:19:13.757561	bb9d9274	116	29	1.0000	DISCARD	gen=440 glyphs=4
2026-03-14T01:19:16.183141	55d6c151	120	30	1.0000	DISCARD	gen=396 glyphs=4
2026-03-14T01:19:16.457600	a78f9454	120	30	1.0000	DISCARD	gen=440 glyphs=4
2026-03-14T01:19:18.895756	37f4017b	116	29	1.0000	DISCARD	gen=396 glyphs=4
2026-03-14T01:19:19.162134	eca7ab6c	116	29	1.0000	DISCARD	gen=440 glyphs=4
2026-03-14T01:19:21.601248	d11c1062	120	30	1.0000	DISCARD	gen=396 glyphs=4
2026-03-14T01:19:21.868022	e8c7f6cf	120	30	1.0000	DISCARD	gen=440 glyphs=4
2026-03-14T01:19:24.296650	37f4017b	116	29	1.0000	DISCARD	gen=397 glyphs=4
2026-03-14T01:19:24.567458	e2cd28ea	120	30	1.0000	DISCARD	gen=440 glyphs=4
2026-03-14T01:19:27.021202	bfdf7cad	120	30	1.0000	DISCARD	gen=397 glyphs=4
2026-03-14T01:19:27.284860	19355583	120	30	1.0000	DISCARD	gen=441 glyphs=4
2026-03-14T01:19:29.724887	7e96dfeb	120	30	0.9500	DISCARD	gen=397 glyphs=4
2026-03-14T01:19:29.993938	8aef8872	116	29	1.0000	DISCARD	gen=441 glyphs=4
2026-03-14T01:19:32.447436	127e31ec	120	30	1.0000	DISCARD	gen=397 glyphs=4
2026-03-14T01:19:32.717951	dfb1c8fd	116	29	0.9500	DISCARD	gen=441 glyphs=4
2026-03-14T01:19:35.160774	5ff8c587	116	29	1.0000	DISCARD	gen=397 glyphs=4
2026-03-14T01:19:35.421971	7d1e646e	116	29	1.0000	DISCARD	gen=441 glyphs=4
2026-03-14T01:19:37.899883	ea95d66d	116	29	1.0000	DISCARD	gen=397 glyphs=4
2026-03-14T01:19:38.172189	16e3b4be	116	29	1.0000	DISCARD	gen=441 glyphs=4
2026-03-14T01:19:40.697980	4c9b0dd4	120	30	1.0000	DISCARD	gen=397 glyphs=4
2026-03-14T01:19:40.980475	050862ad	120	30	1.0000	DISCARD	gen=441 glyphs=4
2026-03-14T01:19:43.442072	aacb1996	116	29	1.0000	DISCARD	gen=397 glyphs=4
2026-03-14T01:19:43.709640	b7aed8e9	116	29	1.0000	DISCARD	gen=441 glyphs=4
2026-03-14T01:19:46.133961	12b38c2d	116	29	1.0000	DISCARD	gen=397 glyphs=4
2026-03-14T01:19:46.411018	0eaedb57	116	29	1.0000	DISCARD	gen=441 glyphs=4
2026-03-14T01:19:48.820423	55d6c151	120	30	1.0000	DISCARD	gen=397 glyphs=4
2026-03-14T01:19:49.099072	9f7c4228	120	30	1.0000	DISCARD	gen=441 glyphs=4
2026-03-14T01:19:51.526798	37f4017b	116	29	1.0000	DISCARD	gen=398 glyphs=4
2026-03-14T01:19:51.806179	19355583	120	30	1.0000	DISCARD	gen=441 glyphs=4
2026-03-14T01:19:54.234642	bfdf7cad	120	30	1.0000	DISCARD	gen=398 glyphs=4
2026-03-14T01:19:54.510362	19355583	120	30	1.0000	DISCARD	gen=442 glyphs=4
2026-03-14T01:19:56.921913	fdb5d108	120	30	1.0000	DISCARD	gen=398 glyphs=4
2026-03-14T01:19:57.188595	8aef8872	116	29	1.0000	DISCARD	gen=442 glyphs=4
2026-03-14T01:19:59.626618	52d012d4	116	29	0.9500	DISCARD	gen=398 glyphs=4
2026-03-14T01:19:59.897792	0eaedb57	116	29	1.0000	DISCARD	gen=442 glyphs=4
2026-03-14T01:20:02.334865	32626222	116	29	1.0000	DISCARD	gen=398 glyphs=4
2026-03-14T01:20:02.603962	050862ad	120	30	1.0000	DISCARD	gen=442 glyphs=4
2026-03-14T01:20:05.034606	5b9807ac	120	30	1.0000	DISCARD	gen=398 glyphs=4
2026-03-14T01:20:05.306501	050862ad	120	30	1.0000	DISCARD	gen=442 glyphs=4
2026-03-14T01:20:07.753601	01083fdc	120	30	1.0000	DISCARD	gen=398 glyphs=4
2026-03-14T01:20:08.021241	8aef8872	116	29	1.0000	DISCARD	gen=442 glyphs=4
2026-03-14T01:20:10.448128	1d34459a	116	29	1.0000	DISCARD	gen=398 glyphs=4
2026-03-14T01:20:10.736329	50dc991d	116	29	1.0000	DISCARD	gen=442 glyphs=4
2026-03-14T01:20:13.203814	cffd026f	120	30	1.0000	DISCARD	gen=398 glyphs=4
2026-03-14T01:20:13.471447	19355583	120	30	1.0000	DISCARD	gen=442 glyphs=4
2026-03-14T01:20:15.907001	37f4017b	116	29	1.0000	DISCARD	gen=398 glyphs=4
2026-03-14T01:20:16.185495	41b73c6e	116	29	1.0000	DISCARD	gen=442 glyphs=4
2026-03-14T01:20:18.588053	37f4017b	116	29	1.0000	DISCARD	gen=399 glyphs=4
2026-03-14T01:20:18.868976	66aaabbc	120	30	1.0000	DISCARD	gen=442 glyphs=4
2026-03-14T01:20:21.307273	bfdf7cad	120	30	1.0000	DISCARD	gen=399 glyphs=4
2026-03-14T01:20:21.575015	19355583	120	30	1.0000	DISCARD	gen=443 glyphs=4
2026-03-14T01:20:24.010975	12b38c2d	116	29	1.0000	DISCARD	gen=399 glyphs=4
2026-03-14T01:20:24.284955	8aef8872	116	29	1.0000	DISCARD	gen=443 glyphs=4
2026-03-14T01:20:26.719205	5b9807ac	120	30	1.0000	DISCARD	gen=399 glyphs=4
2026-03-14T01:20:26.988295	19355583	120	30	1.0000	DISCARD	gen=443 glyphs=4
2026-03-14T01:20:29.422407	bfdf7cad	120	30	1.0000	DISCARD	gen=399 glyphs=4
2026-03-14T01:20:29.694933	19355583	120	30	1.0000	DISCARD	gen=443 glyphs=4
2026-03-14T01:20:32.098854	55d6c151	120	30	1.0000	DISCARD	gen=399 glyphs=4
2026-03-14T01:20:32.366971	050862ad	120	30	1.0000	DISCARD	gen=443 glyphs=4
2026-03-14T01:20:34.929661	5a06ca32	120	30	1.0000	DISCARD	gen=399 glyphs=4
2026-03-14T01:20:35.204604	e8c7f6cf	120	30	1.0000	DISCARD	gen=443 glyphs=4
2026-03-14T01:20:37.681460	7ca87b42	116	29	1.0000	DISCARD	gen=399 glyphs=4
2026-03-14T01:20:37.962249	8aef8872	116	29	1.0000	DISCARD	gen=443 glyphs=4
2026-03-14T01:20:40.429118	0ceed4c0	116	29	1.0000	DISCARD	gen=399 glyphs=4
2026-03-14T01:20:40.694161	e8c7f6cf	120	30	1.0000	DISCARD	gen=443 glyphs=4
2026-03-14T01:20:43.333555	12b38c2d	116	29	1.0000	DISCARD	gen=399 glyphs=4
2026-03-14T01:20:43.715761	f17f0f20	116	29	1.0000	DISCARD	gen=443 glyphs=4
2026-03-14T01:20:46.742532	37f4017b	116	29	1.0000	DISCARD	gen=400 glyphs=4
2026-03-14T01:20:47.031773	c9c4c654	116	29	1.0000	DISCARD	gen=443 glyphs=4
2026-03-14T01:20:50.243479	bfdf7cad	120	30	1.0000	DISCARD	gen=400 glyphs=4
2026-03-14T01:20:50.526959	19355583	120	30	1.0000	DISCARD	gen=444 glyphs=4
2026-03-14T01:20:54.006776	ec5677dd	120	30	0.9500	DISCARD	gen=400 glyphs=4
2026-03-14T01:20:54.327537	8aef8872	116	29	1.0000	DISCARD	gen=444 glyphs=4
2026-03-14T01:20:56.929008	55d6c151	120	30	1.0000	DISCARD	gen=400 glyphs=4
2026-03-14T01:20:57.205094	67cb81be	120	30	1.0000	DISCARD	gen=444 glyphs=4
2026-03-14T01:20:59.655532	37f4017b	116	29	1.0000	DISCARD	gen=400 glyphs=4
2026-03-14T01:20:59.917323	8aef8872	116	29	1.0000	DISCARD	gen=444 glyphs=4
2026-03-14T01:21:02.345623	37f4017b	116	29	1.0000	DISCARD	gen=400 glyphs=4
2026-03-14T01:21:02.619497	050862ad	120	30	1.0000	DISCARD	gen=444 glyphs=4
2026-03-14T01:21:05.077777	55d6c151	120	30	1.0000	DISCARD	gen=400 glyphs=4
2026-03-14T01:21:05.341687	050862ad	120	30	1.0000	DISCARD	gen=444 glyphs=4
2026-03-14T01:21:07.793217	7ca87b42	116	29	1.0000	DISCARD	gen=400 glyphs=4
2026-03-14T01:21:08.087550	a78f9454	120	30	1.0000	DISCARD	gen=444 glyphs=4
2026-03-14T01:21:10.534472	37f4017b	116	29	1.0000	DISCARD	gen=400 glyphs=4
2026-03-14T01:21:10.800221	eca7ab6c	116	29	1.0000	DISCARD	gen=444 glyphs=4
2026-03-14T01:21:13.248064	5b9807ac	120	30	1.0000	DISCARD	gen=400 glyphs=4
2026-03-14T01:21:13.521194	b7aed8e9	116	29	1.0000	DISCARD	gen=444 glyphs=4
2026-03-14T01:21:15.954205	37f4017b	116	29	1.0000	DISCARD	gen=401 glyphs=4
2026-03-14T01:21:16.238150	19355583	120	30	1.0000	DISCARD	gen=444 glyphs=4
2026-03-14T01:21:18.750931	bfdf7cad	120	30	1.0000	DISCARD	gen=401 glyphs=4
2026-03-14T01:21:19.020376	19355583	120	30	1.0000	DISCARD	gen=445 glyphs=4
2026-03-14T01:21:21.458085	fdb5d108	120	30	1.0000	DISCARD	gen=401 glyphs=4
2026-03-14T01:21:21.743943	8aef8872	116	29	1.0000	DISCARD	gen=445 glyphs=4
2026-03-14T01:21:24.212864	d11c1062	120	30	1.0000	DISCARD	gen=401 glyphs=4
2026-03-14T01:21:24.492540	8aef8872	116	29	1.0000	DISCARD	gen=445 glyphs=4
2026-03-14T01:21:26.949353	37f4017b	116	29	1.0000	DISCARD	gen=401 glyphs=4
2026-03-14T01:21:27.229664	67cb81be	120	30	1.0000	DISCARD	gen=445 glyphs=4
2026-03-14T01:21:29.669137	7ca87b42	116	29	1.0000	DISCARD	gen=401 glyphs=4
2026-03-14T01:21:29.941072	e8c7f6cf	120	30	1.0000	DISCARD	gen=445 glyphs=4
2026-03-14T01:21:32.356248	37f4017b	116	29	1.0000	DISCARD	gen=401 glyphs=4
2026-03-14T01:21:32.630431	8aef8872	116	29	1.0000	DISCARD	gen=445 glyphs=4
2026-03-14T01:21:35.049463	37f4017b	116	29	1.0000	DISCARD	gen=401 glyphs=4
2026-03-14T01:21:35.329593	a78f9454	120	30	1.0000	DISCARD	gen=445 glyphs=4
2026-03-14T01:21:37.782496	55d6c151	120	30	1.0000	DISCARD	gen=401 glyphs=4
2026-03-14T01:21:38.072200	050862ad	120	30	1.0000	DISCARD	gen=445 glyphs=4
2026-03-14T01:21:40.507630	3ede564d	116	29	1.0000	DISCARD	gen=401 glyphs=4
2026-03-14T01:21:40.780689	9e34ede0	116	29	1.0000	DISCARD	gen=445 glyphs=4
2026-03-14T01:21:43.212670	37f4017b	116	29	1.0000	DISCARD	gen=402 glyphs=4
2026-03-14T01:21:43.483017	b5f6b375	116	29	0.9500	DISCARD	gen=445 glyphs=4
2026-03-14T01:21:45.908656	bfdf7cad	120	30	1.0000	DISCARD	gen=402 glyphs=4
2026-03-14T01:21:46.183196	19355583	120	30	1.0000	DISCARD	gen=446 glyphs=4
2026-03-14T01:21:48.676435	5b9807ac	120	30	1.0000	DISCARD	gen=402 glyphs=4
2026-03-14T01:21:48.941141	8aef8872	116	29	1.0000	DISCARD	gen=446 glyphs=4
2026-03-14T01:21:51.413879	10fb247f	116	29	1.0000	DISCARD	gen=402 glyphs=4
2026-03-14T01:21:51.686951	e8c7f6cf	120	30	1.0000	DISCARD	gen=446 glyphs=4
2026-03-14T01:21:54.122391	55d6c151	120	30	1.0000	DISCARD	gen=402 glyphs=4
2026-03-14T01:21:54.391282	19355583	120	30	1.0000	DISCARD	gen=446 glyphs=4
2026-03-14T01:21:58.225489	2701cb73	116	29	1.0000	DISCARD	gen=402 glyphs=4
2026-03-14T01:21:58.505869	66bb9e09	116	29	1.0000	DISCARD	gen=446 glyphs=4
2026-03-14T01:22:01.016929	37f4017b	116	29	1.0000	DISCARD	gen=402 glyphs=4
2026-03-14T01:22:01.290311	19355583	120	30	1.0000	DISCARD	gen=446 glyphs=4
2026-03-14T01:22:03.818514	bfdf7cad	120	30	1.0000	DISCARD	gen=402 glyphs=4
2026-03-14T01:22:04.183092	c27255d3	120	30	0.9500	DISCARD	gen=446 glyphs=4
2026-03-14T01:22:07.337228	db56e1b9	116	29	1.0000	DISCARD	gen=402 glyphs=4
2026-03-14T01:22:07.629649	8aef8872	116	29	1.0000	DISCARD	gen=446 glyphs=4
