timestamp	program_hash	spirv_size	word_count	fitness	status	description
2026-03-14T07:36:45.407522	6d114405	0	0	0.0000	CRASH	gen=670 glyphs=4
2026-03-14T07:36:45.407717	099964a4	0	0	0.0000	CRASH	gen=670 glyphs=4
2026-03-14T07:36:45.407911	099964a4	0	0	0.0000	CRASH	gen=670 glyphs=4
2026-03-14T07:36:45.408106	dcb1fb50	0	0	0.0000	CRASH	gen=670 glyphs=4
2026-03-14T07:36:45.408301	099964a4	0	0	0.0000	CRASH	gen=670 glyphs=4
2026-03-14T07:36:45.408497	79b2fd60	0	0	0.0000	CRASH	gen=670 glyphs=4
2026-03-14T07:36:45.408695	15f8f3e1	0	0	0.0000	CRASH	gen=670 glyphs=4
2026-03-14T07:36:45.408975	099964a4	0	0	0.0000	CRASH	gen=671 glyphs=4
2026-03-14T07:36:45.409171	099964a4	0	0	0.0000	CRASH	gen=671 glyphs=4
2026-03-14T07:36:45.409366	099964a4	0	0	0.0000	CRASH	gen=671 glyphs=4
2026-03-14T07:36:45.409567	ff30496a	0	0	0.0000	CRASH	gen=671 glyphs=3
2026-03-14T07:36:45.409763	30f6571a	0	0	0.0000	CRASH	gen=671 glyphs=4
2026-03-14T07:36:45.409959	2007318c	0	0	0.0000	CRASH	gen=671 glyphs=4
2026-03-14T07:36:45.410154	0b13bff3	0	0	0.0000	CRASH	gen=671 glyphs=3
2026-03-14T07:36:45.410349	ca9e2532	0	0	0.0000	CRASH	gen=671 glyphs=4
2026-03-14T07:36:45.410548	3ca14993	0	0	0.0000	CRASH	gen=671 glyphs=4
2026-03-14T07:36:45.410751	dcb1fb50	0	0	0.0000	CRASH	gen=671 glyphs=4
2026-03-14T07:36:45.411028	099964a4	0	0	0.0000	CRASH	gen=672 glyphs=4
2026-03-14T07:36:45.411223	099964a4	0	0	0.0000	CRASH	gen=672 glyphs=4
2026-03-14T07:36:45.411420	dcb1fb50	0	0	0.0000	CRASH	gen=672 glyphs=4
2026-03-14T07:36:45.411616	110de659	0	0	0.0000	CRASH	gen=672 glyphs=4
2026-03-14T07:36:45.411812	381592e6	0	0	0.0000	CRASH	gen=672 glyphs=4
2026-03-14T07:36:45.412005	bfe4ff66	0	0	0.0000	CRASH	gen=672 glyphs=4
2026-03-14T07:36:45.412198	099964a4	0	0	0.0000	CRASH	gen=672 glyphs=4
2026-03-14T07:36:45.412390	099964a4	0	0	0.0000	CRASH	gen=672 glyphs=4
2026-03-14T07:36:45.412585	cb38ab9f	0	0	0.0000	CRASH	gen=672 glyphs=4
2026-03-14T07:36:45.412779	099964a4	0	0	0.0000	CRASH	gen=672 glyphs=4
2026-03-14T07:36:45.413055	099964a4	0	0	0.0000	CRASH	gen=673 glyphs=4
2026-03-14T07:36:45.413250	099964a4	0	0	0.0000	CRASH	gen=673 glyphs=4
2026-03-14T07:36:45.413443	002b4643	0	0	0.0000	CRASH	gen=673 glyphs=4
2026-03-14T07:36:45.413639	dcb1fb50	0	0	0.0000	CRASH	gen=673 glyphs=4
2026-03-14T07:36:45.413839	099964a4	0	0	0.0000	CRASH	gen=673 glyphs=4
2026-03-14T07:36:45.414029	099964a4	0	0	0.0000	CRASH	gen=673 glyphs=4
2026-03-14T07:36:45.414220	099964a4	0	0	0.0000	CRASH	gen=673 glyphs=4
2026-03-14T07:36:45.414411	cf93b656	0	0	0.0000	CRASH	gen=673 glyphs=3
2026-03-14T07:36:45.414603	cd7c021f	0	0	0.0000	CRASH	gen=673 glyphs=4
2026-03-14T07:36:45.414797	7ede4765	0	0	0.0000	CRASH	gen=673 glyphs=2
2026-03-14T07:36:45.415081	099964a4	0	0	0.0000	CRASH	gen=674 glyphs=4
2026-03-14T07:36:45.415273	099964a4	0	0	0.0000	CRASH	gen=674 glyphs=4
2026-03-14T07:36:45.415466	cf93b656	0	0	0.0000	CRASH	gen=674 glyphs=3
2026-03-14T07:36:45.415660	099964a4	0	0	0.0000	CRASH	gen=674 glyphs=4
2026-03-14T07:36:45.415854	80cef82b	0	0	0.0000	CRASH	gen=674 glyphs=4
2026-03-14T07:36:45.416052	099964a4	0	0	0.0000	CRASH	gen=674 glyphs=4
2026-03-14T07:36:45.416244	b397227b	0	0	0.0000	CRASH	gen=674 glyphs=4
2026-03-14T07:36:45.416438	099964a4	0	0	0.0000	CRASH	gen=674 glyphs=4
2026-03-14T07:36:45.416633	099964a4	0	0	0.0000	CRASH	gen=674 glyphs=4
2026-03-14T07:36:45.416825	099964a4	0	0	0.0000	CRASH	gen=674 glyphs=4
2026-03-14T07:36:45.417100	099964a4	0	0	0.0000	CRASH	gen=675 glyphs=4
2026-03-14T07:36:45.417299	099964a4	0	0	0.0000	CRASH	gen=675 glyphs=4
2026-03-14T07:36:45.417493	b88fb150	0	0	0.0000	CRASH	gen=675 glyphs=4
2026-03-14T07:36:45.417690	ff30496a	0	0	0.0000	CRASH	gen=675 glyphs=3
2026-03-14T07:36:45.417887	099964a4	0	0	0.0000	CRASH	gen=675 glyphs=4
2026-03-14T07:36:45.418083	a4bd8336	0	0	0.0000	CRASH	gen=675 glyphs=3
2026-03-14T07:36:45.418276	099964a4	0	0	0.0000	CRASH	gen=675 glyphs=4
2026-03-14T07:36:45.418467	099964a4	0	0	0.0000	CRASH	gen=675 glyphs=4
2026-03-14T07:36:45.418667	5b141ec7	0	0	0.0000	CRASH	gen=675 glyphs=2
2026-03-14T07:36:45.418860	3ca14993	0	0	0.0000	CRASH	gen=675 glyphs=4
2026-03-14T07:36:45.419138	099964a4	0	0	0.0000	CRASH	gen=676 glyphs=4
2026-03-14T07:36:45.419334	099964a4	0	0	0.0000	CRASH	gen=676 glyphs=4
2026-03-14T07:36:45.419531	099964a4	0	0	0.0000	CRASH	gen=676 glyphs=4
2026-03-14T07:36:45.419733	099964a4	0	0	0.0000	CRASH	gen=676 glyphs=4
2026-03-14T07:36:45.419935	de01026a	0	0	0.0000	CRASH	gen=676 glyphs=4
2026-03-14T07:36:45.420134	099964a4	0	0	0.0000	CRASH	gen=676 glyphs=4
2026-03-14T07:36:45.420329	bcda8f82	0	0	0.0000	CRASH	gen=676 glyphs=2
2026-03-14T07:36:45.420527	80cef82b	0	0	0.0000	CRASH	gen=676 glyphs=4
2026-03-14T07:36:45.420730	099964a4	0	0	0.0000	CRASH	gen=676 glyphs=4
2026-03-14T07:36:45.420926	099964a4	0	0	0.0000	CRASH	gen=676 glyphs=4
2026-03-14T07:36:45.421213	099964a4	0	0	0.0000	CRASH	gen=677 glyphs=4
2026-03-14T07:36:45.421408	099964a4	0	0	0.0000	CRASH	gen=677 glyphs=4
2026-03-14T07:36:45.421602	099964a4	0	0	0.0000	CRASH	gen=677 glyphs=4
2026-03-14T07:36:45.421793	099964a4	0	0	0.0000	CRASH	gen=677 glyphs=4
2026-03-14T07:36:45.421983	e432c944	0	0	0.0000	CRASH	gen=677 glyphs=4
2026-03-14T07:36:45.422175	099964a4	0	0	0.0000	CRASH	gen=677 glyphs=4
2026-03-14T07:36:45.422371	6e4ca794	0	0	0.0000	CRASH	gen=677 glyphs=3
2026-03-14T07:36:45.422565	099964a4	0	0	0.0000	CRASH	gen=677 glyphs=4
2026-03-14T07:36:45.422759	88aa539e	0	0	0.0000	CRASH	gen=677 glyphs=5
2026-03-14T07:36:45.422955	099964a4	0	0	0.0000	CRASH	gen=677 glyphs=4
2026-03-14T07:36:45.423237	099964a4	0	0	0.0000	CRASH	gen=678 glyphs=4
2026-03-14T07:36:45.423441	099964a4	0	0	0.0000	CRASH	gen=678 glyphs=4
2026-03-14T07:36:45.423641	099964a4	0	0	0.0000	CRASH	gen=678 glyphs=4
2026-03-14T07:36:45.423841	099964a4	0	0	0.0000	CRASH	gen=678 glyphs=4
2026-03-14T07:36:45.424039	c724b196	0	0	0.0000	CRASH	gen=678 glyphs=4
2026-03-14T07:36:45.424234	dcb1fb50	0	0	0.0000	CRASH	gen=678 glyphs=4
2026-03-14T07:36:45.424435	db00b5d6	0	0	0.0000	CRASH	gen=678 glyphs=4
2026-03-14T07:36:45.424635	cf93b656	0	0	0.0000	CRASH	gen=678 glyphs=3
2026-03-14T07:36:45.424835	cf93b656	0	0	0.0000	CRASH	gen=678 glyphs=3
2026-03-14T07:36:45.425032	099964a4	0	0	0.0000	CRASH	gen=678 glyphs=4
2026-03-14T07:36:45.425313	099964a4	0	0	0.0000	CRASH	gen=679 glyphs=4
2026-03-14T07:36:45.425514	099964a4	0	0	0.0000	CRASH	gen=679 glyphs=4
2026-03-14T07:36:45.425719	3ca14993	0	0	0.0000	CRASH	gen=679 glyphs=4
2026-03-14T07:36:45.425916	099964a4	0	0	0.0000	CRASH	gen=679 glyphs=4
2026-03-14T07:36:45.426111	099964a4	0	0	0.0000	CRASH	gen=679 glyphs=4
2026-03-14T07:36:45.426306	dcb1fb50	0	0	0.0000	CRASH	gen=679 glyphs=4
2026-03-14T07:36:45.426506	099964a4	0	0	0.0000	CRASH	gen=679 glyphs=4
2026-03-14T07:36:45.426703	099964a4	0	0	0.0000	CRASH	gen=679 glyphs=4
2026-03-14T07:36:45.426899	099964a4	0	0	0.0000	CRASH	gen=679 glyphs=4
2026-03-14T07:36:45.427091	dcb1fb50	0	0	0.0000	CRASH	gen=679 glyphs=4
2026-03-14T07:36:45.427368	099964a4	0	0	0.0000	CRASH	gen=680 glyphs=4
2026-03-14T07:36:45.427572	099964a4	0	0	0.0000	CRASH	gen=680 glyphs=4
2026-03-14T07:36:45.427768	099964a4	0	0	0.0000	CRASH	gen=680 glyphs=4
2026-03-14T07:36:45.427961	b8bd95e8	0	0	0.0000	CRASH	gen=680 glyphs=4
2026-03-14T07:36:45.428155	66a97acd	0	0	0.0000	CRASH	gen=680 glyphs=4
2026-03-14T07:36:45.428353	80cef82b	0	0	0.0000	CRASH	gen=680 glyphs=4
2026-03-14T07:36:45.428555	099964a4	0	0	0.0000	CRASH	gen=680 glyphs=4
2026-03-14T07:36:45.428750	1038d194	0	0	0.0000	CRASH	gen=680 glyphs=4
2026-03-14T07:36:45.428947	099964a4	0	0	0.0000	CRASH	gen=680 glyphs=4
2026-03-14T07:36:45.429142	b9bbfcb7	0	0	0.0000	CRASH	gen=680 glyphs=4
2026-03-14T07:36:45.429435	099964a4	0	0	0.0000	CRASH	gen=681 glyphs=4
2026-03-14T07:36:45.429639	099964a4	0	0	0.0000	CRASH	gen=681 glyphs=4
2026-03-14T07:36:45.429833	5bc6d4a5	0	0	0.0000	CRASH	gen=681 glyphs=4
2026-03-14T07:36:45.430027	40085cbe	0	0	0.0000	CRASH	gen=681 glyphs=4
2026-03-14T07:36:45.430224	78343f3f	0	0	0.0000	CRASH	gen=681 glyphs=4
2026-03-14T07:36:45.430416	9702321e	0	0	0.0000	CRASH	gen=681 glyphs=3
2026-03-14T07:36:45.430614	c95ab909	0	0	0.0000	CRASH	gen=681 glyphs=4
2026-03-14T07:36:45.430817	19298857	0	0	0.0000	CRASH	gen=681 glyphs=4
2026-03-14T07:36:45.431012	099964a4	0	0	0.0000	CRASH	gen=681 glyphs=4
2026-03-14T07:36:45.431204	ff30496a	0	0	0.0000	CRASH	gen=681 glyphs=3
2026-03-14T07:36:45.431477	099964a4	0	0	0.0000	CRASH	gen=682 glyphs=4
2026-03-14T07:36:45.431674	099964a4	0	0	0.0000	CRASH	gen=682 glyphs=4
2026-03-14T07:36:45.431869	099964a4	0	0	0.0000	CRASH	gen=682 glyphs=4
2026-03-14T07:36:45.432063	099964a4	0	0	0.0000	CRASH	gen=682 glyphs=4
2026-03-14T07:36:45.432254	8b20868a	0	0	0.0000	CRASH	gen=682 glyphs=4
2026-03-14T07:36:45.432447	e83a5f0a	0	0	0.0000	CRASH	gen=682 glyphs=4
2026-03-14T07:36:45.432645	ff30496a	0	0	0.0000	CRASH	gen=682 glyphs=3
2026-03-14T07:36:45.432844	b6b84f7d	0	0	0.0000	CRASH	gen=682 glyphs=3
2026-03-14T07:36:45.433038	099964a4	0	0	0.0000	CRASH	gen=682 glyphs=4
2026-03-14T07:36:45.433232	dcb1fb50	0	0	0.0000	CRASH	gen=682 glyphs=4
2026-03-14T07:36:45.433552	099964a4	0	0	0.0000	CRASH	gen=683 glyphs=4
2026-03-14T07:36:45.433762	099964a4	0	0	0.0000	CRASH	gen=683 glyphs=4
2026-03-14T07:36:45.433961	099964a4	0	0	0.0000	CRASH	gen=683 glyphs=4
2026-03-14T07:36:45.434154	80cef82b	0	0	0.0000	CRASH	gen=683 glyphs=4
2026-03-14T07:36:45.434349	db92800f	0	0	0.0000	CRASH	gen=683 glyphs=4
2026-03-14T07:36:45.434548	dfec07c4	0	0	0.0000	CRASH	gen=683 glyphs=3
2026-03-14T07:36:45.434740	741a0d59	0	0	0.0000	CRASH	gen=683 glyphs=4
2026-03-14T07:36:45.434945	d6055ca0	0	0	0.0000	CRASH	gen=683 glyphs=3
2026-03-14T07:36:45.435142	099964a4	0	0	0.0000	CRASH	gen=683 glyphs=4
2026-03-14T07:36:45.435334	dcb1fb50	0	0	0.0000	CRASH	gen=683 glyphs=4
2026-03-14T07:36:45.435618	099964a4	0	0	0.0000	CRASH	gen=684 glyphs=4
2026-03-14T07:36:45.435816	099964a4	0	0	0.0000	CRASH	gen=684 glyphs=4
2026-03-14T07:36:45.436022	8e3f5dc8	0	0	0.0000	CRASH	gen=684 glyphs=4
2026-03-14T07:36:45.436216	95229603	0	0	0.0000	CRASH	gen=684 glyphs=3
2026-03-14T07:36:45.436411	3ca14993	0	0	0.0000	CRASH	gen=684 glyphs=4
2026-03-14T07:36:45.436607	099964a4	0	0	0.0000	CRASH	gen=684 glyphs=4
2026-03-14T07:36:45.436801	7ede4765	0	0	0.0000	CRASH	gen=684 glyphs=2
2026-03-14T07:36:45.436995	7ede4765	0	0	0.0000	CRASH	gen=684 glyphs=2
2026-03-14T07:36:45.437192	527d78d2	0	0	0.0000	CRASH	gen=684 glyphs=4
2026-03-14T07:36:45.437387	099964a4	0	0	0.0000	CRASH	gen=684 glyphs=4
2026-03-14T07:36:45.437659	099964a4	0	0	0.0000	CRASH	gen=685 glyphs=4
2026-03-14T07:36:45.437857	099964a4	0	0	0.0000	CRASH	gen=685 glyphs=4
2026-03-14T07:36:45.438073	8da1f8d8	0	0	0.0000	CRASH	gen=685 glyphs=4
2026-03-14T07:36:45.438272	099964a4	0	0	0.0000	CRASH	gen=685 glyphs=4
2026-03-14T07:36:45.438465	099964a4	0	0	0.0000	CRASH	gen=685 glyphs=4
2026-03-14T07:36:45.438661	099964a4	0	0	0.0000	CRASH	gen=685 glyphs=4
2026-03-14T07:36:45.438859	4a9a5b20	0	0	0.0000	CRASH	gen=685 glyphs=4
2026-03-14T07:36:45.439069	099964a4	0	0	0.0000	CRASH	gen=685 glyphs=4
2026-03-14T07:36:45.439267	4823bac7	0	0	0.0000	CRASH	gen=685 glyphs=4
2026-03-14T07:36:45.439462	099964a4	0	0	0.0000	CRASH	gen=685 glyphs=4
2026-03-14T07:36:45.439739	099964a4	0	0	0.0000	CRASH	gen=686 glyphs=4
2026-03-14T07:36:45.439947	099964a4	0	0	0.0000	CRASH	gen=686 glyphs=4
2026-03-14T07:36:45.440142	099964a4	0	0	0.0000	CRASH	gen=686 glyphs=4
2026-03-14T07:36:45.440345	cf93b656	0	0	0.0000	CRASH	gen=686 glyphs=3
2026-03-14T07:36:45.440549	8be7eae0	0	0	0.0000	CRASH	gen=686 glyphs=3
2026-03-14T07:36:45.440759	34896abc	0	0	0.0000	CRASH	gen=686 glyphs=3
2026-03-14T07:36:45.440968	cf93b656	0	0	0.0000	CRASH	gen=686 glyphs=3
2026-03-14T07:36:45.441162	ef8c444a	0	0	0.0000	CRASH	gen=686 glyphs=3
2026-03-14T07:36:45.441359	099964a4	0	0	0.0000	CRASH	gen=686 glyphs=4
2026-03-14T07:36:45.441553	099964a4	0	0	0.0000	CRASH	gen=686 glyphs=4
2026-03-14T07:36:45.441835	099964a4	0	0	0.0000	CRASH	gen=687 glyphs=4
2026-03-14T07:36:45.442029	099964a4	0	0	0.0000	CRASH	gen=687 glyphs=4
2026-03-14T07:36:45.442223	80cef82b	0	0	0.0000	CRASH	gen=687 glyphs=4
2026-03-14T07:36:45.442418	3ca14993	0	0	0.0000	CRASH	gen=687 glyphs=4
2026-03-14T07:36:45.442618	c22466fd	0	0	0.0000	CRASH	gen=687 glyphs=4
2026-03-14T07:36:45.442811	099964a4	0	0	0.0000	CRASH	gen=687 glyphs=4
2026-03-14T07:36:45.443002	2fad17e8	0	0	0.0000	CRASH	gen=687 glyphs=3
2026-03-14T07:36:45.443193	099964a4	0	0	0.0000	CRASH	gen=687 glyphs=4
2026-03-14T07:36:45.443384	71cf2bb7	0	0	0.0000	CRASH	gen=687 glyphs=3
2026-03-14T07:36:45.443582	3ca14993	0	0	0.0000	CRASH	gen=687 glyphs=4
2026-03-14T07:36:45.443866	099964a4	0	0	0.0000	CRASH	gen=688 glyphs=4
2026-03-14T07:36:45.444064	099964a4	0	0	0.0000	CRASH	gen=688 glyphs=4
2026-03-14T07:36:45.444259	ea32cb29	0	0	0.0000	CRASH	gen=688 glyphs=4
2026-03-14T07:36:45.444454	099964a4	0	0	0.0000	CRASH	gen=688 glyphs=4
2026-03-14T07:36:45.444655	099964a4	0	0	0.0000	CRASH	gen=688 glyphs=4
2026-03-14T07:36:45.444845	099964a4	0	0	0.0000	CRASH	gen=688 glyphs=4
2026-03-14T07:36:45.445036	27f35313	0	0	0.0000	CRASH	gen=688 glyphs=4
2026-03-14T07:36:45.445228	099964a4	0	0	0.0000	CRASH	gen=688 glyphs=4
2026-03-14T07:36:45.445422	59315675	0	0	0.0000	CRASH	gen=688 glyphs=4
2026-03-14T07:36:45.445622	099964a4	0	0	0.0000	CRASH	gen=688 glyphs=4
2026-03-14T07:36:45.445895	099964a4	0	0	0.0000	CRASH	gen=689 glyphs=4
2026-03-14T07:36:45.446090	099964a4	0	0	0.0000	CRASH	gen=689 glyphs=4
2026-03-14T07:36:45.446285	ecf151e2	0	0	0.0000	CRASH	gen=689 glyphs=4
2026-03-14T07:36:45.446481	099964a4	0	0	0.0000	CRASH	gen=689 glyphs=4
2026-03-14T07:36:45.446683	099964a4	0	0	0.0000	CRASH	gen=689 glyphs=4
2026-03-14T07:36:45.446875	cf93b656	0	0	0.0000	CRASH	gen=689 glyphs=3
2026-03-14T07:36:45.447069	c0806631	0	0	0.0000	CRASH	gen=689 glyphs=4
2026-03-14T07:36:45.447265	099964a4	0	0	0.0000	CRASH	gen=689 glyphs=4
2026-03-14T07:36:45.447459	099964a4	0	0	0.0000	CRASH	gen=689 glyphs=4
2026-03-14T07:36:45.447653	099964a4	0	0	0.0000	CRASH	gen=689 glyphs=4
2026-03-14T07:36:45.447929	099964a4	0	0	0.0000	CRASH	gen=690 glyphs=4
2026-03-14T07:36:45.448126	099964a4	0	0	0.0000	CRASH	gen=690 glyphs=4
2026-03-14T07:36:45.448318	099964a4	0	0	0.0000	CRASH	gen=690 glyphs=4
2026-03-14T07:36:45.448513	099964a4	0	0	0.0000	CRASH	gen=690 glyphs=4
2026-03-14T07:36:45.448708	8da1f8d8	0	0	0.0000	CRASH	gen=690 glyphs=4
2026-03-14T07:36:45.448914	099964a4	0	0	0.0000	CRASH	gen=690 glyphs=4
2026-03-14T07:36:45.449106	5572db26	0	0	0.0000	CRASH	gen=690 glyphs=4
2026-03-14T07:36:45.449300	099964a4	0	0	0.0000	CRASH	gen=690 glyphs=4
2026-03-14T07:36:45.449495	099964a4	0	0	0.0000	CRASH	gen=690 glyphs=4
2026-03-14T07:36:45.449696	9ba95bc9	0	0	0.0000	CRASH	gen=690 glyphs=4
2026-03-14T07:36:45.449984	099964a4	0	0	0.0000	CRASH	gen=691 glyphs=4
2026-03-14T07:36:45.450182	099964a4	0	0	0.0000	CRASH	gen=691 glyphs=4
2026-03-14T07:36:45.450376	cf93b656	0	0	0.0000	CRASH	gen=691 glyphs=3
2026-03-14T07:36:45.450575	f331489f	0	0	0.0000	CRASH	gen=691 glyphs=3
2026-03-14T07:36:45.450770	3ca14993	0	0	0.0000	CRASH	gen=691 glyphs=4
2026-03-14T07:36:45.450965	80cef82b	0	0	0.0000	CRASH	gen=691 glyphs=4
2026-03-14T07:36:45.451167	099964a4	0	0	0.0000	CRASH	gen=691 glyphs=4
2026-03-14T07:36:45.451360	3a734398	0	0	0.0000	CRASH	gen=691 glyphs=4
2026-03-14T07:36:45.451556	8da1f8d8	0	0	0.0000	CRASH	gen=691 glyphs=4
2026-03-14T07:36:45.451750	099964a4	0	0	0.0000	CRASH	gen=691 glyphs=4
2026-03-14T07:36:45.452034	099964a4	0	0	0.0000	CRASH	gen=692 glyphs=4
2026-03-14T07:36:45.452235	099964a4	0	0	0.0000	CRASH	gen=692 glyphs=4
2026-03-14T07:36:45.452428	d33bffc5	0	0	0.0000	CRASH	gen=692 glyphs=3
2026-03-14T07:36:45.452623	099964a4	0	0	0.0000	CRASH	gen=692 glyphs=4
2026-03-14T07:36:45.452815	d0eb8ca9	0	0	0.0000	CRASH	gen=692 glyphs=3
2026-03-14T07:36:45.453007	13b8b8bd	0	0	0.0000	CRASH	gen=692 glyphs=4
2026-03-14T07:36:45.453201	80cef82b	0	0	0.0000	CRASH	gen=692 glyphs=4
2026-03-14T07:36:45.453400	7084beb7	0	0	0.0000	CRASH	gen=692 glyphs=5
2026-03-14T07:36:45.453595	099964a4	0	0	0.0000	CRASH	gen=692 glyphs=4
2026-03-14T07:36:45.453783	099964a4	0	0	0.0000	CRASH	gen=692 glyphs=4
2026-03-14T07:36:45.454061	099964a4	0	0	0.0000	CRASH	gen=693 glyphs=4
2026-03-14T07:36:45.454257	099964a4	0	0	0.0000	CRASH	gen=693 glyphs=4
2026-03-14T07:36:45.454460	5f1f92be	0	0	0.0000	CRASH	gen=693 glyphs=3
2026-03-14T07:36:45.454656	099964a4	0	0	0.0000	CRASH	gen=693 glyphs=4
2026-03-14T07:36:45.454851	3a5581be	0	0	0.0000	CRASH	gen=693 glyphs=1
2026-03-14T07:36:45.455045	66ed9296	0	0	0.0000	CRASH	gen=693 glyphs=4
2026-03-14T07:36:45.455239	099964a4	0	0	0.0000	CRASH	gen=693 glyphs=4
2026-03-14T07:36:45.455433	099964a4	0	0	0.0000	CRASH	gen=693 glyphs=4
2026-03-14T07:36:45.455635	099964a4	0	0	0.0000	CRASH	gen=693 glyphs=4
2026-03-14T07:36:45.455827	099964a4	0	0	0.0000	CRASH	gen=693 glyphs=4
2026-03-14T07:36:45.456095	099964a4	0	0	0.0000	CRASH	gen=694 glyphs=4
2026-03-14T07:36:45.456288	099964a4	0	0	0.0000	CRASH	gen=694 glyphs=4
2026-03-14T07:36:45.456481	099964a4	0	0	0.0000	CRASH	gen=694 glyphs=4
2026-03-14T07:36:45.456680	099964a4	0	0	0.0000	CRASH	gen=694 glyphs=4
2026-03-14T07:36:45.456874	099964a4	0	0	0.0000	CRASH	gen=694 glyphs=4
2026-03-14T07:36:45.457066	29282bbf	0	0	0.0000	CRASH	gen=694 glyphs=3
2026-03-14T07:36:45.457261	099964a4	0	0	0.0000	CRASH	gen=694 glyphs=4
2026-03-14T07:36:45.457454	099964a4	0	0	0.0000	CRASH	gen=694 glyphs=4
2026-03-14T07:36:45.457663	099964a4	0	0	0.0000	CRASH	gen=694 glyphs=4
2026-03-14T07:36:45.457861	98fcf6d4	0	0	0.0000	CRASH	gen=694 glyphs=4
2026-03-14T07:36:45.458132	099964a4	0	0	0.0000	CRASH	gen=695 glyphs=4
2026-03-14T07:36:45.458328	099964a4	0	0	0.0000	CRASH	gen=695 glyphs=4
2026-03-14T07:36:45.458526	099964a4	0	0	0.0000	CRASH	gen=695 glyphs=4
2026-03-14T07:36:45.458722	099964a4	0	0	0.0000	CRASH	gen=695 glyphs=4
2026-03-14T07:36:45.458916	099964a4	0	0	0.0000	CRASH	gen=695 glyphs=4
2026-03-14T07:36:45.459108	462edbe3	0	0	0.0000	CRASH	gen=695 glyphs=4
2026-03-14T07:36:45.459302	ff30496a	0	0	0.0000	CRASH	gen=695 glyphs=3
2026-03-14T07:36:45.459498	ff30496a	0	0	0.0000	CRASH	gen=695 glyphs=3
2026-03-14T07:36:45.459694	dcb1fb50	0	0	0.0000	CRASH	gen=695 glyphs=4
2026-03-14T07:36:45.459895	3ca14993	0	0	0.0000	CRASH	gen=695 glyphs=4
2026-03-14T07:36:45.460173	099964a4	0	0	0.0000	CRASH	gen=696 glyphs=4
2026-03-14T07:36:45.460368	099964a4	0	0	0.0000	CRASH	gen=696 glyphs=4
2026-03-14T07:36:45.460566	b826a922	0	0	0.0000	CRASH	gen=696 glyphs=2
2026-03-14T07:36:45.460761	099964a4	0	0	0.0000	CRASH	gen=696 glyphs=4
2026-03-14T07:36:45.460962	3a734398	0	0	0.0000	CRASH	gen=696 glyphs=4
2026-03-14T07:36:45.461154	49eb93ff	0	0	0.0000	CRASH	gen=696 glyphs=3
2026-03-14T07:36:45.461346	f6c1d2ca	0	0	0.0000	CRASH	gen=696 glyphs=4
2026-03-14T07:36:45.461542	099964a4	0	0	0.0000	CRASH	gen=696 glyphs=4
2026-03-14T07:36:45.461737	099964a4	0	0	0.0000	CRASH	gen=696 glyphs=4
2026-03-14T07:36:45.461932	ff30496a	0	0	0.0000	CRASH	gen=696 glyphs=3
2026-03-14T07:36:45.462203	099964a4	0	0	0.0000	CRASH	gen=697 glyphs=4
2026-03-14T07:36:45.462400	099964a4	0	0	0.0000	CRASH	gen=697 glyphs=4
2026-03-14T07:36:45.462595	cf93b656	0	0	0.0000	CRASH	gen=697 glyphs=3
2026-03-14T07:36:45.462789	099964a4	0	0	0.0000	CRASH	gen=697 glyphs=4
2026-03-14T07:36:45.462981	f99a8299	0	0	0.0000	CRASH	gen=697 glyphs=2
2026-03-14T07:36:45.463173	099964a4	0	0	0.0000	CRASH	gen=697 glyphs=4
2026-03-14T07:36:45.463364	dcb1fb50	0	0	0.0000	CRASH	gen=697 glyphs=4
2026-03-14T07:36:45.463558	099964a4	0	0	0.0000	CRASH	gen=697 glyphs=4
2026-03-14T07:36:45.463768	099964a4	0	0	0.0000	CRASH	gen=697 glyphs=4
2026-03-14T07:36:45.463959	099964a4	0	0	0.0000	CRASH	gen=697 glyphs=4
2026-03-14T07:36:45.464246	099964a4	0	0	0.0000	CRASH	gen=698 glyphs=4
2026-03-14T07:36:45.464440	099964a4	0	0	0.0000	CRASH	gen=698 glyphs=4
2026-03-14T07:36:45.464635	97fbbd26	0	0	0.0000	CRASH	gen=698 glyphs=3
2026-03-14T07:36:45.464828	53026be5	0	0	0.0000	CRASH	gen=698 glyphs=3
2026-03-14T07:36:45.465021	cf93b656	0	0	0.0000	CRASH	gen=698 glyphs=3
2026-03-14T07:36:45.465216	1e2cad81	0	0	0.0000	CRASH	gen=698 glyphs=3
2026-03-14T07:36:45.465409	8da1f8d8	0	0	0.0000	CRASH	gen=698 glyphs=4
2026-03-14T07:36:45.465604	cf93b656	0	0	0.0000	CRASH	gen=698 glyphs=3
2026-03-14T07:36:45.465800	099964a4	0	0	0.0000	CRASH	gen=698 glyphs=4
2026-03-14T07:36:45.465991	099964a4	0	0	0.0000	CRASH	gen=698 glyphs=4
2026-03-14T07:36:45.466263	099964a4	0	0	0.0000	CRASH	gen=699 glyphs=4
2026-03-14T07:36:45.466460	099964a4	0	0	0.0000	CRASH	gen=699 glyphs=4
2026-03-14T07:36:45.466656	082b42d0	0	0	0.0000	CRASH	gen=699 glyphs=4
2026-03-14T07:36:45.466851	099964a4	0	0	0.0000	CRASH	gen=699 glyphs=4
2026-03-14T07:36:45.467044	7ede4765	0	0	0.0000	CRASH	gen=699 glyphs=2
2026-03-14T07:36:45.467237	099964a4	0	0	0.0000	CRASH	gen=699 glyphs=4
2026-03-14T07:36:45.467432	099964a4	0	0	0.0000	CRASH	gen=699 glyphs=4
2026-03-14T07:36:45.467627	a78658c3	0	0	0.0000	CRASH	gen=699 glyphs=4
2026-03-14T07:36:45.467824	099964a4	0	0	0.0000	CRASH	gen=699 glyphs=4
2026-03-14T07:36:45.468019	099964a4	0	0	0.0000	CRASH	gen=699 glyphs=4
2026-03-14T07:36:45.468282	099964a4	0	0	0.0000	CRASH	gen=700 glyphs=4
2026-03-14T07:36:45.468482	099964a4	0	0	0.0000	CRASH	gen=700 glyphs=4
2026-03-14T07:36:45.468683	099964a4	0	0	0.0000	CRASH	gen=700 glyphs=4
2026-03-14T07:36:45.468878	ff30496a	0	0	0.0000	CRASH	gen=700 glyphs=3
2026-03-14T07:36:45.469071	099964a4	0	0	0.0000	CRASH	gen=700 glyphs=4
2026-03-14T07:36:45.469263	099964a4	0	0	0.0000	CRASH	gen=700 glyphs=4
2026-03-14T07:36:45.469457	7ede4765	0	0	0.0000	CRASH	gen=700 glyphs=2
2026-03-14T07:36:45.469653	099964a4	0	0	0.0000	CRASH	gen=700 glyphs=4
2026-03-14T07:36:45.469851	099964a4	0	0	0.0000	CRASH	gen=700 glyphs=4
2026-03-14T07:36:45.470044	80cef82b	0	0	0.0000	CRASH	gen=700 glyphs=4
2026-03-14T07:36:45.470328	099964a4	0	0	0.0000	CRASH	gen=701 glyphs=4
2026-03-14T07:36:45.470531	099964a4	0	0	0.0000	CRASH	gen=701 glyphs=4
2026-03-14T07:36:45.470725	099964a4	0	0	0.0000	CRASH	gen=701 glyphs=4
2026-03-14T07:36:45.470919	7ede4765	0	0	0.0000	CRASH	gen=701 glyphs=2
2026-03-14T07:36:45.471113	099964a4	0	0	0.0000	CRASH	gen=701 glyphs=4
2026-03-14T07:36:45.471308	099964a4	0	0	0.0000	CRASH	gen=701 glyphs=4
