timestamp	program_hash	spirv_size	word_count	fitness	status	description
2026-03-13T23:41:19.385060	5a06ca32	120	30	1.0000	DISCARD	gen=183 glyphs=4
2026-03-13T23:41:19.642905	9e34ede0	116	29	1.0000	DISCARD	gen=227 glyphs=4
2026-03-13T23:41:22.101942	37f4017b	116	29	1.0000	DISCARD	gen=184 glyphs=4
2026-03-13T23:41:22.369553	eca7ab6c	116	29	1.0000	DISCARD	gen=227 glyphs=4
2026-03-13T23:41:24.811589	bfdf7cad	120	30	1.0000	DISCARD	gen=184 glyphs=4
2026-03-13T23:41:25.071850	19355583	120	30	1.0000	DISCARD	gen=228 glyphs=4
2026-03-13T23:41:27.498021	d5ff5077	116	29	1.0000	DISCARD	gen=184 glyphs=4
2026-03-13T23:41:27.773434	8aef8872	116	29	1.0000	DISCARD	gen=228 glyphs=4
2026-03-13T23:41:30.205291	71e2ba66	116	29	1.0000	DISCARD	gen=184 glyphs=4
2026-03-13T23:41:30.475808	d39feb94	116	29	1.0000	DISCARD	gen=228 glyphs=4
2026-03-13T23:41:32.894983	1edc8ffa	116	29	1.0000	DISCARD	gen=184 glyphs=4
2026-03-13T23:41:33.171760	b57e7176	120	30	1.0000	DISCARD	gen=228 glyphs=4
2026-03-13T23:41:35.652728	2701cb73	116	29	1.0000	DISCARD	gen=184 glyphs=4
2026-03-13T23:41:35.921831	a78f9454	120	30	1.0000	DISCARD	gen=228 glyphs=4
2026-03-13T23:41:38.343265	5b9807ac	120	30	1.0000	DISCARD	gen=184 glyphs=4
2026-03-13T23:41:38.602554	19355583	120	30	1.0000	DISCARD	gen=228 glyphs=4
2026-03-13T23:41:41.036070	fdb5d108	120	30	1.0000	DISCARD	gen=184 glyphs=4
2026-03-13T23:41:41.300864	19355583	120	30	1.0000	DISCARD	gen=228 glyphs=4
2026-03-13T23:41:43.727150	37f4017b	116	29	1.0000	DISCARD	gen=184 glyphs=4
2026-03-13T23:41:43.999590	0eaedb57	116	29	1.0000	DISCARD	gen=228 glyphs=4
2026-03-13T23:41:46.445570	fdb5d108	120	30	1.0000	DISCARD	gen=184 glyphs=4
2026-03-13T23:41:46.732271	19355583	120	30	1.0000	DISCARD	gen=228 glyphs=4
2026-03-13T23:41:49.148957	37f4017b	116	29	1.0000	DISCARD	gen=185 glyphs=4
2026-03-13T23:41:49.423462	40d698e9	120	30	0.9500	DISCARD	gen=228 glyphs=4
2026-03-13T23:41:51.851965	bfdf7cad	120	30	1.0000	DISCARD	gen=185 glyphs=4
2026-03-13T23:41:52.123365	19355583	120	30	1.0000	DISCARD	gen=229 glyphs=4
2026-03-13T23:41:54.565049	5a06ca32	120	30	1.0000	DISCARD	gen=185 glyphs=4
2026-03-13T23:41:54.834642	8aef8872	116	29	1.0000	DISCARD	gen=229 glyphs=4
2026-03-13T23:41:57.264856	046899e6	120	30	1.0000	DISCARD	gen=185 glyphs=4
2026-03-13T23:41:57.517108	8aef8872	116	29	1.0000	DISCARD	gen=229 glyphs=4
2026-03-13T23:41:59.942770	e37a0de2	116	29	0.9500	DISCARD	gen=185 glyphs=4
2026-03-13T23:42:00.212164	0eaedb57	116	29	1.0000	DISCARD	gen=229 glyphs=4
2026-03-13T23:42:02.638917	37f4017b	116	29	1.0000	DISCARD	gen=185 glyphs=4
2026-03-13T23:42:02.904963	b57e7176	120	30	1.0000	DISCARD	gen=229 glyphs=4
2026-03-13T23:42:05.356486	2701cb73	116	29	1.0000	DISCARD	gen=185 glyphs=4
2026-03-13T23:42:05.656788	d6d47214	116	29	1.0000	DISCARD	gen=229 glyphs=4
2026-03-13T23:42:08.153831	37f4017b	116	29	1.0000	DISCARD	gen=185 glyphs=4
2026-03-13T23:42:08.427951	b57e7176	120	30	1.0000	DISCARD	gen=229 glyphs=4
2026-03-13T23:42:10.839191	3ab6b57b	116	29	1.0000	DISCARD	gen=185 glyphs=4
2026-03-13T23:42:11.096694	0eaedb57	116	29	1.0000	DISCARD	gen=229 glyphs=4
2026-03-13T23:42:13.550041	0f28cea3	124	31	0.9500	DISCARD	gen=185 glyphs=4
2026-03-13T23:42:13.817129	050862ad	120	30	1.0000	DISCARD	gen=229 glyphs=4
2026-03-13T23:42:16.251535	37f4017b	116	29	1.0000	DISCARD	gen=186 glyphs=4
2026-03-13T23:42:16.519249	0eaedb57	116	29	1.0000	DISCARD	gen=229 glyphs=4
2026-03-13T23:42:18.936410	bfdf7cad	120	30	1.0000	DISCARD	gen=186 glyphs=4
2026-03-13T23:42:19.209439	19355583	120	30	1.0000	DISCARD	gen=230 glyphs=4
2026-03-13T23:42:21.629443	5a06ca32	120	30	1.0000	DISCARD	gen=186 glyphs=4
2026-03-13T23:42:21.896454	8aef8872	116	29	1.0000	DISCARD	gen=230 glyphs=4
2026-03-13T23:42:24.323580	55d6c151	120	30	1.0000	DISCARD	gen=186 glyphs=4
2026-03-13T23:42:24.605150	2b2e2632	116	29	1.0000	DISCARD	gen=230 glyphs=4
2026-03-13T23:42:27.038476	37f4017b	116	29	1.0000	DISCARD	gen=186 glyphs=4
2026-03-13T23:42:27.306100	934b4014	116	29	1.0000	DISCARD	gen=230 glyphs=4
2026-03-13T23:42:29.710651	2701cb73	116	29	1.0000	DISCARD	gen=186 glyphs=4
2026-03-13T23:42:29.994075	1e5f0e21	116	29	1.0000	DISCARD	gen=230 glyphs=4
2026-03-13T23:42:32.417679	fdb5d108	120	30	1.0000	DISCARD	gen=186 glyphs=4
2026-03-13T23:42:32.684054	8aef8872	116	29	1.0000	DISCARD	gen=230 glyphs=4
2026-03-13T23:42:35.115469	fdb5d108	120	30	1.0000	DISCARD	gen=186 glyphs=4
2026-03-13T23:42:35.382110	19355583	120	30	1.0000	DISCARD	gen=230 glyphs=4
2026-03-13T23:42:37.882474	fdb5d108	120	30	1.0000	DISCARD	gen=186 glyphs=4
2026-03-13T23:42:38.154080	67cb81be	120	30	1.0000	DISCARD	gen=230 glyphs=4
2026-03-13T23:42:40.591787	d11c1062	120	30	1.0000	DISCARD	gen=186 glyphs=4
2026-03-13T23:42:40.849630	5b92f2c1	116	29	1.0000	DISCARD	gen=230 glyphs=4
2026-03-13T23:42:43.292594	37f4017b	116	29	1.0000	DISCARD	gen=187 glyphs=4
2026-03-13T23:42:43.554318	8bcc5ca5	116	29	1.0000	DISCARD	gen=230 glyphs=4
2026-03-13T23:42:46.040807	bfdf7cad	120	30	1.0000	DISCARD	gen=187 glyphs=4
2026-03-13T23:42:46.327588	19355583	120	30	1.0000	DISCARD	gen=231 glyphs=4
2026-03-13T23:42:48.843198	5a06ca32	120	30	1.0000	DISCARD	gen=187 glyphs=4
2026-03-13T23:42:49.129286	8aef8872	116	29	1.0000	DISCARD	gen=231 glyphs=4
2026-03-13T23:42:51.679139	d6fcf272	116	29	0.9500	DISCARD	gen=187 glyphs=4
2026-03-13T23:42:51.968964	7ae7b0c0	116	29	1.0000	DISCARD	gen=231 glyphs=4
2026-03-13T23:42:54.442050	5a06ca32	120	30	1.0000	DISCARD	gen=187 glyphs=4
2026-03-13T23:42:54.706229	8aef8872	116	29	1.0000	DISCARD	gen=231 glyphs=4
2026-03-13T23:42:57.135103	4c9b0dd4	120	30	1.0000	DISCARD	gen=187 glyphs=4
2026-03-13T23:42:57.409162	0eaedb57	116	29	1.0000	DISCARD	gen=231 glyphs=4
2026-03-13T23:42:59.817729	37f4017b	116	29	1.0000	DISCARD	gen=187 glyphs=4
2026-03-13T23:43:00.093384	8aef8872	116	29	1.0000	DISCARD	gen=231 glyphs=4
2026-03-13T23:43:02.545443	5b9807ac	120	30	1.0000	DISCARD	gen=187 glyphs=4
2026-03-13T23:43:02.825283	19355583	120	30	1.0000	DISCARD	gen=231 glyphs=4
2026-03-13T23:43:05.284315	4c9b0dd4	120	30	1.0000	DISCARD	gen=187 glyphs=4
2026-03-13T23:43:05.546798	1e5f0e21	116	29	1.0000	DISCARD	gen=231 glyphs=4
2026-03-13T23:43:07.962272	5a06ca32	120	30	1.0000	DISCARD	gen=187 glyphs=4
2026-03-13T23:43:08.227630	2c61ba3f	116	29	1.0000	DISCARD	gen=231 glyphs=4
2026-03-13T23:43:10.726359	37f4017b	116	29	1.0000	DISCARD	gen=188 glyphs=4
2026-03-13T23:43:10.991293	875e0f8a	116	29	1.0000	DISCARD	gen=231 glyphs=4
2026-03-13T23:43:13.426098	bfdf7cad	120	30	1.0000	DISCARD	gen=188 glyphs=4
2026-03-13T23:43:13.691836	19355583	120	30	1.0000	DISCARD	gen=232 glyphs=4
2026-03-13T23:43:16.140982	71e2ba66	116	29	1.0000	DISCARD	gen=188 glyphs=4
2026-03-13T23:43:16.410878	8aef8872	116	29	1.0000	DISCARD	gen=232 glyphs=4
2026-03-13T23:43:18.821338	fdb5d108	120	30	1.0000	DISCARD	gen=188 glyphs=4
2026-03-13T23:43:19.085002	e2cd28ea	120	30	1.0000	DISCARD	gen=232 glyphs=4
2026-03-13T23:43:21.490043	55d6c151	120	30	1.0000	DISCARD	gen=188 glyphs=4
2026-03-13T23:43:21.754950	587e7388	120	30	1.0000	DISCARD	gen=232 glyphs=4
2026-03-13T23:43:24.227374	d11c1062	120	30	1.0000	DISCARD	gen=188 glyphs=4
2026-03-13T23:43:24.482090	b3defbf7	120	30	1.0000	DISCARD	gen=232 glyphs=4
2026-03-13T23:43:26.895973	37f4017b	116	29	1.0000	DISCARD	gen=188 glyphs=4
2026-03-13T23:43:27.161426	0eaedb57	116	29	1.0000	DISCARD	gen=232 glyphs=4
2026-03-13T23:43:29.575533	dc1a9623	116	29	1.0000	DISCARD	gen=188 glyphs=4
2026-03-13T23:43:29.840814	8aef8872	116	29	1.0000	DISCARD	gen=232 glyphs=4
2026-03-13T23:43:32.267006	7ca87b42	116	29	1.0000	DISCARD	gen=188 glyphs=4
2026-03-13T23:43:32.539276	a78f9454	120	30	1.0000	DISCARD	gen=232 glyphs=4
2026-03-13T23:43:34.968684	4c9b0dd4	120	30	1.0000	DISCARD	gen=188 glyphs=4
2026-03-13T23:43:35.236388	50dc991d	116	29	1.0000	DISCARD	gen=232 glyphs=4
2026-03-13T23:43:37.646256	37f4017b	116	29	1.0000	DISCARD	gen=189 glyphs=4
2026-03-13T23:43:37.913750	06edd61f	116	29	1.0000	DISCARD	gen=232 glyphs=4
2026-03-13T23:43:40.300127	bfdf7cad	120	30	1.0000	DISCARD	gen=189 glyphs=4
2026-03-13T23:43:40.571895	19355583	120	30	1.0000	DISCARD	gen=233 glyphs=4
2026-03-13T23:43:43.099497	f7416d46	120	30	1.0000	DISCARD	gen=189 glyphs=4
2026-03-13T23:43:43.380715	8aef8872	116	29	1.0000	DISCARD	gen=233 glyphs=4
2026-03-13T23:43:45.795126	5a06ca32	120	30	1.0000	DISCARD	gen=189 glyphs=4
2026-03-13T23:43:46.070082	d7c8681b	120	30	1.0000	DISCARD	gen=233 glyphs=4
2026-03-13T23:43:48.488251	dc1e40b6	116	29	1.0000	DISCARD	gen=189 glyphs=4
2026-03-13T23:43:48.759982	e8c7f6cf	120	30	1.0000	DISCARD	gen=233 glyphs=4
2026-03-13T23:43:51.168240	37f4017b	116	29	1.0000	DISCARD	gen=189 glyphs=4
2026-03-13T23:43:51.460596	19355583	120	30	1.0000	DISCARD	gen=233 glyphs=4
2026-03-13T23:43:53.864237	37f4017b	116	29	1.0000	DISCARD	gen=189 glyphs=4
2026-03-13T23:43:54.124259	8aef8872	116	29	1.0000	DISCARD	gen=233 glyphs=4
2026-03-13T23:43:56.526657	56ec6026	116	29	1.0000	DISCARD	gen=189 glyphs=4
2026-03-13T23:43:56.800293	050862ad	120	30	1.0000	DISCARD	gen=233 glyphs=4
2026-03-13T23:43:59.203210	70598624	120	30	0.9500	DISCARD	gen=189 glyphs=4
2026-03-13T23:43:59.476724	c4e3f3e8	116	29	1.0000	DISCARD	gen=233 glyphs=4
2026-03-13T23:44:01.895716	bfdf7cad	120	30	1.0000	DISCARD	gen=189 glyphs=4
2026-03-13T23:44:02.172477	875e0f8a	116	29	1.0000	DISCARD	gen=233 glyphs=4
2026-03-13T23:44:04.610432	37f4017b	116	29	1.0000	DISCARD	gen=190 glyphs=4
2026-03-13T23:44:04.887736	17768d1f	116	29	1.0000	DISCARD	gen=233 glyphs=4
2026-03-13T23:44:07.297892	bfdf7cad	120	30	1.0000	DISCARD	gen=190 glyphs=4
2026-03-13T23:44:07.572610	19355583	120	30	1.0000	DISCARD	gen=234 glyphs=4
2026-03-13T23:44:09.969887	5a06ca32	120	30	1.0000	DISCARD	gen=190 glyphs=4
2026-03-13T23:44:10.239838	8aef8872	116	29	1.0000	DISCARD	gen=234 glyphs=4
2026-03-13T23:44:12.675019	5a06ca32	120	30	1.0000	DISCARD	gen=190 glyphs=4
2026-03-13T23:44:12.999804	67cb81be	120	30	1.0000	DISCARD	gen=234 glyphs=4
2026-03-13T23:44:15.489799	37f4017b	116	29	1.0000	DISCARD	gen=190 glyphs=4
2026-03-13T23:44:15.758059	61adb725	116	29	1.0000	DISCARD	gen=234 glyphs=4
2026-03-13T23:44:18.191439	5a06ca32	120	30	1.0000	DISCARD	gen=190 glyphs=4
2026-03-13T23:44:18.474904	0eaedb57	116	29	1.0000	DISCARD	gen=234 glyphs=4
2026-03-13T23:44:20.889103	55d6c151	120	30	1.0000	DISCARD	gen=190 glyphs=4
2026-03-13T23:44:21.159259	50dc991d	116	29	1.0000	DISCARD	gen=234 glyphs=4
2026-03-13T23:44:23.567348	e90b9129	116	29	1.0000	DISCARD	gen=190 glyphs=4
2026-03-13T23:44:23.839924	67cb81be	120	30	1.0000	DISCARD	gen=234 glyphs=4
2026-03-13T23:44:26.244786	71e2ba66	116	29	1.0000	DISCARD	gen=190 glyphs=4
2026-03-13T23:44:26.527607	9e34ede0	116	29	1.0000	DISCARD	gen=234 glyphs=4
2026-03-13T23:44:28.950746	5a06ca32	120	30	1.0000	DISCARD	gen=190 glyphs=4
2026-03-13T23:44:29.225597	8aef8872	116	29	1.0000	DISCARD	gen=234 glyphs=4
2026-03-13T23:44:31.647238	37f4017b	116	29	1.0000	DISCARD	gen=191 glyphs=4
2026-03-13T23:44:31.922913	0eaedb57	116	29	1.0000	DISCARD	gen=234 glyphs=4
2026-03-13T23:44:34.336896	bfdf7cad	120	30	1.0000	DISCARD	gen=191 glyphs=4
2026-03-13T23:44:34.610588	19355583	120	30	1.0000	DISCARD	gen=235 glyphs=4
2026-03-13T23:44:37.034069	37f4017b	116	29	1.0000	DISCARD	gen=191 glyphs=4
2026-03-13T23:44:37.295435	8aef8872	116	29	1.0000	DISCARD	gen=235 glyphs=4
2026-03-13T23:44:39.702259	fdb5d108	120	30	1.0000	DISCARD	gen=191 glyphs=4
2026-03-13T23:44:39.985239	ee7f5562	116	29	1.0000	DISCARD	gen=235 glyphs=4
2026-03-13T23:44:42.390301	37f4017b	116	29	1.0000	DISCARD	gen=191 glyphs=4
2026-03-13T23:44:42.657310	5d8bf919	116	29	1.0000	DISCARD	gen=235 glyphs=4
2026-03-13T23:44:45.115459	bfdf7cad	120	30	1.0000	DISCARD	gen=191 glyphs=4
2026-03-13T23:44:45.391146	eca7ab6c	116	29	1.0000	DISCARD	gen=235 glyphs=4
2026-03-13T23:44:47.828536	55d6c151	120	30	1.0000	DISCARD	gen=191 glyphs=4
2026-03-13T23:44:48.101326	11f30d45	116	29	1.0000	DISCARD	gen=235 glyphs=4
2026-03-13T23:44:50.505904	96aa564c	116	29	1.0000	DISCARD	gen=191 glyphs=4
2026-03-13T23:44:50.766648	4f460767	116	29	1.0000	DISCARD	gen=235 glyphs=4
2026-03-13T23:44:53.167039	2701cb73	116	29	1.0000	DISCARD	gen=191 glyphs=4
2026-03-13T23:44:53.442161	19355583	120	30	1.0000	DISCARD	gen=235 glyphs=4
2026-03-13T23:44:55.864252	0984a47b	116	29	1.0000	DISCARD	gen=191 glyphs=4
2026-03-13T23:44:56.142610	265f044a	116	29	1.0000	DISCARD	gen=235 glyphs=4
2026-03-13T23:44:58.581141	37f4017b	116	29	1.0000	DISCARD	gen=192 glyphs=4
2026-03-13T23:44:58.846795	4b6a148d	116	29	1.0000	DISCARD	gen=235 glyphs=4
2026-03-13T23:45:01.266647	bfdf7cad	120	30	1.0000	DISCARD	gen=192 glyphs=4
2026-03-13T23:45:01.547386	19355583	120	30	1.0000	DISCARD	gen=236 glyphs=4
2026-03-13T23:45:04.016344	55d6c151	120	30	1.0000	DISCARD	gen=192 glyphs=4
2026-03-13T23:45:04.288854	8aef8872	116	29	1.0000	DISCARD	gen=236 glyphs=4
2026-03-13T23:45:06.697957	37f4017b	116	29	1.0000	DISCARD	gen=192 glyphs=4
2026-03-13T23:45:06.957430	9691ae3a	116	29	1.0000	DISCARD	gen=236 glyphs=4
2026-03-13T23:45:09.448215	71e2ba66	116	29	1.0000	DISCARD	gen=192 glyphs=4
2026-03-13T23:45:09.714089	fd8cfb4b	116	29	1.0000	DISCARD	gen=236 glyphs=4
2026-03-13T23:45:12.139332	6672178b	116	29	1.0000	DISCARD	gen=192 glyphs=4
2026-03-13T23:45:12.417529	f62cdcee	116	29	0.9500	DISCARD	gen=236 glyphs=4
2026-03-13T23:45:14.843409	524c005a	116	29	1.0000	DISCARD	gen=192 glyphs=4
2026-03-13T23:45:15.113076	50dc991d	116	29	1.0000	DISCARD	gen=236 glyphs=4
2026-03-13T23:45:17.664355	fdb5d108	120	30	1.0000	DISCARD	gen=192 glyphs=4
2026-03-13T23:45:17.941552	0eaedb57	116	29	1.0000	DISCARD	gen=236 glyphs=4
2026-03-13T23:45:20.390443	d11c1062	120	30	1.0000	DISCARD	gen=192 glyphs=4
2026-03-13T23:45:20.655319	0eaedb57	116	29	1.0000	DISCARD	gen=236 glyphs=4
2026-03-13T23:45:23.094290	d11c1062	120	30	1.0000	DISCARD	gen=192 glyphs=4
2026-03-13T23:45:23.364560	10982b53	116	29	1.0000	DISCARD	gen=236 glyphs=4
2026-03-13T23:45:25.762668	37f4017b	116	29	1.0000	DISCARD	gen=193 glyphs=4
2026-03-13T23:45:26.030180	6c241e9c	120	30	0.9500	DISCARD	gen=236 glyphs=4
2026-03-13T23:45:28.443413	bfdf7cad	120	30	1.0000	DISCARD	gen=193 glyphs=4
2026-03-13T23:45:28.711528	19355583	120	30	1.0000	DISCARD	gen=237 glyphs=4
2026-03-13T23:45:31.130942	37f4017b	116	29	1.0000	DISCARD	gen=193 glyphs=4
2026-03-13T23:45:31.405491	8aef8872	116	29	1.0000	DISCARD	gen=237 glyphs=4
2026-03-13T23:45:33.822609	55d6c151	120	30	1.0000	DISCARD	gen=193 glyphs=4
2026-03-13T23:45:34.094248	1c27b465	116	29	1.0000	DISCARD	gen=237 glyphs=4
2026-03-13T23:45:36.587110	37f4017b	116	29	1.0000	DISCARD	gen=193 glyphs=4
2026-03-13T23:45:36.866415	0eaedb57	116	29	1.0000	DISCARD	gen=237 glyphs=4
2026-03-13T23:45:39.436375	5b9807ac	120	30	1.0000	DISCARD	gen=193 glyphs=4
2026-03-13T23:45:39.731310	8aef8872	116	29	1.0000	DISCARD	gen=237 glyphs=4
2026-03-13T23:45:42.289537	5a06ca32	120	30	1.0000	DISCARD	gen=193 glyphs=4
2026-03-13T23:45:42.574040	1e5f0e21	116	29	1.0000	DISCARD	gen=237 glyphs=4
2026-03-13T23:45:45.138945	71e2ba66	116	29	1.0000	DISCARD	gen=193 glyphs=4
2026-03-13T23:45:45.442327	19355583	120	30	1.0000	DISCARD	gen=237 glyphs=4
2026-03-13T23:45:47.951625	12b38c2d	116	29	1.0000	DISCARD	gen=193 glyphs=4
2026-03-13T23:45:48.299301	a3af3b6b	120	30	1.0000	DISCARD	gen=237 glyphs=4
2026-03-13T23:45:50.831623	5a06ca32	120	30	1.0000	DISCARD	gen=193 glyphs=4
2026-03-13T23:45:51.103700	12bc4a17	116	29	1.0000	DISCARD	gen=237 glyphs=4
2026-03-13T23:45:53.513503	37f4017b	116	29	1.0000	DISCARD	gen=194 glyphs=4
2026-03-13T23:45:53.781717	976d7d4a	120	30	1.0000	DISCARD	gen=237 glyphs=4
2026-03-13T23:45:56.220192	bfdf7cad	120	30	1.0000	DISCARD	gen=194 glyphs=4
2026-03-13T23:45:56.481604	19355583	120	30	1.0000	DISCARD	gen=238 glyphs=4
2026-03-13T23:45:58.914212	fdb5d108	120	30	1.0000	DISCARD	gen=194 glyphs=4
2026-03-13T23:45:59.183046	8aef8872	116	29	1.0000	DISCARD	gen=238 glyphs=4
2026-03-13T23:46:01.613835	d11c1062	120	30	1.0000	DISCARD	gen=194 glyphs=4
2026-03-13T23:46:01.886969	cc5467a7	120	30	1.0000	DISCARD	gen=238 glyphs=4
2026-03-13T23:46:04.299898	06e3fe15	116	29	1.0000	DISCARD	gen=194 glyphs=4
2026-03-13T23:46:04.569830	19355583	120	30	1.0000	DISCARD	gen=238 glyphs=4
2026-03-13T23:46:07.012826	4c9b0dd4	120	30	1.0000	DISCARD	gen=194 glyphs=4
2026-03-13T23:46:07.273592	1ac673b4	116	29	1.0000	DISCARD	gen=238 glyphs=4
2026-03-13T23:46:09.687996	37f4017b	116	29	1.0000	DISCARD	gen=194 glyphs=4
2026-03-13T23:46:09.955263	a2f8c70f	116	29	1.0000	DISCARD	gen=238 glyphs=4
2026-03-13T23:46:12.368194	523cc7ac	116	29	1.0000	DISCARD	gen=194 glyphs=4
2026-03-13T23:46:12.643005	875e0f8a	116	29	1.0000	DISCARD	gen=238 glyphs=4
2026-03-13T23:46:15.085399	71e2ba66	116	29	1.0000	DISCARD	gen=194 glyphs=4
2026-03-13T23:46:15.350046	1e5f0e21	116	29	1.0000	DISCARD	gen=238 glyphs=4
2026-03-13T23:46:17.794521	f690a271	120	30	1.0000	DISCARD	gen=194 glyphs=4
2026-03-13T23:46:18.053211	1e5f0e21	116	29	1.0000	DISCARD	gen=238 glyphs=4
2026-03-13T23:46:20.529536	37f4017b	116	29	1.0000	DISCARD	gen=195 glyphs=4
2026-03-13T23:46:20.822619	8aef8872	116	29	1.0000	DISCARD	gen=238 glyphs=4
2026-03-13T23:46:23.259302	bfdf7cad	120	30	1.0000	DISCARD	gen=195 glyphs=4
2026-03-13T23:46:23.528428	19355583	120	30	1.0000	DISCARD	gen=239 glyphs=4
2026-03-13T23:46:25.988524	4e5115da	120	30	1.0000	DISCARD	gen=195 glyphs=4
2026-03-13T23:46:26.256268	8aef8872	116	29	1.0000	DISCARD	gen=239 glyphs=4
2026-03-13T23:46:28.685484	5a06ca32	120	30	1.0000	DISCARD	gen=195 glyphs=4
2026-03-13T23:46:28.958333	875e0f8a	116	29	1.0000	DISCARD	gen=239 glyphs=4
2026-03-13T23:46:31.352198	e64a683a	120	30	1.0000	DISCARD	gen=195 glyphs=4
2026-03-13T23:46:31.618508	0eaedb57	116	29	1.0000	DISCARD	gen=239 glyphs=4
2026-03-13T23:46:34.155660	71e2ba66	116	29	1.0000	DISCARD	gen=195 glyphs=4
2026-03-13T23:46:34.440560	1e5f0e21	116	29	1.0000	DISCARD	gen=239 glyphs=4
2026-03-13T23:46:36.972358	05748304	120	30	1.0000	DISCARD	gen=195 glyphs=4
2026-03-13T23:46:37.242395	8aef8872	116	29	1.0000	DISCARD	gen=239 glyphs=4
2026-03-13T23:46:39.678995	1b695f25	116	29	1.0000	DISCARD	gen=195 glyphs=4
2026-03-13T23:46:39.951865	9e34ede0	116	29	1.0000	DISCARD	gen=239 glyphs=4
2026-03-13T23:46:42.440559	173b4345	124	31	0.9500	DISCARD	gen=195 glyphs=4
2026-03-13T23:46:42.733535	ae44ace5	116	29	1.0000	DISCARD	gen=239 glyphs=4
2026-03-13T23:46:45.171701	5a06ca32	120	30	1.0000	DISCARD	gen=195 glyphs=4
2026-03-13T23:46:45.450617	df539161	116	29	1.0000	DISCARD	gen=239 glyphs=4
2026-03-13T23:46:47.943331	37f4017b	116	29	1.0000	DISCARD	gen=196 glyphs=4
2026-03-13T23:46:48.231454	0eaedb57	116	29	1.0000	DISCARD	gen=239 glyphs=4
2026-03-13T23:46:50.664143	bfdf7cad	120	30	1.0000	DISCARD	gen=196 glyphs=4
2026-03-13T23:46:50.931827	19355583	120	30	1.0000	DISCARD	gen=240 glyphs=4
2026-03-13T23:46:53.432381	fdb5d108	120	30	1.0000	DISCARD	gen=196 glyphs=4
2026-03-13T23:46:53.707103	8aef8872	116	29	1.0000	DISCARD	gen=240 glyphs=4
2026-03-13T23:46:56.127064	37f4017b	116	29	1.0000	DISCARD	gen=196 glyphs=4
2026-03-13T23:46:56.395992	b5623ed8	120	30	1.0000	DISCARD	gen=240 glyphs=4
2026-03-13T23:46:58.819894	5b9807ac	120	30	1.0000	DISCARD	gen=196 glyphs=4
2026-03-13T23:46:59.095942	515e0e15	116	29	1.0000	DISCARD	gen=240 glyphs=4
2026-03-13T23:47:01.510423	5a06ca32	120	30	1.0000	DISCARD	gen=196 glyphs=4
2026-03-13T23:47:01.777948	0eaedb57	116	29	1.0000	DISCARD	gen=240 glyphs=4
2026-03-13T23:47:04.225409	fdb5d108	120	30	1.0000	DISCARD	gen=196 glyphs=4
2026-03-13T23:47:04.500331	b7aed8e9	116	29	1.0000	DISCARD	gen=240 glyphs=4
2026-03-13T23:47:06.919304	1d34459a	116	29	1.0000	DISCARD	gen=196 glyphs=4
2026-03-13T23:47:07.367133	d7c8681b	120	30	1.0000	DISCARD	gen=240 glyphs=4
2026-03-13T23:47:09.736977	5a06ca32	120	30	1.0000	DISCARD	gen=196 glyphs=4
2026-03-13T23:47:09.997435	0eaedb57	116	29	1.0000	DISCARD	gen=240 glyphs=4
2026-03-13T23:47:12.423103	7ca87b42	116	29	1.0000	DISCARD	gen=196 glyphs=4
2026-03-13T23:47:12.689472	66de22dc	120	30	1.0000	DISCARD	gen=240 glyphs=4
2026-03-13T23:47:15.114624	37f4017b	116	29	1.0000	DISCARD	gen=197 glyphs=4
2026-03-13T23:47:15.376320	8ea4edab	116	29	1.0000	DISCARD	gen=240 glyphs=4
2026-03-13T23:47:17.798782	bfdf7cad	120	30	1.0000	DISCARD	gen=197 glyphs=4
2026-03-13T23:47:18.064927	19355583	120	30	1.0000	DISCARD	gen=241 glyphs=4
2026-03-13T23:47:20.475691	14cdb8b7	116	29	1.0000	DISCARD	gen=197 glyphs=4
2026-03-13T23:47:20.746682	8aef8872	116	29	1.0000	DISCARD	gen=241 glyphs=4
2026-03-13T23:47:23.162078	42fc086e	120	30	1.0000	DISCARD	gen=197 glyphs=4
2026-03-13T23:47:23.432817	875e0f8a	116	29	1.0000	DISCARD	gen=241 glyphs=4
2026-03-13T23:47:25.914190	37f4017b	116	29	1.0000	DISCARD	gen=197 glyphs=4
2026-03-13T23:47:26.194227	050862ad	120	30	1.0000	DISCARD	gen=241 glyphs=4
2026-03-13T23:47:28.763183	5a06ca32	120	30	1.0000	DISCARD	gen=197 glyphs=4
2026-03-13T23:47:29.035476	ae44ace5	116	29	1.0000	DISCARD	gen=241 glyphs=4
2026-03-13T23:47:31.463427	4c9b0dd4	120	30	1.0000	DISCARD	gen=197 glyphs=4
2026-03-13T23:47:31.740776	8aef8872	116	29	1.0000	DISCARD	gen=241 glyphs=4
2026-03-13T23:47:34.193454	37f4017b	116	29	1.0000	DISCARD	gen=197 glyphs=4
2026-03-13T23:47:34.454314	50dc991d	116	29	1.0000	DISCARD	gen=241 glyphs=4
2026-03-13T23:47:37.027263	37f4017b	116	29	1.0000	DISCARD	gen=197 glyphs=4
2026-03-13T23:47:37.294221	0eaedb57	116	29	1.0000	DISCARD	gen=241 glyphs=4
2026-03-13T23:47:39.732067	621e2bf2	116	29	1.0000	DISCARD	gen=197 glyphs=4
2026-03-13T23:47:39.997761	8aef8872	116	29	1.0000	DISCARD	gen=241 glyphs=4
2026-03-13T23:47:42.423515	37f4017b	116	29	1.0000	DISCARD	gen=198 glyphs=4
2026-03-13T23:47:42.704511	b57e7176	120	30	1.0000	DISCARD	gen=241 glyphs=4
2026-03-13T23:47:45.163312	bfdf7cad	120	30	1.0000	DISCARD	gen=198 glyphs=4
2026-03-13T23:47:45.434975	19355583	120	30	1.0000	DISCARD	gen=242 glyphs=4
2026-03-13T23:47:47.884191	37f4017b	116	29	1.0000	DISCARD	gen=198 glyphs=4
2026-03-13T23:47:48.149849	8aef8872	116	29	1.0000	DISCARD	gen=242 glyphs=4
2026-03-13T23:47:50.576033	5a06ca32	120	30	1.0000	DISCARD	gen=198 glyphs=4
2026-03-13T23:47:50.842383	eca7ab6c	116	29	1.0000	DISCARD	gen=242 glyphs=4
2026-03-13T23:47:53.283020	9c2d1aa4	116	29	1.0000	DISCARD	gen=198 glyphs=4
2026-03-13T23:47:53.553685	ca615afe	116	29	1.0000	DISCARD	gen=242 glyphs=4
