timestamp	program_hash	spirv_size	word_count	fitness	status	description
2026-03-14T03:34:45.963135	2c6ee654	116	29	0.9500	DISCARD	gen=694 glyphs=4
2026-03-14T03:34:46.248756	ec9d6759	120	30	1.0000	DISCARD	gen=738 glyphs=4
2026-03-14T03:34:48.674671	37f4017b	116	29	1.0000	DISCARD	gen=695 glyphs=4
2026-03-14T03:34:48.954989	2032fdb5	116	29	1.0000	DISCARD	gen=738 glyphs=4
2026-03-14T03:34:51.489684	bfdf7cad	120	30	1.0000	DISCARD	gen=695 glyphs=4
2026-03-14T03:34:51.752739	19355583	120	30	1.0000	DISCARD	gen=739 glyphs=4
2026-03-14T03:34:54.191347	32ef5889	116	29	1.0000	DISCARD	gen=695 glyphs=4
2026-03-14T03:34:54.456796	8aef8872	116	29	1.0000	DISCARD	gen=739 glyphs=4
2026-03-14T03:34:56.908998	5b9807ac	120	30	1.0000	DISCARD	gen=695 glyphs=4
2026-03-14T03:34:57.177325	8aef8872	116	29	1.0000	DISCARD	gen=739 glyphs=4
2026-03-14T03:34:59.595447	37f4017b	116	29	1.0000	DISCARD	gen=695 glyphs=4
2026-03-14T03:34:59.868942	19355583	120	30	1.0000	DISCARD	gen=739 glyphs=4
2026-03-14T03:35:02.315156	56bfbc5d	116	29	1.0000	DISCARD	gen=695 glyphs=4
2026-03-14T03:35:02.589356	8aef8872	116	29	1.0000	DISCARD	gen=739 glyphs=4
2026-03-14T03:35:05.040537	8146b2f6	116	29	0.9500	DISCARD	gen=695 glyphs=4
2026-03-14T03:35:05.315126	050862ad	120	30	1.0000	DISCARD	gen=739 glyphs=4
2026-03-14T03:35:07.798074	7ca87b42	116	29	1.0000	DISCARD	gen=695 glyphs=4
2026-03-14T03:35:08.068082	19355583	120	30	1.0000	DISCARD	gen=739 glyphs=4
2026-03-14T03:35:10.534522	607a1ddd	116	29	1.0000	DISCARD	gen=695 glyphs=4
2026-03-14T03:35:10.810668	19355583	120	30	1.0000	DISCARD	gen=739 glyphs=4
2026-03-14T03:35:13.272975	a898136f	120	30	1.0000	DISCARD	gen=695 glyphs=4
2026-03-14T03:35:13.546454	5c9aa19e	116	29	1.0000	DISCARD	gen=739 glyphs=4
2026-03-14T03:35:16.035652	37f4017b	116	29	1.0000	DISCARD	gen=696 glyphs=4
2026-03-14T03:35:16.316204	b7aed8e9	116	29	1.0000	DISCARD	gen=739 glyphs=4
2026-03-14T03:35:18.786426	bfdf7cad	120	30	1.0000	DISCARD	gen=696 glyphs=4
2026-03-14T03:35:19.054794	19355583	120	30	1.0000	DISCARD	gen=740 glyphs=4
2026-03-14T03:35:21.566600	55d6c151	120	30	1.0000	DISCARD	gen=696 glyphs=4
2026-03-14T03:35:21.870357	8aef8872	116	29	1.0000	DISCARD	gen=740 glyphs=4
2026-03-14T03:35:24.393764	55d6c151	120	30	1.0000	DISCARD	gen=696 glyphs=4
2026-03-14T03:35:24.659413	8aef8872	116	29	1.0000	DISCARD	gen=740 glyphs=4
2026-03-14T03:35:27.140034	4c9b0dd4	120	30	1.0000	DISCARD	gen=696 glyphs=4
2026-03-14T03:35:27.422726	0eaedb57	116	29	1.0000	DISCARD	gen=740 glyphs=4
2026-03-14T03:35:29.884991	5a06ca32	120	30	1.0000	DISCARD	gen=696 glyphs=4
2026-03-14T03:35:30.155946	d7c8681b	120	30	1.0000	DISCARD	gen=740 glyphs=4
2026-03-14T03:35:32.677800	17eeb926	116	29	1.0000	DISCARD	gen=696 glyphs=4
2026-03-14T03:35:32.951654	d7c8681b	120	30	1.0000	DISCARD	gen=740 glyphs=4
2026-03-14T03:35:35.400019	37f4017b	116	29	1.0000	DISCARD	gen=696 glyphs=4
2026-03-14T03:35:35.677702	0eaedb57	116	29	1.0000	DISCARD	gen=740 glyphs=4
2026-03-14T03:35:38.139873	fdb5d108	120	30	1.0000	DISCARD	gen=696 glyphs=4
2026-03-14T03:35:38.416576	a0a084c6	120	30	1.0000	DISCARD	gen=740 glyphs=4
2026-03-14T03:35:40.906987	5b40840c	120	30	1.0000	DISCARD	gen=696 glyphs=4
2026-03-14T03:35:41.192505	19355583	120	30	1.0000	DISCARD	gen=740 glyphs=4
2026-03-14T03:35:43.663249	37f4017b	116	29	1.0000	DISCARD	gen=697 glyphs=4
2026-03-14T03:35:43.939653	1e5f0e21	116	29	1.0000	DISCARD	gen=740 glyphs=4
2026-03-14T03:35:46.403664	bfdf7cad	120	30	1.0000	DISCARD	gen=697 glyphs=4
2026-03-14T03:35:46.671313	19355583	120	30	1.0000	DISCARD	gen=741 glyphs=4
2026-03-14T03:35:49.158303	84717f37	124	31	0.9500	DISCARD	gen=697 glyphs=4
2026-03-14T03:35:49.429095	8aef8872	116	29	1.0000	DISCARD	gen=741 glyphs=4
2026-03-14T03:35:51.911335	37f4017b	116	29	1.0000	DISCARD	gen=697 glyphs=4
2026-03-14T03:35:52.190891	06c0c825	120	30	1.0000	DISCARD	gen=741 glyphs=4
2026-03-14T03:35:54.753900	5a06ca32	120	30	1.0000	DISCARD	gen=697 glyphs=4
2026-03-14T03:35:55.033950	b57e7176	120	30	1.0000	DISCARD	gen=741 glyphs=4
2026-03-14T03:35:57.528735	37f4017b	116	29	1.0000	DISCARD	gen=697 glyphs=4
2026-03-14T03:35:57.806143	d5c0542d	116	29	1.0000	DISCARD	gen=741 glyphs=4
2026-03-14T03:36:00.282010	d11c1062	120	30	1.0000	DISCARD	gen=697 glyphs=4
2026-03-14T03:36:00.553757	a78f9454	120	30	1.0000	DISCARD	gen=741 glyphs=4
2026-03-14T03:36:03.045061	55d6c151	120	30	1.0000	DISCARD	gen=697 glyphs=4
2026-03-14T03:36:03.304700	8aef8872	116	29	1.0000	DISCARD	gen=741 glyphs=4
2026-03-14T03:36:05.788409	c2a8abe4	120	30	1.0000	DISCARD	gen=697 glyphs=4
2026-03-14T03:36:06.062579	0eaedb57	116	29	1.0000	DISCARD	gen=741 glyphs=4
2026-03-14T03:36:08.569531	55d6c151	120	30	1.0000	DISCARD	gen=697 glyphs=4
2026-03-14T03:36:08.858249	eca7ab6c	116	29	1.0000	DISCARD	gen=741 glyphs=4
2026-03-14T03:36:11.318880	37f4017b	116	29	1.0000	DISCARD	gen=698 glyphs=4
2026-03-14T03:36:11.594962	b57e7176	120	30	1.0000	DISCARD	gen=741 glyphs=4
2026-03-14T03:36:14.065461	bfdf7cad	120	30	1.0000	DISCARD	gen=698 glyphs=4
2026-03-14T03:36:14.334637	19355583	120	30	1.0000	DISCARD	gen=742 glyphs=4
2026-03-14T03:36:16.798630	d607fa4c	124	31	0.9500	DISCARD	gen=698 glyphs=4
2026-03-14T03:36:17.063533	8aef8872	116	29	1.0000	DISCARD	gen=742 glyphs=4
2026-03-14T03:36:19.554939	7354cb56	116	29	1.0000	DISCARD	gen=698 glyphs=4
2026-03-14T03:36:19.835954	b0d476b4	116	29	1.0000	DISCARD	gen=742 glyphs=4
2026-03-14T03:36:22.313337	d11c1062	120	30	1.0000	DISCARD	gen=698 glyphs=4
2026-03-14T03:36:22.577963	0eaedb57	116	29	1.0000	DISCARD	gen=742 glyphs=4
2026-03-14T03:36:25.053353	37f4017b	116	29	1.0000	DISCARD	gen=698 glyphs=4
2026-03-14T03:36:25.359396	8a9e0089	120	30	1.0000	DISCARD	gen=742 glyphs=4
2026-03-14T03:36:27.864947	7baa40c7	116	29	1.0000	DISCARD	gen=698 glyphs=4
2026-03-14T03:36:28.139217	e8c7f6cf	120	30	1.0000	DISCARD	gen=742 glyphs=4
2026-03-14T03:36:30.620150	55d6c151	120	30	1.0000	DISCARD	gen=698 glyphs=4
2026-03-14T03:36:30.882233	d7c8681b	120	30	1.0000	DISCARD	gen=742 glyphs=4
2026-03-14T03:36:33.351584	37f4017b	116	29	1.0000	DISCARD	gen=698 glyphs=4
2026-03-14T03:36:33.615816	e2cd28ea	120	30	1.0000	DISCARD	gen=742 glyphs=4
2026-03-14T03:36:36.055820	ff0fd775	116	29	1.0000	DISCARD	gen=698 glyphs=4
2026-03-14T03:36:36.323702	050862ad	120	30	1.0000	DISCARD	gen=742 glyphs=4
2026-03-14T03:36:38.774746	37f4017b	116	29	1.0000	DISCARD	gen=699 glyphs=4
2026-03-14T03:36:39.049486	0eaedb57	116	29	1.0000	DISCARD	gen=742 glyphs=4
2026-03-14T03:36:41.538455	bfdf7cad	120	30	1.0000	DISCARD	gen=699 glyphs=4
2026-03-14T03:36:41.825993	19355583	120	30	1.0000	DISCARD	gen=743 glyphs=4
2026-03-14T03:36:44.278109	309c7c83	116	29	1.0000	DISCARD	gen=699 glyphs=4
2026-03-14T03:36:44.553456	8aef8872	116	29	1.0000	DISCARD	gen=743 glyphs=4
2026-03-14T03:36:47.009292	9c99ef24	120	30	1.0000	DISCARD	gen=699 glyphs=4
2026-03-14T03:36:47.290347	50dc991d	116	29	1.0000	DISCARD	gen=743 glyphs=4
2026-03-14T03:36:49.916039	cf93e0ef	116	29	1.0000	DISCARD	gen=699 glyphs=4
2026-03-14T03:36:50.190372	fc97baab	116	29	1.0000	DISCARD	gen=743 glyphs=4
2026-03-14T03:36:52.649371	1d34459a	116	29	1.0000	DISCARD	gen=699 glyphs=4
2026-03-14T03:36:52.925250	b57e7176	120	30	1.0000	DISCARD	gen=743 glyphs=4
2026-03-14T03:36:55.412951	bfdf7cad	120	30	1.0000	DISCARD	gen=699 glyphs=4
2026-03-14T03:36:55.686878	b57e7176	120	30	1.0000	DISCARD	gen=743 glyphs=4
2026-03-14T03:36:58.242802	55d6c151	120	30	1.0000	DISCARD	gen=699 glyphs=4
2026-03-14T03:36:58.515182	050862ad	120	30	1.0000	DISCARD	gen=743 glyphs=4
2026-03-14T03:37:00.976358	fdb5d108	120	30	1.0000	DISCARD	gen=699 glyphs=4
2026-03-14T03:37:01.242046	3a527587	116	29	1.0000	DISCARD	gen=743 glyphs=4
2026-03-14T03:37:03.793969	55d6c151	120	30	1.0000	DISCARD	gen=699 glyphs=4
2026-03-14T03:37:04.064480	ea352381	116	29	1.0000	DISCARD	gen=743 glyphs=4
2026-03-14T03:37:06.543460	37f4017b	116	29	1.0000	DISCARD	gen=700 glyphs=4
2026-03-14T03:37:06.822363	8aef8872	116	29	1.0000	DISCARD	gen=743 glyphs=4
2026-03-14T03:37:09.295146	bfdf7cad	120	30	1.0000	DISCARD	gen=700 glyphs=4
2026-03-14T03:37:09.566613	19355583	120	30	1.0000	DISCARD	gen=744 glyphs=4
2026-03-14T03:37:12.041486	5b9807ac	120	30	1.0000	DISCARD	gen=700 glyphs=4
2026-03-14T03:37:12.310165	8aef8872	116	29	1.0000	DISCARD	gen=744 glyphs=4
2026-03-14T03:37:14.812865	1d34459a	116	29	1.0000	DISCARD	gen=700 glyphs=4
2026-03-14T03:37:15.090691	67cb81be	120	30	1.0000	DISCARD	gen=744 glyphs=4
2026-03-14T03:37:17.571074	37f4017b	116	29	1.0000	DISCARD	gen=700 glyphs=4
2026-03-14T03:37:17.841499	2377181a	120	30	1.0000	DISCARD	gen=744 glyphs=4
2026-03-14T03:37:20.300131	bfdf7cad	120	30	1.0000	DISCARD	gen=700 glyphs=4
2026-03-14T03:37:20.579339	0eaedb57	116	29	1.0000	DISCARD	gen=744 glyphs=4
2026-03-14T03:37:23.060472	f10240aa	120	30	1.0000	DISCARD	gen=700 glyphs=4
2026-03-14T03:37:23.341928	8aef8872	116	29	1.0000	DISCARD	gen=744 glyphs=4
2026-03-14T03:37:25.803293	37f4017b	116	29	1.0000	DISCARD	gen=700 glyphs=4
2026-03-14T03:37:26.077199	67cb81be	120	30	1.0000	DISCARD	gen=744 glyphs=4
2026-03-14T03:37:28.565435	2701cb73	116	29	1.0000	DISCARD	gen=700 glyphs=4
2026-03-14T03:37:28.919285	4614905d	116	29	1.0000	DISCARD	gen=744 glyphs=4
2026-03-14T03:37:31.429318	4c9b0dd4	120	30	1.0000	DISCARD	gen=700 glyphs=4
2026-03-14T03:37:31.708319	67cb81be	120	30	1.0000	DISCARD	gen=744 glyphs=4
2026-03-14T03:37:34.178794	37f4017b	116	29	1.0000	DISCARD	gen=701 glyphs=4
2026-03-14T03:37:34.454427	ae44ace5	116	29	1.0000	DISCARD	gen=744 glyphs=4
2026-03-14T03:37:36.916669	bfdf7cad	120	30	1.0000	DISCARD	gen=701 glyphs=4
2026-03-14T03:37:37.193434	19355583	120	30	1.0000	DISCARD	gen=745 glyphs=4
2026-03-14T03:37:39.676290	ed096be7	116	29	1.0000	DISCARD	gen=701 glyphs=4
2026-03-14T03:37:39.950912	8aef8872	116	29	1.0000	DISCARD	gen=745 glyphs=4
2026-03-14T03:37:42.397797	adb73bfd	116	29	1.0000	DISCARD	gen=701 glyphs=4
2026-03-14T03:37:42.669093	eaadf18f	116	29	1.0000	DISCARD	gen=745 glyphs=4
2026-03-14T03:37:45.143617	5a06ca32	120	30	1.0000	DISCARD	gen=701 glyphs=4
2026-03-14T03:37:45.416569	bab942ca	116	29	1.0000	DISCARD	gen=745 glyphs=4
2026-03-14T03:37:47.876089	bfdf7cad	120	30	1.0000	DISCARD	gen=701 glyphs=4
2026-03-14T03:37:48.147899	8aef8872	116	29	1.0000	DISCARD	gen=745 glyphs=4
2026-03-14T03:37:50.609097	71e2ba66	116	29	1.0000	DISCARD	gen=701 glyphs=4
2026-03-14T03:37:50.867570	19355583	120	30	1.0000	DISCARD	gen=745 glyphs=4
2026-03-14T03:37:53.349248	fdb5d108	120	30	1.0000	DISCARD	gen=701 glyphs=4
2026-03-14T03:37:53.631896	0eaedb57	116	29	1.0000	DISCARD	gen=745 glyphs=4
2026-03-14T03:37:56.099584	d11c1062	120	30	1.0000	DISCARD	gen=701 glyphs=4
2026-03-14T03:37:56.376631	875e0f8a	116	29	1.0000	DISCARD	gen=745 glyphs=4
2026-03-14T03:37:58.829626	691238c7	116	29	1.0000	DISCARD	gen=701 glyphs=4
2026-03-14T03:37:59.094653	b57e7176	120	30	1.0000	DISCARD	gen=745 glyphs=4
2026-03-14T03:38:01.601110	37f4017b	116	29	1.0000	DISCARD	gen=702 glyphs=4
2026-03-14T03:38:01.875881	44a87183	120	30	1.0000	DISCARD	gen=745 glyphs=4
2026-03-14T03:38:04.358554	bfdf7cad	120	30	1.0000	DISCARD	gen=702 glyphs=4
2026-03-14T03:38:04.627279	19355583	120	30	1.0000	DISCARD	gen=746 glyphs=4
2026-03-14T03:38:08.791396	55d6c151	120	30	1.0000	DISCARD	gen=702 glyphs=4
2026-03-14T03:38:09.078782	8aef8872	116	29	1.0000	DISCARD	gen=746 glyphs=4
2026-03-14T03:38:11.525828	37f4017b	116	29	1.0000	DISCARD	gen=702 glyphs=4
2026-03-14T03:38:11.814422	b57e7176	120	30	1.0000	DISCARD	gen=746 glyphs=4
2026-03-14T03:38:14.232637	71e2ba66	116	29	1.0000	DISCARD	gen=702 glyphs=4
2026-03-14T03:38:14.506562	0eaedb57	116	29	1.0000	DISCARD	gen=746 glyphs=4
2026-03-14T03:38:18.565064	1d34459a	116	29	1.0000	DISCARD	gen=702 glyphs=4
2026-03-14T03:38:18.847350	a78f9454	120	30	1.0000	DISCARD	gen=746 glyphs=4
2026-03-14T03:38:21.285424	37f4017b	116	29	1.0000	DISCARD	gen=702 glyphs=4
2026-03-14T03:38:21.551907	d7c8681b	120	30	1.0000	DISCARD	gen=746 glyphs=4
2026-03-14T03:38:24.024392	bfdf7cad	120	30	1.0000	DISCARD	gen=702 glyphs=4
2026-03-14T03:38:24.295113	4c59dddd	120	30	1.0000	DISCARD	gen=746 glyphs=4
2026-03-14T03:38:26.776828	46646282	116	29	0.9500	DISCARD	gen=702 glyphs=4
2026-03-14T03:38:27.047290	76205582	116	29	1.0000	DISCARD	gen=746 glyphs=4
2026-03-14T03:38:29.495304	5b9807ac	120	30	1.0000	DISCARD	gen=702 glyphs=4
2026-03-14T03:38:29.773013	8aef8872	116	29	1.0000	DISCARD	gen=746 glyphs=4
2026-03-14T03:38:33.932976	37f4017b	116	29	1.0000	DISCARD	gen=703 glyphs=4
2026-03-14T03:38:34.212001	e2cd28ea	120	30	1.0000	DISCARD	gen=746 glyphs=4
2026-03-14T03:38:36.659916	bfdf7cad	120	30	1.0000	DISCARD	gen=703 glyphs=4
2026-03-14T03:38:36.937382	19355583	120	30	1.0000	DISCARD	gen=747 glyphs=4
2026-03-14T03:38:39.384561	37f4017b	116	29	1.0000	DISCARD	gen=703 glyphs=4
2026-03-14T03:38:39.659362	8aef8872	116	29	1.0000	DISCARD	gen=747 glyphs=4
2026-03-14T03:38:43.749003	1d34459a	116	29	1.0000	DISCARD	gen=703 glyphs=4
2026-03-14T03:38:44.019853	f4f868a7	124	31	0.9500	DISCARD	gen=747 glyphs=4
2026-03-14T03:38:46.492016	5b9807ac	120	30	1.0000	DISCARD	gen=703 glyphs=4
2026-03-14T03:38:46.762630	67cb81be	120	30	1.0000	DISCARD	gen=747 glyphs=4
2026-03-14T03:38:50.885928	37f4017b	116	29	1.0000	DISCARD	gen=703 glyphs=4
2026-03-14T03:38:51.161101	e2cd28ea	120	30	1.0000	DISCARD	gen=747 glyphs=4
2026-03-14T03:38:53.609378	5a06ca32	120	30	1.0000	DISCARD	gen=703 glyphs=4
2026-03-14T03:38:53.868850	050862ad	120	30	1.0000	DISCARD	gen=747 glyphs=4
2026-03-14T03:38:57.975646	5a06ca32	120	30	1.0000	DISCARD	gen=703 glyphs=4
2026-03-14T03:38:58.250133	a78f9454	120	30	1.0000	DISCARD	gen=747 glyphs=4
2026-03-14T03:39:00.712253	0bb2336c	116	29	1.0000	DISCARD	gen=703 glyphs=4
2026-03-14T03:39:00.989402	e2cd28ea	120	30	1.0000	DISCARD	gen=747 glyphs=4
2026-03-14T03:39:03.462903	fdb5d108	120	30	1.0000	DISCARD	gen=703 glyphs=4
2026-03-14T03:39:03.733986	1e5f0e21	116	29	1.0000	DISCARD	gen=747 glyphs=4
2026-03-14T03:39:08.004397	37f4017b	116	29	1.0000	DISCARD	gen=704 glyphs=4
2026-03-14T03:39:08.266347	e8dcd97b	116	29	1.0000	DISCARD	gen=747 glyphs=4
2026-03-14T03:39:10.733500	bfdf7cad	120	30	1.0000	DISCARD	gen=704 glyphs=4
2026-03-14T03:39:11.003016	19355583	120	30	1.0000	DISCARD	gen=748 glyphs=4
2026-03-14T03:39:13.474993	fdb5d108	120	30	1.0000	DISCARD	gen=704 glyphs=4
2026-03-14T03:39:13.760354	8aef8872	116	29	1.0000	DISCARD	gen=748 glyphs=4
2026-03-14T03:39:17.936924	3235ee2f	120	30	1.0000	DISCARD	gen=704 glyphs=4
2026-03-14T03:39:18.199444	ae44ace5	116	29	1.0000	DISCARD	gen=748 glyphs=4
2026-03-14T03:39:20.683533	5a06ca32	120	30	1.0000	DISCARD	gen=704 glyphs=4
2026-03-14T03:39:20.958465	50dc991d	116	29	1.0000	DISCARD	gen=748 glyphs=4
2026-03-14T03:39:23.597372	55d6c151	120	30	1.0000	DISCARD	gen=704 glyphs=4
2026-03-14T03:39:27.343601	a78f9454	120	30	1.0000	DISCARD	gen=748 glyphs=4
2026-03-14T03:39:29.821770	fdb5d108	120	30	1.0000	DISCARD	gen=704 glyphs=4
2026-03-14T03:39:30.094878	8aef8872	116	29	1.0000	DISCARD	gen=748 glyphs=4
2026-03-14T03:39:32.561891	5b9807ac	120	30	1.0000	DISCARD	gen=704 glyphs=4
2026-03-14T03:39:32.830611	0eaedb57	116	29	1.0000	DISCARD	gen=748 glyphs=4
2026-03-14T03:39:35.323907	fdb5d108	120	30	1.0000	DISCARD	gen=704 glyphs=4
2026-03-14T03:39:35.592081	c3889725	116	29	1.0000	DISCARD	gen=748 glyphs=4
2026-03-14T03:39:38.190666	5a06ca32	120	30	1.0000	DISCARD	gen=704 glyphs=4
2026-03-14T03:39:38.468168	050862ad	120	30	1.0000	DISCARD	gen=748 glyphs=4
2026-03-14T03:39:40.915475	37f4017b	116	29	1.0000	DISCARD	gen=705 glyphs=4
2026-03-14T03:39:41.192194	f566be41	116	29	1.0000	DISCARD	gen=748 glyphs=4
2026-03-14T03:39:43.653291	bfdf7cad	120	30	1.0000	DISCARD	gen=705 glyphs=4
2026-03-14T03:39:43.931681	19355583	120	30	1.0000	DISCARD	gen=749 glyphs=4
2026-03-14T03:39:46.437326	2ecfec27	116	29	1.0000	DISCARD	gen=705 glyphs=4
2026-03-14T03:39:46.701868	8aef8872	116	29	1.0000	DISCARD	gen=749 glyphs=4
2026-03-14T03:39:49.167828	b4509935	120	30	1.0000	DISCARD	gen=705 glyphs=4
2026-03-14T03:39:49.437020	b57e7176	120	30	1.0000	DISCARD	gen=749 glyphs=4
2026-03-14T03:39:51.902213	84294031	116	29	1.0000	DISCARD	gen=705 glyphs=4
2026-03-14T03:39:52.189394	b59de9d8	120	30	1.0000	DISCARD	gen=749 glyphs=4
2026-03-14T03:39:54.681042	12b38c2d	116	29	1.0000	DISCARD	gen=705 glyphs=4
2026-03-14T03:39:54.951504	e2cd28ea	120	30	1.0000	DISCARD	gen=749 glyphs=4
2026-03-14T03:39:57.416657	55d6c151	120	30	1.0000	DISCARD	gen=705 glyphs=4
2026-03-14T03:39:57.690027	0eaedb57	116	29	1.0000	DISCARD	gen=749 glyphs=4
2026-03-14T03:40:00.141140	5a06ca32	120	30	1.0000	DISCARD	gen=705 glyphs=4
2026-03-14T03:40:00.410544	24b70e36	116	29	0.9500	DISCARD	gen=749 glyphs=4
2026-03-14T03:40:02.897076	fdb5d108	120	30	1.0000	DISCARD	gen=705 glyphs=4
2026-03-14T03:40:03.167610	19355583	120	30	1.0000	DISCARD	gen=749 glyphs=4
2026-03-14T03:40:05.602289	bfdf7cad	120	30	1.0000	DISCARD	gen=705 glyphs=4
2026-03-14T03:40:05.873261	8aef8872	116	29	1.0000	DISCARD	gen=749 glyphs=4
2026-03-14T03:40:08.385915	37f4017b	116	29	1.0000	DISCARD	gen=706 glyphs=4
2026-03-14T03:40:08.685445	543f98ca	120	30	1.0000	DISCARD	gen=749 glyphs=4
2026-03-14T03:40:11.148683	bfdf7cad	120	30	1.0000	DISCARD	gen=706 glyphs=4
2026-03-14T03:40:11.419904	19355583	120	30	1.0000	DISCARD	gen=750 glyphs=4
2026-03-14T03:40:13.871187	d11c1062	120	30	1.0000	DISCARD	gen=706 glyphs=4
2026-03-14T03:40:14.154119	8aef8872	116	29	1.0000	DISCARD	gen=750 glyphs=4
2026-03-14T03:40:16.583791	0dcfa604	116	29	1.0000	DISCARD	gen=706 glyphs=4
2026-03-14T03:40:16.864171	8aef8872	116	29	1.0000	DISCARD	gen=750 glyphs=4
2026-03-14T03:40:19.301943	f6b1c7eb	116	29	1.0000	DISCARD	gen=706 glyphs=4
2026-03-14T03:40:19.569174	875e0f8a	116	29	1.0000	DISCARD	gen=750 glyphs=4
2026-03-14T03:40:22.016833	55d6c151	120	30	1.0000	DISCARD	gen=706 glyphs=4
2026-03-14T03:40:22.281373	050862ad	120	30	1.0000	DISCARD	gen=750 glyphs=4
2026-03-14T03:40:24.701412	d46db515	120	30	1.0000	DISCARD	gen=706 glyphs=4
2026-03-14T03:40:24.966771	d7c8681b	120	30	1.0000	DISCARD	gen=750 glyphs=4
2026-03-14T03:40:27.414264	2b71f50e	116	29	1.0000	DISCARD	gen=706 glyphs=4
2026-03-14T03:40:27.681744	525c326d	116	29	1.0000	DISCARD	gen=750 glyphs=4
2026-03-14T03:40:30.119853	bfdf7cad	120	30	1.0000	DISCARD	gen=706 glyphs=4
2026-03-14T03:40:30.398031	8aef8872	116	29	1.0000	DISCARD	gen=750 glyphs=4
2026-03-14T03:40:32.820841	5a06ca32	120	30	1.0000	DISCARD	gen=706 glyphs=4
2026-03-14T03:40:33.099204	4586a7e4	120	30	1.0000	DISCARD	gen=750 glyphs=4
2026-03-14T03:40:35.521493	37f4017b	116	29	1.0000	DISCARD	gen=707 glyphs=4
2026-03-14T03:40:35.789698	0eaedb57	116	29	1.0000	DISCARD	gen=750 glyphs=4
2026-03-14T03:40:38.244254	bfdf7cad	120	30	1.0000	DISCARD	gen=707 glyphs=4
2026-03-14T03:40:38.508721	19355583	120	30	1.0000	DISCARD	gen=751 glyphs=4
2026-03-14T03:40:41.018228	37f4017b	116	29	1.0000	DISCARD	gen=707 glyphs=4
2026-03-14T03:40:41.299566	8aef8872	116	29	1.0000	DISCARD	gen=751 glyphs=4
2026-03-14T03:40:43.740193	5a06ca32	120	30	1.0000	DISCARD	gen=707 glyphs=4
2026-03-14T03:40:44.003529	0eaedb57	116	29	1.0000	DISCARD	gen=751 glyphs=4
2026-03-14T03:40:46.432446	55d6c151	120	30	1.0000	DISCARD	gen=707 glyphs=4
2026-03-14T03:40:46.705125	8aef8872	116	29	1.0000	DISCARD	gen=751 glyphs=4
2026-03-14T03:40:49.117946	7ca87b42	116	29	1.0000	DISCARD	gen=707 glyphs=4
2026-03-14T03:40:49.391743	ae44ace5	116	29	1.0000	DISCARD	gen=751 glyphs=4
2026-03-14T03:40:51.814131	ef0484da	116	29	1.0000	DISCARD	gen=707 glyphs=4
2026-03-14T03:40:52.088906	b760590e	116	29	1.0000	DISCARD	gen=751 glyphs=4
2026-03-14T03:40:54.524546	37f4017b	116	29	1.0000	DISCARD	gen=707 glyphs=4
2026-03-14T03:40:54.801040	0eaedb57	116	29	1.0000	DISCARD	gen=751 glyphs=4
2026-03-14T03:40:57.209868	37f4017b	116	29	1.0000	DISCARD	gen=707 glyphs=4
2026-03-14T03:40:57.484539	875e0f8a	116	29	1.0000	DISCARD	gen=751 glyphs=4
2026-03-14T03:40:59.926989	55d6c151	120	30	1.0000	DISCARD	gen=707 glyphs=4
2026-03-14T03:41:00.187069	67cb81be	120	30	1.0000	DISCARD	gen=751 glyphs=4
2026-03-14T03:41:02.631209	37f4017b	116	29	1.0000	DISCARD	gen=708 glyphs=4
2026-03-14T03:41:02.899248	8810604e	116	29	1.0000	DISCARD	gen=751 glyphs=4
2026-03-14T03:41:05.333682	bfdf7cad	120	30	1.0000	DISCARD	gen=708 glyphs=4
2026-03-14T03:41:05.603597	19355583	120	30	1.0000	DISCARD	gen=752 glyphs=4
2026-03-14T03:41:08.029914	37f4017b	116	29	1.0000	DISCARD	gen=708 glyphs=4
2026-03-14T03:41:08.300387	8aef8872	116	29	1.0000	DISCARD	gen=752 glyphs=4
2026-03-14T03:41:10.764219	e00b0435	120	30	1.0000	DISCARD	gen=708 glyphs=4
2026-03-14T03:41:11.037081	050862ad	120	30	1.0000	DISCARD	gen=752 glyphs=4
2026-03-14T03:41:13.562923	2701cb73	116	29	1.0000	DISCARD	gen=708 glyphs=4
2026-03-14T03:41:13.843119	19355583	120	30	1.0000	DISCARD	gen=752 glyphs=4
2026-03-14T03:41:16.255988	37f4017b	116	29	1.0000	DISCARD	gen=708 glyphs=4
2026-03-14T03:41:16.529889	0cf85ae4	120	30	1.0000	DISCARD	gen=752 glyphs=4
2026-03-14T03:41:18.962882	75ce5d50	120	30	1.0000	DISCARD	gen=708 glyphs=4
2026-03-14T03:41:19.231194	fc998fbf	116	29	1.0000	DISCARD	gen=752 glyphs=4
2026-03-14T03:41:21.670483	37f4017b	116	29	1.0000	DISCARD	gen=708 glyphs=4
2026-03-14T03:41:21.949609	e2cd28ea	120	30	1.0000	DISCARD	gen=752 glyphs=4
2026-03-14T03:41:24.377073	5a06ca32	120	30	1.0000	DISCARD	gen=708 glyphs=4
2026-03-14T03:41:24.641311	ca05f912	116	29	1.0000	DISCARD	gen=752 glyphs=4
2026-03-14T03:41:27.053023	b47f42b5	116	29	1.0000	DISCARD	gen=708 glyphs=4
2026-03-14T03:41:27.319705	f276b03d	116	29	1.0000	DISCARD	gen=752 glyphs=4
2026-03-14T03:41:29.715945	37f4017b	116	29	1.0000	DISCARD	gen=709 glyphs=4
2026-03-14T03:41:30.002195	d7c8681b	120	30	1.0000	DISCARD	gen=752 glyphs=4
2026-03-14T03:41:32.424522	bfdf7cad	120	30	1.0000	DISCARD	gen=709 glyphs=4
2026-03-14T03:41:32.696158	19355583	120	30	1.0000	DISCARD	gen=753 glyphs=4
2026-03-14T03:41:35.116002	1586e4ec	116	29	1.0000	DISCARD	gen=709 glyphs=4
2026-03-14T03:41:35.391861	8aef8872	116	29	1.0000	DISCARD	gen=753 glyphs=4
2026-03-14T03:41:37.842945	37f4017b	116	29	1.0000	DISCARD	gen=709 glyphs=4
2026-03-14T03:41:38.127747	b2cf1bff	120	30	1.0000	DISCARD	gen=753 glyphs=4
2026-03-14T03:41:40.579769	d11c1062	120	30	1.0000	DISCARD	gen=709 glyphs=4
2026-03-14T03:41:40.851028	41e9f8c7	116	29	0.9500	DISCARD	gen=753 glyphs=4
