timestamp	program_hash	spirv_size	word_count	fitness	status	description
2026-03-14T00:41:42.060054	12b38c2d	116	29	1.0000	DISCARD	gen=315 glyphs=4
2026-03-14T00:41:42.327565	67cb81be	120	30	1.0000	DISCARD	gen=359 glyphs=4
2026-03-14T00:41:44.756071	37f4017b	116	29	1.0000	DISCARD	gen=315 glyphs=4
2026-03-14T00:41:45.023104	48d5dc19	116	29	1.0000	DISCARD	gen=359 glyphs=4
2026-03-14T00:41:47.456018	5a06ca32	120	30	1.0000	DISCARD	gen=315 glyphs=4
2026-03-14T00:41:47.730775	050862ad	120	30	1.0000	DISCARD	gen=359 glyphs=4
2026-03-14T00:41:50.164746	5a06ca32	120	30	1.0000	DISCARD	gen=315 glyphs=4
2026-03-14T00:41:50.431630	dd54e3fa	120	30	1.0000	DISCARD	gen=359 glyphs=4
2026-03-14T00:41:52.885223	4c9b0dd4	120	30	1.0000	DISCARD	gen=315 glyphs=4
2026-03-14T00:41:53.149623	67cb81be	120	30	1.0000	DISCARD	gen=359 glyphs=4
2026-03-14T00:41:55.593719	5a06ca32	120	30	1.0000	DISCARD	gen=315 glyphs=4
2026-03-14T00:41:55.862907	a78f9454	120	30	1.0000	DISCARD	gen=359 glyphs=4
2026-03-14T00:41:58.286968	cba2b308	120	30	1.0000	DISCARD	gen=315 glyphs=4
2026-03-14T00:41:58.566327	8aef8872	116	29	1.0000	DISCARD	gen=359 glyphs=4
2026-03-14T00:42:01.087916	37f4017b	116	29	1.0000	DISCARD	gen=316 glyphs=4
2026-03-14T00:42:01.363150	050862ad	120	30	1.0000	DISCARD	gen=359 glyphs=4
2026-03-14T00:42:03.809978	bfdf7cad	120	30	1.0000	DISCARD	gen=316 glyphs=4
2026-03-14T00:42:04.098978	19355583	120	30	1.0000	DISCARD	gen=360 glyphs=4
2026-03-14T00:42:06.544206	261b5e68	116	29	1.0000	DISCARD	gen=316 glyphs=4
2026-03-14T00:42:06.812093	8aef8872	116	29	1.0000	DISCARD	gen=360 glyphs=4
2026-03-14T00:42:09.232020	55d6c151	120	30	1.0000	DISCARD	gen=316 glyphs=4
2026-03-14T00:42:09.493034	0eaedb57	116	29	1.0000	DISCARD	gen=360 glyphs=4
2026-03-14T00:42:11.917573	55d6c151	120	30	1.0000	DISCARD	gen=316 glyphs=4
2026-03-14T00:42:12.188145	67cb81be	120	30	1.0000	DISCARD	gen=360 glyphs=4
2026-03-14T00:42:14.593842	5a06ca32	120	30	1.0000	DISCARD	gen=316 glyphs=4
2026-03-14T00:42:14.869341	0eaedb57	116	29	1.0000	DISCARD	gen=360 glyphs=4
2026-03-14T00:42:17.305210	ece6dfa0	120	30	1.0000	DISCARD	gen=316 glyphs=4
2026-03-14T00:42:17.586163	8aef8872	116	29	1.0000	DISCARD	gen=360 glyphs=4
2026-03-14T00:42:20.022034	5a06ca32	120	30	1.0000	DISCARD	gen=316 glyphs=4
2026-03-14T00:42:20.294470	050862ad	120	30	1.0000	DISCARD	gen=360 glyphs=4
2026-03-14T00:42:22.707613	fdb5d108	120	30	1.0000	DISCARD	gen=316 glyphs=4
2026-03-14T00:42:22.974012	b57e7176	120	30	1.0000	DISCARD	gen=360 glyphs=4
2026-03-14T00:42:25.418599	4c9b0dd4	120	30	1.0000	DISCARD	gen=316 glyphs=4
2026-03-14T00:42:25.699179	875e0f8a	116	29	1.0000	DISCARD	gen=360 glyphs=4
2026-03-14T00:42:28.139938	37f4017b	116	29	1.0000	DISCARD	gen=317 glyphs=4
2026-03-14T00:42:28.431333	50dc991d	116	29	1.0000	DISCARD	gen=360 glyphs=4
2026-03-14T00:42:30.843665	bfdf7cad	120	30	1.0000	DISCARD	gen=317 glyphs=4
2026-03-14T00:42:31.128581	19355583	120	30	1.0000	DISCARD	gen=361 glyphs=4
2026-03-14T00:42:33.683867	5a06ca32	120	30	1.0000	DISCARD	gen=317 glyphs=4
2026-03-14T00:42:33.961140	8aef8872	116	29	1.0000	DISCARD	gen=361 glyphs=4
2026-03-14T00:42:36.399454	5a06ca32	120	30	1.0000	DISCARD	gen=317 glyphs=4
2026-03-14T00:42:36.673801	69322efd	116	29	1.0000	DISCARD	gen=361 glyphs=4
2026-03-14T00:42:39.100376	1d34459a	116	29	1.0000	DISCARD	gen=317 glyphs=4
2026-03-14T00:42:39.364832	cb2e4812	116	29	1.0000	DISCARD	gen=361 glyphs=4
2026-03-14T00:42:41.797163	71e2ba66	116	29	1.0000	DISCARD	gen=317 glyphs=4
2026-03-14T00:42:42.064386	1445ee87	116	29	1.0000	DISCARD	gen=361 glyphs=4
2026-03-14T00:42:44.474404	5a06ca32	120	30	1.0000	DISCARD	gen=317 glyphs=4
2026-03-14T00:42:44.753268	0eaedb57	116	29	1.0000	DISCARD	gen=361 glyphs=4
2026-03-14T00:42:47.168145	37f4017b	116	29	1.0000	DISCARD	gen=317 glyphs=4
2026-03-14T00:42:47.434151	9e34ede0	116	29	1.0000	DISCARD	gen=361 glyphs=4
2026-03-14T00:42:49.862185	6315a55a	116	29	1.0000	DISCARD	gen=317 glyphs=4
2026-03-14T00:42:50.141289	8aef8872	116	29	1.0000	DISCARD	gen=361 glyphs=4
2026-03-14T00:42:52.589208	37f4017b	116	29	1.0000	DISCARD	gen=317 glyphs=4
2026-03-14T00:42:52.856682	a78f9454	120	30	1.0000	DISCARD	gen=361 glyphs=4
2026-03-14T00:42:55.282985	37f4017b	116	29	1.0000	DISCARD	gen=318 glyphs=4
2026-03-14T00:42:55.560680	ae44ace5	116	29	1.0000	DISCARD	gen=361 glyphs=4
2026-03-14T00:42:57.979625	bfdf7cad	120	30	1.0000	DISCARD	gen=318 glyphs=4
2026-03-14T00:42:58.249496	19355583	120	30	1.0000	DISCARD	gen=362 glyphs=4
2026-03-14T00:43:00.655631	4c9b0dd4	120	30	1.0000	DISCARD	gen=318 glyphs=4
2026-03-14T00:43:00.917355	8aef8872	116	29	1.0000	DISCARD	gen=362 glyphs=4
2026-03-14T00:43:03.344067	5bc24a83	116	29	1.0000	DISCARD	gen=318 glyphs=4
2026-03-14T00:43:03.611240	0eaedb57	116	29	1.0000	DISCARD	gen=362 glyphs=4
2026-03-14T00:43:06.132469	12b38c2d	116	29	1.0000	DISCARD	gen=318 glyphs=4
2026-03-14T00:43:06.397835	050862ad	120	30	1.0000	DISCARD	gen=362 glyphs=4
2026-03-14T00:43:08.821547	37f4017b	116	29	1.0000	DISCARD	gen=318 glyphs=4
2026-03-14T00:43:09.089944	9e34ede0	116	29	1.0000	DISCARD	gen=362 glyphs=4
2026-03-14T00:43:11.496126	588f9c27	116	29	1.0000	DISCARD	gen=318 glyphs=4
2026-03-14T00:43:11.771012	8aef8872	116	29	1.0000	DISCARD	gen=362 glyphs=4
2026-03-14T00:43:14.200595	0b6d3318	120	30	1.0000	DISCARD	gen=318 glyphs=4
2026-03-14T00:43:14.464808	67cb81be	120	30	1.0000	DISCARD	gen=362 glyphs=4
2026-03-14T00:43:16.912909	fdb5d108	120	30	1.0000	DISCARD	gen=318 glyphs=4
2026-03-14T00:43:17.186754	0eaedb57	116	29	1.0000	DISCARD	gen=362 glyphs=4
2026-03-14T00:43:19.668280	7ca87b42	116	29	1.0000	DISCARD	gen=318 glyphs=4
2026-03-14T00:43:19.941119	b7aed8e9	116	29	1.0000	DISCARD	gen=362 glyphs=4
2026-03-14T00:43:22.440182	37f4017b	116	29	1.0000	DISCARD	gen=319 glyphs=4
2026-03-14T00:43:22.719109	e8c7f6cf	120	30	1.0000	DISCARD	gen=362 glyphs=4
2026-03-14T00:43:25.269103	bfdf7cad	120	30	1.0000	DISCARD	gen=319 glyphs=4
2026-03-14T00:43:25.555197	19355583	120	30	1.0000	DISCARD	gen=363 glyphs=4
2026-03-14T00:43:28.094346	55d6c151	120	30	1.0000	DISCARD	gen=319 glyphs=4
2026-03-14T00:43:28.374994	8aef8872	116	29	1.0000	DISCARD	gen=363 glyphs=4
2026-03-14T00:43:30.899495	983ea2b4	116	29	1.0000	DISCARD	gen=319 glyphs=4
2026-03-14T00:43:31.176474	0eaedb57	116	29	1.0000	DISCARD	gen=363 glyphs=4
2026-03-14T00:43:33.697663	55d6c151	120	30	1.0000	DISCARD	gen=319 glyphs=4
2026-03-14T00:43:33.976653	b31cddb3	120	30	1.0000	DISCARD	gen=363 glyphs=4
2026-03-14T00:43:36.559803	12b38c2d	116	29	1.0000	DISCARD	gen=319 glyphs=4
2026-03-14T00:43:36.835762	0eaedb57	116	29	1.0000	DISCARD	gen=363 glyphs=4
2026-03-14T00:43:39.252286	2701cb73	116	29	1.0000	DISCARD	gen=319 glyphs=4
2026-03-14T00:43:39.527985	4d5265f3	116	29	1.0000	DISCARD	gen=363 glyphs=4
2026-03-14T00:43:41.927235	55d6c151	120	30	1.0000	DISCARD	gen=319 glyphs=4
2026-03-14T00:43:42.193438	bb286276	120	30	1.0000	DISCARD	gen=363 glyphs=4
2026-03-14T00:43:44.638580	7ca87b42	116	29	1.0000	DISCARD	gen=319 glyphs=4
2026-03-14T00:43:44.899800	dfa7a201	116	29	1.0000	DISCARD	gen=363 glyphs=4
2026-03-14T00:43:47.329018	37f4017b	116	29	1.0000	DISCARD	gen=319 glyphs=4
2026-03-14T00:43:47.594946	cd70fc81	120	30	1.0000	DISCARD	gen=363 glyphs=4
2026-03-14T00:43:50.040008	37f4017b	116	29	1.0000	DISCARD	gen=320 glyphs=4
2026-03-14T00:43:50.328485	19355583	120	30	1.0000	DISCARD	gen=363 glyphs=4
2026-03-14T00:43:52.776207	bfdf7cad	120	30	1.0000	DISCARD	gen=320 glyphs=4
2026-03-14T00:43:53.040630	19355583	120	30	1.0000	DISCARD	gen=364 glyphs=4
2026-03-14T00:43:55.461790	12b38c2d	116	29	1.0000	DISCARD	gen=320 glyphs=4
2026-03-14T00:43:55.730281	8aef8872	116	29	1.0000	DISCARD	gen=364 glyphs=4
2026-03-14T00:43:58.164088	5a06ca32	120	30	1.0000	DISCARD	gen=320 glyphs=4
2026-03-14T00:43:58.441793	050862ad	120	30	1.0000	DISCARD	gen=364 glyphs=4
2026-03-14T00:44:00.851869	fdb5d108	120	30	1.0000	DISCARD	gen=320 glyphs=4
2026-03-14T00:44:01.120261	686f8c20	116	29	1.0000	DISCARD	gen=364 glyphs=4
2026-03-14T00:44:03.560780	8e8a8a18	120	30	1.0000	DISCARD	gen=320 glyphs=4
2026-03-14T00:44:03.827234	c28cb754	116	29	1.0000	DISCARD	gen=364 glyphs=4
2026-03-14T00:44:06.256329	c8db9e12	120	30	1.0000	DISCARD	gen=320 glyphs=4
2026-03-14T00:44:06.534497	9e34ede0	116	29	1.0000	DISCARD	gen=364 glyphs=4
2026-03-14T00:44:09.050543	37f4017b	116	29	1.0000	DISCARD	gen=320 glyphs=4
2026-03-14T00:44:09.324412	67cb81be	120	30	1.0000	DISCARD	gen=364 glyphs=4
2026-03-14T00:44:11.778028	37f4017b	116	29	1.0000	DISCARD	gen=320 glyphs=4
2026-03-14T00:44:12.046861	717c5866	116	29	1.0000	DISCARD	gen=364 glyphs=4
2026-03-14T00:44:14.499065	37f4017b	116	29	1.0000	DISCARD	gen=320 glyphs=4
2026-03-14T00:44:14.773660	19355583	120	30	1.0000	DISCARD	gen=364 glyphs=4
2026-03-14T00:44:17.206856	37f4017b	116	29	1.0000	DISCARD	gen=321 glyphs=4
2026-03-14T00:44:17.475017	62be292a	116	29	1.0000	DISCARD	gen=364 glyphs=4
2026-03-14T00:44:19.891069	bfdf7cad	120	30	1.0000	DISCARD	gen=321 glyphs=4
2026-03-14T00:44:20.172628	19355583	120	30	1.0000	DISCARD	gen=365 glyphs=4
2026-03-14T00:44:22.590437	d11c1062	120	30	1.0000	DISCARD	gen=321 glyphs=4
2026-03-14T00:44:22.867974	8aef8872	116	29	1.0000	DISCARD	gen=365 glyphs=4
2026-03-14T00:44:25.280489	d11c1062	120	30	1.0000	DISCARD	gen=321 glyphs=4
2026-03-14T00:44:25.548950	8aef8872	116	29	1.0000	DISCARD	gen=365 glyphs=4
2026-03-14T00:44:27.968945	400e26c2	116	29	0.9500	DISCARD	gen=321 glyphs=4
2026-03-14T00:44:28.251901	af8d9149	116	29	1.0000	DISCARD	gen=365 glyphs=4
2026-03-14T00:44:30.660757	55d6c151	120	30	1.0000	DISCARD	gen=321 glyphs=4
2026-03-14T00:44:30.930548	50dc991d	116	29	1.0000	DISCARD	gen=365 glyphs=4
2026-03-14T00:44:33.366163	5a06ca32	120	30	1.0000	DISCARD	gen=321 glyphs=4
2026-03-14T00:44:33.631815	8aef8872	116	29	1.0000	DISCARD	gen=365 glyphs=4
2026-03-14T00:44:36.046591	292b923b	116	29	1.0000	DISCARD	gen=321 glyphs=4
2026-03-14T00:44:36.327941	d41e6b1d	120	30	1.0000	DISCARD	gen=365 glyphs=4
2026-03-14T00:44:38.766543	5a06ca32	120	30	1.0000	DISCARD	gen=321 glyphs=4
2026-03-14T00:44:39.040732	19355583	120	30	1.0000	DISCARD	gen=365 glyphs=4
2026-03-14T00:44:41.578623	37f4017b	116	29	1.0000	DISCARD	gen=321 glyphs=4
2026-03-14T00:44:41.852951	f7f26f2e	116	29	0.9500	DISCARD	gen=365 glyphs=4
2026-03-14T00:44:44.271205	37f4017b	116	29	1.0000	DISCARD	gen=322 glyphs=4
2026-03-14T00:44:44.540400	8aef8872	116	29	1.0000	DISCARD	gen=365 glyphs=4
2026-03-14T00:44:46.962557	bfdf7cad	120	30	1.0000	DISCARD	gen=322 glyphs=4
2026-03-14T00:44:47.243633	19355583	120	30	1.0000	DISCARD	gen=366 glyphs=4
2026-03-14T00:44:49.676416	5a06ca32	120	30	1.0000	DISCARD	gen=322 glyphs=4
2026-03-14T00:44:49.932442	8aef8872	116	29	1.0000	DISCARD	gen=366 glyphs=4
2026-03-14T00:44:52.369085	1d34459a	116	29	1.0000	DISCARD	gen=322 glyphs=4
2026-03-14T00:44:52.633916	4919b92d	116	29	1.0000	DISCARD	gen=366 glyphs=4
2026-03-14T00:44:55.045506	55d6c151	120	30	1.0000	DISCARD	gen=322 glyphs=4
2026-03-14T00:44:55.318031	19355583	120	30	1.0000	DISCARD	gen=366 glyphs=4
2026-03-14T00:44:57.713929	7f31ec6f	116	29	1.0000	DISCARD	gen=322 glyphs=4
2026-03-14T00:44:57.990696	8aef8872	116	29	1.0000	DISCARD	gen=366 glyphs=4
2026-03-14T00:45:00.407630	bc755ac8	116	29	1.0000	DISCARD	gen=322 glyphs=4
2026-03-14T00:45:00.675807	e2cd28ea	120	30	1.0000	DISCARD	gen=366 glyphs=4
2026-03-14T00:45:03.115273	5a06ca32	120	30	1.0000	DISCARD	gen=322 glyphs=4
2026-03-14T00:45:03.382159	75c842a9	116	29	1.0000	DISCARD	gen=366 glyphs=4
2026-03-14T00:45:05.817001	71e2ba66	116	29	1.0000	DISCARD	gen=322 glyphs=4
2026-03-14T00:45:06.092658	8aef8872	116	29	1.0000	DISCARD	gen=366 glyphs=4
2026-03-14T00:45:08.557940	ed4912fb	116	29	1.0000	DISCARD	gen=322 glyphs=4
2026-03-14T00:45:08.830475	b7aed8e9	116	29	1.0000	DISCARD	gen=366 glyphs=4
2026-03-14T00:45:11.307949	37f4017b	116	29	1.0000	DISCARD	gen=323 glyphs=4
2026-03-14T00:45:11.599008	8feda5ab	116	29	1.0000	DISCARD	gen=366 glyphs=4
2026-03-14T00:45:14.052265	bfdf7cad	120	30	1.0000	DISCARD	gen=323 glyphs=4
2026-03-14T00:45:14.326231	19355583	120	30	1.0000	DISCARD	gen=367 glyphs=4
2026-03-14T00:45:16.756938	769d9df4	120	30	1.0000	DISCARD	gen=323 glyphs=4
2026-03-14T00:45:17.031077	8aef8872	116	29	1.0000	DISCARD	gen=367 glyphs=4
2026-03-14T00:45:19.450931	47783130	116	29	1.0000	DISCARD	gen=323 glyphs=4
2026-03-14T00:45:19.714985	1e511469	116	29	1.0000	DISCARD	gen=367 glyphs=4
2026-03-14T00:45:22.111501	5a06ca32	120	30	1.0000	DISCARD	gen=323 glyphs=4
2026-03-14T00:45:22.377922	d7c8681b	120	30	1.0000	DISCARD	gen=367 glyphs=4
2026-03-14T00:45:24.837329	2b4d3451	116	29	1.0000	DISCARD	gen=323 glyphs=4
2026-03-14T00:45:25.100607	a78f9454	120	30	1.0000	DISCARD	gen=367 glyphs=4
2026-03-14T00:45:27.532176	582f93a4	116	29	1.0000	DISCARD	gen=323 glyphs=4
2026-03-14T00:45:27.800648	9e34ede0	116	29	1.0000	DISCARD	gen=367 glyphs=4
2026-03-14T00:45:30.201094	61fc31aa	116	29	1.0000	DISCARD	gen=323 glyphs=4
2026-03-14T00:45:30.470018	67cb81be	120	30	1.0000	DISCARD	gen=367 glyphs=4
2026-03-14T00:45:32.888075	527001ff	116	29	0.9500	DISCARD	gen=323 glyphs=4
2026-03-14T00:45:33.161270	b57e7176	120	30	1.0000	DISCARD	gen=367 glyphs=4
2026-03-14T00:45:35.582586	71e2ba66	116	29	1.0000	DISCARD	gen=323 glyphs=4
2026-03-14T00:45:35.848978	0eaedb57	116	29	1.0000	DISCARD	gen=367 glyphs=4
2026-03-14T00:45:38.275859	37f4017b	116	29	1.0000	DISCARD	gen=324 glyphs=4
2026-03-14T00:45:38.543528	9e34ede0	116	29	1.0000	DISCARD	gen=367 glyphs=4
2026-03-14T00:45:40.982108	bfdf7cad	120	30	1.0000	DISCARD	gen=324 glyphs=4
2026-03-14T00:45:41.273444	19355583	120	30	1.0000	DISCARD	gen=368 glyphs=4
2026-03-14T00:45:43.790422	5a06ca32	120	30	1.0000	DISCARD	gen=324 glyphs=4
2026-03-14T00:45:44.064249	8aef8872	116	29	1.0000	DISCARD	gen=368 glyphs=4
2026-03-14T00:45:46.517846	22e88fef	116	29	1.0000	DISCARD	gen=324 glyphs=4
2026-03-14T00:45:46.776761	50dc991d	116	29	1.0000	DISCARD	gen=368 glyphs=4
2026-03-14T00:45:49.193224	42fc4bee	120	30	1.0000	DISCARD	gen=324 glyphs=4
2026-03-14T00:45:49.462083	e8c7f6cf	120	30	1.0000	DISCARD	gen=368 glyphs=4
2026-03-14T00:45:51.865298	1d34459a	116	29	1.0000	DISCARD	gen=324 glyphs=4
2026-03-14T00:45:52.136324	eca7ab6c	116	29	1.0000	DISCARD	gen=368 glyphs=4
2026-03-14T00:45:54.572772	5a06ca32	120	30	1.0000	DISCARD	gen=324 glyphs=4
2026-03-14T00:45:54.839751	ae44ace5	116	29	1.0000	DISCARD	gen=368 glyphs=4
2026-03-14T00:45:57.248871	b3028fc6	120	30	1.0000	DISCARD	gen=324 glyphs=4
2026-03-14T00:45:57.517221	eca7ab6c	116	29	1.0000	DISCARD	gen=368 glyphs=4
2026-03-14T00:45:59.939356	37f4017b	116	29	1.0000	DISCARD	gen=324 glyphs=4
2026-03-14T00:46:00.221947	ae44ace5	116	29	1.0000	DISCARD	gen=368 glyphs=4
2026-03-14T00:46:02.646142	d11c1062	120	30	1.0000	DISCARD	gen=324 glyphs=4
2026-03-14T00:46:02.913756	e2cd28ea	120	30	1.0000	DISCARD	gen=368 glyphs=4
2026-03-14T00:46:05.341538	37f4017b	116	29	1.0000	DISCARD	gen=325 glyphs=4
2026-03-14T00:46:05.621761	8aef8872	116	29	1.0000	DISCARD	gen=368 glyphs=4
2026-03-14T00:46:08.028203	bfdf7cad	120	30	1.0000	DISCARD	gen=325 glyphs=4
2026-03-14T00:46:08.295448	19355583	120	30	1.0000	DISCARD	gen=369 glyphs=4
2026-03-14T00:46:10.715303	1d34459a	116	29	1.0000	DISCARD	gen=325 glyphs=4
2026-03-14T00:46:10.987967	8aef8872	116	29	1.0000	DISCARD	gen=369 glyphs=4
2026-03-14T00:46:13.412492	5a06ca32	120	30	1.0000	DISCARD	gen=325 glyphs=4
2026-03-14T00:46:13.679531	0eaedb57	116	29	1.0000	DISCARD	gen=369 glyphs=4
2026-03-14T00:46:16.179032	ccb7e7da	116	29	1.0000	DISCARD	gen=325 glyphs=4
2026-03-14T00:46:16.465773	0eaedb57	116	29	1.0000	DISCARD	gen=369 glyphs=4
2026-03-14T00:46:18.872064	5a06ca32	120	30	1.0000	DISCARD	gen=325 glyphs=4
2026-03-14T00:46:19.139736	0eaedb57	116	29	1.0000	DISCARD	gen=369 glyphs=4
2026-03-14T00:46:21.574977	eaf9a1b9	116	29	1.0000	DISCARD	gen=325 glyphs=4
2026-03-14T00:46:21.843063	875e0f8a	116	29	1.0000	DISCARD	gen=369 glyphs=4
2026-03-14T00:46:24.257928	12b38c2d	116	29	1.0000	DISCARD	gen=325 glyphs=4
2026-03-14T00:46:24.523686	8aef8872	116	29	1.0000	DISCARD	gen=369 glyphs=4
2026-03-14T00:46:26.965787	71e2ba66	116	29	1.0000	DISCARD	gen=325 glyphs=4
2026-03-14T00:46:27.244255	81d5c0a5	116	29	1.0000	DISCARD	gen=369 glyphs=4
2026-03-14T00:46:29.651259	55d6c151	120	30	1.0000	DISCARD	gen=325 glyphs=4
2026-03-14T00:46:29.914490	eca7ab6c	116	29	1.0000	DISCARD	gen=369 glyphs=4
2026-03-14T00:46:32.354494	37f4017b	116	29	1.0000	DISCARD	gen=326 glyphs=4
2026-03-14T00:46:32.634037	67cb81be	120	30	1.0000	DISCARD	gen=369 glyphs=4
2026-03-14T00:46:35.164404	bfdf7cad	120	30	1.0000	DISCARD	gen=326 glyphs=4
2026-03-14T00:46:35.443222	19355583	120	30	1.0000	DISCARD	gen=370 glyphs=4
2026-03-14T00:46:37.940324	fdb5d108	120	30	1.0000	DISCARD	gen=326 glyphs=4
2026-03-14T00:46:38.218731	8aef8872	116	29	1.0000	DISCARD	gen=370 glyphs=4
2026-03-14T00:46:40.688963	37f4017b	116	29	1.0000	DISCARD	gen=326 glyphs=4
2026-03-14T00:46:40.962024	b57e7176	120	30	1.0000	DISCARD	gen=370 glyphs=4
2026-03-14T00:46:43.489873	fdb5d108	120	30	1.0000	DISCARD	gen=326 glyphs=4
2026-03-14T00:46:43.766942	19355583	120	30	1.0000	DISCARD	gen=370 glyphs=4
2026-03-14T00:46:46.257398	2701cb73	116	29	1.0000	DISCARD	gen=326 glyphs=4
2026-03-14T00:46:46.563892	b57e7176	120	30	1.0000	DISCARD	gen=370 glyphs=4
2026-03-14T00:46:49.209929	d11c1062	120	30	1.0000	DISCARD	gen=326 glyphs=4
2026-03-14T00:46:49.491011	f1f2f7a8	116	29	0.9500	DISCARD	gen=370 glyphs=4
2026-03-14T00:46:51.940558	5a06ca32	120	30	1.0000	DISCARD	gen=326 glyphs=4
2026-03-14T00:46:52.213983	ae44ace5	116	29	1.0000	DISCARD	gen=370 glyphs=4
2026-03-14T00:46:54.685663	521989c4	116	29	1.0000	DISCARD	gen=326 glyphs=4
2026-03-14T00:46:54.955321	eca7ab6c	116	29	1.0000	DISCARD	gen=370 glyphs=4
2026-03-14T00:46:57.393231	5a06ca32	120	30	1.0000	DISCARD	gen=326 glyphs=4
2026-03-14T00:46:57.661039	050862ad	120	30	1.0000	DISCARD	gen=370 glyphs=4
2026-03-14T00:47:00.097846	37f4017b	116	29	1.0000	DISCARD	gen=327 glyphs=4
2026-03-14T00:47:00.378408	cfd92c39	120	30	1.0000	DISCARD	gen=370 glyphs=4
2026-03-14T00:47:02.804215	bfdf7cad	120	30	1.0000	DISCARD	gen=327 glyphs=4
2026-03-14T00:47:03.072129	19355583	120	30	1.0000	DISCARD	gen=371 glyphs=4
2026-03-14T00:47:05.533549	4c9b0dd4	120	30	1.0000	DISCARD	gen=327 glyphs=4
2026-03-14T00:47:05.798868	8aef8872	116	29	1.0000	DISCARD	gen=371 glyphs=4
2026-03-14T00:47:08.246132	6260548c	116	29	1.0000	DISCARD	gen=327 glyphs=4
2026-03-14T00:47:08.513575	5f7c0505	116	29	1.0000	DISCARD	gen=371 glyphs=4
2026-03-14T00:47:10.968173	5a06ca32	120	30	1.0000	DISCARD	gen=327 glyphs=4
2026-03-14T00:47:11.253368	cb229a9a	120	30	1.0000	DISCARD	gen=371 glyphs=4
2026-03-14T00:47:13.679879	5b9807ac	120	30	1.0000	DISCARD	gen=327 glyphs=4
2026-03-14T00:47:13.964361	50dc991d	116	29	1.0000	DISCARD	gen=371 glyphs=4
2026-03-14T00:47:16.440954	37f4017b	116	29	1.0000	DISCARD	gen=327 glyphs=4
2026-03-14T00:47:16.707701	0eaedb57	116	29	1.0000	DISCARD	gen=371 glyphs=4
2026-03-14T00:47:19.159849	9af18118	116	29	1.0000	DISCARD	gen=327 glyphs=4
2026-03-14T00:47:19.445803	1783ba35	116	29	1.0000	DISCARD	gen=371 glyphs=4
2026-03-14T00:47:21.911306	2701cb73	116	29	1.0000	DISCARD	gen=327 glyphs=4
2026-03-14T00:47:22.178477	1e5f0e21	116	29	1.0000	DISCARD	gen=371 glyphs=4
2026-03-14T00:47:24.615103	8dfc7224	116	29	1.0000	DISCARD	gen=327 glyphs=4
2026-03-14T00:47:24.896526	3982cdf6	120	30	1.0000	DISCARD	gen=371 glyphs=4
2026-03-14T00:47:27.382728	37f4017b	116	29	1.0000	DISCARD	gen=328 glyphs=4
2026-03-14T00:47:27.654803	eca7ab6c	116	29	1.0000	DISCARD	gen=371 glyphs=4
2026-03-14T00:47:30.072944	bfdf7cad	120	30	1.0000	DISCARD	gen=328 glyphs=4
2026-03-14T00:47:30.337096	19355583	120	30	1.0000	DISCARD	gen=372 glyphs=4
2026-03-14T00:47:32.762859	5a06ca32	120	30	1.0000	DISCARD	gen=328 glyphs=4
2026-03-14T00:47:33.028958	8aef8872	116	29	1.0000	DISCARD	gen=372 glyphs=4
2026-03-14T00:47:35.486210	5a06ca32	120	30	1.0000	DISCARD	gen=328 glyphs=4
2026-03-14T00:47:35.742775	19355583	120	30	1.0000	DISCARD	gen=372 glyphs=4
2026-03-14T00:47:38.173974	5a06ca32	120	30	1.0000	DISCARD	gen=328 glyphs=4
2026-03-14T00:47:38.454631	0eaedb57	116	29	1.0000	DISCARD	gen=372 glyphs=4
2026-03-14T00:47:40.906738	fdb5d108	120	30	1.0000	DISCARD	gen=328 glyphs=4
2026-03-14T00:47:41.192035	19355583	120	30	1.0000	DISCARD	gen=372 glyphs=4
2026-03-14T00:47:43.650964	9a6093e8	120	30	1.0000	DISCARD	gen=328 glyphs=4
2026-03-14T00:47:43.912389	67cb81be	120	30	1.0000	DISCARD	gen=372 glyphs=4
2026-03-14T00:47:46.377406	37f4017b	116	29	1.0000	DISCARD	gen=328 glyphs=4
2026-03-14T00:47:46.649638	50dc991d	116	29	1.0000	DISCARD	gen=372 glyphs=4
2026-03-14T00:47:49.114843	a3f5f14e	116	29	1.0000	DISCARD	gen=328 glyphs=4
2026-03-14T00:47:49.387363	32f3857d	116	29	1.0000	DISCARD	gen=372 glyphs=4
2026-03-14T00:47:51.897118	37f4017b	116	29	1.0000	DISCARD	gen=328 glyphs=4
2026-03-14T00:47:52.169340	ee00fafa	120	30	1.0000	DISCARD	gen=372 glyphs=4
2026-03-14T00:47:54.620785	37f4017b	116	29	1.0000	DISCARD	gen=329 glyphs=4
2026-03-14T00:47:54.888155	19355583	120	30	1.0000	DISCARD	gen=372 glyphs=4
2026-03-14T00:47:57.345048	bfdf7cad	120	30	1.0000	DISCARD	gen=329 glyphs=4
2026-03-14T00:47:57.611372	19355583	120	30	1.0000	DISCARD	gen=373 glyphs=4
2026-03-14T00:48:00.053132	55d6c151	120	30	1.0000	DISCARD	gen=329 glyphs=4
2026-03-14T00:48:00.326615	8aef8872	116	29	1.0000	DISCARD	gen=373 glyphs=4
2026-03-14T00:48:02.742335	37f4017b	116	29	1.0000	DISCARD	gen=329 glyphs=4
2026-03-14T00:48:03.015903	997f18e7	116	29	0.9500	DISCARD	gen=373 glyphs=4
2026-03-14T00:48:05.456529	7ca87b42	116	29	1.0000	DISCARD	gen=329 glyphs=4
2026-03-14T00:48:05.722634	50dc991d	116	29	1.0000	DISCARD	gen=373 glyphs=4
2026-03-14T00:48:08.167854	d11c1062	120	30	1.0000	DISCARD	gen=329 glyphs=4
2026-03-14T00:48:08.449643	b65d7cfc	120	30	1.0000	DISCARD	gen=373 glyphs=4
2026-03-14T00:48:10.899256	fdb5d108	120	30	1.0000	DISCARD	gen=329 glyphs=4
2026-03-14T00:48:11.164793	e01fdc31	116	29	0.9500	DISCARD	gen=373 glyphs=4
2026-03-14T00:48:13.608528	55d6c151	120	30	1.0000	DISCARD	gen=329 glyphs=4
2026-03-14T00:48:13.880863	e2cd28ea	120	30	1.0000	DISCARD	gen=373 glyphs=4
2026-03-14T00:48:16.316429	55d6c151	120	30	1.0000	DISCARD	gen=329 glyphs=4
2026-03-14T00:48:16.585904	875e0f8a	116	29	1.0000	DISCARD	gen=373 glyphs=4
