timestamp	program_hash	spirv_size	word_count	fitness	status	description
2026-03-14T07:36:44.118340	099964a4	0	0	0.0000	CRASH	gen=43 glyphs=4
2026-03-14T07:36:44.118535	02486744	0	0	0.0000	CRASH	gen=43 glyphs=3
2026-03-14T07:36:44.118730	099964a4	0	0	0.0000	CRASH	gen=43 glyphs=4
2026-03-14T07:36:44.118920	099964a4	0	0	0.0000	CRASH	gen=43 glyphs=4
2026-03-14T07:36:44.119200	099964a4	0	0	0.0000	CRASH	gen=44 glyphs=4
2026-03-14T07:36:44.119395	099964a4	0	0	0.0000	CRASH	gen=44 glyphs=4
2026-03-14T07:36:44.119591	099964a4	0	0	0.0000	CRASH	gen=44 glyphs=4
2026-03-14T07:36:44.119782	099964a4	0	0	0.0000	CRASH	gen=44 glyphs=4
2026-03-14T07:36:44.119972	ff30496a	0	0	0.0000	CRASH	gen=44 glyphs=3
2026-03-14T07:36:44.120167	3cc143f7	0	0	0.0000	CRASH	gen=44 glyphs=4
2026-03-14T07:36:44.120358	099964a4	0	0	0.0000	CRASH	gen=44 glyphs=4
2026-03-14T07:36:44.120549	33123eba	0	0	0.0000	CRASH	gen=44 glyphs=4
2026-03-14T07:36:44.120740	8472f058	0	0	0.0000	CRASH	gen=44 glyphs=4
2026-03-14T07:36:44.120931	d2f97143	0	0	0.0000	CRASH	gen=44 glyphs=5
2026-03-14T07:36:44.121221	099964a4	0	0	0.0000	CRASH	gen=45 glyphs=4
2026-03-14T07:36:44.121413	099964a4	0	0	0.0000	CRASH	gen=45 glyphs=4
2026-03-14T07:36:44.121608	099964a4	0	0	0.0000	CRASH	gen=45 glyphs=4
2026-03-14T07:36:44.121797	099964a4	0	0	0.0000	CRASH	gen=45 glyphs=4
2026-03-14T07:36:44.121990	8da1f8d8	0	0	0.0000	CRASH	gen=45 glyphs=4
2026-03-14T07:36:44.122186	099964a4	0	0	0.0000	CRASH	gen=45 glyphs=4
2026-03-14T07:36:44.122377	099964a4	0	0	0.0000	CRASH	gen=45 glyphs=4
2026-03-14T07:36:44.122575	099964a4	0	0	0.0000	CRASH	gen=45 glyphs=4
2026-03-14T07:36:44.122767	f76504ad	0	0	0.0000	CRASH	gen=45 glyphs=4
2026-03-14T07:36:44.122958	cf93b656	0	0	0.0000	CRASH	gen=45 glyphs=3
2026-03-14T07:36:44.123244	099964a4	0	0	0.0000	CRASH	gen=46 glyphs=4
2026-03-14T07:36:44.123437	099964a4	0	0	0.0000	CRASH	gen=46 glyphs=4
2026-03-14T07:36:44.123631	8da1f8d8	0	0	0.0000	CRASH	gen=46 glyphs=4
2026-03-14T07:36:44.123823	11f7b9e6	0	0	0.0000	CRASH	gen=46 glyphs=4
2026-03-14T07:36:44.124015	ddc30e5c	0	0	0.0000	CRASH	gen=46 glyphs=2
2026-03-14T07:36:44.124207	099964a4	0	0	0.0000	CRASH	gen=46 glyphs=4
2026-03-14T07:36:44.124405	9bd89858	0	0	0.0000	CRASH	gen=46 glyphs=4
2026-03-14T07:36:44.124601	a28bfb3a	0	0	0.0000	CRASH	gen=46 glyphs=4
2026-03-14T07:36:44.124799	099964a4	0	0	0.0000	CRASH	gen=46 glyphs=4
2026-03-14T07:36:44.124992	413ee269	0	0	0.0000	CRASH	gen=46 glyphs=4
2026-03-14T07:36:44.125263	099964a4	0	0	0.0000	CRASH	gen=47 glyphs=4
2026-03-14T07:36:44.125459	099964a4	0	0	0.0000	CRASH	gen=47 glyphs=4
2026-03-14T07:36:44.125653	099964a4	0	0	0.0000	CRASH	gen=47 glyphs=4
2026-03-14T07:36:44.125844	3a734398	0	0	0.0000	CRASH	gen=47 glyphs=4
2026-03-14T07:36:44.126038	6f8bcd51	0	0	0.0000	CRASH	gen=47 glyphs=4
2026-03-14T07:36:44.126229	d139f842	0	0	0.0000	CRASH	gen=47 glyphs=3
2026-03-14T07:36:44.126424	099964a4	0	0	0.0000	CRASH	gen=47 glyphs=4
2026-03-14T07:36:44.126617	099964a4	0	0	0.0000	CRASH	gen=47 glyphs=4
2026-03-14T07:36:44.126810	099964a4	0	0	0.0000	CRASH	gen=47 glyphs=4
2026-03-14T07:36:44.127000	ff30496a	0	0	0.0000	CRASH	gen=47 glyphs=3
2026-03-14T07:36:44.127287	099964a4	0	0	0.0000	CRASH	gen=48 glyphs=4
2026-03-14T07:36:44.127487	099964a4	0	0	0.0000	CRASH	gen=48 glyphs=4
2026-03-14T07:36:44.127685	099964a4	0	0	0.0000	CRASH	gen=48 glyphs=4
2026-03-14T07:36:44.127877	dcb1fb50	0	0	0.0000	CRASH	gen=48 glyphs=4
2026-03-14T07:36:44.128073	099964a4	0	0	0.0000	CRASH	gen=48 glyphs=4
2026-03-14T07:36:44.128265	b3e7d542	0	0	0.0000	CRASH	gen=48 glyphs=3
2026-03-14T07:36:44.128459	099964a4	0	0	0.0000	CRASH	gen=48 glyphs=4
2026-03-14T07:36:44.128659	099964a4	0	0	0.0000	CRASH	gen=48 glyphs=4
2026-03-14T07:36:44.128853	0bb4f4e2	0	0	0.0000	CRASH	gen=48 glyphs=3
2026-03-14T07:36:44.129046	f898488e	0	0	0.0000	CRASH	gen=48 glyphs=4
2026-03-14T07:36:44.129318	099964a4	0	0	0.0000	CRASH	gen=49 glyphs=4
2026-03-14T07:36:44.129511	099964a4	0	0	0.0000	CRASH	gen=49 glyphs=4
2026-03-14T07:36:44.129713	dcf59db0	0	0	0.0000	CRASH	gen=49 glyphs=2
2026-03-14T07:36:44.129907	099964a4	0	0	0.0000	CRASH	gen=49 glyphs=4
2026-03-14T07:36:44.130100	8da1f8d8	0	0	0.0000	CRASH	gen=49 glyphs=4
2026-03-14T07:36:44.130294	099964a4	0	0	0.0000	CRASH	gen=49 glyphs=4
2026-03-14T07:36:44.130490	dcb1fb50	0	0	0.0000	CRASH	gen=49 glyphs=4
2026-03-14T07:36:44.130688	d0e477c0	0	0	0.0000	CRASH	gen=49 glyphs=4
2026-03-14T07:36:44.130884	099964a4	0	0	0.0000	CRASH	gen=49 glyphs=4
2026-03-14T07:36:44.131077	270a9175	0	0	0.0000	CRASH	gen=49 glyphs=4
2026-03-14T07:36:44.131364	099964a4	0	0	0.0000	CRASH	gen=50 glyphs=4
2026-03-14T07:36:44.131563	099964a4	0	0	0.0000	CRASH	gen=50 glyphs=4
2026-03-14T07:36:44.131762	7ede4765	0	0	0.0000	CRASH	gen=50 glyphs=2
2026-03-14T07:36:44.131957	80cef82b	0	0	0.0000	CRASH	gen=50 glyphs=4
2026-03-14T07:36:44.132152	6eb8bb7a	0	0	0.0000	CRASH	gen=50 glyphs=4
2026-03-14T07:36:44.132345	8da1f8d8	0	0	0.0000	CRASH	gen=50 glyphs=4
2026-03-14T07:36:44.132541	099964a4	0	0	0.0000	CRASH	gen=50 glyphs=4
2026-03-14T07:36:44.132733	3a734398	0	0	0.0000	CRASH	gen=50 glyphs=4
2026-03-14T07:36:44.132933	099964a4	0	0	0.0000	CRASH	gen=50 glyphs=4
2026-03-14T07:36:44.133126	e7f02728	0	0	0.0000	CRASH	gen=50 glyphs=5
2026-03-14T07:36:44.133414	099964a4	0	0	0.0000	CRASH	gen=51 glyphs=4
2026-03-14T07:36:44.133612	099964a4	0	0	0.0000	CRASH	gen=51 glyphs=4
2026-03-14T07:36:44.133806	7ede4765	0	0	0.0000	CRASH	gen=51 glyphs=2
2026-03-14T07:36:44.134001	ebc2816f	0	0	0.0000	CRASH	gen=51 glyphs=4
2026-03-14T07:36:44.134196	6560ce20	0	0	0.0000	CRASH	gen=51 glyphs=3
2026-03-14T07:36:44.134388	51cc8f95	0	0	0.0000	CRASH	gen=51 glyphs=3
2026-03-14T07:36:44.134581	099964a4	0	0	0.0000	CRASH	gen=51 glyphs=4
2026-03-14T07:36:44.134772	c84b1b52	0	0	0.0000	CRASH	gen=51 glyphs=3
2026-03-14T07:36:44.134968	099964a4	0	0	0.0000	CRASH	gen=51 glyphs=4
2026-03-14T07:36:44.135161	099964a4	0	0	0.0000	CRASH	gen=51 glyphs=4
2026-03-14T07:36:44.135437	099964a4	0	0	0.0000	CRASH	gen=52 glyphs=4
2026-03-14T07:36:44.135635	099964a4	0	0	0.0000	CRASH	gen=52 glyphs=4
2026-03-14T07:36:44.135831	099964a4	0	0	0.0000	CRASH	gen=52 glyphs=4
2026-03-14T07:36:44.136030	c66bc630	0	0	0.0000	CRASH	gen=52 glyphs=4
2026-03-14T07:36:44.136238	099964a4	0	0	0.0000	CRASH	gen=52 glyphs=4
2026-03-14T07:36:44.136430	099964a4	0	0	0.0000	CRASH	gen=52 glyphs=4
2026-03-14T07:36:44.136627	7ede4765	0	0	0.0000	CRASH	gen=52 glyphs=2
2026-03-14T07:36:44.136819	267467b6	0	0	0.0000	CRASH	gen=52 glyphs=4
2026-03-14T07:36:44.137014	099964a4	0	0	0.0000	CRASH	gen=52 glyphs=4
2026-03-14T07:36:44.137210	099964a4	0	0	0.0000	CRASH	gen=52 glyphs=4
2026-03-14T07:36:44.137473	099964a4	0	0	0.0000	CRASH	gen=53 glyphs=4
2026-03-14T07:36:44.137668	099964a4	0	0	0.0000	CRASH	gen=53 glyphs=4
2026-03-14T07:36:44.137862	099964a4	0	0	0.0000	CRASH	gen=53 glyphs=4
2026-03-14T07:36:44.138053	099964a4	0	0	0.0000	CRASH	gen=53 glyphs=4
2026-03-14T07:36:44.138248	feb0990d	0	0	0.0000	CRASH	gen=53 glyphs=4
2026-03-14T07:36:44.138442	099964a4	0	0	0.0000	CRASH	gen=53 glyphs=4
2026-03-14T07:36:44.138635	099964a4	0	0	0.0000	CRASH	gen=53 glyphs=4
2026-03-14T07:36:44.138828	099964a4	0	0	0.0000	CRASH	gen=53 glyphs=4
2026-03-14T07:36:44.139019	099964a4	0	0	0.0000	CRASH	gen=53 glyphs=4
2026-03-14T07:36:44.139215	ff30496a	0	0	0.0000	CRASH	gen=53 glyphs=3
2026-03-14T07:36:44.139502	099964a4	0	0	0.0000	CRASH	gen=54 glyphs=4
2026-03-14T07:36:44.139699	099964a4	0	0	0.0000	CRASH	gen=54 glyphs=4
2026-03-14T07:36:44.139894	099964a4	0	0	0.0000	CRASH	gen=54 glyphs=4
2026-03-14T07:36:44.140087	099964a4	0	0	0.0000	CRASH	gen=54 glyphs=4
2026-03-14T07:36:44.140280	099964a4	0	0	0.0000	CRASH	gen=54 glyphs=4
2026-03-14T07:36:44.140475	7ede4765	0	0	0.0000	CRASH	gen=54 glyphs=2
2026-03-14T07:36:44.140671	acc97950	0	0	0.0000	CRASH	gen=54 glyphs=4
2026-03-14T07:36:44.140868	0df03738	0	0	0.0000	CRASH	gen=54 glyphs=3
2026-03-14T07:36:44.141062	099964a4	0	0	0.0000	CRASH	gen=54 glyphs=4
2026-03-14T07:36:44.141254	cf93b656	0	0	0.0000	CRASH	gen=54 glyphs=3
2026-03-14T07:36:44.141532	099964a4	0	0	0.0000	CRASH	gen=55 glyphs=4
2026-03-14T07:36:44.141728	099964a4	0	0	0.0000	CRASH	gen=55 glyphs=4
2026-03-14T07:36:44.141920	3ca14993	0	0	0.0000	CRASH	gen=55 glyphs=4
2026-03-14T07:36:44.142111	3ca14993	0	0	0.0000	CRASH	gen=55 glyphs=4
2026-03-14T07:36:44.142303	a70be911	0	0	0.0000	CRASH	gen=55 glyphs=4
2026-03-14T07:36:44.142503	4c79a04e	0	0	0.0000	CRASH	gen=55 glyphs=2
2026-03-14T07:36:44.142697	099964a4	0	0	0.0000	CRASH	gen=55 glyphs=4
2026-03-14T07:36:44.142886	099964a4	0	0	0.0000	CRASH	gen=55 glyphs=4
2026-03-14T07:36:44.143078	3ca14993	0	0	0.0000	CRASH	gen=55 glyphs=4
2026-03-14T07:36:44.143269	099964a4	0	0	0.0000	CRASH	gen=55 glyphs=4
2026-03-14T07:36:44.143546	099964a4	0	0	0.0000	CRASH	gen=56 glyphs=4
2026-03-14T07:36:44.143740	099964a4	0	0	0.0000	CRASH	gen=56 glyphs=4
2026-03-14T07:36:44.143931	3ca14993	0	0	0.0000	CRASH	gen=56 glyphs=4
2026-03-14T07:36:44.144125	5e59904c	0	0	0.0000	CRASH	gen=56 glyphs=4
2026-03-14T07:36:44.144317	099964a4	0	0	0.0000	CRASH	gen=56 glyphs=4
2026-03-14T07:36:44.144506	8b915b6c	0	0	0.0000	CRASH	gen=56 glyphs=3
2026-03-14T07:36:44.144707	1d2a1280	0	0	0.0000	CRASH	gen=56 glyphs=2
2026-03-14T07:36:44.144897	ff30496a	0	0	0.0000	CRASH	gen=56 glyphs=3
2026-03-14T07:36:44.145090	f5dd5ab0	0	0	0.0000	CRASH	gen=56 glyphs=3
2026-03-14T07:36:44.145287	099964a4	0	0	0.0000	CRASH	gen=56 glyphs=4
2026-03-14T07:36:44.145565	099964a4	0	0	0.0000	CRASH	gen=57 glyphs=4
2026-03-14T07:36:44.145764	099964a4	0	0	0.0000	CRASH	gen=57 glyphs=4
2026-03-14T07:36:44.145957	3a734398	0	0	0.0000	CRASH	gen=57 glyphs=4
2026-03-14T07:36:44.146148	09a690cf	0	0	0.0000	CRASH	gen=57 glyphs=2
2026-03-14T07:36:44.146339	09094f57	0	0	0.0000	CRASH	gen=57 glyphs=3
2026-03-14T07:36:44.146533	ff30496a	0	0	0.0000	CRASH	gen=57 glyphs=3
2026-03-14T07:36:44.146728	de08a21d	0	0	0.0000	CRASH	gen=57 glyphs=2
2026-03-14T07:36:44.146925	3a734398	0	0	0.0000	CRASH	gen=57 glyphs=4
2026-03-14T07:36:44.147119	099964a4	0	0	0.0000	CRASH	gen=57 glyphs=4
2026-03-14T07:36:44.147312	ff30496a	0	0	0.0000	CRASH	gen=57 glyphs=3
2026-03-14T07:36:44.147595	099964a4	0	0	0.0000	CRASH	gen=58 glyphs=4
2026-03-14T07:36:44.147791	099964a4	0	0	0.0000	CRASH	gen=58 glyphs=4
2026-03-14T07:36:44.147989	dcb1fb50	0	0	0.0000	CRASH	gen=58 glyphs=4
2026-03-14T07:36:44.148185	099964a4	0	0	0.0000	CRASH	gen=58 glyphs=4
2026-03-14T07:36:44.148377	099964a4	0	0	0.0000	CRASH	gen=58 glyphs=4
2026-03-14T07:36:44.148569	099964a4	0	0	0.0000	CRASH	gen=58 glyphs=4
2026-03-14T07:36:44.148759	69676878	0	0	0.0000	CRASH	gen=58 glyphs=3
2026-03-14T07:36:44.148955	80cef82b	0	0	0.0000	CRASH	gen=58 glyphs=4
2026-03-14T07:36:44.149152	099964a4	0	0	0.0000	CRASH	gen=58 glyphs=4
2026-03-14T07:36:44.149346	ffae86f6	0	0	0.0000	CRASH	gen=58 glyphs=4
2026-03-14T07:36:44.149613	099964a4	0	0	0.0000	CRASH	gen=59 glyphs=4
2026-03-14T07:36:44.149807	099964a4	0	0	0.0000	CRASH	gen=59 glyphs=4
2026-03-14T07:36:44.150003	6adc3ae3	0	0	0.0000	CRASH	gen=59 glyphs=5
2026-03-14T07:36:44.150197	ff30496a	0	0	0.0000	CRASH	gen=59 glyphs=3
2026-03-14T07:36:44.150392	099964a4	0	0	0.0000	CRASH	gen=59 glyphs=4
2026-03-14T07:36:44.150587	cf93b656	0	0	0.0000	CRASH	gen=59 glyphs=3
2026-03-14T07:36:44.150780	099964a4	0	0	0.0000	CRASH	gen=59 glyphs=4
2026-03-14T07:36:44.150972	099964a4	0	0	0.0000	CRASH	gen=59 glyphs=4
2026-03-14T07:36:44.151168	099964a4	0	0	0.0000	CRASH	gen=59 glyphs=4
2026-03-14T07:36:44.151360	099964a4	0	0	0.0000	CRASH	gen=59 glyphs=4
2026-03-14T07:36:44.151638	099964a4	0	0	0.0000	CRASH	gen=60 glyphs=4
2026-03-14T07:36:44.151832	099964a4	0	0	0.0000	CRASH	gen=60 glyphs=4
2026-03-14T07:36:44.152026	3ca14993	0	0	0.0000	CRASH	gen=60 glyphs=4
2026-03-14T07:36:44.152223	099964a4	0	0	0.0000	CRASH	gen=60 glyphs=4
2026-03-14T07:36:44.152419	099964a4	0	0	0.0000	CRASH	gen=60 glyphs=4
2026-03-14T07:36:44.152611	2c408277	0	0	0.0000	CRASH	gen=60 glyphs=4
2026-03-14T07:36:44.152806	c3ae6f1a	0	0	0.0000	CRASH	gen=60 glyphs=4
2026-03-14T07:36:44.152999	c6336ecd	0	0	0.0000	CRASH	gen=60 glyphs=4
2026-03-14T07:36:44.153194	725ddd18	0	0	0.0000	CRASH	gen=60 glyphs=3
2026-03-14T07:36:44.153389	099964a4	0	0	0.0000	CRASH	gen=60 glyphs=4
2026-03-14T07:36:44.153681	099964a4	0	0	0.0000	CRASH	gen=61 glyphs=4
2026-03-14T07:36:44.153877	099964a4	0	0	0.0000	CRASH	gen=61 glyphs=4
2026-03-14T07:36:44.154073	099964a4	0	0	0.0000	CRASH	gen=61 glyphs=4
2026-03-14T07:36:44.154265	099964a4	0	0	0.0000	CRASH	gen=61 glyphs=4
2026-03-14T07:36:44.154463	ff30496a	0	0	0.0000	CRASH	gen=61 glyphs=3
2026-03-14T07:36:44.155050	8da1f8d8	0	0	0.0000	CRASH	gen=61 glyphs=4
2026-03-14T07:36:44.155246	cf93b656	0	0	0.0000	CRASH	gen=61 glyphs=3
2026-03-14T07:36:44.155445	585a2cf1	0	0	0.0000	CRASH	gen=61 glyphs=4
2026-03-14T07:36:44.155643	099964a4	0	0	0.0000	CRASH	gen=61 glyphs=4
2026-03-14T07:36:44.155835	099964a4	0	0	0.0000	CRASH	gen=61 glyphs=4
2026-03-14T07:36:44.156114	099964a4	0	0	0.0000	CRASH	gen=62 glyphs=4
2026-03-14T07:36:44.156309	099964a4	0	0	0.0000	CRASH	gen=62 glyphs=4
2026-03-14T07:36:44.156506	4427ea1f	0	0	0.0000	CRASH	gen=62 glyphs=4
2026-03-14T07:36:44.156706	cf93b656	0	0	0.0000	CRASH	gen=62 glyphs=3
2026-03-14T07:36:44.156900	5b63351c	0	0	0.0000	CRASH	gen=62 glyphs=5
2026-03-14T07:36:44.157093	099964a4	0	0	0.0000	CRASH	gen=62 glyphs=4
2026-03-14T07:36:44.157286	16be9b24	0	0	0.0000	CRASH	gen=62 glyphs=4
2026-03-14T07:36:44.157481	099964a4	0	0	0.0000	CRASH	gen=62 glyphs=4
2026-03-14T07:36:44.157681	45c0cf0e	0	0	0.0000	CRASH	gen=62 glyphs=5
2026-03-14T07:36:44.157874	ff30496a	0	0	0.0000	CRASH	gen=62 glyphs=3
2026-03-14T07:36:44.158136	099964a4	0	0	0.0000	CRASH	gen=63 glyphs=4
2026-03-14T07:36:44.158329	099964a4	0	0	0.0000	CRASH	gen=63 glyphs=4
2026-03-14T07:36:44.158522	099964a4	0	0	0.0000	CRASH	gen=63 glyphs=4
2026-03-14T07:36:44.158716	ff30496a	0	0	0.0000	CRASH	gen=63 glyphs=3
2026-03-14T07:36:44.158906	a99f876a	0	0	0.0000	CRASH	gen=63 glyphs=4
2026-03-14T07:36:44.159100	dcb1fb50	0	0	0.0000	CRASH	gen=63 glyphs=4
2026-03-14T07:36:44.159294	099964a4	0	0	0.0000	CRASH	gen=63 glyphs=4
2026-03-14T07:36:44.159486	1d26b0e9	0	0	0.0000	CRASH	gen=63 glyphs=4
2026-03-14T07:36:44.159690	099964a4	0	0	0.0000	CRASH	gen=63 glyphs=4
2026-03-14T07:36:44.159884	099964a4	0	0	0.0000	CRASH	gen=63 glyphs=4
2026-03-14T07:36:44.160156	099964a4	0	0	0.0000	CRASH	gen=64 glyphs=4
2026-03-14T07:36:44.160352	099964a4	0	0	0.0000	CRASH	gen=64 glyphs=4
2026-03-14T07:36:44.160547	8da1f8d8	0	0	0.0000	CRASH	gen=64 glyphs=4
2026-03-14T07:36:44.160747	a6a46554	0	0	0.0000	CRASH	gen=64 glyphs=3
2026-03-14T07:36:44.160940	b076c53c	0	0	0.0000	CRASH	gen=64 glyphs=4
2026-03-14T07:36:44.161131	099964a4	0	0	0.0000	CRASH	gen=64 glyphs=4
2026-03-14T07:36:44.161322	099964a4	0	0	0.0000	CRASH	gen=64 glyphs=4
2026-03-14T07:36:44.161512	332d7cea	0	0	0.0000	CRASH	gen=64 glyphs=1
2026-03-14T07:36:44.161706	099964a4	0	0	0.0000	CRASH	gen=64 glyphs=4
2026-03-14T07:36:44.161908	099964a4	0	0	0.0000	CRASH	gen=64 glyphs=4
2026-03-14T07:36:44.162182	099964a4	0	0	0.0000	CRASH	gen=65 glyphs=4
2026-03-14T07:36:44.162378	099964a4	0	0	0.0000	CRASH	gen=65 glyphs=4
2026-03-14T07:36:44.162575	6c427843	0	0	0.0000	CRASH	gen=65 glyphs=4
2026-03-14T07:36:44.162769	068f7dd6	0	0	0.0000	CRASH	gen=65 glyphs=4
2026-03-14T07:36:44.162965	30555bf7	0	0	0.0000	CRASH	gen=65 glyphs=1
2026-03-14T07:36:44.163157	feb17fdf	0	0	0.0000	CRASH	gen=65 glyphs=3
2026-03-14T07:36:44.163349	79316a7a	0	0	0.0000	CRASH	gen=65 glyphs=4
2026-03-14T07:36:44.163546	099964a4	0	0	0.0000	CRASH	gen=65 glyphs=4
2026-03-14T07:36:44.163742	ef32df7f	0	0	0.0000	CRASH	gen=65 glyphs=4
2026-03-14T07:36:44.163939	099964a4	0	0	0.0000	CRASH	gen=65 glyphs=4
2026-03-14T07:36:44.164213	099964a4	0	0	0.0000	CRASH	gen=66 glyphs=4
2026-03-14T07:36:44.164407	099964a4	0	0	0.0000	CRASH	gen=66 glyphs=4
2026-03-14T07:36:44.164604	099964a4	0	0	0.0000	CRASH	gen=66 glyphs=4
2026-03-14T07:36:44.164797	099964a4	0	0	0.0000	CRASH	gen=66 glyphs=4
2026-03-14T07:36:44.164988	c210992e	0	0	0.0000	CRASH	gen=66 glyphs=4
2026-03-14T07:36:44.165190	3a734398	0	0	0.0000	CRASH	gen=66 glyphs=4
2026-03-14T07:36:44.165386	099964a4	0	0	0.0000	CRASH	gen=66 glyphs=4
2026-03-14T07:36:44.165583	099964a4	0	0	0.0000	CRASH	gen=66 glyphs=4
2026-03-14T07:36:44.165780	3a734398	0	0	0.0000	CRASH	gen=66 glyphs=4
2026-03-14T07:36:44.165973	099964a4	0	0	0.0000	CRASH	gen=66 glyphs=4
2026-03-14T07:36:44.166254	099964a4	0	0	0.0000	CRASH	gen=67 glyphs=4
2026-03-14T07:36:44.166452	099964a4	0	0	0.0000	CRASH	gen=67 glyphs=4
2026-03-14T07:36:44.166651	cf93b656	0	0	0.0000	CRASH	gen=67 glyphs=3
2026-03-14T07:36:44.166845	80cef82b	0	0	0.0000	CRASH	gen=67 glyphs=4
2026-03-14T07:36:44.167041	099964a4	0	0	0.0000	CRASH	gen=67 glyphs=4
2026-03-14T07:36:44.167233	7c8d57f0	0	0	0.0000	CRASH	gen=67 glyphs=4
2026-03-14T07:36:44.167430	3ca14993	0	0	0.0000	CRASH	gen=67 glyphs=4
2026-03-14T07:36:44.167624	ff30496a	0	0	0.0000	CRASH	gen=67 glyphs=3
2026-03-14T07:36:44.167820	099964a4	0	0	0.0000	CRASH	gen=67 glyphs=4
2026-03-14T07:36:44.168014	099964a4	0	0	0.0000	CRASH	gen=67 glyphs=4
2026-03-14T07:36:44.168286	099964a4	0	0	0.0000	CRASH	gen=68 glyphs=4
2026-03-14T07:36:44.168490	099964a4	0	0	0.0000	CRASH	gen=68 glyphs=4
2026-03-14T07:36:44.168687	dcb1fb50	0	0	0.0000	CRASH	gen=68 glyphs=4
2026-03-14T07:36:44.168882	099964a4	0	0	0.0000	CRASH	gen=68 glyphs=4
2026-03-14T07:36:44.169077	8da1f8d8	0	0	0.0000	CRASH	gen=68 glyphs=4
2026-03-14T07:36:44.169271	099964a4	0	0	0.0000	CRASH	gen=68 glyphs=4
2026-03-14T07:36:44.169467	80cef82b	0	0	0.0000	CRASH	gen=68 glyphs=4
2026-03-14T07:36:44.169668	80cef82b	0	0	0.0000	CRASH	gen=68 glyphs=4
2026-03-14T07:36:44.169865	1ee1d30e	0	0	0.0000	CRASH	gen=68 glyphs=4
2026-03-14T07:36:44.170062	9aff5c0e	0	0	0.0000	CRASH	gen=68 glyphs=2
2026-03-14T07:36:44.170336	099964a4	0	0	0.0000	CRASH	gen=69 glyphs=4
2026-03-14T07:36:44.170534	099964a4	0	0	0.0000	CRASH	gen=69 glyphs=4
2026-03-14T07:36:44.170736	099964a4	0	0	0.0000	CRASH	gen=69 glyphs=4
2026-03-14T07:36:44.170929	8da1f8d8	0	0	0.0000	CRASH	gen=69 glyphs=4
2026-03-14T07:36:44.171127	099964a4	0	0	0.0000	CRASH	gen=69 glyphs=4
2026-03-14T07:36:44.171319	099964a4	0	0	0.0000	CRASH	gen=69 glyphs=4
2026-03-14T07:36:44.171515	099964a4	0	0	0.0000	CRASH	gen=69 glyphs=4
2026-03-14T07:36:44.171718	099964a4	0	0	0.0000	CRASH	gen=69 glyphs=4
2026-03-14T07:36:44.171916	099964a4	0	0	0.0000	CRASH	gen=69 glyphs=4
2026-03-14T07:36:44.172113	dcb1fb50	0	0	0.0000	CRASH	gen=69 glyphs=4
2026-03-14T07:36:44.172393	099964a4	0	0	0.0000	CRASH	gen=70 glyphs=4
2026-03-14T07:36:44.172590	099964a4	0	0	0.0000	CRASH	gen=70 glyphs=4
2026-03-14T07:36:44.172793	099964a4	0	0	0.0000	CRASH	gen=70 glyphs=4
2026-03-14T07:36:44.172986	099964a4	0	0	0.0000	CRASH	gen=70 glyphs=4
2026-03-14T07:36:44.173180	11b7b75f	0	0	0.0000	CRASH	gen=70 glyphs=4
2026-03-14T07:36:44.173375	7ede4765	0	0	0.0000	CRASH	gen=70 glyphs=2
2026-03-14T07:36:44.173572	099964a4	0	0	0.0000	CRASH	gen=70 glyphs=4
2026-03-14T07:36:44.173764	2d717266	0	0	0.0000	CRASH	gen=70 glyphs=3
2026-03-14T07:36:44.173967	932bd826	0	0	0.0000	CRASH	gen=70 glyphs=4
2026-03-14T07:36:44.174161	cf93b656	0	0	0.0000	CRASH	gen=70 glyphs=3
2026-03-14T07:36:44.174445	099964a4	0	0	0.0000	CRASH	gen=71 glyphs=4
2026-03-14T07:36:44.174647	099964a4	0	0	0.0000	CRASH	gen=71 glyphs=4
2026-03-14T07:36:44.174840	8da1f8d8	0	0	0.0000	CRASH	gen=71 glyphs=4
2026-03-14T07:36:44.175039	099964a4	0	0	0.0000	CRASH	gen=71 glyphs=4
2026-03-14T07:36:44.175234	099964a4	0	0	0.0000	CRASH	gen=71 glyphs=4
2026-03-14T07:36:44.175426	099964a4	0	0	0.0000	CRASH	gen=71 glyphs=4
2026-03-14T07:36:44.175621	80cef82b	0	0	0.0000	CRASH	gen=71 glyphs=4
2026-03-14T07:36:44.175815	3a734398	0	0	0.0000	CRASH	gen=71 glyphs=4
2026-03-14T07:36:44.176010	1f40d413	0	0	0.0000	CRASH	gen=71 glyphs=4
2026-03-14T07:36:44.176210	099964a4	0	0	0.0000	CRASH	gen=71 glyphs=4
2026-03-14T07:36:44.176483	099964a4	0	0	0.0000	CRASH	gen=72 glyphs=4
2026-03-14T07:36:44.176679	099964a4	0	0	0.0000	CRASH	gen=72 glyphs=4
2026-03-14T07:36:44.176874	634fe803	0	0	0.0000	CRASH	gen=72 glyphs=4
2026-03-14T07:36:44.177067	099964a4	0	0	0.0000	CRASH	gen=72 glyphs=4
2026-03-14T07:36:44.177268	3a734398	0	0	0.0000	CRASH	gen=72 glyphs=4
2026-03-14T07:36:44.177458	099964a4	0	0	0.0000	CRASH	gen=72 glyphs=4
2026-03-14T07:36:44.177653	8da1f8d8	0	0	0.0000	CRASH	gen=72 glyphs=4
2026-03-14T07:36:44.177845	099964a4	0	0	0.0000	CRASH	gen=72 glyphs=4
2026-03-14T07:36:44.178037	099964a4	0	0	0.0000	CRASH	gen=72 glyphs=4
2026-03-14T07:36:44.178238	a8d36bbf	0	0	0.0000	CRASH	gen=72 glyphs=4
2026-03-14T07:36:44.178520	099964a4	0	0	0.0000	CRASH	gen=73 glyphs=4
2026-03-14T07:36:44.178717	099964a4	0	0	0.0000	CRASH	gen=73 glyphs=4
2026-03-14T07:36:44.178912	099964a4	0	0	0.0000	CRASH	gen=73 glyphs=4
2026-03-14T07:36:44.179106	8da1f8d8	0	0	0.0000	CRASH	gen=73 glyphs=4
2026-03-14T07:36:44.179306	dd3ac2b7	0	0	0.0000	CRASH	gen=73 glyphs=2
2026-03-14T07:36:44.179497	c1878c9c	0	0	0.0000	CRASH	gen=73 glyphs=4
2026-03-14T07:36:44.179694	5a1e97de	0	0	0.0000	CRASH	gen=73 glyphs=5
2026-03-14T07:36:44.179889	8da1f8d8	0	0	0.0000	CRASH	gen=73 glyphs=4
2026-03-14T07:36:44.180086	2263c9e8	0	0	0.0000	CRASH	gen=73 glyphs=4
2026-03-14T07:36:44.180281	424fa0b4	0	0	0.0000	CRASH	gen=73 glyphs=4
2026-03-14T07:36:44.180559	099964a4	0	0	0.0000	CRASH	gen=74 glyphs=4
2026-03-14T07:36:44.180754	099964a4	0	0	0.0000	CRASH	gen=74 glyphs=4
2026-03-14T07:36:44.180947	1788ea6f	0	0	0.0000	CRASH	gen=74 glyphs=4
2026-03-14T07:36:44.181141	099964a4	0	0	0.0000	CRASH	gen=74 glyphs=4
2026-03-14T07:36:44.181334	3ebf7292	0	0	0.0000	CRASH	gen=74 glyphs=4
2026-03-14T07:36:44.181539	0dc6dee8	0	0	0.0000	CRASH	gen=74 glyphs=3
2026-03-14T07:36:44.181731	099964a4	0	0	0.0000	CRASH	gen=74 glyphs=4
2026-03-14T07:36:44.181921	5f6b1373	0	0	0.0000	CRASH	gen=74 glyphs=3
2026-03-14T07:36:44.182119	dce2699b	0	0	0.0000	CRASH	gen=74 glyphs=4
2026-03-14T07:36:44.182315	3ca14993	0	0	0.0000	CRASH	gen=74 glyphs=4
2026-03-14T07:36:44.182606	099964a4	0	0	0.0000	CRASH	gen=75 glyphs=4
2026-03-14T07:36:44.182806	099964a4	0	0	0.0000	CRASH	gen=75 glyphs=4
2026-03-14T07:36:44.183002	b1948c17	0	0	0.0000	CRASH	gen=75 glyphs=4
