timestamp	program_hash	spirv_size	word_count	fitness	status	description
2026-03-14T00:28:23.981623	bfdf7cad	120	30	1.0000	DISCARD	gen=286 glyphs=4
2026-03-14T00:28:24.252088	19355583	120	30	1.0000	DISCARD	gen=330 glyphs=4
2026-03-14T00:28:26.733288	9fcabc22	120	30	1.0000	DISCARD	gen=286 glyphs=4
2026-03-14T00:28:27.017724	8aef8872	116	29	1.0000	DISCARD	gen=330 glyphs=4
2026-03-14T00:28:29.457874	fdb5d108	120	30	1.0000	DISCARD	gen=286 glyphs=4
2026-03-14T00:28:29.742972	8aef8872	116	29	1.0000	DISCARD	gen=330 glyphs=4
2026-03-14T00:28:32.223923	d11c1062	120	30	1.0000	DISCARD	gen=286 glyphs=4
2026-03-14T00:28:32.493479	19355583	120	30	1.0000	DISCARD	gen=330 glyphs=4
2026-03-14T00:28:34.964089	3d0c1e1d	116	29	1.0000	DISCARD	gen=286 glyphs=4
2026-03-14T00:28:35.230276	1e5f0e21	116	29	1.0000	DISCARD	gen=330 glyphs=4
2026-03-14T00:28:37.712603	bfdf7cad	120	30	1.0000	DISCARD	gen=286 glyphs=4
2026-03-14T00:28:37.979676	19355583	120	30	1.0000	DISCARD	gen=330 glyphs=4
2026-03-14T00:28:40.413962	5a06ca32	120	30	1.0000	DISCARD	gen=286 glyphs=4
2026-03-14T00:28:40.701765	f7ed0226	116	29	1.0000	DISCARD	gen=330 glyphs=4
2026-03-14T00:28:43.190702	bfdf7cad	120	30	1.0000	DISCARD	gen=286 glyphs=4
2026-03-14T00:28:43.463757	1f9ea9b6	120	30	1.0000	DISCARD	gen=330 glyphs=4
2026-03-14T00:28:45.955419	55d6c151	120	30	1.0000	DISCARD	gen=286 glyphs=4
2026-03-14T00:28:46.234101	041b4d23	116	29	1.0000	DISCARD	gen=330 glyphs=4
2026-03-14T00:28:48.697411	37f4017b	116	29	1.0000	DISCARD	gen=287 glyphs=4
2026-03-14T00:28:48.972270	5120f6c6	120	30	1.0000	DISCARD	gen=330 glyphs=4
2026-03-14T00:28:51.417249	bfdf7cad	120	30	1.0000	DISCARD	gen=287 glyphs=4
2026-03-14T00:28:51.687458	19355583	120	30	1.0000	DISCARD	gen=331 glyphs=4
2026-03-14T00:28:54.145114	2701cb73	116	29	1.0000	DISCARD	gen=287 glyphs=4
2026-03-14T00:28:54.427547	8aef8872	116	29	1.0000	DISCARD	gen=331 glyphs=4
2026-03-14T00:28:56.889556	d11c1062	120	30	1.0000	DISCARD	gen=287 glyphs=4
2026-03-14T00:28:57.159004	ddce106d	116	29	1.0000	DISCARD	gen=331 glyphs=4
2026-03-14T00:28:59.629849	55d6c151	120	30	1.0000	DISCARD	gen=287 glyphs=4
2026-03-14T00:28:59.901064	2c79fa8e	116	29	1.0000	DISCARD	gen=331 glyphs=4
2026-03-14T00:29:02.340818	fdb5d108	120	30	1.0000	DISCARD	gen=287 glyphs=4
2026-03-14T00:29:02.617381	8aef8872	116	29	1.0000	DISCARD	gen=331 glyphs=4
2026-03-14T00:29:05.051984	12b38c2d	116	29	1.0000	DISCARD	gen=287 glyphs=4
2026-03-14T00:29:05.323313	9e34ede0	116	29	1.0000	DISCARD	gen=331 glyphs=4
2026-03-14T00:29:07.788321	5a06ca32	120	30	1.0000	DISCARD	gen=287 glyphs=4
2026-03-14T00:29:08.061331	8aef8872	116	29	1.0000	DISCARD	gen=331 glyphs=4
2026-03-14T00:29:10.499143	3569e14e	120	30	1.0000	DISCARD	gen=287 glyphs=4
2026-03-14T00:29:10.774036	19355583	120	30	1.0000	DISCARD	gen=331 glyphs=4
2026-03-14T00:29:13.222790	bfdf7cad	120	30	1.0000	DISCARD	gen=287 glyphs=4
2026-03-14T00:29:13.496702	79c083cc	116	29	1.0000	DISCARD	gen=331 glyphs=4
2026-03-14T00:29:15.963403	37f4017b	116	29	1.0000	DISCARD	gen=288 glyphs=4
2026-03-14T00:29:16.280419	1e5f0e21	116	29	1.0000	DISCARD	gen=331 glyphs=4
2026-03-14T00:29:18.798938	bfdf7cad	120	30	1.0000	DISCARD	gen=288 glyphs=4
2026-03-14T00:29:19.072250	19355583	120	30	1.0000	DISCARD	gen=332 glyphs=4
2026-03-14T00:29:21.529365	bfdf7cad	120	30	1.0000	DISCARD	gen=288 glyphs=4
2026-03-14T00:29:21.792300	8aef8872	116	29	1.0000	DISCARD	gen=332 glyphs=4
2026-03-14T00:29:24.262192	fdb5d108	120	30	1.0000	DISCARD	gen=288 glyphs=4
2026-03-14T00:29:24.554954	ae44ace5	116	29	1.0000	DISCARD	gen=332 glyphs=4
2026-03-14T00:29:27.027191	4c9b0dd4	120	30	1.0000	DISCARD	gen=288 glyphs=4
2026-03-14T00:29:27.300483	19355583	120	30	1.0000	DISCARD	gen=332 glyphs=4
2026-03-14T00:29:29.708513	37f4017b	116	29	1.0000	DISCARD	gen=288 glyphs=4
2026-03-14T00:29:29.989302	41281d50	116	29	1.0000	DISCARD	gen=332 glyphs=4
2026-03-14T00:29:32.425122	5a06ca32	120	30	1.0000	DISCARD	gen=288 glyphs=4
2026-03-14T00:29:32.694720	e8c7f6cf	120	30	1.0000	DISCARD	gen=332 glyphs=4
2026-03-14T00:29:35.137285	06eee11d	120	30	1.0000	DISCARD	gen=288 glyphs=4
2026-03-14T00:29:35.406310	d7c8681b	120	30	1.0000	DISCARD	gen=332 glyphs=4
2026-03-14T00:29:37.878935	bfdf7cad	120	30	1.0000	DISCARD	gen=288 glyphs=4
2026-03-14T00:29:38.152511	e2cd28ea	120	30	1.0000	DISCARD	gen=332 glyphs=4
2026-03-14T00:29:40.630915	5a06ca32	120	30	1.0000	DISCARD	gen=288 glyphs=4
2026-03-14T00:29:40.922556	0eaedb57	116	29	1.0000	DISCARD	gen=332 glyphs=4
2026-03-14T00:29:43.379301	37f4017b	116	29	1.0000	DISCARD	gen=289 glyphs=4
2026-03-14T00:29:43.642304	7a6e04ef	116	29	1.0000	DISCARD	gen=332 glyphs=4
2026-03-14T00:29:46.085008	bfdf7cad	120	30	1.0000	DISCARD	gen=289 glyphs=4
2026-03-14T00:29:46.352444	19355583	120	30	1.0000	DISCARD	gen=333 glyphs=4
2026-03-14T00:29:48.902419	e92eeb13	120	30	1.0000	DISCARD	gen=289 glyphs=4
2026-03-14T00:29:49.178394	8aef8872	116	29	1.0000	DISCARD	gen=333 glyphs=4
2026-03-14T00:29:51.653787	3c72b3b5	116	29	1.0000	DISCARD	gen=289 glyphs=4
2026-03-14T00:29:51.928879	22940597	120	30	1.0000	DISCARD	gen=333 glyphs=4
2026-03-14T00:29:54.382833	d11c1062	120	30	1.0000	DISCARD	gen=289 glyphs=4
2026-03-14T00:29:54.661513	f95cc56e	116	29	1.0000	DISCARD	gen=333 glyphs=4
2026-03-14T00:29:57.131162	cb1c9ce7	116	29	1.0000	DISCARD	gen=289 glyphs=4
2026-03-14T00:29:57.405994	8aef8872	116	29	1.0000	DISCARD	gen=333 glyphs=4
2026-03-14T00:29:59.845485	5a06ca32	120	30	1.0000	DISCARD	gen=289 glyphs=4
2026-03-14T00:30:00.120481	67cb81be	120	30	1.0000	DISCARD	gen=333 glyphs=4
2026-03-14T00:30:02.597178	37f4017b	116	29	1.0000	DISCARD	gen=289 glyphs=4
2026-03-14T00:30:02.871461	19355583	120	30	1.0000	DISCARD	gen=333 glyphs=4
2026-03-14T00:30:05.356944	37f4017b	116	29	1.0000	DISCARD	gen=289 glyphs=4
2026-03-14T00:30:05.633196	67cb81be	120	30	1.0000	DISCARD	gen=333 glyphs=4
2026-03-14T00:30:08.132912	5a06ca32	120	30	1.0000	DISCARD	gen=289 glyphs=4
2026-03-14T00:30:08.395747	050862ad	120	30	1.0000	DISCARD	gen=333 glyphs=4
2026-03-14T00:30:10.851602	37f4017b	116	29	1.0000	DISCARD	gen=290 glyphs=4
2026-03-14T00:30:11.121635	9e34ede0	116	29	1.0000	DISCARD	gen=333 glyphs=4
2026-03-14T00:30:13.594898	bfdf7cad	120	30	1.0000	DISCARD	gen=290 glyphs=4
2026-03-14T00:30:13.864215	19355583	120	30	1.0000	DISCARD	gen=334 glyphs=4
2026-03-14T00:30:16.345964	f24a9a35	116	29	1.0000	DISCARD	gen=290 glyphs=4
2026-03-14T00:30:16.617085	8aef8872	116	29	1.0000	DISCARD	gen=334 glyphs=4
2026-03-14T00:30:19.076691	dfbe4aa9	120	30	1.0000	DISCARD	gen=290 glyphs=4
2026-03-14T00:30:19.353014	0eaedb57	116	29	1.0000	DISCARD	gen=334 glyphs=4
2026-03-14T00:30:21.908027	55d6c151	120	30	1.0000	DISCARD	gen=290 glyphs=4
2026-03-14T00:30:22.183052	0eaedb57	116	29	1.0000	DISCARD	gen=334 glyphs=4
2026-03-14T00:30:24.664167	5a06ca32	120	30	1.0000	DISCARD	gen=290 glyphs=4
2026-03-14T00:30:24.938902	40c88eab	116	29	1.0000	DISCARD	gen=334 glyphs=4
2026-03-14T00:30:27.417593	5a06ca32	120	30	1.0000	DISCARD	gen=290 glyphs=4
2026-03-14T00:30:27.692515	19355583	120	30	1.0000	DISCARD	gen=334 glyphs=4
2026-03-14T00:30:30.162369	12b38c2d	116	29	1.0000	DISCARD	gen=290 glyphs=4
2026-03-14T00:30:30.437600	68b7f6ec	116	29	1.0000	DISCARD	gen=334 glyphs=4
2026-03-14T00:30:32.909261	5a06ca32	120	30	1.0000	DISCARD	gen=290 glyphs=4
2026-03-14T00:30:33.188535	e2cd28ea	120	30	1.0000	DISCARD	gen=334 glyphs=4
2026-03-14T00:30:35.648275	39e7b4ac	116	29	1.0000	DISCARD	gen=290 glyphs=4
2026-03-14T00:30:35.919859	eca7ab6c	116	29	1.0000	DISCARD	gen=334 glyphs=4
2026-03-14T00:30:38.367902	37f4017b	116	29	1.0000	DISCARD	gen=291 glyphs=4
2026-03-14T00:30:38.649717	9e34ede0	116	29	1.0000	DISCARD	gen=334 glyphs=4
2026-03-14T00:30:41.126656	bfdf7cad	120	30	1.0000	DISCARD	gen=291 glyphs=4
2026-03-14T00:30:41.395062	19355583	120	30	1.0000	DISCARD	gen=335 glyphs=4
2026-03-14T00:30:43.868822	12b38c2d	116	29	1.0000	DISCARD	gen=291 glyphs=4
2026-03-14T00:30:44.151188	8aef8872	116	29	1.0000	DISCARD	gen=335 glyphs=4
2026-03-14T00:30:46.611231	3bef03d1	120	30	0.9500	DISCARD	gen=291 glyphs=4
2026-03-14T00:30:46.885279	0eaedb57	116	29	1.0000	DISCARD	gen=335 glyphs=4
2026-03-14T00:30:49.351007	71e2ba66	116	29	1.0000	DISCARD	gen=291 glyphs=4
2026-03-14T00:30:49.625391	8c4189fd	116	29	1.0000	DISCARD	gen=335 glyphs=4
2026-03-14T00:30:52.095266	fdb5d108	120	30	1.0000	DISCARD	gen=291 glyphs=4
2026-03-14T00:30:52.359496	050862ad	120	30	1.0000	DISCARD	gen=335 glyphs=4
2026-03-14T00:30:54.834543	5b9807ac	120	30	1.0000	DISCARD	gen=291 glyphs=4
2026-03-14T00:30:55.108207	d7c8681b	120	30	1.0000	DISCARD	gen=335 glyphs=4
2026-03-14T00:30:57.558628	811fb15b	116	29	1.0000	DISCARD	gen=291 glyphs=4
2026-03-14T00:30:57.824237	eca7ab6c	116	29	1.0000	DISCARD	gen=335 glyphs=4
2026-03-14T00:31:00.300283	4d5b277f	120	30	1.0000	DISCARD	gen=291 glyphs=4
2026-03-14T00:31:00.578932	8aef8872	116	29	1.0000	DISCARD	gen=335 glyphs=4
2026-03-14T00:31:03.059678	37f4017b	116	29	1.0000	DISCARD	gen=291 glyphs=4
2026-03-14T00:31:03.335056	4b9d069a	120	30	1.0000	DISCARD	gen=335 glyphs=4
2026-03-14T00:31:05.787245	37f4017b	116	29	1.0000	DISCARD	gen=292 glyphs=4
2026-03-14T00:31:06.059962	f126051e	116	29	0.9500	DISCARD	gen=335 glyphs=4
2026-03-14T00:31:08.503936	bfdf7cad	120	30	1.0000	DISCARD	gen=292 glyphs=4
2026-03-14T00:31:08.791200	19355583	120	30	1.0000	DISCARD	gen=336 glyphs=4
2026-03-14T00:31:11.238356	fdb5d108	120	30	1.0000	DISCARD	gen=292 glyphs=4
2026-03-14T00:31:11.511235	8aef8872	116	29	1.0000	DISCARD	gen=336 glyphs=4
2026-03-14T00:31:13.988136	7e133b04	120	30	1.0000	DISCARD	gen=292 glyphs=4
2026-03-14T00:31:14.266544	e8c7f6cf	120	30	1.0000	DISCARD	gen=336 glyphs=4
2026-03-14T00:31:16.717640	55d6c151	120	30	1.0000	DISCARD	gen=292 glyphs=4
2026-03-14T00:31:16.989589	4bc6fe91	116	29	1.0000	DISCARD	gen=336 glyphs=4
2026-03-14T00:31:19.419423	55d6c151	120	30	1.0000	DISCARD	gen=292 glyphs=4
2026-03-14T00:31:19.689881	a78f9454	120	30	1.0000	DISCARD	gen=336 glyphs=4
2026-03-14T00:31:22.169805	bfdf7cad	120	30	1.0000	DISCARD	gen=292 glyphs=4
2026-03-14T00:31:22.441854	050862ad	120	30	1.0000	DISCARD	gen=336 glyphs=4
2026-03-14T00:31:24.961033	cbfdb2c0	116	29	0.9500	DISCARD	gen=292 glyphs=4
2026-03-14T00:31:25.233324	ae44ace5	116	29	1.0000	DISCARD	gen=336 glyphs=4
2026-03-14T00:31:27.701828	37f4017b	116	29	1.0000	DISCARD	gen=292 glyphs=4
2026-03-14T00:31:27.970286	8aef8872	116	29	1.0000	DISCARD	gen=336 glyphs=4
2026-03-14T00:31:30.417326	d11c1062	120	30	1.0000	DISCARD	gen=292 glyphs=4
2026-03-14T00:31:30.689146	8aef8872	116	29	1.0000	DISCARD	gen=336 glyphs=4
2026-03-14T00:31:33.135583	37f4017b	116	29	1.0000	DISCARD	gen=293 glyphs=4
2026-03-14T00:31:33.408053	5f5b9501	116	29	1.0000	DISCARD	gen=336 glyphs=4
2026-03-14T00:31:35.845622	bfdf7cad	120	30	1.0000	DISCARD	gen=293 glyphs=4
2026-03-14T00:31:36.114108	19355583	120	30	1.0000	DISCARD	gen=337 glyphs=4
2026-03-14T00:31:38.567418	01b3b6a3	116	29	1.0000	DISCARD	gen=293 glyphs=4
2026-03-14T00:31:38.842577	8aef8872	116	29	1.0000	DISCARD	gen=337 glyphs=4
2026-03-14T00:31:41.299351	bfdf7cad	120	30	1.0000	DISCARD	gen=293 glyphs=4
2026-03-14T00:31:41.566544	050862ad	120	30	1.0000	DISCARD	gen=337 glyphs=4
2026-03-14T00:31:44.038181	dd2b058c	120	30	1.0000	DISCARD	gen=293 glyphs=4
2026-03-14T00:31:44.311902	9e34ede0	116	29	1.0000	DISCARD	gen=337 glyphs=4
2026-03-14T00:31:46.754434	59b4dc07	116	29	1.0000	DISCARD	gen=293 glyphs=4
2026-03-14T00:31:47.018858	eca7ab6c	116	29	1.0000	DISCARD	gen=337 glyphs=4
2026-03-14T00:31:49.482131	1d34459a	116	29	1.0000	DISCARD	gen=293 glyphs=4
2026-03-14T00:31:49.754246	9efef13f	116	29	1.0000	DISCARD	gen=337 glyphs=4
2026-03-14T00:31:52.237943	bb8f91fa	116	29	1.0000	DISCARD	gen=293 glyphs=4
2026-03-14T00:31:52.504189	050862ad	120	30	1.0000	DISCARD	gen=337 glyphs=4
2026-03-14T00:31:54.967386	12b38c2d	116	29	1.0000	DISCARD	gen=293 glyphs=4
2026-03-14T00:31:55.249214	8aef8872	116	29	1.0000	DISCARD	gen=337 glyphs=4
2026-03-14T00:31:57.774965	5a06ca32	120	30	1.0000	DISCARD	gen=293 glyphs=4
2026-03-14T00:31:58.042134	8fb51bd9	116	29	1.0000	DISCARD	gen=337 glyphs=4
2026-03-14T00:32:00.510402	37f4017b	116	29	1.0000	DISCARD	gen=294 glyphs=4
2026-03-14T00:32:00.781488	d7c8681b	120	30	1.0000	DISCARD	gen=337 glyphs=4
2026-03-14T00:32:03.255228	bfdf7cad	120	30	1.0000	DISCARD	gen=294 glyphs=4
2026-03-14T00:32:03.533477	19355583	120	30	1.0000	DISCARD	gen=338 glyphs=4
2026-03-14T00:32:05.987688	37f4017b	116	29	1.0000	DISCARD	gen=294 glyphs=4
2026-03-14T00:32:06.257078	8aef8872	116	29	1.0000	DISCARD	gen=338 glyphs=4
2026-03-14T00:32:08.734830	fdb5d108	120	30	1.0000	DISCARD	gen=294 glyphs=4
2026-03-14T00:32:09.005293	ab2ed00e	120	30	1.0000	DISCARD	gen=338 glyphs=4
2026-03-14T00:32:11.490804	fdb5d108	120	30	1.0000	DISCARD	gen=294 glyphs=4
2026-03-14T00:32:11.764366	875e0f8a	116	29	1.0000	DISCARD	gen=338 glyphs=4
2026-03-14T00:32:14.229852	37f4017b	116	29	1.0000	DISCARD	gen=294 glyphs=4
2026-03-14T00:32:14.515216	19355583	120	30	1.0000	DISCARD	gen=338 glyphs=4
2026-03-14T00:32:16.959716	55d6c151	120	30	1.0000	DISCARD	gen=294 glyphs=4
2026-03-14T00:32:17.237709	e8c7f6cf	120	30	1.0000	DISCARD	gen=338 glyphs=4
2026-03-14T00:32:19.702663	37f4017b	116	29	1.0000	DISCARD	gen=294 glyphs=4
2026-03-14T00:32:19.966113	9e34ede0	116	29	1.0000	DISCARD	gen=338 glyphs=4
2026-03-14T00:32:22.412224	fdb5d108	120	30	1.0000	DISCARD	gen=294 glyphs=4
2026-03-14T00:32:22.689531	050862ad	120	30	1.0000	DISCARD	gen=338 glyphs=4
2026-03-14T00:32:25.157581	55d6c151	120	30	1.0000	DISCARD	gen=294 glyphs=4
2026-03-14T00:32:25.427138	b028ec35	116	29	1.0000	DISCARD	gen=338 glyphs=4
2026-03-14T00:32:27.983808	37f4017b	116	29	1.0000	DISCARD	gen=295 glyphs=4
2026-03-14T00:32:28.268694	19355583	120	30	1.0000	DISCARD	gen=338 glyphs=4
2026-03-14T00:32:30.727336	bfdf7cad	120	30	1.0000	DISCARD	gen=295 glyphs=4
2026-03-14T00:32:31.003950	19355583	120	30	1.0000	DISCARD	gen=339 glyphs=4
2026-03-14T00:32:33.453173	bfdf7cad	120	30	1.0000	DISCARD	gen=295 glyphs=4
2026-03-14T00:32:33.723771	8aef8872	116	29	1.0000	DISCARD	gen=339 glyphs=4
2026-03-14T00:32:36.181836	d82c8da2	116	29	1.0000	DISCARD	gen=295 glyphs=4
2026-03-14T00:32:36.454668	2328a989	116	29	1.0000	DISCARD	gen=339 glyphs=4
2026-03-14T00:32:38.929366	12b38c2d	116	29	1.0000	DISCARD	gen=295 glyphs=4
2026-03-14T00:32:39.200241	9e34ede0	116	29	1.0000	DISCARD	gen=339 glyphs=4
2026-03-14T00:32:41.680389	21065ad1	120	30	1.0000	DISCARD	gen=295 glyphs=4
2026-03-14T00:32:41.951705	050862ad	120	30	1.0000	DISCARD	gen=339 glyphs=4
2026-03-14T00:32:44.415702	12b38c2d	116	29	1.0000	DISCARD	gen=295 glyphs=4
2026-03-14T00:32:44.679897	50dc991d	116	29	1.0000	DISCARD	gen=339 glyphs=4
2026-03-14T00:32:47.157026	37f4017b	116	29	1.0000	DISCARD	gen=295 glyphs=4
2026-03-14T00:32:47.428607	1e5f0e21	116	29	1.0000	DISCARD	gen=339 glyphs=4
2026-03-14T00:32:49.899951	bfdf7cad	120	30	1.0000	DISCARD	gen=295 glyphs=4
2026-03-14T00:32:50.166992	97f04843	116	29	1.0000	DISCARD	gen=339 glyphs=4
2026-03-14T00:32:52.592549	1d34459a	116	29	1.0000	DISCARD	gen=295 glyphs=4
2026-03-14T00:32:52.876033	19355583	120	30	1.0000	DISCARD	gen=339 glyphs=4
2026-03-14T00:32:55.339967	37f4017b	116	29	1.0000	DISCARD	gen=296 glyphs=4
2026-03-14T00:32:55.617628	67cb81be	120	30	1.0000	DISCARD	gen=339 glyphs=4
2026-03-14T00:32:58.067541	bfdf7cad	120	30	1.0000	DISCARD	gen=296 glyphs=4
2026-03-14T00:32:58.331067	19355583	120	30	1.0000	DISCARD	gen=340 glyphs=4
2026-03-14T00:33:00.898511	fdb5d108	120	30	1.0000	DISCARD	gen=296 glyphs=4
2026-03-14T00:33:01.169569	8aef8872	116	29	1.0000	DISCARD	gen=340 glyphs=4
2026-03-14T00:33:03.609208	5b9807ac	120	30	1.0000	DISCARD	gen=296 glyphs=4
2026-03-14T00:33:03.877933	eca7ab6c	116	29	1.0000	DISCARD	gen=340 glyphs=4
2026-03-14T00:33:06.327063	bdffd9c3	116	29	1.0000	DISCARD	gen=296 glyphs=4
2026-03-14T00:33:06.605473	19355583	120	30	1.0000	DISCARD	gen=340 glyphs=4
2026-03-14T00:33:09.084277	1d34459a	116	29	1.0000	DISCARD	gen=296 glyphs=4
2026-03-14T00:33:09.348905	a78f9454	120	30	1.0000	DISCARD	gen=340 glyphs=4
2026-03-14T00:33:11.847092	55d6c151	120	30	1.0000	DISCARD	gen=296 glyphs=4
2026-03-14T00:33:12.130465	c80277cd	120	30	0.9500	DISCARD	gen=340 glyphs=4
2026-03-14T00:33:14.591555	5a06ca32	120	30	1.0000	DISCARD	gen=296 glyphs=4
2026-03-14T00:33:14.862174	2d2385e2	116	29	1.0000	DISCARD	gen=340 glyphs=4
2026-03-14T00:33:17.340892	76084bab	120	30	1.0000	DISCARD	gen=296 glyphs=4
2026-03-14T00:33:17.606143	19355583	120	30	1.0000	DISCARD	gen=340 glyphs=4
2026-03-14T00:33:20.086411	5a06ca32	120	30	1.0000	DISCARD	gen=296 glyphs=4
2026-03-14T00:33:20.353307	eca7ab6c	116	29	1.0000	DISCARD	gen=340 glyphs=4
2026-03-14T00:33:22.841179	37f4017b	116	29	1.0000	DISCARD	gen=297 glyphs=4
2026-03-14T00:33:23.118460	19355583	120	30	1.0000	DISCARD	gen=340 glyphs=4
2026-03-14T00:33:25.583958	bfdf7cad	120	30	1.0000	DISCARD	gen=297 glyphs=4
2026-03-14T00:33:25.852755	19355583	120	30	1.0000	DISCARD	gen=341 glyphs=4
2026-03-14T00:33:28.362588	9ce85e41	120	30	1.0000	DISCARD	gen=297 glyphs=4
2026-03-14T00:33:28.642097	8aef8872	116	29	1.0000	DISCARD	gen=341 glyphs=4
2026-03-14T00:33:31.199083	cafd4b73	116	29	1.0000	DISCARD	gen=297 glyphs=4
2026-03-14T00:33:31.507090	eca7ab6c	116	29	1.0000	DISCARD	gen=341 glyphs=4
2026-03-14T00:33:33.982818	930b28f3	120	30	1.0000	DISCARD	gen=297 glyphs=4
2026-03-14T00:33:34.262485	11eb8f8e	116	29	1.0000	DISCARD	gen=341 glyphs=4
2026-03-14T00:33:36.763622	5a06ca32	120	30	1.0000	DISCARD	gen=297 glyphs=4
2026-03-14T00:33:37.032198	eca7ab6c	116	29	1.0000	DISCARD	gen=341 glyphs=4
2026-03-14T00:33:39.509379	fdb5d108	120	30	1.0000	DISCARD	gen=297 glyphs=4
2026-03-14T00:33:39.774154	ae44ace5	116	29	1.0000	DISCARD	gen=341 glyphs=4
2026-03-14T00:33:42.239252	d2780e41	116	29	1.0000	DISCARD	gen=297 glyphs=4
2026-03-14T00:33:42.515968	b7aed8e9	116	29	1.0000	DISCARD	gen=341 glyphs=4
2026-03-14T00:33:45.006228	bfdf7cad	120	30	1.0000	DISCARD	gen=297 glyphs=4
2026-03-14T00:33:45.275571	0eaef5a7	116	29	1.0000	DISCARD	gen=341 glyphs=4
2026-03-14T00:33:47.754696	5a06ca32	120	30	1.0000	DISCARD	gen=297 glyphs=4
2026-03-14T00:33:48.014811	0eaedb57	116	29	1.0000	DISCARD	gen=341 glyphs=4
2026-03-14T00:33:50.473133	37f4017b	116	29	1.0000	DISCARD	gen=298 glyphs=4
2026-03-14T00:33:50.739279	8aef8872	116	29	1.0000	DISCARD	gen=341 glyphs=4
2026-03-14T00:33:53.216142	bfdf7cad	120	30	1.0000	DISCARD	gen=298 glyphs=4
2026-03-14T00:33:53.487714	19355583	120	30	1.0000	DISCARD	gen=342 glyphs=4
2026-03-14T00:33:55.944740	37f4017b	116	29	1.0000	DISCARD	gen=298 glyphs=4
2026-03-14T00:33:56.224315	8aef8872	116	29	1.0000	DISCARD	gen=342 glyphs=4
2026-03-14T00:33:58.691581	37f4017b	116	29	1.0000	DISCARD	gen=298 glyphs=4
2026-03-14T00:33:58.963775	2615b719	120	30	1.0000	DISCARD	gen=342 glyphs=4
2026-03-14T00:34:01.450923	37f4017b	116	29	1.0000	DISCARD	gen=298 glyphs=4
2026-03-14T00:34:01.725437	67cb81be	120	30	1.0000	DISCARD	gen=342 glyphs=4
2026-03-14T00:34:04.251589	55d6c151	120	30	1.0000	DISCARD	gen=298 glyphs=4
2026-03-14T00:34:04.531710	9e34ede0	116	29	1.0000	DISCARD	gen=342 glyphs=4
2026-03-14T00:34:07.019358	12b38c2d	116	29	1.0000	DISCARD	gen=298 glyphs=4
2026-03-14T00:34:07.289606	050862ad	120	30	1.0000	DISCARD	gen=342 glyphs=4
2026-03-14T00:34:09.772780	55d6c151	120	30	1.0000	DISCARD	gen=298 glyphs=4
2026-03-14T00:34:10.041185	8aef8872	116	29	1.0000	DISCARD	gen=342 glyphs=4
2026-03-14T00:34:12.528618	5a06ca32	120	30	1.0000	DISCARD	gen=298 glyphs=4
2026-03-14T00:34:12.801467	8aef8872	116	29	1.0000	DISCARD	gen=342 glyphs=4
2026-03-14T00:34:15.243379	37f4017b	116	29	1.0000	DISCARD	gen=298 glyphs=4
2026-03-14T00:34:15.528422	19355583	120	30	1.0000	DISCARD	gen=342 glyphs=4
2026-03-14T00:34:18.001068	37f4017b	116	29	1.0000	DISCARD	gen=299 glyphs=4
2026-03-14T00:34:18.272730	2d1bf9b9	116	29	1.0000	DISCARD	gen=342 glyphs=4
2026-03-14T00:34:20.749868	bfdf7cad	120	30	1.0000	DISCARD	gen=299 glyphs=4
2026-03-14T00:34:21.026102	19355583	120	30	1.0000	DISCARD	gen=343 glyphs=4
2026-03-14T00:34:23.483277	9a873826	120	30	1.0000	DISCARD	gen=299 glyphs=4
2026-03-14T00:34:23.752892	8aef8872	116	29	1.0000	DISCARD	gen=343 glyphs=4
2026-03-14T00:34:26.208863	37f4017b	116	29	1.0000	DISCARD	gen=299 glyphs=4
2026-03-14T00:34:26.482285	eca7ab6c	116	29	1.0000	DISCARD	gen=343 glyphs=4
2026-03-14T00:34:28.959730	0f01882e	116	29	0.9500	DISCARD	gen=299 glyphs=4
2026-03-14T00:34:29.227642	f261fbb0	120	30	1.0000	DISCARD	gen=343 glyphs=4
2026-03-14T00:34:31.684340	d11c1062	120	30	1.0000	DISCARD	gen=299 glyphs=4
2026-03-14T00:34:31.951731	50dc991d	116	29	1.0000	DISCARD	gen=343 glyphs=4
2026-03-14T00:34:34.429077	55d6c151	120	30	1.0000	DISCARD	gen=299 glyphs=4
2026-03-14T00:34:34.734907	b57e7176	120	30	1.0000	DISCARD	gen=343 glyphs=4
2026-03-14T00:34:37.240410	5a06ca32	120	30	1.0000	DISCARD	gen=299 glyphs=4
2026-03-14T00:34:37.505232	b7aed8e9	116	29	1.0000	DISCARD	gen=343 glyphs=4
2026-03-14T00:34:39.964746	4c9b0dd4	120	30	1.0000	DISCARD	gen=299 glyphs=4
2026-03-14T00:34:40.237164	e8e2063d	120	30	1.0000	DISCARD	gen=343 glyphs=4
2026-03-14T00:34:42.703059	5a06ca32	120	30	1.0000	DISCARD	gen=299 glyphs=4
2026-03-14T00:34:42.982536	050862ad	120	30	1.0000	DISCARD	gen=343 glyphs=4
2026-03-14T00:34:45.429915	37f4017b	116	29	1.0000	DISCARD	gen=300 glyphs=4
2026-03-14T00:34:45.704368	d7c8681b	120	30	1.0000	DISCARD	gen=343 glyphs=4
2026-03-14T00:34:48.180342	bfdf7cad	120	30	1.0000	DISCARD	gen=300 glyphs=4
2026-03-14T00:34:48.457276	19355583	120	30	1.0000	DISCARD	gen=344 glyphs=4
2026-03-14T00:34:50.938453	5b9807ac	120	30	1.0000	DISCARD	gen=300 glyphs=4
2026-03-14T00:34:51.223404	8aef8872	116	29	1.0000	DISCARD	gen=344 glyphs=4
2026-03-14T00:34:53.711405	7ca87b42	116	29	1.0000	DISCARD	gen=300 glyphs=4
2026-03-14T00:34:53.984753	4e86f752	120	30	1.0000	DISCARD	gen=344 glyphs=4
2026-03-14T00:34:56.422506	e448eaa8	116	29	1.0000	DISCARD	gen=300 glyphs=4
2026-03-14T00:34:56.687242	898adcf9	120	30	1.0000	DISCARD	gen=344 glyphs=4
2026-03-14T00:34:59.129314	fdb5d108	120	30	1.0000	DISCARD	gen=300 glyphs=4
2026-03-14T00:34:59.401733	f8ef4979	120	30	0.9500	DISCARD	gen=344 glyphs=4
2026-03-14T00:35:01.859620	bfdf7cad	120	30	1.0000	DISCARD	gen=300 glyphs=4
2026-03-14T00:35:02.122549	19355583	120	30	1.0000	DISCARD	gen=344 glyphs=4
