timestamp	program_hash	spirv_size	word_count	fitness	status	description
2026-03-14T02:01:35.019111	7944780e	116	29	1.0000	DISCARD	gen=490 glyphs=4
2026-03-14T02:01:35.298967	0eaedb57	116	29	1.0000	DISCARD	gen=534 glyphs=4
2026-03-14T02:01:37.772442	5b9807ac	120	30	1.0000	DISCARD	gen=490 glyphs=4
2026-03-14T02:01:38.044036	b57e7176	120	30	1.0000	DISCARD	gen=534 glyphs=4
2026-03-14T02:01:40.457297	e7d7fc49	116	29	1.0000	DISCARD	gen=490 glyphs=4
2026-03-14T02:01:40.731052	050862ad	120	30	1.0000	DISCARD	gen=534 glyphs=4
2026-03-14T02:01:43.171659	37f4017b	116	29	1.0000	DISCARD	gen=490 glyphs=4
2026-03-14T02:01:43.435661	eca7ab6c	116	29	1.0000	DISCARD	gen=534 glyphs=4
2026-03-14T02:01:45.848057	55d6c151	120	30	1.0000	DISCARD	gen=490 glyphs=4
2026-03-14T02:01:46.113801	e3264c15	120	30	1.0000	DISCARD	gen=534 glyphs=4
2026-03-14T02:01:48.558176	37f4017b	116	29	1.0000	DISCARD	gen=491 glyphs=4
2026-03-14T02:01:48.830760	19355583	120	30	1.0000	DISCARD	gen=534 glyphs=4
2026-03-14T02:01:51.232390	bfdf7cad	120	30	1.0000	DISCARD	gen=491 glyphs=4
2026-03-14T02:01:51.498322	19355583	120	30	1.0000	DISCARD	gen=535 glyphs=4
2026-03-14T02:01:53.913172	fdb5d108	120	30	1.0000	DISCARD	gen=491 glyphs=4
2026-03-14T02:01:54.173471	8aef8872	116	29	1.0000	DISCARD	gen=535 glyphs=4
2026-03-14T02:01:56.644568	1d34459a	116	29	1.0000	DISCARD	gen=491 glyphs=4
2026-03-14T02:01:56.915097	67cb81be	120	30	1.0000	DISCARD	gen=535 glyphs=4
2026-03-14T02:01:59.335940	d11c1062	120	30	1.0000	DISCARD	gen=491 glyphs=4
2026-03-14T02:01:59.609193	a4cb84ba	120	30	1.0000	DISCARD	gen=535 glyphs=4
2026-03-14T02:02:02.033069	1d34459a	116	29	1.0000	DISCARD	gen=491 glyphs=4
2026-03-14T02:02:02.302070	eca7ab6c	116	29	1.0000	DISCARD	gen=535 glyphs=4
2026-03-14T02:02:04.714414	fdb5d108	120	30	1.0000	DISCARD	gen=491 glyphs=4
2026-03-14T02:02:04.977816	050862ad	120	30	1.0000	DISCARD	gen=535 glyphs=4
2026-03-14T02:02:07.497197	5a06ca32	120	30	1.0000	DISCARD	gen=491 glyphs=4
2026-03-14T02:02:07.760023	50dc991d	116	29	1.0000	DISCARD	gen=535 glyphs=4
2026-03-14T02:02:10.182334	bfdf7cad	120	30	1.0000	DISCARD	gen=491 glyphs=4
2026-03-14T02:02:10.440195	908f3f69	120	30	1.0000	DISCARD	gen=535 glyphs=4
2026-03-14T02:02:12.954466	71e2ba66	116	29	1.0000	DISCARD	gen=491 glyphs=4
2026-03-14T02:02:13.255136	67cb81be	120	30	1.0000	DISCARD	gen=535 glyphs=4
2026-03-14T02:02:15.883491	37f4017b	116	29	1.0000	DISCARD	gen=492 glyphs=4
2026-03-14T02:02:16.168679	d73f9b86	116	29	1.0000	DISCARD	gen=535 glyphs=4
2026-03-14T02:02:18.634164	bfdf7cad	120	30	1.0000	DISCARD	gen=492 glyphs=4
2026-03-14T02:02:18.899774	19355583	120	30	1.0000	DISCARD	gen=536 glyphs=4
2026-03-14T02:02:21.392846	5a06ca32	120	30	1.0000	DISCARD	gen=492 glyphs=4
2026-03-14T02:02:21.661764	8aef8872	116	29	1.0000	DISCARD	gen=536 glyphs=4
2026-03-14T02:02:24.135729	fdb5d108	120	30	1.0000	DISCARD	gen=492 glyphs=4
2026-03-14T02:02:24.395201	1e5f0e21	116	29	1.0000	DISCARD	gen=536 glyphs=4
2026-03-14T02:02:26.857535	b1795e53	116	29	1.0000	DISCARD	gen=492 glyphs=4
2026-03-14T02:02:27.131374	a78f9454	120	30	1.0000	DISCARD	gen=536 glyphs=4
2026-03-14T02:02:29.594363	1aedc420	116	29	1.0000	DISCARD	gen=492 glyphs=4
2026-03-14T02:02:29.858797	eca7ab6c	116	29	1.0000	DISCARD	gen=536 glyphs=4
2026-03-14T02:02:32.325423	569bd032	116	29	1.0000	DISCARD	gen=492 glyphs=4
2026-03-14T02:02:32.602505	d7c8681b	120	30	1.0000	DISCARD	gen=536 glyphs=4
2026-03-14T02:02:35.053822	fdb5d108	120	30	1.0000	DISCARD	gen=492 glyphs=4
2026-03-14T02:02:35.326467	53411e0a	120	30	1.0000	DISCARD	gen=536 glyphs=4
2026-03-14T02:02:37.846066	37f4017b	116	29	1.0000	DISCARD	gen=492 glyphs=4
2026-03-14T02:02:38.117168	50dc991d	116	29	1.0000	DISCARD	gen=536 glyphs=4
2026-03-14T02:02:40.618748	5b9807ac	120	30	1.0000	DISCARD	gen=492 glyphs=4
2026-03-14T02:02:40.912667	875e0f8a	116	29	1.0000	DISCARD	gen=536 glyphs=4
2026-03-14T02:02:43.395339	37f4017b	116	29	1.0000	DISCARD	gen=493 glyphs=4
2026-03-14T02:02:43.665100	eca7ab6c	116	29	1.0000	DISCARD	gen=536 glyphs=4
2026-03-14T02:02:46.144701	bfdf7cad	120	30	1.0000	DISCARD	gen=493 glyphs=4
2026-03-14T02:02:46.417995	19355583	120	30	1.0000	DISCARD	gen=537 glyphs=4
2026-03-14T02:02:48.873113	d11c1062	120	30	1.0000	DISCARD	gen=493 glyphs=4
2026-03-14T02:02:49.149493	8aef8872	116	29	1.0000	DISCARD	gen=537 glyphs=4
2026-03-14T02:02:51.637294	9b1c51f8	120	30	1.0000	DISCARD	gen=493 glyphs=4
2026-03-14T02:02:51.905792	ae44ace5	116	29	1.0000	DISCARD	gen=537 glyphs=4
2026-03-14T02:02:54.393619	5a06ca32	120	30	1.0000	DISCARD	gen=493 glyphs=4
2026-03-14T02:02:54.676186	875e0f8a	116	29	1.0000	DISCARD	gen=537 glyphs=4
2026-03-14T02:02:57.159691	37f4017b	116	29	1.0000	DISCARD	gen=493 glyphs=4
2026-03-14T02:02:57.435950	0eaedb57	116	29	1.0000	DISCARD	gen=537 glyphs=4
2026-03-14T02:02:59.893412	37f4017b	116	29	1.0000	DISCARD	gen=493 glyphs=4
2026-03-14T02:03:00.170642	8aef8872	116	29	1.0000	DISCARD	gen=537 glyphs=4
2026-03-14T02:03:02.685943	f6906b08	116	29	0.9500	DISCARD	gen=493 glyphs=4
2026-03-14T02:03:02.957526	0eaedb57	116	29	1.0000	DISCARD	gen=537 glyphs=4
2026-03-14T02:03:05.443028	fdb5d108	120	30	1.0000	DISCARD	gen=493 glyphs=4
2026-03-14T02:03:05.713357	a78f9454	120	30	1.0000	DISCARD	gen=537 glyphs=4
2026-03-14T02:03:08.214646	bfdf7cad	120	30	1.0000	DISCARD	gen=493 glyphs=4
2026-03-14T02:03:08.486557	ae44ace5	116	29	1.0000	DISCARD	gen=537 glyphs=4
2026-03-14T02:03:11.070600	37f4017b	116	29	1.0000	DISCARD	gen=494 glyphs=4
2026-03-14T02:03:11.355338	f319d391	116	29	0.9500	DISCARD	gen=537 glyphs=4
2026-03-14T02:03:13.799974	bfdf7cad	120	30	1.0000	DISCARD	gen=494 glyphs=4
2026-03-14T02:03:14.073806	19355583	120	30	1.0000	DISCARD	gen=538 glyphs=4
2026-03-14T02:03:16.530265	55d6c151	120	30	1.0000	DISCARD	gen=494 glyphs=4
2026-03-14T02:03:16.822134	8aef8872	116	29	1.0000	DISCARD	gen=538 glyphs=4
2026-03-14T02:03:19.309019	7ca87b42	116	29	1.0000	DISCARD	gen=494 glyphs=4
2026-03-14T02:03:19.583055	19355583	120	30	1.0000	DISCARD	gen=538 glyphs=4
2026-03-14T02:03:22.040987	55d6c151	120	30	1.0000	DISCARD	gen=494 glyphs=4
2026-03-14T02:03:22.311952	ea7579ba	124	31	0.9500	DISCARD	gen=538 glyphs=4
2026-03-14T02:03:24.791344	55d6c151	120	30	1.0000	DISCARD	gen=494 glyphs=4
2026-03-14T02:03:25.059982	67cb81be	120	30	1.0000	DISCARD	gen=538 glyphs=4
2026-03-14T02:03:27.545989	1d34459a	116	29	1.0000	DISCARD	gen=494 glyphs=4
2026-03-14T02:03:27.811136	8aef8872	116	29	1.0000	DISCARD	gen=538 glyphs=4
2026-03-14T02:03:30.321381	40092223	116	29	1.0000	DISCARD	gen=494 glyphs=4
2026-03-14T02:03:30.593593	a78f9454	120	30	1.0000	DISCARD	gen=538 glyphs=4
2026-03-14T02:03:33.074875	9412c2b1	116	29	1.0000	DISCARD	gen=494 glyphs=4
2026-03-14T02:03:33.349220	19355583	120	30	1.0000	DISCARD	gen=538 glyphs=4
2026-03-14T02:03:35.831000	cb4a282c	116	29	1.0000	DISCARD	gen=494 glyphs=4
2026-03-14T02:03:36.103307	8aef8872	116	29	1.0000	DISCARD	gen=538 glyphs=4
2026-03-14T02:03:38.566393	37f4017b	116	29	1.0000	DISCARD	gen=495 glyphs=4
2026-03-14T02:03:38.848582	8aef8872	116	29	1.0000	DISCARD	gen=538 glyphs=4
2026-03-14T02:03:41.335557	bfdf7cad	120	30	1.0000	DISCARD	gen=495 glyphs=4
2026-03-14T02:03:41.613644	19355583	120	30	1.0000	DISCARD	gen=539 glyphs=4
2026-03-14T02:03:44.110878	b176abd1	116	29	1.0000	DISCARD	gen=495 glyphs=4
2026-03-14T02:03:44.387806	8aef8872	116	29	1.0000	DISCARD	gen=539 glyphs=4
2026-03-14T02:03:46.818487	fdb5d108	120	30	1.0000	DISCARD	gen=495 glyphs=4
2026-03-14T02:03:47.086541	af345db0	116	29	1.0000	DISCARD	gen=539 glyphs=4
2026-03-14T02:03:49.532928	37f4017b	116	29	1.0000	DISCARD	gen=495 glyphs=4
2026-03-14T02:03:49.793474	d7c8681b	120	30	1.0000	DISCARD	gen=539 glyphs=4
2026-03-14T02:03:52.269866	ab047fe9	120	30	1.0000	DISCARD	gen=495 glyphs=4
2026-03-14T02:03:52.547562	f5ce218d	116	29	1.0000	DISCARD	gen=539 glyphs=4
2026-03-14T02:03:54.998174	fdb5d108	120	30	1.0000	DISCARD	gen=495 glyphs=4
2026-03-14T02:03:55.291320	e2cd28ea	120	30	1.0000	DISCARD	gen=539 glyphs=4
2026-03-14T02:03:57.735886	37f4017b	116	29	1.0000	DISCARD	gen=495 glyphs=4
2026-03-14T02:03:58.008995	50dc991d	116	29	1.0000	DISCARD	gen=539 glyphs=4
2026-03-14T02:04:00.487785	71e2ba66	116	29	1.0000	DISCARD	gen=495 glyphs=4
2026-03-14T02:04:00.759706	ae44ace5	116	29	1.0000	DISCARD	gen=539 glyphs=4
2026-03-14T02:04:03.200332	bfdf7cad	120	30	1.0000	DISCARD	gen=495 glyphs=4
2026-03-14T02:04:03.482595	92316804	116	29	1.0000	DISCARD	gen=539 glyphs=4
2026-03-14T02:04:05.945029	37f4017b	116	29	1.0000	DISCARD	gen=496 glyphs=4
2026-03-14T02:04:06.236119	de39246f	116	29	1.0000	DISCARD	gen=539 glyphs=4
2026-03-14T02:04:08.703686	bfdf7cad	120	30	1.0000	DISCARD	gen=496 glyphs=4
2026-03-14T02:04:08.986760	19355583	120	30	1.0000	DISCARD	gen=540 glyphs=4
2026-03-14T02:04:11.474539	d11c1062	120	30	1.0000	DISCARD	gen=496 glyphs=4
2026-03-14T02:04:11.739357	8aef8872	116	29	1.0000	DISCARD	gen=540 glyphs=4
2026-03-14T02:04:14.286346	7b68de09	120	30	1.0000	DISCARD	gen=496 glyphs=4
2026-03-14T02:04:14.557884	0eaedb57	116	29	1.0000	DISCARD	gen=540 glyphs=4
2026-03-14T02:04:17.040193	38888626	120	30	1.0000	DISCARD	gen=496 glyphs=4
2026-03-14T02:04:17.320527	e2cd28ea	120	30	1.0000	DISCARD	gen=540 glyphs=4
2026-03-14T02:04:20.011997	55d6c151	120	30	1.0000	DISCARD	gen=496 glyphs=4
2026-03-14T02:04:20.280991	50dc991d	116	29	1.0000	DISCARD	gen=540 glyphs=4
2026-03-14T02:04:22.765596	1d34459a	116	29	1.0000	DISCARD	gen=496 glyphs=4
2026-03-14T02:04:23.041745	8aef8872	116	29	1.0000	DISCARD	gen=540 glyphs=4
2026-03-14T02:04:25.626626	5b9807ac	120	30	1.0000	DISCARD	gen=496 glyphs=4
2026-03-14T02:04:25.900028	d7c8681b	120	30	1.0000	DISCARD	gen=540 glyphs=4
2026-03-14T02:04:28.389348	5a06ca32	120	30	1.0000	DISCARD	gen=496 glyphs=4
2026-03-14T02:04:28.678831	b57e7176	120	30	1.0000	DISCARD	gen=540 glyphs=4
2026-03-14T02:04:31.133291	ce3b4f2a	116	29	1.0000	DISCARD	gen=496 glyphs=4
2026-03-14T02:04:31.407320	1e5f0e21	116	29	1.0000	DISCARD	gen=540 glyphs=4
2026-03-14T02:04:33.878347	37f4017b	116	29	1.0000	DISCARD	gen=497 glyphs=4
2026-03-14T02:04:34.151616	875e0f8a	116	29	1.0000	DISCARD	gen=540 glyphs=4
2026-03-14T02:04:36.630919	bfdf7cad	120	30	1.0000	DISCARD	gen=497 glyphs=4
2026-03-14T02:04:36.907213	19355583	120	30	1.0000	DISCARD	gen=541 glyphs=4
2026-03-14T02:04:39.508978	87fb3c8d	116	29	1.0000	DISCARD	gen=497 glyphs=4
2026-03-14T02:04:39.778105	8aef8872	116	29	1.0000	DISCARD	gen=541 glyphs=4
2026-03-14T02:04:42.228765	12b38c2d	116	29	1.0000	DISCARD	gen=497 glyphs=4
2026-03-14T02:04:42.498463	0eaedb57	116	29	1.0000	DISCARD	gen=541 glyphs=4
2026-03-14T02:04:44.989173	98ec1412	116	29	1.0000	DISCARD	gen=497 glyphs=4
2026-03-14T02:04:45.260932	50dc991d	116	29	1.0000	DISCARD	gen=541 glyphs=4
2026-03-14T02:04:47.768222	0f422aa9	120	30	1.0000	DISCARD	gen=497 glyphs=4
2026-03-14T02:04:48.037079	875e0f8a	116	29	1.0000	DISCARD	gen=541 glyphs=4
2026-03-14T02:04:50.518801	37f4017b	116	29	1.0000	DISCARD	gen=497 glyphs=4
2026-03-14T02:04:50.805076	1cfcb252	116	29	1.0000	DISCARD	gen=541 glyphs=4
2026-03-14T02:04:53.316748	bfdf7cad	120	30	1.0000	DISCARD	gen=497 glyphs=4
2026-03-14T02:04:53.588916	1e5f0e21	116	29	1.0000	DISCARD	gen=541 glyphs=4
2026-03-14T02:04:56.067260	4fbd5203	120	30	0.9500	DISCARD	gen=497 glyphs=4
2026-03-14T02:04:56.329863	8aef8872	116	29	1.0000	DISCARD	gen=541 glyphs=4
2026-03-14T02:04:58.784044	aac95fb5	120	30	1.0000	DISCARD	gen=497 glyphs=4
2026-03-14T02:04:59.058422	9e34ede0	116	29	1.0000	DISCARD	gen=541 glyphs=4
2026-03-14T02:05:01.507939	37f4017b	116	29	1.0000	DISCARD	gen=498 glyphs=4
2026-03-14T02:05:01.781873	8aef8872	116	29	1.0000	DISCARD	gen=541 glyphs=4
2026-03-14T02:05:04.275161	bfdf7cad	120	30	1.0000	DISCARD	gen=498 glyphs=4
2026-03-14T02:05:04.560472	19355583	120	30	1.0000	DISCARD	gen=542 glyphs=4
2026-03-14T02:05:07.105516	5a06ca32	120	30	1.0000	DISCARD	gen=498 glyphs=4
2026-03-14T02:05:07.376866	8aef8872	116	29	1.0000	DISCARD	gen=542 glyphs=4
2026-03-14T02:05:09.847738	37f4017b	116	29	1.0000	DISCARD	gen=498 glyphs=4
2026-03-14T02:05:10.116161	e2cd28ea	120	30	1.0000	DISCARD	gen=542 glyphs=4
2026-03-14T02:05:12.557415	5a06ca32	120	30	1.0000	DISCARD	gen=498 glyphs=4
2026-03-14T02:05:12.832992	1e5f0e21	116	29	1.0000	DISCARD	gen=542 glyphs=4
2026-03-14T02:05:15.323830	d65d4709	116	29	1.0000	DISCARD	gen=498 glyphs=4
2026-03-14T02:05:15.605107	8aef8872	116	29	1.0000	DISCARD	gen=542 glyphs=4
2026-03-14T02:05:18.149077	37f4017b	116	29	1.0000	DISCARD	gen=498 glyphs=4
2026-03-14T02:05:18.428683	d7c8681b	120	30	1.0000	DISCARD	gen=542 glyphs=4
2026-03-14T02:05:20.899077	5b9807ac	120	30	1.0000	DISCARD	gen=498 glyphs=4
2026-03-14T02:05:21.181899	19355583	120	30	1.0000	DISCARD	gen=542 glyphs=4
2026-03-14T02:05:23.651031	7be8dacd	120	30	1.0000	DISCARD	gen=498 glyphs=4
2026-03-14T02:05:23.922628	8aef8872	116	29	1.0000	DISCARD	gen=542 glyphs=4
2026-03-14T02:05:26.374144	d84b9757	116	29	1.0000	DISCARD	gen=498 glyphs=4
2026-03-14T02:05:26.649216	875e0f8a	116	29	1.0000	DISCARD	gen=542 glyphs=4
2026-03-14T02:05:29.111994	37f4017b	116	29	1.0000	DISCARD	gen=499 glyphs=4
2026-03-14T02:05:29.396039	b7aed8e9	116	29	1.0000	DISCARD	gen=542 glyphs=4
2026-03-14T02:05:31.893439	bfdf7cad	120	30	1.0000	DISCARD	gen=499 glyphs=4
2026-03-14T02:05:32.161149	19355583	120	30	1.0000	DISCARD	gen=543 glyphs=4
2026-03-14T02:05:34.615881	70962b3d	116	29	1.0000	DISCARD	gen=499 glyphs=4
2026-03-14T02:05:34.898735	8aef8872	116	29	1.0000	DISCARD	gen=543 glyphs=4
2026-03-14T02:05:37.369651	cd48049d	116	29	1.0000	DISCARD	gen=499 glyphs=4
2026-03-14T02:05:37.638042	19355583	120	30	1.0000	DISCARD	gen=543 glyphs=4
2026-03-14T02:05:40.097796	d11c1062	120	30	1.0000	DISCARD	gen=499 glyphs=4
2026-03-14T02:05:40.381755	1e5f0e21	116	29	1.0000	DISCARD	gen=543 glyphs=4
2026-03-14T02:05:42.843342	5a06ca32	120	30	1.0000	DISCARD	gen=499 glyphs=4
2026-03-14T02:05:43.118649	a78f9454	120	30	1.0000	DISCARD	gen=543 glyphs=4
2026-03-14T02:05:45.564393	9d07ccda	116	29	1.0000	DISCARD	gen=499 glyphs=4
2026-03-14T02:05:45.840232	19355583	120	30	1.0000	DISCARD	gen=543 glyphs=4
2026-03-14T02:05:48.305933	e0d94fe6	120	30	1.0000	DISCARD	gen=499 glyphs=4
2026-03-14T02:05:48.615741	19355583	120	30	1.0000	DISCARD	gen=543 glyphs=4
2026-03-14T02:05:51.137428	dee23f58	116	29	1.0000	DISCARD	gen=499 glyphs=4
2026-03-14T02:05:51.410217	b7aed8e9	116	29	1.0000	DISCARD	gen=543 glyphs=4
2026-03-14T02:05:53.843332	d6262788	116	29	1.0000	DISCARD	gen=499 glyphs=4
2026-03-14T02:05:54.103788	875e0f8a	116	29	1.0000	DISCARD	gen=543 glyphs=4
2026-03-14T02:05:56.569226	37f4017b	116	29	1.0000	DISCARD	gen=500 glyphs=4
2026-03-14T02:05:56.835280	19355583	120	30	1.0000	DISCARD	gen=543 glyphs=4
2026-03-14T02:05:59.306618	bfdf7cad	120	30	1.0000	DISCARD	gen=500 glyphs=4
2026-03-14T02:05:59.594738	19355583	120	30	1.0000	DISCARD	gen=544 glyphs=4
2026-03-14T02:06:02.070456	a5c67f3b	120	30	0.9500	DISCARD	gen=500 glyphs=4
2026-03-14T02:06:02.338367	8aef8872	116	29	1.0000	DISCARD	gen=544 glyphs=4
2026-03-14T02:06:04.828802	4c9b0dd4	120	30	1.0000	DISCARD	gen=500 glyphs=4
2026-03-14T02:06:05.096822	a59c74e0	120	30	1.0000	DISCARD	gen=544 glyphs=4
2026-03-14T02:06:07.565116	37f4017b	116	29	1.0000	DISCARD	gen=500 glyphs=4
2026-03-14T02:06:07.832969	9e34ede0	116	29	1.0000	DISCARD	gen=544 glyphs=4
2026-03-14T02:06:10.310912	5a06ca32	120	30	1.0000	DISCARD	gen=500 glyphs=4
2026-03-14T02:06:10.594580	c231d4d6	116	29	1.0000	DISCARD	gen=544 glyphs=4
2026-03-14T02:06:13.036288	bfdf7cad	120	30	1.0000	DISCARD	gen=500 glyphs=4
2026-03-14T02:06:13.308467	b7aed8e9	116	29	1.0000	DISCARD	gen=544 glyphs=4
2026-03-14T02:06:15.779470	5a06ca32	120	30	1.0000	DISCARD	gen=500 glyphs=4
2026-03-14T02:06:16.046583	9e34ede0	116	29	1.0000	DISCARD	gen=544 glyphs=4
2026-03-14T02:06:18.527559	4c9b0dd4	120	30	1.0000	DISCARD	gen=500 glyphs=4
2026-03-14T02:06:18.791978	875e0f8a	116	29	1.0000	DISCARD	gen=544 glyphs=4
2026-03-14T02:06:21.322462	5a06ca32	120	30	1.0000	DISCARD	gen=500 glyphs=4
2026-03-14T02:06:21.596719	25ba88be	116	29	1.0000	DISCARD	gen=544 glyphs=4
2026-03-14T02:06:24.084027	37f4017b	116	29	1.0000	DISCARD	gen=501 glyphs=4
2026-03-14T02:06:24.366987	19355583	120	30	1.0000	DISCARD	gen=544 glyphs=4
2026-03-14T02:06:26.862392	bfdf7cad	120	30	1.0000	DISCARD	gen=501 glyphs=4
2026-03-14T02:06:27.146742	19355583	120	30	1.0000	DISCARD	gen=545 glyphs=4
2026-03-14T02:06:29.604836	04f1e9b5	116	29	1.0000	DISCARD	gen=501 glyphs=4
2026-03-14T02:06:29.878175	8aef8872	116	29	1.0000	DISCARD	gen=545 glyphs=4
2026-03-14T02:06:32.361428	37f4017b	116	29	1.0000	DISCARD	gen=501 glyphs=4
2026-03-14T02:06:32.642492	50dc991d	116	29	1.0000	DISCARD	gen=545 glyphs=4
2026-03-14T02:06:35.114360	55d6c151	120	30	1.0000	DISCARD	gen=501 glyphs=4
2026-03-14T02:06:35.390549	e4228eef	116	29	1.0000	DISCARD	gen=545 glyphs=4
2026-03-14T02:06:37.857263	8595ff92	116	29	1.0000	DISCARD	gen=501 glyphs=4
2026-03-14T02:06:38.128970	7aebd483	116	29	1.0000	DISCARD	gen=545 glyphs=4
2026-03-14T02:06:40.579799	55d6c151	120	30	1.0000	DISCARD	gen=501 glyphs=4
2026-03-14T02:06:40.843706	19355583	120	30	1.0000	DISCARD	gen=545 glyphs=4
2026-03-14T02:06:43.325500	5b9807ac	120	30	1.0000	DISCARD	gen=501 glyphs=4
2026-03-14T02:06:43.593292	71f13e2a	116	29	1.0000	DISCARD	gen=545 glyphs=4
2026-03-14T02:06:46.080534	5a06ca32	120	30	1.0000	DISCARD	gen=501 glyphs=4
2026-03-14T02:06:46.357144	2e78b5b6	116	29	1.0000	DISCARD	gen=545 glyphs=4
2026-03-14T02:06:48.812329	37f4017b	116	29	1.0000	DISCARD	gen=501 glyphs=4
2026-03-14T02:06:49.093712	b7aed8e9	116	29	1.0000	DISCARD	gen=545 glyphs=4
2026-03-14T02:06:51.550151	37f4017b	116	29	1.0000	DISCARD	gen=502 glyphs=4
2026-03-14T02:06:51.829894	050862ad	120	30	1.0000	DISCARD	gen=545 glyphs=4
2026-03-14T02:06:54.387283	bfdf7cad	120	30	1.0000	DISCARD	gen=502 glyphs=4
2026-03-14T02:06:54.664249	19355583	120	30	1.0000	DISCARD	gen=546 glyphs=4
2026-03-14T02:06:57.143457	37f4017b	116	29	1.0000	DISCARD	gen=502 glyphs=4
2026-03-14T02:06:57.418090	8aef8872	116	29	1.0000	DISCARD	gen=546 glyphs=4
2026-03-14T02:06:59.853549	f078923d	116	29	1.0000	DISCARD	gen=502 glyphs=4
2026-03-14T02:07:00.131672	8aef8872	116	29	1.0000	DISCARD	gen=546 glyphs=4
2026-03-14T02:07:02.604433	5a06ca32	120	30	1.0000	DISCARD	gen=502 glyphs=4
2026-03-14T02:07:02.878356	0a9a3316	120	30	1.0000	DISCARD	gen=546 glyphs=4
2026-03-14T02:07:05.322980	7ca87b42	116	29	1.0000	DISCARD	gen=502 glyphs=4
2026-03-14T02:07:05.596363	1ae647b5	116	29	1.0000	DISCARD	gen=546 glyphs=4
2026-03-14T02:07:08.056489	37f4017b	116	29	1.0000	DISCARD	gen=502 glyphs=4
2026-03-14T02:07:08.347979	76fbdabf	120	30	1.0000	DISCARD	gen=546 glyphs=4
2026-03-14T02:07:10.803901	55d6c151	120	30	1.0000	DISCARD	gen=502 glyphs=4
2026-03-14T02:07:11.088412	eca7ab6c	116	29	1.0000	DISCARD	gen=546 glyphs=4
2026-03-14T02:07:13.561960	5a06ca32	120	30	1.0000	DISCARD	gen=502 glyphs=4
2026-03-14T02:07:13.839291	838512a4	116	29	1.0000	DISCARD	gen=546 glyphs=4
2026-03-14T02:07:16.289203	a20e392d	120	30	1.0000	DISCARD	gen=502 glyphs=4
2026-03-14T02:07:16.567075	e2cd28ea	120	30	1.0000	DISCARD	gen=546 glyphs=4
2026-03-14T02:07:19.019601	37f4017b	116	29	1.0000	DISCARD	gen=503 glyphs=4
2026-03-14T02:07:19.292302	19355583	120	30	1.0000	DISCARD	gen=546 glyphs=4
2026-03-14T02:07:21.771777	bfdf7cad	120	30	1.0000	DISCARD	gen=503 glyphs=4
2026-03-14T02:07:22.041291	19355583	120	30	1.0000	DISCARD	gen=547 glyphs=4
2026-03-14T02:07:24.563501	fdb5d108	120	30	1.0000	DISCARD	gen=503 glyphs=4
2026-03-14T02:07:24.846557	8aef8872	116	29	1.0000	DISCARD	gen=547 glyphs=4
2026-03-14T02:07:27.329610	9cab9cad	116	29	1.0000	DISCARD	gen=503 glyphs=4
2026-03-14T02:07:27.608347	8f69757f	116	29	1.0000	DISCARD	gen=547 glyphs=4
2026-03-14T02:07:30.069535	71e2ba66	116	29	1.0000	DISCARD	gen=503 glyphs=4
2026-03-14T02:07:30.341936	b57e7176	120	30	1.0000	DISCARD	gen=547 glyphs=4
2026-03-14T02:07:32.798765	2701cb73	116	29	1.0000	DISCARD	gen=503 glyphs=4
2026-03-14T02:07:33.085846	eca7ab6c	116	29	1.0000	DISCARD	gen=547 glyphs=4
2026-03-14T02:07:35.539184	1c3b9be1	116	29	1.0000	DISCARD	gen=503 glyphs=4
2026-03-14T02:07:35.810467	dd699e71	120	30	1.0000	DISCARD	gen=547 glyphs=4
2026-03-14T02:07:38.293073	60e471b7	120	30	1.0000	DISCARD	gen=503 glyphs=4
2026-03-14T02:07:38.570328	eca7ab6c	116	29	1.0000	DISCARD	gen=547 glyphs=4
2026-03-14T02:07:41.042319	bd57ecb4	116	29	1.0000	DISCARD	gen=503 glyphs=4
2026-03-14T02:07:41.308745	e8c7f6cf	120	30	1.0000	DISCARD	gen=547 glyphs=4
2026-03-14T02:07:43.779740	37f4017b	116	29	1.0000	DISCARD	gen=503 glyphs=4
2026-03-14T02:07:44.051851	7ef246bc	116	29	1.0000	DISCARD	gen=547 glyphs=4
2026-03-14T02:07:46.511973	37f4017b	116	29	1.0000	DISCARD	gen=504 glyphs=4
2026-03-14T02:07:46.791466	467f4407	120	30	1.0000	DISCARD	gen=547 glyphs=4
2026-03-14T02:07:49.277667	bfdf7cad	120	30	1.0000	DISCARD	gen=504 glyphs=4
2026-03-14T02:07:49.545552	19355583	120	30	1.0000	DISCARD	gen=548 glyphs=4
2026-03-14T02:07:51.994970	5b9807ac	120	30	1.0000	DISCARD	gen=504 glyphs=4
2026-03-14T02:07:52.271447	8aef8872	116	29	1.0000	DISCARD	gen=548 glyphs=4
2026-03-14T02:07:54.760315	5a06ca32	120	30	1.0000	DISCARD	gen=504 glyphs=4
2026-03-14T02:07:55.041577	2e7032df	116	29	1.0000	DISCARD	gen=548 glyphs=4
2026-03-14T02:07:57.600738	71e2ba66	116	29	1.0000	DISCARD	gen=504 glyphs=4
2026-03-14T02:07:57.868172	e8c7f6cf	120	30	1.0000	DISCARD	gen=548 glyphs=4
2026-03-14T02:08:00.327798	5a06ca32	120	30	1.0000	DISCARD	gen=504 glyphs=4
2026-03-14T02:08:00.600408	e2cd28ea	120	30	1.0000	DISCARD	gen=548 glyphs=4
2026-03-14T02:08:03.070226	69477c18	116	29	1.0000	DISCARD	gen=504 glyphs=4
2026-03-14T02:08:03.357035	0eaedb57	116	29	1.0000	DISCARD	gen=548 glyphs=4
2026-03-14T02:08:05.791709	4c9b0dd4	120	30	1.0000	DISCARD	gen=504 glyphs=4
2026-03-14T02:08:06.080896	69a22137	120	30	1.0000	DISCARD	gen=548 glyphs=4
2026-03-14T02:08:08.536299	1d34459a	116	29	1.0000	DISCARD	gen=504 glyphs=4
2026-03-14T02:08:08.805346	19355583	120	30	1.0000	DISCARD	gen=548 glyphs=4
2026-03-14T02:08:11.258254	83602610	120	30	1.0000	DISCARD	gen=504 glyphs=4
2026-03-14T02:08:11.531248	b57e7176	120	30	1.0000	DISCARD	gen=548 glyphs=4
2026-03-14T02:08:13.975094	37f4017b	116	29	1.0000	DISCARD	gen=505 glyphs=4
2026-03-14T02:08:14.256889	19355583	120	30	1.0000	DISCARD	gen=548 glyphs=4
