timestamp	program_hash	spirv_size	word_count	fitness	status	description
2026-03-14T07:36:45.471505	099964a4	0	0	0.0000	CRASH	gen=701 glyphs=4
2026-03-14T07:36:45.471699	099964a4	0	0	0.0000	CRASH	gen=701 glyphs=4
2026-03-14T07:36:45.471895	80cef82b	0	0	0.0000	CRASH	gen=701 glyphs=4
2026-03-14T07:36:45.472095	e8d790a9	0	0	0.0000	CRASH	gen=701 glyphs=4
2026-03-14T07:36:45.472373	099964a4	0	0	0.0000	CRASH	gen=702 glyphs=4
2026-03-14T07:36:45.472575	099964a4	0	0	0.0000	CRASH	gen=702 glyphs=4
2026-03-14T07:36:45.472772	099964a4	0	0	0.0000	CRASH	gen=702 glyphs=4
2026-03-14T07:36:45.472966	099964a4	0	0	0.0000	CRASH	gen=702 glyphs=4
2026-03-14T07:36:45.473162	411e07d0	0	0	0.0000	CRASH	gen=702 glyphs=3
2026-03-14T07:36:45.473355	a0f7e892	0	0	0.0000	CRASH	gen=702 glyphs=4
2026-03-14T07:36:45.473551	7ede4765	0	0	0.0000	CRASH	gen=702 glyphs=2
2026-03-14T07:36:45.473750	099964a4	0	0	0.0000	CRASH	gen=702 glyphs=4
2026-03-14T07:36:45.473944	099964a4	0	0	0.0000	CRASH	gen=702 glyphs=4
2026-03-14T07:36:45.474135	3a734398	0	0	0.0000	CRASH	gen=702 glyphs=4
2026-03-14T07:36:45.474407	099964a4	0	0	0.0000	CRASH	gen=703 glyphs=4
2026-03-14T07:36:45.474609	099964a4	0	0	0.0000	CRASH	gen=703 glyphs=4
2026-03-14T07:36:45.474808	099964a4	0	0	0.0000	CRASH	gen=703 glyphs=4
2026-03-14T07:36:45.475000	099964a4	0	0	0.0000	CRASH	gen=703 glyphs=4
2026-03-14T07:36:45.475193	b147c767	0	0	0.0000	CRASH	gen=703 glyphs=4
2026-03-14T07:36:45.475388	099964a4	0	0	0.0000	CRASH	gen=703 glyphs=4
2026-03-14T07:36:45.475586	f2ab5701	0	0	0.0000	CRASH	gen=703 glyphs=3
2026-03-14T07:36:45.475783	0ae9edd4	0	0	0.0000	CRASH	gen=703 glyphs=4
2026-03-14T07:36:45.475978	099964a4	0	0	0.0000	CRASH	gen=703 glyphs=4
2026-03-14T07:36:45.476173	099964a4	0	0	0.0000	CRASH	gen=703 glyphs=4
2026-03-14T07:36:45.476455	099964a4	0	0	0.0000	CRASH	gen=704 glyphs=4
2026-03-14T07:36:45.476660	099964a4	0	0	0.0000	CRASH	gen=704 glyphs=4
2026-03-14T07:36:45.476884	099964a4	0	0	0.0000	CRASH	gen=704 glyphs=4
2026-03-14T07:36:45.477100	099964a4	0	0	0.0000	CRASH	gen=704 glyphs=4
2026-03-14T07:36:45.477300	099964a4	0	0	0.0000	CRASH	gen=704 glyphs=4
2026-03-14T07:36:45.477500	4b89d007	0	0	0.0000	CRASH	gen=704 glyphs=4
2026-03-14T07:36:45.477707	5d5e79ce	0	0	0.0000	CRASH	gen=704 glyphs=3
2026-03-14T07:36:45.477911	7d157884	0	0	0.0000	CRASH	gen=704 glyphs=3
2026-03-14T07:36:45.478126	099964a4	0	0	0.0000	CRASH	gen=704 glyphs=4
2026-03-14T07:36:45.478323	099964a4	0	0	0.0000	CRASH	gen=704 glyphs=4
2026-03-14T07:36:45.478605	099964a4	0	0	0.0000	CRASH	gen=705 glyphs=4
2026-03-14T07:36:45.478813	099964a4	0	0	0.0000	CRASH	gen=705 glyphs=4
2026-03-14T07:36:45.479022	04e00b8e	0	0	0.0000	CRASH	gen=705 glyphs=4
2026-03-14T07:36:45.479228	40180d83	0	0	0.0000	CRASH	gen=705 glyphs=4
2026-03-14T07:36:45.479425	099964a4	0	0	0.0000	CRASH	gen=705 glyphs=4
2026-03-14T07:36:45.479623	cf93b656	0	0	0.0000	CRASH	gen=705 glyphs=3
2026-03-14T07:36:45.479822	099964a4	0	0	0.0000	CRASH	gen=705 glyphs=4
2026-03-14T07:36:45.480019	1b76fa57	0	0	0.0000	CRASH	gen=705 glyphs=3
2026-03-14T07:36:45.480221	099964a4	0	0	0.0000	CRASH	gen=705 glyphs=4
2026-03-14T07:36:45.480419	8da1f8d8	0	0	0.0000	CRASH	gen=705 glyphs=4
2026-03-14T07:36:45.480720	099964a4	0	0	0.0000	CRASH	gen=706 glyphs=4
2026-03-14T07:36:45.480918	099964a4	0	0	0.0000	CRASH	gen=706 glyphs=4
2026-03-14T07:36:45.481114	099964a4	0	0	0.0000	CRASH	gen=706 glyphs=4
2026-03-14T07:36:45.481313	4a9a51f5	0	0	0.0000	CRASH	gen=706 glyphs=4
2026-03-14T07:36:45.481512	836557d6	0	0	0.0000	CRASH	gen=706 glyphs=4
2026-03-14T07:36:45.481714	099964a4	0	0	0.0000	CRASH	gen=706 glyphs=4
2026-03-14T07:36:45.481917	64bfed83	0	0	0.0000	CRASH	gen=706 glyphs=3
2026-03-14T07:36:45.482112	099964a4	0	0	0.0000	CRASH	gen=706 glyphs=4
2026-03-14T07:36:45.482320	099964a4	0	0	0.0000	CRASH	gen=706 glyphs=4
2026-03-14T07:36:45.482534	099964a4	0	0	0.0000	CRASH	gen=706 glyphs=4
2026-03-14T07:36:45.482817	099964a4	0	0	0.0000	CRASH	gen=707 glyphs=4
2026-03-14T07:36:45.483025	099964a4	0	0	0.0000	CRASH	gen=707 glyphs=4
2026-03-14T07:36:45.483221	fd09771c	0	0	0.0000	CRASH	gen=707 glyphs=3
2026-03-14T07:36:45.483419	7ede4765	0	0	0.0000	CRASH	gen=707 glyphs=2
2026-03-14T07:36:45.483621	099964a4	0	0	0.0000	CRASH	gen=707 glyphs=4
2026-03-14T07:36:45.483824	099964a4	0	0	0.0000	CRASH	gen=707 glyphs=4
2026-03-14T07:36:45.484021	099964a4	0	0	0.0000	CRASH	gen=707 glyphs=4
2026-03-14T07:36:45.484214	099964a4	0	0	0.0000	CRASH	gen=707 glyphs=4
2026-03-14T07:36:45.484414	cf93b656	0	0	0.0000	CRASH	gen=707 glyphs=3
2026-03-14T07:36:45.484614	099964a4	0	0	0.0000	CRASH	gen=707 glyphs=4
2026-03-14T07:36:45.484895	099964a4	0	0	0.0000	CRASH	gen=708 glyphs=4
2026-03-14T07:36:45.485096	099964a4	0	0	0.0000	CRASH	gen=708 glyphs=4
2026-03-14T07:36:45.485293	8da1f8d8	0	0	0.0000	CRASH	gen=708 glyphs=4
2026-03-14T07:36:45.485497	e6e351b7	0	0	0.0000	CRASH	gen=708 glyphs=3
2026-03-14T07:36:45.485694	d752284f	0	0	0.0000	CRASH	gen=708 glyphs=4
2026-03-14T07:36:45.485889	b4fcf48e	0	0	0.0000	CRASH	gen=708 glyphs=4
2026-03-14T07:36:45.486082	7ede4765	0	0	0.0000	CRASH	gen=708 glyphs=2
2026-03-14T07:36:45.486275	099964a4	0	0	0.0000	CRASH	gen=708 glyphs=4
2026-03-14T07:36:45.486470	46b6d114	0	0	0.0000	CRASH	gen=708 glyphs=4
2026-03-14T07:36:45.486675	a0ec759d	0	0	0.0000	CRASH	gen=708 glyphs=4
2026-03-14T07:36:45.486953	099964a4	0	0	0.0000	CRASH	gen=709 glyphs=4
2026-03-14T07:36:45.487150	099964a4	0	0	0.0000	CRASH	gen=709 glyphs=4
2026-03-14T07:36:45.487349	f99f7780	0	0	0.0000	CRASH	gen=709 glyphs=5
2026-03-14T07:36:45.487556	7ede4765	0	0	0.0000	CRASH	gen=709 glyphs=2
2026-03-14T07:36:45.487756	3e3c7020	0	0	0.0000	CRASH	gen=709 glyphs=4
2026-03-14T07:36:45.487953	099964a4	0	0	0.0000	CRASH	gen=709 glyphs=4
2026-03-14T07:36:45.488147	099964a4	0	0	0.0000	CRASH	gen=709 glyphs=4
2026-03-14T07:36:45.488341	099964a4	0	0	0.0000	CRASH	gen=709 glyphs=4
2026-03-14T07:36:45.488539	ca66b8d0	0	0	0.0000	CRASH	gen=709 glyphs=3
2026-03-14T07:36:45.488741	5ee8f3e2	0	0	0.0000	CRASH	gen=709 glyphs=4
2026-03-14T07:36:45.489025	099964a4	0	0	0.0000	CRASH	gen=710 glyphs=4
2026-03-14T07:36:45.489221	099964a4	0	0	0.0000	CRASH	gen=710 glyphs=4
2026-03-14T07:36:45.489418	95b8dc14	0	0	0.0000	CRASH	gen=710 glyphs=4
2026-03-14T07:36:45.489617	ff30496a	0	0	0.0000	CRASH	gen=710 glyphs=3
2026-03-14T07:36:45.489823	099964a4	0	0	0.0000	CRASH	gen=710 glyphs=4
2026-03-14T07:36:45.490019	dcf3b769	0	0	0.0000	CRASH	gen=710 glyphs=3
2026-03-14T07:36:45.490219	80cef82b	0	0	0.0000	CRASH	gen=710 glyphs=4
2026-03-14T07:36:45.490419	f6edaf7c	0	0	0.0000	CRASH	gen=710 glyphs=3
2026-03-14T07:36:45.490629	099964a4	0	0	0.0000	CRASH	gen=710 glyphs=4
2026-03-14T07:36:45.490832	099964a4	0	0	0.0000	CRASH	gen=710 glyphs=4
2026-03-14T07:36:45.491121	099964a4	0	0	0.0000	CRASH	gen=711 glyphs=4
2026-03-14T07:36:45.491319	099964a4	0	0	0.0000	CRASH	gen=711 glyphs=4
2026-03-14T07:36:45.491513	3ca14993	0	0	0.0000	CRASH	gen=711 glyphs=4
2026-03-14T07:36:45.491710	dcb1fb50	0	0	0.0000	CRASH	gen=711 glyphs=4
2026-03-14T07:36:45.491908	9e768d32	0	0	0.0000	CRASH	gen=711 glyphs=4
2026-03-14T07:36:45.492115	17292baf	0	0	0.0000	CRASH	gen=711 glyphs=3
2026-03-14T07:36:45.492328	099964a4	0	0	0.0000	CRASH	gen=711 glyphs=4
2026-03-14T07:36:45.492533	099964a4	0	0	0.0000	CRASH	gen=711 glyphs=4
2026-03-14T07:36:45.492734	3a734398	0	0	0.0000	CRASH	gen=711 glyphs=4
2026-03-14T07:36:45.492938	80cef82b	0	0	0.0000	CRASH	gen=711 glyphs=4
2026-03-14T07:36:45.493219	099964a4	0	0	0.0000	CRASH	gen=712 glyphs=4
2026-03-14T07:36:45.493426	099964a4	0	0	0.0000	CRASH	gen=712 glyphs=4
2026-03-14T07:36:45.493629	099964a4	0	0	0.0000	CRASH	gen=712 glyphs=4
2026-03-14T07:36:45.493824	f23a0d43	0	0	0.0000	CRASH	gen=712 glyphs=2
2026-03-14T07:36:45.494024	099964a4	0	0	0.0000	CRASH	gen=712 glyphs=4
2026-03-14T07:36:45.494220	099964a4	0	0	0.0000	CRASH	gen=712 glyphs=4
2026-03-14T07:36:45.494415	3a734398	0	0	0.0000	CRASH	gen=712 glyphs=4
2026-03-14T07:36:45.494615	099964a4	0	0	0.0000	CRASH	gen=712 glyphs=4
2026-03-14T07:36:45.494813	80cef82b	0	0	0.0000	CRASH	gen=712 glyphs=4
2026-03-14T07:36:45.495009	099964a4	0	0	0.0000	CRASH	gen=712 glyphs=4
2026-03-14T07:36:45.495293	099964a4	0	0	0.0000	CRASH	gen=713 glyphs=4
2026-03-14T07:36:45.495490	099964a4	0	0	0.0000	CRASH	gen=713 glyphs=4
2026-03-14T07:36:45.495688	099964a4	0	0	0.0000	CRASH	gen=713 glyphs=4
2026-03-14T07:36:45.495882	099964a4	0	0	0.0000	CRASH	gen=713 glyphs=4
2026-03-14T07:36:45.496088	099964a4	0	0	0.0000	CRASH	gen=713 glyphs=4
2026-03-14T07:36:45.496282	aa8a5e92	0	0	0.0000	CRASH	gen=713 glyphs=3
2026-03-14T07:36:45.496476	099964a4	0	0	0.0000	CRASH	gen=713 glyphs=4
2026-03-14T07:36:45.496671	c8544098	0	0	0.0000	CRASH	gen=713 glyphs=2
2026-03-14T07:36:45.496866	099964a4	0	0	0.0000	CRASH	gen=713 glyphs=4
2026-03-14T07:36:45.497061	099964a4	0	0	0.0000	CRASH	gen=713 glyphs=4
2026-03-14T07:36:45.497358	099964a4	0	0	0.0000	CRASH	gen=714 glyphs=4
2026-03-14T07:36:45.497579	099964a4	0	0	0.0000	CRASH	gen=714 glyphs=4
2026-03-14T07:36:45.497799	099964a4	0	0	0.0000	CRASH	gen=714 glyphs=4
2026-03-14T07:36:45.498010	099964a4	0	0	0.0000	CRASH	gen=714 glyphs=4
2026-03-14T07:36:45.498218	61dae081	0	0	0.0000	CRASH	gen=714 glyphs=3
2026-03-14T07:36:45.498437	099964a4	0	0	0.0000	CRASH	gen=714 glyphs=4
2026-03-14T07:36:45.498654	099964a4	0	0	0.0000	CRASH	gen=714 glyphs=4
2026-03-14T07:36:45.498850	099964a4	0	0	0.0000	CRASH	gen=714 glyphs=4
2026-03-14T07:36:45.499046	af818f1b	0	0	0.0000	CRASH	gen=714 glyphs=3
2026-03-14T07:36:45.499244	fa6fb7f4	0	0	0.0000	CRASH	gen=714 glyphs=3
2026-03-14T07:36:45.499539	099964a4	0	0	0.0000	CRASH	gen=715 glyphs=4
2026-03-14T07:36:45.499742	099964a4	0	0	0.0000	CRASH	gen=715 glyphs=4
2026-03-14T07:36:45.499944	cf93b656	0	0	0.0000	CRASH	gen=715 glyphs=3
2026-03-14T07:36:45.500140	ff30496a	0	0	0.0000	CRASH	gen=715 glyphs=3
2026-03-14T07:36:45.500352	a59bef21	0	0	0.0000	CRASH	gen=715 glyphs=3
2026-03-14T07:36:45.500567	0d8139e3	0	0	0.0000	CRASH	gen=715 glyphs=3
2026-03-14T07:36:45.500764	339e1cf9	0	0	0.0000	CRASH	gen=715 glyphs=2
2026-03-14T07:36:45.500961	099964a4	0	0	0.0000	CRASH	gen=715 glyphs=4
2026-03-14T07:36:45.501160	3a734398	0	0	0.0000	CRASH	gen=715 glyphs=4
2026-03-14T07:36:45.501380	0c1ae1ca	0	0	0.0000	CRASH	gen=715 glyphs=3
2026-03-14T07:36:45.501695	099964a4	0	0	0.0000	CRASH	gen=716 glyphs=4
2026-03-14T07:36:45.501915	099964a4	0	0	0.0000	CRASH	gen=716 glyphs=4
2026-03-14T07:36:45.502137	099964a4	0	0	0.0000	CRASH	gen=716 glyphs=4
2026-03-14T07:36:45.502340	099964a4	0	0	0.0000	CRASH	gen=716 glyphs=4
2026-03-14T07:36:45.502538	3ca14993	0	0	0.0000	CRASH	gen=716 glyphs=4
2026-03-14T07:36:45.502739	099964a4	0	0	0.0000	CRASH	gen=716 glyphs=4
2026-03-14T07:36:45.502932	7228d68f	0	0	0.0000	CRASH	gen=716 glyphs=3
2026-03-14T07:36:45.503125	3a734398	0	0	0.0000	CRASH	gen=716 glyphs=4
2026-03-14T07:36:45.503325	3ca14993	0	0	0.0000	CRASH	gen=716 glyphs=4
2026-03-14T07:36:45.503523	cb10b252	0	0	0.0000	CRASH	gen=716 glyphs=3
2026-03-14T07:36:45.503806	099964a4	0	0	0.0000	CRASH	gen=717 glyphs=4
2026-03-14T07:36:45.504004	099964a4	0	0	0.0000	CRASH	gen=717 glyphs=4
2026-03-14T07:36:45.504197	099964a4	0	0	0.0000	CRASH	gen=717 glyphs=4
2026-03-14T07:36:45.504388	099964a4	0	0	0.0000	CRASH	gen=717 glyphs=4
2026-03-14T07:36:45.504586	099964a4	0	0	0.0000	CRASH	gen=717 glyphs=4
2026-03-14T07:36:45.504781	a3bc8a53	0	0	0.0000	CRASH	gen=717 glyphs=4
2026-03-14T07:36:45.504980	099964a4	0	0	0.0000	CRASH	gen=717 glyphs=4
2026-03-14T07:36:45.505170	dcb1fb50	0	0	0.0000	CRASH	gen=717 glyphs=4
2026-03-14T07:36:45.505364	099964a4	0	0	0.0000	CRASH	gen=717 glyphs=4
2026-03-14T07:36:45.505556	f5e41d71	0	0	0.0000	CRASH	gen=717 glyphs=4
2026-03-14T07:36:45.505830	099964a4	0	0	0.0000	CRASH	gen=718 glyphs=4
2026-03-14T07:36:45.506029	099964a4	0	0	0.0000	CRASH	gen=718 glyphs=4
2026-03-14T07:36:45.506224	6ca545e3	0	0	0.0000	CRASH	gen=718 glyphs=4
2026-03-14T07:36:45.506417	099964a4	0	0	0.0000	CRASH	gen=718 glyphs=4
2026-03-14T07:36:45.506612	ff30496a	0	0	0.0000	CRASH	gen=718 glyphs=3
2026-03-14T07:36:45.506803	e2afdf9a	0	0	0.0000	CRASH	gen=718 glyphs=4
2026-03-14T07:36:45.506999	099964a4	0	0	0.0000	CRASH	gen=718 glyphs=4
2026-03-14T07:36:45.507190	099964a4	0	0	0.0000	CRASH	gen=718 glyphs=4
2026-03-14T07:36:45.507386	099964a4	0	0	0.0000	CRASH	gen=718 glyphs=4
2026-03-14T07:36:45.507581	099964a4	0	0	0.0000	CRASH	gen=718 glyphs=4
2026-03-14T07:36:45.507859	099964a4	0	0	0.0000	CRASH	gen=719 glyphs=4
2026-03-14T07:36:45.508062	099964a4	0	0	0.0000	CRASH	gen=719 glyphs=4
2026-03-14T07:36:45.508255	cf93b656	0	0	0.0000	CRASH	gen=719 glyphs=3
2026-03-14T07:36:45.508446	dcb1fb50	0	0	0.0000	CRASH	gen=719 glyphs=4
2026-03-14T07:36:45.508644	099964a4	0	0	0.0000	CRASH	gen=719 glyphs=4
2026-03-14T07:36:45.508839	3a734398	0	0	0.0000	CRASH	gen=719 glyphs=4
2026-03-14T07:36:45.509035	7ede4765	0	0	0.0000	CRASH	gen=719 glyphs=2
2026-03-14T07:36:45.509231	099964a4	0	0	0.0000	CRASH	gen=719 glyphs=4
2026-03-14T07:36:45.509425	7b3c510f	0	0	0.0000	CRASH	gen=719 glyphs=4
2026-03-14T07:36:45.509621	099964a4	0	0	0.0000	CRASH	gen=719 glyphs=4
2026-03-14T07:36:45.509898	099964a4	0	0	0.0000	CRASH	gen=720 glyphs=4
2026-03-14T07:36:45.510100	099964a4	0	0	0.0000	CRASH	gen=720 glyphs=4
2026-03-14T07:36:45.510305	099964a4	0	0	0.0000	CRASH	gen=720 glyphs=4
2026-03-14T07:36:45.510502	099964a4	0	0	0.0000	CRASH	gen=720 glyphs=4
2026-03-14T07:36:45.510696	099964a4	0	0	0.0000	CRASH	gen=720 glyphs=4
2026-03-14T07:36:45.510890	099964a4	0	0	0.0000	CRASH	gen=720 glyphs=4
2026-03-14T07:36:45.511082	099964a4	0	0	0.0000	CRASH	gen=720 glyphs=4
2026-03-14T07:36:45.511279	099964a4	0	0	0.0000	CRASH	gen=720 glyphs=4
2026-03-14T07:36:45.511476	099964a4	0	0	0.0000	CRASH	gen=720 glyphs=4
2026-03-14T07:36:45.511672	099964a4	0	0	0.0000	CRASH	gen=720 glyphs=4
2026-03-14T07:36:45.511958	099964a4	0	0	0.0000	CRASH	gen=721 glyphs=4
2026-03-14T07:36:45.512152	099964a4	0	0	0.0000	CRASH	gen=721 glyphs=4
2026-03-14T07:36:45.512351	4a7d6ab3	0	0	0.0000	CRASH	gen=721 glyphs=2
2026-03-14T07:36:45.512544	099964a4	0	0	0.0000	CRASH	gen=721 glyphs=4
2026-03-14T07:36:45.512736	099964a4	0	0	0.0000	CRASH	gen=721 glyphs=4
2026-03-14T07:36:45.512928	3ca14993	0	0	0.0000	CRASH	gen=721 glyphs=4
2026-03-14T07:36:45.513124	ab18a16c	0	0	0.0000	CRASH	gen=721 glyphs=4
2026-03-14T07:36:45.513320	e9bdb4e6	0	0	0.0000	CRASH	gen=721 glyphs=2
2026-03-14T07:36:45.513521	6a09caf5	0	0	0.0000	CRASH	gen=721 glyphs=5
2026-03-14T07:36:45.513719	7ede4765	0	0	0.0000	CRASH	gen=721 glyphs=2
2026-03-14T07:36:45.514002	099964a4	0	0	0.0000	CRASH	gen=722 glyphs=4
2026-03-14T07:36:45.514200	099964a4	0	0	0.0000	CRASH	gen=722 glyphs=4
2026-03-14T07:36:45.514395	099964a4	0	0	0.0000	CRASH	gen=722 glyphs=4
2026-03-14T07:36:45.514591	80f35753	0	0	0.0000	CRASH	gen=722 glyphs=3
2026-03-14T07:36:45.514785	3ca14993	0	0	0.0000	CRASH	gen=722 glyphs=4
2026-03-14T07:36:45.514978	dcb1fb50	0	0	0.0000	CRASH	gen=722 glyphs=4
2026-03-14T07:36:45.515172	ba391606	0	0	0.0000	CRASH	gen=722 glyphs=3
2026-03-14T07:36:45.515365	ae4b44c9	0	0	0.0000	CRASH	gen=722 glyphs=3
2026-03-14T07:36:45.515569	099964a4	0	0	0.0000	CRASH	gen=722 glyphs=4
2026-03-14T07:36:45.515764	cf6b8bf6	0	0	0.0000	CRASH	gen=722 glyphs=4
2026-03-14T07:36:45.516048	099964a4	0	0	0.0000	CRASH	gen=723 glyphs=4
2026-03-14T07:36:45.516246	099964a4	0	0	0.0000	CRASH	gen=723 glyphs=4
2026-03-14T07:36:45.516451	099964a4	0	0	0.0000	CRASH	gen=723 glyphs=4
2026-03-14T07:36:45.516652	099964a4	0	0	0.0000	CRASH	gen=723 glyphs=4
2026-03-14T07:36:45.516850	099964a4	0	0	0.0000	CRASH	gen=723 glyphs=4
2026-03-14T07:36:45.517045	4c64332b	0	0	0.0000	CRASH	gen=723 glyphs=5
2026-03-14T07:36:45.517243	099964a4	0	0	0.0000	CRASH	gen=723 glyphs=4
2026-03-14T07:36:45.517439	b361cbd7	0	0	0.0000	CRASH	gen=723 glyphs=3
2026-03-14T07:36:45.517643	099964a4	0	0	0.0000	CRASH	gen=723 glyphs=4
2026-03-14T07:36:45.517837	099964a4	0	0	0.0000	CRASH	gen=723 glyphs=4
2026-03-14T07:36:45.518114	099964a4	0	0	0.0000	CRASH	gen=724 glyphs=4
2026-03-14T07:36:45.518311	099964a4	0	0	0.0000	CRASH	gen=724 glyphs=4
2026-03-14T07:36:45.518508	099964a4	0	0	0.0000	CRASH	gen=724 glyphs=4
2026-03-14T07:36:45.518709	099964a4	0	0	0.0000	CRASH	gen=724 glyphs=4
2026-03-14T07:36:45.518903	099964a4	0	0	0.0000	CRASH	gen=724 glyphs=4
2026-03-14T07:36:45.519098	099964a4	0	0	0.0000	CRASH	gen=724 glyphs=4
2026-03-14T07:36:45.519295	099964a4	0	0	0.0000	CRASH	gen=724 glyphs=4
2026-03-14T07:36:45.519491	099964a4	0	0	0.0000	CRASH	gen=724 glyphs=4
2026-03-14T07:36:45.519691	099964a4	0	0	0.0000	CRASH	gen=724 glyphs=4
2026-03-14T07:36:45.519887	099964a4	0	0	0.0000	CRASH	gen=724 glyphs=4
2026-03-14T07:36:45.520151	099964a4	0	0	0.0000	CRASH	gen=725 glyphs=4
2026-03-14T07:36:45.520346	099964a4	0	0	0.0000	CRASH	gen=725 glyphs=4
2026-03-14T07:36:45.520541	5ec0e1e3	0	0	0.0000	CRASH	gen=725 glyphs=4
2026-03-14T07:36:45.520733	dcb1fb50	0	0	0.0000	CRASH	gen=725 glyphs=4
2026-03-14T07:36:45.520930	099964a4	0	0	0.0000	CRASH	gen=725 glyphs=4
2026-03-14T07:36:45.521122	47eaefab	0	0	0.0000	CRASH	gen=725 glyphs=4
2026-03-14T07:36:45.521313	099964a4	0	0	0.0000	CRASH	gen=725 glyphs=4
2026-03-14T07:36:45.521507	099964a4	0	0	0.0000	CRASH	gen=725 glyphs=4
2026-03-14T07:36:45.521707	13acf87e	0	0	0.0000	CRASH	gen=725 glyphs=3
2026-03-14T07:36:45.521906	1cff9e12	0	0	0.0000	CRASH	gen=725 glyphs=4
2026-03-14T07:36:45.522179	099964a4	0	0	0.0000	CRASH	gen=726 glyphs=4
2026-03-14T07:36:45.522374	099964a4	0	0	0.0000	CRASH	gen=726 glyphs=4
2026-03-14T07:36:45.522574	ff30496a	0	0	0.0000	CRASH	gen=726 glyphs=3
2026-03-14T07:36:45.522769	9ed7b328	0	0	0.0000	CRASH	gen=726 glyphs=2
2026-03-14T07:36:45.522967	6c8e4621	0	0	0.0000	CRASH	gen=726 glyphs=3
2026-03-14T07:36:45.523160	099964a4	0	0	0.0000	CRASH	gen=726 glyphs=4
2026-03-14T07:36:45.523352	099964a4	0	0	0.0000	CRASH	gen=726 glyphs=4
2026-03-14T07:36:45.523548	099964a4	0	0	0.0000	CRASH	gen=726 glyphs=4
2026-03-14T07:36:45.523743	099964a4	0	0	0.0000	CRASH	gen=726 glyphs=4
2026-03-14T07:36:45.523936	099964a4	0	0	0.0000	CRASH	gen=726 glyphs=4
2026-03-14T07:36:45.524208	099964a4	0	0	0.0000	CRASH	gen=727 glyphs=4
2026-03-14T07:36:45.524402	099964a4	0	0	0.0000	CRASH	gen=727 glyphs=4
2026-03-14T07:36:45.524599	7950c5be	0	0	0.0000	CRASH	gen=727 glyphs=3
2026-03-14T07:36:45.524795	5210f0dd	0	0	0.0000	CRASH	gen=727 glyphs=4
2026-03-14T07:36:45.524989	099964a4	0	0	0.0000	CRASH	gen=727 glyphs=4
2026-03-14T07:36:45.525187	099964a4	0	0	0.0000	CRASH	gen=727 glyphs=4
2026-03-14T07:36:45.525379	3a734398	0	0	0.0000	CRASH	gen=727 glyphs=4
2026-03-14T07:36:45.525576	fc528fe0	0	0	0.0000	CRASH	gen=727 glyphs=3
2026-03-14T07:36:45.525771	099964a4	0	0	0.0000	CRASH	gen=727 glyphs=4
2026-03-14T07:36:45.525961	099964a4	0	0	0.0000	CRASH	gen=727 glyphs=4
2026-03-14T07:36:45.526240	099964a4	0	0	0.0000	CRASH	gen=728 glyphs=4
2026-03-14T07:36:45.526437	099964a4	0	0	0.0000	CRASH	gen=728 glyphs=4
2026-03-14T07:36:45.526635	cb9cee33	0	0	0.0000	CRASH	gen=728 glyphs=4
2026-03-14T07:36:45.526829	3a734398	0	0	0.0000	CRASH	gen=728 glyphs=4
2026-03-14T07:36:45.527021	099964a4	0	0	0.0000	CRASH	gen=728 glyphs=4
2026-03-14T07:36:45.527218	099964a4	0	0	0.0000	CRASH	gen=728 glyphs=4
2026-03-14T07:36:45.527413	099964a4	0	0	0.0000	CRASH	gen=728 glyphs=4
2026-03-14T07:36:45.527607	bdef4336	0	0	0.0000	CRASH	gen=728 glyphs=3
2026-03-14T07:36:45.527805	8da1f8d8	0	0	0.0000	CRASH	gen=728 glyphs=4
2026-03-14T07:36:45.528000	099964a4	0	0	0.0000	CRASH	gen=728 glyphs=4
2026-03-14T07:36:45.528274	099964a4	0	0	0.0000	CRASH	gen=729 glyphs=4
2026-03-14T07:36:45.528471	099964a4	0	0	0.0000	CRASH	gen=729 glyphs=4
2026-03-14T07:36:45.528666	3ca14993	0	0	0.0000	CRASH	gen=729 glyphs=4
2026-03-14T07:36:45.528859	ed47372a	0	0	0.0000	CRASH	gen=729 glyphs=4
2026-03-14T07:36:45.529054	099964a4	0	0	0.0000	CRASH	gen=729 glyphs=4
2026-03-14T07:36:45.529247	099964a4	0	0	0.0000	CRASH	gen=729 glyphs=4
2026-03-14T07:36:45.529444	099964a4	0	0	0.0000	CRASH	gen=729 glyphs=4
2026-03-14T07:36:45.529639	8da1f8d8	0	0	0.0000	CRASH	gen=729 glyphs=4
2026-03-14T07:36:45.529834	099964a4	0	0	0.0000	CRASH	gen=729 glyphs=4
2026-03-14T07:36:45.530025	18eebb17	0	0	0.0000	CRASH	gen=729 glyphs=4
2026-03-14T07:36:45.530289	099964a4	0	0	0.0000	CRASH	gen=730 glyphs=4
2026-03-14T07:36:45.530485	099964a4	0	0	0.0000	CRASH	gen=730 glyphs=4
2026-03-14T07:36:45.530679	099964a4	0	0	0.0000	CRASH	gen=730 glyphs=4
2026-03-14T07:36:45.530869	099964a4	0	0	0.0000	CRASH	gen=730 glyphs=4
2026-03-14T07:36:45.531056	520c8c37	0	0	0.0000	CRASH	gen=730 glyphs=3
2026-03-14T07:36:45.531248	099964a4	0	0	0.0000	CRASH	gen=730 glyphs=4
2026-03-14T07:36:45.531441	80cef82b	0	0	0.0000	CRASH	gen=730 glyphs=4
2026-03-14T07:36:45.531636	3a734398	0	0	0.0000	CRASH	gen=730 glyphs=4
2026-03-14T07:36:45.531831	8da1f8d8	0	0	0.0000	CRASH	gen=730 glyphs=4
2026-03-14T07:36:45.532027	099964a4	0	0	0.0000	CRASH	gen=730 glyphs=4
2026-03-14T07:36:45.532315	099964a4	0	0	0.0000	CRASH	gen=731 glyphs=4
2026-03-14T07:36:45.532515	099964a4	0	0	0.0000	CRASH	gen=731 glyphs=4
2026-03-14T07:36:45.532713	ed9fbc3f	0	0	0.0000	CRASH	gen=731 glyphs=4
2026-03-14T07:36:45.532909	099964a4	0	0	0.0000	CRASH	gen=731 glyphs=4
2026-03-14T07:36:45.533103	099964a4	0	0	0.0000	CRASH	gen=731 glyphs=4
2026-03-14T07:36:45.533296	099964a4	0	0	0.0000	CRASH	gen=731 glyphs=4
2026-03-14T07:36:45.533489	099964a4	0	0	0.0000	CRASH	gen=731 glyphs=4
2026-03-14T07:36:45.533687	71588554	0	0	0.0000	CRASH	gen=731 glyphs=5
2026-03-14T07:36:45.533883	80cef82b	0	0	0.0000	CRASH	gen=731 glyphs=4
2026-03-14T07:36:45.534077	9ff0ee58	0	0	0.0000	CRASH	gen=731 glyphs=4
2026-03-14T07:36:45.534350	099964a4	0	0	0.0000	CRASH	gen=732 glyphs=4
2026-03-14T07:36:45.534551	099964a4	0	0	0.0000	CRASH	gen=732 glyphs=4
2026-03-14T07:36:45.534748	099964a4	0	0	0.0000	CRASH	gen=732 glyphs=4
2026-03-14T07:36:45.534941	099964a4	0	0	0.0000	CRASH	gen=732 glyphs=4
2026-03-14T07:36:45.535132	71e31b95	0	0	0.0000	CRASH	gen=732 glyphs=3
2026-03-14T07:36:45.535326	099964a4	0	0	0.0000	CRASH	gen=732 glyphs=4
2026-03-14T07:36:45.535522	ca7906af	0	0	0.0000	CRASH	gen=732 glyphs=3
2026-03-14T07:36:45.535719	099964a4	0	0	0.0000	CRASH	gen=732 glyphs=4
2026-03-14T07:36:45.535913	099964a4	0	0	0.0000	CRASH	gen=732 glyphs=4
