timestamp	program_hash	spirv_size	word_count	fitness	status	description
2026-03-14T03:14:49.812833	bfdf7cad	120	30	1.0000	DISCARD	gen=651 glyphs=4
2026-03-14T03:14:50.078367	19355583	120	30	1.0000	DISCARD	gen=695 glyphs=4
2026-03-14T03:14:52.495882	55d6c151	120	30	1.0000	DISCARD	gen=651 glyphs=4
2026-03-14T03:14:52.768298	8aef8872	116	29	1.0000	DISCARD	gen=695 glyphs=4
2026-03-14T03:14:55.177116	4c9b0dd4	120	30	1.0000	DISCARD	gen=651 glyphs=4
2026-03-14T03:14:55.444098	99161c57	116	29	1.0000	DISCARD	gen=695 glyphs=4
2026-03-14T03:14:57.861065	2a5ac090	116	29	1.0000	DISCARD	gen=651 glyphs=4
2026-03-14T03:14:58.137262	8aef8872	116	29	1.0000	DISCARD	gen=695 glyphs=4
2026-03-14T03:15:00.563138	37f4017b	116	29	1.0000	DISCARD	gen=651 glyphs=4
2026-03-14T03:15:00.832043	44ef3de0	116	29	1.0000	DISCARD	gen=695 glyphs=4
2026-03-14T03:15:03.269146	37f4017b	116	29	1.0000	DISCARD	gen=651 glyphs=4
2026-03-14T03:15:03.527372	eca7ab6c	116	29	1.0000	DISCARD	gen=695 glyphs=4
2026-03-14T03:15:05.979832	5a06ca32	120	30	1.0000	DISCARD	gen=651 glyphs=4
2026-03-14T03:15:06.249813	e2cd28ea	120	30	1.0000	DISCARD	gen=695 glyphs=4
2026-03-14T03:15:08.723290	2701cb73	116	29	1.0000	DISCARD	gen=651 glyphs=4
2026-03-14T03:15:08.992122	0eaedb57	116	29	1.0000	DISCARD	gen=695 glyphs=4
2026-03-14T03:15:11.421943	7d614178	116	29	1.0000	DISCARD	gen=651 glyphs=4
2026-03-14T03:15:11.687442	58d02ce0	120	30	1.0000	DISCARD	gen=695 glyphs=4
2026-03-14T03:15:14.185922	37f4017b	116	29	1.0000	DISCARD	gen=652 glyphs=4
2026-03-14T03:15:14.456748	50dc991d	116	29	1.0000	DISCARD	gen=695 glyphs=4
2026-03-14T03:15:16.886269	bfdf7cad	120	30	1.0000	DISCARD	gen=652 glyphs=4
2026-03-14T03:15:17.177908	19355583	120	30	1.0000	DISCARD	gen=696 glyphs=4
2026-03-14T03:15:19.623807	1d34459a	116	29	1.0000	DISCARD	gen=652 glyphs=4
2026-03-14T03:15:19.885397	8aef8872	116	29	1.0000	DISCARD	gen=696 glyphs=4
2026-03-14T03:15:22.322649	0f4f53a4	116	29	1.0000	DISCARD	gen=652 glyphs=4
2026-03-14T03:15:22.601611	a78f9454	120	30	1.0000	DISCARD	gen=696 glyphs=4
2026-03-14T03:15:25.045749	37f4017b	116	29	1.0000	DISCARD	gen=652 glyphs=4
2026-03-14T03:15:25.315664	b6139f72	120	30	1.0000	DISCARD	gen=696 glyphs=4
2026-03-14T03:15:27.764789	37f4017b	116	29	1.0000	DISCARD	gen=652 glyphs=4
2026-03-14T03:15:28.025195	286c8cde	116	29	1.0000	DISCARD	gen=696 glyphs=4
2026-03-14T03:15:30.476788	8892a8c3	120	30	1.0000	DISCARD	gen=652 glyphs=4
2026-03-14T03:15:30.745034	8aef8872	116	29	1.0000	DISCARD	gen=696 glyphs=4
2026-03-14T03:15:33.184947	37f4017b	116	29	1.0000	DISCARD	gen=652 glyphs=4
2026-03-14T03:15:33.456965	ea111e13	120	30	1.0000	DISCARD	gen=696 glyphs=4
2026-03-14T03:15:35.919993	ee46480a	120	30	1.0000	DISCARD	gen=652 glyphs=4
2026-03-14T03:15:36.194852	ae44ace5	116	29	1.0000	DISCARD	gen=696 glyphs=4
2026-03-14T03:15:38.644874	5a06ca32	120	30	1.0000	DISCARD	gen=652 glyphs=4
2026-03-14T03:15:38.923668	ae44ace5	116	29	1.0000	DISCARD	gen=696 glyphs=4
2026-03-14T03:15:41.349397	37f4017b	116	29	1.0000	DISCARD	gen=653 glyphs=4
2026-03-14T03:15:41.618696	81045bc4	116	29	0.9500	DISCARD	gen=696 glyphs=4
2026-03-14T03:15:44.067364	bfdf7cad	120	30	1.0000	DISCARD	gen=653 glyphs=4
2026-03-14T03:15:44.345916	19355583	120	30	1.0000	DISCARD	gen=697 glyphs=4
2026-03-14T03:15:46.867450	4b669095	116	29	1.0000	DISCARD	gen=653 glyphs=4
2026-03-14T03:15:47.144611	8aef8872	116	29	1.0000	DISCARD	gen=697 glyphs=4
2026-03-14T03:15:49.595173	37f4017b	116	29	1.0000	DISCARD	gen=653 glyphs=4
2026-03-14T03:15:49.857645	a78f9454	120	30	1.0000	DISCARD	gen=697 glyphs=4
2026-03-14T03:15:52.309893	55d6c151	120	30	1.0000	DISCARD	gen=653 glyphs=4
2026-03-14T03:15:52.590316	b57e7176	120	30	1.0000	DISCARD	gen=697 glyphs=4
2026-03-14T03:15:55.040177	37f4017b	116	29	1.0000	DISCARD	gen=653 glyphs=4
2026-03-14T03:15:55.298771	c74f0570	116	29	1.0000	DISCARD	gen=697 glyphs=4
2026-03-14T03:15:57.744853	fdb5d108	120	30	1.0000	DISCARD	gen=653 glyphs=4
2026-03-14T03:15:58.023376	19355583	120	30	1.0000	DISCARD	gen=697 glyphs=4
2026-03-14T03:16:00.449312	52d17396	116	29	1.0000	DISCARD	gen=653 glyphs=4
2026-03-14T03:16:00.716136	f6cf0d0f	116	29	1.0000	DISCARD	gen=697 glyphs=4
2026-03-14T03:16:03.141361	5b53cab2	120	30	1.0000	DISCARD	gen=653 glyphs=4
2026-03-14T03:16:03.424885	00a3ae4a	116	29	1.0000	DISCARD	gen=697 glyphs=4
2026-03-14T03:16:05.819491	5b1b8c33	116	29	1.0000	DISCARD	gen=653 glyphs=4
2026-03-14T03:16:06.085987	a78f9454	120	30	1.0000	DISCARD	gen=697 glyphs=4
2026-03-14T03:16:08.507275	37f4017b	116	29	1.0000	DISCARD	gen=654 glyphs=4
2026-03-14T03:16:08.773984	8aef8872	116	29	1.0000	DISCARD	gen=697 glyphs=4
2026-03-14T03:16:11.209858	bfdf7cad	120	30	1.0000	DISCARD	gen=654 glyphs=4
2026-03-14T03:16:11.470122	19355583	120	30	1.0000	DISCARD	gen=698 glyphs=4
2026-03-14T03:16:13.887125	2701cb73	116	29	1.0000	DISCARD	gen=654 glyphs=4
2026-03-14T03:16:14.155806	8aef8872	116	29	1.0000	DISCARD	gen=698 glyphs=4
2026-03-14T03:16:16.561163	d11c1062	120	30	1.0000	DISCARD	gen=654 glyphs=4
2026-03-14T03:16:16.863183	61369835	116	29	1.0000	DISCARD	gen=698 glyphs=4
2026-03-14T03:16:19.334446	08d1ce8d	116	29	1.0000	DISCARD	gen=654 glyphs=4
2026-03-14T03:16:19.604112	eca7ab6c	116	29	1.0000	DISCARD	gen=698 glyphs=4
2026-03-14T03:16:22.011060	37f4017b	116	29	1.0000	DISCARD	gen=654 glyphs=4
2026-03-14T03:16:22.274504	8aef8872	116	29	1.0000	DISCARD	gen=698 glyphs=4
2026-03-14T03:16:24.686337	2701cb73	116	29	1.0000	DISCARD	gen=654 glyphs=4
2026-03-14T03:16:24.972551	38e42268	116	29	1.0000	DISCARD	gen=698 glyphs=4
2026-03-14T03:16:27.364346	1a7c2a86	116	29	1.0000	DISCARD	gen=654 glyphs=4
2026-03-14T03:16:27.639526	b7aed8e9	116	29	1.0000	DISCARD	gen=698 glyphs=4
2026-03-14T03:16:30.059959	55d6c151	120	30	1.0000	DISCARD	gen=654 glyphs=4
2026-03-14T03:16:30.336991	9f9693f8	120	30	1.0000	DISCARD	gen=698 glyphs=4
2026-03-14T03:16:32.742014	bfdf7cad	120	30	1.0000	DISCARD	gen=654 glyphs=4
2026-03-14T03:16:33.007645	b57e7176	120	30	1.0000	DISCARD	gen=698 glyphs=4
2026-03-14T03:16:35.428958	37f4017b	116	29	1.0000	DISCARD	gen=655 glyphs=4
2026-03-14T03:16:35.699307	8aef8872	116	29	1.0000	DISCARD	gen=698 glyphs=4
2026-03-14T03:16:38.130952	bfdf7cad	120	30	1.0000	DISCARD	gen=655 glyphs=4
2026-03-14T03:16:38.388531	19355583	120	30	1.0000	DISCARD	gen=699 glyphs=4
2026-03-14T03:16:40.785746	37f4017b	116	29	1.0000	DISCARD	gen=655 glyphs=4
2026-03-14T03:16:41.047448	8aef8872	116	29	1.0000	DISCARD	gen=699 glyphs=4
2026-03-14T03:16:43.449281	d11c1062	120	30	1.0000	DISCARD	gen=655 glyphs=4
2026-03-14T03:16:43.719284	b57e7176	120	30	1.0000	DISCARD	gen=699 glyphs=4
2026-03-14T03:16:46.133405	d11c1062	120	30	1.0000	DISCARD	gen=655 glyphs=4
2026-03-14T03:16:46.408090	d7c8681b	120	30	1.0000	DISCARD	gen=699 glyphs=4
2026-03-14T03:16:48.858816	37f4017b	116	29	1.0000	DISCARD	gen=655 glyphs=4
2026-03-14T03:16:49.129895	8aef8872	116	29	1.0000	DISCARD	gen=699 glyphs=4
2026-03-14T03:16:51.550197	fdb5d108	120	30	1.0000	DISCARD	gen=655 glyphs=4
2026-03-14T03:16:51.812404	ae44ace5	116	29	1.0000	DISCARD	gen=699 glyphs=4
2026-03-14T03:16:54.225233	6b0ed28e	116	29	1.0000	DISCARD	gen=655 glyphs=4
2026-03-14T03:16:54.495835	8aef8872	116	29	1.0000	DISCARD	gen=699 glyphs=4
2026-03-14T03:16:56.906398	fdb5d108	120	30	1.0000	DISCARD	gen=655 glyphs=4
2026-03-14T03:16:57.175267	ae44ace5	116	29	1.0000	DISCARD	gen=699 glyphs=4
2026-03-14T03:16:59.609238	6efcc223	116	29	0.9500	DISCARD	gen=655 glyphs=4
2026-03-14T03:16:59.878990	19355583	120	30	1.0000	DISCARD	gen=699 glyphs=4
2026-03-14T03:17:02.288992	37f4017b	116	29	1.0000	DISCARD	gen=656 glyphs=4
2026-03-14T03:17:02.547196	b7aed8e9	116	29	1.0000	DISCARD	gen=699 glyphs=4
2026-03-14T03:17:04.967736	bfdf7cad	120	30	1.0000	DISCARD	gen=656 glyphs=4
2026-03-14T03:17:05.235998	19355583	120	30	1.0000	DISCARD	gen=700 glyphs=4
2026-03-14T03:17:07.642812	d11c1062	120	30	1.0000	DISCARD	gen=656 glyphs=4
2026-03-14T03:17:07.905134	8aef8872	116	29	1.0000	DISCARD	gen=700 glyphs=4
2026-03-14T03:17:10.332645	d5e9ffa4	116	29	0.9500	DISCARD	gen=656 glyphs=4
2026-03-14T03:17:10.604795	9e34ede0	116	29	1.0000	DISCARD	gen=700 glyphs=4
2026-03-14T03:17:13.000560	727229c0	116	29	0.9500	DISCARD	gen=656 glyphs=4
2026-03-14T03:17:13.285396	8aef8872	116	29	1.0000	DISCARD	gen=700 glyphs=4
2026-03-14T03:17:15.694329	37f4017b	116	29	1.0000	DISCARD	gen=656 glyphs=4
2026-03-14T03:17:15.951509	e8c7f6cf	120	30	1.0000	DISCARD	gen=700 glyphs=4
2026-03-14T03:17:18.351895	37f4017b	116	29	1.0000	DISCARD	gen=656 glyphs=4
2026-03-14T03:17:18.635634	a49ae979	116	29	1.0000	DISCARD	gen=700 glyphs=4
2026-03-14T03:17:21.061267	53650a2e	116	29	0.9500	DISCARD	gen=656 glyphs=4
2026-03-14T03:17:21.335982	ae44ace5	116	29	1.0000	DISCARD	gen=700 glyphs=4
2026-03-14T03:17:23.757583	71e2ba66	116	29	1.0000	DISCARD	gen=656 glyphs=4
2026-03-14T03:17:24.026664	e2cd28ea	120	30	1.0000	DISCARD	gen=700 glyphs=4
2026-03-14T03:17:26.443771	cc33736d	120	30	1.0000	DISCARD	gen=656 glyphs=4
2026-03-14T03:17:26.709383	a6bc2b6c	120	30	1.0000	DISCARD	gen=700 glyphs=4
2026-03-14T03:17:29.106470	37f4017b	116	29	1.0000	DISCARD	gen=657 glyphs=4
2026-03-14T03:17:29.382024	b57e7176	120	30	1.0000	DISCARD	gen=700 glyphs=4
2026-03-14T03:17:31.813160	bfdf7cad	120	30	1.0000	DISCARD	gen=657 glyphs=4
2026-03-14T03:17:32.081424	19355583	120	30	1.0000	DISCARD	gen=701 glyphs=4
2026-03-14T03:17:34.518614	5a06ca32	120	30	1.0000	DISCARD	gen=657 glyphs=4
2026-03-14T03:17:34.776965	8aef8872	116	29	1.0000	DISCARD	gen=701 glyphs=4
2026-03-14T03:17:37.203637	8d0e5de9	120	30	1.0000	DISCARD	gen=657 glyphs=4
2026-03-14T03:17:37.473420	0eaedb57	116	29	1.0000	DISCARD	gen=701 glyphs=4
2026-03-14T03:17:39.878321	d11c1062	120	30	1.0000	DISCARD	gen=657 glyphs=4
2026-03-14T03:17:40.147128	b7aed8e9	116	29	1.0000	DISCARD	gen=701 glyphs=4
2026-03-14T03:17:42.557853	5a06ca32	120	30	1.0000	DISCARD	gen=657 glyphs=4
2026-03-14T03:17:42.824496	9088a0b3	120	30	1.0000	DISCARD	gen=701 glyphs=4
2026-03-14T03:17:45.255619	37f4017b	116	29	1.0000	DISCARD	gen=657 glyphs=4
2026-03-14T03:17:45.515071	050862ad	120	30	1.0000	DISCARD	gen=701 glyphs=4
2026-03-14T03:17:47.951152	5a06ca32	120	30	1.0000	DISCARD	gen=657 glyphs=4
2026-03-14T03:17:48.227135	8aef8872	116	29	1.0000	DISCARD	gen=701 glyphs=4
2026-03-14T03:17:50.643286	1d34459a	116	29	1.0000	DISCARD	gen=657 glyphs=4
2026-03-14T03:17:50.898981	59a507bd	116	29	1.0000	DISCARD	gen=701 glyphs=4
2026-03-14T03:17:53.425717	bfdf7cad	120	30	1.0000	DISCARD	gen=657 glyphs=4
2026-03-14T03:17:53.689870	0eaedb57	116	29	1.0000	DISCARD	gen=701 glyphs=4
2026-03-14T03:17:56.100125	37f4017b	116	29	1.0000	DISCARD	gen=658 glyphs=4
2026-03-14T03:17:56.372967	8aef8872	116	29	1.0000	DISCARD	gen=701 glyphs=4
2026-03-14T03:17:58.797226	bfdf7cad	120	30	1.0000	DISCARD	gen=658 glyphs=4
2026-03-14T03:17:59.062838	19355583	120	30	1.0000	DISCARD	gen=702 glyphs=4
2026-03-14T03:18:01.489473	7ca87b42	116	29	1.0000	DISCARD	gen=658 glyphs=4
2026-03-14T03:18:01.743550	8aef8872	116	29	1.0000	DISCARD	gen=702 glyphs=4
2026-03-14T03:18:04.162115	55d6c151	120	30	1.0000	DISCARD	gen=658 glyphs=4
2026-03-14T03:18:04.428992	50dc991d	116	29	1.0000	DISCARD	gen=702 glyphs=4
2026-03-14T03:18:06.825232	299e495c	116	29	0.9500	DISCARD	gen=658 glyphs=4
2026-03-14T03:18:07.093254	0eaedb57	116	29	1.0000	DISCARD	gen=702 glyphs=4
2026-03-14T03:18:09.502221	5d57d83c	120	30	1.0000	DISCARD	gen=658 glyphs=4
2026-03-14T03:18:09.765420	f1773540	116	29	1.0000	DISCARD	gen=702 glyphs=4
2026-03-14T03:18:12.177056	37f4017b	116	29	1.0000	DISCARD	gen=658 glyphs=4
2026-03-14T03:18:12.436052	050862ad	120	30	1.0000	DISCARD	gen=702 glyphs=4
2026-03-14T03:18:14.824604	5a06ca32	120	30	1.0000	DISCARD	gen=658 glyphs=4
2026-03-14T03:18:15.090522	3b924039	116	29	1.0000	DISCARD	gen=702 glyphs=4
2026-03-14T03:18:17.566854	37f4017b	116	29	1.0000	DISCARD	gen=658 glyphs=4
2026-03-14T03:18:17.822574	41a2e376	116	29	1.0000	DISCARD	gen=702 glyphs=4
2026-03-14T03:18:20.222002	1d34459a	116	29	1.0000	DISCARD	gen=658 glyphs=4
2026-03-14T03:18:20.510772	1e5f0e21	116	29	1.0000	DISCARD	gen=702 glyphs=4
2026-03-14T03:18:22.899813	37f4017b	116	29	1.0000	DISCARD	gen=659 glyphs=4
2026-03-14T03:18:23.161801	0eaedb57	116	29	1.0000	DISCARD	gen=702 glyphs=4
2026-03-14T03:18:25.700610	bfdf7cad	120	30	1.0000	DISCARD	gen=659 glyphs=4
2026-03-14T03:18:25.963926	19355583	120	30	1.0000	DISCARD	gen=703 glyphs=4
2026-03-14T03:18:28.386787	12b38c2d	116	29	1.0000	DISCARD	gen=659 glyphs=4
2026-03-14T03:18:28.669807	8aef8872	116	29	1.0000	DISCARD	gen=703 glyphs=4
2026-03-14T03:18:31.094602	12b38c2d	116	29	1.0000	DISCARD	gen=659 glyphs=4
2026-03-14T03:18:31.349438	9e34ede0	116	29	1.0000	DISCARD	gen=703 glyphs=4
2026-03-14T03:18:33.756172	37f4017b	116	29	1.0000	DISCARD	gen=659 glyphs=4
2026-03-14T03:18:34.021434	c7449efe	116	29	1.0000	DISCARD	gen=703 glyphs=4
2026-03-14T03:18:36.482790	4c9b0dd4	120	30	1.0000	DISCARD	gen=659 glyphs=4
2026-03-14T03:18:36.762062	875e0f8a	116	29	1.0000	DISCARD	gen=703 glyphs=4
2026-03-14T03:18:39.183071	37f4017b	116	29	1.0000	DISCARD	gen=659 glyphs=4
2026-03-14T03:18:39.452514	8aef8872	116	29	1.0000	DISCARD	gen=703 glyphs=4
2026-03-14T03:18:41.859501	7ca87b42	116	29	1.0000	DISCARD	gen=659 glyphs=4
2026-03-14T03:18:42.125058	0eaedb57	116	29	1.0000	DISCARD	gen=703 glyphs=4
2026-03-14T03:18:44.506958	37f4017b	116	29	1.0000	DISCARD	gen=659 glyphs=4
2026-03-14T03:18:44.785472	50dc991d	116	29	1.0000	DISCARD	gen=703 glyphs=4
2026-03-14T03:18:47.184566	1d34459a	116	29	1.0000	DISCARD	gen=659 glyphs=4
2026-03-14T03:18:47.452059	875e0f8a	116	29	1.0000	DISCARD	gen=703 glyphs=4
2026-03-14T03:18:49.846274	37f4017b	116	29	1.0000	DISCARD	gen=660 glyphs=4
2026-03-14T03:18:50.111031	a2b77cfc	120	30	0.9500	DISCARD	gen=703 glyphs=4
2026-03-14T03:18:52.538818	bfdf7cad	120	30	1.0000	DISCARD	gen=660 glyphs=4
2026-03-14T03:18:52.807194	19355583	120	30	1.0000	DISCARD	gen=704 glyphs=4
2026-03-14T03:18:55.215167	5a06ca32	120	30	1.0000	DISCARD	gen=660 glyphs=4
2026-03-14T03:18:55.480508	8aef8872	116	29	1.0000	DISCARD	gen=704 glyphs=4
2026-03-14T03:18:57.978122	5a06ca32	120	30	1.0000	DISCARD	gen=660 glyphs=4
2026-03-14T03:18:58.250219	8aef8872	116	29	1.0000	DISCARD	gen=704 glyphs=4
2026-03-14T03:19:00.637737	55d6c151	120	30	1.0000	DISCARD	gen=660 glyphs=4
2026-03-14T03:19:00.904875	a78f9454	120	30	1.0000	DISCARD	gen=704 glyphs=4
2026-03-14T03:19:03.334658	5b9807ac	120	30	1.0000	DISCARD	gen=660 glyphs=4
2026-03-14T03:19:03.601336	67cb81be	120	30	1.0000	DISCARD	gen=704 glyphs=4
2026-03-14T03:19:05.993226	bfdf7cad	120	30	1.0000	DISCARD	gen=660 glyphs=4
2026-03-14T03:19:06.260316	19355583	120	30	1.0000	DISCARD	gen=704 glyphs=4
2026-03-14T03:19:08.674052	5a06ca32	120	30	1.0000	DISCARD	gen=660 glyphs=4
2026-03-14T03:19:08.944028	0eaedb57	116	29	1.0000	DISCARD	gen=704 glyphs=4
2026-03-14T03:19:11.354215	e305a08f	120	30	1.0000	DISCARD	gen=660 glyphs=4
2026-03-14T03:19:11.624222	0f3b21c2	116	29	1.0000	DISCARD	gen=704 glyphs=4
2026-03-14T03:19:14.038367	fdb5d108	120	30	1.0000	DISCARD	gen=660 glyphs=4
2026-03-14T03:19:14.300219	eca7ab6c	116	29	1.0000	DISCARD	gen=704 glyphs=4
2026-03-14T03:19:16.715431	37f4017b	116	29	1.0000	DISCARD	gen=661 glyphs=4
2026-03-14T03:19:16.983151	050862ad	120	30	1.0000	DISCARD	gen=704 glyphs=4
2026-03-14T03:19:19.414630	bfdf7cad	120	30	1.0000	DISCARD	gen=661 glyphs=4
2026-03-14T03:19:19.676792	19355583	120	30	1.0000	DISCARD	gen=705 glyphs=4
2026-03-14T03:19:22.105466	37f4017b	116	29	1.0000	DISCARD	gen=661 glyphs=4
2026-03-14T03:19:22.371175	8aef8872	116	29	1.0000	DISCARD	gen=705 glyphs=4
2026-03-14T03:19:24.779303	bfdf7cad	120	30	1.0000	DISCARD	gen=661 glyphs=4
2026-03-14T03:19:25.054590	8aef8872	116	29	1.0000	DISCARD	gen=705 glyphs=4
2026-03-14T03:19:27.467077	c807eac7	116	29	1.0000	DISCARD	gen=661 glyphs=4
2026-03-14T03:19:27.792939	0eaedb57	116	29	1.0000	DISCARD	gen=705 glyphs=4
2026-03-14T03:19:30.238576	5a06ca32	120	30	1.0000	DISCARD	gen=661 glyphs=4
2026-03-14T03:19:30.503676	9e34ede0	116	29	1.0000	DISCARD	gen=705 glyphs=4
2026-03-14T03:19:32.929897	294c48dc	116	29	0.9500	DISCARD	gen=661 glyphs=4
2026-03-14T03:19:33.204929	050862ad	120	30	1.0000	DISCARD	gen=705 glyphs=4
2026-03-14T03:19:35.632189	37f4017b	116	29	1.0000	DISCARD	gen=661 glyphs=4
2026-03-14T03:19:35.915304	3053c9c1	120	30	1.0000	DISCARD	gen=705 glyphs=4
2026-03-14T03:19:38.345168	37f4017b	116	29	1.0000	DISCARD	gen=661 glyphs=4
2026-03-14T03:19:38.615368	19355583	120	30	1.0000	DISCARD	gen=705 glyphs=4
2026-03-14T03:19:40.999403	736b5ffc	116	29	1.0000	DISCARD	gen=661 glyphs=4
2026-03-14T03:19:41.266525	050862ad	120	30	1.0000	DISCARD	gen=705 glyphs=4
2026-03-14T03:19:43.688325	37f4017b	116	29	1.0000	DISCARD	gen=662 glyphs=4
2026-03-14T03:19:43.962825	e2cd28ea	120	30	1.0000	DISCARD	gen=705 glyphs=4
2026-03-14T03:19:46.376126	bfdf7cad	120	30	1.0000	DISCARD	gen=662 glyphs=4
2026-03-14T03:19:46.643211	19355583	120	30	1.0000	DISCARD	gen=706 glyphs=4
2026-03-14T03:19:49.065753	0b704616	120	30	1.0000	DISCARD	gen=662 glyphs=4
2026-03-14T03:19:49.338368	8aef8872	116	29	1.0000	DISCARD	gen=706 glyphs=4
2026-03-14T03:19:51.756603	231b78fe	116	29	1.0000	DISCARD	gen=662 glyphs=4
2026-03-14T03:19:52.030407	1e5f0e21	116	29	1.0000	DISCARD	gen=706 glyphs=4
2026-03-14T03:19:54.443015	71e2ba66	116	29	1.0000	DISCARD	gen=662 glyphs=4
2026-03-14T03:19:54.722141	19355583	120	30	1.0000	DISCARD	gen=706 glyphs=4
2026-03-14T03:19:57.150336	5a06ca32	120	30	1.0000	DISCARD	gen=662 glyphs=4
2026-03-14T03:19:57.414894	3e1d4b06	116	29	1.0000	DISCARD	gen=706 glyphs=4
2026-03-14T03:19:59.858423	fdb5d108	120	30	1.0000	DISCARD	gen=662 glyphs=4
2026-03-14T03:20:00.148919	27b0383c	120	30	1.0000	DISCARD	gen=706 glyphs=4
2026-03-14T03:20:02.610604	54d4dd2c	116	29	1.0000	DISCARD	gen=662 glyphs=4
2026-03-14T03:20:02.886452	875e0f8a	116	29	1.0000	DISCARD	gen=706 glyphs=4
2026-03-14T03:20:05.308017	5a06ca32	120	30	1.0000	DISCARD	gen=662 glyphs=4
2026-03-14T03:20:05.579006	0eaedb57	116	29	1.0000	DISCARD	gen=706 glyphs=4
2026-03-14T03:20:07.998771	d9f0ae8b	116	29	1.0000	DISCARD	gen=662 glyphs=4
2026-03-14T03:20:08.266309	b57e7176	120	30	1.0000	DISCARD	gen=706 glyphs=4
2026-03-14T03:20:10.695416	37f4017b	116	29	1.0000	DISCARD	gen=663 glyphs=4
2026-03-14T03:20:10.961992	be438c43	116	29	1.0000	DISCARD	gen=706 glyphs=4
2026-03-14T03:20:13.393370	bfdf7cad	120	30	1.0000	DISCARD	gen=663 glyphs=4
2026-03-14T03:20:13.664802	19355583	120	30	1.0000	DISCARD	gen=707 glyphs=4
2026-03-14T03:20:16.117190	3fa9040e	116	29	1.0000	DISCARD	gen=663 glyphs=4
2026-03-14T03:20:16.387174	8aef8872	116	29	1.0000	DISCARD	gen=707 glyphs=4
2026-03-14T03:20:18.815328	55d6c151	120	30	1.0000	DISCARD	gen=663 glyphs=4
2026-03-14T03:20:19.078119	050862ad	120	30	1.0000	DISCARD	gen=707 glyphs=4
2026-03-14T03:20:21.519094	37f4017b	116	29	1.0000	DISCARD	gen=663 glyphs=4
2026-03-14T03:20:21.799621	b7aed8e9	116	29	1.0000	DISCARD	gen=707 glyphs=4
2026-03-14T03:20:24.212395	71e2ba66	116	29	1.0000	DISCARD	gen=663 glyphs=4
2026-03-14T03:20:24.482036	8aef8872	116	29	1.0000	DISCARD	gen=707 glyphs=4
2026-03-14T03:20:26.932650	1d34459a	116	29	1.0000	DISCARD	gen=663 glyphs=4
2026-03-14T03:20:27.200874	9e34ede0	116	29	1.0000	DISCARD	gen=707 glyphs=4
2026-03-14T03:20:29.614319	5a06ca32	120	30	1.0000	DISCARD	gen=663 glyphs=4
2026-03-14T03:20:29.875298	dcf173c8	116	29	1.0000	DISCARD	gen=707 glyphs=4
2026-03-14T03:20:32.377043	fb777d0a	116	29	1.0000	DISCARD	gen=663 glyphs=4
2026-03-14T03:20:32.636893	1e5f0e21	116	29	1.0000	DISCARD	gen=707 glyphs=4
2026-03-14T03:20:35.050574	4b8bb3f5	120	30	1.0000	DISCARD	gen=663 glyphs=4
2026-03-14T03:20:35.321349	0eaedb57	116	29	1.0000	DISCARD	gen=707 glyphs=4
2026-03-14T03:20:37.755181	37f4017b	116	29	1.0000	DISCARD	gen=664 glyphs=4
2026-03-14T03:20:38.016207	4549249b	116	29	1.0000	DISCARD	gen=707 glyphs=4
2026-03-14T03:20:40.448624	bfdf7cad	120	30	1.0000	DISCARD	gen=664 glyphs=4
2026-03-14T03:20:40.734658	19355583	120	30	1.0000	DISCARD	gen=708 glyphs=4
2026-03-14T03:20:43.160366	5a06ca32	120	30	1.0000	DISCARD	gen=664 glyphs=4
2026-03-14T03:20:43.433347	8aef8872	116	29	1.0000	DISCARD	gen=708 glyphs=4
2026-03-14T03:20:45.883887	5a06ca32	120	30	1.0000	DISCARD	gen=664 glyphs=4
2026-03-14T03:20:46.161817	ac9bf87f	116	29	1.0000	DISCARD	gen=708 glyphs=4
2026-03-14T03:20:48.594332	4c9b0dd4	120	30	1.0000	DISCARD	gen=664 glyphs=4
2026-03-14T03:20:48.875230	19355583	120	30	1.0000	DISCARD	gen=708 glyphs=4
2026-03-14T03:20:51.290785	37f4017b	116	29	1.0000	DISCARD	gen=664 glyphs=4
2026-03-14T03:20:51.555270	b57e7176	120	30	1.0000	DISCARD	gen=708 glyphs=4
2026-03-14T03:20:53.975820	5b9807ac	120	30	1.0000	DISCARD	gen=664 glyphs=4
2026-03-14T03:20:54.242087	415ded29	120	30	1.0000	DISCARD	gen=708 glyphs=4
2026-03-14T03:20:56.656408	55d6c151	120	30	1.0000	DISCARD	gen=664 glyphs=4
2026-03-14T03:20:56.927815	0eaedb57	116	29	1.0000	DISCARD	gen=708 glyphs=4
2026-03-14T03:20:59.344449	71e2ba66	116	29	1.0000	DISCARD	gen=664 glyphs=4
2026-03-14T03:20:59.610192	ce289b2f	116	29	1.0000	DISCARD	gen=708 glyphs=4
2026-03-14T03:21:02.004194	1d34459a	116	29	1.0000	DISCARD	gen=664 glyphs=4
2026-03-14T03:21:02.279223	9e34ede0	116	29	1.0000	DISCARD	gen=708 glyphs=4
2026-03-14T03:21:04.805741	37f4017b	116	29	1.0000	DISCARD	gen=665 glyphs=4
2026-03-14T03:21:05.069204	875e0f8a	116	29	1.0000	DISCARD	gen=708 glyphs=4
2026-03-14T03:21:07.501295	bfdf7cad	120	30	1.0000	DISCARD	gen=665 glyphs=4
2026-03-14T03:21:07.760032	19355583	120	30	1.0000	DISCARD	gen=709 glyphs=4
2026-03-14T03:21:10.202489	cdb1348a	116	29	0.9000	DISCARD	gen=665 glyphs=4
2026-03-14T03:21:10.469624	8aef8872	116	29	1.0000	DISCARD	gen=709 glyphs=4
2026-03-14T03:21:12.853677	37f4017b	116	29	1.0000	DISCARD	gen=665 glyphs=4
2026-03-14T03:21:13.128653	e2cd28ea	120	30	1.0000	DISCARD	gen=709 glyphs=4
2026-03-14T03:21:15.512839	12b38c2d	116	29	1.0000	DISCARD	gen=665 glyphs=4
2026-03-14T03:21:15.785064	ae44ace5	116	29	1.0000	DISCARD	gen=709 glyphs=4
2026-03-14T03:21:18.187297	55d6c151	120	30	1.0000	DISCARD	gen=665 glyphs=4
2026-03-14T03:21:18.459487	0eaedb57	116	29	1.0000	DISCARD	gen=709 glyphs=4
2026-03-14T03:21:20.862257	37f4017b	116	29	1.0000	DISCARD	gen=665 glyphs=4
2026-03-14T03:21:21.125779	d7c8681b	120	30	1.0000	DISCARD	gen=709 glyphs=4
