timestamp	program_hash	spirv_size	word_count	fitness	status	description
2026-03-14T07:36:44.438928	d6ee85a1	0	0	0.0000	CRASH	gen=200 glyphs=4
2026-03-14T07:36:44.439129	8f97b2a9	0	0	0.0000	CRASH	gen=200 glyphs=3
2026-03-14T07:36:44.439413	099964a4	0	0	0.0000	CRASH	gen=201 glyphs=4
2026-03-14T07:36:44.439613	099964a4	0	0	0.0000	CRASH	gen=201 glyphs=4
2026-03-14T07:36:44.439810	5f9fe02d	0	0	0.0000	CRASH	gen=201 glyphs=3
2026-03-14T07:36:44.440004	099964a4	0	0	0.0000	CRASH	gen=201 glyphs=4
2026-03-14T07:36:44.440212	3ca14993	0	0	0.0000	CRASH	gen=201 glyphs=4
2026-03-14T07:36:44.440407	b242f9b2	0	0	0.0000	CRASH	gen=201 glyphs=4
2026-03-14T07:36:44.440604	099964a4	0	0	0.0000	CRASH	gen=201 glyphs=4
2026-03-14T07:36:44.440796	099964a4	0	0	0.0000	CRASH	gen=201 glyphs=4
2026-03-14T07:36:44.440990	bddf8340	0	0	0.0000	CRASH	gen=201 glyphs=4
2026-03-14T07:36:44.441192	38dd62ec	0	0	0.0000	CRASH	gen=201 glyphs=4
2026-03-14T07:36:44.441462	099964a4	0	0	0.0000	CRASH	gen=202 glyphs=4
2026-03-14T07:36:44.441663	099964a4	0	0	0.0000	CRASH	gen=202 glyphs=4
2026-03-14T07:36:44.441857	099964a4	0	0	0.0000	CRASH	gen=202 glyphs=4
2026-03-14T07:36:44.442052	099964a4	0	0	0.0000	CRASH	gen=202 glyphs=4
2026-03-14T07:36:44.442246	099964a4	0	0	0.0000	CRASH	gen=202 glyphs=4
2026-03-14T07:36:44.442442	099964a4	0	0	0.0000	CRASH	gen=202 glyphs=4
2026-03-14T07:36:44.442637	099964a4	0	0	0.0000	CRASH	gen=202 glyphs=4
2026-03-14T07:36:44.442829	3ca14993	0	0	0.0000	CRASH	gen=202 glyphs=4
2026-03-14T07:36:44.443025	7ede4765	0	0	0.0000	CRASH	gen=202 glyphs=2
2026-03-14T07:36:44.443217	cd1a8dca	0	0	0.0000	CRASH	gen=202 glyphs=4
2026-03-14T07:36:44.443496	099964a4	0	0	0.0000	CRASH	gen=203 glyphs=4
2026-03-14T07:36:44.443691	099964a4	0	0	0.0000	CRASH	gen=203 glyphs=4
2026-03-14T07:36:44.443886	25852db5	0	0	0.0000	CRASH	gen=203 glyphs=4
2026-03-14T07:36:44.444080	099964a4	0	0	0.0000	CRASH	gen=203 glyphs=4
2026-03-14T07:36:44.444276	099964a4	0	0	0.0000	CRASH	gen=203 glyphs=4
2026-03-14T07:36:44.444474	18966024	0	0	0.0000	CRASH	gen=203 glyphs=4
2026-03-14T07:36:44.444675	0b8c43ef	0	0	0.0000	CRASH	gen=203 glyphs=4
2026-03-14T07:36:44.444871	099964a4	0	0	0.0000	CRASH	gen=203 glyphs=4
2026-03-14T07:36:44.445066	099964a4	0	0	0.0000	CRASH	gen=203 glyphs=4
2026-03-14T07:36:44.445258	099964a4	0	0	0.0000	CRASH	gen=203 glyphs=4
2026-03-14T07:36:44.445547	099964a4	0	0	0.0000	CRASH	gen=204 glyphs=4
2026-03-14T07:36:44.445744	099964a4	0	0	0.0000	CRASH	gen=204 glyphs=4
2026-03-14T07:36:44.445939	099964a4	0	0	0.0000	CRASH	gen=204 glyphs=4
2026-03-14T07:36:44.446134	099964a4	0	0	0.0000	CRASH	gen=204 glyphs=4
2026-03-14T07:36:44.446328	6d979a95	0	0	0.0000	CRASH	gen=204 glyphs=3
2026-03-14T07:36:44.446524	80cef82b	0	0	0.0000	CRASH	gen=204 glyphs=4
2026-03-14T07:36:44.446722	099964a4	0	0	0.0000	CRASH	gen=204 glyphs=4
2026-03-14T07:36:44.446918	26745e4f	0	0	0.0000	CRASH	gen=204 glyphs=4
2026-03-14T07:36:44.447119	2cd3582e	0	0	0.0000	CRASH	gen=204 glyphs=4
2026-03-14T07:36:44.447324	c23fb7f0	0	0	0.0000	CRASH	gen=204 glyphs=2
2026-03-14T07:36:44.447607	099964a4	0	0	0.0000	CRASH	gen=205 glyphs=4
2026-03-14T07:36:44.447805	099964a4	0	0	0.0000	CRASH	gen=205 glyphs=4
2026-03-14T07:36:44.447999	099964a4	0	0	0.0000	CRASH	gen=205 glyphs=4
2026-03-14T07:36:44.448193	099964a4	0	0	0.0000	CRASH	gen=205 glyphs=4
2026-03-14T07:36:44.448386	436006a9	0	0	0.0000	CRASH	gen=205 glyphs=3
2026-03-14T07:36:44.448580	b37683da	0	0	0.0000	CRASH	gen=205 glyphs=5
2026-03-14T07:36:44.448778	3a734398	0	0	0.0000	CRASH	gen=205 glyphs=4
2026-03-14T07:36:44.448972	3a734398	0	0	0.0000	CRASH	gen=205 glyphs=4
2026-03-14T07:36:44.449185	41d71977	0	0	0.0000	CRASH	gen=205 glyphs=3
2026-03-14T07:36:44.449379	0ae2ec5c	0	0	0.0000	CRASH	gen=205 glyphs=4
2026-03-14T07:36:44.449659	099964a4	0	0	0.0000	CRASH	gen=206 glyphs=4
2026-03-14T07:36:44.449861	099964a4	0	0	0.0000	CRASH	gen=206 glyphs=4
2026-03-14T07:36:44.450055	099964a4	0	0	0.0000	CRASH	gen=206 glyphs=4
2026-03-14T07:36:44.450248	099964a4	0	0	0.0000	CRASH	gen=206 glyphs=4
2026-03-14T07:36:44.450440	a9b17602	0	0	0.0000	CRASH	gen=206 glyphs=2
2026-03-14T07:36:44.450635	3ca14993	0	0	0.0000	CRASH	gen=206 glyphs=4
2026-03-14T07:36:44.450834	099964a4	0	0	0.0000	CRASH	gen=206 glyphs=4
2026-03-14T07:36:44.451028	984aface	0	0	0.0000	CRASH	gen=206 glyphs=4
2026-03-14T07:36:44.451225	099964a4	0	0	0.0000	CRASH	gen=206 glyphs=4
2026-03-14T07:36:44.451417	099964a4	0	0	0.0000	CRASH	gen=206 glyphs=4
2026-03-14T07:36:44.451694	099964a4	0	0	0.0000	CRASH	gen=207 glyphs=4
2026-03-14T07:36:44.451892	099964a4	0	0	0.0000	CRASH	gen=207 glyphs=4
2026-03-14T07:36:44.452086	099964a4	0	0	0.0000	CRASH	gen=207 glyphs=4
2026-03-14T07:36:44.452276	099964a4	0	0	0.0000	CRASH	gen=207 glyphs=4
2026-03-14T07:36:44.452468	099964a4	0	0	0.0000	CRASH	gen=207 glyphs=4
2026-03-14T07:36:44.452662	099964a4	0	0	0.0000	CRASH	gen=207 glyphs=4
2026-03-14T07:36:44.452852	29c8ff80	0	0	0.0000	CRASH	gen=207 glyphs=4
2026-03-14T07:36:44.453046	099964a4	0	0	0.0000	CRASH	gen=207 glyphs=4
2026-03-14T07:36:44.453249	099964a4	0	0	0.0000	CRASH	gen=207 glyphs=4
2026-03-14T07:36:44.453450	ff30496a	0	0	0.0000	CRASH	gen=207 glyphs=3
2026-03-14T07:36:44.453732	099964a4	0	0	0.0000	CRASH	gen=208 glyphs=4
2026-03-14T07:36:44.453939	099964a4	0	0	0.0000	CRASH	gen=208 glyphs=4
2026-03-14T07:36:44.454154	43c9ffec	0	0	0.0000	CRASH	gen=208 glyphs=4
2026-03-14T07:36:44.454366	6157c461	0	0	0.0000	CRASH	gen=208 glyphs=3
2026-03-14T07:36:44.454570	099964a4	0	0	0.0000	CRASH	gen=208 glyphs=4
2026-03-14T07:36:44.454761	8da1f8d8	0	0	0.0000	CRASH	gen=208 glyphs=4
2026-03-14T07:36:44.454958	099964a4	0	0	0.0000	CRASH	gen=208 glyphs=4
2026-03-14T07:36:44.455154	099964a4	0	0	0.0000	CRASH	gen=208 glyphs=4
2026-03-14T07:36:44.455347	099964a4	0	0	0.0000	CRASH	gen=208 glyphs=4
2026-03-14T07:36:44.455541	0e8e83d3	0	0	0.0000	CRASH	gen=208 glyphs=4
2026-03-14T07:36:44.455826	099964a4	0	0	0.0000	CRASH	gen=209 glyphs=4
2026-03-14T07:36:44.456018	099964a4	0	0	0.0000	CRASH	gen=209 glyphs=4
2026-03-14T07:36:44.456218	099964a4	0	0	0.0000	CRASH	gen=209 glyphs=4
2026-03-14T07:36:44.456408	099964a4	0	0	0.0000	CRASH	gen=209 glyphs=4
2026-03-14T07:36:44.456602	099964a4	0	0	0.0000	CRASH	gen=209 glyphs=4
2026-03-14T07:36:44.456792	099964a4	0	0	0.0000	CRASH	gen=209 glyphs=4
2026-03-14T07:36:44.456985	80cef82b	0	0	0.0000	CRASH	gen=209 glyphs=4
2026-03-14T07:36:44.457177	099964a4	0	0	0.0000	CRASH	gen=209 glyphs=4
2026-03-14T07:36:44.457372	099964a4	0	0	0.0000	CRASH	gen=209 glyphs=4
2026-03-14T07:36:44.457564	dcb1fb50	0	0	0.0000	CRASH	gen=209 glyphs=4
2026-03-14T07:36:44.457840	099964a4	0	0	0.0000	CRASH	gen=210 glyphs=4
2026-03-14T07:36:44.458037	099964a4	0	0	0.0000	CRASH	gen=210 glyphs=4
2026-03-14T07:36:44.458229	099964a4	0	0	0.0000	CRASH	gen=210 glyphs=4
2026-03-14T07:36:44.458432	099964a4	0	0	0.0000	CRASH	gen=210 glyphs=4
2026-03-14T07:36:44.458627	cf93b656	0	0	0.0000	CRASH	gen=210 glyphs=3
2026-03-14T07:36:44.458819	c8c06836	0	0	0.0000	CRASH	gen=210 glyphs=3
2026-03-14T07:36:44.459013	099964a4	0	0	0.0000	CRASH	gen=210 glyphs=4
2026-03-14T07:36:44.459207	099964a4	0	0	0.0000	CRASH	gen=210 glyphs=4
2026-03-14T07:36:44.459404	cf93b656	0	0	0.0000	CRASH	gen=210 glyphs=3
2026-03-14T07:36:44.459600	099964a4	0	0	0.0000	CRASH	gen=210 glyphs=4
2026-03-14T07:36:44.459879	099964a4	0	0	0.0000	CRASH	gen=211 glyphs=4
2026-03-14T07:36:44.460071	099964a4	0	0	0.0000	CRASH	gen=211 glyphs=4
2026-03-14T07:36:44.460263	ff30496a	0	0	0.0000	CRASH	gen=211 glyphs=3
2026-03-14T07:36:44.460456	667e72f9	0	0	0.0000	CRASH	gen=211 glyphs=4
2026-03-14T07:36:44.460655	04898b58	0	0	0.0000	CRASH	gen=211 glyphs=3
2026-03-14T07:36:44.460849	ff30496a	0	0	0.0000	CRASH	gen=211 glyphs=3
2026-03-14T07:36:44.461041	099964a4	0	0	0.0000	CRASH	gen=211 glyphs=4
2026-03-14T07:36:44.461233	099964a4	0	0	0.0000	CRASH	gen=211 glyphs=4
2026-03-14T07:36:44.461426	099964a4	0	0	0.0000	CRASH	gen=211 glyphs=4
2026-03-14T07:36:44.461623	6f3ba1bf	0	0	0.0000	CRASH	gen=211 glyphs=3
2026-03-14T07:36:44.461893	099964a4	0	0	0.0000	CRASH	gen=212 glyphs=4
2026-03-14T07:36:44.462089	099964a4	0	0	0.0000	CRASH	gen=212 glyphs=4
2026-03-14T07:36:44.462282	ff30496a	0	0	0.0000	CRASH	gen=212 glyphs=3
2026-03-14T07:36:44.462474	6e83ddd7	0	0	0.0000	CRASH	gen=212 glyphs=2
2026-03-14T07:36:44.462674	1c11366b	0	0	0.0000	CRASH	gen=212 glyphs=3
2026-03-14T07:36:44.462865	099964a4	0	0	0.0000	CRASH	gen=212 glyphs=4
2026-03-14T07:36:44.463055	099964a4	0	0	0.0000	CRASH	gen=212 glyphs=4
2026-03-14T07:36:44.463246	099964a4	0	0	0.0000	CRASH	gen=212 glyphs=4
2026-03-14T07:36:44.463444	cf93b656	0	0	0.0000	CRASH	gen=212 glyphs=3
2026-03-14T07:36:44.463642	3ca14993	0	0	0.0000	CRASH	gen=212 glyphs=4
2026-03-14T07:36:44.463924	099964a4	0	0	0.0000	CRASH	gen=213 glyphs=4
2026-03-14T07:36:44.464120	099964a4	0	0	0.0000	CRASH	gen=213 glyphs=4
2026-03-14T07:36:44.464312	099964a4	0	0	0.0000	CRASH	gen=213 glyphs=4
2026-03-14T07:36:44.464504	7ede4765	0	0	0.0000	CRASH	gen=213 glyphs=2
2026-03-14T07:36:44.464701	80cef82b	0	0	0.0000	CRASH	gen=213 glyphs=4
2026-03-14T07:36:44.464898	6e0fd0b3	0	0	0.0000	CRASH	gen=213 glyphs=4
2026-03-14T07:36:44.465092	099964a4	0	0	0.0000	CRASH	gen=213 glyphs=4
2026-03-14T07:36:44.465283	099964a4	0	0	0.0000	CRASH	gen=213 glyphs=4
2026-03-14T07:36:44.465475	ff30496a	0	0	0.0000	CRASH	gen=213 glyphs=3
2026-03-14T07:36:44.465669	3a734398	0	0	0.0000	CRASH	gen=213 glyphs=4
2026-03-14T07:36:44.465953	099964a4	0	0	0.0000	CRASH	gen=214 glyphs=4
2026-03-14T07:36:44.466149	099964a4	0	0	0.0000	CRASH	gen=214 glyphs=4
2026-03-14T07:36:44.466344	fcbab5eb	0	0	0.0000	CRASH	gen=214 glyphs=4
2026-03-14T07:36:44.466541	099964a4	0	0	0.0000	CRASH	gen=214 glyphs=4
2026-03-14T07:36:44.466734	dcb1fb50	0	0	0.0000	CRASH	gen=214 glyphs=4
2026-03-14T07:36:44.466933	bd31a305	0	0	0.0000	CRASH	gen=214 glyphs=3
2026-03-14T07:36:44.467126	c5745af4	0	0	0.0000	CRASH	gen=214 glyphs=4
2026-03-14T07:36:44.467319	099964a4	0	0	0.0000	CRASH	gen=214 glyphs=4
2026-03-14T07:36:44.467513	3a734398	0	0	0.0000	CRASH	gen=214 glyphs=4
2026-03-14T07:36:44.467709	ff30496a	0	0	0.0000	CRASH	gen=214 glyphs=3
2026-03-14T07:36:44.467989	099964a4	0	0	0.0000	CRASH	gen=215 glyphs=4
2026-03-14T07:36:44.468194	099964a4	0	0	0.0000	CRASH	gen=215 glyphs=4
2026-03-14T07:36:44.468397	7858e384	0	0	0.0000	CRASH	gen=215 glyphs=5
2026-03-14T07:36:44.468594	099964a4	0	0	0.0000	CRASH	gen=215 glyphs=4
2026-03-14T07:36:44.468787	8da1f8d8	0	0	0.0000	CRASH	gen=215 glyphs=4
2026-03-14T07:36:44.468983	32ea488a	0	0	0.0000	CRASH	gen=215 glyphs=2
2026-03-14T07:36:44.469177	fa71a627	0	0	0.0000	CRASH	gen=215 glyphs=3
2026-03-14T07:36:44.469370	099964a4	0	0	0.0000	CRASH	gen=215 glyphs=4
2026-03-14T07:36:44.469568	3ca14993	0	0	0.0000	CRASH	gen=215 glyphs=4
2026-03-14T07:36:44.469762	099964a4	0	0	0.0000	CRASH	gen=215 glyphs=4
2026-03-14T07:36:44.470058	099964a4	0	0	0.0000	CRASH	gen=216 glyphs=4
2026-03-14T07:36:44.470257	099964a4	0	0	0.0000	CRASH	gen=216 glyphs=4
2026-03-14T07:36:44.470450	099964a4	0	0	0.0000	CRASH	gen=216 glyphs=4
2026-03-14T07:36:44.470649	bab2affa	0	0	0.0000	CRASH	gen=216 glyphs=3
2026-03-14T07:36:44.470841	099964a4	0	0	0.0000	CRASH	gen=216 glyphs=4
2026-03-14T07:36:44.471030	099964a4	0	0	0.0000	CRASH	gen=216 glyphs=4
2026-03-14T07:36:44.471226	099964a4	0	0	0.0000	CRASH	gen=216 glyphs=4
2026-03-14T07:36:44.471415	6c7bcb33	0	0	0.0000	CRASH	gen=216 glyphs=4
2026-03-14T07:36:44.471620	099964a4	0	0	0.0000	CRASH	gen=216 glyphs=4
2026-03-14T07:36:44.471818	2377b86d	0	0	0.0000	CRASH	gen=216 glyphs=4
2026-03-14T07:36:44.472108	099964a4	0	0	0.0000	CRASH	gen=217 glyphs=4
2026-03-14T07:36:44.472313	099964a4	0	0	0.0000	CRASH	gen=217 glyphs=4
2026-03-14T07:36:44.472513	099964a4	0	0	0.0000	CRASH	gen=217 glyphs=4
2026-03-14T07:36:44.472708	dcb1fb50	0	0	0.0000	CRASH	gen=217 glyphs=4
2026-03-14T07:36:44.472903	601529d1	0	0	0.0000	CRASH	gen=217 glyphs=4
2026-03-14T07:36:44.473097	3a734398	0	0	0.0000	CRASH	gen=217 glyphs=4
2026-03-14T07:36:44.473294	099964a4	0	0	0.0000	CRASH	gen=217 glyphs=4
2026-03-14T07:36:44.473486	099964a4	0	0	0.0000	CRASH	gen=217 glyphs=4
2026-03-14T07:36:44.473683	2b8d1fe7	0	0	0.0000	CRASH	gen=217 glyphs=3
2026-03-14T07:36:44.473875	78d89677	0	0	0.0000	CRASH	gen=217 glyphs=3
2026-03-14T07:36:44.474154	099964a4	0	0	0.0000	CRASH	gen=218 glyphs=4
2026-03-14T07:36:44.474354	099964a4	0	0	0.0000	CRASH	gen=218 glyphs=4
2026-03-14T07:36:44.474567	099964a4	0	0	0.0000	CRASH	gen=218 glyphs=4
2026-03-14T07:36:44.474760	ff30496a	0	0	0.0000	CRASH	gen=218 glyphs=3
2026-03-14T07:36:44.474953	676ae862	0	0	0.0000	CRASH	gen=218 glyphs=4
2026-03-14T07:36:44.475146	dcb1fb50	0	0	0.0000	CRASH	gen=218 glyphs=4
2026-03-14T07:36:44.475343	81c2629c	0	0	0.0000	CRASH	gen=218 glyphs=3
2026-03-14T07:36:44.475540	099964a4	0	0	0.0000	CRASH	gen=218 glyphs=4
2026-03-14T07:36:44.475735	3ca14993	0	0	0.0000	CRASH	gen=218 glyphs=4
2026-03-14T07:36:44.475930	099964a4	0	0	0.0000	CRASH	gen=218 glyphs=4
2026-03-14T07:36:44.476202	099964a4	0	0	0.0000	CRASH	gen=219 glyphs=4
2026-03-14T07:36:44.476401	099964a4	0	0	0.0000	CRASH	gen=219 glyphs=4
2026-03-14T07:36:44.476596	dcb1fb50	0	0	0.0000	CRASH	gen=219 glyphs=4
2026-03-14T07:36:44.476789	17d91511	0	0	0.0000	CRASH	gen=219 glyphs=4
2026-03-14T07:36:44.476983	a876e3e0	0	0	0.0000	CRASH	gen=219 glyphs=4
2026-03-14T07:36:44.477175	099964a4	0	0	0.0000	CRASH	gen=219 glyphs=4
2026-03-14T07:36:44.477366	b69958c3	0	0	0.0000	CRASH	gen=219 glyphs=4
2026-03-14T07:36:44.477566	3a734398	0	0	0.0000	CRASH	gen=219 glyphs=4
2026-03-14T07:36:44.477758	7d261e04	0	0	0.0000	CRASH	gen=219 glyphs=2
2026-03-14T07:36:44.477950	1ced2c88	0	0	0.0000	CRASH	gen=219 glyphs=3
2026-03-14T07:36:44.478230	099964a4	0	0	0.0000	CRASH	gen=220 glyphs=4
2026-03-14T07:36:44.478424	099964a4	0	0	0.0000	CRASH	gen=220 glyphs=4
2026-03-14T07:36:44.478622	099964a4	0	0	0.0000	CRASH	gen=220 glyphs=4
2026-03-14T07:36:44.478815	099964a4	0	0	0.0000	CRASH	gen=220 glyphs=4
2026-03-14T07:36:44.479003	7ede4765	0	0	0.0000	CRASH	gen=220 glyphs=2
2026-03-14T07:36:44.479193	cbc3c180	0	0	0.0000	CRASH	gen=220 glyphs=4
2026-03-14T07:36:44.479383	7ede4765	0	0	0.0000	CRASH	gen=220 glyphs=2
2026-03-14T07:36:44.479576	d2bfcec7	0	0	0.0000	CRASH	gen=220 glyphs=2
2026-03-14T07:36:44.479770	099964a4	0	0	0.0000	CRASH	gen=220 glyphs=4
2026-03-14T07:36:44.479964	7ede4765	0	0	0.0000	CRASH	gen=220 glyphs=2
2026-03-14T07:36:44.480237	099964a4	0	0	0.0000	CRASH	gen=221 glyphs=4
2026-03-14T07:36:44.480432	099964a4	0	0	0.0000	CRASH	gen=221 glyphs=4
2026-03-14T07:36:44.480629	cf93b656	0	0	0.0000	CRASH	gen=221 glyphs=3
2026-03-14T07:36:44.480822	6dfb4bff	0	0	0.0000	CRASH	gen=221 glyphs=3
2026-03-14T07:36:44.481014	e79304f5	0	0	0.0000	CRASH	gen=221 glyphs=4
2026-03-14T07:36:44.481208	3ca14993	0	0	0.0000	CRASH	gen=221 glyphs=4
2026-03-14T07:36:44.481401	1ddfeceb	0	0	0.0000	CRASH	gen=221 glyphs=4
2026-03-14T07:36:44.481600	099964a4	0	0	0.0000	CRASH	gen=221 glyphs=4
2026-03-14T07:36:44.481799	099964a4	0	0	0.0000	CRASH	gen=221 glyphs=4
2026-03-14T07:36:44.481989	ff30496a	0	0	0.0000	CRASH	gen=221 glyphs=3
2026-03-14T07:36:44.482276	099964a4	0	0	0.0000	CRASH	gen=222 glyphs=4
2026-03-14T07:36:44.482471	099964a4	0	0	0.0000	CRASH	gen=222 glyphs=4
2026-03-14T07:36:44.482666	099964a4	0	0	0.0000	CRASH	gen=222 glyphs=4
2026-03-14T07:36:44.482863	58b05568	0	0	0.0000	CRASH	gen=222 glyphs=3
2026-03-14T07:36:44.483054	099964a4	0	0	0.0000	CRASH	gen=222 glyphs=4
2026-03-14T07:36:44.483244	3ca14993	0	0	0.0000	CRASH	gen=222 glyphs=4
2026-03-14T07:36:44.483438	099964a4	0	0	0.0000	CRASH	gen=222 glyphs=4
2026-03-14T07:36:44.483634	bc56eefd	0	0	0.0000	CRASH	gen=222 glyphs=3
2026-03-14T07:36:44.483835	80cef82b	0	0	0.0000	CRASH	gen=222 glyphs=4
2026-03-14T07:36:44.484028	b9c008f9	0	0	0.0000	CRASH	gen=222 glyphs=4
2026-03-14T07:36:44.484306	099964a4	0	0	0.0000	CRASH	gen=223 glyphs=4
2026-03-14T07:36:44.484506	099964a4	0	0	0.0000	CRASH	gen=223 glyphs=4
2026-03-14T07:36:44.484702	3a734398	0	0	0.0000	CRASH	gen=223 glyphs=4
2026-03-14T07:36:44.484900	ce34fd7e	0	0	0.0000	CRASH	gen=223 glyphs=4
2026-03-14T07:36:44.485097	a6b30c4b	0	0	0.0000	CRASH	gen=223 glyphs=5
2026-03-14T07:36:44.485293	5d05daac	0	0	0.0000	CRASH	gen=223 glyphs=4
2026-03-14T07:36:44.485489	099964a4	0	0	0.0000	CRASH	gen=223 glyphs=4
2026-03-14T07:36:44.485683	099964a4	0	0	0.0000	CRASH	gen=223 glyphs=4
2026-03-14T07:36:44.485877	ff30496a	0	0	0.0000	CRASH	gen=223 glyphs=3
2026-03-14T07:36:44.486075	099964a4	0	0	0.0000	CRASH	gen=223 glyphs=4
2026-03-14T07:36:44.486340	099964a4	0	0	0.0000	CRASH	gen=224 glyphs=4
2026-03-14T07:36:44.486536	099964a4	0	0	0.0000	CRASH	gen=224 glyphs=4
2026-03-14T07:36:44.486728	ff30496a	0	0	0.0000	CRASH	gen=224 glyphs=3
2026-03-14T07:36:44.486918	099964a4	0	0	0.0000	CRASH	gen=224 glyphs=4
2026-03-14T07:36:44.487112	0da6afb1	0	0	0.0000	CRASH	gen=224 glyphs=4
2026-03-14T07:36:44.487303	099964a4	0	0	0.0000	CRASH	gen=224 glyphs=4
2026-03-14T07:36:44.487493	14add3bf	0	0	0.0000	CRASH	gen=224 glyphs=4
2026-03-14T07:36:44.487688	cf93b656	0	0	0.0000	CRASH	gen=224 glyphs=3
2026-03-14T07:36:44.487877	099964a4	0	0	0.0000	CRASH	gen=224 glyphs=4
2026-03-14T07:36:44.488073	cea127cc	0	0	0.0000	CRASH	gen=224 glyphs=4
2026-03-14T07:36:44.488346	099964a4	0	0	0.0000	CRASH	gen=225 glyphs=4
2026-03-14T07:36:44.488546	099964a4	0	0	0.0000	CRASH	gen=225 glyphs=4
2026-03-14T07:36:44.488739	3a734398	0	0	0.0000	CRASH	gen=225 glyphs=4
2026-03-14T07:36:44.488945	6566612f	0	0	0.0000	CRASH	gen=225 glyphs=5
2026-03-14T07:36:44.489146	3ca14993	0	0	0.0000	CRASH	gen=225 glyphs=4
2026-03-14T07:36:44.489344	80cef82b	0	0	0.0000	CRASH	gen=225 glyphs=4
2026-03-14T07:36:44.489540	099964a4	0	0	0.0000	CRASH	gen=225 glyphs=4
2026-03-14T07:36:44.489735	ff30496a	0	0	0.0000	CRASH	gen=225 glyphs=3
2026-03-14T07:36:44.489927	099964a4	0	0	0.0000	CRASH	gen=225 glyphs=4
2026-03-14T07:36:44.490126	099964a4	0	0	0.0000	CRASH	gen=225 glyphs=4
2026-03-14T07:36:44.490394	099964a4	0	0	0.0000	CRASH	gen=226 glyphs=4
2026-03-14T07:36:44.490588	099964a4	0	0	0.0000	CRASH	gen=226 glyphs=4
2026-03-14T07:36:44.490780	cb0dd9eb	0	0	0.0000	CRASH	gen=226 glyphs=4
2026-03-14T07:36:44.490972	099964a4	0	0	0.0000	CRASH	gen=226 glyphs=4
2026-03-14T07:36:44.491163	3ca14993	0	0	0.0000	CRASH	gen=226 glyphs=4
2026-03-14T07:36:44.491356	873c2d8c	0	0	0.0000	CRASH	gen=226 glyphs=3
2026-03-14T07:36:44.491550	7f89b6cd	0	0	0.0000	CRASH	gen=226 glyphs=4
2026-03-14T07:36:44.491742	adb3daf0	0	0	0.0000	CRASH	gen=226 glyphs=4
2026-03-14T07:36:44.491935	7065f037	0	0	0.0000	CRASH	gen=226 glyphs=3
2026-03-14T07:36:44.492127	4be1cadf	0	0	0.0000	CRASH	gen=226 glyphs=3
2026-03-14T07:36:44.492396	099964a4	0	0	0.0000	CRASH	gen=227 glyphs=4
2026-03-14T07:36:44.492593	099964a4	0	0	0.0000	CRASH	gen=227 glyphs=4
2026-03-14T07:36:44.492786	099964a4	0	0	0.0000	CRASH	gen=227 glyphs=4
2026-03-14T07:36:44.492978	3ca14993	0	0	0.0000	CRASH	gen=227 glyphs=4
2026-03-14T07:36:44.493171	099964a4	0	0	0.0000	CRASH	gen=227 glyphs=4
2026-03-14T07:36:44.493366	099964a4	0	0	0.0000	CRASH	gen=227 glyphs=4
2026-03-14T07:36:44.493560	e94396e9	0	0	0.0000	CRASH	gen=227 glyphs=2
2026-03-14T07:36:44.493751	c8e8728d	0	0	0.0000	CRASH	gen=227 glyphs=4
2026-03-14T07:36:44.493947	7ede4765	0	0	0.0000	CRASH	gen=227 glyphs=2
2026-03-14T07:36:44.494139	099964a4	0	0	0.0000	CRASH	gen=227 glyphs=4
2026-03-14T07:36:44.494416	099964a4	0	0	0.0000	CRASH	gen=228 glyphs=4
2026-03-14T07:36:44.494613	099964a4	0	0	0.0000	CRASH	gen=228 glyphs=4
2026-03-14T07:36:44.494805	fd51636f	0	0	0.0000	CRASH	gen=228 glyphs=4
2026-03-14T07:36:44.494998	3a734398	0	0	0.0000	CRASH	gen=228 glyphs=4
2026-03-14T07:36:44.495189	099964a4	0	0	0.0000	CRASH	gen=228 glyphs=4
2026-03-14T07:36:44.495379	099964a4	0	0	0.0000	CRASH	gen=228 glyphs=4
2026-03-14T07:36:44.495575	ff30496a	0	0	0.0000	CRASH	gen=228 glyphs=3
2026-03-14T07:36:44.495770	099964a4	0	0	0.0000	CRASH	gen=228 glyphs=4
2026-03-14T07:36:44.495962	3a734398	0	0	0.0000	CRASH	gen=228 glyphs=4
2026-03-14T07:36:44.496151	39b08ed4	0	0	0.0000	CRASH	gen=228 glyphs=3
2026-03-14T07:36:44.496428	099964a4	0	0	0.0000	CRASH	gen=229 glyphs=4
2026-03-14T07:36:44.496633	099964a4	0	0	0.0000	CRASH	gen=229 glyphs=4
2026-03-14T07:36:44.496827	11fa111b	0	0	0.0000	CRASH	gen=229 glyphs=2
2026-03-14T07:36:44.497019	8da1f8d8	0	0	0.0000	CRASH	gen=229 glyphs=4
2026-03-14T07:36:44.497215	099964a4	0	0	0.0000	CRASH	gen=229 glyphs=4
2026-03-14T07:36:44.497409	dcb1fb50	0	0	0.0000	CRASH	gen=229 glyphs=4
2026-03-14T07:36:44.497610	3812ed46	0	0	0.0000	CRASH	gen=229 glyphs=3
2026-03-14T07:36:44.497804	3ca14993	0	0	0.0000	CRASH	gen=229 glyphs=4
2026-03-14T07:36:44.498000	3ca14993	0	0	0.0000	CRASH	gen=229 glyphs=4
2026-03-14T07:36:44.498192	099964a4	0	0	0.0000	CRASH	gen=229 glyphs=4
2026-03-14T07:36:44.498462	099964a4	0	0	0.0000	CRASH	gen=230 glyphs=4
2026-03-14T07:36:44.498667	099964a4	0	0	0.0000	CRASH	gen=230 glyphs=4
2026-03-14T07:36:44.498862	099964a4	0	0	0.0000	CRASH	gen=230 glyphs=4
2026-03-14T07:36:44.499054	099964a4	0	0	0.0000	CRASH	gen=230 glyphs=4
2026-03-14T07:36:44.499247	213f91b1	0	0	0.0000	CRASH	gen=230 glyphs=3
2026-03-14T07:36:44.499440	80cef82b	0	0	0.0000	CRASH	gen=230 glyphs=4
2026-03-14T07:36:44.499638	352313e3	0	0	0.0000	CRASH	gen=230 glyphs=2
2026-03-14T07:36:44.499833	099964a4	0	0	0.0000	CRASH	gen=230 glyphs=4
2026-03-14T07:36:44.500029	e5692247	0	0	0.0000	CRASH	gen=230 glyphs=3
2026-03-14T07:36:44.500223	099964a4	0	0	0.0000	CRASH	gen=230 glyphs=4
2026-03-14T07:36:44.500501	099964a4	0	0	0.0000	CRASH	gen=231 glyphs=4
2026-03-14T07:36:44.500699	099964a4	0	0	0.0000	CRASH	gen=231 glyphs=4
2026-03-14T07:36:44.500895	cf93b656	0	0	0.0000	CRASH	gen=231 glyphs=3
2026-03-14T07:36:44.501087	f0517d1f	0	0	0.0000	CRASH	gen=231 glyphs=4
2026-03-14T07:36:44.501281	099964a4	0	0	0.0000	CRASH	gen=231 glyphs=4
2026-03-14T07:36:44.501479	099964a4	0	0	0.0000	CRASH	gen=231 glyphs=4
2026-03-14T07:36:44.501677	5e513b2a	0	0	0.0000	CRASH	gen=231 glyphs=2
2026-03-14T07:36:44.501876	099964a4	0	0	0.0000	CRASH	gen=231 glyphs=4
2026-03-14T07:36:44.502071	099964a4	0	0	0.0000	CRASH	gen=231 glyphs=4
2026-03-14T07:36:44.502263	099964a4	0	0	0.0000	CRASH	gen=231 glyphs=4
2026-03-14T07:36:44.502543	099964a4	0	0	0.0000	CRASH	gen=232 glyphs=4
