timestamp	program_hash	spirv_size	word_count	fitness	status	description
2026-03-14T07:36:46.044564	ee5b95d3	0	0	0.0000	CRASH	gen=983 glyphs=4
2026-03-14T07:36:46.044763	099964a4	0	0	0.0000	CRASH	gen=983 glyphs=4
2026-03-14T07:36:46.044956	099964a4	0	0	0.0000	CRASH	gen=983 glyphs=4
2026-03-14T07:36:46.045148	099964a4	0	0	0.0000	CRASH	gen=983 glyphs=4
2026-03-14T07:36:46.045340	3a734398	0	0	0.0000	CRASH	gen=983 glyphs=4
2026-03-14T07:36:46.045537	cf93b656	0	0	0.0000	CRASH	gen=983 glyphs=3
2026-03-14T07:36:46.045727	805518f3	0	0	0.0000	CRASH	gen=983 glyphs=4
2026-03-14T07:36:46.046001	099964a4	0	0	0.0000	CRASH	gen=984 glyphs=4
2026-03-14T07:36:46.046194	099964a4	0	0	0.0000	CRASH	gen=984 glyphs=4
2026-03-14T07:36:46.046389	099964a4	0	0	0.0000	CRASH	gen=984 glyphs=4
2026-03-14T07:36:46.046583	099964a4	0	0	0.0000	CRASH	gen=984 glyphs=4
2026-03-14T07:36:46.046774	099964a4	0	0	0.0000	CRASH	gen=984 glyphs=4
2026-03-14T07:36:46.046969	099964a4	0	0	0.0000	CRASH	gen=984 glyphs=4
2026-03-14T07:36:46.047158	099964a4	0	0	0.0000	CRASH	gen=984 glyphs=4
2026-03-14T07:36:46.047348	9151efdb	0	0	0.0000	CRASH	gen=984 glyphs=4
2026-03-14T07:36:46.047542	099964a4	0	0	0.0000	CRASH	gen=984 glyphs=4
2026-03-14T07:36:46.047731	099964a4	0	0	0.0000	CRASH	gen=984 glyphs=4
2026-03-14T07:36:46.048007	099964a4	0	0	0.0000	CRASH	gen=985 glyphs=4
2026-03-14T07:36:46.048203	099964a4	0	0	0.0000	CRASH	gen=985 glyphs=4
2026-03-14T07:36:46.048395	cf93b656	0	0	0.0000	CRASH	gen=985 glyphs=3
2026-03-14T07:36:46.048589	80cef82b	0	0	0.0000	CRASH	gen=985 glyphs=4
2026-03-14T07:36:46.048781	2b151c06	0	0	0.0000	CRASH	gen=985 glyphs=4
2026-03-14T07:36:46.048980	099964a4	0	0	0.0000	CRASH	gen=985 glyphs=4
2026-03-14T07:36:46.049172	dc9af7b7	0	0	0.0000	CRASH	gen=985 glyphs=4
2026-03-14T07:36:46.049363	099964a4	0	0	0.0000	CRASH	gen=985 glyphs=4
2026-03-14T07:36:46.049556	d5d3eca2	0	0	0.0000	CRASH	gen=985 glyphs=4
2026-03-14T07:36:46.049747	099964a4	0	0	0.0000	CRASH	gen=985 glyphs=4
2026-03-14T07:36:46.050021	099964a4	0	0	0.0000	CRASH	gen=986 glyphs=4
2026-03-14T07:36:46.050214	099964a4	0	0	0.0000	CRASH	gen=986 glyphs=4
2026-03-14T07:36:46.050407	3a734398	0	0	0.0000	CRASH	gen=986 glyphs=4
2026-03-14T07:36:46.050598	dcb1fb50	0	0	0.0000	CRASH	gen=986 glyphs=4
2026-03-14T07:36:46.050791	ff30496a	0	0	0.0000	CRASH	gen=986 glyphs=3
2026-03-14T07:36:46.050982	ff30496a	0	0	0.0000	CRASH	gen=986 glyphs=3
2026-03-14T07:36:46.051181	099964a4	0	0	0.0000	CRASH	gen=986 glyphs=4
2026-03-14T07:36:46.051372	1e0d34bf	0	0	0.0000	CRASH	gen=986 glyphs=2
2026-03-14T07:36:46.051570	ff30496a	0	0	0.0000	CRASH	gen=986 glyphs=3
2026-03-14T07:36:46.051763	80cef82b	0	0	0.0000	CRASH	gen=986 glyphs=4
2026-03-14T07:36:46.052049	099964a4	0	0	0.0000	CRASH	gen=987 glyphs=4
2026-03-14T07:36:46.052251	099964a4	0	0	0.0000	CRASH	gen=987 glyphs=4
2026-03-14T07:36:46.052446	8da1f8d8	0	0	0.0000	CRASH	gen=987 glyphs=4
2026-03-14T07:36:46.052643	099964a4	0	0	0.0000	CRASH	gen=987 glyphs=4
2026-03-14T07:36:46.052837	50496877	0	0	0.0000	CRASH	gen=987 glyphs=3
2026-03-14T07:36:46.053030	099964a4	0	0	0.0000	CRASH	gen=987 glyphs=4
2026-03-14T07:36:46.053225	099964a4	0	0	0.0000	CRASH	gen=987 glyphs=4
2026-03-14T07:36:46.053417	099964a4	0	0	0.0000	CRASH	gen=987 glyphs=4
2026-03-14T07:36:46.053611	4ad947dc	0	0	0.0000	CRASH	gen=987 glyphs=4
2026-03-14T07:36:46.053803	80cef82b	0	0	0.0000	CRASH	gen=987 glyphs=4
2026-03-14T07:36:46.054078	099964a4	0	0	0.0000	CRASH	gen=988 glyphs=4
2026-03-14T07:36:46.054275	099964a4	0	0	0.0000	CRASH	gen=988 glyphs=4
2026-03-14T07:36:46.054468	7ede4765	0	0	0.0000	CRASH	gen=988 glyphs=2
2026-03-14T07:36:46.054660	fd0cd2c3	0	0	0.0000	CRASH	gen=988 glyphs=3
2026-03-14T07:36:46.054853	f79fdced	0	0	0.0000	CRASH	gen=988 glyphs=4
2026-03-14T07:36:46.055044	099964a4	0	0	0.0000	CRASH	gen=988 glyphs=4
2026-03-14T07:36:46.055235	099964a4	0	0	0.0000	CRASH	gen=988 glyphs=4
2026-03-14T07:36:46.055432	099964a4	0	0	0.0000	CRASH	gen=988 glyphs=4
2026-03-14T07:36:46.055629	099964a4	0	0	0.0000	CRASH	gen=988 glyphs=4
2026-03-14T07:36:46.055824	099964a4	0	0	0.0000	CRASH	gen=988 glyphs=4
2026-03-14T07:36:46.056106	099964a4	0	0	0.0000	CRASH	gen=989 glyphs=4
2026-03-14T07:36:46.056301	099964a4	0	0	0.0000	CRASH	gen=989 glyphs=4
2026-03-14T07:36:46.056500	5d3fb169	0	0	0.0000	CRASH	gen=989 glyphs=1
2026-03-14T07:36:46.056693	ff30496a	0	0	0.0000	CRASH	gen=989 glyphs=3
2026-03-14T07:36:46.056885	099964a4	0	0	0.0000	CRASH	gen=989 glyphs=4
2026-03-14T07:36:46.057077	1b8256c8	0	0	0.0000	CRASH	gen=989 glyphs=4
2026-03-14T07:36:46.057271	099964a4	0	0	0.0000	CRASH	gen=989 glyphs=4
2026-03-14T07:36:46.057465	099964a4	0	0	0.0000	CRASH	gen=989 glyphs=4
2026-03-14T07:36:46.057660	b6cfe565	0	0	0.0000	CRASH	gen=989 glyphs=4
2026-03-14T07:36:46.057852	3a734398	0	0	0.0000	CRASH	gen=989 glyphs=4
2026-03-14T07:36:46.058133	099964a4	0	0	0.0000	CRASH	gen=990 glyphs=4
2026-03-14T07:36:46.058331	099964a4	0	0	0.0000	CRASH	gen=990 glyphs=4
2026-03-14T07:36:46.058529	d9cb3b6d	0	0	0.0000	CRASH	gen=990 glyphs=4
2026-03-14T07:36:46.058724	dcb1fb50	0	0	0.0000	CRASH	gen=990 glyphs=4
2026-03-14T07:36:46.058917	3ca14993	0	0	0.0000	CRASH	gen=990 glyphs=4
2026-03-14T07:36:46.059111	099964a4	0	0	0.0000	CRASH	gen=990 glyphs=4
2026-03-14T07:36:46.059304	099964a4	0	0	0.0000	CRASH	gen=990 glyphs=4
2026-03-14T07:36:46.059495	3ca14993	0	0	0.0000	CRASH	gen=990 glyphs=4
2026-03-14T07:36:46.059699	099964a4	0	0	0.0000	CRASH	gen=990 glyphs=4
2026-03-14T07:36:46.059894	64bb28fb	0	0	0.0000	CRASH	gen=990 glyphs=4
2026-03-14T07:36:46.060167	099964a4	0	0	0.0000	CRASH	gen=991 glyphs=4
2026-03-14T07:36:46.060360	099964a4	0	0	0.0000	CRASH	gen=991 glyphs=4
2026-03-14T07:36:46.060555	099964a4	0	0	0.0000	CRASH	gen=991 glyphs=4
2026-03-14T07:36:46.060750	099964a4	0	0	0.0000	CRASH	gen=991 glyphs=4
2026-03-14T07:36:46.060940	099964a4	0	0	0.0000	CRASH	gen=991 glyphs=4
2026-03-14T07:36:46.061134	099964a4	0	0	0.0000	CRASH	gen=991 glyphs=4
2026-03-14T07:36:46.061324	099964a4	0	0	0.0000	CRASH	gen=991 glyphs=4
2026-03-14T07:36:46.061519	cf93b656	0	0	0.0000	CRASH	gen=991 glyphs=3
2026-03-14T07:36:46.061710	099964a4	0	0	0.0000	CRASH	gen=991 glyphs=4
2026-03-14T07:36:46.061900	dcb1fb50	0	0	0.0000	CRASH	gen=991 glyphs=4
2026-03-14T07:36:46.062171	099964a4	0	0	0.0000	CRASH	gen=992 glyphs=4
2026-03-14T07:36:46.062364	099964a4	0	0	0.0000	CRASH	gen=992 glyphs=4
2026-03-14T07:36:46.062556	099964a4	0	0	0.0000	CRASH	gen=992 glyphs=4
2026-03-14T07:36:46.062745	dc227193	0	0	0.0000	CRASH	gen=992 glyphs=3
2026-03-14T07:36:46.062942	099964a4	0	0	0.0000	CRASH	gen=992 glyphs=4
2026-03-14T07:36:46.063129	f9647220	0	0	0.0000	CRASH	gen=992 glyphs=4
2026-03-14T07:36:46.063316	099964a4	0	0	0.0000	CRASH	gen=992 glyphs=4
2026-03-14T07:36:46.063503	099964a4	0	0	0.0000	CRASH	gen=992 glyphs=4
2026-03-14T07:36:46.063695	80cef82b	0	0	0.0000	CRASH	gen=992 glyphs=4
2026-03-14T07:36:46.063890	099964a4	0	0	0.0000	CRASH	gen=992 glyphs=4
2026-03-14T07:36:46.064169	099964a4	0	0	0.0000	CRASH	gen=993 glyphs=4
2026-03-14T07:36:46.064360	099964a4	0	0	0.0000	CRASH	gen=993 glyphs=4
2026-03-14T07:36:46.064553	099964a4	0	0	0.0000	CRASH	gen=993 glyphs=4
2026-03-14T07:36:46.064743	099964a4	0	0	0.0000	CRASH	gen=993 glyphs=4
2026-03-14T07:36:46.064938	099964a4	0	0	0.0000	CRASH	gen=993 glyphs=4
2026-03-14T07:36:46.065129	099964a4	0	0	0.0000	CRASH	gen=993 glyphs=4
2026-03-14T07:36:46.065318	099964a4	0	0	0.0000	CRASH	gen=993 glyphs=4
2026-03-14T07:36:46.065506	7ede4765	0	0	0.0000	CRASH	gen=993 glyphs=2
2026-03-14T07:36:46.065696	099964a4	0	0	0.0000	CRASH	gen=993 glyphs=4
2026-03-14T07:36:46.065888	42a99813	0	0	0.0000	CRASH	gen=993 glyphs=4
2026-03-14T07:36:46.066162	099964a4	0	0	0.0000	CRASH	gen=994 glyphs=4
2026-03-14T07:36:46.066355	099964a4	0	0	0.0000	CRASH	gen=994 glyphs=4
2026-03-14T07:36:46.066551	ff30496a	0	0	0.0000	CRASH	gen=994 glyphs=3
2026-03-14T07:36:46.066742	099964a4	0	0	0.0000	CRASH	gen=994 glyphs=4
2026-03-14T07:36:46.066934	c3e54544	0	0	0.0000	CRASH	gen=994 glyphs=2
2026-03-14T07:36:46.067127	099964a4	0	0	0.0000	CRASH	gen=994 glyphs=4
2026-03-14T07:36:46.067318	099964a4	0	0	0.0000	CRASH	gen=994 glyphs=4
2026-03-14T07:36:46.067508	3ca14993	0	0	0.0000	CRASH	gen=994 glyphs=4
2026-03-14T07:36:46.067705	cf93b656	0	0	0.0000	CRASH	gen=994 glyphs=3
2026-03-14T07:36:46.067898	fe57ddd3	0	0	0.0000	CRASH	gen=994 glyphs=3
2026-03-14T07:36:46.068176	099964a4	0	0	0.0000	CRASH	gen=995 glyphs=4
2026-03-14T07:36:46.068370	099964a4	0	0	0.0000	CRASH	gen=995 glyphs=4
2026-03-14T07:36:46.068567	099964a4	0	0	0.0000	CRASH	gen=995 glyphs=4
2026-03-14T07:36:46.068757	099964a4	0	0	0.0000	CRASH	gen=995 glyphs=4
2026-03-14T07:36:46.068949	98ab827b	0	0	0.0000	CRASH	gen=995 glyphs=4
2026-03-14T07:36:46.069139	099964a4	0	0	0.0000	CRASH	gen=995 glyphs=4
2026-03-14T07:36:46.069335	942f1ba4	0	0	0.0000	CRASH	gen=995 glyphs=4
2026-03-14T07:36:46.069528	099964a4	0	0	0.0000	CRASH	gen=995 glyphs=4
2026-03-14T07:36:46.069720	099964a4	0	0	0.0000	CRASH	gen=995 glyphs=4
2026-03-14T07:36:46.069912	6b324e3a	0	0	0.0000	CRASH	gen=995 glyphs=5
2026-03-14T07:36:46.070181	099964a4	0	0	0.0000	CRASH	gen=996 glyphs=4
2026-03-14T07:36:46.070383	099964a4	0	0	0.0000	CRASH	gen=996 glyphs=4
2026-03-14T07:36:46.070577	099964a4	0	0	0.0000	CRASH	gen=996 glyphs=4
2026-03-14T07:36:46.070768	099964a4	0	0	0.0000	CRASH	gen=996 glyphs=4
2026-03-14T07:36:46.070962	099964a4	0	0	0.0000	CRASH	gen=996 glyphs=4
2026-03-14T07:36:46.071153	b059153b	0	0	0.0000	CRASH	gen=996 glyphs=4
2026-03-14T07:36:46.071351	3ca14993	0	0	0.0000	CRASH	gen=996 glyphs=4
2026-03-14T07:36:46.071551	3ca14993	0	0	0.0000	CRASH	gen=996 glyphs=4
2026-03-14T07:36:46.071749	80cef82b	0	0	0.0000	CRASH	gen=996 glyphs=4
2026-03-14T07:36:46.071946	099964a4	0	0	0.0000	CRASH	gen=996 glyphs=4
2026-03-14T07:36:46.072224	099964a4	0	0	0.0000	CRASH	gen=997 glyphs=4
2026-03-14T07:36:46.072419	099964a4	0	0	0.0000	CRASH	gen=997 glyphs=4
2026-03-14T07:36:46.072621	b91b6333	0	0	0.0000	CRASH	gen=997 glyphs=3
2026-03-14T07:36:46.072815	099964a4	0	0	0.0000	CRASH	gen=997 glyphs=4
2026-03-14T07:36:46.073008	2d1182a8	0	0	0.0000	CRASH	gen=997 glyphs=5
2026-03-14T07:36:46.073203	099964a4	0	0	0.0000	CRASH	gen=997 glyphs=4
2026-03-14T07:36:46.073396	f1317d23	0	0	0.0000	CRASH	gen=997 glyphs=4
2026-03-14T07:36:46.073592	5f69e2ee	0	0	0.0000	CRASH	gen=997 glyphs=1
2026-03-14T07:36:46.073788	3a734398	0	0	0.0000	CRASH	gen=997 glyphs=4
2026-03-14T07:36:46.073979	099964a4	0	0	0.0000	CRASH	gen=997 glyphs=4
2026-03-14T07:36:46.074251	099964a4	0	0	0.0000	CRASH	gen=998 glyphs=4
2026-03-14T07:36:46.074444	099964a4	0	0	0.0000	CRASH	gen=998 glyphs=4
2026-03-14T07:36:46.074637	099964a4	0	0	0.0000	CRASH	gen=998 glyphs=4
2026-03-14T07:36:46.074836	eb50b762	0	0	0.0000	CRASH	gen=998 glyphs=4
2026-03-14T07:36:46.075027	099964a4	0	0	0.0000	CRASH	gen=998 glyphs=4
2026-03-14T07:36:46.075215	87294503	0	0	0.0000	CRASH	gen=998 glyphs=4
2026-03-14T07:36:46.075406	3ca14993	0	0	0.0000	CRASH	gen=998 glyphs=4
2026-03-14T07:36:46.075598	ff30496a	0	0	0.0000	CRASH	gen=998 glyphs=3
2026-03-14T07:36:46.075806	dcb1fb50	0	0	0.0000	CRASH	gen=998 glyphs=4
2026-03-14T07:36:46.076003	099964a4	0	0	0.0000	CRASH	gen=998 glyphs=4
2026-03-14T07:36:46.076284	099964a4	0	0	0.0000	CRASH	gen=999 glyphs=4
2026-03-14T07:36:46.076477	099964a4	0	0	0.0000	CRASH	gen=999 glyphs=4
2026-03-14T07:36:46.076676	229984b2	0	0	0.0000	CRASH	gen=999 glyphs=5
2026-03-14T07:36:46.076876	76858655	0	0	0.0000	CRASH	gen=999 glyphs=3
2026-03-14T07:36:46.077070	6b34d96d	0	0	0.0000	CRASH	gen=999 glyphs=3
2026-03-14T07:36:46.077261	099964a4	0	0	0.0000	CRASH	gen=999 glyphs=4
2026-03-14T07:36:46.077455	7ede4765	0	0	0.0000	CRASH	gen=999 glyphs=2
2026-03-14T07:36:46.077648	099964a4	0	0	0.0000	CRASH	gen=999 glyphs=4
2026-03-14T07:36:46.077840	099964a4	0	0	0.0000	CRASH	gen=999 glyphs=4
2026-03-14T07:36:46.078037	2cb29894	0	0	0.0000	CRASH	gen=999 glyphs=4
2026-03-14T07:37:22.190969	099964a4	0	0	0.0000	CRASH	gen=0 glyphs=4
2026-03-14T07:37:22.191235	7388b794	0	0	0.0000	CRASH	gen=0 glyphs=4
2026-03-14T07:37:22.191480	dc9f06e0	0	0	0.0000	CRASH	gen=1 glyphs=4
2026-03-14T07:37:22.191691	099964a4	0	0	0.0000	CRASH	gen=1 glyphs=4
2026-03-14T07:37:22.191923	df6be21c	0	0	0.0000	CRASH	gen=2 glyphs=4
2026-03-14T07:37:22.192125	099964a4	0	0	0.0000	CRASH	gen=2 glyphs=4
2026-03-14T07:37:22.192348	dc9f06e0	0	0	0.0000	CRASH	gen=3 glyphs=4
2026-03-14T07:37:22.192546	099964a4	0	0	0.0000	CRASH	gen=3 glyphs=4
2026-03-14T07:37:22.192753	099964a4	0	0	0.0000	CRASH	gen=4 glyphs=4
2026-03-14T07:37:22.192947	72e50f61	0	0	0.0000	CRASH	gen=4 glyphs=4
2026-03-14T07:37:22.193183	72e50f61	0	0	0.0000	CRASH	gen=5 glyphs=4
2026-03-14T07:37:22.193393	099964a4	0	0	0.0000	CRASH	gen=5 glyphs=4
2026-03-14T07:37:22.193623	099964a4	0	0	0.0000	CRASH	gen=6 glyphs=4
2026-03-14T07:37:22.193817	099964a4	0	0	0.0000	CRASH	gen=6 glyphs=4
2026-03-14T07:37:22.194027	43958b55	0	0	0.0000	CRASH	gen=7 glyphs=4
2026-03-14T07:37:22.194225	72e50f61	0	0	0.0000	CRASH	gen=7 glyphs=4
2026-03-14T07:37:22.194445	d520a101	0	0	0.0000	CRASH	gen=8 glyphs=2
2026-03-14T07:37:22.194643	72e50f61	0	0	0.0000	CRASH	gen=8 glyphs=4
2026-03-14T07:37:22.194860	099964a4	0	0	0.0000	CRASH	gen=9 glyphs=4
2026-03-14T07:37:22.195057	8c8e15d9	0	0	0.0000	CRASH	gen=9 glyphs=3
2026-03-14T07:37:22.195277	dc9f06e0	0	0	0.0000	CRASH	gen=10 glyphs=4
2026-03-14T07:37:22.195472	dc9f06e0	0	0	0.0000	CRASH	gen=10 glyphs=4
2026-03-14T07:37:22.195686	4f6dc649	0	0	0.0000	CRASH	gen=11 glyphs=4
2026-03-14T07:37:22.195882	72e50f61	0	0	0.0000	CRASH	gen=11 glyphs=4
2026-03-14T07:37:22.196093	dc9f06e0	0	0	0.0000	CRASH	gen=12 glyphs=4
2026-03-14T07:37:22.196292	099964a4	0	0	0.0000	CRASH	gen=12 glyphs=4
2026-03-14T07:37:22.196510	099964a4	0	0	0.0000	CRASH	gen=13 glyphs=4
2026-03-14T07:37:22.196706	a20a6518	0	0	0.0000	CRASH	gen=13 glyphs=4
2026-03-14T07:37:22.196921	099964a4	0	0	0.0000	CRASH	gen=14 glyphs=4
2026-03-14T07:37:22.197116	d45f2f81	0	0	0.0000	CRASH	gen=14 glyphs=4
2026-03-14T07:37:22.197343	099964a4	0	0	0.0000	CRASH	gen=15 glyphs=4
2026-03-14T07:37:22.197539	354fc584	0	0	0.0000	CRASH	gen=15 glyphs=4
2026-03-14T07:37:22.197754	2ff9a045	0	0	0.0000	CRASH	gen=16 glyphs=4
2026-03-14T07:37:22.197949	72e50f61	0	0	0.0000	CRASH	gen=16 glyphs=4
2026-03-14T07:37:22.198165	2cf9319a	0	0	0.0000	CRASH	gen=17 glyphs=3
2026-03-14T07:37:22.198368	72e50f61	0	0	0.0000	CRASH	gen=17 glyphs=4
2026-03-14T07:37:22.198588	099964a4	0	0	0.0000	CRASH	gen=18 glyphs=4
2026-03-14T07:37:22.198793	099964a4	0	0	0.0000	CRASH	gen=18 glyphs=4
2026-03-14T07:37:22.199011	dc9f06e0	0	0	0.0000	CRASH	gen=19 glyphs=4
2026-03-14T07:37:22.199213	099964a4	0	0	0.0000	CRASH	gen=19 glyphs=4
2026-03-14T07:38:05.225524	099964a4	0	0	0.0000	CRASH	gen=0 glyphs=4
2026-03-14T07:38:05.231559	419ece24	0	0	0.0000	CRASH	gen=0 glyphs=4
2026-03-14T07:38:05.236979	099964a4	0	0	0.0000	CRASH	gen=0 glyphs=4
2026-03-14T07:38:05.242334	1dd4f828	124	31	0.9500	DISCARD	gen=1 glyphs=4
2026-03-14T07:38:05.247386	c2304a04	120	30	0.9600	DISCARD	gen=1 glyphs=5
2026-03-14T07:38:05.252568	73a001ae	120	30	0.9600	DISCARD	gen=1 glyphs=5
2026-03-14T07:38:05.257324	fd2be326	116	29	1.0000	DISCARD	gen=2 glyphs=4
2026-03-14T07:38:05.262161	4f640d5e	116	29	1.0000	DISCARD	gen=2 glyphs=3
2026-03-14T07:38:05.267142	fd2be326	116	29	1.0000	DISCARD	gen=2 glyphs=4
2026-03-14T07:38:05.272971	b10a3450	116	29	1.0000	DISCARD	gen=3 glyphs=3
2026-03-14T07:38:05.279118	d547ebec	116	29	1.0000	DISCARD	gen=3 glyphs=4
2026-03-14T07:38:05.284556	2974ac2e	116	29	1.0000	DISCARD	gen=3 glyphs=3
2026-03-14T07:38:05.289036	debc2c99	120	30	1.0000	DISCARD	gen=4 glyphs=6
2026-03-14T07:38:05.294124	fd2be326	116	29	1.0000	DISCARD	gen=4 glyphs=4
2026-03-14T07:38:05.299935	b0cb21f2	116	29	1.0000	DISCARD	gen=4 glyphs=3
2026-03-14T07:38:05.304840	2974ac2e	116	29	1.0000	DISCARD	gen=5 glyphs=3
2026-03-14T07:38:05.309617	2d204788	116	29	1.0000	DISCARD	gen=5 glyphs=2
2026-03-14T07:38:05.315072	debc2c99	120	30	1.0000	DISCARD	gen=5 glyphs=6
2026-03-14T07:38:05.320716	b10a3450	116	29	1.0000	DISCARD	gen=6 glyphs=3
2026-03-14T07:38:05.325270	66edc685	116	29	1.0000	DISCARD	gen=6 glyphs=3
2026-03-14T07:38:05.330283	b10a3450	116	29	1.0000	DISCARD	gen=6 glyphs=3
2026-03-14T07:38:05.336063	2974ac2e	116	29	1.0000	DISCARD	gen=7 glyphs=3
2026-03-14T07:38:05.341319	2974ac2e	116	29	1.0000	DISCARD	gen=7 glyphs=3
2026-03-14T07:38:05.346493	b10a3450	116	29	1.0000	DISCARD	gen=7 glyphs=3
2026-03-14T07:38:05.351937	fd2be326	116	29	1.0000	DISCARD	gen=8 glyphs=4
2026-03-14T07:38:05.357078	fd2be326	116	29	1.0000	DISCARD	gen=8 glyphs=4
2026-03-14T07:38:05.361847	b10a3450	116	29	1.0000	DISCARD	gen=8 glyphs=3
2026-03-14T07:38:05.367519	b10a3450	116	29	1.0000	DISCARD	gen=9 glyphs=3
2026-03-14T07:38:05.372907	2f57efa5	120	30	1.0000	DISCARD	gen=9 glyphs=6
2026-03-14T07:38:05.377880	b10a3450	116	29	1.0000	DISCARD	gen=9 glyphs=3
2026-03-14T07:38:05.384329	7134e4ce	120	30	1.0000	DISCARD	gen=10 glyphs=5
2026-03-14T07:38:05.390233	b10a3450	116	29	1.0000	DISCARD	gen=10 glyphs=3
2026-03-14T07:38:05.396004	cbb39df8	116	29	1.0000	DISCARD	gen=10 glyphs=5
2026-03-14T07:38:05.401619	7134e4ce	120	30	1.0000	DISCARD	gen=11 glyphs=5
2026-03-14T07:38:05.406712	b10a3450	116	29	1.0000	DISCARD	gen=11 glyphs=3
2026-03-14T07:38:05.411677	fbd0ccb2	116	29	1.0000	DISCARD	gen=11 glyphs=3
2026-03-14T07:38:05.417532	2974ac2e	116	29	1.0000	DISCARD	gen=12 glyphs=3
2026-03-14T07:38:05.423363	b10a3450	116	29	1.0000	DISCARD	gen=12 glyphs=3
2026-03-14T07:38:05.428886	2974ac2e	116	29	1.0000	DISCARD	gen=12 glyphs=3
2026-03-14T07:38:05.434646	fd2be326	116	29	1.0000	DISCARD	gen=13 glyphs=4
2026-03-14T07:38:05.440621	fd2be326	116	29	1.0000	DISCARD	gen=13 glyphs=4
2026-03-14T07:38:05.445695	82969988	116	29	1.0000	DISCARD	gen=13 glyphs=2
2026-03-14T07:38:05.451298	7134e4ce	120	30	1.0000	DISCARD	gen=14 glyphs=5
2026-03-14T07:38:05.456273	4d853f0e	116	29	1.0000	DISCARD	gen=14 glyphs=3
2026-03-14T07:38:05.462694	b10a3450	116	29	1.0000	DISCARD	gen=14 glyphs=3
2026-03-14T07:38:05.468043	2974ac2e	116	29	1.0000	DISCARD	gen=15 glyphs=3
2026-03-14T07:38:05.473829	2974ac2e	116	29	1.0000	DISCARD	gen=15 glyphs=3
2026-03-14T07:38:05.479465	2e83cdb1	116	29	0.9500	DISCARD	gen=15 glyphs=4
2026-03-14T07:38:05.485300	b10a3450	116	29	1.0000	DISCARD	gen=16 glyphs=3
2026-03-14T07:38:05.491019	7134e4ce	120	30	1.0000	DISCARD	gen=16 glyphs=5
2026-03-14T07:38:05.496620	2974ac2e	116	29	1.0000	DISCARD	gen=16 glyphs=3
2026-03-14T07:38:05.502173	7134e4ce	120	30	1.0000	DISCARD	gen=17 glyphs=5
2026-03-14T07:38:05.508292	7134e4ce	120	30	1.0000	DISCARD	gen=17 glyphs=5
2026-03-14T07:38:05.513499	7134e4ce	120	30	1.0000	DISCARD	gen=17 glyphs=5
2026-03-14T07:38:05.519132	2974ac2e	116	29	1.0000	DISCARD	gen=18 glyphs=3
2026-03-14T07:38:05.525083	06dbafaa	120	30	1.0000	DISCARD	gen=18 glyphs=6
2026-03-14T07:38:05.530273	2974ac2e	116	29	1.0000	DISCARD	gen=18 glyphs=3
2026-03-14T07:38:05.536014	ef40fa4a	116	29	1.0000	DISCARD	gen=19 glyphs=5
2026-03-14T07:38:05.541368	538ecab4	116	29	1.0000	DISCARD	gen=19 glyphs=3
2026-03-14T07:38:05.547046	2974ac2e	116	29	1.0000	DISCARD	gen=19 glyphs=3
2026-03-14T07:38:05.552638	f629d36d	116	29	1.0000	DISCARD	gen=20 glyphs=2
2026-03-14T07:38:05.557930	fd2be326	116	29	1.0000	DISCARD	gen=20 glyphs=4
2026-03-14T07:38:05.562868	bd583174	116	29	0.9333	DISCARD	gen=20 glyphs=3
2026-03-14T07:38:05.568670	fd2be326	116	29	1.0000	DISCARD	gen=21 glyphs=4
2026-03-14T07:38:05.574116	7134e4ce	120	30	1.0000	DISCARD	gen=21 glyphs=5
2026-03-14T07:38:05.579732	b10a3450	116	29	1.0000	DISCARD	gen=21 glyphs=3
2026-03-14T07:38:05.586886	b10a3450	116	29	1.0000	DISCARD	gen=22 glyphs=3
2026-03-14T07:38:05.593849	b10a3450	116	29	1.0000	DISCARD	gen=22 glyphs=3
2026-03-14T07:38:05.599879	b10a3450	116	29	1.0000	DISCARD	gen=22 glyphs=3
2026-03-14T07:38:05.605584	6e2bf9bd	116	29	1.0000	DISCARD	gen=23 glyphs=3
2026-03-14T07:38:05.611185	a66f784b	116	29	0.9500	DISCARD	gen=23 glyphs=4
2026-03-14T07:38:05.617573	fd2be326	116	29	1.0000	DISCARD	gen=23 glyphs=4
2026-03-14T07:38:05.623107	bd39c36c	120	30	0.9667	DISCARD	gen=24 glyphs=6
2026-03-14T07:38:05.628888	b10a3450	116	29	1.0000	DISCARD	gen=24 glyphs=3
2026-03-14T07:38:05.634225	fd2be326	116	29	1.0000	DISCARD	gen=24 glyphs=4
2026-03-14T07:38:05.639330	b10a3450	116	29	1.0000	DISCARD	gen=25 glyphs=3
2026-03-14T07:38:05.644499	16af6248	120	30	1.0000	DISCARD	gen=25 glyphs=4
2026-03-14T07:38:05.650241	2974ac2e	116	29	1.0000	DISCARD	gen=25 glyphs=3
2026-03-14T07:38:05.656137	debc2c99	120	30	1.0000	DISCARD	gen=26 glyphs=6
2026-03-14T07:38:05.661749	2974ac2e	116	29	1.0000	DISCARD	gen=26 glyphs=3
2026-03-14T07:38:05.667279	4a619e2b	116	29	1.0000	DISCARD	gen=26 glyphs=2
2026-03-14T07:38:05.672448	69153ead	116	29	1.0000	DISCARD	gen=27 glyphs=6
2026-03-14T07:38:05.677411	95d56764	116	29	1.0000	DISCARD	gen=27 glyphs=4
2026-03-14T07:38:05.682706	b10a3450	116	29	1.0000	DISCARD	gen=27 glyphs=3
2026-03-14T07:38:05.688711	7134e4ce	120	30	1.0000	DISCARD	gen=28 glyphs=5
2026-03-14T07:38:05.693543	dc1fd5d7	116	29	1.0000	DISCARD	gen=28 glyphs=3
2026-03-14T07:38:05.698544	fd2be326	116	29	1.0000	DISCARD	gen=28 glyphs=4
2026-03-14T07:38:05.703632	7134e4ce	120	30	1.0000	DISCARD	gen=29 glyphs=5
2026-03-14T07:38:05.708532	b10a3450	116	29	1.0000	DISCARD	gen=29 glyphs=3
2026-03-14T07:38:05.713600	b10a3450	116	29	1.0000	DISCARD	gen=29 glyphs=3
2026-03-14T07:38:05.718560	86059586	116	29	1.0000	DISCARD	gen=30 glyphs=3
2026-03-14T07:38:05.723510	33bd4fda	116	29	1.0000	DISCARD	gen=30 glyphs=4
2026-03-14T07:38:05.728508	423d6b78	116	29	1.0000	DISCARD	gen=30 glyphs=2
2026-03-14T07:38:05.733454	debc2c99	120	30	1.0000	DISCARD	gen=31 glyphs=6
2026-03-14T07:38:05.739449	b10a3450	116	29	1.0000	DISCARD	gen=31 glyphs=3
2026-03-14T07:38:05.745758	b10a3450	116	29	1.0000	DISCARD	gen=31 glyphs=3
2026-03-14T07:38:05.751260	b10a3450	116	29	1.0000	DISCARD	gen=32 glyphs=3
2026-03-14T07:38:05.756536	fd2be326	116	29	1.0000	DISCARD	gen=32 glyphs=4
2026-03-14T07:38:05.761791	2974ac2e	116	29	1.0000	DISCARD	gen=32 glyphs=3
2026-03-14T07:38:05.766958	b10a3450	116	29	1.0000	DISCARD	gen=33 glyphs=3
2026-03-14T07:38:05.773772	f15c14fc	116	29	1.0000	DISCARD	gen=33 glyphs=3
