timestamp	program_hash	spirv_size	word_count	fitness	status	description
2026-03-14T07:36:44.767362	cbac0d24	0	0	0.0000	CRASH	gen=357 glyphs=3
2026-03-14T07:36:44.767558	89d5f4fe	0	0	0.0000	CRASH	gen=357 glyphs=3
2026-03-14T07:36:44.767751	3ca14993	0	0	0.0000	CRASH	gen=357 glyphs=4
2026-03-14T07:36:44.767949	099964a4	0	0	0.0000	CRASH	gen=357 glyphs=4
2026-03-14T07:36:44.768141	cf93b656	0	0	0.0000	CRASH	gen=357 glyphs=3
2026-03-14T07:36:44.768335	099964a4	0	0	0.0000	CRASH	gen=357 glyphs=4
2026-03-14T07:36:44.768528	80cef82b	0	0	0.0000	CRASH	gen=357 glyphs=4
2026-03-14T07:36:44.768801	099964a4	0	0	0.0000	CRASH	gen=358 glyphs=4
2026-03-14T07:36:44.769000	099964a4	0	0	0.0000	CRASH	gen=358 glyphs=4
2026-03-14T07:36:44.769194	3a734398	0	0	0.0000	CRASH	gen=358 glyphs=4
2026-03-14T07:36:44.769387	099964a4	0	0	0.0000	CRASH	gen=358 glyphs=4
2026-03-14T07:36:44.769582	8da1f8d8	0	0	0.0000	CRASH	gen=358 glyphs=4
2026-03-14T07:36:44.769775	099964a4	0	0	0.0000	CRASH	gen=358 glyphs=4
2026-03-14T07:36:44.769968	dcb1fb50	0	0	0.0000	CRASH	gen=358 glyphs=4
2026-03-14T07:36:44.770168	099964a4	0	0	0.0000	CRASH	gen=358 glyphs=4
2026-03-14T07:36:44.770359	8da1f8d8	0	0	0.0000	CRASH	gen=358 glyphs=4
2026-03-14T07:36:44.770557	099964a4	0	0	0.0000	CRASH	gen=358 glyphs=4
2026-03-14T07:36:44.770825	099964a4	0	0	0.0000	CRASH	gen=359 glyphs=4
2026-03-14T07:36:44.771020	099964a4	0	0	0.0000	CRASH	gen=359 glyphs=4
2026-03-14T07:36:44.771220	09c12810	0	0	0.0000	CRASH	gen=359 glyphs=4
2026-03-14T07:36:44.771418	b1cbafd5	0	0	0.0000	CRASH	gen=359 glyphs=4
2026-03-14T07:36:44.771621	099964a4	0	0	0.0000	CRASH	gen=359 glyphs=4
2026-03-14T07:36:44.771821	099964a4	0	0	0.0000	CRASH	gen=359 glyphs=4
2026-03-14T07:36:44.772021	c12d32ec	0	0	0.0000	CRASH	gen=359 glyphs=4
2026-03-14T07:36:44.772227	099964a4	0	0	0.0000	CRASH	gen=359 glyphs=4
2026-03-14T07:36:44.772428	099964a4	0	0	0.0000	CRASH	gen=359 glyphs=4
2026-03-14T07:36:44.772640	099964a4	0	0	0.0000	CRASH	gen=359 glyphs=4
2026-03-14T07:36:44.772927	099964a4	0	0	0.0000	CRASH	gen=360 glyphs=4
2026-03-14T07:36:44.773129	099964a4	0	0	0.0000	CRASH	gen=360 glyphs=4
2026-03-14T07:36:44.773326	099964a4	0	0	0.0000	CRASH	gen=360 glyphs=4
2026-03-14T07:36:44.773518	099964a4	0	0	0.0000	CRASH	gen=360 glyphs=4
2026-03-14T07:36:44.773711	ff30496a	0	0	0.0000	CRASH	gen=360 glyphs=3
2026-03-14T07:36:44.773905	099964a4	0	0	0.0000	CRASH	gen=360 glyphs=4
2026-03-14T07:36:44.774095	099964a4	0	0	0.0000	CRASH	gen=360 glyphs=4
2026-03-14T07:36:44.774289	59744f7b	0	0	0.0000	CRASH	gen=360 glyphs=4
2026-03-14T07:36:44.774482	099964a4	0	0	0.0000	CRASH	gen=360 glyphs=4
2026-03-14T07:36:44.774679	61fb2921	0	0	0.0000	CRASH	gen=360 glyphs=3
2026-03-14T07:36:44.774964	099964a4	0	0	0.0000	CRASH	gen=361 glyphs=4
2026-03-14T07:36:44.775165	099964a4	0	0	0.0000	CRASH	gen=361 glyphs=4
2026-03-14T07:36:44.775370	c45266ac	0	0	0.0000	CRASH	gen=361 glyphs=4
2026-03-14T07:36:44.775573	2e76f437	0	0	0.0000	CRASH	gen=361 glyphs=5
2026-03-14T07:36:44.775773	099964a4	0	0	0.0000	CRASH	gen=361 glyphs=4
2026-03-14T07:36:44.775971	099964a4	0	0	0.0000	CRASH	gen=361 glyphs=4
2026-03-14T07:36:44.776166	77b1bc04	0	0	0.0000	CRASH	gen=361 glyphs=2
2026-03-14T07:36:44.776364	099964a4	0	0	0.0000	CRASH	gen=361 glyphs=4
2026-03-14T07:36:44.776562	e01082cb	0	0	0.0000	CRASH	gen=361 glyphs=3
2026-03-14T07:36:44.776757	56bfb944	0	0	0.0000	CRASH	gen=361 glyphs=4
2026-03-14T07:36:44.777041	099964a4	0	0	0.0000	CRASH	gen=362 glyphs=4
2026-03-14T07:36:44.777235	099964a4	0	0	0.0000	CRASH	gen=362 glyphs=4
2026-03-14T07:36:44.777431	0270064e	0	0	0.0000	CRASH	gen=362 glyphs=4
2026-03-14T07:36:44.777628	af4052a9	0	0	0.0000	CRASH	gen=362 glyphs=4
2026-03-14T07:36:44.777821	733473e2	0	0	0.0000	CRASH	gen=362 glyphs=4
2026-03-14T07:36:44.778014	21b4c6ba	0	0	0.0000	CRASH	gen=362 glyphs=5
2026-03-14T07:36:44.778208	3a734398	0	0	0.0000	CRASH	gen=362 glyphs=4
2026-03-14T07:36:44.778398	42fe0fb0	0	0	0.0000	CRASH	gen=362 glyphs=4
2026-03-14T07:36:44.778600	62e25557	0	0	0.0000	CRASH	gen=362 glyphs=4
2026-03-14T07:36:44.778794	099964a4	0	0	0.0000	CRASH	gen=362 glyphs=4
2026-03-14T07:36:44.779076	099964a4	0	0	0.0000	CRASH	gen=363 glyphs=4
2026-03-14T07:36:44.779273	099964a4	0	0	0.0000	CRASH	gen=363 glyphs=4
2026-03-14T07:36:44.779467	80cef82b	0	0	0.0000	CRASH	gen=363 glyphs=4
2026-03-14T07:36:44.779670	80cef82b	0	0	0.0000	CRASH	gen=363 glyphs=4
2026-03-14T07:36:44.779867	099964a4	0	0	0.0000	CRASH	gen=363 glyphs=4
2026-03-14T07:36:44.780063	099964a4	0	0	0.0000	CRASH	gen=363 glyphs=4
2026-03-14T07:36:44.780256	6c83caed	0	0	0.0000	CRASH	gen=363 glyphs=4
2026-03-14T07:36:44.780452	5161687b	0	0	0.0000	CRASH	gen=363 glyphs=4
2026-03-14T07:36:44.780655	b91e2a1e	0	0	0.0000	CRASH	gen=363 glyphs=3
2026-03-14T07:36:44.780847	d0289a03	0	0	0.0000	CRASH	gen=363 glyphs=3
2026-03-14T07:36:44.781123	099964a4	0	0	0.0000	CRASH	gen=364 glyphs=4
2026-03-14T07:36:44.781319	099964a4	0	0	0.0000	CRASH	gen=364 glyphs=4
2026-03-14T07:36:44.781514	01ff7693	0	0	0.0000	CRASH	gen=364 glyphs=4
2026-03-14T07:36:44.781717	3294c0bf	0	0	0.0000	CRASH	gen=364 glyphs=3
2026-03-14T07:36:44.781909	3145b882	0	0	0.0000	CRASH	gen=364 glyphs=4
2026-03-14T07:36:44.782106	80cef82b	0	0	0.0000	CRASH	gen=364 glyphs=4
2026-03-14T07:36:44.782300	099964a4	0	0	0.0000	CRASH	gen=364 glyphs=4
2026-03-14T07:36:44.782492	099964a4	0	0	0.0000	CRASH	gen=364 glyphs=4
2026-03-14T07:36:44.782690	099964a4	0	0	0.0000	CRASH	gen=364 glyphs=4
2026-03-14T07:36:44.782889	8da1f8d8	0	0	0.0000	CRASH	gen=364 glyphs=4
2026-03-14T07:36:44.783164	099964a4	0	0	0.0000	CRASH	gen=365 glyphs=4
2026-03-14T07:36:44.783360	099964a4	0	0	0.0000	CRASH	gen=365 glyphs=4
2026-03-14T07:36:44.783555	ea98e01a	0	0	0.0000	CRASH	gen=365 glyphs=3
2026-03-14T07:36:44.783749	ff30496a	0	0	0.0000	CRASH	gen=365 glyphs=3
2026-03-14T07:36:44.783944	ff30496a	0	0	0.0000	CRASH	gen=365 glyphs=3
2026-03-14T07:36:44.784137	099964a4	0	0	0.0000	CRASH	gen=365 glyphs=4
2026-03-14T07:36:44.784328	cae29c90	0	0	0.0000	CRASH	gen=365 glyphs=4
2026-03-14T07:36:44.784525	099964a4	0	0	0.0000	CRASH	gen=365 glyphs=4
2026-03-14T07:36:44.784719	ff30496a	0	0	0.0000	CRASH	gen=365 glyphs=3
2026-03-14T07:36:44.784915	d0431240	0	0	0.0000	CRASH	gen=365 glyphs=4
2026-03-14T07:36:44.785194	099964a4	0	0	0.0000	CRASH	gen=366 glyphs=4
2026-03-14T07:36:44.785391	099964a4	0	0	0.0000	CRASH	gen=366 glyphs=4
2026-03-14T07:36:44.785589	a9a46508	0	0	0.0000	CRASH	gen=366 glyphs=3
2026-03-14T07:36:44.785786	dcb1fb50	0	0	0.0000	CRASH	gen=366 glyphs=4
2026-03-14T07:36:44.785986	3a734398	0	0	0.0000	CRASH	gen=366 glyphs=4
2026-03-14T07:36:44.786177	3ca14993	0	0	0.0000	CRASH	gen=366 glyphs=4
2026-03-14T07:36:44.786372	3ca14993	0	0	0.0000	CRASH	gen=366 glyphs=4
2026-03-14T07:36:44.786568	19f374eb	0	0	0.0000	CRASH	gen=366 glyphs=3
2026-03-14T07:36:44.786769	099964a4	0	0	0.0000	CRASH	gen=366 glyphs=4
2026-03-14T07:36:44.786969	735e2129	0	0	0.0000	CRASH	gen=366 glyphs=4
2026-03-14T07:36:44.787254	099964a4	0	0	0.0000	CRASH	gen=367 glyphs=4
2026-03-14T07:36:44.787453	099964a4	0	0	0.0000	CRASH	gen=367 glyphs=4
2026-03-14T07:36:44.787653	07715e60	0	0	0.0000	CRASH	gen=367 glyphs=3
2026-03-14T07:36:44.787850	ef6aad69	0	0	0.0000	CRASH	gen=367 glyphs=4
2026-03-14T07:36:44.788055	3bc91820	0	0	0.0000	CRASH	gen=367 glyphs=4
2026-03-14T07:36:44.788253	099964a4	0	0	0.0000	CRASH	gen=367 glyphs=4
2026-03-14T07:36:44.788449	8da1f8d8	0	0	0.0000	CRASH	gen=367 glyphs=4
2026-03-14T07:36:44.788650	099964a4	0	0	0.0000	CRASH	gen=367 glyphs=4
2026-03-14T07:36:44.788847	099964a4	0	0	0.0000	CRASH	gen=367 glyphs=4
2026-03-14T07:36:44.789046	837bcc9f	0	0	0.0000	CRASH	gen=367 glyphs=5
2026-03-14T07:36:44.789343	099964a4	0	0	0.0000	CRASH	gen=368 glyphs=4
2026-03-14T07:36:44.789552	099964a4	0	0	0.0000	CRASH	gen=368 glyphs=4
2026-03-14T07:36:44.789756	099964a4	0	0	0.0000	CRASH	gen=368 glyphs=4
2026-03-14T07:36:44.789961	ff30496a	0	0	0.0000	CRASH	gen=368 glyphs=3
2026-03-14T07:36:44.790164	099964a4	0	0	0.0000	CRASH	gen=368 glyphs=4
2026-03-14T07:36:44.790363	4d17fc0e	0	0	0.0000	CRASH	gen=368 glyphs=5
2026-03-14T07:36:44.790568	4d0b3e5a	0	0	0.0000	CRASH	gen=368 glyphs=4
2026-03-14T07:36:44.790769	8da1f8d8	0	0	0.0000	CRASH	gen=368 glyphs=4
2026-03-14T07:36:44.790974	62227571	0	0	0.0000	CRASH	gen=368 glyphs=4
2026-03-14T07:36:44.791178	099964a4	0	0	0.0000	CRASH	gen=368 glyphs=4
2026-03-14T07:36:44.791473	099964a4	0	0	0.0000	CRASH	gen=369 glyphs=4
2026-03-14T07:36:44.791679	099964a4	0	0	0.0000	CRASH	gen=369 glyphs=4
2026-03-14T07:36:44.791879	7ede4765	0	0	0.0000	CRASH	gen=369 glyphs=2
2026-03-14T07:36:44.792076	92b820cf	0	0	0.0000	CRASH	gen=369 glyphs=4
2026-03-14T07:36:44.792278	099964a4	0	0	0.0000	CRASH	gen=369 glyphs=4
2026-03-14T07:36:44.792475	099964a4	0	0	0.0000	CRASH	gen=369 glyphs=4
2026-03-14T07:36:44.792672	099964a4	0	0	0.0000	CRASH	gen=369 glyphs=4
2026-03-14T07:36:44.792866	55a0d9f9	0	0	0.0000	CRASH	gen=369 glyphs=3
2026-03-14T07:36:44.793060	099964a4	0	0	0.0000	CRASH	gen=369 glyphs=4
2026-03-14T07:36:44.793252	64019ba1	0	0	0.0000	CRASH	gen=369 glyphs=4
2026-03-14T07:36:44.793554	099964a4	0	0	0.0000	CRASH	gen=370 glyphs=4
2026-03-14T07:36:44.793759	099964a4	0	0	0.0000	CRASH	gen=370 glyphs=4
2026-03-14T07:36:44.793965	099964a4	0	0	0.0000	CRASH	gen=370 glyphs=4
2026-03-14T07:36:44.794166	29a49e18	0	0	0.0000	CRASH	gen=370 glyphs=3
2026-03-14T07:36:44.794360	099964a4	0	0	0.0000	CRASH	gen=370 glyphs=4
2026-03-14T07:36:44.794558	2c96a437	0	0	0.0000	CRASH	gen=370 glyphs=2
2026-03-14T07:36:44.794751	caa1f792	0	0	0.0000	CRASH	gen=370 glyphs=2
2026-03-14T07:36:44.794943	099964a4	0	0	0.0000	CRASH	gen=370 glyphs=4
2026-03-14T07:36:44.795135	ff30496a	0	0	0.0000	CRASH	gen=370 glyphs=3
2026-03-14T07:36:44.795327	3a734398	0	0	0.0000	CRASH	gen=370 glyphs=4
2026-03-14T07:36:44.795622	099964a4	0	0	0.0000	CRASH	gen=371 glyphs=4
2026-03-14T07:36:44.795819	099964a4	0	0	0.0000	CRASH	gen=371 glyphs=4
2026-03-14T07:36:44.796014	4916a217	0	0	0.0000	CRASH	gen=371 glyphs=3
2026-03-14T07:36:44.796209	3ca14993	0	0	0.0000	CRASH	gen=371 glyphs=4
2026-03-14T07:36:44.796402	3a734398	0	0	0.0000	CRASH	gen=371 glyphs=4
2026-03-14T07:36:44.796604	099964a4	0	0	0.0000	CRASH	gen=371 glyphs=4
2026-03-14T07:36:44.796797	3a734398	0	0	0.0000	CRASH	gen=371 glyphs=4
2026-03-14T07:36:44.796990	eb6e6e92	0	0	0.0000	CRASH	gen=371 glyphs=3
2026-03-14T07:36:44.797185	3ca14993	0	0	0.0000	CRASH	gen=371 glyphs=4
2026-03-14T07:36:44.797380	acdef757	0	0	0.0000	CRASH	gen=371 glyphs=4
2026-03-14T07:36:44.797657	099964a4	0	0	0.0000	CRASH	gen=372 glyphs=4
2026-03-14T07:36:44.797850	099964a4	0	0	0.0000	CRASH	gen=372 glyphs=4
2026-03-14T07:36:44.798061	c277a72f	0	0	0.0000	CRASH	gen=372 glyphs=4
2026-03-14T07:36:44.798257	80cef82b	0	0	0.0000	CRASH	gen=372 glyphs=4
2026-03-14T07:36:44.798457	099964a4	0	0	0.0000	CRASH	gen=372 glyphs=4
2026-03-14T07:36:44.798651	af6cebe2	0	0	0.0000	CRASH	gen=372 glyphs=4
2026-03-14T07:36:44.798868	dcb1fb50	0	0	0.0000	CRASH	gen=372 glyphs=4
2026-03-14T07:36:44.799081	099964a4	0	0	0.0000	CRASH	gen=372 glyphs=4
2026-03-14T07:36:44.799274	1cb0b626	0	0	0.0000	CRASH	gen=372 glyphs=3
2026-03-14T07:36:44.799472	099964a4	0	0	0.0000	CRASH	gen=372 glyphs=4
2026-03-14T07:36:44.799745	099964a4	0	0	0.0000	CRASH	gen=373 glyphs=4
2026-03-14T07:36:44.799948	099964a4	0	0	0.0000	CRASH	gen=373 glyphs=4
2026-03-14T07:36:44.800144	f2774251	0	0	0.0000	CRASH	gen=373 glyphs=2
2026-03-14T07:36:44.800341	099964a4	0	0	0.0000	CRASH	gen=373 glyphs=4
2026-03-14T07:36:44.800539	8618aee5	0	0	0.0000	CRASH	gen=373 glyphs=3
2026-03-14T07:36:44.800736	099964a4	0	0	0.0000	CRASH	gen=373 glyphs=4
2026-03-14T07:36:44.800935	099964a4	0	0	0.0000	CRASH	gen=373 glyphs=4
2026-03-14T07:36:44.801127	099964a4	0	0	0.0000	CRASH	gen=373 glyphs=4
2026-03-14T07:36:44.801324	8365dc4d	0	0	0.0000	CRASH	gen=373 glyphs=4
2026-03-14T07:36:44.801523	274a683a	0	0	0.0000	CRASH	gen=373 glyphs=3
2026-03-14T07:36:44.801795	099964a4	0	0	0.0000	CRASH	gen=374 glyphs=4
2026-03-14T07:36:44.801993	099964a4	0	0	0.0000	CRASH	gen=374 glyphs=4
2026-03-14T07:36:44.802184	099964a4	0	0	0.0000	CRASH	gen=374 glyphs=4
2026-03-14T07:36:44.802376	099964a4	0	0	0.0000	CRASH	gen=374 glyphs=4
2026-03-14T07:36:44.802568	8da1f8d8	0	0	0.0000	CRASH	gen=374 glyphs=4
2026-03-14T07:36:44.802763	099964a4	0	0	0.0000	CRASH	gen=374 glyphs=4
2026-03-14T07:36:44.802957	099964a4	0	0	0.0000	CRASH	gen=374 glyphs=4
2026-03-14T07:36:44.803147	099964a4	0	0	0.0000	CRASH	gen=374 glyphs=4
2026-03-14T07:36:44.803336	d9deeb41	0	0	0.0000	CRASH	gen=374 glyphs=3
2026-03-14T07:36:44.803529	099964a4	0	0	0.0000	CRASH	gen=374 glyphs=4
2026-03-14T07:36:44.803806	099964a4	0	0	0.0000	CRASH	gen=375 glyphs=4
2026-03-14T07:36:44.804002	099964a4	0	0	0.0000	CRASH	gen=375 glyphs=4
2026-03-14T07:36:44.804200	099964a4	0	0	0.0000	CRASH	gen=375 glyphs=4
2026-03-14T07:36:44.804393	099964a4	0	0	0.0000	CRASH	gen=375 glyphs=4
2026-03-14T07:36:44.804590	8069a669	0	0	0.0000	CRASH	gen=375 glyphs=4
2026-03-14T07:36:44.804784	099964a4	0	0	0.0000	CRASH	gen=375 glyphs=4
2026-03-14T07:36:44.804977	099964a4	0	0	0.0000	CRASH	gen=375 glyphs=4
2026-03-14T07:36:44.805171	099964a4	0	0	0.0000	CRASH	gen=375 glyphs=4
2026-03-14T07:36:44.805365	099964a4	0	0	0.0000	CRASH	gen=375 glyphs=4
2026-03-14T07:36:44.805559	099964a4	0	0	0.0000	CRASH	gen=375 glyphs=4
2026-03-14T07:36:44.805837	099964a4	0	0	0.0000	CRASH	gen=376 glyphs=4
2026-03-14T07:36:44.806032	099964a4	0	0	0.0000	CRASH	gen=376 glyphs=4
2026-03-14T07:36:44.806231	099964a4	0	0	0.0000	CRASH	gen=376 glyphs=4
2026-03-14T07:36:44.806425	c02a0fce	0	0	0.0000	CRASH	gen=376 glyphs=5
2026-03-14T07:36:44.806623	099964a4	0	0	0.0000	CRASH	gen=376 glyphs=4
2026-03-14T07:36:44.806816	099964a4	0	0	0.0000	CRASH	gen=376 glyphs=4
2026-03-14T07:36:44.807010	ff30496a	0	0	0.0000	CRASH	gen=376 glyphs=3
2026-03-14T07:36:44.807203	099964a4	0	0	0.0000	CRASH	gen=376 glyphs=4
2026-03-14T07:36:44.807397	099964a4	0	0	0.0000	CRASH	gen=376 glyphs=4
2026-03-14T07:36:44.807595	8bca05cc	0	0	0.0000	CRASH	gen=376 glyphs=4
2026-03-14T07:36:44.807870	099964a4	0	0	0.0000	CRASH	gen=377 glyphs=4
2026-03-14T07:36:44.808066	099964a4	0	0	0.0000	CRASH	gen=377 glyphs=4
2026-03-14T07:36:44.808259	099964a4	0	0	0.0000	CRASH	gen=377 glyphs=4
2026-03-14T07:36:44.808457	099964a4	0	0	0.0000	CRASH	gen=377 glyphs=4
2026-03-14T07:36:44.808654	099964a4	0	0	0.0000	CRASH	gen=377 glyphs=4
2026-03-14T07:36:44.808845	099964a4	0	0	0.0000	CRASH	gen=377 glyphs=4
2026-03-14T07:36:44.809035	dcb1fb50	0	0	0.0000	CRASH	gen=377 glyphs=4
2026-03-14T07:36:44.809228	a77d21fb	0	0	0.0000	CRASH	gen=377 glyphs=4
2026-03-14T07:36:44.809427	099964a4	0	0	0.0000	CRASH	gen=377 glyphs=4
2026-03-14T07:36:44.809622	7ede4765	0	0	0.0000	CRASH	gen=377 glyphs=2
2026-03-14T07:36:44.809891	099964a4	0	0	0.0000	CRASH	gen=378 glyphs=4
2026-03-14T07:36:44.810085	099964a4	0	0	0.0000	CRASH	gen=378 glyphs=4
2026-03-14T07:36:44.810278	099964a4	0	0	0.0000	CRASH	gen=378 glyphs=4
2026-03-14T07:36:44.810472	099964a4	0	0	0.0000	CRASH	gen=378 glyphs=4
2026-03-14T07:36:44.810667	dcb1fb50	0	0	0.0000	CRASH	gen=378 glyphs=4
2026-03-14T07:36:44.810860	099964a4	0	0	0.0000	CRASH	gen=378 glyphs=4
2026-03-14T07:36:44.811052	80cef82b	0	0	0.0000	CRASH	gen=378 glyphs=4
2026-03-14T07:36:44.811244	3ca14993	0	0	0.0000	CRASH	gen=378 glyphs=4
2026-03-14T07:36:44.811438	80cef82b	0	0	0.0000	CRASH	gen=378 glyphs=4
2026-03-14T07:36:44.811635	099964a4	0	0	0.0000	CRASH	gen=378 glyphs=4
2026-03-14T07:36:44.811909	099964a4	0	0	0.0000	CRASH	gen=379 glyphs=4
2026-03-14T07:36:44.812104	099964a4	0	0	0.0000	CRASH	gen=379 glyphs=4
2026-03-14T07:36:44.812296	f57c4710	0	0	0.0000	CRASH	gen=379 glyphs=3
2026-03-14T07:36:44.812489	cf93b656	0	0	0.0000	CRASH	gen=379 glyphs=3
2026-03-14T07:36:44.812691	099964a4	0	0	0.0000	CRASH	gen=379 glyphs=4
2026-03-14T07:36:44.812885	099964a4	0	0	0.0000	CRASH	gen=379 glyphs=4
2026-03-14T07:36:44.813076	099964a4	0	0	0.0000	CRASH	gen=379 glyphs=4
2026-03-14T07:36:44.813269	cd31376c	0	0	0.0000	CRASH	gen=379 glyphs=4
2026-03-14T07:36:44.813467	099964a4	0	0	0.0000	CRASH	gen=379 glyphs=4
2026-03-14T07:36:44.813668	b9fca31b	0	0	0.0000	CRASH	gen=379 glyphs=4
2026-03-14T07:36:44.813949	099964a4	0	0	0.0000	CRASH	gen=380 glyphs=4
2026-03-14T07:36:44.814145	099964a4	0	0	0.0000	CRASH	gen=380 glyphs=4
2026-03-14T07:36:44.814338	3ca14993	0	0	0.0000	CRASH	gen=380 glyphs=4
2026-03-14T07:36:44.814534	e5423a6a	0	0	0.0000	CRASH	gen=380 glyphs=4
2026-03-14T07:36:44.814728	099964a4	0	0	0.0000	CRASH	gen=380 glyphs=4
2026-03-14T07:36:44.814925	ff30496a	0	0	0.0000	CRASH	gen=380 glyphs=3
2026-03-14T07:36:44.815119	099964a4	0	0	0.0000	CRASH	gen=380 glyphs=4
2026-03-14T07:36:44.815310	67d50b63	0	0	0.0000	CRASH	gen=380 glyphs=4
2026-03-14T07:36:44.815504	80cef82b	0	0	0.0000	CRASH	gen=380 glyphs=4
2026-03-14T07:36:44.815697	5647248e	0	0	0.0000	CRASH	gen=380 glyphs=3
2026-03-14T07:36:44.815986	099964a4	0	0	0.0000	CRASH	gen=381 glyphs=4
2026-03-14T07:36:44.816181	099964a4	0	0	0.0000	CRASH	gen=381 glyphs=4
2026-03-14T07:36:44.816374	b1f5cd3e	0	0	0.0000	CRASH	gen=381 glyphs=4
2026-03-14T07:36:44.816572	099964a4	0	0	0.0000	CRASH	gen=381 glyphs=4
2026-03-14T07:36:44.816765	099964a4	0	0	0.0000	CRASH	gen=381 glyphs=4
2026-03-14T07:36:44.816959	dcb1fb50	0	0	0.0000	CRASH	gen=381 glyphs=4
2026-03-14T07:36:44.817157	a9781a5e	0	0	0.0000	CRASH	gen=381 glyphs=2
2026-03-14T07:36:44.817347	099964a4	0	0	0.0000	CRASH	gen=381 glyphs=4
2026-03-14T07:36:44.817544	099964a4	0	0	0.0000	CRASH	gen=381 glyphs=4
2026-03-14T07:36:44.817739	099964a4	0	0	0.0000	CRASH	gen=381 glyphs=4
2026-03-14T07:36:44.818008	099964a4	0	0	0.0000	CRASH	gen=382 glyphs=4
2026-03-14T07:36:44.818207	099964a4	0	0	0.0000	CRASH	gen=382 glyphs=4
2026-03-14T07:36:44.818397	099964a4	0	0	0.0000	CRASH	gen=382 glyphs=4
2026-03-14T07:36:44.818592	099964a4	0	0	0.0000	CRASH	gen=382 glyphs=4
2026-03-14T07:36:44.818783	a8fc0913	0	0	0.0000	CRASH	gen=382 glyphs=3
2026-03-14T07:36:44.818973	8da1f8d8	0	0	0.0000	CRASH	gen=382 glyphs=4
2026-03-14T07:36:44.819170	099964a4	0	0	0.0000	CRASH	gen=382 glyphs=4
2026-03-14T07:36:44.819362	099964a4	0	0	0.0000	CRASH	gen=382 glyphs=4
2026-03-14T07:36:44.819560	3ca14993	0	0	0.0000	CRASH	gen=382 glyphs=4
2026-03-14T07:36:44.819755	099964a4	0	0	0.0000	CRASH	gen=382 glyphs=4
2026-03-14T07:36:44.820043	099964a4	0	0	0.0000	CRASH	gen=383 glyphs=4
2026-03-14T07:36:44.820244	099964a4	0	0	0.0000	CRASH	gen=383 glyphs=4
2026-03-14T07:36:44.820441	fcfd89e7	0	0	0.0000	CRASH	gen=383 glyphs=4
2026-03-14T07:36:44.820640	80c084b6	0	0	0.0000	CRASH	gen=383 glyphs=4
2026-03-14T07:36:44.820840	099964a4	0	0	0.0000	CRASH	gen=383 glyphs=4
2026-03-14T07:36:44.821039	3ca14993	0	0	0.0000	CRASH	gen=383 glyphs=4
2026-03-14T07:36:44.821238	475ee675	0	0	0.0000	CRASH	gen=383 glyphs=4
2026-03-14T07:36:44.821437	099964a4	0	0	0.0000	CRASH	gen=383 glyphs=4
2026-03-14T07:36:44.821644	8b2c6735	0	0	0.0000	CRASH	gen=383 glyphs=4
2026-03-14T07:36:44.821845	099964a4	0	0	0.0000	CRASH	gen=383 glyphs=4
2026-03-14T07:36:44.822134	099964a4	0	0	0.0000	CRASH	gen=384 glyphs=4
2026-03-14T07:36:44.822340	099964a4	0	0	0.0000	CRASH	gen=384 glyphs=4
2026-03-14T07:36:44.822541	099964a4	0	0	0.0000	CRASH	gen=384 glyphs=4
2026-03-14T07:36:44.822741	ffd586a7	0	0	0.0000	CRASH	gen=384 glyphs=4
2026-03-14T07:36:44.822937	3ca14993	0	0	0.0000	CRASH	gen=384 glyphs=4
2026-03-14T07:36:44.823133	099964a4	0	0	0.0000	CRASH	gen=384 glyphs=4
2026-03-14T07:36:44.823328	75f58b2f	0	0	0.0000	CRASH	gen=384 glyphs=4
2026-03-14T07:36:44.823531	a1ac8d1b	0	0	0.0000	CRASH	gen=384 glyphs=3
2026-03-14T07:36:44.823737	099964a4	0	0	0.0000	CRASH	gen=384 glyphs=4
2026-03-14T07:36:44.823933	0dc54e86	0	0	0.0000	CRASH	gen=384 glyphs=4
2026-03-14T07:36:44.824224	099964a4	0	0	0.0000	CRASH	gen=385 glyphs=4
2026-03-14T07:36:44.824426	099964a4	0	0	0.0000	CRASH	gen=385 glyphs=4
2026-03-14T07:36:44.824631	8da1f8d8	0	0	0.0000	CRASH	gen=385 glyphs=4
2026-03-14T07:36:44.824827	20fd1d3b	0	0	0.0000	CRASH	gen=385 glyphs=4
2026-03-14T07:36:44.825022	099964a4	0	0	0.0000	CRASH	gen=385 glyphs=4
2026-03-14T07:36:44.825216	dd482792	0	0	0.0000	CRASH	gen=385 glyphs=2
2026-03-14T07:36:44.825407	099964a4	0	0	0.0000	CRASH	gen=385 glyphs=4
2026-03-14T07:36:44.825604	099964a4	0	0	0.0000	CRASH	gen=385 glyphs=4
2026-03-14T07:36:44.825799	f6b9cec4	0	0	0.0000	CRASH	gen=385 glyphs=3
2026-03-14T07:36:44.825992	80cef82b	0	0	0.0000	CRASH	gen=385 glyphs=4
2026-03-14T07:36:44.826270	099964a4	0	0	0.0000	CRASH	gen=386 glyphs=4
2026-03-14T07:36:44.826465	099964a4	0	0	0.0000	CRASH	gen=386 glyphs=4
2026-03-14T07:36:44.826666	099964a4	0	0	0.0000	CRASH	gen=386 glyphs=4
2026-03-14T07:36:44.826861	310f00dd	0	0	0.0000	CRASH	gen=386 glyphs=4
2026-03-14T07:36:44.827057	099964a4	0	0	0.0000	CRASH	gen=386 glyphs=4
2026-03-14T07:36:44.827252	fa6ff140	0	0	0.0000	CRASH	gen=386 glyphs=4
2026-03-14T07:36:44.827447	099964a4	0	0	0.0000	CRASH	gen=386 glyphs=4
2026-03-14T07:36:44.827644	099964a4	0	0	0.0000	CRASH	gen=386 glyphs=4
2026-03-14T07:36:44.827840	5d4cc4e2	0	0	0.0000	CRASH	gen=386 glyphs=4
2026-03-14T07:36:44.828034	8d34531c	0	0	0.0000	CRASH	gen=386 glyphs=5
2026-03-14T07:36:44.828315	099964a4	0	0	0.0000	CRASH	gen=387 glyphs=4
2026-03-14T07:36:44.828514	099964a4	0	0	0.0000	CRASH	gen=387 glyphs=4
2026-03-14T07:36:44.828713	099964a4	0	0	0.0000	CRASH	gen=387 glyphs=4
2026-03-14T07:36:44.828911	099964a4	0	0	0.0000	CRASH	gen=387 glyphs=4
2026-03-14T07:36:44.829107	099964a4	0	0	0.0000	CRASH	gen=387 glyphs=4
2026-03-14T07:36:44.829302	449b2023	0	0	0.0000	CRASH	gen=387 glyphs=5
2026-03-14T07:36:44.829501	099964a4	0	0	0.0000	CRASH	gen=387 glyphs=4
2026-03-14T07:36:44.829699	099964a4	0	0	0.0000	CRASH	gen=387 glyphs=4
2026-03-14T07:36:44.829900	6de424af	0	0	0.0000	CRASH	gen=387 glyphs=4
2026-03-14T07:36:44.830097	ff30496a	0	0	0.0000	CRASH	gen=387 glyphs=3
2026-03-14T07:36:44.830377	099964a4	0	0	0.0000	CRASH	gen=388 glyphs=4
2026-03-14T07:36:44.830578	099964a4	0	0	0.0000	CRASH	gen=388 glyphs=4
2026-03-14T07:36:44.830773	c2260f32	0	0	0.0000	CRASH	gen=388 glyphs=3
2026-03-14T07:36:44.830971	6dd3602e	0	0	0.0000	CRASH	gen=388 glyphs=5
2026-03-14T07:36:44.831167	099964a4	0	0	0.0000	CRASH	gen=388 glyphs=4
2026-03-14T07:36:44.831364	7ede4765	0	0	0.0000	CRASH	gen=388 glyphs=2
