timestamp	program_hash	spirv_size	word_count	fitness	status	description
2026-03-14T07:36:44.703501	099964a4	0	0	0.0000	CRASH	gen=326 glyphs=4
2026-03-14T07:36:44.703700	099964a4	0	0	0.0000	CRASH	gen=326 glyphs=4
2026-03-14T07:36:44.703899	3ca14993	0	0	0.0000	CRASH	gen=326 glyphs=4
2026-03-14T07:36:44.704095	099964a4	0	0	0.0000	CRASH	gen=326 glyphs=4
2026-03-14T07:36:44.704288	6c0ddfb8	0	0	0.0000	CRASH	gen=326 glyphs=4
2026-03-14T07:36:44.704488	342ef5b9	0	0	0.0000	CRASH	gen=326 glyphs=4
2026-03-14T07:36:44.704687	b644bfd3	0	0	0.0000	CRASH	gen=326 glyphs=4
2026-03-14T07:36:44.704881	3ca14993	0	0	0.0000	CRASH	gen=326 glyphs=4
2026-03-14T07:36:44.705078	099964a4	0	0	0.0000	CRASH	gen=326 glyphs=4
2026-03-14T07:36:44.705273	099964a4	0	0	0.0000	CRASH	gen=326 glyphs=4
2026-03-14T07:36:44.705556	099964a4	0	0	0.0000	CRASH	gen=327 glyphs=4
2026-03-14T07:36:44.705755	099964a4	0	0	0.0000	CRASH	gen=327 glyphs=4
2026-03-14T07:36:44.705951	099964a4	0	0	0.0000	CRASH	gen=327 glyphs=4
2026-03-14T07:36:44.706147	72e397e4	0	0	0.0000	CRASH	gen=327 glyphs=3
2026-03-14T07:36:44.706348	099964a4	0	0	0.0000	CRASH	gen=327 glyphs=4
2026-03-14T07:36:44.706551	7ede4765	0	0	0.0000	CRASH	gen=327 glyphs=2
2026-03-14T07:36:44.706750	91bf7d9a	0	0	0.0000	CRASH	gen=327 glyphs=3
2026-03-14T07:36:44.706944	b5c1e4fc	0	0	0.0000	CRASH	gen=327 glyphs=4
2026-03-14T07:36:44.707142	180aac1b	0	0	0.0000	CRASH	gen=327 glyphs=4
2026-03-14T07:36:44.707335	8b5f0e88	0	0	0.0000	CRASH	gen=327 glyphs=4
2026-03-14T07:36:44.707619	099964a4	0	0	0.0000	CRASH	gen=328 glyphs=4
2026-03-14T07:36:44.707829	099964a4	0	0	0.0000	CRASH	gen=328 glyphs=4
2026-03-14T07:36:44.708033	ff30496a	0	0	0.0000	CRASH	gen=328 glyphs=3
2026-03-14T07:36:44.708230	099964a4	0	0	0.0000	CRASH	gen=328 glyphs=4
2026-03-14T07:36:44.708433	cf93b656	0	0	0.0000	CRASH	gen=328 glyphs=3
2026-03-14T07:36:44.708635	63fdf25b	0	0	0.0000	CRASH	gen=328 glyphs=4
2026-03-14T07:36:44.708835	099964a4	0	0	0.0000	CRASH	gen=328 glyphs=4
2026-03-14T07:36:44.709030	80cef82b	0	0	0.0000	CRASH	gen=328 glyphs=4
2026-03-14T07:36:44.709228	099964a4	0	0	0.0000	CRASH	gen=328 glyphs=4
2026-03-14T07:36:44.709423	e51e1b90	0	0	0.0000	CRASH	gen=328 glyphs=3
2026-03-14T07:36:44.709705	099964a4	0	0	0.0000	CRASH	gen=329 glyphs=4
2026-03-14T07:36:44.709908	099964a4	0	0	0.0000	CRASH	gen=329 glyphs=4
2026-03-14T07:36:44.710104	099964a4	0	0	0.0000	CRASH	gen=329 glyphs=4
2026-03-14T07:36:44.710298	8da1f8d8	0	0	0.0000	CRASH	gen=329 glyphs=4
2026-03-14T07:36:44.710494	cf93b656	0	0	0.0000	CRASH	gen=329 glyphs=3
2026-03-14T07:36:44.710688	3a734398	0	0	0.0000	CRASH	gen=329 glyphs=4
2026-03-14T07:36:44.710890	8da1f8d8	0	0	0.0000	CRASH	gen=329 glyphs=4
2026-03-14T07:36:44.711087	7aaafedc	0	0	0.0000	CRASH	gen=329 glyphs=3
2026-03-14T07:36:44.711282	80cef82b	0	0	0.0000	CRASH	gen=329 glyphs=4
2026-03-14T07:36:44.711477	349499a7	0	0	0.0000	CRASH	gen=329 glyphs=3
2026-03-14T07:36:44.711748	099964a4	0	0	0.0000	CRASH	gen=330 glyphs=4
2026-03-14T07:36:44.711950	099964a4	0	0	0.0000	CRASH	gen=330 glyphs=4
2026-03-14T07:36:44.712147	099964a4	0	0	0.0000	CRASH	gen=330 glyphs=4
2026-03-14T07:36:44.712341	099964a4	0	0	0.0000	CRASH	gen=330 glyphs=4
2026-03-14T07:36:44.712536	099964a4	0	0	0.0000	CRASH	gen=330 glyphs=4
2026-03-14T07:36:44.712730	80cef82b	0	0	0.0000	CRASH	gen=330 glyphs=4
2026-03-14T07:36:44.712926	099964a4	0	0	0.0000	CRASH	gen=330 glyphs=4
2026-03-14T07:36:44.713120	099964a4	0	0	0.0000	CRASH	gen=330 glyphs=4
2026-03-14T07:36:44.713319	099964a4	0	0	0.0000	CRASH	gen=330 glyphs=4
2026-03-14T07:36:44.713515	099964a4	0	0	0.0000	CRASH	gen=330 glyphs=4
2026-03-14T07:36:44.713805	099964a4	0	0	0.0000	CRASH	gen=331 glyphs=4
2026-03-14T07:36:44.714008	099964a4	0	0	0.0000	CRASH	gen=331 glyphs=4
2026-03-14T07:36:44.714207	3080c646	0	0	0.0000	CRASH	gen=331 glyphs=4
2026-03-14T07:36:44.714403	de5d8e09	0	0	0.0000	CRASH	gen=331 glyphs=4
2026-03-14T07:36:44.714602	099964a4	0	0	0.0000	CRASH	gen=331 glyphs=4
2026-03-14T07:36:44.714795	569f36d7	0	0	0.0000	CRASH	gen=331 glyphs=4
2026-03-14T07:36:44.714988	175e4a85	0	0	0.0000	CRASH	gen=331 glyphs=4
2026-03-14T07:36:44.715189	dcb1fb50	0	0	0.0000	CRASH	gen=331 glyphs=4
2026-03-14T07:36:44.715387	8b6f599f	0	0	0.0000	CRASH	gen=331 glyphs=4
2026-03-14T07:36:44.715583	099964a4	0	0	0.0000	CRASH	gen=331 glyphs=4
2026-03-14T07:36:44.715856	099964a4	0	0	0.0000	CRASH	gen=332 glyphs=4
2026-03-14T07:36:44.716054	099964a4	0	0	0.0000	CRASH	gen=332 glyphs=4
2026-03-14T07:36:44.716255	099964a4	0	0	0.0000	CRASH	gen=332 glyphs=4
2026-03-14T07:36:44.716449	099964a4	0	0	0.0000	CRASH	gen=332 glyphs=4
2026-03-14T07:36:44.716645	099964a4	0	0	0.0000	CRASH	gen=332 glyphs=4
2026-03-14T07:36:44.716840	099964a4	0	0	0.0000	CRASH	gen=332 glyphs=4
2026-03-14T07:36:44.717039	099964a4	0	0	0.0000	CRASH	gen=332 glyphs=4
2026-03-14T07:36:44.717241	905a3051	0	0	0.0000	CRASH	gen=332 glyphs=4
2026-03-14T07:36:44.717438	099964a4	0	0	0.0000	CRASH	gen=332 glyphs=4
2026-03-14T07:36:44.717635	cf93b656	0	0	0.0000	CRASH	gen=332 glyphs=3
2026-03-14T07:36:44.717901	099964a4	0	0	0.0000	CRASH	gen=333 glyphs=4
2026-03-14T07:36:44.718095	099964a4	0	0	0.0000	CRASH	gen=333 glyphs=4
2026-03-14T07:36:44.718292	099964a4	0	0	0.0000	CRASH	gen=333 glyphs=4
2026-03-14T07:36:44.718482	c6f245fd	0	0	0.0000	CRASH	gen=333 glyphs=4
2026-03-14T07:36:44.718678	099964a4	0	0	0.0000	CRASH	gen=333 glyphs=4
2026-03-14T07:36:44.718868	e84c9350	0	0	0.0000	CRASH	gen=333 glyphs=4
2026-03-14T07:36:44.719060	492c53e2	0	0	0.0000	CRASH	gen=333 glyphs=4
2026-03-14T07:36:44.719252	099964a4	0	0	0.0000	CRASH	gen=333 glyphs=4
2026-03-14T07:36:44.719446	cf93b656	0	0	0.0000	CRASH	gen=333 glyphs=3
2026-03-14T07:36:44.719637	80cef82b	0	0	0.0000	CRASH	gen=333 glyphs=4
2026-03-14T07:36:44.719912	099964a4	0	0	0.0000	CRASH	gen=334 glyphs=4
2026-03-14T07:36:44.720104	099964a4	0	0	0.0000	CRASH	gen=334 glyphs=4
2026-03-14T07:36:44.720298	abee838d	0	0	0.0000	CRASH	gen=334 glyphs=4
2026-03-14T07:36:44.720496	3a734398	0	0	0.0000	CRASH	gen=334 glyphs=4
2026-03-14T07:36:44.720691	099964a4	0	0	0.0000	CRASH	gen=334 glyphs=4
2026-03-14T07:36:44.720881	cf93b656	0	0	0.0000	CRASH	gen=334 glyphs=3
2026-03-14T07:36:44.721071	099964a4	0	0	0.0000	CRASH	gen=334 glyphs=4
2026-03-14T07:36:44.721261	15a879cc	0	0	0.0000	CRASH	gen=334 glyphs=4
2026-03-14T07:36:44.721458	08e79dee	0	0	0.0000	CRASH	gen=334 glyphs=4
2026-03-14T07:36:44.721651	6155003e	0	0	0.0000	CRASH	gen=334 glyphs=4
2026-03-14T07:36:44.721926	099964a4	0	0	0.0000	CRASH	gen=335 glyphs=4
2026-03-14T07:36:44.722120	099964a4	0	0	0.0000	CRASH	gen=335 glyphs=4
2026-03-14T07:36:44.722316	40833702	0	0	0.0000	CRASH	gen=335 glyphs=4
2026-03-14T07:36:44.722519	c7283234	0	0	0.0000	CRASH	gen=335 glyphs=4
2026-03-14T07:36:44.722713	ff30496a	0	0	0.0000	CRASH	gen=335 glyphs=3
2026-03-14T07:36:44.722903	099964a4	0	0	0.0000	CRASH	gen=335 glyphs=4
2026-03-14T07:36:44.723094	099964a4	0	0	0.0000	CRASH	gen=335 glyphs=4
2026-03-14T07:36:44.723284	099964a4	0	0	0.0000	CRASH	gen=335 glyphs=4
2026-03-14T07:36:44.723476	70e5f0fa	0	0	0.0000	CRASH	gen=335 glyphs=4
2026-03-14T07:36:44.723676	cf93b656	0	0	0.0000	CRASH	gen=335 glyphs=3
2026-03-14T07:36:44.723946	099964a4	0	0	0.0000	CRASH	gen=336 glyphs=4
2026-03-14T07:36:44.724140	099964a4	0	0	0.0000	CRASH	gen=336 glyphs=4
2026-03-14T07:36:44.724336	06031668	0	0	0.0000	CRASH	gen=336 glyphs=4
2026-03-14T07:36:44.724533	3ca14993	0	0	0.0000	CRASH	gen=336 glyphs=4
2026-03-14T07:36:44.724733	099964a4	0	0	0.0000	CRASH	gen=336 glyphs=4
2026-03-14T07:36:44.724925	099964a4	0	0	0.0000	CRASH	gen=336 glyphs=4
2026-03-14T07:36:44.725117	099964a4	0	0	0.0000	CRASH	gen=336 glyphs=4
2026-03-14T07:36:44.725309	099964a4	0	0	0.0000	CRASH	gen=336 glyphs=4
2026-03-14T07:36:44.725503	099964a4	0	0	0.0000	CRASH	gen=336 glyphs=4
2026-03-14T07:36:44.725703	099964a4	0	0	0.0000	CRASH	gen=336 glyphs=4
2026-03-14T07:36:44.725981	099964a4	0	0	0.0000	CRASH	gen=337 glyphs=4
2026-03-14T07:36:44.726178	099964a4	0	0	0.0000	CRASH	gen=337 glyphs=4
2026-03-14T07:36:44.726370	3a734398	0	0	0.0000	CRASH	gen=337 glyphs=4
2026-03-14T07:36:44.726568	44968268	0	0	0.0000	CRASH	gen=337 glyphs=4
2026-03-14T07:36:44.726766	029411a1	0	0	0.0000	CRASH	gen=337 glyphs=4
2026-03-14T07:36:44.726960	099964a4	0	0	0.0000	CRASH	gen=337 glyphs=4
2026-03-14T07:36:44.727151	099964a4	0	0	0.0000	CRASH	gen=337 glyphs=4
2026-03-14T07:36:44.727342	099964a4	0	0	0.0000	CRASH	gen=337 glyphs=4
2026-03-14T07:36:44.727537	099964a4	0	0	0.0000	CRASH	gen=337 glyphs=4
2026-03-14T07:36:44.727729	85e2fd72	0	0	0.0000	CRASH	gen=337 glyphs=3
2026-03-14T07:36:44.728005	099964a4	0	0	0.0000	CRASH	gen=338 glyphs=4
2026-03-14T07:36:44.728199	099964a4	0	0	0.0000	CRASH	gen=338 glyphs=4
2026-03-14T07:36:44.728393	7ede4765	0	0	0.0000	CRASH	gen=338 glyphs=2
2026-03-14T07:36:44.728587	099964a4	0	0	0.0000	CRASH	gen=338 glyphs=4
2026-03-14T07:36:44.728781	3ca14993	0	0	0.0000	CRASH	gen=338 glyphs=4
2026-03-14T07:36:44.728977	3f770c15	0	0	0.0000	CRASH	gen=338 glyphs=4
2026-03-14T07:36:44.729172	099964a4	0	0	0.0000	CRASH	gen=338 glyphs=4
2026-03-14T07:36:44.729363	099964a4	0	0	0.0000	CRASH	gen=338 glyphs=4
2026-03-14T07:36:44.729559	099964a4	0	0	0.0000	CRASH	gen=338 glyphs=4
2026-03-14T07:36:44.729751	3ca14993	0	0	0.0000	CRASH	gen=338 glyphs=4
2026-03-14T07:36:44.730028	099964a4	0	0	0.0000	CRASH	gen=339 glyphs=4
2026-03-14T07:36:44.730226	099964a4	0	0	0.0000	CRASH	gen=339 glyphs=4
2026-03-14T07:36:44.730423	80cef82b	0	0	0.0000	CRASH	gen=339 glyphs=4
2026-03-14T07:36:44.730636	099964a4	0	0	0.0000	CRASH	gen=339 glyphs=4
2026-03-14T07:36:44.730830	ff30496a	0	0	0.0000	CRASH	gen=339 glyphs=3
2026-03-14T07:36:44.731031	cf93b656	0	0	0.0000	CRASH	gen=339 glyphs=3
2026-03-14T07:36:44.731223	155014f7	0	0	0.0000	CRASH	gen=339 glyphs=3
2026-03-14T07:36:44.731418	099964a4	0	0	0.0000	CRASH	gen=339 glyphs=4
2026-03-14T07:36:44.731615	099964a4	0	0	0.0000	CRASH	gen=339 glyphs=4
2026-03-14T07:36:44.731808	632858ff	0	0	0.0000	CRASH	gen=339 glyphs=4
2026-03-14T07:36:44.732084	099964a4	0	0	0.0000	CRASH	gen=340 glyphs=4
2026-03-14T07:36:44.732280	099964a4	0	0	0.0000	CRASH	gen=340 glyphs=4
2026-03-14T07:36:44.732475	7ede4765	0	0	0.0000	CRASH	gen=340 glyphs=2
2026-03-14T07:36:44.732673	099964a4	0	0	0.0000	CRASH	gen=340 glyphs=4
2026-03-14T07:36:44.732867	099964a4	0	0	0.0000	CRASH	gen=340 glyphs=4
2026-03-14T07:36:44.733063	3a734398	0	0	0.0000	CRASH	gen=340 glyphs=4
2026-03-14T07:36:44.733257	099964a4	0	0	0.0000	CRASH	gen=340 glyphs=4
2026-03-14T07:36:44.733448	c611808d	0	0	0.0000	CRASH	gen=340 glyphs=3
2026-03-14T07:36:44.733643	099964a4	0	0	0.0000	CRASH	gen=340 glyphs=4
2026-03-14T07:36:44.733832	ff30496a	0	0	0.0000	CRASH	gen=340 glyphs=3
2026-03-14T07:36:44.734110	099964a4	0	0	0.0000	CRASH	gen=341 glyphs=4
2026-03-14T07:36:44.734305	099964a4	0	0	0.0000	CRASH	gen=341 glyphs=4
2026-03-14T07:36:44.734500	099964a4	0	0	0.0000	CRASH	gen=341 glyphs=4
2026-03-14T07:36:44.734695	099964a4	0	0	0.0000	CRASH	gen=341 glyphs=4
2026-03-14T07:36:44.734888	099964a4	0	0	0.0000	CRASH	gen=341 glyphs=4
2026-03-14T07:36:44.735080	dcb1fb50	0	0	0.0000	CRASH	gen=341 glyphs=4
2026-03-14T07:36:44.735281	099964a4	0	0	0.0000	CRASH	gen=341 glyphs=4
2026-03-14T07:36:44.735474	099964a4	0	0	0.0000	CRASH	gen=341 glyphs=4
2026-03-14T07:36:44.735672	099964a4	0	0	0.0000	CRASH	gen=341 glyphs=4
2026-03-14T07:36:44.735867	099964a4	0	0	0.0000	CRASH	gen=341 glyphs=4
2026-03-14T07:36:44.736137	099964a4	0	0	0.0000	CRASH	gen=342 glyphs=4
2026-03-14T07:36:44.736338	099964a4	0	0	0.0000	CRASH	gen=342 glyphs=4
2026-03-14T07:36:44.736534	099964a4	0	0	0.0000	CRASH	gen=342 glyphs=4
2026-03-14T07:36:44.736727	ef2d835d	0	0	0.0000	CRASH	gen=342 glyphs=4
2026-03-14T07:36:44.736923	099964a4	0	0	0.0000	CRASH	gen=342 glyphs=4
2026-03-14T07:36:44.737114	099964a4	0	0	0.0000	CRASH	gen=342 glyphs=4
2026-03-14T07:36:44.737311	b756622b	0	0	0.0000	CRASH	gen=342 glyphs=5
2026-03-14T07:36:44.737507	099964a4	0	0	0.0000	CRASH	gen=342 glyphs=4
2026-03-14T07:36:44.737706	099964a4	0	0	0.0000	CRASH	gen=342 glyphs=4
2026-03-14T07:36:44.737903	dcb1fb50	0	0	0.0000	CRASH	gen=342 glyphs=4
2026-03-14T07:36:44.738182	099964a4	0	0	0.0000	CRASH	gen=343 glyphs=4
2026-03-14T07:36:44.738382	099964a4	0	0	0.0000	CRASH	gen=343 glyphs=4
2026-03-14T07:36:44.738580	798ce976	0	0	0.0000	CRASH	gen=343 glyphs=3
2026-03-14T07:36:44.738775	099964a4	0	0	0.0000	CRASH	gen=343 glyphs=4
2026-03-14T07:36:44.738970	dcb1fb50	0	0	0.0000	CRASH	gen=343 glyphs=4
2026-03-14T07:36:44.739165	ceea12c4	0	0	0.0000	CRASH	gen=343 glyphs=4
2026-03-14T07:36:44.739362	099964a4	0	0	0.0000	CRASH	gen=343 glyphs=4
2026-03-14T07:36:44.739558	099964a4	0	0	0.0000	CRASH	gen=343 glyphs=4
2026-03-14T07:36:44.739755	7ede4765	0	0	0.0000	CRASH	gen=343 glyphs=2
2026-03-14T07:36:44.739951	099964a4	0	0	0.0000	CRASH	gen=343 glyphs=4
2026-03-14T07:36:44.740223	099964a4	0	0	0.0000	CRASH	gen=344 glyphs=4
2026-03-14T07:36:44.740421	099964a4	0	0	0.0000	CRASH	gen=344 glyphs=4
2026-03-14T07:36:44.740621	099964a4	0	0	0.0000	CRASH	gen=344 glyphs=4
2026-03-14T07:36:44.740816	099964a4	0	0	0.0000	CRASH	gen=344 glyphs=4
2026-03-14T07:36:44.741011	dcb1fb50	0	0	0.0000	CRASH	gen=344 glyphs=4
2026-03-14T07:36:44.741207	27f6de6b	0	0	0.0000	CRASH	gen=344 glyphs=3
2026-03-14T07:36:44.741402	217598c1	0	0	0.0000	CRASH	gen=344 glyphs=2
2026-03-14T07:36:44.741600	099964a4	0	0	0.0000	CRASH	gen=344 glyphs=4
2026-03-14T07:36:44.741795	099964a4	0	0	0.0000	CRASH	gen=344 glyphs=4
2026-03-14T07:36:44.741989	099964a4	0	0	0.0000	CRASH	gen=344 glyphs=4
2026-03-14T07:36:44.742266	099964a4	0	0	0.0000	CRASH	gen=345 glyphs=4
2026-03-14T07:36:44.742461	099964a4	0	0	0.0000	CRASH	gen=345 glyphs=4
2026-03-14T07:36:44.742663	099964a4	0	0	0.0000	CRASH	gen=345 glyphs=4
2026-03-14T07:36:44.742855	3ca14993	0	0	0.0000	CRASH	gen=345 glyphs=4
2026-03-14T07:36:44.743051	099964a4	0	0	0.0000	CRASH	gen=345 glyphs=4
2026-03-14T07:36:44.743242	8da1f8d8	0	0	0.0000	CRASH	gen=345 glyphs=4
2026-03-14T07:36:44.743438	099964a4	0	0	0.0000	CRASH	gen=345 glyphs=4
2026-03-14T07:36:44.743635	80cef82b	0	0	0.0000	CRASH	gen=345 glyphs=4
2026-03-14T07:36:44.743831	ff30496a	0	0	0.0000	CRASH	gen=345 glyphs=3
2026-03-14T07:36:44.744024	8da1f8d8	0	0	0.0000	CRASH	gen=345 glyphs=4
2026-03-14T07:36:44.744306	099964a4	0	0	0.0000	CRASH	gen=346 glyphs=4
2026-03-14T07:36:44.744502	099964a4	0	0	0.0000	CRASH	gen=346 glyphs=4
2026-03-14T07:36:44.744705	099964a4	0	0	0.0000	CRASH	gen=346 glyphs=4
2026-03-14T07:36:44.744897	099964a4	0	0	0.0000	CRASH	gen=346 glyphs=4
2026-03-14T07:36:44.745089	2a454503	0	0	0.0000	CRASH	gen=346 glyphs=4
2026-03-14T07:36:44.745282	3ca14993	0	0	0.0000	CRASH	gen=346 glyphs=4
2026-03-14T07:36:44.745477	dcb1fb50	0	0	0.0000	CRASH	gen=346 glyphs=4
2026-03-14T07:36:44.745674	099964a4	0	0	0.0000	CRASH	gen=346 glyphs=4
2026-03-14T07:36:44.745873	8a27ed03	0	0	0.0000	CRASH	gen=346 glyphs=2
2026-03-14T07:36:44.746068	099964a4	0	0	0.0000	CRASH	gen=346 glyphs=4
2026-03-14T07:36:44.746345	099964a4	0	0	0.0000	CRASH	gen=347 glyphs=4
2026-03-14T07:36:44.746548	099964a4	0	0	0.0000	CRASH	gen=347 glyphs=4
2026-03-14T07:36:44.746745	099964a4	0	0	0.0000	CRASH	gen=347 glyphs=4
2026-03-14T07:36:44.746941	099964a4	0	0	0.0000	CRASH	gen=347 glyphs=4
2026-03-14T07:36:44.747137	3ca14993	0	0	0.0000	CRASH	gen=347 glyphs=4
2026-03-14T07:36:44.747333	e3d5d8e4	0	0	0.0000	CRASH	gen=347 glyphs=5
2026-03-14T07:36:44.747530	099964a4	0	0	0.0000	CRASH	gen=347 glyphs=4
2026-03-14T07:36:44.747721	37db9011	0	0	0.0000	CRASH	gen=347 glyphs=4
2026-03-14T07:36:44.747922	d0dad964	0	0	0.0000	CRASH	gen=347 glyphs=4
2026-03-14T07:36:44.748117	099964a4	0	0	0.0000	CRASH	gen=347 glyphs=4
2026-03-14T07:36:44.748391	099964a4	0	0	0.0000	CRASH	gen=348 glyphs=4
2026-03-14T07:36:44.748589	099964a4	0	0	0.0000	CRASH	gen=348 glyphs=4
2026-03-14T07:36:44.748782	099964a4	0	0	0.0000	CRASH	gen=348 glyphs=4
2026-03-14T07:36:44.748980	3ca14993	0	0	0.0000	CRASH	gen=348 glyphs=4
2026-03-14T07:36:44.749178	099964a4	0	0	0.0000	CRASH	gen=348 glyphs=4
2026-03-14T07:36:44.749370	80cef82b	0	0	0.0000	CRASH	gen=348 glyphs=4
2026-03-14T07:36:44.749566	099964a4	0	0	0.0000	CRASH	gen=348 glyphs=4
2026-03-14T07:36:44.749757	7ede4765	0	0	0.0000	CRASH	gen=348 glyphs=2
2026-03-14T07:36:44.749964	ff30496a	0	0	0.0000	CRASH	gen=348 glyphs=3
2026-03-14T07:36:44.750162	14cdd568	0	0	0.0000	CRASH	gen=348 glyphs=4
2026-03-14T07:36:44.750443	099964a4	0	0	0.0000	CRASH	gen=349 glyphs=4
2026-03-14T07:36:44.750642	099964a4	0	0	0.0000	CRASH	gen=349 glyphs=4
2026-03-14T07:36:44.750837	957e6dd3	0	0	0.0000	CRASH	gen=349 glyphs=4
2026-03-14T07:36:44.751039	ff30496a	0	0	0.0000	CRASH	gen=349 glyphs=3
2026-03-14T07:36:44.751235	099964a4	0	0	0.0000	CRASH	gen=349 glyphs=4
2026-03-14T07:36:44.751428	80cef82b	0	0	0.0000	CRASH	gen=349 glyphs=4
2026-03-14T07:36:44.751623	5b650080	0	0	0.0000	CRASH	gen=349 glyphs=2
2026-03-14T07:36:44.751816	dcb1fb50	0	0	0.0000	CRASH	gen=349 glyphs=4
2026-03-14T07:36:44.752015	7ede4765	0	0	0.0000	CRASH	gen=349 glyphs=2
2026-03-14T07:36:44.752217	099964a4	0	0	0.0000	CRASH	gen=349 glyphs=4
2026-03-14T07:36:44.752497	099964a4	0	0	0.0000	CRASH	gen=350 glyphs=4
2026-03-14T07:36:44.752696	099964a4	0	0	0.0000	CRASH	gen=350 glyphs=4
2026-03-14T07:36:44.752893	ff30496a	0	0	0.0000	CRASH	gen=350 glyphs=3
2026-03-14T07:36:44.753088	099964a4	0	0	0.0000	CRASH	gen=350 glyphs=4
2026-03-14T07:36:44.753283	52ff213d	0	0	0.0000	CRASH	gen=350 glyphs=4
2026-03-14T07:36:44.753480	099964a4	0	0	0.0000	CRASH	gen=350 glyphs=4
2026-03-14T07:36:44.753675	099964a4	0	0	0.0000	CRASH	gen=350 glyphs=4
2026-03-14T07:36:44.753866	cf93b656	0	0	0.0000	CRASH	gen=350 glyphs=3
2026-03-14T07:36:44.754059	7ede4765	0	0	0.0000	CRASH	gen=350 glyphs=2
2026-03-14T07:36:44.754255	099964a4	0	0	0.0000	CRASH	gen=350 glyphs=4
2026-03-14T07:36:44.754543	099964a4	0	0	0.0000	CRASH	gen=351 glyphs=4
2026-03-14T07:36:44.754742	099964a4	0	0	0.0000	CRASH	gen=351 glyphs=4
2026-03-14T07:36:44.754938	8da1f8d8	0	0	0.0000	CRASH	gen=351 glyphs=4
2026-03-14T07:36:44.755134	fc80cb7c	0	0	0.0000	CRASH	gen=351 glyphs=4
2026-03-14T07:36:44.755333	e0dd6855	0	0	0.0000	CRASH	gen=351 glyphs=3
2026-03-14T07:36:44.755530	e2f4b42c	0	0	0.0000	CRASH	gen=351 glyphs=4
2026-03-14T07:36:44.755726	099964a4	0	0	0.0000	CRASH	gen=351 glyphs=4
2026-03-14T07:36:44.755920	099964a4	0	0	0.0000	CRASH	gen=351 glyphs=4
2026-03-14T07:36:44.756114	d9953afa	0	0	0.0000	CRASH	gen=351 glyphs=3
2026-03-14T07:36:44.756310	a76bea36	0	0	0.0000	CRASH	gen=351 glyphs=4
2026-03-14T07:36:44.756587	099964a4	0	0	0.0000	CRASH	gen=352 glyphs=4
2026-03-14T07:36:44.756787	099964a4	0	0	0.0000	CRASH	gen=352 glyphs=4
2026-03-14T07:36:44.756982	099964a4	0	0	0.0000	CRASH	gen=352 glyphs=4
2026-03-14T07:36:44.757175	099964a4	0	0	0.0000	CRASH	gen=352 glyphs=4
2026-03-14T07:36:44.757374	099964a4	0	0	0.0000	CRASH	gen=352 glyphs=4
2026-03-14T07:36:44.757570	43706197	0	0	0.0000	CRASH	gen=352 glyphs=3
2026-03-14T07:36:44.757763	d6a65ac6	0	0	0.0000	CRASH	gen=352 glyphs=2
2026-03-14T07:36:44.757957	099964a4	0	0	0.0000	CRASH	gen=352 glyphs=4
2026-03-14T07:36:44.758153	099964a4	0	0	0.0000	CRASH	gen=352 glyphs=4
2026-03-14T07:36:44.758346	8da1f8d8	0	0	0.0000	CRASH	gen=352 glyphs=4
2026-03-14T07:36:44.758633	099964a4	0	0	0.0000	CRASH	gen=353 glyphs=4
2026-03-14T07:36:44.758828	099964a4	0	0	0.0000	CRASH	gen=353 glyphs=4
2026-03-14T07:36:44.759022	e785076d	0	0	0.0000	CRASH	gen=353 glyphs=4
2026-03-14T07:36:44.759215	8da1f8d8	0	0	0.0000	CRASH	gen=353 glyphs=4
2026-03-14T07:36:44.759407	3a734398	0	0	0.0000	CRASH	gen=353 glyphs=4
2026-03-14T07:36:44.759605	8009a5e5	0	0	0.0000	CRASH	gen=353 glyphs=4
2026-03-14T07:36:44.759800	5cc5769c	0	0	0.0000	CRASH	gen=353 glyphs=5
2026-03-14T07:36:44.759993	099964a4	0	0	0.0000	CRASH	gen=353 glyphs=4
2026-03-14T07:36:44.760185	3ca14993	0	0	0.0000	CRASH	gen=353 glyphs=4
2026-03-14T07:36:44.760377	099964a4	0	0	0.0000	CRASH	gen=353 glyphs=4
2026-03-14T07:36:44.760669	099964a4	0	0	0.0000	CRASH	gen=354 glyphs=4
2026-03-14T07:36:44.760864	099964a4	0	0	0.0000	CRASH	gen=354 glyphs=4
2026-03-14T07:36:44.761060	099964a4	0	0	0.0000	CRASH	gen=354 glyphs=4
2026-03-14T07:36:44.761252	d89c6a4a	0	0	0.0000	CRASH	gen=354 glyphs=2
2026-03-14T07:36:44.761445	099964a4	0	0	0.0000	CRASH	gen=354 glyphs=4
2026-03-14T07:36:44.761644	62abef8b	0	0	0.0000	CRASH	gen=354 glyphs=4
2026-03-14T07:36:44.761844	b1668061	0	0	0.0000	CRASH	gen=354 glyphs=4
2026-03-14T07:36:44.762040	0079bc9f	0	0	0.0000	CRASH	gen=354 glyphs=2
2026-03-14T07:36:44.762236	099964a4	0	0	0.0000	CRASH	gen=354 glyphs=4
2026-03-14T07:36:44.762432	099964a4	0	0	0.0000	CRASH	gen=354 glyphs=4
2026-03-14T07:36:44.762711	099964a4	0	0	0.0000	CRASH	gen=355 glyphs=4
2026-03-14T07:36:44.762908	099964a4	0	0	0.0000	CRASH	gen=355 glyphs=4
2026-03-14T07:36:44.763101	099964a4	0	0	0.0000	CRASH	gen=355 glyphs=4
2026-03-14T07:36:44.763293	099964a4	0	0	0.0000	CRASH	gen=355 glyphs=4
2026-03-14T07:36:44.763483	099964a4	0	0	0.0000	CRASH	gen=355 glyphs=4
2026-03-14T07:36:44.763683	3a734398	0	0	0.0000	CRASH	gen=355 glyphs=4
2026-03-14T07:36:44.763876	ba1c8ffc	0	0	0.0000	CRASH	gen=355 glyphs=4
2026-03-14T07:36:44.764071	8352dd63	0	0	0.0000	CRASH	gen=355 glyphs=4
2026-03-14T07:36:44.764266	d818f03c	0	0	0.0000	CRASH	gen=355 glyphs=4
2026-03-14T07:36:44.764462	cf93b656	0	0	0.0000	CRASH	gen=355 glyphs=3
2026-03-14T07:36:44.764748	099964a4	0	0	0.0000	CRASH	gen=356 glyphs=4
2026-03-14T07:36:44.764946	099964a4	0	0	0.0000	CRASH	gen=356 glyphs=4
2026-03-14T07:36:44.765140	099964a4	0	0	0.0000	CRASH	gen=356 glyphs=4
2026-03-14T07:36:44.765334	099964a4	0	0	0.0000	CRASH	gen=356 glyphs=4
2026-03-14T07:36:44.765530	099964a4	0	0	0.0000	CRASH	gen=356 glyphs=4
2026-03-14T07:36:44.765723	3a734398	0	0	0.0000	CRASH	gen=356 glyphs=4
2026-03-14T07:36:44.765922	099964a4	0	0	0.0000	CRASH	gen=356 glyphs=4
2026-03-14T07:36:44.766118	099964a4	0	0	0.0000	CRASH	gen=356 glyphs=4
2026-03-14T07:36:44.766314	099964a4	0	0	0.0000	CRASH	gen=356 glyphs=4
2026-03-14T07:36:44.766506	fff25fd2	0	0	0.0000	CRASH	gen=356 glyphs=3
2026-03-14T07:36:44.766774	099964a4	0	0	0.0000	CRASH	gen=357 glyphs=4
2026-03-14T07:36:44.766974	099964a4	0	0	0.0000	CRASH	gen=357 glyphs=4
2026-03-14T07:36:44.767169	099964a4	0	0	0.0000	CRASH	gen=357 glyphs=4
