timestamp	program_hash	spirv_size	word_count	fitness	status	description
2026-03-14T01:01:43.320608	bfdf7cad	120	30	1.0000	DISCARD	gen=359 glyphs=4
2026-03-14T01:01:43.586242	19355583	120	30	1.0000	DISCARD	gen=403 glyphs=4
2026-03-14T01:01:46.039206	7ca87b42	116	29	1.0000	DISCARD	gen=359 glyphs=4
2026-03-14T01:01:46.315508	8aef8872	116	29	1.0000	DISCARD	gen=403 glyphs=4
2026-03-14T01:01:48.762976	5a06ca32	120	30	1.0000	DISCARD	gen=359 glyphs=4
2026-03-14T01:01:49.033438	a2a80ac9	116	29	1.0000	DISCARD	gen=403 glyphs=4
2026-03-14T01:01:51.496860	5b9807ac	120	30	1.0000	DISCARD	gen=359 glyphs=4
2026-03-14T01:01:51.762277	8aef8872	116	29	1.0000	DISCARD	gen=403 glyphs=4
2026-03-14T01:01:54.221289	37f4017b	116	29	1.0000	DISCARD	gen=359 glyphs=4
2026-03-14T01:01:54.490366	19355583	120	30	1.0000	DISCARD	gen=403 glyphs=4
2026-03-14T01:01:56.921608	2701cb73	116	29	1.0000	DISCARD	gen=359 glyphs=4
2026-03-14T01:01:57.193712	50dc991d	116	29	1.0000	DISCARD	gen=403 glyphs=4
2026-03-14T01:01:59.648548	5a06ca32	120	30	1.0000	DISCARD	gen=359 glyphs=4
2026-03-14T01:01:59.916156	159ab9e3	116	29	1.0000	DISCARD	gen=403 glyphs=4
2026-03-14T01:02:02.361524	4c9b0dd4	120	30	1.0000	DISCARD	gen=359 glyphs=4
2026-03-14T01:02:02.634100	0eaedb57	116	29	1.0000	DISCARD	gen=403 glyphs=4
2026-03-14T01:02:05.113184	8c50cb2d	120	30	1.0000	DISCARD	gen=359 glyphs=4
2026-03-14T01:02:05.390809	050862ad	120	30	1.0000	DISCARD	gen=403 glyphs=4
2026-03-14T01:02:07.841281	37f4017b	116	29	1.0000	DISCARD	gen=360 glyphs=4
2026-03-14T01:02:08.119462	0eaedb57	116	29	1.0000	DISCARD	gen=403 glyphs=4
2026-03-14T01:02:10.655545	bfdf7cad	120	30	1.0000	DISCARD	gen=360 glyphs=4
2026-03-14T01:02:10.921148	19355583	120	30	1.0000	DISCARD	gen=404 glyphs=4
2026-03-14T01:02:13.366838	1d34459a	116	29	1.0000	DISCARD	gen=360 glyphs=4
2026-03-14T01:02:13.645464	8aef8872	116	29	1.0000	DISCARD	gen=404 glyphs=4
2026-03-14T01:02:16.080103	37f4017b	116	29	1.0000	DISCARD	gen=360 glyphs=4
2026-03-14T01:02:16.350161	50dc991d	116	29	1.0000	DISCARD	gen=404 glyphs=4
2026-03-14T01:02:18.805028	37f4017b	116	29	1.0000	DISCARD	gen=360 glyphs=4
2026-03-14T01:02:19.069625	8aef8872	116	29	1.0000	DISCARD	gen=404 glyphs=4
2026-03-14T01:02:21.502095	b55547c9	116	29	1.0000	DISCARD	gen=360 glyphs=4
2026-03-14T01:02:21.775053	e03f26ef	120	30	1.0000	DISCARD	gen=404 glyphs=4
2026-03-14T01:02:24.234091	55d6c151	120	30	1.0000	DISCARD	gen=360 glyphs=4
2026-03-14T01:02:24.504974	050862ad	120	30	1.0000	DISCARD	gen=404 glyphs=4
2026-03-14T01:02:26.942510	c712f8bc	116	29	1.0000	DISCARD	gen=360 glyphs=4
2026-03-14T01:02:27.211194	e09e53f7	120	30	1.0000	DISCARD	gen=404 glyphs=4
2026-03-14T01:02:29.648324	7ca87b42	116	29	1.0000	DISCARD	gen=360 glyphs=4
2026-03-14T01:02:29.914603	050862ad	120	30	1.0000	DISCARD	gen=404 glyphs=4
2026-03-14T01:02:32.338061	37f4017b	116	29	1.0000	DISCARD	gen=360 glyphs=4
2026-03-14T01:02:32.612960	d7c8681b	120	30	1.0000	DISCARD	gen=404 glyphs=4
2026-03-14T01:02:35.057158	37f4017b	116	29	1.0000	DISCARD	gen=361 glyphs=4
2026-03-14T01:02:35.331334	b57e7176	120	30	1.0000	DISCARD	gen=404 glyphs=4
2026-03-14T01:02:37.801479	bfdf7cad	120	30	1.0000	DISCARD	gen=361 glyphs=4
2026-03-14T01:02:38.064961	19355583	120	30	1.0000	DISCARD	gen=405 glyphs=4
2026-03-14T01:02:40.505473	e5b104bc	116	29	1.0000	DISCARD	gen=361 glyphs=4
2026-03-14T01:02:40.779486	8aef8872	116	29	1.0000	DISCARD	gen=405 glyphs=4
2026-03-14T01:02:43.339152	af9d7183	116	29	1.0000	DISCARD	gen=361 glyphs=4
2026-03-14T01:02:43.600660	c25a1a6c	120	30	1.0000	DISCARD	gen=405 glyphs=4
2026-03-14T01:02:46.051449	37f4017b	116	29	1.0000	DISCARD	gen=361 glyphs=4
2026-03-14T01:02:46.345605	a78f9454	120	30	1.0000	DISCARD	gen=405 glyphs=4
2026-03-14T01:02:48.779699	37f4017b	116	29	1.0000	DISCARD	gen=361 glyphs=4
2026-03-14T01:02:49.048912	19355583	120	30	1.0000	DISCARD	gen=405 glyphs=4
2026-03-14T01:02:51.500556	5b9807ac	120	30	1.0000	DISCARD	gen=361 glyphs=4
2026-03-14T01:02:51.774938	9f926a96	116	29	1.0000	DISCARD	gen=405 glyphs=4
2026-03-14T01:02:54.209678	5a06ca32	120	30	1.0000	DISCARD	gen=361 glyphs=4
2026-03-14T01:02:54.488167	e2cd28ea	120	30	1.0000	DISCARD	gen=405 glyphs=4
2026-03-14T01:02:56.936749	71e2ba66	116	29	1.0000	DISCARD	gen=361 glyphs=4
2026-03-14T01:02:57.199265	92d56f1d	116	29	1.0000	DISCARD	gen=405 glyphs=4
2026-03-14T01:02:59.649786	4c9b0dd4	120	30	1.0000	DISCARD	gen=361 glyphs=4
2026-03-14T01:02:59.924595	b57e7176	120	30	1.0000	DISCARD	gen=405 glyphs=4
2026-03-14T01:03:02.368948	37f4017b	116	29	1.0000	DISCARD	gen=362 glyphs=4
2026-03-14T01:03:02.635513	8aef8872	116	29	1.0000	DISCARD	gen=405 glyphs=4
2026-03-14T01:03:05.122441	bfdf7cad	120	30	1.0000	DISCARD	gen=362 glyphs=4
2026-03-14T01:03:05.395053	19355583	120	30	1.0000	DISCARD	gen=406 glyphs=4
2026-03-14T01:03:07.879149	12b38c2d	116	29	1.0000	DISCARD	gen=362 glyphs=4
2026-03-14T01:03:08.149973	8aef8872	116	29	1.0000	DISCARD	gen=406 glyphs=4
2026-03-14T01:03:10.622313	f6ea8eb0	120	30	1.0000	DISCARD	gen=362 glyphs=4
2026-03-14T01:03:10.894565	19355583	120	30	1.0000	DISCARD	gen=406 glyphs=4
2026-03-14T01:03:13.392824	55d6c151	120	30	1.0000	DISCARD	gen=362 glyphs=4
2026-03-14T01:03:13.672913	875e0f8a	116	29	1.0000	DISCARD	gen=406 glyphs=4
2026-03-14T01:03:16.172514	5a06ca32	120	30	1.0000	DISCARD	gen=362 glyphs=4
2026-03-14T01:03:16.435621	4fb0c034	120	30	1.0000	DISCARD	gen=406 glyphs=4
2026-03-14T01:03:18.909745	1d34459a	116	29	1.0000	DISCARD	gen=362 glyphs=4
2026-03-14T01:03:19.181565	5d413195	120	30	1.0000	DISCARD	gen=406 glyphs=4
2026-03-14T01:03:21.617079	37f4017b	116	29	1.0000	DISCARD	gen=362 glyphs=4
2026-03-14T01:03:21.892160	0eaedb57	116	29	1.0000	DISCARD	gen=406 glyphs=4
2026-03-14T01:03:24.379197	d11c1062	120	30	1.0000	DISCARD	gen=362 glyphs=4
2026-03-14T01:03:24.649510	19355583	120	30	1.0000	DISCARD	gen=406 glyphs=4
2026-03-14T01:03:27.104129	4c9b0dd4	120	30	1.0000	DISCARD	gen=362 glyphs=4
2026-03-14T01:03:27.373466	e8c7f6cf	120	30	1.0000	DISCARD	gen=406 glyphs=4
2026-03-14T01:03:29.857991	37f4017b	116	29	1.0000	DISCARD	gen=363 glyphs=4
2026-03-14T01:03:30.119016	9544a2f2	116	29	1.0000	DISCARD	gen=406 glyphs=4
2026-03-14T01:03:32.575310	bfdf7cad	120	30	1.0000	DISCARD	gen=363 glyphs=4
2026-03-14T01:03:32.845972	19355583	120	30	1.0000	DISCARD	gen=407 glyphs=4
2026-03-14T01:03:35.347748	7ca87b42	116	29	1.0000	DISCARD	gen=363 glyphs=4
2026-03-14T01:03:35.618523	8aef8872	116	29	1.0000	DISCARD	gen=407 glyphs=4
2026-03-14T01:03:38.062810	6b3e5f3a	116	29	0.9500	DISCARD	gen=363 glyphs=4
2026-03-14T01:03:38.337258	050862ad	120	30	1.0000	DISCARD	gen=407 glyphs=4
2026-03-14T01:03:40.803988	9dac3133	116	29	1.0000	DISCARD	gen=363 glyphs=4
2026-03-14T01:03:41.072544	67cb81be	120	30	1.0000	DISCARD	gen=407 glyphs=4
2026-03-14T01:03:43.538565	2ee14dc4	120	30	1.0000	DISCARD	gen=363 glyphs=4
2026-03-14T01:03:43.808651	19355583	120	30	1.0000	DISCARD	gen=407 glyphs=4
2026-03-14T01:03:46.372405	71e2ba66	116	29	1.0000	DISCARD	gen=363 glyphs=4
2026-03-14T01:03:46.650222	0eaedb57	116	29	1.0000	DISCARD	gen=407 glyphs=4
2026-03-14T01:03:49.118643	807fb84c	116	29	1.0000	DISCARD	gen=363 glyphs=4
2026-03-14T01:03:49.390950	0eaedb57	116	29	1.0000	DISCARD	gen=407 glyphs=4
2026-03-14T01:03:51.849979	4c9b0dd4	120	30	1.0000	DISCARD	gen=363 glyphs=4
2026-03-14T01:03:52.117800	46a407a0	116	29	1.0000	DISCARD	gen=407 glyphs=4
2026-03-14T01:03:54.571338	37f4017b	116	29	1.0000	DISCARD	gen=363 glyphs=4
2026-03-14T01:03:54.843155	e9937938	120	30	1.0000	DISCARD	gen=407 glyphs=4
2026-03-14T01:03:57.285089	37f4017b	116	29	1.0000	DISCARD	gen=364 glyphs=4
2026-03-14T01:03:57.565620	ae44ace5	116	29	1.0000	DISCARD	gen=407 glyphs=4
2026-03-14T01:04:00.000161	bfdf7cad	120	30	1.0000	DISCARD	gen=364 glyphs=4
2026-03-14T01:04:00.276640	19355583	120	30	1.0000	DISCARD	gen=408 glyphs=4
2026-03-14T01:04:02.709845	517c2b2e	116	29	1.0000	DISCARD	gen=364 glyphs=4
2026-03-14T01:04:02.968715	8aef8872	116	29	1.0000	DISCARD	gen=408 glyphs=4
2026-03-14T01:04:05.448554	37f4017b	116	29	1.0000	DISCARD	gen=364 glyphs=4
2026-03-14T01:04:05.719651	ab558de1	116	29	1.0000	DISCARD	gen=408 glyphs=4
2026-03-14T01:04:08.159185	71e2ba66	116	29	1.0000	DISCARD	gen=364 glyphs=4
2026-03-14T01:04:08.425552	a622dfb6	120	30	1.0000	DISCARD	gen=408 glyphs=4
2026-03-14T01:04:10.880798	37f4017b	116	29	1.0000	DISCARD	gen=364 glyphs=4
2026-03-14T01:04:11.160118	b57e7176	120	30	1.0000	DISCARD	gen=408 glyphs=4
2026-03-14T01:04:13.604581	7ca87b42	116	29	1.0000	DISCARD	gen=364 glyphs=4
2026-03-14T01:04:13.877174	875e0f8a	116	29	1.0000	DISCARD	gen=408 glyphs=4
2026-03-14T01:04:16.327240	e8f5ffde	116	29	0.9500	DISCARD	gen=364 glyphs=4
2026-03-14T01:04:16.589662	e2cd28ea	120	30	1.0000	DISCARD	gen=408 glyphs=4
2026-03-14T01:04:19.145748	55d6c151	120	30	1.0000	DISCARD	gen=364 glyphs=4
2026-03-14T01:04:19.406690	8aef8872	116	29	1.0000	DISCARD	gen=408 glyphs=4
2026-03-14T01:04:21.878014	5a06ca32	120	30	1.0000	DISCARD	gen=364 glyphs=4
2026-03-14T01:04:22.140991	ae44ace5	116	29	1.0000	DISCARD	gen=408 glyphs=4
2026-03-14T01:04:24.590961	37f4017b	116	29	1.0000	DISCARD	gen=365 glyphs=4
2026-03-14T01:04:24.854544	ec8ecd48	116	29	1.0000	DISCARD	gen=408 glyphs=4
2026-03-14T01:04:27.311085	bfdf7cad	120	30	1.0000	DISCARD	gen=365 glyphs=4
2026-03-14T01:04:27.605935	19355583	120	30	1.0000	DISCARD	gen=409 glyphs=4
2026-03-14T01:04:30.070461	55d6c151	120	30	1.0000	DISCARD	gen=365 glyphs=4
2026-03-14T01:04:30.337022	8aef8872	116	29	1.0000	DISCARD	gen=409 glyphs=4
2026-03-14T01:04:32.779001	2ea46def	116	29	1.0000	DISCARD	gen=365 glyphs=4
2026-03-14T01:04:33.069542	7b36c96d	120	30	1.0000	DISCARD	gen=409 glyphs=4
2026-03-14T01:04:35.513892	71e2ba66	116	29	1.0000	DISCARD	gen=365 glyphs=4
2026-03-14T01:04:35.795068	50dc991d	116	29	1.0000	DISCARD	gen=409 glyphs=4
2026-03-14T01:04:38.272039	55d6c151	120	30	1.0000	DISCARD	gen=365 glyphs=4
2026-03-14T01:04:38.536088	eca7ab6c	116	29	1.0000	DISCARD	gen=409 glyphs=4
2026-03-14T01:04:40.990897	f28f0914	120	30	0.9500	DISCARD	gen=365 glyphs=4
2026-03-14T01:04:41.262760	19355583	120	30	1.0000	DISCARD	gen=409 glyphs=4
2026-03-14T01:04:43.769092	8c849523	116	29	0.9500	DISCARD	gen=365 glyphs=4
2026-03-14T01:04:44.046410	67cb81be	120	30	1.0000	DISCARD	gen=409 glyphs=4
2026-03-14T01:04:46.533680	55d6c151	120	30	1.0000	DISCARD	gen=365 glyphs=4
2026-03-14T01:04:46.803309	8aef8872	116	29	1.0000	DISCARD	gen=409 glyphs=4
2026-03-14T01:04:49.315390	12b38c2d	116	29	1.0000	DISCARD	gen=365 glyphs=4
2026-03-14T01:04:49.592867	315553e0	116	29	1.0000	DISCARD	gen=409 glyphs=4
2026-03-14T01:04:52.087369	37f4017b	116	29	1.0000	DISCARD	gen=366 glyphs=4
2026-03-14T01:04:52.353059	c331247a	116	29	1.0000	DISCARD	gen=409 glyphs=4
2026-03-14T01:04:54.800803	bfdf7cad	120	30	1.0000	DISCARD	gen=366 glyphs=4
2026-03-14T01:04:55.080398	19355583	120	30	1.0000	DISCARD	gen=410 glyphs=4
2026-03-14T01:04:57.529014	4c9b0dd4	120	30	1.0000	DISCARD	gen=366 glyphs=4
2026-03-14T01:04:57.797618	8aef8872	116	29	1.0000	DISCARD	gen=410 glyphs=4
2026-03-14T01:05:00.240089	2701cb73	116	29	1.0000	DISCARD	gen=366 glyphs=4
2026-03-14T01:05:00.505937	0525bc9e	116	29	1.0000	DISCARD	gen=410 glyphs=4
2026-03-14T01:05:03.040097	37f4017b	116	29	1.0000	DISCARD	gen=366 glyphs=4
2026-03-14T01:05:03.320827	0f87f35c	116	29	1.0000	DISCARD	gen=410 glyphs=4
2026-03-14T01:05:05.797251	37f4017b	116	29	1.0000	DISCARD	gen=366 glyphs=4
2026-03-14T01:05:06.073385	ae44ace5	116	29	1.0000	DISCARD	gen=410 glyphs=4
2026-03-14T01:05:08.577468	37f4017b	116	29	1.0000	DISCARD	gen=366 glyphs=4
2026-03-14T01:05:08.852622	9e34ede0	116	29	1.0000	DISCARD	gen=410 glyphs=4
2026-03-14T01:05:11.323925	37f4017b	116	29	1.0000	DISCARD	gen=366 glyphs=4
2026-03-14T01:05:11.600511	a1e300f0	116	29	1.0000	DISCARD	gen=410 glyphs=4
2026-03-14T01:05:14.106753	fdb5d108	120	30	1.0000	DISCARD	gen=366 glyphs=4
2026-03-14T01:05:14.383270	8aef8872	116	29	1.0000	DISCARD	gen=410 glyphs=4
2026-03-14T01:05:16.880973	402967da	116	29	1.0000	DISCARD	gen=366 glyphs=4
2026-03-14T01:05:17.149225	d7c8681b	120	30	1.0000	DISCARD	gen=410 glyphs=4
2026-03-14T01:05:19.618721	37f4017b	116	29	1.0000	DISCARD	gen=367 glyphs=4
2026-03-14T01:05:19.904808	d83fd40b	116	29	1.0000	DISCARD	gen=410 glyphs=4
2026-03-14T01:05:22.475543	bfdf7cad	120	30	1.0000	DISCARD	gen=367 glyphs=4
2026-03-14T01:05:22.751456	19355583	120	30	1.0000	DISCARD	gen=411 glyphs=4
2026-03-14T01:05:25.241986	b29017d4	120	30	1.0000	DISCARD	gen=367 glyphs=4
2026-03-14T01:05:25.510253	8aef8872	116	29	1.0000	DISCARD	gen=411 glyphs=4
2026-03-14T01:05:27.988122	5a06ca32	120	30	1.0000	DISCARD	gen=367 glyphs=4
2026-03-14T01:05:28.249155	0eaedb57	116	29	1.0000	DISCARD	gen=411 glyphs=4
2026-03-14T01:05:30.742573	0873bfb4	120	30	1.0000	DISCARD	gen=367 glyphs=4
2026-03-14T01:05:31.022433	4fcac1ce	116	29	1.0000	DISCARD	gen=411 glyphs=4
2026-03-14T01:05:33.488213	bfdf7cad	120	30	1.0000	DISCARD	gen=367 glyphs=4
2026-03-14T01:05:33.773670	19355583	120	30	1.0000	DISCARD	gen=411 glyphs=4
2026-03-14T01:05:36.266382	fdb5d108	120	30	1.0000	DISCARD	gen=367 glyphs=4
2026-03-14T01:05:36.536813	1e5f0e21	116	29	1.0000	DISCARD	gen=411 glyphs=4
2026-03-14T01:05:39.027199	5a06ca32	120	30	1.0000	DISCARD	gen=367 glyphs=4
2026-03-14T01:05:39.311470	ae44ace5	116	29	1.0000	DISCARD	gen=411 glyphs=4
2026-03-14T01:05:41.792028	37f4017b	116	29	1.0000	DISCARD	gen=367 glyphs=4
2026-03-14T01:05:42.066307	875e0f8a	116	29	1.0000	DISCARD	gen=411 glyphs=4
2026-03-14T01:05:44.581234	37f4017b	116	29	1.0000	DISCARD	gen=367 glyphs=4
2026-03-14T01:05:44.853693	ae44ace5	116	29	1.0000	DISCARD	gen=411 glyphs=4
2026-03-14T01:05:47.335162	37f4017b	116	29	1.0000	DISCARD	gen=368 glyphs=4
2026-03-14T01:05:47.604821	2f42e56b	120	30	1.0000	DISCARD	gen=411 glyphs=4
2026-03-14T01:05:50.078443	bfdf7cad	120	30	1.0000	DISCARD	gen=368 glyphs=4
2026-03-14T01:05:50.354301	19355583	120	30	1.0000	DISCARD	gen=412 glyphs=4
2026-03-14T01:05:52.914083	5bd683e7	116	29	1.0000	DISCARD	gen=368 glyphs=4
2026-03-14T01:05:53.201079	8aef8872	116	29	1.0000	DISCARD	gen=412 glyphs=4
2026-03-14T01:05:55.699554	37f4017b	116	29	1.0000	DISCARD	gen=368 glyphs=4
2026-03-14T01:05:55.969982	0eaedb57	116	29	1.0000	DISCARD	gen=412 glyphs=4
2026-03-14T01:05:58.707657	bf56fbc0	116	29	1.0000	DISCARD	gen=368 glyphs=4
2026-03-14T01:05:58.987539	a78f9454	120	30	1.0000	DISCARD	gen=412 glyphs=4
2026-03-14T01:06:01.464471	5a06ca32	120	30	1.0000	DISCARD	gen=368 glyphs=4
2026-03-14T01:06:01.738350	3e2d2cdf	116	29	1.0000	DISCARD	gen=412 glyphs=4
2026-03-14T01:06:04.232556	55d6c151	120	30	1.0000	DISCARD	gen=368 glyphs=4
2026-03-14T01:06:04.515725	b6054051	116	29	1.0000	DISCARD	gen=412 glyphs=4
2026-03-14T01:06:06.990735	37f4017b	116	29	1.0000	DISCARD	gen=368 glyphs=4
2026-03-14T01:06:07.265554	41f82e1d	120	30	0.9500	DISCARD	gen=412 glyphs=4
2026-03-14T01:06:09.787247	fdb5d108	120	30	1.0000	DISCARD	gen=368 glyphs=4
2026-03-14T01:06:10.066221	875e0f8a	116	29	1.0000	DISCARD	gen=412 glyphs=4
2026-03-14T01:06:12.579591	2299dadf	120	30	1.0000	DISCARD	gen=368 glyphs=4
2026-03-14T01:06:12.863210	b7aed8e9	116	29	1.0000	DISCARD	gen=412 glyphs=4
2026-03-14T01:06:15.328230	37f4017b	116	29	1.0000	DISCARD	gen=369 glyphs=4
2026-03-14T01:06:15.599883	001bd72f	120	30	1.0000	DISCARD	gen=412 glyphs=4
2026-03-14T01:06:18.077279	bfdf7cad	120	30	1.0000	DISCARD	gen=369 glyphs=4
2026-03-14T01:06:18.356930	19355583	120	30	1.0000	DISCARD	gen=413 glyphs=4
2026-03-14T01:06:21.038665	3957f036	120	30	1.0000	DISCARD	gen=369 glyphs=4
2026-03-14T01:06:21.347042	8aef8872	116	29	1.0000	DISCARD	gen=413 glyphs=4
2026-03-14T01:06:24.097647	f5b21283	116	29	1.0000	DISCARD	gen=369 glyphs=4
2026-03-14T01:06:24.397377	d7c8681b	120	30	1.0000	DISCARD	gen=413 glyphs=4
2026-03-14T01:06:26.936764	55d6c151	120	30	1.0000	DISCARD	gen=369 glyphs=4
2026-03-14T01:06:27.222938	b7aed8e9	116	29	1.0000	DISCARD	gen=413 glyphs=4
2026-03-14T01:06:29.831325	12b38c2d	116	29	1.0000	DISCARD	gen=369 glyphs=4
2026-03-14T01:06:30.202162	0eaedb57	116	29	1.0000	DISCARD	gen=413 glyphs=4
2026-03-14T01:06:33.278643	fdb5d108	120	30	1.0000	DISCARD	gen=369 glyphs=4
2026-03-14T01:06:33.569033	c8205a03	116	29	0.9500	DISCARD	gen=413 glyphs=4
2026-03-14T01:06:36.875561	5b9807ac	120	30	1.0000	DISCARD	gen=369 glyphs=4
2026-03-14T01:06:37.169062	0eaedb57	116	29	1.0000	DISCARD	gen=413 glyphs=4
2026-03-14T01:06:40.661218	4c9b0dd4	120	30	1.0000	DISCARD	gen=369 glyphs=4
2026-03-14T01:06:41.003007	945dd724	116	29	1.0000	DISCARD	gen=413 glyphs=4
2026-03-14T01:06:43.701098	55d6c151	120	30	1.0000	DISCARD	gen=369 glyphs=4
2026-03-14T01:06:43.987077	0eaedb57	116	29	1.0000	DISCARD	gen=413 glyphs=4
2026-03-14T01:06:46.463590	37f4017b	116	29	1.0000	DISCARD	gen=370 glyphs=4
2026-03-14T01:06:46.730362	2047fc2f	120	30	0.9500	DISCARD	gen=413 glyphs=4
2026-03-14T01:06:49.224639	bfdf7cad	120	30	1.0000	DISCARD	gen=370 glyphs=4
2026-03-14T01:06:49.495561	19355583	120	30	1.0000	DISCARD	gen=414 glyphs=4
2026-03-14T01:06:52.101054	37f4017b	116	29	1.0000	DISCARD	gen=370 glyphs=4
2026-03-14T01:06:52.380694	8aef8872	116	29	1.0000	DISCARD	gen=414 glyphs=4
2026-03-14T01:06:54.881526	5a06ca32	120	30	1.0000	DISCARD	gen=370 glyphs=4
2026-03-14T01:06:55.167183	856ef55b	116	29	1.0000	DISCARD	gen=414 glyphs=4
2026-03-14T01:06:57.757700	37f4017b	116	29	1.0000	DISCARD	gen=370 glyphs=4
2026-03-14T01:06:58.027291	e2cd28ea	120	30	1.0000	DISCARD	gen=414 glyphs=4
2026-03-14T01:07:00.510003	7ca87b42	116	29	1.0000	DISCARD	gen=370 glyphs=4
2026-03-14T01:07:00.798560	0eaedb57	116	29	1.0000	DISCARD	gen=414 glyphs=4
2026-03-14T01:07:03.288983	55d6c151	120	30	1.0000	DISCARD	gen=370 glyphs=4
2026-03-14T01:07:03.566953	050862ad	120	30	1.0000	DISCARD	gen=414 glyphs=4
2026-03-14T01:07:06.082500	887b95bd	120	30	1.0000	DISCARD	gen=370 glyphs=4
2026-03-14T01:07:06.359235	8aef8872	116	29	1.0000	DISCARD	gen=414 glyphs=4
2026-03-14T01:07:08.826452	5a06ca32	120	30	1.0000	DISCARD	gen=370 glyphs=4
2026-03-14T01:07:09.101389	e82a05e6	116	29	1.0000	DISCARD	gen=414 glyphs=4
2026-03-14T01:07:11.610633	1d34459a	116	29	1.0000	DISCARD	gen=370 glyphs=4
2026-03-14T01:07:11.879691	ae44ace5	116	29	1.0000	DISCARD	gen=414 glyphs=4
2026-03-14T01:07:14.549357	37f4017b	116	29	1.0000	DISCARD	gen=371 glyphs=4
2026-03-14T01:07:14.830026	050862ad	120	30	1.0000	DISCARD	gen=414 glyphs=4
2026-03-14T01:07:17.347888	bfdf7cad	120	30	1.0000	DISCARD	gen=371 glyphs=4
2026-03-14T01:07:17.629211	19355583	120	30	1.0000	DISCARD	gen=415 glyphs=4
2026-03-14T01:07:20.129099	bfdf7cad	120	30	1.0000	DISCARD	gen=371 glyphs=4
2026-03-14T01:07:20.404367	8aef8872	116	29	1.0000	DISCARD	gen=415 glyphs=4
2026-03-14T01:07:23.024001	55d6c151	120	30	1.0000	DISCARD	gen=371 glyphs=4
2026-03-14T01:07:23.390704	b7aed8e9	116	29	1.0000	DISCARD	gen=415 glyphs=4
2026-03-14T01:07:26.444046	55d6c151	120	30	1.0000	DISCARD	gen=371 glyphs=4
2026-03-14T01:07:26.714126	4b835462	120	30	1.0000	DISCARD	gen=415 glyphs=4
2026-03-14T01:07:30.107749	71e2ba66	116	29	1.0000	DISCARD	gen=371 glyphs=4
2026-03-14T01:07:30.383899	19355583	120	30	1.0000	DISCARD	gen=415 glyphs=4
2026-03-14T01:07:34.106907	37f4017b	116	29	1.0000	DISCARD	gen=371 glyphs=4
2026-03-14T01:07:34.401428	19355583	120	30	1.0000	DISCARD	gen=415 glyphs=4
2026-03-14T01:07:37.092129	7ca87b42	116	29	1.0000	DISCARD	gen=371 glyphs=4
2026-03-14T01:07:37.372182	67cb81be	120	30	1.0000	DISCARD	gen=415 glyphs=4
2026-03-14T01:07:39.843779	5a06ca32	120	30	1.0000	DISCARD	gen=371 glyphs=4
2026-03-14T01:07:40.120999	ae44ace5	116	29	1.0000	DISCARD	gen=415 glyphs=4
2026-03-14T01:07:42.603853	bfdf7cad	120	30	1.0000	DISCARD	gen=371 glyphs=4
2026-03-14T01:07:42.878006	050862ad	120	30	1.0000	DISCARD	gen=415 glyphs=4
2026-03-14T01:07:45.364968	37f4017b	116	29	1.0000	DISCARD	gen=372 glyphs=4
2026-03-14T01:07:45.639830	9e34ede0	116	29	1.0000	DISCARD	gen=415 glyphs=4
2026-03-14T01:07:48.179977	bfdf7cad	120	30	1.0000	DISCARD	gen=372 glyphs=4
2026-03-14T01:07:48.458391	19355583	120	30	1.0000	DISCARD	gen=416 glyphs=4
2026-03-14T01:07:51.042097	37f4017b	116	29	1.0000	DISCARD	gen=372 glyphs=4
2026-03-14T01:07:51.324140	8aef8872	116	29	1.0000	DISCARD	gen=416 glyphs=4
2026-03-14T01:07:53.879104	e2c04de6	120	30	1.0000	DISCARD	gen=372 glyphs=4
2026-03-14T01:07:54.153591	8aef8872	116	29	1.0000	DISCARD	gen=416 glyphs=4
2026-03-14T01:07:56.623691	5a06ca32	120	30	1.0000	DISCARD	gen=372 glyphs=4
2026-03-14T01:07:56.898473	b57e7176	120	30	1.0000	DISCARD	gen=416 glyphs=4
2026-03-14T01:07:59.393976	5a06ca32	120	30	1.0000	DISCARD	gen=372 glyphs=4
2026-03-14T01:07:59.660653	67cb81be	120	30	1.0000	DISCARD	gen=416 glyphs=4
2026-03-14T01:08:02.229670	adf21783	116	29	1.0000	DISCARD	gen=372 glyphs=4
2026-03-14T01:08:02.509393	d7c8681b	120	30	1.0000	DISCARD	gen=416 glyphs=4
2026-03-14T01:08:05.015588	3b0446a9	116	29	1.0000	DISCARD	gen=372 glyphs=4
2026-03-14T01:08:05.286653	b57e7176	120	30	1.0000	DISCARD	gen=416 glyphs=4
2026-03-14T01:08:07.790163	1d34459a	116	29	1.0000	DISCARD	gen=372 glyphs=4
2026-03-14T01:08:08.063055	74441fcc	116	29	1.0000	DISCARD	gen=416 glyphs=4
2026-03-14T01:08:10.553836	55d6c151	120	30	1.0000	DISCARD	gen=372 glyphs=4
2026-03-14T01:08:10.824983	0eaedb57	116	29	1.0000	DISCARD	gen=416 glyphs=4
2026-03-14T01:08:13.320528	37f4017b	116	29	1.0000	DISCARD	gen=373 glyphs=4
2026-03-14T01:08:13.610146	135fb28a	120	30	1.0000	DISCARD	gen=416 glyphs=4
2026-03-14T01:08:16.108175	bfdf7cad	120	30	1.0000	DISCARD	gen=373 glyphs=4
2026-03-14T01:08:16.395939	19355583	120	30	1.0000	DISCARD	gen=417 glyphs=4
2026-03-14T01:08:18.880584	12b38c2d	116	29	1.0000	DISCARD	gen=373 glyphs=4
2026-03-14T01:08:19.149232	8aef8872	116	29	1.0000	DISCARD	gen=417 glyphs=4
2026-03-14T01:08:21.639434	8ff860a9	116	29	1.0000	DISCARD	gen=373 glyphs=4
2026-03-14T01:08:21.911282	0eaedb57	116	29	1.0000	DISCARD	gen=417 glyphs=4
2026-03-14T01:08:24.396747	37f4017b	116	29	1.0000	DISCARD	gen=373 glyphs=4
2026-03-14T01:08:24.671312	78f466d2	116	29	1.0000	DISCARD	gen=417 glyphs=4
2026-03-14T01:08:27.149056	d11c1062	120	30	1.0000	DISCARD	gen=373 glyphs=4
2026-03-14T01:08:27.407993	b57e7176	120	30	1.0000	DISCARD	gen=417 glyphs=4
2026-03-14T01:08:29.900294	37f4017b	116	29	1.0000	DISCARD	gen=373 glyphs=4
2026-03-14T01:08:30.175911	b57e7176	120	30	1.0000	DISCARD	gen=417 glyphs=4
