timestamp	program_hash	spirv_size	word_count	fitness	status	description
2026-03-13T22:07:58.409027	19355583	120	30	1.0000	DISCARD	gen=29 glyphs=4
2026-03-13T22:08:00.153425	8aef8872	116	29	1.0000	DISCARD	gen=29 glyphs=4
2026-03-13T22:08:01.888026	8aef8872	116	29	1.0000	DISCARD	gen=29 glyphs=4
2026-03-13T22:08:03.607122	19355583	120	30	1.0000	DISCARD	gen=30 glyphs=4
2026-03-13T22:08:05.338882	8aef8872	116	29	1.0000	DISCARD	gen=30 glyphs=4
2026-03-13T22:08:07.079442	50dc991d	116	29	1.0000	DISCARD	gen=30 glyphs=4
2026-03-13T22:08:08.836353	b7aed8e9	116	29	1.0000	DISCARD	gen=30 glyphs=4
2026-03-13T22:08:10.593525	e2cd28ea	120	30	1.0000	DISCARD	gen=30 glyphs=4
2026-03-13T22:08:12.308421	19355583	120	30	1.0000	DISCARD	gen=30 glyphs=4
2026-03-13T22:08:14.082942	a78f9454	120	30	1.0000	DISCARD	gen=30 glyphs=4
2026-03-13T22:08:15.801854	050862ad	120	30	1.0000	DISCARD	gen=30 glyphs=4
2026-03-13T22:08:17.650846	8aef8872	116	29	1.0000	DISCARD	gen=30 glyphs=4
2026-03-13T22:08:19.424125	50dc991d	116	29	1.0000	DISCARD	gen=30 glyphs=4
2026-03-13T22:08:21.143142	19355583	120	30	1.0000	DISCARD	gen=31 glyphs=4
2026-03-13T22:08:22.866494	8aef8872	116	29	1.0000	DISCARD	gen=31 glyphs=4
2026-03-13T22:08:24.581829	67cb81be	120	30	1.0000	DISCARD	gen=31 glyphs=4
2026-03-13T22:08:26.274061	8aef8872	116	29	1.0000	DISCARD	gen=31 glyphs=4
2026-03-13T22:08:27.942017	ae44ace5	116	29	1.0000	DISCARD	gen=31 glyphs=4
2026-03-13T22:08:29.643949	19355583	120	30	1.0000	DISCARD	gen=31 glyphs=4
2026-03-13T22:08:31.397488	9e34ede0	116	29	1.0000	DISCARD	gen=31 glyphs=4
2026-03-13T22:08:33.100311	050862ad	120	30	1.0000	DISCARD	gen=31 glyphs=4
2026-03-13T22:08:34.776576	1faf728f	120	30	1.0000	DISCARD	gen=31 glyphs=4
2026-03-13T22:08:36.477084	8aef8872	116	29	1.0000	DISCARD	gen=31 glyphs=4
2026-03-13T22:08:38.169760	19355583	120	30	1.0000	DISCARD	gen=32 glyphs=4
2026-03-13T22:08:39.848218	8aef8872	116	29	1.0000	DISCARD	gen=32 glyphs=4
2026-03-13T22:08:41.536170	554e06f0	116	29	1.0000	DISCARD	gen=32 glyphs=4
2026-03-13T22:08:43.221769	fd080073	120	30	1.0000	DISCARD	gen=32 glyphs=4
2026-03-13T22:08:44.922757	0eaedb57	116	29	1.0000	DISCARD	gen=32 glyphs=4
2026-03-13T22:08:46.604957	1e5f0e21	116	29	1.0000	DISCARD	gen=32 glyphs=4
2026-03-13T22:08:48.290624	0eaedb57	116	29	1.0000	DISCARD	gen=32 glyphs=4
2026-03-13T22:08:50.097697	8aef8872	116	29	1.0000	DISCARD	gen=32 glyphs=4
2026-03-13T22:08:51.820674	0eaedb57	116	29	1.0000	DISCARD	gen=32 glyphs=4
2026-03-13T22:08:53.495181	d7c8681b	120	30	1.0000	DISCARD	gen=32 glyphs=4
2026-03-13T22:08:55.172057	19355583	120	30	1.0000	DISCARD	gen=33 glyphs=4
2026-03-13T22:08:56.871662	8aef8872	116	29	1.0000	DISCARD	gen=33 glyphs=4
2026-03-13T22:08:58.605177	e8c7f6cf	120	30	1.0000	DISCARD	gen=33 glyphs=4
2026-03-13T22:09:00.338764	4ce8c51d	116	29	1.0000	DISCARD	gen=33 glyphs=4
2026-03-13T22:09:02.044856	050862ad	120	30	1.0000	DISCARD	gen=33 glyphs=4
2026-03-13T22:09:03.764837	3b742ebb	116	29	1.0000	DISCARD	gen=33 glyphs=4
2026-03-13T22:09:05.508473	1e5f0e21	116	29	1.0000	DISCARD	gen=33 glyphs=4
2026-03-13T22:09:07.242628	e2cd28ea	120	30	1.0000	DISCARD	gen=33 glyphs=4
2026-03-13T22:09:08.928346	c48d0643	116	29	1.0000	DISCARD	gen=33 glyphs=4
2026-03-13T22:09:10.587522	8aef8872	116	29	1.0000	DISCARD	gen=33 glyphs=4
2026-03-13T22:09:12.244787	19355583	120	30	1.0000	DISCARD	gen=34 glyphs=4
2026-03-13T22:09:13.933414	8aef8872	116	29	1.0000	DISCARD	gen=34 glyphs=4
2026-03-13T22:09:15.594816	e2cd28ea	120	30	1.0000	DISCARD	gen=34 glyphs=4
2026-03-13T22:09:17.284191	8aef8872	116	29	1.0000	DISCARD	gen=34 glyphs=4
2026-03-13T22:09:18.942026	d7c8681b	120	30	1.0000	DISCARD	gen=34 glyphs=4
2026-03-13T22:09:20.610220	b93bbcd2	116	29	1.0000	DISCARD	gen=34 glyphs=4
2026-03-13T22:09:22.374817	8aef8872	116	29	1.0000	DISCARD	gen=34 glyphs=4
2026-03-13T22:09:24.074960	b7aed8e9	116	29	1.0000	DISCARD	gen=34 glyphs=4
2026-03-13T22:09:25.735113	8aef8872	116	29	1.0000	DISCARD	gen=34 glyphs=4
2026-03-13T22:09:27.440682	8aef8872	116	29	1.0000	DISCARD	gen=34 glyphs=4
2026-03-13T22:09:29.121480	19355583	120	30	1.0000	DISCARD	gen=35 glyphs=4
2026-03-13T22:09:30.818940	8aef8872	116	29	1.0000	DISCARD	gen=35 glyphs=4
2026-03-13T22:09:32.553059	19355583	120	30	1.0000	DISCARD	gen=35 glyphs=4
2026-03-13T22:09:34.238303	eca7ab6c	116	29	1.0000	DISCARD	gen=35 glyphs=4
2026-03-13T22:09:35.915113	e8c7f6cf	120	30	1.0000	DISCARD	gen=35 glyphs=4
2026-03-13T22:09:37.592751	050862ad	120	30	1.0000	DISCARD	gen=35 glyphs=4
2026-03-13T22:09:39.275248	19355583	120	30	1.0000	DISCARD	gen=35 glyphs=4
2026-03-13T22:09:40.944616	841a67e1	116	29	0.9500	DISCARD	gen=35 glyphs=4
2026-03-13T22:09:42.636720	19355583	120	30	1.0000	DISCARD	gen=35 glyphs=4
2026-03-13T22:09:44.350430	e8c7f6cf	120	30	1.0000	DISCARD	gen=35 glyphs=4
2026-03-13T22:09:46.033168	19355583	120	30	1.0000	DISCARD	gen=36 glyphs=4
2026-03-13T22:09:47.735299	8aef8872	116	29	1.0000	DISCARD	gen=36 glyphs=4
2026-03-13T22:09:49.436895	01461e8e	116	29	1.0000	DISCARD	gen=36 glyphs=4
2026-03-13T22:09:51.124484	a78f9454	120	30	1.0000	DISCARD	gen=36 glyphs=4
2026-03-13T22:09:52.843057	e2cd28ea	120	30	1.0000	DISCARD	gen=36 glyphs=4
2026-03-13T22:09:54.585395	19355583	120	30	1.0000	DISCARD	gen=36 glyphs=4
2026-03-13T22:09:56.237404	ef9c9c90	116	29	1.0000	DISCARD	gen=36 glyphs=4
2026-03-13T22:09:57.904836	8aef8872	116	29	1.0000	DISCARD	gen=36 glyphs=4
2026-03-13T22:09:59.570731	1e5f0e21	116	29	1.0000	DISCARD	gen=36 glyphs=4
2026-03-13T22:10:01.233267	5522d4c7	116	29	1.0000	DISCARD	gen=36 glyphs=4
2026-03-13T22:10:02.903293	19355583	120	30	1.0000	DISCARD	gen=37 glyphs=4
2026-03-13T22:10:04.578745	8aef8872	116	29	1.0000	DISCARD	gen=37 glyphs=4
2026-03-13T22:10:06.322497	0eaedb57	116	29	1.0000	DISCARD	gen=37 glyphs=4
2026-03-13T22:10:08.044493	86ec9bc2	116	29	1.0000	DISCARD	gen=37 glyphs=4
2026-03-13T22:10:09.745495	54d80d05	116	29	1.0000	DISCARD	gen=37 glyphs=4
2026-03-13T22:10:11.434901	8aef8872	116	29	1.0000	DISCARD	gen=37 glyphs=4
2026-03-13T22:10:27.026548	19355583	120	30	1.0000	DISCARD	gen=37 glyphs=4
2026-03-13T22:10:28.766368	8aef8872	116	29	1.0000	DISCARD	gen=37 glyphs=4
2026-03-13T22:10:30.482084	9e34ede0	116	29	1.0000	DISCARD	gen=37 glyphs=4
2026-03-13T22:10:32.178171	8aef8872	116	29	1.0000	DISCARD	gen=37 glyphs=4
2026-03-13T22:10:33.915639	19355583	120	30	1.0000	DISCARD	gen=38 glyphs=4
2026-03-13T22:10:35.613630	8aef8872	116	29	1.0000	DISCARD	gen=38 glyphs=4
2026-03-13T22:10:37.342930	8aef8872	116	29	1.0000	DISCARD	gen=38 glyphs=4
2026-03-13T22:10:39.243051	b57e7176	120	30	1.0000	DISCARD	gen=38 glyphs=4
2026-03-13T22:10:40.979407	e2cd28ea	120	30	1.0000	DISCARD	gen=38 glyphs=4
2026-03-13T22:10:42.702342	19355583	120	30	1.0000	DISCARD	gen=38 glyphs=4
2026-03-13T22:10:44.405414	8aef8872	116	29	1.0000	DISCARD	gen=38 glyphs=4
2026-03-13T22:10:46.246016	0eaedb57	116	29	1.0000	DISCARD	gen=38 glyphs=4
2026-03-13T22:10:47.938015	2d9474bb	116	29	1.0000	DISCARD	gen=38 glyphs=4
2026-03-13T22:10:49.647626	e8c7f6cf	120	30	1.0000	DISCARD	gen=38 glyphs=4
2026-03-13T22:10:51.364807	19355583	120	30	1.0000	DISCARD	gen=39 glyphs=4
2026-03-13T22:10:53.082300	8aef8872	116	29	1.0000	DISCARD	gen=39 glyphs=4
2026-03-13T22:10:54.818310	0eaedb57	116	29	1.0000	DISCARD	gen=39 glyphs=4
2026-03-13T22:10:56.579881	1e5f0e21	116	29	1.0000	DISCARD	gen=39 glyphs=4
2026-03-13T22:10:58.373680	050862ad	120	30	1.0000	DISCARD	gen=39 glyphs=4
2026-03-13T22:11:00.109394	e8c7f6cf	120	30	1.0000	DISCARD	gen=39 glyphs=4
2026-03-13T22:11:01.860657	0eaedb57	116	29	1.0000	DISCARD	gen=39 glyphs=4
2026-03-13T22:11:03.592691	19355583	120	30	1.0000	DISCARD	gen=39 glyphs=4
2026-03-13T22:11:05.298933	19355583	120	30	1.0000	DISCARD	gen=39 glyphs=4
2026-03-13T22:11:11.992127	f7ff8c1a	120	30	1.0000	DISCARD	gen=39 glyphs=4
2026-03-13T22:11:13.711709	19355583	120	30	1.0000	DISCARD	gen=40 glyphs=4
2026-03-13T22:11:15.449110	8aef8872	116	29	1.0000	DISCARD	gen=40 glyphs=4
2026-03-13T22:11:17.178816	724995da	120	30	0.9500	DISCARD	gen=40 glyphs=4
2026-03-13T22:11:18.910029	3d92608b	116	29	1.0000	DISCARD	gen=40 glyphs=4
2026-03-13T22:11:20.649237	a2e2511b	116	29	1.0000	DISCARD	gen=40 glyphs=4
2026-03-13T22:11:22.381617	50dc991d	116	29	1.0000	DISCARD	gen=40 glyphs=4
2026-03-13T22:11:24.105007	e2cd28ea	120	30	1.0000	DISCARD	gen=40 glyphs=4
2026-03-13T22:11:25.824140	0eaedb57	116	29	1.0000	DISCARD	gen=40 glyphs=4
2026-03-13T22:11:27.581193	1b9e1892	120	30	1.0000	DISCARD	gen=40 glyphs=4
2026-03-13T22:11:29.393251	050862ad	120	30	1.0000	DISCARD	gen=40 glyphs=4
2026-03-13T22:11:31.121320	19355583	120	30	1.0000	DISCARD	gen=41 glyphs=4
2026-03-13T22:11:32.881498	8aef8872	116	29	1.0000	DISCARD	gen=41 glyphs=4
2026-03-13T22:11:34.610560	5dbd1f57	116	29	1.0000	DISCARD	gen=41 glyphs=4
2026-03-13T22:11:36.322250	8aef8872	116	29	1.0000	DISCARD	gen=41 glyphs=4
2026-03-13T22:11:38.239632	16684da1	120	30	1.0000	DISCARD	gen=41 glyphs=4
2026-03-13T22:11:39.970792	6f5ed55a	116	29	1.0000	DISCARD	gen=41 glyphs=4
2026-03-13T22:11:41.703370	55125674	116	29	1.0000	DISCARD	gen=41 glyphs=4
2026-03-13T22:11:43.442682	0eaedb57	116	29	1.0000	DISCARD	gen=41 glyphs=4
2026-03-13T22:11:45.170325	8aef8872	116	29	1.0000	DISCARD	gen=41 glyphs=4
2026-03-13T22:11:46.914478	37dc96f0	120	30	1.0000	DISCARD	gen=41 glyphs=4
2026-03-13T22:11:48.647581	19355583	120	30	1.0000	DISCARD	gen=42 glyphs=4
2026-03-13T22:11:50.385488	8aef8872	116	29	1.0000	DISCARD	gen=42 glyphs=4
2026-03-13T22:11:52.098647	d7409a0e	116	29	1.0000	DISCARD	gen=42 glyphs=4
2026-03-13T22:11:53.805193	d7c8681b	120	30	1.0000	DISCARD	gen=42 glyphs=4
2026-03-13T22:11:59.035152	e416ccaf	116	29	0.9500	DISCARD	gen=42 glyphs=4
2026-03-13T22:12:00.775666	9e34ede0	116	29	1.0000	DISCARD	gen=42 glyphs=4
2026-03-13T22:12:02.484250	bfe7ee73	116	29	1.0000	DISCARD	gen=42 glyphs=4
2026-03-13T22:12:04.199329	5cec4cc9	116	29	0.9500	DISCARD	gen=42 glyphs=4
2026-03-13T22:12:05.906155	aaf520e5	116	29	1.0000	DISCARD	gen=42 glyphs=4
2026-03-13T22:12:07.644376	050862ad	120	30	1.0000	DISCARD	gen=42 glyphs=4
2026-03-13T22:12:09.382115	19355583	120	30	1.0000	DISCARD	gen=43 glyphs=4
2026-03-13T22:12:32.711321	8aef8872	116	29	1.0000	DISCARD	gen=43 glyphs=4
2026-03-13T22:12:34.503395	234aaec1	120	30	1.0000	DISCARD	gen=43 glyphs=4
2026-03-13T22:12:36.244298	b57e7176	120	30	1.0000	DISCARD	gen=43 glyphs=4
2026-03-13T22:12:37.975630	050862ad	120	30	1.0000	DISCARD	gen=43 glyphs=4
2026-03-13T22:12:39.773006	f0b6128d	124	31	0.9500	DISCARD	gen=43 glyphs=4
2026-03-13T22:12:41.535205	8aef8872	116	29	1.0000	DISCARD	gen=43 glyphs=4
2026-03-13T22:12:43.270967	0eaedb57	116	29	1.0000	DISCARD	gen=43 glyphs=4
2026-03-13T22:12:45.016368	875e0f8a	116	29	1.0000	DISCARD	gen=43 glyphs=4
2026-03-13T22:12:47.691711	fffb3cff	120	30	1.0000	DISCARD	gen=43 glyphs=4
2026-03-13T22:12:48.269065	099964a4	0	0	0.0000	CRASH	gen=0 glyphs=4
2026-03-13T22:12:50.570140	19355583	120	30	1.0000	DISCARD	gen=44 glyphs=4
2026-03-13T22:12:51.165938	099964a4	0	0	0.0000	CRASH	gen=0 glyphs=4
2026-03-13T22:12:53.484921	8aef8872	116	29	1.0000	DISCARD	gen=44 glyphs=4
2026-03-13T22:12:54.060038	099964a4	0	0	0.0000	CRASH	gen=0 glyphs=4
2026-03-13T22:12:56.384457	ba48e53e	116	29	1.0000	DISCARD	gen=44 glyphs=4
2026-03-13T22:12:56.964154	099964a4	0	0	0.0000	CRASH	gen=0 glyphs=4
2026-03-13T22:12:59.256774	67cb81be	120	30	1.0000	DISCARD	gen=44 glyphs=4
2026-03-13T22:13:00.048359	099964a4	0	0	0.0000	CRASH	gen=0 glyphs=4
2026-03-13T22:13:02.361854	0eaedb57	116	29	1.0000	DISCARD	gen=44 glyphs=4
2026-03-13T22:13:02.946008	099964a4	0	0	0.0000	CRASH	gen=0 glyphs=4
2026-03-13T22:13:05.302106	050862ad	120	30	1.0000	DISCARD	gen=44 glyphs=4
2026-03-13T22:13:05.882018	53a07b2d	120	30	0.9500	KEEP	gen=0 glyphs=4
2026-03-13T22:13:08.209269	8aef8872	116	29	1.0000	DISCARD	gen=44 glyphs=4
2026-03-13T22:13:08.794599	099964a4	0	0	0.0000	CRASH	gen=0 glyphs=4
2026-03-13T22:13:11.149180	19355583	120	30	1.0000	DISCARD	gen=44 glyphs=4
2026-03-13T22:13:11.725250	099964a4	0	0	0.0000	CRASH	gen=0 glyphs=4
2026-03-13T22:13:14.026551	8aef8872	116	29	1.0000	DISCARD	gen=44 glyphs=4
2026-03-13T22:13:14.598349	4145fa27	0	0	0.0000	CRASH	gen=0 glyphs=4
2026-03-13T22:13:16.931951	eb28011d	120	30	1.0000	DISCARD	gen=44 glyphs=4
2026-03-13T22:13:17.625809	744ae5aa	120	30	0.9500	DISCARD	gen=1 glyphs=4
2026-03-13T22:13:24.899081	19355583	120	30	1.0000	DISCARD	gen=45 glyphs=4
2026-03-13T22:13:25.482119	099964a4	0	0	0.0000	CRASH	gen=1 glyphs=4
2026-03-13T22:13:27.808999	8aef8872	116	29	1.0000	DISCARD	gen=45 glyphs=4
2026-03-13T22:13:28.415339	71e2ba66	116	29	1.0000	DISCARD	gen=1 glyphs=4
2026-03-13T22:13:30.788992	0eaedb57	116	29	1.0000	DISCARD	gen=45 glyphs=4
2026-03-13T22:13:31.355423	37f4017b	116	29	1.0000	DISCARD	gen=1 glyphs=4
2026-03-13T22:13:35.058052	875e0f8a	116	29	1.0000	DISCARD	gen=45 glyphs=4
2026-03-13T22:13:35.661575	099964a4	0	0	0.0000	CRASH	gen=1 glyphs=4
2026-03-13T22:13:38.006816	8aef8872	116	29	1.0000	DISCARD	gen=45 glyphs=4
2026-03-13T22:13:38.578046	099964a4	0	0	0.0000	CRASH	gen=1 glyphs=4
2026-03-13T22:13:41.135228	50dc991d	116	29	1.0000	DISCARD	gen=45 glyphs=4
2026-03-13T22:13:41.729676	37f4017b	116	29	1.0000	DISCARD	gen=1 glyphs=4
2026-03-13T22:13:44.063311	67cb81be	120	30	1.0000	DISCARD	gen=45 glyphs=4
2026-03-13T22:13:44.643101	fdb5d108	120	30	1.0000	DISCARD	gen=1 glyphs=4
2026-03-13T22:13:46.981782	3f8b640a	116	29	1.0000	DISCARD	gen=45 glyphs=4
2026-03-13T22:13:47.564161	b1a027d1	0	0	0.0000	CRASH	gen=1 glyphs=4
2026-03-13T22:13:49.853821	dbe3a46c	116	29	1.0000	DISCARD	gen=45 glyphs=4
2026-03-13T22:13:50.420795	744ae5aa	120	30	0.9500	DISCARD	gen=1 glyphs=4
2026-03-13T22:13:52.722191	0eaedb57	116	29	1.0000	DISCARD	gen=45 glyphs=4
2026-03-13T22:13:53.294728	37f4017b	116	29	1.0000	DISCARD	gen=2 glyphs=4
2026-03-13T22:13:55.633239	19355583	120	30	1.0000	DISCARD	gen=46 glyphs=4
2026-03-13T22:13:56.211256	bfdf7cad	120	30	1.0000	DISCARD	gen=2 glyphs=4
2026-03-13T22:13:58.589699	8aef8872	116	29	1.0000	DISCARD	gen=46 glyphs=4
2026-03-13T22:13:59.165304	cce95c21	116	29	1.0000	DISCARD	gen=2 glyphs=4
2026-03-13T22:14:01.483274	0eaedb57	116	29	1.0000	DISCARD	gen=46 glyphs=4
2026-03-13T22:14:02.052099	4502e7a5	120	30	1.0000	DISCARD	gen=2 glyphs=4
2026-03-13T22:14:04.393826	a78f9454	120	30	1.0000	DISCARD	gen=46 glyphs=4
2026-03-13T22:14:04.980157	37f4017b	116	29	1.0000	DISCARD	gen=2 glyphs=4
2026-03-13T22:14:07.375151	b9af5a56	120	30	1.0000	DISCARD	gen=46 glyphs=4
2026-03-13T22:14:07.986560	fdb5d108	120	30	1.0000	DISCARD	gen=2 glyphs=4
2026-03-13T22:14:10.322171	ac43f3aa	116	29	1.0000	DISCARD	gen=46 glyphs=4
2026-03-13T22:14:10.914216	37f4017b	116	29	1.0000	DISCARD	gen=2 glyphs=4
2026-03-13T22:14:13.286341	9e34ede0	116	29	1.0000	DISCARD	gen=46 glyphs=4
2026-03-13T22:14:13.862601	37f4017b	116	29	1.0000	DISCARD	gen=2 glyphs=4
2026-03-13T22:14:16.190111	8d0d2a7e	120	30	1.0000	DISCARD	gen=46 glyphs=4
2026-03-13T22:14:16.779036	5b9807ac	120	30	1.0000	DISCARD	gen=2 glyphs=4
2026-03-13T22:14:19.115396	ae5ab30b	116	29	0.9500	DISCARD	gen=46 glyphs=4
2026-03-13T22:14:19.692754	5a06ca32	120	30	1.0000	DISCARD	gen=2 glyphs=4
2026-03-13T22:14:22.234735	1dcffbc7	116	29	1.0000	DISCARD	gen=46 glyphs=4
2026-03-13T22:14:22.894009	37f4017b	116	29	1.0000	DISCARD	gen=3 glyphs=4
2026-03-13T22:14:25.337233	19355583	120	30	1.0000	DISCARD	gen=47 glyphs=4
2026-03-13T22:14:25.942674	bfdf7cad	120	30	1.0000	DISCARD	gen=3 glyphs=4
2026-03-13T22:14:28.709236	8aef8872	116	29	1.0000	DISCARD	gen=47 glyphs=4
2026-03-13T22:14:29.296794	364de889	116	29	1.0000	DISCARD	gen=3 glyphs=4
2026-03-13T22:14:31.916440	94aa6c78	116	29	1.0000	DISCARD	gen=47 glyphs=4
2026-03-13T22:14:32.506344	37f4017b	116	29	1.0000	DISCARD	gen=3 glyphs=4
2026-03-13T22:14:35.094283	67cb81be	120	30	1.0000	DISCARD	gen=47 glyphs=4
2026-03-13T22:14:35.971781	37f4017b	116	29	1.0000	DISCARD	gen=3 glyphs=4
2026-03-13T22:14:38.567243	8aef8872	116	29	1.0000	DISCARD	gen=47 glyphs=4
2026-03-13T22:14:39.206693	5a06ca32	120	30	1.0000	DISCARD	gen=3 glyphs=4
2026-03-13T22:14:41.680029	50959328	116	29	1.0000	DISCARD	gen=47 glyphs=4
2026-03-13T22:14:42.284093	37f4017b	116	29	1.0000	DISCARD	gen=3 glyphs=4
2026-03-13T22:14:44.649149	b7aed8e9	116	29	1.0000	DISCARD	gen=47 glyphs=4
2026-03-13T22:14:45.242092	516d8dea	116	29	1.0000	DISCARD	gen=3 glyphs=4
2026-03-13T22:14:47.593956	8aef8872	116	29	1.0000	DISCARD	gen=47 glyphs=4
2026-03-13T22:14:48.172837	55d6c151	120	30	1.0000	DISCARD	gen=3 glyphs=4
2026-03-13T22:14:50.505512	62ad4d3c	120	30	1.0000	DISCARD	gen=47 glyphs=4
2026-03-13T22:14:51.073321	d11c1062	120	30	1.0000	DISCARD	gen=3 glyphs=4
2026-03-13T22:14:53.458992	b7aed8e9	116	29	1.0000	DISCARD	gen=47 glyphs=4
2026-03-13T22:14:54.038734	37f4017b	116	29	1.0000	DISCARD	gen=4 glyphs=4
2026-03-13T22:14:56.376261	19355583	120	30	1.0000	DISCARD	gen=48 glyphs=4
2026-03-13T22:14:56.947983	bfdf7cad	120	30	1.0000	DISCARD	gen=4 glyphs=4
2026-03-13T22:14:59.273554	8aef8872	116	29	1.0000	DISCARD	gen=48 glyphs=4
2026-03-13T22:14:59.855166	5b9807ac	120	30	1.0000	DISCARD	gen=4 glyphs=4
2026-03-13T22:15:06.674469	0ca6ff33	0	0	0.0000	CRASH	gen=48 glyphs=4
2026-03-13T22:15:10.141204	a9d666d4	0	0	0.0000	CRASH	gen=4 glyphs=4
2026-03-13T22:15:18.049531	e2cd28ea	0	0	0.0000	CRASH	gen=48 glyphs=4
2026-03-13T22:15:20.980380	ce9f157a	0	0	0.0000	CRASH	gen=4 glyphs=4
2026-03-13T22:15:28.960783	ae44ace5	0	0	0.0000	CRASH	gen=48 glyphs=4
2026-03-13T22:15:31.505717	37f4017b	0	0	0.0000	CRASH	gen=4 glyphs=4
2026-03-13T22:15:40.524508	8aef8872	116	29	1.0000	DISCARD	gen=48 glyphs=4
2026-03-13T22:15:41.106413	5a06ca32	120	30	1.0000	DISCARD	gen=4 glyphs=4
2026-03-13T22:15:43.486428	c34ce93c	116	29	1.0000	DISCARD	gen=48 glyphs=4
2026-03-13T22:15:44.080194	5a06ca32	120	30	1.0000	DISCARD	gen=4 glyphs=4
2026-03-13T22:15:46.433657	16dfbb7f	120	30	1.0000	DISCARD	gen=48 glyphs=4
2026-03-13T22:15:47.030743	2701cb73	116	29	1.0000	DISCARD	gen=4 glyphs=4
2026-03-13T22:15:49.360995	50dc991d	116	29	1.0000	DISCARD	gen=48 glyphs=4
2026-03-13T22:15:49.937548	47869acc	116	29	1.0000	DISCARD	gen=4 glyphs=4
2026-03-13T22:15:52.257812	2971a704	116	29	1.0000	DISCARD	gen=48 glyphs=4
2026-03-13T22:15:52.826742	37f4017b	116	29	1.0000	DISCARD	gen=5 glyphs=4
2026-03-13T22:15:55.180036	19355583	120	30	1.0000	DISCARD	gen=49 glyphs=4
2026-03-13T22:15:55.754515	bfdf7cad	120	30	1.0000	DISCARD	gen=5 glyphs=4
2026-03-13T22:15:58.081044	8aef8872	116	29	1.0000	DISCARD	gen=49 glyphs=4
2026-03-13T22:15:58.683507	5a06ca32	120	30	1.0000	DISCARD	gen=5 glyphs=4
2026-03-13T22:16:01.017853	9a6f4a5c	116	29	1.0000	DISCARD	gen=49 glyphs=4
2026-03-13T22:16:01.598764	5a06ca32	120	30	1.0000	DISCARD	gen=5 glyphs=4
2026-03-13T22:16:03.926065	8aef8872	116	29	1.0000	DISCARD	gen=49 glyphs=4
2026-03-13T22:16:04.513292	37f4017b	116	29	1.0000	DISCARD	gen=5 glyphs=4
2026-03-13T22:16:06.831767	050862ad	120	30	1.0000	DISCARD	gen=49 glyphs=4
2026-03-13T22:16:07.413164	55d6c151	120	30	1.0000	DISCARD	gen=5 glyphs=4
2026-03-13T22:16:09.715083	9e34ede0	116	29	1.0000	DISCARD	gen=49 glyphs=4
2026-03-13T22:16:10.295646	5a06ca32	120	30	1.0000	DISCARD	gen=5 glyphs=4
2026-03-13T22:16:12.617326	5bfbfd0c	116	29	1.0000	DISCARD	gen=49 glyphs=4
2026-03-13T22:16:13.216727	fdb5d108	120	30	1.0000	DISCARD	gen=5 glyphs=4
2026-03-13T22:16:15.685395	bd45cabb	116	29	1.0000	DISCARD	gen=49 glyphs=4
2026-03-13T22:16:16.279662	37f4017b	116	29	1.0000	DISCARD	gen=5 glyphs=4
2026-03-13T22:16:18.609466	050862ad	120	30	1.0000	DISCARD	gen=49 glyphs=4
2026-03-13T22:16:19.189313	fdb5d108	120	30	1.0000	DISCARD	gen=5 glyphs=4
2026-03-13T22:16:21.552768	8aef8872	116	29	1.0000	DISCARD	gen=49 glyphs=4
2026-03-13T22:16:22.137130	37f4017b	116	29	1.0000	DISCARD	gen=6 glyphs=4
2026-03-13T22:16:30.034824	19355583	120	30	1.0000	DISCARD	gen=50 glyphs=4
2026-03-13T22:16:30.626860	bfdf7cad	120	30	1.0000	DISCARD	gen=6 glyphs=4
2026-03-13T22:16:32.956312	8aef8872	116	29	1.0000	DISCARD	gen=50 glyphs=4
2026-03-13T22:16:33.537910	12b38c2d	116	29	1.0000	DISCARD	gen=6 glyphs=4
2026-03-13T22:16:35.824397	19355583	120	30	1.0000	DISCARD	gen=50 glyphs=4
2026-03-13T22:16:36.406567	5a06ca32	120	30	1.0000	DISCARD	gen=6 glyphs=4
2026-03-13T22:16:38.711921	d7c8681b	120	30	1.0000	DISCARD	gen=50 glyphs=4
2026-03-13T22:16:39.291014	5a06ca32	120	30	1.0000	DISCARD	gen=6 glyphs=4
2026-03-13T22:16:41.601296	3343e906	116	29	1.0000	DISCARD	gen=50 glyphs=4
2026-03-13T22:16:42.191203	4c9b0dd4	120	30	1.0000	DISCARD	gen=6 glyphs=4
2026-03-13T22:16:44.528578	4759f7b8	116	29	0.9500	DISCARD	gen=50 glyphs=4
2026-03-13T22:16:45.112904	37f4017b	116	29	1.0000	DISCARD	gen=6 glyphs=4
2026-03-13T22:16:47.575046	d7c8681b	120	30	1.0000	DISCARD	gen=50 glyphs=4
2026-03-13T22:16:48.173828	5a06ca32	120	30	1.0000	DISCARD	gen=6 glyphs=4
2026-03-13T22:16:50.532939	19355583	120	30	1.0000	DISCARD	gen=50 glyphs=4
2026-03-13T22:16:51.116130	37f4017b	116	29	1.0000	DISCARD	gen=6 glyphs=4
2026-03-13T22:16:53.483057	67cb81be	120	30	1.0000	DISCARD	gen=50 glyphs=4
2026-03-13T22:16:54.078343	61845c67	116	29	1.0000	DISCARD	gen=6 glyphs=4
2026-03-13T22:16:56.415180	ede41cc5	120	30	1.0000	DISCARD	gen=50 glyphs=4
2026-03-13T22:16:56.994749	37f4017b	116	29	1.0000	DISCARD	gen=7 glyphs=4
2026-03-13T22:16:59.332204	19355583	120	30	1.0000	DISCARD	gen=51 glyphs=4
2026-03-13T22:16:59.917460	bfdf7cad	120	30	1.0000	DISCARD	gen=7 glyphs=4
2026-03-13T22:17:02.237140	8aef8872	116	29	1.0000	DISCARD	gen=51 glyphs=4
2026-03-13T22:17:02.816137	1d34459a	116	29	1.0000	DISCARD	gen=7 glyphs=4
2026-03-13T22:17:05.140858	ae44ace5	116	29	1.0000	DISCARD	gen=51 glyphs=4
2026-03-13T22:17:05.729450	4c9b0dd4	120	30	1.0000	DISCARD	gen=7 glyphs=4
2026-03-13T22:17:08.034823	7986840f	120	30	1.0000	DISCARD	gen=51 glyphs=4
2026-03-13T22:17:08.626304	3bb875b8	120	30	1.0000	DISCARD	gen=7 glyphs=4
2026-03-13T22:17:10.937640	c58dcbbd	116	29	0.9500	DISCARD	gen=51 glyphs=4
2026-03-13T22:17:11.527763	442b91e6	120	30	1.0000	DISCARD	gen=7 glyphs=4
2026-03-13T22:17:13.863575	8dc17efc	116	29	1.0000	DISCARD	gen=51 glyphs=4
2026-03-13T22:17:14.455830	37f4017b	116	29	1.0000	DISCARD	gen=7 glyphs=4
2026-03-13T22:17:16.771801	050862ad	120	30	1.0000	DISCARD	gen=51 glyphs=4
2026-03-13T22:17:17.345781	37f4017b	116	29	1.0000	DISCARD	gen=7 glyphs=4
