timestamp	program_hash	spirv_size	word_count	fitness	status	description
2026-03-14T03:21:23.528208	2701cb73	116	29	1.0000	DISCARD	gen=665 glyphs=4
2026-03-14T03:21:23.791707	8aef8872	116	29	1.0000	DISCARD	gen=709 glyphs=4
2026-03-14T03:21:26.193232	4644283c	120	30	1.0000	DISCARD	gen=665 glyphs=4
2026-03-14T03:21:26.455932	1e5f0e21	116	29	1.0000	DISCARD	gen=709 glyphs=4
2026-03-14T03:21:28.864279	55d6c151	120	30	1.0000	DISCARD	gen=665 glyphs=4
2026-03-14T03:21:29.118628	d7c8681b	120	30	1.0000	DISCARD	gen=709 glyphs=4
2026-03-14T03:21:31.507878	37f4017b	116	29	1.0000	DISCARD	gen=666 glyphs=4
2026-03-14T03:21:31.775657	e7fdeac0	120	30	1.0000	DISCARD	gen=709 glyphs=4
2026-03-14T03:21:34.199780	bfdf7cad	120	30	1.0000	DISCARD	gen=666 glyphs=4
2026-03-14T03:21:34.467481	19355583	120	30	1.0000	DISCARD	gen=710 glyphs=4
2026-03-14T03:21:36.960771	5a06ca32	120	30	1.0000	DISCARD	gen=666 glyphs=4
2026-03-14T03:21:37.223198	8aef8872	116	29	1.0000	DISCARD	gen=710 glyphs=4
2026-03-14T03:21:39.632280	7f4d29d3	116	29	0.9500	DISCARD	gen=666 glyphs=4
2026-03-14T03:21:39.892565	8bde8be4	116	29	1.0000	DISCARD	gen=710 glyphs=4
2026-03-14T03:21:42.280141	5b9807ac	120	30	1.0000	DISCARD	gen=666 glyphs=4
2026-03-14T03:21:42.545401	0eaedb57	116	29	1.0000	DISCARD	gen=710 glyphs=4
2026-03-14T03:21:44.948774	37f4017b	116	29	1.0000	DISCARD	gen=666 glyphs=4
2026-03-14T03:21:45.205557	8aef8872	116	29	1.0000	DISCARD	gen=710 glyphs=4
2026-03-14T03:21:47.609578	bfdf7cad	120	30	1.0000	DISCARD	gen=666 glyphs=4
2026-03-14T03:21:47.876374	ae44ace5	116	29	1.0000	DISCARD	gen=710 glyphs=4
2026-03-14T03:21:50.268934	37f4017b	116	29	1.0000	DISCARD	gen=666 glyphs=4
2026-03-14T03:21:50.536588	eede2ef7	116	29	1.0000	DISCARD	gen=710 glyphs=4
2026-03-14T03:21:52.931384	fdb5d108	120	30	1.0000	DISCARD	gen=666 glyphs=4
2026-03-14T03:21:53.193300	a78f9454	120	30	1.0000	DISCARD	gen=710 glyphs=4
2026-03-14T03:21:55.647940	5b9807ac	120	30	1.0000	DISCARD	gen=666 glyphs=4
2026-03-14T03:21:55.905714	19355583	120	30	1.0000	DISCARD	gen=710 glyphs=4
2026-03-14T03:21:58.314780	37f4017b	116	29	1.0000	DISCARD	gen=667 glyphs=4
2026-03-14T03:21:58.600643	c45ccdbe	116	29	1.0000	DISCARD	gen=710 glyphs=4
2026-03-14T03:22:01.023987	bfdf7cad	120	30	1.0000	DISCARD	gen=667 glyphs=4
2026-03-14T03:22:01.290024	19355583	120	30	1.0000	DISCARD	gen=711 glyphs=4
2026-03-14T03:22:03.686545	12b38c2d	116	29	1.0000	DISCARD	gen=667 glyphs=4
2026-03-14T03:22:03.973948	8aef8872	116	29	1.0000	DISCARD	gen=711 glyphs=4
2026-03-14T03:22:06.416512	5a06ca32	120	30	1.0000	DISCARD	gen=667 glyphs=4
2026-03-14T03:22:06.741059	0eaedb57	116	29	1.0000	DISCARD	gen=711 glyphs=4
2026-03-14T03:22:09.170605	a716881e	120	30	1.0000	DISCARD	gen=667 glyphs=4
2026-03-14T03:22:09.426382	9e34ede0	116	29	1.0000	DISCARD	gen=711 glyphs=4
2026-03-14T03:22:11.853135	55d6c151	120	30	1.0000	DISCARD	gen=667 glyphs=4
2026-03-14T03:22:12.120203	8aef8872	116	29	1.0000	DISCARD	gen=711 glyphs=4
2026-03-14T03:22:14.506807	5a06ca32	120	30	1.0000	DISCARD	gen=667 glyphs=4
2026-03-14T03:22:14.771424	050862ad	120	30	1.0000	DISCARD	gen=711 glyphs=4
2026-03-14T03:22:17.169437	37f4017b	116	29	1.0000	DISCARD	gen=667 glyphs=4
2026-03-14T03:22:17.446504	8aef8872	116	29	1.0000	DISCARD	gen=711 glyphs=4
2026-03-14T03:22:19.861670	37f4017b	116	29	1.0000	DISCARD	gen=667 glyphs=4
2026-03-14T03:22:20.132614	a78f9454	120	30	1.0000	DISCARD	gen=711 glyphs=4
2026-03-14T03:22:22.519696	1d34459a	116	29	1.0000	DISCARD	gen=667 glyphs=4
2026-03-14T03:22:22.793824	e8c7f6cf	120	30	1.0000	DISCARD	gen=711 glyphs=4
2026-03-14T03:22:25.195908	37f4017b	116	29	1.0000	DISCARD	gen=668 glyphs=4
2026-03-14T03:22:25.464076	eca7ab6c	116	29	1.0000	DISCARD	gen=711 glyphs=4
2026-03-14T03:22:27.837244	bfdf7cad	120	30	1.0000	DISCARD	gen=668 glyphs=4
2026-03-14T03:22:28.100795	19355583	120	30	1.0000	DISCARD	gen=712 glyphs=4
2026-03-14T03:22:30.515181	37f4017b	116	29	1.0000	DISCARD	gen=668 glyphs=4
2026-03-14T03:22:30.791709	8aef8872	116	29	1.0000	DISCARD	gen=712 glyphs=4
2026-03-14T03:22:33.209407	0a3fbc99	116	29	0.9500	DISCARD	gen=668 glyphs=4
2026-03-14T03:22:33.474700	0eaedb57	116	29	1.0000	DISCARD	gen=712 glyphs=4
2026-03-14T03:22:35.876479	e618453a	116	29	0.9500	DISCARD	gen=668 glyphs=4
2026-03-14T03:22:36.157926	ad2c388b	120	30	1.0000	DISCARD	gen=712 glyphs=4
2026-03-14T03:22:38.625276	7ca87b42	116	29	1.0000	DISCARD	gen=668 glyphs=4
2026-03-14T03:22:38.896587	a1309531	116	29	1.0000	DISCARD	gen=712 glyphs=4
2026-03-14T03:22:41.346941	bfdf7cad	120	30	1.0000	DISCARD	gen=668 glyphs=4
2026-03-14T03:22:41.619576	8aef8872	116	29	1.0000	DISCARD	gen=712 glyphs=4
2026-03-14T03:22:44.005164	5a06ca32	120	30	1.0000	DISCARD	gen=668 glyphs=4
2026-03-14T03:22:44.272089	e8360ed0	116	29	1.0000	DISCARD	gen=712 glyphs=4
2026-03-14T03:22:46.681289	e4597b56	116	29	1.0000	DISCARD	gen=668 glyphs=4
2026-03-14T03:22:46.957177	d7c8681b	120	30	1.0000	DISCARD	gen=712 glyphs=4
2026-03-14T03:22:49.357470	55d6c151	120	30	1.0000	DISCARD	gen=668 glyphs=4
2026-03-14T03:22:49.638093	050862ad	120	30	1.0000	DISCARD	gen=712 glyphs=4
2026-03-14T03:22:52.057732	37f4017b	116	29	1.0000	DISCARD	gen=669 glyphs=4
2026-03-14T03:22:52.321045	d0aeeaa9	116	29	1.0000	DISCARD	gen=712 glyphs=4
2026-03-14T03:22:54.730157	bfdf7cad	120	30	1.0000	DISCARD	gen=669 glyphs=4
2026-03-14T03:22:55.011473	19355583	120	30	1.0000	DISCARD	gen=713 glyphs=4
2026-03-14T03:22:57.396005	bfdf7cad	120	30	1.0000	DISCARD	gen=669 glyphs=4
2026-03-14T03:22:57.659503	8aef8872	116	29	1.0000	DISCARD	gen=713 glyphs=4
2026-03-14T03:23:00.051460	5a06ca32	120	30	1.0000	DISCARD	gen=669 glyphs=4
2026-03-14T03:23:00.325170	e8c0f482	116	29	1.0000	DISCARD	gen=713 glyphs=4
2026-03-14T03:23:02.743649	5a06ca32	120	30	1.0000	DISCARD	gen=669 glyphs=4
2026-03-14T03:23:03.016971	3f2be6fb	116	29	1.0000	DISCARD	gen=713 glyphs=4
2026-03-14T03:23:05.426471	bfdf7cad	120	30	1.0000	DISCARD	gen=669 glyphs=4
2026-03-14T03:23:05.699974	1e5f0e21	116	29	1.0000	DISCARD	gen=713 glyphs=4
2026-03-14T03:23:08.124403	55d6c151	120	30	1.0000	DISCARD	gen=669 glyphs=4
2026-03-14T03:23:08.386453	8aef8872	116	29	1.0000	DISCARD	gen=713 glyphs=4
2026-03-14T03:23:10.850641	3685bcfd	120	30	1.0000	DISCARD	gen=669 glyphs=4
2026-03-14T03:23:11.136931	4c3a5a21	116	29	1.0000	DISCARD	gen=713 glyphs=4
2026-03-14T03:23:13.581226	42ee3d30	116	29	0.9500	DISCARD	gen=669 glyphs=4
2026-03-14T03:23:13.841413	1e4e9a0b	120	30	0.9500	DISCARD	gen=713 glyphs=4
2026-03-14T03:23:16.201427	5b9807ac	120	30	1.0000	DISCARD	gen=669 glyphs=4
2026-03-14T03:23:16.481482	50dc991d	116	29	1.0000	DISCARD	gen=713 glyphs=4
2026-03-14T03:23:18.856509	37f4017b	116	29	1.0000	DISCARD	gen=670 glyphs=4
2026-03-14T03:23:19.118187	67cb81be	120	30	1.0000	DISCARD	gen=713 glyphs=4
2026-03-14T03:23:21.510998	bfdf7cad	120	30	1.0000	DISCARD	gen=670 glyphs=4
2026-03-14T03:23:21.768948	19355583	120	30	1.0000	DISCARD	gen=714 glyphs=4
2026-03-14T03:23:24.169067	9fa646b7	116	29	1.0000	DISCARD	gen=670 glyphs=4
2026-03-14T03:23:24.437507	8aef8872	116	29	1.0000	DISCARD	gen=714 glyphs=4
2026-03-14T03:23:26.840336	37f4017b	116	29	1.0000	DISCARD	gen=670 glyphs=4
2026-03-14T03:23:27.104072	3f375e4a	120	30	1.0000	DISCARD	gen=714 glyphs=4
2026-03-14T03:23:29.528913	5a06ca32	120	30	1.0000	DISCARD	gen=670 glyphs=4
2026-03-14T03:23:29.793019	8aef8872	116	29	1.0000	DISCARD	gen=714 glyphs=4
2026-03-14T03:23:32.173334	12b38c2d	116	29	1.0000	DISCARD	gen=670 glyphs=4
2026-03-14T03:23:32.453639	ae44ace5	116	29	1.0000	DISCARD	gen=714 glyphs=4
2026-03-14T03:23:34.853307	71e2ba66	116	29	1.0000	DISCARD	gen=670 glyphs=4
2026-03-14T03:23:35.136796	50dc991d	116	29	1.0000	DISCARD	gen=714 glyphs=4
2026-03-14T03:23:37.509522	37f4017b	116	29	1.0000	DISCARD	gen=670 glyphs=4
2026-03-14T03:23:37.773871	0eaedb57	116	29	1.0000	DISCARD	gen=714 glyphs=4
2026-03-14T03:23:40.149486	aa3926e1	116	29	1.0000	DISCARD	gen=670 glyphs=4
2026-03-14T03:23:40.418916	e8c7f6cf	120	30	1.0000	DISCARD	gen=714 glyphs=4
2026-03-14T03:23:42.868691	bc0e512f	120	30	1.0000	DISCARD	gen=670 glyphs=4
2026-03-14T03:23:43.142360	b7aed8e9	116	29	1.0000	DISCARD	gen=714 glyphs=4
2026-03-14T03:23:45.571159	37f4017b	116	29	1.0000	DISCARD	gen=671 glyphs=4
2026-03-14T03:23:45.838078	8aef8872	116	29	1.0000	DISCARD	gen=714 glyphs=4
2026-03-14T03:23:48.213039	bfdf7cad	120	30	1.0000	DISCARD	gen=671 glyphs=4
2026-03-14T03:23:48.470331	19355583	120	30	1.0000	DISCARD	gen=715 glyphs=4
2026-03-14T03:23:50.871651	37f4017b	116	29	1.0000	DISCARD	gen=671 glyphs=4
2026-03-14T03:23:51.135012	8aef8872	116	29	1.0000	DISCARD	gen=715 glyphs=4
2026-03-14T03:23:53.570203	37f4017b	116	29	1.0000	DISCARD	gen=671 glyphs=4
2026-03-14T03:23:53.835307	ae44ace5	116	29	1.0000	DISCARD	gen=715 glyphs=4
2026-03-14T03:23:56.258619	5b9807ac	120	30	1.0000	DISCARD	gen=671 glyphs=4
2026-03-14T03:23:56.524681	67cb81be	120	30	1.0000	DISCARD	gen=715 glyphs=4
2026-03-14T03:23:58.909998	1ce6f320	120	30	1.0000	DISCARD	gen=671 glyphs=4
2026-03-14T03:23:59.176842	dc9530ae	116	29	1.0000	DISCARD	gen=715 glyphs=4
2026-03-14T03:24:01.562599	5a06ca32	120	30	1.0000	DISCARD	gen=671 glyphs=4
2026-03-14T03:24:01.829199	19355583	120	30	1.0000	DISCARD	gen=715 glyphs=4
2026-03-14T03:24:04.221050	51adf5b5	116	29	1.0000	DISCARD	gen=671 glyphs=4
2026-03-14T03:24:04.482373	9e34ede0	116	29	1.0000	DISCARD	gen=715 glyphs=4
2026-03-14T03:24:06.859925	fdb5d108	120	30	1.0000	DISCARD	gen=671 glyphs=4
2026-03-14T03:24:07.125670	b57e7176	120	30	1.0000	DISCARD	gen=715 glyphs=4
2026-03-14T03:24:09.549368	37f4017b	116	29	1.0000	DISCARD	gen=671 glyphs=4
2026-03-14T03:24:09.807328	050862ad	120	30	1.0000	DISCARD	gen=715 glyphs=4
2026-03-14T03:24:12.203824	37f4017b	116	29	1.0000	DISCARD	gen=672 glyphs=4
2026-03-14T03:24:12.465682	e60fdd3e	116	29	1.0000	DISCARD	gen=715 glyphs=4
2026-03-14T03:24:14.934356	bfdf7cad	120	30	1.0000	DISCARD	gen=672 glyphs=4
2026-03-14T03:24:15.215713	19355583	120	30	1.0000	DISCARD	gen=716 glyphs=4
2026-03-14T03:24:17.646543	d11c1062	120	30	1.0000	DISCARD	gen=672 glyphs=4
2026-03-14T03:24:17.909784	8aef8872	116	29	1.0000	DISCARD	gen=716 glyphs=4
2026-03-14T03:24:20.306771	497132c8	116	29	1.0000	DISCARD	gen=672 glyphs=4
2026-03-14T03:24:20.573545	4bc1abf1	116	29	1.0000	DISCARD	gen=716 glyphs=4
2026-03-14T03:24:22.969610	831f3b8a	116	29	1.0000	DISCARD	gen=672 glyphs=4
2026-03-14T03:24:23.227877	19355583	120	30	1.0000	DISCARD	gen=716 glyphs=4
2026-03-14T03:24:25.630376	37f4017b	116	29	1.0000	DISCARD	gen=672 glyphs=4
2026-03-14T03:24:25.905229	19355583	120	30	1.0000	DISCARD	gen=716 glyphs=4
2026-03-14T03:24:28.288705	12b38c2d	116	29	1.0000	DISCARD	gen=672 glyphs=4
2026-03-14T03:24:28.554873	eff0ac82	116	29	1.0000	DISCARD	gen=716 glyphs=4
2026-03-14T03:24:30.944456	d11c1062	120	30	1.0000	DISCARD	gen=672 glyphs=4
2026-03-14T03:24:31.214373	ae44ace5	116	29	1.0000	DISCARD	gen=716 glyphs=4
2026-03-14T03:24:33.621292	99082236	116	29	1.0000	DISCARD	gen=672 glyphs=4
2026-03-14T03:24:33.881483	19355583	120	30	1.0000	DISCARD	gen=716 glyphs=4
2026-03-14T03:24:36.278985	37f4017b	116	29	1.0000	DISCARD	gen=672 glyphs=4
2026-03-14T03:24:36.540538	050862ad	120	30	1.0000	DISCARD	gen=716 glyphs=4
2026-03-14T03:24:38.928447	37f4017b	116	29	1.0000	DISCARD	gen=673 glyphs=4
2026-03-14T03:24:39.204916	050862ad	120	30	1.0000	DISCARD	gen=716 glyphs=4
2026-03-14T03:24:41.613803	bfdf7cad	120	30	1.0000	DISCARD	gen=673 glyphs=4
2026-03-14T03:24:41.890112	19355583	120	30	1.0000	DISCARD	gen=717 glyphs=4
2026-03-14T03:24:44.272401	fdb5d108	120	30	1.0000	DISCARD	gen=673 glyphs=4
2026-03-14T03:24:44.534786	8aef8872	116	29	1.0000	DISCARD	gen=717 glyphs=4
2026-03-14T03:24:47.023809	37f4017b	116	29	1.0000	DISCARD	gen=673 glyphs=4
2026-03-14T03:24:47.292888	19355583	120	30	1.0000	DISCARD	gen=717 glyphs=4
2026-03-14T03:24:49.673217	5a06ca32	120	30	1.0000	DISCARD	gen=673 glyphs=4
2026-03-14T03:24:49.930926	19355583	120	30	1.0000	DISCARD	gen=717 glyphs=4
2026-03-14T03:24:52.341437	5a06ca32	120	30	1.0000	DISCARD	gen=673 glyphs=4
2026-03-14T03:24:52.599360	9dd56780	120	30	1.0000	DISCARD	gen=717 glyphs=4
2026-03-14T03:24:55.008003	d11c1062	120	30	1.0000	DISCARD	gen=673 glyphs=4
2026-03-14T03:24:55.275366	eca7ab6c	116	29	1.0000	DISCARD	gen=717 glyphs=4
2026-03-14T03:24:57.692678	37f4017b	116	29	1.0000	DISCARD	gen=673 glyphs=4
2026-03-14T03:24:57.969104	f6315598	120	30	1.0000	DISCARD	gen=717 glyphs=4
2026-03-14T03:25:00.378354	9e025c47	120	30	1.0000	DISCARD	gen=673 glyphs=4
2026-03-14T03:25:00.637418	50dc991d	116	29	1.0000	DISCARD	gen=717 glyphs=4
2026-03-14T03:25:03.066603	55d6c151	120	30	1.0000	DISCARD	gen=673 glyphs=4
2026-03-14T03:25:03.345359	19355583	120	30	1.0000	DISCARD	gen=717 glyphs=4
2026-03-14T03:25:05.752153	37f4017b	116	29	1.0000	DISCARD	gen=674 glyphs=4
2026-03-14T03:25:06.018810	0eaedb57	116	29	1.0000	DISCARD	gen=717 glyphs=4
2026-03-14T03:25:08.439980	bfdf7cad	120	30	1.0000	DISCARD	gen=674 glyphs=4
2026-03-14T03:25:08.709619	19355583	120	30	1.0000	DISCARD	gen=718 glyphs=4
2026-03-14T03:25:11.136385	d72558b9	116	29	1.0000	DISCARD	gen=674 glyphs=4
2026-03-14T03:25:11.402173	8aef8872	116	29	1.0000	DISCARD	gen=718 glyphs=4
2026-03-14T03:25:13.830618	2701cb73	116	29	1.0000	DISCARD	gen=674 glyphs=4
2026-03-14T03:25:14.112274	b57e7176	120	30	1.0000	DISCARD	gen=718 glyphs=4
2026-03-14T03:25:16.550984	6b72a52f	116	29	1.0000	DISCARD	gen=674 glyphs=4
2026-03-14T03:25:16.812797	50dc991d	116	29	1.0000	DISCARD	gen=718 glyphs=4
2026-03-14T03:25:19.322788	41b316c2	116	29	1.0000	DISCARD	gen=674 glyphs=4
2026-03-14T03:25:19.588334	8aef8872	116	29	1.0000	DISCARD	gen=718 glyphs=4
2026-03-14T03:25:22.016815	5a06ca32	120	30	1.0000	DISCARD	gen=674 glyphs=4
2026-03-14T03:25:22.277428	e34f39c0	120	30	1.0000	DISCARD	gen=718 glyphs=4
2026-03-14T03:25:24.706358	5a06ca32	120	30	1.0000	DISCARD	gen=674 glyphs=4
2026-03-14T03:25:24.971989	fa666aa0	116	29	1.0000	DISCARD	gen=718 glyphs=4
2026-03-14T03:25:27.398059	8cd0018b	120	30	1.0000	DISCARD	gen=674 glyphs=4
2026-03-14T03:25:27.668658	19355583	120	30	1.0000	DISCARD	gen=718 glyphs=4
2026-03-14T03:25:30.083619	71e2ba66	116	29	1.0000	DISCARD	gen=674 glyphs=4
2026-03-14T03:25:30.343941	9e34ede0	116	29	1.0000	DISCARD	gen=718 glyphs=4
2026-03-14T03:25:32.776951	37f4017b	116	29	1.0000	DISCARD	gen=675 glyphs=4
2026-03-14T03:25:33.054588	0eaedb57	116	29	1.0000	DISCARD	gen=718 glyphs=4
2026-03-14T03:25:35.473351	bfdf7cad	120	30	1.0000	DISCARD	gen=675 glyphs=4
2026-03-14T03:25:35.743232	19355583	120	30	1.0000	DISCARD	gen=719 glyphs=4
2026-03-14T03:25:38.144248	5a06ca32	120	30	1.0000	DISCARD	gen=675 glyphs=4
2026-03-14T03:25:38.417602	8aef8872	116	29	1.0000	DISCARD	gen=719 glyphs=4
2026-03-14T03:25:40.852267	d11c1062	120	30	1.0000	DISCARD	gen=675 glyphs=4
2026-03-14T03:25:41.119601	8aef8872	116	29	1.0000	DISCARD	gen=719 glyphs=4
2026-03-14T03:25:43.563870	fdb5d108	120	30	1.0000	DISCARD	gen=675 glyphs=4
2026-03-14T03:25:43.833076	b7e15248	120	30	1.0000	DISCARD	gen=719 glyphs=4
2026-03-14T03:25:46.275995	4c9b0dd4	120	30	1.0000	DISCARD	gen=675 glyphs=4
2026-03-14T03:25:46.545174	ae44ace5	116	29	1.0000	DISCARD	gen=719 glyphs=4
2026-03-14T03:25:48.967346	5a06ca32	120	30	1.0000	DISCARD	gen=675 glyphs=4
2026-03-14T03:25:49.297717	946b6f64	116	29	1.0000	DISCARD	gen=719 glyphs=4
2026-03-14T03:25:51.774692	3d077055	116	29	1.0000	DISCARD	gen=675 glyphs=4
2026-03-14T03:25:52.050278	b7aed8e9	116	29	1.0000	DISCARD	gen=719 glyphs=4
2026-03-14T03:25:54.469965	fdb5d108	120	30	1.0000	DISCARD	gen=675 glyphs=4
2026-03-14T03:25:54.743979	b57e7176	120	30	1.0000	DISCARD	gen=719 glyphs=4
2026-03-14T03:25:57.206501	5a06ca32	120	30	1.0000	DISCARD	gen=675 glyphs=4
2026-03-14T03:25:57.491985	19355583	120	30	1.0000	DISCARD	gen=719 glyphs=4
2026-03-14T03:25:59.907433	37f4017b	116	29	1.0000	DISCARD	gen=676 glyphs=4
2026-03-14T03:26:00.185352	8aef8872	116	29	1.0000	DISCARD	gen=719 glyphs=4
2026-03-14T03:26:02.618831	bfdf7cad	120	30	1.0000	DISCARD	gen=676 glyphs=4
2026-03-14T03:26:02.888259	19355583	120	30	1.0000	DISCARD	gen=720 glyphs=4
2026-03-14T03:26:05.303608	7ca87b42	116	29	1.0000	DISCARD	gen=676 glyphs=4
2026-03-14T03:26:05.572829	8aef8872	116	29	1.0000	DISCARD	gen=720 glyphs=4
2026-03-14T03:26:07.999906	5b3bbf49	120	30	1.0000	DISCARD	gen=676 glyphs=4
2026-03-14T03:26:08.269686	244cb469	116	29	1.0000	DISCARD	gen=720 glyphs=4
2026-03-14T03:26:10.696064	55d6c151	120	30	1.0000	DISCARD	gen=676 glyphs=4
2026-03-14T03:26:10.963364	b35d9690	116	29	1.0000	DISCARD	gen=720 glyphs=4
2026-03-14T03:26:13.381161	5985316c	120	30	1.0000	DISCARD	gen=676 glyphs=4
2026-03-14T03:26:13.657018	1165c108	116	29	1.0000	DISCARD	gen=720 glyphs=4
2026-03-14T03:26:16.066373	37f4017b	116	29	1.0000	DISCARD	gen=676 glyphs=4
2026-03-14T03:26:16.344692	19355583	120	30	1.0000	DISCARD	gen=720 glyphs=4
2026-03-14T03:26:18.816429	1d34459a	116	29	1.0000	DISCARD	gen=676 glyphs=4
2026-03-14T03:26:19.087248	19355583	120	30	1.0000	DISCARD	gen=720 glyphs=4
2026-03-14T03:26:21.632555	71e2ba66	116	29	1.0000	DISCARD	gen=676 glyphs=4
2026-03-14T03:26:21.920807	f00168bf	120	30	0.9500	DISCARD	gen=720 glyphs=4
2026-03-14T03:26:24.355725	55d6c151	120	30	1.0000	DISCARD	gen=676 glyphs=4
2026-03-14T03:26:24.631114	d7c8681b	120	30	1.0000	DISCARD	gen=720 glyphs=4
2026-03-14T03:26:27.054500	37f4017b	116	29	1.0000	DISCARD	gen=677 glyphs=4
2026-03-14T03:26:27.325896	050862ad	120	30	1.0000	DISCARD	gen=720 glyphs=4
2026-03-14T03:26:29.747293	bfdf7cad	120	30	1.0000	DISCARD	gen=677 glyphs=4
2026-03-14T03:26:30.016427	19355583	120	30	1.0000	DISCARD	gen=721 glyphs=4
2026-03-14T03:26:32.474950	55d6c151	120	30	1.0000	DISCARD	gen=677 glyphs=4
2026-03-14T03:26:32.755770	8aef8872	116	29	1.0000	DISCARD	gen=721 glyphs=4
2026-03-14T03:26:35.175472	12b38c2d	116	29	1.0000	DISCARD	gen=677 glyphs=4
2026-03-14T03:26:35.443531	1e5f0e21	116	29	1.0000	DISCARD	gen=721 glyphs=4
2026-03-14T03:26:37.888827	2701cb73	116	29	1.0000	DISCARD	gen=677 glyphs=4
2026-03-14T03:26:38.158410	292dd633	116	29	1.0000	DISCARD	gen=721 glyphs=4
2026-03-14T03:26:40.586964	5a06ca32	120	30	1.0000	DISCARD	gen=677 glyphs=4
2026-03-14T03:26:40.856695	9ed65b57	120	30	1.0000	DISCARD	gen=721 glyphs=4
2026-03-14T03:26:43.256171	37f4017b	116	29	1.0000	DISCARD	gen=677 glyphs=4
2026-03-14T03:26:43.525408	b57e7176	120	30	1.0000	DISCARD	gen=721 glyphs=4
2026-03-14T03:26:45.946394	37f4017b	116	29	1.0000	DISCARD	gen=677 glyphs=4
2026-03-14T03:26:46.210502	67cb81be	120	30	1.0000	DISCARD	gen=721 glyphs=4
2026-03-14T03:26:48.642147	37f4017b	116	29	1.0000	DISCARD	gen=677 glyphs=4
2026-03-14T03:26:48.904415	e8c7f6cf	120	30	1.0000	DISCARD	gen=721 glyphs=4
2026-03-14T03:26:51.307388	8d295a6a	116	29	1.0000	DISCARD	gen=677 glyphs=4
2026-03-14T03:26:51.573552	1fdc818b	116	29	1.0000	DISCARD	gen=721 glyphs=4
2026-03-14T03:26:54.147260	37f4017b	116	29	1.0000	DISCARD	gen=678 glyphs=4
2026-03-14T03:26:54.424478	ff1bf5a7	120	30	1.0000	DISCARD	gen=721 glyphs=4
2026-03-14T03:26:56.842430	bfdf7cad	120	30	1.0000	DISCARD	gen=678 glyphs=4
2026-03-14T03:26:57.129046	19355583	120	30	1.0000	DISCARD	gen=722 glyphs=4
2026-03-14T03:26:59.536004	216ef8bd	120	30	1.0000	DISCARD	gen=678 glyphs=4
2026-03-14T03:26:59.799377	8aef8872	116	29	1.0000	DISCARD	gen=722 glyphs=4
2026-03-14T03:27:02.213468	1414e31f	116	29	1.0000	DISCARD	gen=678 glyphs=4
2026-03-14T03:27:02.491478	e8c7f6cf	120	30	1.0000	DISCARD	gen=722 glyphs=4
2026-03-14T03:27:04.900327	55d6c151	120	30	1.0000	DISCARD	gen=678 glyphs=4
2026-03-14T03:27:05.167451	19355583	120	30	1.0000	DISCARD	gen=722 glyphs=4
2026-03-14T03:27:07.612239	5a06ca32	120	30	1.0000	DISCARD	gen=678 glyphs=4
2026-03-14T03:27:07.880841	19355583	120	30	1.0000	DISCARD	gen=722 glyphs=4
2026-03-14T03:27:10.303682	12b38c2d	116	29	1.0000	DISCARD	gen=678 glyphs=4
2026-03-14T03:27:10.571837	8aef8872	116	29	1.0000	DISCARD	gen=722 glyphs=4
2026-03-14T03:27:13.001384	71e2ba66	116	29	1.0000	DISCARD	gen=678 glyphs=4
2026-03-14T03:27:13.267247	050862ad	120	30	1.0000	DISCARD	gen=722 glyphs=4
2026-03-14T03:27:15.678421	2701cb73	116	29	1.0000	DISCARD	gen=678 glyphs=4
2026-03-14T03:27:15.937749	ae44ace5	116	29	1.0000	DISCARD	gen=722 glyphs=4
2026-03-14T03:27:18.340453	bfdf7cad	120	30	1.0000	DISCARD	gen=678 glyphs=4
2026-03-14T03:27:18.604328	7610f5cf	116	29	1.0000	DISCARD	gen=722 glyphs=4
2026-03-14T03:27:21.024595	37f4017b	116	29	1.0000	DISCARD	gen=679 glyphs=4
2026-03-14T03:27:21.291682	875e0f8a	116	29	1.0000	DISCARD	gen=722 glyphs=4
2026-03-14T03:27:23.706964	bfdf7cad	120	30	1.0000	DISCARD	gen=679 glyphs=4
2026-03-14T03:27:23.968757	19355583	120	30	1.0000	DISCARD	gen=723 glyphs=4
2026-03-14T03:27:26.464193	55d6c151	120	30	1.0000	DISCARD	gen=679 glyphs=4
2026-03-14T03:27:26.726353	8aef8872	116	29	1.0000	DISCARD	gen=723 glyphs=4
2026-03-14T03:27:29.173421	37f4017b	116	29	1.0000	DISCARD	gen=679 glyphs=4
2026-03-14T03:27:29.443554	050862ad	120	30	1.0000	DISCARD	gen=723 glyphs=4
2026-03-14T03:27:31.864461	3cb06380	120	30	1.0000	DISCARD	gen=679 glyphs=4
2026-03-14T03:27:32.144097	d7c8681b	120	30	1.0000	DISCARD	gen=723 glyphs=4
2026-03-14T03:27:34.580572	5a06ca32	120	30	1.0000	DISCARD	gen=679 glyphs=4
2026-03-14T03:27:34.849970	050862ad	120	30	1.0000	DISCARD	gen=723 glyphs=4
2026-03-14T03:27:37.283479	37f4017b	116	29	1.0000	DISCARD	gen=679 glyphs=4
2026-03-14T03:27:37.562404	b57e7176	120	30	1.0000	DISCARD	gen=723 glyphs=4
2026-03-14T03:27:39.993307	7ca87b42	116	29	1.0000	DISCARD	gen=679 glyphs=4
2026-03-14T03:27:40.251036	8aef8872	116	29	1.0000	DISCARD	gen=723 glyphs=4
2026-03-14T03:27:42.664199	2701cb73	116	29	1.0000	DISCARD	gen=679 glyphs=4
2026-03-14T03:27:42.930649	a78f9454	120	30	1.0000	DISCARD	gen=723 glyphs=4
2026-03-14T03:27:45.356348	1d34459a	116	29	1.0000	DISCARD	gen=679 glyphs=4
2026-03-14T03:27:45.618124	9e34ede0	116	29	1.0000	DISCARD	gen=723 glyphs=4
2026-03-14T03:27:48.053998	37f4017b	116	29	1.0000	DISCARD	gen=680 glyphs=4
2026-03-14T03:27:48.327550	78b0540b	120	30	1.0000	DISCARD	gen=723 glyphs=4
2026-03-14T03:27:50.746314	bfdf7cad	120	30	1.0000	DISCARD	gen=680 glyphs=4
2026-03-14T03:27:51.011682	19355583	120	30	1.0000	DISCARD	gen=724 glyphs=4
2026-03-14T03:27:53.414138	cad8c5e9	116	29	1.0000	DISCARD	gen=680 glyphs=4
2026-03-14T03:27:53.681605	8aef8872	116	29	1.0000	DISCARD	gen=724 glyphs=4
