timestamp	program_hash	spirv_size	word_count	fitness	status	description
2026-03-14T07:36:45.343962	099964a4	0	0	0.0000	CRASH	gen=639 glyphs=4
2026-03-14T07:36:45.344156	099964a4	0	0	0.0000	CRASH	gen=639 glyphs=4
2026-03-14T07:36:45.344349	f418354b	0	0	0.0000	CRASH	gen=639 glyphs=3
2026-03-14T07:36:45.344553	dcb1fb50	0	0	0.0000	CRASH	gen=639 glyphs=4
2026-03-14T07:36:45.344750	099964a4	0	0	0.0000	CRASH	gen=639 glyphs=4
2026-03-14T07:36:45.344943	099964a4	0	0	0.0000	CRASH	gen=639 glyphs=4
2026-03-14T07:36:45.345137	dcb1fb50	0	0	0.0000	CRASH	gen=639 glyphs=4
2026-03-14T07:36:45.345332	cf93b656	0	0	0.0000	CRASH	gen=639 glyphs=3
2026-03-14T07:36:45.345530	af418026	0	0	0.0000	CRASH	gen=639 glyphs=4
2026-03-14T07:36:45.345723	7ede4765	0	0	0.0000	CRASH	gen=639 glyphs=2
2026-03-14T07:36:45.345997	099964a4	0	0	0.0000	CRASH	gen=640 glyphs=4
2026-03-14T07:36:45.346189	099964a4	0	0	0.0000	CRASH	gen=640 glyphs=4
2026-03-14T07:36:45.346386	e545abe0	0	0	0.0000	CRASH	gen=640 glyphs=3
2026-03-14T07:36:45.346581	099964a4	0	0	0.0000	CRASH	gen=640 glyphs=4
2026-03-14T07:36:45.346775	099964a4	0	0	0.0000	CRASH	gen=640 glyphs=4
2026-03-14T07:36:45.346974	099964a4	0	0	0.0000	CRASH	gen=640 glyphs=4
2026-03-14T07:36:45.347167	099964a4	0	0	0.0000	CRASH	gen=640 glyphs=4
2026-03-14T07:36:45.347359	099964a4	0	0	0.0000	CRASH	gen=640 glyphs=4
2026-03-14T07:36:45.347553	7ede4765	0	0	0.0000	CRASH	gen=640 glyphs=2
2026-03-14T07:36:45.347745	099964a4	0	0	0.0000	CRASH	gen=640 glyphs=4
2026-03-14T07:36:45.348032	099964a4	0	0	0.0000	CRASH	gen=641 glyphs=4
2026-03-14T07:36:45.348225	099964a4	0	0	0.0000	CRASH	gen=641 glyphs=4
2026-03-14T07:36:45.348420	099964a4	0	0	0.0000	CRASH	gen=641 glyphs=4
2026-03-14T07:36:45.348616	8da1f8d8	0	0	0.0000	CRASH	gen=641 glyphs=4
2026-03-14T07:36:45.348812	099964a4	0	0	0.0000	CRASH	gen=641 glyphs=4
2026-03-14T07:36:45.349007	099964a4	0	0	0.0000	CRASH	gen=641 glyphs=4
2026-03-14T07:36:45.349200	cf93b656	0	0	0.0000	CRASH	gen=641 glyphs=3
2026-03-14T07:36:45.349391	099964a4	0	0	0.0000	CRASH	gen=641 glyphs=4
2026-03-14T07:36:45.349588	b6ed275b	0	0	0.0000	CRASH	gen=641 glyphs=4
2026-03-14T07:36:45.349782	013be642	0	0	0.0000	CRASH	gen=641 glyphs=3
2026-03-14T07:36:45.350064	099964a4	0	0	0.0000	CRASH	gen=642 glyphs=4
2026-03-14T07:36:45.350259	099964a4	0	0	0.0000	CRASH	gen=642 glyphs=4
2026-03-14T07:36:45.350453	099964a4	0	0	0.0000	CRASH	gen=642 glyphs=4
2026-03-14T07:36:45.350647	8da1f8d8	0	0	0.0000	CRASH	gen=642 glyphs=4
2026-03-14T07:36:45.350843	2385de97	0	0	0.0000	CRASH	gen=642 glyphs=4
2026-03-14T07:36:45.351038	80cef82b	0	0	0.0000	CRASH	gen=642 glyphs=4
2026-03-14T07:36:45.351247	35994fde	0	0	0.0000	CRASH	gen=642 glyphs=3
2026-03-14T07:36:45.351443	3ca14993	0	0	0.0000	CRASH	gen=642 glyphs=4
2026-03-14T07:36:45.351645	74728be1	0	0	0.0000	CRASH	gen=642 glyphs=4
2026-03-14T07:36:45.351843	099964a4	0	0	0.0000	CRASH	gen=642 glyphs=4
2026-03-14T07:36:45.352115	099964a4	0	0	0.0000	CRASH	gen=643 glyphs=4
2026-03-14T07:36:45.352311	099964a4	0	0	0.0000	CRASH	gen=643 glyphs=4
2026-03-14T07:36:45.352505	099964a4	0	0	0.0000	CRASH	gen=643 glyphs=4
2026-03-14T07:36:45.352700	099964a4	0	0	0.0000	CRASH	gen=643 glyphs=4
2026-03-14T07:36:45.352893	cf93b656	0	0	0.0000	CRASH	gen=643 glyphs=3
2026-03-14T07:36:45.353086	80cef82b	0	0	0.0000	CRASH	gen=643 glyphs=4
2026-03-14T07:36:45.353282	099964a4	0	0	0.0000	CRASH	gen=643 glyphs=4
2026-03-14T07:36:45.353476	099964a4	0	0	0.0000	CRASH	gen=643 glyphs=4
2026-03-14T07:36:45.353673	099964a4	0	0	0.0000	CRASH	gen=643 glyphs=4
2026-03-14T07:36:45.353867	099964a4	0	0	0.0000	CRASH	gen=643 glyphs=4
2026-03-14T07:36:45.354147	099964a4	0	0	0.0000	CRASH	gen=644 glyphs=4
2026-03-14T07:36:45.354344	099964a4	0	0	0.0000	CRASH	gen=644 glyphs=4
2026-03-14T07:36:45.354551	739ec30e	0	0	0.0000	CRASH	gen=644 glyphs=3
2026-03-14T07:36:45.354749	59e556f5	0	0	0.0000	CRASH	gen=644 glyphs=4
2026-03-14T07:36:45.354949	099964a4	0	0	0.0000	CRASH	gen=644 glyphs=4
2026-03-14T07:36:45.355142	51b2f248	0	0	0.0000	CRASH	gen=644 glyphs=4
2026-03-14T07:36:45.355341	099964a4	0	0	0.0000	CRASH	gen=644 glyphs=4
2026-03-14T07:36:45.355547	099964a4	0	0	0.0000	CRASH	gen=644 glyphs=4
2026-03-14T07:36:45.355745	099964a4	0	0	0.0000	CRASH	gen=644 glyphs=4
2026-03-14T07:36:45.355948	099964a4	0	0	0.0000	CRASH	gen=644 glyphs=4
2026-03-14T07:36:45.356226	099964a4	0	0	0.0000	CRASH	gen=645 glyphs=4
2026-03-14T07:36:45.356422	099964a4	0	0	0.0000	CRASH	gen=645 glyphs=4
2026-03-14T07:36:45.356626	dcb1fb50	0	0	0.0000	CRASH	gen=645 glyphs=4
2026-03-14T07:36:45.356822	5901de6c	0	0	0.0000	CRASH	gen=645 glyphs=3
2026-03-14T07:36:45.357016	099964a4	0	0	0.0000	CRASH	gen=645 glyphs=4
2026-03-14T07:36:45.357208	099964a4	0	0	0.0000	CRASH	gen=645 glyphs=4
2026-03-14T07:36:45.357397	8da1f8d8	0	0	0.0000	CRASH	gen=645 glyphs=4
2026-03-14T07:36:45.357597	ed2dd7e2	0	0	0.0000	CRASH	gen=645 glyphs=4
2026-03-14T07:36:45.357791	099964a4	0	0	0.0000	CRASH	gen=645 glyphs=4
2026-03-14T07:36:45.357980	ff30496a	0	0	0.0000	CRASH	gen=645 glyphs=3
2026-03-14T07:36:45.358247	099964a4	0	0	0.0000	CRASH	gen=646 glyphs=4
2026-03-14T07:36:45.358441	099964a4	0	0	0.0000	CRASH	gen=646 glyphs=4
2026-03-14T07:36:45.358640	099964a4	0	0	0.0000	CRASH	gen=646 glyphs=4
2026-03-14T07:36:45.358835	099964a4	0	0	0.0000	CRASH	gen=646 glyphs=4
2026-03-14T07:36:45.359027	3d00ffea	0	0	0.0000	CRASH	gen=646 glyphs=3
2026-03-14T07:36:45.359224	ff30496a	0	0	0.0000	CRASH	gen=646 glyphs=3
2026-03-14T07:36:45.359418	d02f50d5	0	0	0.0000	CRASH	gen=646 glyphs=4
2026-03-14T07:36:45.359616	099964a4	0	0	0.0000	CRASH	gen=646 glyphs=4
2026-03-14T07:36:45.359814	099964a4	0	0	0.0000	CRASH	gen=646 glyphs=4
2026-03-14T07:36:45.360009	85af7aa6	0	0	0.0000	CRASH	gen=646 glyphs=4
2026-03-14T07:36:45.360289	099964a4	0	0	0.0000	CRASH	gen=647 glyphs=4
2026-03-14T07:36:45.360483	099964a4	0	0	0.0000	CRASH	gen=647 glyphs=4
2026-03-14T07:36:45.360683	758515f6	0	0	0.0000	CRASH	gen=647 glyphs=4
2026-03-14T07:36:45.360880	dcb1fb50	0	0	0.0000	CRASH	gen=647 glyphs=4
2026-03-14T07:36:45.361076	099964a4	0	0	0.0000	CRASH	gen=647 glyphs=4
2026-03-14T07:36:45.361270	099964a4	0	0	0.0000	CRASH	gen=647 glyphs=4
2026-03-14T07:36:45.361463	2e9d9b05	0	0	0.0000	CRASH	gen=647 glyphs=4
2026-03-14T07:36:45.361658	abbe1ffd	0	0	0.0000	CRASH	gen=647 glyphs=2
2026-03-14T07:36:45.361856	099964a4	0	0	0.0000	CRASH	gen=647 glyphs=4
2026-03-14T07:36:45.362045	099964a4	0	0	0.0000	CRASH	gen=647 glyphs=4
2026-03-14T07:36:45.362317	099964a4	0	0	0.0000	CRASH	gen=648 glyphs=4
2026-03-14T07:36:45.362512	099964a4	0	0	0.0000	CRASH	gen=648 glyphs=4
2026-03-14T07:36:45.362715	a9851b19	0	0	0.0000	CRASH	gen=648 glyphs=5
2026-03-14T07:36:45.362915	e6e925df	0	0	0.0000	CRASH	gen=648 glyphs=2
2026-03-14T07:36:45.363109	099964a4	0	0	0.0000	CRASH	gen=648 glyphs=4
2026-03-14T07:36:45.363301	a1aa9966	0	0	0.0000	CRASH	gen=648 glyphs=4
2026-03-14T07:36:45.363495	099964a4	0	0	0.0000	CRASH	gen=648 glyphs=4
2026-03-14T07:36:45.363690	099964a4	0	0	0.0000	CRASH	gen=648 glyphs=4
2026-03-14T07:36:45.363883	b7a69d47	0	0	0.0000	CRASH	gen=648 glyphs=4
2026-03-14T07:36:45.364082	79c4c19f	0	0	0.0000	CRASH	gen=648 glyphs=4
2026-03-14T07:36:45.364355	099964a4	0	0	0.0000	CRASH	gen=649 glyphs=4
2026-03-14T07:36:45.364551	099964a4	0	0	0.0000	CRASH	gen=649 glyphs=4
2026-03-14T07:36:45.364746	3ca14993	0	0	0.0000	CRASH	gen=649 glyphs=4
2026-03-14T07:36:45.364938	854f6b7e	0	0	0.0000	CRASH	gen=649 glyphs=4
2026-03-14T07:36:45.365135	c06cfd91	0	0	0.0000	CRASH	gen=649 glyphs=2
2026-03-14T07:36:45.365325	099964a4	0	0	0.0000	CRASH	gen=649 glyphs=4
2026-03-14T07:36:45.365520	099964a4	0	0	0.0000	CRASH	gen=649 glyphs=4
2026-03-14T07:36:45.365713	dcb1fb50	0	0	0.0000	CRASH	gen=649 glyphs=4
2026-03-14T07:36:45.365908	d5506dea	0	0	0.0000	CRASH	gen=649 glyphs=3
2026-03-14T07:36:45.366106	ff30496a	0	0	0.0000	CRASH	gen=649 glyphs=3
2026-03-14T07:36:45.366385	099964a4	0	0	0.0000	CRASH	gen=650 glyphs=4
2026-03-14T07:36:45.366583	099964a4	0	0	0.0000	CRASH	gen=650 glyphs=4
2026-03-14T07:36:45.366775	099964a4	0	0	0.0000	CRASH	gen=650 glyphs=4
2026-03-14T07:36:45.366968	823f5b24	0	0	0.0000	CRASH	gen=650 glyphs=4
2026-03-14T07:36:45.367166	099964a4	0	0	0.0000	CRASH	gen=650 glyphs=4
2026-03-14T07:36:45.367360	5a72936a	0	0	0.0000	CRASH	gen=650 glyphs=2
2026-03-14T07:36:45.367556	099964a4	0	0	0.0000	CRASH	gen=650 glyphs=4
2026-03-14T07:36:45.367749	099964a4	0	0	0.0000	CRASH	gen=650 glyphs=4
2026-03-14T07:36:45.367942	099964a4	0	0	0.0000	CRASH	gen=650 glyphs=4
2026-03-14T07:36:45.368133	e3937d39	0	0	0.0000	CRASH	gen=650 glyphs=4
2026-03-14T07:36:45.368405	099964a4	0	0	0.0000	CRASH	gen=651 glyphs=4
2026-03-14T07:36:45.368604	099964a4	0	0	0.0000	CRASH	gen=651 glyphs=4
2026-03-14T07:36:45.368800	099964a4	0	0	0.0000	CRASH	gen=651 glyphs=4
2026-03-14T07:36:45.368993	099964a4	0	0	0.0000	CRASH	gen=651 glyphs=4
2026-03-14T07:36:45.369191	099964a4	0	0	0.0000	CRASH	gen=651 glyphs=4
2026-03-14T07:36:45.369389	ce93ea13	0	0	0.0000	CRASH	gen=651 glyphs=4
2026-03-14T07:36:45.369588	dcb1fb50	0	0	0.0000	CRASH	gen=651 glyphs=4
2026-03-14T07:36:45.369786	099964a4	0	0	0.0000	CRASH	gen=651 glyphs=4
2026-03-14T07:36:45.369985	099964a4	0	0	0.0000	CRASH	gen=651 glyphs=4
2026-03-14T07:36:45.370187	099964a4	0	0	0.0000	CRASH	gen=651 glyphs=4
2026-03-14T07:36:45.370467	099964a4	0	0	0.0000	CRASH	gen=652 glyphs=4
2026-03-14T07:36:45.370664	099964a4	0	0	0.0000	CRASH	gen=652 glyphs=4
2026-03-14T07:36:45.370859	099964a4	0	0	0.0000	CRASH	gen=652 glyphs=4
2026-03-14T07:36:45.371052	8737d8f3	0	0	0.0000	CRASH	gen=652 glyphs=4
2026-03-14T07:36:45.371246	099964a4	0	0	0.0000	CRASH	gen=652 glyphs=4
2026-03-14T07:36:45.371442	099964a4	0	0	0.0000	CRASH	gen=652 glyphs=4
2026-03-14T07:36:45.371637	099964a4	0	0	0.0000	CRASH	gen=652 glyphs=4
2026-03-14T07:36:45.371831	099964a4	0	0	0.0000	CRASH	gen=652 glyphs=4
2026-03-14T07:36:45.372026	099964a4	0	0	0.0000	CRASH	gen=652 glyphs=4
2026-03-14T07:36:45.372220	099964a4	0	0	0.0000	CRASH	gen=652 glyphs=4
2026-03-14T07:36:45.372498	099964a4	0	0	0.0000	CRASH	gen=653 glyphs=4
2026-03-14T07:36:45.372697	099964a4	0	0	0.0000	CRASH	gen=653 glyphs=4
2026-03-14T07:36:45.372892	b3cacbcb	0	0	0.0000	CRASH	gen=653 glyphs=2
2026-03-14T07:36:45.373084	099964a4	0	0	0.0000	CRASH	gen=653 glyphs=4
2026-03-14T07:36:45.373276	dcb1fb50	0	0	0.0000	CRASH	gen=653 glyphs=4
2026-03-14T07:36:45.373478	c2026f5d	0	0	0.0000	CRASH	gen=653 glyphs=4
2026-03-14T07:36:45.373675	099964a4	0	0	0.0000	CRASH	gen=653 glyphs=4
2026-03-14T07:36:45.373871	099964a4	0	0	0.0000	CRASH	gen=653 glyphs=4
2026-03-14T07:36:45.374065	3ca14993	0	0	0.0000	CRASH	gen=653 glyphs=4
2026-03-14T07:36:45.374257	099964a4	0	0	0.0000	CRASH	gen=653 glyphs=4
2026-03-14T07:36:45.374548	099964a4	0	0	0.0000	CRASH	gen=654 glyphs=4
2026-03-14T07:36:45.374743	099964a4	0	0	0.0000	CRASH	gen=654 glyphs=4
2026-03-14T07:36:45.374936	8da1f8d8	0	0	0.0000	CRASH	gen=654 glyphs=4
2026-03-14T07:36:45.375131	099964a4	0	0	0.0000	CRASH	gen=654 glyphs=4
2026-03-14T07:36:45.375324	06c7b308	0	0	0.0000	CRASH	gen=654 glyphs=5
2026-03-14T07:36:45.375520	466d2d3b	0	0	0.0000	CRASH	gen=654 glyphs=3
2026-03-14T07:36:45.375717	8da1f8d8	0	0	0.0000	CRASH	gen=654 glyphs=4
2026-03-14T07:36:45.375909	cf93b656	0	0	0.0000	CRASH	gen=654 glyphs=3
2026-03-14T07:36:45.376103	54bc524a	0	0	0.0000	CRASH	gen=654 glyphs=3
2026-03-14T07:36:45.376297	099964a4	0	0	0.0000	CRASH	gen=654 glyphs=4
2026-03-14T07:36:45.376566	099964a4	0	0	0.0000	CRASH	gen=655 glyphs=4
2026-03-14T07:36:45.376763	099964a4	0	0	0.0000	CRASH	gen=655 glyphs=4
2026-03-14T07:36:45.376955	ec41e882	0	0	0.0000	CRASH	gen=655 glyphs=4
2026-03-14T07:36:45.377151	099964a4	0	0	0.0000	CRASH	gen=655 glyphs=4
2026-03-14T07:36:45.377343	099964a4	0	0	0.0000	CRASH	gen=655 glyphs=4
2026-03-14T07:36:45.377537	80cef82b	0	0	0.0000	CRASH	gen=655 glyphs=4
2026-03-14T07:36:45.377737	257dea60	0	0	0.0000	CRASH	gen=655 glyphs=3
2026-03-14T07:36:45.377929	dcb1fb50	0	0	0.0000	CRASH	gen=655 glyphs=4
2026-03-14T07:36:45.378121	099964a4	0	0	0.0000	CRASH	gen=655 glyphs=4
2026-03-14T07:36:45.378311	8da1f8d8	0	0	0.0000	CRASH	gen=655 glyphs=4
2026-03-14T07:36:45.378585	099964a4	0	0	0.0000	CRASH	gen=656 glyphs=4
2026-03-14T07:36:45.378784	099964a4	0	0	0.0000	CRASH	gen=656 glyphs=4
2026-03-14T07:36:45.378985	0230012b	0	0	0.0000	CRASH	gen=656 glyphs=3
2026-03-14T07:36:45.379180	dae12e9e	0	0	0.0000	CRASH	gen=656 glyphs=2
2026-03-14T07:36:45.379376	c53def1a	0	0	0.0000	CRASH	gen=656 glyphs=4
2026-03-14T07:36:45.379580	99b9f45e	0	0	0.0000	CRASH	gen=656 glyphs=1
2026-03-14T07:36:45.379775	ff30496a	0	0	0.0000	CRASH	gen=656 glyphs=3
2026-03-14T07:36:45.379970	737bf5b0	0	0	0.0000	CRASH	gen=656 glyphs=3
2026-03-14T07:36:45.380168	099964a4	0	0	0.0000	CRASH	gen=656 glyphs=4
2026-03-14T07:36:45.380360	099964a4	0	0	0.0000	CRASH	gen=656 glyphs=4
2026-03-14T07:36:45.380638	099964a4	0	0	0.0000	CRASH	gen=657 glyphs=4
2026-03-14T07:36:45.380835	099964a4	0	0	0.0000	CRASH	gen=657 glyphs=4
2026-03-14T07:36:45.381027	099964a4	0	0	0.0000	CRASH	gen=657 glyphs=4
2026-03-14T07:36:45.381224	099964a4	0	0	0.0000	CRASH	gen=657 glyphs=4
2026-03-14T07:36:45.381420	3c335efd	0	0	0.0000	CRASH	gen=657 glyphs=3
2026-03-14T07:36:45.381614	6fd83f60	0	0	0.0000	CRASH	gen=657 glyphs=3
2026-03-14T07:36:45.381807	3a734398	0	0	0.0000	CRASH	gen=657 glyphs=4
2026-03-14T07:36:45.382005	099964a4	0	0	0.0000	CRASH	gen=657 glyphs=4
2026-03-14T07:36:45.382200	099964a4	0	0	0.0000	CRASH	gen=657 glyphs=4
2026-03-14T07:36:45.382390	099964a4	0	0	0.0000	CRASH	gen=657 glyphs=4
2026-03-14T07:36:45.382675	099964a4	0	0	0.0000	CRASH	gen=658 glyphs=4
2026-03-14T07:36:45.382868	099964a4	0	0	0.0000	CRASH	gen=658 glyphs=4
2026-03-14T07:36:45.383065	053a8dab	0	0	0.0000	CRASH	gen=658 glyphs=4
2026-03-14T07:36:45.383260	099964a4	0	0	0.0000	CRASH	gen=658 glyphs=4
2026-03-14T07:36:45.383451	3a240618	0	0	0.0000	CRASH	gen=658 glyphs=3
2026-03-14T07:36:45.383644	5051e6c2	0	0	0.0000	CRASH	gen=658 glyphs=3
2026-03-14T07:36:45.383835	099964a4	0	0	0.0000	CRASH	gen=658 glyphs=4
2026-03-14T07:36:45.384032	099964a4	0	0	0.0000	CRASH	gen=658 glyphs=4
2026-03-14T07:36:45.384226	8da1f8d8	0	0	0.0000	CRASH	gen=658 glyphs=4
2026-03-14T07:36:45.384423	099964a4	0	0	0.0000	CRASH	gen=658 glyphs=4
2026-03-14T07:36:45.384693	099964a4	0	0	0.0000	CRASH	gen=659 glyphs=4
2026-03-14T07:36:45.384887	099964a4	0	0	0.0000	CRASH	gen=659 glyphs=4
2026-03-14T07:36:45.385084	02b00df7	0	0	0.0000	CRASH	gen=659 glyphs=4
2026-03-14T07:36:45.385277	099964a4	0	0	0.0000	CRASH	gen=659 glyphs=4
2026-03-14T07:36:45.385472	abb3cf0d	0	0	0.0000	CRASH	gen=659 glyphs=4
2026-03-14T07:36:45.385670	099964a4	0	0	0.0000	CRASH	gen=659 glyphs=4
2026-03-14T07:36:45.385863	a986b8fb	0	0	0.0000	CRASH	gen=659 glyphs=4
2026-03-14T07:36:45.386058	7ede4765	0	0	0.0000	CRASH	gen=659 glyphs=2
2026-03-14T07:36:45.386254	cf93b656	0	0	0.0000	CRASH	gen=659 glyphs=3
2026-03-14T07:36:45.386446	cf064c9e	0	0	0.0000	CRASH	gen=659 glyphs=4
2026-03-14T07:36:45.386722	099964a4	0	0	0.0000	CRASH	gen=660 glyphs=4
2026-03-14T07:36:45.386917	099964a4	0	0	0.0000	CRASH	gen=660 glyphs=4
2026-03-14T07:36:45.387112	02a88407	0	0	0.0000	CRASH	gen=660 glyphs=4
2026-03-14T07:36:45.387309	099964a4	0	0	0.0000	CRASH	gen=660 glyphs=4
2026-03-14T07:36:45.387501	8da1f8d8	0	0	0.0000	CRASH	gen=660 glyphs=4
2026-03-14T07:36:45.387697	099964a4	0	0	0.0000	CRASH	gen=660 glyphs=4
2026-03-14T07:36:45.387888	80cef82b	0	0	0.0000	CRASH	gen=660 glyphs=4
2026-03-14T07:36:45.388082	ff30496a	0	0	0.0000	CRASH	gen=660 glyphs=3
2026-03-14T07:36:45.388281	5e0f916e	0	0	0.0000	CRASH	gen=660 glyphs=4
2026-03-14T07:36:45.388475	b6bfe648	0	0	0.0000	CRASH	gen=660 glyphs=4
2026-03-14T07:36:45.388758	099964a4	0	0	0.0000	CRASH	gen=661 glyphs=4
2026-03-14T07:36:45.388953	099964a4	0	0	0.0000	CRASH	gen=661 glyphs=4
2026-03-14T07:36:45.389144	9fadc223	0	0	0.0000	CRASH	gen=661 glyphs=4
2026-03-14T07:36:45.389352	099964a4	0	0	0.0000	CRASH	gen=661 glyphs=4
2026-03-14T07:36:45.389545	bacec048	0	0	0.0000	CRASH	gen=661 glyphs=4
2026-03-14T07:36:45.389738	099964a4	0	0	0.0000	CRASH	gen=661 glyphs=4
2026-03-14T07:36:45.389927	cf93b656	0	0	0.0000	CRASH	gen=661 glyphs=3
2026-03-14T07:36:45.390117	099964a4	0	0	0.0000	CRASH	gen=661 glyphs=4
2026-03-14T07:36:45.390308	099964a4	0	0	0.0000	CRASH	gen=661 glyphs=4
2026-03-14T07:36:45.390500	ff30496a	0	0	0.0000	CRASH	gen=661 glyphs=3
2026-03-14T07:36:45.390766	099964a4	0	0	0.0000	CRASH	gen=662 glyphs=4
2026-03-14T07:36:45.390961	099964a4	0	0	0.0000	CRASH	gen=662 glyphs=4
2026-03-14T07:36:45.391156	ff30496a	0	0	0.0000	CRASH	gen=662 glyphs=3
2026-03-14T07:36:45.391348	099964a4	0	0	0.0000	CRASH	gen=662 glyphs=4
2026-03-14T07:36:45.391547	099964a4	0	0	0.0000	CRASH	gen=662 glyphs=4
2026-03-14T07:36:45.391738	7ede4765	0	0	0.0000	CRASH	gen=662 glyphs=2
2026-03-14T07:36:45.391930	405de11f	0	0	0.0000	CRASH	gen=662 glyphs=3
2026-03-14T07:36:45.392122	9f074a7b	0	0	0.0000	CRASH	gen=662 glyphs=2
2026-03-14T07:36:45.392316	099964a4	0	0	0.0000	CRASH	gen=662 glyphs=4
2026-03-14T07:36:45.392507	099964a4	0	0	0.0000	CRASH	gen=662 glyphs=4
2026-03-14T07:36:45.392782	099964a4	0	0	0.0000	CRASH	gen=663 glyphs=4
2026-03-14T07:36:45.392977	099964a4	0	0	0.0000	CRASH	gen=663 glyphs=4
2026-03-14T07:36:45.393169	099964a4	0	0	0.0000	CRASH	gen=663 glyphs=4
2026-03-14T07:36:45.393359	099964a4	0	0	0.0000	CRASH	gen=663 glyphs=4
2026-03-14T07:36:45.393552	099964a4	0	0	0.0000	CRASH	gen=663 glyphs=4
2026-03-14T07:36:45.393749	80cef82b	0	0	0.0000	CRASH	gen=663 glyphs=4
2026-03-14T07:36:45.393943	099964a4	0	0	0.0000	CRASH	gen=663 glyphs=4
2026-03-14T07:36:45.394133	ff30496a	0	0	0.0000	CRASH	gen=663 glyphs=3
2026-03-14T07:36:45.394325	3a734398	0	0	0.0000	CRASH	gen=663 glyphs=4
2026-03-14T07:36:45.394515	98503284	0	0	0.0000	CRASH	gen=663 glyphs=3
2026-03-14T07:36:45.394793	099964a4	0	0	0.0000	CRASH	gen=664 glyphs=4
2026-03-14T07:36:45.394990	099964a4	0	0	0.0000	CRASH	gen=664 glyphs=4
2026-03-14T07:36:45.395183	099964a4	0	0	0.0000	CRASH	gen=664 glyphs=4
2026-03-14T07:36:45.395376	0560a097	0	0	0.0000	CRASH	gen=664 glyphs=4
2026-03-14T07:36:45.395571	099964a4	0	0	0.0000	CRASH	gen=664 glyphs=4
2026-03-14T07:36:45.395767	7ede4765	0	0	0.0000	CRASH	gen=664 glyphs=2
2026-03-14T07:36:45.395960	76de324c	0	0	0.0000	CRASH	gen=664 glyphs=4
2026-03-14T07:36:45.396158	489b56d0	0	0	0.0000	CRASH	gen=664 glyphs=4
2026-03-14T07:36:45.396353	5697002a	0	0	0.0000	CRASH	gen=664 glyphs=3
2026-03-14T07:36:45.396548	099964a4	0	0	0.0000	CRASH	gen=664 glyphs=4
2026-03-14T07:36:45.396826	099964a4	0	0	0.0000	CRASH	gen=665 glyphs=4
2026-03-14T07:36:45.397024	099964a4	0	0	0.0000	CRASH	gen=665 glyphs=4
2026-03-14T07:36:45.397218	099964a4	0	0	0.0000	CRASH	gen=665 glyphs=4
2026-03-14T07:36:45.397410	099964a4	0	0	0.0000	CRASH	gen=665 glyphs=4
2026-03-14T07:36:45.397604	099964a4	0	0	0.0000	CRASH	gen=665 glyphs=4
2026-03-14T07:36:45.397798	dcb1fb50	0	0	0.0000	CRASH	gen=665 glyphs=4
2026-03-14T07:36:45.397996	099964a4	0	0	0.0000	CRASH	gen=665 glyphs=4
2026-03-14T07:36:45.398189	7aef26b9	0	0	0.0000	CRASH	gen=665 glyphs=4
2026-03-14T07:36:45.398384	c2361a9f	0	0	0.0000	CRASH	gen=665 glyphs=5
2026-03-14T07:36:45.398580	934ecf50	0	0	0.0000	CRASH	gen=665 glyphs=4
2026-03-14T07:36:45.398852	099964a4	0	0	0.0000	CRASH	gen=666 glyphs=4
2026-03-14T07:36:45.399052	099964a4	0	0	0.0000	CRASH	gen=666 glyphs=4
2026-03-14T07:36:45.399246	44604e8e	0	0	0.0000	CRASH	gen=666 glyphs=3
2026-03-14T07:36:45.399441	d1b514b0	0	0	0.0000	CRASH	gen=666 glyphs=4
2026-03-14T07:36:45.399640	340d383a	0	0	0.0000	CRASH	gen=666 glyphs=2
2026-03-14T07:36:45.399833	3ae7a650	0	0	0.0000	CRASH	gen=666 glyphs=4
2026-03-14T07:36:45.400030	3534b1cf	0	0	0.0000	CRASH	gen=666 glyphs=3
2026-03-14T07:36:45.400223	6b5c0b5a	0	0	0.0000	CRASH	gen=666 glyphs=3
2026-03-14T07:36:45.400419	d995802a	0	0	0.0000	CRASH	gen=666 glyphs=3
2026-03-14T07:36:45.400614	099964a4	0	0	0.0000	CRASH	gen=666 glyphs=4
2026-03-14T07:36:45.400884	099964a4	0	0	0.0000	CRASH	gen=667 glyphs=4
2026-03-14T07:36:45.401081	099964a4	0	0	0.0000	CRASH	gen=667 glyphs=4
2026-03-14T07:36:45.401274	099964a4	0	0	0.0000	CRASH	gen=667 glyphs=4
2026-03-14T07:36:45.401465	9897944a	0	0	0.0000	CRASH	gen=667 glyphs=4
2026-03-14T07:36:45.401660	099964a4	0	0	0.0000	CRASH	gen=667 glyphs=4
2026-03-14T07:36:45.401849	099964a4	0	0	0.0000	CRASH	gen=667 glyphs=4
2026-03-14T07:36:45.402038	84d9a089	0	0	0.0000	CRASH	gen=667 glyphs=4
2026-03-14T07:36:45.402238	099964a4	0	0	0.0000	CRASH	gen=667 glyphs=4
2026-03-14T07:36:45.402429	b2a12ae0	0	0	0.0000	CRASH	gen=667 glyphs=4
2026-03-14T07:36:45.402622	099964a4	0	0	0.0000	CRASH	gen=667 glyphs=4
2026-03-14T07:36:45.402884	099964a4	0	0	0.0000	CRASH	gen=668 glyphs=4
2026-03-14T07:36:45.403076	099964a4	0	0	0.0000	CRASH	gen=668 glyphs=4
2026-03-14T07:36:45.403270	3ca14993	0	0	0.0000	CRASH	gen=668 glyphs=4
2026-03-14T07:36:45.403462	80cef82b	0	0	0.0000	CRASH	gen=668 glyphs=4
2026-03-14T07:36:45.403656	099964a4	0	0	0.0000	CRASH	gen=668 glyphs=4
2026-03-14T07:36:45.403853	0eadd0ef	0	0	0.0000	CRASH	gen=668 glyphs=4
2026-03-14T07:36:45.404046	22a4d71b	0	0	0.0000	CRASH	gen=668 glyphs=4
2026-03-14T07:36:45.404237	3ca14993	0	0	0.0000	CRASH	gen=668 glyphs=4
2026-03-14T07:36:45.404429	80cef82b	0	0	0.0000	CRASH	gen=668 glyphs=4
2026-03-14T07:36:45.404626	099964a4	0	0	0.0000	CRASH	gen=668 glyphs=4
2026-03-14T07:36:45.404901	099964a4	0	0	0.0000	CRASH	gen=669 glyphs=4
2026-03-14T07:36:45.405092	099964a4	0	0	0.0000	CRASH	gen=669 glyphs=4
2026-03-14T07:36:45.405286	099964a4	0	0	0.0000	CRASH	gen=669 glyphs=4
2026-03-14T07:36:45.405479	a97d3845	0	0	0.0000	CRASH	gen=669 glyphs=1
2026-03-14T07:36:45.405673	099964a4	0	0	0.0000	CRASH	gen=669 glyphs=4
2026-03-14T07:36:45.405865	3a734398	0	0	0.0000	CRASH	gen=669 glyphs=4
2026-03-14T07:36:45.406057	099964a4	0	0	0.0000	CRASH	gen=669 glyphs=4
2026-03-14T07:36:45.406249	099964a4	0	0	0.0000	CRASH	gen=669 glyphs=4
2026-03-14T07:36:45.406450	099964a4	0	0	0.0000	CRASH	gen=669 glyphs=4
2026-03-14T07:36:45.406647	099964a4	0	0	0.0000	CRASH	gen=669 glyphs=4
2026-03-14T07:36:45.406929	099964a4	0	0	0.0000	CRASH	gen=670 glyphs=4
2026-03-14T07:36:45.407126	099964a4	0	0	0.0000	CRASH	gen=670 glyphs=4
2026-03-14T07:36:45.407323	099964a4	0	0	0.0000	CRASH	gen=670 glyphs=4
