timestamp	program_hash	spirv_size	word_count	fitness	status	description
2026-03-14T02:08:16.706620	bfdf7cad	120	30	1.0000	DISCARD	gen=505 glyphs=4
2026-03-14T02:08:16.989067	19355583	120	30	1.0000	DISCARD	gen=549 glyphs=4
2026-03-14T02:08:19.468844	7ca87b42	116	29	1.0000	DISCARD	gen=505 glyphs=4
2026-03-14T02:08:19.745564	8aef8872	116	29	1.0000	DISCARD	gen=549 glyphs=4
2026-03-14T02:08:22.169035	d2d27704	116	29	1.0000	DISCARD	gen=505 glyphs=4
2026-03-14T02:08:22.440500	0eaedb57	116	29	1.0000	DISCARD	gen=549 glyphs=4
2026-03-14T02:08:24.932026	55d6c151	120	30	1.0000	DISCARD	gen=505 glyphs=4
2026-03-14T02:08:25.197793	e2cd28ea	120	30	1.0000	DISCARD	gen=549 glyphs=4
2026-03-14T02:08:27.704628	7a3deba1	120	30	1.0000	DISCARD	gen=505 glyphs=4
2026-03-14T02:08:27.973294	8585ed3d	116	29	0.9500	DISCARD	gen=549 glyphs=4
2026-03-14T02:08:30.446079	d1aa56fe	124	31	0.9500	DISCARD	gen=505 glyphs=4
2026-03-14T02:08:30.724291	42790c95	120	30	1.0000	DISCARD	gen=549 glyphs=4
2026-03-14T02:08:33.198762	71e2ba66	116	29	1.0000	DISCARD	gen=505 glyphs=4
2026-03-14T02:08:33.474947	c0e12361	116	29	1.0000	DISCARD	gen=549 glyphs=4
2026-03-14T02:08:35.933711	4c9b0dd4	120	30	1.0000	DISCARD	gen=505 glyphs=4
2026-03-14T02:08:36.198362	050862ad	120	30	1.0000	DISCARD	gen=549 glyphs=4
2026-03-14T02:08:38.674019	37f4017b	116	29	1.0000	DISCARD	gen=505 glyphs=4
2026-03-14T02:08:38.950695	8aef8872	116	29	1.0000	DISCARD	gen=549 glyphs=4
2026-03-14T02:08:41.394233	37f4017b	116	29	1.0000	DISCARD	gen=506 glyphs=4
2026-03-14T02:08:41.669556	e2cd28ea	120	30	1.0000	DISCARD	gen=549 glyphs=4
2026-03-14T02:08:44.147655	bfdf7cad	120	30	1.0000	DISCARD	gen=506 glyphs=4
2026-03-14T02:08:44.415883	19355583	120	30	1.0000	DISCARD	gen=550 glyphs=4
2026-03-14T02:08:46.866900	fdb5d108	120	30	1.0000	DISCARD	gen=506 glyphs=4
2026-03-14T02:08:47.140605	8aef8872	116	29	1.0000	DISCARD	gen=550 glyphs=4
2026-03-14T02:08:49.599390	5a06ca32	120	30	1.0000	DISCARD	gen=506 glyphs=4
2026-03-14T02:08:49.872644	e8c7f6cf	120	30	1.0000	DISCARD	gen=550 glyphs=4
2026-03-14T02:08:52.326943	55d6c151	120	30	1.0000	DISCARD	gen=506 glyphs=4
2026-03-14T02:08:52.609461	0eaedb57	116	29	1.0000	DISCARD	gen=550 glyphs=4
2026-03-14T02:08:55.059246	a2b69c20	116	29	1.0000	DISCARD	gen=506 glyphs=4
2026-03-14T02:08:55.333550	050862ad	120	30	1.0000	DISCARD	gen=550 glyphs=4
2026-03-14T02:08:57.804051	37f4017b	116	29	1.0000	DISCARD	gen=506 glyphs=4
2026-03-14T02:08:58.066823	bbee5151	116	29	1.0000	DISCARD	gen=550 glyphs=4
2026-03-14T02:09:00.574034	bbe74bad	116	29	1.0000	DISCARD	gen=506 glyphs=4
2026-03-14T02:09:00.863994	0eaedb57	116	29	1.0000	DISCARD	gen=550 glyphs=4
2026-03-14T02:09:03.335533	311dc862	120	30	1.0000	DISCARD	gen=506 glyphs=4
2026-03-14T02:09:03.607050	d7c8681b	120	30	1.0000	DISCARD	gen=550 glyphs=4
2026-03-14T02:09:06.057712	55d6c151	120	30	1.0000	DISCARD	gen=506 glyphs=4
2026-03-14T02:09:06.328356	cd1f7045	120	30	1.0000	DISCARD	gen=550 glyphs=4
2026-03-14T02:09:08.832671	37f4017b	116	29	1.0000	DISCARD	gen=507 glyphs=4
2026-03-14T02:09:09.110886	19355583	120	30	1.0000	DISCARD	gen=550 glyphs=4
2026-03-14T02:09:11.609145	bfdf7cad	120	30	1.0000	DISCARD	gen=507 glyphs=4
2026-03-14T02:09:11.876032	19355583	120	30	1.0000	DISCARD	gen=551 glyphs=4
2026-03-14T02:09:14.375378	55d6c151	120	30	1.0000	DISCARD	gen=507 glyphs=4
2026-03-14T02:09:14.638813	8aef8872	116	29	1.0000	DISCARD	gen=551 glyphs=4
2026-03-14T02:09:17.105746	55d6c151	120	30	1.0000	DISCARD	gen=507 glyphs=4
2026-03-14T02:09:17.379923	9e34ede0	116	29	1.0000	DISCARD	gen=551 glyphs=4
2026-03-14T02:09:19.834808	5d34c719	116	29	0.9500	DISCARD	gen=507 glyphs=4
2026-03-14T02:09:20.114507	50dc991d	116	29	1.0000	DISCARD	gen=551 glyphs=4
2026-03-14T02:09:22.613077	37f4017b	116	29	1.0000	DISCARD	gen=507 glyphs=4
2026-03-14T02:09:22.894065	67cb81be	120	30	1.0000	DISCARD	gen=551 glyphs=4
2026-03-14T02:09:25.401726	aae90efb	120	30	1.0000	DISCARD	gen=507 glyphs=4
2026-03-14T02:09:25.668625	e2cd28ea	120	30	1.0000	DISCARD	gen=551 glyphs=4
2026-03-14T02:09:28.147254	4c9b0dd4	120	30	1.0000	DISCARD	gen=507 glyphs=4
2026-03-14T02:09:28.439454	0eaedb57	116	29	1.0000	DISCARD	gen=551 glyphs=4
2026-03-14T02:09:30.899242	5a06ca32	120	30	1.0000	DISCARD	gen=507 glyphs=4
2026-03-14T02:09:31.214965	9e34ede0	116	29	1.0000	DISCARD	gen=551 glyphs=4
2026-03-14T02:09:33.732753	672c39a4	116	29	1.0000	DISCARD	gen=507 glyphs=4
2026-03-14T02:09:34.023245	67cb81be	120	30	1.0000	DISCARD	gen=551 glyphs=4
2026-03-14T02:09:36.477766	37f4017b	116	29	1.0000	DISCARD	gen=508 glyphs=4
2026-03-14T02:09:36.753985	966a0f64	116	29	0.9500	DISCARD	gen=551 glyphs=4
2026-03-14T02:09:39.228668	bfdf7cad	120	30	1.0000	DISCARD	gen=508 glyphs=4
2026-03-14T02:09:39.505063	19355583	120	30	1.0000	DISCARD	gen=552 glyphs=4
2026-03-14T02:09:41.971676	5a06ca32	120	30	1.0000	DISCARD	gen=508 glyphs=4
2026-03-14T02:09:42.244122	8aef8872	116	29	1.0000	DISCARD	gen=552 glyphs=4
2026-03-14T02:09:44.725909	37f4017b	116	29	1.0000	DISCARD	gen=508 glyphs=4
2026-03-14T02:09:44.995836	fddb3a7c	120	30	1.0000	DISCARD	gen=552 glyphs=4
2026-03-14T02:09:47.462395	37f4017b	116	29	1.0000	DISCARD	gen=508 glyphs=4
2026-03-14T02:09:47.737984	9ea0be0d	120	30	1.0000	DISCARD	gen=552 glyphs=4
2026-03-14T02:09:50.194056	1d34459a	116	29	1.0000	DISCARD	gen=508 glyphs=4
2026-03-14T02:09:50.462553	b6d59220	116	29	1.0000	DISCARD	gen=552 glyphs=4
2026-03-14T02:09:52.929819	1d34459a	116	29	1.0000	DISCARD	gen=508 glyphs=4
2026-03-14T02:09:53.213143	50dc991d	116	29	1.0000	DISCARD	gen=552 glyphs=4
2026-03-14T02:09:55.665273	37f4017b	116	29	1.0000	DISCARD	gen=508 glyphs=4
2026-03-14T02:09:55.944056	0eaedb57	116	29	1.0000	DISCARD	gen=552 glyphs=4
2026-03-14T02:09:58.414258	7ca87b42	116	29	1.0000	DISCARD	gen=508 glyphs=4
2026-03-14T02:09:58.681388	a1172277	116	29	1.0000	DISCARD	gen=552 glyphs=4
2026-03-14T02:10:01.156496	d11c1062	120	30	1.0000	DISCARD	gen=508 glyphs=4
2026-03-14T02:10:01.441306	0eaedb57	116	29	1.0000	DISCARD	gen=552 glyphs=4
2026-03-14T02:10:03.937498	37f4017b	116	29	1.0000	DISCARD	gen=509 glyphs=4
2026-03-14T02:10:04.211804	73dc0638	120	30	1.0000	DISCARD	gen=552 glyphs=4
2026-03-14T02:10:06.704364	bfdf7cad	120	30	1.0000	DISCARD	gen=509 glyphs=4
2026-03-14T02:10:06.981362	19355583	120	30	1.0000	DISCARD	gen=553 glyphs=4
2026-03-14T02:10:09.466380	55d6c151	120	30	1.0000	DISCARD	gen=509 glyphs=4
2026-03-14T02:10:09.734596	8aef8872	116	29	1.0000	DISCARD	gen=553 glyphs=4
2026-03-14T02:10:12.207169	37f4017b	116	29	1.0000	DISCARD	gen=509 glyphs=4
2026-03-14T02:10:12.483063	19355583	120	30	1.0000	DISCARD	gen=553 glyphs=4
2026-03-14T02:10:14.959105	37f4017b	116	29	1.0000	DISCARD	gen=509 glyphs=4
2026-03-14T02:10:15.244102	8aef8872	116	29	1.0000	DISCARD	gen=553 glyphs=4
2026-03-14T02:10:17.733999	f1fa6f35	116	29	1.0000	DISCARD	gen=509 glyphs=4
2026-03-14T02:10:18.007907	050862ad	120	30	1.0000	DISCARD	gen=553 glyphs=4
2026-03-14T02:10:20.481089	fdb5d108	120	30	1.0000	DISCARD	gen=509 glyphs=4
2026-03-14T02:10:20.752766	8aef8872	116	29	1.0000	DISCARD	gen=553 glyphs=4
2026-03-14T02:10:23.245109	1d34459a	116	29	1.0000	DISCARD	gen=509 glyphs=4
2026-03-14T02:10:23.524372	d7c8681b	120	30	1.0000	DISCARD	gen=553 glyphs=4
2026-03-14T02:10:26.002538	fdb5d108	120	30	1.0000	DISCARD	gen=509 glyphs=4
2026-03-14T02:10:26.282721	86daee77	120	30	1.0000	DISCARD	gen=553 glyphs=4
2026-03-14T02:10:28.768389	5a06ca32	120	30	1.0000	DISCARD	gen=509 glyphs=4
2026-03-14T02:10:29.030565	875e0f8a	116	29	1.0000	DISCARD	gen=553 glyphs=4
2026-03-14T02:10:31.513011	37f4017b	116	29	1.0000	DISCARD	gen=510 glyphs=4
2026-03-14T02:10:31.798177	050862ad	120	30	1.0000	DISCARD	gen=553 glyphs=4
2026-03-14T02:10:34.282161	bfdf7cad	120	30	1.0000	DISCARD	gen=510 glyphs=4
2026-03-14T02:10:34.553404	19355583	120	30	1.0000	DISCARD	gen=554 glyphs=4
2026-03-14T02:10:37.116998	7cb53415	116	29	1.0000	DISCARD	gen=510 glyphs=4
2026-03-14T02:10:37.394290	8aef8872	116	29	1.0000	DISCARD	gen=554 glyphs=4
2026-03-14T02:10:39.852987	37f4017b	116	29	1.0000	DISCARD	gen=510 glyphs=4
2026-03-14T02:10:40.141599	eca7ab6c	116	29	1.0000	DISCARD	gen=554 glyphs=4
2026-03-14T02:10:42.630229	5a06ca32	120	30	1.0000	DISCARD	gen=510 glyphs=4
2026-03-14T02:10:42.904913	e4bfbeab	120	30	1.0000	DISCARD	gen=554 glyphs=4
2026-03-14T02:10:45.363481	c8a08b9c	116	29	1.0000	DISCARD	gen=510 glyphs=4
2026-03-14T02:10:45.637435	e8c7f6cf	120	30	1.0000	DISCARD	gen=554 glyphs=4
2026-03-14T02:10:48.080475	37f4017b	116	29	1.0000	DISCARD	gen=510 glyphs=4
2026-03-14T02:10:48.344526	050862ad	120	30	1.0000	DISCARD	gen=554 glyphs=4
2026-03-14T02:10:50.790745	55d6c151	120	30	1.0000	DISCARD	gen=510 glyphs=4
2026-03-14T02:10:51.060368	95b47feb	120	30	1.0000	DISCARD	gen=554 glyphs=4
2026-03-14T02:10:53.511714	ebbdd641	120	30	1.0000	DISCARD	gen=510 glyphs=4
2026-03-14T02:10:53.791647	050862ad	120	30	1.0000	DISCARD	gen=554 glyphs=4
2026-03-14T02:10:56.271544	1d34459a	116	29	1.0000	DISCARD	gen=510 glyphs=4
2026-03-14T02:10:56.559383	a78f9454	120	30	1.0000	DISCARD	gen=554 glyphs=4
2026-03-14T02:10:59.043781	37f4017b	116	29	1.0000	DISCARD	gen=511 glyphs=4
2026-03-14T02:10:59.317801	e2cd28ea	120	30	1.0000	DISCARD	gen=554 glyphs=4
2026-03-14T02:11:01.770543	bfdf7cad	120	30	1.0000	DISCARD	gen=511 glyphs=4
2026-03-14T02:11:02.037833	19355583	120	30	1.0000	DISCARD	gen=555 glyphs=4
2026-03-14T02:11:04.510662	55d6c151	120	30	1.0000	DISCARD	gen=511 glyphs=4
2026-03-14T02:11:04.799329	8aef8872	116	29	1.0000	DISCARD	gen=555 glyphs=4
2026-03-14T02:11:07.270629	37f4017b	116	29	1.0000	DISCARD	gen=511 glyphs=4
2026-03-14T02:11:07.567202	eec2e6f7	116	29	1.0000	DISCARD	gen=555 glyphs=4
2026-03-14T02:11:10.015119	b8712434	120	30	1.0000	DISCARD	gen=511 glyphs=4
2026-03-14T02:11:10.276006	cade9047	116	29	1.0000	DISCARD	gen=555 glyphs=4
2026-03-14T02:11:12.743304	37f4017b	116	29	1.0000	DISCARD	gen=511 glyphs=4
2026-03-14T02:11:13.018667	875e0f8a	116	29	1.0000	DISCARD	gen=555 glyphs=4
2026-03-14T02:11:15.442238	7ca87b42	116	29	1.0000	DISCARD	gen=511 glyphs=4
2026-03-14T02:11:15.718171	eca7ab6c	116	29	1.0000	DISCARD	gen=555 glyphs=4
2026-03-14T02:11:18.152215	78bc3dbb	120	30	1.0000	DISCARD	gen=511 glyphs=4
2026-03-14T02:11:18.424324	0eaedb57	116	29	1.0000	DISCARD	gen=555 glyphs=4
2026-03-14T02:11:20.892949	715ffe1f	116	29	0.9500	DISCARD	gen=511 glyphs=4
2026-03-14T02:11:21.173287	b7aed8e9	116	29	1.0000	DISCARD	gen=555 glyphs=4
2026-03-14T02:11:23.630069	5a06ca32	120	30	1.0000	DISCARD	gen=511 glyphs=4
2026-03-14T02:11:23.900363	0eaedb57	116	29	1.0000	DISCARD	gen=555 glyphs=4
2026-03-14T02:11:26.338389	37f4017b	116	29	1.0000	DISCARD	gen=512 glyphs=4
2026-03-14T02:11:26.615006	50dc991d	116	29	1.0000	DISCARD	gen=555 glyphs=4
2026-03-14T02:11:29.044205	bfdf7cad	120	30	1.0000	DISCARD	gen=512 glyphs=4
2026-03-14T02:11:29.316579	19355583	120	30	1.0000	DISCARD	gen=556 glyphs=4
2026-03-14T02:11:31.758472	37f4017b	116	29	1.0000	DISCARD	gen=512 glyphs=4
2026-03-14T02:11:32.024382	8aef8872	116	29	1.0000	DISCARD	gen=556 glyphs=4
2026-03-14T02:11:34.496152	2d8cbd48	116	29	1.0000	DISCARD	gen=512 glyphs=4
2026-03-14T02:11:34.768493	b36885e2	116	29	1.0000	DISCARD	gen=556 glyphs=4
2026-03-14T02:11:37.218485	fdb5d108	120	30	1.0000	DISCARD	gen=512 glyphs=4
2026-03-14T02:11:37.510390	b7da49f2	116	29	1.0000	DISCARD	gen=556 glyphs=4
2026-03-14T02:11:40.030265	12b38c2d	116	29	1.0000	DISCARD	gen=512 glyphs=4
2026-03-14T02:11:40.302404	c3178bb2	116	29	1.0000	DISCARD	gen=556 glyphs=4
2026-03-14T02:11:42.767716	55d6c151	120	30	1.0000	DISCARD	gen=512 glyphs=4
2026-03-14T02:11:43.025443	8aef8872	116	29	1.0000	DISCARD	gen=556 glyphs=4
2026-03-14T02:11:45.562196	12b38c2d	116	29	1.0000	DISCARD	gen=512 glyphs=4
2026-03-14T02:11:45.835253	eca7ab6c	116	29	1.0000	DISCARD	gen=556 glyphs=4
2026-03-14T02:11:48.291746	55d6c151	120	30	1.0000	DISCARD	gen=512 glyphs=4
2026-03-14T02:11:48.574295	8aef8872	116	29	1.0000	DISCARD	gen=556 glyphs=4
2026-03-14T02:11:51.029072	12b38c2d	116	29	1.0000	DISCARD	gen=512 glyphs=4
2026-03-14T02:11:51.318763	59ab8a65	116	29	1.0000	DISCARD	gen=556 glyphs=4
2026-03-14T02:11:53.792002	37f4017b	116	29	1.0000	DISCARD	gen=513 glyphs=4
2026-03-14T02:11:54.080864	ae44ace5	116	29	1.0000	DISCARD	gen=556 glyphs=4
2026-03-14T02:11:56.520315	bfdf7cad	120	30	1.0000	DISCARD	gen=513 glyphs=4
2026-03-14T02:11:56.790009	19355583	120	30	1.0000	DISCARD	gen=557 glyphs=4
2026-03-14T02:11:59.228699	fdb5d108	120	30	1.0000	DISCARD	gen=513 glyphs=4
2026-03-14T02:11:59.513380	8aef8872	116	29	1.0000	DISCARD	gen=557 glyphs=4
2026-03-14T02:12:01.949913	fdb5d108	120	30	1.0000	DISCARD	gen=513 glyphs=4
2026-03-14T02:12:02.222930	1a388b83	116	29	1.0000	DISCARD	gen=557 glyphs=4
2026-03-14T02:12:04.710302	1d34459a	116	29	1.0000	DISCARD	gen=513 glyphs=4
2026-03-14T02:12:04.973126	a78f9454	120	30	1.0000	DISCARD	gen=557 glyphs=4
2026-03-14T02:12:07.421297	60d59b00	116	29	1.0000	DISCARD	gen=513 glyphs=4
2026-03-14T02:12:07.695252	875e0f8a	116	29	1.0000	DISCARD	gen=557 glyphs=4
2026-03-14T02:12:10.214629	de11f17e	116	29	1.0000	DISCARD	gen=513 glyphs=4
2026-03-14T02:12:10.493120	67cb81be	120	30	1.0000	DISCARD	gen=557 glyphs=4
2026-03-14T02:12:13.012908	71e2ba66	116	29	1.0000	DISCARD	gen=513 glyphs=4
2026-03-14T02:12:13.275539	e056386c	116	29	1.0000	DISCARD	gen=557 glyphs=4
2026-03-14T02:12:15.738979	f6149a4b	116	29	1.0000	DISCARD	gen=513 glyphs=4
2026-03-14T02:12:16.013587	19355583	120	30	1.0000	DISCARD	gen=557 glyphs=4
2026-03-14T02:12:18.432946	7ca87b42	116	29	1.0000	DISCARD	gen=513 glyphs=4
2026-03-14T02:12:18.707338	6d32b425	120	30	1.0000	DISCARD	gen=557 glyphs=4
2026-03-14T02:12:21.185663	37f4017b	116	29	1.0000	DISCARD	gen=514 glyphs=4
2026-03-14T02:12:21.457964	0eaedb57	116	29	1.0000	DISCARD	gen=557 glyphs=4
2026-03-14T02:12:23.923416	bfdf7cad	120	30	1.0000	DISCARD	gen=514 glyphs=4
2026-03-14T02:12:24.196640	19355583	120	30	1.0000	DISCARD	gen=558 glyphs=4
2026-03-14T02:12:26.623081	0fbd3a32	116	29	1.0000	DISCARD	gen=514 glyphs=4
2026-03-14T02:12:26.889609	8aef8872	116	29	1.0000	DISCARD	gen=558 glyphs=4
2026-03-14T02:12:29.335611	5a06ca32	120	30	1.0000	DISCARD	gen=514 glyphs=4
2026-03-14T02:12:29.604596	050862ad	120	30	1.0000	DISCARD	gen=558 glyphs=4
2026-03-14T02:12:32.053553	80412cbe	120	30	1.0000	DISCARD	gen=514 glyphs=4
2026-03-14T02:12:32.343488	0eaedb57	116	29	1.0000	DISCARD	gen=558 glyphs=4
2026-03-14T02:12:34.786253	1d34459a	116	29	1.0000	DISCARD	gen=514 glyphs=4
2026-03-14T02:12:35.057835	95e5ba62	116	29	1.0000	DISCARD	gen=558 glyphs=4
2026-03-14T02:12:37.496623	5b9807ac	120	30	1.0000	DISCARD	gen=514 glyphs=4
2026-03-14T02:12:37.766050	e272b853	116	29	0.9000	DISCARD	gen=558 glyphs=4
2026-03-14T02:12:40.213703	fdb5d108	120	30	1.0000	DISCARD	gen=514 glyphs=4
2026-03-14T02:12:40.475446	0eaedb57	116	29	1.0000	DISCARD	gen=558 glyphs=4
2026-03-14T02:12:43.050575	37f4017b	116	29	1.0000	DISCARD	gen=514 glyphs=4
2026-03-14T02:12:43.336382	e8c7f6cf	120	30	1.0000	DISCARD	gen=558 glyphs=4
2026-03-14T02:12:45.815316	4c9b0dd4	120	30	1.0000	DISCARD	gen=514 glyphs=4
2026-03-14T02:12:46.086636	8aef8872	116	29	1.0000	DISCARD	gen=558 glyphs=4
2026-03-14T02:12:48.536720	37f4017b	116	29	1.0000	DISCARD	gen=515 glyphs=4
2026-03-14T02:12:48.803416	eca7ab6c	116	29	1.0000	DISCARD	gen=558 glyphs=4
2026-03-14T02:12:51.233133	bfdf7cad	120	30	1.0000	DISCARD	gen=515 glyphs=4
2026-03-14T02:12:51.507510	19355583	120	30	1.0000	DISCARD	gen=559 glyphs=4
2026-03-14T02:12:53.955311	8910b17e	120	30	1.0000	DISCARD	gen=515 glyphs=4
2026-03-14T02:12:54.226371	8aef8872	116	29	1.0000	DISCARD	gen=559 glyphs=4
2026-03-14T02:12:56.645006	4c9b0dd4	120	30	1.0000	DISCARD	gen=515 glyphs=4
2026-03-14T02:12:56.910530	ca41196f	116	29	1.0000	DISCARD	gen=559 glyphs=4
2026-03-14T02:12:59.350527	37f4017b	116	29	1.0000	DISCARD	gen=515 glyphs=4
2026-03-14T02:12:59.626105	a9a07a0a	116	29	1.0000	DISCARD	gen=559 glyphs=4
2026-03-14T02:13:02.071782	5a06ca32	120	30	1.0000	DISCARD	gen=515 glyphs=4
2026-03-14T02:13:02.340057	cd886736	116	29	1.0000	DISCARD	gen=559 glyphs=4
2026-03-14T02:13:04.799992	37f4017b	116	29	1.0000	DISCARD	gen=515 glyphs=4
2026-03-14T02:13:05.075336	050862ad	120	30	1.0000	DISCARD	gen=559 glyphs=4
2026-03-14T02:13:07.487619	f354c251	120	30	1.0000	DISCARD	gen=515 glyphs=4
2026-03-14T02:13:07.769714	ad7596c1	116	29	1.0000	DISCARD	gen=559 glyphs=4
2026-03-14T02:13:10.202933	55d6c151	120	30	1.0000	DISCARD	gen=515 glyphs=4
2026-03-14T02:13:10.470987	b57e7176	120	30	1.0000	DISCARD	gen=559 glyphs=4
2026-03-14T02:13:12.924642	7ca87b42	116	29	1.0000	DISCARD	gen=515 glyphs=4
2026-03-14T02:13:13.198629	0eaedb57	116	29	1.0000	DISCARD	gen=559 glyphs=4
2026-03-14T02:13:15.752905	37f4017b	116	29	1.0000	DISCARD	gen=516 glyphs=4
2026-03-14T02:13:16.041410	0c703bd5	120	30	1.0000	DISCARD	gen=559 glyphs=4
2026-03-14T02:13:18.485140	bfdf7cad	120	30	1.0000	DISCARD	gen=516 glyphs=4
2026-03-14T02:13:18.757430	19355583	120	30	1.0000	DISCARD	gen=560 glyphs=4
2026-03-14T02:13:21.212040	7ca87b42	116	29	1.0000	DISCARD	gen=516 glyphs=4
2026-03-14T02:13:21.481778	8aef8872	116	29	1.0000	DISCARD	gen=560 glyphs=4
2026-03-14T02:13:23.918581	7ca87b42	116	29	1.0000	DISCARD	gen=516 glyphs=4
2026-03-14T02:13:24.193846	8aef8872	116	29	1.0000	DISCARD	gen=560 glyphs=4
2026-03-14T02:13:26.641377	5a06ca32	120	30	1.0000	DISCARD	gen=516 glyphs=4
2026-03-14T02:13:26.911728	e2cd28ea	120	30	1.0000	DISCARD	gen=560 glyphs=4
2026-03-14T02:13:29.357683	4c9b0dd4	120	30	1.0000	DISCARD	gen=516 glyphs=4
2026-03-14T02:13:29.613815	050862ad	120	30	1.0000	DISCARD	gen=560 glyphs=4
2026-03-14T02:13:32.071528	c5615410	116	29	1.0000	DISCARD	gen=516 glyphs=4
2026-03-14T02:13:32.337475	67cb81be	120	30	1.0000	DISCARD	gen=560 glyphs=4
2026-03-14T02:13:34.765938	55d6c151	120	30	1.0000	DISCARD	gen=516 glyphs=4
2026-03-14T02:13:35.050048	9e34ede0	116	29	1.0000	DISCARD	gen=560 glyphs=4
2026-03-14T02:13:37.485661	2701cb73	116	29	1.0000	DISCARD	gen=516 glyphs=4
2026-03-14T02:13:37.761118	8aef8872	116	29	1.0000	DISCARD	gen=560 glyphs=4
2026-03-14T02:13:40.189350	fdb5d108	120	30	1.0000	DISCARD	gen=516 glyphs=4
2026-03-14T02:13:40.456506	c124ca95	120	30	1.0000	DISCARD	gen=560 glyphs=4
2026-03-14T02:13:42.918844	37f4017b	116	29	1.0000	DISCARD	gen=517 glyphs=4
2026-03-14T02:13:43.190033	19355583	120	30	1.0000	DISCARD	gen=560 glyphs=4
2026-03-14T02:13:45.625938	bfdf7cad	120	30	1.0000	DISCARD	gen=517 glyphs=4
2026-03-14T02:13:45.918353	19355583	120	30	1.0000	DISCARD	gen=561 glyphs=4
2026-03-14T02:13:48.409031	7ca87b42	116	29	1.0000	DISCARD	gen=517 glyphs=4
2026-03-14T02:13:48.678385	8aef8872	116	29	1.0000	DISCARD	gen=561 glyphs=4
2026-03-14T02:13:51.117260	edb8fa1e	120	30	1.0000	DISCARD	gen=517 glyphs=4
2026-03-14T02:13:51.407783	8eacad85	116	29	1.0000	DISCARD	gen=561 glyphs=4
2026-03-14T02:13:53.866002	1d34459a	116	29	1.0000	DISCARD	gen=517 glyphs=4
2026-03-14T02:13:54.134967	8aef8872	116	29	1.0000	DISCARD	gen=561 glyphs=4
2026-03-14T02:13:56.584122	1d34459a	116	29	1.0000	DISCARD	gen=517 glyphs=4
2026-03-14T02:13:56.839670	e2cd28ea	120	30	1.0000	DISCARD	gen=561 glyphs=4
2026-03-14T02:13:59.309742	37f4017b	116	29	1.0000	DISCARD	gen=517 glyphs=4
2026-03-14T02:13:59.575750	ae44ace5	116	29	1.0000	DISCARD	gen=561 glyphs=4
2026-03-14T02:14:02.016329	b6dd67b6	116	29	1.0000	DISCARD	gen=517 glyphs=4
2026-03-14T02:14:02.293045	e8c7f6cf	120	30	1.0000	DISCARD	gen=561 glyphs=4
2026-03-14T02:14:04.725482	2701cb73	116	29	1.0000	DISCARD	gen=517 glyphs=4
2026-03-14T02:14:04.997494	b7aed8e9	116	29	1.0000	DISCARD	gen=561 glyphs=4
2026-03-14T02:14:07.474132	bfdf7cad	120	30	1.0000	DISCARD	gen=517 glyphs=4
2026-03-14T02:14:07.743528	b0be03bc	116	29	1.0000	DISCARD	gen=561 glyphs=4
2026-03-14T02:14:10.205675	37f4017b	116	29	1.0000	DISCARD	gen=518 glyphs=4
2026-03-14T02:14:10.468760	0eaedb57	116	29	1.0000	DISCARD	gen=561 glyphs=4
2026-03-14T02:14:12.910243	bfdf7cad	120	30	1.0000	DISCARD	gen=518 glyphs=4
2026-03-14T02:14:13.181576	19355583	120	30	1.0000	DISCARD	gen=562 glyphs=4
2026-03-14T02:14:15.624865	bfdf7cad	120	30	1.0000	DISCARD	gen=518 glyphs=4
2026-03-14T02:14:15.890009	8aef8872	116	29	1.0000	DISCARD	gen=562 glyphs=4
2026-03-14T02:14:18.415917	55d6c151	120	30	1.0000	DISCARD	gen=518 glyphs=4
2026-03-14T02:14:18.690981	50dc991d	116	29	1.0000	DISCARD	gen=562 glyphs=4
2026-03-14T02:14:21.182374	5238791e	116	29	1.0000	DISCARD	gen=518 glyphs=4
2026-03-14T02:14:21.460993	1e8b6538	116	29	1.0000	DISCARD	gen=562 glyphs=4
2026-03-14T02:14:23.905403	16d1a991	120	30	1.0000	DISCARD	gen=518 glyphs=4
2026-03-14T02:14:24.165960	1e5f0e21	116	29	1.0000	DISCARD	gen=562 glyphs=4
2026-03-14T02:14:26.608369	37f4017b	116	29	1.0000	DISCARD	gen=518 glyphs=4
2026-03-14T02:14:26.881685	8aef8872	116	29	1.0000	DISCARD	gen=562 glyphs=4
2026-03-14T02:14:29.352961	37f4017b	116	29	1.0000	DISCARD	gen=518 glyphs=4
2026-03-14T02:14:29.626901	ae44ace5	116	29	1.0000	DISCARD	gen=562 glyphs=4
2026-03-14T02:14:32.103598	37f4017b	116	29	1.0000	DISCARD	gen=518 glyphs=4
2026-03-14T02:14:32.393667	ae44ace5	116	29	1.0000	DISCARD	gen=562 glyphs=4
2026-03-14T02:14:34.875986	37f4017b	116	29	1.0000	DISCARD	gen=518 glyphs=4
2026-03-14T02:14:35.145089	875e0f8a	116	29	1.0000	DISCARD	gen=562 glyphs=4
2026-03-14T02:14:37.601949	37f4017b	116	29	1.0000	DISCARD	gen=519 glyphs=4
2026-03-14T02:14:37.872442	bf35a1bb	116	29	1.0000	DISCARD	gen=562 glyphs=4
2026-03-14T02:14:40.331477	bfdf7cad	120	30	1.0000	DISCARD	gen=519 glyphs=4
2026-03-14T02:14:40.591849	19355583	120	30	1.0000	DISCARD	gen=563 glyphs=4
2026-03-14T02:14:43.068533	5b9807ac	120	30	1.0000	DISCARD	gen=519 glyphs=4
2026-03-14T02:14:43.351688	8aef8872	116	29	1.0000	DISCARD	gen=563 glyphs=4
2026-03-14T02:14:45.788378	12b38c2d	116	29	1.0000	DISCARD	gen=519 glyphs=4
2026-03-14T02:14:46.059246	e8c7f6cf	120	30	1.0000	DISCARD	gen=563 glyphs=4
2026-03-14T02:14:48.500689	954aa09d	120	30	1.0000	DISCARD	gen=519 glyphs=4
2026-03-14T02:14:48.790348	9e34ede0	116	29	1.0000	DISCARD	gen=563 glyphs=4
2026-03-14T02:14:51.334936	71e2ba66	116	29	1.0000	DISCARD	gen=519 glyphs=4
2026-03-14T02:14:51.604864	050862ad	120	30	1.0000	DISCARD	gen=563 glyphs=4
2026-03-14T02:14:54.041675	37f4017b	116	29	1.0000	DISCARD	gen=519 glyphs=4
2026-03-14T02:14:54.313603	c842fb99	120	30	1.0000	DISCARD	gen=563 glyphs=4
