timestamp	program_hash	spirv_size	word_count	fitness	status	description
2026-03-14T07:36:44.569329	c8921501	0	0	0.0000	CRASH	gen=263 glyphs=4
2026-03-14T07:36:44.569553	cf93b656	0	0	0.0000	CRASH	gen=263 glyphs=3
2026-03-14T07:36:44.569765	ff30496a	0	0	0.0000	CRASH	gen=263 glyphs=3
2026-03-14T07:36:44.569973	3a734398	0	0	0.0000	CRASH	gen=263 glyphs=4
2026-03-14T07:36:44.570189	099964a4	0	0	0.0000	CRASH	gen=263 glyphs=4
2026-03-14T07:36:44.570402	2ad0425b	0	0	0.0000	CRASH	gen=263 glyphs=4
2026-03-14T07:36:44.570709	099964a4	0	0	0.0000	CRASH	gen=264 glyphs=4
2026-03-14T07:36:44.570922	099964a4	0	0	0.0000	CRASH	gen=264 glyphs=4
2026-03-14T07:36:44.571132	099964a4	0	0	0.0000	CRASH	gen=264 glyphs=4
2026-03-14T07:36:44.571341	3ca14993	0	0	0.0000	CRASH	gen=264 glyphs=4
2026-03-14T07:36:44.571555	099964a4	0	0	0.0000	CRASH	gen=264 glyphs=4
2026-03-14T07:36:44.571769	099964a4	0	0	0.0000	CRASH	gen=264 glyphs=4
2026-03-14T07:36:44.571979	b25e92c1	0	0	0.0000	CRASH	gen=264 glyphs=4
2026-03-14T07:36:44.572192	826bdf94	0	0	0.0000	CRASH	gen=264 glyphs=4
2026-03-14T07:36:44.572410	8da1f8d8	0	0	0.0000	CRASH	gen=264 glyphs=4
2026-03-14T07:36:44.572634	099964a4	0	0	0.0000	CRASH	gen=264 glyphs=4
2026-03-14T07:36:44.572947	099964a4	0	0	0.0000	CRASH	gen=265 glyphs=4
2026-03-14T07:36:44.573169	099964a4	0	0	0.0000	CRASH	gen=265 glyphs=4
2026-03-14T07:36:44.573385	3ca14993	0	0	0.0000	CRASH	gen=265 glyphs=4
2026-03-14T07:36:44.573603	099964a4	0	0	0.0000	CRASH	gen=265 glyphs=4
2026-03-14T07:36:44.573821	80cef82b	0	0	0.0000	CRASH	gen=265 glyphs=4
2026-03-14T07:36:44.574043	099964a4	0	0	0.0000	CRASH	gen=265 glyphs=4
2026-03-14T07:36:44.574265	5b59acf1	0	0	0.0000	CRASH	gen=265 glyphs=4
2026-03-14T07:36:44.574486	8da1f8d8	0	0	0.0000	CRASH	gen=265 glyphs=4
2026-03-14T07:36:44.574704	3ca14993	0	0	0.0000	CRASH	gen=265 glyphs=4
2026-03-14T07:36:44.574928	099964a4	0	0	0.0000	CRASH	gen=265 glyphs=4
2026-03-14T07:36:44.575234	099964a4	0	0	0.0000	CRASH	gen=266 glyphs=4
2026-03-14T07:36:44.575447	099964a4	0	0	0.0000	CRASH	gen=266 glyphs=4
2026-03-14T07:36:44.575661	099964a4	0	0	0.0000	CRASH	gen=266 glyphs=4
2026-03-14T07:36:44.575875	099964a4	0	0	0.0000	CRASH	gen=266 glyphs=4
2026-03-14T07:36:44.576087	099964a4	0	0	0.0000	CRASH	gen=266 glyphs=4
2026-03-14T07:36:44.576301	099964a4	0	0	0.0000	CRASH	gen=266 glyphs=4
2026-03-14T07:36:44.576513	7ede4765	0	0	0.0000	CRASH	gen=266 glyphs=2
2026-03-14T07:36:44.576729	099964a4	0	0	0.0000	CRASH	gen=266 glyphs=4
2026-03-14T07:36:44.576951	099964a4	0	0	0.0000	CRASH	gen=266 glyphs=4
2026-03-14T07:36:44.577167	dcb1fb50	0	0	0.0000	CRASH	gen=266 glyphs=4
2026-03-14T07:36:44.577474	099964a4	0	0	0.0000	CRASH	gen=267 glyphs=4
2026-03-14T07:36:44.577695	099964a4	0	0	0.0000	CRASH	gen=267 glyphs=4
2026-03-14T07:36:44.577911	099964a4	0	0	0.0000	CRASH	gen=267 glyphs=4
2026-03-14T07:36:44.578129	40d75931	0	0	0.0000	CRASH	gen=267 glyphs=3
2026-03-14T07:36:44.578349	ff30496a	0	0	0.0000	CRASH	gen=267 glyphs=3
2026-03-14T07:36:44.578568	099964a4	0	0	0.0000	CRASH	gen=267 glyphs=4
2026-03-14T07:36:44.578790	099964a4	0	0	0.0000	CRASH	gen=267 glyphs=4
2026-03-14T07:36:44.579012	c26e4c9b	0	0	0.0000	CRASH	gen=267 glyphs=2
2026-03-14T07:36:44.579240	099964a4	0	0	0.0000	CRASH	gen=267 glyphs=4
2026-03-14T07:36:44.579465	abc793e3	0	0	0.0000	CRASH	gen=267 glyphs=5
2026-03-14T07:36:44.579802	099964a4	0	0	0.0000	CRASH	gen=268 glyphs=4
2026-03-14T07:36:44.580029	099964a4	0	0	0.0000	CRASH	gen=268 glyphs=4
2026-03-14T07:36:44.580261	099964a4	0	0	0.0000	CRASH	gen=268 glyphs=4
2026-03-14T07:36:44.580490	099964a4	0	0	0.0000	CRASH	gen=268 glyphs=4
2026-03-14T07:36:44.580715	8da1f8d8	0	0	0.0000	CRASH	gen=268 glyphs=4
2026-03-14T07:36:44.580935	5c3ac5cd	0	0	0.0000	CRASH	gen=268 glyphs=3
2026-03-14T07:36:44.581158	8da1f8d8	0	0	0.0000	CRASH	gen=268 glyphs=4
2026-03-14T07:36:44.581378	c2f7a387	0	0	0.0000	CRASH	gen=268 glyphs=4
2026-03-14T07:36:44.581610	099964a4	0	0	0.0000	CRASH	gen=268 glyphs=4
2026-03-14T07:36:44.581836	099964a4	0	0	0.0000	CRASH	gen=268 glyphs=4
2026-03-14T07:36:44.582169	099964a4	0	0	0.0000	CRASH	gen=269 glyphs=4
2026-03-14T07:36:44.582399	099964a4	0	0	0.0000	CRASH	gen=269 glyphs=4
2026-03-14T07:36:44.582624	099964a4	0	0	0.0000	CRASH	gen=269 glyphs=4
2026-03-14T07:36:44.582847	099964a4	0	0	0.0000	CRASH	gen=269 glyphs=4
2026-03-14T07:36:44.583070	099964a4	0	0	0.0000	CRASH	gen=269 glyphs=4
2026-03-14T07:36:44.583289	8da1f8d8	0	0	0.0000	CRASH	gen=269 glyphs=4
2026-03-14T07:36:44.583504	b50e2ffe	0	0	0.0000	CRASH	gen=269 glyphs=3
2026-03-14T07:36:44.583719	099964a4	0	0	0.0000	CRASH	gen=269 glyphs=4
2026-03-14T07:36:44.583936	099964a4	0	0	0.0000	CRASH	gen=269 glyphs=4
2026-03-14T07:36:44.584153	300f7c6e	0	0	0.0000	CRASH	gen=269 glyphs=4
2026-03-14T07:36:44.584469	099964a4	0	0	0.0000	CRASH	gen=270 glyphs=4
2026-03-14T07:36:44.584699	099964a4	0	0	0.0000	CRASH	gen=270 glyphs=4
2026-03-14T07:36:44.584920	0bdb44a6	0	0	0.0000	CRASH	gen=270 glyphs=4
2026-03-14T07:36:44.585138	3a734398	0	0	0.0000	CRASH	gen=270 glyphs=4
2026-03-14T07:36:44.585354	099964a4	0	0	0.0000	CRASH	gen=270 glyphs=4
2026-03-14T07:36:44.585575	099964a4	0	0	0.0000	CRASH	gen=270 glyphs=4
2026-03-14T07:36:44.585788	099964a4	0	0	0.0000	CRASH	gen=270 glyphs=4
2026-03-14T07:36:44.585999	099964a4	0	0	0.0000	CRASH	gen=270 glyphs=4
2026-03-14T07:36:44.586211	9da9aeec	0	0	0.0000	CRASH	gen=270 glyphs=2
2026-03-14T07:36:44.586427	099964a4	0	0	0.0000	CRASH	gen=270 glyphs=4
2026-03-14T07:36:44.586739	099964a4	0	0	0.0000	CRASH	gen=271 glyphs=4
2026-03-14T07:36:44.586963	099964a4	0	0	0.0000	CRASH	gen=271 glyphs=4
2026-03-14T07:36:44.587182	3a734398	0	0	0.0000	CRASH	gen=271 glyphs=4
2026-03-14T07:36:44.587400	099964a4	0	0	0.0000	CRASH	gen=271 glyphs=4
2026-03-14T07:36:44.587627	099964a4	0	0	0.0000	CRASH	gen=271 glyphs=4
2026-03-14T07:36:44.587846	247687ac	0	0	0.0000	CRASH	gen=271 glyphs=4
2026-03-14T07:36:44.588066	099964a4	0	0	0.0000	CRASH	gen=271 glyphs=4
2026-03-14T07:36:44.588283	7ede4765	0	0	0.0000	CRASH	gen=271 glyphs=2
2026-03-14T07:36:44.588499	099964a4	0	0	0.0000	CRASH	gen=271 glyphs=4
2026-03-14T07:36:44.588719	8da1f8d8	0	0	0.0000	CRASH	gen=271 glyphs=4
2026-03-14T07:36:44.589045	099964a4	0	0	0.0000	CRASH	gen=272 glyphs=4
2026-03-14T07:36:44.589267	099964a4	0	0	0.0000	CRASH	gen=272 glyphs=4
2026-03-14T07:36:44.589486	3ca14993	0	0	0.0000	CRASH	gen=272 glyphs=4
2026-03-14T07:36:44.589720	099964a4	0	0	0.0000	CRASH	gen=272 glyphs=4
2026-03-14T07:36:44.589941	099964a4	0	0	0.0000	CRASH	gen=272 glyphs=4
2026-03-14T07:36:44.590158	14006a9d	0	0	0.0000	CRASH	gen=272 glyphs=5
2026-03-14T07:36:44.590378	b6fda98d	0	0	0.0000	CRASH	gen=272 glyphs=2
2026-03-14T07:36:44.590601	099964a4	0	0	0.0000	CRASH	gen=272 glyphs=4
2026-03-14T07:36:44.590825	099964a4	0	0	0.0000	CRASH	gen=272 glyphs=4
2026-03-14T07:36:44.591041	2aaed46d	0	0	0.0000	CRASH	gen=272 glyphs=2
2026-03-14T07:36:44.591356	099964a4	0	0	0.0000	CRASH	gen=273 glyphs=4
2026-03-14T07:36:44.591583	099964a4	0	0	0.0000	CRASH	gen=273 glyphs=4
2026-03-14T07:36:44.591806	f09e7cb3	0	0	0.0000	CRASH	gen=273 glyphs=4
2026-03-14T07:36:44.592020	099964a4	0	0	0.0000	CRASH	gen=273 glyphs=4
2026-03-14T07:36:44.592231	099964a4	0	0	0.0000	CRASH	gen=273 glyphs=4
2026-03-14T07:36:44.592440	099964a4	0	0	0.0000	CRASH	gen=273 glyphs=4
2026-03-14T07:36:44.592656	3a734398	0	0	0.0000	CRASH	gen=273 glyphs=4
2026-03-14T07:36:44.592880	52f4c6db	0	0	0.0000	CRASH	gen=273 glyphs=4
2026-03-14T07:36:44.593106	099964a4	0	0	0.0000	CRASH	gen=273 glyphs=4
2026-03-14T07:36:44.593319	099964a4	0	0	0.0000	CRASH	gen=273 glyphs=4
2026-03-14T07:36:44.593627	099964a4	0	0	0.0000	CRASH	gen=274 glyphs=4
2026-03-14T07:36:44.593854	099964a4	0	0	0.0000	CRASH	gen=274 glyphs=4
2026-03-14T07:36:44.594079	099964a4	0	0	0.0000	CRASH	gen=274 glyphs=4
2026-03-14T07:36:44.594300	099964a4	0	0	0.0000	CRASH	gen=274 glyphs=4
2026-03-14T07:36:44.594530	099964a4	0	0	0.0000	CRASH	gen=274 glyphs=4
2026-03-14T07:36:44.594755	9cd5c313	0	0	0.0000	CRASH	gen=274 glyphs=4
2026-03-14T07:36:44.594982	099964a4	0	0	0.0000	CRASH	gen=274 glyphs=4
2026-03-14T07:36:44.595199	099964a4	0	0	0.0000	CRASH	gen=274 glyphs=4
2026-03-14T07:36:44.595422	7ede4765	0	0	0.0000	CRASH	gen=274 glyphs=2
2026-03-14T07:36:44.595645	13dfa0bb	0	0	0.0000	CRASH	gen=274 glyphs=4
2026-03-14T07:36:44.595949	099964a4	0	0	0.0000	CRASH	gen=275 glyphs=4
2026-03-14T07:36:44.596171	099964a4	0	0	0.0000	CRASH	gen=275 glyphs=4
2026-03-14T07:36:44.596393	be3671b6	0	0	0.0000	CRASH	gen=275 glyphs=2
2026-03-14T07:36:44.596617	099964a4	0	0	0.0000	CRASH	gen=275 glyphs=4
2026-03-14T07:36:44.596840	7ede4765	0	0	0.0000	CRASH	gen=275 glyphs=2
2026-03-14T07:36:44.597069	3a734398	0	0	0.0000	CRASH	gen=275 glyphs=4
2026-03-14T07:36:44.597291	099964a4	0	0	0.0000	CRASH	gen=275 glyphs=4
2026-03-14T07:36:44.597514	099964a4	0	0	0.0000	CRASH	gen=275 glyphs=4
2026-03-14T07:36:44.597739	689119d7	0	0	0.0000	CRASH	gen=275 glyphs=3
2026-03-14T07:36:44.597958	7ede4765	0	0	0.0000	CRASH	gen=275 glyphs=2
2026-03-14T07:36:44.598280	099964a4	0	0	0.0000	CRASH	gen=276 glyphs=4
2026-03-14T07:36:44.598499	099964a4	0	0	0.0000	CRASH	gen=276 glyphs=4
2026-03-14T07:36:44.598717	099964a4	0	0	0.0000	CRASH	gen=276 glyphs=4
2026-03-14T07:36:44.598935	3312b222	0	0	0.0000	CRASH	gen=276 glyphs=3
2026-03-14T07:36:44.599159	099964a4	0	0	0.0000	CRASH	gen=276 glyphs=4
2026-03-14T07:36:44.599379	bad1896c	0	0	0.0000	CRASH	gen=276 glyphs=3
2026-03-14T07:36:44.599598	099964a4	0	0	0.0000	CRASH	gen=276 glyphs=4
2026-03-14T07:36:44.599815	384b23c9	0	0	0.0000	CRASH	gen=276 glyphs=5
2026-03-14T07:36:44.600037	32f62cf7	0	0	0.0000	CRASH	gen=276 glyphs=4
2026-03-14T07:36:44.600262	ff30496a	0	0	0.0000	CRASH	gen=276 glyphs=3
2026-03-14T07:36:44.600585	099964a4	0	0	0.0000	CRASH	gen=277 glyphs=4
2026-03-14T07:36:44.600810	099964a4	0	0	0.0000	CRASH	gen=277 glyphs=4
2026-03-14T07:36:44.601032	099964a4	0	0	0.0000	CRASH	gen=277 glyphs=4
2026-03-14T07:36:44.601257	099964a4	0	0	0.0000	CRASH	gen=277 glyphs=4
2026-03-14T07:36:44.601473	099964a4	0	0	0.0000	CRASH	gen=277 glyphs=4
2026-03-14T07:36:44.601689	8da1f8d8	0	0	0.0000	CRASH	gen=277 glyphs=4
2026-03-14T07:36:44.601906	3a734398	0	0	0.0000	CRASH	gen=277 glyphs=4
2026-03-14T07:36:44.602123	dcb1fb50	0	0	0.0000	CRASH	gen=277 glyphs=4
2026-03-14T07:36:44.602344	b4ffebf8	0	0	0.0000	CRASH	gen=277 glyphs=3
2026-03-14T07:36:44.602559	099964a4	0	0	0.0000	CRASH	gen=277 glyphs=4
2026-03-14T07:36:44.602859	099964a4	0	0	0.0000	CRASH	gen=278 glyphs=4
2026-03-14T07:36:44.603073	099964a4	0	0	0.0000	CRASH	gen=278 glyphs=4
2026-03-14T07:36:44.603290	099964a4	0	0	0.0000	CRASH	gen=278 glyphs=4
2026-03-14T07:36:44.603499	8da1f8d8	0	0	0.0000	CRASH	gen=278 glyphs=4
2026-03-14T07:36:44.603712	e8bf4e06	0	0	0.0000	CRASH	gen=278 glyphs=3
2026-03-14T07:36:44.603929	099964a4	0	0	0.0000	CRASH	gen=278 glyphs=4
2026-03-14T07:36:44.604142	099964a4	0	0	0.0000	CRASH	gen=278 glyphs=4
2026-03-14T07:36:44.604359	099964a4	0	0	0.0000	CRASH	gen=278 glyphs=4
2026-03-14T07:36:44.604573	5fbb2baa	0	0	0.0000	CRASH	gen=278 glyphs=3
2026-03-14T07:36:44.604789	b6ea1f13	0	0	0.0000	CRASH	gen=278 glyphs=3
2026-03-14T07:36:44.605089	099964a4	0	0	0.0000	CRASH	gen=279 glyphs=4
2026-03-14T07:36:44.605303	099964a4	0	0	0.0000	CRASH	gen=279 glyphs=4
2026-03-14T07:36:44.605519	a75f5596	0	0	0.0000	CRASH	gen=279 glyphs=5
2026-03-14T07:36:44.605735	099964a4	0	0	0.0000	CRASH	gen=279 glyphs=4
2026-03-14T07:36:44.605948	3ca14993	0	0	0.0000	CRASH	gen=279 glyphs=4
2026-03-14T07:36:44.606171	099964a4	0	0	0.0000	CRASH	gen=279 glyphs=4
2026-03-14T07:36:44.606389	099964a4	0	0	0.0000	CRASH	gen=279 glyphs=4
2026-03-14T07:36:44.606618	dcb1fb50	0	0	0.0000	CRASH	gen=279 glyphs=4
2026-03-14T07:36:44.606837	d9007a9a	0	0	0.0000	CRASH	gen=279 glyphs=3
2026-03-14T07:36:44.607056	98d13b1d	0	0	0.0000	CRASH	gen=279 glyphs=4
2026-03-14T07:36:44.607373	099964a4	0	0	0.0000	CRASH	gen=280 glyphs=4
2026-03-14T07:36:44.607604	099964a4	0	0	0.0000	CRASH	gen=280 glyphs=4
2026-03-14T07:36:44.607827	ff30496a	0	0	0.0000	CRASH	gen=280 glyphs=3
2026-03-14T07:36:44.608047	099964a4	0	0	0.0000	CRASH	gen=280 glyphs=4
2026-03-14T07:36:44.608267	80cef82b	0	0	0.0000	CRASH	gen=280 glyphs=4
2026-03-14T07:36:44.608487	dcb1fb50	0	0	0.0000	CRASH	gen=280 glyphs=4
2026-03-14T07:36:44.608712	b1014059	0	0	0.0000	CRASH	gen=280 glyphs=3
2026-03-14T07:36:44.608921	9e2605bf	0	0	0.0000	CRASH	gen=280 glyphs=4
2026-03-14T07:36:44.609131	3ca14993	0	0	0.0000	CRASH	gen=280 glyphs=4
2026-03-14T07:36:44.609338	4ea278a1	0	0	0.0000	CRASH	gen=280 glyphs=4
2026-03-14T07:36:44.609622	099964a4	0	0	0.0000	CRASH	gen=281 glyphs=4
2026-03-14T07:36:44.609828	099964a4	0	0	0.0000	CRASH	gen=281 glyphs=4
2026-03-14T07:36:44.610029	d8309172	0	0	0.0000	CRASH	gen=281 glyphs=2
2026-03-14T07:36:44.610235	8bb21211	0	0	0.0000	CRASH	gen=281 glyphs=3
2026-03-14T07:36:44.610443	3a734398	0	0	0.0000	CRASH	gen=281 glyphs=4
2026-03-14T07:36:44.610652	ff30496a	0	0	0.0000	CRASH	gen=281 glyphs=3
2026-03-14T07:36:44.610863	099964a4	0	0	0.0000	CRASH	gen=281 glyphs=4
2026-03-14T07:36:44.611067	4f8b5c2e	0	0	0.0000	CRASH	gen=281 glyphs=3
2026-03-14T07:36:44.611275	099964a4	0	0	0.0000	CRASH	gen=281 glyphs=4
2026-03-14T07:36:44.611482	099964a4	0	0	0.0000	CRASH	gen=281 glyphs=4
2026-03-14T07:36:44.611785	099964a4	0	0	0.0000	CRASH	gen=282 glyphs=4
2026-03-14T07:36:44.611996	099964a4	0	0	0.0000	CRASH	gen=282 glyphs=4
2026-03-14T07:36:44.612210	0e6278cd	0	0	0.0000	CRASH	gen=282 glyphs=4
2026-03-14T07:36:44.612426	8da1f8d8	0	0	0.0000	CRASH	gen=282 glyphs=4
2026-03-14T07:36:44.612635	099964a4	0	0	0.0000	CRASH	gen=282 glyphs=4
2026-03-14T07:36:44.612835	099964a4	0	0	0.0000	CRASH	gen=282 glyphs=4
2026-03-14T07:36:44.613035	47f3db14	0	0	0.0000	CRASH	gen=282 glyphs=3
2026-03-14T07:36:44.613241	099964a4	0	0	0.0000	CRASH	gen=282 glyphs=4
2026-03-14T07:36:44.613451	396c0f90	0	0	0.0000	CRASH	gen=282 glyphs=4
2026-03-14T07:36:44.613670	7ede4765	0	0	0.0000	CRASH	gen=282 glyphs=2
2026-03-14T07:36:44.613988	099964a4	0	0	0.0000	CRASH	gen=283 glyphs=4
2026-03-14T07:36:44.614205	099964a4	0	0	0.0000	CRASH	gen=283 glyphs=4
2026-03-14T07:36:44.614419	099964a4	0	0	0.0000	CRASH	gen=283 glyphs=4
2026-03-14T07:36:44.614635	217094ad	0	0	0.0000	CRASH	gen=283 glyphs=4
2026-03-14T07:36:44.614850	3ca14993	0	0	0.0000	CRASH	gen=283 glyphs=4
2026-03-14T07:36:44.615072	34b03500	0	0	0.0000	CRASH	gen=283 glyphs=4
2026-03-14T07:36:44.615285	7e5a80c9	0	0	0.0000	CRASH	gen=283 glyphs=3
2026-03-14T07:36:44.615504	35081949	0	0	0.0000	CRASH	gen=283 glyphs=5
2026-03-14T07:36:44.615729	099964a4	0	0	0.0000	CRASH	gen=283 glyphs=4
2026-03-14T07:36:44.615947	099964a4	0	0	0.0000	CRASH	gen=283 glyphs=4
2026-03-14T07:36:44.616244	099964a4	0	0	0.0000	CRASH	gen=284 glyphs=4
2026-03-14T07:36:44.616458	099964a4	0	0	0.0000	CRASH	gen=284 glyphs=4
2026-03-14T07:36:44.616675	ae0df6c6	0	0	0.0000	CRASH	gen=284 glyphs=4
2026-03-14T07:36:44.616890	fd7ed0b1	0	0	0.0000	CRASH	gen=284 glyphs=4
2026-03-14T07:36:44.617104	4208934e	0	0	0.0000	CRASH	gen=284 glyphs=2
2026-03-14T07:36:44.617316	099964a4	0	0	0.0000	CRASH	gen=284 glyphs=4
2026-03-14T07:36:44.617529	099964a4	0	0	0.0000	CRASH	gen=284 glyphs=4
2026-03-14T07:36:44.617738	cdee2d02	0	0	0.0000	CRASH	gen=284 glyphs=4
2026-03-14T07:36:44.617954	67cea5ce	0	0	0.0000	CRASH	gen=284 glyphs=4
2026-03-14T07:36:44.618173	099964a4	0	0	0.0000	CRASH	gen=284 glyphs=4
2026-03-14T07:36:44.618482	099964a4	0	0	0.0000	CRASH	gen=285 glyphs=4
2026-03-14T07:36:44.618701	099964a4	0	0	0.0000	CRASH	gen=285 glyphs=4
2026-03-14T07:36:44.618917	ff30496a	0	0	0.0000	CRASH	gen=285 glyphs=3
2026-03-14T07:36:44.619129	099964a4	0	0	0.0000	CRASH	gen=285 glyphs=4
2026-03-14T07:36:44.619342	099964a4	0	0	0.0000	CRASH	gen=285 glyphs=4
2026-03-14T07:36:44.619563	cf93b656	0	0	0.0000	CRASH	gen=285 glyphs=3
2026-03-14T07:36:44.619774	ff30496a	0	0	0.0000	CRASH	gen=285 glyphs=3
2026-03-14T07:36:44.619988	8da1f8d8	0	0	0.0000	CRASH	gen=285 glyphs=4
2026-03-14T07:36:44.620208	1b3a7110	0	0	0.0000	CRASH	gen=285 glyphs=3
2026-03-14T07:36:44.620420	9be88adb	0	0	0.0000	CRASH	gen=285 glyphs=4
2026-03-14T07:36:44.620714	099964a4	0	0	0.0000	CRASH	gen=286 glyphs=4
2026-03-14T07:36:44.620928	099964a4	0	0	0.0000	CRASH	gen=286 glyphs=4
2026-03-14T07:36:44.621142	099964a4	0	0	0.0000	CRASH	gen=286 glyphs=4
2026-03-14T07:36:44.621353	f61aed95	0	0	0.0000	CRASH	gen=286 glyphs=3
2026-03-14T07:36:44.621571	ba77da83	0	0	0.0000	CRASH	gen=286 glyphs=4
2026-03-14T07:36:44.621786	099964a4	0	0	0.0000	CRASH	gen=286 glyphs=4
2026-03-14T07:36:44.621998	099964a4	0	0	0.0000	CRASH	gen=286 glyphs=4
2026-03-14T07:36:44.622207	099964a4	0	0	0.0000	CRASH	gen=286 glyphs=4
2026-03-14T07:36:44.622416	099964a4	0	0	0.0000	CRASH	gen=286 glyphs=4
2026-03-14T07:36:44.622632	099964a4	0	0	0.0000	CRASH	gen=286 glyphs=4
2026-03-14T07:36:44.622927	099964a4	0	0	0.0000	CRASH	gen=287 glyphs=4
2026-03-14T07:36:44.623143	099964a4	0	0	0.0000	CRASH	gen=287 glyphs=4
2026-03-14T07:36:44.623364	b6824bf0	0	0	0.0000	CRASH	gen=287 glyphs=3
2026-03-14T07:36:44.623583	345acd8e	0	0	0.0000	CRASH	gen=287 glyphs=2
2026-03-14T07:36:44.623795	402cc652	0	0	0.0000	CRASH	gen=287 glyphs=4
2026-03-14T07:36:44.624005	099964a4	0	0	0.0000	CRASH	gen=287 glyphs=4
2026-03-14T07:36:44.624217	099964a4	0	0	0.0000	CRASH	gen=287 glyphs=4
2026-03-14T07:36:44.624431	7ede4765	0	0	0.0000	CRASH	gen=287 glyphs=2
2026-03-14T07:36:44.624648	099964a4	0	0	0.0000	CRASH	gen=287 glyphs=4
2026-03-14T07:36:44.624864	f78e862a	0	0	0.0000	CRASH	gen=287 glyphs=3
2026-03-14T07:36:44.625162	099964a4	0	0	0.0000	CRASH	gen=288 glyphs=4
2026-03-14T07:36:44.625379	099964a4	0	0	0.0000	CRASH	gen=288 glyphs=4
2026-03-14T07:36:44.625599	3a734398	0	0	0.0000	CRASH	gen=288 glyphs=4
2026-03-14T07:36:44.625815	80cef82b	0	0	0.0000	CRASH	gen=288 glyphs=4
2026-03-14T07:36:44.626030	f2ab8e49	0	0	0.0000	CRASH	gen=288 glyphs=3
2026-03-14T07:36:44.626242	c9c21ad0	0	0	0.0000	CRASH	gen=288 glyphs=3
2026-03-14T07:36:44.626454	976862c6	0	0	0.0000	CRASH	gen=288 glyphs=4
2026-03-14T07:36:44.626672	9c796e24	0	0	0.0000	CRASH	gen=288 glyphs=4
2026-03-14T07:36:44.626893	099964a4	0	0	0.0000	CRASH	gen=288 glyphs=4
2026-03-14T07:36:44.627114	099964a4	0	0	0.0000	CRASH	gen=288 glyphs=4
2026-03-14T07:36:44.627417	099964a4	0	0	0.0000	CRASH	gen=289 glyphs=4
2026-03-14T07:36:44.627640	099964a4	0	0	0.0000	CRASH	gen=289 glyphs=4
2026-03-14T07:36:44.627855	8da1f8d8	0	0	0.0000	CRASH	gen=289 glyphs=4
2026-03-14T07:36:44.628072	548e88ff	0	0	0.0000	CRASH	gen=289 glyphs=4
2026-03-14T07:36:44.628291	099964a4	0	0	0.0000	CRASH	gen=289 glyphs=4
2026-03-14T07:36:44.628503	099964a4	0	0	0.0000	CRASH	gen=289 glyphs=4
2026-03-14T07:36:44.628719	099964a4	0	0	0.0000	CRASH	gen=289 glyphs=4
2026-03-14T07:36:44.628925	e7990a9a	0	0	0.0000	CRASH	gen=289 glyphs=4
2026-03-14T07:36:44.629141	099964a4	0	0	0.0000	CRASH	gen=289 glyphs=4
2026-03-14T07:36:44.629341	60312707	0	0	0.0000	CRASH	gen=289 glyphs=2
2026-03-14T07:36:44.629629	099964a4	0	0	0.0000	CRASH	gen=290 glyphs=4
2026-03-14T07:36:44.629825	099964a4	0	0	0.0000	CRASH	gen=290 glyphs=4
2026-03-14T07:36:44.630025	099964a4	0	0	0.0000	CRASH	gen=290 glyphs=4
2026-03-14T07:36:44.630219	099964a4	0	0	0.0000	CRASH	gen=290 glyphs=4
2026-03-14T07:36:44.630419	6e86aa8a	0	0	0.0000	CRASH	gen=290 glyphs=3
2026-03-14T07:36:44.630614	099964a4	0	0	0.0000	CRASH	gen=290 glyphs=4
2026-03-14T07:36:44.630806	099964a4	0	0	0.0000	CRASH	gen=290 glyphs=4
2026-03-14T07:36:44.631000	2120bf31	0	0	0.0000	CRASH	gen=290 glyphs=4
2026-03-14T07:36:44.631196	099964a4	0	0	0.0000	CRASH	gen=290 glyphs=4
2026-03-14T07:36:44.631394	4b1d7960	0	0	0.0000	CRASH	gen=290 glyphs=4
2026-03-14T07:36:44.631676	099964a4	0	0	0.0000	CRASH	gen=291 glyphs=4
2026-03-14T07:36:44.631875	099964a4	0	0	0.0000	CRASH	gen=291 glyphs=4
2026-03-14T07:36:44.632074	cf93b656	0	0	0.0000	CRASH	gen=291 glyphs=3
2026-03-14T07:36:44.632269	80cef82b	0	0	0.0000	CRASH	gen=291 glyphs=4
2026-03-14T07:36:44.632470	099964a4	0	0	0.0000	CRASH	gen=291 glyphs=4
2026-03-14T07:36:44.632664	099964a4	0	0	0.0000	CRASH	gen=291 glyphs=4
2026-03-14T07:36:44.632857	099964a4	0	0	0.0000	CRASH	gen=291 glyphs=4
2026-03-14T07:36:44.633053	ff30496a	0	0	0.0000	CRASH	gen=291 glyphs=3
2026-03-14T07:36:44.633247	3ca14993	0	0	0.0000	CRASH	gen=291 glyphs=4
2026-03-14T07:36:44.633446	de6ddd3d	0	0	0.0000	CRASH	gen=291 glyphs=4
2026-03-14T07:36:44.633734	099964a4	0	0	0.0000	CRASH	gen=292 glyphs=4
2026-03-14T07:36:44.633932	099964a4	0	0	0.0000	CRASH	gen=292 glyphs=4
2026-03-14T07:36:44.634130	099964a4	0	0	0.0000	CRASH	gen=292 glyphs=4
2026-03-14T07:36:44.634326	1ac13e9d	0	0	0.0000	CRASH	gen=292 glyphs=5
2026-03-14T07:36:44.634521	099964a4	0	0	0.0000	CRASH	gen=292 glyphs=4
2026-03-14T07:36:44.634723	d6366d45	0	0	0.0000	CRASH	gen=292 glyphs=4
2026-03-14T07:36:44.634920	dcb1fb50	0	0	0.0000	CRASH	gen=292 glyphs=4
2026-03-14T07:36:44.635114	7ede4765	0	0	0.0000	CRASH	gen=292 glyphs=2
2026-03-14T07:36:44.635307	4b327687	0	0	0.0000	CRASH	gen=292 glyphs=4
2026-03-14T07:36:44.635499	099964a4	0	0	0.0000	CRASH	gen=292 glyphs=4
2026-03-14T07:36:44.635792	099964a4	0	0	0.0000	CRASH	gen=293 glyphs=4
2026-03-14T07:36:44.635989	099964a4	0	0	0.0000	CRASH	gen=293 glyphs=4
2026-03-14T07:36:44.636183	d7b0985f	0	0	0.0000	CRASH	gen=293 glyphs=4
2026-03-14T07:36:44.636378	54787c6a	0	0	0.0000	CRASH	gen=293 glyphs=5
2026-03-14T07:36:44.636579	099964a4	0	0	0.0000	CRASH	gen=293 glyphs=4
2026-03-14T07:36:44.636780	57ba729f	0	0	0.0000	CRASH	gen=293 glyphs=4
2026-03-14T07:36:44.636974	dffabac7	0	0	0.0000	CRASH	gen=293 glyphs=4
2026-03-14T07:36:44.637168	099964a4	0	0	0.0000	CRASH	gen=293 glyphs=4
2026-03-14T07:36:44.637361	099964a4	0	0	0.0000	CRASH	gen=293 glyphs=4
2026-03-14T07:36:44.637554	099964a4	0	0	0.0000	CRASH	gen=293 glyphs=4
2026-03-14T07:36:44.637833	099964a4	0	0	0.0000	CRASH	gen=294 glyphs=4
2026-03-14T07:36:44.638030	099964a4	0	0	0.0000	CRASH	gen=294 glyphs=4
2026-03-14T07:36:44.638224	099964a4	0	0	0.0000	CRASH	gen=294 glyphs=4
2026-03-14T07:36:44.638417	80cef82b	0	0	0.0000	CRASH	gen=294 glyphs=4
2026-03-14T07:36:44.638613	0a580c06	0	0	0.0000	CRASH	gen=294 glyphs=3
2026-03-14T07:36:44.638806	a5e37687	0	0	0.0000	CRASH	gen=294 glyphs=4
2026-03-14T07:36:44.639004	8da1f8d8	0	0	0.0000	CRASH	gen=294 glyphs=4
