timestamp	program_hash	spirv_size	word_count	fitness	status	description
2026-03-13T23:54:33.014458	bfdf7cad	120	30	1.0000	DISCARD	gen=213 glyphs=4
2026-03-13T23:54:33.285053	19355583	120	30	1.0000	DISCARD	gen=257 glyphs=4
2026-03-13T23:54:35.750933	37f4017b	116	29	1.0000	DISCARD	gen=213 glyphs=4
2026-03-13T23:54:36.029002	8aef8872	116	29	1.0000	DISCARD	gen=257 glyphs=4
2026-03-13T23:54:38.477111	bfc4bb58	116	29	1.0000	DISCARD	gen=213 glyphs=4
2026-03-13T23:54:38.740050	50dc991d	116	29	1.0000	DISCARD	gen=257 glyphs=4
2026-03-13T23:54:41.184039	37f4017b	116	29	1.0000	DISCARD	gen=213 glyphs=4
2026-03-13T23:54:41.451559	0eaedb57	116	29	1.0000	DISCARD	gen=257 glyphs=4
2026-03-13T23:54:43.901541	37f4017b	116	29	1.0000	DISCARD	gen=213 glyphs=4
2026-03-13T23:54:44.173080	050862ad	120	30	1.0000	DISCARD	gen=257 glyphs=4
2026-03-13T23:54:46.617983	9657c13e	116	29	1.0000	DISCARD	gen=213 glyphs=4
2026-03-13T23:54:46.885488	7966e6ab	120	30	1.0000	DISCARD	gen=257 glyphs=4
2026-03-13T23:54:49.363849	37f4017b	116	29	1.0000	DISCARD	gen=213 glyphs=4
2026-03-13T23:54:49.669905	cda7d3ee	120	30	1.0000	DISCARD	gen=257 glyphs=4
2026-03-13T23:54:52.100618	37f4017b	116	29	1.0000	DISCARD	gen=213 glyphs=4
2026-03-13T23:54:52.367295	0eaedb57	116	29	1.0000	DISCARD	gen=257 glyphs=4
2026-03-13T23:54:54.812897	3abf4263	120	30	1.0000	DISCARD	gen=213 glyphs=4
2026-03-13T23:54:55.088882	050862ad	120	30	1.0000	DISCARD	gen=257 glyphs=4
2026-03-13T23:54:57.520855	37f4017b	116	29	1.0000	DISCARD	gen=214 glyphs=4
2026-03-13T23:54:57.789542	e8c7f6cf	120	30	1.0000	DISCARD	gen=257 glyphs=4
2026-03-13T23:55:00.244833	bfdf7cad	120	30	1.0000	DISCARD	gen=214 glyphs=4
2026-03-13T23:55:00.515299	19355583	120	30	1.0000	DISCARD	gen=258 glyphs=4
2026-03-13T23:55:02.976883	fdb5d108	120	30	1.0000	DISCARD	gen=214 glyphs=4
2026-03-13T23:55:03.247544	8aef8872	116	29	1.0000	DISCARD	gen=258 glyphs=4
2026-03-13T23:55:05.670036	5a06ca32	120	30	1.0000	DISCARD	gen=214 glyphs=4
2026-03-13T23:55:05.941325	ae44ace5	116	29	1.0000	DISCARD	gen=258 glyphs=4
2026-03-13T23:55:08.367295	bfdf7cad	120	30	1.0000	DISCARD	gen=214 glyphs=4
2026-03-13T23:55:08.642244	50dc991d	116	29	1.0000	DISCARD	gen=258 glyphs=4
2026-03-13T23:55:11.074086	bfdf7cad	120	30	1.0000	DISCARD	gen=214 glyphs=4
2026-03-13T23:55:11.341285	75401213	116	29	1.0000	DISCARD	gen=258 glyphs=4
2026-03-13T23:55:13.787775	55d6c151	120	30	1.0000	DISCARD	gen=214 glyphs=4
2026-03-13T23:55:14.060127	d0576c3a	116	29	0.9500	DISCARD	gen=258 glyphs=4
2026-03-13T23:55:16.477258	37f4017b	116	29	1.0000	DISCARD	gen=214 glyphs=4
2026-03-13T23:55:16.744772	28a9b6df	116	29	1.0000	DISCARD	gen=258 glyphs=4
2026-03-13T23:55:19.159565	1d34459a	116	29	1.0000	DISCARD	gen=214 glyphs=4
2026-03-13T23:55:19.431499	6d08c6ff	116	29	1.0000	DISCARD	gen=258 glyphs=4
2026-03-13T23:55:21.922066	5a06ca32	120	30	1.0000	DISCARD	gen=214 glyphs=4
2026-03-13T23:55:22.189089	19355583	120	30	1.0000	DISCARD	gen=258 glyphs=4
2026-03-13T23:55:24.620539	37f4017b	116	29	1.0000	DISCARD	gen=215 glyphs=4
2026-03-13T23:55:24.889120	98044589	120	30	0.9500	DISCARD	gen=258 glyphs=4
2026-03-13T23:55:27.294164	bfdf7cad	120	30	1.0000	DISCARD	gen=215 glyphs=4
2026-03-13T23:55:27.558251	19355583	120	30	1.0000	DISCARD	gen=259 glyphs=4
2026-03-13T23:55:29.999747	7ca87b42	116	29	1.0000	DISCARD	gen=215 glyphs=4
2026-03-13T23:55:30.279083	8aef8872	116	29	1.0000	DISCARD	gen=259 glyphs=4
2026-03-13T23:55:32.690509	e5dddb53	120	30	1.0000	DISCARD	gen=215 glyphs=4
2026-03-13T23:55:32.952339	0a99069d	120	30	1.0000	DISCARD	gen=259 glyphs=4
2026-03-13T23:55:35.398576	2701cb73	116	29	1.0000	DISCARD	gen=215 glyphs=4
2026-03-13T23:55:35.667483	19355583	120	30	1.0000	DISCARD	gen=259 glyphs=4
2026-03-13T23:55:38.104331	37f4017b	116	29	1.0000	DISCARD	gen=215 glyphs=4
2026-03-13T23:55:38.370401	855d4019	120	30	1.0000	DISCARD	gen=259 glyphs=4
2026-03-13T23:55:40.809119	2701cb73	116	29	1.0000	DISCARD	gen=215 glyphs=4
2026-03-13T23:55:41.085589	050862ad	120	30	1.0000	DISCARD	gen=259 glyphs=4
2026-03-13T23:55:43.511845	1d34459a	116	29	1.0000	DISCARD	gen=215 glyphs=4
2026-03-13T23:55:43.781925	1e5f0e21	116	29	1.0000	DISCARD	gen=259 glyphs=4
2026-03-13T23:55:46.196763	e9eaf2ef	120	30	1.0000	DISCARD	gen=215 glyphs=4
2026-03-13T23:55:46.466841	50dc991d	116	29	1.0000	DISCARD	gen=259 glyphs=4
2026-03-13T23:55:48.923145	fdb5d108	120	30	1.0000	DISCARD	gen=215 glyphs=4
2026-03-13T23:55:49.183482	e8c7f6cf	120	30	1.0000	DISCARD	gen=259 glyphs=4
2026-03-13T23:55:51.623162	37f4017b	116	29	1.0000	DISCARD	gen=216 glyphs=4
2026-03-13T23:55:51.904582	19355583	120	30	1.0000	DISCARD	gen=259 glyphs=4
2026-03-13T23:55:54.609760	bfdf7cad	120	30	1.0000	DISCARD	gen=216 glyphs=4
2026-03-13T23:55:54.889892	19355583	120	30	1.0000	DISCARD	gen=260 glyphs=4
2026-03-13T23:55:57.303046	fdb5d108	120	30	1.0000	DISCARD	gen=216 glyphs=4
2026-03-13T23:55:57.567566	8aef8872	116	29	1.0000	DISCARD	gen=260 glyphs=4
2026-03-13T23:56:00.005453	37f4017b	116	29	1.0000	DISCARD	gen=216 glyphs=4
2026-03-13T23:56:00.270576	1e5f0e21	116	29	1.0000	DISCARD	gen=260 glyphs=4
2026-03-13T23:56:02.730949	7a9deebb	120	30	1.0000	DISCARD	gen=216 glyphs=4
2026-03-13T23:56:03.005999	1be33833	120	30	1.0000	DISCARD	gen=260 glyphs=4
2026-03-13T23:56:05.440906	ec6df13e	116	29	1.0000	DISCARD	gen=216 glyphs=4
2026-03-13T23:56:05.701942	05747e49	116	29	1.0000	DISCARD	gen=260 glyphs=4
2026-03-13T23:56:08.193807	7ca87b42	116	29	1.0000	DISCARD	gen=216 glyphs=4
2026-03-13T23:56:08.464243	50dc991d	116	29	1.0000	DISCARD	gen=260 glyphs=4
2026-03-13T23:56:10.910944	c4c2e404	120	30	1.0000	DISCARD	gen=216 glyphs=4
2026-03-13T23:56:11.176707	1e5f0e21	116	29	1.0000	DISCARD	gen=260 glyphs=4
2026-03-13T23:56:13.621633	37f4017b	116	29	1.0000	DISCARD	gen=216 glyphs=4
2026-03-13T23:56:13.882838	e2cd28ea	120	30	1.0000	DISCARD	gen=260 glyphs=4
2026-03-13T23:56:16.359050	37f4017b	116	29	1.0000	DISCARD	gen=216 glyphs=4
2026-03-13T23:56:16.623277	b7aed8e9	116	29	1.0000	DISCARD	gen=260 glyphs=4
2026-03-13T23:56:19.051742	37f4017b	116	29	1.0000	DISCARD	gen=217 glyphs=4
2026-03-13T23:56:19.317043	2c340b25	120	30	1.0000	DISCARD	gen=260 glyphs=4
2026-03-13T23:56:21.782612	bfdf7cad	120	30	1.0000	DISCARD	gen=217 glyphs=4
2026-03-13T23:56:22.046338	19355583	120	30	1.0000	DISCARD	gen=261 glyphs=4
2026-03-13T23:56:24.538474	37f4017b	116	29	1.0000	DISCARD	gen=217 glyphs=4
2026-03-13T23:56:24.802613	8aef8872	116	29	1.0000	DISCARD	gen=261 glyphs=4
2026-03-13T23:56:27.289231	5b9807ac	120	30	1.0000	DISCARD	gen=217 glyphs=4
2026-03-13T23:56:27.564355	2302c130	116	29	1.0000	DISCARD	gen=261 glyphs=4
2026-03-13T23:56:29.997587	4ae7260e	116	29	1.0000	DISCARD	gen=217 glyphs=4
2026-03-13T23:56:30.277377	c498db10	120	30	1.0000	DISCARD	gen=261 glyphs=4
2026-03-13T23:56:32.685920	55d6c151	120	30	1.0000	DISCARD	gen=217 glyphs=4
2026-03-13T23:56:32.959277	4195a5de	116	29	1.0000	DISCARD	gen=261 glyphs=4
2026-03-13T23:56:35.374106	5a06ca32	120	30	1.0000	DISCARD	gen=217 glyphs=4
2026-03-13T23:56:35.660427	ae44ace5	116	29	1.0000	DISCARD	gen=261 glyphs=4
2026-03-13T23:56:38.093031	cc442d7c	116	29	1.0000	DISCARD	gen=217 glyphs=4
2026-03-13T23:56:38.361534	8aef8872	116	29	1.0000	DISCARD	gen=261 glyphs=4
2026-03-13T23:56:40.786079	5a06ca32	120	30	1.0000	DISCARD	gen=217 glyphs=4
2026-03-13T23:56:41.060851	0eaedb57	116	29	1.0000	DISCARD	gen=261 glyphs=4
2026-03-13T23:56:43.492070	37f4017b	116	29	1.0000	DISCARD	gen=217 glyphs=4
2026-03-13T23:56:43.755119	19355583	120	30	1.0000	DISCARD	gen=261 glyphs=4
2026-03-13T23:56:46.189510	37f4017b	116	29	1.0000	DISCARD	gen=218 glyphs=4
2026-03-13T23:56:46.460199	b57e7176	120	30	1.0000	DISCARD	gen=261 glyphs=4
2026-03-13T23:56:48.849848	bfdf7cad	120	30	1.0000	DISCARD	gen=218 glyphs=4
2026-03-13T23:56:49.134354	19355583	120	30	1.0000	DISCARD	gen=262 glyphs=4
2026-03-13T23:56:51.540445	38fbc362	116	29	1.0000	DISCARD	gen=218 glyphs=4
2026-03-13T23:56:51.813502	8aef8872	116	29	1.0000	DISCARD	gen=262 glyphs=4
2026-03-13T23:56:54.231573	37f4017b	116	29	1.0000	DISCARD	gen=218 glyphs=4
2026-03-13T23:56:54.503579	050862ad	120	30	1.0000	DISCARD	gen=262 glyphs=4
2026-03-13T23:56:57.061297	4c9b0dd4	120	30	1.0000	DISCARD	gen=218 glyphs=4
2026-03-13T23:56:57.342744	0eaedb57	116	29	1.0000	DISCARD	gen=262 glyphs=4
2026-03-13T23:56:59.764995	727fabe5	124	31	0.9500	DISCARD	gen=218 glyphs=4
2026-03-13T23:57:00.041273	9a09dac0	116	29	1.0000	DISCARD	gen=262 glyphs=4
2026-03-13T23:57:02.463006	37f4017b	116	29	1.0000	DISCARD	gen=218 glyphs=4
2026-03-13T23:57:02.746623	a78f9454	120	30	1.0000	DISCARD	gen=262 glyphs=4
2026-03-13T23:57:05.208412	55d6c151	120	30	1.0000	DISCARD	gen=218 glyphs=4
2026-03-13T23:57:05.486664	1c4e6b77	116	29	1.0000	DISCARD	gen=262 glyphs=4
2026-03-13T23:57:07.912630	37f4017b	116	29	1.0000	DISCARD	gen=218 glyphs=4
2026-03-13T23:57:08.178596	3eb51b28	116	29	0.9500	DISCARD	gen=262 glyphs=4
2026-03-13T23:57:10.599757	fdb5d108	120	30	1.0000	DISCARD	gen=218 glyphs=4
2026-03-13T23:57:10.856921	ae44ace5	116	29	1.0000	DISCARD	gen=262 glyphs=4
2026-03-13T23:57:13.285251	37f4017b	116	29	1.0000	DISCARD	gen=219 glyphs=4
2026-03-13T23:57:13.556631	e9b7b8ca	116	29	0.9500	DISCARD	gen=262 glyphs=4
2026-03-13T23:57:16.013690	bfdf7cad	120	30	1.0000	DISCARD	gen=219 glyphs=4
2026-03-13T23:57:16.272971	19355583	120	30	1.0000	DISCARD	gen=263 glyphs=4
2026-03-13T23:57:18.705578	55d6c151	120	30	1.0000	DISCARD	gen=219 glyphs=4
2026-03-13T23:57:18.966696	8aef8872	116	29	1.0000	DISCARD	gen=263 glyphs=4
2026-03-13T23:57:21.447870	d8bf26ec	116	29	1.0000	DISCARD	gen=219 glyphs=4
2026-03-13T23:57:21.712676	eca7ab6c	116	29	1.0000	DISCARD	gen=263 glyphs=4
2026-03-13T23:57:24.135899	5a06ca32	120	30	1.0000	DISCARD	gen=219 glyphs=4
2026-03-13T23:57:24.392334	4d57607f	116	29	1.0000	DISCARD	gen=263 glyphs=4
2026-03-13T23:57:26.818147	5a06ca32	120	30	1.0000	DISCARD	gen=219 glyphs=4
2026-03-13T23:57:27.084920	15e51b8f	120	30	1.0000	DISCARD	gen=263 glyphs=4
2026-03-13T23:57:29.577028	fdb5d108	120	30	1.0000	DISCARD	gen=219 glyphs=4
2026-03-13T23:57:29.840584	a78f9454	120	30	1.0000	DISCARD	gen=263 glyphs=4
2026-03-13T23:57:32.287830	37f4017b	116	29	1.0000	DISCARD	gen=219 glyphs=4
2026-03-13T23:57:32.563923	9e34ede0	116	29	1.0000	DISCARD	gen=263 glyphs=4
2026-03-13T23:57:35.013007	37f4017b	116	29	1.0000	DISCARD	gen=219 glyphs=4
2026-03-13T23:57:35.283471	d7c8681b	120	30	1.0000	DISCARD	gen=263 glyphs=4
2026-03-13T23:57:37.722214	e99cb946	116	29	1.0000	DISCARD	gen=219 glyphs=4
2026-03-13T23:57:37.991731	3ac5a407	120	30	1.0000	DISCARD	gen=263 glyphs=4
2026-03-13T23:57:40.391475	37f4017b	116	29	1.0000	DISCARD	gen=220 glyphs=4
2026-03-13T23:57:40.668310	9e34ede0	116	29	1.0000	DISCARD	gen=263 glyphs=4
2026-03-13T23:57:43.091847	bfdf7cad	120	30	1.0000	DISCARD	gen=220 glyphs=4
2026-03-13T23:57:43.369397	19355583	120	30	1.0000	DISCARD	gen=264 glyphs=4
2026-03-13T23:57:45.829303	5a06ca32	120	30	1.0000	DISCARD	gen=220 glyphs=4
2026-03-13T23:57:46.093108	8aef8872	116	29	1.0000	DISCARD	gen=264 glyphs=4
2026-03-13T23:57:48.519597	1d34459a	116	29	1.0000	DISCARD	gen=220 glyphs=4
2026-03-13T23:57:48.794078	472ce298	120	30	1.0000	DISCARD	gen=264 glyphs=4
2026-03-13T23:57:51.239373	4c9b0dd4	120	30	1.0000	DISCARD	gen=220 glyphs=4
2026-03-13T23:57:51.507847	44097ba0	116	29	1.0000	DISCARD	gen=264 glyphs=4
2026-03-13T23:57:53.938409	37f4017b	116	29	1.0000	DISCARD	gen=220 glyphs=4
2026-03-13T23:57:54.201314	c7635f07	116	29	1.0000	DISCARD	gen=264 glyphs=4
2026-03-13T23:57:56.630234	5a06ca32	120	30	1.0000	DISCARD	gen=220 glyphs=4
2026-03-13T23:57:56.904908	ca08dfd3	116	29	1.0000	DISCARD	gen=264 glyphs=4
2026-03-13T23:57:59.324952	55d6c151	120	30	1.0000	DISCARD	gen=220 glyphs=4
2026-03-13T23:57:59.601601	e06397b1	116	29	1.0000	DISCARD	gen=264 glyphs=4
2026-03-13T23:58:02.126910	37f4017b	116	29	1.0000	DISCARD	gen=220 glyphs=4
2026-03-13T23:58:02.400619	0eaedb57	116	29	1.0000	DISCARD	gen=264 glyphs=4
2026-03-13T23:58:04.805669	1d34459a	116	29	1.0000	DISCARD	gen=220 glyphs=4
2026-03-13T23:58:05.069362	932d852d	116	29	1.0000	DISCARD	gen=264 glyphs=4
2026-03-13T23:58:07.488373	37f4017b	116	29	1.0000	DISCARD	gen=221 glyphs=4
2026-03-13T23:58:07.758282	2c15ba00	116	29	1.0000	DISCARD	gen=264 glyphs=4
2026-03-13T23:58:10.215622	bfdf7cad	120	30	1.0000	DISCARD	gen=221 glyphs=4
2026-03-13T23:58:10.484464	19355583	120	30	1.0000	DISCARD	gen=265 glyphs=4
2026-03-13T23:58:12.907266	37f4017b	116	29	1.0000	DISCARD	gen=221 glyphs=4
2026-03-13T23:58:13.175339	8aef8872	116	29	1.0000	DISCARD	gen=265 glyphs=4
2026-03-13T23:58:15.808412	6b28237e	120	30	1.0000	DISCARD	gen=221 glyphs=4
2026-03-13T23:58:16.090203	8aef8872	116	29	1.0000	DISCARD	gen=265 glyphs=4
2026-03-13T23:58:18.527598	fdb5d108	120	30	1.0000	DISCARD	gen=221 glyphs=4
2026-03-13T23:58:18.794549	8aef8872	116	29	1.0000	DISCARD	gen=265 glyphs=4
2026-03-13T23:58:21.223311	55d6c151	120	30	1.0000	DISCARD	gen=221 glyphs=4
2026-03-13T23:58:21.497654	19355583	120	30	1.0000	DISCARD	gen=265 glyphs=4
2026-03-13T23:58:23.939488	5a06ca32	120	30	1.0000	DISCARD	gen=221 glyphs=4
2026-03-13T23:58:24.206991	15807ebe	116	29	1.0000	DISCARD	gen=265 glyphs=4
2026-03-13T23:58:26.662114	4c9b0dd4	120	30	1.0000	DISCARD	gen=221 glyphs=4
2026-03-13T23:58:26.938427	19355583	120	30	1.0000	DISCARD	gen=265 glyphs=4
2026-03-13T23:58:29.374015	bfdf7cad	120	30	1.0000	DISCARD	gen=221 glyphs=4
2026-03-13T23:58:29.644352	2679715f	120	30	1.0000	DISCARD	gen=265 glyphs=4
2026-03-13T23:58:32.141047	71e2ba66	116	29	1.0000	DISCARD	gen=221 glyphs=4
2026-03-13T23:58:32.418700	0eaedb57	116	29	1.0000	DISCARD	gen=265 glyphs=4
2026-03-13T23:58:34.833297	37f4017b	116	29	1.0000	DISCARD	gen=222 glyphs=4
2026-03-13T23:58:35.107775	40a73b82	116	29	0.9500	DISCARD	gen=265 glyphs=4
2026-03-13T23:58:37.549761	bfdf7cad	120	30	1.0000	DISCARD	gen=222 glyphs=4
2026-03-13T23:58:37.826847	19355583	120	30	1.0000	DISCARD	gen=266 glyphs=4
2026-03-13T23:58:40.282803	5a06ca32	120	30	1.0000	DISCARD	gen=222 glyphs=4
2026-03-13T23:58:40.543823	8aef8872	116	29	1.0000	DISCARD	gen=266 glyphs=4
2026-03-13T23:58:42.998305	b1d92c0e	116	29	1.0000	DISCARD	gen=222 glyphs=4
2026-03-13T23:58:43.268650	64b618d2	120	30	1.0000	DISCARD	gen=266 glyphs=4
2026-03-13T23:58:45.709146	12b38c2d	116	29	1.0000	DISCARD	gen=222 glyphs=4
2026-03-13T23:58:45.979460	1e5f0e21	116	29	1.0000	DISCARD	gen=266 glyphs=4
2026-03-13T23:58:48.399928	7ca87b42	116	29	1.0000	DISCARD	gen=222 glyphs=4
2026-03-13T23:58:48.673372	6f15d43c	120	30	1.0000	DISCARD	gen=266 glyphs=4
2026-03-13T23:58:51.096777	55d6c151	120	30	1.0000	DISCARD	gen=222 glyphs=4
2026-03-13T23:58:51.374348	97bcdd7c	116	29	1.0000	DISCARD	gen=266 glyphs=4
2026-03-13T23:58:53.807808	5a06ca32	120	30	1.0000	DISCARD	gen=222 glyphs=4
2026-03-13T23:58:54.069640	8b8d2365	116	29	1.0000	DISCARD	gen=266 glyphs=4
2026-03-13T23:58:56.518358	c6e13a77	116	29	0.9500	DISCARD	gen=222 glyphs=4
2026-03-13T23:58:56.790048	8aef8872	116	29	1.0000	DISCARD	gen=266 glyphs=4
2026-03-13T23:58:59.235750	37f4017b	116	29	1.0000	DISCARD	gen=222 glyphs=4
2026-03-13T23:58:59.496783	50dc991d	116	29	1.0000	DISCARD	gen=266 glyphs=4
2026-03-13T23:59:01.938583	37f4017b	116	29	1.0000	DISCARD	gen=223 glyphs=4
2026-03-13T23:59:02.208515	19355583	120	30	1.0000	DISCARD	gen=266 glyphs=4
2026-03-13T23:59:04.711633	bfdf7cad	120	30	1.0000	DISCARD	gen=223 glyphs=4
2026-03-13T23:59:04.985064	19355583	120	30	1.0000	DISCARD	gen=267 glyphs=4
2026-03-13T23:59:07.397420	37f4017b	116	29	1.0000	DISCARD	gen=223 glyphs=4
2026-03-13T23:59:07.672655	8aef8872	116	29	1.0000	DISCARD	gen=267 glyphs=4
2026-03-13T23:59:10.106620	2d0add53	116	29	1.0000	DISCARD	gen=223 glyphs=4
2026-03-13T23:59:10.376981	cc1e99d5	120	30	1.0000	DISCARD	gen=267 glyphs=4
2026-03-13T23:59:12.807449	12b38c2d	116	29	1.0000	DISCARD	gen=223 glyphs=4
2026-03-13T23:59:13.077115	a5997b37	120	30	1.0000	DISCARD	gen=267 glyphs=4
2026-03-13T23:59:15.522987	37f4017b	116	29	1.0000	DISCARD	gen=223 glyphs=4
2026-03-13T23:59:15.795399	d2b04d88	116	29	0.9500	DISCARD	gen=267 glyphs=4
2026-03-13T23:59:18.233286	17b57c79	116	29	1.0000	DISCARD	gen=223 glyphs=4
2026-03-13T23:59:18.502939	8aef8872	116	29	1.0000	DISCARD	gen=267 glyphs=4
2026-03-13T23:59:20.906801	37f4017b	116	29	1.0000	DISCARD	gen=223 glyphs=4
2026-03-13T23:59:21.190187	50dc991d	116	29	1.0000	DISCARD	gen=267 glyphs=4
2026-03-13T23:59:23.602138	37f4017b	116	29	1.0000	DISCARD	gen=223 glyphs=4
2026-03-13T23:59:23.869567	875e0f8a	116	29	1.0000	DISCARD	gen=267 glyphs=4
2026-03-13T23:59:26.275917	37f4017b	116	29	1.0000	DISCARD	gen=223 glyphs=4
2026-03-13T23:59:26.544743	8aef8872	116	29	1.0000	DISCARD	gen=267 glyphs=4
2026-03-13T23:59:28.979168	37f4017b	116	29	1.0000	DISCARD	gen=224 glyphs=4
2026-03-13T23:59:29.248884	67cb81be	120	30	1.0000	DISCARD	gen=267 glyphs=4
2026-03-13T23:59:31.677094	bfdf7cad	120	30	1.0000	DISCARD	gen=224 glyphs=4
2026-03-13T23:59:31.934999	19355583	120	30	1.0000	DISCARD	gen=268 glyphs=4
2026-03-13T23:59:34.421583	55d6c151	120	30	1.0000	DISCARD	gen=224 glyphs=4
2026-03-13T23:59:34.709804	8aef8872	116	29	1.0000	DISCARD	gen=268 glyphs=4
2026-03-13T23:59:37.145643	4c9b0dd4	120	30	1.0000	DISCARD	gen=224 glyphs=4
2026-03-13T23:59:37.414782	1e5f0e21	116	29	1.0000	DISCARD	gen=268 glyphs=4
2026-03-13T23:59:39.816271	fdb5d108	120	30	1.0000	DISCARD	gen=224 glyphs=4
2026-03-13T23:59:40.089322	8aef8872	116	29	1.0000	DISCARD	gen=268 glyphs=4
2026-03-13T23:59:42.479121	37f4017b	116	29	1.0000	DISCARD	gen=224 glyphs=4
2026-03-13T23:59:42.767204	19355583	120	30	1.0000	DISCARD	gen=268 glyphs=4
2026-03-13T23:59:45.164575	37f4017b	116	29	1.0000	DISCARD	gen=224 glyphs=4
2026-03-13T23:59:45.418529	97130b37	116	29	1.0000	DISCARD	gen=268 glyphs=4
2026-03-13T23:59:47.825252	5b9807ac	120	30	1.0000	DISCARD	gen=224 glyphs=4
2026-03-13T23:59:48.084783	875e0f8a	116	29	1.0000	DISCARD	gen=268 glyphs=4
2026-03-13T23:59:50.489818	71e2ba66	116	29	1.0000	DISCARD	gen=224 glyphs=4
2026-03-13T23:59:50.745108	b7aed8e9	116	29	1.0000	DISCARD	gen=268 glyphs=4
2026-03-13T23:59:53.163840	439c85c5	120	30	1.0000	DISCARD	gen=224 glyphs=4
2026-03-13T23:59:53.432814	50dc991d	116	29	1.0000	DISCARD	gen=268 glyphs=4
2026-03-13T23:59:55.847081	37f4017b	116	29	1.0000	DISCARD	gen=225 glyphs=4
2026-03-13T23:59:56.118932	8aef8872	116	29	1.0000	DISCARD	gen=268 glyphs=4
2026-03-13T23:59:58.509758	bfdf7cad	120	30	1.0000	DISCARD	gen=225 glyphs=4
2026-03-13T23:59:58.775979	19355583	120	30	1.0000	DISCARD	gen=269 glyphs=4
2026-03-14T00:00:01.207232	903709a8	116	29	1.0000	DISCARD	gen=225 glyphs=4
2026-03-14T00:00:01.463854	8aef8872	116	29	1.0000	DISCARD	gen=269 glyphs=4
2026-03-14T00:00:03.913492	5a06ca32	120	30	1.0000	DISCARD	gen=225 glyphs=4
2026-03-14T00:00:04.184083	96067ffe	116	29	1.0000	DISCARD	gen=269 glyphs=4
2026-03-14T00:00:06.623402	ec6de172	116	29	1.0000	DISCARD	gen=225 glyphs=4
2026-03-14T00:00:06.894168	b57e7176	120	30	1.0000	DISCARD	gen=269 glyphs=4
2026-03-14T00:00:09.340773	71e2ba66	116	29	1.0000	DISCARD	gen=225 glyphs=4
2026-03-14T00:00:09.614979	b57e7176	120	30	1.0000	DISCARD	gen=269 glyphs=4
2026-03-14T00:00:12.051646	fdb5d108	120	30	1.0000	DISCARD	gen=225 glyphs=4
2026-03-14T00:00:12.309783	0eaedb57	116	29	1.0000	DISCARD	gen=269 glyphs=4
2026-03-14T00:00:14.729178	37f4017b	116	29	1.0000	DISCARD	gen=225 glyphs=4
2026-03-14T00:00:14.994893	19355583	120	30	1.0000	DISCARD	gen=269 glyphs=4
2026-03-14T00:00:17.395438	f3669c39	116	29	1.0000	DISCARD	gen=225 glyphs=4
2026-03-14T00:00:17.676295	bc88e411	116	29	1.0000	DISCARD	gen=269 glyphs=4
2026-03-14T00:00:20.099785	5a06ca32	120	30	1.0000	DISCARD	gen=225 glyphs=4
2026-03-14T00:00:20.362712	0eaedb57	116	29	1.0000	DISCARD	gen=269 glyphs=4
2026-03-14T00:00:22.799159	37f4017b	116	29	1.0000	DISCARD	gen=226 glyphs=4
2026-03-14T00:00:23.069581	875e0f8a	116	29	1.0000	DISCARD	gen=269 glyphs=4
2026-03-14T00:00:25.525309	bfdf7cad	120	30	1.0000	DISCARD	gen=226 glyphs=4
2026-03-14T00:00:25.800362	19355583	120	30	1.0000	DISCARD	gen=270 glyphs=4
2026-03-14T00:00:28.225331	fdb5d108	120	30	1.0000	DISCARD	gen=226 glyphs=4
2026-03-14T00:00:28.509027	8aef8872	116	29	1.0000	DISCARD	gen=270 glyphs=4
2026-03-14T00:00:30.950210	fdb5d108	120	30	1.0000	DISCARD	gen=226 glyphs=4
2026-03-14T00:00:31.216015	875e0f8a	116	29	1.0000	DISCARD	gen=270 glyphs=4
2026-03-14T00:00:33.633594	4c9b0dd4	120	30	1.0000	DISCARD	gen=226 glyphs=4
2026-03-14T00:00:33.907946	050862ad	120	30	1.0000	DISCARD	gen=270 glyphs=4
2026-03-14T00:00:36.323331	fdb5d108	120	30	1.0000	DISCARD	gen=226 glyphs=4
2026-03-14T00:00:36.589605	b57e7176	120	30	1.0000	DISCARD	gen=270 glyphs=4
2026-03-14T00:00:39.107688	6ea4a2e4	116	29	1.0000	DISCARD	gen=226 glyphs=4
2026-03-14T00:00:39.377765	bf3d259b	116	29	1.0000	DISCARD	gen=270 glyphs=4
2026-03-14T00:00:41.787200	1e10eea6	116	29	1.0000	DISCARD	gen=226 glyphs=4
2026-03-14T00:00:42.060809	e2cd28ea	120	30	1.0000	DISCARD	gen=270 glyphs=4
2026-03-14T00:00:44.455318	292fddd3	116	29	0.9500	DISCARD	gen=226 glyphs=4
2026-03-14T00:00:44.720908	50dc991d	116	29	1.0000	DISCARD	gen=270 glyphs=4
2026-03-14T00:00:47.151459	c1654abf	120	30	1.0000	DISCARD	gen=226 glyphs=4
2026-03-14T00:00:47.418038	b7aed8e9	116	29	1.0000	DISCARD	gen=270 glyphs=4
2026-03-14T00:00:49.837053	37f4017b	116	29	1.0000	DISCARD	gen=227 glyphs=4
2026-03-14T00:00:50.099332	19355583	120	30	1.0000	DISCARD	gen=270 glyphs=4
2026-03-14T00:00:52.509286	bfdf7cad	120	30	1.0000	DISCARD	gen=227 glyphs=4
2026-03-14T00:00:52.779499	19355583	120	30	1.0000	DISCARD	gen=271 glyphs=4
2026-03-14T00:00:55.190379	74f6865a	116	29	0.9500	DISCARD	gen=227 glyphs=4
2026-03-14T00:00:55.466159	8aef8872	116	29	1.0000	DISCARD	gen=271 glyphs=4
2026-03-14T00:00:57.877445	71e2ba66	116	29	1.0000	DISCARD	gen=227 glyphs=4
2026-03-14T00:00:58.146511	d062b53d	120	30	1.0000	DISCARD	gen=271 glyphs=4
2026-03-14T00:01:00.549134	37f4017b	116	29	1.0000	DISCARD	gen=227 glyphs=4
2026-03-14T00:01:00.815435	77631e77	116	29	0.9500	DISCARD	gen=271 glyphs=4
2026-03-14T00:01:03.247762	4c9b0dd4	120	30	1.0000	DISCARD	gen=227 glyphs=4
2026-03-14T00:01:03.513008	e35b39f5	116	29	1.0000	DISCARD	gen=271 glyphs=4
2026-03-14T00:01:05.938532	55d6c151	120	30	1.0000	DISCARD	gen=227 glyphs=4
2026-03-14T00:01:06.206578	a78f9454	120	30	1.0000	DISCARD	gen=271 glyphs=4
