timestamp	program_hash	spirv_size	word_count	fitness	status	description
2026-03-13T22:32:49.206556	18203014	116	29	1.0000	DISCARD	gen=81 glyphs=4
2026-03-13T22:32:49.746188	bf7394dd	116	29	1.0000	DISCARD	gen=37 glyphs=4
2026-03-13T22:32:51.966148	050862ad	120	30	1.0000	DISCARD	gen=81 glyphs=4
2026-03-13T22:32:52.521757	cb246772	116	29	1.0000	DISCARD	gen=37 glyphs=4
2026-03-13T22:32:54.696919	8aef8872	116	29	1.0000	DISCARD	gen=81 glyphs=4
2026-03-13T22:32:55.250005	37f4017b	116	29	1.0000	DISCARD	gen=37 glyphs=4
2026-03-13T22:32:57.453653	ae44ace5	116	29	1.0000	DISCARD	gen=81 glyphs=4
2026-03-13T22:32:58.010298	5b9807ac	120	30	1.0000	DISCARD	gen=37 glyphs=4
2026-03-13T22:33:00.216069	875e0f8a	116	29	1.0000	DISCARD	gen=81 glyphs=4
2026-03-13T22:33:00.762092	8ef9c901	120	30	1.0000	DISCARD	gen=37 glyphs=4
2026-03-13T22:33:02.999216	2738cfb8	120	30	0.9500	DISCARD	gen=81 glyphs=4
2026-03-13T22:33:03.557899	1d34459a	116	29	1.0000	DISCARD	gen=37 glyphs=4
2026-03-13T22:33:05.751807	ad560df6	116	29	1.0000	DISCARD	gen=81 glyphs=4
2026-03-13T22:33:06.303247	37f4017b	116	29	1.0000	DISCARD	gen=38 glyphs=4
2026-03-13T22:33:08.487975	19355583	120	30	1.0000	DISCARD	gen=82 glyphs=4
2026-03-13T22:33:09.026625	bfdf7cad	120	30	1.0000	DISCARD	gen=38 glyphs=4
2026-03-13T22:33:11.216693	8aef8872	116	29	1.0000	DISCARD	gen=82 glyphs=4
2026-03-13T22:33:11.774384	55d6c151	120	30	1.0000	DISCARD	gen=38 glyphs=4
2026-03-13T22:33:13.970634	eca7ab6c	116	29	1.0000	DISCARD	gen=82 glyphs=4
2026-03-13T22:33:14.520792	12b38c2d	116	29	1.0000	DISCARD	gen=38 glyphs=4
2026-03-13T22:33:16.810110	b7aed8e9	116	29	1.0000	DISCARD	gen=82 glyphs=4
2026-03-13T22:33:17.369166	1aef725b	116	29	1.0000	DISCARD	gen=38 glyphs=4
2026-03-13T22:33:19.563442	b7aed8e9	116	29	1.0000	DISCARD	gen=82 glyphs=4
2026-03-13T22:33:20.105741	37f4017b	116	29	1.0000	DISCARD	gen=38 glyphs=4
2026-03-13T22:33:22.305096	8aef8872	116	29	1.0000	DISCARD	gen=82 glyphs=4
2026-03-13T22:33:22.850550	2638f518	120	30	1.0000	DISCARD	gen=38 glyphs=4
2026-03-13T22:33:25.040887	1e5f0e21	116	29	1.0000	DISCARD	gen=82 glyphs=4
2026-03-13T22:33:25.610295	9f95b7ef	116	29	1.0000	DISCARD	gen=38 glyphs=4
2026-03-13T22:33:27.801805	b7aed8e9	116	29	1.0000	DISCARD	gen=82 glyphs=4
2026-03-13T22:33:28.352134	71e2ba66	116	29	1.0000	DISCARD	gen=38 glyphs=4
2026-03-13T22:33:30.553600	67cb81be	120	30	1.0000	DISCARD	gen=82 glyphs=4
2026-03-13T22:33:31.092101	5a06ca32	120	30	1.0000	DISCARD	gen=38 glyphs=4
2026-03-13T22:33:33.314683	50dc991d	116	29	1.0000	DISCARD	gen=82 glyphs=4
2026-03-13T22:33:33.870906	37f4017b	116	29	1.0000	DISCARD	gen=39 glyphs=4
2026-03-13T22:33:36.093957	19355583	120	30	1.0000	DISCARD	gen=83 glyphs=4
2026-03-13T22:33:36.657167	bfdf7cad	120	30	1.0000	DISCARD	gen=39 glyphs=4
2026-03-13T22:33:38.847830	8aef8872	116	29	1.0000	DISCARD	gen=83 glyphs=4
2026-03-13T22:33:39.417319	bfdf7cad	120	30	1.0000	DISCARD	gen=39 glyphs=4
2026-03-13T22:33:41.625818	aa67bbd1	116	29	1.0000	DISCARD	gen=83 glyphs=4
2026-03-13T22:33:42.187736	bfdf7cad	120	30	1.0000	DISCARD	gen=39 glyphs=4
2026-03-13T22:33:44.366554	050862ad	120	30	1.0000	DISCARD	gen=83 glyphs=4
2026-03-13T22:33:44.918116	12b38c2d	116	29	1.0000	DISCARD	gen=39 glyphs=4
2026-03-13T22:33:47.202786	19355583	120	30	1.0000	DISCARD	gen=83 glyphs=4
2026-03-13T22:33:47.782557	6c98cc21	116	29	1.0000	DISCARD	gen=39 glyphs=4
2026-03-13T22:33:49.974228	8aef8872	116	29	1.0000	DISCARD	gen=83 glyphs=4
2026-03-13T22:33:50.518924	55d6c151	120	30	1.0000	DISCARD	gen=39 glyphs=4
2026-03-13T22:33:52.702284	9e34ede0	116	29	1.0000	DISCARD	gen=83 glyphs=4
2026-03-13T22:33:53.240443	106950d5	116	29	1.0000	DISCARD	gen=39 glyphs=4
2026-03-13T22:33:55.456268	b7aed8e9	116	29	1.0000	DISCARD	gen=83 glyphs=4
2026-03-13T22:33:56.000289	7a33d2ee	124	31	0.9500	DISCARD	gen=39 glyphs=4
2026-03-13T22:33:58.202278	18896385	116	29	1.0000	DISCARD	gen=83 glyphs=4
2026-03-13T22:33:58.760515	1d2d35c6	120	30	1.0000	DISCARD	gen=39 glyphs=4
2026-03-13T22:34:00.948415	1e5f0e21	116	29	1.0000	DISCARD	gen=83 glyphs=4
2026-03-13T22:34:01.521265	37f4017b	116	29	1.0000	DISCARD	gen=40 glyphs=4
2026-03-13T22:34:03.706938	19355583	120	30	1.0000	DISCARD	gen=84 glyphs=4
2026-03-13T22:34:04.258640	bfdf7cad	120	30	1.0000	DISCARD	gen=40 glyphs=4
2026-03-13T22:34:06.462603	8aef8872	116	29	1.0000	DISCARD	gen=84 glyphs=4
2026-03-13T22:34:06.993799	2701cb73	116	29	1.0000	DISCARD	gen=40 glyphs=4
2026-03-13T22:34:09.179159	e2cd28ea	120	30	1.0000	DISCARD	gen=84 glyphs=4
2026-03-13T22:34:09.729344	5a06ca32	120	30	1.0000	DISCARD	gen=40 glyphs=4
2026-03-13T22:34:11.908642	875e0f8a	116	29	1.0000	DISCARD	gen=84 glyphs=4
2026-03-13T22:34:12.479481	12b38c2d	116	29	1.0000	DISCARD	gen=40 glyphs=4
2026-03-13T22:34:14.679391	67cb81be	120	30	1.0000	DISCARD	gen=84 glyphs=4
2026-03-13T22:34:15.224250	37f4017b	116	29	1.0000	DISCARD	gen=40 glyphs=4
2026-03-13T22:34:17.428440	2819f6b9	116	29	1.0000	DISCARD	gen=84 glyphs=4
2026-03-13T22:34:17.981071	55d6c151	120	30	1.0000	DISCARD	gen=40 glyphs=4
2026-03-13T22:34:20.258573	50dc991d	116	29	1.0000	DISCARD	gen=84 glyphs=4
2026-03-13T22:34:20.805495	5a06ca32	120	30	1.0000	DISCARD	gen=40 glyphs=4
2026-03-13T22:34:23.015929	1e5f0e21	116	29	1.0000	DISCARD	gen=84 glyphs=4
2026-03-13T22:34:23.564132	6b40ab14	116	29	1.0000	DISCARD	gen=40 glyphs=4
2026-03-13T22:34:25.785756	9e34ede0	116	29	1.0000	DISCARD	gen=84 glyphs=4
2026-03-13T22:34:26.327184	1d34459a	116	29	1.0000	DISCARD	gen=40 glyphs=4
2026-03-13T22:34:28.544528	50dc991d	116	29	1.0000	DISCARD	gen=84 glyphs=4
2026-03-13T22:34:29.106914	37f4017b	116	29	1.0000	DISCARD	gen=41 glyphs=4
2026-03-13T22:34:31.308239	19355583	120	30	1.0000	DISCARD	gen=85 glyphs=4
2026-03-13T22:34:31.854781	bfdf7cad	120	30	1.0000	DISCARD	gen=41 glyphs=4
2026-03-13T22:34:34.083804	8aef8872	116	29	1.0000	DISCARD	gen=85 glyphs=4
2026-03-13T22:34:34.628473	37f4017b	116	29	1.0000	DISCARD	gen=41 glyphs=4
2026-03-13T22:34:36.848791	e23ec8cd	116	29	1.0000	DISCARD	gen=85 glyphs=4
2026-03-13T22:34:37.392352	041ccd03	116	29	1.0000	DISCARD	gen=41 glyphs=4
2026-03-13T22:34:39.604589	50dc991d	116	29	1.0000	DISCARD	gen=85 glyphs=4
2026-03-13T22:34:40.154674	12b38c2d	116	29	1.0000	DISCARD	gen=41 glyphs=4
2026-03-13T22:34:42.363119	050862ad	120	30	1.0000	DISCARD	gen=85 glyphs=4
2026-03-13T22:34:42.938581	5a06ca32	120	30	1.0000	DISCARD	gen=41 glyphs=4
2026-03-13T22:34:45.121103	eca7ab6c	116	29	1.0000	DISCARD	gen=85 glyphs=4
2026-03-13T22:34:45.667094	7ca87b42	116	29	1.0000	DISCARD	gen=41 glyphs=4
2026-03-13T22:34:47.879547	d5b8349e	120	30	1.0000	DISCARD	gen=85 glyphs=4
2026-03-13T22:34:48.421270	e2b7e235	120	30	1.0000	DISCARD	gen=41 glyphs=4
2026-03-13T22:34:50.674443	050862ad	120	30	1.0000	DISCARD	gen=85 glyphs=4
2026-03-13T22:34:51.232986	b6b70590	116	29	1.0000	DISCARD	gen=41 glyphs=4
2026-03-13T22:34:53.434617	e2cd28ea	120	30	1.0000	DISCARD	gen=85 glyphs=4
2026-03-13T22:34:53.987852	55d6c151	120	30	1.0000	DISCARD	gen=41 glyphs=4
2026-03-13T22:34:56.183940	d7a90b5a	120	30	1.0000	DISCARD	gen=85 glyphs=4
2026-03-13T22:34:56.732499	37f4017b	116	29	1.0000	DISCARD	gen=42 glyphs=4
2026-03-13T22:34:58.927985	19355583	120	30	1.0000	DISCARD	gen=86 glyphs=4
2026-03-13T22:34:59.481885	bfdf7cad	120	30	1.0000	DISCARD	gen=42 glyphs=4
2026-03-13T22:35:01.663448	8aef8872	116	29	1.0000	DISCARD	gen=86 glyphs=4
2026-03-13T22:35:02.211880	671f2d5e	120	30	1.0000	DISCARD	gen=42 glyphs=4
2026-03-13T22:35:04.429256	19355583	120	30	1.0000	DISCARD	gen=86 glyphs=4
2026-03-13T22:35:04.960871	12b38c2d	116	29	1.0000	DISCARD	gen=42 glyphs=4
2026-03-13T22:35:07.156782	fa9bc871	116	29	1.0000	DISCARD	gen=86 glyphs=4
2026-03-13T22:35:07.711116	0d5d855d	120	30	1.0000	DISCARD	gen=42 glyphs=4
2026-03-13T22:35:09.896576	8aef8872	116	29	1.0000	DISCARD	gen=86 glyphs=4
2026-03-13T22:35:10.453162	55d6c151	120	30	1.0000	DISCARD	gen=42 glyphs=4
2026-03-13T22:35:12.639569	d7c8681b	120	30	1.0000	DISCARD	gen=86 glyphs=4
2026-03-13T22:35:13.199383	23049f0d	120	30	1.0000	DISCARD	gen=42 glyphs=4
2026-03-13T22:35:15.376180	0eaedb57	116	29	1.0000	DISCARD	gen=86 glyphs=4
2026-03-13T22:35:15.942687	1d34459a	116	29	1.0000	DISCARD	gen=42 glyphs=4
2026-03-13T22:35:18.141116	8aef8872	116	29	1.0000	DISCARD	gen=86 glyphs=4
2026-03-13T22:35:18.701420	5a06ca32	120	30	1.0000	DISCARD	gen=42 glyphs=4
2026-03-13T22:35:20.888632	875e0f8a	116	29	1.0000	DISCARD	gen=86 glyphs=4
2026-03-13T22:35:21.432181	5a06ca32	120	30	1.0000	DISCARD	gen=42 glyphs=4
2026-03-13T22:35:23.696025	875e0f8a	116	29	1.0000	DISCARD	gen=86 glyphs=4
2026-03-13T22:35:24.251225	37f4017b	116	29	1.0000	DISCARD	gen=43 glyphs=4
2026-03-13T22:35:33.822040	19355583	120	30	1.0000	DISCARD	gen=87 glyphs=4
2026-03-13T22:35:34.376222	bfdf7cad	120	30	1.0000	DISCARD	gen=43 glyphs=4
2026-03-13T22:35:36.603252	8aef8872	116	29	1.0000	DISCARD	gen=87 glyphs=4
2026-03-13T22:35:37.145593	55d6c151	120	30	1.0000	DISCARD	gen=43 glyphs=4
2026-03-13T22:35:39.753324	eca7ab6c	116	29	1.0000	DISCARD	gen=87 glyphs=4
2026-03-13T22:35:40.311620	5a06ca32	120	30	1.0000	DISCARD	gen=43 glyphs=4
2026-03-13T22:35:42.477237	67cb81be	120	30	1.0000	DISCARD	gen=87 glyphs=4
2026-03-13T22:35:43.035502	12b38c2d	116	29	1.0000	DISCARD	gen=43 glyphs=4
2026-03-13T22:35:45.245993	d8d9fd0c	116	29	1.0000	DISCARD	gen=87 glyphs=4
2026-03-13T22:35:45.789142	55d6c151	120	30	1.0000	DISCARD	gen=43 glyphs=4
2026-03-13T22:35:47.979667	6b13fbc5	116	29	1.0000	DISCARD	gen=87 glyphs=4
2026-03-13T22:35:48.536888	5b9807ac	120	30	1.0000	DISCARD	gen=43 glyphs=4
2026-03-13T22:35:50.747901	8aef8872	116	29	1.0000	DISCARD	gen=87 glyphs=4
2026-03-13T22:35:51.314936	37f4017b	116	29	1.0000	DISCARD	gen=43 glyphs=4
2026-03-13T22:35:53.556350	a78f9454	120	30	1.0000	DISCARD	gen=87 glyphs=4
2026-03-13T22:35:54.159990	7ca87b42	116	29	1.0000	DISCARD	gen=43 glyphs=4
2026-03-13T22:35:56.463665	8aef8872	116	29	1.0000	DISCARD	gen=87 glyphs=4
2026-03-13T22:35:57.037001	fdb5d108	120	30	1.0000	DISCARD	gen=43 glyphs=4
2026-03-13T22:35:59.249223	875e0f8a	116	29	1.0000	DISCARD	gen=87 glyphs=4
2026-03-13T22:35:59.819209	37f4017b	116	29	1.0000	DISCARD	gen=44 glyphs=4
2026-03-13T22:36:02.071817	19355583	120	30	1.0000	DISCARD	gen=88 glyphs=4
2026-03-13T22:36:02.627296	bfdf7cad	120	30	1.0000	DISCARD	gen=44 glyphs=4
2026-03-13T22:36:04.840133	8aef8872	116	29	1.0000	DISCARD	gen=88 glyphs=4
2026-03-13T22:36:05.389314	7ca87b42	116	29	1.0000	DISCARD	gen=44 glyphs=4
2026-03-13T22:36:07.643619	8aef8872	116	29	1.0000	DISCARD	gen=88 glyphs=4
2026-03-13T22:36:08.218555	bfdf7cad	120	30	1.0000	DISCARD	gen=44 glyphs=4
2026-03-13T22:36:10.434334	0eaedb57	116	29	1.0000	DISCARD	gen=88 glyphs=4
2026-03-13T22:36:10.988255	06149bd8	116	29	1.0000	DISCARD	gen=44 glyphs=4
2026-03-13T22:36:13.191138	cb103b1a	116	29	1.0000	DISCARD	gen=88 glyphs=4
2026-03-13T22:36:13.748140	37f4017b	116	29	1.0000	DISCARD	gen=44 glyphs=4
2026-03-13T22:36:15.967615	0eaedb57	116	29	1.0000	DISCARD	gen=88 glyphs=4
2026-03-13T22:36:16.514561	37f4017b	116	29	1.0000	DISCARD	gen=44 glyphs=4
2026-03-13T22:36:18.718648	9e34ede0	116	29	1.0000	DISCARD	gen=88 glyphs=4
2026-03-13T22:36:19.277765	aaf11809	116	29	1.0000	DISCARD	gen=44 glyphs=4
2026-03-13T22:36:21.471655	2ac44341	116	29	1.0000	DISCARD	gen=88 glyphs=4
2026-03-13T22:36:22.012307	37f4017b	116	29	1.0000	DISCARD	gen=44 glyphs=4
2026-03-13T22:36:24.210392	8aef8872	116	29	1.0000	DISCARD	gen=88 glyphs=4
2026-03-13T22:36:24.782798	5a06ca32	120	30	1.0000	DISCARD	gen=44 glyphs=4
2026-03-13T22:36:27.053131	8aef8872	116	29	1.0000	DISCARD	gen=88 glyphs=4
2026-03-13T22:36:27.608966	37f4017b	116	29	1.0000	DISCARD	gen=45 glyphs=4
2026-03-13T22:36:29.826294	19355583	120	30	1.0000	DISCARD	gen=89 glyphs=4
2026-03-13T22:36:30.380359	bfdf7cad	120	30	1.0000	DISCARD	gen=45 glyphs=4
2026-03-13T22:36:32.610204	8aef8872	116	29	1.0000	DISCARD	gen=89 glyphs=4
2026-03-13T22:36:33.158099	1202b13e	120	30	1.0000	DISCARD	gen=45 glyphs=4
2026-03-13T22:36:35.373575	e8c7f6cf	120	30	1.0000	DISCARD	gen=89 glyphs=4
2026-03-13T22:36:35.914906	12b38c2d	116	29	1.0000	DISCARD	gen=45 glyphs=4
2026-03-13T22:36:38.146113	0eaedb57	116	29	1.0000	DISCARD	gen=89 glyphs=4
2026-03-13T22:36:38.679650	5a06ca32	120	30	1.0000	DISCARD	gen=45 glyphs=4
2026-03-13T22:36:40.904880	50dc991d	116	29	1.0000	DISCARD	gen=89 glyphs=4
2026-03-13T22:36:41.449300	f562da8b	116	29	1.0000	DISCARD	gen=45 glyphs=4
2026-03-13T22:36:43.682197	78f07336	120	30	1.0000	DISCARD	gen=89 glyphs=4
2026-03-13T22:36:44.233764	d11c1062	120	30	1.0000	DISCARD	gen=45 glyphs=4
2026-03-13T22:36:46.462471	a78f9454	120	30	1.0000	DISCARD	gen=89 glyphs=4
2026-03-13T22:36:47.006404	37f4017b	116	29	1.0000	DISCARD	gen=45 glyphs=4
2026-03-13T22:36:49.224160	7b9be945	120	30	1.0000	DISCARD	gen=89 glyphs=4
2026-03-13T22:36:49.776945	71e2ba66	116	29	1.0000	DISCARD	gen=45 glyphs=4
2026-03-13T22:36:51.987027	050862ad	120	30	1.0000	DISCARD	gen=89 glyphs=4
2026-03-13T22:36:52.544810	5a06ca32	120	30	1.0000	DISCARD	gen=45 glyphs=4
2026-03-13T22:36:54.774303	875e0f8a	116	29	1.0000	DISCARD	gen=89 glyphs=4
2026-03-13T22:36:55.312417	37f4017b	116	29	1.0000	DISCARD	gen=46 glyphs=4
2026-03-13T22:36:57.526755	19355583	120	30	1.0000	DISCARD	gen=90 glyphs=4
2026-03-13T22:36:58.139717	bfdf7cad	120	30	1.0000	DISCARD	gen=46 glyphs=4
2026-03-13T22:37:00.419404	8aef8872	116	29	1.0000	DISCARD	gen=90 glyphs=4
2026-03-13T22:37:00.982644	53b0a34b	116	29	1.0000	DISCARD	gen=46 glyphs=4
2026-03-13T22:37:03.293818	8aef8872	116	29	1.0000	DISCARD	gen=90 glyphs=4
2026-03-13T22:37:03.860129	5a06ca32	120	30	1.0000	DISCARD	gen=46 glyphs=4
2026-03-13T22:37:06.086966	d7c8681b	120	30	1.0000	DISCARD	gen=90 glyphs=4
2026-03-13T22:37:06.626853	2701cb73	116	29	1.0000	DISCARD	gen=46 glyphs=4
2026-03-13T22:37:08.821385	050862ad	120	30	1.0000	DISCARD	gen=90 glyphs=4
2026-03-13T22:37:09.363642	5b9807ac	120	30	1.0000	DISCARD	gen=46 glyphs=4
2026-03-13T22:37:11.575976	eca7ab6c	116	29	1.0000	DISCARD	gen=90 glyphs=4
2026-03-13T22:37:12.118744	57ec317e	120	30	1.0000	DISCARD	gen=46 glyphs=4
2026-03-13T22:37:14.319230	3cf1faf3	116	29	1.0000	DISCARD	gen=90 glyphs=4
2026-03-13T22:37:14.862348	5a06ca32	120	30	1.0000	DISCARD	gen=46 glyphs=4
2026-03-13T22:37:17.077879	d7c8681b	120	30	1.0000	DISCARD	gen=90 glyphs=4
2026-03-13T22:37:17.623835	1d34459a	116	29	1.0000	DISCARD	gen=46 glyphs=4
2026-03-13T22:37:19.809073	9e34ede0	116	29	1.0000	DISCARD	gen=90 glyphs=4
2026-03-13T22:37:20.347940	d11c1062	120	30	1.0000	DISCARD	gen=46 glyphs=4
2026-03-13T22:37:22.520054	2fd062e8	120	30	1.0000	DISCARD	gen=90 glyphs=4
2026-03-13T22:37:23.085288	37f4017b	116	29	1.0000	DISCARD	gen=47 glyphs=4
2026-03-13T22:37:25.257621	19355583	120	30	1.0000	DISCARD	gen=91 glyphs=4
2026-03-13T22:37:25.813302	bfdf7cad	120	30	1.0000	DISCARD	gen=47 glyphs=4
2026-03-13T22:37:27.989214	8aef8872	116	29	1.0000	DISCARD	gen=91 glyphs=4
2026-03-13T22:37:28.554756	5a06ca32	120	30	1.0000	DISCARD	gen=47 glyphs=4
2026-03-13T22:37:30.800643	7ee8bda8	116	29	1.0000	DISCARD	gen=91 glyphs=4
2026-03-13T22:37:31.356374	37f4017b	116	29	1.0000	DISCARD	gen=47 glyphs=4
2026-03-13T22:37:33.520088	050862ad	120	30	1.0000	DISCARD	gen=91 glyphs=4
2026-03-13T22:37:34.071682	55d6c151	120	30	1.0000	DISCARD	gen=47 glyphs=4
2026-03-13T22:37:36.242541	eca7ab6c	116	29	1.0000	DISCARD	gen=91 glyphs=4
2026-03-13T22:37:36.784822	71e2ba66	116	29	1.0000	DISCARD	gen=47 glyphs=4
2026-03-13T22:37:38.992636	ae44ace5	116	29	1.0000	DISCARD	gen=91 glyphs=4
2026-03-13T22:37:39.538556	3d822a04	116	29	1.0000	DISCARD	gen=47 glyphs=4
2026-03-13T22:37:41.741620	fe2513d8	116	29	1.0000	DISCARD	gen=91 glyphs=4
2026-03-13T22:37:42.278995	55d6c151	120	30	1.0000	DISCARD	gen=47 glyphs=4
2026-03-13T22:37:44.508521	8aef8872	116	29	1.0000	DISCARD	gen=91 glyphs=4
2026-03-13T22:37:45.050153	37f4017b	116	29	1.0000	DISCARD	gen=47 glyphs=4
2026-03-13T22:37:47.260354	875e0f8a	116	29	1.0000	DISCARD	gen=91 glyphs=4
2026-03-13T22:37:47.819316	37be1d13	120	30	1.0000	DISCARD	gen=47 glyphs=4
2026-03-13T22:37:50.005231	23787518	116	29	0.9500	DISCARD	gen=91 glyphs=4
2026-03-13T22:37:50.543020	37f4017b	116	29	1.0000	DISCARD	gen=48 glyphs=4
2026-03-13T22:37:52.749176	19355583	120	30	1.0000	DISCARD	gen=92 glyphs=4
2026-03-13T22:37:53.289980	bfdf7cad	120	30	1.0000	DISCARD	gen=48 glyphs=4
2026-03-13T22:37:55.486996	8aef8872	116	29	1.0000	DISCARD	gen=92 glyphs=4
2026-03-13T22:37:56.019988	c77964ef	120	30	1.0000	DISCARD	gen=48 glyphs=4
2026-03-13T22:37:58.215553	b7aed8e9	116	29	1.0000	DISCARD	gen=92 glyphs=4
2026-03-13T22:37:58.759003	4c9b0dd4	120	30	1.0000	DISCARD	gen=48 glyphs=4
2026-03-13T22:38:00.959901	2f70d088	116	29	1.0000	DISCARD	gen=92 glyphs=4
2026-03-13T22:38:01.538265	55d6c151	120	30	1.0000	DISCARD	gen=48 glyphs=4
2026-03-13T22:38:03.760192	8aef8872	116	29	1.0000	DISCARD	gen=92 glyphs=4
2026-03-13T22:38:04.319951	2701cb73	116	29	1.0000	DISCARD	gen=48 glyphs=4
2026-03-13T22:38:06.531923	8aef8872	116	29	1.0000	DISCARD	gen=92 glyphs=4
2026-03-13T22:38:07.079937	55d6c151	120	30	1.0000	DISCARD	gen=48 glyphs=4
2026-03-13T22:38:09.233390	19355583	120	30	1.0000	DISCARD	gen=92 glyphs=4
2026-03-13T22:38:09.787541	d11c1062	120	30	1.0000	DISCARD	gen=48 glyphs=4
2026-03-13T22:38:11.952037	19355583	120	30	1.0000	DISCARD	gen=92 glyphs=4
2026-03-13T22:38:12.497601	1d34459a	116	29	1.0000	DISCARD	gen=48 glyphs=4
2026-03-13T22:38:14.653798	50dc991d	116	29	1.0000	DISCARD	gen=92 glyphs=4
2026-03-13T22:38:15.209227	4c9b0dd4	120	30	1.0000	DISCARD	gen=48 glyphs=4
2026-03-13T22:38:17.387397	19355583	120	30	1.0000	DISCARD	gen=92 glyphs=4
2026-03-13T22:38:17.931506	37f4017b	116	29	1.0000	DISCARD	gen=49 glyphs=4
2026-03-13T22:38:20.090063	19355583	120	30	1.0000	DISCARD	gen=93 glyphs=4
2026-03-13T22:38:20.624602	bfdf7cad	120	30	1.0000	DISCARD	gen=49 glyphs=4
2026-03-13T22:38:22.795901	8aef8872	116	29	1.0000	DISCARD	gen=93 glyphs=4
2026-03-13T22:38:23.343904	5a06ca32	120	30	1.0000	DISCARD	gen=49 glyphs=4
2026-03-13T22:38:25.523765	ca20ddeb	120	30	1.0000	DISCARD	gen=93 glyphs=4
2026-03-13T22:38:26.054820	12b38c2d	116	29	1.0000	DISCARD	gen=49 glyphs=4
2026-03-13T22:38:28.228131	d7c8681b	120	30	1.0000	DISCARD	gen=93 glyphs=4
2026-03-13T22:38:28.761099	848cfcfa	120	30	1.0000	DISCARD	gen=49 glyphs=4
2026-03-13T22:38:30.938773	0eaedb57	116	29	1.0000	DISCARD	gen=93 glyphs=4
2026-03-13T22:38:31.475910	bfdf7cad	120	30	1.0000	DISCARD	gen=49 glyphs=4
2026-03-13T22:38:33.672421	67cb81be	120	30	1.0000	DISCARD	gen=93 glyphs=4
2026-03-13T22:38:34.229941	71e2ba66	116	29	1.0000	DISCARD	gen=49 glyphs=4
2026-03-13T22:38:36.407515	b57e7176	120	30	1.0000	DISCARD	gen=93 glyphs=4
2026-03-13T22:38:36.947898	3ba0bbf5	120	30	1.0000	DISCARD	gen=49 glyphs=4
2026-03-13T22:38:39.126648	e8c7f6cf	120	30	1.0000	DISCARD	gen=93 glyphs=4
2026-03-13T22:38:39.664203	5ee34566	116	29	1.0000	DISCARD	gen=49 glyphs=4
2026-03-13T22:38:41.826120	b57e7176	120	30	1.0000	DISCARD	gen=93 glyphs=4
2026-03-13T22:38:42.389082	fdb5d108	120	30	1.0000	DISCARD	gen=49 glyphs=4
2026-03-13T22:38:44.577303	43be5d48	116	29	1.0000	DISCARD	gen=93 glyphs=4
2026-03-13T22:38:45.110958	37f4017b	116	29	1.0000	DISCARD	gen=50 glyphs=4
2026-03-13T22:38:47.311714	19355583	120	30	1.0000	DISCARD	gen=94 glyphs=4
2026-03-13T22:38:47.852852	bfdf7cad	120	30	1.0000	DISCARD	gen=50 glyphs=4
2026-03-13T22:38:50.034624	8aef8872	116	29	1.0000	DISCARD	gen=94 glyphs=4
2026-03-13T22:38:50.581772	2701cb73	116	29	1.0000	DISCARD	gen=50 glyphs=4
2026-03-13T22:38:52.763238	0eaedb57	116	29	1.0000	DISCARD	gen=94 glyphs=4
2026-03-13T22:38:53.485636	a2fa4aef	116	29	1.0000	DISCARD	gen=50 glyphs=4
2026-03-13T22:38:57.124201	9e34ede0	116	29	1.0000	DISCARD	gen=94 glyphs=4
2026-03-13T22:38:57.662091	5a06ca32	120	30	1.0000	DISCARD	gen=50 glyphs=4
2026-03-13T22:38:59.827014	50dc991d	116	29	1.0000	DISCARD	gen=94 glyphs=4
2026-03-13T22:39:00.389649	37f4017b	116	29	1.0000	DISCARD	gen=50 glyphs=4
2026-03-13T22:39:02.544649	875e0f8a	116	29	1.0000	DISCARD	gen=94 glyphs=4
2026-03-13T22:39:03.086568	37f4017b	116	29	1.0000	DISCARD	gen=50 glyphs=4
2026-03-13T22:39:05.359760	ae44ace5	116	29	1.0000	DISCARD	gen=94 glyphs=4
2026-03-13T22:39:05.925711	55d6c151	120	30	1.0000	DISCARD	gen=50 glyphs=4
2026-03-13T22:39:08.142832	43dbf85c	120	30	1.0000	DISCARD	gen=94 glyphs=4
2026-03-13T22:39:08.693079	501810e4	120	30	1.0000	DISCARD	gen=50 glyphs=4
2026-03-13T22:39:10.930149	2c3fd93f	120	30	0.9500	DISCARD	gen=94 glyphs=4
2026-03-13T22:39:11.487672	03721878	116	29	1.0000	DISCARD	gen=50 glyphs=4
2026-03-13T22:39:13.710664	8aef8872	116	29	1.0000	DISCARD	gen=94 glyphs=4
2026-03-13T22:39:14.256943	37f4017b	116	29	1.0000	DISCARD	gen=51 glyphs=4
2026-03-13T22:39:16.477314	19355583	120	30	1.0000	DISCARD	gen=95 glyphs=4
2026-03-13T22:39:17.019728	bfdf7cad	120	30	1.0000	DISCARD	gen=51 glyphs=4
2026-03-13T22:39:19.224241	8aef8872	116	29	1.0000	DISCARD	gen=95 glyphs=4
2026-03-13T22:39:19.777007	810124bb	116	29	1.0000	DISCARD	gen=51 glyphs=4
2026-03-13T22:39:21.981107	9e34ede0	116	29	1.0000	DISCARD	gen=95 glyphs=4
2026-03-13T22:39:22.529024	fdb5d108	120	30	1.0000	DISCARD	gen=51 glyphs=4
2026-03-13T22:39:24.783018	67cb81be	120	30	1.0000	DISCARD	gen=95 glyphs=4
2026-03-13T22:39:25.318775	37f4017b	116	29	1.0000	DISCARD	gen=51 glyphs=4
2026-03-13T22:39:27.494488	050862ad	120	30	1.0000	DISCARD	gen=95 glyphs=4
2026-03-13T22:39:28.038834	2a42fd8c	116	29	1.0000	DISCARD	gen=51 glyphs=4
2026-03-13T22:39:30.221502	83215262	116	29	0.9500	DISCARD	gen=95 glyphs=4
2026-03-13T22:39:30.768712	6d110018	116	29	1.0000	DISCARD	gen=51 glyphs=4
2026-03-13T22:39:32.996652	050862ad	120	30	1.0000	DISCARD	gen=95 glyphs=4
2026-03-13T22:39:33.556002	55d6c151	120	30	1.0000	DISCARD	gen=51 glyphs=4
2026-03-13T22:39:35.763135	8aef8872	116	29	1.0000	DISCARD	gen=95 glyphs=4
2026-03-13T22:39:36.322881	37f4017b	116	29	1.0000	DISCARD	gen=51 glyphs=4
2026-03-13T22:39:38.574533	0eaedb57	116	29	1.0000	DISCARD	gen=95 glyphs=4
2026-03-13T22:39:39.126050	71e2ba66	116	29	1.0000	DISCARD	gen=51 glyphs=4
2026-03-13T22:39:41.337540	d7c8681b	120	30	1.0000	DISCARD	gen=95 glyphs=4
2026-03-13T22:39:41.887029	37f4017b	116	29	1.0000	DISCARD	gen=52 glyphs=4
2026-03-13T22:39:44.111510	19355583	120	30	1.0000	DISCARD	gen=96 glyphs=4
2026-03-13T22:39:44.684395	bfdf7cad	120	30	1.0000	DISCARD	gen=52 glyphs=4
