timestamp	program_hash	spirv_size	word_count	fitness	status	description
2026-03-14T07:36:45.280237	099964a4	0	0	0.0000	CRASH	gen=607 glyphs=4
2026-03-14T07:36:45.280437	099964a4	0	0	0.0000	CRASH	gen=607 glyphs=4
2026-03-14T07:36:45.280638	099964a4	0	0	0.0000	CRASH	gen=607 glyphs=4
2026-03-14T07:36:45.280907	099964a4	0	0	0.0000	CRASH	gen=608 glyphs=4
2026-03-14T07:36:45.281107	099964a4	0	0	0.0000	CRASH	gen=608 glyphs=4
2026-03-14T07:36:45.281301	80cef82b	0	0	0.0000	CRASH	gen=608 glyphs=4
2026-03-14T07:36:45.281497	099964a4	0	0	0.0000	CRASH	gen=608 glyphs=4
2026-03-14T07:36:45.281691	099964a4	0	0	0.0000	CRASH	gen=608 glyphs=4
2026-03-14T07:36:45.281883	d77cead4	0	0	0.0000	CRASH	gen=608 glyphs=4
2026-03-14T07:36:45.282080	099964a4	0	0	0.0000	CRASH	gen=608 glyphs=4
2026-03-14T07:36:45.282272	ed3d7cae	0	0	0.0000	CRASH	gen=608 glyphs=4
2026-03-14T07:36:45.282464	80cef82b	0	0	0.0000	CRASH	gen=608 glyphs=4
2026-03-14T07:36:45.282660	98b4ab5b	0	0	0.0000	CRASH	gen=608 glyphs=4
2026-03-14T07:36:45.282940	099964a4	0	0	0.0000	CRASH	gen=609 glyphs=4
2026-03-14T07:36:45.283139	099964a4	0	0	0.0000	CRASH	gen=609 glyphs=4
2026-03-14T07:36:45.283334	d2f9cc82	0	0	0.0000	CRASH	gen=609 glyphs=4
2026-03-14T07:36:45.283530	099964a4	0	0	0.0000	CRASH	gen=609 glyphs=4
2026-03-14T07:36:45.283725	cb37c90d	0	0	0.0000	CRASH	gen=609 glyphs=3
2026-03-14T07:36:45.283918	80cef82b	0	0	0.0000	CRASH	gen=609 glyphs=4
2026-03-14T07:36:45.284113	099964a4	0	0	0.0000	CRASH	gen=609 glyphs=4
2026-03-14T07:36:45.284309	6c2817de	0	0	0.0000	CRASH	gen=609 glyphs=4
2026-03-14T07:36:45.284503	814f1bcb	0	0	0.0000	CRASH	gen=609 glyphs=3
2026-03-14T07:36:45.284696	137a5744	0	0	0.0000	CRASH	gen=609 glyphs=4
2026-03-14T07:36:45.284976	099964a4	0	0	0.0000	CRASH	gen=610 glyphs=4
2026-03-14T07:36:45.285171	099964a4	0	0	0.0000	CRASH	gen=610 glyphs=4
2026-03-14T07:36:45.285369	099964a4	0	0	0.0000	CRASH	gen=610 glyphs=4
2026-03-14T07:36:45.285565	dcb1fb50	0	0	0.0000	CRASH	gen=610 glyphs=4
2026-03-14T07:36:45.285759	099964a4	0	0	0.0000	CRASH	gen=610 glyphs=4
2026-03-14T07:36:45.285951	810b6b73	0	0	0.0000	CRASH	gen=610 glyphs=4
2026-03-14T07:36:45.286147	099964a4	0	0	0.0000	CRASH	gen=610 glyphs=4
2026-03-14T07:36:45.286346	3ca14993	0	0	0.0000	CRASH	gen=610 glyphs=4
2026-03-14T07:36:45.286545	099964a4	0	0	0.0000	CRASH	gen=610 glyphs=4
2026-03-14T07:36:45.286737	ff30496a	0	0	0.0000	CRASH	gen=610 glyphs=3
2026-03-14T07:36:45.287012	099964a4	0	0	0.0000	CRASH	gen=611 glyphs=4
2026-03-14T07:36:45.287209	099964a4	0	0	0.0000	CRASH	gen=611 glyphs=4
2026-03-14T07:36:45.287408	099964a4	0	0	0.0000	CRASH	gen=611 glyphs=4
2026-03-14T07:36:45.287603	dcb1fb50	0	0	0.0000	CRASH	gen=611 glyphs=4
2026-03-14T07:36:45.287799	cf93b656	0	0	0.0000	CRASH	gen=611 glyphs=3
2026-03-14T07:36:45.287992	991c0ca7	0	0	0.0000	CRASH	gen=611 glyphs=4
2026-03-14T07:36:45.288187	099964a4	0	0	0.0000	CRASH	gen=611 glyphs=4
2026-03-14T07:36:45.288383	80cef82b	0	0	0.0000	CRASH	gen=611 glyphs=4
2026-03-14T07:36:45.288582	099964a4	0	0	0.0000	CRASH	gen=611 glyphs=4
2026-03-14T07:36:45.288774	099964a4	0	0	0.0000	CRASH	gen=611 glyphs=4
2026-03-14T07:36:45.289041	099964a4	0	0	0.0000	CRASH	gen=612 glyphs=4
2026-03-14T07:36:45.289239	099964a4	0	0	0.0000	CRASH	gen=612 glyphs=4
2026-03-14T07:36:45.289436	ff30496a	0	0	0.0000	CRASH	gen=612 glyphs=3
2026-03-14T07:36:45.289634	099964a4	0	0	0.0000	CRASH	gen=612 glyphs=4
2026-03-14T07:36:45.289827	dcb1fb50	0	0	0.0000	CRASH	gen=612 glyphs=4
2026-03-14T07:36:45.290020	099964a4	0	0	0.0000	CRASH	gen=612 glyphs=4
2026-03-14T07:36:45.290212	80cef82b	0	0	0.0000	CRASH	gen=612 glyphs=4
2026-03-14T07:36:45.290407	099964a4	0	0	0.0000	CRASH	gen=612 glyphs=4
2026-03-14T07:36:45.290611	7ede4765	0	0	0.0000	CRASH	gen=612 glyphs=2
2026-03-14T07:36:45.290805	099964a4	0	0	0.0000	CRASH	gen=612 glyphs=4
2026-03-14T07:36:45.291077	099964a4	0	0	0.0000	CRASH	gen=613 glyphs=4
2026-03-14T07:36:45.291271	099964a4	0	0	0.0000	CRASH	gen=613 glyphs=4
2026-03-14T07:36:45.291464	099964a4	0	0	0.0000	CRASH	gen=613 glyphs=4
2026-03-14T07:36:45.291661	099964a4	0	0	0.0000	CRASH	gen=613 glyphs=4
2026-03-14T07:36:45.291854	e364ac44	0	0	0.0000	CRASH	gen=613 glyphs=3
2026-03-14T07:36:45.292048	099964a4	0	0	0.0000	CRASH	gen=613 glyphs=4
2026-03-14T07:36:45.292239	099964a4	0	0	0.0000	CRASH	gen=613 glyphs=4
2026-03-14T07:36:45.292431	dcb1fb50	0	0	0.0000	CRASH	gen=613 glyphs=4
2026-03-14T07:36:45.292635	099964a4	0	0	0.0000	CRASH	gen=613 glyphs=4
2026-03-14T07:36:45.292830	3a734398	0	0	0.0000	CRASH	gen=613 glyphs=4
2026-03-14T07:36:45.293100	099964a4	0	0	0.0000	CRASH	gen=614 glyphs=4
2026-03-14T07:36:45.293295	099964a4	0	0	0.0000	CRASH	gen=614 glyphs=4
2026-03-14T07:36:45.293490	099964a4	0	0	0.0000	CRASH	gen=614 glyphs=4
2026-03-14T07:36:45.293691	099964a4	0	0	0.0000	CRASH	gen=614 glyphs=4
2026-03-14T07:36:45.293883	0773c629	0	0	0.0000	CRASH	gen=614 glyphs=4
2026-03-14T07:36:45.294078	dcb1fb50	0	0	0.0000	CRASH	gen=614 glyphs=4
2026-03-14T07:36:45.294272	4e15955f	0	0	0.0000	CRASH	gen=614 glyphs=3
2026-03-14T07:36:45.294466	099964a4	0	0	0.0000	CRASH	gen=614 glyphs=4
2026-03-14T07:36:45.294663	099964a4	0	0	0.0000	CRASH	gen=614 glyphs=4
2026-03-14T07:36:45.294861	099964a4	0	0	0.0000	CRASH	gen=614 glyphs=4
2026-03-14T07:36:45.295132	099964a4	0	0	0.0000	CRASH	gen=615 glyphs=4
2026-03-14T07:36:45.295324	099964a4	0	0	0.0000	CRASH	gen=615 glyphs=4
2026-03-14T07:36:45.295520	3ca14993	0	0	0.0000	CRASH	gen=615 glyphs=4
2026-03-14T07:36:45.295711	dcb1fb50	0	0	0.0000	CRASH	gen=615 glyphs=4
2026-03-14T07:36:45.295906	80cef82b	0	0	0.0000	CRASH	gen=615 glyphs=4
2026-03-14T07:36:45.296097	099964a4	0	0	0.0000	CRASH	gen=615 glyphs=4
2026-03-14T07:36:45.296288	239c49aa	0	0	0.0000	CRASH	gen=615 glyphs=3
2026-03-14T07:36:45.296478	099964a4	0	0	0.0000	CRASH	gen=615 glyphs=4
2026-03-14T07:36:45.296675	97be813a	0	0	0.0000	CRASH	gen=615 glyphs=4
2026-03-14T07:36:45.296872	099964a4	0	0	0.0000	CRASH	gen=615 glyphs=4
2026-03-14T07:36:45.297139	099964a4	0	0	0.0000	CRASH	gen=616 glyphs=4
2026-03-14T07:36:45.297333	099964a4	0	0	0.0000	CRASH	gen=616 glyphs=4
2026-03-14T07:36:45.297528	099964a4	0	0	0.0000	CRASH	gen=616 glyphs=4
2026-03-14T07:36:45.297719	3a734398	0	0	0.0000	CRASH	gen=616 glyphs=4
2026-03-14T07:36:45.297914	099964a4	0	0	0.0000	CRASH	gen=616 glyphs=4
2026-03-14T07:36:45.298107	099964a4	0	0	0.0000	CRASH	gen=616 glyphs=4
2026-03-14T07:36:45.298299	099964a4	0	0	0.0000	CRASH	gen=616 glyphs=4
2026-03-14T07:36:45.298493	099964a4	0	0	0.0000	CRASH	gen=616 glyphs=4
2026-03-14T07:36:45.298692	099964a4	0	0	0.0000	CRASH	gen=616 glyphs=4
2026-03-14T07:36:45.298885	c8db455c	0	0	0.0000	CRASH	gen=616 glyphs=4
2026-03-14T07:36:45.299162	099964a4	0	0	0.0000	CRASH	gen=617 glyphs=4
2026-03-14T07:36:45.299354	099964a4	0	0	0.0000	CRASH	gen=617 glyphs=4
2026-03-14T07:36:45.299548	099964a4	0	0	0.0000	CRASH	gen=617 glyphs=4
2026-03-14T07:36:45.299739	099964a4	0	0	0.0000	CRASH	gen=617 glyphs=4
2026-03-14T07:36:45.299930	b66c0b50	0	0	0.0000	CRASH	gen=617 glyphs=3
2026-03-14T07:36:45.300126	099964a4	0	0	0.0000	CRASH	gen=617 glyphs=4
2026-03-14T07:36:45.300318	099964a4	0	0	0.0000	CRASH	gen=617 glyphs=4
2026-03-14T07:36:45.300509	cf93b656	0	0	0.0000	CRASH	gen=617 glyphs=3
2026-03-14T07:36:45.300705	099964a4	0	0	0.0000	CRASH	gen=617 glyphs=4
2026-03-14T07:36:45.300899	4cb46bcd	0	0	0.0000	CRASH	gen=617 glyphs=4
2026-03-14T07:36:45.301183	099964a4	0	0	0.0000	CRASH	gen=618 glyphs=4
2026-03-14T07:36:45.301377	099964a4	0	0	0.0000	CRASH	gen=618 glyphs=4
2026-03-14T07:36:45.301572	bd41864a	0	0	0.0000	CRASH	gen=618 glyphs=4
2026-03-14T07:36:45.301764	7ede4765	0	0	0.0000	CRASH	gen=618 glyphs=2
2026-03-14T07:36:45.301956	c12a6af9	0	0	0.0000	CRASH	gen=618 glyphs=4
2026-03-14T07:36:45.302157	3ca14993	0	0	0.0000	CRASH	gen=618 glyphs=4
2026-03-14T07:36:45.302350	099964a4	0	0	0.0000	CRASH	gen=618 glyphs=4
2026-03-14T07:36:45.302547	dcb1fb50	0	0	0.0000	CRASH	gen=618 glyphs=4
2026-03-14T07:36:45.302747	d577e25a	0	0	0.0000	CRASH	gen=618 glyphs=3
2026-03-14T07:36:45.302944	cf93b656	0	0	0.0000	CRASH	gen=618 glyphs=3
2026-03-14T07:36:45.303229	099964a4	0	0	0.0000	CRASH	gen=619 glyphs=4
2026-03-14T07:36:45.303423	099964a4	0	0	0.0000	CRASH	gen=619 glyphs=4
2026-03-14T07:36:45.303619	6e70e50d	0	0	0.0000	CRASH	gen=619 glyphs=3
2026-03-14T07:36:45.303813	099964a4	0	0	0.0000	CRASH	gen=619 glyphs=4
2026-03-14T07:36:45.304005	099964a4	0	0	0.0000	CRASH	gen=619 glyphs=4
2026-03-14T07:36:45.304199	072bffda	0	0	0.0000	CRASH	gen=619 glyphs=4
2026-03-14T07:36:45.304395	099964a4	0	0	0.0000	CRASH	gen=619 glyphs=4
2026-03-14T07:36:45.304588	585bf377	0	0	0.0000	CRASH	gen=619 glyphs=4
2026-03-14T07:36:45.304783	099964a4	0	0	0.0000	CRASH	gen=619 glyphs=4
2026-03-14T07:36:45.304973	099964a4	0	0	0.0000	CRASH	gen=619 glyphs=4
2026-03-14T07:36:45.305252	099964a4	0	0	0.0000	CRASH	gen=620 glyphs=4
2026-03-14T07:36:45.305447	099964a4	0	0	0.0000	CRASH	gen=620 glyphs=4
2026-03-14T07:36:45.305647	099964a4	0	0	0.0000	CRASH	gen=620 glyphs=4
2026-03-14T07:36:45.305842	35b48b4f	0	0	0.0000	CRASH	gen=620 glyphs=4
2026-03-14T07:36:45.306038	cf93b656	0	0	0.0000	CRASH	gen=620 glyphs=3
2026-03-14T07:36:45.306233	099964a4	0	0	0.0000	CRASH	gen=620 glyphs=4
2026-03-14T07:36:45.306433	099964a4	0	0	0.0000	CRASH	gen=620 glyphs=4
2026-03-14T07:36:45.306631	099964a4	0	0	0.0000	CRASH	gen=620 glyphs=4
2026-03-14T07:36:45.306836	cf45a5b1	0	0	0.0000	CRASH	gen=620 glyphs=4
2026-03-14T07:36:45.307033	099964a4	0	0	0.0000	CRASH	gen=620 glyphs=4
2026-03-14T07:36:45.307315	099964a4	0	0	0.0000	CRASH	gen=621 glyphs=4
2026-03-14T07:36:45.307512	099964a4	0	0	0.0000	CRASH	gen=621 glyphs=4
2026-03-14T07:36:45.307710	099964a4	0	0	0.0000	CRASH	gen=621 glyphs=4
2026-03-14T07:36:45.307901	099964a4	0	0	0.0000	CRASH	gen=621 glyphs=4
2026-03-14T07:36:45.308095	7c252482	0	0	0.0000	CRASH	gen=621 glyphs=3
2026-03-14T07:36:45.308287	02878cc0	0	0	0.0000	CRASH	gen=621 glyphs=3
2026-03-14T07:36:45.308486	099964a4	0	0	0.0000	CRASH	gen=621 glyphs=4
2026-03-14T07:36:45.308687	cf93b656	0	0	0.0000	CRASH	gen=621 glyphs=3
2026-03-14T07:36:45.308882	099964a4	0	0	0.0000	CRASH	gen=621 glyphs=4
2026-03-14T07:36:45.309076	3e5fe5b2	0	0	0.0000	CRASH	gen=621 glyphs=5
2026-03-14T07:36:45.309352	099964a4	0	0	0.0000	CRASH	gen=622 glyphs=4
2026-03-14T07:36:45.309556	099964a4	0	0	0.0000	CRASH	gen=622 glyphs=4
2026-03-14T07:36:45.309752	099964a4	0	0	0.0000	CRASH	gen=622 glyphs=4
2026-03-14T07:36:45.309945	099964a4	0	0	0.0000	CRASH	gen=622 glyphs=4
2026-03-14T07:36:45.310139	099964a4	0	0	0.0000	CRASH	gen=622 glyphs=4
2026-03-14T07:36:45.310332	630e8839	0	0	0.0000	CRASH	gen=622 glyphs=3
2026-03-14T07:36:45.310537	e290ac79	0	0	0.0000	CRASH	gen=622 glyphs=2
2026-03-14T07:36:45.310731	b559230b	0	0	0.0000	CRASH	gen=622 glyphs=4
2026-03-14T07:36:45.310929	d5f5fb04	0	0	0.0000	CRASH	gen=622 glyphs=4
2026-03-14T07:36:45.311128	a0d2e018	0	0	0.0000	CRASH	gen=622 glyphs=3
2026-03-14T07:36:45.311408	099964a4	0	0	0.0000	CRASH	gen=623 glyphs=4
2026-03-14T07:36:45.311611	099964a4	0	0	0.0000	CRASH	gen=623 glyphs=4
2026-03-14T07:36:45.311808	3a734398	0	0	0.0000	CRASH	gen=623 glyphs=4
2026-03-14T07:36:45.312001	099964a4	0	0	0.0000	CRASH	gen=623 glyphs=4
2026-03-14T07:36:45.312198	099964a4	0	0	0.0000	CRASH	gen=623 glyphs=4
2026-03-14T07:36:45.312389	099964a4	0	0	0.0000	CRASH	gen=623 glyphs=4
2026-03-14T07:36:45.312587	cf93b656	0	0	0.0000	CRASH	gen=623 glyphs=3
2026-03-14T07:36:45.312780	abf56c6b	0	0	0.0000	CRASH	gen=623 glyphs=5
2026-03-14T07:36:45.312981	9cda714e	0	0	0.0000	CRASH	gen=623 glyphs=4
2026-03-14T07:36:45.313175	099964a4	0	0	0.0000	CRASH	gen=623 glyphs=4
2026-03-14T07:36:45.313443	099964a4	0	0	0.0000	CRASH	gen=624 glyphs=4
2026-03-14T07:36:45.313648	099964a4	0	0	0.0000	CRASH	gen=624 glyphs=4
2026-03-14T07:36:45.313842	9b5e6190	0	0	0.0000	CRASH	gen=624 glyphs=3
2026-03-14T07:36:45.314035	099964a4	0	0	0.0000	CRASH	gen=624 glyphs=4
2026-03-14T07:36:45.314229	fde1369a	0	0	0.0000	CRASH	gen=624 glyphs=3
2026-03-14T07:36:45.314422	7ede4765	0	0	0.0000	CRASH	gen=624 glyphs=2
2026-03-14T07:36:45.314617	3a734398	0	0	0.0000	CRASH	gen=624 glyphs=4
2026-03-14T07:36:45.314816	5bc9adc2	0	0	0.0000	CRASH	gen=624 glyphs=4
2026-03-14T07:36:45.315014	6374f35c	0	0	0.0000	CRASH	gen=624 glyphs=2
2026-03-14T07:36:45.315209	580ebdc4	0	0	0.0000	CRASH	gen=624 glyphs=2
2026-03-14T07:36:45.315488	099964a4	0	0	0.0000	CRASH	gen=625 glyphs=4
2026-03-14T07:36:45.315684	099964a4	0	0	0.0000	CRASH	gen=625 glyphs=4
2026-03-14T07:36:45.315880	41a7448a	0	0	0.0000	CRASH	gen=625 glyphs=5
2026-03-14T07:36:45.316075	b8540cf9	0	0	0.0000	CRASH	gen=625 glyphs=3
2026-03-14T07:36:45.316269	a4074184	0	0	0.0000	CRASH	gen=625 glyphs=4
2026-03-14T07:36:45.316463	099964a4	0	0	0.0000	CRASH	gen=625 glyphs=4
2026-03-14T07:36:45.316659	099964a4	0	0	0.0000	CRASH	gen=625 glyphs=4
2026-03-14T07:36:45.316854	099964a4	0	0	0.0000	CRASH	gen=625 glyphs=4
2026-03-14T07:36:45.317048	099964a4	0	0	0.0000	CRASH	gen=625 glyphs=4
2026-03-14T07:36:45.317242	9b6133db	0	0	0.0000	CRASH	gen=625 glyphs=4
2026-03-14T07:36:45.317519	099964a4	0	0	0.0000	CRASH	gen=626 glyphs=4
2026-03-14T07:36:45.317714	099964a4	0	0	0.0000	CRASH	gen=626 glyphs=4
2026-03-14T07:36:45.317911	cf93b656	0	0	0.0000	CRASH	gen=626 glyphs=3
2026-03-14T07:36:45.318104	1bd9a520	0	0	0.0000	CRASH	gen=626 glyphs=3
2026-03-14T07:36:45.318299	55ecf9c5	0	0	0.0000	CRASH	gen=626 glyphs=4
2026-03-14T07:36:45.318493	ff30496a	0	0	0.0000	CRASH	gen=626 glyphs=3
2026-03-14T07:36:45.318689	a591115e	0	0	0.0000	CRASH	gen=626 glyphs=5
2026-03-14T07:36:45.318885	0a7c3d35	0	0	0.0000	CRASH	gen=626 glyphs=4
2026-03-14T07:36:45.319085	80cef82b	0	0	0.0000	CRASH	gen=626 glyphs=4
2026-03-14T07:36:45.319278	7ede4765	0	0	0.0000	CRASH	gen=626 glyphs=2
2026-03-14T07:36:45.319556	099964a4	0	0	0.0000	CRASH	gen=627 glyphs=4
2026-03-14T07:36:45.319750	099964a4	0	0	0.0000	CRASH	gen=627 glyphs=4
2026-03-14T07:36:45.319943	099964a4	0	0	0.0000	CRASH	gen=627 glyphs=4
2026-03-14T07:36:45.320140	099964a4	0	0	0.0000	CRASH	gen=627 glyphs=4
2026-03-14T07:36:45.320334	099964a4	0	0	0.0000	CRASH	gen=627 glyphs=4
2026-03-14T07:36:45.320529	099964a4	0	0	0.0000	CRASH	gen=627 glyphs=4
2026-03-14T07:36:45.320720	cf93b656	0	0	0.0000	CRASH	gen=627 glyphs=3
2026-03-14T07:36:45.320910	099964a4	0	0	0.0000	CRASH	gen=627 glyphs=4
2026-03-14T07:36:45.321107	6c466bfd	0	0	0.0000	CRASH	gen=627 glyphs=4
2026-03-14T07:36:45.321298	7ede4765	0	0	0.0000	CRASH	gen=627 glyphs=2
2026-03-14T07:36:45.321581	099964a4	0	0	0.0000	CRASH	gen=628 glyphs=4
2026-03-14T07:36:45.321779	099964a4	0	0	0.0000	CRASH	gen=628 glyphs=4
2026-03-14T07:36:45.321974	099964a4	0	0	0.0000	CRASH	gen=628 glyphs=4
2026-03-14T07:36:45.322169	3eb89af9	0	0	0.0000	CRASH	gen=628 glyphs=2
2026-03-14T07:36:45.322359	2d33323a	0	0	0.0000	CRASH	gen=628 glyphs=4
2026-03-14T07:36:45.322553	8da1f8d8	0	0	0.0000	CRASH	gen=628 glyphs=4
2026-03-14T07:36:45.322745	099964a4	0	0	0.0000	CRASH	gen=628 glyphs=4
2026-03-14T07:36:45.322936	099964a4	0	0	0.0000	CRASH	gen=628 glyphs=4
2026-03-14T07:36:45.323132	07696509	0	0	0.0000	CRASH	gen=628 glyphs=3
2026-03-14T07:36:45.323333	099964a4	0	0	0.0000	CRASH	gen=628 glyphs=4
2026-03-14T07:36:45.323605	099964a4	0	0	0.0000	CRASH	gen=629 glyphs=4
2026-03-14T07:36:45.323798	099964a4	0	0	0.0000	CRASH	gen=629 glyphs=4
2026-03-14T07:36:45.323991	099964a4	0	0	0.0000	CRASH	gen=629 glyphs=4
2026-03-14T07:36:45.324184	1ba7e269	0	0	0.0000	CRASH	gen=629 glyphs=2
2026-03-14T07:36:45.324381	099964a4	0	0	0.0000	CRASH	gen=629 glyphs=4
2026-03-14T07:36:45.324577	7ede4765	0	0	0.0000	CRASH	gen=629 glyphs=2
2026-03-14T07:36:45.324775	099964a4	0	0	0.0000	CRASH	gen=629 glyphs=4
2026-03-14T07:36:45.324968	099964a4	0	0	0.0000	CRASH	gen=629 glyphs=4
2026-03-14T07:36:45.325163	edf59280	0	0	0.0000	CRASH	gen=629 glyphs=2
2026-03-14T07:36:45.325359	71fbd897	0	0	0.0000	CRASH	gen=629 glyphs=3
2026-03-14T07:36:45.325636	099964a4	0	0	0.0000	CRASH	gen=630 glyphs=4
2026-03-14T07:36:45.325833	099964a4	0	0	0.0000	CRASH	gen=630 glyphs=4
2026-03-14T07:36:45.326029	dcb1fb50	0	0	0.0000	CRASH	gen=630 glyphs=4
2026-03-14T07:36:45.326225	ee0ab26a	0	0	0.0000	CRASH	gen=630 glyphs=3
2026-03-14T07:36:45.326424	099964a4	0	0	0.0000	CRASH	gen=630 glyphs=4
2026-03-14T07:36:45.326619	4ec66f98	0	0	0.0000	CRASH	gen=630 glyphs=3
2026-03-14T07:36:45.326812	dcb1fb50	0	0	0.0000	CRASH	gen=630 glyphs=4
2026-03-14T07:36:45.327005	7ede4765	0	0	0.0000	CRASH	gen=630 glyphs=2
2026-03-14T07:36:45.327201	7ede4765	0	0	0.0000	CRASH	gen=630 glyphs=2
2026-03-14T07:36:45.327394	3192a2ef	0	0	0.0000	CRASH	gen=630 glyphs=2
2026-03-14T07:36:45.327688	099964a4	0	0	0.0000	CRASH	gen=631 glyphs=4
2026-03-14T07:36:45.327886	099964a4	0	0	0.0000	CRASH	gen=631 glyphs=4
2026-03-14T07:36:45.328079	099964a4	0	0	0.0000	CRASH	gen=631 glyphs=4
2026-03-14T07:36:45.328272	e7555bac	0	0	0.0000	CRASH	gen=631 glyphs=3
2026-03-14T07:36:45.328467	099964a4	0	0	0.0000	CRASH	gen=631 glyphs=4
2026-03-14T07:36:45.328666	80cef82b	0	0	0.0000	CRASH	gen=631 glyphs=4
2026-03-14T07:36:45.328863	e0370948	0	0	0.0000	CRASH	gen=631 glyphs=4
2026-03-14T07:36:45.329059	7ede4765	0	0	0.0000	CRASH	gen=631 glyphs=2
2026-03-14T07:36:45.329255	099964a4	0	0	0.0000	CRASH	gen=631 glyphs=4
2026-03-14T07:36:45.329447	099964a4	0	0	0.0000	CRASH	gen=631 glyphs=4
2026-03-14T07:36:45.329730	099964a4	0	0	0.0000	CRASH	gen=632 glyphs=4
2026-03-14T07:36:45.329926	099964a4	0	0	0.0000	CRASH	gen=632 glyphs=4
2026-03-14T07:36:45.330121	ff30496a	0	0	0.0000	CRASH	gen=632 glyphs=3
2026-03-14T07:36:45.330315	8da1f8d8	0	0	0.0000	CRASH	gen=632 glyphs=4
2026-03-14T07:36:45.330512	099964a4	0	0	0.0000	CRASH	gen=632 glyphs=4
2026-03-14T07:36:45.330711	d3de30b5	0	0	0.0000	CRASH	gen=632 glyphs=4
2026-03-14T07:36:45.330908	099964a4	0	0	0.0000	CRASH	gen=632 glyphs=4
2026-03-14T07:36:45.331101	3a734398	0	0	0.0000	CRASH	gen=632 glyphs=4
2026-03-14T07:36:45.331296	aae89005	0	0	0.0000	CRASH	gen=632 glyphs=4
2026-03-14T07:36:45.331495	c7e86a8f	0	0	0.0000	CRASH	gen=632 glyphs=3
2026-03-14T07:36:45.331779	099964a4	0	0	0.0000	CRASH	gen=633 glyphs=4
2026-03-14T07:36:45.331974	099964a4	0	0	0.0000	CRASH	gen=633 glyphs=4
2026-03-14T07:36:45.332168	cf93b656	0	0	0.0000	CRASH	gen=633 glyphs=3
2026-03-14T07:36:45.332361	099964a4	0	0	0.0000	CRASH	gen=633 glyphs=4
2026-03-14T07:36:45.332557	099964a4	0	0	0.0000	CRASH	gen=633 glyphs=4
2026-03-14T07:36:45.332752	099964a4	0	0	0.0000	CRASH	gen=633 glyphs=4
2026-03-14T07:36:45.332944	b635a84a	0	0	0.0000	CRASH	gen=633 glyphs=4
2026-03-14T07:36:45.333136	7ea1e0c4	0	0	0.0000	CRASH	gen=633 glyphs=2
2026-03-14T07:36:45.333331	43ba7ea2	0	0	0.0000	CRASH	gen=633 glyphs=3
2026-03-14T07:36:45.333528	215d3a6d	0	0	0.0000	CRASH	gen=633 glyphs=4
2026-03-14T07:36:45.333810	099964a4	0	0	0.0000	CRASH	gen=634 glyphs=4
2026-03-14T07:36:45.334007	099964a4	0	0	0.0000	CRASH	gen=634 glyphs=4
2026-03-14T07:36:45.334202	d12b1d99	0	0	0.0000	CRASH	gen=634 glyphs=4
2026-03-14T07:36:45.334394	099964a4	0	0	0.0000	CRASH	gen=634 glyphs=4
2026-03-14T07:36:45.334589	099964a4	0	0	0.0000	CRASH	gen=634 glyphs=4
2026-03-14T07:36:45.334783	099964a4	0	0	0.0000	CRASH	gen=634 glyphs=4
2026-03-14T07:36:45.334980	80cef82b	0	0	0.0000	CRASH	gen=634 glyphs=4
2026-03-14T07:36:45.335174	83a0e6f6	0	0	0.0000	CRASH	gen=634 glyphs=3
2026-03-14T07:36:45.335367	099964a4	0	0	0.0000	CRASH	gen=634 glyphs=4
2026-03-14T07:36:45.335563	7ede4765	0	0	0.0000	CRASH	gen=634 glyphs=2
2026-03-14T07:36:45.335828	099964a4	0	0	0.0000	CRASH	gen=635 glyphs=4
2026-03-14T07:36:45.336026	099964a4	0	0	0.0000	CRASH	gen=635 glyphs=4
2026-03-14T07:36:45.336221	7ede4765	0	0	0.0000	CRASH	gen=635 glyphs=2
2026-03-14T07:36:45.336415	099964a4	0	0	0.0000	CRASH	gen=635 glyphs=4
2026-03-14T07:36:45.336612	dcb1fb50	0	0	0.0000	CRASH	gen=635 glyphs=4
2026-03-14T07:36:45.336808	099964a4	0	0	0.0000	CRASH	gen=635 glyphs=4
2026-03-14T07:36:45.337006	cf93b656	0	0	0.0000	CRASH	gen=635 glyphs=3
2026-03-14T07:36:45.337197	8da1f8d8	0	0	0.0000	CRASH	gen=635 glyphs=4
2026-03-14T07:36:45.337394	ff30496a	0	0	0.0000	CRASH	gen=635 glyphs=3
2026-03-14T07:36:45.337589	099964a4	0	0	0.0000	CRASH	gen=635 glyphs=4
2026-03-14T07:36:45.337866	099964a4	0	0	0.0000	CRASH	gen=636 glyphs=4
2026-03-14T07:36:45.338070	099964a4	0	0	0.0000	CRASH	gen=636 glyphs=4
2026-03-14T07:36:45.338267	3ca14993	0	0	0.0000	CRASH	gen=636 glyphs=4
2026-03-14T07:36:45.338464	f028fb97	0	0	0.0000	CRASH	gen=636 glyphs=3
2026-03-14T07:36:45.338663	f9b2061a	0	0	0.0000	CRASH	gen=636 glyphs=4
2026-03-14T07:36:45.338857	099964a4	0	0	0.0000	CRASH	gen=636 glyphs=4
2026-03-14T07:36:45.339049	099964a4	0	0	0.0000	CRASH	gen=636 glyphs=4
2026-03-14T07:36:45.339244	2b4b2eb2	0	0	0.0000	CRASH	gen=636 glyphs=4
2026-03-14T07:36:45.339436	42f5ec11	0	0	0.0000	CRASH	gen=636 glyphs=4
2026-03-14T07:36:45.339630	099964a4	0	0	0.0000	CRASH	gen=636 glyphs=4
2026-03-14T07:36:45.339896	099964a4	0	0	0.0000	CRASH	gen=637 glyphs=4
2026-03-14T07:36:45.340090	099964a4	0	0	0.0000	CRASH	gen=637 glyphs=4
2026-03-14T07:36:45.340286	8da1f8d8	0	0	0.0000	CRASH	gen=637 glyphs=4
2026-03-14T07:36:45.340481	099964a4	0	0	0.0000	CRASH	gen=637 glyphs=4
2026-03-14T07:36:45.340677	099964a4	0	0	0.0000	CRASH	gen=637 glyphs=4
2026-03-14T07:36:45.340868	d97003e8	0	0	0.0000	CRASH	gen=637 glyphs=4
2026-03-14T07:36:45.341062	46c6ceec	0	0	0.0000	CRASH	gen=637 glyphs=5
2026-03-14T07:36:45.341259	099964a4	0	0	0.0000	CRASH	gen=637 glyphs=4
2026-03-14T07:36:45.341453	099964a4	0	0	0.0000	CRASH	gen=637 glyphs=4
2026-03-14T07:36:45.341645	53d13a97	0	0	0.0000	CRASH	gen=637 glyphs=4
2026-03-14T07:36:45.341922	099964a4	0	0	0.0000	CRASH	gen=638 glyphs=4
2026-03-14T07:36:45.342118	099964a4	0	0	0.0000	CRASH	gen=638 glyphs=4
2026-03-14T07:36:45.342319	099964a4	0	0	0.0000	CRASH	gen=638 glyphs=4
2026-03-14T07:36:45.342513	099964a4	0	0	0.0000	CRASH	gen=638 glyphs=4
2026-03-14T07:36:45.342711	0bfcff78	0	0	0.0000	CRASH	gen=638 glyphs=4
2026-03-14T07:36:45.342906	85cb9668	0	0	0.0000	CRASH	gen=638 glyphs=2
2026-03-14T07:36:45.343100	099964a4	0	0	0.0000	CRASH	gen=638 glyphs=4
2026-03-14T07:36:45.343292	c3943d9b	0	0	0.0000	CRASH	gen=638 glyphs=4
2026-03-14T07:36:45.343490	3ca14993	0	0	0.0000	CRASH	gen=638 glyphs=4
2026-03-14T07:36:45.343684	099964a4	0	0	0.0000	CRASH	gen=638 glyphs=4
