timestamp	program_hash	spirv_size	word_count	fitness	status	description
2026-03-14T00:15:01.179917	37f4017b	116	29	1.0000	DISCARD	gen=256 glyphs=4
2026-03-14T00:15:01.453329	8aef8872	116	29	1.0000	DISCARD	gen=300 glyphs=4
2026-03-14T00:15:03.942163	37f4017b	116	29	1.0000	DISCARD	gen=257 glyphs=4
2026-03-14T00:15:04.223283	19355583	120	30	1.0000	DISCARD	gen=300 glyphs=4
2026-03-14T00:15:06.706122	bfdf7cad	120	30	1.0000	DISCARD	gen=257 glyphs=4
2026-03-14T00:15:06.978932	19355583	120	30	1.0000	DISCARD	gen=301 glyphs=4
2026-03-14T00:15:09.464624	d11c1062	120	30	1.0000	DISCARD	gen=257 glyphs=4
2026-03-14T00:15:09.734467	8aef8872	116	29	1.0000	DISCARD	gen=301 glyphs=4
2026-03-14T00:15:12.229096	a0743d04	120	30	1.0000	DISCARD	gen=257 glyphs=4
2026-03-14T00:15:12.513052	8aef8872	116	29	1.0000	DISCARD	gen=301 glyphs=4
2026-03-14T00:15:15.012834	d5cbdf62	116	29	1.0000	DISCARD	gen=257 glyphs=4
2026-03-14T00:15:15.277863	e2cd28ea	120	30	1.0000	DISCARD	gen=301 glyphs=4
2026-03-14T00:15:17.744045	07dc8a51	120	30	1.0000	DISCARD	gen=257 glyphs=4
2026-03-14T00:15:18.022784	19355583	120	30	1.0000	DISCARD	gen=301 glyphs=4
2026-03-14T00:15:20.486304	4b7d0feb	116	29	1.0000	DISCARD	gen=257 glyphs=4
2026-03-14T00:15:20.756115	eca7ab6c	116	29	1.0000	DISCARD	gen=301 glyphs=4
2026-03-14T00:15:23.214145	55d6c151	120	30	1.0000	DISCARD	gen=257 glyphs=4
2026-03-14T00:15:23.495636	7567a00f	116	29	1.0000	DISCARD	gen=301 glyphs=4
2026-03-14T00:15:25.999242	5b9807ac	120	30	1.0000	DISCARD	gen=257 glyphs=4
2026-03-14T00:15:26.267850	b7aed8e9	116	29	1.0000	DISCARD	gen=301 glyphs=4
2026-03-14T00:15:28.746076	55d6c151	120	30	1.0000	DISCARD	gen=257 glyphs=4
2026-03-14T00:15:29.103384	050862ad	120	30	1.0000	DISCARD	gen=301 glyphs=4
2026-03-14T00:15:31.607453	37f4017b	116	29	1.0000	DISCARD	gen=258 glyphs=4
2026-03-14T00:15:31.879217	eca7ab6c	116	29	1.0000	DISCARD	gen=301 glyphs=4
2026-03-14T00:15:34.368848	bfdf7cad	120	30	1.0000	DISCARD	gen=258 glyphs=4
2026-03-14T00:15:34.647527	19355583	120	30	1.0000	DISCARD	gen=302 glyphs=4
2026-03-14T00:15:37.137837	26e6473f	116	29	1.0000	DISCARD	gen=258 glyphs=4
2026-03-14T00:15:37.409913	8aef8872	116	29	1.0000	DISCARD	gen=302 glyphs=4
2026-03-14T00:15:39.888923	5b9807ac	120	30	1.0000	DISCARD	gen=258 glyphs=4
2026-03-14T00:15:40.155186	050862ad	120	30	1.0000	DISCARD	gen=302 glyphs=4
2026-03-14T00:15:42.657235	4c9b0dd4	120	30	1.0000	DISCARD	gen=258 glyphs=4
2026-03-14T00:15:42.952406	50dc991d	116	29	1.0000	DISCARD	gen=302 glyphs=4
2026-03-14T00:15:45.416097	7eda0547	120	30	0.9500	DISCARD	gen=258 glyphs=4
2026-03-14T00:15:45.699731	19355583	120	30	1.0000	DISCARD	gen=302 glyphs=4
2026-03-14T00:15:48.210204	d11c1062	120	30	1.0000	DISCARD	gen=258 glyphs=4
2026-03-14T00:15:48.489423	b57e7176	120	30	1.0000	DISCARD	gen=302 glyphs=4
2026-03-14T00:15:51.125379	37f4017b	116	29	1.0000	DISCARD	gen=258 glyphs=4
2026-03-14T00:15:51.420795	a78f9454	120	30	1.0000	DISCARD	gen=302 glyphs=4
2026-03-14T00:15:53.960196	55d6c151	120	30	1.0000	DISCARD	gen=258 glyphs=4
2026-03-14T00:15:54.241494	67cb81be	120	30	1.0000	DISCARD	gen=302 glyphs=4
2026-03-14T00:15:56.803471	11b1fba4	116	29	1.0000	DISCARD	gen=258 glyphs=4
2026-03-14T00:15:57.086689	0eaedb57	116	29	1.0000	DISCARD	gen=302 glyphs=4
2026-03-14T00:15:59.647563	37f4017b	116	29	1.0000	DISCARD	gen=259 glyphs=4
2026-03-14T00:15:59.928177	4e9c3f79	116	29	1.0000	DISCARD	gen=302 glyphs=4
2026-03-14T00:16:02.567848	bfdf7cad	120	30	1.0000	DISCARD	gen=259 glyphs=4
2026-03-14T00:16:02.853515	19355583	120	30	1.0000	DISCARD	gen=303 glyphs=4
2026-03-14T00:16:05.406826	5a06ca32	120	30	1.0000	DISCARD	gen=259 glyphs=4
2026-03-14T00:16:05.677348	8aef8872	116	29	1.0000	DISCARD	gen=303 glyphs=4
2026-03-14T00:16:08.121986	55d6c151	120	30	1.0000	DISCARD	gen=259 glyphs=4
2026-03-14T00:16:08.392694	050862ad	120	30	1.0000	DISCARD	gen=303 glyphs=4
2026-03-14T00:16:10.867137	d11c1062	120	30	1.0000	DISCARD	gen=259 glyphs=4
2026-03-14T00:16:11.147098	416cb21c	116	29	1.0000	DISCARD	gen=303 glyphs=4
2026-03-14T00:16:13.591461	1ba19185	116	29	1.0000	DISCARD	gen=259 glyphs=4
2026-03-14T00:16:13.855148	edb3cfbf	116	29	1.0000	DISCARD	gen=303 glyphs=4
2026-03-14T00:16:16.301886	5b9807ac	120	30	1.0000	DISCARD	gen=259 glyphs=4
2026-03-14T00:16:16.574261	1e5f0e21	116	29	1.0000	DISCARD	gen=303 glyphs=4
2026-03-14T00:16:19.024236	f5eae48e	116	29	1.0000	DISCARD	gen=259 glyphs=4
2026-03-14T00:16:19.298318	8aef8872	116	29	1.0000	DISCARD	gen=303 glyphs=4
2026-03-14T00:16:21.761568	5a06ca32	120	30	1.0000	DISCARD	gen=259 glyphs=4
2026-03-14T00:16:22.029452	26e793d3	116	29	1.0000	DISCARD	gen=303 glyphs=4
2026-03-14T00:16:24.496921	6ead4e09	116	29	1.0000	DISCARD	gen=259 glyphs=4
2026-03-14T00:16:24.759813	8aef8872	116	29	1.0000	DISCARD	gen=303 glyphs=4
2026-03-14T00:16:27.214683	37f4017b	116	29	1.0000	DISCARD	gen=260 glyphs=4
2026-03-14T00:16:27.485399	1e5f0e21	116	29	1.0000	DISCARD	gen=303 glyphs=4
2026-03-14T00:16:29.943570	bfdf7cad	120	30	1.0000	DISCARD	gen=260 glyphs=4
2026-03-14T00:16:30.205215	19355583	120	30	1.0000	DISCARD	gen=304 glyphs=4
2026-03-14T00:16:32.723612	5a06ca32	120	30	1.0000	DISCARD	gen=260 glyphs=4
2026-03-14T00:16:32.989848	8aef8872	116	29	1.0000	DISCARD	gen=304 glyphs=4
2026-03-14T00:16:35.498004	5a06ca32	120	30	1.0000	DISCARD	gen=260 glyphs=4
2026-03-14T00:16:35.782493	0b98dbdd	116	29	1.0000	DISCARD	gen=304 glyphs=4
2026-03-14T00:16:38.227901	37f4017b	116	29	1.0000	DISCARD	gen=260 glyphs=4
2026-03-14T00:16:38.496268	19355583	120	30	1.0000	DISCARD	gen=304 glyphs=4
2026-03-14T00:16:40.958586	5a06ca32	120	30	1.0000	DISCARD	gen=260 glyphs=4
2026-03-14T00:16:41.230810	9e34ede0	116	29	1.0000	DISCARD	gen=304 glyphs=4
2026-03-14T00:16:43.650574	fdb5d108	120	30	1.0000	DISCARD	gen=260 glyphs=4
2026-03-14T00:16:43.922715	050862ad	120	30	1.0000	DISCARD	gen=304 glyphs=4
2026-03-14T00:16:46.377145	5a06ca32	120	30	1.0000	DISCARD	gen=260 glyphs=4
2026-03-14T00:16:46.642709	b811526e	120	30	1.0000	DISCARD	gen=304 glyphs=4
2026-03-14T00:16:49.081791	55d6c151	120	30	1.0000	DISCARD	gen=260 glyphs=4
2026-03-14T00:16:49.350249	3e176aba	116	29	1.0000	DISCARD	gen=304 glyphs=4
2026-03-14T00:16:51.786472	37f4017b	116	29	1.0000	DISCARD	gen=260 glyphs=4
2026-03-14T00:16:52.060544	e7b2245f	116	29	1.0000	DISCARD	gen=304 glyphs=4
2026-03-14T00:16:54.510306	37f4017b	116	29	1.0000	DISCARD	gen=261 glyphs=4
2026-03-14T00:16:54.782664	4f7fa62d	120	30	1.0000	DISCARD	gen=304 glyphs=4
2026-03-14T00:16:57.237082	bfdf7cad	120	30	1.0000	DISCARD	gen=261 glyphs=4
2026-03-14T00:16:57.524693	19355583	120	30	1.0000	DISCARD	gen=305 glyphs=4
2026-03-14T00:16:59.993055	55d6c151	120	30	1.0000	DISCARD	gen=261 glyphs=4
2026-03-14T00:17:00.268320	8aef8872	116	29	1.0000	DISCARD	gen=305 glyphs=4
2026-03-14T00:17:02.742119	5a06ca32	120	30	1.0000	DISCARD	gen=261 glyphs=4
2026-03-14T00:17:03.012181	e8c7f6cf	120	30	1.0000	DISCARD	gen=305 glyphs=4
2026-03-14T00:17:05.573395	1d34459a	116	29	1.0000	DISCARD	gen=261 glyphs=4
2026-03-14T00:17:05.833028	050862ad	120	30	1.0000	DISCARD	gen=305 glyphs=4
2026-03-14T00:17:08.297933	5b9807ac	120	30	1.0000	DISCARD	gen=261 glyphs=4
2026-03-14T00:17:08.566633	e2cd28ea	120	30	1.0000	DISCARD	gen=305 glyphs=4
2026-03-14T00:17:11.046173	37f4017b	116	29	1.0000	DISCARD	gen=261 glyphs=4
2026-03-14T00:17:11.309787	b7aed8e9	116	29	1.0000	DISCARD	gen=305 glyphs=4
2026-03-14T00:17:13.771614	4c9b0dd4	120	30	1.0000	DISCARD	gen=261 glyphs=4
2026-03-14T00:17:14.042082	0eaedb57	116	29	1.0000	DISCARD	gen=305 glyphs=4
2026-03-14T00:17:16.495109	5a06ca32	120	30	1.0000	DISCARD	gen=261 glyphs=4
2026-03-14T00:17:16.758766	8d7b3a64	120	30	1.0000	DISCARD	gen=305 glyphs=4
2026-03-14T00:17:19.254727	45682ca7	116	29	1.0000	DISCARD	gen=261 glyphs=4
2026-03-14T00:17:19.528337	8aef8872	116	29	1.0000	DISCARD	gen=305 glyphs=4
2026-03-14T00:17:22.016016	37f4017b	116	29	1.0000	DISCARD	gen=262 glyphs=4
2026-03-14T00:17:22.289268	9d831b8e	116	29	1.0000	DISCARD	gen=305 glyphs=4
2026-03-14T00:17:24.740483	bfdf7cad	120	30	1.0000	DISCARD	gen=262 glyphs=4
2026-03-14T00:17:25.005297	19355583	120	30	1.0000	DISCARD	gen=306 glyphs=4
2026-03-14T00:17:27.456013	55d6c151	120	30	1.0000	DISCARD	gen=262 glyphs=4
2026-03-14T00:17:27.743203	8aef8872	116	29	1.0000	DISCARD	gen=306 glyphs=4
2026-03-14T00:17:30.198807	1d34459a	116	29	1.0000	DISCARD	gen=262 glyphs=4
2026-03-14T00:17:30.470033	1e5f0e21	116	29	1.0000	DISCARD	gen=306 glyphs=4
2026-03-14T00:17:32.946167	5a06ca32	120	30	1.0000	DISCARD	gen=262 glyphs=4
2026-03-14T00:17:33.207757	e2cd28ea	120	30	1.0000	DISCARD	gen=306 glyphs=4
2026-03-14T00:17:35.664900	e4bfb95c	116	29	1.0000	DISCARD	gen=262 glyphs=4
2026-03-14T00:17:35.935113	b16af3eb	116	29	1.0000	DISCARD	gen=306 glyphs=4
2026-03-14T00:17:38.485605	55d6c151	120	30	1.0000	DISCARD	gen=262 glyphs=4
2026-03-14T00:17:38.763952	ae44ace5	116	29	1.0000	DISCARD	gen=306 glyphs=4
2026-03-14T00:17:41.212400	927ae02a	116	29	1.0000	DISCARD	gen=262 glyphs=4
2026-03-14T00:17:41.482937	5d13e440	116	29	1.0000	DISCARD	gen=306 glyphs=4
2026-03-14T00:17:43.937436	37f4017b	116	29	1.0000	DISCARD	gen=262 glyphs=4
2026-03-14T00:17:44.208936	050862ad	120	30	1.0000	DISCARD	gen=306 glyphs=4
2026-03-14T00:17:46.657521	bfdc3575	120	30	1.0000	DISCARD	gen=262 glyphs=4
2026-03-14T00:17:46.924931	b42ab462	120	30	1.0000	DISCARD	gen=306 glyphs=4
2026-03-14T00:17:49.384106	37f4017b	116	29	1.0000	DISCARD	gen=263 glyphs=4
2026-03-14T00:17:49.669065	b7aed8e9	116	29	1.0000	DISCARD	gen=306 glyphs=4
2026-03-14T00:17:52.113393	bfdf7cad	120	30	1.0000	DISCARD	gen=263 glyphs=4
2026-03-14T00:17:52.387625	19355583	120	30	1.0000	DISCARD	gen=307 glyphs=4
2026-03-14T00:17:54.858255	72cd370a	120	30	1.0000	DISCARD	gen=263 glyphs=4
2026-03-14T00:17:55.141709	8aef8872	116	29	1.0000	DISCARD	gen=307 glyphs=4
2026-03-14T00:17:57.593128	5b9807ac	120	30	1.0000	DISCARD	gen=263 glyphs=4
2026-03-14T00:17:57.868382	0eaedb57	116	29	1.0000	DISCARD	gen=307 glyphs=4
2026-03-14T00:18:00.343414	bfdf7cad	120	30	1.0000	DISCARD	gen=263 glyphs=4
2026-03-14T00:18:00.618916	ac5a7de8	120	30	1.0000	DISCARD	gen=307 glyphs=4
2026-03-14T00:18:03.087037	6dce65e5	120	30	1.0000	DISCARD	gen=263 glyphs=4
2026-03-14T00:18:03.369372	19355583	120	30	1.0000	DISCARD	gen=307 glyphs=4
2026-03-14T00:18:05.836543	4c9b0dd4	120	30	1.0000	DISCARD	gen=263 glyphs=4
2026-03-14T00:18:06.107890	0eaedb57	116	29	1.0000	DISCARD	gen=307 glyphs=4
2026-03-14T00:18:08.657212	bfdf7cad	120	30	1.0000	DISCARD	gen=263 glyphs=4
2026-03-14T00:18:08.920744	19355583	120	30	1.0000	DISCARD	gen=307 glyphs=4
2026-03-14T00:18:11.406125	71e2ba66	116	29	1.0000	DISCARD	gen=263 glyphs=4
2026-03-14T00:18:11.672233	a78f9454	120	30	1.0000	DISCARD	gen=307 glyphs=4
2026-03-14T00:18:14.131284	31473841	116	29	1.0000	DISCARD	gen=263 glyphs=4
2026-03-14T00:18:14.397964	1e5f0e21	116	29	1.0000	DISCARD	gen=307 glyphs=4
2026-03-14T00:18:16.856978	37f4017b	116	29	1.0000	DISCARD	gen=264 glyphs=4
2026-03-14T00:18:17.129102	10db23d6	120	30	1.0000	DISCARD	gen=307 glyphs=4
2026-03-14T00:18:19.590593	bfdf7cad	120	30	1.0000	DISCARD	gen=264 glyphs=4
2026-03-14T00:18:19.863621	19355583	120	30	1.0000	DISCARD	gen=308 glyphs=4
2026-03-14T00:18:22.349238	55d6c151	120	30	1.0000	DISCARD	gen=264 glyphs=4
2026-03-14T00:18:22.637371	8aef8872	116	29	1.0000	DISCARD	gen=308 glyphs=4
2026-03-14T00:18:25.083335	37f4017b	116	29	1.0000	DISCARD	gen=264 glyphs=4
2026-03-14T00:18:25.359826	1e5f0e21	116	29	1.0000	DISCARD	gen=308 glyphs=4
2026-03-14T00:18:27.802063	5a06ca32	120	30	1.0000	DISCARD	gen=264 glyphs=4
2026-03-14T00:18:28.067590	0eaedb57	116	29	1.0000	DISCARD	gen=308 glyphs=4
2026-03-14T00:18:30.525370	4c9b0dd4	120	30	1.0000	DISCARD	gen=264 glyphs=4
2026-03-14T00:18:30.783570	8aef8872	116	29	1.0000	DISCARD	gen=308 glyphs=4
2026-03-14T00:18:33.230193	5a06ca32	120	30	1.0000	DISCARD	gen=264 glyphs=4
2026-03-14T00:18:33.492993	b57e7176	120	30	1.0000	DISCARD	gen=308 glyphs=4
2026-03-14T00:18:35.918300	37f4017b	116	29	1.0000	DISCARD	gen=264 glyphs=4
2026-03-14T00:18:36.195958	8aef8872	116	29	1.0000	DISCARD	gen=308 glyphs=4
2026-03-14T00:18:38.670085	41301f86	120	30	1.0000	DISCARD	gen=264 glyphs=4
2026-03-14T00:18:38.948548	d7c8681b	120	30	1.0000	DISCARD	gen=308 glyphs=4
2026-03-14T00:18:41.515099	7b1fab36	120	30	1.0000	DISCARD	gen=264 glyphs=4
2026-03-14T00:18:41.790131	19355583	120	30	1.0000	DISCARD	gen=308 glyphs=4
2026-03-14T00:18:44.228160	37f4017b	116	29	1.0000	DISCARD	gen=265 glyphs=4
2026-03-14T00:18:44.501667	b57e7176	120	30	1.0000	DISCARD	gen=308 glyphs=4
2026-03-14T00:18:46.953423	bfdf7cad	120	30	1.0000	DISCARD	gen=265 glyphs=4
2026-03-14T00:18:47.228080	19355583	120	30	1.0000	DISCARD	gen=309 glyphs=4
2026-03-14T00:18:49.648314	37f4017b	116	29	1.0000	DISCARD	gen=265 glyphs=4
2026-03-14T00:18:49.919825	8aef8872	116	29	1.0000	DISCARD	gen=309 glyphs=4
2026-03-14T00:18:52.339902	7f822d90	116	29	1.0000	DISCARD	gen=265 glyphs=4
2026-03-14T00:18:52.614151	19355583	120	30	1.0000	DISCARD	gen=309 glyphs=4
2026-03-14T00:18:55.052371	d11c1062	120	30	1.0000	DISCARD	gen=265 glyphs=4
2026-03-14T00:18:55.320900	b57e7176	120	30	1.0000	DISCARD	gen=309 glyphs=4
2026-03-14T00:18:57.788271	ddd12be6	120	30	1.0000	DISCARD	gen=265 glyphs=4
2026-03-14T00:18:58.066608	0eaedb57	116	29	1.0000	DISCARD	gen=309 glyphs=4
2026-03-14T00:19:00.518632	2701cb73	116	29	1.0000	DISCARD	gen=265 glyphs=4
2026-03-14T00:19:00.800348	0e662342	116	29	1.0000	DISCARD	gen=309 glyphs=4
2026-03-14T00:19:03.254033	5a06ca32	120	30	1.0000	DISCARD	gen=265 glyphs=4
2026-03-14T00:19:03.531388	0c1dc0db	120	30	0.9500	DISCARD	gen=309 glyphs=4
2026-03-14T00:19:05.940736	55d6c151	120	30	1.0000	DISCARD	gen=265 glyphs=4
2026-03-14T00:19:06.223855	b7aed8e9	116	29	1.0000	DISCARD	gen=309 glyphs=4
2026-03-14T00:19:08.669501	37f4017b	116	29	1.0000	DISCARD	gen=265 glyphs=4
2026-03-14T00:19:08.931637	0eaedb57	116	29	1.0000	DISCARD	gen=309 glyphs=4
2026-03-14T00:19:11.379158	37f4017b	116	29	1.0000	DISCARD	gen=266 glyphs=4
2026-03-14T00:19:11.729187	b7aed8e9	116	29	1.0000	DISCARD	gen=309 glyphs=4
2026-03-14T00:19:14.208273	bfdf7cad	120	30	1.0000	DISCARD	gen=266 glyphs=4
2026-03-14T00:19:14.481263	19355583	120	30	1.0000	DISCARD	gen=310 glyphs=4
2026-03-14T00:19:16.955791	5a06ca32	120	30	1.0000	DISCARD	gen=266 glyphs=4
2026-03-14T00:19:17.236637	8aef8872	116	29	1.0000	DISCARD	gen=310 glyphs=4
2026-03-14T00:19:19.671800	98b3e099	116	29	1.0000	DISCARD	gen=266 glyphs=4
2026-03-14T00:19:19.956866	e8c7f6cf	120	30	1.0000	DISCARD	gen=310 glyphs=4
2026-03-14T00:19:22.418280	20952fed	116	29	1.0000	DISCARD	gen=266 glyphs=4
2026-03-14T00:19:22.689229	050862ad	120	30	1.0000	DISCARD	gen=310 glyphs=4
2026-03-14T00:19:25.159022	5a06ca32	120	30	1.0000	DISCARD	gen=266 glyphs=4
2026-03-14T00:19:25.432333	19355583	120	30	1.0000	DISCARD	gen=310 glyphs=4
2026-03-14T00:19:27.915150	37f4017b	116	29	1.0000	DISCARD	gen=266 glyphs=4
2026-03-14T00:19:28.172313	4bf278b8	116	29	1.0000	DISCARD	gen=310 glyphs=4
2026-03-14T00:19:30.636120	55d6c151	120	30	1.0000	DISCARD	gen=266 glyphs=4
2026-03-14T00:19:30.919611	8aef8872	116	29	1.0000	DISCARD	gen=310 glyphs=4
2026-03-14T00:19:33.359513	fdb5d108	120	30	1.0000	DISCARD	gen=266 glyphs=4
2026-03-14T00:19:33.622893	bc2a0080	116	29	0.9500	DISCARD	gen=310 glyphs=4
2026-03-14T00:19:36.085111	fdb5d108	120	30	1.0000	DISCARD	gen=266 glyphs=4
2026-03-14T00:19:36.352133	9e34ede0	116	29	1.0000	DISCARD	gen=310 glyphs=4
2026-03-14T00:19:38.798660	37f4017b	116	29	1.0000	DISCARD	gen=267 glyphs=4
2026-03-14T00:19:39.068567	e2cd28ea	120	30	1.0000	DISCARD	gen=310 glyphs=4
2026-03-14T00:19:41.546898	bfdf7cad	120	30	1.0000	DISCARD	gen=267 glyphs=4
2026-03-14T00:19:41.816929	19355583	120	30	1.0000	DISCARD	gen=311 glyphs=4
2026-03-14T00:19:44.323104	55d6c151	120	30	1.0000	DISCARD	gen=267 glyphs=4
2026-03-14T00:19:44.600148	8aef8872	116	29	1.0000	DISCARD	gen=311 glyphs=4
2026-03-14T00:19:47.095832	37f4017b	116	29	1.0000	DISCARD	gen=267 glyphs=4
2026-03-14T00:19:47.360199	19355583	120	30	1.0000	DISCARD	gen=311 glyphs=4
2026-03-14T00:19:49.822864	fdb5d108	120	30	1.0000	DISCARD	gen=267 glyphs=4
2026-03-14T00:19:50.100786	8aef8872	116	29	1.0000	DISCARD	gen=311 glyphs=4
2026-03-14T00:19:52.551678	fdb5d108	120	30	1.0000	DISCARD	gen=267 glyphs=4
2026-03-14T00:19:52.813374	050862ad	120	30	1.0000	DISCARD	gen=311 glyphs=4
2026-03-14T00:19:55.266815	37f4017b	116	29	1.0000	DISCARD	gen=267 glyphs=4
2026-03-14T00:19:55.530459	b7aed8e9	116	29	1.0000	DISCARD	gen=311 glyphs=4
2026-03-14T00:19:57.992805	fdb5d108	120	30	1.0000	DISCARD	gen=267 glyphs=4
2026-03-14T00:19:58.263282	19355583	120	30	1.0000	DISCARD	gen=311 glyphs=4
2026-03-14T00:20:00.706437	5a06ca32	120	30	1.0000	DISCARD	gen=267 glyphs=4
2026-03-14T00:20:00.977628	67cb81be	120	30	1.0000	DISCARD	gen=311 glyphs=4
2026-03-14T00:20:03.457747	703c3b64	120	30	1.0000	DISCARD	gen=267 glyphs=4
2026-03-14T00:20:03.732684	2cc06536	116	29	1.0000	DISCARD	gen=311 glyphs=4
2026-03-14T00:20:06.234032	37f4017b	116	29	1.0000	DISCARD	gen=268 glyphs=4
2026-03-14T00:20:06.500843	8aef8872	116	29	1.0000	DISCARD	gen=311 glyphs=4
2026-03-14T00:20:08.977597	bfdf7cad	120	30	1.0000	DISCARD	gen=268 glyphs=4
2026-03-14T00:20:09.252619	19355583	120	30	1.0000	DISCARD	gen=312 glyphs=4
2026-03-14T00:20:11.725871	440ed9fd	116	29	1.0000	DISCARD	gen=268 glyphs=4
2026-03-14T00:20:11.999112	8aef8872	116	29	1.0000	DISCARD	gen=312 glyphs=4
2026-03-14T00:20:14.483016	7ca87b42	116	29	1.0000	DISCARD	gen=268 glyphs=4
2026-03-14T00:20:14.747952	9e34ede0	116	29	1.0000	DISCARD	gen=312 glyphs=4
2026-03-14T00:20:17.308228	386cb0f8	120	30	0.9500	DISCARD	gen=268 glyphs=4
2026-03-14T00:20:17.585043	19355583	120	30	1.0000	DISCARD	gen=312 glyphs=4
2026-03-14T00:20:20.043805	5a06ca32	120	30	1.0000	DISCARD	gen=268 glyphs=4
2026-03-14T00:20:20.329868	050862ad	120	30	1.0000	DISCARD	gen=312 glyphs=4
2026-03-14T00:20:22.815604	71e2ba66	116	29	1.0000	DISCARD	gen=268 glyphs=4
2026-03-14T00:20:23.076283	ff8106f6	120	30	1.0000	DISCARD	gen=312 glyphs=4
2026-03-14T00:20:25.543002	5a06ca32	120	30	1.0000	DISCARD	gen=268 glyphs=4
2026-03-14T00:20:25.817387	19355583	120	30	1.0000	DISCARD	gen=312 glyphs=4
2026-03-14T00:20:28.303379	37f4017b	116	29	1.0000	DISCARD	gen=268 glyphs=4
2026-03-14T00:20:28.574787	875e0f8a	116	29	1.0000	DISCARD	gen=312 glyphs=4
2026-03-14T00:20:31.047474	e2fa00fb	116	29	1.0000	DISCARD	gen=268 glyphs=4
2026-03-14T00:20:31.320621	a78f9454	120	30	1.0000	DISCARD	gen=312 glyphs=4
2026-03-14T00:20:33.785109	37f4017b	116	29	1.0000	DISCARD	gen=269 glyphs=4
2026-03-14T00:20:34.065862	b317542e	120	30	1.0000	DISCARD	gen=312 glyphs=4
2026-03-14T00:20:36.529602	bfdf7cad	120	30	1.0000	DISCARD	gen=269 glyphs=4
2026-03-14T00:20:36.803440	19355583	120	30	1.0000	DISCARD	gen=313 glyphs=4
2026-03-14T00:20:39.282031	4c9b0dd4	120	30	1.0000	DISCARD	gen=269 glyphs=4
2026-03-14T00:20:39.550267	8aef8872	116	29	1.0000	DISCARD	gen=313 glyphs=4
2026-03-14T00:20:42.019475	16d757ff	116	29	1.0000	DISCARD	gen=269 glyphs=4
2026-03-14T00:20:42.291407	a78f9454	120	30	1.0000	DISCARD	gen=313 glyphs=4
2026-03-14T00:20:44.766087	c73f99d1	120	30	1.0000	DISCARD	gen=269 glyphs=4
2026-03-14T00:20:45.043050	c030923f	116	29	1.0000	DISCARD	gen=313 glyphs=4
2026-03-14T00:20:47.583165	37f4017b	116	29	1.0000	DISCARD	gen=269 glyphs=4
2026-03-14T00:20:47.852887	e2cd28ea	120	30	1.0000	DISCARD	gen=313 glyphs=4
2026-03-14T00:20:50.365003	37f4017b	116	29	1.0000	DISCARD	gen=269 glyphs=4
2026-03-14T00:20:50.638020	32c83d66	116	29	1.0000	DISCARD	gen=313 glyphs=4
2026-03-14T00:20:53.090485	37f4017b	116	29	1.0000	DISCARD	gen=269 glyphs=4
2026-03-14T00:20:53.359779	e8c7f6cf	120	30	1.0000	DISCARD	gen=313 glyphs=4
2026-03-14T00:20:55.826490	37f4017b	116	29	1.0000	DISCARD	gen=269 glyphs=4
2026-03-14T00:20:56.099228	3d316aaf	116	29	1.0000	DISCARD	gen=313 glyphs=4
2026-03-14T00:20:58.594476	37f4017b	116	29	1.0000	DISCARD	gen=269 glyphs=4
2026-03-14T00:20:58.873995	e2cd28ea	120	30	1.0000	DISCARD	gen=313 glyphs=4
2026-03-14T00:21:01.339080	37f4017b	116	29	1.0000	DISCARD	gen=270 glyphs=4
2026-03-14T00:21:01.610749	8aef8872	116	29	1.0000	DISCARD	gen=313 glyphs=4
2026-03-14T00:21:04.118717	bfdf7cad	120	30	1.0000	DISCARD	gen=270 glyphs=4
2026-03-14T00:21:04.399447	19355583	120	30	1.0000	DISCARD	gen=314 glyphs=4
2026-03-14T00:21:06.888426	1d34459a	116	29	1.0000	DISCARD	gen=270 glyphs=4
2026-03-14T00:21:07.167441	8aef8872	116	29	1.0000	DISCARD	gen=314 glyphs=4
2026-03-14T00:21:09.667605	8a4c4129	120	30	1.0000	DISCARD	gen=270 glyphs=4
2026-03-14T00:21:09.942313	9e34ede0	116	29	1.0000	DISCARD	gen=314 glyphs=4
2026-03-14T00:21:12.416909	4a81d9f8	120	30	1.0000	DISCARD	gen=270 glyphs=4
2026-03-14T00:21:12.691154	b57e7176	120	30	1.0000	DISCARD	gen=314 glyphs=4
2026-03-14T00:21:15.133118	2701cb73	116	29	1.0000	DISCARD	gen=270 glyphs=4
2026-03-14T00:21:15.402332	0eaedb57	116	29	1.0000	DISCARD	gen=314 glyphs=4
2026-03-14T00:21:17.849098	5a06ca32	120	30	1.0000	DISCARD	gen=270 glyphs=4
2026-03-14T00:21:18.122393	eca7ab6c	116	29	1.0000	DISCARD	gen=314 glyphs=4
2026-03-14T00:21:20.662084	fdb5d108	120	30	1.0000	DISCARD	gen=270 glyphs=4
2026-03-14T00:21:20.930946	19355583	120	30	1.0000	DISCARD	gen=314 glyphs=4
2026-03-14T00:21:23.386276	fdb5d108	120	30	1.0000	DISCARD	gen=270 glyphs=4
2026-03-14T00:21:23.654052	db774934	116	29	1.0000	DISCARD	gen=314 glyphs=4
2026-03-14T00:21:26.111501	fdb5d108	120	30	1.0000	DISCARD	gen=270 glyphs=4
2026-03-14T00:21:26.404238	e2cd28ea	120	30	1.0000	DISCARD	gen=314 glyphs=4
2026-03-14T00:21:28.852677	37f4017b	116	29	1.0000	DISCARD	gen=271 glyphs=4
2026-03-14T00:21:29.119683	0eaedb57	116	29	1.0000	DISCARD	gen=314 glyphs=4
2026-03-14T00:21:31.605823	bfdf7cad	120	30	1.0000	DISCARD	gen=271 glyphs=4
2026-03-14T00:21:31.871448	19355583	120	30	1.0000	DISCARD	gen=315 glyphs=4
2026-03-14T00:21:34.359132	bfdf7cad	120	30	1.0000	DISCARD	gen=271 glyphs=4
2026-03-14T00:21:34.645604	8aef8872	116	29	1.0000	DISCARD	gen=315 glyphs=4
2026-03-14T00:21:37.086316	d11c1062	120	30	1.0000	DISCARD	gen=271 glyphs=4
2026-03-14T00:21:37.362334	eca7ab6c	116	29	1.0000	DISCARD	gen=315 glyphs=4
2026-03-14T00:21:39.818621	1d34459a	116	29	1.0000	DISCARD	gen=271 glyphs=4
2026-03-14T00:21:40.085049	050862ad	120	30	1.0000	DISCARD	gen=315 glyphs=4
