timestamp	program_hash	spirv_size	word_count	fitness	status	description
2026-03-13T23:00:06.165480	43ff329f	116	29	1.0000	DISCARD	gen=140 glyphs=4
2026-03-13T23:00:06.711086	37f4017b	116	29	1.0000	DISCARD	gen=96 glyphs=4
2026-03-13T23:00:08.892911	19355583	120	30	1.0000	DISCARD	gen=140 glyphs=4
2026-03-13T23:00:09.432937	5a06ca32	120	30	1.0000	DISCARD	gen=96 glyphs=4
2026-03-13T23:00:11.594243	c2067021	120	30	1.0000	DISCARD	gen=140 glyphs=4
2026-03-13T23:00:12.126105	12b38c2d	116	29	1.0000	DISCARD	gen=96 glyphs=4
2026-03-13T23:00:14.274946	e2cd28ea	120	30	1.0000	DISCARD	gen=140 glyphs=4
2026-03-13T23:00:14.829074	bd2148d3	116	29	1.0000	DISCARD	gen=96 glyphs=4
2026-03-13T23:00:17.041966	50dc991d	116	29	1.0000	DISCARD	gen=140 glyphs=4
2026-03-13T23:00:17.594527	62c47523	120	30	1.0000	DISCARD	gen=96 glyphs=4
2026-03-13T23:00:19.756821	29e3fa1e	120	30	1.0000	DISCARD	gen=140 glyphs=4
2026-03-13T23:00:20.306142	71e2ba66	116	29	1.0000	DISCARD	gen=96 glyphs=4
2026-03-13T23:00:22.472865	8aef8872	116	29	1.0000	DISCARD	gen=140 glyphs=4
2026-03-13T23:00:23.011836	4c9b0dd4	120	30	1.0000	DISCARD	gen=96 glyphs=4
2026-03-13T23:00:25.197044	e2b22d04	116	29	1.0000	DISCARD	gen=140 glyphs=4
2026-03-13T23:00:25.731163	37f4017b	116	29	1.0000	DISCARD	gen=97 glyphs=4
2026-03-13T23:00:27.898854	19355583	120	30	1.0000	DISCARD	gen=141 glyphs=4
2026-03-13T23:00:28.425245	bfdf7cad	120	30	1.0000	DISCARD	gen=97 glyphs=4
2026-03-13T23:00:30.590281	8aef8872	116	29	1.0000	DISCARD	gen=141 glyphs=4
2026-03-13T23:00:31.125511	d11c1062	120	30	1.0000	DISCARD	gen=97 glyphs=4
2026-03-13T23:00:33.291154	a80cd0ff	116	29	1.0000	DISCARD	gen=141 glyphs=4
2026-03-13T23:00:33.828222	55d6c151	120	30	1.0000	DISCARD	gen=97 glyphs=4
2026-03-13T23:00:35.977145	b57e7176	120	30	1.0000	DISCARD	gen=141 glyphs=4
2026-03-13T23:00:36.508572	6f6f3c9e	116	29	1.0000	DISCARD	gen=97 glyphs=4
2026-03-13T23:00:38.691439	19355583	120	30	1.0000	DISCARD	gen=141 glyphs=4
2026-03-13T23:00:39.235618	71e2ba66	116	29	1.0000	DISCARD	gen=97 glyphs=4
2026-03-13T23:00:41.380386	0eaedb57	116	29	1.0000	DISCARD	gen=141 glyphs=4
2026-03-13T23:00:41.920945	5a06ca32	120	30	1.0000	DISCARD	gen=97 glyphs=4
2026-03-13T23:00:44.069266	050862ad	120	30	1.0000	DISCARD	gen=141 glyphs=4
2026-03-13T23:00:44.613428	37f4017b	116	29	1.0000	DISCARD	gen=97 glyphs=4
2026-03-13T23:00:46.802203	4891d3e5	116	29	0.9500	DISCARD	gen=141 glyphs=4
2026-03-13T23:00:47.353557	1053f4ae	116	29	1.0000	DISCARD	gen=97 glyphs=4
2026-03-13T23:00:49.575158	8aef8872	116	29	1.0000	DISCARD	gen=141 glyphs=4
2026-03-13T23:00:50.118292	bc6aef5e	116	29	1.0000	DISCARD	gen=97 glyphs=4
2026-03-13T23:00:52.291639	f3f8997d	116	29	1.0000	DISCARD	gen=141 glyphs=4
2026-03-13T23:00:52.846471	37f4017b	116	29	1.0000	DISCARD	gen=98 glyphs=4
2026-03-13T23:00:55.022759	19355583	120	30	1.0000	DISCARD	gen=142 glyphs=4
2026-03-13T23:00:55.551688	bfdf7cad	120	30	1.0000	DISCARD	gen=98 glyphs=4
2026-03-13T23:00:57.712204	8aef8872	116	29	1.0000	DISCARD	gen=142 glyphs=4
2026-03-13T23:00:58.251017	7ca87b42	116	29	1.0000	DISCARD	gen=98 glyphs=4
2026-03-13T23:01:00.416539	875e0f8a	116	29	1.0000	DISCARD	gen=142 glyphs=4
2026-03-13T23:01:00.955159	37f4017b	116	29	1.0000	DISCARD	gen=98 glyphs=4
2026-03-13T23:01:03.124864	19355583	120	30	1.0000	DISCARD	gen=142 glyphs=4
2026-03-13T23:01:03.659467	22a2d884	116	29	1.0000	DISCARD	gen=98 glyphs=4
2026-03-13T23:01:05.842962	0eaedb57	116	29	1.0000	DISCARD	gen=142 glyphs=4
2026-03-13T23:01:06.384066	d11c1062	120	30	1.0000	DISCARD	gen=98 glyphs=4
2026-03-13T23:01:08.550614	19355583	120	30	1.0000	DISCARD	gen=142 glyphs=4
2026-03-13T23:01:09.083950	55d6c151	120	30	1.0000	DISCARD	gen=98 glyphs=4
2026-03-13T23:01:11.242606	19355583	120	30	1.0000	DISCARD	gen=142 glyphs=4
2026-03-13T23:01:11.773909	5c97086c	120	30	1.0000	DISCARD	gen=98 glyphs=4
2026-03-13T23:01:13.953983	d7c8681b	120	30	1.0000	DISCARD	gen=142 glyphs=4
2026-03-13T23:01:14.500969	fdb5d108	120	30	1.0000	DISCARD	gen=98 glyphs=4
2026-03-13T23:01:16.658869	ae44ace5	116	29	1.0000	DISCARD	gen=142 glyphs=4
2026-03-13T23:01:17.198209	dccd82b4	120	30	1.0000	DISCARD	gen=98 glyphs=4
2026-03-13T23:01:19.357903	efe9390e	116	29	1.0000	DISCARD	gen=142 glyphs=4
2026-03-13T23:01:19.892494	37f4017b	116	29	1.0000	DISCARD	gen=99 glyphs=4
2026-03-13T23:01:22.108637	19355583	120	30	1.0000	DISCARD	gen=143 glyphs=4
2026-03-13T23:01:22.642977	bfdf7cad	120	30	1.0000	DISCARD	gen=99 glyphs=4
2026-03-13T23:01:24.804756	8aef8872	116	29	1.0000	DISCARD	gen=143 glyphs=4
2026-03-13T23:01:25.338460	d11c1062	120	30	1.0000	DISCARD	gen=99 glyphs=4
2026-03-13T23:01:27.493647	19355583	120	30	1.0000	DISCARD	gen=143 glyphs=4
2026-03-13T23:01:28.035522	68498f35	116	29	1.0000	DISCARD	gen=99 glyphs=4
2026-03-13T23:01:30.210109	eca7ab6c	116	29	1.0000	DISCARD	gen=143 glyphs=4
2026-03-13T23:01:30.749631	2701cb73	116	29	1.0000	DISCARD	gen=99 glyphs=4
2026-03-13T23:01:32.925606	050862ad	120	30	1.0000	DISCARD	gen=143 glyphs=4
2026-03-13T23:01:33.478829	37f4017b	116	29	1.0000	DISCARD	gen=99 glyphs=4
2026-03-13T23:01:39.821974	50dc991d	116	29	1.0000	DISCARD	gen=143 glyphs=4
2026-03-13T23:01:40.354009	fdb5d108	120	30	1.0000	DISCARD	gen=99 glyphs=4
2026-03-13T23:01:42.502820	8aef8872	116	29	1.0000	DISCARD	gen=143 glyphs=4
2026-03-13T23:01:43.053126	5a06ca32	120	30	1.0000	DISCARD	gen=99 glyphs=4
2026-03-13T23:01:45.209975	01bf8f06	116	29	1.0000	DISCARD	gen=143 glyphs=4
2026-03-13T23:01:45.751929	37f4017b	116	29	1.0000	DISCARD	gen=99 glyphs=4
2026-03-13T23:01:47.909183	050862ad	120	30	1.0000	DISCARD	gen=143 glyphs=4
2026-03-13T23:01:48.598807	55d6c151	120	30	1.0000	DISCARD	gen=99 glyphs=4
2026-03-13T23:01:50.797957	d7c8681b	120	30	1.0000	DISCARD	gen=143 glyphs=4
2026-03-13T23:01:51.339315	37f4017b	116	29	1.0000	DISCARD	gen=100 glyphs=4
2026-03-13T23:01:53.573568	19355583	120	30	1.0000	DISCARD	gen=144 glyphs=4
2026-03-13T23:01:54.106937	bfdf7cad	120	30	1.0000	DISCARD	gen=100 glyphs=4
2026-03-13T23:01:56.263880	8aef8872	116	29	1.0000	DISCARD	gen=144 glyphs=4
2026-03-13T23:01:56.807229	37f4017b	116	29	1.0000	DISCARD	gen=100 glyphs=4
2026-03-13T23:01:58.977427	6a42e449	120	30	1.0000	DISCARD	gen=144 glyphs=4
2026-03-13T23:01:59.528730	5ccf729e	116	29	1.0000	DISCARD	gen=100 glyphs=4
2026-03-13T23:02:01.695917	19355583	120	30	1.0000	DISCARD	gen=144 glyphs=4
2026-03-13T23:02:02.237651	4e6dced3	120	30	1.0000	DISCARD	gen=100 glyphs=4
2026-03-13T23:02:04.423482	19355583	120	30	1.0000	DISCARD	gen=144 glyphs=4
2026-03-13T23:02:04.977274	37f4017b	116	29	1.0000	DISCARD	gen=100 glyphs=4
2026-03-13T23:02:07.135527	e2cd28ea	120	30	1.0000	DISCARD	gen=144 glyphs=4
2026-03-13T23:02:07.662207	5a06ca32	120	30	1.0000	DISCARD	gen=100 glyphs=4
2026-03-13T23:02:09.836853	8aef8872	116	29	1.0000	DISCARD	gen=144 glyphs=4
2026-03-13T23:02:10.375117	2701cb73	116	29	1.0000	DISCARD	gen=100 glyphs=4
2026-03-13T23:02:12.545316	e8c7f6cf	120	30	1.0000	DISCARD	gen=144 glyphs=4
2026-03-13T23:02:13.089624	d11c1062	120	30	1.0000	DISCARD	gen=100 glyphs=4
2026-03-13T23:02:15.274456	9e34ede0	116	29	1.0000	DISCARD	gen=144 glyphs=4
2026-03-13T23:02:15.830866	e8dfbef4	120	30	1.0000	DISCARD	gen=100 glyphs=4
2026-03-13T23:02:18.021432	875e0f8a	116	29	1.0000	DISCARD	gen=144 glyphs=4
2026-03-13T23:02:18.585124	37f4017b	116	29	1.0000	DISCARD	gen=101 glyphs=4
2026-03-13T23:02:20.779178	19355583	120	30	1.0000	DISCARD	gen=145 glyphs=4
2026-03-13T23:02:21.335408	bfdf7cad	120	30	1.0000	DISCARD	gen=101 glyphs=4
2026-03-13T23:02:23.584849	8aef8872	116	29	1.0000	DISCARD	gen=145 glyphs=4
2026-03-13T23:02:24.150844	360ce6b9	120	30	1.0000	DISCARD	gen=101 glyphs=4
2026-03-13T23:02:26.386567	8aef8872	116	29	1.0000	DISCARD	gen=145 glyphs=4
2026-03-13T23:02:26.950308	37f4017b	116	29	1.0000	DISCARD	gen=101 glyphs=4
2026-03-13T23:02:29.160736	b7aed8e9	116	29	1.0000	DISCARD	gen=145 glyphs=4
2026-03-13T23:02:29.724697	5b9807ac	120	30	1.0000	DISCARD	gen=101 glyphs=4
2026-03-13T23:02:31.941526	8aef8872	116	29	1.0000	DISCARD	gen=145 glyphs=4
2026-03-13T23:02:32.501873	37f4017b	116	29	1.0000	DISCARD	gen=101 glyphs=4
2026-03-13T23:02:34.754627	19355583	120	30	1.0000	DISCARD	gen=145 glyphs=4
2026-03-13T23:02:35.312578	4c9b0dd4	120	30	1.0000	DISCARD	gen=101 glyphs=4
2026-03-13T23:02:37.710081	1e5f0e21	116	29	1.0000	DISCARD	gen=145 glyphs=4
2026-03-13T23:02:38.238340	5a06ca32	120	30	1.0000	DISCARD	gen=101 glyphs=4
2026-03-13T23:02:40.412774	e2b1c35b	116	29	0.9500	DISCARD	gen=145 glyphs=4
2026-03-13T23:02:40.959432	059b8180	116	29	1.0000	DISCARD	gen=101 glyphs=4
2026-03-13T23:02:43.123326	8aef8872	116	29	1.0000	DISCARD	gen=145 glyphs=4
2026-03-13T23:02:43.664117	5a06ca32	120	30	1.0000	DISCARD	gen=101 glyphs=4
2026-03-13T23:02:45.794103	19355583	120	30	1.0000	DISCARD	gen=145 glyphs=4
2026-03-13T23:02:46.334019	37f4017b	116	29	1.0000	DISCARD	gen=102 glyphs=4
2026-03-13T23:02:48.513116	19355583	120	30	1.0000	DISCARD	gen=146 glyphs=4
2026-03-13T23:02:49.050210	bfdf7cad	120	30	1.0000	DISCARD	gen=102 glyphs=4
2026-03-13T23:02:51.203614	8aef8872	116	29	1.0000	DISCARD	gen=146 glyphs=4
2026-03-13T23:02:51.744721	66f99f17	116	29	1.0000	DISCARD	gen=102 glyphs=4
2026-03-13T23:02:53.894552	da1a3443	116	29	1.0000	DISCARD	gen=146 glyphs=4
2026-03-13T23:02:54.445837	dfcd0819	120	30	1.0000	DISCARD	gen=102 glyphs=4
2026-03-13T23:02:56.679496	19355583	120	30	1.0000	DISCARD	gen=146 glyphs=4
2026-03-13T23:02:57.209758	5a06ca32	120	30	1.0000	DISCARD	gen=102 glyphs=4
2026-03-13T23:02:59.377692	8aef8872	116	29	1.0000	DISCARD	gen=146 glyphs=4
2026-03-13T23:02:59.895952	4bf3b9e5	120	30	1.0000	DISCARD	gen=102 glyphs=4
2026-03-13T23:03:02.021669	67cb81be	120	30	1.0000	DISCARD	gen=146 glyphs=4
2026-03-13T23:03:02.575412	37f4017b	116	29	1.0000	DISCARD	gen=102 glyphs=4
2026-03-13T23:03:04.723838	19355583	120	30	1.0000	DISCARD	gen=146 glyphs=4
2026-03-13T23:03:05.255199	fdb5d108	120	30	1.0000	DISCARD	gen=102 glyphs=4
2026-03-13T23:03:07.380172	0eaedb57	116	29	1.0000	DISCARD	gen=146 glyphs=4
2026-03-13T23:03:07.928396	bb530782	116	29	1.0000	DISCARD	gen=102 glyphs=4
2026-03-13T23:03:10.039275	1631a7fd	116	29	1.0000	DISCARD	gen=146 glyphs=4
2026-03-13T23:03:10.567060	37f4017b	116	29	1.0000	DISCARD	gen=102 glyphs=4
2026-03-13T23:03:12.716140	875e0f8a	116	29	1.0000	DISCARD	gen=146 glyphs=4
2026-03-13T23:03:13.251213	37f4017b	116	29	1.0000	DISCARD	gen=103 glyphs=4
2026-03-13T23:03:15.390998	19355583	120	30	1.0000	DISCARD	gen=147 glyphs=4
2026-03-13T23:03:15.925137	bfdf7cad	120	30	1.0000	DISCARD	gen=103 glyphs=4
2026-03-13T23:03:18.067983	8aef8872	116	29	1.0000	DISCARD	gen=147 glyphs=4
2026-03-13T23:03:18.588617	cf2eacd5	120	30	1.0000	DISCARD	gen=103 glyphs=4
2026-03-13T23:03:20.733053	da218be6	116	29	1.0000	DISCARD	gen=147 glyphs=4
2026-03-13T23:03:21.266693	55d6c151	120	30	1.0000	DISCARD	gen=103 glyphs=4
2026-03-13T23:03:23.397014	b57e7176	120	30	1.0000	DISCARD	gen=147 glyphs=4
2026-03-13T23:03:23.928639	74fb8bfa	116	29	1.0000	DISCARD	gen=103 glyphs=4
2026-03-13T23:03:26.060758	67cb81be	120	30	1.0000	DISCARD	gen=147 glyphs=4
2026-03-13T23:03:26.632136	37f4017b	116	29	1.0000	DISCARD	gen=103 glyphs=4
2026-03-13T23:03:28.825096	a78f9454	120	30	1.0000	DISCARD	gen=147 glyphs=4
2026-03-13T23:03:29.371102	b235d2f4	120	30	1.0000	DISCARD	gen=103 glyphs=4
2026-03-13T23:03:31.529047	e8c7f6cf	120	30	1.0000	DISCARD	gen=147 glyphs=4
2026-03-13T23:03:32.061007	fdb5d108	120	30	1.0000	DISCARD	gen=103 glyphs=4
2026-03-13T23:03:34.210667	0eaedb57	116	29	1.0000	DISCARD	gen=147 glyphs=4
2026-03-13T23:03:34.754959	37f4017b	116	29	1.0000	DISCARD	gen=103 glyphs=4
2026-03-13T23:03:36.906685	a0e1c878	116	29	1.0000	DISCARD	gen=147 glyphs=4
2026-03-13T23:03:37.440542	15136a15	116	29	1.0000	DISCARD	gen=103 glyphs=4
2026-03-13T23:03:39.594170	fb8c0119	120	30	1.0000	DISCARD	gen=147 glyphs=4
2026-03-13T23:03:40.131151	37f4017b	116	29	1.0000	DISCARD	gen=104 glyphs=4
2026-03-13T23:03:42.270021	19355583	120	30	1.0000	DISCARD	gen=148 glyphs=4
2026-03-13T23:03:42.813441	bfdf7cad	120	30	1.0000	DISCARD	gen=104 glyphs=4
2026-03-13T23:03:44.959450	8aef8872	116	29	1.0000	DISCARD	gen=148 glyphs=4
2026-03-13T23:03:45.488092	55d6c151	120	30	1.0000	DISCARD	gen=104 glyphs=4
2026-03-13T23:03:47.638130	7e0e33fa	116	29	0.9500	DISCARD	gen=148 glyphs=4
2026-03-13T23:03:48.166169	12b38c2d	116	29	1.0000	DISCARD	gen=104 glyphs=4
2026-03-13T23:03:50.310663	e2cd28ea	120	30	1.0000	DISCARD	gen=148 glyphs=4
2026-03-13T23:03:50.855156	71e2ba66	116	29	1.0000	DISCARD	gen=104 glyphs=4
2026-03-13T23:03:53.006063	18b0249e	116	29	0.9500	DISCARD	gen=148 glyphs=4
2026-03-13T23:03:53.546715	5a06ca32	120	30	1.0000	DISCARD	gen=104 glyphs=4
2026-03-13T23:03:55.693723	050862ad	120	30	1.0000	DISCARD	gen=148 glyphs=4
2026-03-13T23:03:56.230959	d0307d26	116	29	1.0000	DISCARD	gen=104 glyphs=4
2026-03-13T23:03:58.467977	875e0f8a	116	29	1.0000	DISCARD	gen=148 glyphs=4
2026-03-13T23:03:59.026505	55d6c151	120	30	1.0000	DISCARD	gen=104 glyphs=4
2026-03-13T23:04:01.304997	e572e00e	116	29	1.0000	DISCARD	gen=148 glyphs=4
2026-03-13T23:04:01.857569	55d6c151	120	30	1.0000	DISCARD	gen=104 glyphs=4
2026-03-13T23:04:04.079741	8aef8872	116	29	1.0000	DISCARD	gen=148 glyphs=4
2026-03-13T23:04:04.622341	cb9f038a	120	30	1.0000	DISCARD	gen=104 glyphs=4
2026-03-13T23:04:06.840066	85610e3b	116	29	0.9500	DISCARD	gen=148 glyphs=4
2026-03-13T23:04:07.409915	37f4017b	116	29	1.0000	DISCARD	gen=105 glyphs=4
2026-03-13T23:04:09.623046	19355583	120	30	1.0000	DISCARD	gen=149 glyphs=4
2026-03-13T23:04:10.169771	bfdf7cad	120	30	1.0000	DISCARD	gen=105 glyphs=4
2026-03-13T23:04:12.365952	8aef8872	116	29	1.0000	DISCARD	gen=149 glyphs=4
2026-03-13T23:04:12.919258	5a06ca32	120	30	1.0000	DISCARD	gen=105 glyphs=4
2026-03-13T23:04:15.119662	18aa4260	120	30	1.0000	DISCARD	gen=149 glyphs=4
2026-03-13T23:04:15.675953	13120770	116	29	1.0000	DISCARD	gen=105 glyphs=4
2026-03-13T23:04:17.863269	e2cd28ea	120	30	1.0000	DISCARD	gen=149 glyphs=4
2026-03-13T23:04:18.409170	55d6c151	120	30	1.0000	DISCARD	gen=105 glyphs=4
2026-03-13T23:04:20.598821	a78f9454	120	30	1.0000	DISCARD	gen=149 glyphs=4
2026-03-13T23:04:21.142834	4a396ad4	120	30	1.0000	DISCARD	gen=105 glyphs=4
2026-03-13T23:04:23.315969	b57e7176	120	30	1.0000	DISCARD	gen=149 glyphs=4
2026-03-13T23:04:23.870547	0d07d9ea	116	29	0.9500	DISCARD	gen=105 glyphs=4
2026-03-13T23:04:26.039727	e8c7f6cf	120	30	1.0000	DISCARD	gen=149 glyphs=4
2026-03-13T23:04:26.591553	5a06ca32	120	30	1.0000	DISCARD	gen=105 glyphs=4
2026-03-13T23:04:28.782159	f0dcd08e	116	29	0.9500	DISCARD	gen=149 glyphs=4
2026-03-13T23:04:29.327060	71e2ba66	116	29	1.0000	DISCARD	gen=105 glyphs=4
2026-03-13T23:04:31.581868	d7c8681b	120	30	1.0000	DISCARD	gen=149 glyphs=4
2026-03-13T23:04:32.130232	5b9807ac	120	30	1.0000	DISCARD	gen=105 glyphs=4
2026-03-13T23:04:34.335877	e8c7f6cf	120	30	1.0000	DISCARD	gen=149 glyphs=4
2026-03-13T23:04:34.868076	37f4017b	116	29	1.0000	DISCARD	gen=106 glyphs=4
2026-03-13T23:04:37.072234	19355583	120	30	1.0000	DISCARD	gen=150 glyphs=4
2026-03-13T23:04:37.614995	bfdf7cad	120	30	1.0000	DISCARD	gen=106 glyphs=4
2026-03-13T23:04:39.766752	8aef8872	116	29	1.0000	DISCARD	gen=150 glyphs=4
2026-03-13T23:04:40.301688	5a948b85	116	29	1.0000	DISCARD	gen=106 glyphs=4
2026-03-13T23:04:42.500525	9e34ede0	116	29	1.0000	DISCARD	gen=150 glyphs=4
2026-03-13T23:04:43.036694	97d18408	116	29	1.0000	DISCARD	gen=106 glyphs=4
2026-03-13T23:04:45.185985	67cb81be	120	30	1.0000	DISCARD	gen=150 glyphs=4
2026-03-13T23:04:45.726200	5ec18fb2	116	29	0.9500	DISCARD	gen=106 glyphs=4
2026-03-13T23:04:47.895690	0eaedb57	116	29	1.0000	DISCARD	gen=150 glyphs=4
2026-03-13T23:04:48.438092	f6305066	116	29	1.0000	DISCARD	gen=106 glyphs=4
2026-03-13T23:04:50.613816	1e5f0e21	116	29	1.0000	DISCARD	gen=150 glyphs=4
2026-03-13T23:04:51.152529	7ca87b42	116	29	1.0000	DISCARD	gen=106 glyphs=4
2026-03-13T23:04:53.295053	3a4f49c2	116	29	0.9500	DISCARD	gen=150 glyphs=4
2026-03-13T23:04:53.818859	5a06ca32	120	30	1.0000	DISCARD	gen=106 glyphs=4
2026-03-13T23:04:55.969651	8f9019f2	120	30	1.0000	DISCARD	gen=150 glyphs=4
2026-03-13T23:04:56.491112	12b38c2d	116	29	1.0000	DISCARD	gen=106 glyphs=4
2026-03-13T23:04:58.630191	c156494f	116	29	1.0000	DISCARD	gen=150 glyphs=4
2026-03-13T23:04:59.166297	9a880469	116	29	1.0000	DISCARD	gen=106 glyphs=4
2026-03-13T23:05:01.313408	87433313	116	29	1.0000	DISCARD	gen=150 glyphs=4
2026-03-13T23:05:01.898128	37f4017b	116	29	1.0000	DISCARD	gen=107 glyphs=4
2026-03-13T23:05:04.121994	19355583	120	30	1.0000	DISCARD	gen=151 glyphs=4
2026-03-13T23:05:04.656038	bfdf7cad	120	30	1.0000	DISCARD	gen=107 glyphs=4
2026-03-13T23:05:06.802037	8aef8872	116	29	1.0000	DISCARD	gen=151 glyphs=4
2026-03-13T23:05:07.340787	55d6c151	120	30	1.0000	DISCARD	gen=107 glyphs=4
2026-03-13T23:05:09.504965	8aef8872	116	29	1.0000	DISCARD	gen=151 glyphs=4
2026-03-13T23:05:10.024909	d11c1062	120	30	1.0000	DISCARD	gen=107 glyphs=4
2026-03-13T23:05:12.182304	67cb81be	120	30	1.0000	DISCARD	gen=151 glyphs=4
2026-03-13T23:05:12.727883	5b9807ac	120	30	1.0000	DISCARD	gen=107 glyphs=4
2026-03-13T23:05:14.889384	19355583	120	30	1.0000	DISCARD	gen=151 glyphs=4
2026-03-13T23:05:15.431745	55d6c151	120	30	1.0000	DISCARD	gen=107 glyphs=4
2026-03-13T23:05:17.589346	b57e7176	120	30	1.0000	DISCARD	gen=151 glyphs=4
2026-03-13T23:05:18.137794	bfdf7cad	120	30	1.0000	DISCARD	gen=107 glyphs=4
2026-03-13T23:05:20.294216	8c2516aa	120	30	1.0000	DISCARD	gen=151 glyphs=4
2026-03-13T23:05:20.828284	28a550ab	116	29	1.0000	DISCARD	gen=107 glyphs=4
2026-03-13T23:05:22.968633	eca7ab6c	116	29	1.0000	DISCARD	gen=151 glyphs=4
2026-03-13T23:05:23.508459	f6b90d8a	116	29	1.0000	DISCARD	gen=107 glyphs=4
2026-03-13T23:05:25.659164	9a3ba215	120	30	1.0000	DISCARD	gen=151 glyphs=4
2026-03-13T23:05:26.189853	be43dcb3	116	29	0.9500	DISCARD	gen=107 glyphs=4
2026-03-13T23:05:28.337080	fc7baad4	116	29	1.0000	DISCARD	gen=151 glyphs=4
2026-03-13T23:05:28.890000	37f4017b	116	29	1.0000	DISCARD	gen=108 glyphs=4
2026-03-13T23:05:31.053156	19355583	120	30	1.0000	DISCARD	gen=152 glyphs=4
2026-03-13T23:05:31.598849	bfdf7cad	120	30	1.0000	DISCARD	gen=108 glyphs=4
2026-03-13T23:05:33.778861	8aef8872	116	29	1.0000	DISCARD	gen=152 glyphs=4
2026-03-13T23:05:34.319358	26e9738a	116	29	1.0000	DISCARD	gen=108 glyphs=4
2026-03-13T23:05:36.499082	8aef8872	116	29	1.0000	DISCARD	gen=152 glyphs=4
2026-03-13T23:05:37.036597	67f0389d	116	29	1.0000	DISCARD	gen=108 glyphs=4
2026-03-13T23:05:39.170074	9e34ede0	116	29	1.0000	DISCARD	gen=152 glyphs=4
2026-03-13T23:05:39.708140	2701cb73	116	29	1.0000	DISCARD	gen=108 glyphs=4
2026-03-13T23:05:41.880848	ae44ace5	116	29	1.0000	DISCARD	gen=152 glyphs=4
2026-03-13T23:05:42.409786	5a06ca32	120	30	1.0000	DISCARD	gen=108 glyphs=4
2026-03-13T23:05:44.574264	8aef8872	116	29	1.0000	DISCARD	gen=152 glyphs=4
2026-03-13T23:05:45.096795	37f4017b	116	29	1.0000	DISCARD	gen=108 glyphs=4
2026-03-13T23:05:47.258826	8aef8872	116	29	1.0000	DISCARD	gen=152 glyphs=4
2026-03-13T23:05:47.798986	5a06ca32	120	30	1.0000	DISCARD	gen=108 glyphs=4
2026-03-13T23:05:49.962120	50dc991d	116	29	1.0000	DISCARD	gen=152 glyphs=4
2026-03-13T23:05:50.499006	5a06ca32	120	30	1.0000	DISCARD	gen=108 glyphs=4
2026-03-13T23:05:52.641047	9e34ede0	116	29	1.0000	DISCARD	gen=152 glyphs=4
2026-03-13T23:05:53.185951	12b38c2d	116	29	1.0000	DISCARD	gen=108 glyphs=4
2026-03-13T23:05:55.326822	9e34ede0	116	29	1.0000	DISCARD	gen=152 glyphs=4
2026-03-13T23:05:55.875281	37f4017b	116	29	1.0000	DISCARD	gen=109 glyphs=4
2026-03-13T23:05:58.025661	19355583	120	30	1.0000	DISCARD	gen=153 glyphs=4
2026-03-13T23:05:58.560088	bfdf7cad	120	30	1.0000	DISCARD	gen=109 glyphs=4
2026-03-13T23:06:00.696184	8aef8872	116	29	1.0000	DISCARD	gen=153 glyphs=4
2026-03-13T23:06:01.233970	12b38c2d	116	29	1.0000	DISCARD	gen=109 glyphs=4
2026-03-13T23:06:03.387091	050862ad	120	30	1.0000	DISCARD	gen=153 glyphs=4
2026-03-13T23:06:03.907769	d11c1062	120	30	1.0000	DISCARD	gen=109 glyphs=4
2026-03-13T23:06:06.090737	0eaedb57	116	29	1.0000	DISCARD	gen=153 glyphs=4
2026-03-13T23:06:06.674964	12b38c2d	116	29	1.0000	DISCARD	gen=109 glyphs=4
2026-03-13T23:06:08.824510	67cb81be	120	30	1.0000	DISCARD	gen=153 glyphs=4
2026-03-13T23:06:09.391138	d11c1062	120	30	1.0000	DISCARD	gen=109 glyphs=4
2026-03-13T23:06:11.530890	aadb5933	116	29	1.0000	DISCARD	gen=153 glyphs=4
2026-03-13T23:06:12.070112	a8cc58cb	116	29	1.0000	DISCARD	gen=109 glyphs=4
2026-03-13T23:06:14.222113	19355583	120	30	1.0000	DISCARD	gen=153 glyphs=4
2026-03-13T23:06:14.759202	2701cb73	116	29	1.0000	DISCARD	gen=109 glyphs=4
2026-03-13T23:06:16.948345	8aef8872	116	29	1.0000	DISCARD	gen=153 glyphs=4
2026-03-13T23:06:17.477585	19c368a7	116	29	1.0000	DISCARD	gen=109 glyphs=4
2026-03-13T23:06:19.631607	b7aed8e9	116	29	1.0000	DISCARD	gen=153 glyphs=4
2026-03-13T23:06:20.186690	fdb5d108	120	30	1.0000	DISCARD	gen=109 glyphs=4
2026-03-13T23:06:22.324126	9e34ede0	116	29	1.0000	DISCARD	gen=153 glyphs=4
2026-03-13T23:06:22.860648	37f4017b	116	29	1.0000	DISCARD	gen=110 glyphs=4
2026-03-13T23:06:25.007440	19355583	120	30	1.0000	DISCARD	gen=154 glyphs=4
2026-03-13T23:06:25.548974	bfdf7cad	120	30	1.0000	DISCARD	gen=110 glyphs=4
2026-03-13T23:06:27.716092	8aef8872	116	29	1.0000	DISCARD	gen=154 glyphs=4
2026-03-13T23:06:28.254737	8171bd63	116	29	0.9500	DISCARD	gen=110 glyphs=4
2026-03-13T23:06:30.431475	d97746f5	116	29	1.0000	DISCARD	gen=154 glyphs=4
2026-03-13T23:06:30.959481	55d6c151	120	30	1.0000	DISCARD	gen=110 glyphs=4
2026-03-13T23:06:33.128299	0eaedb57	116	29	1.0000	DISCARD	gen=154 glyphs=4
2026-03-13T23:06:33.677767	37f4017b	116	29	1.0000	DISCARD	gen=110 glyphs=4
2026-03-13T23:06:35.853410	19355583	120	30	1.0000	DISCARD	gen=154 glyphs=4
2026-03-13T23:06:36.381975	55d6c151	120	30	1.0000	DISCARD	gen=110 glyphs=4
2026-03-13T23:06:43.095556	19355583	120	30	1.0000	DISCARD	gen=154 glyphs=4
2026-03-13T23:06:43.627900	220b94e4	116	29	0.9000	DISCARD	gen=110 glyphs=4
2026-03-13T23:06:45.807027	8aef8872	116	29	1.0000	DISCARD	gen=154 glyphs=4
2026-03-13T23:06:46.345196	37f4017b	116	29	1.0000	DISCARD	gen=110 glyphs=4
2026-03-13T23:06:48.478618	979e02ca	116	29	1.0000	DISCARD	gen=154 glyphs=4
2026-03-13T23:06:49.029619	5a06ca32	120	30	1.0000	DISCARD	gen=110 glyphs=4
