timestamp	program_hash	spirv_size	word_count	fitness	status	description
2026-03-14T02:35:03.594432	7ca87b42	116	29	1.0000	DISCARD	gen=563 glyphs=4
2026-03-14T02:35:03.866745	a0617cfb	120	30	1.0000	DISCARD	gen=607 glyphs=4
2026-03-14T02:35:06.342671	d11c1062	120	30	1.0000	DISCARD	gen=563 glyphs=4
2026-03-14T02:35:06.618215	9e34ede0	116	29	1.0000	DISCARD	gen=607 glyphs=4
2026-03-14T02:35:09.088426	cba20d74	116	29	0.9500	DISCARD	gen=563 glyphs=4
2026-03-14T02:35:09.363445	0eaedb57	116	29	1.0000	DISCARD	gen=607 glyphs=4
2026-03-14T02:35:11.813633	37f4017b	116	29	1.0000	DISCARD	gen=563 glyphs=4
2026-03-14T02:35:12.100216	1e5f0e21	116	29	1.0000	DISCARD	gen=607 glyphs=4
2026-03-14T02:35:14.551934	1d8419dc	116	29	1.0000	DISCARD	gen=563 glyphs=4
2026-03-14T02:35:14.819621	ae44ace5	116	29	1.0000	DISCARD	gen=607 glyphs=4
2026-03-14T02:35:17.285889	37f4017b	116	29	1.0000	DISCARD	gen=564 glyphs=4
2026-03-14T02:35:17.563677	ae44ace5	116	29	1.0000	DISCARD	gen=607 glyphs=4
2026-03-14T02:35:20.049655	bfdf7cad	120	30	1.0000	DISCARD	gen=564 glyphs=4
2026-03-14T02:35:20.318004	19355583	120	30	1.0000	DISCARD	gen=608 glyphs=4
2026-03-14T02:35:22.768623	5a06ca32	120	30	1.0000	DISCARD	gen=564 glyphs=4
2026-03-14T02:35:23.037028	8aef8872	116	29	1.0000	DISCARD	gen=608 glyphs=4
2026-03-14T02:35:25.523548	5a06ca32	120	30	1.0000	DISCARD	gen=564 glyphs=4
2026-03-14T02:35:25.794244	050862ad	120	30	1.0000	DISCARD	gen=608 glyphs=4
2026-03-14T02:35:28.268234	12b38c2d	116	29	1.0000	DISCARD	gen=564 glyphs=4
2026-03-14T02:35:28.542792	f06e6c35	116	29	1.0000	DISCARD	gen=608 glyphs=4
2026-03-14T02:35:31.031874	d11c1062	120	30	1.0000	DISCARD	gen=564 glyphs=4
2026-03-14T02:35:31.301226	4c6bd128	116	29	1.0000	DISCARD	gen=608 glyphs=4
2026-03-14T02:35:33.771130	f90e2371	120	30	1.0000	DISCARD	gen=564 glyphs=4
2026-03-14T02:35:34.033106	4904c8f3	116	29	1.0000	DISCARD	gen=608 glyphs=4
2026-03-14T02:35:36.517123	5a06ca32	120	30	1.0000	DISCARD	gen=564 glyphs=4
2026-03-14T02:35:36.785243	8aef8872	116	29	1.0000	DISCARD	gen=608 glyphs=4
2026-03-14T02:35:39.269186	55d6c151	120	30	1.0000	DISCARD	gen=564 glyphs=4
2026-03-14T02:35:39.544301	7418aa44	116	29	1.0000	DISCARD	gen=608 glyphs=4
2026-03-14T02:35:42.009228	5b9807ac	120	30	1.0000	DISCARD	gen=564 glyphs=4
2026-03-14T02:35:42.277434	495ded2d	120	30	1.0000	DISCARD	gen=608 glyphs=4
2026-03-14T02:35:44.748564	37f4017b	116	29	1.0000	DISCARD	gen=565 glyphs=4
2026-03-14T02:35:45.020247	0eaedb57	116	29	1.0000	DISCARD	gen=608 glyphs=4
2026-03-14T02:35:47.494433	bfdf7cad	120	30	1.0000	DISCARD	gen=565 glyphs=4
2026-03-14T02:35:47.765817	19355583	120	30	1.0000	DISCARD	gen=609 glyphs=4
2026-03-14T02:35:50.204797	5b9807ac	120	30	1.0000	DISCARD	gen=565 glyphs=4
2026-03-14T02:35:50.483636	8aef8872	116	29	1.0000	DISCARD	gen=609 glyphs=4
2026-03-14T02:35:52.948071	0afd53a7	120	30	1.0000	DISCARD	gen=565 glyphs=4
2026-03-14T02:35:53.220535	8aef8872	116	29	1.0000	DISCARD	gen=609 glyphs=4
2026-03-14T02:35:55.697397	55d6c151	120	30	1.0000	DISCARD	gen=565 glyphs=4
2026-03-14T02:35:55.964386	8aef8872	116	29	1.0000	DISCARD	gen=609 glyphs=4
2026-03-14T02:35:58.425938	55d6c151	120	30	1.0000	DISCARD	gen=565 glyphs=4
2026-03-14T02:35:58.703223	0eaedb57	116	29	1.0000	DISCARD	gen=609 glyphs=4
2026-03-14T02:36:01.181548	5a06ca32	120	30	1.0000	DISCARD	gen=565 glyphs=4
2026-03-14T02:36:01.505862	d9040f38	120	30	1.0000	DISCARD	gen=609 glyphs=4
2026-03-14T02:36:04.005080	5a06ca32	120	30	1.0000	DISCARD	gen=565 glyphs=4
2026-03-14T02:36:04.267122	c131b295	116	29	1.0000	DISCARD	gen=609 glyphs=4
2026-03-14T02:36:06.738674	fdb5d108	120	30	1.0000	DISCARD	gen=565 glyphs=4
2026-03-14T02:36:07.008219	8aef8872	116	29	1.0000	DISCARD	gen=609 glyphs=4
2026-03-14T02:36:09.487841	37f4017b	116	29	1.0000	DISCARD	gen=565 glyphs=4
2026-03-14T02:36:09.762180	050862ad	120	30	1.0000	DISCARD	gen=609 glyphs=4
2026-03-14T02:36:12.241064	37f4017b	116	29	1.0000	DISCARD	gen=566 glyphs=4
2026-03-14T02:36:12.514726	e2cd28ea	120	30	1.0000	DISCARD	gen=609 glyphs=4
2026-03-14T02:36:14.985874	bfdf7cad	120	30	1.0000	DISCARD	gen=566 glyphs=4
2026-03-14T02:36:15.259636	19355583	120	30	1.0000	DISCARD	gen=610 glyphs=4
2026-03-14T02:36:17.702706	843c875b	116	29	1.0000	DISCARD	gen=566 glyphs=4
2026-03-14T02:36:17.979071	8aef8872	116	29	1.0000	DISCARD	gen=610 glyphs=4
2026-03-14T02:36:20.438135	26c291ae	120	30	1.0000	DISCARD	gen=566 glyphs=4
2026-03-14T02:36:20.712128	8aef8872	116	29	1.0000	DISCARD	gen=610 glyphs=4
2026-03-14T02:36:23.173958	5a06ca32	120	30	1.0000	DISCARD	gen=566 glyphs=4
2026-03-14T02:36:23.435890	93e496bc	120	30	1.0000	DISCARD	gen=610 glyphs=4
2026-03-14T02:36:25.924564	5b9807ac	120	30	1.0000	DISCARD	gen=566 glyphs=4
2026-03-14T02:36:26.201849	e8c7f6cf	120	30	1.0000	DISCARD	gen=610 glyphs=4
2026-03-14T02:36:28.672908	55d6c151	120	30	1.0000	DISCARD	gen=566 glyphs=4
2026-03-14T02:36:28.952759	9e34ede0	116	29	1.0000	DISCARD	gen=610 glyphs=4
2026-03-14T02:36:31.424309	2701cb73	116	29	1.0000	DISCARD	gen=566 glyphs=4
2026-03-14T02:36:31.702687	f28fd6ae	120	30	1.0000	DISCARD	gen=610 glyphs=4
2026-03-14T02:36:34.269822	ef3d273f	120	30	1.0000	DISCARD	gen=566 glyphs=4
2026-03-14T02:36:34.551186	8aef8872	116	29	1.0000	DISCARD	gen=610 glyphs=4
2026-03-14T02:36:37.046721	1d34459a	116	29	1.0000	DISCARD	gen=566 glyphs=4
2026-03-14T02:36:37.335008	0eaedb57	116	29	1.0000	DISCARD	gen=610 glyphs=4
2026-03-14T02:36:39.790639	37f4017b	116	29	1.0000	DISCARD	gen=567 glyphs=4
2026-03-14T02:36:40.048969	050862ad	120	30	1.0000	DISCARD	gen=610 glyphs=4
2026-03-14T02:36:42.515596	bfdf7cad	120	30	1.0000	DISCARD	gen=567 glyphs=4
2026-03-14T02:36:42.791640	19355583	120	30	1.0000	DISCARD	gen=611 glyphs=4
2026-03-14T02:36:45.307259	d11c1062	120	30	1.0000	DISCARD	gen=567 glyphs=4
2026-03-14T02:36:45.568242	8aef8872	116	29	1.0000	DISCARD	gen=611 glyphs=4
2026-03-14T02:36:48.072456	4c9b0dd4	120	30	1.0000	DISCARD	gen=567 glyphs=4
2026-03-14T02:36:48.368731	050862ad	120	30	1.0000	DISCARD	gen=611 glyphs=4
2026-03-14T02:36:50.834818	5a06ca32	120	30	1.0000	DISCARD	gen=567 glyphs=4
2026-03-14T02:36:51.123489	b57e7176	120	30	1.0000	DISCARD	gen=611 glyphs=4
2026-03-14T02:36:53.594806	4c9b0dd4	120	30	1.0000	DISCARD	gen=567 glyphs=4
2026-03-14T02:36:53.877903	1e5f0e21	116	29	1.0000	DISCARD	gen=611 glyphs=4
2026-03-14T02:36:56.343043	6d20e771	120	30	1.0000	DISCARD	gen=567 glyphs=4
2026-03-14T02:36:56.615276	19355583	120	30	1.0000	DISCARD	gen=611 glyphs=4
2026-03-14T02:36:59.064668	2334816f	116	29	1.0000	DISCARD	gen=567 glyphs=4
2026-03-14T02:36:59.336263	42a8a415	116	29	0.9500	DISCARD	gen=611 glyphs=4
2026-03-14T02:37:01.797742	4c9b0dd4	120	30	1.0000	DISCARD	gen=567 glyphs=4
2026-03-14T02:37:02.079387	1e5f0e21	116	29	1.0000	DISCARD	gen=611 glyphs=4
2026-03-14T02:37:04.545655	4c9b0dd4	120	30	1.0000	DISCARD	gen=567 glyphs=4
2026-03-14T02:37:04.818014	8aef8872	116	29	1.0000	DISCARD	gen=611 glyphs=4
2026-03-14T02:37:07.360334	37f4017b	116	29	1.0000	DISCARD	gen=568 glyphs=4
2026-03-14T02:37:07.639772	eca7ab6c	116	29	1.0000	DISCARD	gen=611 glyphs=4
2026-03-14T02:37:10.102196	bfdf7cad	120	30	1.0000	DISCARD	gen=568 glyphs=4
2026-03-14T02:37:10.372278	19355583	120	30	1.0000	DISCARD	gen=612 glyphs=4
2026-03-14T02:37:12.833227	5a06ca32	120	30	1.0000	DISCARD	gen=568 glyphs=4
2026-03-14T02:37:13.100783	8aef8872	116	29	1.0000	DISCARD	gen=612 glyphs=4
2026-03-14T02:37:15.558633	fdb5d108	120	30	1.0000	DISCARD	gen=568 glyphs=4
2026-03-14T02:37:15.827428	eca7ab6c	116	29	1.0000	DISCARD	gen=612 glyphs=4
2026-03-14T02:37:18.289538	2701cb73	116	29	1.0000	DISCARD	gen=568 glyphs=4
2026-03-14T02:37:18.551931	b7aed8e9	116	29	1.0000	DISCARD	gen=612 glyphs=4
2026-03-14T02:37:20.996956	37f4017b	116	29	1.0000	DISCARD	gen=568 glyphs=4
2026-03-14T02:37:21.272846	8aef8872	116	29	1.0000	DISCARD	gen=612 glyphs=4
2026-03-14T02:37:23.725498	4c6d831f	116	29	1.0000	DISCARD	gen=568 glyphs=4
2026-03-14T02:37:24.000255	0eaedb57	116	29	1.0000	DISCARD	gen=612 glyphs=4
2026-03-14T02:37:26.478489	fdb5d108	120	30	1.0000	DISCARD	gen=568 glyphs=4
2026-03-14T02:37:26.750776	6a1b9087	120	30	1.0000	DISCARD	gen=612 glyphs=4
2026-03-14T02:37:29.250142	4efd8aed	116	29	1.0000	DISCARD	gen=568 glyphs=4
2026-03-14T02:37:29.520380	50dc991d	116	29	1.0000	DISCARD	gen=612 glyphs=4
2026-03-14T02:37:31.994648	5a06ca32	120	30	1.0000	DISCARD	gen=568 glyphs=4
2026-03-14T02:37:32.262837	8aef8872	116	29	1.0000	DISCARD	gen=612 glyphs=4
2026-03-14T02:37:34.704333	37f4017b	116	29	1.0000	DISCARD	gen=569 glyphs=4
2026-03-14T02:37:34.968964	067824e8	116	29	1.0000	DISCARD	gen=612 glyphs=4
2026-03-14T02:37:37.445026	bfdf7cad	120	30	1.0000	DISCARD	gen=569 glyphs=4
2026-03-14T02:37:37.722476	19355583	120	30	1.0000	DISCARD	gen=613 glyphs=4
2026-03-14T02:37:40.180697	37f4017b	116	29	1.0000	DISCARD	gen=569 glyphs=4
2026-03-14T02:37:40.444772	8aef8872	116	29	1.0000	DISCARD	gen=613 glyphs=4
2026-03-14T02:37:42.886876	37f4017b	116	29	1.0000	DISCARD	gen=569 glyphs=4
2026-03-14T02:37:43.152987	47c13b26	116	29	1.0000	DISCARD	gen=613 glyphs=4
2026-03-14T02:37:45.600531	71e2ba66	116	29	1.0000	DISCARD	gen=569 glyphs=4
2026-03-14T02:37:45.874964	050862ad	120	30	1.0000	DISCARD	gen=613 glyphs=4
2026-03-14T02:37:48.328197	d11c1062	120	30	1.0000	DISCARD	gen=569 glyphs=4
2026-03-14T02:37:48.593414	b99ff105	120	30	1.0000	DISCARD	gen=613 glyphs=4
2026-03-14T02:37:51.036927	7ca87b42	116	29	1.0000	DISCARD	gen=569 glyphs=4
2026-03-14T02:37:51.304446	0eaedb57	116	29	1.0000	DISCARD	gen=613 glyphs=4
2026-03-14T02:37:53.784745	81804085	116	29	1.0000	DISCARD	gen=569 glyphs=4
2026-03-14T02:37:54.050655	b1f50893	116	29	1.0000	DISCARD	gen=613 glyphs=4
2026-03-14T02:37:56.532622	5a06ca32	120	30	1.0000	DISCARD	gen=569 glyphs=4
2026-03-14T02:37:56.816678	b1a91c7e	116	29	1.0000	DISCARD	gen=613 glyphs=4
2026-03-14T02:37:59.250995	d10679ac	116	29	1.0000	DISCARD	gen=569 glyphs=4
2026-03-14T02:37:59.523323	0eaedb57	116	29	1.0000	DISCARD	gen=613 glyphs=4
2026-03-14T02:38:01.969795	37f4017b	116	29	1.0000	DISCARD	gen=570 glyphs=4
2026-03-14T02:38:02.235943	e2cd28ea	120	30	1.0000	DISCARD	gen=613 glyphs=4
2026-03-14T02:38:04.701705	bfdf7cad	120	30	1.0000	DISCARD	gen=570 glyphs=4
2026-03-14T02:38:04.981927	19355583	120	30	1.0000	DISCARD	gen=614 glyphs=4
2026-03-14T02:38:07.419238	bfdf7cad	120	30	1.0000	DISCARD	gen=570 glyphs=4
2026-03-14T02:38:07.688293	8aef8872	116	29	1.0000	DISCARD	gen=614 glyphs=4
2026-03-14T02:38:10.267008	f9992e9c	120	30	0.9500	DISCARD	gen=570 glyphs=4
2026-03-14T02:38:10.548835	b57e7176	120	30	1.0000	DISCARD	gen=614 glyphs=4
2026-03-14T02:38:12.950328	965ef1bb	120	30	1.0000	DISCARD	gen=570 glyphs=4
2026-03-14T02:38:13.228049	d70c3631	116	29	1.0000	DISCARD	gen=614 glyphs=4
2026-03-14T02:38:15.663295	2701cb73	116	29	1.0000	DISCARD	gen=570 glyphs=4
2026-03-14T02:38:15.934919	8aef8872	116	29	1.0000	DISCARD	gen=614 glyphs=4
2026-03-14T02:38:18.380092	37f4017b	116	29	1.0000	DISCARD	gen=570 glyphs=4
2026-03-14T02:38:18.659312	b7aed8e9	116	29	1.0000	DISCARD	gen=614 glyphs=4
2026-03-14T02:38:21.102464	37f4017b	116	29	1.0000	DISCARD	gen=570 glyphs=4
2026-03-14T02:38:21.369114	13602636	116	29	1.0000	DISCARD	gen=614 glyphs=4
2026-03-14T02:38:23.836740	37f4017b	116	29	1.0000	DISCARD	gen=570 glyphs=4
2026-03-14T02:38:24.107558	e8c7f6cf	120	30	1.0000	DISCARD	gen=614 glyphs=4
2026-03-14T02:38:26.577643	5a06ca32	120	30	1.0000	DISCARD	gen=570 glyphs=4
2026-03-14T02:38:26.850957	388fb1e0	116	29	1.0000	DISCARD	gen=614 glyphs=4
2026-03-14T02:38:29.302373	37f4017b	116	29	1.0000	DISCARD	gen=571 glyphs=4
2026-03-14T02:38:29.583827	a5ef6bda	120	30	1.0000	DISCARD	gen=614 glyphs=4
2026-03-14T02:38:32.026313	bfdf7cad	120	30	1.0000	DISCARD	gen=571 glyphs=4
2026-03-14T02:38:32.303872	19355583	120	30	1.0000	DISCARD	gen=615 glyphs=4
2026-03-14T02:38:34.748071	55d6c151	120	30	1.0000	DISCARD	gen=571 glyphs=4
2026-03-14T02:38:35.016352	8aef8872	116	29	1.0000	DISCARD	gen=615 glyphs=4
2026-03-14T02:38:37.465179	37f4017b	116	29	1.0000	DISCARD	gen=571 glyphs=4
2026-03-14T02:38:37.742710	54c1fcef	116	29	1.0000	DISCARD	gen=615 glyphs=4
2026-03-14T02:38:40.218766	71e2ba66	116	29	1.0000	DISCARD	gen=571 glyphs=4
2026-03-14T02:38:40.541263	19355583	120	30	1.0000	DISCARD	gen=615 glyphs=4
2026-03-14T02:38:43.043567	22032558	116	29	1.0000	DISCARD	gen=571 glyphs=4
2026-03-14T02:38:43.312576	41cab23b	116	29	1.0000	DISCARD	gen=615 glyphs=4
2026-03-14T02:38:45.755338	37f4017b	116	29	1.0000	DISCARD	gen=571 glyphs=4
2026-03-14T02:38:46.022828	e0d0da6b	116	29	1.0000	DISCARD	gen=615 glyphs=4
2026-03-14T02:38:48.461651	bfdf7cad	120	30	1.0000	DISCARD	gen=571 glyphs=4
2026-03-14T02:38:48.732202	d7c8681b	120	30	1.0000	DISCARD	gen=615 glyphs=4
2026-03-14T02:38:51.144112	55d6c151	120	30	1.0000	DISCARD	gen=571 glyphs=4
2026-03-14T02:38:51.414056	d7c8681b	120	30	1.0000	DISCARD	gen=615 glyphs=4
2026-03-14T02:38:53.886405	a9106cac	116	29	1.0000	DISCARD	gen=571 glyphs=4
2026-03-14T02:38:54.154080	8aef8872	116	29	1.0000	DISCARD	gen=615 glyphs=4
2026-03-14T02:38:56.600057	37f4017b	116	29	1.0000	DISCARD	gen=572 glyphs=4
2026-03-14T02:38:56.872623	50dc991d	116	29	1.0000	DISCARD	gen=615 glyphs=4
2026-03-14T02:38:59.310336	bfdf7cad	120	30	1.0000	DISCARD	gen=572 glyphs=4
2026-03-14T02:38:59.578553	19355583	120	30	1.0000	DISCARD	gen=616 glyphs=4
2026-03-14T02:39:02.004973	5a06ca32	120	30	1.0000	DISCARD	gen=572 glyphs=4
2026-03-14T02:39:02.275956	8aef8872	116	29	1.0000	DISCARD	gen=616 glyphs=4
2026-03-14T02:39:04.695553	55d6c151	120	30	1.0000	DISCARD	gen=572 glyphs=4
2026-03-14T02:39:04.964247	8aef8872	116	29	1.0000	DISCARD	gen=616 glyphs=4
2026-03-14T02:39:07.427966	2701cb73	116	29	1.0000	DISCARD	gen=572 glyphs=4
2026-03-14T02:39:07.712032	d7c8681b	120	30	1.0000	DISCARD	gen=616 glyphs=4
2026-03-14T02:39:10.156879	37f4017b	116	29	1.0000	DISCARD	gen=572 glyphs=4
2026-03-14T02:39:10.430813	88f52fd1	120	30	1.0000	DISCARD	gen=616 glyphs=4
2026-03-14T02:39:12.920337	090a2fa9	116	29	1.0000	DISCARD	gen=572 glyphs=4
2026-03-14T02:39:13.184253	d7c8681b	120	30	1.0000	DISCARD	gen=616 glyphs=4
2026-03-14T02:39:15.645540	2701cb73	116	29	1.0000	DISCARD	gen=572 glyphs=4
2026-03-14T02:39:15.916312	e8c7f6cf	120	30	1.0000	DISCARD	gen=616 glyphs=4
2026-03-14T02:39:18.356308	dd25144d	116	29	1.0000	DISCARD	gen=572 glyphs=4
2026-03-14T02:39:18.637714	cd20d0ce	116	29	1.0000	DISCARD	gen=616 glyphs=4
2026-03-14T02:39:21.077845	1d34459a	116	29	1.0000	DISCARD	gen=572 glyphs=4
2026-03-14T02:39:21.341537	0eaedb57	116	29	1.0000	DISCARD	gen=616 glyphs=4
2026-03-14T02:39:23.787660	37f4017b	116	29	1.0000	DISCARD	gen=573 glyphs=4
2026-03-14T02:39:24.066508	a077bfe0	120	30	1.0000	DISCARD	gen=616 glyphs=4
2026-03-14T02:39:26.506562	bfdf7cad	120	30	1.0000	DISCARD	gen=573 glyphs=4
2026-03-14T02:39:26.789354	19355583	120	30	1.0000	DISCARD	gen=617 glyphs=4
2026-03-14T02:39:29.230686	71e2ba66	116	29	1.0000	DISCARD	gen=573 glyphs=4
2026-03-14T02:39:29.500294	8aef8872	116	29	1.0000	DISCARD	gen=617 glyphs=4
2026-03-14T02:39:31.932759	37f4017b	116	29	1.0000	DISCARD	gen=573 glyphs=4
2026-03-14T02:39:32.203571	32f35930	116	29	1.0000	DISCARD	gen=617 glyphs=4
2026-03-14T02:39:34.682456	23395608	116	29	1.0000	DISCARD	gen=573 glyphs=4
2026-03-14T02:39:34.948201	050862ad	120	30	1.0000	DISCARD	gen=617 glyphs=4
2026-03-14T02:39:37.394921	5a06ca32	120	30	1.0000	DISCARD	gen=573 glyphs=4
2026-03-14T02:39:37.672041	8e489ffa	116	29	1.0000	DISCARD	gen=617 glyphs=4
2026-03-14T02:39:40.101496	2ff9023a	116	29	1.0000	DISCARD	gen=573 glyphs=4
2026-03-14T02:39:40.366106	e2cd28ea	120	30	1.0000	DISCARD	gen=617 glyphs=4
2026-03-14T02:39:42.804202	84cc1963	120	30	1.0000	DISCARD	gen=573 glyphs=4
2026-03-14T02:39:43.073482	8aef8872	116	29	1.0000	DISCARD	gen=617 glyphs=4
2026-03-14T02:39:45.625583	37f4017b	116	29	1.0000	DISCARD	gen=573 glyphs=4
2026-03-14T02:39:45.890337	050862ad	120	30	1.0000	DISCARD	gen=617 glyphs=4
2026-03-14T02:39:48.297100	2701cb73	116	29	1.0000	DISCARD	gen=573 glyphs=4
2026-03-14T02:39:48.566657	bdaa5da6	116	29	1.0000	DISCARD	gen=617 glyphs=4
2026-03-14T02:39:51.031331	37f4017b	116	29	1.0000	DISCARD	gen=574 glyphs=4
2026-03-14T02:39:51.291410	225517ce	116	29	1.0000	DISCARD	gen=617 glyphs=4
2026-03-14T02:39:53.720124	bfdf7cad	120	30	1.0000	DISCARD	gen=574 glyphs=4
2026-03-14T02:39:53.979033	19355583	120	30	1.0000	DISCARD	gen=618 glyphs=4
2026-03-14T02:39:56.410044	37f4017b	116	29	1.0000	DISCARD	gen=574 glyphs=4
2026-03-14T02:39:56.675235	8aef8872	116	29	1.0000	DISCARD	gen=618 glyphs=4
2026-03-14T02:39:59.098775	37f4017b	116	29	1.0000	DISCARD	gen=574 glyphs=4
2026-03-14T02:39:59.374015	875e0f8a	116	29	1.0000	DISCARD	gen=618 glyphs=4
2026-03-14T02:40:01.789128	1d34459a	116	29	1.0000	DISCARD	gen=574 glyphs=4
2026-03-14T02:40:02.049122	050862ad	120	30	1.0000	DISCARD	gen=618 glyphs=4
2026-03-14T02:40:04.550389	bb878e20	120	30	1.0000	DISCARD	gen=574 glyphs=4
2026-03-14T02:40:04.827279	9e34ede0	116	29	1.0000	DISCARD	gen=618 glyphs=4
2026-03-14T02:40:07.297531	5b9807ac	120	30	1.0000	DISCARD	gen=574 glyphs=4
2026-03-14T02:40:07.572939	dee33c53	116	29	1.0000	DISCARD	gen=618 glyphs=4
2026-03-14T02:40:10.018244	55d6c151	120	30	1.0000	DISCARD	gen=574 glyphs=4
2026-03-14T02:40:10.295479	050862ad	120	30	1.0000	DISCARD	gen=618 glyphs=4
2026-03-14T02:40:12.802010	37f4017b	116	29	1.0000	DISCARD	gen=574 glyphs=4
2026-03-14T02:40:13.069436	9dc58a36	116	29	1.0000	DISCARD	gen=618 glyphs=4
2026-03-14T02:40:15.551375	5a06ca32	120	30	1.0000	DISCARD	gen=574 glyphs=4
2026-03-14T02:40:15.865010	50dc991d	116	29	1.0000	DISCARD	gen=618 glyphs=4
2026-03-14T02:40:18.353384	37f4017b	116	29	1.0000	DISCARD	gen=575 glyphs=4
2026-03-14T02:40:18.621138	b7aed8e9	116	29	1.0000	DISCARD	gen=618 glyphs=4
2026-03-14T02:40:21.092906	bfdf7cad	120	30	1.0000	DISCARD	gen=575 glyphs=4
2026-03-14T02:40:21.367998	19355583	120	30	1.0000	DISCARD	gen=619 glyphs=4
2026-03-14T02:40:23.837960	1d34459a	116	29	1.0000	DISCARD	gen=575 glyphs=4
2026-03-14T02:40:24.111210	8aef8872	116	29	1.0000	DISCARD	gen=619 glyphs=4
2026-03-14T02:40:26.580387	1d34459a	116	29	1.0000	DISCARD	gen=575 glyphs=4
2026-03-14T02:40:26.861010	19355583	120	30	1.0000	DISCARD	gen=619 glyphs=4
2026-03-14T02:40:29.333001	3f08d7cb	120	30	1.0000	DISCARD	gen=575 glyphs=4
2026-03-14T02:40:29.608452	e8c7f6cf	120	30	1.0000	DISCARD	gen=619 glyphs=4
2026-03-14T02:40:32.088281	c8b8623a	116	29	1.0000	DISCARD	gen=575 glyphs=4
2026-03-14T02:40:32.355438	19355583	120	30	1.0000	DISCARD	gen=619 glyphs=4
2026-03-14T02:40:34.815219	37f4017b	116	29	1.0000	DISCARD	gen=575 glyphs=4
2026-03-14T02:40:35.083803	9e34ede0	116	29	1.0000	DISCARD	gen=619 glyphs=4
2026-03-14T02:40:37.519549	7ca87b42	116	29	1.0000	DISCARD	gen=575 glyphs=4
2026-03-14T02:40:37.797353	050862ad	120	30	1.0000	DISCARD	gen=619 glyphs=4
2026-03-14T02:40:40.254113	55d6c151	120	30	1.0000	DISCARD	gen=575 glyphs=4
2026-03-14T02:40:40.535626	19355583	120	30	1.0000	DISCARD	gen=619 glyphs=4
2026-03-14T02:40:42.982954	37f4017b	116	29	1.0000	DISCARD	gen=575 glyphs=4
2026-03-14T02:40:43.262191	875e0f8a	116	29	1.0000	DISCARD	gen=619 glyphs=4
2026-03-14T02:40:45.722678	37f4017b	116	29	1.0000	DISCARD	gen=576 glyphs=4
2026-03-14T02:40:46.008577	1e5f0e21	116	29	1.0000	DISCARD	gen=619 glyphs=4
2026-03-14T02:40:48.586614	bfdf7cad	120	30	1.0000	DISCARD	gen=576 glyphs=4
2026-03-14T02:40:48.875872	19355583	120	30	1.0000	DISCARD	gen=620 glyphs=4
2026-03-14T02:40:51.323026	d11c1062	120	30	1.0000	DISCARD	gen=576 glyphs=4
2026-03-14T02:40:51.586777	8aef8872	116	29	1.0000	DISCARD	gen=620 glyphs=4
2026-03-14T02:40:54.065438	401d0e55	116	29	1.0000	DISCARD	gen=576 glyphs=4
2026-03-14T02:40:54.339704	68b248e4	120	30	1.0000	DISCARD	gen=620 glyphs=4
2026-03-14T02:40:56.786597	12b38c2d	116	29	1.0000	DISCARD	gen=576 glyphs=4
2026-03-14T02:40:57.063704	19355583	120	30	1.0000	DISCARD	gen=620 glyphs=4
2026-03-14T02:40:59.523313	0e367038	116	29	1.0000	DISCARD	gen=576 glyphs=4
2026-03-14T02:40:59.795463	dc22597e	120	30	1.0000	DISCARD	gen=620 glyphs=4
2026-03-14T02:41:02.267664	1d34459a	116	29	1.0000	DISCARD	gen=576 glyphs=4
2026-03-14T02:41:02.555953	e8c7f6cf	120	30	1.0000	DISCARD	gen=620 glyphs=4
2026-03-14T02:41:05.054948	37f4017b	116	29	1.0000	DISCARD	gen=576 glyphs=4
2026-03-14T02:41:05.330231	b7aed8e9	116	29	1.0000	DISCARD	gen=620 glyphs=4
2026-03-14T02:41:07.813270	5a06ca32	120	30	1.0000	DISCARD	gen=576 glyphs=4
2026-03-14T02:41:08.090254	9e34ede0	116	29	1.0000	DISCARD	gen=620 glyphs=4
2026-03-14T02:41:10.544069	d11c1062	120	30	1.0000	DISCARD	gen=576 glyphs=4
2026-03-14T02:41:10.814184	9e34ede0	116	29	1.0000	DISCARD	gen=620 glyphs=4
2026-03-14T02:41:13.273698	37f4017b	116	29	1.0000	DISCARD	gen=577 glyphs=4
2026-03-14T02:41:13.543737	19355583	120	30	1.0000	DISCARD	gen=620 glyphs=4
2026-03-14T02:41:16.034209	bfdf7cad	120	30	1.0000	DISCARD	gen=577 glyphs=4
2026-03-14T02:41:16.294368	19355583	120	30	1.0000	DISCARD	gen=621 glyphs=4
2026-03-14T02:41:18.730383	55d6c151	120	30	1.0000	DISCARD	gen=577 glyphs=4
2026-03-14T02:41:19.003148	8aef8872	116	29	1.0000	DISCARD	gen=621 glyphs=4
2026-03-14T02:41:21.536726	29593d60	120	30	1.0000	DISCARD	gen=577 glyphs=4
2026-03-14T02:41:21.815758	6f08222f	120	30	1.0000	DISCARD	gen=621 glyphs=4
2026-03-14T02:41:24.249538	55d6c151	120	30	1.0000	DISCARD	gen=577 glyphs=4
2026-03-14T02:41:24.519842	8aef8872	116	29	1.0000	DISCARD	gen=621 glyphs=4
2026-03-14T02:41:26.966974	effc08f0	120	30	1.0000	DISCARD	gen=577 glyphs=4
2026-03-14T02:41:27.258551	1237ceaa	116	29	1.0000	DISCARD	gen=621 glyphs=4
2026-03-14T02:41:29.681108	9e26eef3	124	31	0.9500	DISCARD	gen=577 glyphs=4
2026-03-14T02:41:29.950169	00bedb61	120	30	1.0000	DISCARD	gen=621 glyphs=4
2026-03-14T02:41:32.385939	37f4017b	116	29	1.0000	DISCARD	gen=577 glyphs=4
2026-03-14T02:41:32.646625	19355583	120	30	1.0000	DISCARD	gen=621 glyphs=4
2026-03-14T02:41:35.093167	12b38c2d	116	29	1.0000	DISCARD	gen=577 glyphs=4
2026-03-14T02:41:35.367002	591d94ad	116	29	1.0000	DISCARD	gen=621 glyphs=4
2026-03-14T02:41:37.841801	5b9807ac	120	30	1.0000	DISCARD	gen=577 glyphs=4
2026-03-14T02:41:38.112264	8aef8872	116	29	1.0000	DISCARD	gen=621 glyphs=4
2026-03-14T02:41:40.546092	37f4017b	116	29	1.0000	DISCARD	gen=578 glyphs=4
2026-03-14T02:41:40.821713	19355583	120	30	1.0000	DISCARD	gen=621 glyphs=4
