timestamp	program_hash	spirv_size	word_count	fitness	status	description
2026-03-14T07:36:45.980926	099964a4	0	0	0.0000	CRASH	gen=952 glyphs=4
2026-03-14T07:36:45.981123	099964a4	0	0	0.0000	CRASH	gen=952 glyphs=4
2026-03-14T07:36:45.981317	72ccaf96	0	0	0.0000	CRASH	gen=952 glyphs=3
2026-03-14T07:36:45.981508	099964a4	0	0	0.0000	CRASH	gen=952 glyphs=4
2026-03-14T07:36:45.981703	cf93b656	0	0	0.0000	CRASH	gen=952 glyphs=3
2026-03-14T07:36:45.981896	3a734398	0	0	0.0000	CRASH	gen=952 glyphs=4
2026-03-14T07:36:45.982091	5c2afa6c	0	0	0.0000	CRASH	gen=952 glyphs=4
2026-03-14T07:36:45.982285	099964a4	0	0	0.0000	CRASH	gen=952 glyphs=4
2026-03-14T07:36:45.982480	73c57d4e	0	0	0.0000	CRASH	gen=952 glyphs=4
2026-03-14T07:36:45.982674	e31582a3	0	0	0.0000	CRASH	gen=952 glyphs=4
2026-03-14T07:36:45.982946	099964a4	0	0	0.0000	CRASH	gen=953 glyphs=4
2026-03-14T07:36:45.983148	099964a4	0	0	0.0000	CRASH	gen=953 glyphs=4
2026-03-14T07:36:45.983339	8da1f8d8	0	0	0.0000	CRASH	gen=953 glyphs=4
2026-03-14T07:36:45.983536	aef9a1a1	0	0	0.0000	CRASH	gen=953 glyphs=5
2026-03-14T07:36:45.983732	099964a4	0	0	0.0000	CRASH	gen=953 glyphs=4
2026-03-14T07:36:45.983925	099964a4	0	0	0.0000	CRASH	gen=953 glyphs=4
2026-03-14T07:36:45.984126	099964a4	0	0	0.0000	CRASH	gen=953 glyphs=4
2026-03-14T07:36:45.984319	cf93b656	0	0	0.0000	CRASH	gen=953 glyphs=3
2026-03-14T07:36:45.984519	099964a4	0	0	0.0000	CRASH	gen=953 glyphs=4
2026-03-14T07:36:45.984713	f4e9c35e	0	0	0.0000	CRASH	gen=953 glyphs=4
2026-03-14T07:36:45.984991	099964a4	0	0	0.0000	CRASH	gen=954 glyphs=4
2026-03-14T07:36:45.985192	099964a4	0	0	0.0000	CRASH	gen=954 glyphs=4
2026-03-14T07:36:45.985388	d81c35b4	0	0	0.0000	CRASH	gen=954 glyphs=3
2026-03-14T07:36:45.985584	dc5494b6	0	0	0.0000	CRASH	gen=954 glyphs=3
2026-03-14T07:36:45.985778	099964a4	0	0	0.0000	CRASH	gen=954 glyphs=4
2026-03-14T07:36:45.985971	3a734398	0	0	0.0000	CRASH	gen=954 glyphs=4
2026-03-14T07:36:45.986162	02e16ac9	0	0	0.0000	CRASH	gen=954 glyphs=3
2026-03-14T07:36:45.986359	099964a4	0	0	0.0000	CRASH	gen=954 glyphs=4
2026-03-14T07:36:45.986557	099964a4	0	0	0.0000	CRASH	gen=954 glyphs=4
2026-03-14T07:36:45.986748	73230eb9	0	0	0.0000	CRASH	gen=954 glyphs=2
2026-03-14T07:36:45.987030	099964a4	0	0	0.0000	CRASH	gen=955 glyphs=4
2026-03-14T07:36:45.987223	099964a4	0	0	0.0000	CRASH	gen=955 glyphs=4
2026-03-14T07:36:45.987419	099964a4	0	0	0.0000	CRASH	gen=955 glyphs=4
2026-03-14T07:36:45.987614	8da1f8d8	0	0	0.0000	CRASH	gen=955 glyphs=4
2026-03-14T07:36:45.987808	32d82fd8	0	0	0.0000	CRASH	gen=955 glyphs=2
2026-03-14T07:36:45.987999	659f2a3e	0	0	0.0000	CRASH	gen=955 glyphs=3
2026-03-14T07:36:45.988191	099964a4	0	0	0.0000	CRASH	gen=955 glyphs=4
2026-03-14T07:36:45.988388	099964a4	0	0	0.0000	CRASH	gen=955 glyphs=4
2026-03-14T07:36:45.988585	099964a4	0	0	0.0000	CRASH	gen=955 glyphs=4
2026-03-14T07:36:45.988780	04aea747	0	0	0.0000	CRASH	gen=955 glyphs=2
2026-03-14T07:36:45.989072	099964a4	0	0	0.0000	CRASH	gen=956 glyphs=4
2026-03-14T07:36:45.989270	099964a4	0	0	0.0000	CRASH	gen=956 glyphs=4
2026-03-14T07:36:45.989471	0c1d37f9	0	0	0.0000	CRASH	gen=956 glyphs=3
2026-03-14T07:36:45.989667	cf93b656	0	0	0.0000	CRASH	gen=956 glyphs=3
2026-03-14T07:36:45.989860	099964a4	0	0	0.0000	CRASH	gen=956 glyphs=4
2026-03-14T07:36:45.990055	3ca14993	0	0	0.0000	CRASH	gen=956 glyphs=4
2026-03-14T07:36:45.990251	099964a4	0	0	0.0000	CRASH	gen=956 glyphs=4
2026-03-14T07:36:45.990445	8da1f8d8	0	0	0.0000	CRASH	gen=956 glyphs=4
2026-03-14T07:36:45.990644	099964a4	0	0	0.0000	CRASH	gen=956 glyphs=4
2026-03-14T07:36:45.990836	28f2e863	0	0	0.0000	CRASH	gen=956 glyphs=3
2026-03-14T07:36:45.991118	099964a4	0	0	0.0000	CRASH	gen=957 glyphs=4
2026-03-14T07:36:45.991315	099964a4	0	0	0.0000	CRASH	gen=957 glyphs=4
2026-03-14T07:36:45.991513	3ca14993	0	0	0.0000	CRASH	gen=957 glyphs=4
2026-03-14T07:36:45.991715	f37f129c	0	0	0.0000	CRASH	gen=957 glyphs=4
2026-03-14T07:36:45.991910	099964a4	0	0	0.0000	CRASH	gen=957 glyphs=4
2026-03-14T07:36:45.992103	099964a4	0	0	0.0000	CRASH	gen=957 glyphs=4
2026-03-14T07:36:45.992296	fd52bbc0	0	0	0.0000	CRASH	gen=957 glyphs=5
2026-03-14T07:36:45.992490	c1f0bc51	0	0	0.0000	CRASH	gen=957 glyphs=4
2026-03-14T07:36:45.992695	099964a4	0	0	0.0000	CRASH	gen=957 glyphs=4
2026-03-14T07:36:45.992887	f7c04575	0	0	0.0000	CRASH	gen=957 glyphs=4
2026-03-14T07:36:45.993167	099964a4	0	0	0.0000	CRASH	gen=958 glyphs=4
2026-03-14T07:36:45.993362	099964a4	0	0	0.0000	CRASH	gen=958 glyphs=4
2026-03-14T07:36:45.993560	099964a4	0	0	0.0000	CRASH	gen=958 glyphs=4
2026-03-14T07:36:45.993759	099964a4	0	0	0.0000	CRASH	gen=958 glyphs=4
2026-03-14T07:36:45.993970	099964a4	0	0	0.0000	CRASH	gen=958 glyphs=4
2026-03-14T07:36:45.994163	099964a4	0	0	0.0000	CRASH	gen=958 glyphs=4
2026-03-14T07:36:45.994356	c4ccbaab	0	0	0.0000	CRASH	gen=958 glyphs=4
2026-03-14T07:36:45.994554	f014fd8a	0	0	0.0000	CRASH	gen=958 glyphs=5
2026-03-14T07:36:45.994754	51700af1	0	0	0.0000	CRASH	gen=958 glyphs=4
2026-03-14T07:36:45.994946	dcb1fb50	0	0	0.0000	CRASH	gen=958 glyphs=4
2026-03-14T07:36:45.995219	099964a4	0	0	0.0000	CRASH	gen=959 glyphs=4
2026-03-14T07:36:45.995415	099964a4	0	0	0.0000	CRASH	gen=959 glyphs=4
2026-03-14T07:36:45.995610	fac067b3	0	0	0.0000	CRASH	gen=959 glyphs=4
2026-03-14T07:36:45.995810	099964a4	0	0	0.0000	CRASH	gen=959 glyphs=4
2026-03-14T07:36:45.996003	5a6dc228	0	0	0.0000	CRASH	gen=959 glyphs=4
2026-03-14T07:36:45.996198	f33fd36e	0	0	0.0000	CRASH	gen=959 glyphs=4
2026-03-14T07:36:45.996394	7ede4765	0	0	0.0000	CRASH	gen=959 glyphs=2
2026-03-14T07:36:45.996589	cf93b656	0	0	0.0000	CRASH	gen=959 glyphs=3
2026-03-14T07:36:45.996782	dcb1fb50	0	0	0.0000	CRASH	gen=959 glyphs=4
2026-03-14T07:36:45.996982	099964a4	0	0	0.0000	CRASH	gen=959 glyphs=4
2026-03-14T07:36:45.997245	099964a4	0	0	0.0000	CRASH	gen=960 glyphs=4
2026-03-14T07:36:45.997438	099964a4	0	0	0.0000	CRASH	gen=960 glyphs=4
2026-03-14T07:36:45.997636	099964a4	0	0	0.0000	CRASH	gen=960 glyphs=4
2026-03-14T07:36:45.997831	80cef82b	0	0	0.0000	CRASH	gen=960 glyphs=4
2026-03-14T07:36:45.998031	3a734398	0	0	0.0000	CRASH	gen=960 glyphs=4
2026-03-14T07:36:45.998227	3a734398	0	0	0.0000	CRASH	gen=960 glyphs=4
2026-03-14T07:36:45.998423	099964a4	0	0	0.0000	CRASH	gen=960 glyphs=4
2026-03-14T07:36:45.998624	80cef82b	0	0	0.0000	CRASH	gen=960 glyphs=4
2026-03-14T07:36:45.998821	8de20380	0	0	0.0000	CRASH	gen=960 glyphs=3
2026-03-14T07:36:45.999021	099964a4	0	0	0.0000	CRASH	gen=960 glyphs=4
2026-03-14T07:36:45.999309	099964a4	0	0	0.0000	CRASH	gen=961 glyphs=4
2026-03-14T07:36:45.999507	099964a4	0	0	0.0000	CRASH	gen=961 glyphs=4
2026-03-14T07:36:45.999705	099964a4	0	0	0.0000	CRASH	gen=961 glyphs=4
2026-03-14T07:36:45.999897	0633d1af	0	0	0.0000	CRASH	gen=961 glyphs=3
2026-03-14T07:36:46.000097	b12b4a53	0	0	0.0000	CRASH	gen=961 glyphs=4
2026-03-14T07:36:46.000294	06e4334c	0	0	0.0000	CRASH	gen=961 glyphs=3
2026-03-14T07:36:46.000490	099964a4	0	0	0.0000	CRASH	gen=961 glyphs=4
2026-03-14T07:36:46.000686	099964a4	0	0	0.0000	CRASH	gen=961 glyphs=4
2026-03-14T07:36:46.000881	099964a4	0	0	0.0000	CRASH	gen=961 glyphs=4
2026-03-14T07:36:46.001079	099964a4	0	0	0.0000	CRASH	gen=961 glyphs=4
2026-03-14T07:36:46.001363	099964a4	0	0	0.0000	CRASH	gen=962 glyphs=4
2026-03-14T07:36:46.001563	099964a4	0	0	0.0000	CRASH	gen=962 glyphs=4
2026-03-14T07:36:46.001759	099964a4	0	0	0.0000	CRASH	gen=962 glyphs=4
2026-03-14T07:36:46.001952	4d221201	0	0	0.0000	CRASH	gen=962 glyphs=4
2026-03-14T07:36:46.002152	451634da	0	0	0.0000	CRASH	gen=962 glyphs=3
2026-03-14T07:36:46.002345	8da1f8d8	0	0	0.0000	CRASH	gen=962 glyphs=4
2026-03-14T07:36:46.002543	099964a4	0	0	0.0000	CRASH	gen=962 glyphs=4
2026-03-14T07:36:46.002735	099964a4	0	0	0.0000	CRASH	gen=962 glyphs=4
2026-03-14T07:36:46.002929	48b6e4f2	0	0	0.0000	CRASH	gen=962 glyphs=3
2026-03-14T07:36:46.003120	099964a4	0	0	0.0000	CRASH	gen=962 glyphs=4
2026-03-14T07:36:46.003394	099964a4	0	0	0.0000	CRASH	gen=963 glyphs=4
2026-03-14T07:36:46.003593	099964a4	0	0	0.0000	CRASH	gen=963 glyphs=4
2026-03-14T07:36:46.003792	2a4245d2	0	0	0.0000	CRASH	gen=963 glyphs=4
2026-03-14T07:36:46.003989	51cca96c	0	0	0.0000	CRASH	gen=963 glyphs=4
2026-03-14T07:36:46.004186	099964a4	0	0	0.0000	CRASH	gen=963 glyphs=4
2026-03-14T07:36:46.004384	099964a4	0	0	0.0000	CRASH	gen=963 glyphs=4
2026-03-14T07:36:46.004581	099964a4	0	0	0.0000	CRASH	gen=963 glyphs=4
2026-03-14T07:36:46.004775	099964a4	0	0	0.0000	CRASH	gen=963 glyphs=4
2026-03-14T07:36:46.004974	099964a4	0	0	0.0000	CRASH	gen=963 glyphs=4
2026-03-14T07:36:46.005168	3ca14993	0	0	0.0000	CRASH	gen=963 glyphs=4
2026-03-14T07:36:46.005450	099964a4	0	0	0.0000	CRASH	gen=964 glyphs=4
2026-03-14T07:36:46.005651	099964a4	0	0	0.0000	CRASH	gen=964 glyphs=4
2026-03-14T07:36:46.005847	dcb1fb50	0	0	0.0000	CRASH	gen=964 glyphs=4
2026-03-14T07:36:46.006047	099964a4	0	0	0.0000	CRASH	gen=964 glyphs=4
2026-03-14T07:36:46.006242	099964a4	0	0	0.0000	CRASH	gen=964 glyphs=4
2026-03-14T07:36:46.006444	0b33698f	0	0	0.0000	CRASH	gen=964 glyphs=4
2026-03-14T07:36:46.006643	f84671ae	0	0	0.0000	CRASH	gen=964 glyphs=3
2026-03-14T07:36:46.006839	099964a4	0	0	0.0000	CRASH	gen=964 glyphs=4
2026-03-14T07:36:46.007035	56571427	0	0	0.0000	CRASH	gen=964 glyphs=4
2026-03-14T07:36:46.007228	099964a4	0	0	0.0000	CRASH	gen=964 glyphs=4
2026-03-14T07:36:46.007509	099964a4	0	0	0.0000	CRASH	gen=965 glyphs=4
2026-03-14T07:36:46.007707	099964a4	0	0	0.0000	CRASH	gen=965 glyphs=4
2026-03-14T07:36:46.007903	488c3706	0	0	0.0000	CRASH	gen=965 glyphs=3
2026-03-14T07:36:46.008100	099964a4	0	0	0.0000	CRASH	gen=965 glyphs=4
2026-03-14T07:36:46.008296	d7e69e4a	0	0	0.0000	CRASH	gen=965 glyphs=3
2026-03-14T07:36:46.008495	1d745315	0	0	0.0000	CRASH	gen=965 glyphs=3
2026-03-14T07:36:46.008694	099964a4	0	0	0.0000	CRASH	gen=965 glyphs=4
2026-03-14T07:36:46.008889	4559e156	0	0	0.0000	CRASH	gen=965 glyphs=3
2026-03-14T07:36:46.009086	099964a4	0	0	0.0000	CRASH	gen=965 glyphs=4
2026-03-14T07:36:46.009281	099964a4	0	0	0.0000	CRASH	gen=965 glyphs=4
2026-03-14T07:36:46.009554	099964a4	0	0	0.0000	CRASH	gen=966 glyphs=4
2026-03-14T07:36:46.009763	099964a4	0	0	0.0000	CRASH	gen=966 glyphs=4
2026-03-14T07:36:46.009958	099964a4	0	0	0.0000	CRASH	gen=966 glyphs=4
2026-03-14T07:36:46.010153	ffff5993	0	0	0.0000	CRASH	gen=966 glyphs=3
2026-03-14T07:36:46.010345	099964a4	0	0	0.0000	CRASH	gen=966 glyphs=4
2026-03-14T07:36:46.010540	099964a4	0	0	0.0000	CRASH	gen=966 glyphs=4
2026-03-14T07:36:46.010733	5ec2f3a0	0	0	0.0000	CRASH	gen=966 glyphs=4
2026-03-14T07:36:46.010928	ff30496a	0	0	0.0000	CRASH	gen=966 glyphs=3
2026-03-14T07:36:46.011123	099964a4	0	0	0.0000	CRASH	gen=966 glyphs=4
2026-03-14T07:36:46.011315	ff30496a	0	0	0.0000	CRASH	gen=966 glyphs=3
2026-03-14T07:36:46.011599	099964a4	0	0	0.0000	CRASH	gen=967 glyphs=4
2026-03-14T07:36:46.011799	099964a4	0	0	0.0000	CRASH	gen=967 glyphs=4
2026-03-14T07:36:46.011994	099964a4	0	0	0.0000	CRASH	gen=967 glyphs=4
2026-03-14T07:36:46.012187	3a734398	0	0	0.0000	CRASH	gen=967 glyphs=4
2026-03-14T07:36:46.012382	3ca14993	0	0	0.0000	CRASH	gen=967 glyphs=4
2026-03-14T07:36:46.012578	099964a4	0	0	0.0000	CRASH	gen=967 glyphs=4
2026-03-14T07:36:46.012772	62cbe2b0	0	0	0.0000	CRASH	gen=967 glyphs=4
2026-03-14T07:36:46.012968	099964a4	0	0	0.0000	CRASH	gen=967 glyphs=4
2026-03-14T07:36:46.013160	099964a4	0	0	0.0000	CRASH	gen=967 glyphs=4
2026-03-14T07:36:46.013351	68775bcc	0	0	0.0000	CRASH	gen=967 glyphs=5
2026-03-14T07:36:46.013638	099964a4	0	0	0.0000	CRASH	gen=968 glyphs=4
2026-03-14T07:36:46.013836	099964a4	0	0	0.0000	CRASH	gen=968 glyphs=4
2026-03-14T07:36:46.014032	7ede4765	0	0	0.0000	CRASH	gen=968 glyphs=2
2026-03-14T07:36:46.014224	099964a4	0	0	0.0000	CRASH	gen=968 glyphs=4
2026-03-14T07:36:46.014418	a98b2a40	0	0	0.0000	CRASH	gen=968 glyphs=3
2026-03-14T07:36:46.014619	099964a4	0	0	0.0000	CRASH	gen=968 glyphs=4
2026-03-14T07:36:46.014814	099964a4	0	0	0.0000	CRASH	gen=968 glyphs=4
2026-03-14T07:36:46.015013	099964a4	0	0	0.0000	CRASH	gen=968 glyphs=4
2026-03-14T07:36:46.015205	e5d35650	0	0	0.0000	CRASH	gen=968 glyphs=3
2026-03-14T07:36:46.015397	c37492b9	0	0	0.0000	CRASH	gen=968 glyphs=4
2026-03-14T07:36:46.015685	099964a4	0	0	0.0000	CRASH	gen=969 glyphs=4
2026-03-14T07:36:46.015882	099964a4	0	0	0.0000	CRASH	gen=969 glyphs=4
2026-03-14T07:36:46.016084	ff30496a	0	0	0.0000	CRASH	gen=969 glyphs=3
2026-03-14T07:36:46.016277	97eacab8	0	0	0.0000	CRASH	gen=969 glyphs=3
2026-03-14T07:36:46.016473	ccbbafc6	0	0	0.0000	CRASH	gen=969 glyphs=3
2026-03-14T07:36:46.016668	cdfd7338	0	0	0.0000	CRASH	gen=969 glyphs=4
2026-03-14T07:36:46.016862	7ede4765	0	0	0.0000	CRASH	gen=969 glyphs=2
2026-03-14T07:36:46.017053	099964a4	0	0	0.0000	CRASH	gen=969 glyphs=4
2026-03-14T07:36:46.017247	dd0c1b69	0	0	0.0000	CRASH	gen=969 glyphs=3
2026-03-14T07:36:46.017442	099964a4	0	0	0.0000	CRASH	gen=969 glyphs=4
2026-03-14T07:36:46.017717	099964a4	0	0	0.0000	CRASH	gen=970 glyphs=4
2026-03-14T07:36:46.017911	099964a4	0	0	0.0000	CRASH	gen=970 glyphs=4
2026-03-14T07:36:46.018105	dcb1fb50	0	0	0.0000	CRASH	gen=970 glyphs=4
2026-03-14T07:36:46.018302	7ede4765	0	0	0.0000	CRASH	gen=970 glyphs=2
2026-03-14T07:36:46.018493	099964a4	0	0	0.0000	CRASH	gen=970 glyphs=4
2026-03-14T07:36:46.018688	099964a4	0	0	0.0000	CRASH	gen=970 glyphs=4
2026-03-14T07:36:46.018879	0ec31b5b	0	0	0.0000	CRASH	gen=970 glyphs=4
2026-03-14T07:36:46.019074	099964a4	0	0	0.0000	CRASH	gen=970 glyphs=4
2026-03-14T07:36:46.019270	099964a4	0	0	0.0000	CRASH	gen=970 glyphs=4
2026-03-14T07:36:46.019459	3ca14993	0	0	0.0000	CRASH	gen=970 glyphs=4
2026-03-14T07:36:46.019736	099964a4	0	0	0.0000	CRASH	gen=971 glyphs=4
2026-03-14T07:36:46.019930	099964a4	0	0	0.0000	CRASH	gen=971 glyphs=4
2026-03-14T07:36:46.020124	3a734398	0	0	0.0000	CRASH	gen=971 glyphs=4
2026-03-14T07:36:46.020320	099964a4	0	0	0.0000	CRASH	gen=971 glyphs=4
2026-03-14T07:36:46.020512	27b1cfff	0	0	0.0000	CRASH	gen=971 glyphs=4
2026-03-14T07:36:46.020707	099964a4	0	0	0.0000	CRASH	gen=971 glyphs=4
2026-03-14T07:36:46.020899	7ede4765	0	0	0.0000	CRASH	gen=971 glyphs=2
2026-03-14T07:36:46.021089	dcb1fb50	0	0	0.0000	CRASH	gen=971 glyphs=4
2026-03-14T07:36:46.021282	3a734398	0	0	0.0000	CRASH	gen=971 glyphs=4
2026-03-14T07:36:46.021475	099964a4	0	0	0.0000	CRASH	gen=971 glyphs=4
2026-03-14T07:36:46.021754	099964a4	0	0	0.0000	CRASH	gen=972 glyphs=4
2026-03-14T07:36:46.021946	099964a4	0	0	0.0000	CRASH	gen=972 glyphs=4
2026-03-14T07:36:46.022138	099964a4	0	0	0.0000	CRASH	gen=972 glyphs=4
2026-03-14T07:36:46.022329	dcb1fb50	0	0	0.0000	CRASH	gen=972 glyphs=4
2026-03-14T07:36:46.022528	8da1f8d8	0	0	0.0000	CRASH	gen=972 glyphs=4
2026-03-14T07:36:46.022721	31136263	0	0	0.0000	CRASH	gen=972 glyphs=4
2026-03-14T07:36:46.022914	71aeacbe	0	0	0.0000	CRASH	gen=972 glyphs=4
2026-03-14T07:36:46.023106	7ede4765	0	0	0.0000	CRASH	gen=972 glyphs=2
2026-03-14T07:36:46.023298	8ae75aa8	0	0	0.0000	CRASH	gen=972 glyphs=5
2026-03-14T07:36:46.023495	f3ab3036	0	0	0.0000	CRASH	gen=972 glyphs=4
2026-03-14T07:36:46.023773	099964a4	0	0	0.0000	CRASH	gen=973 glyphs=4
2026-03-14T07:36:46.023968	099964a4	0	0	0.0000	CRASH	gen=973 glyphs=4
2026-03-14T07:36:46.024161	099964a4	0	0	0.0000	CRASH	gen=973 glyphs=4
2026-03-14T07:36:46.024350	80cef82b	0	0	0.0000	CRASH	gen=973 glyphs=4
2026-03-14T07:36:46.024550	e40d6cae	0	0	0.0000	CRASH	gen=973 glyphs=4
2026-03-14T07:36:46.024741	099964a4	0	0	0.0000	CRASH	gen=973 glyphs=4
2026-03-14T07:36:46.024932	7ede4765	0	0	0.0000	CRASH	gen=973 glyphs=2
2026-03-14T07:36:46.025121	0e0056ea	0	0	0.0000	CRASH	gen=973 glyphs=3
2026-03-14T07:36:46.025316	73d951e2	0	0	0.0000	CRASH	gen=973 glyphs=1
2026-03-14T07:36:46.025507	099964a4	0	0	0.0000	CRASH	gen=973 glyphs=4
2026-03-14T07:36:46.025790	099964a4	0	0	0.0000	CRASH	gen=974 glyphs=4
2026-03-14T07:36:46.025983	099964a4	0	0	0.0000	CRASH	gen=974 glyphs=4
2026-03-14T07:36:46.026175	099964a4	0	0	0.0000	CRASH	gen=974 glyphs=4
2026-03-14T07:36:46.026366	099964a4	0	0	0.0000	CRASH	gen=974 glyphs=4
2026-03-14T07:36:46.026560	7b8cd8a9	0	0	0.0000	CRASH	gen=974 glyphs=4
2026-03-14T07:36:46.026757	099964a4	0	0	0.0000	CRASH	gen=974 glyphs=4
2026-03-14T07:36:46.026950	ff30496a	0	0	0.0000	CRASH	gen=974 glyphs=3
2026-03-14T07:36:46.027141	099964a4	0	0	0.0000	CRASH	gen=974 glyphs=4
2026-03-14T07:36:46.027334	099964a4	0	0	0.0000	CRASH	gen=974 glyphs=4
2026-03-14T07:36:46.027533	099964a4	0	0	0.0000	CRASH	gen=974 glyphs=4
2026-03-14T07:36:46.027808	099964a4	0	0	0.0000	CRASH	gen=975 glyphs=4
2026-03-14T07:36:46.028003	099964a4	0	0	0.0000	CRASH	gen=975 glyphs=4
2026-03-14T07:36:46.028196	099964a4	0	0	0.0000	CRASH	gen=975 glyphs=4
2026-03-14T07:36:46.028388	319402eb	0	0	0.0000	CRASH	gen=975 glyphs=4
2026-03-14T07:36:46.028585	099964a4	0	0	0.0000	CRASH	gen=975 glyphs=4
2026-03-14T07:36:46.028780	dcb1fb50	0	0	0.0000	CRASH	gen=975 glyphs=4
2026-03-14T07:36:46.028974	099964a4	0	0	0.0000	CRASH	gen=975 glyphs=4
2026-03-14T07:36:46.029166	a952630b	0	0	0.0000	CRASH	gen=975 glyphs=4
2026-03-14T07:36:46.029359	099964a4	0	0	0.0000	CRASH	gen=975 glyphs=4
2026-03-14T07:36:46.029553	80cef82b	0	0	0.0000	CRASH	gen=975 glyphs=4
2026-03-14T07:36:46.029822	099964a4	0	0	0.0000	CRASH	gen=976 glyphs=4
2026-03-14T07:36:46.030015	099964a4	0	0	0.0000	CRASH	gen=976 glyphs=4
2026-03-14T07:36:46.030209	099964a4	0	0	0.0000	CRASH	gen=976 glyphs=4
2026-03-14T07:36:46.030401	ff30496a	0	0	0.0000	CRASH	gen=976 glyphs=3
2026-03-14T07:36:46.030597	8da1f8d8	0	0	0.0000	CRASH	gen=976 glyphs=4
2026-03-14T07:36:46.030794	099964a4	0	0	0.0000	CRASH	gen=976 glyphs=4
2026-03-14T07:36:46.030992	80cef82b	0	0	0.0000	CRASH	gen=976 glyphs=4
2026-03-14T07:36:46.031189	229450d0	0	0	0.0000	CRASH	gen=976 glyphs=3
2026-03-14T07:36:46.031384	ce8bf825	0	0	0.0000	CRASH	gen=976 glyphs=3
2026-03-14T07:36:46.031582	099964a4	0	0	0.0000	CRASH	gen=976 glyphs=4
2026-03-14T07:36:46.031861	099964a4	0	0	0.0000	CRASH	gen=977 glyphs=4
2026-03-14T07:36:46.032061	099964a4	0	0	0.0000	CRASH	gen=977 glyphs=4
2026-03-14T07:36:46.032254	099964a4	0	0	0.0000	CRASH	gen=977 glyphs=4
2026-03-14T07:36:46.032448	099964a4	0	0	0.0000	CRASH	gen=977 glyphs=4
2026-03-14T07:36:46.032644	7ede4765	0	0	0.0000	CRASH	gen=977 glyphs=2
2026-03-14T07:36:46.032839	80cef82b	0	0	0.0000	CRASH	gen=977 glyphs=4
2026-03-14T07:36:46.033037	81e38642	0	0	0.0000	CRASH	gen=977 glyphs=3
2026-03-14T07:36:46.033231	cf93b656	0	0	0.0000	CRASH	gen=977 glyphs=3
2026-03-14T07:36:46.033425	099964a4	0	0	0.0000	CRASH	gen=977 glyphs=4
2026-03-14T07:36:46.033618	3a734398	0	0	0.0000	CRASH	gen=977 glyphs=4
2026-03-14T07:36:46.033892	099964a4	0	0	0.0000	CRASH	gen=978 glyphs=4
2026-03-14T07:36:46.034089	099964a4	0	0	0.0000	CRASH	gen=978 glyphs=4
2026-03-14T07:36:46.034281	099964a4	0	0	0.0000	CRASH	gen=978 glyphs=4
2026-03-14T07:36:46.034476	099964a4	0	0	0.0000	CRASH	gen=978 glyphs=4
2026-03-14T07:36:46.034670	af18fd23	0	0	0.0000	CRASH	gen=978 glyphs=4
2026-03-14T07:36:46.034862	363338a6	0	0	0.0000	CRASH	gen=978 glyphs=4
2026-03-14T07:36:46.035053	099964a4	0	0	0.0000	CRASH	gen=978 glyphs=4
2026-03-14T07:36:46.035248	3ca14993	0	0	0.0000	CRASH	gen=978 glyphs=4
2026-03-14T07:36:46.035441	099964a4	0	0	0.0000	CRASH	gen=978 glyphs=4
2026-03-14T07:36:46.035634	099964a4	0	0	0.0000	CRASH	gen=978 glyphs=4
2026-03-14T07:36:46.035916	099964a4	0	0	0.0000	CRASH	gen=979 glyphs=4
2026-03-14T07:36:46.036109	099964a4	0	0	0.0000	CRASH	gen=979 glyphs=4
2026-03-14T07:36:46.036310	8d5f1a9c	0	0	0.0000	CRASH	gen=979 glyphs=3
2026-03-14T07:36:46.036504	099964a4	0	0	0.0000	CRASH	gen=979 glyphs=4
2026-03-14T07:36:46.036702	099964a4	0	0	0.0000	CRASH	gen=979 glyphs=4
2026-03-14T07:36:46.036894	099964a4	0	0	0.0000	CRASH	gen=979 glyphs=4
2026-03-14T07:36:46.037084	35279218	0	0	0.0000	CRASH	gen=979 glyphs=3
2026-03-14T07:36:46.037280	099964a4	0	0	0.0000	CRASH	gen=979 glyphs=4
2026-03-14T07:36:46.037473	099964a4	0	0	0.0000	CRASH	gen=979 glyphs=4
2026-03-14T07:36:46.037668	26b350da	0	0	0.0000	CRASH	gen=979 glyphs=2
2026-03-14T07:36:46.037931	099964a4	0	0	0.0000	CRASH	gen=980 glyphs=4
2026-03-14T07:36:46.038123	099964a4	0	0	0.0000	CRASH	gen=980 glyphs=4
2026-03-14T07:36:46.038318	099964a4	0	0	0.0000	CRASH	gen=980 glyphs=4
2026-03-14T07:36:46.038509	099964a4	0	0	0.0000	CRASH	gen=980 glyphs=4
2026-03-14T07:36:46.038701	dcb1fb50	0	0	0.0000	CRASH	gen=980 glyphs=4
2026-03-14T07:36:46.038894	20cf2fa4	0	0	0.0000	CRASH	gen=980 glyphs=3
2026-03-14T07:36:46.039085	228f43df	0	0	0.0000	CRASH	gen=980 glyphs=3
2026-03-14T07:36:46.039279	099964a4	0	0	0.0000	CRASH	gen=980 glyphs=4
2026-03-14T07:36:46.039477	099964a4	0	0	0.0000	CRASH	gen=980 glyphs=4
2026-03-14T07:36:46.039673	099964a4	0	0	0.0000	CRASH	gen=980 glyphs=4
2026-03-14T07:36:46.039959	099964a4	0	0	0.0000	CRASH	gen=981 glyphs=4
2026-03-14T07:36:46.040155	099964a4	0	0	0.0000	CRASH	gen=981 glyphs=4
2026-03-14T07:36:46.040351	099964a4	0	0	0.0000	CRASH	gen=981 glyphs=4
2026-03-14T07:36:46.040550	dcb1fb50	0	0	0.0000	CRASH	gen=981 glyphs=4
2026-03-14T07:36:46.040745	099964a4	0	0	0.0000	CRASH	gen=981 glyphs=4
2026-03-14T07:36:46.040936	099964a4	0	0	0.0000	CRASH	gen=981 glyphs=4
2026-03-14T07:36:46.041126	099964a4	0	0	0.0000	CRASH	gen=981 glyphs=4
2026-03-14T07:36:46.041315	be724445	0	0	0.0000	CRASH	gen=981 glyphs=5
2026-03-14T07:36:46.041513	099964a4	0	0	0.0000	CRASH	gen=981 glyphs=4
2026-03-14T07:36:46.041706	099964a4	0	0	0.0000	CRASH	gen=981 glyphs=4
2026-03-14T07:36:46.041970	099964a4	0	0	0.0000	CRASH	gen=982 glyphs=4
2026-03-14T07:36:46.042161	099964a4	0	0	0.0000	CRASH	gen=982 glyphs=4
2026-03-14T07:36:46.042350	099964a4	0	0	0.0000	CRASH	gen=982 glyphs=4
2026-03-14T07:36:46.042543	3ca14993	0	0	0.0000	CRASH	gen=982 glyphs=4
2026-03-14T07:36:46.042739	643bdfa1	0	0	0.0000	CRASH	gen=982 glyphs=3
2026-03-14T07:36:46.042929	dcb1fb50	0	0	0.0000	CRASH	gen=982 glyphs=4
2026-03-14T07:36:46.043124	099964a4	0	0	0.0000	CRASH	gen=982 glyphs=4
2026-03-14T07:36:46.043316	099964a4	0	0	0.0000	CRASH	gen=982 glyphs=4
2026-03-14T07:36:46.043512	099964a4	0	0	0.0000	CRASH	gen=982 glyphs=4
2026-03-14T07:36:46.043711	099964a4	0	0	0.0000	CRASH	gen=982 glyphs=4
2026-03-14T07:36:46.043980	099964a4	0	0	0.0000	CRASH	gen=983 glyphs=4
2026-03-14T07:36:46.044174	099964a4	0	0	0.0000	CRASH	gen=983 glyphs=4
2026-03-14T07:36:46.044369	099964a4	0	0	0.0000	CRASH	gen=983 glyphs=4
