timestamp	program_hash	spirv_size	word_count	fitness	status	description
2026-03-14T03:01:40.631743	55d6c151	120	30	1.0000	DISCARD	gen=621 glyphs=4
2026-03-14T03:01:40.898449	67cb81be	120	30	1.0000	DISCARD	gen=665 glyphs=4
2026-03-14T03:01:43.308714	37f4017b	116	29	1.0000	DISCARD	gen=622 glyphs=4
2026-03-14T03:01:43.593790	b57e7176	120	30	1.0000	DISCARD	gen=665 glyphs=4
2026-03-14T03:01:46.015750	bfdf7cad	120	30	1.0000	DISCARD	gen=622 glyphs=4
2026-03-14T03:01:46.297814	19355583	120	30	1.0000	DISCARD	gen=666 glyphs=4
2026-03-14T03:01:48.708187	5a06ca32	120	30	1.0000	DISCARD	gen=622 glyphs=4
2026-03-14T03:01:48.976137	8aef8872	116	29	1.0000	DISCARD	gen=666 glyphs=4
2026-03-14T03:01:51.405902	cc532302	116	29	1.0000	DISCARD	gen=622 glyphs=4
2026-03-14T03:01:51.671047	30d5d95e	120	30	1.0000	DISCARD	gen=666 glyphs=4
2026-03-14T03:01:54.083057	fdb5d108	120	30	1.0000	DISCARD	gen=622 glyphs=4
2026-03-14T03:01:54.347874	8aef8872	116	29	1.0000	DISCARD	gen=666 glyphs=4
2026-03-14T03:01:56.791653	99edaf5a	116	29	1.0000	DISCARD	gen=622 glyphs=4
2026-03-14T03:01:57.062427	19355583	120	30	1.0000	DISCARD	gen=666 glyphs=4
2026-03-14T03:01:59.514387	fdb5d108	120	30	1.0000	DISCARD	gen=622 glyphs=4
2026-03-14T03:01:59.843488	0eaedb57	116	29	1.0000	DISCARD	gen=666 glyphs=4
2026-03-14T03:02:02.300754	37f4017b	116	29	1.0000	DISCARD	gen=622 glyphs=4
2026-03-14T03:02:02.570653	1e5f0e21	116	29	1.0000	DISCARD	gen=666 glyphs=4
2026-03-14T03:02:04.978164	fcfed408	116	29	0.9500	DISCARD	gen=622 glyphs=4
2026-03-14T03:02:05.236590	8aef8872	116	29	1.0000	DISCARD	gen=666 glyphs=4
2026-03-14T03:02:07.679837	79d028c8	116	29	0.9500	DISCARD	gen=622 glyphs=4
2026-03-14T03:02:07.948595	050862ad	120	30	1.0000	DISCARD	gen=666 glyphs=4
2026-03-14T03:02:10.321490	37f4017b	116	29	1.0000	DISCARD	gen=623 glyphs=4
2026-03-14T03:02:10.586301	ae44ace5	116	29	1.0000	DISCARD	gen=666 glyphs=4
2026-03-14T03:02:13.003630	bfdf7cad	120	30	1.0000	DISCARD	gen=623 glyphs=4
2026-03-14T03:02:13.267135	19355583	120	30	1.0000	DISCARD	gen=667 glyphs=4
2026-03-14T03:02:15.648903	5b9807ac	120	30	1.0000	DISCARD	gen=623 glyphs=4
2026-03-14T03:02:15.912819	8aef8872	116	29	1.0000	DISCARD	gen=667 glyphs=4
2026-03-14T03:02:18.319815	37f4017b	116	29	1.0000	DISCARD	gen=623 glyphs=4
2026-03-14T03:02:18.591347	b57e7176	120	30	1.0000	DISCARD	gen=667 glyphs=4
2026-03-14T03:02:21.014124	22a27ef1	116	29	1.0000	DISCARD	gen=623 glyphs=4
2026-03-14T03:02:21.268955	0e3171cf	120	30	1.0000	DISCARD	gen=667 glyphs=4
2026-03-14T03:02:23.676596	55d6c151	120	30	1.0000	DISCARD	gen=623 glyphs=4
2026-03-14T03:02:23.940575	fe34c20d	116	29	1.0000	DISCARD	gen=667 glyphs=4
2026-03-14T03:02:26.356956	55d6c151	120	30	1.0000	DISCARD	gen=623 glyphs=4
2026-03-14T03:02:26.640447	1e5f0e21	116	29	1.0000	DISCARD	gen=667 glyphs=4
2026-03-14T03:02:29.061075	7ca87b42	116	29	1.0000	DISCARD	gen=623 glyphs=4
2026-03-14T03:02:29.336355	e05308b8	116	29	1.0000	DISCARD	gen=667 glyphs=4
2026-03-14T03:02:31.826715	12b38c2d	116	29	1.0000	DISCARD	gen=623 glyphs=4
2026-03-14T03:02:32.106824	eca7ab6c	116	29	1.0000	DISCARD	gen=667 glyphs=4
2026-03-14T03:02:34.575293	7ca87b42	116	29	1.0000	DISCARD	gen=623 glyphs=4
2026-03-14T03:02:34.843883	0eaedb57	116	29	1.0000	DISCARD	gen=667 glyphs=4
2026-03-14T03:02:37.249290	37f4017b	116	29	1.0000	DISCARD	gen=624 glyphs=4
2026-03-14T03:02:37.519569	050862ad	120	30	1.0000	DISCARD	gen=667 glyphs=4
2026-03-14T03:02:39.930313	bfdf7cad	120	30	1.0000	DISCARD	gen=624 glyphs=4
2026-03-14T03:02:40.207626	19355583	120	30	1.0000	DISCARD	gen=668 glyphs=4
2026-03-14T03:02:42.621270	37f4017b	116	29	1.0000	DISCARD	gen=624 glyphs=4
2026-03-14T03:02:42.894448	8aef8872	116	29	1.0000	DISCARD	gen=668 glyphs=4
2026-03-14T03:02:45.309799	37f4017b	116	29	1.0000	DISCARD	gen=624 glyphs=4
2026-03-14T03:02:45.587510	67cb81be	120	30	1.0000	DISCARD	gen=668 glyphs=4
2026-03-14T03:02:47.997770	7ca87b42	116	29	1.0000	DISCARD	gen=624 glyphs=4
2026-03-14T03:02:48.257614	19355583	120	30	1.0000	DISCARD	gen=668 glyphs=4
2026-03-14T03:02:50.689150	a0b5fd5b	120	30	1.0000	DISCARD	gen=624 glyphs=4
2026-03-14T03:02:50.948819	67cb81be	120	30	1.0000	DISCARD	gen=668 glyphs=4
2026-03-14T03:02:53.370692	1d34459a	116	29	1.0000	DISCARD	gen=624 glyphs=4
2026-03-14T03:02:53.636674	6bc84540	116	29	1.0000	DISCARD	gen=668 glyphs=4
2026-03-14T03:02:56.047338	be5fb3cf	116	29	1.0000	DISCARD	gen=624 glyphs=4
2026-03-14T03:02:56.313945	875e0f8a	116	29	1.0000	DISCARD	gen=668 glyphs=4
2026-03-14T03:02:58.727254	5a06ca32	120	30	1.0000	DISCARD	gen=624 glyphs=4
2026-03-14T03:02:58.991322	d7c8681b	120	30	1.0000	DISCARD	gen=668 glyphs=4
2026-03-14T03:03:01.399806	71e2ba66	116	29	1.0000	DISCARD	gen=624 glyphs=4
2026-03-14T03:03:01.684840	b4e7fd82	116	29	0.9500	DISCARD	gen=668 glyphs=4
2026-03-14T03:03:04.177570	37f4017b	116	29	1.0000	DISCARD	gen=625 glyphs=4
2026-03-14T03:03:04.449342	67cb81be	120	30	1.0000	DISCARD	gen=668 glyphs=4
2026-03-14T03:03:06.883919	bfdf7cad	120	30	1.0000	DISCARD	gen=625 glyphs=4
2026-03-14T03:03:07.149333	19355583	120	30	1.0000	DISCARD	gen=669 glyphs=4
2026-03-14T03:03:09.577869	5a06ca32	120	30	1.0000	DISCARD	gen=625 glyphs=4
2026-03-14T03:03:09.850181	8aef8872	116	29	1.0000	DISCARD	gen=669 glyphs=4
2026-03-14T03:03:12.264450	5a06ca32	120	30	1.0000	DISCARD	gen=625 glyphs=4
2026-03-14T03:03:12.532900	8aef8872	116	29	1.0000	DISCARD	gen=669 glyphs=4
2026-03-14T03:03:14.935094	5a06ca32	120	30	1.0000	DISCARD	gen=625 glyphs=4
2026-03-14T03:03:15.204292	b7aed8e9	116	29	1.0000	DISCARD	gen=669 glyphs=4
2026-03-14T03:03:17.626805	1d34459a	116	29	1.0000	DISCARD	gen=625 glyphs=4
2026-03-14T03:03:17.891200	b727dbf8	116	29	1.0000	DISCARD	gen=669 glyphs=4
2026-03-14T03:03:20.305966	5b9807ac	120	30	1.0000	DISCARD	gen=625 glyphs=4
2026-03-14T03:03:20.562263	eca7ab6c	116	29	1.0000	DISCARD	gen=669 glyphs=4
2026-03-14T03:03:22.988927	15bacd84	116	29	0.9500	DISCARD	gen=625 glyphs=4
2026-03-14T03:03:23.253852	050862ad	120	30	1.0000	DISCARD	gen=669 glyphs=4
2026-03-14T03:03:25.687619	8e819e42	116	29	1.0000	DISCARD	gen=625 glyphs=4
2026-03-14T03:03:25.944273	0eaedb57	116	29	1.0000	DISCARD	gen=669 glyphs=4
2026-03-14T03:03:28.353091	fdb5d108	120	30	1.0000	DISCARD	gen=625 glyphs=4
2026-03-14T03:03:28.614872	5193a22a	116	29	1.0000	DISCARD	gen=669 glyphs=4
2026-03-14T03:03:31.059357	37f4017b	116	29	1.0000	DISCARD	gen=626 glyphs=4
2026-03-14T03:03:31.333440	a78f9454	120	30	1.0000	DISCARD	gen=669 glyphs=4
2026-03-14T03:03:33.736607	bfdf7cad	120	30	1.0000	DISCARD	gen=626 glyphs=4
2026-03-14T03:03:34.001534	19355583	120	30	1.0000	DISCARD	gen=670 glyphs=4
2026-03-14T03:03:36.508886	5a06ca32	120	30	1.0000	DISCARD	gen=626 glyphs=4
2026-03-14T03:03:36.797250	8aef8872	116	29	1.0000	DISCARD	gen=670 glyphs=4
2026-03-14T03:03:39.206330	4c9b0dd4	120	30	1.0000	DISCARD	gen=626 glyphs=4
2026-03-14T03:03:39.473407	0eaedb57	116	29	1.0000	DISCARD	gen=670 glyphs=4
2026-03-14T03:03:41.904980	37f4017b	116	29	1.0000	DISCARD	gen=626 glyphs=4
2026-03-14T03:03:42.173203	2fcabc31	120	30	1.0000	DISCARD	gen=670 glyphs=4
2026-03-14T03:03:44.586073	07cbe53f	116	29	1.0000	DISCARD	gen=626 glyphs=4
2026-03-14T03:03:44.851848	19355583	120	30	1.0000	DISCARD	gen=670 glyphs=4
2026-03-14T03:03:47.248217	fdb5d108	120	30	1.0000	DISCARD	gen=626 glyphs=4
2026-03-14T03:03:47.523229	8aef8872	116	29	1.0000	DISCARD	gen=670 glyphs=4
2026-03-14T03:03:49.931104	d11c1062	120	30	1.0000	DISCARD	gen=626 glyphs=4
2026-03-14T03:03:50.191967	9e34ede0	116	29	1.0000	DISCARD	gen=670 glyphs=4
2026-03-14T03:03:52.614384	bfdf7cad	120	30	1.0000	DISCARD	gen=626 glyphs=4
2026-03-14T03:03:52.886984	875e0f8a	116	29	1.0000	DISCARD	gen=670 glyphs=4
2026-03-14T03:03:55.326321	5a06ca32	120	30	1.0000	DISCARD	gen=626 glyphs=4
2026-03-14T03:03:55.590268	8aef8872	116	29	1.0000	DISCARD	gen=670 glyphs=4
2026-03-14T03:03:58.001586	37f4017b	116	29	1.0000	DISCARD	gen=627 glyphs=4
2026-03-14T03:03:58.266607	050862ad	120	30	1.0000	DISCARD	gen=670 glyphs=4
2026-03-14T03:04:00.677890	bfdf7cad	120	30	1.0000	DISCARD	gen=627 glyphs=4
2026-03-14T03:04:00.935937	19355583	120	30	1.0000	DISCARD	gen=671 glyphs=4
2026-03-14T03:04:03.356808	d0fa1b72	124	31	0.9500	DISCARD	gen=627 glyphs=4
2026-03-14T03:04:03.617387	8aef8872	116	29	1.0000	DISCARD	gen=671 glyphs=4
2026-03-14T03:04:06.024458	37f4017b	116	29	1.0000	DISCARD	gen=627 glyphs=4
2026-03-14T03:04:06.299945	8aef8872	116	29	1.0000	DISCARD	gen=671 glyphs=4
2026-03-14T03:04:08.821101	b887b73c	120	30	0.9500	DISCARD	gen=627 glyphs=4
2026-03-14T03:04:09.087695	0eaedb57	116	29	1.0000	DISCARD	gen=671 glyphs=4
2026-03-14T03:04:11.514817	37f4017b	116	29	1.0000	DISCARD	gen=627 glyphs=4
2026-03-14T03:04:11.786373	050862ad	120	30	1.0000	DISCARD	gen=671 glyphs=4
2026-03-14T03:04:14.211120	70ace4e2	120	30	0.9500	DISCARD	gen=627 glyphs=4
2026-03-14T03:04:14.470160	19355583	120	30	1.0000	DISCARD	gen=671 glyphs=4
2026-03-14T03:04:16.890842	f87250ae	116	29	1.0000	DISCARD	gen=627 glyphs=4
2026-03-14T03:04:17.164787	d5d0f959	120	30	1.0000	DISCARD	gen=671 glyphs=4
2026-03-14T03:04:19.602982	71e2ba66	116	29	1.0000	DISCARD	gen=627 glyphs=4
2026-03-14T03:04:19.875017	19355583	120	30	1.0000	DISCARD	gen=671 glyphs=4
2026-03-14T03:04:22.282255	8d9138de	120	30	1.0000	DISCARD	gen=627 glyphs=4
2026-03-14T03:04:22.548787	1e5f0e21	116	29	1.0000	DISCARD	gen=671 glyphs=4
2026-03-14T03:04:24.968962	37f4017b	116	29	1.0000	DISCARD	gen=628 glyphs=4
2026-03-14T03:04:25.234321	19355583	120	30	1.0000	DISCARD	gen=671 glyphs=4
2026-03-14T03:04:27.644355	bfdf7cad	120	30	1.0000	DISCARD	gen=628 glyphs=4
2026-03-14T03:04:27.912077	19355583	120	30	1.0000	DISCARD	gen=672 glyphs=4
2026-03-14T03:04:30.312126	37f4017b	116	29	1.0000	DISCARD	gen=628 glyphs=4
2026-03-14T03:04:30.587413	8aef8872	116	29	1.0000	DISCARD	gen=672 glyphs=4
2026-03-14T03:04:33.005077	37f4017b	116	29	1.0000	DISCARD	gen=628 glyphs=4
2026-03-14T03:04:33.271939	b57e7176	120	30	1.0000	DISCARD	gen=672 glyphs=4
2026-03-14T03:04:35.710166	06d9b0b8	120	30	1.0000	DISCARD	gen=628 glyphs=4
2026-03-14T03:04:35.979745	997eb48d	116	29	1.0000	DISCARD	gen=672 glyphs=4
2026-03-14T03:04:38.396995	2701cb73	116	29	1.0000	DISCARD	gen=628 glyphs=4
2026-03-14T03:04:38.668028	9e34ede0	116	29	1.0000	DISCARD	gen=672 glyphs=4
2026-03-14T03:04:41.097947	37f4017b	116	29	1.0000	DISCARD	gen=628 glyphs=4
2026-03-14T03:04:41.366316	9e34ede0	116	29	1.0000	DISCARD	gen=672 glyphs=4
2026-03-14T03:04:43.774492	4e54b128	116	29	0.9500	DISCARD	gen=628 glyphs=4
2026-03-14T03:04:44.052568	36984471	120	30	1.0000	DISCARD	gen=672 glyphs=4
2026-03-14T03:04:46.474819	37f4017b	116	29	1.0000	DISCARD	gen=628 glyphs=4
2026-03-14T03:04:46.749604	071561f8	116	29	1.0000	DISCARD	gen=672 glyphs=4
2026-03-14T03:04:49.178079	37f4017b	116	29	1.0000	DISCARD	gen=628 glyphs=4
2026-03-14T03:04:49.443901	c19c119a	120	30	1.0000	DISCARD	gen=672 glyphs=4
2026-03-14T03:04:51.838194	37f4017b	116	29	1.0000	DISCARD	gen=629 glyphs=4
2026-03-14T03:04:52.110312	c51384eb	116	29	1.0000	DISCARD	gen=672 glyphs=4
2026-03-14T03:04:54.519124	bfdf7cad	120	30	1.0000	DISCARD	gen=629 glyphs=4
2026-03-14T03:04:54.793346	19355583	120	30	1.0000	DISCARD	gen=673 glyphs=4
2026-03-14T03:04:57.205063	fdb5d108	120	30	1.0000	DISCARD	gen=629 glyphs=4
2026-03-14T03:04:57.477706	8aef8872	116	29	1.0000	DISCARD	gen=673 glyphs=4
2026-03-14T03:05:00.015056	7ca87b42	116	29	1.0000	DISCARD	gen=629 glyphs=4
2026-03-14T03:05:00.295158	e8c7f6cf	120	30	1.0000	DISCARD	gen=673 glyphs=4
2026-03-14T03:05:02.868020	fdb5d108	120	30	1.0000	DISCARD	gen=629 glyphs=4
2026-03-14T03:05:03.146292	02f8adf4	116	29	1.0000	DISCARD	gen=673 glyphs=4
2026-03-14T03:05:05.646942	37f4017b	116	29	1.0000	DISCARD	gen=629 glyphs=4
2026-03-14T03:05:05.940201	050862ad	120	30	1.0000	DISCARD	gen=673 glyphs=4
2026-03-14T03:05:08.459329	9bb8d118	116	29	1.0000	DISCARD	gen=629 glyphs=4
2026-03-14T03:05:08.735921	875e0f8a	116	29	1.0000	DISCARD	gen=673 glyphs=4
2026-03-14T03:05:11.284645	55d6c151	120	30	1.0000	DISCARD	gen=629 glyphs=4
2026-03-14T03:05:11.549293	19355583	120	30	1.0000	DISCARD	gen=673 glyphs=4
2026-03-14T03:05:13.992269	4a315dc2	116	29	1.0000	DISCARD	gen=629 glyphs=4
2026-03-14T03:05:14.264091	6771158f	120	30	1.0000	DISCARD	gen=673 glyphs=4
2026-03-14T03:05:16.703662	12b38c2d	116	29	1.0000	DISCARD	gen=629 glyphs=4
2026-03-14T03:05:16.970824	e8c7f6cf	120	30	1.0000	DISCARD	gen=673 glyphs=4
2026-03-14T03:05:19.397350	37f4017b	116	29	1.0000	DISCARD	gen=630 glyphs=4
2026-03-14T03:05:19.675452	0eaedb57	116	29	1.0000	DISCARD	gen=673 glyphs=4
2026-03-14T03:05:22.123225	bfdf7cad	120	30	1.0000	DISCARD	gen=630 glyphs=4
2026-03-14T03:05:22.381152	19355583	120	30	1.0000	DISCARD	gen=674 glyphs=4
2026-03-14T03:05:24.811418	08fe7999	116	29	1.0000	DISCARD	gen=630 glyphs=4
2026-03-14T03:05:25.082580	8aef8872	116	29	1.0000	DISCARD	gen=674 glyphs=4
2026-03-14T03:05:27.492101	37f4017b	116	29	1.0000	DISCARD	gen=630 glyphs=4
2026-03-14T03:05:27.766847	d7c8681b	120	30	1.0000	DISCARD	gen=674 glyphs=4
2026-03-14T03:05:30.207284	12156351	120	30	1.0000	DISCARD	gen=630 glyphs=4
2026-03-14T03:05:30.473456	a78bf096	116	29	1.0000	DISCARD	gen=674 glyphs=4
2026-03-14T03:05:32.904046	d7a755a3	120	30	1.0000	DISCARD	gen=630 glyphs=4
2026-03-14T03:05:33.170189	c8e8fdd1	116	29	1.0000	DISCARD	gen=674 glyphs=4
2026-03-14T03:05:35.593706	37f4017b	116	29	1.0000	DISCARD	gen=630 glyphs=4
2026-03-14T03:05:35.863129	e2cd28ea	120	30	1.0000	DISCARD	gen=674 glyphs=4
2026-03-14T03:05:38.300825	d11c1062	120	30	1.0000	DISCARD	gen=630 glyphs=4
2026-03-14T03:05:38.569503	050862ad	120	30	1.0000	DISCARD	gen=674 glyphs=4
2026-03-14T03:05:41.011600	473e1382	116	29	1.0000	DISCARD	gen=630 glyphs=4
2026-03-14T03:05:41.286288	0eaedb57	116	29	1.0000	DISCARD	gen=674 glyphs=4
2026-03-14T03:05:43.809288	a034ea8a	116	29	0.9500	DISCARD	gen=630 glyphs=4
2026-03-14T03:05:44.082496	d7c8681b	120	30	1.0000	DISCARD	gen=674 glyphs=4
2026-03-14T03:05:46.518108	37f4017b	116	29	1.0000	DISCARD	gen=631 glyphs=4
2026-03-14T03:05:46.798365	eca7ab6c	116	29	1.0000	DISCARD	gen=674 glyphs=4
2026-03-14T03:05:49.246570	bfdf7cad	120	30	1.0000	DISCARD	gen=631 glyphs=4
2026-03-14T03:05:49.537618	19355583	120	30	1.0000	DISCARD	gen=675 glyphs=4
2026-03-14T03:05:51.989680	7b1120a6	116	29	0.9500	DISCARD	gen=631 glyphs=4
2026-03-14T03:05:52.270768	8aef8872	116	29	1.0000	DISCARD	gen=675 glyphs=4
2026-03-14T03:05:54.697748	37f4017b	116	29	1.0000	DISCARD	gen=631 glyphs=4
2026-03-14T03:05:54.976103	0eaedb57	116	29	1.0000	DISCARD	gen=675 glyphs=4
2026-03-14T03:05:57.400343	d7b0ff30	116	29	1.0000	DISCARD	gen=631 glyphs=4
2026-03-14T03:05:57.661991	0eaedb57	116	29	1.0000	DISCARD	gen=675 glyphs=4
2026-03-14T03:06:00.098602	2701cb73	116	29	1.0000	DISCARD	gen=631 glyphs=4
2026-03-14T03:06:00.376973	b1adbaa5	116	29	1.0000	DISCARD	gen=675 glyphs=4
2026-03-14T03:06:02.837100	37f4017b	116	29	1.0000	DISCARD	gen=631 glyphs=4
2026-03-14T03:06:03.118983	085a6d11	116	29	1.0000	DISCARD	gen=675 glyphs=4
2026-03-14T03:06:05.566455	7ca87b42	116	29	1.0000	DISCARD	gen=631 glyphs=4
2026-03-14T03:06:05.845119	8aef8872	116	29	1.0000	DISCARD	gen=675 glyphs=4
2026-03-14T03:06:08.262845	1d34459a	116	29	1.0000	DISCARD	gen=631 glyphs=4
2026-03-14T03:06:08.539954	050862ad	120	30	1.0000	DISCARD	gen=675 glyphs=4
2026-03-14T03:06:10.973761	5a06ca32	120	30	1.0000	DISCARD	gen=631 glyphs=4
2026-03-14T03:06:11.253014	b57e7176	120	30	1.0000	DISCARD	gen=675 glyphs=4
2026-03-14T03:06:13.701417	37f4017b	116	29	1.0000	DISCARD	gen=632 glyphs=4
2026-03-14T03:06:14.021633	19355583	120	30	1.0000	DISCARD	gen=675 glyphs=4
2026-03-14T03:06:16.505818	bfdf7cad	120	30	1.0000	DISCARD	gen=632 glyphs=4
2026-03-14T03:06:16.777236	19355583	120	30	1.0000	DISCARD	gen=676 glyphs=4
2026-03-14T03:06:19.250666	c147f45a	116	29	1.0000	DISCARD	gen=632 glyphs=4
2026-03-14T03:06:19.512101	8aef8872	116	29	1.0000	DISCARD	gen=676 glyphs=4
2026-03-14T03:06:21.955833	37f4017b	116	29	1.0000	DISCARD	gen=632 glyphs=4
2026-03-14T03:06:22.215601	19355583	120	30	1.0000	DISCARD	gen=676 glyphs=4
2026-03-14T03:06:24.644280	e561d2e3	116	29	1.0000	DISCARD	gen=632 glyphs=4
2026-03-14T03:06:24.906690	e2cd28ea	120	30	1.0000	DISCARD	gen=676 glyphs=4
2026-03-14T03:06:27.354665	5a06ca32	120	30	1.0000	DISCARD	gen=632 glyphs=4
2026-03-14T03:06:27.626050	3bdbd40d	116	29	1.0000	DISCARD	gen=676 glyphs=4
2026-03-14T03:06:30.087825	37f4017b	116	29	1.0000	DISCARD	gen=632 glyphs=4
2026-03-14T03:06:30.364126	8aef8872	116	29	1.0000	DISCARD	gen=676 glyphs=4
2026-03-14T03:06:32.806038	55d6c151	120	30	1.0000	DISCARD	gen=632 glyphs=4
2026-03-14T03:06:33.067640	0eaedb57	116	29	1.0000	DISCARD	gen=676 glyphs=4
2026-03-14T03:06:35.519007	7ca87b42	116	29	1.0000	DISCARD	gen=632 glyphs=4
2026-03-14T03:06:35.787585	a78f9454	120	30	1.0000	DISCARD	gen=676 glyphs=4
2026-03-14T03:06:38.214983	71e2ba66	116	29	1.0000	DISCARD	gen=632 glyphs=4
2026-03-14T03:06:38.480914	0eaedb57	116	29	1.0000	DISCARD	gen=676 glyphs=4
2026-03-14T03:06:40.911136	37f4017b	116	29	1.0000	DISCARD	gen=633 glyphs=4
2026-03-14T03:06:41.172533	f9a9fcb8	116	29	1.0000	DISCARD	gen=676 glyphs=4
2026-03-14T03:06:43.606384	bfdf7cad	120	30	1.0000	DISCARD	gen=633 glyphs=4
2026-03-14T03:06:43.870865	19355583	120	30	1.0000	DISCARD	gen=677 glyphs=4
2026-03-14T03:06:46.381744	5a06ca32	120	30	1.0000	DISCARD	gen=633 glyphs=4
2026-03-14T03:06:46.685239	8aef8872	116	29	1.0000	DISCARD	gen=677 glyphs=4
2026-03-14T03:06:49.113053	5a06ca32	120	30	1.0000	DISCARD	gen=633 glyphs=4
2026-03-14T03:06:49.383741	1e5f0e21	116	29	1.0000	DISCARD	gen=677 glyphs=4
2026-03-14T03:06:51.830890	7ca87b42	116	29	1.0000	DISCARD	gen=633 glyphs=4
2026-03-14T03:06:52.089710	875e0f8a	116	29	1.0000	DISCARD	gen=677 glyphs=4
2026-03-14T03:06:54.500949	5a06ca32	120	30	1.0000	DISCARD	gen=633 glyphs=4
2026-03-14T03:06:54.768915	b7aed8e9	116	29	1.0000	DISCARD	gen=677 glyphs=4
2026-03-14T03:06:57.206201	55d6c151	120	30	1.0000	DISCARD	gen=633 glyphs=4
2026-03-14T03:06:57.484208	19355583	120	30	1.0000	DISCARD	gen=677 glyphs=4
2026-03-14T03:06:59.909871	bfdf7cad	120	30	1.0000	DISCARD	gen=633 glyphs=4
2026-03-14T03:07:00.185459	0eaedb57	116	29	1.0000	DISCARD	gen=677 glyphs=4
2026-03-14T03:07:02.611104	4c9b0dd4	120	30	1.0000	DISCARD	gen=633 glyphs=4
2026-03-14T03:07:02.886527	7dadf638	120	30	1.0000	DISCARD	gen=677 glyphs=4
2026-03-14T03:07:05.349569	08d4912e	120	30	1.0000	DISCARD	gen=633 glyphs=4
2026-03-14T03:07:05.627276	d7c8681b	120	30	1.0000	DISCARD	gen=677 glyphs=4
2026-03-14T03:07:08.070946	37f4017b	116	29	1.0000	DISCARD	gen=634 glyphs=4
2026-03-14T03:07:08.348631	0eaedb57	116	29	1.0000	DISCARD	gen=677 glyphs=4
2026-03-14T03:07:10.769700	bfdf7cad	120	30	1.0000	DISCARD	gen=634 glyphs=4
2026-03-14T03:07:11.052300	19355583	120	30	1.0000	DISCARD	gen=678 glyphs=4
2026-03-14T03:07:13.500538	3b1cd628	120	30	1.0000	DISCARD	gen=634 glyphs=4
2026-03-14T03:07:13.769137	8aef8872	116	29	1.0000	DISCARD	gen=678 glyphs=4
2026-03-14T03:07:16.199778	37f4017b	116	29	1.0000	DISCARD	gen=634 glyphs=4
2026-03-14T03:07:16.468632	e2958d85	120	30	1.0000	DISCARD	gen=678 glyphs=4
2026-03-14T03:07:18.968699	37f4017b	116	29	1.0000	DISCARD	gen=634 glyphs=4
2026-03-14T03:07:19.245198	e2cd28ea	120	30	1.0000	DISCARD	gen=678 glyphs=4
2026-03-14T03:07:21.673523	fdb5d108	120	30	1.0000	DISCARD	gen=634 glyphs=4
2026-03-14T03:07:21.937305	43b06c00	120	30	1.0000	DISCARD	gen=678 glyphs=4
2026-03-14T03:07:24.351704	f8e0ac61	116	29	1.0000	DISCARD	gen=634 glyphs=4
2026-03-14T03:07:24.624383	e2cd28ea	120	30	1.0000	DISCARD	gen=678 glyphs=4
2026-03-14T03:07:27.038361	fdb5d108	120	30	1.0000	DISCARD	gen=634 glyphs=4
2026-03-14T03:07:27.297322	1e5f0e21	116	29	1.0000	DISCARD	gen=678 glyphs=4
2026-03-14T03:07:29.693112	55d6c151	120	30	1.0000	DISCARD	gen=634 glyphs=4
2026-03-14T03:07:29.948935	a78f9454	120	30	1.0000	DISCARD	gen=678 glyphs=4
2026-03-14T03:07:32.342789	2f13408a	116	29	1.0000	DISCARD	gen=634 glyphs=4
2026-03-14T03:07:32.619035	19355583	120	30	1.0000	DISCARD	gen=678 glyphs=4
2026-03-14T03:07:35.033477	37f4017b	116	29	1.0000	DISCARD	gen=635 glyphs=4
2026-03-14T03:07:35.304576	050862ad	120	30	1.0000	DISCARD	gen=678 glyphs=4
2026-03-14T03:07:37.715007	bfdf7cad	120	30	1.0000	DISCARD	gen=635 glyphs=4
2026-03-14T03:07:37.971689	19355583	120	30	1.0000	DISCARD	gen=679 glyphs=4
2026-03-14T03:07:40.424438	16b58d25	120	30	1.0000	DISCARD	gen=635 glyphs=4
2026-03-14T03:07:40.683103	8aef8872	116	29	1.0000	DISCARD	gen=679 glyphs=4
2026-03-14T03:07:43.084035	14f700d8	116	29	1.0000	DISCARD	gen=635 glyphs=4
2026-03-14T03:07:43.353625	e880a2fe	120	30	1.0000	DISCARD	gen=679 glyphs=4
2026-03-14T03:07:45.759078	8b00013b	120	30	1.0000	DISCARD	gen=635 glyphs=4
2026-03-14T03:07:46.020712	b57e7176	120	30	1.0000	DISCARD	gen=679 glyphs=4
2026-03-14T03:07:48.430884	5b9807ac	120	30	1.0000	DISCARD	gen=635 glyphs=4
2026-03-14T03:07:48.692298	8aef8872	116	29	1.0000	DISCARD	gen=679 glyphs=4
2026-03-14T03:07:51.185538	37f4017b	116	29	1.0000	DISCARD	gen=635 glyphs=4
2026-03-14T03:07:51.458152	0eaedb57	116	29	1.0000	DISCARD	gen=679 glyphs=4
2026-03-14T03:07:53.856646	5a06ca32	120	30	1.0000	DISCARD	gen=635 glyphs=4
2026-03-14T03:07:54.117140	67cb81be	120	30	1.0000	DISCARD	gen=679 glyphs=4
2026-03-14T03:07:56.543580	71e2ba66	116	29	1.0000	DISCARD	gen=635 glyphs=4
2026-03-14T03:07:56.810454	d44b3cf4	116	29	1.0000	DISCARD	gen=679 glyphs=4
2026-03-14T03:07:59.227121	653e4fe5	124	31	0.9500	DISCARD	gen=635 glyphs=4
2026-03-14T03:07:59.505945	050862ad	120	30	1.0000	DISCARD	gen=679 glyphs=4
2026-03-14T03:08:01.912784	37f4017b	116	29	1.0000	DISCARD	gen=636 glyphs=4
2026-03-14T03:08:02.189622	bb622ea2	120	30	1.0000	DISCARD	gen=679 glyphs=4
2026-03-14T03:08:04.614462	bfdf7cad	120	30	1.0000	DISCARD	gen=636 glyphs=4
2026-03-14T03:08:04.882869	19355583	120	30	1.0000	DISCARD	gen=680 glyphs=4
2026-03-14T03:08:07.282275	5a06ca32	120	30	1.0000	DISCARD	gen=636 glyphs=4
2026-03-14T03:08:07.560479	8aef8872	116	29	1.0000	DISCARD	gen=680 glyphs=4
2026-03-14T03:08:09.972662	7b8da31c	116	29	1.0000	DISCARD	gen=636 glyphs=4
2026-03-14T03:08:10.232417	8aef8872	116	29	1.0000	DISCARD	gen=680 glyphs=4
2026-03-14T03:08:12.661152	924cdff3	120	30	1.0000	DISCARD	gen=636 glyphs=4
2026-03-14T03:08:12.927305	f9d63a2d	116	29	1.0000	DISCARD	gen=680 glyphs=4
