timestamp	program_hash	spirv_size	word_count	fitness	status	description
2026-03-13T23:27:56.154403	55d6c151	120	30	1.0000	DISCARD	gen=154 glyphs=4
2026-03-13T23:27:56.432393	acd7eab0	120	30	1.0000	DISCARD	gen=198 glyphs=4
2026-03-13T23:27:58.926352	9d66d155	120	30	0.9500	DISCARD	gen=154 glyphs=4
2026-03-13T23:27:59.198154	407b6ab8	120	30	1.0000	DISCARD	gen=198 glyphs=4
2026-03-13T23:28:01.662970	bcdb90e3	120	30	1.0000	DISCARD	gen=154 glyphs=4
2026-03-13T23:28:01.945120	9e34ede0	116	29	1.0000	DISCARD	gen=198 glyphs=4
2026-03-13T23:28:04.403952	37f4017b	116	29	1.0000	DISCARD	gen=155 glyphs=4
2026-03-13T23:28:04.679491	b7aed8e9	116	29	1.0000	DISCARD	gen=198 glyphs=4
2026-03-13T23:28:07.154990	bfdf7cad	120	30	1.0000	DISCARD	gen=155 glyphs=4
2026-03-13T23:28:07.431127	19355583	120	30	1.0000	DISCARD	gen=199 glyphs=4
2026-03-13T23:28:09.916256	eb36d59b	120	30	1.0000	DISCARD	gen=155 glyphs=4
2026-03-13T23:28:10.180783	8aef8872	116	29	1.0000	DISCARD	gen=199 glyphs=4
2026-03-13T23:28:12.650297	5ff24edb	120	30	1.0000	DISCARD	gen=155 glyphs=4
2026-03-13T23:28:12.922167	50dc991d	116	29	1.0000	DISCARD	gen=199 glyphs=4
2026-03-13T23:28:15.390102	d11c1062	120	30	1.0000	DISCARD	gen=155 glyphs=4
2026-03-13T23:28:15.673194	0eaedb57	116	29	1.0000	DISCARD	gen=199 glyphs=4
2026-03-13T23:28:18.125618	5a06ca32	120	30	1.0000	DISCARD	gen=155 glyphs=4
2026-03-13T23:28:18.402050	19355583	120	30	1.0000	DISCARD	gen=199 glyphs=4
2026-03-13T23:28:20.921968	1d34459a	116	29	1.0000	DISCARD	gen=155 glyphs=4
2026-03-13T23:28:21.196706	3b4b4bd9	124	31	0.9500	DISCARD	gen=199 glyphs=4
2026-03-13T23:28:23.684111	37f4017b	116	29	1.0000	DISCARD	gen=155 glyphs=4
2026-03-13T23:28:23.944933	ff21ecfe	116	29	1.0000	DISCARD	gen=199 glyphs=4
2026-03-13T23:28:26.401066	2701cb73	116	29	1.0000	DISCARD	gen=155 glyphs=4
2026-03-13T23:28:26.669857	19355583	120	30	1.0000	DISCARD	gen=199 glyphs=4
2026-03-13T23:28:29.129644	12b38c2d	116	29	1.0000	DISCARD	gen=155 glyphs=4
2026-03-13T23:28:29.398210	01bf1ad6	116	29	1.0000	DISCARD	gen=199 glyphs=4
2026-03-13T23:28:31.825579	37f4017b	116	29	1.0000	DISCARD	gen=156 glyphs=4
2026-03-13T23:28:32.099671	30b0f381	120	30	1.0000	DISCARD	gen=199 glyphs=4
2026-03-13T23:28:34.523813	bfdf7cad	120	30	1.0000	DISCARD	gen=156 glyphs=4
2026-03-13T23:28:34.794634	19355583	120	30	1.0000	DISCARD	gen=200 glyphs=4
2026-03-13T23:28:37.224357	34ae4cfc	120	30	0.9500	DISCARD	gen=156 glyphs=4
2026-03-13T23:28:37.501612	8aef8872	116	29	1.0000	DISCARD	gen=200 glyphs=4
2026-03-13T23:28:39.978662	5b9807ac	120	30	1.0000	DISCARD	gen=156 glyphs=4
2026-03-13T23:28:40.246160	253c10bc	116	29	1.0000	DISCARD	gen=200 glyphs=4
2026-03-13T23:28:42.693768	53df21ae	116	29	1.0000	DISCARD	gen=156 glyphs=4
2026-03-13T23:28:42.965252	19355583	120	30	1.0000	DISCARD	gen=200 glyphs=4
2026-03-13T23:28:45.451161	fdb5d108	120	30	1.0000	DISCARD	gen=156 glyphs=4
2026-03-13T23:28:45.742552	eca7ab6c	116	29	1.0000	DISCARD	gen=200 glyphs=4
2026-03-13T23:28:48.203878	37f4017b	116	29	1.0000	DISCARD	gen=156 glyphs=4
2026-03-13T23:28:48.475186	8aef8872	116	29	1.0000	DISCARD	gen=200 glyphs=4
2026-03-13T23:28:50.959428	2befa1e3	116	29	0.9500	DISCARD	gen=156 glyphs=4
2026-03-13T23:28:51.219054	0eaedb57	116	29	1.0000	DISCARD	gen=200 glyphs=4
2026-03-13T23:28:53.711597	5a06ca32	120	30	1.0000	DISCARD	gen=156 glyphs=4
2026-03-13T23:28:53.982167	9d0e4891	120	30	1.0000	DISCARD	gen=200 glyphs=4
2026-03-13T23:28:56.441753	37f4017b	116	29	1.0000	DISCARD	gen=156 glyphs=4
2026-03-13T23:28:56.733150	19355583	120	30	1.0000	DISCARD	gen=200 glyphs=4
2026-03-13T23:28:59.184347	37f4017b	116	29	1.0000	DISCARD	gen=157 glyphs=4
2026-03-13T23:28:59.466033	0eaedb57	116	29	1.0000	DISCARD	gen=200 glyphs=4
2026-03-13T23:29:01.889444	bfdf7cad	120	30	1.0000	DISCARD	gen=157 glyphs=4
2026-03-13T23:29:02.155466	19355583	120	30	1.0000	DISCARD	gen=201 glyphs=4
2026-03-13T23:29:04.607276	c2fbef33	116	29	0.9500	DISCARD	gen=157 glyphs=4
2026-03-13T23:29:04.874797	8aef8872	116	29	1.0000	DISCARD	gen=201 glyphs=4
2026-03-13T23:29:07.324597	5a06ca32	120	30	1.0000	DISCARD	gen=157 glyphs=4
2026-03-13T23:29:07.588802	19355583	120	30	1.0000	DISCARD	gen=201 glyphs=4
2026-03-13T23:29:10.032015	b5b8beec	116	29	1.0000	DISCARD	gen=157 glyphs=4
2026-03-13T23:29:10.298177	0eaedb57	116	29	1.0000	DISCARD	gen=201 glyphs=4
2026-03-13T23:29:12.752851	8bd3ee89	120	30	1.0000	DISCARD	gen=157 glyphs=4
2026-03-13T23:29:13.026728	b57e7176	120	30	1.0000	DISCARD	gen=201 glyphs=4
2026-03-13T23:29:15.457379	5fa8971d	116	29	1.0000	DISCARD	gen=157 glyphs=4
2026-03-13T23:29:15.730826	0eaedb57	116	29	1.0000	DISCARD	gen=201 glyphs=4
2026-03-13T23:29:18.174514	4c9b0dd4	120	30	1.0000	DISCARD	gen=157 glyphs=4
2026-03-13T23:29:18.442589	8aef8872	116	29	1.0000	DISCARD	gen=201 glyphs=4
2026-03-13T23:29:20.864265	fdb5d108	120	30	1.0000	DISCARD	gen=157 glyphs=4
2026-03-13T23:29:21.138625	fcdd9b3f	116	29	1.0000	DISCARD	gen=201 glyphs=4
2026-03-13T23:29:23.616407	63d47295	116	29	1.0000	DISCARD	gen=157 glyphs=4
2026-03-13T23:29:23.898970	0a61c9e2	120	30	1.0000	DISCARD	gen=201 glyphs=4
2026-03-13T23:29:26.438444	37f4017b	116	29	1.0000	DISCARD	gen=158 glyphs=4
2026-03-13T23:29:26.702808	e8c7f6cf	120	30	1.0000	DISCARD	gen=201 glyphs=4
2026-03-13T23:29:29.135036	bfdf7cad	120	30	1.0000	DISCARD	gen=158 glyphs=4
2026-03-13T23:29:29.404345	19355583	120	30	1.0000	DISCARD	gen=202 glyphs=4
2026-03-13T23:29:31.852769	37f4017b	116	29	1.0000	DISCARD	gen=158 glyphs=4
2026-03-13T23:29:32.124206	8aef8872	116	29	1.0000	DISCARD	gen=202 glyphs=4
2026-03-13T23:29:34.577166	4c9b0dd4	120	30	1.0000	DISCARD	gen=158 glyphs=4
2026-03-13T23:29:34.848444	ae44ace5	116	29	1.0000	DISCARD	gen=202 glyphs=4
2026-03-13T23:29:37.286944	02838069	120	30	1.0000	DISCARD	gen=158 glyphs=4
2026-03-13T23:29:37.555402	e8c7f6cf	120	30	1.0000	DISCARD	gen=202 glyphs=4
2026-03-13T23:29:39.991420	8613405e	116	29	1.0000	DISCARD	gen=158 glyphs=4
2026-03-13T23:29:40.251806	8aef8872	116	29	1.0000	DISCARD	gen=202 glyphs=4
2026-03-13T23:29:42.715428	bfdf7cad	120	30	1.0000	DISCARD	gen=158 glyphs=4
2026-03-13T23:29:42.990774	0929db66	116	29	1.0000	DISCARD	gen=202 glyphs=4
2026-03-13T23:29:45.428476	5a06ca32	120	30	1.0000	DISCARD	gen=158 glyphs=4
2026-03-13T23:29:45.701575	e8c7f6cf	120	30	1.0000	DISCARD	gen=202 glyphs=4
2026-03-13T23:29:48.109419	bfdf7cad	120	30	1.0000	DISCARD	gen=158 glyphs=4
2026-03-13T23:29:48.374052	50dc991d	116	29	1.0000	DISCARD	gen=202 glyphs=4
2026-03-13T23:29:50.804758	5a06ca32	120	30	1.0000	DISCARD	gen=158 glyphs=4
2026-03-13T23:29:51.072014	8aef8872	116	29	1.0000	DISCARD	gen=202 glyphs=4
2026-03-13T23:29:53.487354	37f4017b	116	29	1.0000	DISCARD	gen=159 glyphs=4
2026-03-13T23:29:53.779667	610717ac	120	30	1.0000	DISCARD	gen=202 glyphs=4
2026-03-13T23:29:56.286168	bfdf7cad	120	30	1.0000	DISCARD	gen=159 glyphs=4
2026-03-13T23:29:56.579024	19355583	120	30	1.0000	DISCARD	gen=203 glyphs=4
2026-03-13T23:29:59.038816	e1858acd	120	30	1.0000	DISCARD	gen=159 glyphs=4
2026-03-13T23:29:59.317013	8aef8872	116	29	1.0000	DISCARD	gen=203 glyphs=4
2026-03-13T23:30:01.792478	65313e69	116	29	1.0000	DISCARD	gen=159 glyphs=4
2026-03-13T23:30:02.064300	d7c8681b	120	30	1.0000	DISCARD	gen=203 glyphs=4
2026-03-13T23:30:04.507962	5a06ca32	120	30	1.0000	DISCARD	gen=159 glyphs=4
2026-03-13T23:30:04.775718	8aef8872	116	29	1.0000	DISCARD	gen=203 glyphs=4
2026-03-13T23:30:07.237482	12b38c2d	116	29	1.0000	DISCARD	gen=159 glyphs=4
2026-03-13T23:30:07.508299	79cbc53c	116	29	1.0000	DISCARD	gen=203 glyphs=4
2026-03-13T23:30:10.005269	4dc0ebde	116	29	0.9500	DISCARD	gen=159 glyphs=4
2026-03-13T23:30:10.272063	b57e7176	120	30	1.0000	DISCARD	gen=203 glyphs=4
2026-03-13T23:30:12.749874	fdb5d108	120	30	1.0000	DISCARD	gen=159 glyphs=4
2026-03-13T23:30:13.030981	8aef8872	116	29	1.0000	DISCARD	gen=203 glyphs=4
2026-03-13T23:30:15.503652	37f4017b	116	29	1.0000	DISCARD	gen=159 glyphs=4
2026-03-13T23:30:15.777043	8aef8872	116	29	1.0000	DISCARD	gen=203 glyphs=4
2026-03-13T23:30:18.229301	fdb5d108	120	30	1.0000	DISCARD	gen=159 glyphs=4
2026-03-13T23:30:18.512315	eca7ab6c	116	29	1.0000	DISCARD	gen=203 glyphs=4
2026-03-13T23:30:20.977391	37f4017b	116	29	1.0000	DISCARD	gen=160 glyphs=4
2026-03-13T23:30:21.247037	19355583	120	30	1.0000	DISCARD	gen=203 glyphs=4
2026-03-13T23:30:23.710511	bfdf7cad	120	30	1.0000	DISCARD	gen=160 glyphs=4
2026-03-13T23:30:23.999970	19355583	120	30	1.0000	DISCARD	gen=204 glyphs=4
2026-03-13T23:30:26.438506	bfdf7cad	120	30	1.0000	DISCARD	gen=160 glyphs=4
2026-03-13T23:30:26.708303	8aef8872	116	29	1.0000	DISCARD	gen=204 glyphs=4
2026-03-13T23:30:29.236871	55d6c151	120	30	1.0000	DISCARD	gen=160 glyphs=4
2026-03-13T23:30:29.515501	0eaedb57	116	29	1.0000	DISCARD	gen=204 glyphs=4
2026-03-13T23:30:31.964336	55d6c151	120	30	1.0000	DISCARD	gen=160 glyphs=4
2026-03-13T23:30:32.241127	6c9acbf9	116	29	1.0000	DISCARD	gen=204 glyphs=4
2026-03-13T23:30:34.684586	5a06ca32	120	30	1.0000	DISCARD	gen=160 glyphs=4
2026-03-13T23:30:34.978760	67cb81be	120	30	1.0000	DISCARD	gen=204 glyphs=4
2026-03-13T23:30:37.446262	ac85a090	116	29	1.0000	DISCARD	gen=160 glyphs=4
2026-03-13T23:30:37.709206	196cb3fe	116	29	0.9500	DISCARD	gen=204 glyphs=4
2026-03-13T23:30:40.172546	d11c1062	120	30	1.0000	DISCARD	gen=160 glyphs=4
2026-03-13T23:30:40.447820	0eaedb57	116	29	1.0000	DISCARD	gen=204 glyphs=4
2026-03-13T23:30:42.892068	55d6c151	120	30	1.0000	DISCARD	gen=160 glyphs=4
2026-03-13T23:30:43.177368	eca7ab6c	116	29	1.0000	DISCARD	gen=204 glyphs=4
2026-03-13T23:30:45.638917	55d6c151	120	30	1.0000	DISCARD	gen=160 glyphs=4
2026-03-13T23:30:45.928264	0eaedb57	116	29	1.0000	DISCARD	gen=204 glyphs=4
2026-03-13T23:30:48.360553	37f4017b	116	29	1.0000	DISCARD	gen=161 glyphs=4
2026-03-13T23:30:48.629415	0eaedb57	116	29	1.0000	DISCARD	gen=204 glyphs=4
2026-03-13T23:30:51.094671	bfdf7cad	120	30	1.0000	DISCARD	gen=161 glyphs=4
2026-03-13T23:30:51.358031	19355583	120	30	1.0000	DISCARD	gen=205 glyphs=4
2026-03-13T23:30:53.829080	c783c15f	116	29	1.0000	DISCARD	gen=161 glyphs=4
2026-03-13T23:30:54.092341	8aef8872	116	29	1.0000	DISCARD	gen=205 glyphs=4
2026-03-13T23:30:56.553882	106538c6	120	30	1.0000	DISCARD	gen=161 glyphs=4
2026-03-13T23:30:56.823560	82ccf617	116	29	0.9500	DISCARD	gen=205 glyphs=4
2026-03-13T23:30:59.277826	37f4017b	116	29	1.0000	DISCARD	gen=161 glyphs=4
2026-03-13T23:30:59.595507	050862ad	120	30	1.0000	DISCARD	gen=205 glyphs=4
2026-03-13T23:31:02.135509	5b9807ac	120	30	1.0000	DISCARD	gen=161 glyphs=4
2026-03-13T23:31:02.415353	8aef8872	116	29	1.0000	DISCARD	gen=205 glyphs=4
2026-03-13T23:31:04.866329	aa742a4f	116	29	1.0000	DISCARD	gen=161 glyphs=4
2026-03-13T23:31:05.151685	0eaedb57	116	29	1.0000	DISCARD	gen=205 glyphs=4
2026-03-13T23:31:07.608548	37f4017b	116	29	1.0000	DISCARD	gen=161 glyphs=4
2026-03-13T23:31:07.888750	8aef8872	116	29	1.0000	DISCARD	gen=205 glyphs=4
2026-03-13T23:31:10.346601	fdb5d108	120	30	1.0000	DISCARD	gen=161 glyphs=4
2026-03-13T23:31:10.630823	9e34ede0	116	29	1.0000	DISCARD	gen=205 glyphs=4
2026-03-13T23:31:13.094791	37f4017b	116	29	1.0000	DISCARD	gen=161 glyphs=4
2026-03-13T23:31:13.355254	e28a3d5c	116	29	1.0000	DISCARD	gen=205 glyphs=4
2026-03-13T23:31:15.825168	37f4017b	116	29	1.0000	DISCARD	gen=162 glyphs=4
2026-03-13T23:31:16.092484	77daea40	116	29	1.0000	DISCARD	gen=205 glyphs=4
2026-03-13T23:31:18.551370	bfdf7cad	120	30	1.0000	DISCARD	gen=162 glyphs=4
2026-03-13T23:31:18.828218	19355583	120	30	1.0000	DISCARD	gen=206 glyphs=4
2026-03-13T23:31:21.310180	9b635c41	116	29	1.0000	DISCARD	gen=162 glyphs=4
2026-03-13T23:31:21.604068	8aef8872	116	29	1.0000	DISCARD	gen=206 glyphs=4
2026-03-13T23:31:24.033402	670e7b5e	116	29	1.0000	DISCARD	gen=162 glyphs=4
2026-03-13T23:31:24.320935	f2a79825	120	30	1.0000	DISCARD	gen=206 glyphs=4
2026-03-13T23:31:26.750630	37f4017b	116	29	1.0000	DISCARD	gen=162 glyphs=4
2026-03-13T23:31:27.025041	67cb81be	120	30	1.0000	DISCARD	gen=206 glyphs=4
2026-03-13T23:31:29.712021	5a06ca32	120	30	1.0000	DISCARD	gen=162 glyphs=4
2026-03-13T23:31:29.995581	875e0f8a	116	29	1.0000	DISCARD	gen=206 glyphs=4
2026-03-13T23:31:32.559071	55d6c151	120	30	1.0000	DISCARD	gen=162 glyphs=4
2026-03-13T23:31:32.837830	050862ad	120	30	1.0000	DISCARD	gen=206 glyphs=4
2026-03-13T23:31:35.351293	55d6c151	120	30	1.0000	DISCARD	gen=162 glyphs=4
2026-03-13T23:31:35.628957	875e0f8a	116	29	1.0000	DISCARD	gen=206 glyphs=4
2026-03-13T23:31:38.731417	55d6c151	120	30	1.0000	DISCARD	gen=162 glyphs=4
2026-03-13T23:31:39.044189	ae44ace5	116	29	1.0000	DISCARD	gen=206 glyphs=4
2026-03-13T23:31:42.138715	5a06ca32	120	30	1.0000	DISCARD	gen=162 glyphs=4
2026-03-13T23:31:42.496432	073921b7	120	30	1.0000	DISCARD	gen=206 glyphs=4
2026-03-13T23:31:45.157127	37f4017b	116	29	1.0000	DISCARD	gen=163 glyphs=4
2026-03-13T23:31:45.436065	9e34ede0	116	29	1.0000	DISCARD	gen=206 glyphs=4
2026-03-13T23:31:47.887045	bfdf7cad	120	30	1.0000	DISCARD	gen=163 glyphs=4
2026-03-13T23:31:48.161260	19355583	120	30	1.0000	DISCARD	gen=207 glyphs=4
2026-03-13T23:31:50.652540	2701cb73	116	29	1.0000	DISCARD	gen=163 glyphs=4
2026-03-13T23:31:50.925103	8aef8872	116	29	1.0000	DISCARD	gen=207 glyphs=4
2026-03-13T23:31:53.422418	2d1f327b	116	29	0.9500	DISCARD	gen=163 glyphs=4
2026-03-13T23:31:53.689121	4b2a0873	120	30	0.9500	DISCARD	gen=207 glyphs=4
2026-03-13T23:31:56.152105	5a06ca32	120	30	1.0000	DISCARD	gen=163 glyphs=4
2026-03-13T23:31:56.438458	67cb81be	120	30	1.0000	DISCARD	gen=207 glyphs=4
2026-03-13T23:31:58.895731	cbed8637	116	29	1.0000	DISCARD	gen=163 glyphs=4
2026-03-13T23:31:59.171690	780bfd47	120	30	1.0000	DISCARD	gen=207 glyphs=4
2026-03-13T23:32:01.618956	fdb5d108	120	30	1.0000	DISCARD	gen=163 glyphs=4
2026-03-13T23:32:01.892967	8aef8872	116	29	1.0000	DISCARD	gen=207 glyphs=4
2026-03-13T23:32:04.406759	5a06ca32	120	30	1.0000	DISCARD	gen=163 glyphs=4
2026-03-13T23:32:04.700246	41f8da54	116	29	1.0000	DISCARD	gen=207 glyphs=4
2026-03-13T23:32:07.188786	2701cb73	116	29	1.0000	DISCARD	gen=163 glyphs=4
2026-03-13T23:32:07.459116	8aef8872	116	29	1.0000	DISCARD	gen=207 glyphs=4
2026-03-13T23:32:09.917699	7ca87b42	116	29	1.0000	DISCARD	gen=163 glyphs=4
2026-03-13T23:32:10.181945	8aef8872	116	29	1.0000	DISCARD	gen=207 glyphs=4
2026-03-13T23:32:12.665215	37f4017b	116	29	1.0000	DISCARD	gen=164 glyphs=4
2026-03-13T23:32:12.932558	ae44ace5	116	29	1.0000	DISCARD	gen=207 glyphs=4
2026-03-13T23:32:15.385862	bfdf7cad	120	30	1.0000	DISCARD	gen=164 glyphs=4
2026-03-13T23:32:15.660263	19355583	120	30	1.0000	DISCARD	gen=208 glyphs=4
2026-03-13T23:32:18.119329	d11c1062	120	30	1.0000	DISCARD	gen=164 glyphs=4
2026-03-13T23:32:18.391805	8aef8872	116	29	1.0000	DISCARD	gen=208 glyphs=4
2026-03-13T23:32:20.840676	9f07d766	120	30	1.0000	DISCARD	gen=164 glyphs=4
2026-03-13T23:32:21.108700	eca7ab6c	116	29	1.0000	DISCARD	gen=208 glyphs=4
2026-03-13T23:32:23.548288	2701cb73	116	29	1.0000	DISCARD	gen=164 glyphs=4
2026-03-13T23:32:23.817934	e2cd28ea	120	30	1.0000	DISCARD	gen=208 glyphs=4
2026-03-13T23:32:26.319792	2701cb73	116	29	1.0000	DISCARD	gen=164 glyphs=4
2026-03-13T23:32:26.584614	b57e7176	120	30	1.0000	DISCARD	gen=208 glyphs=4
2026-03-13T23:32:29.034584	37f4017b	116	29	1.0000	DISCARD	gen=164 glyphs=4
2026-03-13T23:32:29.298435	1e5f0e21	116	29	1.0000	DISCARD	gen=208 glyphs=4
2026-03-13T23:32:31.739782	a20314e9	120	30	1.0000	DISCARD	gen=164 glyphs=4
2026-03-13T23:32:32.016040	e8c7f6cf	120	30	1.0000	DISCARD	gen=208 glyphs=4
2026-03-13T23:32:34.512027	71e2ba66	116	29	1.0000	DISCARD	gen=164 glyphs=4
2026-03-13T23:32:34.785189	0eaedb57	116	29	1.0000	DISCARD	gen=208 glyphs=4
2026-03-13T23:32:37.312021	37f4017b	116	29	1.0000	DISCARD	gen=164 glyphs=4
2026-03-13T23:32:37.578322	67cb81be	120	30	1.0000	DISCARD	gen=208 glyphs=4
2026-03-13T23:32:40.047064	37f4017b	116	29	1.0000	DISCARD	gen=165 glyphs=4
2026-03-13T23:32:40.330830	eca7ab6c	116	29	1.0000	DISCARD	gen=208 glyphs=4
2026-03-13T23:32:42.772078	bfdf7cad	120	30	1.0000	DISCARD	gen=165 glyphs=4
2026-03-13T23:32:43.052540	19355583	120	30	1.0000	DISCARD	gen=209 glyphs=4
2026-03-13T23:32:45.497978	55d6c151	120	30	1.0000	DISCARD	gen=165 glyphs=4
2026-03-13T23:32:45.772340	8aef8872	116	29	1.0000	DISCARD	gen=209 glyphs=4
2026-03-13T23:32:48.405034	bfdf7cad	120	30	1.0000	DISCARD	gen=165 glyphs=4
2026-03-13T23:32:48.679861	19355583	120	30	1.0000	DISCARD	gen=209 glyphs=4
2026-03-13T23:32:51.147428	e86ec82f	116	29	1.0000	DISCARD	gen=165 glyphs=4
2026-03-13T23:32:51.416472	eca7ab6c	116	29	1.0000	DISCARD	gen=209 glyphs=4
2026-03-13T23:32:53.888344	c6566b40	120	30	1.0000	DISCARD	gen=165 glyphs=4
2026-03-13T23:32:54.160500	8aef8872	116	29	1.0000	DISCARD	gen=209 glyphs=4
2026-03-13T23:32:56.597605	fdb5d108	120	30	1.0000	DISCARD	gen=165 glyphs=4
2026-03-13T23:32:56.860383	b7aed8e9	116	29	1.0000	DISCARD	gen=209 glyphs=4
2026-03-13T23:32:59.346533	ceefa52b	116	29	0.9500	DISCARD	gen=165 glyphs=4
2026-03-13T23:32:59.622213	050862ad	120	30	1.0000	DISCARD	gen=209 glyphs=4
2026-03-13T23:33:02.073931	4c9b0dd4	120	30	1.0000	DISCARD	gen=165 glyphs=4
2026-03-13T23:33:02.354975	13b5c525	116	29	1.0000	DISCARD	gen=209 glyphs=4
2026-03-13T23:33:04.801877	bfdf7cad	120	30	1.0000	DISCARD	gen=165 glyphs=4
2026-03-13T23:33:05.068920	2e974d0c	120	30	1.0000	DISCARD	gen=209 glyphs=4
2026-03-13T23:33:07.592271	37f4017b	116	29	1.0000	DISCARD	gen=166 glyphs=4
2026-03-13T23:33:07.898482	ae44ace5	116	29	1.0000	DISCARD	gen=209 glyphs=4
2026-03-13T23:33:10.361580	bfdf7cad	120	30	1.0000	DISCARD	gen=166 glyphs=4
2026-03-13T23:33:10.638337	19355583	120	30	1.0000	DISCARD	gen=210 glyphs=4
2026-03-13T23:33:13.114862	1d34459a	116	29	1.0000	DISCARD	gen=166 glyphs=4
2026-03-13T23:33:13.384296	8aef8872	116	29	1.0000	DISCARD	gen=210 glyphs=4
2026-03-13T23:33:15.850824	faad9113	120	30	1.0000	DISCARD	gen=166 glyphs=4
2026-03-13T23:33:16.131958	8aef8872	116	29	1.0000	DISCARD	gen=210 glyphs=4
2026-03-13T23:33:18.573102	37f4017b	116	29	1.0000	DISCARD	gen=166 glyphs=4
2026-03-13T23:33:18.843052	b57e7176	120	30	1.0000	DISCARD	gen=210 glyphs=4
2026-03-13T23:33:21.300119	6747a38b	116	29	1.0000	DISCARD	gen=166 glyphs=4
2026-03-13T23:33:21.571511	9e34ede0	116	29	1.0000	DISCARD	gen=210 glyphs=4
2026-03-13T23:33:24.253396	efa8d915	116	29	1.0000	DISCARD	gen=166 glyphs=4
2026-03-13T23:33:24.537062	50dc991d	116	29	1.0000	DISCARD	gen=210 glyphs=4
2026-03-13T23:33:27.020744	240425b3	116	29	1.0000	DISCARD	gen=166 glyphs=4
2026-03-13T23:33:27.287636	8aef8872	116	29	1.0000	DISCARD	gen=210 glyphs=4
2026-03-13T23:33:29.774530	37f4017b	116	29	1.0000	DISCARD	gen=166 glyphs=4
2026-03-13T23:33:30.046661	19355583	120	30	1.0000	DISCARD	gen=210 glyphs=4
2026-03-13T23:33:32.507376	5a06ca32	120	30	1.0000	DISCARD	gen=166 glyphs=4
2026-03-13T23:33:32.802180	1e5f0e21	116	29	1.0000	DISCARD	gen=210 glyphs=4
2026-03-13T23:33:35.278047	37f4017b	116	29	1.0000	DISCARD	gen=167 glyphs=4
2026-03-13T23:33:35.555046	3de4452f	120	30	1.0000	DISCARD	gen=210 glyphs=4
2026-03-13T23:33:38.022245	bfdf7cad	120	30	1.0000	DISCARD	gen=167 glyphs=4
2026-03-13T23:33:38.302759	19355583	120	30	1.0000	DISCARD	gen=211 glyphs=4
2026-03-13T23:33:40.862185	37f4017b	116	29	1.0000	DISCARD	gen=167 glyphs=4
2026-03-13T23:33:41.133348	8aef8872	116	29	1.0000	DISCARD	gen=211 glyphs=4
2026-03-13T23:33:43.613278	55d6c151	120	30	1.0000	DISCARD	gen=167 glyphs=4
2026-03-13T23:33:43.885117	8aef8872	116	29	1.0000	DISCARD	gen=211 glyphs=4
2026-03-13T23:33:46.335357	37f4017b	116	29	1.0000	DISCARD	gen=167 glyphs=4
2026-03-13T23:33:46.609598	8aef8872	116	29	1.0000	DISCARD	gen=211 glyphs=4
2026-03-13T23:33:49.080567	5a06ca32	120	30	1.0000	DISCARD	gen=167 glyphs=4
2026-03-13T23:33:49.366298	8aef8872	116	29	1.0000	DISCARD	gen=211 glyphs=4
2026-03-13T23:33:51.831867	4c9b0dd4	120	30	1.0000	DISCARD	gen=167 glyphs=4
2026-03-13T23:33:52.112548	923b89b5	116	29	1.0000	DISCARD	gen=211 glyphs=4
2026-03-13T23:33:54.565285	55d6c151	120	30	1.0000	DISCARD	gen=167 glyphs=4
2026-03-13T23:33:54.832032	67cb81be	120	30	1.0000	DISCARD	gen=211 glyphs=4
2026-03-13T23:33:57.296795	f7d0f590	120	30	1.0000	DISCARD	gen=167 glyphs=4
2026-03-13T23:33:57.561577	ffa6982d	116	29	1.0000	DISCARD	gen=211 glyphs=4
2026-03-13T23:34:03.386238	55d6c151	120	30	1.0000	DISCARD	gen=167 glyphs=4
2026-03-13T23:34:03.647668	ae44ace5	116	29	1.0000	DISCARD	gen=211 glyphs=4
2026-03-13T23:34:06.089019	37f4017b	116	29	1.0000	DISCARD	gen=168 glyphs=4
2026-03-13T23:34:06.351327	8aef8872	116	29	1.0000	DISCARD	gen=211 glyphs=4
2026-03-13T23:34:08.834150	bfdf7cad	120	30	1.0000	DISCARD	gen=168 glyphs=4
2026-03-13T23:34:09.106002	19355583	120	30	1.0000	DISCARD	gen=212 glyphs=4
2026-03-13T23:34:11.615661	19ccb67c	116	29	1.0000	DISCARD	gen=168 glyphs=4
2026-03-13T23:34:11.881589	8aef8872	116	29	1.0000	DISCARD	gen=212 glyphs=4
2026-03-13T23:34:14.339263	bf33453b	120	30	1.0000	DISCARD	gen=168 glyphs=4
2026-03-13T23:34:14.604063	55c72761	116	29	0.9500	DISCARD	gen=212 glyphs=4
2026-03-13T23:34:17.043450	b00043dd	116	29	1.0000	DISCARD	gen=168 glyphs=4
2026-03-13T23:34:17.310132	b57e7176	120	30	1.0000	DISCARD	gen=212 glyphs=4
2026-03-13T23:34:19.760012	fdb5d108	120	30	1.0000	DISCARD	gen=168 glyphs=4
2026-03-13T23:34:20.035403	0eaedb57	116	29	1.0000	DISCARD	gen=212 glyphs=4
2026-03-13T23:34:22.538806	55d6c151	120	30	1.0000	DISCARD	gen=168 glyphs=4
2026-03-13T23:34:22.804582	2389fd57	120	30	1.0000	DISCARD	gen=212 glyphs=4
2026-03-13T23:34:25.280283	5a06ca32	120	30	1.0000	DISCARD	gen=168 glyphs=4
2026-03-13T23:34:25.539714	b57e7176	120	30	1.0000	DISCARD	gen=212 glyphs=4
2026-03-13T23:34:27.994240	5a06ca32	120	30	1.0000	DISCARD	gen=168 glyphs=4
2026-03-13T23:34:28.285654	cb403127	116	29	1.0000	DISCARD	gen=212 glyphs=4
2026-03-13T23:34:30.717522	37f4017b	116	29	1.0000	DISCARD	gen=168 glyphs=4
2026-03-13T23:34:30.988866	19355583	120	30	1.0000	DISCARD	gen=212 glyphs=4
2026-03-13T23:34:33.443233	37f4017b	116	29	1.0000	DISCARD	gen=169 glyphs=4
2026-03-13T23:34:33.717288	a78f9454	120	30	1.0000	DISCARD	gen=212 glyphs=4
2026-03-13T23:34:36.171154	bfdf7cad	120	30	1.0000	DISCARD	gen=169 glyphs=4
2026-03-13T23:34:36.439699	19355583	120	30	1.0000	DISCARD	gen=213 glyphs=4
2026-03-13T23:34:38.890819	d11c1062	120	30	1.0000	DISCARD	gen=169 glyphs=4
2026-03-13T23:34:39.169841	8aef8872	116	29	1.0000	DISCARD	gen=213 glyphs=4
